rank,id,subreddit,permalink,author,title,score,upvote_ratio,num_comments,author_flair_text,created_utc,over_18,edited,stickied,locked,is_original_content
1,150ozmc,news,/r/news/comments/150ozmc/twitter_has_lost_50_in_ad_revenue_and_is_now_cash/,smiledrs,Twitter has lost 50% in ad revenue and is now cash flow negative.,24003,0.94,2166,,1689459989.0,False,False,False,False,False
2,150ouqq,antiwork,/r/antiwork/comments/150ouqq/ppp_fraud_is_worst_in_history_200b_stolen_and/,IcyHeartWarmSmile,"PPP fraud is ‘worst in history’: $200B stolen and blown on Lamborghinis, beach houses and bling",12877,0.98,629,,1689459655.0,False,False,False,False,False
3,150rffh,CrazyFuckingVideos,/r/CrazyFuckingVideos/comments/150rffh/boxer_flashes_the_crowd_on_live_tv_after_first_win/,Grace_God,Boxer flashes the crowd on live tv after first win,8278,0.95,679,,1689466359.0,True,False,False,False,False
4,150svoq,WhitePeopleTwitter,/r/WhitePeopleTwitter/comments/150svoq/going_down_with_the_ship/,Twelve-Majestic-Lies,Going down with the ship,5915,0.98,328,,1689470509.0,False,False,False,False,False
5,150q89x,todayilearned,/r/todayilearned/comments/150q89x/til_there_are_consumers_who_are_known_as/,laik72,"TIL There are consumers who are known as Harbingers of Failure. They have a knack for buying products that turn out to be market flops. ""when the harbingers buy a product at least three times, it’s really bad news: The probability of success for that product drops 56 percent.""",8530,0.97,1198,,1689463150.0,False,False,False,False,False
6,150mu36,nextfuckinglevel,/r/nextfuckinglevel/comments/150mu36/steph_curry_hits_a_hole_in_one_at_the_century/,Mykcul,Steph Curry hits a Hole in One at the Century Golf Championship!,21458,0.94,922,,1689454636.0,False,False,False,False,False
7,150o598,PublicFreakout,/r/PublicFreakout/comments/150o598/thats_one_way_to_celebrate_a_win/,panserstrek,That’s one way to celebrate a win,11618,0.95,699,,1689457904.0,True,False,False,False,False
8,150mpdj,meirl,/r/meirl/comments/150mpdj/meirl/,orchid_breeder,meirl,17619,0.97,612,,1689454303.0,False,False,False,False,False
9,150labs,subway,/r/subway/comments/150labs/someone_forgot_to_put_the_bread_in_the_fridge/,xoze44,Someone forgot to put the bread in the fridge last night...,28101,0.97,1015,,1689450792.0,False,False,False,False,False
10,150k5fh,Damnthatsinteresting,/r/Damnthatsinteresting/comments/150k5fh/a_bear_just_coming_out_of_hibernation/,truly-immaculate,A bear just coming out of hibernation,39001,0.94,1223,,1689447917.0,False,False,False,False,False
11,150kj3y,MadeMeSmile,/r/MadeMeSmile/comments/150kj3y/the_joy_is_so_contagious/,GoodBoi_8606,The joy is so contagious,42214,0.88,1417,,1689448858.0,False,False,False,False,False
12,150kobh,pettyrevenge,/r/pettyrevenge/comments/150kobh/i_put_vegetables_in_all_my_food_to_stop_my/,veggieevengeance,I put vegetables in all my food to stop my roommate's kid from eating it. Mom threatens LEGAL action,13972,0.95,1897,,1689449214.0,False,1689449781.0,False,False,False
13,150j5s4,oddlysatisfying,/r/oddlysatisfying/comments/150j5s4/border_collie_playing_footvolley_in_brazil/,SinjiOnO,Border Collie playing footvolley in Brazil,29440,0.96,488,,1689445489.0,False,False,False,False,False
14,150n109,facepalm,/r/facepalm/comments/150n109/you_can_only_pity_such_people/,QualityKeys,You can only pity such people,8342,0.99,239,,1689455090.0,False,False,False,False,False
15,150o32b,BlackPeopleTwitter,/r/BlackPeopleTwitter/comments/150o32b/auntie_is_cookin/,PhotosByVicky,Auntie is cookin’!,6326,0.96,512,☑️,1689457761.0,False,False,False,False,False
16,150k18f,golf,/r/golf/comments/150k18f/steph_curry_with_a_hole_in_one_at_the_american/,B_M_Fahrtz,Steph Curry with a Hole in One at the American Century Championship,13008,0.95,774,,1689447651.0,False,False,False,False,False
17,150pyy9,cats,/r/cats/comments/150pyy9/someone_dumped_this_cat_in_my_bin_yesterday_found/,Strict_Carpenter_661,Someone dumped this cat in my bin yesterday. Found it crying and took him in. I’ve already got 3 cats so not looking to keep anymore. Any advice on what I should do?,4513,0.98,454,,1689462479.0,False,False,False,False,False
18,150ska3,nba,/r/nba/comments/150ska3/a_drunk_charles_barkley_delivers_a_sequel_to_an/,Sp_Gamer_Live,A drunk Charles Barkley delivers a sequel to an all time moment and defends the LGBTQ+ community again,2815,0.95,250,:min-1: Timberwolves,1689469581.0,False,False,False,False,False
19,150nhcx,mildlyinfuriating,/r/mildlyinfuriating/comments/150nhcx/why_do_we_have_this_up_already_it_is_july/,keviniskrazy,Why do we have this up already it is JULY FIFTEENTH,6648,0.92,1328,,1689456225.0,False,False,False,False,False
20,150nvug,HumansBeingBros,/r/HumansBeingBros/comments/150nvug/window_washers_wear_superhero_costumes_for_the/,westcoastcdn19,Window washers wear superhero costumes for the kids at Norton Children’s hospital,5576,0.97,76,,1689457256.0,False,False,False,False,False
21,150q28y,tifu,/r/tifu/comments/150q28y/tifu_sucking_dick/,watwatwahwah,TIFU sucking dick,4185,0.84,1328,,1689462712.0,False,False,False,False,False
22,150rxm8,Unexpected,/r/Unexpected/comments/150rxm8/thats_one_way_to_celebrate/,anxietyin480p,That's one way to celebrate,3029,0.93,218,,1689467760.0,False,False,False,False,False
23,150qwjs,maybemaybemaybe,/r/maybemaybemaybe/comments/150qwjs/maybe_maybe_maybe/,Firm_Matter7435,Maybe Maybe Maybe,3447,0.95,204,,1689464938.0,False,False,False,False,False
24,150pi1c,goldenretrievers,/r/goldenretrievers/comments/150pi1c/lost_my_boy_today_ill_remember_him_like_this/,jsmith19977,"Lost my boy today, I'll remember him like this",3997,0.97,148,,1689461298.0,False,False,False,False,False
25,150kb2f,me_irlgbt,/r/me_irlgbt/comments/150kb2f/me_irlgbt/,Lux-xxv,ME🏳️‍⚧️ IRLGBT,11649,0.87,306,YEEN DEGENERATE :demiro::lesbian::trans::degen:,1689448304.0,False,False,False,False,False
26,150ljmf,tumblr,/r/tumblr/comments/150ljmf/why_are_people_so_opinionated_on_whether_or_not/,infinitysaga,Why are people so opinionated on whether or not some people deserve food,8133,0.96,205,,1689451431.0,False,False,False,False,False
27,150lg75,SipsTea,/r/SipsTea/comments/150lg75/moments_before_disaster/,KyleDurbinz,Moments before disaster..,8070,0.96,189,,1689451213.0,False,False,False,False,False
28,150rk95,rareinsults,/r/rareinsults/comments/150rk95/str_abba_mus/,DOPEnheimer,Str abba mus,2970,0.98,141,,1689466731.0,False,False,False,False,False
29,150ky5d,TikTokCringe,/r/TikTokCringe/comments/150ky5d/i_love_it_lol/,Slight_Laugh2170,I love it! LOL,7481,0.95,743,,1689449900.0,False,False,False,False,False
30,150laof,politics,/r/politics/comments/150laof/a_gay_couple_ran_a_rural_restaurant_in_peace_then/,lotta_love,A gay couple ran a rural restaurant in peace. Then new neighbors arrived.,6329,0.95,760,,1689450815.0,False,False,False,False,False
31,150jtie,funny,/r/funny/comments/150jtie/the_ultimate_weapon/,Alucard__07,The ultimate weapon,8032,0.96,302,,1689447097.0,False,False,False,False,False
32,150hvlq,memes,/r/memes/comments/150hvlq/it_took_til_he_was_44_to_learn_something_i_knew/,JohnAdams4621,It took til he was 44 to learn something I knew when I was 5,23503,0.91,518,,1689442324.0,False,False,False,False,False
33,150owch,shittymoviedetails,/r/shittymoviedetails/comments/150owch/in_barbie_2023_many_characters_look_at_barbies/,Hendrick_Davies64,"In Barbie (2023), many characters look at Barbie’s feet with amazement, this is a reference to Morgot Robbie having the highest rating on wikifeet",3737,0.96,113,,1689459765.0,False,False,False,False,False
34,150l0es,lotrmemes,/r/lotrmemes/comments/150l0es/today_i_discovered_the_fellowships_matching/,nirnrootsandwich,Today I discovered the Fellowship's matching tattoos,6364,0.97,213,,1689450067.0,False,False,False,False,False
35,150os6z,Economics,/r/Economics/comments/150os6z/ppp_fraud_is_worst_in_history_200b_stolen_and/,IcyHeartWarmSmile,"PPP fraud is ‘worst in history’: $200B stolen and blown on Lamborghinis, beach houses and bling",3352,0.96,338,,1689459478.0,False,False,False,False,False
36,150joqz,FunnyandSad,/r/FunnyandSad/comments/150joqz/1_rich_people_ignored_to_pay_their_taxes/,LongjumpingCanz,1% rich people ignored to pay their taxes,7418,0.94,242,,1689446765.0,False,False,False,False,False
37,150m4e2,worldnews,/r/worldnews/comments/150m4e2/ukraine_rejects_bulgarian_presidents_claims_that/,green_flash,Ukraine Rejects Bulgarian President’s Claims That Kyiv Is to Be Blamed for Russia’s Ongoing War,4747,0.96,300,,1689452873.0,False,False,False,False,False
38,150mzsr,wholesomememes,/r/wholesomememes/comments/150mzsr/she_said_yes/,Luftwaffle-1,she said yes!!!,4157,0.95,102,,1689455008.0,False,False,False,False,False
39,150g6sa,comics,/r/comics/comments/150g6sa/garf/,MrWeiner,Garf,12185,0.96,145,SMBC Comics,1689438174.0,False,False,False,False,False
40,150etla,BeAmazed,/r/BeAmazed/comments/150etla/rejected_lamb_raised_by_farm_dog/,External_Industry739,Rejected lamb raised by farm dog,23546,0.95,457,,1689434768.0,False,False,False,False,False
41,150j0ab,therewasanattempt,/r/therewasanattempt/comments/150j0ab/to_deliver_a_package/,SlugsLoveBeer,To deliver a package,7380,0.94,532,,1689445109.0,False,False,False,False,False
42,150hr3s,marvelmemes,/r/marvelmemes/comments/150hr3s/all_legend_in_one_frame/,Madagascar003,All legend in one frame 🖼️,9205,0.93,121,Avengers,1689442018.0,False,False,False,False,False
43,150k1iz,WhitePeopleTwitter,/r/WhitePeopleTwitter/comments/150k1iz/cant_be_diagnosed_if_you_dont_go_to_a_doctor/,No-Diamond-5097,Can't be diagnosed if you dont go to a doctor.,29574,0.96,709,,1689447668.0,False,False,False,False,False
44,150ikcz,PoliticalHumor,/r/PoliticalHumor/comments/150ikcz/its_karma_thats_a_bitch_honey/,7dayweekendgirl,"It's Karma that's a bitch, honey.",6749,0.96,171,,1689444033.0,False,False,False,False,False
45,150rhf5,OneOrangeBraincell,/r/OneOrangeBraincell/comments/150rhf5/i_dont_know_who_needs_to_hear_this_but_walter/,whateverislovely,I don’t know who needs to hear this but Walter Cronkat wants you to know it’s gonna be okay,1739,0.99,49,,1689466517.0,False,False,False,False,False
46,150lwpp,LifeProTips,/r/LifeProTips/comments/150lwpp/lpt_being_lonely_can_lead_to_a_vicious_cycle/,zazzlekdazzle,"LPT: Being lonely can lead to a vicious cycle where the more obvious it is, the less people want to interact with you. The best way to break the cycle is to learn how to act like someone who isn't lonely. (Details in the post.)",3617,0.92,155,,1689452345.0,False,1689472156.0,False,False,False
47,150gwp9,BrandNewSentence,/r/BrandNewSentence/comments/150gwp9/yeah_i_would_apologize_too/,DarkFoxy666,yeah I would apologize too,9079,0.97,250,,1689439961.0,False,False,False,False,False
48,150oii4,ThatsInsane,/r/ThatsInsane/comments/150oii4/guy_goes_to_the_waterpark_but_doesnt_know_how_to/,WeAreTheBaddiess,Guy goes to the waterpark but doesn't know how to swim,2406,0.96,267,,1689458800.0,False,False,False,False,False
49,150qf0l,IllegallySmolCats,/r/IllegallySmolCats/comments/150qf0l/the_gremlins_in_my_garage_are_3_weeks_old_today/,budhorse4,The gremlins in my garage are 3 weeks old today,1854,0.98,44,,1689463634.0,False,False,False,False,False
50,150iys3,Justrolledintotheshop,/r/Justrolledintotheshop/comments/150iys3/customer_reports_an_unsettling_energy_in_the/,ShelleyCortez-42,"Customer reports an unsettling energy in the seats and requests a restoration of chakras to their original, optimal state.",5048,0.97,304,,1689445002.0,False,False,False,False,False
51,150o4ad,lastimages,/r/lastimages/comments/150o4ad/19_and_18_year_old_brothers_nick_and_jack_both/,AdeptLaw6184,"19 and 18 year old brothers, Nick and Jack, both passed away due to drug overdose on the same day, their mother found them.",2461,0.95,206,,1689457843.0,False,False,False,False,False
52,150f4ci,OldSchoolCool,/r/OldSchoolCool/comments/150f4ci/roland_was_a_4000_pound_sea_elephant_who_lived_in/,OkImprovement90,"Roland was a 4,000 pound sea elephant who lived in Berlin Zoo from the late 1920's until his death during WW2",9366,0.96,446,,1689435520.0,False,False,False,False,False
53,150eq99,movies,/r/movies/comments/150eq99/what_movie_did_you_expect_it_be_meh_but_turned/,Ok-Meat4184,What movie did you expect it be “meh” but turned out to be really good,10286,0.93,7669,,1689434523.0,False,False,False,False,False
54,150pv99,PrequelMemes,/r/PrequelMemes/comments/150pv99/only_a_sith_deals_in_absolutes/,stunk_funky,Only a Sith deals in absolutes.,1943,0.96,47,,1689462214.0,False,False,False,False,False
55,150lilq,Genshin_Impact,/r/Genshin_Impact/comments/150lilq/i_was_not_expecting_the_fire_to_actually_appear/,ElenCelebrindal,I was NOT expecting the fire to actually appear,3714,0.98,178,,1689451357.0,False,False,False,False,False
56,150udgm,baseball,/r/baseball/comments/150udgm/highlight_the_mets_allow_a_run_in_the_9th_as/,amatom27,[Highlight] The Mets allow a run in the 9th as Brett Baty misjudges a routine popup,1006,0.97,346,Philadelphia Phillies :phi2:,1689474965.0,False,False,False,False,False
57,150h2dt,CuratedTumblr,/r/CuratedTumblr/comments/150h2dt/never_ask_a_woman_her_age_a_man_his_salary_a/,Kobussy,"Never ask a woman her age, a man his salary, A european what he thinks about immigrants and the romani.",7335,0.94,737,Will shill for marathon bungie.,1689440356.0,False,False,False,False,False
58,150dsa1,JustGuysBeingDudes,/r/JustGuysBeingDudes/comments/150dsa1/good_man/,Reeeeeve,Good Man,14948,0.93,273,,1689432166.0,False,False,False,False,False
59,150kost,awfuleverything,/r/awfuleverything/comments/150kost/6_tourists_arrested_in_spain_for_gangraping_an_18/,ridesharegai,6 tourists arrested in Spain for gangraping an 18 year old girl,4094,0.98,309,,1689449249.0,True,False,False,False,False
60,150k6l4,pcmasterrace,/r/pcmasterrace/comments/150k6l4/linus_opening_my_gift/,fire-marshmallow,Linus Opening my gift,4127,0.93,94,,1689447990.0,False,False,False,False,False
61,150keq9,TwoXChromosomes,/r/TwoXChromosomes/comments/150keq9/my_bf_broke_up_with_me_for_lying_about_pooping/,gnugget3,My bf broke up with me for “lying” about pooping.,3896,0.91,967,,1689448555.0,False,False,False,False,False
62,150jd6i,AskReddit,/r/AskReddit/comments/150jd6i/what_common_sexy_thing_is_a_turnoff_for_you/,aloe_veracity,What common “sexy” thing is a turn-off for you personally?,4690,0.91,4019,,1689445979.0,True,False,False,False,False
63,150kmur,oddlysatisfying,/r/oddlysatisfying/comments/150kmur/parrot_realizing_that_this_persons_hand_is/,yourSAS,Parrot realizing that this person's hand is friendly,13486,0.97,115,,1689449116.0,False,False,False,False,False
64,150cs2n,technology,/r/technology/comments/150cs2n/reddit_enrages_users_again_by_ditching_thankyou/,thebelsnickle1991,Reddit enrages users again by ditching thank-you coins and awards,15338,0.9,1909,,1689429578.0,False,False,False,False,False
65,150m36k,whenthe,/r/whenthe/comments/150m36k/for_8_years_i_thought_it_was_funny_then_i_turned_9/,LoonasHusband,"For 8 years I thought it was funny, then I turned 9",3255,0.97,119,,1689452786.0,False,False,False,False,False
66,150goln,dankmemes,/r/dankmemes/comments/150goln/aww_its_a_stray_cat/,thepositivepandemic,"Aww, it’s a stray cat.",9711,0.95,158,,1689439410.0,False,False,False,False,False
67,150hufj,ImTheMainCharacter,/r/ImTheMainCharacter/comments/150hufj/person_thinks_they_can_walk_on_stage_and_start/,thefatalmagnificence,Person thinks they can walk on stage and start recording a tiktok.,5348,0.97,289,,1689442250.0,False,False,False,False,False
68,150d6z2,shitposting,/r/shitposting/comments/150d6z2/yeah_get_stre_wait_glory_to_spez/,Notafuqin_Carrot211,Yeah get stre- wait (glory to spez),31064,0.96,194,We do a little trolling :snoo_trollface:,1689430615.0,False,False,False,False,False
69,150otfe,HistoryPorn,/r/HistoryPorn/comments/150otfe/a_dead_italian_soldier_holding_a_photo_of_his/,Virtual-Dish-9461,"A dead Italian soldier holding a photo of his child during the North Africa campaign, 1940s [1080x1087]",2019,0.94,74,,1689459570.0,True,False,False,False,False
70,150mzr0,nbacirclejerk,/r/nbacirclejerk/comments/150mzr0/the_actual_nba_is_cooked/,Nickname-CJ,The actual NBA is cooked,2537,0.97,116,,1689455005.0,False,False,False,False,False
71,150i9z7,mildlyinfuriating,/r/mildlyinfuriating/comments/150i9z7/people_who_leave_their_trash_on_shelves_in_stores/,ADGM1868,People who leave their trash on shelves in stores…,18703,0.97,940,,1689443298.0,False,False,False,False,False
72,150qrbs,HolUp,/r/HolUp/comments/150qrbs/based_eighth_grader/,UltraSaiyan419,Based eighth grader.,1558,0.96,27,,1689464529.0,False,False,False,False,False
73,150puhl,WorkReform,/r/WorkReform/comments/150puhl/lets_do_it_again/,zzill6,Let's Do It Again!,1714,0.99,27,🤝 Join A Union,1689462162.0,False,False,False,False,False
74,150givs,LeopardsAteMyFace,/r/LeopardsAteMyFace/comments/150givs/shaker_heights_attorney_a_trump_supporter_tells/,JoshOfArc,"Shaker Heights attorney, a Trump supporter, tells judge he voted twice in last two elections by accident",5896,0.97,262,,1689439012.0,False,False,False,False,False
75,150jft4,Chipotle,/r/Chipotle/comments/150jft4/never_ordering_online_again/,fastfalcon991,Never ordering online again,4031,0.93,205,,1689446155.0,False,False,False,False,False
76,150odat,Hololive,/r/Hololive/comments/150odat/holocure_is_bae_part_of_the_playtesting_team/,brickwallrunner,[HoloCure] Is Bae part of the Playtesting team?,2080,0.98,48,:Suisei::Fubuki::Moona::Amelia::Achan:,1689458462.0,True,False,False,False,False
77,150fyut,TwoSentenceHorror,/r/TwoSentenceHorror/comments/150fyut/i_felt_embarrassed_cleaning_myself_off_after/,Dumbbitch20,I felt embarrassed cleaning myself off after spilling my drink in front of my date,7746,0.95,185,,1689437623.0,False,False,False,False,False
78,150ifnk,WitchesVsPatriarchy,/r/WitchesVsPatriarchy/comments/150ifnk/gender_magic/,13curseyoukhan,Gender magic,4517,0.88,76,,1689443699.0,False,False,False,False,False
79,150oeub,NatureIsFuckingLit,/r/NatureIsFuckingLit/comments/150oeub/an_octopus_riding_an_eel/,pstbo,🔥 An octopus riding an eel,1990,0.98,118,,1689458555.0,False,False,False,False,False
80,150hf3o,pics,/r/pics/comments/150hf3o/john_oliver_is_burning_my_5000_reddit_coins_for/,BrokenMusicB0x,John Oliver is burning my 5000 reddit coins for rewards come get them while they are hot,5529,0.81,4237,,1689441199.0,False,False,False,False,False
81,150imk1,nba,/r/nba/comments/150imk1/rnba_lets_buy_05_of_the_grizzlies/,AncientGorilla,"r/NBA, let's buy 0.5% of the Grizzlies",12792,0.94,824,,1689444169.0,False,1689450717.0,False,False,False
82,150f3ty,Funnymemes,/r/Funnymemes/comments/150f3ty/methallica_or_five_finger_meth_punch/,Proof-Oil-7716,Methallica or Five Finger Meth Punch,11874,0.84,10033,,1689435483.0,False,False,False,False,False
83,150mqrf,Tinder,/r/Tinder/comments/150mqrf/some_real_gems_on_hinge/,oschutz,some real gems on hinge 👍,2431,0.96,269,,1689454404.0,False,False,False,False,False
84,150p4l8,SquaredCircle,/r/SquaredCircle/comments/150p4l8/bruce_prichard_on_what_john_cena_told_him_about/,elegantSolomons62,"Bruce Prichard on what John Cena told him about Make-A-Wish: ""Their wish wasn't to be surrounded by cameras & press. Their wish was to meet me & they're gonna get an experience w/ me, a one-on-one experience w/ me & I'm not doing it for publicity..I'm doing it because a dying child asked to meet me""",1728,0.96,132,,1689460342.0,False,False,False,False,False
85,150b304,technicallythetruth,/r/technicallythetruth/comments/150b304/well_that_was_so_easy/,directvolcano,Well that was so easy,46815,0.95,996,,1689424946.0,False,False,False,False,False
86,150e816,StarWars,/r/StarWars/comments/150e816/i_made_a_3d_printed_darksaber/,suppeoftheday,I made a 3d printed Darksaber,8031,0.96,175,,1689433278.0,False,False,False,False,False
87,150sby8,thalassophobia,/r/thalassophobia/comments/150sby8/saturation_diver_encounters_sperm_whale_in_the/,AGoodKForTheWin,Saturation diver encounters sperm whale in the deep sea,1101,0.98,78,,1689468925.0,False,False,False,False,False
88,150ioxv,Damnthatsinteresting,/r/Damnthatsinteresting/comments/150ioxv/parrot_indian_ringneck_navigating_youtube_and/,SinjiOnO,Parrot (Indian Ringneck) navigating Youtube and doesn't like it when you change the channel.,14704,0.98,330,,1689444326.0,False,False,False,False,False
89,150hrgz,facepalm,/r/facepalm/comments/150hrgz/whats_with_the_double_standard/,ExtremeFreedomz,What's with the double standard?,20891,0.94,666,,1689442041.0,False,False,False,False,False
90,150dxyj,doordash,/r/doordash/comments/150dxyj/alright_which_one_of_you_was_it/,Ballsofhumansteel,"Alright, which one of you was it..",10361,0.89,997,,1689432577.0,False,False,False,False,False
91,150ic5u,aww,/r/aww/comments/150ic5u/show_me_it_show_me_it_knock_knock/,thehornsoffscreen,Show me it! Show me it! (Knock knock!),4122,0.89,108,,1689443452.0,False,False,False,False,False
92,150bvr1,oddlyterrifying,/r/oddlyterrifying/comments/150bvr1/this_chart_showing_birth/,CouchTo5k,This chart showing birth.,19390,0.93,1328,,1689427156.0,True,False,False,False,False
93,150sitc,DOG,/r/DOG/comments/150sitc/kind_people_helps_out_a_mistreated_dog/,InterestingLab99399,Kind people helps out a mistreated dog,1025,0.98,29,,1689469465.0,False,False,False,False,False
94,150dx5m,UkraineWarVideoReport,/r/UkraineWarVideoReport/comments/150dx5m/the_ukrainian_soldier_that_stepped_on_a_mine_in/,Accurate9638,⚡️The Ukrainian soldier that stepped on a mine in that viral video is out of the hospital.,7994,0.95,430,,1689432519.0,False,False,False,False,False
95,150jgdj,MemePiece,/r/MemePiece/comments/150jgdj/when_u_cry_in_op_u_ugly_cry/,IDJPunkI,"When u cry in OP, u ugly cry.",3592,0.96,116,,1689446193.0,False,False,False,False,False
96,150orow,PoliticalCompassMemes,/r/PoliticalCompassMemes/comments/150orow/good_choice/,cruelsummersadness,Good choice 🙏,1667,0.91,194,:authright: - Auth-Right,1689459439.0,False,False,False,False,False
97,150nrq3,madlads,/r/madlads/comments/150nrq3/rebuild_her_house_out_of_meat_next/,RandomGuyWontSayDATA,Rebuild her house out of meat next,1911,0.91,48,← terrified,1689456954.0,False,False,False,False,False
98,150ox56,space,/r/space/comments/150ox56/fog_this_morning_was_so_dense_that_the_sunspots/,LittleEpicBoss,"Fog this morning was so dense that the sunspots were visible by naked eye, picture taken with normal phone",1610,0.97,70,,1689459826.0,False,False,False,False,False
99,150k88u,houseplants,/r/houseplants/comments/150k88u/thought_that_yall_would_appreciate_my_houseplant/,Cerulean28,Thought that ya'll would appreciate my houseplant tattoo!,2944,0.95,97,,1689448109.0,False,False,False,False,False
100,150mzkf,anime_irl,/r/anime_irl/comments/150mzkf/anime_irl/,Guywiddahhair,anime_irl,2069,0.99,46,,1689454992.0,False,False,False,False,False
