rank,id,subreddit,permalink,author,title,score,upvote_ratio,num_comments,author_flair_text,created_utc,over_18,edited,stickied,locked,is_original_content
1,14jirc0,WhitePeopleTwitter,/r/WhitePeopleTwitter/comments/14jirc0/so_books_cant_even_mention_that_lgbtq_people_exist/,thatguy9684736255,So books can't even mention that LGBTQ people exist?,20266,0.95,821,,1687789488.0,False,False,False,False,False
2,14jjru9,politics,/r/politics/comments/14jjru9/hamburger_marys_wins_court_victory_against_ron/,HyacinthFT,"Hamburger Mary’s wins court victory against Ron DeSantis’ drag ban | The judge called the law ""vague and overbroad,"" saying it could apply to burlesque shows or a skit at a family BBQ.",11992,0.97,322,,1687791898.0,False,False,False,False,False
3,14jip88,MadeMeSmile,/r/MadeMeSmile/comments/14jip88/this_tween_who_is_pants_shittingly_excited_to/,Soloflow786,This tween who is pants shittingly excited to meet… Michael McDonald.,19122,0.93,904,,1687789346.0,False,False,False,False,False
4,14jj4a1,lotrmemes,/r/lotrmemes/comments/14jj4a1/i_know_why_he_liked_hobbits_so_much_now/,l_arpenteur,I know why he liked Hobbits so much now...,14051,0.97,337,,1687790332.0,False,False,False,False,False
5,14jieaz,todayilearned,/r/todayilearned/comments/14jieaz/til_that_star_wars_released_a_christmas_music/,Anadyne,"TIL that STAR WARS released a Christmas music album in 1980 and the producers wanted a better lead singer for the track ""R2-D2 We Wish You a Merry Christmas"" so they asked the 17 year old kid who was sweeping floors at the studio, and he nailed it. His name was Jon Bon Jovi.",17656,0.92,552,,1687788644.0,False,False,False,False,False
6,14jislk,OldSchoolCool,/r/OldSchoolCool/comments/14jislk/my_parents_in_the_early_90s_in_nyc/,sunkissedmist,My parents in the early 90s in NYC.,12651,0.96,460,,1687789567.0,False,False,False,False,False
7,14jgil9,facepalm,/r/facepalm/comments/14jgil9/oh_my_god_what_a_complete_idiot_what_was_he/,Lenore8264,"Oh my god, what a complete idiot. What was he thinking!??",47161,0.92,3630,,1687783938.0,False,False,False,False,False
8,14ji5e2,news,/r/news/comments/14ji5e2/supreme_court_allows_for_louisiana_congressional/,AudibleNod,Supreme Court allows for Louisiana congressional map to be redrawn to add another majority-Black district,11936,0.96,524,,1687788069.0,False,False,False,False,False
9,14jgnql,Damnthatsinteresting,/r/Damnthatsinteresting/comments/14jgnql/photographers_intimidate_an_approaching_bear/,caosck,Photographers intimidate an approaching bear,26622,0.97,974,,1687784332.0,False,False,False,False,False
10,14jg7xu,mildlyinfuriating,/r/mildlyinfuriating/comments/14jg7xu/23_times_a_week_i_collect_syringes_from_my/,mtsiri,"2-3 times a week, I collect syringes from my balcony. This is how my super old neighbor is trying to get me evicted, as she believes that my roommate and I are gay, and she thinks all gay people are drug addicts.",68907,0.87,5299,,1687783132.0,False,False,False,False,False
11,14jfyr6,cats,/r/cats/comments/14jfyr6/laws_apply_to_everyone/,Physical-Theory-5829,Laws apply to everyone 🫡,17998,0.98,130,,1687782424.0,False,False,False,False,False
12,14jjzb3,AskReddit,/r/AskReddit/comments/14jjzb3/whats_the_most_disturbing_piece_of_audio_there_is/,odinson-09,What's the most disturbing piece of audio there is?,7822,0.9,5138,,1687792389.0,True,False,False,False,False
13,14jftqn,oddlysatisfying,/r/oddlysatisfying/comments/14jftqn/crystal_clear_glacier_stream_in_alaska/,yourSAS,Crystal clear glacier stream in Alaska,24849,0.97,363,,1687782035.0,False,False,False,False,False
14,14jhrbj,meirl,/r/meirl/comments/14jhrbj/meirl/,iamcoollife1994,meirl,12948,0.97,232,,1687787132.0,False,False,False,False,False
15,14jhgyo,nextfuckinglevel,/r/nextfuckinglevel/comments/14jhgyo/this_crazy_ass_light_show_thing/,qwbif,This crazy ass light show thing,13587,0.93,280,,1687786392.0,False,False,False,False,False
16,14jhjnb,antiwork,/r/antiwork/comments/14jhjnb/hilarious/,hyonjean,Hilarious! 😄,10675,0.97,145,,1687786582.0,False,False,False,False,False
17,14jettq,technology,/r/technology/comments/14jettq/jp_morgan_accidentally_deletes_evidence_in/,Sorin61,JP Morgan accidentally deletes evidence in multi-million record retention screwup,20797,0.96,1228,,1687779178.0,False,False,False,False,False
18,14jj1eu,ukraine,/r/ukraine/comments/14jj1eu/president_zelensky_stopped_by_a_gas_station_in/,vectorix108,"President Zelensky stopped by a gas station in the Donetsk region, where he talked with soldiers and got some coffee",6794,0.95,298,,1687790140.0,False,False,False,False,False
19,14jmuvf,HolUp,/r/HolUp/comments/14jmuvf/tesla_driver_said_hol_up/,ThatGirl_BeWriting,Tesla driver said Hol up!,4144,0.93,127,,1687798961.0,False,False,False,False,False
20,14jftbb,maybemaybemaybe,/r/maybemaybemaybe/comments/14jftbb/maybe_maybe_maybe/,lebelle25,maybe maybe maybe,14558,0.93,446,,1687782002.0,False,False,False,False,False
21,14jm4ny,AmItheAsshole,/r/AmItheAsshole/comments/14jm4ny/aita_for_telling_my_parents_if_they_wanna_charge/,Ok-Advance5531,AITA for telling my parents if they wanna charge me rent then they need to treat me like an adult?,4047,0.97,984,,1687797314.0,False,1687805191.0,False,False,False
22,14jnza5,nba,/r/nba/comments/14jnza5/wojanrowski_espn_sources_the_hawks_are_finalizing/,Michael_B_Lopez,"[Wojanrowski] ESPN Sources: The Hawks are finalizing a trade to send F/C John Collins to the Jazz for Rudy Gay and a future second-round pick. Atlanta’s largely unloading Collins’ three years, $78M for some roster building flexibility and alignment with looming changes to salary cap.",3143,0.98,901,:gsw-1: Warriors,1687801479.0,False,False,False,False,False
23,14jevks,memes,/r/memes/comments/14jevks/medieval_maidens/,DrGt2,Medieval Maidens,21987,0.94,242,,1687779316.0,False,False,False,False,False
24,14jes8d,gaming,/r/gaming/comments/14jes8d/my_aerith_cosplay_i_made_using_only_thrifted/,hoodbobthugpants,My Aerith cosplay I made using only thrifted materials,27674,0.8,747,,1687779055.0,False,False,False,False,False
25,14jgexy,pics,/r/pics/comments/14jgexy/testing_the_mods_by_not_posting_john_oliver_not/,TheGerk,"Testing the mods by not posting John Oliver. Not in the title, and clearly not in the image.",9689,0.86,127,,1687783669.0,False,False,False,False,False
26,14jfpaa,WhitePeopleTwitter,/r/WhitePeopleTwitter/comments/14jfpaa/i_feel_so_bad_for_dr_peter_hotez_because_he_has/,JohnSheet69420,I feel SO bad for Dr. Peter Hotez because he has to deal with this garbage,33796,0.92,2536,,1687781674.0,False,False,False,False,False
27,14jh9nt,Damnthatsinteresting,/r/Damnthatsinteresting/comments/14jh9nt/the_tiger_stopped_and_waited_until_the_elephants/,rco888,The tiger stopped and waited until the elephants crossed the road.,19440,0.98,504,,1687785874.0,False,False,False,False,False
28,14jdsfb,comics,/r/comics/comments/14jdsfb/mental_block/,MrLovens,Mental Block,17552,0.96,130,Mr. Lovenstein,1687775963.0,False,False,False,False,False
29,14je7zn,therewasanattempt,/r/therewasanattempt/comments/14je7zn/to_not_shake_the_principals_hand/,thepezdispenzer,To not shake the principals hand,22095,0.89,2950,,1687777313.0,False,False,False,True,False
30,14ji7gc,marvelmemes,/r/marvelmemes/comments/14ji7gc/thanos_who/,Peach_sloth,Thanos who??,6215,0.95,200,Avengers,1687788189.0,False,False,False,False,False
31,14jdax3,technicallythetruth,/r/technicallythetruth/comments/14jdax3/at_least_they_have_an_extra_room_now/,Humiliatin,At least they have an extra room now,27664,0.95,181,,1687774392.0,False,False,False,False,False
32,14jf2mu,iamatotalpieceofshit,/r/iamatotalpieceofshit/comments/14jf2mu/idiot_tourist_engraves_the_name_of_his_girlfriend/,thoxo,"Idiot tourist engraves the name of his girlfriend with keys on the Colosseum, Rome. He is facing a 18.000€ fine. As a Roman, I wish they would ban him from Rome forever.",10071,0.97,668,,1687779914.0,False,False,False,False,False
33,14jizf6,TikTokCringe,/r/TikTokCringe/comments/14jizf6/looks_like_hospital_bracelets_to_me/,blithehope,Looks like hospital bracelets to me,5355,0.86,154,,1687790015.0,False,False,False,False,False
34,14jcik2,worldnews,/r/worldnews/comments/14jcik2/uk_government_considers_preparing_for_scenario_of/,turboNOMAD,UK government considers preparing for scenario of unexpected collapse of Russian Federation – The Times,29168,0.93,1971,,1687771817.0,False,False,False,False,False
35,14jhlqf,doordash,/r/doordash/comments/14jhlqf/smokers_shouldnt_be_allowed_to_be_dashers/,,Smokers shouldn't be allowed to be Dashers,6823,0.78,2083,,1687786737.0,False,1687798483.0,False,False,False
36,14jdwz9,BeAmazed,/r/BeAmazed/comments/14jdwz9/baby_kangaroo_cute/,XahidX,Baby Kangaroo: Cute,14565,0.96,162,,1687776375.0,False,False,False,False,False
37,14jj17u,MadeMeSmile,/r/MadeMeSmile/comments/14jj17u/his_reaction_on_a_donation_is_too_wholesome/,not_a_profession,His reaction on a donation is too wholesome,8540,0.97,89,,1687790127.0,False,False,False,False,False
38,14jgjm4,whenthe,/r/whenthe/comments/14jgjm4/femboy_maid_moment/,Imperator_Crispico,Femboy maid moment,8354,0.94,106,,1687784019.0,False,False,False,False,False
39,14je01k,videos,/r/videos/comments/14je01k/reddit_may_be_violating_the_fucking_ccpa/,DrewbieWanKenobie,Reddit may be violating the fucking CCPA,13264,0.9,1137,,1687776646.0,True,False,False,False,False
40,14jjmip,pcgaming,/r/pcgaming/comments/14jjmip/ddos_attack_on_blizzard_leads_to_more_calls_for_a/,chrisdh79,DDoS attack on Blizzard leads to more calls for a Diablo 4 offline mode | Some players were unable to access the game for over 12 hours,4030,0.94,562,,1687791574.0,False,False,False,False,False
41,14jf2ia,TwoXChromosomes,/r/TwoXChromosomes/comments/14jf2ia/michigan_house_votes_to_outlaw_child_marriage/,Madame_President_,Michigan House votes to outlaw child marriage,7958,0.98,253,,1687779905.0,False,False,False,False,False
42,14jl5gh,FunnyandSad,/r/FunnyandSad/comments/14jl5gh/1_rich_people_ignored_to_pay_their_taxes/,SpryMustang,1% rich people ignored to pay their taxes,3335,0.96,132,,1687795111.0,False,False,False,False,False
43,14je97i,politics,/r/politics/comments/14je97i/democrats_warn_party_the_threat_of_trump_winning/,LuvKrahft,Democrats warn party: The threat of Trump winning in 2024 is 'very real',24701,0.92,3240,:flag-us: America,1687777406.0,False,False,False,False,False
44,14jm72m,shitposting,/r/shitposting/comments/14jm72m/heil_spez_i_lost_faith/,Siil_Udus,Heil spez I lost faith,2981,0.97,50,,1687797467.0,False,False,False,False,False
45,14jgex3,facepalm,/r/facepalm/comments/14jgex3/jp_morgan_accidentally_mass_deletes_evidence/,Gamer4Lyph,"JP Morgan ""accidentally"" mass deletes evidence requested as part of an investigation. Gets fined.",11611,0.98,690,,1687783667.0,False,False,False,False,False
46,14jet0k,popculturechat,/r/popculturechat/comments/14jet0k/oppenheimer_team_doesnt_give_a_fuck/,DamnThatsInsaneLol,Oppenheimer team doesn't give a fuck 😭,8423,0.94,376,,1687779111.0,False,False,False,False,False
47,14jlpoa,rareinsults,/r/rareinsults/comments/14jlpoa/they_do_look_alike_to_be_fair/,bowmanbs695,They do look alike to be fair,2969,0.97,39,,1687796366.0,False,False,False,False,False
48,14jhg3u,mildlyinfuriating,/r/mildlyinfuriating/comments/14jhg3u/my_parents_are_staying_in_a_hotel_that_promised/,IMLRG,My parents are staying in a hotel that promised to serve them breakfast during their stay. This is the breakfast they were given.,9220,0.97,1007,,1687786332.0,False,False,False,False,False
49,14jerb1,nextfuckinglevel,/r/nextfuckinglevel/comments/14jerb1/two_toptier_geoguessr_players_guessing_a_location/,NotExistingRediter,"Two top-tier Geoguessr players guessing a location from anywhere in the world in 0.1 seconds, the information retention is insane",25332,0.89,1371,,1687778989.0,False,False,False,False,False
50,14jc366,wholesomememes,/r/wholesomememes/comments/14jc366/if_you_feel_like_you_need_a_distraction_from_the/,khadigahegazy,"If you feel like you need a distraction from the grim headlines and you're the type of person who can find comfort on the positive side of the internet, you're not alone.",24869,0.95,212,,1687770371.0,False,False,False,False,False
51,14jhye1,PublicFreakout,/r/PublicFreakout/comments/14jhye1/1010_for_confidence/,DickDastardly619,10/10 for confidence,4766,0.94,477,,1687787602.0,True,False,False,False,False
52,14jennw,PoliticalHumor,/r/PoliticalHumor/comments/14jennw/the_us_marine_corps_faces_having_no_confirmed/,eaglemaxie,The U.S. Marine Corps faces having no confirmed leader for first time in 164 years,7875,0.94,411,,1687778679.0,False,False,False,False,False
53,14jbm9a,funny,/r/funny/comments/14jbm9a/spacegate/,jhericurls,SpaceGate,39006,0.9,1206,,1687768803.0,False,False,False,False,False
54,14jgw8i,ProgrammerHumor,/r/ProgrammerHumor/comments/14jgw8i/whentheproductisnotreadybuttheclientmustseesomethi/,m3nation007,whenTheProductIsNotReadyButTheClientMustSeeSomething,5270,0.98,90,,1687784925.0,False,False,False,False,False
55,14jmdip,Breath_of_the_Wild,/r/Breath_of_the_Wild/comments/14jmdip/who_would_win/,Tha-AK-killah,who would win,2524,0.98,77,,1687797877.0,False,False,False,False,False
56,14ji2f6,dankmemes,/r/dankmemes/comments/14ji2f6/i_know_what_i_have_done/,white-rice77,I know what I have done,4929,0.95,63,,1687787882.0,False,False,False,False,False
57,14jjbp8,oddlyterrifying,/r/oddlyterrifying/comments/14jjbp8/the_corklid_trapdoor_spider_if_you_see_what_looks/,badlybloviate99,"The Cork-lid trapdoor spider. If you see what looks like an ancient coin buried in sand, leave it alone...",3740,0.96,153,,1687790836.0,False,False,False,False,False
58,14jjjbk,MoldyMemes,/r/MoldyMemes/comments/14jjjbk/minor_mistake/,markedsa,minor mistake,3591,0.98,55,,1687791356.0,False,False,False,False,False
59,14jgywl,Superstonk,/r/Superstonk/comments/14jgywl/oh_hey_wadda_you_know_deutsche_bank_just_told/,jab136,Oh hey wadda you know. Deutsche bank just told investors they don't actually own shares.,5508,0.95,193,🦍✔️✔️Voted twice💣💥🚀 There's always a boom tomorrow🚀💥💣,1687785115.0,False,False,False,False,False
60,14jf2io,WorkReform,/r/WorkReform/comments/14jf2io/private_health_insurance_industry_is_a_scam/,XXmynameisNeganXX,"Private health insurance industry is a scam! healthcare should be publicly funded and free for everyone. If you get sick, you get the treatment you deserve, no money involved period.",6109,0.96,237,🏏 People Are A Resource,1687779906.0,False,False,False,False,False
61,14jfuvd,NatureIsFuckingLit,/r/NatureIsFuckingLit/comments/14jfuvd/pond_heron_fishing_in_style/,yourSAS,🔥 Pond heron fishing in style,5091,0.97,49,:polar-bear:,1687782116.0,False,False,False,False,False
62,14jdp66,formuladank,/r/formuladank/comments/14jdp66/investors_planning_f1_race_locations/,iKiWY,Investors planning F1 race locations,8026,0.97,199,Safety Dog,1687775660.0,False,False,False,False,False
63,14ji4ii,HermanCainAward,/r/HermanCainAward/comments/14ji4ii/right_winger_laura_loomer_reveals_she_struggles/,gunsof,"Right winger Laura Loomer reveals she struggles eating out because she believes everything smells and tastes weird. Suggests the food has changed. She had a ""brutal"" case of Covid last September.",3462,0.96,396,,1687788020.0,False,False,False,False,False
64,14jfmct,Eldenring,/r/Eldenring/comments/14jfmct/this_did_no_go_as_planned/,__StrangerDanger__,This did no go as planned,5297,0.97,150,,1687781445.0,False,False,False,False,False
65,14ji2hl,WhitePeopleTwitter,/r/WhitePeopleTwitter/comments/14ji2hl/the_supreme_court_says_louisianas_congressional/,seangolden06,The Supreme Court says Louisiana's congressional map must be redrawn to add a second majority-Black district.,9483,0.98,170,,1687787886.0,False,False,False,False,False
66,14jeba4,JustGuysBeingDudes,/r/JustGuysBeingDudes/comments/14jeba4/fine_dining/,Layhereincarnated,Fine Dining,6431,0.95,139,,1687777585.0,False,False,False,False,False
67,14jkksm,pcmasterrace,/r/pcmasterrace/comments/14jkksm/couldnt_ask_for_a_better_bachelor_party/,BoardingPanth,Couldn’t ask for a better bachelor party,2545,0.96,142,:tux: PC Master Race,1687793782.0,False,False,False,False,False
68,14jgq3p,EarthPorn,/r/EarthPorn/comments/14jgq3p/a_tornado_forming_over_the_green_fields_of/,spiider_bro,A tornado forming over the green fields of Wyoming [OC] [5472 x 3648],4039,0.96,49,,1687784486.0,False,False,False,False,False
69,14jgp37,NewsOfTheStupid,/r/NewsOfTheStupid/comments/14jgp37/gop_names_trump_man_of_the_decade_in_michigan/,Misguided_Society,"GOP names Trump ‘Man of the Decade’ in Michigan after rambling speech - ‘if you don't have steel, you don't have a country, like borders, like elections, got to have real elections,’ Trump said",4090,0.89,731,,1687784426.0,False,False,False,False,False
70,14jfczy,clevercomebacks,/r/clevercomebacks/comments/14jfczy/friend_or_money/,CuteAngryGirl,Friend or money?,5207,0.95,323,,1687780756.0,False,False,False,False,False
71,14jiybg,TikTokCringe,/r/TikTokCringe/comments/14jiybg/call_her_tf_out_actions_have_consequences/,blithehope,"call her tf out, actions have consequences",4659,0.96,388,,1687789941.0,False,False,False,False,False
72,14jkbs6,Damnthatsinteresting,/r/Damnthatsinteresting/comments/14jkbs6/edible_helium_balloon/,yourSAS,Edible Helium balloon ,6383,0.95,188,,1687793202.0,False,False,False,False,False
73,14jkkvb,SipsTea,/r/SipsTea/comments/14jkkvb/meanwhile_somewhere_far/,MrDaval,Meanwhile somewhere far!,2413,0.97,21,,1687793787.0,False,False,False,False,False
74,14jcyi6,oddlysatisfying,/r/oddlysatisfying/comments/14jcyi6/resin_and_maple_burl_donut/,Gh0stDestr0y,Resin and Maple Burl Donut,21141,0.94,435,Flair Loading...,1687773283.0,False,False,False,False,False
75,14jlauy,mildlyinteresting,/r/mildlyinteresting/comments/14jlauy/an_open_letter_to_the_admins/,AutoModerator,An open letter to the admins,2215,0.83,541,,1687795431.0,False,False,True,False,True
76,14jbgug,PrequelMemes,/r/PrequelMemes/comments/14jbgug/dont_forget_ewan_travelled_from_london_to_new/,SnakeVicBossMGS,Don’t forget Ewan travelled from London to New York on a bike.,13516,0.94,396,,1687768286.0,False,False,False,False,False
77,14jlb22,Genshin_Impact,/r/Genshin_Impact/comments/14jlb22/official_2023_birthday_web_event_shorts_yae_miko/,Bisentinel,Official 2023 Birthday Web Event Shorts: Yae Miko,2146,0.99,73,,1687795444.0,False,False,False,False,False
78,14jndz6,MadeMeSmile,/r/MadeMeSmile/comments/14jndz6/at_the_european_championships_two_hurdlers_from/,Soloflow786,"At the European Championships, two hurdlers from Team Belgium were injured and couldn't compete. Without any runners, Team Belgium would have been disqualified, so a shot putter stepped up and took their place. This is what team spirit looks like.",3899,0.99,118,,1687800119.0,False,False,False,False,False
79,14jhjfj,TheRightCantMeme,/r/TheRightCantMeme/comments/14jhjfj/theyre_actually_going_mask_off_about_getting_rid/,Butters12Stotch,They're actually going mask off about getting rid of Social Security,3381,0.95,144,,1687786569.0,False,False,False,False,False
80,14jgh4g,NonPoliticalTwitter,/r/NonPoliticalTwitter/comments/14jgh4g/my_level_of_awkwardness/,girolski07,My level of awkwardness.,3901,0.97,40,:blue1::blue2::1111::1112:,1687783836.0,False,False,False,False,False
81,14jhm78,cats,/r/cats/comments/14jhm78/what_is_this_face/,rwozzy0729,What is this face?,5311,0.98,319,,1687786770.0,False,False,False,False,False
82,14jci8t,CasualUK,/r/CasualUK/comments/14jci8t/staying_at_my_parents_tonight_my_boyfriend_just/,Fluffy-Survey4036,Staying at my parents tonight. My boyfriend just looked in their fridge and said ‘I’ve never seen a fridge have so much yet so little at the same time’,7836,0.96,556,,1687771791.0,False,False,False,False,False
83,14jepea,TheLastAirbender,/r/TheLastAirbender/comments/14jepea/i_hope_this_hasnt_been_done_already/,Bisexual-Demigod,I Hope this Hasn't Been Done Already,5284,0.97,159,:Asami:,1687778825.0,False,False,False,False,False
84,14jkw13,shitposting,/r/shitposting/comments/14jkw13/glory_to_spez/,Resident_Village_930,Glory to spez,3407,0.95,153,,1687794499.0,False,False,False,False,False
85,14jc0lu,pokemon,/r/pokemon/comments/14jc0lu/volcarona_care_guide/,Soggy-Specialist-358,Volcarona care guide,9074,0.95,99,,1687770141.0,False,False,False,False,True
86,14jejzm,todayilearned,/r/todayilearned/comments/14jejzm/til_that_there_is_an_enigma_message_that_hasnt/,Quique1222,TIL That there is an Enigma message that hasn't been broken yet,8412,0.95,791,,1687778367.0,False,False,False,False,False
87,14jijm0,PoliticalCompassMemes,/r/PoliticalCompassMemes/comments/14jijm0/mission_impossible_california_trying_to_be_sane/,Rust1n_Cohle,Mission impossible: California trying to be sane for 5 seconds,2827,0.81,1277,:libright: - Lib-Right,1687788987.0,False,False,False,False,False
88,14jdvbd,tumblr,/r/tumblr/comments/14jdvbd/a_lot_to_vent/,ConfidenceNo4748,A lot to vent,5877,0.97,21,,1687776225.0,False,False,False,False,False
89,14jj0an,Tinder,/r/Tinder/comments/14jj0an/right/,conFmck,Right...,2618,0.9,272,,1687790075.0,True,False,False,False,False
90,14jfq6l,DunderMifflin,/r/DunderMifflin/comments/14jfq6l/the_stress_of_my_modern_office_has_caused_me_to/,suntmint,The stress of my modern office has caused me to go into a deppression,4018,0.97,82,,1687781738.0,False,False,False,False,False
91,14jh02n,technews,/r/technews/comments/14jh02n/white_house_announces_40_billion_in_broadband/,chrisdh79,White House announces $40 billion in broadband funding | The funding is part of the administration’s goal to connect all Americans to high-speed broadband by 2030.,3310,0.96,289,,1687785193.0,False,False,False,False,False
92,14jik28,CitiesSkylines,/r/CitiesSkylines/comments/14jik28/a_fresh_peek_at_the_scale_of_cs2/,stevay_b,A fresh peek at the scale of CS2,2682,0.97,253,,1687789015.0,False,False,False,False,False
93,14jjf52,ukraine,/r/ukraine/comments/14jjf52/oleksandr_and_andrii_serve_in_the_armed_forces/,TotalSpaceNut,Oleksandr and Andrii serve in the Armed Forces and are awaiting for a civil partnership in Ukraine,3678,0.92,170,,1687791078.0,False,False,False,False,False
94,14jg3ma,teenagers,/r/teenagers/comments/14jg3ma/how_do_i_answer_this/,TNTmannen200,How do i answer this?,4258,0.96,658,19,1687782792.0,True,False,False,False,False
95,14jh2w4,shittytattoos,/r/shittytattoos/comments/14jh2w4/stolen_from_a_facebook_group/,LordMinivan,Stolen from a facebook group,3252,0.97,235,,1687785384.0,False,False,False,False,False
96,14jhjk3,Rabbits,/r/Rabbits/comments/14jhjk3/today_my_dearest_koko_left_for_somewhere_better/,janysl,Today my dearest koko left for somewhere better. He has given me so much love and joy throughout the 12 years he’s with me. He’s always such a considerate old bunny and so sweet and loving. He will continue living in my heart forever. Till we meet again ❤️❤️ And thanks everyone for loving him here!,3029,0.96,231,,1687786576.0,False,False,False,False,False
97,14jcvy2,LeopardsAteMyFace,/r/LeopardsAteMyFace/comments/14jcvy2/russian_occupiers_drop_chemical_project_on/,Humble_Novice,Russian Occupiers Drop Chemical Project on Ukrainian Positions Only for the Wind to Blow It Back On Them,6431,0.95,205,,1687773044.0,False,False,False,False,False
98,14jdfcs,Animemes,/r/Animemes/comments/14jdfcs/tan_women/,jAustinJr,Tan women🔛🔝,6419,0.92,208,,1687774785.0,False,False,False,False,False
99,14jdolo,wholesomememes,/r/wholesomememes/comments/14jdolo/take_a_puppy/,thesitekick,Take a puppy,10839,0.98,57,,1687775605.0,False,False,False,False,False
100,14jfcpo,marvelstudios,/r/marvelstudios/comments/14jfcpo/for_those_who_were_present_during_the_beginning/,Browsing_unrelated,"For those who were present during the beginning of Phase 1, what were your impressions or reflections at that time?",4120,0.9,1106,,1687780734.0,False,False,False,False,False
