rank,id,subreddit,permalink,author,title,score,upvote_ratio,num_comments,author_flair_text,created_utc,over_18,edited,stickied,locked,is_original_content
1,14qwtqf,WhitePeopleTwitter,/r/WhitePeopleTwitter/comments/14qwtqf/reddit_what_do_you_think/,seangolden06,"Reddit, what do you think?",28113,0.93,763,,1688520955.0,False,False,False,False,False
2,14qxs5l,oddlysatisfying,/r/oddlysatisfying/comments/14qxs5l/submerging_eiderdown_in_water/,solateor,submerging eiderdown in water,13138,0.98,178,,1688523926.0,False,False,False,False,False
3,14qwazj,Damnthatsinteresting,/r/Damnthatsinteresting/comments/14qwazj/in_1970_dock_ellis_threw_a_nohitter_under_the/,Seraphenigma,"In 1970, Dock Ellis threw a no-hitter under the influence of LSD",16899,0.96,580,,1688519308.0,False,False,False,False,False
4,14qxf9g,wholesomememes,/r/wholesomememes/comments/14qxf9g/it_was_and_still_is_one_of_the_best_feelings/,utterbreakerjy,It was and still is one of the best feelings,10484,0.97,125,,1688522829.0,False,False,False,False,False
5,14qwnzk,MadeMeSmile,/r/MadeMeSmile/comments/14qwnzk/after_a_long_battle_my_dream_came_true_today_my/,simoonne,After a long battle. My dream came true today! My mom ie cancer free. So proud of her.,11550,0.95,155,,1688520452.0,False,False,False,False,False
6,14qvc1k,facepalm,/r/facepalm/comments/14qvc1k/i_dont_understand_why_he_would_move_on/,NoPermissionaz,I don't understand why he would move on.,31141,0.92,1537,,1688516368.0,False,False,False,False,False
7,14qtkbz,mildlyinfuriating,/r/mildlyinfuriating/comments/14qtkbz/kids_eat_free_lol/,hadtodoit_69,“Kids eat free” lol,22215,0.95,1043,,1688511335.0,False,False,False,False,False
8,14qugij,madlads,/r/madlads/comments/14qugij/madlad_in_lecture_repost_because_of_new_rules/,littlerocky12,Madlad in Lecture (repost because of new rules),14291,0.95,184,,1688513828.0,False,False,False,False,False
9,14qvviq,maybemaybemaybe,/r/maybemaybemaybe/comments/14qvviq/maybe_maybe_maybe/,50ShadesOfSpray_,Maybe maybe maybe,10114,0.87,729,,1688518002.0,False,False,False,False,False
10,14qujpd,therewasanattempt,/r/therewasanattempt/comments/14qujpd/to_be_cute/,handilypulp96,to be cute,11895,0.95,453,,1688514072.0,False,False,False,False,False
11,14quv22,politics,/r/politics/comments/14quv22/republican_party_ridiculed_after_tweeting_wrong/,Oleg101,Republican Party ridiculed after tweeting wrong flag for Fourth of July,8380,0.96,363,,1688515000.0,False,False,False,False,False
12,14qygsn,memes,/r/memes/comments/14qygsn/try_to_go_to_work_on_monday_morning/,EnvySugarCover,try to go to work on Monday morning,5154,0.97,192,(⊃｡•́‿•̀｡)⊃,1688526079.0,False,False,False,False,False
13,14qxmle,BeAmazed,/r/BeAmazed/comments/14qxmle/no_one_told_me_moose_were_this_massive/,beastmodeChadF13,no one told me moose were THIS massive ,5227,0.95,503,,1688523441.0,False,False,False,False,False
14,14quo8i,funny,/r/funny/comments/14quo8i/if_u_ever_feel_like_a_failure_remember_denmarks/,Fun_Bison_1693,If u ever feel like a failure remember Denmark's Travel agency made this advertisement to fight Denmark's low birth rate,8394,0.94,551,,1688514436.0,True,False,False,False,False
15,14qy45l,gaming,/r/gaming/comments/14qy45l/im_buying_a_game_on_steam_how_do_i_turn_tax_off/,Vanddrake,"I'm buying a game on Steam, how do I turn tax off??",4383,0.92,484,,1688524956.0,False,False,False,False,False
16,14qu65p,todayilearned,/r/todayilearned/comments/14qu65p/til_that_the_bbc_had_no_archival_policy_until/,PegPelvis,"TIL that the BBC had no archival policy until 1978, and many of its old broadcasts were only aired live. A number of BBC broadcasts are lost, including a show featuring a then-unknown Bob Dylan; 97 episodes of Dr. Who; and most of its coverage of the moon landing.",8754,0.98,259,,1688513053.0,False,False,False,False,False
17,14qs7v0,nextfuckinglevel,/r/nextfuckinglevel/comments/14qs7v0/pilot_and_atc_talk_student_pilot_through_an/,IncidentalIncidence,Pilot and ATC talk student pilot through an emergency landing after landing gear breaks on takeoff,25600,0.83,407,,1688507800.0,False,False,False,False,False
18,14qzk9o,HonkaiStarRail,/r/HonkaiStarRail/comments/14qzk9o/official_character_announcement_fu_xuan_5_star/,Xanek,【Official】 Character Announcement: Fu Xuan (5 Star - Quantum / Preservation),2995,0.96,249,,1688529619.0,False,False,False,False,False
19,14qx6nu,oddlyterrifying,/r/oddlyterrifying/comments/14qx6nu/went_to_throw_something_in_the_little_recyling/,hunterorila,Went to throw something in the little recyling bin we have on the counter and...,4597,0.97,166,,1688522105.0,False,False,False,False,False
20,14qq9ms,antiwork,/r/antiwork/comments/14qq9ms/my_boss_was_mad_at_me_for_posting_online_how_much/,Jacq1987,"My boss was mad at me for posting online how much I make per hour and threatened to fire me, so I quit.",21560,0.93,1680,,1688503045.0,False,False,False,False,False
21,14qr9lq,OldSchoolCool,/r/OldSchoolCool/comments/14qr9lq/penelope_cruz_and_salma_hayek_in_90s/,cliptemnestra,Penelope Cruz and Salma Hayek in 90s,12331,0.95,554,,1688505466.0,False,False,False,False,False
22,14qvrc3,aww,/r/aww/comments/14qvrc3/mini_taekwondo/,TrueSkyDemon,Mini Taekwondo,5127,0.88,132,,1688517657.0,False,False,False,False,False
23,14r1xv8,HumansBeingBros,/r/HumansBeingBros/comments/14r1xv8/the_trapped_dog_doesnt_wait_a_bit_to_hug_the/,JettMe_Red,The trapped dog doesn't wait a bit to hug the rescuer after being freed..,1692,0.98,34,,1688537435.0,False,False,False,False,False
24,14qtjbu,meirl,/r/meirl/comments/14qtjbu/meirl/,AMCBUYANDHOLD,Meirl,10451,0.84,190,,1688511261.0,False,False,False,False,False
25,14qqi4r,cats,/r/cats/comments/14qqi4r/give_him_everything_he_wants/,Small_Elf_Girl,Give him everything he wants 😿,12723,0.97,280,,1688503620.0,False,False,False,False,False
26,14qtw8d,PrequelMemes,/r/PrequelMemes/comments/14qtw8d/beard/,Alternative_Serve368,Beard,6698,0.98,87,,1688512261.0,False,False,False,False,False
27,14qpzsq,worldnews,/r/worldnews/comments/14qpzsq/russia_rigs_znpp_reactor_buildings_with/,TheRealMykola,Russia rigs ZNPP reactor buildings with explosives – AFU,11142,0.95,1713,,1688502411.0,False,False,False,False,False
28,14qsjdc,tumblr,/r/tumblr/comments/14qsjdc/the_second_and_third_coming/,StraightOuttaOlaphis,The second and third coming,7813,0.97,120,,1688508613.0,False,False,False,False,False
29,14qydmc,shitposting,/r/shitposting/comments/14qydmc/heil_dear_leader_spez/,OdinAurelius,Heil dear leader Spez,2661,0.96,41,William Dripfoe,1688525804.0,False,False,False,False,False
30,14qr3lt,BrandNewSentence,/r/BrandNewSentence/comments/14qr3lt/yeah_this_will_probably_be_a_mature_conversation/,venmke,"Yeah, this will probably be a mature conversation.",11210,0.94,953,,1688505058.0,False,False,False,False,False
31,14qrlmf,HolUp,/r/HolUp/comments/14qrlmf/literally_my_hero/,MeteoXavier,Literally My Hero,9257,0.95,31,,1688506260.0,False,False,False,False,False
32,14qu6kj,NonPoliticalTwitter,/r/NonPoliticalTwitter/comments/14qu6kj/i_mean_seriously/,CattDawg2008,i mean seriously,5171,0.95,72,:blue1::blue2::1111::1112:,1688513086.0,False,False,False,False,False
33,14qqy4v,PeterExplainsTheJoke,/r/PeterExplainsTheJoke/comments/14qqy4v/can_someone_help/,Responsible_Body5907,Can someone help,10788,0.92,877,,1688504683.0,False,False,False,False,False
34,14qo9wu,doordash,/r/doordash/comments/14qo9wu/why_is_my_driver_in_georgia/,Takeapropaganda666,Why is my driver in Georgia,21197,0.93,1437,,1688498312.0,False,False,False,False,False
35,14qpb0x,comics,/r/comics/comments/14qpb0x/choose_your_weapon/,MurkyWay,Choose Your Weapon,11495,0.95,551,Swords,1688500807.0,False,False,False,False,False
36,14qwxjs,nba,/r/nba/comments/14qwxjs/today_marks_7_years_ago_to_the_day_that_kevin/,CulturalRoll,Today marks 7 years ago to the day that Kevin Durant signed with the Golden State Warriors -- possibly the most infamous signing in NBA history,2702,0.93,666,:gsw-5: Warriors,1688521283.0,False,1688537073.0,False,False,False
37,14quhi1,WorkReform,/r/WorkReform/comments/14quhi1/i_took_a_job_nobody_wanted_and_made_it_so_good_i/,BakerLovePie,I took a job nobody wanted and made it so good I got fired.,3987,0.98,183,,1688513906.0,False,False,False,False,False
38,14qnpha,NatureIsFuckingLit,/r/NatureIsFuckingLit/comments/14qnpha/a_snake_slithering_up_a_brick_wall/,amish_novelty,🔥 A snake slithering up a brick wall,15131,0.94,392,,1688496989.0,False,False,False,False,False
39,14qqf8r,Serverlife,/r/Serverlife/comments/14qqf8r/arrested_for_not_paying_a_tables_tab_that_walked/,HypocriticalHobbes,Arrested for not paying a tables tab that walked out,10062,0.83,1872,,1688503423.0,False,1688504727.0,False,False,False
40,14qve1f,DesignPorn,/r/DesignPorn/comments/14qve1f/its_only_a_drain_but/,Organic-Squirm,It’s only a drain but…,3423,0.95,65,,1688516521.0,False,False,False,False,False
41,14qvuwr,LateStageCapitalism,/r/LateStageCapitalism/comments/14qvuwr/who_pulls_the_strings/,irish_fellow_nyc,Who pulls the strings...,3073,0.96,62,,1688517950.0,False,False,False,False,False
42,14qmw0w,news,/r/news/comments/14qmw0w/suspicious_powder_found_at_the_white_house_when/,Swoltergeist,"Suspicious powder found at the White House when Biden was gone was cocaine, AP sources say",17311,0.9,2491,,1688495124.0,False,False,False,False,False
43,14qq56t,PublicFreakout,/r/PublicFreakout/comments/14qq56t/fafo_arrest_me_i_dare_you/,binks922,FAFO - Arrest Me! I Dare You!,9043,0.94,978,,1688502755.0,True,False,False,False,False
44,14qpkng,PoliticalHumor,/r/PoliticalHumor/comments/14qpkng/spot_the_billionaire/,phydeauxbreath,Spot the Billionaire,8428,0.94,322,,1688501410.0,False,False,False,False,False
45,14qrsa6,pcmasterrace,/r/pcmasterrace/comments/14qrsa6/after_2_weeks_of_trying_to_fix_my_connectors/,Tomek3DS,"After 2 weeks of trying to fix my connectors, buying new fans, and going through mountains of support in an attempt to stop my cooling from sounding like an engine, I came to learn that I had to press the ""apply"" button.",5957,0.97,191,,1688506712.0,False,False,False,False,False
46,14qosd8,Unexpected,/r/Unexpected/comments/14qosd8/ninja_baby_turtle/,KylieJade-,Ninja baby turtle!,10821,0.97,93,,1688499564.0,False,False,False,False,True
47,14qv539,animememes,/r/animememes/comments/14qv539/bitter_truth/,Con___artist,Bitter Truth,3537,0.93,103,,1688515803.0,False,False,False,False,False
48,14qp4zf,StupidFood,/r/StupidFood/comments/14qp4zf/2k_pizza_for_a_celeb/,danonck,"$2k ""pizza"" for a celeb",10449,0.83,2528,,1688500385.0,False,False,False,False,False
49,14qun6f,HyruleEngineering,/r/HyruleEngineering/comments/14qun6f/gentlemen_the_age_of_jet_aircrafts_has_finally/,Ultrababouin,"Gentlemen, the age of jet aircrafts has finally arrived",3393,0.97,123,Mad scientist,1688514346.0,False,False,False,False,False
50,14quojl,TikTokCringe,/r/TikTokCringe/comments/14quojl/yoooo/,xella64,Yoooo 💀,3378,0.96,234,,1688514461.0,False,False,False,False,False
51,14qv8mr,ImTheMainCharacter,/r/ImTheMainCharacter/comments/14qv8mr/man_walks_in_the_middle_of_the_road/,FellowTravellers,Man walks in the middle of the road,3034,0.95,417,,1688516090.0,False,False,False,False,False
52,14qy4a4,CrazyFuckingVideos,/r/CrazyFuckingVideos/comments/14qy4a4/mans_does_not_get_paid_enough_for_this_response/,Caseyisweird,Mans does not get paid enough for this response. ,1893,0.89,546,,1688524970.0,False,False,False,False,False
53,14qqa9c,Spiderman,/r/Spiderman/comments/14qqa9c/mexican_revolution_spiderman_by_percodine_on/,Competitive_Yak1988,Mexican Revolution Spider-Man by @Percodine on Twitter,6860,0.96,269,,1688503088.0,False,False,False,False,False
54,14qp9yt,WTF,/r/WTF/comments/14qp9yt/welcome_to_zombieland/,sirblackhand,Welcome To Zombieland ,7415,0.91,845,,1688500734.0,False,False,False,False,False
55,14qtq5g,Damnthatsinteresting,/r/Damnthatsinteresting/comments/14qtq5g/controlled_demolition/,VoteThis,Controlled Demolition,14964,0.94,364,,1688511775.0,False,False,False,False,False
56,14qs5c9,Showerthoughts,/r/Showerthoughts/comments/14qs5c9/humanity_has_put_so_many_safety_measures_in_place/,hanMan86,Humanity has put so many safety measures in place that natural selection can no longer eliminate stupid people at an effective rate.,4749,0.89,421,,1688507618.0,False,False,False,False,False
57,14qypyo,Hololive,/r/Hololive/comments/14qypyo/i_love_these_dorks/,Customer-Sorry,I love these dorks,1639,0.98,25,:Matsuri::Okayu::Gura::Subaru::Matsuri:,1688526852.0,False,False,False,False,False
58,14qt3h0,Grimdank,/r/Grimdank/comments/14qt3h0/lets_pretend_that_didnt_happen/,Careful-Level,Let's pretend that didn't happen,4101,0.97,227,,1688510076.0,False,False,False,False,False
59,14quz75,lotrmemes,/r/lotrmemes/comments/14quz75/why_does_he_always_die_tho/,Forest_folf,Why does he always die tho,3002,0.97,120,Dwarf,1688515334.0,False,False,False,False,False
60,14qoc4v,dankmemes,/r/dankmemes/comments/14qoc4v/from_mickey_mouse_club_to_lou_ferrigno/,LemonConnoiseur,From Mickey Mouse Club to Lou Ferrigno,11579,0.95,447,☣️,1688498460.0,False,False,False,False,False
61,14qohwj,ProgrammerHumor,/r/ProgrammerHumor/comments/14qohwj/thanksforthefork/,huxx__,thanksForTheFork,8116,0.97,97,,1688498845.0,False,False,False,False,False
62,14qw4e2,teenagers,/r/teenagers/comments/14qw4e2/guys_this_girl_after_5_minutes_of_chatting_with/,ItzJustOriginal,Guys this girl after 5 minutes of chatting with me just sent a boob pic. what do I do,2532,0.94,677,15,1688518779.0,True,False,False,False,False
63,14qua94,OneOrangeBraincell,/r/OneOrangeBraincell/comments/14qua94/some_of_my_favorite_photos_of_my_most_precious/,Eolssu,Some of my favorite photos of my most precious treasure. 🧡,3088,0.99,135,,1688513386.0,False,False,False,False,False
64,14qm3gz,Tinder,/r/Tinder/comments/14qm3gz/almost_found_my_perfect_woman/,proffesaur,Almost found my perfect woman,12085,0.96,220,,1688493319.0,False,False,False,False,False
65,14qvpj9,DunderMifflin,/r/DunderMifflin/comments/14qvpj9/the_most_popular_oscar_line_was_besides_having/,goldenretreiverdude,"The most popular Oscar line was: “Besides having sex with men, I'd say the Finer Things Club is the gayest thing about me.” - Next up is Dwight Schrute (Mr Poop) - Comment your favorite Dwight line from the show! Only comment with Dwight lines and do not comment a line is someone else already has!",2478,0.92,619,:david: David Wallace,1688517510.0,False,False,False,False,False
66,14qxhyo,therewasanattempt,/r/therewasanattempt/comments/14qxhyo/to_ask_a_fashion_blogger_a_nuclear_weapon_question/,shurikien,To ask a fashion blogger a nuclear weapon question,4685,0.94,366,,1688523064.0,False,False,False,False,False
67,14qzpd2,HonkaiStarRail_leaks,/r/HonkaiStarRail_leaks/comments/14qzpd2/fu_xuan_official_reveal/,Slight-Improvement84,Fu Xuan official reveal,1260,0.96,161,,1688530036.0,False,False,False,False,False
68,14qvwln,facepalm,/r/facepalm/comments/14qvwln/only_fans_vs_twitch/,LadyBirdDavis,Only Fans vs. Twitch,6743,0.95,176,,1688518098.0,False,False,False,False,False
69,14qsnas,NewsOfTheStupid,/r/NewsOfTheStupid/comments/14qsnas/republican_party_forced_to_delete_fourth_of_july/,Misguided_Society,Republican Party forced to delete Fourth of July tweet after the flags they used in the graphic were not the American flag. They were the West African Liberian flag.,3756,0.94,170,,1688508896.0,False,False,False,False,False
70,14qzkxc,Genshin_Impact,/r/Genshin_Impact/comments/14qzkxc/happy_birthday_barbara/,genshinimpact,"Happy Birthday, Barbara!",1265,0.98,23,:hoyo1::hoyo2: Official,1688529670.0,False,False,False,False,False
71,14qomxc,AskReddit,/r/AskReddit/comments/14qomxc/what_to_do_when_your_partner_has_a_lower_sex/,AaneMeg,What to do when your partner has a lower sex drive than you?,7189,0.91,1901,,1688499186.0,True,False,False,False,False
72,14qox80,ThatsInsane,/r/ThatsInsane/comments/14qox80/american_cop_attacks_woman_filming_her_husbands/,LouisSaintJust1789,American Cop attacks woman filming her husbands arrest and puts his knee on her neck.,6682,0.91,635,,1688499876.0,False,False,False,False,False
73,14qv6jg,terriblefacebookmemes,/r/terriblefacebookmemes/comments/14qv6jg/remember_when_we_had_0_unemployment_and_world/,speachtree,Remember when we had 0 unemployment and world peace? Wasn’t that nice?,2569,0.96,165,,1688515913.0,False,False,False,False,False
74,14r1aau,nextfuckinglevel,/r/nextfuckinglevel/comments/14r1aau/sharp_and_very_decent_human/,TenselyDazzling,Sharp and very decent human,2209,0.98,99,,1688535204.0,False,False,False,False,False
75,14qucx1,Eyebleach,/r/Eyebleach/comments/14qucx1/my_wonderful_and_beautiful_grandma_i_love_you_3/,SophiaElvenKitten,My wonderful and beautiful grandma!! I love you :) <3 Akochan!!!,2830,0.94,47,,1688513569.0,False,False,False,False,False
76,14qy6ev,pettyrevenge,/r/pettyrevenge/comments/14qy6ev/my_stepdad_wore_the_same_shirt_i_got_in_trouble/,PlotHole2017,My stepdad wore the same shirt I got in trouble for during the parent teacher meeting,1484,0.95,64,,1688525159.0,False,False,False,False,False
77,14qqsli,AITAH,/r/AITAH/comments/14qqsli/aita_for_breaking_my_promise_and_ruining_my_kids/,UnusualEarth5833,AITA for breaking my promise and ruining my kids realtionship with their dad,4737,0.93,1254,,1688504336.0,False,1688505633.0,False,False,False
78,14r0moh,BeAmazed,/r/BeAmazed/comments/14r0moh/yep_thats_a_big_fat_10/,kimcutiepie,Yep! That's a big fat 10!,2367,0.99,62,,1688533072.0,False,False,False,False,False
79,14qy2hp,doordash_drivers,/r/doordash_drivers/comments/14qy2hp/whyre_they_like_this/,grizzyber,why’re they like this 💀,1511,0.97,108,,1688524807.0,False,False,False,False,False
80,14qvlwa,diablo4,/r/diablo4/comments/14qvlwa/what_is_your_biggest_frustration_so_far_in_diablo/,IMSirDiaries,What is your biggest frustration so far in DIABLO IV?,2205,0.97,520,,1688517188.0,False,False,False,False,False
81,14quux3,clevercomebacks,/r/clevercomebacks/comments/14quux3/family_is_everything/,mrl33602,Family is everything,2478,0.96,35,,1688514987.0,False,False,False,False,False
82,14qvuus,mildlyinfuriating,/r/mildlyinfuriating/comments/14qvuus/neighbor_keeps_breaking_windows_if_we_park_in_the/,PlayBoiPrada,Neighbor keeps breaking windows if we park in the ‘wrong’ spot on a public road.,6047,0.9,649,,1688517945.0,False,False,False,False,False
83,14qnafg,CombatFootage,/r/CombatFootage/comments/14qnafg/destruction_of_a_russian_ammunition_depot_in/,sagakino,Destruction of a russian ammunition depot in Donetsk City,7193,0.96,364,,1688496063.0,False,False,False,False,False
84,14qtkbs,memes,/r/memes/comments/14qtkbs/havent_seen_a_dollar_coin_in_a_long_time/,Sadboy_looking4memes,Haven't seen a dollar coin in a long time.,11199,0.97,398,OC Meme Maker,1688511335.0,False,False,False,False,False
85,14qlu1p,marvelmemes,/r/marvelmemes/comments/14qlu1p/thats_feels_bad/,SamirZero,That's feels bad.,12304,0.95,219,Avengers,1688492694.0,False,False,False,False,False
86,14qswhf,Gunners,/r/Gunners/comments/14qswhf/david_ornstein_exclusive_arsenal_have_reached/,S3ther,[David Ornstein] 🚨 EXCLUSIVE: Arsenal have reached total agreement with West Ham to sign Declan Rice. #WHUFC have now accepted #AFC payment structure on record £100m + £5m fee. 24yo England midfielder given permission to do medical & finalise personal terms @TheAthleticFC,3133,0.96,327,:AH1::AH2::AH3::AH4::AH5:/r/Place 2022,1688509556.0,False,False,False,False,False
87,14qnuqq,LeopardsAteMyFace,/r/LeopardsAteMyFace/comments/14qnuqq/thoughts_and_prayers_to_the_wealthy_women_who/,remmij,Thoughts and prayers to the wealthy women who voted for DeSantis,6343,0.98,341,,1688497319.0,False,False,False,False,False
88,14qt3qb,satisfying,/r/satisfying/comments/14qt3qb/30mph_rearend_test_suv_edition/,make--it--happen,30mph Rear-End Test (SUV Edition),3190,0.89,331,,1688510096.0,False,False,False,False,False
89,14qm8ba,pics,/r/pics/comments/14qm8ba/how_come_that_sub_is_allowed_to_stay_private/,RiseUpAgainstThem,How come that sub is allowed to stay private while everyone else has to reopen. John Oliver=confused,8818,0.86,336,,1688493640.0,True,False,False,False,False
90,14qwq6u,19684,/r/19684/comments/14qwq6u/rule/,OutrageousPomelo7,rule,1714,0.96,59,,1688520648.0,False,False,False,False,False
91,14qoj9d,ukraine,/r/ukraine/comments/14qoj9d/mother_motherland_in_kyiv_today/,F_M_G_W_A_C," ""Mother Motherland"" in Kyiv today ",5676,0.96,160,,1688498944.0,False,False,False,False,False
92,14qtis3,LifeProTips,/r/LifeProTips/comments/14qtis3/lpt_when_attending_a_party_at_someones_home_help/,bluegambit875,"LPT: When attending a party at someone's home, help pick up trash when things start winding down. Other people will start doing the same and the cleanup will go much faster. Plus you will be viewed as a thoughtful and considerate guest.",2753,0.96,76,,1688511218.0,False,False,False,False,False
93,14qtkxl,popculturechat,/r/popculturechat/comments/14qtkxl/scarlett_johanssons_surprisingly_endearingly/,parishilton2,"Scarlett Johansson’s surprisingly, endearingly awful fashion (in her early days)",2733,0.92,416,The 🔑 is not to drive your jet ski in the dark.,1688511385.0,False,False,False,False,False
94,14qsxkm,PoliticalMemes,/r/PoliticalMemes/comments/14qsxkm/is_it_possible_that_donald_trump_is_the/,thesystemmechanic,Is it possible that Donald Trump is the Antichrist the Bible predicted? Article in comments.,2979,0.91,301,,1688509633.0,False,False,False,False,False
95,14qvg33,BlackPeopleTwitter,/r/BlackPeopleTwitter/comments/14qvg33/i_am_so_sick_of_every_black_podcast_being_about/,Kobussy,I am so sick of every black podcast being about relationships and dating and what your partner should be like. Talk about comics or films or anime or history or physics or literally anything else than dating.,2039,0.96,299,,1688516702.0,False,False,False,False,False
96,14qxljh,rareinsults,/r/rareinsults/comments/14qxljh/big_oof_moment/,SpecialistTackle606,Big oof moment,1436,0.97,21,,1688523351.0,False,False,False,False,False
97,14qu1vs,whenthe,/r/whenthe/comments/14qu1vs/bbut_muh_ideology/,IRageQuit06,"""b-but muh ideology""",2667,0.9,124,,1688512719.0,False,False,False,False,False
98,14qpmdu,politics,/r/politics/comments/14qpmdu/fascists_go_home_philadelphians_reject_far_right/,newnemo,“Fascists Go Home!”: Philadelphians Reject Far Right “Moms for Liberty” | Over 50 local and national organizations joined to counter the harmful messaging from the far right group’s conference.,15067,0.94,813,:flag-vt: Vermont,1688501522.0,False,False,False,False,False
99,14quuxe,shittymoviedetails,/r/shittymoviedetails/comments/14quuxe/in_titanic_1997_rose_drops_her_priceless_necklace/,Mr_Westerfield,"In Titanic (1997), Rose drops her priceless necklace into the sea because she thinks that’s a better use for it than, like, leaving it to her family or paying the medical bills for a kid with cancer or something",2185,0.99,38,,1688514987.0,False,False,False,False,False
100,14qwg2k,FunnyAnimals,/r/FunnyAnimals/comments/14qwg2k/cat_found_out_where_the_light_switch_is/,Subzerocool9,Cat found out where the light switch is ,1668,0.97,29,,1688519755.0,False,False,False,False,False
