rank,id,subreddit,permalink,author,title,score,upvote_ratio,num_comments,author_flair_text,created_utc,over_18,edited,stickied,locked,is_original_content
1,14ul3iw,news,/r/news/comments/14ul3iw/suspended_twitter_account_tracking_elon_musks_jet/,IsItJustMeOrt,Suspended Twitter account tracking Elon Musk’s jet moves to Threads,27101,0.94,1109,,1688865307.0,False,False,False,False,False
2,14ukmrj,Damnthatsinteresting,/r/Damnthatsinteresting/comments/14ukmrj/as_a_child_this_ladys_dad_used_to_tell_her_a/,Ipunishdogabusers,As a child this lady's dad used to tell her a story about how Alex Trebek lived in the basement of her dad's aunts house. This is Alex Trebeks response to the story,25493,0.97,241,,1688863960.0,False,False,False,False,False
3,14uly57,MadeMeSmile,/r/MadeMeSmile/comments/14uly57/he_now_has_262k_subscribers_on_youtube/,Legitimate-Tough6200,He now has 262k subscribers on YouTube.,9022,0.97,214,,1688867843.0,False,False,False,False,False
4,14uifn6,WhitePeopleTwitter,/r/WhitePeopleTwitter/comments/14uifn6/elon_musks_jet_tracker_is_back_and_now_on_threads/,TheSparklyNinja,Elon musk’s jet tracker is back and now on Threads,19617,0.97,459,,1688857955.0,False,False,False,False,False
5,14ulps2,politics,/r/politics/comments/14ulps2/pay_attention_to_what_you_see_donald_trump_is/,thenewrepublic,"Pay Attention to What You See: Donald Trump Is Losing His Marbles | If he keeps this up, he’ll drag the entire Republican Party down with him in 2024.",6966,0.94,803,The New Republic,1688867138.0,False,False,False,False,False
6,14uifh2,todayilearned,/r/todayilearned/comments/14uifh2/til_disney_refused_to_let_a_father_use_a/,ThorsMeatHole,TIL Disney refused to let a father use a Spiderman headstone for his 4 year old son’s funeral.,14721,0.91,1107,,1688857941.0,False,False,False,False,False
7,14uon4u,funny,/r/funny/comments/14uon4u/stealth_level_1000/,m3nation007,Stealth level 1000,3806,0.99,126,,1688876070.0,False,False,False,False,False
8,14uivzx,facepalm,/r/facepalm/comments/14uivzx/imagine_being_insane_enough_to_believe_this/,Piccolo-Sufficient,Imagine being insane enough to believe this,13595,0.88,2715,,1688859147.0,False,False,False,False,False
9,14umc68,LeopardsAteMyFace,/r/LeopardsAteMyFace/comments/14umc68/well_you_made_the_checkmark_purchasable/,SternenO,"Well, you made the checkmark purchasable",4155,0.97,143,,1688868961.0,False,False,False,False,False
10,14ui519,nba,/r/nba/comments/14ui519/charania_just_in_san_antonio_spurs_coach_gregg/,Brady331,[Charania] Just In: San Antonio Spurs coach Gregg Popovich – the winningest NBA coach of all-time – has signed a new five-year contract extension with the franchise.,8268,0.97,490,:bos-2: Celtics,1688857226.0,False,False,False,False,False
11,14uma4p,BeAmazed,/r/BeAmazed/comments/14uma4p/airline_pilot_takeoff_vs_boeing_test_pilot_takeoff/,purple-circle,Airline pilot take-off vs Boeing test pilot take-off,4189,0.97,399,,1688868798.0,False,False,False,False,False
12,14uh4kl,TikTokCringe,/r/TikTokCringe/comments/14uh4kl/_/,Snoo-33732,😈,13660,0.86,1355,,1688854569.0,False,False,False,False,False
13,14ug1yf,comics,/r/comics/comments/14ug1yf/turned_on/,MrLovens,turned on,13343,0.95,131,Mr. Lovenstein,1688851897.0,False,False,False,False,False
14,14ulm7h,MMA,/r/MMA/comments/14ulm7h/spoiler_robbie_lawler_vs_niko_price/,notwayinoo,[SPOILER] Robbie Lawler vs. Niko Price,4104,0.96,752,,1688866837.0,False,False,False,False,False
15,14uksou,therewasanattempt,/r/therewasanattempt/comments/14uksou/to_be_a_cool_dude/,pryinglyEstrange,to be a cool dude,4648,0.98,182,,1688864447.0,False,False,False,False,False
16,14uiv8e,rareinsults,/r/rareinsults/comments/14uiv8e/he_just_answered_the_question/,69pooppoo69,He just answered the question 💀,6799,0.97,132,,1688859096.0,False,False,False,False,False
17,14ukd2b,pcmasterrace,/r/pcmasterrace/comments/14ukd2b/10_years_ago_i_made_a_friend_on_dayz/,macabregame,"10 years ago, I made a friend on DayZ. Coincidentally, we ended up in the same city, and last year we quit our jobs to focus on developing our own game. Our trailer just debuted at the PC Gaming Show! Words can't express our euphoria.",4811,0.95,361,,1688863190.0,False,False,False,False,False
18,14ug75k,tumblr,/r/tumblr/comments/14ug75k/female_authors/,utkarsh_aryan,Female Authors,10416,0.96,399,,1688852262.0,False,False,False,False,False
19,14uize7,cats,/r/cats/comments/14uize7/how_can_i_convince_my_boyfriend_to_let_me_keep/,dracumorda,How can I convince my boyfriend to let me keep this cat?,5617,0.97,859,,1688859404.0,False,False,False,False,False
20,14ulez7,mildlyinfuriating,/r/mildlyinfuriating/comments/14ulez7/my_sister_in_law_points_all_the_knives_up_in_the/,chevron20,My sister in law points all the knives up in the dishwasher.,3664,0.94,706,,1688866243.0,False,False,False,False,False
21,14uhfom,baseball,/r/baseball/comments/14uhfom/elly_de_la_cruz_steals_3rd_base_and_home/,Blazingbee98,Elly De La Cruz steals 3rd base and home!,6292,0.96,642,TEAM CHAOS :CHAOS-wagon:,1688855376.0,False,False,False,False,False
22,14udrm0,Unexpected,/r/Unexpected/comments/14udrm0/how_it_started_vs_how_its_going/,an_reddit_man,How it started vs how it’s going,19049,0.95,377,,1688846320.0,False,False,False,False,False
23,14ugjyp,HumansBeingBros,/r/HumansBeingBros/comments/14ugjyp/saving_the_cat/,Redditor_in_Space,Saving the cat,7093,0.97,152,,1688853154.0,False,False,False,False,False
24,14ucazu,oddlysatisfying,/r/oddlysatisfying/comments/14ucazu/guy_saves_a_pelican_choking_badly_on_a_huge_fish/,Pristine-Position413,Guy Saves A Pelican Choking Badly On A Huge Fish,24170,0.93,640,,1688842722.0,False,False,False,False,False
25,14ublay,meirl,/r/meirl/comments/14ublay/meirl/,iamcoollife1994,meirl,41852,0.94,4238,,1688840956.0,False,False,False,False,False
26,14ubjgv,ContagiousLaughter,/r/ContagiousLaughter/comments/14ubjgv/i_think_its_a_good_deal_lol/,liittlefiish3,I think it's a good deal lol,28951,0.92,806,,1688840823.0,False,False,False,False,False
27,14uddw3,nextfuckinglevel,/r/nextfuckinglevel/comments/14uddw3/archer_perfectly_shoots_lengthwise_through/,Cold_Zero_,Archer perfectly shoots lengthwise through falling straw,14009,0.95,285,,1688845359.0,False,False,False,False,False
28,14ujwmw,maybemaybemaybe,/r/maybemaybemaybe/comments/14ujwmw/maybe_maybe_maybe/,peseoane,Maybe Maybe Maybe,3803,0.97,62,,1688861900.0,False,False,False,False,False
29,14ul6yp,PublicFreakout,/r/PublicFreakout/comments/14ul6yp/fascists_strolling_through_austin/,gravityVT,Fascists strolling through Austin,3070,0.92,978,,1688865588.0,False,False,False,False,False
30,14ub5za,worldnews,/r/worldnews/comments/14ub5za/us_official_says_exiled_wagner_boss_prigozhin_may/,Beyond_The_Dim,US official says 'exiled' Wagner boss Prigozhin may not have gone to Belarus at all — and may have used a body double to make it appear as though he fled Russia,19549,0.95,1131,,1688839893.0,False,False,False,False,False
31,14ud5fr,Weird,/r/Weird/comments/14ud5fr/does_anyone_know_what_is_going_on_here/,pseudo-boots,Does anyone know what is going on here?,16595,0.95,2111,,1688844783.0,False,False,False,False,False
32,14umxj0,sports,/r/sports/comments/14umxj0/elly_de_la_cruz_steals_2nd_3rd_and_home_base_all/,BCLetsRide69,"Elly De La Cruz steals 2nd, 3rd, and home base all in the span of two pitches.",2130,0.96,161,,1688870765.0,False,False,False,False,False
33,14ucy1y,gaming,/r/gaming/comments/14ucy1y/bloodborne_painting_i_made/,ArtbyAEB,Bloodborne painting i made,11205,0.94,195,,1688844276.0,False,False,False,False,False
34,14uclat,lotrmemes,/r/lotrmemes/comments/14uclat/just_light_my_shit_up/,themassivemover,Just light my shit up,13164,0.97,296,,1688843396.0,False,False,False,False,False
35,14uc7pv,JustGuysBeingDudes,/r/JustGuysBeingDudes/comments/14uc7pv/just_one_of_the_boys/,gacoug,Just one of the boys,14087,0.96,180,,1688842488.0,False,False,False,False,False
36,14uebek,clevercomebacks,/r/clevercomebacks/comments/14uebek/no_lies_were_spoken/,Lavangdon,No lies were spoken.,8255,0.97,34,,1688847677.0,False,False,False,False,False
37,14ukjov,oddlyspecific,/r/oddlyspecific/comments/14ukjov/this_is_when_my_phone_anxiety_began_did_anyone/,Mammoth-Medicine1385,This is when my phone anxiety began. Did anyone else rehearse what they were going to say to the receptionist?,3004,0.97,27,,1688863708.0,False,False,False,False,False
38,14uegcw,PoliticalHumor,/r/PoliticalHumor/comments/14uegcw/joke_writes_itself/,weezo182,Joke writes itself,7019,0.96,509,,1688848033.0,False,False,False,False,False
39,14uklne,LifeProTips,/r/LifeProTips/comments/14uklne/lpt_if_someone_at_a_business_does_you_a_favor_and/,merewautt,"LPT: If someone at a business does you a favor and you want to write a positive review, keep it vague or basic. You could get them in trouble.",2797,0.96,54,,1688863871.0,False,1688865603.0,False,False,False
40,14udqbx,marvelmemes,/r/marvelmemes/comments/14udqbx/im_not_sure_how_to_feel_about_this/,TheCoranger,I'm not sure how to feel about this,10835,0.89,227,Avengers,1688846227.0,False,False,False,False,False
41,14ui0bv,memes,/r/memes/comments/14ui0bv/there_are_three_kinds_of_people/,sylvestermeister,There are three kinds of people,4468,0.98,285,Dark Mode Elitist,1688856880.0,False,False,False,False,False
42,14ua6uj,funnyvideos,/r/funnyvideos/comments/14ua6uj/little_girl/,Odd-Tutor931,Little girl...,21397,0.96,231,,1688837539.0,False,False,False,False,False
43,14uc32f,wholesomememes,/r/wholesomememes/comments/14uc32f/animals_are_so_kind_indeed/,AyAan2022,Animals are so Kind Indeed,13877,0.93,155,,1688842164.0,False,False,False,False,False
44,14unrmt,ufc,/r/ufc/comments/14unrmt/holy_shit_what_just_happened/,Uaquamarine,HOLY SHIT WHAT JUST HAPPENED,1562,0.96,494,Go sleep,1688873322.0,False,False,False,False,False
45,14ugc7i,ImTheMainCharacter,/r/ImTheMainCharacter/comments/14ugc7i/good_for_her/,Wilinehart,Good for her,4926,0.95,283,,1688852611.0,False,False,False,False,False
46,14ugs9u,Eldenring,/r/Eldenring/comments/14ugs9u/every_time_oc/,Rase57,Every. Time. [OC],4588,0.97,105,:restored:,1688853721.0,False,False,False,False,False
47,14ubreg,PrequelMemes,/r/PrequelMemes/comments/14ubreg/intriguing/,johnlen1n,Intriguing...,12329,0.97,97,Good soldiers follow orders,1688841371.0,False,False,False,False,False
48,14ujr30,dankmemes,/r/dankmemes/comments/14ujr30/i_like_my_coffee_how_i_like_my_humor_dark_with_a/,keyscowinfilipino,I like my coffee how I like my humor : dark with a lot of milk,3474,0.81,151,,1688861474.0,False,False,False,False,False
49,14ulqy5,movies,/r/movies/comments/14ulqy5/nudity_making_a_comeback_in_cinema_nsfwspoilers/,badassj00,Nudity Making a Comeback in Cinema? (NSFW+Spoilers),2034,0.84,1047,,1688867233.0,True,1688883462.0,False,False,False
50,14uhrq7,Damnthatsinteresting,/r/Damnthatsinteresting/comments/14uhrq7/mating_tortoises_interrupt_hunting_leopard/,RealRock_n_Rolla,Mating tortoises interrupt hunting leopard,18346,0.98,592,,1688856249.0,False,False,False,False,False
51,14uhwwf,Genshin_Impact,/r/Genshin_Impact/comments/14uhwwf/come_if_youre_not_scared/,liyue_lily,Come if you're not scared,3647,0.96,127,,1688856628.0,False,False,False,False,False
52,14ud0xf,oddlyterrifying,/r/oddlyterrifying/comments/14ud0xf/6_year_old_paperboy_1910/,VincentKo,"6 year old paperboy, 1910",8459,0.96,261,,1688844476.0,False,False,False,False,False
53,14ufz96,weddingdress,/r/weddingdress/comments/14ufz96/said_yes_to_the_red_dress/,NoPresence6987,Said yes - to the Red dress!,4448,0.96,384,,1688851730.0,False,False,False,False,False
54,14ubpzg,blackmagicfuckery,/r/blackmagicfuckery/comments/14ubpzg/phenakistoscope/,11stainless11,Phenakistoscope,8651,0.96,162,,1688841273.0,False,False,False,False,False
55,14uf92p,NatureIsFuckingLit,/r/NatureIsFuckingLit/comments/14uf92p/mother_and_calf_humpback_whale/,CommandSalty5741,🔥Mother and calf Humpback whale,4716,0.98,80,,1688849994.0,False,False,False,False,False
56,14uiyb4,cursedcomments,/r/cursedcomments/comments/14uiyb4/cursed_testicle/,poppip11,cursed_testicle,3003,0.98,47,,1688859319.0,False,False,False,False,False
57,14ukexs,shitposting,/r/shitposting/comments/14ukexs/still_have_to_deal_with_the_second_letter_of_the/,Mediocre_Fox_,Still have to deal with the second letter of the English lexicon though... and heil Spez,2326,0.99,312,I want pee in my ass :slitheen:,1688863327.0,False,False,False,False,False
58,14ufjco,ukraine,/r/ukraine/comments/14ufjco/5th_of_july_my_friend_roman_pyrog_died_on/,NobiusG,"5th of July my friend Roman Pyrog died on Zaporizhzhya front, rest in peace hero!",4366,0.96,108,,1688850659.0,False,False,False,False,False
59,14ubaqe,OldSchoolCool,/r/OldSchoolCool/comments/14ubaqe/in_1977_buffy_saintemarie_made_an_appearance_on/,milkhoneyed,"In 1977, Buffy Sainte-Marie made an appearance on Sesame Street while nursing her son, Dakota Wolfchild, making history as the first breastfeeding mother to appear on a major television program.",8340,0.97,488,,1688840218.0,False,False,False,False,False
60,14ug3eu,CuratedTumblr,/r/CuratedTumblr/comments/14ug3eu/family_pet/,the_princess_frog,Family pet,4136,0.97,155,,1688852001.0,False,False,False,False,False
61,14unbwy,NonPoliticalTwitter,/r/NonPoliticalTwitter/comments/14unbwy/so_many_crimes_i_would_commit/,Thatonegooseguy,So many crimes I would commit,1383,0.99,22,:blue1::blue2::1111::1112:,1688871960.0,False,False,False,False,False
62,14uhj2z,lotr,/r/lotr/comments/14uhj2z/my_wife_preps_an_lotr_feast_to_pair_with_a/,StellarSag,My wife preps an LOTR feast to pair with a trilogy marathon every year for her birthday. This is her best work yet.,3199,0.97,162,,1688855617.0,False,False,False,False,False
63,14uhgna,AnimalsBeingBros,/r/AnimalsBeingBros/comments/14uhgna/alpaca_bros/,westcoastcdn19,Alpaca bros ,3212,0.97,28,,1688855442.0,False,False,False,False,False
64,14ue6w3,HolUp,/r/HolUp/comments/14ue6w3/doing_what/,Fritz_Water_Bottle,Doing what?,6279,0.97,80,,1688847352.0,False,False,False,False,False
65,14ucy25,AskReddit,/r/AskReddit/comments/14ucy25/children_of_sex_workers_how_did_you_find_out_your/,ameen__shaikh,"Children of sex workers, how did you find out your mom/dad was a sex worker?",6742,0.92,1315,,1688844277.0,True,False,False,False,False
66,14uktdn,trees,/r/trees/comments/14uktdn/my_first_indoor_grow/,InLikeErrolFlynn,My first indoor grow,1911,0.98,138,,1688864493.0,False,False,False,False,False
67,14uo7en,IllegallySmolCats,/r/IllegallySmolCats/comments/14uo7en/smol_angry_hungry/,Impressirink9780,Smol Angry Hungry,1157,0.99,37,,1688874702.0,False,False,False,False,False
68,14uk7gv,ATBGE,/r/ATBGE/comments/14uk7gv/my_friend_made_a_deviled_egg_cake/,KyonaPrayerCircleMem,My friend made a deviled egg cake.,2102,0.94,197,,1688862747.0,False,False,False,False,False
69,14ug03h,iamatotalpieceofshit,/r/iamatotalpieceofshit/comments/14ug03h/feeding_a_baby_meth/,DennisReynoIds,Feeding a baby meth,3821,0.97,323,,1688851783.0,False,False,False,False,False
70,14ub4zv,Plumbing,/r/Plumbing/comments/14ub4zv/im_just_the_electrician_but_i_dont_have_much/,jaydaddy1980,"I'm just the electrician, but I don't have much faith in our plumber",7918,0.97,862,,1688839828.0,False,False,False,False,False
71,14u8lb1,BrandNewSentence,/r/BrandNewSentence/comments/14u8lb1/well_thats_one_way_of_reacting_to_this_movie/,jessiewhite2008,Well that's one way of reacting to this movie,19211,0.96,508,,1688833550.0,False,False,False,False,False
72,14umms1,pettyrevenge,/r/pettyrevenge/comments/14umms1/cant_buy_a_homeless_man_a_pizza_fine_by_me/,Huge_Buddy_2216,Can't buy a homeless man a pizza? Fine by me.,1401,0.97,70,,1688869859.0,False,1688874898.0,False,False,False
73,14uof7k,facepalm,/r/facepalm/comments/14uof7k/tiktok_challenges_home_of_the_darwin_awards/,Alien__Yes,TikTok Challenges -Home of the Darwin Awards,3010,0.99,343,,1688875383.0,False,False,False,False,False
74,14u9jrj,antiwork,/r/antiwork/comments/14u9jrj/why_do_we_accept_lower_and_lower_standard_of/,Clean-Barracuda-8583,Why do we accept lower and lower standard of living in North America?,11019,0.9,1853,,1688835910.0,False,1688858962.0,False,False,False
75,14uiosa,thalassophobia,/r/thalassophobia/comments/14uiosa/another_day_at_work_pretending_im_an_astronaut/,HannahAquanaut,"Another day at work, pretending I`m an astronaut",2459,0.97,129,,1688858627.0,False,False,False,False,False
76,14udzx1,TrueOffMyChest,/r/TrueOffMyChest/comments/14udzx1/i_broke_up_with_my_boyfriend_over_text_because_of/,Celestial-passing,I broke up with my boyfriend over text because of what he wanted,5064,0.94,469,,1688846868.0,False,False,False,False,False
77,14ua8i2,BlackPeopleTwitter,/r/BlackPeopleTwitter/comments/14ua8i2/id_sweep_a_beach_first/,Alucard_Everlasting,I'd sweep a beach first,8407,0.97,244,,1688837659.0,False,False,False,False,False
78,14ugpau,Grimdank,/r/Grimdank/comments/14ugpau/old_friend_by_mick19988/,Jakeholeman,Old Friend by @Mick19988,3255,0.97,71,Dank Angels,1688853529.0,False,False,False,False,False
79,14ukook,TaylorSwift,/r/TaylorSwift/comments/14ukook/taylor_lautners_wife_taylor_lautner_with_taylor/,chae_yo,"Taylor Lautner’s wife, Taylor Lautner, with Taylor Swift in 2010 vs. 2023.",1821,0.97,69,:fearless2021: Fearless (Taylor's Version),1688864115.0,False,False,False,False,False
80,14uo8pu,anime_irl,/r/anime_irl/comments/14uo8pu/anime_irl/,BlablaBlabla215600,anime_irl,1047,0.98,31,,1688874824.0,False,False,False,False,False
81,14ugtu7,TwoSentenceHorror,/r/TwoSentenceHorror/comments/14ugtu7/our_oldest_daughter_finally_seems_to_have/,StudentofArceus,Our oldest daughter finally seems to have recovered from her deep depression!,3198,0.97,91,,1688853818.0,False,False,False,False,False
82,14uenmj,PeterExplainsTheJoke,/r/PeterExplainsTheJoke/comments/14uenmj/petah_what_does_this_mean/,KennyMcCormicks,"Petah, what does this mean?",4447,0.94,189,,1688848529.0,False,False,False,False,False
83,14uj0ky,OnePunchMan,/r/OnePunchMan/comments/14uj0ky/garou_vs_homelander_pt2_unfinisheddiscontinued/,Comissar_Poszar,Garou vs Homelander pt.2 (UNFINISHED/DISCONTINUED),2261,0.96,106,:Bruh:,1688859496.0,False,False,False,False,False
84,14uelf8,WhitePeopleTwitter,/r/WhitePeopleTwitter/comments/14uelf8/id_like_donald_trump_to_testify_in_front_of/,Travismatthew08,"‘I’d like Donald Trump to testify in front of Congress for 11 hours on live television, and explain himself, the way Hillary Clinton did…’",18593,0.93,650,,1688848378.0,False,False,False,False,False
85,14uh2ch,DunderMifflin,/r/DunderMifflin/comments/14uh2ch/whos_doing_better_in_a_zombie_apocalypse/,jregan0409,Who’s doing better in a zombie apocalypse?,2874,0.94,657,:harvey:Harvey,1688854415.0,False,False,False,False,False
86,14uh5o3,Terraria,/r/Terraria/comments/14uh5o3/might_i_ask_what_the_hell_is_this_random_world/,roman_pokefan,Might I ask what the hell is this random world name????,2899,0.98,136,,1688854647.0,False,False,False,False,False
87,14u98r8,CrazyFuckingVideos,/r/CrazyFuckingVideos/comments/14u98r8/man_suffering_from_hydrophobia_caused_by_rabies/,MrPredictableArts,Man suffering from Hydrophobia caused by rabies,11333,0.93,1401,,1688835171.0,False,False,False,False,False
88,14uhues,BikiniBottomTwitter,/r/BikiniBottomTwitter/comments/14uhues/nasty_patty_krab/,OkDeparture1702,Nasty Patty krab,2520,0.97,32,,1688856445.0,False,False,False,False,False
89,14uho77,fixedbytheduet,/r/fixedbytheduet/comments/14uho77/thats_much_better/,Snoo-33732,That’s much better,2603,0.89,258,,1688855990.0,False,False,False,False,False
90,14uf8yr,sadcringe,/r/sadcringe/comments/14uf8yr/easily_the_worst_tweet_ive_ever_read/,mikeyG92,Easily the worst tweet I’ve ever read,3603,0.95,143,,1688849985.0,False,False,False,False,False
91,14ufiif,Spiderman,/r/Spiderman/comments/14ufiif/like_father_like_son/,One-Ad3222,Like father like son,3508,0.96,36,,1688850606.0,False,False,False,False,False
92,14ufytg,TerrifyingAsFuck,/r/TerrifyingAsFuck/comments/14ufytg/man_hit_by_a_car/,Mirabooo,Man hit by a car,3305,0.95,234,,1688851695.0,True,False,False,False,False
93,14ujqs2,DeepRockGalactic,/r/DeepRockGalactic/comments/14ujqs2/you_cannot_stop_me/,MatchaLottie,You cannot stop me.,1933,0.98,56,:swarmer::swarmer::swarmer::swarmer::swarmer::swarmer::swarmer:,1688861456.0,False,False,False,False,False
94,14uhmeh,funny,/r/funny/comments/14uhmeh/just_let_him_in/,brainsick93,Just… let him in.,7663,0.97,172,,1688855848.0,False,False,False,False,False
95,14u9cy5,OneOrangeBraincell,/r/OneOrangeBraincell/comments/14u9cy5/the_tables_have_turned/,modren-man,the tables have turned...,9341,0.98,108,,1688835462.0,False,False,False,False,False
96,14umhs2,HonkaiStarRail,/r/HonkaiStarRail/comments/14umhs2/peak_mommy_vibes/,AsaCocoPeko,Peak Mommy Vibes,1262,0.96,44,All Hail the Master Diviner :Fuxuan:,1688869424.0,False,False,False,False,False
97,14uj6se,geography,/r/geography/comments/14uj6se/why_is_it_so_rare_to_hear_about_these_huge/,hibannyyttk,Why is it so rare to hear about these huge Chinese cities?,1981,0.92,511,,1688859971.0,False,False,False,False,False
98,14ujmv0,3Dprinting,/r/3Dprinting/comments/14ujmv0/someone_said_print_a_face/,Bulky_Association229,Someone said print a face,1866,0.93,70,,1688861153.0,False,False,False,False,False
99,14ugps2,Fauxmoi,/r/Fauxmoi/comments/14ugps2/margot_robbie_debuts_crimped_hairstyle_and/,funambula,Margot Robbie Debuts Crimped Hairstyle and Channels 'Totally Hair' Barbie in Mexico,2787,0.93,196,chris pine’s flip phone,1688853559.0,False,False,False,False,False
100,14umuh1,WTF,/r/WTF/comments/14umuh1/amazon_driver_finds_his_way_onto_racetrack_at_the/,fingeritoutdude,Amazon driver finds his way onto racetrack at the end of a pass.,1139,0.96,56,,1688870505.0,False,False,False,False,False
