rank,id,subreddit,permalink,author,title,score,upvote_ratio,num_comments,author_flair_text,created_utc,over_18,edited,stickied,locked,is_original_content
1,1528asf,MadeMeSmile,/r/MadeMeSmile/comments/1528asf/designated_driver_making_sure_she_gets_home_safe/,mindyour,Designated driver making sure she gets home safe.,54568,0.96,904,,1689614965.0,False,False,False,False,False
2,1529fvw,worldnews,/r/worldnews/comments/1529fvw/italy_begins_stripping_lesbian_mothers_of_their/,HyacinthFT,Italy begins stripping lesbian mothers of their parental rights,15449,0.93,2109,,1689617587.0,False,False,False,False,False
3,152c7wu,nextfuckinglevel,/r/nextfuckinglevel/comments/152c7wu/dog_detecting_one_drop_of_gasoline_in_his_scent/,infinitiumvortex,Dog detecting one drop of gasoline in his Scent Discrimination Training for arson detection,7833,0.97,248,,1689623909.0,False,False,False,False,False
4,1527tlc,BrandNewSentence,/r/BrandNewSentence/comments/1527tlc/i_know_i_probably_shouldnt_laugh_about_this_but/,mecnev,I know I probably shouldn't laugh about this but damn,25551,0.95,1299,,1689613875.0,False,False,False,False,False
5,1528z8h,TikTokCringe,/r/TikTokCringe/comments/1528z8h/unbelievable/,Snoo-33732,Unbelievable,13329,0.92,1597,,1689616532.0,False,False,False,False,False
6,1528e2l,tumblr,/r/tumblr/comments/1528e2l/fear_of_being_shoved_into_a_taffy_machine/,SaraAnnabelle,Fear of being shoved into a taffy machine,15942,0.97,502,,1689615165.0,False,False,False,False,False
7,1529kna,PublicFreakout,/r/PublicFreakout/comments/1529kna/climate_activists_spray_paint_on_megayacht_owned/,mushyrain,Climate activists spray paint on megayacht owned by heir to the Walmart fortune,9783,0.95,1499,,1689617892.0,False,False,False,False,False
8,1527972,politics,/r/politics/comments/1527972/why_isnt_clarence_thomas_facing_impeachment/,LuvKrahft,Why Isn't Clarence Thomas Facing Impeachment Hearings?,11577,0.96,617,:flag-us: America,1689612593.0,False,False,False,False,False
9,1528omw,therewasanattempt,/r/therewasanattempt/comments/1528omw/to_play_at_the_gym/,11stainless11,to play at the gym,10354,0.98,553,,1689615851.0,False,False,False,False,False
10,152d80h,mildlyinfuriating,/r/mildlyinfuriating/comments/152d80h/homeless_guy_sits_outside_my_job_and_only_cares/,majik_rose,"Homeless guy sits outside my job and only cares about the money, leaves behind all the food ppl give him",4744,0.91,1091,,1689626167.0,False,False,False,False,False
11,1526ebd,todayilearned,/r/todayilearned/comments/1526ebd/til_that_due_to_industry_influence_missouri_has/,ProbablySomeBoomer,"TIL that due to industry influence, Missouri has some of the loosest alcohol laws in the US. Hard liquor can be sold in grocery stores and gas stations; bars can double as liquor stores; public intoxication is legal; and open containers are allowed in most areas, including by passengers in vehicles.",12527,0.97,1592,,1689610611.0,False,False,False,False,False
12,1523tge,WhitePeopleTwitter,/r/WhitePeopleTwitter/comments/1523tge/professor_callie_rennison_makes_brock_turner_the/,AlwaysTheNoob,Professor Callie Rennison makes Brock Turner the literal textbook definition of a rapist,51862,0.93,1100,,1689604808.0,False,False,False,False,False
13,1527qgw,technicallythetruth,/r/technicallythetruth/comments/1527qgw/a_life_tip_from_betty_crocker/,0Ring-0,A life tip from Betty Crocker?,13066,0.96,222,,1689613677.0,False,False,False,False,False
14,1528v8v,oddlysatisfying,/r/oddlysatisfying/comments/1528v8v/satisfying_lincoln_continental_1975/,esberat,Satisfying Lincoln Continental 1975.,8217,0.93,440,,1689616276.0,False,False,False,False,False
15,1523hq8,news,/r/news/comments/1523hq8/new_drug_found_to_slow_alzheimers_hailed_a/,ICumCoffee,New drug found to slow Alzheimer's hailed a 'turning point in fight against disease',21001,0.96,843,,1689604044.0,False,False,False,False,False
16,1529o5k,dankmemes,/r/dankmemes/comments/1529o5k/tonight_we_comment_in_hell/,thepositivepandemic,"Tonight, we comment, in hell!",7183,0.97,236,,1689618113.0,False,False,False,False,False
17,152ad5j,gaming,/r/gaming/comments/152ad5j/boyfriend_wanted_totk_for_his_birthday_so_i_made/,marshmellers95,Boyfriend wanted TotK for his birthday so I made him a Link cake to go with it!,5142,0.94,137,,1689619716.0,False,False,False,False,False
18,152d6a0,comics,/r/comics/comments/152d6a0/heal_turn/,MrLovens,Heal Turn,3684,0.99,54,Mr. Lovenstein,1689626059.0,False,False,False,False,False
19,1525vlz,oddlyterrifying,/r/oddlyterrifying/comments/1525vlz/the_vegas_msg_sphere/,Kalunda2,The Vegas MSG sphere,13912,0.95,679,,1689609465.0,False,False,False,False,False
20,1526s03,BeAmazed,/r/BeAmazed/comments/1526s03/a_dress_that_changes_color_when_exposed_to/,sandwichmclee,A dress that changes color when exposed to sunlight.,11530,0.9,970,,1689611472.0,False,False,False,False,False
21,1525xp0,Gamingcirclejerk,/r/Gamingcirclejerk/comments/1525xp0/so_ron_has_always_just_been_cool_like_that/,tdolomax,"So, Ron has always just been cool like that?",11356,0.93,283,,1689609601.0,False,False,False,False,False
22,1525ttn,StupidFood,/r/StupidFood/comments/1525ttn/how_to_ruin_a_burger/,wet_egirl_ass,How to ruin a burger,14486,0.88,3519,,1689609352.0,False,False,False,False,False
23,1525t2o,facepalm,/r/facepalm/comments/1525t2o/i_dont_know_what_to_say/,No_Mongoose1140,I... dont know what to say.,17028,0.88,2066,,1689609309.0,False,False,False,False,False
24,1529she,TwoXChromosomes,/r/TwoXChromosomes/comments/1529she/i_recently_realized_i_was_trafficked_as_a/,ExMoIsMyPersonality,I recently realized I was trafficked as a teenager. My mom conveniently has no memory of that summer. Trigger Warning.,5243,0.95,273,,1689618390.0,True,1689618603.0,False,False,False
25,15258ie,HolUp,/r/HolUp/comments/15258ie/if_you_know_you_already_understood/,esberat,"If you know, you already understood.",16295,0.92,568,:zfg1::zfg2::zfg3::zfg4:,1689608004.0,False,False,False,False,False
26,15252sw,Unexpected,/r/Unexpected/comments/15252sw/almost_died/,howmanygrapes_,Almost died,12918,0.96,659,,1689607648.0,False,False,False,False,False
27,152450v,PrequelMemes,/r/PrequelMemes/comments/152450v/i_dont_like_sand_not_good_for_the_complexion/,stunk_funky,I don’t like sand. Not good for the complexion.,15791,0.97,391,,1689605533.0,False,False,False,False,False
28,1524wkq,meirl,/r/meirl/comments/1524wkq/me_irl/,TemmyLade,Me irl,14075,0.96,1474,,1689607243.0,False,False,False,False,False
29,1523odq,AbsoluteUnits,/r/AbsoluteUnits/comments/1523odq/who_was_this_made_for/,denselyDock,Who was this made for,19247,0.94,4376,,1689604485.0,False,False,False,False,False
30,1527z11,PoliticalHumor,/r/PoliticalHumor/comments/1527z11/moms_for_liberty_or_something/,weezo182,Moms for liberty.... or something,5688,0.97,59,,1689614218.0,False,False,False,False,False
31,15263jf,science,/r/science/comments/15263jf/conservatives_are_more_likely_to_complain_in/,HeinieKaboobler,Conservatives are more likely to complain in everyday service contexts due to their higher sense of entitlement,8315,0.8,702,,1689609938.0,False,False,False,False,False
32,1525wwj,antiwork,/r/antiwork/comments/1525wwj/i_have_automated_my_job_and_my_productivity_is_of/,HardTruthssss,"I have automated my job and my productivity is of 10 workers, my boss knows about it and wants me to share the tool I use with the company, should I design it to break once I am gone or fired? or once I am gone should I offer it as a subscription service? Or should I just give it for free?",8242,0.93,2699,,1689609548.0,False,False,False,False,False
33,1528wh7,nottheonion,/r/nottheonion/comments/1528wh7/a_spelling_mistake_is_causing_thousands_of/,Cagey898,A Spelling Mistake Is Causing Thousands of Sensitive Pentagon Documents to Be Leaked to a Russian Ally,4882,0.96,211,,1689616356.0,False,False,False,False,False
34,152c17q,clevercomebacks,/r/clevercomebacks/comments/152c17q/look_i_made_a_joke/,HolidayOwlz,LOoK I MaDE a JoKe,3250,0.98,45,,1689623492.0,False,False,False,False,False
35,1524q1m,Damnthatsinteresting,/r/Damnthatsinteresting/comments/1524q1m/100_years_old_drawing_tool/,daas_hu_gurudev_ka,100 years old Drawing tool. ,9713,0.98,163,,1689606828.0,False,False,False,False,False
36,1528xf8,whenthe,/r/whenthe/comments/1528xf8/evil_intentions/,PowerfulOperation8,Evil intentions,5583,0.98,261,,1689616416.0,False,False,False,False,False
37,1527vsw,oddlyspecific,/r/oddlyspecific/comments/1527vsw/what_a_turn_of_events/,Optimal_Test3280,What a turn of events,5741,0.95,384,,1689614017.0,False,False,False,False,False
38,1525bb4,aww,/r/aww/comments/1525bb4/baby_octopus_exploring_the_world/,Top-Evidence-2807,Baby octopus exploring the world,8103,0.93,170,,1689608184.0,False,False,False,False,False
39,15260i8,OldSchoolCool,/r/OldSchoolCool/comments/15260i8/me_and_my_bestie_at_our_prom_in_1988_yes_those/,66Lightning650,"Me and my bestie at our prom in 1988, yes those are cookies is my cleavage and yes she is smoking.",6398,0.95,296,,1689609749.0,False,False,False,False,False
40,152asln,nextfuckinglevel,/r/nextfuckinglevel/comments/152asln/amazing_robotic_engineering_robot_can_self_right/,Fuzzy_Logic_4_Life,"Amazing robotic engineering, robot can self right itself.",7291,0.97,1135,,1689620675.0,False,False,False,False,False
41,1521ql0,BlackPeopleTwitter,/r/BlackPeopleTwitter/comments/1521ql0/arm_leg_leg_arm_head/,jorginho20regista,Arm leg leg arm head,13098,0.95,377,,1689599862.0,False,False,False,False,False
42,1521saq,funny,/r/funny/comments/1521saq/my_wifes_sense_of_humor_isjuvenile/,BooRadleysreddit,My wife's sense of humor is.....juvenile,14081,0.88,391,,1689599986.0,False,False,False,False,False
43,152994j,baseball,/r/baseball/comments/152994j/passan_breaking_my_back/,Waaaaaaaaaasuup,[Passan] BREAKING: My back.,3753,0.97,395,Major League Baseball :mlb:,1689617137.0,False,False,False,False,False
44,1528ko7,Eldenring,/r/Eldenring/comments/1528ko7/too_sad_to_confront/,cloodhee,Too sad to confront,4259,0.98,62,,1689615606.0,False,False,False,False,False
45,1527zjw,OneOrangeBraincell,/r/OneOrangeBraincell/comments/1527zjw/many_on_my_last_post_pointed_out_that_there_were/,GingaNinja1427,"Many on my last post pointed out that there were 2 gingers in my home. They Are wrong, there are three.",4467,0.98,74,,1689614253.0,False,False,False,False,False
46,152a9fc,WTF,/r/WTF/comments/152a9fc/the_crane_is_going_place/,8wine,The crane is going place,3277,0.95,290,,1689619478.0,False,False,False,False,False
47,15291wz,Superstonk,/r/Superstonk/comments/15291wz/ryan_cohen_on_twitter/,Dependent-Sandwich34,Ryan Cohen on Twitter,4531,0.94,341,🎮 Power to the Players 🛑,1689616706.0,False,False,False,False,False
48,1525zyh,technology,/r/technology/comments/1525zyh/amazon_told_drivers_not_to_worry_about_invan/,777fer,Amazon Told Drivers Not to Worry About In-Van Surveillance Cameras. Now Footage Is Leaking Online,5134,0.97,357,,1689609718.0,False,False,False,False,False
49,15213k7,Whatcouldgowrong,/r/Whatcouldgowrong/comments/15213k7/driving_by_the_river_edge/,uchman365,Driving by the river edge,12833,0.97,513,,1689598270.0,False,False,False,False,False
50,1522zzv,SipsTea,/r/SipsTea/comments/1522zzv/dating_tips/,8wine,Dating tips,10800,0.88,544,,1689602873.0,False,False,False,False,False
51,15224jk,cats,/r/cats/comments/15224jk/my_cat_brought_home_a_kitten_now_he_seems_to/,Character-Search7009,My cat brought home a kitten. Now he seems to regret parenthood,9995,0.99,229,,1689600819.0,False,False,False,False,False
52,152avdz,oddlysatisfying,/r/oddlysatisfying/comments/152avdz/pencil_sharpeners_throughout_the_years/,vjenkinsgo,Pencil sharpeners throughout the years,5655,0.94,203,,1689620859.0,False,False,False,False,False
53,1526gfe,Breath_of_the_Wild,/r/Breath_of_the_Wild/comments/1526gfe/who_would_win/,Formal-Setting-6609,Who would win?,5025,0.97,246,340 hours,1689610758.0,False,False,False,False,False
54,15240i5,ProgrammerHumor,/r/ProgrammerHumor/comments/15240i5/programmingishard/,Yamoyek,programmingIsHard,7047,0.97,311,:cp::c::py:,1689605247.0,False,False,False,False,False
55,1521pty,MapPorn,/r/MapPorn/comments/1521pty/latest_un_vote_to_end_us_embargo_against_cuba/,flyingcatwithhorns,Latest UN vote to end US embargo against Cuba,10838,0.92,2398,,1689599807.0,False,False,False,False,False
56,1527qkp,IASIP,/r/IASIP/comments/1527qkp/podcast_update/,lto23,Podcast update,3830,0.96,358,,1689613684.0,False,False,False,False,False
57,15238jv,memes,/r/memes/comments/15238jv/didnt_know_what_to_say/,DaNoahLP,Didnt know what to say,11562,0.97,182,,1689603440.0,False,False,False,False,False
58,1528jw0,UFOs,/r/UFOs/comments/1528jw0/rep_tim_burchett_the_house_oversight_committee/,CreditCardOnly,"Rep. Tim Burchett: “The House Oversight Committee will hold a hearing on UAPs on Wednesday, 7/26. We’re done with the cover-ups.”",3457,0.9,980,,1689615552.0,False,False,False,False,False
59,1525o0k,BeAmazed,/r/BeAmazed/comments/1525o0k/the_pocket_watch/,Ok_Influence_4274,The pocket watch,11697,0.94,505,,1689608994.0,False,False,False,False,False
60,152bj3z,WhitePeopleTwitter,/r/WhitePeopleTwitter/comments/152bj3z/conservatives_when_reading_comprehension/,JohnSheet69420,Conservatives when reading comprehension:,4378,0.97,192,,1689622359.0,False,False,False,False,False
61,1528u0x,MadeMeSmile,/r/MadeMeSmile/comments/1528u0x/such_a_fun_way_to_take_travel_photos/,H_G_Bells,Such a fun way to take travel photos! ,6368,0.98,118,,1689616204.0,False,False,False,False,False
62,1526c5v,MaliciousCompliance,/r/MaliciousCompliance/comments/1526c5v/youre_so_obsessed_with_how_i_dress_that_youre/,shoegazeslut,"You're so obsessed with how I dress that you're going to involve HR? All right, let's get a supervisor involved and see how that goes for you.",4125,0.9,453,,1689610479.0,False,False,False,False,True
63,15255g2,Baking,/r/Baking/comments/15255g2/first_chocolate_tart/,Extrafluffymeowloaf,First Chocolate Tart,4855,0.98,126,,1689607820.0,False,False,False,False,False
64,1525dmy,PublicFreakout,/r/PublicFreakout/comments/1525dmy/these_volunteers_are_amazing/,Jumpman707,These volunteers are amazing,10423,0.96,491,,1689608335.0,False,False,False,False,False
65,1523jzy,me_irlgbt,/r/me_irlgbt/comments/1523jzy/me_irlgbt/,Fulcagay,me_irlgbt,6996,0.89,181,,1689604202.0,False,False,False,False,False
66,152563u,shitposting,/r/shitposting/comments/152563u/exactly_praise_spez/,Babyfox44,EXactly - praise spez,5906,0.96,95,,1689607856.0,False,False,False,False,False
67,152a9g9,BikiniBottomTwitter,/r/BikiniBottomTwitter/comments/152a9g9/its_a_good_move/,evan_lolz,It’s a good move,2489,0.98,34,:Bold_and_Brash:,1689619480.0,False,False,False,False,False
68,1525dgh,WorkReform,/r/WorkReform/comments/1525dgh/republicans_who_rail_against_raising_the_minimum/,DemCast_USA,Republicans who rail against raising the minimum wage because “that’s way more than I made when I was young” literally don’t understand inflation.,4516,0.97,102,,1689608322.0,False,False,False,False,False
69,1524zyf,popculturechat,/r/popculturechat/comments/1524zyf/ariana_grande_husband_dalton_gomez_are_divorcing/,impeccabletim,"Ariana Grande, husband Dalton Gomez are divorcing after 2 years of marriage",4874,0.9,1042,Followed by John Cena,1689607472.0,False,False,False,False,False
70,1524gs9,NonPoliticalTwitter,/r/NonPoliticalTwitter/comments/1524gs9/bowling_for_soup/,Tua-Lipa,Bowling For Soup,5093,0.97,51,:blue1::blue2::1111::1112:,1689606248.0,False,False,False,False,False
71,1521n5o,NoStupidQuestions,/r/NoStupidQuestions/comments/1521n5o/why_do_companies_not_understand_that/,Mister_McGreg,Why do companies not understand that oversaturation of their ads makes people hate them?,8065,0.91,1379,,1689599619.0,False,1689616794.0,False,False,False
72,1529aj9,LifeProTips,/r/LifeProTips/comments/1529aj9/lpt_be_careful_of_who_and_what_you_talk_about/,ManateeJamboree,LPT: Be careful of who and what you talk about with work colleagues. You never know who will use your own words against you to climb up the corporate ladder.,2671,0.96,143,,1689617228.0,False,False,False,False,False
73,151zuaf,meme,/r/meme/comments/151zuaf/brilliant/,Lunar_Rainbow_Pro,Brilliant!,15680,0.94,360,,1689594925.0,False,False,False,False,False
74,1529188,funnyvideos,/r/funnyvideos/comments/1529188/rrrruuuurrr/,MrCheRRyPi,Rrrruuuurrr,2780,0.97,54,,1689616657.0,False,False,False,False,False
75,15248n5,formuladank,/r/formuladank/comments/15248n5/we_all_hope_for_a_podium_for_piastri/,ionutandreiciobotaru,We all hope for a podium for Piastri,5120,0.98,46, Nico Hüüüüüüüülkenberg,1689605765.0,False,False,False,False,False
76,1528qv9,diablo4,/r/diablo4/comments/1528qv9/fact/,SPinalloverdaworld,Fact,2691,0.96,185,,1689615986.0,False,False,False,False,False
77,1523vl4,unpopularopinion,/r/unpopularopinion/comments/1523vl4/people_who_lament_about_their_multiple_six_figure/,B4K5c7N,People who lament about their multiple six figure salaries “not being very much” are just humble bragging,5734,0.84,1587,,1689604943.0,False,1689612485.0,False,False,False
78,152456v,LateStageCapitalism,/r/LateStageCapitalism/comments/152456v/i_just_dont_understand_why/,Steffee98,I just don't understand why.,4821,0.98,89,,1689605544.0,False,False,False,False,False
79,152797p,discordVideos,/r/discordVideos/comments/152797p/anime_style/,Exastiken,anime style,3492,0.96,76,,1689612594.0,False,False,False,False,False
80,1520ewv,AnimalsBeingDerps,/r/AnimalsBeingDerps/comments/1520ewv/what_the_heck_is_this/,1Hate17Here,“What the heck is this?”,9161,0.96,86,,1689596435.0,False,False,False,False,False
81,1521cfx,wholesomememes,/r/wholesomememes/comments/1521cfx/this_is_stupid_but_use_it_or_lose_it_comment_here/,I2iSTUDIOS,"This is stupid, but use it or lose it, comment here and i'll give a Tree hugging award till I run out",9074,0.93,2301,,1689598896.0,False,False,False,False,False
82,152aw6y,OnePiece,/r/OnePiece/comments/152aw6y/one_piece_chapter_1088_spoilers/,gyrozepp2,One Piece chapter 1088 spoilers,2004,0.96,951,Lazy Justice,1689620916.0,False,1689621031.0,True,False,False
83,1528cae,inthenews,/r/inthenews/comments/1528cae/donald_trump_brands_us_a_thirdworld_hellhole_run/,Unhappy_Earth1,Donald Trump brands US a ‘third-world hellhole’ run by ‘perverts’ and ‘thugs’,2701,0.93,617,,1689615052.0,False,False,False,False,False
84,1529xmq,CombatFootage,/r/CombatFootage/comments/1529xmq/russian_mortar_suffers_a_failure_and_blows_up_the/,HalalMeatCOEggo,Russian mortar suffers a failure and blows up the crew,2205,0.96,227,,1689618723.0,True,False,False,False,False
85,1527kyf,Hololive,/r/Hololive/comments/1527kyf/omega_deleted/,Negative_Patience_21,Omega deleted,3034,0.96,425,,1689613334.0,False,False,False,False,False
86,15292cr,insanepeoplefacebook,/r/insanepeoplefacebook/comments/15292cr/ffs/,Vyzantinist,Ffs.,2459,0.98,165,,1689616738.0,False,False,False,False,False
87,1523zly,ukraine,/r/ukraine/comments/1523zly/the_endless_procession_of_funeral_cars_carrying/,UNITED24Media,The endless procession of funeral cars carrying to remains of the MH17 victims. Will never forget.,4437,0.98,90,:FlagUA: Ukraine Media,1689605190.0,False,False,False,False,False
88,1528u9e,IllegallySmolCats,/r/IllegallySmolCats/comments/1528u9e/found_this_cat/,TacoRedneck,Found this cat.,2455,0.99,115,,1689616217.0,False,False,False,False,False
89,152chb5,Fauxmoi,/r/Fauxmoi/comments/152chb5/sofía_vergara_and_joe_manganiello_divorcing_after/,ugggghhhhhhhhh,Sofía Vergara and Joe Manganiello divorcing after 7 years of marriage,1554,0.97,397,,1689624500.0,False,False,False,False,False
90,1522lym,Unexpected,/r/Unexpected/comments/1522lym/barking_up_the_wrong_tree/,VariousBasket125,Barking up the wrong tree ,15980,0.96,367,,1689601979.0,False,False,False,False,False
91,1522lza,facepalm,/r/facepalm/comments/1522lza/are_you_really_a_man_without_a_beard/,EpicBroodjeFrikandel,Are you really a man without a beard?,18496,0.95,1031,,1689601980.0,False,False,False,False,False
92,1521kvt,maybemaybemaybe,/r/maybemaybemaybe/comments/1521kvt/maybe_maybe_maybe/,OkPitcha,Maybe maybe maybe,6695,0.93,131,,1689599459.0,False,False,False,False,False
93,1521nwm,Tinder,/r/Tinder/comments/1521nwm/matched_a_dead_girl_on_tinder_fair_play/,CGCharlie,Matched a dead girl on tinder fair play,6158,0.94,559,,1689599672.0,False,False,False,False,False
94,1524flg,chessbeginners,/r/chessbeginners/comments/1524flg/god_im_good/,Mezzzmo,God I'm good,4142,0.97,100,,1689606174.0,False,False,False,False,False
95,151x6lq,space,/r/space/comments/151x6lq/buzz_aldrin_on_the_54th_anniversary_of_the_launch/,rainbowarriorhere,Buzz Aldrin on the 54th Anniversary of the launch of Apollo 11,17687,0.92,1195,,1689586717.0,False,False,False,False,False
96,15234cn,skyrim,/r/skyrim/comments/15234cn/i_literally_created_a_cursed_ring_it_gives_me/,AnkokunoMasaki,"I literally created a cursed ring, it gives me infinite health but whenever I remove it I die. Anyway to fix this?  ",4726,0.96,497,,1689603163.0,False,False,False,False,False
97,1524n58,freefromwork,/r/freefromwork/comments/1524n58/the_uc_davis_pepper_spray_incident_that_the/,NewClassroomz,"The UC Davis pepper spray incident that the university payed over $100,000 to ""erase from the internet""",3671,0.96,38,,1689606643.0,False,False,False,False,False
98,151zqym,Damnthatsinteresting,/r/Damnthatsinteresting/comments/151zqym/a_royal_navy_sea_harrier_after_making_an/,Status-Victory,"A Royal Navy Sea Harrier after making an emergency landing on a container ship at sea, the Pilot was lost and running out of fuel and decided to eject, however he spotted the Alraigo ship and emergency landed, saving the £7m jet. The Alraigo crew and owners were awarded £570,000 compensation.",41084,0.97,1131,,1689594660.0,False,False,False,False,False
99,1526sky,DiWHY,/r/DiWHY/comments/1526sky/wcgw_using_twine_and_exposed_wood_screws_to/,KEVLAR60442,WCGW using twine and exposed wood screws to create a swinging computer char in the rafters?,2870,0.88,408,,1689611510.0,False,False,False,False,False
100,1527wyr,cursedcomments,/r/cursedcomments/comments/1527wyr/cursed_food/,SOUMO_007,Cursed_food,2611,0.97,56,,1689614093.0,False,False,False,False,False
