rank,id,subreddit,permalink,author,title,score,upvote_ratio,num_comments,author_flair_text,created_utc,over_18,edited,stickied,locked,is_original_content
1,1528asf,MadeMeSmile,/r/MadeMeSmile/comments/1528asf/designated_driver_making_sure_she_gets_home_safe/,mindyour,Designated driver making sure she gets home safe.,14025,0.98,307,,1689614965.0,False,False,False,False,False
2,1523tge,WhitePeopleTwitter,/r/WhitePeopleTwitter/comments/1523tge/professor_callie_rennison_makes_brock_turner_the/,AlwaysTheNoob,Professor Callie Rennison makes Brock Turner the literal textbook definition of a rapist,29976,0.96,651,,1689604808.0,False,False,False,False,False
3,15243h3,subway,/r/subway/comments/15243h3/update_i_was_fired/,sleepparalysisagain,[UPDATE] I was fired,27643,0.93,2144,,1689605436.0,False,False,False,False,False
4,1524293,nextfuckinglevel,/r/nextfuckinglevel/comments/1524293/victoria_cameron_texas_4a_girls_100_meter_state/,esberat,Victoria Cameron Texas 4A Girls 100 meter state champ.,14809,0.97,483,,1689605361.0,False,False,False,False,False
5,1523hq8,news,/r/news/comments/1523hq8/new_drug_found_to_slow_alzheimers_hailed_a/,ICumCoffee,New drug found to slow Alzheimer's hailed a 'turning point in fight against disease',12973,0.97,611,,1689604044.0,False,False,False,False,False
6,1523hvk,todayilearned,/r/todayilearned/comments/1523hvk/til_that_the_failed_superman_film_which_had_cast/,Make_the_music_stop,"TIL that the failed Superman film which had cast Nicolas Cage ending up costing Warner Brothers around $30 million. $20 million of that was paid to Nicolas Cage, his guarantee if the production halted.",13727,0.97,493,,1689604054.0,False,False,False,False,False
7,1523gz2,meirl,/r/meirl/comments/1523gz2/meirl/,dpotilas89,Meirl,14425,0.92,418,,1689603991.0,False,False,False,False,False
8,151zqym,Damnthatsinteresting,/r/Damnthatsinteresting/comments/151zqym/a_royal_navy_sea_harrier_after_making_an/,Status-Victory,"A Royal Navy Sea Harrier after making an emergency landing on a container ship at sea, the Pilot was lost and running out of fuel and decided to eject, however he spotted the Alraigo ship and emergency landed, saving the £7m jet. The Alraigo crew and owners were awarded £570,000 compensation.",33360,0.97,973,,1689594660.0,False,False,False,False,False
9,152450v,PrequelMemes,/r/PrequelMemes/comments/152450v/i_dont_like_sand_not_good_for_the_complexion/,stunk_funky,I don’t like sand. Not good for the complexion.,8553,0.97,244,,1689605533.0,False,False,False,False,False
10,151zg0c,politics,/r/politics/comments/151zg0c/billionaires_arent_okay_for_their_mental_health/,semaphore-1842,"Billionaires aren't okay — for their mental health, time to drastically raise their taxes: From threatening cage matches to backing RFK Jr., billionaires prove too much money detaches a person from reality",26386,0.9,1582,,1689593774.0,False,False,False,False,False
11,1525vlz,oddlyterrifying,/r/oddlyterrifying/comments/1525vlz/the_vegas_msg_sphere/,Kalunda2,The Vegas MSG sphere,5910,0.96,306,,1689609465.0,False,False,False,False,False
12,1522lym,Unexpected,/r/Unexpected/comments/1522lym/barking_up_the_wrong_tree/,VariousBasket125,Barking up the wrong tree ,10079,0.96,281,,1689601979.0,False,False,False,False,False
13,15258ie,HolUp,/r/HolUp/comments/15258ie/if_you_know_you_already_understood/,esberat,"If you know, you already understood.",6874,0.95,230,:zfg1::zfg2::zfg3::zfg4:,1689608004.0,False,False,False,False,False
14,1527tlc,BrandNewSentence,/r/BrandNewSentence/comments/1527tlc/i_know_i_probably_shouldnt_laugh_about_this_but/,mecnev,I know I probably shouldn't laugh about this but damn,4237,0.98,205,,1689613875.0,False,False,False,False,False
15,1523odq,AbsoluteUnits,/r/AbsoluteUnits/comments/1523odq/who_was_this_made_for/,denselyDock,Who was this made for,7653,0.96,2033,,1689604485.0,False,False,False,False,False
16,1522lza,facepalm,/r/facepalm/comments/1522lza/are_you_really_a_man_without_a_beard/,EpicBroodjeFrikandel,Are you really a man without a beard?,9641,0.97,660,,1689601980.0,False,False,False,False,False
17,1525dmy,PublicFreakout,/r/PublicFreakout/comments/1525dmy/these_volunteers_are_amazing/,Jumpman707,These volunteers are amazing,5324,0.97,289,,1689608335.0,False,False,False,False,False
18,1521ql0,BlackPeopleTwitter,/r/BlackPeopleTwitter/comments/1521ql0/arm_leg_leg_arm_head/,jorginho20regista,Arm leg leg arm head,9074,0.96,302,,1689599862.0,False,False,False,False,False
19,151zi2e,therewasanattempt,/r/therewasanattempt/comments/151zi2e/to_not_go_home/,AristonD,To not go home,17794,0.96,465,,1689593951.0,False,False,False,False,False
20,15213k7,Whatcouldgowrong,/r/Whatcouldgowrong/comments/15213k7/driving_by_the_river_edge/,uchman365,Driving by the river edge,9067,0.97,410,,1689598270.0,False,False,False,False,False
21,151zc1a,TikTokCringe,/r/TikTokCringe/comments/151zc1a/shes_right/,laughtercupcake51,She's right.,17788,0.89,2311,,1689593448.0,False,False,False,False,False
22,1521saq,funny,/r/funny/comments/1521saq/my_wifes_sense_of_humor_isjuvenile/,BooRadleysreddit,My wife's sense of humor is.....juvenile,7748,0.9,266,,1689599986.0,False,False,False,False,False
23,1525ttn,StupidFood,/r/StupidFood/comments/1525ttn/how_to_ruin_a_burger/,wet_egirl_ass,How to ruin a burger,4348,0.92,1243,,1689609352.0,False,False,False,False,False
24,151xxhn,comics,/r/comics/comments/151xxhn/mind_body_problem/,MrLovens,Mind Body Problem,21058,0.97,185,Mr. Lovenstein,1689589156.0,False,False,False,False,False
25,15263jf,science,/r/science/comments/15263jf/conservatives_are_more_likely_to_complain_in/,HeinieKaboobler,Conservatives are more likely to complain in everyday service contexts due to their higher sense of entitlement,3776,0.81,365,,1689609938.0,False,False,False,False,False
26,1522zzv,SipsTea,/r/SipsTea/comments/1522zzv/dating_tips/,8wine,Dating tips,6448,0.9,278,,1689602873.0,False,False,False,False,False
27,1525o0k,BeAmazed,/r/BeAmazed/comments/1525o0k/the_pocket_watch/,Ok_Influence_4274,The pocket watch,3850,0.95,202,,1689608994.0,False,False,False,False,False
28,1521pty,MapPorn,/r/MapPorn/comments/1521pty/latest_un_vote_to_end_us_embargo_against_cuba/,flyingcatwithhorns,Latest UN vote to end US embargo against Cuba,6844,0.92,1596,,1689599807.0,False,False,False,False,False
29,1525xp0,Gamingcirclejerk,/r/Gamingcirclejerk/comments/1525xp0/so_ron_has_always_just_been_cool_like_that/,tdolomax,"So, Ron has always just been cool like that?",3592,0.96,80,,1689609601.0,False,False,False,False,False
30,15240i5,ProgrammerHumor,/r/ProgrammerHumor/comments/15240i5/programmingishard/,Yamoyek,programmingIsHard,4338,0.97,203,:cp::c::py:,1689605247.0,False,False,False,False,False
31,151xesf,tumblr,/r/tumblr/comments/151xesf/supersexy_male/,SaraAnnabelle,Super-Sexy Male,21313,0.97,297,,1689587483.0,False,False,False,False,False
32,151zuaf,meme,/r/meme/comments/151zuaf/brilliant/,Lunar_Rainbow_Pro,Brilliant!,9953,0.95,293,,1689594925.0,False,False,False,False,False
33,151zzae,memes,/r/memes/comments/151zzae/im_flattered/,ThatCoolBlondeGirl,I'm flattered,12618,0.92,313,Selling Stonks for CASH MONEY,1689595295.0,False,False,False,False,False
34,15205jz,shitposting,/r/shitposting/comments/15205jz/hold_my_praise_spez/,jaska9999,hold my 🥤(praise spez),11384,0.96,212,,1689595751.0,False,False,False,False,False
35,1525bb4,aww,/r/aww/comments/1525bb4/baby_octopus_exploring_the_world/,Top-Evidence-2807,Baby octopus exploring the world,3360,0.93,94,,1689608184.0,False,False,False,False,False
36,151x6lq,space,/r/space/comments/151x6lq/buzz_aldrin_on_the_54th_anniversary_of_the_launch/,rainbowarriorhere,Buzz Aldrin on the 54th Anniversary of the launch of Apollo 11,14033,0.93,1014,,1689586717.0,False,False,False,False,False
37,1520ewv,AnimalsBeingDerps,/r/AnimalsBeingDerps/comments/1520ewv/what_the_heck_is_this/,1Hate17Here,“What the heck is this?”,6457,0.96,63,,1689596435.0,False,False,False,False,False
38,1521802,WhitePeopleTwitter,/r/WhitePeopleTwitter/comments/1521802/i_mean_gestures_broadly/,KHaskins77,I mean… *gestures broadly*,27839,0.97,742,,1689598592.0,False,False,False,False,False
39,1523jzy,me_irlgbt,/r/me_irlgbt/comments/1523jzy/me_irlgbt/,Fulcagay,me_irlgbt,3998,0.93,96,,1689604202.0,False,False,False,False,False
40,1521cfx,wholesomememes,/r/wholesomememes/comments/1521cfx/this_is_stupid_but_use_it_or_lose_it_comment_here/,I2iSTUDIOS,"This is stupid, but use it or lose it, comment here and i'll give a Tree hugging award till I run out",5705,0.95,1608,,1689598896.0,False,False,False,False,False
41,1524zyf,popculturechat,/r/popculturechat/comments/1524zyf/ariana_grande_husband_dalton_gomez_are_divorcing/,impeccabletim,"Ariana Grande, husband Dalton Gomez are divorcing after 2 years of marriage",3101,0.92,778,Followed by John Cena,1689607472.0,False,False,False,False,False
42,151wawv,mildlyinfuriating,/r/mildlyinfuriating/comments/151wawv/someone_keeps_doing_this_to_a_public_basketball/,Dutch2211,Someone keeps doing this to a public basketball court.,22433,0.97,1283,,1689583712.0,False,False,False,False,False
43,152994j,baseball,/r/baseball/comments/152994j/passan_breaking_my_back/,Waaaaaaaaaasuup,[Passan] BREAKING: My back.,1848,0.98,264,Major League Baseball :mlb:,1689617137.0,False,False,False,False,False
44,1521n5o,NoStupidQuestions,/r/NoStupidQuestions/comments/1521n5o/why_do_companies_not_understand_that/,Mister_McGreg,Why do companies not understand that oversaturation of their ads makes people hate them?,4747,0.92,955,,1689599619.0,False,1689616794.0,False,False,False
45,1523m9t,worldnews,/r/worldnews/comments/1523m9t/belarus_abducts_thousands_of_ukrainian_children/,TheTelegraph,Belarus abducts thousands of Ukrainian children,3540,0.96,138,:verified: The Telegraph ,1689604342.0,False,False,False,False,False
46,151z2u6,anime_irl,/r/anime_irl/comments/151z2u6/anime_irl/,NekoWafers,anime_irl,7619,0.95,111,,1689592689.0,False,False,False,False,False
47,15291wz,Superstonk,/r/Superstonk/comments/15291wz/ryan_cohen_on_twitter/,Dependent-Sandwich34,Ryan Cohen on Twitter,2149,0.97,225,🎮 Power to the Players 🛑,1689616706.0,False,False,False,False,False
48,151wmfb,dankmemes,/r/dankmemes/comments/151wmfb/they_dont_deserver_this/,awwbetteryesno,They don’t deserver this,15671,0.96,202,,1689584801.0,False,False,False,False,False
49,151xv2c,ImTheMainCharacter,/r/ImTheMainCharacter/comments/151xv2c/this_girl_at_the_airport_waits_until_the_queue/,rip-21,This girl at the airport waits until the queue moves all the way forward to move. People confronted her and she said “it’s the same if i move now or later”.,10801,0.83,2897,,1689588934.0,False,False,False,False,False
50,1523hgq,TwoSentenceHorror,/r/TwoSentenceHorror/comments/1523hgq/ever_since_i_learned_morse_code_every_long_and/,AceQuire,"Ever since I learned Morse code, every long and short pulse felt like a hidden message",3342,0.97,132,,1689604027.0,False,False,False,False,False
51,1521wno,MadeMeSmile,/r/MadeMeSmile/comments/1521wno/golden_retrievers_in_scotland_celebrating_their/,Artane_33,Golden Retrievers in Scotland celebrating their 155th anniversary as a breed,15642,0.98,501,,1689600284.0,False,False,False,False,False
52,151yo03,rareinsults,/r/rareinsults/comments/151yo03/fr_tho_his_wife_is_really_a_bitch/,secretslut991,"Fr tho, his wife is really a bitch",10005,0.8,220,,1689591466.0,False,False,False,False,False
53,15255g2,Baking,/r/Baking/comments/15255g2/first_chocolate_tart/,Extrafluffymeowloaf,First Chocolate Tart,2486,0.98,80,,1689607820.0,False,False,False,False,False
54,1521kvt,maybemaybemaybe,/r/maybemaybemaybe/comments/1521kvt/maybe_maybe_maybe/,OkPitcha,Maybe maybe maybe,4068,0.93,100,,1689599459.0,False,False,False,False,False
55,1526c5v,MaliciousCompliance,/r/MaliciousCompliance/comments/1526c5v/youre_so_obsessed_with_how_i_dress_that_youre/,shoegazeslut,"You're so obsessed with how I dress that you're going to involve HR? All right, let's get a supervisor involved and see how that goes for you.",2141,0.91,275,,1689610479.0,False,False,False,False,True
56,151x4ca,2westerneurope4u,/r/2westerneurope4u/comments/151x4ca/why_americans_are_fat/,Json_Bach,Why Americans are fat,10925,0.86,1896,:West_Germany: France’s whore,1689586510.0,False,False,False,False,True
57,151vm46,marvelmemes,/r/marvelmemes/comments/151vm46/yeah/,Alternative_Fox_6871,yeah....,21061,0.93,802,Avengers,1689581305.0,False,False,False,False,False
58,151x6d4,TwoHotTakes,/r/TwoHotTakes/comments/151x6d4/me_and_my_brother_will_never_be_the_same_because/,Exact_Butterscotch40,Me and my brother will never be the same because of a fake wedding.,9240,0.94,1951,,1689586694.0,False,False,False,False,False
59,1524gs9,NonPoliticalTwitter,/r/NonPoliticalTwitter/comments/1524gs9/bowling_for_soup/,Tua-Lipa,Bowling For Soup,2606,0.97,30,:blue1::blue2::1111::1112:,1689606248.0,False,False,False,False,False
60,15248n5,formuladank,/r/formuladank/comments/15248n5/we_all_hope_for_a_podium_for_piastri/,ionutandreiciobotaru,We all hope for a podium for Piastri,2667,0.99,26, Nico Hüüüüüüüülkenberg,1689605765.0,False,False,False,False,False
61,15232uk,JeffArcuri,/r/JeffArcuri/comments/15232uk/mushrooms/,Smartastic,Mushrooms 🍄 ,2954,0.94,68,The Short King,1689603061.0,False,False,False,False,False
62,1525wwj,antiwork,/r/antiwork/comments/1525wwj/i_have_automated_my_job_and_my_productivity_is_of/,HardTruthssss,"I have automated my job and my productivity is of 10 workers, my boss knows about it and wants me to share the tool I use with the company, should I design it to break once I am gone or fired? or once I am gone should I offer it as a subscription service? Or should I just give it for free?",2168,0.96,1005,,1689609548.0,False,False,False,False,False
63,15260i8,OldSchoolCool,/r/OldSchoolCool/comments/15260i8/me_and_my_bestie_at_our_prom_in_1988_yes_those/,66Lightning650,"Me and my bestie at our prom in 1988, yes those are cookies is my cleavage and yes she is smoking.",2116,0.96,132,,1689609749.0,False,False,False,False,False
64,1520eit,nba,/r/nba/comments/1520eit/joel_embiid_i_just_want_to_win_a_championship/,mastermind208,"Joel Embiid: ""I just want to win a championship, whatever it takes. I don't know where that's going to be, whether it's Philly or somewhere else...It's not easy but every single day I work towards it""",4123,0.93,1645,,1689596408.0,False,False,False,False,False
65,1527qkp,IASIP,/r/IASIP/comments/1527qkp/podcast_update/,lto23,Podcast update,1644,0.97,207,,1689613684.0,False,False,False,False,False
66,15234cn,skyrim,/r/skyrim/comments/15234cn/i_literally_created_a_cursed_ring_it_gives_me/,AnkokunoMasaki,"I literally created a cursed ring, it gives me infinite health but whenever I remove it I die. Anyway to fix this?  ",2861,0.96,339,,1689603163.0,False,False,False,False,False
67,151xuve,LateStageCapitalism,/r/LateStageCapitalism/comments/151xuve/voting_with_your_dollars/,Worsechoke,"""Voting with your dollars""",6166,0.96,223,,1689588918.0,False,False,False,False,False
68,1521nwm,Tinder,/r/Tinder/comments/1521nwm/matched_a_dead_girl_on_tinder_fair_play/,CGCharlie,Matched a dead girl on tinder fair play,3376,0.95,335,,1689599672.0,False,False,False,False,False
69,1523vl4,unpopularopinion,/r/unpopularopinion/comments/1523vl4/people_who_lament_about_their_multiple_six_figure/,B4K5c7N,People who lament about their multiple six figure salaries “not being very much” are just humble bragging,2528,0.85,902,,1689604943.0,False,1689612485.0,False,False,False
70,151z9bj,Genshin_Impact,/r/Genshin_Impact/comments/151z9bj/none_could_catch_me_meow_kirara_drone_in_chinese/,Hikuran,"""None could catch me meow~"" Kirara Drone in Chinese Comic-Con(by llloyae)",5123,0.97,101,,1689593227.0,False,False,False,False,False
71,151v2rq,CrazyFuckingVideos,/r/CrazyFuckingVideos/comments/151v2rq/guys_holds_dude_at_gun_point_for_trying_to_steal/,johnballs69,guys holds dude at gun point for trying to steal his car and waits for cops to arrive,15655,0.95,1529,,1689579459.0,True,False,False,False,False
72,15224jk,cats,/r/cats/comments/15224jk/my_cat_brought_home_a_kitten_now_he_seems_to/,Character-Search7009,My cat brought home a kitten. Now he seems to regret parenthood,3056,1.0,99,,1689600819.0,False,False,False,False,False
73,151y983,todayilearned,/r/todayilearned/comments/151y983/til_hp_was_busted_multiple_times_shipping_their/,UnlimitedDuck,"TIL: HP was busted multiple times shipping their laptops like the EliteBook, ProBook, Pavilion and Envy with keyloggers that could record keystrokes to a local file accessible by anyone. This alarming discovery by a cyber-security firm impacted over 460 laptop models. And it happend multiple times.",26573,0.96,1003,,1689590162.0,False,False,False,False,False
74,1527kqa,Showerthoughts,/r/Showerthoughts/comments/1527kqa/using_a_love_potion_to_seduce_someone_is_rape_as/,Ill_Call7235,"using a love potion to seduce someone is rape, as it's having sex under the unfluence of a substance, and they therefore can't give consent.",1611,0.85,288,,1689613321.0,True,False,False,False,False
75,1523zly,ukraine,/r/ukraine/comments/1523zly/the_endless_procession_of_funeral_cars_carrying/,UNITED24Media,The endless procession of funeral cars carrying to remains of the MH17 victims. Will never forget.,2362,0.99,46,:FlagUA: Ukraine Media,1689605190.0,False,False,False,False,False
76,1528wh7,nottheonion,/r/nottheonion/comments/1528wh7/a_spelling_mistake_is_causing_thousands_of/,Cagey898,A Spelling Mistake Is Causing Thousands of Sensitive Pentagon Documents to Be Leaked to a Russian Ally,1335,0.97,64,,1689616356.0,False,False,False,False,False
77,15214kx,HonkaiStarRail,/r/HonkaiStarRail/comments/15214kx/the_path_of_destruction_aka_blade_and_a_bunch_of/,YoMikeeHey,The Path of Destruction a.k.a. Blade and a bunch of pipsqueaks,3523,0.96,134,,1689598343.0,False,False,False,False,False
78,1526lui,UkraineWarVideoReport,/r/UkraineWarVideoReport/comments/1526lui/9_years_ago_russian_buk_missile_tore_to_pieces/,codati2000,"9 years ago, russian BUK missile tore to pieces the Malaysian MH17 airliner with 298 people on board. Russia spent years lying that “Ukraine did it”. But truth prevailed.",1707,0.99,79,,1689611093.0,False,False,False,False,False
79,151xgow,technicallythetruth,/r/technicallythetruth/comments/151xgow/this_should_settle_the_debate/,ercelydom,This should settle the debate.,6843,0.96,386,,1689587675.0,False,False,False,False,False
80,151yyko,technology,/r/technology/comments/151yyko/meta_faces_a_100000_daily_fine_if_it_doesnt_fix/,chrisdh79,"Meta faces a $100,000 daily fine if it doesn't fix privacy issues in Norway | 'It is so clear that this is illegal that we need to intervene now and immediately.'",4393,0.97,157,,1689592324.0,False,False,False,False,False
81,151vkfs,oddlysatisfying,/r/oddlysatisfying/comments/151vkfs/satisfying_overengineered_lighter_assembly/,DukeOfBagels,Satisfying over-engineered lighter assembly,11069,0.96,261,,1689581132.0,False,False,False,False,False
82,15221a6,StarWars,/r/StarWars/comments/15221a6/why_didnt_the_praetorian_guards_accept_kylo_ren/,Dragonic_Overlord_,"Why didn't the Praetorian Guards accept Kylo Ren as their new Master after he killed Snoke? Especially since it's dark side tradition for the pupil to kill the Master and take their place, so Kylo was fulfilling his duty.",2768,0.93,473,Jedi,1689600606.0,False,False,False,False,False
83,15220pp,2007scape,/r/2007scape/comments/15220pp/quit_the_game_gl/,BigSexyDaemon,"Quit the game, gl",2776,0.95,108,,1689600568.0,False,False,False,False,False
84,1520ut6,Awww,/r/Awww/comments/1520ut6/kind_people_helps_out_a_mistreated_dog/,Professor_Bacon3o,Kind people helps out a mistreated dog,3367,0.96,71,,1689597624.0,False,False,False,False,False
85,1520w0c,AskReddit,/r/AskReddit/comments/1520w0c/reddit_what_outrage_over_a_celebrity_was_way/,vantae-bts,"Reddit, what outrage over a celebrity was way overblown?",3277,0.9,4373,,1689597704.0,False,False,False,False,False
86,151ynk1,woahdude,/r/woahdude/comments/151ynk1/titan_submersible_implosion/,Irving_Forbush,Titan submersible implosion,4672,0.9,440,,1689591428.0,False,False,False,False,False
87,15204m5,2meirl4meirl,/r/2meirl4meirl/comments/15204m5/2meirl4meirl/,PewPewAnimeGirl,2meirl4meirl,3652,0.96,73,,1689595676.0,False,False,False,False,False
88,15252sw,Unexpected,/r/Unexpected/comments/15252sw/almost_died/,howmanygrapes_,Almost died,4871,0.98,354,,1689607648.0,False,False,False,False,False
89,1522wr3,Hololive,/r/Hololive/comments/1522wr3/callis_one_piece_drawing_from_last_nights_stream/,lightow,Calli's One Piece drawing from last night's stream!,2420,0.97,41,:Gura::Amelia::Inanis::Calliope::Kiara:,1689602663.0,False,False,False,False,False
90,151v32i,CombatFootage,/r/CombatFootage/comments/151v32i/chechens_fighting_on_ukrainian_side_ambush_a/,Chrushev,Chechens fighting on Ukrainian side ambush a Russian Ural truck. Location and date unknown but presumed recent.,10289,0.95,743,,1689579491.0,False,False,False,False,False
91,151xwnp,PeterExplainsTheJoke,/r/PeterExplainsTheJoke/comments/151xwnp/who_is_justin_roiland_and_what_happened/,Stock_Plenty8987,Who is Justin Roiland and what happened,5655,0.93,156,,1689589075.0,False,False,False,False,False
92,1521mw9,NatureIsFuckingLit,/r/NatureIsFuckingLit/comments/1521mw9/whats_the_point_of_antelopes_horns/,EmptySpaceForAHeart,🔥 What's the point of Antelopes' horns?,2789,0.97,78,,1689599599.0,False,False,False,False,False
93,151znm9,NotHowGirlsWork,/r/NotHowGirlsWork/comments/151znm9/not_how_boobs_work/,Shelly_895,Not how boobs work,3702,0.96,423,,1689594386.0,False,False,False,False,False
94,151yeir,wholesome,/r/wholesome/comments/151yeir/this_is_good/,icutfarts,this is good.,4674,0.98,112,,1689590630.0,False,False,False,False,False
95,1523aq8,IllegallySmolCats,/r/IllegallySmolCats/comments/1523aq8/they_are_a_cult/,MileFazzini,They are a cult,2204,0.98,50,,1689603589.0,False,False,False,False,False
96,1528jw0,UFOs,/r/UFOs/comments/1528jw0/rep_tim_burchett_the_house_oversight_committee/,CreditCardOnly,"Rep. Tim Burchett: “The House Oversight Committee will hold a hearing on UAPs on Wednesday, 7/26. We’re done with the cover-ups.”",1158,0.95,398,,1689615552.0,False,False,False,False,False
97,15208kg,HumansAreMetal,/r/HumansAreMetal/comments/15208kg/liberated_from_a_concentration_camp_jewish_man/,AbeamSecond137,Liberated from a concentration camp. Jewish man releases frustration on German Guard.,3176,0.96,188,,1689595968.0,False,False,False,False,False
98,1523cji,pokemon,/r/pokemon/comments/1523cji/day_28_of_fusing_every_gen_1_pokemon_into_one_by/,TB_Mumpitz,Day 28 of fusing every Gen 1 pokemon into one by adding the idea from the top comment. Gengars face is now on Arboks chest. (28/151),2035,0.94,293,,1689603700.0,False,False,False,False,True
99,1524qyx,NewGreentexts,/r/NewGreentexts/comments/1524qyx/anon_is_in_trouble/,sandwichmclee,Anon is in trouble,1746,0.96,61,,1689606886.0,False,False,False,False,False
100,151z42j,facepalm,/r/facepalm/comments/151z42j/call_for_firefighting_services/,ZestyclosePie831,Call for firefighting services,12210,0.97,229,,1689592793.0,False,False,False,False,False
