rank,id,subreddit,permalink,author,title,score,upvote_ratio,num_comments,author_flair_text,created_utc,over_18,edited,stickied,locked,is_original_content
1,14yu0jf,antiwork,/r/antiwork/comments/14yu0jf/breaking_the_160000_actors_recording_artists/,theworkeragency,"BREAKING: The 160,000 actors, recording artists, stunt performers & media professionals of @sagaftra are officially on strike. It’s the first time since 1960 that writers and actors have been on strike at the same time. They’re shutting Hollywood down.",14747,0.96,1054,,1689276516.0,False,False,False,False,False
2,14yukp3,toptalent,/r/toptalent/comments/14yukp3/with_3_chance_to_live_at_birth_dayton_webber_has/,LetsFindSomeTalent,"With 3% chance to live at birth, Dayton Webber has spent his life defying odds and inspiring others",19878,0.9,724,,1689277869.0,False,False,False,False,False
3,14yr3s4,nextfuckinglevel,/r/nextfuckinglevel/comments/14yr3s4/steve_irwin_talks_about_his_first_meeting_with/,Key-Bedroom-4615,Steve Irwin talks about his first meeting with wife Terri,20923,0.96,553,,1689269725.0,False,False,False,False,False
4,14yqyfn,facepalm,/r/facepalm/comments/14yqyfn/journalist_think_the_red_barons_aircraft_is_a/,Aki008035,Journalist think The Red Baron's Aircraft is a Nazi Aircraft,25009,0.95,1985,,1689269392.0,False,False,False,False,False
5,14ytdwf,news,/r/news/comments/14ytdwf/twitter_owes_exemployees_500_million_in_severance/,JustJohn8,"Twitter owes ex-employees $500 million in severance, lawsuit claims",7987,0.96,401,,1689275061.0,False,False,False,False,False
6,14ypnmm,WhitePeopleTwitter,/r/WhitePeopleTwitter/comments/14ypnmm/republicans_just_lost_their_gerrymandered/,Travismatthew08,Republicans just lost their gerrymandered advantage in New York.,17773,0.97,650,,1689266276.0,False,False,False,False,False
7,14yr8uz,comics,/r/comics/comments/14yr8uz/a_different_kind_of_coming_out_details_in_comment/,Main-Salamander-6687,A different kind of coming out (details in comment),12052,0.91,328,,1689270061.0,False,False,False,False,False
8,14ynyyx,Damnthatsinteresting,/r/Damnthatsinteresting/comments/14ynyyx/a_debit_card_skimmer_at_a_shady_convenience_store/,MaximumJones,A debit card skimmer at a shady convenience store,50231,0.93,1823,,1689262315.0,False,False,False,False,False
9,14ys1mq,nottheonion,/r/nottheonion/comments/14ys1mq/rfk_jr_press_dinner_screaming_match_over_climate/,goatofmind,RFK Jr press dinner screaming match over climate crisis ends with columnist launching his own natural gas,7980,0.94,881,,1689271905.0,False,False,False,False,False
10,14yrptt,memes,/r/memes/comments/14yrptt/i_really_dont_understand/,InFoggusKagernIstKul,I really don't understand,12660,0.97,349,,1689271182.0,False,False,False,False,False
11,14yrqi0,cats,/r/cats/comments/14yrqi0/my_boy_glenn_has_had_quite_the_glow_up_over_the/,sweatpantsandwhiskey,My boy Glenn has had quite the glow up over the last couple weeks!,8070,0.96,235,,1689271223.0,True,False,False,False,False
12,14yprx3,technology,/r/technology/comments/14yprx3/its_official_smartphones_will_need_to_have/,f50ci31y,It's official: Smartphones will need to have replaceable batteries by 2027,10705,0.97,1141,,1689266559.0,False,False,False,False,False
13,14yuv2h,wholesome,/r/wholesome/comments/14yuv2h/just_batman_doin_batman_stuff/,icutfarts,just batman doin' batman stuff,4726,0.97,99,,1689278551.0,False,False,False,False,False
14,14yso3f,Fauxmoi,/r/Fauxmoi/comments/14yso3f/christopher_nolan_has_announced_that_the_cast_of/,Ximiso,Christopher Nolan has announced that the cast of ‘OPPENHEIMER’ has left the premiere to ‘go and write their pickets’ and join the strike.,5707,0.96,317,societal collapse is in the air,1689273379.0,False,False,False,False,False
15,14yojb5,TikTokCringe,/r/TikTokCringe/comments/14yojb5/when_see_something_say_something_goes_wrong/,Sufficient-Bug-9112,When see something say something goes wrong,12445,0.94,1426,,1689263672.0,False,False,False,False,False
16,14ylvuz,MadeMeSmile,/r/MadeMeSmile/comments/14ylvuz/another_comparison_pic_not_there_yet_but_down_115/,MetalJunkie101,"Another comparison pic. Not there yet, but down 115 pounds.",45750,0.94,1550,,1689257317.0,False,False,False,False,False
17,14ys2z4,PeterExplainsTheJoke,/r/PeterExplainsTheJoke/comments/14ys2z4/petah_why_is_the_father_traumatised/,Lapis_District,"Petah, why is the father traumatised?",6706,0.95,435,,1689271995.0,False,False,False,False,False
18,14ym98p,LeopardsAteMyFace,/r/LeopardsAteMyFace/comments/14ym98p/transphobic_michigan_salon_owner_declares_she/,wdcmsnbcgay,"Transphobic Michigan Salon Owner Declares She Won’t Serve Trans or Queer People, Says They Should Seek Services at Pet Groomer…Now Her Suppliers Are Dropping Her Salon",18643,0.92,1486,,1689258226.0,False,False,False,False,False
19,14yt5jj,nba,/r/nba/comments/14yt5jj/comedian_ryan_davis_tells_no_lies_about_kevin/,MTRIFE,Comedian Ryan Davis tells no lies about Kevin Durant,4638,0.94,677,,1689274538.0,True,False,False,False,False
20,14ylude,todayilearned,/r/todayilearned/comments/14ylude/til_that_although_we_are_warned_to_be_most_afraid/,harlsey,"TIL that although we are warned to be most afraid of a mother bear and her cubs, nearly 90% of fatal bear attacks are at the paws of lone male bears.",18318,0.96,862,,1689257215.0,False,False,False,False,False
21,14ymrwl,mildlyinfuriating,/r/mildlyinfuriating/comments/14ymrwl/gas_pumps_that_play_loud_advertisements_and/,comfortably__dum,Gas pumps that play loud advertisements and videos while you pump,14868,0.95,1816,,1689259484.0,False,False,False,False,False
22,14yrr9m,dankmemes,/r/dankmemes/comments/14yrr9m/tip_culture_is_going_to_bleed_into_every_job/,Justhuman963,Tip culture is going to bleed into every job,6130,0.97,357,Its Morbing Time :dogestronk:,1689271268.0,False,False,False,False,False
23,14yuhet,oddlyterrifying,/r/oddlyterrifying/comments/14yuhet/poor_matthew/,smoothloam,Poor Matthew,3826,0.99,101,,1689277615.0,False,False,False,False,False
24,14yskye,formuladank,/r/formuladank/comments/14yskye/just_a_reminder_who_the_actual_scientifically/,ExactCollege3,"Just a reminder who the actual scientifically proven best driver is, in equal machinery",4752,0.97,189,BWOAHHHHHHH ,1689273162.0,False,False,False,False,False
25,14ykrp7,meirl,/r/meirl/comments/14ykrp7/me_irl/,Sonic_the_hedgedog,me_irl,36443,0.94,583,,1689254555.0,False,False,False,False,False
26,14ywkvb,politics,/r/politics/comments/14ywkvb/house_ethics_committee_revives_matt_gaetz_sex/,elisart,House Ethics Committee Revives Matt Gaetz Sex Misconduct Probe,2783,0.99,114,,1689282516.0,False,False,False,False,False
27,14ystxa,Instagramreality,/r/Instagramreality/comments/14ystxa/popular_models_real_face_shows_up_for_12_second/,br0ck,Popular model's real face shows up for 1/2 second?,4175,0.94,377,,1689273773.0,False,False,False,False,False
28,14yr9ge,funny,/r/funny/comments/14yr9ge/roy_wood_jr_on_street_fighter/,angryadobo77,"Roy Wood, Jr. on Street Fighter.",4973,0.97,87,,1689270097.0,False,False,False,False,False
29,14yqm8q,tifu,/r/tifu/comments/14yqm8q/tifu_by_sleeping_with_my_hr_manager/,desperatewatcher,TIFU by sleeping with my HR manager,5741,0.9,742,,1689268545.0,True,1689274309.0,False,False,False
30,14ylygu,worldnews,/r/worldnews/comments/14ylygu/ioc_does_not_plan_to_invite_russia_and_belarus_to/,MagnificentCat,IOC does not plan to invite Russia and Belarus to Olympics-2024,11157,0.95,479,,1689257495.0,False,False,False,False,False
31,14ytv8q,NoStupidQuestions,/r/NoStupidQuestions/comments/14ytv8q/what_does_it_mean_when_people_from_canada_and_us/,NibbleMyRectum,What does it mean when people from Canada and US say chamungus in meetings?,3489,0.95,1002,,1689276170.0,False,False,False,False,False
32,14yrog4,ChatGPT,/r/ChatGPT/comments/14yrog4/vp_product_openai/,HOLUPREDICTIONS,VP Product @OpenAI,4611,0.94,575,:SpinAI:,1689271092.0,False,False,False,False,False
33,14ynhpk,TheLastAirbender,/r/TheLastAirbender/comments/14ynhpk/seems_natural_for_this_scene/,Ghdude1,Seems natural for this scene.,9658,0.94,520,,1689261180.0,False,False,False,False,False
34,14yr5ct,facepalm,/r/facepalm/comments/14yr5ct/wtf/,OutrageusCorner,Wtf 🤦🏾,25410,0.89,5322,,1689269831.0,False,False,False,False,False
35,14ynv4d,movies,/r/movies/comments/14ynv4d/disney_pulling_back_on_making_marvel_star_wars/,KillerCroc1234567,"Disney pulling back on making Marvel, Star Wars content, Iger says",7501,0.95,1915,,1689262070.0,False,False,False,False,False
36,14ynf69,NonPoliticalTwitter,/r/NonPoliticalTwitter/comments/14ynf69/seems_legit/,steepattraction,Seems Legit,8879,0.95,105,:blue1::blue2::1111::1112:,1689261008.0,False,False,False,False,False
37,14yklyf,PoliticalHumor,/r/PoliticalHumor/comments/14yklyf/almost_got_me/,Right_Treat691,Almost got me,13505,0.95,290,,1689254152.0,False,False,False,False,False
38,14ypix6,NatureIsFuckingLit,/r/NatureIsFuckingLit/comments/14ypix6/this_little_cougar_cub_is_so_proud_of_its_mom/,Molly107,🔥 This little cougar cub is so proud of its mom.,5584,0.95,48,:paw-prints:,1689265962.0,False,False,False,False,False
39,14ymw55,PrequelMemes,/r/PrequelMemes/comments/14ymw55/his_ship_got_blown_up_in_order_66/,ukiloi,His ship got blown up in Order 66,10253,0.96,315,,1689259772.0,False,False,False,False,False
40,14yjuss,gaming,/r/gaming/comments/14yjuss/2007_a_little_game_called_halo_3_came_out_i_met_a/,THATwasSMART210,"2007 a little game called “Halo 3” came out, I met a guy online who became one of my first gamer friends. 16 years later we got to meet IRL. Tx to PA",19316,0.91,581,,1689252193.0,False,False,False,False,False
41,14ynlq3,WTF,/r/WTF/comments/14ynlq3/car_pool/,JackFunk,Car pool,7226,0.96,354,,1689261455.0,False,False,False,False,False
42,14yt4si,Unexpected,/r/Unexpected/comments/14yt4si/on_todays_episode_of_what_happens_next/,MyNameGifOreilly,On today's episode of what happens next...,3392,0.95,367,Yo what?,1689274489.0,False,False,False,False,False
43,14ynws4,Tinder,/r/Tinder/comments/14ynws4/first_message_i_dont_hate_it/,Femme_Royale,First message… I don’t hate it,6408,0.96,329,,1689262180.0,False,False,False,False,False
44,14yr1mq,lotrmemes,/r/lotrmemes/comments/14yr1mq/its_rough_out_here_being_from_the_late_1900s/,VetraVex_,It’s rough out here being from the late 1900’s.,4137,0.97,114,,1689269590.0,False,False,False,False,False
45,14yt0et,Damnthatsinteresting,/r/Damnthatsinteresting/comments/14yt0et/man_finds_a_bear_at_his_window/,RealRock_n_Rolla,Man finds a bear at his window,7764,0.98,537,,1689274210.0,False,False,False,False,False
46,14yswe4,therewasanattempt,/r/therewasanattempt/comments/14yswe4/to_open_a_glass_door/,11stainless11,to open a glass door,3221,0.98,416,,1689273938.0,False,False,False,False,False
47,14ywflu,JustGuysBeingDudes,/r/JustGuysBeingDudes/comments/14ywflu/hello_there/,mo_aly1907,Hello there,2067,0.98,39,,1689282180.0,False,False,False,False,False
48,14yt6n1,tumblr,/r/tumblr/comments/14yt6n1/never_forget/,SaraAnnabelle,Never forget,3032,0.99,19,,1689274609.0,False,False,False,False,False
49,14yrx4q,NotHowGirlsWork,/r/NotHowGirlsWork/comments/14yrx4q/little_girl_sits_on_a_table_clearly_asking_for_it/,Balarezok2,Little girl… sits on a table. Clearly asking for it,3447,0.97,294,,1689271616.0,False,False,False,False,False
50,14ynaij,tattoos,/r/tattoos/comments/14ynaij/my_dad_passed_away_a_month_ago_got_his_tattoo_by/,livlev420,My dad passed away a month ago.. got his tattoo! by Patrick at Shapeworld in NYC,6309,0.95,214,,1689260693.0,False,False,False,False,False
51,14ymbev,OldSchoolCool,/r/OldSchoolCool/comments/14ymbev/taiwanese_frogmen_during_the_second_taiwan/,hyperchimpchallenger,Taiwanese frogmen during the Second Taiwan Straight Crisis in 1958. Rocking some Rolex Submarines,7001,0.97,288,,1689258368.0,False,False,False,False,False
52,14yke7m,shitposting,/r/shitposting/comments/14yke7m/what_a_godly_way_to_meet_god_glory_to_spez/,Notafuqin_Carrot211,What a godly way to meet god (glory to spez),18357,0.96,160,We do a little trolling :snoo_trollface:,1689253609.0,False,False,False,False,False
53,14yt5cw,marvelmemes,/r/marvelmemes/comments/14yt5cw/lol/,Heidixoxo1,Lol,2854,0.96,53,Aunt May,1689274525.0,False,False,False,False,False
54,14ypo6a,WorkReform,/r/WorkReform/comments/14ypo6a/asking_for_fair_compensation_is_not_being/,north_canadian_ice,Asking for fair compensation is NoT bEiNg ReAliStIc according to Disney CEO Bob Iger (who makes $25 million a year),4228,0.97,209,💸 National Rent Control,1689266315.0,False,False,False,False,False
55,14yuuhm,pcmasterrace,/r/pcmasterrace/comments/14yuuhm/its_probably_horrible_for_my_pc_to_let_her_sleep/,prahl_hp,It’s probably horrible for my pc to let her sleep on it but i don’t have the heart to move her,2249,0.96,178,,1689278519.0,False,False,False,False,False
56,14yoqx8,WhitePeopleTwitter,/r/WhitePeopleTwitter/comments/14yoqx8/disney_ceo_bob_iger_thinks_writers_and_actors/,TommyShelbyPFB,"Disney CEO Bob Iger thinks writers and actors strike is ""very disturbing"" and they are not being ""realistic""",12982,0.98,337,,1689264150.0,False,False,False,False,False
57,14ykwmr,HolUp,/r/HolUp/comments/14ykwmr/wait_what_did_i_just_do/,No-Alfalfa2412,Wait.. what did i just do...?,15923,0.85,421,,1689254904.0,False,False,False,False,False
58,14yqw3o,Eldenring,/r/Eldenring/comments/14yqw3o/rune_bear_insta_kill/,JolynJarrett,Rune Bear insta kill,3580,0.98,117,,1689269226.0,False,False,False,False,False
59,14yp76a,pettyrevenge,/r/pettyrevenge/comments/14yp76a/i_spent_5000_to_inconvenience_and_embarrass_a/,Outrageous_Rise,"I spent $5,000+ to inconvenience and embarrass a competitor who treated me like crap. It was worth it.",4383,0.94,207,,1689265213.0,False,False,False,False,False
60,14yv3xg,Superstonk,/r/Superstonk/comments/14yv3xg/i_cant_hear_you_closed_with_190_mil_volume_drs/,edgar510,I CAN'T HEAR YOU: Closed with 1.90 Mil Volume!! 🟣🟣🟣🟣***DRS***🟣🟣🟣🟣,2374,0.95,65,👂 I CAN'T HEAR YOU 👂 - Wen Volume,1689279134.0,False,False,False,False,False
61,14yu2ho,doordash,/r/doordash/comments/14yu2ho/caught_red_handed/,tatted_gamer_666,Caught red handed 😂,2308,0.99,116,,1689276641.0,False,False,False,False,False
62,14yrame,oddlysatisfying,/r/oddlysatisfying/comments/14yrame/deadening_removal_using_dry_ice/,PZK3759,Deadening removal using dry ice,3242,0.97,55,,1689270178.0,False,False,False,False,False
63,14ysg40,CrazyFuckingVideos,/r/CrazyFuckingVideos/comments/14ysg40/this_is_where_your_carboat_battery_goes_when_its/,Johnsnoz,This is where your car/boat battery goes when it's recycles,2830,0.96,418,,1689272846.0,False,False,False,False,False
64,14yhzls,2meirl4meirl,/r/2meirl4meirl/comments/14yhzls/2meirl4meirl/,idlystep,2meirl4meirl,33784,0.95,389,,1689246884.0,False,False,False,False,False
65,14yhtrw,funnyvideos,/r/funnyvideos/comments/14yhtrw/just_a_tiktok_dumb_video_pt2/,HelMort,Just a TikTok dumb video pt2,23688,0.95,301,,1689246381.0,False,False,False,False,False
66,14ymui7,nextfuckinglevel,/r/nextfuckinglevel/comments/14ymui7/rescue_the_goat_stuck_with_asphalt_after_3_days/,CPReals,Rescue the goat stuck with asphalt after 3 days.,28631,0.94,969,,1689259656.0,False,False,False,False,False
67,14yowux,iamatotalpieceofshit,/r/iamatotalpieceofshit/comments/14yowux/plastic_surgeon_who_livestreamed_procedures_on/,s_y_s_t_e_m_i_c_,Plastic surgeon who live-streamed procedures on TikTok banned from practicing medicine in Ohio. Three former patients suffered severe complications & needed intense medical care after she operated on them.,4277,0.97,171,,1689264533.0,True,False,False,False,False
68,14yr8vv,MemeVideos,/r/MemeVideos/comments/14yr8vv/technique/,Select-Water-9655,Technique 💯,3327,0.97,46,,1689270063.0,False,False,False,False,False
69,14yhfzq,BrandNewSentence,/r/BrandNewSentence/comments/14yhfzq/what_a_time_to_be_alive/,almonakinvader,What a time to be alive,28899,0.96,471,,1689245173.0,False,False,False,False,False
70,14ypxcb,NoahGetTheBoat,/r/NoahGetTheBoat/comments/14ypxcb/let_the_waters_rise/,brosb4hoes666,Let the waters rise......,3939,0.9,347,,1689266909.0,False,False,False,False,False
71,14yipax,SipsTea,/r/SipsTea/comments/14yipax/he_pulled_a_sneaky_one_on_the_weather_forecast/,Own_Transition4095,He pulled a sneaky one on the weather forecast,14132,0.97,200,,1689248966.0,False,False,False,True,False
72,14yqocv,wallstreetbets,/r/wallstreetbets/comments/14yqocv/275m_day_just_hit_my_10m_goal/,Fausterion18,"+$2.75m day, just hit my $10m goal",3435,0.88,893,NASDAQ's #1 Fan,1689268697.0,False,False,True,False,False
73,14ynyob,StupidFood,/r/StupidFood/comments/14ynyob/hey_japan_and_italy_greetings_from_brazil/,ZacaBR,"Hey Japan and Italy, greetings from Brazil.",5002,0.89,764,,1689262296.0,False,False,False,False,False
74,14ys4dq,wholesomememes,/r/wholesomememes/comments/14ys4dq/it_makes_me_feel_so_much_better/,NewParticularz,It makes me feel so much better.,2721,0.98,37,,1689272089.0,False,False,False,False,False
75,14yriin,deadbydaylight,/r/deadbydaylight/comments/14yriin/thoughts_on_this_idea_twitter_post_from_gorejira/,juliacorco,thoughts on this idea? twitter post from gorejira,2903,0.96,446,:FLAGL: demodog :FLAGL:,1689270701.0,False,False,False,False,False
76,14ypm4d,UkraineWarVideoReport,/r/UkraineWarVideoReport/comments/14ypm4d/ukraine_will_legalise_cannabis_to_help_war/,TheTelegraph,Ukraine will legalise cannabis to help war wounded cope with trauma,3563,0.97,226,Official Source,1689266172.0,False,False,False,False,False
77,14yqoiu,awfuleverything,/r/awfuleverything/comments/14yqoiu/this_thing_flew_into_my_ear_and_died_deep_inside/,tiberius_danger,"This thing flew into my ear and died deep inside my ear canal. It flew in I spazzed, slapped it thought I killed it and was on the ground til 30 seconds later it started buzzing again deep inside my ear. Freaked out stuck my finger way up there and then took the last 30 minutes to get it out.",3240,0.96,170,,1689268707.0,True,False,False,False,False
78,14ytvdi,popculturechat,/r/popculturechat/comments/14ytvdi/oppenheimer_actors_walk_out_of_uk_premiere_as/,jennibeam,Oppenheimer actors walk out of UK premiere as Hollywood stars join writer strike,2088,0.98,103,,1689276179.0,False,False,False,False,False
79,14yk9ex,BeAmazed,/r/BeAmazed/comments/14yk9ex/better_story_than_the_mcu_best_7_minute_spent/,OppoDobbo,"Better story than the MCU, best 7 minute spent.. maybe",10445,0.91,355,,1689253282.0,False,False,False,False,False
80,14yrdeq,TwoSentenceHorror,/r/TwoSentenceHorror/comments/14yrdeq/take_off_your_shoes_before_coming_in_said_the_man/,Olmecareflexa,"""Take off your shoes before coming in,"" said the man after greeting me at the door.",2933,0.96,79,,1689270357.0,False,False,False,False,False
81,14yjb3p,ProgrammerHumor,/r/ProgrammerHumor/comments/14yjb3p/intruderlol/,Strange_Dragonfly964,intruderLol,10057,0.97,75,:py:,1689250678.0,False,False,False,False,False
82,14ylmln,Funnymemes,/r/Funnymemes/comments/14ylmln/crawling_in_my_skin_these_wounds_they_will_not/,Proof-Oil-7716,"“Crawling in my skin, these wounds they will not heal”",7028,0.92,3760,,1689256707.0,False,False,False,False,False
83,14ykwny,sadcringe,/r/sadcringe/comments/14ykwny/glad_or_sad/,ScientifiK_SaucE_314,Glad or sad,7878,0.94,192,,1689254907.0,False,False,False,False,False
84,14yrv8l,AITAH,/r/AITAH/comments/14yrv8l/aitah_for_kicking_out_a_pregnant_lady_from_my/,Fearlessdog123,AITAH For Kicking Out a Pregnant Lady From My Birthday Party?,2607,0.96,664,,1689271499.0,False,False,False,False,False
85,14ytqbu,whenthe,/r/whenthe/comments/14ytqbu/why_does_this_always_happen/,DN-838,Why does this always happen?,2139,0.99,70,,1689275858.0,False,False,False,False,False
86,14ysujy,ImTheMainCharacter,/r/ImTheMainCharacter/comments/14ysujy/wholesome_main_character/,InitialChad,Wholesome main character,2222,0.96,58,,1689273817.0,False,False,False,False,False
87,14yunu2,h3h3productions,/r/h3h3productions/comments/14yunu2/its_happening/,Effective-Impress-10,“It’s happening”,1791,0.98,104,,1689278088.0,False,False,False,False,False
88,14yxc4t,hockey,/r/hockey/comments/14yxc4t/strang_news_scottsdale_police_department_has/,nobokov22,"[Strang] NEWS: Scottsdale Police Department has confirmed to The Athletic that Alex Galchenyuk was arrested on July 9 on a number of charges including private property hit and run, disorderly conduct, failure to obey, resisting arrest, Threatening or Intimidating",1272,0.98,456,MTL - NHL :61707:,1689284349.0,False,False,False,False,False
89,14yiftm,BlackPeopleTwitter,/r/BlackPeopleTwitter/comments/14yiftm/bought_and_paid_for/,districtcourt,Bought and paid for,10911,0.9,692,,1689248210.0,False,False,False,False,False
90,14yp3ds,Overwatch,/r/Overwatch/comments/14yp3ds/she_never_saw_it_coming/,NotMitchu,She never saw it coming 💀,3566,0.97,114,Pixel Torbjörn,1689264956.0,False,False,False,False,False
91,14yua4u,AskReddit,/r/AskReddit/comments/14yua4u/should_a_man_shave_his_balls_or_not_and_why/,SuspectingCarl,"Should a man shave his balls or not, and why?",1846,0.9,1562,,1689277129.0,True,False,False,False,False
92,14yun7e,TrueOffMyChest,/r/TrueOffMyChest/comments/14yun7e/i_just_found_out_i_saved_a_rapists_life/,20Keller12,I just found out I saved a rapists life,1715,0.96,90,,1689278047.0,True,1689291579.0,False,False,False
93,14yl83g,ContagiousLaughter,/r/ContagiousLaughter/comments/14yl83g/news_anchors_fail_to_contain_laughter_what_do_you/,em-dot,"News anchors fail to contain laughter, ""what do you think goes wrong in your relationships?""",5846,0.97,95,,1689255699.0,False,False,False,False,False
94,14yly0g,clevercomebacks,/r/clevercomebacks/comments/14yly0g/delete_your_comment/,fortebe,Delete your comment.,5225,0.96,147,,1689257469.0,False,False,False,False,False
95,14yhwu8,LateStageCapitalism,/r/LateStageCapitalism/comments/14yhwu8/it_was_always_about_control/,HankScorpio42,It was always about control,10233,0.97,209,,1689246652.0,False,False,False,False,False
96,14yqbwd,TwoHotTakes,/r/TwoHotTakes/comments/14yqbwd/i_got_my_best_friend_arrested_and_his_dog_put/,throwRAgatekeepgirl,I got my best friend arrested and his dog put down. It was ‘justified’ but I feel awful.,2904,0.92,518,,1689267826.0,False,False,False,False,False
97,14yjrqo,maybemaybemaybe,/r/maybemaybemaybe/comments/14yjrqo/maybe_maybe_maybe/,Consistent_Smile6292,Maybe maybe maybe,10011,0.89,768,,1689251974.0,False,False,False,False,False
98,14yn4my,HonkaiStarRail,/r/HonkaiStarRail/comments/14yn4my/caelus_and_his_very_normal_friends_chatting_on/,AsaCocoPeko,Caelus and his very normal friends chatting on Whats App,4834,0.93,174,All Hail the Master Diviner :Fuxuan:,1689260330.0,False,False,False,False,False
99,14ynroy,Hololive,/r/Hololive/comments/14ynroy/this_is_how_achan_looks_without_glasses/,MalkynRei78,This is how A-chan looks without glasses,4139,0.96,73,,1689261844.0,False,False,False,False,False
100,14ysi5f,calvinandhobbes,/r/calvinandhobbes/comments/14ysi5f/poor_calvin/,damagedgoodz99824,Poor Calvin,2088,0.98,155,,1689272992.0,False,False,False,False,False
