rank,id,subreddit,permalink,author,title,score,upvote_ratio,num_comments,author_flair_text,created_utc,over_18,edited,stickied,locked,is_original_content
1,14ijd92,todayilearned,/r/todayilearned/comments/14ijd92/til_that_sigourney_weaver_only_earned_35000_for/,Make_the_music_stop,"TIL that Sigourney Weaver only earned $35,000 for Alien (1979) but got $1,000,000 and a share of the profits for Aliens (1986)",8158,0.97,314,,1687690510.0,False,False,False,False,False
2,14ihykp,HolUp,/r/HolUp/comments/14ihykp/dude_wtf/,esberat,"Dude, wtf...",7132,0.96,487,:zfg1::zfg2::zfg3::zfg4:,1687685454.0,False,False,False,False,False
3,14iepeb,WhitePeopleTwitter,/r/WhitePeopleTwitter/comments/14iepeb/the_new_predator_movie_just_dropped/,rhodesleadnowhere,The new predator movie just dropped,16364,0.93,754,,1687673916.0,False,False,False,False,False
4,14ih308,facepalm,/r/facepalm/comments/14ih308/society_explained_in_29_seconds/,stiffspectacls,Society explained in 29 seconds,7727,0.98,247,,1687682331.0,False,False,False,False,False
5,14ifj46,shitposting,/r/shitposting/comments/14ifj46/glory_to_spez/,ligma-joe,Glory to Spez,10354,0.96,114,,1687676793.0,False,False,False,False,False
6,14icv54,antiwork,/r/antiwork/comments/14icv54/and_this_is_why_there_is_a_rush_to_get_us_back_in/,Vdaniels1,And this is why there is a rush to get us back in the office,13897,0.95,1165,,1687667684.0,False,False,False,False,False
7,14iifo7,PoliticalHumor,/r/PoliticalHumor/comments/14iifo7/this_all_makes_a_little_more_sense_now/,UnlimitedDuck,This all makes a little more sense now,3594,0.96,210,,1687687196.0,False,False,False,False,False
8,14ie2lj,memes,/r/memes/comments/14ie2lj/ghost_of_medieval_tsushima/,big-daddy-virgin,Ghost of Medieval Tsushima,14653,0.95,147,,1687671717.0,False,False,False,False,False
9,14ifpzi,AnimalsBeingDerps,/r/AnimalsBeingDerps/comments/14ifpzi/baby_camel_wants_to_nurse/,jemahAeo,Baby camel wants to nurse,6048,0.97,75,,1687677483.0,False,False,False,False,False
10,14idjrl,BeAmazed,/r/BeAmazed/comments/14idjrl/amazing_octopus_stretching_its_tentacles_to_form/,XahidX,Amazing Octopus stretching its tentacles to form a huge balloon,10304,0.97,317,,1687669967.0,False,False,False,False,False
11,14id129,funny,/r/funny/comments/14id129/shaq_pancake_art/,FlippinArtDude,Shaq pancake art,10348,0.94,128,,1687668234.0,False,False,False,False,False
12,14ih1ec,technology,/r/technology/comments/14ih1ec/american_tiktok_user_data_stored_in_china_video/,callmeteji,"American TikTok user data stored in China, video app admits",4019,0.93,436,,1687682170.0,False,False,False,False,False
13,14ibzrf,PrequelMemes,/r/PrequelMemes/comments/14ibzrf/sucks_that_we_are_on_ewansposting_instead_of/,nickonreddit123,Sucks that we are on ewansposting instead of businesses as usual.,26453,0.91,195,,1687664862.0,False,False,False,False,False
14,14id1l7,NonPoliticalTwitter,/r/NonPoliticalTwitter/comments/14id1l7/how_true_is_this/,lhomme21,How true is this,10222,0.94,467,:blue1::blue2::1111::1112:,1687668289.0,False,False,False,False,False
15,14idvya,TikTokCringe,/r/TikTokCringe/comments/14idvya/stone_fish_venom/,Sylas1987,Stone fish venom,8142,0.96,469,,1687671104.0,False,False,False,False,False
16,14ijb9v,oddlysatisfying,/r/oddlysatisfying/comments/14ijb9v/worker_neatly_painting_text_on_the_road/,yourSAS,Worker neatly painting text on the road,2623,0.96,104,,1687690304.0,False,False,False,False,False
17,14ijqw3,AmItheAsshole,/r/AmItheAsshole/comments/14ijqw3/aita_for_giving_back_everything_my_family_bought/,Free-Scallion-2274,AITA for giving back everything my family bought for my son?,2179,0.97,459,,1687691794.0,False,False,False,False,False
18,14icqia,worldnews,/r/worldnews/comments/14icqia/canadians_will_no_longer_have_access_to_news/,N2929,"Canadians will no longer have access to news content on Facebook and Instagram, Meta says",8367,0.97,619,,1687667279.0,False,False,False,False,False
19,14ihh22,starterpacks,/r/starterpacks/comments/14ihh22/getting_the_flu_within_your_first_two_weeks_of/,confidentmilktoast,“Getting the flu within your first two weeks of starting a new job” Starter Pack.,3105,0.96,140,,1687683710.0,False,False,False,False,False
20,14ibqfj,dankmemes,/r/dankmemes/comments/14ibqfj/fuck_this_shit_show/,thetruememeisbest,fuck this shit show,15263,0.96,196,:nu:☣️,1687664024.0,False,False,False,False,False
21,14ibngc,news,/r/news/comments/14ibngc/south_carolina_fire_chief_who_pointed_gun_at/,Molire,South Carolina fire chief who pointed gun at teens who turned in his driveway is being sued,10114,0.97,360,,1687663762.0,False,False,False,False,False
22,14if1na,TwoXChromosomes,/r/TwoXChromosomes/comments/14if1na/update_my_husband_left_me_at_the_hospital_after/,back2backjon,UPDATE My husband left me at the hospital after stillbirth,4659,0.91,300,,1687675091.0,False,1687675454.0,False,False,False
23,14ie1xe,lotrmemes,/r/lotrmemes/comments/14ie1xe/one_does_not_simply_assume_a_game_is_a_cash_grab/,BJ_Beamz,One does not simply assume a game is a cash grab,5917,0.95,204,Grond,1687671656.0,False,False,False,False,False
24,14i8s1q,Damnthatsinteresting,/r/Damnthatsinteresting/comments/14i8s1q/what_happens_when_you_throw_an_apple_from_an/,ledim35,What happens when you throw an apple from an offshore oil rig,62184,0.92,1542,,1687654922.0,False,False,False,False,False
25,14idq5f,clevercomebacks,/r/clevercomebacks/comments/14idq5f/stealing_is_wrong/,Evermoreunlive52,Stealing is wrong?,5960,0.97,48,,1687670572.0,False,False,False,False,False
26,14i9t97,ContagiousLaughter,/r/ContagiousLaughter/comments/14i9t97/its_on/,Cholai_214,It's on ,21690,0.92,663,,1687658016.0,False,False,False,False,False
27,14iaau6,meirl,/r/meirl/comments/14iaau6/me_irl/,RogalikYT,Me irl,15873,0.96,206,,1687659508.0,False,False,False,False,False
28,14i9cd2,gaming,/r/gaming/comments/14i9cd2/good_or_bad_games_it_doesnt_matter_i_have_massive/,Modo97,"Good or bad games? it doesn't matter, I have massive respect for games that still support Split-Screen ❤️",23586,0.91,826,,1687656612.0,False,False,False,False,False
29,14iguum,NatureIsFuckingLit,/r/NatureIsFuckingLit/comments/14iguum/furcifer_pardalis_commonly_known_as_the_panther/,therra123,"🔥 Furcifer pardalis, commonly known as the panther chameleon, is primarily found in eastern and northern regions of Madagascar",2943,0.97,68,,1687681519.0,False,False,False,False,False
30,14iasvz,RandomThoughts,/r/RandomThoughts/comments/14iasvz/do_u_ever_feel_kinda_compelled_to_write_ur/,chesnutpraline,do u ever feel kinda compelled to write ur opinion in a comment but then get kinda tired while writing it and give up after deciding u dont really care enough in the moment to comment and erase it?,11525,0.92,1391,,1687661058.0,False,False,False,False,False
31,14ib9x3,comics,/r/comics/comments/14ib9x3/napsoc/,Sleepy-wun,Naps…[OC],9380,0.95,88,,1687662542.0,False,False,False,False,False
32,14ijn99,politics,/r/politics/comments/14ijn99/why_the_right_is_so_terrified_of_woke_there_are/,Picture-unrelated,Why the right is so terrified of “woke”: There are truths it just can’t face — Conservatives didn’t want to hear about white privilege. So they abandoned reality and joined the orange man’s cult,1708,0.89,221,:flag-or: Oregon,1687691445.0,False,False,False,False,False
33,14ii258,ich_iel,/r/ich_iel/comments/14ii258/ich_iel/,hypefor8wasjustabait,ich_iel,2147,0.96,72,,1687685809.0,True,False,False,False,False
34,14ibf9l,cats,/r/cats/comments/14ibf9l/can_someone_explain_to_me_why_my_cat_will_just/,takeaabreath,Can someone explain to me why my cat will just sit and stare at me for minutes at a time? What does this mean in a cat’s world?,8114,0.98,692,,1687663019.0,False,False,False,False,False
35,14iawpv,oddlyterrifying,/r/oddlyterrifying/comments/14iawpv/pet_king_cobra_gets_angry_at_owner/,RIPStengel,Pet king cobra gets angry at owner.,10671,0.94,488,,1687661397.0,False,False,False,False,False
36,14ibsi7,PublicFreakout,/r/PublicFreakout/comments/14ibsi7/man_wielding_some_kind_of_massive_blade_almost/,NextRace6,Man Wielding Some Kind of Massive Blade Almost Finds Out During Road Rage in Texas,6959,0.98,504,,1687664221.0,False,False,False,False,False
37,14ijqjl,therewasanattempt,/r/therewasanattempt/comments/14ijqjl/to_hang_out/,VariousBasket125,To hang out ,1542,0.94,581,This is a flair,1687691762.0,False,False,False,False,False
38,14i83ko,mildlyinfuriating,/r/mildlyinfuriating/comments/14i83ko/roofers_picked_all_my_fruit/,Bayareathrifted,Roofers picked all my fruit,27809,0.93,1981,,1687652877.0,False,False,False,False,False
39,14i8cnl,wallstreetbets,/r/wallstreetbets/comments/14i8cnl/found_my_new_side_hustle/,rylar,found my new side hustle,15988,0.95,240,Supports a 🅱️arfield Ethnostate :Barfield:,1687653638.0,False,False,False,False,False
40,14igorp,BikiniBottomTwitter,/r/BikiniBottomTwitter/comments/14igorp/this_is_so_true/,BeautifulSwan00,This is so true,2520,0.98,16,,1687680918.0,False,False,False,False,False
41,14igtsr,nextfuckinglevel,/r/nextfuckinglevel/comments/14igtsr/artist_creating_perspective_art/,Siil_Udus,Artist creating perspective art,2477,0.96,45,,1687681411.0,False,False,False,False,False
42,14id7jw,Superstonk,/r/Superstonk/comments/14id7jw/why_i_love_this_company/,GinoF2020,Why I love this company,5652,0.92,128,,1687668859.0,False,False,False,False,False
43,14ic6sh,HumansBeingBros,/r/HumansBeingBros/comments/14ic6sh/a_spooked_horse_found_itself_stuck_in_a_swimming/,alanboston,A spooked horse found itself stuck in a swimming pool in Florida. The county's fire rescue team jumped into action,5932,0.94,219,,1687665508.0,False,False,False,False,False
44,14ibjba,Weird,/r/Weird/comments/14ibjba/opened_a_can_of_peaches_and_they_were_black_and/,Elly_frog,opened a can of peaches and they were black and smelt like fish??,7047,0.92,1718,,1687663376.0,False,False,False,False,False
45,14i7i01,MadeMeSmile,/r/MadeMeSmile/comments/14i7i01/helping_mommy/,IkilledRichieWhelan,Helping Mommy,44353,0.91,474,,1687651171.0,False,False,False,False,False
46,14i7iu6,space,/r/space/comments/14i7iu6/i_grew_up_amazed_by_the_famous_pillars_of/,theillini19,I grew up amazed by the famous Pillars of Creation photo of the Hubble Space Telescope. I never imagined I would one day be able to capture this nebula from my backyard.,15186,0.96,199,,1687651234.0,False,False,False,False,False
47,14ih3ce,HumansAreMetal,/r/HumansAreMetal/comments/14ih3ce/theresa_kachindamoto_saving_the_children/,bislut997,Theresa Kachindamoto saving the children,2123,0.94,31,,1687682365.0,False,False,False,False,False
48,14ig1sw,marvelmemes,/r/marvelmemes/comments/14ig1sw/that_would_have_been_legendary/,SavoryAvarice,That would have been LEGENDARY,2508,0.96,19,Avengers,1687678678.0,False,False,False,False,False
49,14ihbjv,MemePiece,/r/MemePiece/comments/14ihbjv/bruhhh/,LuckyUnification,Bruhhh,1900,0.97,69,,1687683178.0,False,False,False,False,False
50,14iamye,technicallythetruth,/r/technicallythetruth/comments/14iamye/it_does_indeed_look_just_like_ahem_a_quarter_note/,LucidCunning,It does indeed look just like... *ahem...* a quarter note.,7759,0.95,225,,1687660550.0,False,False,False,False,False
51,14ifz75,natureismetal,/r/natureismetal/comments/14ifz75/in_finland_temperature_gets_as_low_as_40c_in/,bislut997,"In Finland temperature gets as low as -40C in winter, the trees are covered in so much snow and frost that it looks like landscape from another planet",2380,0.96,70,,1687678430.0,False,False,False,False,False
52,14id4ee,UpliftingNews,/r/UpliftingNews/comments/14id4ee/most_unionized_us_rail_workers_now_have_new_sick/,Karmanacht,Most unionized US rail workers now have new sick leave,3940,0.96,153,,1687668559.0,False,False,False,False,False
53,14igawl,Animemes,/r/Animemes/comments/14igawl/netflix_one_piece_new_cast_reveal/,SmokingBouquets,Netflix One Piece new cast reveal,2230,0.96,45,,1687679591.0,False,False,False,False,False
54,14iatn6,HyruleEngineering,/r/HyruleEngineering/comments/14iatn6/thatll_be_250k_please/,itsbildo,That'll be $250k please,5877,0.94,131,,1687661122.0,False,False,False,False,False
55,14i6wnc,OldSchoolCool,/r/OldSchoolCool/comments/14i6wnc/one_of_my_friend_groups_from_high_school_class_of/,dustin91,"One of my friend groups from high school, class of ‘87 (pic from ‘88 or ‘89)",14516,0.94,721,,1687649487.0,False,False,False,False,False
56,14i994d,ukraine,/r/ukraine/comments/14i994d/least_year_russian_occupiers_kidnapped_16yo/,ibloodylovecider,"Least year, russian occupiers kidnapped 16yo Tigran Oganesyan and his friend. Today, they took revenge, two Russians occupiers in the Russian-occupied city of Berdyanskwete killed. This video was recorded before the teens were killed in a shoot-out with the police. RIP heroes that were too young 🌻",7800,0.94,221,UK,1687656341.0,True,False,False,False,False
57,14i6eo3,quityourbullshit,/r/quityourbullshit/comments/14i6eo3/the_reddit_admins_believe_that_this_sub_is_for/,Devonmartino,"The Reddit admins believe that this sub is for them, not ordinary Redditors, and we are happy to oblige: From now on, all QYBS posts must be related to lies/BS about Reddit, Reddit Inc., its admins, and related topics.",21716,0.84,967,Source: I made it up,1687648142.0,False,1687648383.0,True,False,False
58,14idjlv,ThatsInsane,/r/ThatsInsane/comments/14idjlv/stone_fish_venom/,Sylas1987,Stone fish venom,3398,0.96,125,,1687669949.0,False,False,False,False,False
59,14ihtj9,ireland,/r/ireland/comments/14ihtj9/have_you_already_watch_philomena_cunk_lol/,XCEREALXKILLERX,Have you already watch Philomena Cunk? Lol,1488,0.94,147,Dublin,1687684932.0,False,False,False,False,False
60,14igrdy,formuladank,/r/formuladank/comments/14igrdy/ive_made_my_choice/,Siffilus23,I've made my choice,1798,0.96,31,“It’s called a motor race. We went car racing”,1687681182.0,False,False,False,False,False
61,14igs3u,MemeVideos,/r/MemeVideos/comments/14igs3u/_/,Naymar083,🧊️ 👍,1839,0.96,34,,1687681249.0,False,False,False,False,False
62,14i8ag8,TedLasso,/r/TedLasso/comments/14i8ag8/id_like_to_think_all_of_our_lives_changed_after/,fn_bot17,I’d like to think all of our lives changed after Ted Lasso,8280,0.92,338,,1687653444.0,False,False,False,False,False
63,14ib4q8,Satisfyingasfuck,/r/Satisfyingasfuck/comments/14ib4q8/this_automatically_adjusting_oxygen_mask_for/,EducationalAeries,This automatically adjusting oxygen mask for pilots,4938,0.96,113,,1687662087.0,False,False,False,False,False
64,14iinyz,HermanCainAward,/r/HermanCainAward/comments/14iinyz/someone_please_make_it_make_sense/,HotPinkLollyWimple,Someone please make it make sense,1179,0.97,84,Phucked around and Phound out,1687687997.0,False,False,False,False,False
65,14iavsq,baseball,/r/baseball/comments/14iavsq/david_fletcher_hr_makes_it_230_angels_in_the_4th/,TVloverCam,DAVID FLETCHER HR MAKES IT 23-0 ANGELS IN THE 4TH!!,4702,0.95,459,Los Angeles Angels :laa1:,1687661313.0,False,False,False,False,False
66,14idf5g,NotHowGirlsWork,/r/NotHowGirlsWork/comments/14idf5g/this_sub_made_me_feel_really_well/,mankyox,This sub made me feel really well,3078,0.95,211,,1687669546.0,False,False,False,False,False
67,14ig2yb,FunnyandSad,/r/FunnyandSad/comments/14ig2yb/uber_is_a_better_choice/,CuteAngryGirl,Uber is a better choice,1821,0.96,71,,1687678795.0,False,False,False,False,False
68,14iftk5,meme,/r/meme/comments/14iftk5/dont_lie/,ScorpLeo102,Don’t lie.,1950,0.89,185,,1687677842.0,False,False,False,False,False
69,14iho3b,Hololive,/r/Hololive/comments/14iho3b/rack_to_the_future/,V-Faction,Rack to the Future,1372,0.97,21,:AkiRose::Amelia::Nene::Polka::Haato:,1687684384.0,False,False,False,False,False
70,14ic2fe,Grimdank,/r/Grimdank/comments/14ic2fe/the_fire_of_vulcan_burns_brothers/,YaGrimboi,The fire of Vulcan burns brothers,3872,0.96,157,,1687665099.0,False,False,False,False,False
71,14igtie,facepalm,/r/facepalm/comments/14igtie/this_is_pretty_ridiculous/,LomaReddy,This is pretty ridiculous,5159,0.94,293,,1687681382.0,False,False,False,False,False
72,14ibnv2,PeterExplainsTheJoke,/r/PeterExplainsTheJoke/comments/14ibnv2/petah_i_dont_drink_alcohol/,IslamLover69,Petah I don’t drink alcohol,4125,0.94,149,,1687663800.0,False,False,False,False,False
73,14ihj8l,memes,/r/memes/comments/14ihj8l/been_doing_that_since_medieval_times/,haloqueenxo,Been doing that since medieval times,4776,0.97,86,,1687683913.0,False,False,False,False,False
74,14iaqhi,Genshin_Impact,/r/Genshin_Impact/comments/14iaqhi/the_perfect_transition_of_71_characters_by/,soulsilk524,The Perfect Transition of 71 Characters by MMOJACKX57 YT,5116,0.93,99,,1687660857.0,False,False,False,False,False
75,14i90a1,nursing,/r/nursing/comments/14i90a1/anyone_hiring/,Frosty-Fact21,Anyone hiring?,5874,0.95,301,"BSN, RN 🍕",1687655629.0,False,False,False,False,False
76,14ih98r,ImTheMainCharacter,/r/ImTheMainCharacter/comments/14ih98r/yeah_lets_just_be_thr_most_annoying_people_at_the/,Snake_Plissken224,"Yeah, let's just be thr most annoying people at the home depot....",1378,0.9,190,,1687682946.0,False,False,False,False,False
77,14i9aey,WTF,/r/WTF/comments/14i9aey/uhh_wtf_is_this/,Full_Guava_4780,Uhh wtf is this,5707,0.94,898,,1687656444.0,False,False,False,False,False
78,14idr7b,anime_irl,/r/anime_irl/comments/14idr7b/anime_irl/,NeVMmz,anime_irl,2609,0.96,34,,1687670675.0,False,False,False,False,False
79,14i5twb,HydroHomies,/r/HydroHomies/comments/14i5twb/not_a_hydrohomie/,happyfuckincakeday,Not a Hydrohomie,13424,0.94,739,,1687646544.0,False,False,False,False,False
80,14iedba,ClashRoyale,/r/ClashRoyale/comments/14iedba/this_is_a_joke_right_what_has_supercell_become/,Max_SteeI,This is a joke right? What has supercell become?,2257,0.96,104,,1687672793.0,False,False,False,False,False
81,14iez5a,aww,/r/aww/comments/14iez5a/the_way_my_cat_gets_into_the_narrowest_place_in/,marehori,The way my cat gets into the narrowest place in the house (with John's reaction) [OC],2001,0.93,33,,1687674851.0,False,False,False,False,True
82,14igzb3,sweden,/r/sweden/comments/14igzb3/tuffa_förhandlingar_på_blocket/,spiderpigbegins,Tuffa förhandlingar på Blocket,1345,0.96,77,Sverige,1687681961.0,False,False,False,False,False
83,14i6y0l,AnarchyChess,/r/AnarchyChess/comments/14i6y0l/no_idea_how_this_is_still_happening_but_id_this/,Not_a_trowaway12323,"No idea how this is still happening, but I'd this post gets 65,536 comments I'll post again with double the amount of demented horses",13839,0.8,12999,:cutehorse:,1687649589.0,False,False,False,False,False
84,14i9iqp,inthenews,/r/inthenews/comments/14i9iqp/rfk_jr_lashes_out_at_rolling_stone_after_article/,lucerousb,RFK Jr. Lashes Out at Rolling Stone After Article Shows GOP Link to Presidential Run: ‘Establishment Propaganda’,4931,0.94,594,,1687657142.0,False,False,False,False,False
85,14i6i11,conservativeterrorism,/r/conservativeterrorism/comments/14i6i11/the_enemy_within_as_this_anti_american_gorilla_is/,waxjammer,The enemy within as this Anti American gorilla is essentially undermining our intelligence and CIA with reckless disregard for our national security interests.,8512,0.92,630,,1687648397.0,False,False,False,False,False
86,14idt6s,soccercirclejerk,/r/soccercirclejerk/comments/14idt6s/football_is_back/,AwepHS,Football is back,2331,0.97,66,,1687670856.0,False,False,False,False,False
87,14ij9l0,CombatFootage,/r/CombatFootage/comments/14ij9l0/translated_disbandment_of_the_57th_motorized/,CatsofUkraine,Translated: Disbandment of the 57th motorized rifle brigade of the Russian Federation. The publication of some details of yesterday's operation Go-Pro video of soldiers of the 1st company of the 1st mechanized battalion of the Third Assault Brigade.,866,0.96,63,,1687690146.0,False,False,False,False,False
88,14i3oy1,agedlikemilk,/r/agedlikemilk/comments/14i3oy1/3200_year_old_cheese_found_in_an_egyptian_tomb/,ChanceryTheRapper,3200 year old cheese found in an Egyptian tomb,29879,0.93,1421,,1687640930.0,False,False,False,False,False
89,14iaqgj,Breath_of_the_Wild,/r/Breath_of_the_Wild/comments/14iaqgj/just_got_my_copy_of_botw_signed_by_zelda_can/,PlatypusGuy613,Just got my copy of BOTW signed by Zelda. Can anyone translate the hylian she wrote?,4124,0.96,143,,1687660855.0,False,False,False,False,False
90,14i6k1y,Eyebleach,/r/Eyebleach/comments/14i6k1y/scribble_is_getting_so_big/,Starchscreech,Scribble is getting so big!,8527,0.97,104,,1687648552.0,False,False,False,False,False
91,14iilft,UkraineWarVideoReport,/r/UkraineWarVideoReport/comments/14iilft/the_russian_army_special_unit_storm_z_which/,CatsofUkraine,"The Russian Army special unit ""Storm Z,"" which supported Wagner Group CEO Prigozhin in yesterday's attempted coup d'état against Russian President Vladimir Putin, is a little dismayed that Prigozhin abandoned them.",960,0.98,111,,1687687746.0,False,False,False,False,False
92,14iit9t,science,/r/science/comments/14iit9t/men_who_perform_just_a_few_minutes_of_strenuous/,Wagamaga,"Men who perform just a few minutes of strenuous exercise are more likely to feel aroused than those who do not work out. Heightened physical responses to exercise, such as elevated heart rate and breathing, lend themselves to an even greater physical response to sexual stimuli.",930,0.95,33,,1687688520.0,False,False,False,False,False
93,14i28oi,JustGuysBeingDudes,/r/JustGuysBeingDudes/comments/14i28oi/saving_an_owl/,pun420,Saving an Owl,34865,0.96,525,,1687637172.0,False,False,False,False,False
94,14i61nh,tumblr,/r/tumblr/comments/14i61nh/whats_your_fave/,Justthisdudeyaknow,What's your fave?,10720,0.92,294,,1687647142.0,False,False,False,False,False
95,14ijmpe,autism,/r/autism/comments/14ijmpe/saw_this_on_twitter/,Technical_Poem_6411,saw this on twitter,741,0.95,114,,1687691393.0,False,False,False,False,False
96,14ifgv3,Overwatch,/r/Overwatch/comments/14ifgv3/intentional_or_unintentional_design/,TylerOfTrades,Intentional or Unintentional Design?,1558,0.97,51,:Brigitte: Brigitte,1687676594.0,False,False,False,False,False
97,14i2tqd,BrandNewSentence,/r/BrandNewSentence/comments/14i2tqd/if_you_whacked_me_with_a_ford_explorer/,Fr3nchT0astCrunch,If you whacked me with a Ford Explorer,24086,0.96,231,,1687638703.0,False,False,False,False,False
98,14i9tgh,nba,/r/nba/comments/14i9tgh/victor_wembanyama_couldnt_ask_for_better_role/,krypto_the_husk,[Victor Wembanyama] Couldn’t ask for better role models 🖤,4007,0.96,510,:mia-2: [MIA] Duncan Robinson,1687658035.0,False,1687666013.0,False,False,False
99,14ibyo6,TaylorSwift,/r/TaylorSwift/comments/14ibyo6/taylor_urged_fans_during_tonights_acoustic_set/,baeeeee91,"Taylor urged fans during tonight’s acoustic set, not to bully anyone online ahead of Speak Now’s release.",2772,0.91,550,":midnights: Ask me why so many fade, but I’m still here",1687664768.0,False,False,False,False,False
100,14i3y42,MurderedByWords,/r/MurderedByWords/comments/14i3y42/very_accurate_description/,cyaron12,very accurate description,13938,0.95,240,,1687641568.0,False,False,False,False,False
