rank,id,subreddit,permalink,author,title,score,upvote_ratio,num_comments,author_flair_text,created_utc,over_18,edited,stickied,locked,is_original_content
1,14xx2ij,therewasanattempt,/r/therewasanattempt/comments/14xx2ij/to_enjoy_paris_vacation/,Sufficient-Bug-9112,to enjoy Paris vacation ,10472,0.94,951,,1689187675.0,False,False,False,False,False
2,14xukym,mildlyinfuriating,/r/mildlyinfuriating/comments/14xukym/the_running_hot_water_from_my_550night_paris/,JonBoy82,The running hot water from my $550/night Paris Hotel Room. 🇫🇷🔥🇫🇷,9847,0.95,1633,,1689181976.0,False,False,False,False,False
3,14xrjwz,MadeMeSmile,/r/MadeMeSmile/comments/14xrjwz/shes_in_her_happy_place/,mindyour,She's in her happy place.,15577,0.97,147,,1689175332.0,False,False,False,False,False
4,14xu3pb,Unexpected,/r/Unexpected/comments/14xu3pb/tattoo_cover_up/,VariousBasket125,Tattoo cover up,9830,0.94,387,,1689180916.0,False,False,False,False,False
5,14xu786,Damnthatsinteresting,/r/Damnthatsinteresting/comments/14xu786/scuba_divers_pinged_by_sonar_from_a_far_away_ship/,coyotepetersun,Scuba divers pinged by sonar from a far away ship,8536,0.98,394,,1689181144.0,False,False,False,False,False
6,14xq044,BrandNewSentence,/r/BrandNewSentence/comments/14xq044/the_whole_sentence/,almonakinvader,The whole sentence,20538,0.96,294,,1689171811.0,False,False,False,False,False
7,14xpnaj,WhitePeopleTwitter,/r/WhitePeopleTwitter/comments/14xpnaj/threatening_to_defend_themselves_i_thought_that/,neiono,Threatening to defend themselves. I thought that was an all American god given right?,20614,0.95,906,,1689170979.0,False,False,False,False,False
8,14xp4eo,facepalm,/r/facepalm/comments/14xp4eo/shots_fired/,IanAgate,Shots fired!,27309,0.87,1115,,1689169754.0,False,False,False,False,False
9,14xqio9,funny,/r/funny/comments/14xqio9/what_the_heck_is_happening/,kurisusam,What the heck is happening 🤔😕,11027,0.9,2434,,1689173006.0,False,False,False,False,False
10,14xxo6a,WTF,/r/WTF/comments/14xxo6a/just_making_out/,Steevo_no_jackass,Just making out,3397,0.93,331,,1689189025.0,False,False,False,False,False
11,14xrjp9,rareinsults,/r/rareinsults/comments/14xrjp9/man_just_birthed_a_baby_leave_him_alone/,TRICCSLIG,"Man just birthed a baby, leave him alone.",10114,0.89,873,,1689175316.0,False,False,False,False,False
12,14xs7z3,wholesomememes,/r/wholesomememes/comments/14xs7z3/i_choose_you/,Signku,I choose you.,6955,0.98,141,,1689176810.0,False,False,False,False,False
13,14xqclq,AskReddit,/r/AskReddit/comments/14xqclq/americans_of_reddit_what_places_in_america_should/,AMGBOI69420,"Americans of Reddit, what places in America should foreigners avoid at all cost?",8575,0.91,13461,,1689172629.0,False,False,False,False,False
14,14xw0gr,clevercomebacks,/r/clevercomebacks/comments/14xw0gr/guess_he_missed_the_foot_job_video/,OlivierLeighton,Guess he missed the foot job video 😏,3836,0.95,221,,1689185222.0,False,False,False,False,False
15,14xtd91,gaming,/r/gaming/comments/14xtd91/just_to_clear_up_any_confusion/,TheUndeadGunslinger,Just to clear up any confusion,5158,0.93,588,PC,1689179290.0,False,False,False,False,False
16,14xvhon,worldnews,/r/worldnews/comments/14xvhon/italian_uproar_over_judges_10second_groping_rule/,I-Am-Uncreative,Italian uproar over judge's 10-second groping rule,3719,0.96,502,,1689184057.0,False,False,False,False,False
17,14xnfmv,TikTokCringe,/r/TikTokCringe/comments/14xnfmv/worst_ad_ever/,Independent_Ad_8179,Worst ad ever?,20032,0.9,1490,,1689165492.0,False,False,False,False,False
18,14xope6,iamatotalpieceofshit,/r/iamatotalpieceofshit/comments/14xope6/landlord_i_didnt_have_to_increase_the_rent_but_i/,Ola366,"Landlord: ""I didn't have to increase the rent but I did it anyway. 🤭""",12306,0.85,3194,,1689168718.0,False,False,False,False,False
19,14xlnhs,politics,/r/politics/comments/14xlnhs/lawyers_with_supreme_court_business_paid_clarence/,dronesclubmember,Lawyers with supreme court business paid Clarence Thomas aide via Venmo,20853,0.96,945,:flag-gb: United Kingdom,1689160660.0,False,False,False,False,False
20,14xs1kl,antiwork,/r/antiwork/comments/14xs1kl/educator_with_15_years_experience_waited_20/,Wytch78,Educator with 15 years experience. Waited 20 minutes for an interview. Got up and left.,5632,0.95,499,White Trash,1689176431.0,False,1689193034.0,False,False,False
21,14xqx39,memes,/r/memes/comments/14xqx39/this_template_is_the_perfect_embodiment_of_the/,mutelyFlank,This template is the perfect embodiment of the situation,8314,0.96,363,,1689173926.0,False,False,False,False,False
22,14xm11q,marvelmemes,/r/marvelmemes/comments/14xm11q/dudes_still_playing_the_role_after_23_years/,GAMMAGREEN62,Dude's still playing the role after 23 years 🫡...,20578,0.96,659,Avengers,1689161702.0,False,False,False,False,False
23,14xs7tm,StarWars,/r/StarWars/comments/14xs7tm/andor_is_nominated_for_best_drama_series_at_the/,jsun31,Andor is nominated for Best Drama Series at the 2023 Emmys,4812,0.97,222,Cassian Andor,1689176799.0,False,False,False,False,False
24,14xmzdb,movies,/r/movies/comments/14xmzdb/steven_spielberg_predicted_the_current_implosion/,TommyShelbyPFB,Steven Spielberg predicted the current implosion of large budget films due to ticket prices 10 years ago,11818,0.93,2895,,1689164293.0,False,False,False,False,False
25,14xp50d,oddlysatisfying,/r/oddlysatisfying/comments/14xp50d/skating_in_medellin/,MethodicaL51,Skating in Medellin,8299,0.94,294,,1689169798.0,False,False,False,False,False
26,14xp2n1,tumblr,/r/tumblr/comments/14xp2n1/i_hate_riddles/,Sonic_the_hedgedog,I Hate Riddles,9264,0.98,66,,1689169629.0,False,False,False,False,False
27,14xqq61,PeterExplainsTheJoke,/r/PeterExplainsTheJoke/comments/14xqq61/petah_what_does_the_japanese_mean/,SamExpert,Petah what does the Japanese mean,6503,0.96,123,,1689173472.0,False,False,False,False,False
28,14xmsck,lotrmemes,/r/lotrmemes/comments/14xmsck/fool_of_a_took/,Haunting_Abalone_398,Fool of a took!,13039,0.97,118,,1689163790.0,False,False,False,False,False
29,14xl3ww,meirl,/r/meirl/comments/14xl3ww/meirl/,Signal-Top1208,MEIRL,24506,0.98,390,,1689159147.0,False,False,False,False,False
30,14xlw4o,news,/r/news/comments/14xlw4o/tax_prep_companies_shared_private_taxpayer_data/,shoecat,"Tax prep companies shared private taxpayer data with Google and Meta for years, congressional probe finds",12436,0.97,477,,1689161335.0,False,False,False,False,False
31,14xryjv,wholesomegreentext,/r/wholesomegreentext/comments/14xryjv/anon_on_being_called_a_fat_loser/,ActiveEagles,Anon on being called a fat loser.,4747,0.97,51,,1689176242.0,False,False,False,False,False
32,14xl7b8,dankmemes,/r/dankmemes/comments/14xl7b8/you_lied_grandma/,MahmoudAO,You lied grandma,22720,0.97,192,,1689159431.0,False,False,False,False,False
33,14xlvra,comics,/r/comics/comments/14xlvra/things_i_never_had_as_a_kid/,NonRock,Things I Never Had as a Kid,11365,0.97,111,Hot Paper Comics,1689161304.0,False,False,False,False,False
34,14xl5ft,nextfuckinglevel,/r/nextfuckinglevel/comments/14xl5ft/imagine_being_so_good_at_basketball_when_you_lose/,NathanWelsh,Imagine being so good at basketball when you lose your dribble you assume it's the court.,45324,0.8,1402,,1689159277.0,False,False,False,False,False
35,14xs95p,PublicFreakout,/r/PublicFreakout/comments/14xs95p/landlord_cuts_through_tenants_front_door_with_a/,elimars,Landlord cuts through tenant’s front door with a circular saw,3957,0.97,463,,1689176876.0,False,False,False,False,False
36,14xuny8,SelfAwarewolves,/r/SelfAwarewolves/comments/14xuny8/bruh/,tiptiptoppy,Bruh,2768,0.98,120,,1689182163.0,False,False,False,False,False
37,14xnpfm,AnimalsBeingDerps,/r/AnimalsBeingDerps/comments/14xnpfm/wants_to_snuggle/,nihonlights,Wants to snuggle,7182,0.97,91,,1689166218.0,False,False,False,False,False
38,14xm6wy,shitposting,/r/shitposting/comments/14xm6wy/aint_no_wayheil_spez/,pastoul,Ain't no way💀(heil spez),18897,0.93,222,,1689162160.0,False,False,False,False,False
39,14xip9e,todayilearned,/r/todayilearned/comments/14xip9e/til_about_albert_severin_roche_a_distinguished/,Huge_Buddy_2216,"TIL about Albert Severin Roche, a distinguished French soldier who was found sleeping during duty and sentenced to death for it. A messenger arrived right before his execution and told the true story: Albert had crawled 10 hours under fire to rescue his captain and then collapsed from exhaustion.",37164,0.96,837,,1689151878.0,False,False,False,False,False
40,14xrr53,Showerthoughts,/r/Showerthoughts/comments/14xrr53/we_pay_taxes_on_money_we_make_taxes_on_money_we/,wolf805,"We pay taxes on money we make, taxes on money we spend, and taxes on things we own, that we already paid taxes on, with already taxed money.",3723,0.9,568,,1689175805.0,False,False,False,False,False
41,14xlj4i,BlackPeopleTwitter,/r/BlackPeopleTwitter/comments/14xlj4i/bros_gonna_die/,HomerFerns,Bro's gonna die,9908,0.95,406,,1689160322.0,False,False,False,False,False
42,14xqf6x,AITAH,/r/AITAH/comments/14xqf6x/aita_for_divorcing_my_41f_husband_43m_to_pursue/,Throwawaymelk,AITA for divorcing my (41F) husband ( 43M) to pursue my dreams?,4929,0.76,6863,,1689172793.0,False,False,False,False,False
43,14xo1jx,doordash,/r/doordash/comments/14xo1jx/is_it_just_me_or_are_all_doordash_drivers/,brbhcham,Is it just me or are all DoorDash drivers starting to do this?,6279,0.92,2819,,1689167041.0,False,False,False,False,False
44,14xsp9n,AnimalsBeingBros,/r/AnimalsBeingBros/comments/14xsp9n/sometimes_all_you_need_is_a_hug/,westcoastcdn19,Sometimes all you need is a hug ,3165,0.97,25,,1689177839.0,False,False,False,False,False
45,14xltjh,MapPorn,/r/MapPorn/comments/14xltjh/the_most_dangerous_cities_in_the_us/,giuliomagnifico,The Most Dangerous Cities in the U.S.,9911,0.9,3104,,1689161131.0,False,False,False,False,False
46,14xl5h1,NonPoliticalTwitter,/r/NonPoliticalTwitter/comments/14xl5h1/its_universally_applicable/,avtomoo,It's universally applicable...,10841,0.97,328,:blue1::blue2::1111::1112:,1689159280.0,False,False,False,False,False
47,14xnox5,WhitePeopleTwitter,/r/WhitePeopleTwitter/comments/14xnox5/child_marriage_now_illegal_in_michigan/,FalconLynx13,Child marriage now illegal in Michigan,32184,0.97,1263,,1689166184.0,False,False,False,False,False
48,14xq4tr,Whatcouldgowrong,/r/Whatcouldgowrong/comments/14xq4tr/climbing_up_a_windmill/,uchman365,Climbing up a windmill,4363,0.97,162,,1689172121.0,False,False,False,False,False
49,14xmfbk,PoliticalHumor,/r/PoliticalHumor/comments/14xmfbk/freedumb/,ChewyRib,Freedumb,7338,0.93,438,,1689162839.0,False,False,False,False,False
50,14xqbj0,PrequelMemes,/r/PrequelMemes/comments/14xqbj0/yea_you_create_a_paradox/,mulezi,Yea you create a paradox.,4421,0.95,113,,1689172557.0,False,False,False,False,False
51,14xkf4k,JustGuysBeingDudes,/r/JustGuysBeingDudes/comments/14xkf4k/its_mandatory/,Chubby-Coxx,It's mandatory,14780,0.94,486,,1689157062.0,False,False,False,False,False
52,14xw13a,me_irlgbt,/r/me_irlgbt/comments/14xw13a/she_irlgbt/,MahouShoujoDysphoria,She_irlgbt,2063,0.99,47,:gq:Environmental Storytelling Moderator💀,1689185263.0,False,False,False,False,False
53,14xl1k1,ThatsInsane,/r/ThatsInsane/comments/14xl1k1/couple_upset_that_their_cat_likes_the_neighbors/,uchman365,Couple Upset That Their Cat Likes The Neighbors,10655,0.95,1629,,1689158965.0,False,False,False,False,False
54,14xpf9x,LateStageCapitalism,/r/LateStageCapitalism/comments/14xpf9x/people_losing_their_homes_is_a_cruel_but/,haloarh,"People losing their homes is a ""cruel but necessary evil.""",4399,0.98,242,,1689170478.0,False,False,False,False,False
55,14xmf39,NoStupidQuestions,/r/NoStupidQuestions/comments/14xmf39/employee_is_very_open_about_the_fact_that_she_is/,LeeParkerMarvin,"Employee is very open about the fact that she is out getting a boob job today. She has been talking for weeks about how much she is lookign forward to it. What do I say when she returns? Am I supposed to say, ""nice boobs,"" or would that be sexual harassment and I should say nothing?",7442,0.92,1679,,1689162817.0,True,False,False,False,False
56,14xvzzx,Breath_of_the_Wild,/r/Breath_of_the_Wild/comments/14xvzzx/i_know_these_are_called_combat_training_but_still/,Morderca_Bidej,"I know these are called ""combat training"" but still are lame imo",2005,0.93,90,,1689185189.0,False,False,False,False,False
57,14xsp3c,lgbt,/r/lgbt/comments/14xsp3c/we_got_married/,Bipolarslut-,We got married! 🥰,2855,0.97,76,:nb-lesbian: Non-Binary Lesbian,1689177826.0,False,False,False,False,False
58,14xnoqa,TrueOffMyChest,/r/TrueOffMyChest/comments/14xnoqa/ive_realised_my_wife_is_a_predator/,throwaway3837276,I've realised my wife is a predator,5883,0.91,875,,1689166172.0,False,1689171992.0,False,False,False
59,14xkf94,PewdiepieSubmissions,/r/PewdiepieSubmissions/comments/14xkf94/110723_welcome_björn/,bobduncanswerve7,11/07/23 - Welcome Björn,33784,0.81,959,:FWP1:,1689157076.0,False,False,True,False,False
60,14xn6m7,SipsTea,/r/SipsTea/comments/14xn6m7/what_do_you_think/,nihonlights,What do you think?,6709,0.95,529,,1689164823.0,False,False,False,False,False
61,14xoic4,NatureIsFuckingLit,/r/NatureIsFuckingLit/comments/14xoic4/a_close_encounter_with_a_juvenile_humpback_whale/,purple-circle,"🔥 A close encounter with a juvenile humpback whale in Coral Bay, Western Australia",4656,0.97,89,,1689168232.0,False,False,False,False,False
62,14xx8mm,oddlyterrifying,/r/oddlyterrifying/comments/14xx8mm/partially_submerged_statue_of_shiva_the_destroyer/,lonely_dude__,Partially submerged statue of shiva the destroyer during the flash flood in uttrakhand.,1632,0.97,31,,1689188067.0,False,False,False,False,False
63,14xu5nd,Damnthatsinteresting,/r/Damnthatsinteresting/comments/14xu5nd/ship_loses_anchor_during_drop/,rco888,Ship loses anchor during drop,5780,0.97,358,,1689181041.0,False,False,False,False,False
64,14xnu3g,LeopardsAteMyFace,/r/LeopardsAteMyFace/comments/14xnu3g/russian_propagandists_making_an_antiukrainian/,Ebibako,"Russian propagandists making an anti-Ukrainian, anti-LGBT film staged a fake 'gay parade' in Moscow with Ukrainian and rainbow flags. Unfortunately they forgot to notify the authorities and were denounced to the police by outraged citizens, leading to an investigation.",4958,0.97,171,,1689166553.0,False,False,False,False,False
65,14xq70t,ukraine,/r/ukraine/comments/14xq70t/biden_to_zelensky_bad_new_for_you_were_not_going/,IgorVozMkUA,"Biden to Zelensky: Bad new for you: we're not going anywhere, you're stuck with us, thank you... (check out Zelensky's reaction)",3692,0.96,254,:Verified: Verified,1689172265.0,False,False,False,False,False
66,14xpjxk,JeffArcuri,/r/JeffArcuri/comments/14xpjxk/king_cobra/,Smartastic,King cobra,3884,0.94,109,The Short King,1689170756.0,False,False,False,False,False
67,14xr6jo,facepalm,/r/facepalm/comments/14xr6jo/thats_what_you_guys_do/,StraightCauses,That's what you guys do.,10044,0.96,525,,1689174492.0,False,False,False,False,False
68,14xojhz,MadeMeSmile,/r/MadeMeSmile/comments/14xojhz/remember_to_compliment_other_mens_lawns/,alanboston,Remember to compliment other men’s lawns,16113,0.93,414,,1689168320.0,False,False,False,False,False
69,14xorav,aww,/r/aww/comments/14xorav/oc_i_told_him_he_looks_handsome/,LilacHuckleberry56,[OC] I told him he looks handsome ☺️,4267,0.94,68,,1689168847.0,False,False,False,False,False
70,14xpgrn,therewasanattempt,/r/therewasanattempt/comments/14xpgrn/to_avoid_the_kid/,HornyDiggler,to avoid the kid ,13398,0.94,1434,Therewasanattemp,1689170561.0,False,False,False,False,False
71,14xrgap,inthenews,/r/inthenews/comments/14xrgap/farmers_insurance_becomes_fourth_insurer_to_pull/,BugOperator,"Farmers Insurance becomes fourth insurer to pull out of Florida, roughly 100,000 policies to be terminated",2973,0.98,420,,1689175107.0,False,False,False,False,False
72,14xqdem,Tinder,/r/Tinder/comments/14xqdem/guy_i_knew_was_new_to_online_dating_and_lets_just/,Taylorenokson,"Guy I knew was new to online dating, and let's just say it was a steep learning curve.",3426,0.95,753,,1689172679.0,False,False,False,False,False
73,14xmjar,technology,/r/technology/comments/14xmjar/harmful_content_should_not_be_promoted_via_social/,WhoIsJolyonWest,"‘Harmful’ content should not be promoted via social media algorithms, peers say",5825,0.9,863,,1689163162.0,False,False,False,False,False
74,14xkwhi,madlads,/r/madlads/comments/14xkwhi/dogeball/,RoidedStoic,dogeball,9119,0.95,137,Official Playboi Carti,1689158547.0,False,False,False,False,False
75,14xrqfh,AbruptChaos,/r/AbruptChaos/comments/14xrqfh/bear_doesnt_recognize_itself_in_a_mirror/,Scaulbylausis,Bear doesn’t recognize itself in a mirror,2777,0.96,154,,1689175759.0,False,False,False,False,False
76,14xnwck,Eldenring,/r/Eldenring/comments/14xnwck/just_for_a_laugh_heres_14_boss_kills_in_less_than/,jdyhrberg,"Just for a Laugh, here's 14 boss kills in less than 3 minutes:",4852,0.96,292,AKA - Sax Slave Gael  :platinum:,1689166710.0,False,False,False,False,False
77,14xo2lg,technicallythetruth,/r/technicallythetruth/comments/14xo2lg/true_to_the_word_cheesburger/,Spider_Bite5248,true to the word cheesburger,4757,0.98,170,,1689167114.0,False,False,False,False,False
78,14xil1z,cats,/r/cats/comments/14xil1z/this_is_the_only_way_oliver_drinks_ive_tried/,Snytbaggen,"This is the only way Oliver drinks. I've tried fountains, different bowl sizes, materials, but he only accepts the spray bottle",15905,0.97,665,,1689151518.0,False,False,False,False,False
79,14xnu6y,HonkaiStarRail,/r/HonkaiStarRail/comments/14xnu6y/stelle_in_trouble_by_himehinghoi/,asilvertintedrose,Stelle in trouble (by @HimeHinghoi),4749,0.96,85,,1689166559.0,False,False,False,False,False
80,14xpbm1,Hololive,/r/Hololive/comments/14xpbm1/sleep_paralysis_towa/,mungobiko,Sleep Paralysis Towa,3826,0.96,72,:Gura:,1689170246.0,False,False,False,False,False
81,14xpu7h,nba,/r/nba/comments/14xpu7h/howard_beck_you_dont_need_free_agency_falk_said/,lopea182,"[Howard Beck] “You don't need free agency,” Falk said, “because these teams, the minute the guy says `I don't want to be on the team,’ they accommodate him.” He added, “I think it's terrible.”",3336,0.94,885,:mia-2: Heat,1689171428.0,False,False,False,False,False
82,14xo0cu,ContagiousLaughter,/r/ContagiousLaughter/comments/14xo0cu/that_must_hurt/,LaughBakery,That must hurt,4250,0.95,54,,1689166959.0,False,False,False,False,False
83,14xptgj,fixedbytheduet,/r/fixedbytheduet/comments/14xptgj/free_my_boy_he_aint_do_nothing_wrong/,girolski07,"Free my boy, he ain't do nothing wrong.",3230,0.97,71,,1689171378.0,False,False,False,False,False
84,14xvz9t,Fauxmoi,/r/Fauxmoi/comments/14xvz9t/margot_robbie_is_enchanted_evening_barbie_at/,invis2020,Margot Robbie is Enchanted Evening Barbie at London premiere ✨,1546,0.95,183,,1689185142.0,False,False,False,False,False
85,14xq3t9,CrazyFuckingVideos,/r/CrazyFuckingVideos/comments/14xq3t9/the_dildo_of_consequence_rarely_arrives_lubed/,carebearstarefear,The dildo of consequence rarely arrives lubed.,3119,0.93,131,,1689172051.0,False,False,False,False,False
86,14xvm1d,memes,/r/memes/comments/14xvm1d/my_poor_hawaiian_rolls/,KBlake1982,My poor Hawaiian rolls,3811,0.99,92,Lives in a Van Down by the River,1689184340.0,False,False,False,False,False
87,14xpz8q,CuratedTumblr,/r/CuratedTumblr/comments/14xpz8q/the_alpha_and_omega_of_fanfiction/,AscendedDragonSage,The Alpha and Omega of Fanfiction,3102,0.96,99,,1689171751.0,False,False,False,False,False
88,14xvoh9,popculturechat,/r/popculturechat/comments/14xvoh9/barbie_european_premier_pink_carpet/,amomentintimebro,Barbie European Premier Pink Carpet,1544,0.96,299,,1689184502.0,False,False,False,False,False
89,14xjvwb,formuladank,/r/formuladank/comments/14xjvwb/toto_is_collecting_fired_drivers_like_thanos/,CalAcacian,Toto is collecting fired drivers like Thanos,9102,0.97,341, • WELL • DONE • BAKU •,1689155470.0,False,False,False,False,False
90,14xm33n,whenthe,/r/whenthe/comments/14xm33n/grrrr_i_hate_hidden_gems/,SirShadyVI,grrrr i hate hidden gems,6776,0.94,380,local touhou poster (moriya shrine's #1 conspirator),1689161854.0,False,False,False,False,False
91,14xmzk4,dadjokes,/r/dadjokes/comments/14xmzk4/ive_been_building_my_comment_karma_for_the_sole/,CnH2nplus2islife,I've been building my comment karma for the sole reason of posting this dad joke.,4532,0.95,113,,1689164305.0,False,1689169215.0,False,False,False
92,14xtjm8,ufc,/r/ufc/comments/14xtjm8/respectful_asf/,_brightsidesuicide_,Respectful asf.,1924,0.98,252,,1689179683.0,False,False,False,False,False
93,14xqq2f,wholesomememes,/r/wholesomememes/comments/14xqq2f/wholesome_short_round/,agilesinki,Wholesome short round.,6989,0.99,70,,1689173466.0,False,False,False,False,False
94,14xj4zi,ireland,/r/ireland/comments/14xj4zi/man_injures_himself_trying_to_burn_a_tricolour/,scubasteve254,Man injures himself trying to burn a tricolour.,10350,0.94,1715,,1689153140.0,False,False,False,False,False
95,14xnsb2,HolUp,/r/HolUp/comments/14xnsb2/the_taste_test/,Meta-Johnny,The taste test,4303,0.96,53,,1689166424.0,False,False,False,False,False
96,14xttdw,Nbamemes,/r/Nbamemes/comments/14xttdw/someone_find_this_man_a_new_super_team/,AdorableHeron808,Someone find this man a new super team,1844,0.95,237,,1689180279.0,False,False,False,False,False
97,14xm7nl,OldSchoolCool,/r/OldSchoolCool/comments/14xm7nl/july_12_1979_my_brother_i_he_was_23_i_was_13_sat/,I_Only_Have_One_Hand,July 12 1979 My brother & I (He was 23 & I was 13) sat on the dugout roof at Comisky Park in Chicago & shared a joint as we watched a riot take place during Disco Demolition Night,4697,0.96,347,,1689162224.0,False,False,False,False,False
98,14xvj7t,AdviceAnimals,/r/AdviceAnimals/comments/14xvj7t/i_was_always_told_labor_was_one_of_the_highest/,DoctorBa11s,I was always told labor was one of the highest costs of running a business.,1473,0.93,167,,1689184157.0,False,False,False,False,False
99,14xlzs6,Unexpected,/r/Unexpected/comments/14xlzs6/making_tiktok_reels/,SteellaaZ,Making TikTok Reels,42454,0.88,1789,,1689161598.0,False,False,False,False,False
100,14xmh1j,MemePiece,/r/MemePiece/comments/14xmh1j/likely_story/,metalhiro,Likely story.,4840,0.95,139,,1689162976.0,False,False,False,False,False
