rank,id,subreddit,permalink,author,title,score,upvote_ratio,num_comments,author_flair_text,created_utc,over_18,edited,stickied,locked,is_original_content
1,14hvfzg,worldnews,/r/worldnews/comments/14hvfzg/wagner_group_now_just_400_km_away_from_moscow/,ledim35,Wagner Group now just 400 km away from Moscow,16592,0.97,2898,,1687619573.0,False,False,False,False,False
2,14htjva,todayilearned,/r/todayilearned/comments/14htjva/til_that_in_singapore_people_who_optout_of/,LunaSinclaire,"TIL that in Singapore, people who opt-out of donating their organs are put on a lower priority to receive an organ transplant than those who did not opt-out.",19751,0.96,969,,1687614516.0,False,False,False,False,False
3,14ht3fs,WhitePeopleTwitter,/r/WhitePeopleTwitter/comments/14ht3fs/the_entire_world_is_fortunate_trump_lost/,OrangeCone2011,The entire world is fortunate Trump lost,23095,0.92,696,,1687613255.0,False,False,False,False,False
4,14ht5r5,antiwork,/r/antiwork/comments/14ht5r5/ah_yesmaking_everyone_poor_so_that_society_can/,UnnaturalGeek,"Ah yes...making everyone poor so that society can function, that's how it all works right?!",16931,0.96,808,,1687613446.0,False,False,False,False,False
5,14htix8,facepalm,/r/facepalm/comments/14htix8/sounds_like_a_plan/,Comfortablejack,Sounds like a plan.,17087,0.96,1149,,1687614445.0,False,False,False,False,False
6,14hu2ob,meirl,/r/meirl/comments/14hu2ob/meirl/,immmuu,meirl,11124,0.96,656,,1687615899.0,False,False,False,False,False
7,14hvc15,Damnthatsinteresting,/r/Damnthatsinteresting/comments/14hvc15/it_is_reported_that_the_wagnerians_broke_through/,Smartercow,It is reported that the Wagnerians broke through the barricades on their way to Moscow,8051,0.98,894,Interested,1687619277.0,False,False,False,False,False
8,14hqxbo,news,/r/news/comments/14hqxbo/russian_helicopters_battle_rebel_mercenaries/,TheOnlyEn,Russian helicopters battle rebel mercenaries rolling towards Moscow,24617,0.96,2735,,1687607022.0,False,False,False,False,False
9,14hrzf0,mildlyinfuriating,/r/mildlyinfuriating/comments/14hrzf0/what_even_is_the_point_of_these_things_they_poke/,____Maximus____,What even is the point of these things? They poke into my assigned spot...,22130,0.95,4959,,1687610163.0,False,False,False,False,False
10,14hr7i7,funny,/r/funny/comments/14hr7i7/this_is_art/,Deep_Information2600,This is art.,17754,0.96,248,,1687607906.0,False,False,False,False,False
11,14hrhr8,BeAmazed,/r/BeAmazed/comments/14hrhr8/cuteness_of_burrowing_owls/,PromotionSolid8285,Cuteness of Burrowing owls 🦉,34322,0.94,857,,1687608721.0,False,False,False,False,False
12,14hs4mq,MadeMeSmile,/r/MadeMeSmile/comments/14hs4mq/these_men_just_made_history_as_the_first_people/,UnitedLab6476,These men just made history as the first people to ever graduate from Yale while incarcerated,15170,0.95,631,,1687610587.0,False,False,False,False,False
13,14hsilw,DesignPorn,/r/DesignPorn/comments/14hsilw/alzheimer_awareness_ad/,Brone9,Alzheimer Awareness Ad,11673,0.97,169,,1687611692.0,False,False,False,False,False
14,14htgyx,BrandNewSentence,/r/BrandNewSentence/comments/14htgyx/when_everythings_pimply_nothing_is/,jnljed,"When everything's pimply, nothing is",8738,0.96,207,,1687614304.0,False,False,False,False,False
15,14hqffd,memes,/r/memes/comments/14hqffd/medieval_get_rich_quick_scheme/,johnlen1n,Medieval get rich quick scheme,25374,0.95,401,:MayMayMaker: MAYMAYMAKERS :MayMayMaker:,1687605475.0,False,False,False,False,False
16,14hrogc,pics,/r/pics/comments/14hrogc/john_oliver_accusing_israel_of_being_an_apartheid/,AlainAlam,John Oliver accusing Israel of being an apartheid state,12094,0.82,765,,1687609288.0,False,False,False,True,False
17,14hptzu,technicallythetruth,/r/technicallythetruth/comments/14hptzu/aye_i_suppose_it_is/,Vass_Kallal,aye i suppose it is,32735,0.96,182,,1687603582.0,False,False,False,False,False
18,14hs1zt,politics,/r/politics/comments/14hs1zt/desantis_calls_medical_marijuana_very/,HallucinogenicFish,DeSantis calls medical marijuana 'very controversial' after fighting for it in Florida,8503,0.95,757,:flag-ga: Georgia,1687610373.0,False,False,False,False,False
19,14hskgi,cats,/r/cats/comments/14hskgi/silky_a_10_year_old_senior_cat_adopted_after/,UnitedLab6476,"Silky, a 10 year old senior cat, adopted after someone previously gave up on her after only 24 hours",7765,0.97,317,,1687611818.0,False,False,False,False,False
20,14homfg,ukraine,/r/ukraine/comments/14homfg/reaction_from_the_frontline_to_the_news_from/,TotalSpaceNut,Reaction from the frontline to the news from russia,33132,0.95,718,,1687599423.0,False,False,False,False,False
21,14hsm22,ProgrammerHumor,/r/ProgrammerHumor/comments/14hsm22/fateofthebrightestfellowfrommybatch/,smilingcarbon,fateOfTheBrightestFellowFromMyBatch,6570,0.97,156,,1687611940.0,False,False,False,False,False
22,14hop45,comics,/r/comics/comments/14hop45/unsinkable_oc/,stabbyclaus,Unsinkable [OC],20452,0.91,422,GnarlyVic,1687599691.0,False,False,False,False,True
23,14hvgoe,nba,/r/nba/comments/14hvgoe/reynolds_tim_duncan_david_robinson_sean_elliott/,Kimber80,"[Reynolds] Tim Duncan, David Robinson, Sean Elliott and Manu Ginobili had dinner with Victor Wembanyama last night after his arrival in San Antonio. Welcome, kid.",4035,0.98,367,,1687619623.0,False,False,False,False,False
24,14hpgom,movies,/r/movies/comments/14hpgom/he_made_a_mess_of_cnn_now_hes_ruining_turner/,harsh2k5,"He Made a Mess of CNN. Now He’s Ruining Turner Classic Movies Too. | David Zaslav, whose Chris Licht hire butchered CNN, is vandalizing TCM, a beloved cultural institution.",13664,0.92,818,,1687602317.0,False,False,False,False,False
25,14ht37c,oddlysatisfying,/r/oddlysatisfying/comments/14ht37c/crayon_river_table/,Gh0stDestr0y,Crayon River Table,6188,0.93,141,Flair Loading...,1687613236.0,False,False,False,False,False
26,14ho3x1,PoliticalHumor,/r/PoliticalHumor/comments/14ho3x1/get_in_line_citizen/,mac-mcgreor,"Get in line, citizen!",22924,0.94,593,,1687597592.0,False,False,True,False,False
27,14hrsrz,WhitePeopleTwitter,/r/WhitePeopleTwitter/comments/14hrsrz/and_all_without_losing_a_single_american_troop/,TrumpterOFyvie,And all without losing a single American troop - thanks Biden,35319,0.9,1435,,1687609638.0,False,False,False,False,False
28,14hpf5j,interesting,/r/interesting/comments/14hpf5j/a_girl_captures_the_moment_russian_heli_destroys/,UmarIrshad,A girl captures the moment Russian heli destroys oil depot in Voronezh to not let Wagner have control of it,14000,0.96,459,,1687602166.0,False,False,False,True,False
29,14hqntk,Whatcouldgowrong,/r/Whatcouldgowrong/comments/14hqntk/liningup_weight_lifters_in_a_row_lifting_too_much/,Calembur,Lining-Up Weight Lifters in a Row + Lifting Too Much Weight,8532,0.95,453,,1687606204.0,False,False,False,False,False
30,14hris8,clevercomebacks,/r/clevercomebacks/comments/14hris8/why_do_they_have_to_do_oscar_the_grouch_like_that/,Flip_Speed,Why do they have to do Oscar the grouch like that?,6958,0.96,99,,1687608808.0,False,False,False,False,False
31,14hs8hs,Damnthatsinteresting,/r/Damnthatsinteresting/comments/14hs8hs/dropping_a_gopro_down_from_a_cruise_ship/,Siil_Udus,Dropping a gopro down from a cruise ship,19183,0.97,441,,1687610901.0,False,False,False,False,False
32,14homvz,therewasanattempt,/r/therewasanattempt/comments/14homvz/to_land_a_f35b/,Dimitri_Ostende,To land a F-35B,15668,0.92,1192,,1687599471.0,False,False,False,False,False
33,14ho3cq,dankmemes,/r/dankmemes/comments/14ho3cq/fuck_putin/,Onetimeguy8,fuck putin,24782,0.93,408,☣️,1687597534.0,False,False,False,False,False
34,14hol74,UkraineWarVideoReport,/r/UkraineWarVideoReport/comments/14hol74/magyar_following_situation_in_russia_with_great/,tomina69,Magyar following situation in russia with great interest,11891,0.95,360,,1687599305.0,False,False,False,False,False
35,14htsgc,pcgaming,/r/pcgaming/comments/14htsgc/battlebit_remastered_is_dominating_steam_because/,Turbostrider27,BattleBit Remastered is dominating Steam because there's no catch: it's just a lot of game for $15,4113,0.95,611,,1687615162.0,False,False,False,False,False
36,14hqtnl,worldnews,/r/worldnews/comments/14hqtnl/prigozhin_says_wagner_wont_surrender_after_putins/,xperia3310,Prigozhin Says Wagner Won’t Surrender After Putin’s Address,18075,0.97,1888,,1687606706.0,False,False,False,False,False
37,14hrema,eu4,/r/eu4/comments/14hrema/guys_i_need_help_25k_pretender_rebels_captured/,VladBarbuRo,"Guys, I need help. 25k Pretender Rebels captured Moskow in my Russia Game.",6033,0.94,180,,1687608467.0,False,False,False,False,False
38,14hoy1x,shitposting,/r/shitposting/comments/14hoy1x/glory_to_spez/,Ohno_cringhe,Glory to spez,16064,0.94,259,We do a little trolling :snoo_trollface:,1687600585.0,False,False,False,False,False
39,14hnsnt,CombatFootage,/r/CombatFootage/comments/14hnsnt/russian_an26_has_been_shot_down_reportedly_by/,BlackMarine,Russian An-26 has been shot down reportedly by Wagner forces,13069,0.97,1175,,1687596504.0,False,False,False,False,False
40,14hr547,insanepeoplefacebook,/r/insanepeoplefacebook/comments/14hr547/bold_of_him_to_think_that_hell_exists_and_assume/,Kcvine,Bold of him to think that hell exists and assume that he won't be burning for all eternity.,5833,0.96,214,,1687607704.0,False,False,False,False,False
41,14hp082,CasualUK,/r/CasualUK/comments/14hp082/sainsburys_seedless_tangerine_18_seeds_18_lies/,RedditorSlug,Sainsbury's 'seedless' tangerine. 18 seeds. 18 lies.,9083,0.96,196,,1687600807.0,False,False,False,False,False
42,14hwqaz,tumblr,/r/tumblr/comments/14hwqaz/inspiring/,ReadIt-Reddit-,Inspiring?,2494,0.97,12,,1687622932.0,False,False,False,False,False
43,14hp3s0,PublicFreakout,/r/PublicFreakout/comments/14hp3s0/my_name_is_hu_mongus/,PUTINnTRUMP_arrest,“My name is HU - MONGUS”,9815,0.92,1077,,1687601095.0,False,False,False,False,False
44,14hsqmi,ContagiousLaughter,/r/ContagiousLaughter/comments/14hsqmi/thats_a_big_win_for_me/,sophisticated_kayla,That's a big win for me,4342,0.97,40,,1687612283.0,False,False,False,False,False
45,14huhxf,coolguides,/r/coolguides/comments/14huhxf/a_cool_guides_landscape_architect_here/,IndelibleDamsel,A cool Guides Landscape architect here,3162,0.92,95,,1687617048.0,False,False,False,False,False
46,14hrip2,2westerneurope4u,/r/2westerneurope4u/comments/14hrip2/can_any_luigis_out_there_explain_this_phenomenon/,Agricorps,Can any Luigis out there explain this phenomenon to me?,5201,0.93,521,:Sweden: Islam enjoyer,1687608799.0,False,False,False,False,False
47,14hq3h8,pcmasterrace,/r/pcmasterrace/comments/14hq3h8/what_8x_amd_instinct_mi200_gpus_can_do_with_a/,ProjectPhysX,"What 8x AMD Instinct MI200 GPUs can do with a combined 512GB VRAM: Bell 222 Helicopter in FluidX3D CFD - 10 Billion Cells, 75k Time Steps, 71TB vizualized - 6.4 hours compute+rendering with OpenCL",6384,0.96,353,,1687604439.0,False,False,False,False,False
48,14hptib,oddlyterrifying,/r/oddlyterrifying/comments/14hptib/the_mummified_head_of_saint_catherine_of_siena/,beefeater1987,"The mummified Head of Saint Catherine of Siena (1347-1380) on display at the Basilica of San Domenico, Siena, Italy",6824,0.96,289,,1687603538.0,False,False,False,False,False
49,14htgut,ImTheMainCharacter,/r/ImTheMainCharacter/comments/14htgut/influencers_when_there_is_public_in_public_place/,OkDoughnut1560,influencers when there is public in public place 🤯,3379,0.92,388,,1687614295.0,False,False,False,False,False
50,14hp4cy,europe,/r/europe/comments/14hp4cy/wagner_mutiny_megathread/,KvalitetstidEnsam,Wagner mutiny megathread,7102,0.94,3229,På lang slik er alt midlertidig,1687601146.0,False,1687604683.0,True,False,False
51,14hpx2t,TwoSentenceHorror,/r/TwoSentenceHorror/comments/14hpx2t/ptsd_warning/,Alpaca1061,PTSD WARNING,7391,0.89,412,,1687603866.0,False,False,False,False,False
52,14htm9h,OldSchoolCool,/r/OldSchoolCool/comments/14htm9h/my_grandpas_class_photo_from_1938_his_family/,Holybull79,"My grandpa's class photo from 1938. His family didn't have enough money for shoes, but he's still the coolest kid on the block.",3191,0.98,204,,1687614691.0,False,False,False,False,False
53,14hwfub,news,/r/news/comments/14hwfub/drunk_drivers_in_texas_who_kill_parents_of_a/,claire0,Drunk drivers in Texas who kill parents of a child will now be required to pay child support,4132,0.98,281,,1687622242.0,False,False,False,False,False
54,14ht1h4,FunnyandSad,/r/FunnyandSad/comments/14ht1h4/thats_how_you_solve_it/,LiveWithinYourMemes,That's how you solve it,3403,0.92,277,,1687613105.0,False,False,False,False,False
55,14hp78t,NonPoliticalTwitter,/r/NonPoliticalTwitter/comments/14hp78t/i_would_definitely_want_to_see/,AssignmentBrief3038,I would definitely want to see...,6623,0.95,119,:blue1::blue2::1111::1112:,1687601421.0,False,False,False,False,False
56,14hov71,MapPorn,/r/MapPorn/comments/14hov71/map_of_roadblocks_on_main_road_between_rostov_and/,Money_Astronaut9789,Map of roadblocks on main road between Rostov and Moscow,6678,0.96,350,,1687600300.0,False,False,False,False,False
57,14hqxmg,AskReddit,/r/AskReddit/comments/14hqxmg/russians_of_reddit_what_do_you_think_of_wagners/,Mindless-Bones,"Russians of Reddit, what do you think of Wagner’s rebellion?",4327,0.92,1302,,1687607049.0,False,False,False,False,False
58,14hpzrz,DunderMifflin,/r/DunderMifflin/comments/14hpzrz/idk_if_this_has_been_done_before/,E115lement,Idk if this has been done before,5156,0.95,110,,1687604110.0,False,False,False,False,False
59,14hppvx,facepalm,/r/facepalm/comments/14hppvx/if_you_make_it_to_the_olympics_you_have_far_more/,OwnDaikonz,"If you make it to the olympics, you have far more work ethic than anyone criticizing your work ethic on Facebook",18149,0.97,106,,1687603195.0,False,False,False,False,False
60,14hpncj,lotrmemes,/r/lotrmemes/comments/14hpncj/repost_but_a_classic/,kneebourobumeqs,Repost but a classic,5390,0.97,52,,1687602939.0,False,False,False,False,False
61,14hudov,BlackPeopleTwitter,/r/BlackPeopleTwitter/comments/14hudov/one_cannot_amass_such_wealth_without_exploiting/,Markual,"One cannot amass such wealth without exploiting, thieving, and killing people.",2475,0.95,90,☑️,1687616731.0,False,False,False,False,False
62,14hs0a7,apolloapp,/r/apolloapp/comments/14hs0a7/reddit_telling_blind_mods_they_will_be_replaced/,Pseudocrat,Reddit Telling Blind Mods They Will Be Replaced While Removing Crucial Tools They Need,3474,0.95,120,,1687610233.0,False,False,False,False,False
63,14hqfp2,discordVideos,/r/discordVideos/comments/14hqfp2/lets_say_hypothetically_this_is_a_title/,hugeantsinmypants,lets say hypothetically this is a title,5913,0.88,359,Haven't Payed Taxes Since 2005🤣🤣,1687605498.0,False,False,False,False,False
64,14htq3a,WorkReform,/r/WorkReform/comments/14htq3a/karen_seems_to_think_workers_deserve_to_live_in/,UnitedLab6476,Karen Seems To Think Workers Deserve To Live In Poverty,2549,0.96,143,,1687614979.0,False,False,False,False,False
65,14ht11h,diablo4,/r/diablo4/comments/14ht11h/tumor_extraction_done_time_to_focus_on_the_other/,defekT1312,"Tumor extraction done, time to focus on the other Battle.",2788,0.91,175,,1687613072.0,False,False,False,False,False
66,14htu4g,IASIP,/r/IASIP/comments/14htu4g/two_wars_in_russia/,Scooter_McLefty,TWO WARS IN RUSSIA?!,2417,0.98,45,:dennis-dart:,1687615277.0,False,False,False,False,False
67,14hpl8s,UkrainianConflict,/r/UkrainianConflict/comments/14hpl8s/putin_has_fled_moscow_apparently/,TheVioletSpy,Putin has fled Moscow apparently,4754,0.98,458,,1687602743.0,False,False,False,False,False
68,14hs5o7,nextfuckinglevel,/r/nextfuckinglevel/comments/14hs5o7/animation_vs_maths/,Mydickcandobackflips,Animation Vs Maths,3187,0.96,101,,1687610674.0,False,False,False,False,False
69,14hvbx6,ukraine,/r/ukraine/comments/14hvbx6/watching_news_with_my_friends_from_the_72nd/,jesterboyd,Watching news with my friends from the 72nd Mechanized Brigade not far from occupied Donetsk,3825,0.98,116,I am Alpharius,1687619267.0,False,False,False,False,False
70,14htjpo,funnyvideos,/r/funnyvideos/comments/14htjpo/rode_mic/,DescriptionHuge6377,Rode mic,2525,0.91,70,,1687614506.0,False,False,False,False,False
71,14hs5pt,AmItheAsshole,/r/AmItheAsshole/comments/14hs5pt/aita_for_refusing_to_do_half_oh_my_husbands_chores/,Old-Boysenberry-5631,AITA for refusing to do half oh my husband’s chores?,3107,0.94,607,,1687610678.0,False,1687610949.0,False,False,False
72,14horss,LeopardsAteMyFace,/r/LeopardsAteMyFace/comments/14horss/putin_vows_to_crush_armed_mutiny_after/,dele7ed,Putin vows to crush 'armed mutiny' after mercenaries seize southern Russian city,5422,0.97,367,,1687599963.0,False,False,False,False,False
73,14hr9s3,comics,/r/comics/comments/14hr9s3/bbq_chips/,neilkohney,BBQ Chips,7310,0.97,85,The Other End,1687608082.0,False,False,False,False,False
74,14hswki,meme,/r/meme/comments/14hswki/thanks_putin/,Double-half-55,Thanks Putin!,2712,0.95,134,,1687612734.0,False,False,False,False,True
75,14hui5p,meirl,/r/meirl/comments/14hui5p/meirl/,Jimbo072,meirl,4180,0.98,193,,1687617064.0,False,False,False,False,False
76,14hmtu5,Satisfyingasfuck,/r/Satisfyingasfuck/comments/14hmtu5/pushing_the_terraform_button/,DecentTracis,Pushing the Terraform button,8145,0.95,112,,1687593042.0,False,False,False,False,False
77,14hw0d7,NatureIsFuckingLit,/r/NatureIsFuckingLit/comments/14hw0d7/mama_bear_relaxing_with_her_cub_on_her_tummy/,amish_novelty,🔥 Mama bear relaxing with her cub on her tummy,1633,0.99,27,,1687621085.0,False,False,False,False,False
78,14hqftp,rareinsults,/r/rareinsults/comments/14hqftp/uncommon_fortnite_skins/,JesusShuttlesworth__,uncommon fortnite skins,3756,0.98,88,,1687605508.0,False,False,False,False,False
79,14hockn,WhatsWrongWithYourCat,/r/WhatsWrongWithYourCat/comments/14hockn/this_is_the_best_place_for_me/,PinaPatootie,This is the best place for me,5127,0.97,51,,1687598449.0,False,False,False,False,False
80,14hp37z,4chan,/r/4chan/comments/14hp37z/father_figure/,mutationsage,Father figure,4294,0.95,276,,1687601039.0,False,False,False,False,False
81,14hse2h,Hololive,/r/Hololive/comments/14hse2h/holy_fubukis_new_visual_are_amazing_shes_so/,Sonicm2008,"Holy, Fubuki's new visual are amazing! She's so expressive and so cute!",2563,0.97,68,:Kronii: :Sana: :Fauna: :Kiara: :Reine: :Inanis:,1687611343.0,False,False,False,False,False
82,14hnm26,JustGuysBeingDudes,/r/JustGuysBeingDudes/comments/14hnm26/rejection/,OneWishGenie69,Rejection,6281,0.93,79,,1687595830.0,False,False,False,False,False
83,14hudyb,todayilearned,/r/todayilearned/comments/14hudyb/til_products_made_by_incarcerated_new_yorkers_who/,maxcrazy,"TIL Products made by incarcerated New Yorkers, who earn as little as 16 cents an hour, power a $50 million-a-year industry.",3629,0.97,224,,1687616752.0,False,False,False,False,False
84,14hv08z,19684,/r/19684/comments/14hv08z/rule/,hellogreeting,Rule,1746,0.94,152,,1687618431.0,False,False,False,False,False
85,14hsn5j,antiwork,/r/antiwork/comments/14hsn5j/the_minimum_wage_would_be_over_24_an_hour/,Sensitive-Jury-1456,The minimum wage would be over $24 an hour...,4502,0.97,210,,1687612022.0,False,False,False,False,False
86,14hw1dj,OneOrangeBraincell,/r/OneOrangeBraincell/comments/14hw1dj/new_noise_who_dis/,Misguided_Society,"New noise, who dis?",1484,0.99,18,,1687621160.0,False,False,False,False,False
87,14hlwa4,WTF,/r/WTF/comments/14hlwa4/those_poor_birds_will_have_ptsd_after_this/,i5sandy,Those poor birds will have PTSD after this,8636,0.94,358,,1687589706.0,False,False,False,False,False
88,14ho99z,LateStageCapitalism,/r/LateStageCapitalism/comments/14ho99z/private_nursing_home_in_dickinson_texas/,privilybury711,Private Nursing Home In Dickinson Texas,4886,0.92,392,,1687598120.0,False,False,False,False,False
89,14hv45z,Stellaris,/r/Stellaris/comments/14hv45z/not_conforming_to_game_theory_is_the_new_meta_guys/,MrZnaczek,Not conforming to game theory is the new meta guys,1598,0.98,110,,1687618720.0,False,False,False,False,True
90,14hvyew,Animemes,/r/Animemes/comments/14hvyew/arguing_with_someone/,girlycharms,Arguing with someone..,1482,0.98,34,,1687620941.0,False,False,False,False,False
91,14hpugw,ThatsInsane,/r/ThatsInsane/comments/14hpugw/wagners_convoy_including_t90s_and_bmp2_heavy/,drinkdowntheccp,"Wagner's convoy, including T-90S and BMP-2 heavy equipment convoys, is now headed north to Moscow",3611,0.97,362,,1687603621.0,False,False,False,False,False
92,14hprj4,Damnthatsinteresting,/r/Damnthatsinteresting/comments/14hprj4/titanics_sister_ship_britannic_wreck_site_at/,Larpushka,"Titanic's sister ship, Britannic, wreck site at depth of only 390 feet (119m)",50413,0.95,2131,,1687603350.0,False,False,False,False,True
93,14hrtmd,LeagueOfMemes,/r/LeagueOfMemes/comments/14hrtmd/let_them_cook/,nep284,Let them cook 🍅,2591,0.97,37,,1687609708.0,False,False,False,False,False
94,14hr1xj,gadgets,/r/gadgets/comments/14hr1xj/this_flamethrowing_robot_dog_is_the_stuff_of/,diacewrb,This flame-throwing robot dog is the stuff of nightmares,2802,0.93,223,,1687607421.0,False,False,False,False,False
95,14hubj6,UkraineWarVideoReport,/r/UkraineWarVideoReport/comments/14hubj6/people_are_trying_to_leave_rostov_now_ruzzian/,stanskiii,People are trying to leave Rostov. Now Ruzzian people are in fear and desperation.,3422,0.97,440,,1687616569.0,False,False,False,False,False
96,14htztr,MadeMeSmile,/r/MadeMeSmile/comments/14htztr/guy_saves_mama_bird_and_her_chicks_from_a_storm/,VariousBasket125,Guy saves mama bird and her chicks from a storm.,3656,0.99,55,,1687615676.0,False,False,False,False,False
97,14hufxp,Jokes,/r/Jokes/comments/14hufxp/a_guy_walks_into_a_bar_in_mexico_and_sees_a_sign/,HelpingHandsUs,"A guy walks into a bar in Mexico, and sees a sign that says ""If you can make this donkey laugh we will give you $100""...",1714,0.94,52,,1687616899.0,True,False,False,False,False
98,14homl6,zelda,/r/zelda/comments/14homl6/mm_i_feel_like_people_dont_talk_about_the_dancing/,SuperSteve06311,[MM] I feel like people dont talk about the dancing redeads enough,4375,0.96,238,:kokirisemerald: ,1687599438.0,False,False,False,False,False
99,14hrxjf,lgbt,/r/lgbt/comments/14hrxjf/a_rat_art_piece_i_recently_completed/,Brodents,A rat art piece I recently completed! 🌈,2427,0.96,47,:bi: Bi-bi-bi,1687610009.0,False,False,False,False,False
100,14hs1sf,TwoXChromosomes,/r/TwoXChromosomes/comments/14hs1sf/maine_bill_proposing_one_of_countrys_least/,shallah,Maine bill proposing one of country's least restrictive abortion laws narrowly clears House vote The bill would allow abortions any time before birth if deemed necessary by a medical provider.,2338,0.98,49,,1687610356.0,False,False,False,False,False
