rank,id,subreddit,permalink,author,title,score,upvote_ratio,num_comments,author_flair_text,created_utc,over_18,edited,stickied,locked,is_original_content
1,14z492f,Damnthatsinteresting,/r/Damnthatsinteresting/comments/14z492f/woman_adopts_a_siberian_lynx/,RealRock_n_Rolla,Woman adopts a Siberian lynx,20380,0.94,899,,1689302896.0,False,False,False,False,False
2,14z3jt1,facepalm,/r/facepalm/comments/14z3jt1/not_all_parents_deserve_children/,PhysicalDecision5265,Not all parents deserve children,16073,0.96,956,,1689300823.0,False,False,False,False,False
3,14z3myl,subway,/r/subway/comments/14z3myl/since_were_on_the_topic_of_fuck_our_bosses_i/,alaskathunderfxck,since we’re on the topic of “fuck our bosses” i share the most satisfying text i’ve ever sent,12769,0.97,992,,1689301078.0,False,False,False,False,False
4,14z2901,nextfuckinglevel,/r/nextfuckinglevel/comments/14z2901/rainbow_above_clouds/,Standard-Salt-6628,Rainbow above clouds,16061,0.97,293,,1689297136.0,False,False,False,False,False
5,14z17m6,toptalent,/r/toptalent/comments/14z17m6/longest_womens_elbow_plank_4_hours_20_minutes/,Crowxzn,"Longest women's elbow plank, 4 hours, 20 minutes (Dana Glowacka, 48)",34317,0.91,2041,,1689294229.0,False,False,False,False,False
6,14z38rz,oddlysatisfying,/r/oddlysatisfying/comments/14z38rz/replacing_a_horseshoe/,rco888,Replacing a horseshoe,8952,0.95,607,,1689299974.0,False,False,False,False,False
7,14yyuif,MadeMeSmile,/r/MadeMeSmile/comments/14yyuif/we_can_all_be_heroes/,Solo_Odyssey,We can all be heroes,51024,0.95,795,,1689288031.0,False,False,False,False,False
8,14z0gqi,funny,/r/funny/comments/14z0gqi/ladies_are_they_always_this_uh_descriptive_when/,shadhead1981,"Ladies, are they always this, uh, descriptive when taking down waxing instructions?",13810,0.95,1034,,1689292206.0,False,False,False,False,False
9,14z11p2,BlackPeopleTwitter,/r/BlackPeopleTwitter/comments/14z11p2/somebody_needs_to_check_for_a_pulse/,districtcourt,Somebody needs to check for a pulse,10544,0.93,254,,1689293761.0,False,False,False,False,False
10,14z87cw,instantkarma,/r/instantkarma/comments/14z87cw/two_thieves_break_into_a_house_and_this_guy_ends/,NauTWitcher,"Two thieves break into a house, and this guy ends up inviting them back in to continue beating them",2721,0.97,160,,1689315051.0,False,False,False,False,False
11,14z3gxp,HumansBeingBros,/r/HumansBeingBros/comments/14z3gxp/a_real_hero/,xzotc,A real hero,6266,0.94,109,,1689300600.0,False,False,False,False,False
12,14z29si,dankmemes,/r/dankmemes/comments/14z29si/saw_it_live/,thepositivepandemic,Saw it live.,10502,0.94,290,,1689297203.0,False,False,False,False,False
13,14yz80m,BrandNewSentence,/r/BrandNewSentence/comments/14yz80m/teen_mom_adds_fentanyl_to_bottle_thinking_it_was/,FitzyFarseer,Teen mom adds fentanyl to bottle thinking it was cocaine,19445,0.95,1028,,1689288985.0,False,False,False,False,False
14,14z42bz,therewasanattempt,/r/therewasanattempt/comments/14z42bz/to_intimidate_cops/,FinalSneak,To intimidate cops,5513,0.88,1159,This is a flair,1689302357.0,True,False,False,False,False
15,14yzupc,TikTokCringe,/r/TikTokCringe/comments/14yzupc/drag_queens_on_a_college_campus_how_dare_they_s/,Boring_Cobbler7058,Drag Queens On a College Campus???!!! How dare they!! /s ,14510,0.83,1487,,1689290586.0,False,False,False,False,False
16,14z4spi,HonkaiStarRail,/r/HonkaiStarRail/comments/14z4spi/this_is_how_yall_look_building_pity/,BaconBurritos,"this is how y'all look ""building pity""",4296,0.95,338,:Caelus::Kafka: aeon of misfortune,1689304497.0,False,False,False,False,False
17,14z4151,Hololive,/r/Hololive/comments/14z4151/fauna_outfit_swap/,FumaTofu,Fauna Outfit Swap!,4915,0.95,84,:Inanis:,1689302251.0,False,False,False,False,False
18,14yyy8c,mildlyinfuriating,/r/mildlyinfuriating/comments/14yyy8c/been_wondering_why_my_measurements_been_off/,NewCrazyReality,Been wondering why my measurements been off.,16159,0.94,658,,1689288296.0,False,False,False,False,False
19,14z443x,AnimalsBeingBros,/r/AnimalsBeingBros/comments/14z443x/blended_family/,westcoastcdn19,Blended family ,4265,0.98,69,,1689302496.0,False,False,False,False,False
20,14yx0hp,WhitePeopleTwitter,/r/WhitePeopleTwitter/comments/14yx0hp/anything_other_than_a_manwoman_to_seek_services/,Ladydi-bds,"""anything other than a man/woman"" to ""seek services at a local pet groomer.""",21523,0.93,1831,,1689283561.0,False,False,False,False,False
21,14z3ka1,PublicFreakout,/r/PublicFreakout/comments/14z3ka1/kids_this_is_why_you_dont_do_drugs/,sakamoto__,Kids this is why you don’t do drugs,4534,0.97,695,,1689300861.0,False,False,False,False,False
22,14z21o1,AnimalsBeingDerps,/r/AnimalsBeingDerps/comments/14z21o1/petting_your_dog_can_be_relaxing/,sco-go,Petting your dog can be relaxing,5594,0.94,171,,1689296568.0,False,False,False,False,False
23,14z2lxt,tumblr,/r/tumblr/comments/14z2lxt/why_have_i_only_just_found_out_that_fishgoldie/,Ivory_0103,Why have I only just found out that Fish/Goldie came back to Tumblr a few months ago love that for her (ik this post specifically is old btw but still),4969,0.97,21,,1689298167.0,False,False,False,False,False
24,14ywflu,JustGuysBeingDudes,/r/JustGuysBeingDudes/comments/14ywflu/hello_there/,mo_aly1907,Hello there,18640,0.95,220,,1689282180.0,False,False,False,False,False
25,14yxi40,Weird,/r/Weird/comments/14yxi40/my_friend_found_this_sign_in_a_cabin_which_freaks/,shingooshmoojiii,My friend found this sign in a cabin which freaks me out...? Any idea...?,15693,0.94,1522,,1689284754.0,False,False,False,False,False
26,14z2un2,meirl,/r/meirl/comments/14z2un2/me_irl/,RogalikYT,Me irl,4493,0.98,95,,1689298850.0,False,False,False,False,False
27,14z5q0f,Genshin_Impact,/r/Genshin_Impact/comments/14z5q0f/happy_birthday_kujou_sara/,genshinimpact,"Happy Birthday, Kujou Sara!",2773,0.97,61,:hoyo1::hoyo2: Official,1689307252.0,False,False,False,False,False
28,14yz1h5,Unexpected,/r/Unexpected/comments/14yz1h5/i_think_i_had_enough_internet_for_today/,PsychoDDRQ,i think i had enough internet for today,10646,0.88,524,,1689288526.0,True,False,False,False,False
29,14yzuw3,technicallythetruth,/r/technicallythetruth/comments/14yzuw3/well_they_certainly_already_had_that_oppenheimer/,Pow67,"Well, they certainly already had that Oppenheimer experience…",9135,0.96,135,,1689290599.0,False,False,False,False,False
30,14yym0y,wholesomememes,/r/wholesomememes/comments/14yym0y/what_a_nice_dad/,casuallyCamp54,What a nice dad,10470,0.95,329,,1689287454.0,False,False,False,False,False
31,14yu0jf,antiwork,/r/antiwork/comments/14yu0jf/breaking_the_160000_actors_recording_artists/,theworkeragency,"BREAKING: The 160,000 actors, recording artists, stunt performers & media professionals of @sagaftra are officially on strike. It’s the first time since 1960 that writers and actors have been on strike at the same time. They’re shutting Hollywood down.",41278,0.91,2577,,1689276516.0,False,False,False,False,False
32,14z349d,rupaulsdragrace,/r/rupaulsdragrace/comments/14z349d/shes_got_my_vote/,adrianna1903,She’s got my vote,3681,0.95,203,Mother Sasha,1689299615.0,False,False,False,False,False
33,14z4b3s,news,/r/news/comments/14z4b3s/scottsdale_bans_natural_grass_in_front_yards_of/,EaglesPDX,Scottsdale bans natural grass in front yards of new houses to conserve water amid Arizona's drought | CNN,2994,0.98,251,,1689303067.0,False,False,False,False,False
34,14z4hwb,ProgrammerHumor,/r/ProgrammerHumor/comments/14z4hwb/cantgethackedifyoucantusecomputer/,SmallPlayz,cantGetHackedIfYouCantUseComputer,2871,0.98,140,,1689303625.0,False,False,False,False,False
35,14z0x86,rareinsults,/r/rareinsults/comments/14z0x86/hes_not_wrong/,GameOfLevels,He’s not wrong,5282,0.96,65,,1689293420.0,False,False,False,False,False
36,14z3w3c,MadeMeSmile,/r/MadeMeSmile/comments/14z3w3c/made_me_smile/,ash0550,Made me Smile,6638,0.97,105,,1689301842.0,False,False,False,False,False
37,14yu2ho,doordash,/r/doordash/comments/14yu2ho/caught_red_handed/,tatted_gamer_666,Caught red handed 😂,22560,0.97,574,,1689276641.0,False,False,False,False,False
38,14z22ja,Damnthatsinteresting,/r/Damnthatsinteresting/comments/14z22ja/the_special_effects_that_went_into_creating_the/,IanAgate,The special effects that went into creating the terminator.,10445,0.99,146,,1689296632.0,False,False,False,False,False
39,14yx9g2,todayilearned,/r/todayilearned/comments/14yx9g2/til_alfred_hitchcock_refused_to_meet_steven/,Primetime22,"TIL Alfred Hitchcock refused to meet Steven Spielberg, who had looked up to him. According to Bruce Dern, this was because Hitchcock had agreed to be the voice of the Jaws ride at Universal Studios, and looking at Spielberg made him feel ""like a whore.""",8212,0.97,287,,1689284153.0,False,False,False,False,False
40,14yuhet,oddlyterrifying,/r/oddlyterrifying/comments/14yuhet/poor_matthew/,smoothloam,Poor Matthew,20214,0.97,380,,1689277615.0,False,False,False,False,False
41,14z2sp6,maybemaybemaybe,/r/maybemaybemaybe/comments/14z2sp6/maybe_maybe_maybe/,Firm_Matter7435,Maybe maybe maybe,3368,0.93,403,,1689298690.0,False,False,False,False,False
42,14ywl3c,memes,/r/memes/comments/14ywl3c/anyone_not_experience_this_during_their_childhood/,pantherghast,Anyone not experience this during their childhood?,14452,0.98,240,,1689282533.0,False,False,False,False,False
43,14z0qm2,shitposting,/r/shitposting/comments/14z0qm2/inventing_new_positions_praise_spez/,jaska9999,inventing new positions (praise spez),5531,0.97,191,,1689292929.0,True,False,False,False,False
44,14yzdev,marvelmemes,/r/marvelmemes/comments/14yzdev/i_got_a_lot_in_mind_lol/,BuddyLoud6062,I got a lot in mind lol.,6932,0.88,5889,Avengers,1689289355.0,False,False,False,False,False
45,14ywmql,BeAmazed,/r/BeAmazed/comments/14ywmql/wait_for_it/,BG_fourteen,Wait for it.,10589,0.91,607,,1689282636.0,False,False,False,False,False
46,14z1ykz,ContagiousLaughter,/r/ContagiousLaughter/comments/14z1ykz/her_laughter_made_me_smile/,QuestionableSpoon,Her laughter made me smile!😊,3654,0.96,108,,1689296353.0,False,False,False,False,False
47,14yuv2h,wholesome,/r/wholesome/comments/14yuv2h/just_batman_doin_batman_stuff/,icutfarts,just batman doin' batman stuff,14987,0.94,267,,1689278551.0,False,False,False,False,False
48,14z6z8b,UkraineWarVideoReport,/r/UkraineWarVideoReport/comments/14z6z8b/russian_tor_sam_system_engages_a_ukrainian/,macktruck6666,Russian Tor SAM system engages a Ukrainian quadcopter,1616,0.98,206,,1689311109.0,False,False,False,False,False
49,14z4dw5,shittymoviedetails,/r/shittymoviedetails/comments/14z4dw5/elementals_has_the_second_worst_wait_what_the_fuck/,Dependent_Way_1038,"Elementals has the second worst- wait, what the fuck?",2470,0.98,134,,1689303300.0,False,False,False,False,False
50,14z1xsw,UberEATS,/r/UberEATS/comments/14z1xsw/can_you_guess_what_happened_when_i_opened_the_door/,120cmMenace,Can you guess what happened when I opened the door?,3509,0.98,413,,1689296289.0,False,False,False,False,False
51,14yvpbj,OldSchoolCool,/r/OldSchoolCool/comments/14yvpbj/my_uncle_trying_to_shank_captain_picard_1991/,repulsive-ardor,"My uncle trying to shank Captain Picard, 1991",9017,0.97,434,,1689280514.0,False,False,False,False,False
52,14ytv8q,NoStupidQuestions,/r/NoStupidQuestions/comments/14ytv8q/what_does_it_mean_when_people_from_canada_and_us/,NibbleMyRectum,What does it mean when people from Canada and US say chamungus in meetings?,15271,0.92,3463,,1689276170.0,False,False,False,False,False
53,14z06fp,HolUp,/r/HolUp/comments/14z06fp/what_would_you_do_in_this_situation/,No-ConspiracyTheory,What would you do in this situation?,5203,0.96,210,,1689291455.0,False,False,False,False,False
54,14yzwlp,worldnews,/r/worldnews/comments/14yzwlp/russia_plans_to_build_dozens_of_prison_camps/,friskythafool,"Russia plans to build dozens of prison camps across Ukraine over the next few years, documents show, hinting Moscow's readying for a long war",4383,0.97,425,,1689290726.0,False,False,False,False,False
55,14z37js,movies,/r/movies/comments/14z37js/hollywoods_groundbreaking_ai_proposal_for_actors/,fungobat,Hollywood's 'Groundbreaking' AI Proposal for Actors Is a Nightmare,2595,0.95,467,,1689299875.0,False,False,False,False,False
56,14yvqd8,cats,/r/cats/comments/14yvqd8/a_month_ago_i_was_a_dog_person_and_things_have/,captainruinit,A month ago I was a dog person and things have escalated rapidly since then: a photo journey of the last 3 weeks at our house,9029,1.0,339,,1689280579.0,False,False,False,False,False
57,14ywmeq,gaming,/r/gaming/comments/14ywmeq/finally_getting_into_pc_gaming_and_installing/,InforMedic,Finally getting into PC gaming and installing this bad boy!,7078,0.95,362,,1689282617.0,False,False,False,False,False
58,14yzn2a,DiWHY,/r/DiWHY/comments/14yzn2a/stairway_slide/,pun420,Stairway Slide,4286,0.95,338,,1689290038.0,False,False,False,False,False
59,14z7tnp,WTF,/r/WTF/comments/14z7tnp/he_saw_things_he_never_forget/,Stepbro_canhelp,He saw things he never forget ,1187,0.97,64,,1689313824.0,False,False,False,False,False
60,14z4oue,197,/r/197/comments/14z4oue/title/,sexurmom,Title,1964,0.96,35,,1689304177.0,False,False,False,False,False
61,14yydph,Breath_of_the_Wild,/r/Breath_of_the_Wild/comments/14yydph/i_dont_think_this_was_the_intended_way/,Azarathos,I don’t think this was the intended way,5029,0.98,143,,1689286889.0,False,False,False,False,False
62,14yua4u,AskReddit,/r/AskReddit/comments/14yua4u/should_a_man_shave_his_balls_or_not_and_why/,SuspectingCarl,"Should a man shave his balls or not, and why?",11769,0.87,5325,,1689277129.0,True,False,False,False,False
63,14yykvl,shittytattoos,/r/shittytattoos/comments/14yykvl/my_sons_first_tattoo/,Flatonr,My sons first tattoo,4803,0.97,208,,1689287384.0,False,False,False,False,False
64,14z0s9q,PrequelMemes,/r/PrequelMemes/comments/14z0s9q/my_boy_got_done_dirty/,asilvertintedrose,My boy got done dirty,3512,0.98,23,I'm THE General Reposti (with some OC memes here & there),1689293046.0,False,False,False,False,False
65,14yt5jj,nba,/r/nba/comments/14yt5jj/comedian_ryan_davis_tells_no_lies_about_kevin/,MTRIFE,Comedian Ryan Davis tells no lies about Kevin Durant,10835,0.93,1472,,1689274538.0,True,False,False,False,False
66,14yso3f,Fauxmoi,/r/Fauxmoi/comments/14yso3f/christopher_nolan_has_announced_that_the_cast_of/,Ximiso,Christopher Nolan has announced that the cast of ‘OPPENHEIMER’ has left the premiere to ‘go and write their pickets’ and join the strike.,11535,0.95,503,societal collapse is in the air,1689273379.0,False,False,False,False,False
67,14ys1mq,nottheonion,/r/nottheonion/comments/14ys1mq/rfk_jr_press_dinner_screaming_match_over_climate/,goatofmind,RFK Jr press dinner screaming match over climate crisis ends with columnist launching his own natural gas,15059,0.92,1376,,1689271905.0,False,False,False,False,False
68,14yvtp0,politics,/r/politics/comments/14yvtp0/trump_super_pac_made_155000_payment_to_melania/,Hot_Bat_2585,"Trump Super PAC Made $155,000 Payment to Melania Trump in 2021",6337,0.97,374,,1689280801.0,False,False,False,False,False
69,14z07q5,facepalm,/r/facepalm/comments/14z07q5/why_are_people_like_this/,ClosedDominance,Why are people like this?,9590,0.94,2086,,1689291551.0,False,False,False,False,False
70,14z3e04,oddlysatisfying,/r/oddlysatisfying/comments/14z3e04/watching_fireworks_through_a_can/,zi-zu,Watching fireworks through a can,4503,0.97,27,,1689300353.0,False,False,False,False,False
71,14z18yi,lgbt,/r/lgbt/comments/14z18yi/i_am_african_i_am_black_and_i_am_gay_i_exist_and/,Alone_Werewolf_5626,"I am African, I am Black, and I am Gay. I exist and I am valid. 💪🖤",2988,0.88,104,,1689294337.0,False,False,False,False,False
72,14z35ve,DeepRockGalactic,/r/DeepRockGalactic/comments/14z35ve/built_a_lego_bosco/,MaximusG29,Built a Lego Bosco!,2207,0.99,97,,1689299740.0,False,False,False,False,False
73,14yprx3,technology,/r/technology/comments/14yprx3/its_official_smartphones_will_need_to_have/,f50ci31y,It's official: Smartphones will need to have replaceable batteries by 2027,25799,0.96,2357,,1689266559.0,False,False,False,False,False
74,14z4t8h,TwoSentenceHorror,/r/TwoSentenceHorror/comments/14z4t8h/being_biologists_we_were_all_astounded_and/,FireFlavour,"Being biologists, we were all astounded and intrigued when a new species of fly emerged that lays thousands of tiny eggs at a time into the air, similarly to spores.",1689,0.98,51,,1689304533.0,False,False,False,False,False
75,14yudqi,clevercomebacks,/r/clevercomebacks/comments/14yudqi/found_in_another_sub/,mrl33602,Found in another sub,9111,0.96,324,,1689277353.0,False,False,False,False,False
76,14yuuhm,pcmasterrace,/r/pcmasterrace/comments/14yuuhm/its_probably_horrible_for_my_pc_to_let_her_sleep/,prahl_hp,It’s probably horrible for my pc to let her sleep on it but i don’t have the heart to move her,7963,0.94,417,,1689278519.0,False,False,False,False,False
77,14z13vc,conservativeterrorism,/r/conservativeterrorism/comments/14z13vc/idaho_opts_out_of_nearly_15_million_that_would/,MacGruber77,Idaho opts out of nearly $15 million that would feed children this summer. Why?,2862,0.97,167,,1689293942.0,False,False,False,False,False
78,14ytmyc,SipsTea,/r/SipsTea/comments/14ytmyc/this_fcking_dog/,Falstgf,This f*cking dog,10643,0.98,94,,1689275643.0,False,False,False,False,False
79,14yr8uz,comics,/r/comics/comments/14yr8uz/a_different_kind_of_coming_out_details_in_comment/,Main-Salamander-6687,A different kind of coming out (details in comment),22686,0.86,593,,1689270061.0,False,False,False,False,False
80,14ystxa,Instagramreality,/r/Instagramreality/comments/14ystxa/popular_models_real_face_shows_up_for_12_second/,br0ck,Popular model's real face shows up for 1/2 second?,10621,0.93,927,,1689273773.0,False,False,False,False,False
81,14z3syj,thesims,/r/thesims/comments/14z3syj/i_am_telling_you_right_now_that_sim_right_there/,theonlybegottensim,"""I am telling you RIGHT NOW... that sim right there is NOT REAL!""",1913,0.95,62,,1689301573.0,False,False,False,False,False
82,14z0w4y,UpliftingNews,/r/UpliftingNews/comments/14z0w4y/it_was_an_accident_the_scientists_who_have_turned/,Sunflier,‘It was an accident’: the scientists who have turned humid air into renewable power | Science,2901,0.97,182,,1689293343.0,False,False,False,False,False
83,14ywac7,HydroHomies,/r/HydroHomies/comments/14ywac7/my_employer_installed_a_spicy_water_dispenser_in/,htmlcody,My employer installed a spicy water dispenser in our break room.,5742,0.97,330,,1689281867.0,False,False,False,False,False
84,14z09hy,TrueOffMyChest,/r/TrueOffMyChest/comments/14z09hy/update_my_brother_in_law_called_me_the_one_who/,,[Update] My brother in law called me the one who got away in his speech and my husband is very hurt and it is my all fault.,3186,0.94,339,,1689291679.0,False,1689323757.0,False,False,False
85,14z4k8s,UFOs,/r/UFOs/comments/14z4k8s/us_army_has_just_launched_helicopters_from_every/,NoResponsibility7400,US army has just launched helicopters from *EVERY* military base across the country.,1678,0.84,1042,,1689303791.0,False,False,False,False,False
86,14yzrl9,OneOrangeBraincell,/r/OneOrangeBraincell/comments/14yzrl9/flexing_his_one_orange_braincell_hard/,Saffronsc,Flexing his one orange braincell HARD 💪🧠 ,3427,0.99,67,,1689290370.0,False,False,False,False,False
87,14z3h1m,TerrifyingAsFuck,/r/TerrifyingAsFuck/comments/14z3h1m/deer_with_a_broken_neck_emerges_from_the_bush/,axlnotfound,Deer with a broken neck emerges from the bush,1921,0.97,96,,1689300607.0,False,False,False,False,False
88,14z0fdl,WitchesVsPatriarchy,/r/WitchesVsPatriarchy/comments/14z0fdl/ever_vigilant/,BoMaxKent,ever vigilant!,2948,0.97,13,,1689292101.0,False,False,False,False,False
89,14yxti5,Tinder,/r/Tinder/comments/14yxti5/_/,xxlovexx434,👁️👄👁️,4325,0.97,336,,1689285535.0,False,False,False,False,False
90,14z3mxv,ThatsInsane,/r/ThatsInsane/comments/14z3mxv/a_melbourne_based_company_anatomics_created_the/,Lucifers-kid,A Melbourne based company Anatomics created the worlds first full skull transplant,1829,0.98,112,,1689301076.0,True,False,False,False,False
91,14z07yd,furry_irl,/r/furry_irl/comments/14z07yd/furryirl/,FreddieGamer2004,Furry😁irl,3029,0.93,135,,1689291569.0,False,False,False,False,False
92,14z2e60,atheism,/r/atheism/comments/14z2e60/a_drag_queen_reading_to_kids_isnt_indoctrination/,Mrdean2013,"A Drag Queen reading to kids isnt ""indoctrination"". Forcing your kids to go to church every week under the threat that they'll burn for eternity in a fiery dimension unless they don't, is.",2118,0.93,85,Agnostic Atheist,1689297555.0,False,False,False,False,False
93,14z86e5,MemeVideos,/r/MemeVideos/comments/14z86e5/curiosity_kills_the_cat/,VividNarzary,Curiosity kills the cat,881,0.97,86,,1689314962.0,False,False,False,False,False
94,14yvgkv,NewsOfTheStupid,/r/NewsOfTheStupid/comments/14yvgkv/actor_jim_caviezel_claims_liberal_elites_drink/,Misguided_Society,"Actor Jim Caviezel claims liberal elites drink the blood of infants - also stating, ‘I believe Donald Trump was selected by God Almighty, and I'm talking about the Father, Son, and Holy Spirit God,’ Caviezel said.",5841,0.87,1820,,1689279956.0,False,False,False,False,False
95,14yyp97,BlackPeopleComedy,/r/BlackPeopleComedy/comments/14yyp97/is_this_all_yall_males/,emmgdac,Is this all y’all males?? 👀👀👀,3702,0.95,121,✊🏽✊🏾✊🏿 verified,1689287664.0,False,False,False,False,False
96,14z0df7,mildlyinfuriating,/r/mildlyinfuriating/comments/14z0df7/this_is_the_thank_you_our_er_got_for_the_killer/,Low_Signature_7771,This is the “thank you” our ER got for the killer month we’ve had. One of the worst since COVID,6628,0.95,1230,,1689291957.0,False,False,False,False,False
97,14z2nns,anime_irl,/r/anime_irl/comments/14z2nns/anime_irl/,Delicious-Let8429,anime_irl,2025,0.98,34,,1689298294.0,False,False,False,False,False
98,14z131i,Eyebleach,/r/Eyebleach/comments/14z131i/looks_like_a_hit_with_the_kitty_i_wish_my_toy/,Vivid_Gadsww,"Looks like a hit with the kitty. I wish my toy picks were as successful with my cats. :,)",2539,0.97,35,,1689293874.0,False,False,False,False,False
99,14z0732,NotHowGirlsWork,/r/NotHowGirlsWork/comments/14z0732/reading_a_novel_sex/,imaginenohell,Reading a novel = sex,2906,0.98,321,,1689291501.0,False,False,False,False,False
100,14yskye,formuladank,/r/formuladank/comments/14yskye/just_a_reminder_who_the_actual_scientifically/,ExactCollege3,"Just a reminder who the actual scientifically proven best driver is, in equal machinery",9439,0.96,299,BWOAHHHHHHH ,1689273162.0,False,False,False,False,False
