rank,id,subreddit,permalink,author,title,score,upvote_ratio,num_comments,author_flair_text,created_utc,over_18,edited,stickied,locked,is_original_content
1,14ijd92,todayilearned,/r/todayilearned/comments/14ijd92/til_that_sigourney_weaver_only_earned_35000_for/,Make_the_music_stop,"TIL that Sigourney Weaver only earned $35,000 for Alien (1979) but got $1,000,000 and a share of the profits for Aliens (1986)",19736,0.96,695,,1687690510.0,False,False,False,False,False
2,14iki9r,facepalm,/r/facepalm/comments/14iki9r/camera_flash_causes_tuna_to_crash_into_aquarium/,Infinite-Captain-622,Camera flash causes tuna to crash into aquarium glass,13963,0.95,1013,,1687694346.0,False,False,False,False,False
3,14ikq4s,WhitePeopleTwitter,/r/WhitePeopleTwitter/comments/14ikq4s/i_wish_this_was_surprising/,CrunchM,I wish this was surprising,10219,0.98,714,,1687695017.0,False,False,False,False,False
4,14ij3jw,Damnthatsinteresting,/r/Damnthatsinteresting/comments/14ij3jw/baloo_from_jungle_book_is_actually_based_on_the/,lonely_dude__,Baloo from jungle book is actually based on the sloth bear found in India which is considered to be the most agressive bear species in the world.,11491,0.98,375,Creator,1687689548.0,False,False,False,False,False
5,14ijqjl,therewasanattempt,/r/therewasanattempt/comments/14ijqjl/to_hang_out/,VariousBasket125,To hang out ,9288,0.94,2241,This is a flair,1687691762.0,False,False,False,False,False
6,14iifo7,PoliticalHumor,/r/PoliticalHumor/comments/14iifo7/this_all_makes_a_little_more_sense_now/,UnlimitedDuck,This all makes a little more sense now,11107,0.94,497,,1687687196.0,False,False,False,False,False
7,14ijqw3,AmItheAsshole,/r/AmItheAsshole/comments/14ijqw3/aita_for_giving_back_everything_my_family_bought/,Free-Scallion-2274,AITA for giving back everything my family bought for my son?,7628,0.94,1223,,1687691794.0,False,False,False,False,False
8,14ijn99,politics,/r/politics/comments/14ijn99/why_the_right_is_so_terrified_of_woke_there_are/,Picture-unrelated,Why the right is so terrified of “woke”: There are truths it just can’t face — Conservatives didn’t want to hear about white privilege. So they abandoned reality and joined the orange man’s cult,7695,0.85,855,:flag-or: Oregon,1687691445.0,False,False,False,False,False
9,14ik8p2,comics,/r/comics/comments/14ik8p2/pimple_boy/,neilkohney,Pimple boy,6099,0.96,65,The Other End,1687693469.0,False,False,False,False,False
10,14ik4qw,nba,/r/nba/comments/14ik4qw/chelsea_gray_with_a_crazy_assist_last_night_in/,srgntalpowell,Chelsea Gray with a crazy assist last night in the WNBA,4809,0.89,455,,1687693091.0,False,False,False,False,False
11,14ih1ec,technology,/r/technology/comments/14ih1ec/american_tiktok_user_data_stored_in_china_video/,callmeteji,"American TikTok user data stored in China, video app admits",9441,0.93,990,,1687682170.0,False,False,False,False,False
12,14ijxre,PublicFreakout,/r/PublicFreakout/comments/14ijxre/dog_saves_girl_from_a_kidnapper/,Genesis_001,Dog saves girl from a kidnapper.,4733,0.98,199,,1687692436.0,False,False,False,False,False
13,14ihh22,starterpacks,/r/starterpacks/comments/14ihh22/getting_the_flu_within_your_first_two_weeks_of/,confidentmilktoast,“Getting the flu within your first two weeks of starting a new job” Starter Pack.,7942,0.96,276,,1687683710.0,False,False,False,False,False
14,14ijykz,dankmemes,/r/dankmemes/comments/14ijykz/their_battle_will_be_legendary/,chaosgiantmemes,Their battle will be legendary!,5092,0.91,66,:runescape1:trash-tier meme lord :runescape2:,1687692520.0,False,False,False,False,False
15,14ifj46,shitposting,/r/shitposting/comments/14ifj46/glory_to_spez/,ligma-joe,Glory to Spez,18445,0.95,148,,1687676793.0,False,False,True,False,False
16,14ikmd8,nextfuckinglevel,/r/nextfuckinglevel/comments/14ikmd8/the_kyoto_tachibana_shs_band_performing_sing_sing/,MulciberTenebras,"The Kyoto Tachibana SHS Band performing ""Sing Sing Sing""",3723,0.97,131,,1687694673.0,False,False,False,False,False
17,14ifpzi,AnimalsBeingDerps,/r/AnimalsBeingDerps/comments/14ifpzi/baby_camel_wants_to_nurse/,jemahAeo,Baby camel wants to nurse,10090,0.96,119,,1687677483.0,False,False,False,False,False
18,14iit9t,science,/r/science/comments/14iit9t/men_who_perform_just_a_few_minutes_of_strenuous/,Wagamaga,"Men who perform just a few minutes of strenuous exercise are more likely to feel aroused than those who do not work out. Heightened physical responses to exercise, such as elevated heart rate and breathing, lend themselves to an even greater physical response to sexual stimuli.",4601,0.95,182,,1687688520.0,False,False,False,False,False
19,14ika87,pics,/r/pics/comments/14ika87/john_olivers_advice_in_protesting_maybe_uspez/,Additional-Gift529,John Oliver's advice in protesting: Maybe u/spez will care about that,3521,0.89,298,,1687693605.0,False,False,False,False,False
20,14iguum,NatureIsFuckingLit,/r/NatureIsFuckingLit/comments/14iguum/furcifer_pardalis_commonly_known_as_the_panther/,therra123,"🔥 Furcifer pardalis, commonly known as the panther chameleon, is primarily found in eastern and northern regions of Madagascar",6206,0.97,120,,1687681519.0,False,False,False,False,False
21,14igorp,BikiniBottomTwitter,/r/BikiniBottomTwitter/comments/14igorp/this_is_so_true/,BeautifulSwan00,This is so true,6325,0.97,35,,1687680918.0,False,False,False,False,False
22,14ijcb5,memes,/r/memes/comments/14ijcb5/anything_can_be_medieval_i_guess/,Acomplished_Bacteria,Anything can be medieval I guess,4094,0.99,53,,1687690413.0,False,False,False,False,False
23,14icv54,antiwork,/r/antiwork/comments/14icv54/and_this_is_why_there_is_a_rush_to_get_us_back_in/,Vdaniels1,And this is why there is a rush to get us back in the office,20162,0.94,1630,,1687667684.0,False,False,False,False,False
24,14id129,funny,/r/funny/comments/14id129/shaq_pancake_art/,FlippinArtDude,Shaq pancake art,20767,0.92,259,,1687668234.0,False,False,False,False,False
25,14idjrl,BeAmazed,/r/BeAmazed/comments/14idjrl/amazing_octopus_stretching_its_tentacles_to_form/,XahidX,Amazing Octopus stretching its tentacles to form a huge balloon,15429,0.97,454,,1687669967.0,False,False,False,False,False
26,14ij6c3,rareinsults,/r/rareinsults/comments/14ij6c3/shoutout_my_anaemic_friends/,TheRealCalT,Shoutout My Anaemic Friends,3676,0.96,14,,1687689819.0,False,False,False,False,False
27,14iks9b,oddlysatisfying,/r/oddlysatisfying/comments/14iks9b/steam_of_boiled_corn/,Gh0stDestr0y,Steam of boiled corn,2766,0.95,72,Flair Loading...,1687695197.0,False,False,False,False,False
28,14idvya,TikTokCringe,/r/TikTokCringe/comments/14idvya/stone_fish_venom/,Sylas1987,Stone fish venom,13569,0.95,731,,1687671104.0,False,False,False,False,False
29,14ijmsa,worldnews,/r/worldnews/comments/14ijmsa/donald_trump_warns_that_if_president_vladimir/,green_flash,"Donald Trump warns that if President Vladimir Putin is overthrown from power, ""unintended consequences"" would follow",3391,0.83,1060,,1687691401.0,False,False,False,False,False
30,14iinyz,HermanCainAward,/r/HermanCainAward/comments/14iinyz/someone_please_make_it_make_sense/,HotPinkLollyWimple,Someone please make it make sense,3849,0.96,218,Phucked around and Phound out,1687687997.0,False,False,False,False,False
31,14ik7wp,Tinder,/r/Tinder/comments/14ik7wp/am_i_the_crazy_one/,Post-pre-mortem,Am I the crazy one?,2932,0.94,557,,1687693395.0,False,False,False,False,False
32,14ikwzy,OneOrangeBraincell,/r/OneOrangeBraincell/comments/14ikwzy/neighbors_orange_gets_lost_and_walks_into_our/,RatDitch,Neighbors orange gets lost and walks into our house instead of his own. Frequently.,2609,0.99,48,,1687695621.0,False,False,False,False,False
33,14iiptx,PrequelMemes,/r/PrequelMemes/comments/14iiptx/thats_life/,johnlen1n,That's life,3998,0.99,46,Good soldiers follow orders,1687688183.0,False,False,False,False,False
34,14ijqu7,MadeMeSmile,/r/MadeMeSmile/comments/14ijqu7/i_used_to_tutor_special_needs_kids_in_highschool/,fg10037,I used to tutor special needs kids in highschool and one came to surprise me at work today!,3153,0.94,188,,1687691790.0,False,False,False,False,False
35,14ih3ce,HumansAreMetal,/r/HumansAreMetal/comments/14ih3ce/theresa_kachindamoto_saving_the_children/,bislut997,Theresa Kachindamoto saving the children,5067,0.95,78,,1687682365.0,False,False,False,False,False
36,14id1l7,NonPoliticalTwitter,/r/NonPoliticalTwitter/comments/14id1l7/how_true_is_this/,lhomme21,How true is this,15345,0.93,627,:blue1::blue2::1111::1112:,1687668289.0,False,False,False,False,False
37,14ih308,facepalm,/r/facepalm/comments/14ih308/society_explained_in_29_seconds/,stiffspectacls,Society explained in 29 seconds,26023,0.96,738,,1687682331.0,False,False,False,False,False
38,14idq5f,clevercomebacks,/r/clevercomebacks/comments/14idq5f/stealing_is_wrong/,Evermoreunlive52,Stealing is wrong?,10915,0.96,78,,1687670572.0,False,False,False,False,False
39,14ie1xe,lotrmemes,/r/lotrmemes/comments/14ie1xe/one_does_not_simply_assume_a_game_is_a_cash_grab/,BJ_Beamz,One does not simply assume a game is a cash grab,9420,0.95,321,Grond,1687671656.0,False,False,False,False,False
40,14ibngc,news,/r/news/comments/14ibngc/south_carolina_fire_chief_who_pointed_gun_at/,Molire,South Carolina fire chief who pointed gun at teens who turned in his driveway is being sued,15982,0.96,533,,1687663762.0,False,False,False,False,False
41,14ihbjv,MemePiece,/r/MemePiece/comments/14ihbjv/bruhhh/,LuckyUnification,Bruhhh,3771,0.96,105,,1687683178.0,False,False,False,False,False
42,14ii258,ich_iel,/r/ich_iel/comments/14ii258/ich_iel/,hypefor8wasjustabait,ich_iel,3182,0.95,88,,1687685809.0,True,False,False,False,False
43,14il0ce,ProgrammerHumor,/r/ProgrammerHumor/comments/14il0ce/networkingstarterpack/,VitaminnCPP,networkingStarterPack,1807,0.94,40,:cp:,1687695910.0,False,False,False,False,False
44,14iid1n,movies,/r/movies/comments/14iid1n/comiccon_crisis_marvel_netflix_sony_hbo_and/,tylerthe-theatre,"Comic-Con Crisis: Marvel, Netflix, Sony, HBO and Universal to Skip SDCC as Fest Faces Another Existential Threat",2788,0.9,310,,1687686911.0,False,False,False,False,False
45,14ifz75,natureismetal,/r/natureismetal/comments/14ifz75/in_finland_temperature_gets_as_low_as_40c_in/,bislut997,"In Finland temperature gets as low as -40C in winter, the trees are covered in so much snow and frost that it looks like landscape from another planet",4354,0.95,121,,1687678430.0,False,False,False,False,False
46,14igawl,Animemes,/r/Animemes/comments/14igawl/netflix_one_piece_new_cast_reveal/,SmokingBouquets,Netflix One Piece new cast reveal,4282,0.94,68,,1687679591.0,False,False,False,False,False
47,14icisc,mildlyinfuriating,/r/mildlyinfuriating/comments/14icisc/unemployed_partner_texting_me_while_im_working/,jj_bills,Unemployed partner texting me while I'm working,12613,0.88,1218,,1687666549.0,False,False,False,False,False
48,14iilft,UkraineWarVideoReport,/r/UkraineWarVideoReport/comments/14iilft/the_russian_army_special_unit_storm_z_which/,CatsofUkraine,"The Russian Army special unit ""Storm Z,"" which supported Wagner Group CEO Prigozhin in yesterday's attempted coup d'état against Russian President Vladimir Putin, is a little dismayed that Prigozhin abandoned them.",2554,0.97,245,,1687687746.0,False,False,False,False,False
49,14ijrhu,WTF,/r/WTF/comments/14ijrhu/thats_too_close/,Cultural_End9105,That's too close,2066,0.96,132,,1687691849.0,False,False,False,False,False
50,14ih98r,ImTheMainCharacter,/r/ImTheMainCharacter/comments/14ih98r/yeah_lets_just_be_thr_most_annoying_people_at_the/,Snake_Plissken224,"Yeah, let's just be thr most annoying people at the home depot....",3259,0.89,424,,1687682946.0,False,False,False,False,False
51,14ifvr8,meirl,/r/meirl/comments/14ifvr8/meirl/,LateRendition,Meirl,4545,0.97,274,,1687678071.0,False,False,False,False,False
52,14im4tx,ContagiousLaughter,/r/ContagiousLaughter/comments/14im4tx/oh_hi_mom/,colorless_man,oh! hi mom.,1435,0.98,51,,1687699166.0,False,False,False,False,False
53,14ij9l0,CombatFootage,/r/CombatFootage/comments/14ij9l0/translated_disbandment_of_the_57th_motorized/,CatsofUkraine,Translated: Disbandment of the 57th motorized rifle brigade of the Russian Federation. The publication of some details of yesterday's operation Go-Pro video of soldiers of the 1st company of the 1st mechanized battalion of the Third Assault Brigade.,2136,0.96,135,,1687690146.0,False,False,False,False,False
54,14igcbf,WorkReform,/r/WorkReform/comments/14igcbf/based_on_a_true_story/,HumorousHelper,Based on a true story,3725,0.98,51,,1687679734.0,False,False,False,False,False
55,14iasvz,RandomThoughts,/r/RandomThoughts/comments/14iasvz/do_u_ever_feel_kinda_compelled_to_write_ur/,chesnutpraline,do u ever feel kinda compelled to write ur opinion in a comment but then get kinda tired while writing it and give up after deciding u dont really care enough in the moment to comment and erase it?,16045,0.91,1759,,1687661058.0,False,False,False,False,False
56,14igs3u,MemeVideos,/r/MemeVideos/comments/14igs3u/_/,Naymar083,🧊️ 👍,3648,0.94,64,,1687681249.0,False,False,False,False,False
57,14iivk2,OnePunchMan,/r/OnePunchMan/comments/14iivk2/went_to_a_convention_and_this_happened/,ghoubi,Went to a convention and this happened....,2243,0.95,77,,1687688754.0,False,False,False,False,False
58,14iepeb,WhitePeopleTwitter,/r/WhitePeopleTwitter/comments/14iepeb/the_new_predator_movie_just_dropped/,rhodesleadnowhere,The new predator movie just dropped,25839,0.91,1108,,1687673916.0,False,False,False,False,False
59,14ihtj9,ireland,/r/ireland/comments/14ihtj9/have_you_already_watch_philomena_cunk_lol/,XCEREALXKILLERX,Have you already watch Philomena Cunk? Lol,2632,0.94,220,Dublin,1687684932.0,False,False,False,False,False
60,14il94v,GreenAndPleasant,/r/GreenAndPleasant/comments/14il94v/1000_percent_this/,HankScorpio42,1000 percent this,1461,0.95,55,,1687696656.0,False,False,False,False,False
61,14ibf9l,cats,/r/cats/comments/14ibf9l/can_someone_explain_to_me_why_my_cat_will_just/,takeaabreath,Can someone explain to me why my cat will just sit and stare at me for minutes at a time? What does this mean in a cat’s world?,11044,0.97,890,,1687663019.0,False,False,False,False,False
62,14iixc1,wholesomememes,/r/wholesomememes/comments/14iixc1/i_am_the_streets/,esberat,I am the streets.,2166,0.97,21,,1687688932.0,False,False,False,False,False
63,14iez5a,aww,/r/aww/comments/14iez5a/the_way_my_cat_gets_into_the_narrowest_place_in/,marehori,The way my cat gets into the narrowest place in the house (with John's reaction) [OC],4517,0.92,61,,1687674851.0,False,False,False,False,True
64,14iiicp,Whatcouldgowrong,/r/Whatcouldgowrong/comments/14iiicp/taking_your_child_to_soft_play/,saboteur2011,Taking your child to soft play,2272,0.92,65,,1687687419.0,False,False,False,False,False
65,14i9cd2,gaming,/r/gaming/comments/14i9cd2/good_or_bad_games_it_doesnt_matter_i_have_massive/,Modo97,"Good or bad games? it doesn't matter, I have massive respect for games that still support Split-Screen ❤️",28007,0.9,958,,1687656612.0,False,False,False,False,False
66,14ihzke,insanepeoplefacebook,/r/insanepeoplefacebook/comments/14ihzke/a_bakerys_evaluation/,SnowWarms,A bakery's evaluation...,2417,0.97,90,,1687685543.0,False,False,False,False,False
67,14ig2yb,FunnyandSad,/r/FunnyandSad/comments/14ig2yb/uber_is_a_better_choice/,CuteAngryGirl,Uber is a better choice,3434,0.96,100,,1687678795.0,False,False,False,False,False
68,14id4ee,UpliftingNews,/r/UpliftingNews/comments/14id4ee/most_unionized_us_rail_workers_now_have_new_sick/,Karmanacht,Most unionized US rail workers now have new sick leave,5915,0.96,247,,1687668559.0,False,False,False,False,False
69,14iawpv,oddlyterrifying,/r/oddlyterrifying/comments/14iawpv/pet_king_cobra_gets_angry_at_owner/,RIPStengel,Pet king cobra gets angry at owner.,13875,0.93,573,,1687661397.0,False,False,False,False,False
70,14id7jw,Superstonk,/r/Superstonk/comments/14id7jw/why_i_love_this_company/,GinoF2020,Why I love this company,7250,0.91,156,,1687668859.0,False,False,False,False,False
71,14ibjba,Weird,/r/Weird/comments/14ibjba/opened_a_can_of_peaches_and_they_were_black_and/,Elly_frog,opened a can of peaches and they were black and smelt like fish??,10542,0.91,2447,,1687663376.0,False,False,False,False,False
72,14ic6sh,HumansBeingBros,/r/HumansBeingBros/comments/14ic6sh/a_spooked_horse_found_itself_stuck_in_a_swimming/,alanboston,A spooked horse found itself stuck in a swimming pool in Florida. The county's fire rescue team jumped into action,7657,0.94,268,,1687665508.0,False,False,False,False,False
73,14iht5d,Rabbits,/r/Rabbits/comments/14iht5d/we_let_our_widowed_bun_choose_a_new_wife_turns/,Epiphany7777,"We let our widowed bun choose a new wife, turns out he likes big ladies!",2270,0.97,46,:dol:,1687684892.0,False,False,False,False,False
74,14iftk5,meme,/r/meme/comments/14iftk5/dont_lie/,ScorpLeo102,Don’t lie.,3635,0.88,339,,1687677842.0,False,False,False,False,False
75,14iho3b,Hololive,/r/Hololive/comments/14iho3b/rack_to_the_future/,V-Faction,Rack to the Future,2378,0.95,36,:AkiRose::Amelia::Nene::Polka::Haato:,1687684384.0,False,False,False,False,False
76,14ijm56,marvelstudios,/r/marvelstudios/comments/14ijm56/mcu_moments_that_will_always_make_you_cheer/,TheJack0fDiamonds,MCU moments that will always make you cheer everytime you see it,1601,0.81,354,Scarlet Witch,1687691335.0,False,False,False,False,False
77,14igrdy,formuladank,/r/formuladank/comments/14igrdy/ive_made_my_choice/,Siffilus23,I've made my choice,2731,0.96,41,“It’s called a motor race. We went car racing”,1687681182.0,False,False,False,False,False
78,14iivjn,trippinthroughtime,/r/trippinthroughtime/comments/14iivjn/what_a_great_diplomat/,esberat,What a great diplomat.,1788,0.95,3,,1687688753.0,False,False,False,False,False
79,14idjlv,ThatsInsane,/r/ThatsInsane/comments/14idjlv/stone_fish_venom/,Sylas1987,Stone fish venom,5012,0.95,194,,1687669949.0,False,False,False,False,False
80,14ikaun,Genshin_Impact,/r/Genshin_Impact/comments/14ikaun/sisters/,2bells1ravine,Sisters,1371,0.98,24,,1687693667.0,False,False,False,False,False
81,14igtsr,nextfuckinglevel,/r/nextfuckinglevel/comments/14igtsr/artist_creating_perspective_art/,Siil_Udus,Artist creating perspective art,6849,0.95,95,,1687681411.0,False,False,False,False,False
82,14i8cnl,wallstreetbets,/r/wallstreetbets/comments/14i8cnl/found_my_new_side_hustle/,rylar,found my new side hustle,17749,0.95,255,Supports a 🅱️arfield Ethnostate :Barfield:,1687653638.0,False,False,False,False,False
83,14ikcjw,CasualUK,/r/CasualUK/comments/14ikcjw/id_like_to_share_this_absolutely_banging_bargain/,borderlinebaggage,I’d like to share this absolutely banging bargain I just got from a British heart foundation charity shop. Full leather recliner for £5. I feel like I’ve won the lottery,1314,0.98,197,,1687693828.0,False,False,False,False,False
84,14ikax0,shittymoviedetails,/r/shittymoviedetails/comments/14ikax0/in_oppenheimer_2023_oppenheimer_looks_miserable/,Xxstevefromminecraft,In Oppenheimer (2023) Oppenheimer looks miserable in every poster and Screen-cap he’s in. This is probably due to the fact he built fucking bombs that killed thousands of people,1339,0.95,54,,1687693674.0,False,False,False,False,False
85,14iamye,technicallythetruth,/r/technicallythetruth/comments/14iamye/it_does_indeed_look_just_like_ahem_a_quarter_note/,LucidCunning,It does indeed look just like... *ahem...* a quarter note.,10881,0.95,270,,1687660550.0,False,False,False,False,False
86,14igx0r,MoldyMemes,/r/MoldyMemes/comments/14igx0r/yeah_i_play_genshin_impact/,shitpostH0F,“Yeah I play Genshin Impact”,2500,0.95,64,,1687681735.0,False,False,False,False,False
87,14ifqd4,terriblefacebookmemes,/r/terriblefacebookmemes/comments/14ifqd4/my_uncle_posted_this/,SmokyDoky876,My uncle posted this,3083,0.93,153,,1687677523.0,False,False,False,False,False
88,14iatn6,HyruleEngineering,/r/HyruleEngineering/comments/14iatn6/thatll_be_250k_please/,itsbildo,That'll be $250k please,7512,0.94,168,,1687661122.0,False,False,False,False,False
89,14i7iu6,space,/r/space/comments/14i7iu6/i_grew_up_amazed_by_the_famous_pillars_of/,theillini19,I grew up amazed by the famous Pillars of Creation photo of the Hubble Space Telescope. I never imagined I would one day be able to capture this nebula from my backyard.,17066,0.96,217,,1687651234.0,False,False,False,False,False
90,14ib4q8,Satisfyingasfuck,/r/Satisfyingasfuck/comments/14ib4q8/this_automatically_adjusting_oxygen_mask_for/,EducationalAeries,This automatically adjusting oxygen mask for pilots,7444,0.96,156,,1687662087.0,False,False,False,False,False
91,14imewq,ukraine,/r/ukraine/comments/14imewq/the_russians_dropped_a_prohibited_asphyxiating/,TotalSpaceNut,"The russians dropped a prohibited asphyxiating aerosol ammunition on one of the positions of the Armed Forces of Ukraine. However, the wind was blowing towards the enemy",915,0.99,50,,1687699969.0,False,False,False,False,False
92,14idf5g,NotHowGirlsWork,/r/NotHowGirlsWork/comments/14idf5g/this_sub_made_me_feel_really_well/,mankyox,This sub made me feel really well,4505,0.94,278,,1687669546.0,False,False,False,False,False
93,14ilsou,MurderedByWords,/r/MurderedByWords/comments/14ilsou/murdered_by_the_cops/,Multiplybead97,Murdered by the cops,984,0.97,21,,1687698228.0,False,False,False,False,False
94,14ijwq2,EarthPorn,/r/EarthPorn/comments/14ijwq2/snapped_this_on_a_open_door_helicopter_ride/,ronhairabx,Snapped this on a open door helicopter ride through the Nā Pali Coast yesterday. [OC] [1920x1080],1270,0.97,18,,1687692339.0,False,False,False,False,False
95,14iln2o,Damnthatsinteresting,/r/Damnthatsinteresting/comments/14iln2o/sorvagsvatn_the_lake_that_hangs_over_the_ocean/,Realistic-Song-199,"Sorvagsvatn, the lake that hangs over the ocean. Faroe islands.",2320,0.97,88,,1687697800.0,False,False,False,False,False
96,14ik9ww,WhatsWrongWithYourCat,/r/WhatsWrongWithYourCat/comments/14ik9ww/tasty_water_mmmm/,evahotie,Tasty water mmmm,1160,0.99,16,,1687693577.0,False,False,False,False,False
97,14ijtoc,tifu,/r/tifu/comments/14ijtoc/tifu_by_calling_out_another_mans_name_while_i/,Expensive_highland,TIFU by calling out another man’s name while I slept,1234,0.91,305,,1687692058.0,False,False,False,False,False
98,14ijvop,maybemaybemaybe,/r/maybemaybemaybe/comments/14ijvop/maybe_maybe_maybe/,GeneralAlex,Maybe Maybe Maybe,1229,0.97,26,,1687692245.0,False,False,False,False,False
99,14ie2lj,memes,/r/memes/comments/14ie2lj/ghost_of_medieval_tsushima/,big-daddy-virgin,Ghost of Medieval Tsushima,19423,0.95,176,,1687671717.0,False,False,False,False,False
100,14ilmcu,WitchesVsPatriarchy,/r/WitchesVsPatriarchy/comments/14ilmcu/you_were_built_for_pleasure/,polkadotska,You were built for pleasure!,912,0.97,13,✨Glitter Witch✨:kakuma:,1687697742.0,False,False,False,False,False
