rank,id,subreddit,permalink,author,title,score,upvote_ratio,num_comments,author_flair_text,created_utc,over_18,edited,stickied,locked,is_original_content
1,14tcqkx,facepalm,/r/facepalm/comments/14tcqkx/right_or_wrong_right_though/,Solopeerless,RIGHT OR WRONG... RIGHT THOUGH,12708,0.92,2677,,1688748840.0,False,False,False,False,False
2,14tak4m,Unexpected,/r/Unexpected/comments/14tak4m/you_stupid_fuc_nevermind_have_a_great_day/,PeevishBoi,"You stupid fuc..... nevermind, have a great day.",15858,0.92,465,,1688743975.0,True,False,False,False,False
3,14t80re,WhitePeopleTwitter,/r/WhitePeopleTwitter/comments/14t80re/but_not_a_drag_queen_never_a_drag_queen/,EmptySpaceForAHeart,"But not a Drag Queen, never a Drag Queen.",15747,0.95,567,,1688738161.0,False,False,False,False,False
4,14t6tem,Damnthatsinteresting,/r/Damnthatsinteresting/comments/14t6tem/cathedral_stonemason_at_work/,Vaanced,Cathedral stonemason at work,30359,0.96,869,,1688735152.0,False,False,False,False,False
5,14tbx9l,lotrmemes,/r/lotrmemes/comments/14tbx9l/such_a_good_actor/,UsernameLaugh,Such a good actor,6940,0.98,186,,1688747014.0,False,False,False,False,False
6,14tb2yr,nextfuckinglevel,/r/nextfuckinglevel/comments/14tb2yr/dad_builds_a_custom_adaptive_controller_so_his/,esberat,Dad builds a custom adaptive controller so his daughter can play Zelda- Breath Of The Wild.,8117,0.96,256,,1688745183.0,False,False,False,False,False
7,14tcrwk,MadeMeSmile,/r/MadeMeSmile/comments/14tcrwk/i_love_a_culture_where_the_customer_isnt_always/,Careful_Cup4484,I love a culture where the customer isn’t always right,5820,0.95,388,,1688748921.0,False,False,False,False,False
8,14t7jf5,meirl,/r/meirl/comments/14t7jf5/me_irl/,Sonic_the_hedgedog,me_irl,17897,0.96,387,,1688736942.0,False,False,False,False,False
9,14tb64r,TikTokCringe,/r/TikTokCringe/comments/14tb64r/the_lack_of_self_awareness_is_as_funny_as_it_is/,AzulaOblongata,The lack of self awareness is as funny as it is sad.,6240,0.94,383,,1688745388.0,False,False,False,False,False
10,14t5i7o,politics,/r/politics/comments/14t5i7o/wendy_rogers_may_have_violated_arizonas_revenge/,hunter15991,Wendy Rogers may have violated Arizona’s ‘revenge porn’ law by tweeting x-rated pictures of Hunter Biden,18350,0.95,1046,:flag-il: Illinois,1688731775.0,False,False,False,False,False
11,14t8hlr,todayilearned,/r/todayilearned/comments/14t8hlr/til_upon_the_death_of_the_dalai_lama_a_search_for/,kickbackthisthat,"TIL Upon the death of the Dalai Lama, a search for his reincarnation is conducted where a child is identified through a series of 'tests' before being recognized as the succeeding Dalai Lama. The current Dalai Lama, Tenzin Gyatso, is the 14th.",9495,0.92,934,,1688739243.0,False,False,False,False,False
12,14t83xp,worldnews,/r/worldnews/comments/14t83xp/for_the_fourth_day_in_a_row_earth_has_broken_or/,Mr_Basketcase,"For the fourth day in a row, Earth has broken or equalled its hottest average temperature record",7727,0.96,982,,1688738374.0,False,False,False,False,False
13,14t9dzm,facepalm,/r/facepalm/comments/14t9dzm/billionaire_elon_musk_continues_to_whine_and/,Maximum-Toast,Billionaire Elon Musk; continues to whine and complain about the existence of the newly released Threads app from Instagram/Facebook.,26667,0.86,2983,,1688741340.0,False,False,False,False,False
14,14tak3e,OneOrangeBraincell,/r/OneOrangeBraincell/comments/14tak3e/her_brain_cell_is_used_for_loving/,causeimsammie,Her brain cell is used for loving,5442,0.98,96,,1688743973.0,False,False,False,False,False
15,14t87xx,LeopardsAteMyFace,/r/LeopardsAteMyFace/comments/14t87xx/republican_lawmaker_who_sponsored_a_bill_this/,Mamacrass,Republican lawmaker who sponsored a bill this year attempting to block minors from watching online pornography may have violated the state’s revenge porn law after publicly posting sexually explicit images of Hunter Biden.,6839,0.97,214,,1688738590.0,False,False,False,False,False
16,14t5g35,DesignPorn,/r/DesignPorn/comments/14t5g35/blood_drops_pearl_necklace/,Furr_Fag,Blood drops pearl necklace,16233,0.9,270,,1688731605.0,False,False,False,False,False
17,14tc25m,Eldenring,/r/Eldenring/comments/14tc25m/i_told_him_weve_all_been_there_buddy/,slamriffs,I told him we’ve all been there buddy,4150,0.97,317,,1688747330.0,False,False,False,False,False
18,14t5a26,mildlyinfuriating,/r/mildlyinfuriating/comments/14t5a26/i_need_15/,Sunaliers,I need 15,31778,0.83,2718,,1688731177.0,False,False,False,False,False
19,14t4qzn,oddlysatisfying,/r/oddlysatisfying/comments/14t4qzn/this_lady_showing_off_her_lengthy_hair/,yourSAS,This lady showing off her lengthy hair,27297,0.88,1358,,1688729766.0,False,False,False,True,False
20,14t88ib,nba,/r/nba/comments/14t88ib/jokic_enters_a_store_in_bosnia_to_buy_beer_the/,TennisHive,"Jokic enters a store in Bosnia, to buy beer. The cashier doesn't recognize him. ""You are so tall, you should have been a basketball player"". He smiles.",6530,0.95,536,:den-4: Nuggets,1688738621.0,False,False,False,False,False
21,14t6s3g,cats,/r/cats/comments/14t6s3g/our_station_cat_doing_her_jobkind_of/,paramedTX,Our station cat doing her job…kind of,8793,0.98,343,,1688735066.0,False,False,False,False,False
22,14t6n2z,Breath_of_the_Wild,/r/Breath_of_the_Wild/comments/14t6n2z/i_think_they_do_it_on_purpose/,CrowHoonter,i think they do it on purpose,8873,0.98,144,,1688734765.0,False,False,False,False,False
23,14t5xzi,BeAmazed,/r/BeAmazed/comments/14t5xzi/zebra_be_like_bitch_i_bite_too/,XahidX,Zebra be like: Bitch I bite too,11438,0.96,262,,1688732932.0,False,False,False,False,False
24,14t8i9r,Funnymemes,/r/Funnymemes/comments/14t8i9r/would_you/,No_Stock160,Would you?,6889,0.95,350,,1688739291.0,False,False,False,False,False
25,14taen9,WhitePeopleTwitter,/r/WhitePeopleTwitter/comments/14taen9/stating_facts_is_hate_speech_on_threads/,Shrek-2020,"Stating ""facts"" is hate speech on Threads",9671,0.92,996,,1688743646.0,False,False,False,False,False
26,14tbby7,wholesomememes,/r/wholesomememes/comments/14tbby7/i_can_celebrate_lunar_new_year_now/,blaze_uchiha999,I can celebrate lunar new year now,4123,0.99,72,,1688745732.0,False,False,False,False,False
27,14t4z97,dankmemes,/r/dankmemes/comments/14t4z97/times_change/,Independent_Tooth_23,Times change,17856,0.91,348,,1688730388.0,True,False,False,False,False
28,14t3pup,comics,/r/comics/comments/14t3pup/threads/,Pizzacakecomic,Threads,27887,0.8,1646,PizzaCake,1688726840.0,False,False,False,False,True
29,14t66x4,memes,/r/memes/comments/14t66x4/how_incompetent_do_you_have_to_be_do_make_fans/,OneTurnsToNone,How incompetent do you have to be do make fans hate Star Wars and Indiana Jones a box office flop?,11268,0.92,883,Royal Shitposter,1688733579.0,False,False,False,False,False
30,14t5j0o,TheLastAirbender,/r/TheLastAirbender/comments/14t5j0o/you_miscalculated_i_love_zuko_more_than_i_fear_you/,Recent-Sorbet,You miscalculated... I love Zuko more than I fear you,9847,0.96,374,,1688731833.0,False,False,False,False,False
31,14t3m3i,therewasanattempt,/r/therewasanattempt/comments/14t3m3i/to_have_a_serious_interview/,Onemoretime536,To have a serious interview,15586,0.96,359,,1688726538.0,True,False,False,False,False
32,14t7ziw,WTF,/r/WTF/comments/14t7ziw/x_ray_of_vibrator_stuck_in_rectum_plus_pair_of/,amanitavirosa247,X Ray of vibrator stuck in rectum plus pair of salad tongs which got stuck trying to remove vibrator,5442,0.95,430,,1688738079.0,True,False,False,False,False
33,14tdua6,PublicFreakout,/r/PublicFreakout/comments/14tdua6/a_tourist_restrains_a_pickpocket_in_italy/,ojodefiz,A tourist restrains a pickpocket in Italy 😳,2634,0.98,228,,1688751349.0,True,False,False,False,False
34,14t4hio,inthenews,/r/inthenews/comments/14t4hio/this_is_a_death_sentence_for_me_florida/,diacewrb,‘This is a death sentence for me’: Florida Republican women say they will switch parties after DeSantis approves alimony law,10291,0.9,1223,,1688729021.0,False,False,False,True,False
35,14t2y2w,HolUp,/r/HolUp/comments/14t2y2w/ins_creed_new_update/,sarcasmka14,🍑🍑in's creed (new update),28498,0.92,352,,1688724502.0,False,False,False,False,False
36,14t8bl6,doordash,/r/doordash/comments/14t8bl6/some_of_us_do_actually_act_like_this_is_a_serious/,JSOFL,Some of US do actually act like this is a serious job and DO NOT BEG. I try to do my share of good deeds.,5004,0.97,176,,1688738825.0,False,False,False,False,False
37,14ta48o,tifu,/r/tifu/comments/14ta48o/tifu_sneezing_while_peeing_a_secret_third_thing/,Greirat3,TIFU sneezing while peeing + a secret third thing,3707,0.95,168,,1688742960.0,True,1688748023.0,False,False,False
38,14t92mx,BikiniBottomTwitter,/r/BikiniBottomTwitter/comments/14t92mx/no/,recordingheart,NO.,4153,0.97,61,,1688740574.0,False,False,False,False,False
39,14t3bjl,antiwork,/r/antiwork/comments/14t3bjl/boss_is_upset_that_i_have_a_second_job/,2eggsforbreakfast,Boss is upset that I have a second job,11447,0.96,685,,1688725656.0,False,False,False,False,False
40,14t6fye,LifeProTips,/r/LifeProTips/comments/14t6fye/lpt_if_you_have_a_chatty_wife_perform_mundane/,PhonB80,"LPT: If you have a chatty wife, perform mundane tasks while she monologues",6255,0.86,561,,1688734226.0,False,1688759650.0,False,False,False
41,14t47sv,shitposting,/r/shitposting/comments/14t47sv/praise_spez_for_he_is_53/,NCR_Veteran_Rangers,Praise Spez For He Is 5’3,17400,0.92,146,,1688728260.0,False,False,False,False,False
42,14t9424,funny,/r/funny/comments/14t9424/even_gorillas_need_to_cut_down_on_their_screen/,moeburn,Even Gorillas need to cut down on their screen time,3816,0.95,113,,1688740673.0,False,False,False,False,False
43,14t6pmu,conservativeterrorism,/r/conservativeterrorism/comments/14t6pmu/not_even_hiding_it_anymore/,Throwawaytown33333,Not even hiding it anymore.,5259,0.94,376,,1688734920.0,False,False,False,False,False
44,14t393k,NonPoliticalTwitter,/r/NonPoliticalTwitter/comments/14t393k/doesnt_look_like_suffering_to_me/,Key-Power-9799,Doesn't look like suffering to me,11397,0.96,91,:blue1::blue2::1111::1112:,1688725446.0,False,False,False,False,False
45,14t7p8m,gaming,/r/gaming/comments/14t7p8m/8_years_old/,Alucard0o,8 years old!,4666,0.91,374,,1688737368.0,False,False,False,False,False
46,14t6sf1,OldSchoolCool,/r/OldSchoolCool/comments/14t6sf1/michael_jordan_in_the_1984_olympics_wearing/,OregonTripleBeam,Michael Jordan in the 1984 Olympics wearing Converse shoes,5002,0.96,377,,1688735087.0,False,False,False,False,False
47,14t7mi9,ContagiousLaughter,/r/ContagiousLaughter/comments/14t7mi9/here_we_go/,LaughBakery,Here we go,4670,0.94,193,,1688737175.0,False,False,False,False,False
48,14t4ooe,NatureIsFuckingLit,/r/NatureIsFuckingLit/comments/14t4ooe/tiger_shark_attacks_boat/,thebigchil73,🔥 Tiger shark attacks boat,7219,0.97,499,,1688729581.0,False,False,False,False,False
49,14t4k3c,AnimalsBeingDerps,/r/AnimalsBeingDerps/comments/14t4k3c/you_get_onion_you_become_disney_princess/,No-Assignment7129,"You get onion, you become Disney Princess. ",7718,0.96,304,,1688729228.0,False,False,False,False,False
50,14t9pw4,news,/r/news/comments/14t9pw4/fox_faces_fcc_license_threat_over_false_election/,hcashew,Fox Faces FCC License Threat Over False Election Claims,3277,0.96,116,,1688742079.0,False,False,False,False,False
51,14t9yai,UpliftingNews,/r/UpliftingNews/comments/14t9yai/arizona_governor_oks_over_the_counter_birth/,Imchildfree,Arizona governor Ok's over the counter birth control,3028,0.96,109,,1688742569.0,False,False,False,False,False
52,14t7efj,todayilearned,/r/todayilearned/comments/14t7efj/til_tommy_thompson_was_an_american_treasure/,Flares117,"TIL: Tommy Thompson was an American treasure hunter who successfully found millions of dollars worth of gold coins from the SS Central America. However, he went on the run due to refusing to pay off his debts and is now in jail as he claims to have memory loss of where he hid 500 gold coins.",7753,0.97,480,,1688736595.0,False,False,False,False,False
53,14t8y61,DunderMifflin,/r/DunderMifflin/comments/14t8y61/when_i_was_12_years_old_im_37_now_i_met_this_gal/,travissetsfire,"When I was 12 years old (I'm 37 now) I met this gal at a summer camp that my mom sent me to. After that week ended, I lost contact with her. Last Friday, I found her again and it was an instant connection. Today, I bought her ring.",3535,0.83,716,,1688740301.0,False,False,False,False,False
54,14taosk,JustGuysBeingDudes,/r/JustGuysBeingDudes/comments/14taosk/practicing_chinese_like_a_dude/,meepmeepitsajeep,Practicing Chinese like a dude ,2674,0.95,66,,1688744281.0,False,False,False,False,False
55,14t3vf5,tumblr,/r/tumblr/comments/14t3vf5/both_of_these_are_hilarious_for_entirely/,ElvirCrate,"Both of these are hilarious, for entirely different reasons",8375,0.96,135,,1688727276.0,False,False,False,False,False
56,14t6g2k,ukraine,/r/ukraine/comments/14t6g2k/the_ministry_of_defense_of_ukriane_has_released_a/,UNITED24Media,The Ministry of Defense of Ukriane has released a mysterious video ,4495,0.95,230,:FlagUA: Ukraine Media,1688734233.0,False,False,False,False,False
57,14t9pg5,starwarsmemes,/r/starwarsmemes/comments/14t9pg5/not_very_smart/,The_Alcoholic_Devil,Not very smart,2949,0.97,47,,1688742058.0,False,False,False,False,False
58,14t8qc9,facepalm,/r/facepalm/comments/14t8qc9/i_love_democracy/,Captain1693,I love democracy,17064,0.98,151,,1688739828.0,False,False,False,False,False
59,14t4zld,LateStageCapitalism,/r/LateStageCapitalism/comments/14t4zld/renters_dont_know_how_lucky_they_are/,penguinopusredux,Renters don't know how lucky they are.,5153,0.97,310,,1688730420.0,False,False,False,False,False
60,14t3m3r,Damnthatsinteresting,/r/Damnthatsinteresting/comments/14t3m3r/jesse_owens_after_he_crushed_hitlers_aryan/,Aggravating_Top8394,Jesse Owens after he crushed Hitlers aryan supremacy myth at the 1936 Olympic Games,25731,0.92,961,,1688726539.0,False,False,False,False,False
61,14tc4fb,movies,/r/movies/comments/14tc4fb/indiana_jones_5_it_took_100_vfx_industrial_light/,Key_Damage_9220,‘Indiana Jones 5’: It Took 100+ VFX Industrial Light and Magic Artists to De-Age Harrison Ford,2050,0.93,585,,1688747468.0,False,False,False,False,False
62,14ta45p,maybemaybemaybe,/r/maybemaybemaybe/comments/14ta45p/maybe_maybe_maybe/,XahidX,Maybe maybe maybe,2659,0.89,137,,1688742954.0,True,False,False,False,False
63,14t8x11,technology,/r/technology/comments/14t8x11/tech_execs_are_stressed_out_half_are_heavy/,Sorin61,"Tech execs are stressed out. Half are heavy drinkers and 45% take painkillers, a new study says",2906,0.94,668,,1688740237.0,False,False,False,False,False
64,14t893o,fixedbytheduet,/r/fixedbytheduet/comments/14t893o/big_facts/,mellabarbarella,Big facts,3213,0.94,110,,1688738657.0,False,False,False,False,False
65,14t4f3c,wholesomememes,/r/wholesomememes/comments/14t4f3c/froggy_is_cool/,No-Contribution-96,Froggy IS cool 😎,11842,0.97,43,,1688728842.0,False,False,False,False,False
66,14tbfjo,Grimdank,/r/Grimdank/comments/14tbfjo/the_eldar_are_significantly_less_racist_than_the/,PanAfricanDream,The Eldar are significantly less racist than the Imperium but somehow always catch flak for being racist,2082,0.93,370,,1688745920.0,False,False,False,False,False
67,14t4h18,pcmasterrace,/r/pcmasterrace/comments/14t4h18/im_still_waiting_for_a_monitor_upgrade/,poinguan,I'm still waiting for a monitor upgrade,5747,0.91,1048,,1688728982.0,False,False,False,False,False
68,14t4uby,MemePiece,/r/MemePiece/comments/14t4uby/hes_been_getting_away_with_it_for_years_without/,metalhiro,He’s been getting away with it for years without any suspicion,5369,0.94,133,,1688730023.0,False,False,False,False,False
69,14t0a88,PoliticalHumor,/r/PoliticalHumor/comments/14t0a88/it_sucks_that_racists_hijacked_actual_patriotism/,Open-Vermicelli-5495,It sucks that racists hijacked actual patriotism,13705,0.91,716,,1688716077.0,False,False,False,False,False
70,14t84w6,MadeMeSmile,/r/MadeMeSmile/comments/14t84w6/daddys_girl_for_life/,bindukwe,Daddy's girl for life,5496,0.94,124,,1688738428.0,False,False,False,False,False
71,14ta00j,BlackPeopleTwitter,/r/BlackPeopleTwitter/comments/14ta00j/and_she_stayed_like_a_real_woman/,jorginho20regista,And she stayed like a real woman,2362,0.89,195,,1688742677.0,False,False,False,False,False
72,14t9atk,StupidFood,/r/StupidFood/comments/14t9atk/i_feel_really_sick_just_by_watching_this/,aridrawzstuff,I feel really sick just by watching this...,2605,0.88,1002,,1688741123.0,False,False,False,False,False
73,14t44w8,Animemes,/r/Animemes/comments/14t44w8/you_can_never_be_too_cautious/,Fulltime_Introvert,You can never be too cautious,6018,0.94,136,,1688728013.0,False,False,False,False,False
74,14tai7i,WitchesVsPatriarchy,/r/WitchesVsPatriarchy/comments/14tai7i/supreme_court_orcas/,sailorjupiter28titan,Supreme Court Orcas,2173,0.95,28,☉ Apostate ✨ Witch of Aiaia ♀,1688743855.0,False,False,False,False,False
75,14t6ser,mildlyinfuriating,/r/mildlyinfuriating/comments/14t6ser/i_watch_the_maintenance_crew_dump_the_recycling/,DrTreesus,I watch the maintenance crew dump the recycling into the trash bag every day after work. Why even have recycling bins?,6649,0.96,920,,1688735087.0,False,False,False,False,False
76,14t68zt,CrazyFuckingVideos,/r/CrazyFuckingVideos/comments/14t68zt/well_hello_there/,Chakwenta,"Well, hello there ",3796,0.95,128,,1688733733.0,True,False,False,False,False
77,14t7ywz,MemeVideos,/r/MemeVideos/comments/14t7ywz/_/,Select-Water-9655,🔥,2985,0.97,50,,1688738042.0,False,False,False,False,False
78,14temuc,nba,/r/nba/comments/14temuc/video_of_the_britney_spears_and_victor_wembanyama/,Vishion-8,Video of the Britney Spears and Victor Wembanyama incident via TMZ,2192,0.98,1332,:nba-1: NBA,1688753139.0,False,False,False,False,False
79,14t29l1,2meirl4meirl,/r/2meirl4meirl/comments/14t29l1/2meirl4meirl/,tHeBrUt3KiLLeR,2meirl4meirl,7811,0.97,139,,1688722403.0,False,False,False,False,False
80,14t54s3,oddlyspecific,/r/oddlyspecific/comments/14t54s3/in_my_work_we_have_a_ladder_that_cannot_be_used/,SaxLert,In my work we have a ladder that cannot be used by people from Netherlands,4417,0.97,121,,1688730808.0,False,False,False,False,False
81,14t7oqp,shittytattoos,/r/shittytattoos/comments/14t7oqp/saw_this_on_instagram_today/,Nkama77,Saw this on Instagram today..,2879,0.95,190,,1688737333.0,False,False,False,False,False
82,14t9z6x,Unexpected,/r/Unexpected/comments/14t9z6x/early_ptsd/,Thapee,Early PTSD!,4033,0.95,129,,1688742628.0,False,False,False,False,False
83,14t62g0,ATBGE,/r/ATBGE/comments/14t62g0/blood_drops_pearl_necklace/,Accomplished_Run_235,Blood drops pearl necklace,3661,0.85,201,,1688733245.0,False,False,False,False,False
84,14t68bv,JoeRogan,/r/JoeRogan/comments/14t68bv/the_older_i_get_the_more_i_hate_wealthy_people/,SkepticDrinker,The older i get the more I hate wealthy people talking about 9 to 5 jobs,3473,0.88,662,Monkey in Space,1688733679.0,False,False,False,False,False
85,14t4szc,nextfuckinglevel,/r/nextfuckinglevel/comments/14t4szc/this_monster_truck_backflip_is_absolutely_insane/,ReturnOneWayTicket,This Monster Truck backflip is absolutely insane!,8947,0.96,305,,1688729922.0,False,False,False,False,False
86,14t9ska,distressingmemes,/r/distressingmemes/comments/14t9ska/its_dusty/,Old-Conversation-506,it's dusty,2200,0.98,69,,1688742235.0,False,False,False,False,False
87,14tdtq0,Overwatch,/r/Overwatch/comments/14tdtq0/is_15249m_enough_to_make_talent_trees/,shiftup1772,Is $152.49M enough to make talent trees?,1358,0.97,95,,1688751314.0,False,False,False,False,False
88,14t2pj5,AITAH,/r/AITAH/comments/14t2pj5/aitah_by_not_clearing_with_my_daughter_im_dating/,,AITAH by not clearing with my daughter I'm dating a white woman?,6438,0.91,2214,,1688723838.0,False,False,False,False,False
89,14tadrb,oddlysatisfying,/r/oddlysatisfying/comments/14tadrb/cathedral_stonemason/,Jmac0585,Cathedral stonemason,3458,0.97,84,,1688743591.0,False,False,False,False,False
90,14t5bfp,PublicFreakout,/r/PublicFreakout/comments/14t5bfp/mans_failed_attempt_to_rob_nail_salon_in_atlanta/,GramzOnline,Man’s failed attempt to rob nail salon in Atlanta 07/03/2023,6982,0.98,508,,1688731271.0,False,False,False,False,False
91,14tapiz,educationalgifs,/r/educationalgifs/comments/14tapiz/how_windows_go_up_and_down_in_a_car/,volossaveroniki,How windows go up and down in a car.,1868,0.94,60,,1688744325.0,False,False,False,False,False
92,14tc0oa,books,/r/books/comments/14tc0oa/george_rr_martin_dont_be_too_impatient_its_only/,RobertoSerrano2003,"George R.R. Martin: ""Don't be too impatient, it's only been 12 years since the last one""",1596,0.9,688,,1688747230.0,False,False,False,False,False
93,14t8ems,PoliticalCompassMemes,/r/PoliticalCompassMemes/comments/14t8ems/as_an_european_it_amazes_me_that_you_could_put/,Gilboss_dc,"As an European it amazes me that you could put children on hormones blockers in the first place, wtf is happening in 🇺🇸 and 🇨🇦?",2442,0.87,602,:right: - Right,1688739041.0,False,False,False,False,False
94,14t4b85,formuladank,/r/formuladank/comments/14t4b85/so_who_is_crashing_this_year/,Odd_Issue_4668,So who is crashing this year,4513,0.97,251,BWOAHHHHHHH ,1688728538.0,False,False,False,False,False
95,14t726f,oddlyterrifying,/r/oddlyterrifying/comments/14t726f/when_you_hide_some_private_files_for_your_eyes/,officerpaws,When you hide some private files for your eyes only and see this the next day,2914,0.98,39,,1688735757.0,False,False,False,False,False
96,14t0nhx,rareinsults,/r/rareinsults/comments/14t0nhx/he_is_a_psychiatrist_witness/,MalayaCarly,He is a psychiatrist witness,9865,0.97,202,,1688717182.0,False,False,False,False,False
97,14t5oe3,SipsTea,/r/SipsTea/comments/14t5oe3/owners_reunited_with_dog_after_he_went_missing/,Grace_Johna,Owners reunited with dog after he went missing during a car accident,3528,0.98,122,,1688732241.0,False,False,False,False,False
98,14t8eef,popculturechat,/r/popculturechat/comments/14t8eef/keke_palmers_baby_daddy_is_already_in_other/,isabellapintoisback,Keke Palmer’s baby daddy is already in other women’s DMs!,2298,0.92,336,,1688739024.0,False,False,False,False,False
99,14tceos,whenthe,/r/whenthe/comments/14tceos/double_budget_infinitely_dogshit_product/,proviking6000,double budget = infinitely dogshit product,1497,0.98,63,,1688748111.0,False,False,False,False,False
100,14t6b6f,Serverlife,/r/Serverlife/comments/14t6b6f/tired_of_weird_a_men/,cl1mate,tired of weird a$$ men,2974,0.91,698,,1688733901.0,False,False,False,False,False
