rank,id,subreddit,permalink,author,title,score,upvote_ratio,num_comments,author_flair_text,created_utc,over_18,edited,stickied,locked,is_original_content
1,14hiw0j,worldnews,/r/worldnews/comments/14hiw0j/wagner_boss_says_hes_en_route_to_moscow_and_ready/,GeoPoliticsMyThang11,"Wagner Boss Says He’s En Route to Moscow and ‘Ready to Die’ With 25,000 Fighters",21055,0.97,2522,,1687579595.0,False,False,False,False,False
2,14hgqwv,WhitePeopleTwitter,/r/WhitePeopleTwitter/comments/14hgqwv/looks_like_a_coup_is_happening_in_russia/,seangolden06,Looks like a coup is happening in Russia,25736,0.96,1124,,1687573024.0,False,False,False,False,False
3,14hff09,facepalm,/r/facepalm/comments/14hff09/oceangate_ceo_stockton_rush_email_exchange_with/,Dapper_Commission915,OceanGate CEO Stockton Rush email exchange with Submersible Operations Expert (Rob McCallum),52253,0.97,3166,,1687569043.0,False,False,False,False,False
4,14hhe0v,politics,/r/politics/comments/14hhe0v/us_says_wagner_coup_is_real_and_serious_as_white/,Haltopen,US says Wagner coup is ‘real’ and ‘serious’ as White House consults allies,11605,0.98,1566,:flag-ma: Massachusetts,1687574951.0,False,False,False,False,False
5,14hhrb8,gaming,/r/gaming/comments/14hhrb8/the_elder_scrolls_6_is_still_5_to_6_years_away/,blackwolf57,The Elder Scrolls 6 is still 5 to 6 years away and it is not yet decided if there will be a PlayStation version. Mentioned by Phil Spencer during the FTC trial.,9350,0.96,1621,,1687576051.0,False,False,False,False,False
6,14hgoid,cats,/r/cats/comments/14hgoid/the_black_one_ran_away_for_2_days_and_the_fat_one/,Basil_Minimum,The black one ran away for 2 days and the fat one did this as soon as she came home … why?,10644,0.97,453,,1687572829.0,False,False,False,False,False
7,14hh824,TikTokCringe,/r/TikTokCringe/comments/14hh824/he_crushed_this_explanation/,Snoo-33732,He crushed this explanation 🌊,8337,0.95,380,,1687574469.0,False,False,False,False,False
8,14hi2o1,wholesomememes,/r/wholesomememes/comments/14hi2o1/no_matter_are_you_deaf_or_not/,MrArsikk,No matter are you deaf or not!,7345,0.97,183,,1687577014.0,False,False,False,False,False
9,14hdebp,mildlyinfuriating,/r/mildlyinfuriating/comments/14hdebp/airbnb_host_tried_to_charge_us_for_changing/,ViberNaut,Airbnb host tried to charge us for changing settings on a thermostat,31210,0.95,1787,,1687563503.0,False,False,False,False,False
10,14hdohd,news,/r/news/comments/14hdohd/iowa_meteorologist_chris_gloninger_quits_18year/,Steel9966,Iowa meteorologist Chris Gloninger quits 18-year career after death threat over climate coverage,18068,0.95,684,,1687564255.0,False,False,False,False,False
11,14hg793,CombatFootage,/r/CombatFootage/comments/14hg793/pmc_wagner_convoy_driving_around_a_road_block_in/,klas228,PMC Wagner Convoy driving around a road block in Rostov,8472,0.97,771,,1687571414.0,False,False,False,False,False
12,14hi1jp,nextfuckinglevel,/r/nextfuckinglevel/comments/14hi1jp/unique_serving_way_in_a_restaurant/,amit-gautam,Unique serving way in a restaurant ,7006,0.9,520,,1687576916.0,False,False,False,False,False
13,14hdunm,wallstreetbets,/r/wallstreetbets/comments/14hdunm/choose_your_fighter/,QuirkyAverageJoe,Choose Your Fighter 🚨,16348,0.93,1582,,1687564725.0,False,False,False,False,False
14,14hhmi7,todayilearned,/r/todayilearned/comments/14hhmi7/til_the_founders_of_outback_steakhouse/,helpmeredditimbored,"TIL the founders of Outback Steakhouse intentionally decided not to visit Australia, as they were concerned that having too much authenticity would confuse customers",6124,0.97,467,,1687575661.0,False,False,False,False,False
15,14hcyxn,oddlysatisfying,/r/oddlysatisfying/comments/14hcyxn/cutting_polymer_clay_and_reshaping/,Gh0stDestr0y,Cutting polymer clay and reshaping,24391,0.93,137,Flair Loading...,1687562367.0,False,False,False,False,False
16,14himhl,shittymoviedetails,/r/shittymoviedetails/comments/14himhl/elemental_2023_is_doing_so_badly_in_the_box/,CoolJoshido,"Elemental (2023) is doing so badly in the Box Office, Pixar has resorted to making fake audience reactions with a fake camrip to promote it. This is cringe™️. ",4917,0.96,274,,1687578771.0,False,False,False,False,False
17,14hf6k3,baseball,/r/baseball/comments/14hf6k3/de_la_cruz_triples_to_complete_the_cycle/,carlsaganfedoraswag,De La Cruz triples to complete the cycle,8138,0.95,979,Cincinnati Reds :cin3:,1687568403.0,False,False,False,False,False
18,14hey3x,UkraineWarVideoReport,/r/UkraineWarVideoReport/comments/14hey3x/alleged_firefight_on_m4_highway_outside_of_rostov/,Demither10,Alleged Firefight on M4 Highway outside of Rostov between Wagner fighters and Russian National Guard,8666,0.97,791,,1687567730.0,False,False,False,False,False
19,14hcs15,OldSchoolCool,/r/OldSchoolCool/comments/14hcs15/my_parents_at_prom_in_the_80s/,ScallionMaximum234,My parents at prom in the 80s,11950,0.95,902,,1687561868.0,False,False,False,False,False
20,14hjtxd,WTF,/r/WTF/comments/14hjtxd/splitted/,yudoit,Splitted,3088,0.94,288,,1687582658.0,False,False,False,False,False
21,14he8d4,inthenews,/r/inthenews/comments/14he8d4/wagner_chief_prigozhin_marches_his_troops_into/,AuthorTomFrost,"Wagner chief Prigozhin marches his troops into Russia, declares war on Russian military leadership, says ‘we will destroy everything’",7884,0.97,974,,1687565742.0,False,False,False,False,False
22,14hdn9g,AskReddit,/r/AskReddit/comments/14hdn9g/which_celebrity_gives_off_vibes_that_they_have/,GreenerPeach01,"Which celebrity gives off vibes that they have committed crimes but keep getting away with it, and you're just waiting for them to get officially caught/charged?",10502,0.9,6697,,1687564168.0,True,False,False,False,False
23,14hgpwd,PublicFreakout,/r/PublicFreakout/comments/14hgpwd/the_wagner_pmc_has_now_mutinied_en_masse_tanks/,LouisSaintJust1789,The Wagner PMC has now mutinied en masse. Tanks have surrounded the Defence Ministry building in Rostov-on-Don,4960,0.97,274,,1687572939.0,False,False,False,False,False
24,14hibws,dankmemes,/r/dankmemes/comments/14hibws/submarine_is_old_news_new_wagner_album_just/,PicklesTheHamster,"Submarine is old news, new Wagner album just dropped.",4114,0.98,54,,1687577832.0,False,False,False,False,False
25,14hclbk,OneOrangeBraincell,/r/OneOrangeBraincell/comments/14hclbk/brain_cell_malfunctioned_floof_belly_defenses_are/,LeninaCrowneIn2020,Brain cell malfunctioned. Floof belly defenses are down. Now's my chance to touch the floof.,10764,0.97,135,,1687561376.0,False,False,False,False,False
26,14hhhkv,unpopularopinion,/r/unpopularopinion/comments/14hhhkv/the_most_comfortable_clothing_to_sleep_in_is/,teaspoon96atl,The most comfortable clothing to sleep in is stiff jeans,4395,0.87,604,,1687575243.0,False,False,False,False,False
27,14h9sca,MadeMeSmile,/r/MadeMeSmile/comments/14h9sca/weather_reporters_fun_idea_to_dress_up_as_cloud/,astralrig96,Weather reporter’s fun idea to dress up as cloud!,25445,0.96,184,,1687554347.0,False,False,False,False,False
28,14hetqe,HolUp,/r/HolUp/comments/14hetqe/happy_drum_noises/,esberat,*Happy drum noises*,7947,0.98,53,:zfg1::zfg2::zfg3::zfg4:,1687567392.0,False,False,False,False,False
29,14hgkt7,ThatsInsane,/r/ThatsInsane/comments/14hgkt7/civil_war_has_begun_in_russia_tonight_reports_of/,ResJustRes,"Civil war has begun in Russia, tonight reports of 25k Wagner mercs on route to Moscow, FSB trying to stop them in Rostov",4724,0.96,392,,1687572533.0,False,False,False,False,False
30,14hfvwb,antiwork,/r/antiwork/comments/14hfvwb/down_with_the_system/,Fluid_Bad_1340,Down with the system,5182,0.98,112,,1687570446.0,False,False,False,False,False
31,14hbtt2,Damnthatsinteresting,/r/Damnthatsinteresting/comments/14hbtt2/watch_jack_nicholson_get_into_character_for_the/,bindukwe,Watch Jack Nicholson get into character for The Shining,16735,0.96,281,,1687559392.0,False,False,False,False,False
32,14hc63t,shitposting,/r/shitposting/comments/14hc63t/that_thousand_yard_stare_worship_spez/,Hondipo,That thousand yard stare | Worship Spez,21374,0.94,312,,1687560281.0,False,False,False,False,False
33,14hew78,awfuleverything,/r/awfuleverything/comments/14hew78/negligent_parents_and_the_horrific_consequences/,Alien__Yes,Negligent parents and the horrific consequences,6302,0.97,410,,1687567578.0,False,False,False,False,False
34,14hgoc4,nba,/r/nba/comments/14hgoc4/kevin_durant_hops_into_a_twitter_space_called_kd/,IMKudaimi123,Kevin Durant hops into a Twitter space called “KD is not top 5”,3985,0.95,565,:chi-2: Bulls,1687572814.0,False,1687573775.0,False,False,False
35,14h90f5,LateStageCapitalism,/r/LateStageCapitalism/comments/14h90f5/if_youre_not_trying_to_save_only_rich_parasites/,ADignifiedLife,"If you're not trying to save only rich parasites, you'll get punished for it. Bizarro world!!",19790,0.92,455,Basic human needs shouldn't be commodified ,1687552512.0,False,False,False,True,False
36,14h9d8q,WorkReform,/r/WorkReform/comments/14h9d8q/you_get_taxed_on_everything_here/,CapableSwordfishs,You get taxed on everything here,15740,0.96,441,,1687553376.0,False,False,False,False,False
37,14ha1lb,me_irlgbt,/r/me_irlgbt/comments/14ha1lb/me_irlgbt/,Murky_Height_4407,me_irlgbt,14876,0.93,142,,1687554974.0,True,False,False,False,False
38,14hdl0g,comics,/r/comics/comments/14hdl0g/sonic_adventure_swipe/,LastPlaceComics,Sonic Adventure ( SWIPE ---> ),6518,0.95,83,,1687563999.0,False,False,False,False,False
39,14he8ed,ukraine,/r/ukraine/comments/14he8ed/lets_not_forget_the_price_of_freedom_anton/,Lysychka-,"Let's not forget the price of freedom: Anton Prasolenko, He played in the theater, loved life, lived next to us, and died for us in Bakhmut.",5342,0.97,60,Скажи паляниця,1687565744.0,False,False,False,False,False
40,14hh5fz,marvelstudios,/r/marvelstudios/comments/14hh5fz/logan_director_james_mangold_wishes_wolverine/,Louis_DCVN,"LOGAN director James Mangold wishes Wolverine wasn't in DEADPOOL 3 but he isn't surprised: ""There was always going to be another Wolverine ... As much liquid as they can squeeze out of that rag, they're going to try to""",3304,0.91,331,,1687574252.0,False,False,False,False,False
41,14hlkix,de,/r/de/comments/14hlkix/was_ist_eben_passiert/,Faehr_Vieh_Fass,Was ist eben passiert?,1543,0.97,159,,1687588549.0,True,False,False,False,False
42,14hgg1j,IASIP,/r/IASIP/comments/14hgg1j/the_show_needs_to_bring_back_the_only_person_who/,columbo928s4,The show needs to bring back the only person who ever understood Dennis...,3535,0.95,174,,1687572136.0,False,False,False,False,False
43,14h7ru1,StupidFood,/r/StupidFood/comments/14h7ru1/petition_to_make_fake_salt_bae_the_avatar_of/,emoteriyaki,Petition to make FAKE Salt Bae the avatar of stupid food,25930,0.91,596,,1687549502.0,False,False,False,False,False
44,14hh8en,UkrainianConflict,/r/UkrainianConflict/comments/14hh8en/wagner_coup_us_says_situation_is_serious_as_white/,ByeLassMyLove,Wagner coup: US says situation is ‘serious’ as White House consults allies,3126,0.98,453,,1687574496.0,False,False,False,False,False
45,14hefgt,animememes,/r/animememes/comments/14hefgt/love_him_or_hate_him_but_you_have_to_admit_that/,Con___artist,Love him or hate him but you have to admit that he is a true King,5866,0.93,137,,1687566284.0,False,False,False,False,False
46,14hdae6,AccidentalAlly,/r/AccidentalAlly/comments/14hdae6/bro_turned_him_amab/,WestCountryGayBoy,Bro turned him amab,6120,0.95,118,,1687563202.0,False,False,False,False,False
47,14he2fs,memes,/r/memes/comments/14he2fs/another_medieval_loophole_to_add_to_the_collection/,Significant_Toe277,Another medieval loophole to add to the collection,7163,0.94,115,,1687565276.0,False,False,False,False,False
48,14hdt7r,AmItheAsshole,/r/AmItheAsshole/comments/14hdt7r/aita_for_kicking_the_majority_of_my_husbands/,snoopgoop7,AITA for kicking the majority of my husbands family out of our wedding when they celebrated their traditions but violated many of my personal rules and boundaries?,5550,0.95,728,,1687564607.0,False,1687573383.0,False,False,False
49,14hbqan,therewasanattempt,/r/therewasanattempt/comments/14hbqan/to_sunbath_in_peace/,ilovekerma,To sunbath in peace.,8109,0.96,857,,1687559142.0,False,False,False,False,False
50,14hdxyd,MurderedByWords,/r/MurderedByWords/comments/14hdxyd/both_silenced_and_debate_me_crowd/,whenitpours3,Both Silenced and Debate Me Crowd,5091,0.95,116,,1687564944.0,False,False,False,False,False
51,14hexfn,lotrmemes,/r/lotrmemes/comments/14hexfn/no_better_way_to_spend_friday_night_alone/,OsjosisMoans,No better way to spend Friday night alone,4284,0.96,203,,1687567676.0,False,False,False,False,False
52,14hfs5y,shittytattoos,/r/shittytattoos/comments/14hfs5y/this_poor_soul_knell_for_the_cross/,Hammy-Cheeks,This poor soul. Knell for the cross....,3824,0.94,546,,1687570142.0,False,False,False,False,False
53,14hd9kv,fightporn,/r/fightporn/comments/14hd9kv/rollin_40s_crip_protects_a_student_getting_jumped/,dupey69,Rollin 40’s crip protects a student getting jumped,5615,0.95,363,,1687563140.0,False,False,False,False,False
54,14hg2dx,Hololive,/r/Hololive/comments/14hg2dx/cant_belive_she_really_said/,Madraccy,Can't belive she really said 🙂,3653,0.94,46,,1687570994.0,False,False,False,False,False
55,14h8o7c,popculturechat,/r/popculturechat/comments/14h8o7c/im_sick_of_lusting_after_pricks_and_cheaters_so/,pannonica,"I'm sick of lusting after pricks and cheaters, so let's DO THIS: who's your favorite *non-problematic* man in entertainment?",15650,0.86,2492,,1687551674.0,False,False,False,True,False
56,14hjske,HonkaiStarRail,/r/HonkaiStarRail/comments/14hjske/i_swear_sampo_is_like_the_most_divisive_character/,ScarHydreigon87,I swear Sampo is like the most divisive character among the fandom,1889,0.95,107,,1687582527.0,False,False,False,False,False
57,14hczx4,worldnews,/r/worldnews/comments/14hczx4/wagner_mercenary_chief_calls_for_armed_rebellion/,GiantSalt95,Wagner mercenary chief calls for armed rebellion against Russian military leadership,39125,0.96,2757,,1687562437.0,False,False,False,False,False
58,14hcv7w,technicallythetruth,/r/technicallythetruth/comments/14hcv7w/never_asking_my_friend_for_advice_again/,Terryblepun,Never asking my friend for advice again,6165,0.98,39,,1687562100.0,False,False,False,False,False
59,14hiw73,Breath_of_the_Wild,/r/Breath_of_the_Wild/comments/14hiw73/my_game_has_a_lot_of_unloaded_textures_apparently/,kyxst,My game has a lot of unloaded textures apparently. So here's a rainbow lynel.,2161,0.98,95,,1687579612.0,False,False,False,False,False
60,14hdc2r,BrandNewSentence,/r/BrandNewSentence/comments/14hdc2r/team_congee_masterrace/,innvme,Team Congee Masterrace,5389,0.98,45,,1687563334.0,False,False,False,False,False
61,14hgxv5,facepalm,/r/facepalm/comments/14hgxv5/the_go_woke_go_broke_crowd_turned_a_mexican/,Mr__O__,The ‘go woke go broke’ crowd turned a Mexican import beer into the top US beer,10892,0.88,1785,,1687573617.0,False,False,False,False,False
62,14h8sg7,CrazyFuckingVideos,/r/CrazyFuckingVideos/comments/14h8sg7/he_got_him/,Mirror24568,He got him,12000,0.96,291,,1687551960.0,False,False,False,False,False
63,14heui8,TheLastAirbender,/r/TheLastAirbender/comments/14heui8/katara_in_air_nomad_outfit_by_hrlshnv/,asilvertintedrose,Katara in Air Nomad outfit [By @hrlshnv],3978,0.96,79,,1687567455.0,False,False,False,False,False
64,14hdma6,WhitePeopleTwitter,/r/WhitePeopleTwitter/comments/14hdma6/900_miles_10_minute_charge_rip_tesla/,KyloRenKardashian,"+900 miles, 10 minute charge. RiP tEsla",24768,0.93,1503,,1687564092.0,False,False,False,False,False
65,14hb8dd,Eyebleach,/r/Eyebleach/comments/14hb8dd/aint_she_precious/,Pretty_Average-,Ain’t she precious,6905,0.97,50,,1687557904.0,False,False,False,False,False
66,14hf3c2,discordVideos,/r/discordVideos/comments/14hf3c2/someone_know_the_song/,Dramatic_Gap_6177,someone know the song?,4378,0.9,394,,1687568142.0,True,False,False,False,False
67,14he7jv,terriblefacebookmemes,/r/terriblefacebookmemes/comments/14he7jv/special_of_the_day_i_guess/,Texgymratdad,Special of the day I guess,4407,0.9,252,,1687565675.0,True,False,False,False,False
68,14heqga,nope,/r/nope/comments/14heqga/okay_bye/,jedisk8er945,"Okay, bye…",3952,0.99,214,,1687567137.0,False,False,False,False,False
69,14hclkc,BeAmazed,/r/BeAmazed/comments/14hclkc/at_103_years_old_this_woman_has_been_lobstering/,KimCureAll,"At 103 years old, this woman has been lobstering for 95 years",5317,0.94,203,,1687561391.0,False,False,False,False,False
70,14h8994,oddlyterrifying,/r/oddlyterrifying/comments/14h8994/former_nba_player_manute_bol_height_77_swimming/,AccomplishedBig7666,Former NBA player Manute Bol height 7’7 swimming in a pool in first pic (1987),14741,0.95,421,,1687550666.0,False,False,False,False,False
71,14hfitz,aww,/r/aww/comments/14hfitz/oc_my_cat_loafing_with_a_whole_bakery_in_his_trunk/,reessies,[OC] my cat loafing with a whole bakery in his trunk,3271,0.94,30,,1687569349.0,False,False,False,False,False
72,14hax9s,instantkarma,/r/instantkarma/comments/14hax9s/random_public_beatdown_for_beating_woman_x/,Fayiette,Random Public Beatdown for beating woman :x,7406,0.94,224,,1687557129.0,True,False,False,False,False
73,14hbqfv,politics,/r/politics/comments/14hbqfv/federal_court_halts_floridas_drag_ban_calling_it/,theindependentonline,"Federal court halts Florida’s drag ban, calling it attempt to ‘suppress the speech’ rights of performers",40120,0.94,878,The Independent,1687559153.0,False,False,False,False,False
74,14hg3bj,DeepRockGalactic,/r/DeepRockGalactic/comments/14hg3bj/deep_rock_galactic_really_needs_to_invest_in_some/,Shidskit,Deep Rock Galactic really needs to invest in some better equipment,2878,0.96,101,,1687571073.0,False,False,False,False,False
75,14hf7lk,pcmasterrace,/r/pcmasterrace/comments/14hf7lk/first_build_went_great/,BeanMotorsport,First build went great,3191,0.96,107,,1687568474.0,False,False,False,False,False
76,14h5zh8,aviation,/r/aviation/comments/14h5zh8/apparently_the_carbon_fiber_used_to_build_the/,Raybanned4lyfe,"Apparently the carbon fiber used to build the Titan's hull was bought by OceanGate from Boeing at a discount, because it was ‘past its shelf-life’",15977,0.95,1436,,1687545094.0,False,False,False,False,False
77,14hiolo,starterpacks,/r/starterpacks/comments/14hiolo/main_street_in_a_small_american_town_starter_pack/,tourmalinefigurine,Main street in a small (American) town starter pack,1810,0.95,114,,1687578971.0,False,False,False,False,False
78,14h7a6v,meirl,/r/meirl/comments/14h7a6v/meirl/,Jimbo072,meirl,16803,0.93,424,,1687548260.0,False,False,False,False,False
79,14hmuti,2westerneurope4u,/r/2westerneurope4u/comments/14hmuti/belgium/,semtexxxx,Belgium 🇧🇪 🫡,873,0.93,91,:Belgium: Separatist,1687593140.0,False,False,False,False,False
80,14hdgss,maybemaybemaybe,/r/maybemaybemaybe/comments/14hdgss/maybe_maybe_maybe/,H_G_Bells,Maybe maybe maybe,4166,0.95,67,,1687563693.0,False,False,False,False,False
81,14hbg1t,BlackPeopleTwitter,/r/BlackPeopleTwitter/comments/14hbg1t/adult_swim/,SpectacularOtter,Adult Swim,5306,0.95,235,☑️  Horny Police 🚔🚨,1687558430.0,False,False,False,False,False
82,14hg357,TerrifyingAsFuck,/r/TerrifyingAsFuck/comments/14hg357/hand_fed_a_shark/,3wayiii,Hand Fed a Shark ,2688,0.97,155,,1687571059.0,True,False,False,False,False
83,14hecq7,Animemes,/r/Animemes/comments/14hecq7/we_are_sorry_king_zanac/,Con___artist,We are Sorry King Zanac,3631,0.98,88,,1687566076.0,False,False,False,False,False
84,14h6aea,Whatcouldgowrong,/r/Whatcouldgowrong/comments/14h6aea/overinflating_your_tyre/,uchman365,Over-inflating your tyre,13984,0.95,892,,1687545852.0,False,False,False,False,False
85,14hdhzi,ATBGE,/r/ATBGE/comments/14hdhzi/this_suit/,catherineshere,This suit 💀,3622,0.95,218,,1687563786.0,False,False,False,False,False
86,14hhif9,SquaredCircle,/r/SquaredCircle/comments/14hhif9/bowens_if_ya_told_me_years_ago_id_have_an_arena/,goodgollygopher,"Bowens: ""If ya told me years ago, I’d have an arena chanting HE’S GAY at me in the most POSITIVE of ways, I’d say you’re crazy. It’s pretty cool to see how far we’ve come. Still more work to do. Happy Pride""",1930,0.93,107,YO! YO! LISTEN! LISTEN!,1687575314.0,False,False,False,False,False
87,14hea8a,doordash_drivers,/r/doordash_drivers/comments/14hea8a/delivered_to_a_grieving_child_today/,Pitiful_Chef5879,Delivered to a grieving child today….,3130,0.98,146,,1687565888.0,False,False,False,False,False
88,14hm8vy,rareinsults,/r/rareinsults/comments/14hm8vy/check_this_dude_out/,dumpycalamus,Check this dude out,857,0.97,46,,1687590922.0,False,False,False,False,False
89,14hcsl1,Weird,/r/Weird/comments/14hcsl1/this_guy_with_horns_who_stands_on_the_side_of_the/,forthunt,This guy with horns who stands on the side of the highway by my house,3907,0.95,515,,1687561905.0,False,False,False,False,False
90,14h9try,AnarchyChess,/r/AnarchyChess/comments/14h9try/bro_premoved_his_opening/,SlowlyElite,Bro premoved his opening💀,6335,0.97,72,,1687554440.0,False,False,False,False,False
91,14hjlkp,sadposting,/r/sadposting/comments/14hjlkp/equality/,Emotional_Log2635,Equality.   :),1244,0.95,92,,1687581889.0,False,False,False,False,False
92,14hb231,Superstonk,/r/Superstonk/comments/14hb231/rc_tweet/,weenythebooty,Rc tweet,5520,0.92,363,Gamecock,1687557479.0,False,False,False,False,False
93,14hey7z,MemeVideos,/r/MemeVideos/comments/14hey7z/4_combo/,RafidUwU,+4 Combo,2753,0.98,89,,1687567739.0,False,False,False,False,False
94,14h89w6,marvelmemes,/r/marvelmemes/comments/14h89w6/just_gonna_ignore_that/,Disastrous_Eye9123,Just gonna ignore that,8131,0.96,157,Spider-Man (Homemade),1687550713.0,False,False,False,False,False
95,14h551l,Tinder,/r/Tinder/comments/14h551l/went_for_it/,ObviouslyAnAlias7,Went for it?,11716,0.97,285,,1687542982.0,False,False,False,False,False
96,14h8hdf,ContagiousLaughter,/r/ContagiousLaughter/comments/14h8hdf/water_bottle_on_fan_challenge_with_dad/,Xman71105,Water bottle on fan challenge with dad,6593,0.96,122,,1687551222.0,False,False,False,False,False
97,14hjdmu,apexlegends,/r/apexlegends/comments/14hjdmu/this_is_a_1_pickrate_legend/,anidevv,This is a 1% pickrate legend,1221,0.94,146,Pathfinder :pathfinder:,1687581154.0,False,False,False,False,False
98,14h4oej,ProgrammerHumor,/r/ProgrammerHumor/comments/14h4oej/thingsthatkeepmeupatnight/,huxx__,thingsThatKeepMeUpAtNight,13905,0.95,262,,1687541833.0,False,False,False,False,False
99,14hcqxc,TwoXChromosomes,/r/TwoXChromosomes/comments/14hcqxc/have_the_girl_go_get_coffee/,pissrightoutmyass,"""Have the girl go get coffee""",3334,0.95,142,,1687561795.0,False,False,False,False,False
100,14hegst,2meirl4meirl,/r/2meirl4meirl/comments/14hegst/2meirl4meirl/,CthulhusIntern,2meirl4meirl,2659,0.98,35,,1687566384.0,False,False,False,False,False
