rank,id,subreddit,permalink,author,title,score,upvote_ratio,num_comments,author_flair_text,created_utc,over_18,edited,stickied,locked,is_original_content
1,14pbfqt,facepalm,/r/facepalm/comments/14pbfqt/imagine_being_this_confidently_stupid/,coarsecylinder,Imagine being this confidently stupid.,28908,0.93,1851,,1688367120.0,False,False,False,False,False
2,14pb1iq,Damnthatsinteresting,/r/Damnthatsinteresting/comments/14pb1iq/cats_that_sailed_on_ships_until_the_mid20th/,chickennoudelsoup,Cats that sailed on ships until the mid-20th century to catch rodents had passports signed with their paw prints,13614,0.98,218,,1688365759.0,False,False,False,False,False
3,14pemck,nextfuckinglevel,/r/nextfuckinglevel/comments/14pemck/kid_goes_down_a_well_to_save_a_toddler_that_fell/,sewn_of_a_gun,Kid goes down a well to save a toddler that fell in,4321,0.97,244,,1688378079.0,False,False,False,False,False
4,14pbjhm,HolUp,/r/HolUp/comments/14pbjhm/give_them_a_taste_of_their_own_medicine/,ImportantEffort4594,Give them a taste of their own medicine,9579,0.95,118,,1688367467.0,False,False,False,False,False
5,14pb8ao,marvelmemes,/r/marvelmemes/comments/14pb8ao/the_cameraman/,Nikhil__P,The Cameraman ,9918,0.97,45,Avengers,1688366412.0,False,False,False,False,False
6,14pbis4,AnimalsBeingBros,/r/AnimalsBeingBros/comments/14pbis4/stray_dog_saves_girl/,Sizzlin9,Stray dog saves girl.,7487,0.96,207,,1688367399.0,False,False,False,False,False
7,14p9l7z,ContagiousLaughter,/r/ContagiousLaughter/comments/14p9l7z/how_to_dad_remakes_his_first_video_with_his_kiddo/,Spontanemoose,How To Dad remakes his first video with his kiddo,13788,0.96,224,,1688360967.0,False,False,False,False,False
8,14pffpj,oddlysatisfying,/r/oddlysatisfying/comments/14pffpj/this_college_countdown/,amy2kim22,This college countdown,2895,0.95,39,,1688380775.0,False,False,False,False,False
9,14p5ev8,worldnews,/r/worldnews/comments/14p5ev8/norway_discovers_massive_underground_deposit_of/,HelloSlowly,"Norway discovers massive underground deposit of high-grade phosphate rock, big enough to satisfy world demand for fertilisers, solar panels and electric car batteries over the next 100 years",39066,0.96,2308,,1688348338.0,False,False,False,False,False
10,14p6zr6,BrandNewSentence,/r/BrandNewSentence/comments/14p6zr6/the_forbidden_art_of_giving_crabs_knowledge/,Ryce_Byce,The forbidden art of giving crabs knowledge,22437,0.96,351,,1688352959.0,False,False,False,False,False
11,14p8h6t,wholesomememes,/r/wholesomememes/comments/14p8h6t/upgrades_people/,DiligentKnocking,Upgrades people,10245,0.97,140,,1688357471.0,False,False,False,False,False
12,14p8v61,dankmemes,/r/dankmemes/comments/14p8v61/even_covers_arent_safe/,ZoomZombie1119,Even covers aren't safe,10901,0.98,76,"the very best, like no one ever was. ",1688358664.0,False,False,False,False,False
13,14p8hn5,NatureIsFuckingLit,/r/NatureIsFuckingLit/comments/14p8hn5/twin_falls_idaho_usa/,iamayeshaerotica,"🔥 Twin Falls, Idaho, USA",8165,0.95,240,,1688357505.0,False,False,False,False,False
14,14p6hic,comics,/r/comics/comments/14p6hic/my_main/,shenanigansen,My Main,16139,0.95,303,Shen Comix,1688351464.0,False,False,False,False,True
15,14pcovp,Piracy,/r/Piracy/comments/14pcovp/its_just_a_small_monthly_payment_dude/,Itzmecaitlyn,"""Its just a small monthly payment dude""",3250,0.94,206, ,1688371366.0,False,False,False,False,False
16,14pd5e0,wholesome,/r/wholesome/comments/14pd5e0/onions/,Devoted_Mike90,Onions..,2801,0.96,43,,1688373006.0,False,False,False,False,False
17,14pdasc,MadeMeSmile,/r/MadeMeSmile/comments/14pdasc/when_my_husband_found_out_that_id_never_had_legos/,shireengul,"When my husband found out that I’d never had Legos (because people around me said they were only for boys), he immediately bought me the sets I was admiring. At 34 y.o., I completed my first builds!",2759,0.99,88,,1688373551.0,False,False,False,False,False
18,14p8g2w,Genshin_Impact,/r/Genshin_Impact/comments/14p8g2w/overture_teaser_the_final_feast_genshin_impact/,genshinimpact,Overture Teaser: The Final Feast | Genshin Impact,7704,0.95,1128,:hoyo1::hoyo2: Official,1688357378.0,False,False,False,False,False
19,14p9uju,sadcringe,/r/sadcringe/comments/14p9uju/lmfao_the_way_the_dude_died_when_he_realized_she/,shanmikko,Lmfao the way the dude died when he realized she was referring to him,4947,0.92,292,,1688361836.0,False,False,False,False,False
20,14pf11u,CombatFootage,/r/CombatFootage/comments/14pf11u/russian_soldier_blowing_himself_up_with_grenade/,Witness2211,"Russian soldier blowing himself up with grenade in front of ukrainian soldier POV [June, Bakhmut area]",1795,0.96,220,,1688379390.0,True,False,False,False,False
21,14p6as9,therewasanattempt,/r/therewasanattempt/comments/14p6as9/to_rob_a_jewelry_store/,FinalSneak,To rob a jewelry store,12747,0.95,875,This is a flair,1688350899.0,False,False,False,False,False
22,14pex4o,Genshin_Impact_Leaks,/r/Genshin_Impact_Leaks/comments/14pex4o/freminet_drip/,Junnielocked,Freminet drip,1807,0.95,409,,1688379037.0,False,False,False,False,False
23,14p3vgr,gaming,/r/gaming/comments/14p3vgr/my_65_yr_old_father_in_law_has_played_one_game/,jagrbomb,My 65 yr old father in law has played one game for the last 15 yrs. These are his stats 😵‍💫,23724,0.94,1425,,1688343929.0,False,False,False,False,False
24,14pelj4,whenthe,/r/whenthe/comments/14pelj4/i_did_nothing_wrong/,NevGuy,I did nothing wrong.,1866,0.97,38,yellow like an EPIC banana ,1688377998.0,False,False,False,False,False
25,14p7yo2,Unexpected,/r/Unexpected/comments/14p7yo2/getting_hit_with_the_full_force_of_these_fireworks/,Jeffrey_Friedl,Getting hit with the full force of these fireworks,6766,0.97,97,,1688355905.0,False,False,False,False,False
26,14p53h0,antiwork,/r/antiwork/comments/14p53h0/there_seems_to_be_a_coordinated_antiwfh_campaign/,econbird,There seems to be a coordinated anti-WFH campaign happening,11036,0.97,710,,1688347433.0,False,False,False,False,False
27,14pd6ri,shittymoviedetails,/r/shittymoviedetails/comments/14pd6ri/the_screaming_nurse_in_the_flash_2023_wasnt/,helpful__explorer,The screaming nurse in The Flash (2023) wasn't scripted. This was just her natural reaction upon coming face to face with Ezra Miller,2277,0.97,28,,1688373131.0,False,False,False,False,False
28,14pc2wc,pcmasterrace,/r/pcmasterrace/comments/14pc2wc/after_5_years_6162018_732023_my_precious_evga/,fray_27,"After 5 years (6/16/2018 - 7/3/2023), my precious EVGA 1080ti has finally bit the dust and may finally be at rest",2792,0.96,331,,1688369220.0,False,False,False,False,False
29,14p979c,PublicFreakout,/r/PublicFreakout/comments/14p979c/drunk_lady_gets_kicked_off_plane/,usernamefred,Drunk lady gets kicked off plane,4696,0.97,511,,1688359779.0,False,False,False,False,False
30,14p7p7d,shitposting,/r/shitposting/comments/14p7p7d/praise_spez_i_hate_spiders/,NCR_Veteran_Rangers,Praise Spez I Hate Spiders,6979,0.98,83,,1688355090.0,False,False,False,False,False
31,14pcf98,ukraine,/r/ukraine/comments/14pcf98/kill_markings_on_the_german_provided_patriot/,Hannibal_Game,Kill Markings on the german provided Patriot battery in Ukraine,2331,0.97,132,,1688370445.0,False,False,False,False,False
32,14pazmx,formuladank,/r/formuladank/comments/14pazmx/f1_twitter_will_nevet_cease_to_amaze_me/,DaDf10,F1 twitter will nevet cease to amaze me,2983,0.95,389,BWOAHHHHHHH ,1688365570.0,False,False,False,False,False
33,14pb410,facepalm,/r/facepalm/comments/14pb410/american_dream/,ScaredAde,American dream,9920,0.91,853,,1688365989.0,False,False,False,False,False
34,14p71a6,lotrmemes,/r/lotrmemes/comments/14p71a6/your_neighbor_on_a_sunday_night_after_a_few_drinks/,CelestialFury,Your neighbor on a Sunday night after a few drinks,6068,0.98,63,,1688353083.0,False,False,False,False,False
35,14p43lp,mildlyinfuriating,/r/mildlyinfuriating/comments/14p43lp/my_cats_consider_this_an_empty_bowl/,kneaddough,My cats consider this an empty bowl.,13872,0.92,698,,1688344576.0,False,False,False,False,False
36,14p9v99,memes,/r/memes/comments/14p9v99/anybodypleasei_dont_give_a_shit_what_its_about/,Ulquiorr4_,Anybody…..please…..I don’t give a shit what it’s about…..,4034,0.89,209,,1688361906.0,False,False,False,False,False
37,14p2xvm,BlackPeopleTwitter,/r/BlackPeopleTwitter/comments/14p2xvm/if_you_take_the_low_road_youre_not_a_victim_when/,SmithNotASmith,"If you take the low road, you're not a victim when you're met there",14316,0.93,371,,1688341400.0,False,False,False,False,False
38,14pdmfw,LeagueOfMemes,/r/LeagueOfMemes/comments/14pdmfw/riot_elon/,insta_brokenleague,Riot Elon,1720,0.97,87,,1688374693.0,False,False,False,True,False
39,14peqy9,politics,/r/politics/comments/14peqy9/josh_hawleys_wife_faces_calls_to_be_sanctioned/,BelleAriel,Josh Hawley's wife faces calls to be sanctioned over Supreme Court case,1441,0.98,86,,1688378505.0,False,False,False,False,False
40,14p3j6t,oddlyterrifying,/r/oddlyterrifying/comments/14p3j6t/a_fraction_of_my_aunts_antique_doll_collection/,ohhhjamie,A *fraction* of my Aunt’s antique doll collection - there are hundreds. Guess who inherits them?,14784,0.96,1170,,1688342976.0,False,False,False,False,False
41,14paxtv,2westerneurope4u,/r/2westerneurope4u/comments/14paxtv/norwegian_imperialism/,simon_ceo_of_sex,Norwegian Imperialism,2704,0.98,305,:Germany: [redacted],1688365403.0,False,False,False,False,False
42,14pcv92,discordVideos,/r/discordVideos/comments/14pcv92/this_cured_my_depression_no_cap_jaden_williams/,DuskyFlunky,this cured my depression no cap 👍🏼 <jaden williams>,1931,0.86,149,,1688371987.0,False,False,False,False,False
43,14p8v00,TwoHotTakes,/r/TwoHotTakes/comments/14p8v00/my_husbands_best_friend_sexualized_my_daughter_at/,Smart_Elderberry_709,My husbands best friend sexualized my daughter at her sweet sixteen,3956,0.9,1230,,1688358649.0,False,1688379608.0,False,False,False
44,14p6jp8,pics,/r/pics/comments/14p6jp8/john_oliver_supports_the_wga/,annepng,John Oliver supports the WGA.,5556,0.88,97,,1688351646.0,False,False,False,False,False
45,14p14le,WhitePeopleTwitter,/r/WhitePeopleTwitter/comments/14p14le/aoc_being_attacked_because_of_a_harmless_selfie/,Visqo,AOC being attacked because of a harmless selfie,32729,0.89,2465,,1688336652.0,False,False,False,False,False
46,14p56nr,Tinder,/r/Tinder/comments/14p56nr/never_taking_advice_from_pickuplines_on_a_discord/,WastedWhaleShark,Never taking advice from #pick-up-lines on a Discord Server again 🤦‍♀️,7807,0.94,344,,1688347692.0,False,False,False,False,False
47,14pf78h,Damnthatsinteresting,/r/Damnthatsinteresting/comments/14pf78h/a_watch_found_in_the_hiroshima_rubble_is_stopped/,silvercatbob,"A watch found in the Hiroshima rubble is stopped at 8:15 AM, the exact time of the 1945 atomic bomb detonation.",2944,0.99,142,,1688379966.0,False,False,False,False,False
48,14p1ifk,OldSchoolCool,/r/OldSchoolCool/comments/14p1ifk/my_grandmas_first_picture_in_canada_after/,ComicDuhComic,My Grandma's first picture in Canada after surviving the holocaust. (1947),16307,0.95,270,,1688337649.0,False,False,False,False,False
49,14pc36l,australia,/r/australia/comments/14pc36l/why_are_these_houses_so_freaking_cold/,Ok_loop,Why are these houses so freaking cold ?!?!,1970,0.93,829,,1688369246.0,False,False,False,False,False
50,14pd3rl,ksi,/r/ksi/comments/14pd3rl/i_beg_the_cameraman_to_do_this_to_jj_in_the/,ShreemSaraswat,I beg the cameraman to do this to jj in the charity match,1698,0.99,13,,1688372836.0,False,False,False,False,False
51,14p9occ,Eldenring,/r/Eldenring/comments/14p9occ/the_disrespect_is_crazy/,cluelesstobes,the disrespect is crazy,2883,0.99,51,,1688361259.0,False,False,False,False,False
52,14pcmx7,SipsTea,/r/SipsTea/comments/14pcmx7/who_are_you/,Chaqquesa,...who are you ?!,1695,0.96,12,,1688371210.0,False,False,False,False,False
53,14pcg7n,tifu,/r/tifu/comments/14pcg7n/tifu_by_giving_my_bf_head_in_my_moms_bed/,InterestInevitable70,TIFU by giving my bf head in my moms bed,1758,0.9,226,,1688370545.0,True,1688370868.0,False,False,False
54,14p3b68,space,/r/space/comments/14p3b68/i_went_to_a_dark_sky_park_to_photograph_the_core/,theillini19,I went to a dark sky park to photograph the core of the Milky Way. By complete coincidence there were thousands of fireflies in the forest out for the summer. Here is a combination of long exposures I took that night of stars and fireflies.,8360,0.98,138,,1688342409.0,False,False,False,False,False
55,14p3a6a,conservativeterrorism,/r/conservativeterrorism/comments/14p3a6a/well_young_people_its_time_for_you_to_sack_up/,t3lnet,"Well young people, it’s time for you to sack up…",8692,0.94,453,,1688342332.0,False,False,False,False,False
56,14pfcdt,UkraineWarVideoReport,/r/UkraineWarVideoReport/comments/14pfcdt/translated_a_firstperson_video_from_the_ukrainian/,Legalized_NSFW_Today,"Translated: A first-person video from the Ukrainian commander, Comrade Datsyk from the 3rd Assault Brigade (3 OSHBr), shows ""The Decepticon"" in the direction of Bakhmut.",1026,0.99,119,,1688380457.0,False,False,False,False,False
57,14ozz0j,todayilearned,/r/todayilearned/comments/14ozz0j/til_a_man_was_awarded_7_million_in_damages_after/,Such-Track5369,TIL A man was awarded $7 million in damages after he developed a lung condition from eating two bags of popcorn every day and inhaling the steam from the bag,22906,0.94,828,,1688333731.0,False,False,False,False,False
58,14p9j31,blessedimages,/r/blessedimages/comments/14p9j31/bob/,Altacontuser_123,Bob,2872,0.87,182,,1688360773.0,False,False,False,False,False
59,14pd5hb,pettyrevenge,/r/pettyrevenge/comments/14pd5hb/i_got_revenge_on_my_bully/,GoldenPotato38,I got revenge on my bully,1409,0.97,73,,1688373014.0,False,False,False,False,False
60,14paveo,Hololive,/r/Hololive/comments/14paveo/guess_who_showed_up/,nakatsukasatsubaki,Guess who showed up,2157,0.99,22,:Aqua:,1688365183.0,False,False,False,False,False
61,14p426j,maybemaybemaybe,/r/maybemaybemaybe/comments/14p426j/maybe_maybe_maybe/,Wide_Abroad1182,Maybe maybe maybe,7554,0.96,163,,1688344463.0,False,False,False,False,False
62,14oz03b,funny,/r/funny/comments/14oz03b/is_this_tasteless_well_yeah_its_subway/,D3T3KT,"Is this tasteless? Well yeah, its subway.",28387,0.93,958,,1688331367.0,False,False,False,False,False
63,14pc0u2,CasualUK,/r/CasualUK/comments/14pc0u2/higgins_the_pheasant_update_shes_currently_sat_by/,thefreshbraincompany,Higgins the Pheasant update. She's currently sat by the window watching the bird table and the workmen next door. Tomorrow we begin the transfer over to her permanent residence.,1662,0.97,38,,1688369022.0,False,False,False,False,False
64,14pcgse,ich_iel,/r/ich_iel/comments/14pcgse/ich_iel/,hell-schwarz,Ich_iel,1554,0.98,7,:milleniumsraetsel: Milleniumsrätsel Löser :F35:,1688370605.0,True,False,False,False,False
65,14p2iam,Catswithjobs,/r/Catswithjobs/comments/14p2iam/cat_manager/,decent694201,Cat manager,9939,0.98,106,,1688340225.0,False,False,False,False,False
66,14ozbal,LeopardsAteMyFace,/r/LeopardsAteMyFace/comments/14ozbal/this_is_a_death_sentence_for_me_sobs_republican/,imaginary_num6er,"“This is a death sentence for me” sobs, Republican woman who voted for DeSantis stripping away her permanent alimony",19180,0.94,1686,,1688332094.0,False,False,False,False,False
67,14p5p0o,DunderMifflin,/r/DunderMifflin/comments/14p5p0o/so_which_one_is_jim/,msoliz52,"""So which one is Jim?""",4581,0.95,90,,1688349158.0,False,False,False,False,False
68,14pdx29,antimeme,/r/antimeme/comments/14pdx29/dont_do_this_in_any_lab/,dimon13456,dont do this in any lab.,1111,0.98,25,,1688375658.0,False,False,False,False,False
69,14p4mhf,meirl,/r/meirl/comments/14p4mhf/me_irl/,Faruzia,Me_irl,5698,0.92,242,,1688346082.0,False,False,False,False,False
70,14pa4tc,BeAmazed,/r/BeAmazed/comments/14pa4tc/darwins_tunnel/,PromotionSolid8285,Darwin's Tunnel,2164,0.91,302,,1688362775.0,False,False,False,False,False
71,14pa2al,dankmemes,/r/dankmemes/comments/14pa2al/gottem/,CameraGunPizza,gottem!,6872,0.97,75,,1688362545.0,False,False,False,False,False
72,14p1a34,ThatsInsane,/r/ThatsInsane/comments/14p1a34/france_more_than_2000_cars_burned_more_than_700/,wats6831,"France: More than 2,000 cars burned, more than 700 businesses were damaged, and more than 3,000 people were arrested.",10530,0.96,236,,1688337052.0,False,False,False,True,False
73,14p5kh6,ChatGPT,/r/ChatGPT/comments/14p5kh6/do_we_really_sound_like_this/,youngdumbandbroke06,Do we really sound like this?,4646,0.95,596,,1688348794.0,False,False,False,False,False
74,14ozrei,news,/r/news/comments/14ozrei/police_arrest_mother_of_7yearold_girl_whose_body/,Cinnamon2017,Police arrest mother of 7-year-old girl whose body was found decaying in closet,12669,0.96,662,,1688333207.0,False,False,False,False,False
75,14p4x7y,fightporn,/r/fightporn/comments/14p4x7y/bitches_gone_wild_well_almost/,J4ckSic4rio,"Bitches gone wild, well almost ",5238,0.9,251,,1688346933.0,False,False,False,False,False
76,14pcq1g,technicallythetruth,/r/technicallythetruth/comments/14pcq1g/reason_for_rebooting_like_1995_ms_windows/,Administrative-Day76,Reason for rebooting like 1995 MS Windows,1279,0.94,48,,1688371463.0,False,False,False,False,False
77,14p2y8t,cats,/r/cats/comments/14p2y8t/does_anyone_have_experience_with_runts_this_guy/,Begonethot212,Does anyone have experience with runts? This guy looks quite a bit younger/different than the other kittens in the litter.,6750,0.98,390,,1688341429.0,False,False,False,False,False
78,14p0zld,NonPoliticalTwitter,/r/NonPoliticalTwitter/comments/14p0zld/terrifying_for_her/,burakalp34,Terrifying for her,9803,0.97,171,:blue1::blue2::1111::1112:,1688336297.0,False,False,False,False,False
79,14ozssv,WTF,/r/WTF/comments/14ozssv/i_drank_the_water_and_popped_it_open/,EnigmaEcstacy,I drank the water and popped it open.,11281,0.95,1228,,1688333309.0,False,False,False,False,False
80,14pbgxi,teenagers,/r/teenagers/comments/14pbgxi/no_im_not_the_enemy_they_are_from/,RacistJacob,No. I'm not the enemy. They are. (From r/im14andthisisdeep),1476,0.98,142,,1688367226.0,False,False,False,False,False
81,14pa9xm,LivestreamFail,/r/LivestreamFail/comments/14pa9xm/kick_has_implemented_feature_to_censor_the_slots/,Nojoboy,"Kick Has Implemented Feature to Censor the Slots & Casino and/or the Pool, Hot Tub & Bikinis sections.",1757,0.9,488,:),1688363222.0,False,False,False,False,False
82,14p3gyd,popheadscirclejerk,/r/popheadscirclejerk/comments/14p3gyd/let_them_cook/,makinishi_KINO,Let them cook,5529,0.94,166,Poggers Rae Jepsen,1688342797.0,False,False,False,False,False
83,14p8fpk,HonkaiStarRail,/r/HonkaiStarRail/comments/14p8fpk/version_12_livestream_planned_for_july_8_2023/,Xanek,"Version 1.2 Livestream planned for July 8, 2023 @ 19:30 (UTC+8) / Honkai: Star Rail Version 1.2 ""Even Immortality Ends"" Special Program",2356,0.97,149,,1688357345.0,False,False,False,False,False
84,14pc8we,meme,/r/meme/comments/14pc8we/it_hurts_you_piece_of_shxt/,TastyJackfruits,it hurts you piece of Shxt,1233,0.98,17,,1688369812.0,False,False,False,False,False
85,14p859u,anime_irl,/r/anime_irl/comments/14p859u/anime_irl/,canivola,anime_irl,2421,0.97,77,,1688356481.0,False,False,False,False,False
86,14p4rzq,wholesomememes,/r/wholesomememes/comments/14p4rzq/memory_unlocked/,Naive_Establishment2,Memory unlocked!!,14811,0.97,203,,1688346501.0,False,False,False,False,False
87,14p4wgt,nextfuckinglevel,/r/nextfuckinglevel/comments/14p4wgt/msg_sphere_in_las_vegas_says_hello_world/,picNsave,"MSG Sphere in Las Vegas says ""Hello World""",16742,0.94,682,,1688346877.0,False,False,False,False,False
88,14p2fux,tumblr,/r/tumblr/comments/14p2fux/tumblr_poster/,lord_braleigh,Tumblr poster,6713,0.98,50,,1688340043.0,False,False,False,False,False
89,14p4y6g,Grimdank,/r/Grimdank/comments/14p4y6g/if_youre_going_to_be_a_dwarf_aim_for_deep_rock/,TheModernRouge,"If you’re going to be a dwarf, aim for Deep Rock Galactic instead of Vermintide",3981,0.97,134,I am Alpharius,1688347014.0,False,False,False,False,False
90,14pbeso,Satisfyingasfuck,/r/Satisfyingasfuck/comments/14pbeso/the_way_this_concession_clerk_serves_popcorn/,OwnConstrction,The way this concession clerk serves popcorn,1347,0.91,133,,1688367034.0,False,False,False,False,False
91,14p1caf,technology,/r/technology/comments/14p1caf/over_100_artists_boycotting_venues_that_use/,geoxol,Over 100 artists boycotting venues that use face-scanning technology,6691,0.96,349,,1688337204.0,False,False,False,False,False
92,14p7u59,cursedcomments,/r/cursedcomments/comments/14p7u59/cursed_advice/,XqueezeMePlease,Cursed_advice,2638,0.99,43,,1688355511.0,False,False,False,False,False
93,14oyn8s,NewsOfTheStupid,/r/NewsOfTheStupid/comments/14oyn8s/man_named_in_supreme_courts_gay_wedding_website/,Misguided_Society,Man Named in Supreme Court's Gay Wedding Website Ruling is Married to a Woman and Never Even Contacted the Web Designer,10890,0.95,679,,1688330493.0,False,False,False,False,False
94,14p9088,197,/r/197/comments/14p9088/rule/,Improvement1708,rule,1977,0.98,16,,1688359130.0,False,False,False,False,False
95,14pcmkj,lgbt,/r/lgbt/comments/14pcmkj/little_announcement/,A__Random__redditor_,Little Announcement...,1040,0.92,50,:trans: Trans-Girl :3,1688371175.0,False,False,False,False,False
96,14p5w1i,CrazyFuckingVideos,/r/CrazyFuckingVideos/comments/14p5w1i/a_visitor_at_a_north_carolina_amusement_park/,rCarmar,A visitor at a North Carolina amusement park spotted a large crack on a roller coaster's pillar,3172,0.97,218,,1688349711.0,False,False,False,False,False
97,14p8jtg,Awww,/r/Awww/comments/14p8jtg/baby_elephant_is_trying_to_be_the_leader_of_the/,Sufficient-Bug-9112,"Baby elephant is trying to ""be the leader"" of the herd",2082,0.99,43,,1688357684.0,False,False,False,False,False
98,14p1tjt,nba,/r/nba/comments/14p1tjt/drakes_comment_on_fred_vanvleets_thank_you_post/,OhmsLaw111,Drake’s comment on Fred Vanvleet’s thank you post.“ Good luck on the Guangdong Dragons…..I mean the Houston Rockets”,5982,0.93,663,:tor-4: Raptors,1688338446.0,False,False,False,False,False
99,14p4f3c,popculturechat,/r/popculturechat/comments/14p4f3c/taylor_swift_trashshamed_by_new_yorks_sanitation/,romeofantasy,Taylor Swift 'trash-shamed' by New York's Sanitation Department.,4025,0.92,307,,1688345478.0,False,False,False,False,False
100,14pdmwz,dankvideos,/r/dankvideos/comments/14pdmwz/concerning/,tax_evading_is_fun,Concerning,859,0.94,27,Dummy T H I C C🍑,1688374738.0,False,False,False,False,False
