rank,id,subreddit,permalink,author,title,score,upvote_ratio,num_comments,author_flair_text,created_utc,over_18,edited,stickied,locked,is_original_content
1,152gpsw,WhitePeopleTwitter,/r/WhitePeopleTwitter/comments/152gpsw/god_bless_charles_barkley/,zzill6,"God Bless, Charles Barkley",18255,0.97,325,,1689634270.0,False,False,False,False,False
2,152f63r,facepalm,/r/facepalm/comments/152f63r/my_old_church_sending_my_mom_hate_mail_for/,babyblueberry333,My old church sending my mom hate mail for divorcing my abusive dad,22062,0.94,3639,,1689630590.0,False,False,False,False,False
3,152eysd,news,/r/news/comments/152eysd/aaa_pulls_back_from_offering_insurance_in_florida/,my2ndr,"AAA pulls back from offering insurance in Florida, following Farmers",10457,0.97,1329,,1689630112.0,False,False,False,False,False
4,152c7wu,nextfuckinglevel,/r/nextfuckinglevel/comments/152c7wu/dog_detecting_one_drop_of_gasoline_in_his_scent/,infinitiumvortex,Dog detecting one drop of gasoline in his Scent Discrimination Training for arson detection,25340,0.95,766,,1689623909.0,False,False,False,False,False
5,152d6a0,comics,/r/comics/comments/152d6a0/heal_turn/,MrLovens,Heal Turn,14692,0.97,211,Mr. Lovenstein,1689626059.0,False,False,False,False,False
6,152g9x9,memes,/r/memes/comments/152g9x9/woman_destroyer/,thepositivepandemic,Woman destroyer.,9718,0.96,519,OC Meme Maker,1689633209.0,False,False,False,False,False
7,152ghe1,funny,/r/funny/comments/152ghe1/little_man_wasnt_about_to_be_denied_again/,thejeffroc,Little man wasn't about to be denied again... ,6911,0.9,369,,1689633707.0,False,False,False,False,False
8,152fhcr,maybemaybemaybe,/r/maybemaybemaybe/comments/152fhcr/maybe_maybe_maybe/,IkilledRichieWhelan,Maybe Maybe Maybe,8828,0.94,125,,1689631314.0,True,False,False,False,False
9,152e6cp,therewasanattempt,/r/therewasanattempt/comments/152e6cp/to_grab_someones_phone/,Wtf_happen,To grab someone’s phone.,11800,0.95,1442,,1689628285.0,False,False,False,False,False
10,152dew7,Damnthatsinteresting,/r/Damnthatsinteresting/comments/152dew7/dr_park_dietz_explains_to_richard_kuklinski_the/,Seraphenigma,Dr. Park Dietz explains to Richard Kuklinski the potential reason why he became a mass murderer,11711,0.97,559,,1689626591.0,False,False,False,False,False
11,152el25,MadeMeSmile,/r/MadeMeSmile/comments/152el25/thier_smiles_and_excitement_is_infectious/,Sufficient-Bug-9112,Thier smiles and excitement is infectious!,9053,0.97,321,,1689629225.0,False,False,False,False,False
12,152eg8p,ContagiousLaughter,/r/ContagiousLaughter/comments/152eg8p/dont_be_an_old_fart/,IkilledRichieWhelan,Don’t be an old fart.,7847,0.95,160,,1689628917.0,False,False,False,False,False
13,152c17q,clevercomebacks,/r/clevercomebacks/comments/152c17q/look_i_made_a_joke/,HolidayOwlz,LOoK I MaDE a JoKe,12045,0.96,145,,1689623492.0,False,False,False,False,False
14,1529fvw,worldnews,/r/worldnews/comments/1529fvw/italy_begins_stripping_lesbian_mothers_of_their/,HyacinthFT,Italy begins stripping lesbian mothers of their parental rights,25241,0.91,3080,,1689617587.0,False,False,False,False,False
15,152eton,politics,/r/politics/comments/152eton/supreme_court_republicans_to_blame_for_lack_of/,vbbryce,"Supreme Court, Republicans to blame for lack of debt forgiveness, students say in poll",6347,0.97,347,:flag-tx: Texas,1689629771.0,False,False,False,False,False
16,1529kna,PublicFreakout,/r/PublicFreakout/comments/1529kna/climate_activists_spray_paint_on_megayacht_owned/,mushyrain,Climate activists spray paint on megayacht owned by heir to the Walmart fortune,18767,0.92,2534,,1689617892.0,False,False,False,False,False
17,152avdz,oddlysatisfying,/r/oddlysatisfying/comments/152avdz/pencil_sharpeners_throughout_the_years/,vjenkinsgo,Pencil sharpeners throughout the years,15576,0.91,441,,1689620859.0,False,False,False,False,False
18,1528z8h,TikTokCringe,/r/TikTokCringe/comments/1528z8h/unbelievable/,Snoo-33732,Unbelievable,22670,0.89,2434,,1689616532.0,False,False,False,False,False
19,152gqim,BlackPeopleTwitter,/r/BlackPeopleTwitter/comments/152gqim/its_just_missing_the_neon_sign_from_etsy/,notjayson,It's just missing the neon sign from etsy.,4123,0.98,124,☑️,1689634315.0,False,False,False,False,False
20,1528e2l,tumblr,/r/tumblr/comments/1528e2l/fear_of_being_shoved_into_a_taffy_machine/,SaraAnnabelle,Fear of being shoved into a taffy machine,25075,0.97,748,,1689615165.0,False,False,False,False,False
21,1527tlc,BrandNewSentence,/r/BrandNewSentence/comments/1527tlc/i_know_i_probably_shouldnt_laugh_about_this_but/,mecnev,I know I probably shouldn't laugh about this but damn,39795,0.93,1869,,1689613875.0,False,False,False,False,False
22,152ad5j,gaming,/r/gaming/comments/152ad5j/boyfriend_wanted_totk_for_his_birthday_so_i_made/,marshmellers95,Boyfriend wanted TotK for his birthday so I made him a Link cake to go with it!,10384,0.93,225,,1689619716.0,False,False,False,False,False
23,152hl5r,LateStageCapitalism,/r/LateStageCapitalism/comments/152hl5r/no_tree_shade_for_you_union_workers/,Polixxa,"No Tree Shade for You, Union Workers!",3489,0.98,111,,1689636400.0,False,False,False,False,False
24,152gv2q,CrazyFuckingVideos,/r/CrazyFuckingVideos/comments/152gv2q/a_guy_tried_to_meet_a_13_yr_old_but_instead_meets/,Dyingtolivee,A guy tried to meet a 13 yr old but instead meets her dad and his dogs ,3721,0.91,394,,1689634633.0,False,False,False,False,False
25,1529o5k,dankmemes,/r/dankmemes/comments/1529o5k/tonight_we_comment_in_hell/,thepositivepandemic,"Tonight, we comment, in hell!",13787,0.96,389,,1689618113.0,False,False,False,False,False
26,1526ebd,todayilearned,/r/todayilearned/comments/1526ebd/til_that_due_to_industry_influence_missouri_has/,ProbablySomeBoomer,"TIL that due to industry influence, Missouri has some of the loosest alcohol laws in the US. Hard liquor can be sold in grocery stores and gas stations; bars can double as liquor stores; public intoxication is legal; and open containers are allowed in most areas, including by passengers in vehicles.",21166,0.96,2429,,1689610611.0,False,False,False,False,False
27,152dldm,BeAmazed,/r/BeAmazed/comments/152dldm/10_orphaned_ducklings_adopted_by_a_mother_duck/,External_Industry739,10 orphaned ducklings adopted by a mother duck,5192,0.98,200,,1689627004.0,False,False,False,False,False
28,1527qgw,technicallythetruth,/r/technicallythetruth/comments/1527qgw/a_life_tip_from_betty_crocker/,0Ring-0,A life tip from Betty Crocker?,25816,0.93,375,,1689613677.0,False,False,False,False,False
29,152b5k1,antiwork,/r/antiwork/comments/152b5k1/when_the_threat_of_being_fired_doesnt_work_they/,BigFrame8879,"When the threat of being fired doesn't work, they have got nothing.",7043,0.97,279,,1689621511.0,False,False,False,False,False
30,152h06y,WhitePeopleTwitter,/r/WhitePeopleTwitter/comments/152h06y/is_there_anything_else_to_blame/,thatguy9684736255,Is there anything else to blame?,8212,0.98,707,,1689634962.0,False,False,False,False,False
31,1527z11,PoliticalHumor,/r/PoliticalHumor/comments/1527z11/moms_for_liberty_or_something/,weezo182,Moms for liberty.... or something,10431,0.96,83,,1689614218.0,False,False,False,False,False
32,152dx60,Unexpected,/r/Unexpected/comments/152dx60/going_for_a_swish/,Virasman,Going for a swish!,4545,0.97,161,,1689627722.0,False,False,False,False,False
33,1529wmr,mildlyinfuriating,/r/mildlyinfuriating/comments/1529wmr/neighbour_moved_in_a_week_ago_and_i_have_never/,Vzxx,"Neighbour moved in a week ago, and I have never seen someone be THIS uncivilised",7946,0.96,869,,1689618658.0,False,False,False,False,False
34,1527vsw,oddlyspecific,/r/oddlyspecific/comments/1527vsw/what_a_turn_of_events/,Optimal_Test3280,What a turn of events,13696,0.94,713,,1689614017.0,False,False,False,False,False
35,1527bqj,meirl,/r/meirl/comments/1527bqj/meirl/,iamcoollife1994,meirl,13267,0.96,222,,1689612753.0,False,False,False,False,False
36,1528wh7,nottheonion,/r/nottheonion/comments/1528wh7/a_spelling_mistake_is_causing_thousands_of/,Cagey898,A Spelling Mistake Is Causing Thousands of Sensitive Pentagon Documents to Be Leaked to a Russian Ally,7867,0.96,287,,1689616356.0,False,False,False,False,False
37,152c8pc,HolUp,/r/HolUp/comments/152c8pc/blind_experiment/,No-ConspiracyTheory,Blind experiment,5641,0.93,273,,1689623965.0,False,False,False,False,False
38,152e8xp,DiWHY,/r/DiWHY/comments/152e8xp/my_boss_thought_these_were_a_good_idea/,Kattivakk,My boss thought these were a good idea,3720,0.98,584,,1689628460.0,False,False,False,False,False
39,1525xp0,Gamingcirclejerk,/r/Gamingcirclejerk/comments/1525xp0/so_ron_has_always_just_been_cool_like_that/,tdolomax,"So, Ron has always just been cool like that?",16550,0.91,406,,1689609601.0,False,False,False,False,False
40,1525vlz,oddlyterrifying,/r/oddlyterrifying/comments/1525vlz/the_vegas_msg_sphere/,Kalunda2,The Vegas MSG sphere,19327,0.94,867,,1689609465.0,False,False,False,False,False
41,152au2d,PrequelMemes,/r/PrequelMemes/comments/152au2d/i_believe_you_watto/,Groslux,I believe you Watto.,5874,0.98,41,,1689620763.0,False,False,False,False,False
42,152a9fc,WTF,/r/WTF/comments/152a9fc/the_crane_is_going_place/,8wine,The crane is going place,5949,0.94,458,,1689619478.0,False,False,False,False,False
43,152bpwa,movies,/r/movies/comments/152bpwa/the_rock_has_to_be_the_most_overrated_movie_star/,finnjakefionnacake,The Rock has to be the most overrated movie star of our time,5112,0.78,1892,,1689622787.0,False,False,False,False,False
44,1525ttn,StupidFood,/r/StupidFood/comments/1525ttn/how_to_ruin_a_burger/,wet_egirl_ass,How to ruin a burger,21943,0.85,5018,,1689609352.0,False,False,False,False,False
45,152cek1,starterpacks,/r/starterpacks/comments/152cek1/riding_a_bike_in_the_us_starter_pack/,CeeWitz,"""Riding a Bike in the US"" starter pack",4472,0.91,418,,1689624318.0,False,False,False,False,False
46,15243h3,subway,/r/subway/comments/15243h3/update_i_was_fired/,sleepparalysisagain,[UPDATE] I was fired,67022,0.89,3234,,1689605436.0,False,False,False,True,False
47,1527zjw,OneOrangeBraincell,/r/OneOrangeBraincell/comments/1527zjw/many_on_my_last_post_pointed_out_that_there_were/,GingaNinja1427,"Many on my last post pointed out that there were 2 gingers in my home. They Are wrong, there are three.",8363,0.97,124,,1689614253.0,False,False,False,False,False
48,152a9g9,BikiniBottomTwitter,/r/BikiniBottomTwitter/comments/152a9g9/its_a_good_move/,evan_lolz,It’s a good move,5495,0.98,62,:Bold_and_Brash:,1689619480.0,False,False,False,False,False
49,1528xf8,whenthe,/r/whenthe/comments/1528xf8/evil_intentions/,PowerfulOperation8,Evil intentions,9068,0.97,407,,1689616416.0,False,False,False,False,False
50,15260i8,OldSchoolCool,/r/OldSchoolCool/comments/15260i8/me_and_my_bestie_at_our_prom_in_1988_yes_those/,66Lightning650,"Me and my bestie at our prom in 1988, yes those are cookies is my cleavage and yes she is smoking.",9924,0.94,403,,1689609749.0,False,False,False,False,False
51,152dq1n,CombatFootage,/r/CombatFootage/comments/152dq1n/longer_version_of_the_chechen_ambush_in_russia/,z7strpurez7,Longer version of the Chechen ambush in Russia,3268,0.97,408,,1689627291.0,True,False,False,False,False
52,15263jf,science,/r/science/comments/15263jf/conservatives_are_more_likely_to_complain_in/,HeinieKaboobler,Conservatives are more likely to complain in everyday service contexts due to their higher sense of entitlement,11889,0.78,902,,1689609938.0,False,False,False,False,False
53,1525bb4,aww,/r/aww/comments/1525bb4/baby_octopus_exploring_the_world/,Top-Evidence-2807,Baby octopus exploring the world,12164,0.92,213,,1689608184.0,False,False,False,False,False
54,1523odq,AbsoluteUnits,/r/AbsoluteUnits/comments/1523odq/who_was_this_made_for/,denselyDock,Who was this made for,28438,0.93,5870,,1689604485.0,False,False,False,False,False
55,152dijq,crochet,/r/crochet/comments/152dijq/most_relatable_comment/,e_j_west,Most relatable comment,3221,0.97,49,,1689626820.0,False,False,False,False,False
56,1528ko7,Eldenring,/r/Eldenring/comments/1528ko7/too_sad_to_confront/,cloodhee,Too sad to confront,6561,0.98,77,,1689615606.0,False,False,False,False,False
57,152bmys,popculturechat,/r/popculturechat/comments/152bmys/category_is_interviewers_asking_celebrities/,iamharoldshipman,Category is: Interviewers asking celebrities misogynistic and inappropriate questions,3784,0.96,336,,1689622598.0,False,False,False,False,False
58,1529vcc,lotrmemes,/r/lotrmemes/comments/1529vcc/a_poor_summary/,bookhead714,A poor summary,5024,0.97,404,,1689618584.0,False,False,False,False,False
59,1528asf,MadeMeSmile,/r/MadeMeSmile/comments/1528asf/designated_driver_making_sure_she_gets_home_safe/,mindyour,Designated driver making sure she gets home safe.,83582,0.95,1267,,1689614965.0,False,False,False,False,False
60,1525zyh,technology,/r/technology/comments/1525zyh/amazon_told_drivers_not_to_worry_about_invan/,777fer,Amazon Told Drivers Not to Worry About In-Van Surveillance Cameras. Now Footage Is Leaking Online,8058,0.97,491,,1689609718.0,False,False,False,False,False
61,152asln,nextfuckinglevel,/r/nextfuckinglevel/comments/152asln/amazing_robotic_engineering_robot_can_self_right/,Fuzzy_Logic_4_Life,"Amazing robotic engineering, robot can self right itself.",18320,0.96,2303,,1689620675.0,False,False,False,False,False
62,152e9ub,nba,/r/nba/comments/152e9ub/phil_jackson_on_differences_between_jordan_and/,waynequit,"Phil Jackson on differences between Jordan and Kobe: “Michael was more charismatic and gregarious than Kobe. He loved hanging out with his teammates and security guards, playing cards, smoking cigars, and joking around.""",2652,0.96,545,,1689628517.0,False,False,False,False,False
63,1526gfe,Breath_of_the_Wild,/r/Breath_of_the_Wild/comments/1526gfe/who_would_win/,Formal-Setting-6609,Who would win?,8302,0.96,310,340 hours,1689610758.0,False,False,False,False,False
64,152994j,baseball,/r/baseball/comments/152994j/passan_breaking_my_back/,Waaaaaaaaaasuup,[Passan] BREAKING: My back.,4778,0.96,445,Major League Baseball :mlb:,1689617137.0,False,False,False,False,False
65,152g7pf,Justrolledintotheshop,/r/Justrolledintotheshop/comments/152g7pf/rolled_out_today_boys_22_years_in_the_field_im/,fmlyjwls,"Rolled out today boys. 22 years in the field, I’m done. No idea what’s next.",2016,0.96,211,,1689633067.0,False,False,False,False,False
66,1525dgh,WorkReform,/r/WorkReform/comments/1525dgh/republicans_who_rail_against_raising_the_minimum/,DemCast_USA,Republicans who rail against raising the minimum wage because “that’s way more than I made when I was young” literally don’t understand inflation.,7936,0.96,170,,1689608322.0,False,False,False,False,False
67,152bs88,AskReddit,/r/AskReddit/comments/152bs88/what_food_are_you_a_bottomless_pit_for/,-pleaseandthankyou,What food are you a bottomless pit for?,3354,0.94,6697,,1689622928.0,False,False,False,False,False
68,15292cr,insanepeoplefacebook,/r/insanepeoplefacebook/comments/15292cr/ffs/,Vyzantinist,Ffs.,4983,0.97,260,,1689616738.0,False,False,False,False,False
69,1525fj0,wholesomememes,/r/wholesomememes/comments/1525fj0/he_didnt_ruin_it/,blaze_uchiha999,He didn't ruin it,8746,0.98,47,,1689608454.0,False,False,False,False,False
70,152bzh2,zelda,/r/zelda/comments/152bzh2/all_girlfriend_got_me_a_switch_and_some_games/,ronnydump,[all] Girlfriend got me a switch and some games today out of nowhere. Gotta get a ring.,3239,0.94,276,,1689623388.0,False,False,False,False,False
71,1528jw0,UFOs,/r/UFOs/comments/1528jw0/rep_tim_burchett_the_house_oversight_committee/,CreditCardOnly,"Rep. Tim Burchett: “The House Oversight Committee will hold a hearing on UAPs on Wednesday, 7/26. We’re done with the cover-ups.”",5107,0.88,1320,,1689615552.0,False,False,False,False,False
72,1528cae,inthenews,/r/inthenews/comments/1528cae/donald_trump_brands_us_a_thirdworld_hellhole_run/,Unhappy_Earth1,Donald Trump brands US a ‘third-world hellhole’ run by ‘perverts’ and ‘thugs’,5084,0.91,709,,1689615052.0,False,False,False,True,False
73,152it5s,anime_irl,/r/anime_irl/comments/152it5s/anime_irl/,yolo_king_1,Anime_irl,1378,0.98,44,,1689639499.0,False,False,False,False,False
74,152gt7k,JustGuysBeingDudes,/r/JustGuysBeingDudes/comments/152gt7k/this_is_what_every_man_wants/,8wine,This is what every man wants.,1768,0.93,65,,1689634506.0,False,False,False,False,False
75,1527qkp,IASIP,/r/IASIP/comments/1527qkp/podcast_update/,lto23,Podcast update,5149,0.96,419,,1689613684.0,False,False,False,False,False
76,15224jk,cats,/r/cats/comments/15224jk/my_cat_brought_home_a_kitten_now_he_seems_to/,Character-Search7009,My cat brought home a kitten. Now he seems to regret parenthood,15902,0.99,333,,1689600819.0,False,False,False,False,False
77,1528u9e,IllegallySmolCats,/r/IllegallySmolCats/comments/1528u9e/found_this_cat/,TacoRedneck,Found this cat.,4515,0.97,185,,1689616217.0,False,False,False,False,False
78,15291wz,Superstonk,/r/Superstonk/comments/15291wz/ryan_cohen_on_twitter/,Dependent-Sandwich34,Ryan Cohen on Twitter,5542,0.93,396,🎮 Power to the Players 🛑,1689616706.0,False,False,False,False,False
79,152kd0u,LeopardsAteMyFace,/r/LeopardsAteMyFace/comments/152kd0u/guy_who_begged_for_elon_and_constantly_praised/,SlagginOff,Guy who begged for Elon and constantly praised Elon is now mad that Elon turned his favorite place into an even bigger shithole than it was before.,1058,0.97,69,,1689643686.0,False,False,False,False,False
80,152chb5,Fauxmoi,/r/Fauxmoi/comments/152chb5/sofía_vergara_and_joe_manganiello_divorcing_after/,ugggghhhhhhhhh,Sofía Vergara and Joe Manganiello divorcing after 7 years of marriage,2754,0.93,587,,1689624500.0,False,False,False,False,False
81,152gtoy,PeterExplainsTheJoke,/r/PeterExplainsTheJoke/comments/152gtoy/i_dont_get_it/,slycinth1,I don’t get it,1653,0.9,89,,1689634537.0,False,False,False,False,False
82,1527972,politics,/r/politics/comments/1527972/why_isnt_clarence_thomas_facing_impeachment/,LuvKrahft,Why Isn't Clarence Thomas Facing Impeachment Hearings?,19404,0.94,920,:flag-us: America,1689612593.0,False,False,False,False,False
83,152elq2,Damnthatsinteresting,/r/Damnthatsinteresting/comments/152elq2/baby_spycam_monkey_mistaken_for_dead_and_mourned/,ojodefiz,Baby Spycam Monkey Mistaken for Dead and Mourned by Troop,5473,0.98,221,,1689629273.0,False,False,False,False,False
84,152bi7m,FunnyAnimals,/r/FunnyAnimals/comments/152bi7m/donkey_has_something_urgent_to_say/,faceof333,Donkey has something urgent to say,3068,0.98,104,,1689622302.0,False,False,False,False,False
85,152cp1m,distressingmemes,/r/distressingmemes/comments/152cp1m/what_a_fun_song/,braidsfox,What a fun song 😀,2681,0.97,114,,1689624981.0,False,False,False,False,False
86,152hsks,HonkaiStarRail,/r/HonkaiStarRail/comments/152hsks/the_baseball_and_the_bat_pun_rii_on_twitter/,_nitro_legacy_,The baseball and the bat @pun_rii on twitter,1387,0.99,26,:Caelus: i break rules and your kneecaps,1689636916.0,False,False,False,False,False
87,1528omw,therewasanattempt,/r/therewasanattempt/comments/1528omw/to_play_at_the_gym/,11stainless11,to play at the gym,17189,0.97,855,,1689615851.0,False,False,False,False,False
88,152ddrx,NonPoliticalTwitter,/r/NonPoliticalTwitter/comments/152ddrx/be_honest_how_many_of_you_made_this_link_i/,TheTechnik,"Be honest, how many of you made this link? I definitely didn’t.",2398,0.93,52,:blue1::blue2::1111::1112:,1689626524.0,False,False,False,False,False
89,15240i5,ProgrammerHumor,/r/ProgrammerHumor/comments/15240i5/programmingishard/,Yamoyek,programmingIsHard,8611,0.96,377,:cp::c::py:,1689605247.0,False,False,False,False,False
90,1526c5v,MaliciousCompliance,/r/MaliciousCompliance/comments/1526c5v/youre_so_obsessed_with_how_i_dress_that_youre/,shoegazeslut,"You're so obsessed with how I dress that you're going to involve HR? All right, let's get a supervisor involved and see how that goes for you.",5748,0.9,559,,1689610479.0,False,False,False,False,True
91,152c6am,shitposting,/r/shitposting/comments/152c6am/look_at_it_heil_spez/,S4MFR3D05,Look at it (Heil Spez),2818,0.99,35,:stuffreverse: Stuff :stuff:,1689623808.0,False,False,False,False,False
92,152hntp,tf2,/r/tf2/comments/152hntp/tf2_is_in_the_steam_news_section_is_that_a_new/,-popgoes,TF2 is in the Steam news section! Is that a new render by Valve?!,1364,0.98,68,Demoman :democlass:,1689636600.0,False,False,False,False,False
93,1522zzv,SipsTea,/r/SipsTea/comments/1522zzv/dating_tips/,8wine,Dating tips,13888,0.87,623,,1689602873.0,False,False,False,False,False
94,1528qv9,diablo4,/r/diablo4/comments/1528qv9/fact/,SPinalloverdaworld,Fact,3942,0.96,256,,1689615986.0,False,False,False,False,False
95,15213k7,Whatcouldgowrong,/r/Whatcouldgowrong/comments/15213k7/driving_by_the_river_edge/,uchman365,Driving by the river edge,15934,0.97,609,,1689598270.0,False,False,False,False,False
96,15255g2,Baking,/r/Baking/comments/15255g2/first_chocolate_tart/,Extrafluffymeowloaf,First Chocolate Tart,6656,0.98,170,,1689607820.0,False,False,False,False,False
97,1529prs,shittymoviedetails,/r/shittymoviedetails/comments/1529prs/in_marvel_studios_avengers_age_of_ultron_2015/,Draco137WasTaken,"In Marvel Studios' Avengers: Age of Ultron (2015), Ultron turns evil after seeing the entire internet. This is because he saw the Wikipedia page on Marvel Studios' Avengers: Age of Ultron (2015) and discovered he was supposed to turn evil after seeing the entire internet.",3627,0.97,28,,1689618218.0,False,False,False,False,False
98,152af5f,KimetsuNoYaiba,/r/KimetsuNoYaiba/comments/152af5f/how_everyone_sees_tanjiro/,Ok_Stranger_197,How everyone sees tanjiro:,3317,0.97,115,,1689619841.0,False,False,False,False,False
99,152eb6m,egg_irl,/r/egg_irl/comments/152eb6m/eggirl/,Julietlow,Egg🔫irl,2011,0.97,45,,1689628596.0,False,False,False,False,False
100,1529qza,19684,/r/19684/comments/1529qza/america/,SenseiJoe100,America 🫡🇺🇲🔫🦅,3622,0.93,309,,1689618296.0,False,False,False,False,False
