rank,id,subreddit,permalink,author,title,score,upvote_ratio,num_comments,author_flair_text,created_utc,over_18,edited,stickied,locked,is_original_content
1,14r5m76,therewasanattempt,/r/therewasanattempt/comments/14r5m76/to_look_like_you_care_about_the_environment/,BloodiStag,To look like you care about the environment,26488,0.96,1522,,1688549395.0,False,False,False,False,False
2,14r5azv,MadeMeSmile,/r/MadeMeSmile/comments/14r5azv/a_brain_tumour_changed_her_life_her_nerves_are/,IanAgate,“A brain tumour changed her life. Her nerves are badly damaged! But today she opened a car door…..walked…..opened a gym door…..walked and sat down ..BY HERSELF 💪🏿💪🏿 what a lady”,13125,0.97,399,,1688548390.0,False,False,False,False,False
3,14r48te,WhitePeopleTwitter,/r/WhitePeopleTwitter/comments/14r48te/never_being_told_no_makes_a_person_stupid/,nejicanspin,"Never being told ""no"" makes a person stupid.",8103,0.99,108,,1688544949.0,False,False,False,False,False
4,14r4an4,dankmemes,/r/dankmemes/comments/14r4an4/cant_help_it/,ChildhoodStreet1616,can't help it,10678,0.98,46,☣️,1688545120.0,False,False,False,False,False
5,14r1xv8,HumansBeingBros,/r/HumansBeingBros/comments/14r1xv8/the_trapped_dog_doesnt_wait_a_bit_to_hug_the/,JettMe_Red,The trapped dog doesn't wait a bit to hug the rescuer after being freed..,17098,0.97,254,,1688537435.0,False,False,False,False,False
6,14r5crl,Damnthatsinteresting,/r/Damnthatsinteresting/comments/14r5crl/orcas_just_passing_by_two_kids_swimming/,LiteratureOk5964,Orcas just passing by two kids swimming ,5934,0.99,461,,1688548540.0,False,False,False,False,False
7,14r2j66,facepalm,/r/facepalm/comments/14r2j66/smart_watch_for_not_so_smart_guy/,LiteratureOk5964,Smart watch for not so smart guy,16475,0.94,565,,1688539435.0,False,False,False,False,False
8,14r1aau,nextfuckinglevel,/r/nextfuckinglevel/comments/14r1aau/sharp_and_very_decent_human/,TenselyDazzling,Sharp and very decent human,21475,0.97,447,,1688535204.0,False,False,False,False,False
9,14r0r2n,meirl,/r/meirl/comments/14r0r2n/meirl/,Majestic-Unicorn33,meirl,23033,0.98,230,,1688533427.0,False,False,False,False,False
10,14r3rj7,HolUp,/r/HolUp/comments/14r3rj7/wash_your_hands/,Quobl_69420,Wash your hands,8315,0.96,113,,1688543437.0,True,False,False,False,False
11,14r0moh,BeAmazed,/r/BeAmazed/comments/14r0moh/yep_thats_a_big_fat_10/,kimcutiepie,Yep! That's a big fat 10!,17312,0.97,232,,1688533072.0,False,False,False,False,False
12,14r7z50,worldnews,/r/worldnews/comments/14r7z50/russians_die_under_mysterious_circumstances_in/,Beyond_The_Dim,Russians die under mysterious circumstances in Mariupol – City Council,2529,0.97,211,,1688556442.0,False,False,False,False,False
13,14r4ls8,technicallythetruth,/r/technicallythetruth/comments/14r4ls8/well_they_are_for_sure/,GignacPL,"Well, they are for sure...",4521,0.98,77,,1688546139.0,False,False,False,False,False
14,14r3szk,UkraineWarVideoReport,/r/UkraineWarVideoReport/comments/14r3szk/drone_footage_of_yesterdays_massive_ammo_dump/,Repulsive-Pattern-57,Drone footage of yesterday’s massive ammo dump explosion in temporarily occupied Makiivka,4603,0.97,276,,1688543574.0,False,False,False,False,False
15,14r4g00,Awww,/r/Awww/comments/14r4g00/when_he_came_to_the_sea_for_the_first_time_in_a/,DustMurkyz,when he came to the sea for the first time in a year,4261,0.97,111,,1688545618.0,False,False,False,False,False
16,14r1lpq,todayilearned,/r/todayilearned/comments/14r1lpq/til_jfk_ordered_1200_of_his_favorite_cuban_cigars/,Berenthegrizzly,TIL JFK ordered 1200 of his favorite cuban cigars the night before he signed the cuban trade embargo,6669,0.98,333,,1688536307.0,False,False,False,False,False
17,14qxs5l,oddlysatisfying,/r/oddlysatisfying/comments/14qxs5l/submerging_eiderdown_in_water/,solateor,submerging eiderdown in water,27501,0.97,317,,1688523926.0,False,False,False,False,False
18,14r4k2z,awfuleverything,/r/awfuleverything/comments/14r4k2z/a_taiwanese_dad_who_hit_his_daughter_40_times_and/,Sakuramochi_Chan,"A Taiwanese dad who hit his daughter 40 times and posted it online, because she got fifth place in her grade.",3768,0.97,162,,1688545985.0,True,False,False,False,False
19,14qyvtg,OldSchoolCool,/r/OldSchoolCool/comments/14qyvtg/1940s_contraption_for_infant_leg_muscle/,wronghoIe,1940’s contraption for infant leg muscle development.,12514,0.98,463,,1688527365.0,False,False,False,False,False
20,14r573v,news,/r/news/comments/14r573v/tirade_over_cop_charged_with_tasering_95yo_great/,ani625,Tirade over cop charged with tasering 95yo great grandmother,3075,0.96,370,,1688548036.0,False,False,False,False,False
21,14r3h7g,JustGuysBeingDudes,/r/JustGuysBeingDudes/comments/14r3h7g/men_are_simple/,flattenedbricks,Men are simple,4162,0.97,89,Lego Bricks,1688542457.0,False,False,False,False,False
22,14r20o1,TikTokCringe,/r/TikTokCringe/comments/14r20o1/pretty_much_child_abuse/,Fr0stRa1d,Pretty much child abuse,5910,0.91,1314,"Sort by flair, dumbass",1688537703.0,False,False,False,False,False
23,14r35j7,whenthe,/r/whenthe/comments/14r35j7/i_live_in_slc_ut_but_we_used_to_live_in_w/,YoruDenftw,"""i live in SLC, UT 🤓 but we used to live in W-""",4931,0.93,217,,1688541396.0,False,False,False,False,False
24,14r5xv7,formuladank,/r/formuladank/comments/14r5xv7/official_interview_with_max_verstappens/,External-Duty-8190,Official interview with Max Verstappen's performance coach,2579,0.98,60,BWOAHHHHHHH ,1688550391.0,False,False,False,False,False
25,14r3pxw,WTF,/r/WTF/comments/14r3pxw/surviving_the_spaghetti_monster/,JamesChisolm,Surviving the spaghetti monster,3528,0.97,161,,1688543289.0,False,False,False,False,False
26,14r1xw8,cursedcomments,/r/cursedcomments/comments/14r1xw8/cursed_ny_car/,UnknownSuxker,Cursed_NY car,6314,0.97,138,,1688537438.0,False,False,False,False,False
27,14r3fqm,comics,/r/comics/comments/14r3fqm/in_these_uncertain_times_find_a_support_crew_that/,spinachgreen,"In these uncertain times, find a support crew that always has your back",3464,0.97,23,,1688542315.0,False,False,False,False,True
28,14r15ms,Unexpected,/r/Unexpected/comments/14r15ms/why_the_food_takes_so_long_at_mcdonalds/,ge0oo,Why the food takes so long at Mcdonalds...,5304,0.95,82,,1688534769.0,False,False,False,False,True
29,14r5ost,Whatcouldgowrong,/r/Whatcouldgowrong/comments/14r5ost/doing_a_water_ride/,shurikien,Doing a water ride,2211,0.92,125,,1688549607.0,False,False,False,False,False
30,14qzviy,AskReddit,/r/AskReddit/comments/14qzviy/if_poor_people_fantasize_about_winning_the/,more_bees_pleas,"If poor people fantasize about winning the lottery, then what do rich people fantasize about?",6753,0.92,4323,,1688530598.0,False,False,False,False,False
31,14r4kgc,anime_irl,/r/anime_irl/comments/14r4kgc/anime_irl/,X3non13,anime_irl,2618,0.92,78,,1688546021.0,False,False,False,False,False
32,14r4e87,AnimalsBeingDerps,/r/AnimalsBeingDerps/comments/14r4e87/hardworking_pupper/,stranger_in_the_boat,Hard-working pupper,2526,0.95,36,,1688545461.0,False,False,False,False,False
33,14r3yk4,ukraine,/r/ukraine/comments/14r3yk4/drone_footage_of_the_recent_massive_ammunition/,ijnfrt,Drone footage of the recent massive ammunition detonation in occupied Makiivka,2694,0.98,178,,1688544071.0,False,False,False,False,False
34,14r4l4s,nba,/r/nba/comments/14r4l4s/vernon_dillon_brooks_took_991_shots_last_year_he/,ErnehJohnson,[Vernon] Dillon Brooks took 991 shots last year. He shot 39.6%. There is only one player in the entire NBA that took more shots and hit less. That player? Fred Van Vleet. 😬,2376,0.98,240,:gsw-3: San Francisco Warriors,1688546083.0,False,1688550611.0,False,False,False
35,14r3417,SipsTea,/r/SipsTea/comments/14r3417/spawn_trap/,SuspectAny7428,Spawn trap,2926,0.98,49,,1688541266.0,False,False,False,False,False
36,14qy9iw,tumblr,/r/tumblr/comments/14qy9iw/straight_to_jail/,caughtyoulookinn,Straight to jail,8089,0.99,45,,1688525441.0,False,False,False,False,False
37,14r2tjx,cats,/r/cats/comments/14r2tjx/a_new_neighbor/,TraditionalElk781,A new neighbor.,2966,0.99,73,,1688540374.0,False,False,False,False,False
38,14r0p8k,oddlyspecific,/r/oddlyspecific/comments/14r0p8k/spaceship/,Mammoth-Medicine1385,Spaceship,4604,0.97,118,,1688533286.0,False,False,False,False,False
39,14r68tb,reddevils,/r/reddevils/comments/14r68tb/bruno_on_ig_story_why_did_you_take_so_long_to/,DonscoMUFC,Bruno on IG story: “Why did you take so long to sign 😡 Welcome @masonmount”,1572,0.96,116,:34:Donny van de Beek,1688551338.0,False,False,False,False,False
40,14qydmc,shitposting,/r/shitposting/comments/14qydmc/heil_dear_leader_spez/,OdinAurelius,Heil dear leader Spez,9564,0.94,126,William Dripfoe,1688525804.0,False,False,False,False,False
41,14r8ros,Gunners,/r/Gunners/comments/14r8ros/david_ornstein_on_twitter_arsenal_have_now/,WeedScaper,David Ornstein on Twitter: 🚨 Arsenal have now reached full agreement with Ajax to sign Jurrien Timber. Negotiations completed on fee of €40m + €5m in largely realistic bonuses. 22yo defender granted permission to undergo medical & finalise personal terms @TheAthleticFC #AFC #Ajax,1077,0.99,137,,1688558751.0,False,False,False,False,False
42,14r6h00,Catswithjobs,/r/Catswithjobs/comments/14r6h00/we_seem_to_have_forgotten_a_major_detail_in_this/,freshkillcams,We seem to have forgotten a major detail in this computer assembly,1512,0.96,31,,1688551988.0,False,False,False,False,False
43,14r4vtr,CasualUK,/r/CasualUK/comments/14r4vtr/the_swan_i_fed_since_he_was_a_single_man_i_then/,UncleBenders,"The swan I fed since he was a single man, I then fed with his girlfriend has returned today with his 4 babies ❤️ ",1953,0.97,58,,1688547070.0,False,False,False,False,False
44,14quv22,politics,/r/politics/comments/14quv22/republican_party_ridiculed_after_tweeting_wrong/,Oleg101,Republican Party ridiculed after tweeting wrong flag for Fourth of July,13772,0.95,513,,1688515000.0,False,False,False,False,False
45,14qzk9o,HonkaiStarRail,/r/HonkaiStarRail/comments/14qzk9o/official_character_announcement_fu_xuan_5_star/,Xanek,【Official】 Character Announcement: Fu Xuan (5 Star - Quantum / Preservation),5515,0.95,370,,1688529619.0,False,False,False,False,False
46,14qx6nu,oddlyterrifying,/r/oddlyterrifying/comments/14qx6nu/went_to_throw_something_in_the_little_recyling/,hunterorila,Went to throw something in the little recyling bin we have on the counter and...,10249,0.96,293,,1688522105.0,False,False,False,False,False
47,14r5425,Hololive,/r/Hololive/comments/14r5425/jp_bro_came_all_the_way_from_japan_to_watch_the/,Buttermilkman,JP bro came all the way from Japan to watch the EN concert,1807,0.98,27,:Miko:,1688547784.0,False,False,False,False,False
48,14qvviq,maybemaybemaybe,/r/maybemaybemaybe/comments/14qvviq/maybe_maybe_maybe/,50ShadesOfSpray_,Maybe maybe maybe,21369,0.83,1332,,1688518002.0,False,False,False,False,False
49,14r5fjk,Piracy,/r/Piracy/comments/14r5fjk/guess_whos_back_again/,Steelouuu,Guess who's back again,1677,0.95,76, ,1688548807.0,False,False,False,False,False
50,14qy2hp,doordash_drivers,/r/doordash_drivers/comments/14qy2hp/whyre_they_like_this/,grizzyber,why’re they like this 💀,6989,0.94,379,,1688524807.0,False,False,False,False,False
51,14qugij,madlads,/r/madlads/comments/14qugij/madlad_in_lecture_repost_because_of_new_rules/,littlerocky12,Madlad in Lecture (repost because of new rules),22446,0.94,250,,1688513828.0,False,False,False,False,False
52,14r1ji3,TrashTaste,/r/TrashTaste/comments/14r1ji3/american_boys/,YAGIboy,American boys,3324,0.93,53,Connoisseur of Trash,1688536098.0,False,False,False,False,False
53,14r3i7b,meme,/r/meme/comments/14r3i7b/hi_7_people_who_will_see_this_on_new/,freearchil521,Hi 7 people who will see this on new,2240,0.92,101,,1688542555.0,False,False,False,False,False
54,14qtkbz,mildlyinfuriating,/r/mildlyinfuriating/comments/14qtkbz/kids_eat_free_lol/,hadtodoit_69,“Kids eat free” lol,34096,0.94,1424,,1688511335.0,False,False,False,False,False
55,14r6rug,ContagiousLaughter,/r/ContagiousLaughter/comments/14r6rug/barbie_doll_dad_joke/,NauTWitcher,Barbie Doll dad joke,1295,0.94,24,,1688552861.0,True,False,False,False,False
56,14quo8i,funny,/r/funny/comments/14quo8i/if_u_ever_feel_like_a_failure_remember_denmarks/,Fun_Bison_1693,If u ever feel like a failure remember Denmark's Travel agency made this advertisement to fight Denmark's low birth rate,13403,0.92,848,,1688514436.0,True,False,False,False,False
57,14r1mds,ProgrammerHumor,/r/ProgrammerHumor/comments/14r1mds/itsbeenhardthesedays/,maujour,itsBeenHardTheseDays,2943,0.99,23,,1688536369.0,False,False,False,False,False
58,14r3nal,OneSecondBeforeDisast,/r/OneSecondBeforeDisast/comments/14r3nal/onesecondbeforedisaster/,SuperTortue,OneSecondBeforeDisaster,2114,0.95,40,,1688543028.0,False,False,False,False,False
59,14r3hjf,2westerneurope4u,/r/2westerneurope4u/comments/14r3hjf/southwestern_europe_choosing_their_languages/,B33PIDYB00P,South-Western Europe choosing their languages,2131,0.94,428,:United_Kingdom: :England: Propa Brexit Geezer,1688542492.0,False,False,False,False,False
60,14r7am2,grandorder,/r/grandorder/comments/14r7am2/new_ssr_servant_medusa_saber/,crazywarriorxx,New SSR servant - Medusa (Saber),1129,0.96,126,:l39a: Apoc Moedred,1688554433.0,False,False,False,False,False
61,14qzm57,memes,/r/memes/comments/14qzm57/is_there_any_other_good_sequels_out_there/,sully23456,Is there any other good sequels out there?,5736,0.85,1110,,1688529760.0,False,False,False,False,False
62,14qyr8m,PublicFreakout,/r/PublicFreakout/comments/14qyr8m/woman_destroys_computers_at_airlines_counter_as_a/,mojitoix,"Woman destroys computers at airline's counter as a complaint of a cancelled flight she says ""Don't give me my money back, I don't give a damn, But this is gonna cost you""",5025,0.98,662,,1688526961.0,False,False,False,False,False
63,14r5ijb,europe,/r/europe/comments/14r5ijb/we_must_admit_brexit_is_a_mistake_and_rejoin_the/,SunEater888,"We must admit Brexit is a mistake and rejoin the single market, says senior Tory Tobias Ellwood",1466,0.93,314,,1688549071.0,False,False,False,False,False
64,14r1ngt,discordVideos,/r/discordVideos/comments/14r1ngt/ayoooo_maybe_what_the_fuck_what_you_say/,Safe_Discipline_4926,Ayoooo Maybe what the fuck what you say,3226,0.87,295,,1688536479.0,True,False,False,False,False
65,14r5zzv,facepalm,/r/facepalm/comments/14r5zzv/famous_gay_murderer_karl_marx/,QJnWo4Life,Famous Gay Murderer Karl Marx,5138,0.94,852,,1688550587.0,False,False,False,False,False
66,14r5ejv,ich_iel,/r/ich_iel/comments/14r5ejv/ichiel/,Penispumpe14,ich🤑iel,1411,0.93,183,,1688548712.0,True,False,False,False,False
67,14r7lgr,BlackPeopleTwitter,/r/BlackPeopleTwitter/comments/14r7lgr/they_need_to_lock_him_up_fast_because_he_is/,imjustheretodomyjob,they need to lock him up FAST because he is FURIOUS,990,0.99,65,☑️ / Mod,1688555308.0,False,False,False,False,False
68,14r19xa,distressingmemes,/r/distressingmemes/comments/14r19xa/first_meme/,IliftHeavyCircles-95,First meme,2888,0.94,95,"they were skinwalkers, not my family",1688535170.0,False,False,False,False,False
69,14qzg0m,wholesomememes,/r/wholesomememes/comments/14qzg0m/happy_crying/,fala_shssfdsdsd,Happy crying,3918,0.98,47,,1688529219.0,False,False,False,False,False
70,14qy4a4,CrazyFuckingVideos,/r/CrazyFuckingVideos/comments/14qy4a4/mans_does_not_get_paid_enough_for_this_response/,Caseyisweird,Mans does not get paid enough for this response. ,5173,0.9,1485,,1688524970.0,False,False,False,False,False
71,14qvrc3,aww,/r/aww/comments/14qvrc3/mini_taekwondo/,TrueSkyDemon,Mini Taekwondo,8694,0.87,182,,1688517657.0,False,False,False,False,False
72,14r6kdz,lotrmemes,/r/lotrmemes/comments/14r6kdz/where_would_you_put_the_word_fk/,HelpfulDominanc,WhEre WoUlD yOu PuT tHe WoRd F**k?!?!,1106,0.95,132,,1688552262.0,False,False,False,False,False
73,14r5u8s,AITAH,/r/AITAH/comments/14r5u8s/aitah_for_refusing_to_see_my_dad_after_he/,OtherwisePea5543,AITAH for refusing to see my dad after he disowned me when he found out I'm not his biologocal daughter?,1249,0.96,404,,1688550070.0,False,False,False,False,False
74,14r3vo5,LinusTechTips,/r/LinusTechTips/comments/14r3vo5/gold_plated_you_say/,NatLovesPancakes,Gold plated you say...,1683,0.95,76,,1688543825.0,False,False,False,False,False
75,14qxj0x,Tinder,/r/Tinder/comments/14qxj0x/that_escalated_quickly/,maxi-mil,That escalated quickly :),5141,0.98,230,,1688523147.0,False,False,False,False,False
76,14r0zif,rareinsults,/r/rareinsults/comments/14r0zif/i_dont_even_know_what_this_means_but_im_pretty/,OftenerDominate459,"I.. dont even know What this means, but im pretty sure it’s an insult",2791,0.93,147,,1688534185.0,False,False,False,False,False
77,14qz8nm,antiwork,/r/antiwork/comments/14qz8nm/i_made_my_company_over_400m_last_year_i_make_less/,TransphobesRNazis,I made my company over $400M last year... I make less than $70K a year.,3700,0.89,499,,1688528538.0,False,1688534047.0,False,False,False
78,14r106y,gadgets,/r/gadgets/comments/14r106y/nasa_restores_contact_with_mars_helicopter_after/,MicroSofty88,NASA restores contact with Mars helicopter after nine weeks of silence,2610,0.97,99,,1688534250.0,False,False,False,False,False
79,14r4ghj,CombatFootage,/r/CombatFootage/comments/14r4ghj/destruction_of_russian_ammunition_dump_in/,BlackMarine,"Destruction of Russian ammunition dump in Makiivka, 04.07.2023",1412,0.97,95,,1688545665.0,False,False,False,False,False
80,14r1nec,LateStageCapitalism,/r/LateStageCapitalism/comments/14r1nec/cant_hide_the_truth/,HoweverObstruct,Can’t hide the truth,2252,0.97,118,,1688536470.0,False,False,False,False,False
81,14r0vvg,IndianFootball,/r/IndianFootball/comments/14r0vvg/indian_sports_right_now/,Still-Deal-17,Indian sports right now,2736,0.94,117,,1688533858.0,False,False,False,True,False
82,14r00kl,explainlikeimfive,/r/explainlikeimfive/comments/14r00kl/eli5_if_a_regular_weight_person_and_an_obese/,bin_of_flowers,"ELI5 If a regular weight person and an obese person were left on a desert island with no food, would the obese person live a lot longer bc they have stored up energy as fat? Or does it not work like that?",2953,0.94,689,,1688531052.0,False,False,False,False,False
83,14r177h,starwarsmemes,/r/starwarsmemes/comments/14r177h/hmmm/,Capcaveman916,Hmmm,2373,0.98,23,,1688534923.0,False,False,False,False,False
84,14qtw8d,PrequelMemes,/r/PrequelMemes/comments/14qtw8d/beard/,Alternative_Serve368,Beard,11855,0.97,117,,1688512261.0,False,False,False,False,False
85,14r21t7,unitedstatesofindia,/r/unitedstatesofindia/comments/14r21t7/fans_singing_maa_tujhe_salaamvande_mataram_in/,LoinKing_,Fans singing Maa Tujhe Salaam/Vande Mataram in stadium after India beat Kuwait and win the SAFF championship final,2043,0.96,75,:Weed: Stoned at the Rooftop,1688537797.0,False,False,False,False,False
86,14r5kan,DeepRockGalactic,/r/DeepRockGalactic/comments/14r5kan/midrillna/,Joe_Duncan,MIDRILLNA,1089,0.98,32,,1688549223.0,False,False,False,False,False
87,14r3rg7,StupidFood,/r/StupidFood/comments/14r3rg7/not_exactly_stupid_but_it_had_me_feeling/,danceswithdeath3rd,"Not exactly stupid, but it had me feeling uncomfortable ",1481,0.9,491,,1688543430.0,False,False,False,False,False
88,14qy6z4,lostredditors,/r/lostredditors/comments/14qy6z4/oh_god/,vanilla38913,oh god,4143,0.97,95,,1688525208.0,False,False,False,False,False
89,14quhi1,WorkReform,/r/WorkReform/comments/14quhi1/i_took_a_job_nobody_wanted_and_made_it_so_good_i/,BakerLovePie,I took a job nobody wanted and made it so good I got fired.,7575,0.97,349,,1688513906.0,False,False,False,False,False
90,14r97st,Genshin_Impact_Leaks,/r/Genshin_Impact_Leaks/comments/14r97st/free_lynette_40/,ukrisreng,Free lynette 4.0,627,0.98,246,,1688559944.0,False,False,False,False,False
91,14r5wi1,assholedesign,/r/assholedesign/comments/14r5wi1/this_ad_for_vitamin_water_that_claims_it_works/,nightlyMaroon,This ad for Vitamin Water that claims it works better than flu shots,995,0.9,54,,1688550277.0,False,False,False,False,False
92,14qve1f,DesignPorn,/r/DesignPorn/comments/14qve1f/its_only_a_drain_but/,Organic-Squirm,It’s only a drain but…,6290,0.95,105,,1688516521.0,False,False,False,False,False
93,14quuxe,shittymoviedetails,/r/shittymoviedetails/comments/14quuxe/in_titanic_1997_rose_drops_her_priceless_necklace/,Mr_Westerfield,"In Titanic (1997), Rose drops her priceless necklace into the sea because she thinks that’s a better use for it than, like, leaving it to her family or paying the medical bills for a kid with cancer or something",7766,0.97,172,,1688514987.0,False,False,False,False,False
94,14r37j6,LeagueOfMemes,/r/LeagueOfMemes/comments/14r37j6/how_vlad_actually_looks_like_vs_vlad_on_dating/,Boudynasr,How Vlad actually looks like vs Vlad on dating websites,1529,0.97,82,,1688541585.0,False,False,False,False,False
95,14r4wqe,Netherlands,/r/Netherlands/comments/14r4wqe/the_a9_is_completely_blocked_between_akersloot_en/,Lillymunsten,The A9 is completely blocked between Akersloot en Uitgeest towards Amsterdam,1140,0.97,174,,1688547148.0,False,False,False,False,False
96,14qu6kj,NonPoliticalTwitter,/r/NonPoliticalTwitter/comments/14qu6kj/i_mean_seriously/,CattDawg2008,i mean seriously,8498,0.95,113,:blue1::blue2::1111::1112:,1688513086.0,False,False,False,False,False
97,14quux3,clevercomebacks,/r/clevercomebacks/comments/14quux3/family_is_everything/,mrl33602,Family is everything,7598,0.94,89,,1688514987.0,False,False,False,False,False
98,14r7noz,movies,/r/movies/comments/14r7noz/new_alien_movie_has_wrapped_filming_ahead_of_2024/,tylerthe-theatre,New Alien movie has wrapped filming ahead of 2024 release,746,0.96,155,,1688555494.0,False,False,False,False,False
99,14r36tv,melbourne,/r/melbourne/comments/14r36tv/which_one_of_you_soft_cocks_did_this/,spacejester,Which one of you soft cocks did this?,1482,0.94,321,,1688541523.0,False,False,False,False,False
100,14r782u,freefolk,/r/freefolk/comments/14r782u/this_gave_me_more_chills_than_the_entire_of/,SnooMacarons9592,This gave me more chills than the entire of season 8!!!,784,0.92,36,We do not kneel,1688554240.0,True,False,False,False,False
