rank,id,subreddit,permalink,author,title,score,upvote_ratio,num_comments,author_flair_text,created_utc,over_18,edited,stickied,locked,is_original_content
1,14wqgze,funny,/r/funny/comments/14wqgze/a_working_printer_certainly_seems_farfetched/,standardkillchain,A working printer certainly seems far-fetched,13704,0.97,306,,1689079708.0,False,False,False,False,False
2,14wrnzv,mildlyinfuriating,/r/mildlyinfuriating/comments/14wrnzv/saved_this_to_my_cart_yesterday_but_decided_to/,QuickWrenn,Saved this to my cart yesterday but decided to wait until today to buy it to get a sale price on Amazon Prime day.,9974,0.99,576,,1689082676.0,False,False,False,False,False
3,14wnxyn,facepalm,/r/facepalm/comments/14wnxyn/companies_dont_care/,Sensitive-Jury-1456,Companies DON'T care.,38410,0.96,943,,1689072875.0,False,False,False,False,False
4,14wnngd,Damnthatsinteresting,/r/Damnthatsinteresting/comments/14wnngd/foal_had_close_call_the_dummy_foal_phenomenon/,Louna_Nova,Foal had close call - The dummy foal phenomenon,21655,0.97,588,,1689072035.0,False,False,False,False,False
5,14wqp8z,nextfuckinglevel,/r/nextfuckinglevel/comments/14wqp8z/man_on_bed_suspended_by_parachutes_flies_away_and/,cutestudent,Man on bed suspended by parachutes flies away and takes a nap,7468,0.92,405,,1689080313.0,False,False,False,False,False
6,14wnfs4,dankmemes,/r/dankmemes/comments/14wnfs4/happened_during_my_first_12_hours_in_la/,DoktoorDre,Happened during my first 12 hours in LA 💀,17060,0.91,1255,,1689071385.0,False,False,False,False,False
7,14wq61c,wholesomememes,/r/wholesomememes/comments/14wq61c/im_waiting/,ReynaAllman,I'm waiting...,6641,0.98,268,,1689078908.0,False,False,False,False,False
8,14wqut8,ContagiousLaughter,/r/ContagiousLaughter/comments/14wqut8/be_careful_what_you_wish_for/,ButtMonkeySlap,Be careful what you wish for...,5306,0.95,63,,1689080676.0,False,False,False,False,False
9,14woftj,community,/r/community/comments/14woftj/the_bear_writers_know_whazzup/,GhOsT_wRiTeR_XVI,“The Bear” writers know whazz-up!,7588,0.94,279,,1689074236.0,False,False,False,False,False
10,14ws36q,BeAmazed,/r/BeAmazed/comments/14ws36q/woman_tackles_fleeing_suspect/,CommercialBox4175,Woman Tackles Fleeing Suspect,4374,0.96,555,,1689083679.0,False,False,False,False,False
11,14wqfqt,marvelmemes,/r/marvelmemes/comments/14wqfqt/so_basically_deadpool_was_the_one_who_fixed_the/,spidey20993,"So basically, Deadpool was the one who fixed the X-Men's outfit",5580,0.98,163,Spider-Man 🕷,1689079619.0,False,False,False,False,False
12,14wtxbf,gaming,/r/gaming/comments/14wtxbf/microsoft_wins_ftc_fight_to_buy_activision/,Gab1024,Microsoft wins FTC fight to buy Activision Blizzard,3153,0.95,1878,,1689088101.0,False,False,False,False,False
13,14wq4po,Animemes,/r/Animemes/comments/14wq4po/the_goat/,jjeg6804,THE G.O.A.T,5364,0.95,164,⠀,1689078801.0,False,False,False,False,False
14,14wpfzs,WhitePeopleTwitter,/r/WhitePeopleTwitter/comments/14wpfzs/republicans_in_congress_believe_white/,Travismatthew08,Republicans in Congress believe White Nationalists are not racist. “(If they are) - That’s your opinion.” - Tommy Tuberville,5133,0.97,289,,1689076983.0,False,False,False,False,False
15,14wkz1a,shitposting,/r/shitposting/comments/14wkz1a/you_guys_are_sick_af_glory_to_spez/,Notafuqin_Carrot211,You guys are sick af ( glory to spez),34758,0.95,241,We do a little trolling :snoo_trollface:,1689063194.0,False,False,False,False,False
16,14wnbxb,pcmasterrace,/r/pcmasterrace/comments/14wnbxb/getting_a_gaming_laptop_was_a_mistake_please_dont/,No_Locksmith_1458,Getting a gaming laptop was a mistake. Please don't buy a gaming laptop,8705,0.88,1487,Desktop,1689071035.0,False,False,False,False,False
17,14wn48x,worldnews,/r/worldnews/comments/14wn48x/nato_decision_on_moving_towards_ukraines/,MagnificentCat,NATO decision on moving towards Ukraine’s membership to be agreed in few hours – Secretary General,7027,0.96,560,,1689070344.0,False,False,False,False,False
18,14wkmz7,news,/r/news/comments/14wkmz7/14yearold_girl_missing_for_2_weeks_found_in/,ezikeo,"14-year-old girl missing for 2 weeks found in Marine barracks was ‘sold,’ says aunt",13982,0.96,1701,,1689062054.0,False,False,False,False,False
19,14wo0fw,memes,/r/memes/comments/14wo0fw/if_you_came_to_australia_for_a_holiday_how_was_it/,K-boomX94,"If you came to Australia for a holiday, how was it?",7350,0.98,353,,1689073074.0,False,False,False,False,False
20,14wpfno,SipsTea,/r/SipsTea/comments/14wpfno/bro_playing_chess_while_we_play_cheekers/,Alternative_Serve368,Bro playing chess while we play cheekers,5044,0.95,147,,1689076959.0,False,False,False,False,False
21,14wom09,unpopularopinion,/r/unpopularopinion/comments/14wom09/you_cant_rarelynever_have_sex_with_your_partner/,EquivalentEmotion950,You can’t rarely/never have sex with your partner and expect them to be faithful.,6331,0.81,2159,,1689074720.0,False,False,False,False,False
22,14wocph,MadeMeSmile,/r/MadeMeSmile/comments/14wocph/my_man_got_moves/,IllTechnician4571,My man got moves!,5296,0.97,53,,1689073993.0,False,False,False,False,False
23,14wmfu3,TikTokCringe,/r/TikTokCringe/comments/14wmfu3/why_dont_my_kids_trust_me_ive_never_did_something/,Arkatoshi,Why don’t my kids trust me? I‘ve never did something wrong in the education. Why won’t they tell me anything?,8581,0.86,1128,,1689068173.0,False,False,False,False,False
24,14wngsl,politics,/r/politics/comments/14wngsl/republican_women_learn_the_hard_way_complicity/,Picture-unrelated,"Republican women learn the hard way: Complicity will not protect you — The Freedom Caucus ousts Marjorie Taylor Greene and Ron DeSantis ends alimony for older, mostly conservative women",5523,0.96,353,:flag-or: Oregon,1689071462.0,False,False,False,False,False
25,14wlwyr,comics,/r/comics/comments/14wlwyr/expressing_out/,GrumpyMashy,Expressing Out,8802,0.9,229,,1689066411.0,False,False,False,False,True
26,14wq3oa,todayilearned,/r/todayilearned/comments/14wq3oa/til_james_bradley_calculated_the_speed_of_light/,Kipperis,TIL James Bradley calculated the speed of light with a 0.4% error margin in 1729,3438,0.98,112,,1689078725.0,False,False,False,False,False
27,14wtohr,WatchPeopleDieInside,/r/WatchPeopleDieInside/comments/14wtohr/playing_with_dog_leads_to_accidental_table/,Boojibs,Playing with dog leads to accidental table destruction ,2065,0.95,289,,1689087562.0,False,False,False,False,False
28,14wle0k,ProgrammerHumor,/r/ProgrammerHumor/comments/14wle0k/kindoflogic/,Strange_Dragonfly964,kindOfLogic,7134,0.95,186,:py:,1689064642.0,False,False,False,False,False
29,14wrgfx,formuladank,/r/formuladank/comments/14wrgfx/honey_badger_what_happened/,Chell_the_assassin,"Honey Badger, what happened",2469,0.98,94,Mika ends his sa🅱️🅱️atical ,1689082182.0,False,False,False,False,False
30,14wny99,TrueOffMyChest,/r/TrueOffMyChest/comments/14wny99/thought_he_stood_me_up_on_our_date_turns_out_he/,quanvuminhtran,"Thought he stood me up on our date, turns out he died...",3953,0.97,154,,1689072900.0,False,False,False,False,False
31,14wo9fb,cats,/r/cats/comments/14wo9fb/this_is_true_love/,Melissa_Lewes,this is true love,3699,0.98,48,,1689073741.0,False,False,False,False,False
32,14wnw8b,whenthe,/r/whenthe/comments/14wnw8b/damn_bro_you_got_the_whole_squad_laughing/,Viggyry,"Damn bro, you got the whole squad laughing",4730,0.85,289,👨‍🦲🧑👨🧑 weezer,1689072735.0,False,False,False,False,False
33,14wkohr,HolUp,/r/HolUp/comments/14wkohr/everyone_sharing_the_happiness/,LogicalAsk5426,Everyone Sharing the happiness ,9373,0.95,226,,1689062188.0,False,False,False,False,False
34,14wpd99,MemePiece,/r/MemePiece/comments/14wpd99/the_only_reason_he_couldve_possibly_put_that_on/,metalhiro,The only reason he could’ve possibly put that on,3054,0.95,67,,1689076806.0,False,False,False,False,False
35,14wk9w1,PoliticalHumor,/r/PoliticalHumor/comments/14wk9w1/it_was_only_a_matter_of_time/,DoreathaBedard,It was only a matter of time,7010,0.97,235,,1689060859.0,False,False,False,False,False
36,14wpmhe,LateStageCapitalism,/r/LateStageCapitalism/comments/14wpmhe/ask_corporations_why_theyre_paying_their/,Sensitive-Jury-1456,Ask corporations why they’re paying their employees low wages,2709,0.98,64,,1689077462.0,False,False,False,False,False
37,14wpnff,technology,/r/technology/comments/14wpnff/san_francisco_protestors_are_disabling_autonomous/,chrisdh79,"San Francisco protestors are disabling autonomous vehicles using traffic cones | ""It's a great time""",2706,0.94,487,,1689077532.0,False,False,False,False,False
38,14wn8ur,LeopardsAteMyFace,/r/LeopardsAteMyFace/comments/14wn8ur/mypillow_is_auctioning_off_equipment_after/,ToffeeFever,MyPillow is auctioning off equipment after retailers pull its products: CEO Mike Lindell says annual sales fell $100 million after several big-box retailers cut ties following his election claims.,3844,0.97,355,,1689070770.0,False,False,False,False,False
39,14wrb8p,ufc,/r/ufc/comments/14wrb8p/well_shit/,thehiguyz,Well Shit,2115,0.97,660,,1689081821.0,False,False,False,False,False
40,14wnl6h,clevercomebacks,/r/clevercomebacks/comments/14wnl6h/thats_not_acceptable/,romanystock99,That's not acceptable.,3700,0.91,187,,1689071837.0,False,False,False,False,False
41,14wrakh,tumblr,/r/tumblr/comments/14wrakh/thats_just_rabbits_vs_hares_all_over_again_lol/,Peter_Rodruigues,That's just rabbits vs hares all over again lol,2184,1.0,43,,1689081773.0,False,False,False,False,False
42,14wmatw,Damnthatsinteresting,/r/Damnthatsinteresting/comments/14wmatw/mama_bird_protects_her_eggs_from_a_hailstorm_in/,PlantZenGuy,"Mama bird protects her eggs from a hailstorm in Boulder, Colorado",17349,0.98,222,,1689067721.0,False,False,False,False,False
43,14whtk4,BrandNewSentence,/r/BrandNewSentence/comments/14whtk4/would_like_to_buy_this_guy_a_beer_and_hear_his/,secretslut991,Would like to buy this guy a beer and hear his story,13387,0.96,92,,1689053067.0,False,False,False,False,False
44,14wor7a,oddlysatisfying,/r/oddlysatisfying/comments/14wor7a/crystal_clear_water/,goldbutthole,Crystal clear water,2542,0.98,54,,1689075129.0,False,False,False,False,False
45,14wgyz5,meirl,/r/meirl/comments/14wgyz5/meirl/,iamcoollife1994,meirl,15598,0.98,254,,1689050430.0,False,False,False,False,False
46,14wmw88,TheLastAirbender,/r/TheLastAirbender/comments/14wmw88/toph_for_sure/,IndependentEmploy661,Toph for sure,3316,0.96,150,,1689069671.0,False,False,False,False,False
47,14wkm6v,europe,/r/europe/comments/14wkm6v/slovak_police_caught_a_guy_speeding_on_an/,mancko28,Slovak police caught a guy speeding on an e-scooter at 118 km/h (68 km/h over the speed limit),4988,0.96,425,Slovakia,1689061977.0,False,False,False,False,False
48,14wr0cs,dataisbeautiful,/r/dataisbeautiful/comments/14wr0cs/oc_first_6_months_of_orbital_launch_attempts_in/,TK_Say,[OC] First 6 Months of orbital launch attempts in 2023. From launch site to orbit.,1758,0.97,107,,1689081071.0,False,False,False,False,False
49,14wh0e9,WTF,/r/WTF/comments/14wh0e9/out_of_anywhere_that_they_couldve_went/,Sad_Implement_8017,Out of anywhere that they could’ve went.,11166,0.95,680,,1689050545.0,True,False,False,False,False
50,14wqgdr,midjourney,/r/midjourney/comments/14wqgdr/cast_of_the_office_in_gta_v_style/,Dankuruma,Cast of 'The Office' in GTA V Style.,1893,0.93,187,,1689079664.0,False,False,False,False,False
51,14wjz0g,cursedcomments,/r/cursedcomments/comments/14wjz0g/cursed_op/,Quobl_69420,Cursed_op,7398,0.96,137,,1689059841.0,False,False,False,False,False
52,14wk6t7,therewasanattempt,/r/therewasanattempt/comments/14wk6t7/to_shame_meat_eaters/,StarkSlur48,To shame meat eaters,5547,0.94,269,,1689060586.0,False,False,False,False,False
53,14wpkri,WorkReform,/r/WorkReform/comments/14wpkri/ask_corporations_why_theyre_paying_their/,Sensitive-Jury-1456,Ask corporations why they’re paying their employees low wages,2066,0.97,42,,1689077334.0,False,False,False,False,False
54,14wq5c6,curb,/r/curb/comments/14wq5c6/finding_your_roots/,nikamats,Finding Your Roots,1914,0.97,125,,1689078853.0,False,False,False,False,False
55,14wmnbh,Genshin_Impact,/r/Genshin_Impact/comments/14wmnbh/why_did_they_make_this_whole_boss_but_then_only/,Sussybeka,Why did they make this whole boss but then only make it temporary,3476,0.94,324,:cyno:,1689068855.0,False,False,False,False,False
56,14wsdum,Superstonk,/r/Superstonk/comments/14wsdum/citadel_securities_and_citadel_market_maker_have/,monkeyshinenyc,Citadel Securities and Citadel Market Maker Have been going after GG hard.,1654,0.95,172,tag u/Superstonk-Flairy for a flair,1689084358.0,False,False,False,False,False
57,14woufn,science,/r/science/comments/14woufn/hospital_understaffing_and_poor_work_conditions/,mvea,Hospital understaffing and poor work conditions associated with physician and nurse burnout and intent to leave. The solutions are not resilience training for clinicians to better cope with adverse working conditions but organizational improvements for safe workloads and better work-life balance.,2196,0.97,178,MD/PhD/JD/MBA | Professor | Medicine,1689075376.0,False,False,False,False,False
58,14wgic9,Unexpected,/r/Unexpected/comments/14wgic9/can_you_say/,Winter_Ad4517,Can you say?,19809,0.88,1662,,1689049029.0,False,False,False,False,False
59,14whi2c,Breath_of_the_Wild,/r/Breath_of_the_Wild/comments/14whi2c/well_excuuuuuuuuuuse_me/,DeeplyThirsty,Well excuuuuuuuuuuse me,9970,0.97,197,,1689052039.0,False,False,False,False,False
60,14wmwi9,technews,/r/technews/comments/14wmwi9/a_proposed_massachusetts_law_would_ban_the_sale/,chrisdh79,A Proposed Massachusetts Law Would Ban the Sale of Cell Phone Location Data,2890,0.98,43,,1689069689.0,False,False,False,False,False
61,14wq9v4,awfuleverything,/r/awfuleverything/comments/14wq9v4/i_guess_this_takes_the_meaning_of_shoey_to_the/,FreeDeterminism,I guess this takes the meaning of “shoey” to the next level…,1763,0.93,158,,1689079195.0,False,False,False,False,False
62,14wqwmm,WhitePeopleTwitter,/r/WhitePeopleTwitter/comments/14wqwmm/remember_find_11780_votes_today_a_grand_jury_in/,Travismatthew08,"Remember ""Find 11,780 votes?"" Today a Grand Jury in Georgia decides whether to charge Trump with felony charges.",3867,0.99,221,,1689080803.0,False,False,False,False,False
63,14wk3un,anime_irl,/r/anime_irl/comments/14wk3un/anime_irl/,maybeharu,anime_irl,4990,0.94,61,,1689060299.0,False,False,False,False,False
64,14wkszv,NatureIsFuckingLit,/r/NatureIsFuckingLit/comments/14wkszv/how_its_like_to_be_stalked_by_a_puma/,esberat,🔥 How it’s like to be stalked by a puma,4230,0.93,219,,1689062587.0,False,False,False,False,False
65,14wmht6,teenagers,/r/teenagers/comments/14wmht6/my_boyfriend_was_dating_2_other_girls_while_with/,g00d_g0d_man,my boyfriend was dating 2 other girls while with me. so the 3 of us all told him we were pregnant...,3301,0.97,249,17,1689068361.0,True,False,False,False,False
66,14wmjsh,Grimdank,/r/Grimdank/comments/14wmjsh/praise_he_on_earth_for_no_jokes_being_made_at_our/,RecentShower6523,Praise He on Earth for no jokes being made at our expense!,3043,0.9,267,,1689068543.0,False,False,False,False,False
67,14wt5zq,Tinder,/r/Tinder/comments/14wt5zq/i_guess_ice_cream_dates_are_considered_a_terrible/,Zhinii1,I guess ice cream dates are considered a terrible idea nowadays,1229,0.98,351,,1689086236.0,False,False,False,False,False
68,14wr2ao,movies,/r/movies/comments/14wr2ao/first_image_of_hugh_grant_as_an_oompa_loompa_in/,MarvelsGrantMan136,First Image of Hugh Grant as an Oompa Loompa in 'Wonka',1475,0.92,335,r/Movies contributor,1689081212.0,False,False,False,False,False
69,14wol8j,DnD,/r/DnD/comments/14wol8j/oc_is_it_a_goose_is_it_an_ooze_yes/,michifromkmk,[OC] Is it a goose? Is it an ooze? Yes!,2010,0.97,57,,1689074657.0,False,False,False,False,True
70,14ws7tk,me_irlgbt,/r/me_irlgbt/comments/14ws7tk/me_irlgbt/,Sonic_the_hedgedog,me_irlgbt,1259,0.98,16,MLM/Ace :mlm_ace:,1689083997.0,False,False,False,False,False
71,14wq617,LifeProTips,/r/LifeProTips/comments/14wq617/lpt_request_best_way_to_respond_to_people_who_ask/,rocketteefsfloor,LPT request: Best way to respond to people who ask for a beer when we have 25 beers on tap?,1620,0.86,997,,1689078908.0,False,False,False,False,False
72,14wnbrj,antiwork,/r/antiwork/comments/14wnbrj/americanshow_did_it_get_this_way/,Enkir,Americans...how did it get this way?,2413,0.93,1037,,1689071017.0,False,1689071201.0,False,False,False
73,14wqgkq,Hololive,/r/Hololive/comments/14wqgkq/d/,woodenpony,:D,1551,0.97,60,:YAGOO::Suisei::Kronii::Koyori:,1689079678.0,False,False,False,False,False
74,14wnwef,nba,/r/nba/comments/14wnwef/chris_paul_had_the_saddest_warriors_introduction/,_felagund,Chris Paul had the saddest Warriors introduction possible,2109,0.93,324,:sas-4: Spurs,1689072746.0,False,False,False,False,False
75,14woyw8,wallstreetbets,/r/wallstreetbets/comments/14woyw8/team_elon_or_mark/,TotherCanvas249,Team Elon or Mark,1839,0.89,442,,1689075715.0,False,False,False,False,False
76,14wmko3,ukraine,/r/ukraine/comments/14wmko3/explained_russian_commander_shot_dead_after/,RoninSolutions,"EXPLAINED: Russian Commander Shot Dead After Posting Runs on Strava Running App. Ukraine’s Defense Intelligence has confirmed the shooting and included some very specific details about what happened to Stanislav Rzhytsky, even the type of gun used.",2523,0.98,172,,1689068628.0,False,False,False,False,False
77,14wm4z8,CrazyFuckingVideos,/r/CrazyFuckingVideos/comments/14wm4z8/drug_bust/,SweetyByHeart,Drug bust,2756,0.96,291,,1689067173.0,True,False,False,False,False
78,14wpbfy,lotrmemes,/r/lotrmemes/comments/14wpbfy/witchcraft/,nsfw_lotr_memes__,Witchcraft.,1634,0.95,31,,1689076657.0,False,False,False,False,False
79,14wqolf,PoliticalCompassMemes,/r/PoliticalCompassMemes/comments/14wqolf/something_something_student_loans/,lucimorningstar_,Something something student loans,1356,0.77,494,:libleft: - Lib-Left,1689080265.0,False,False,False,False,False
80,14wrq4m,popculturechat,/r/popculturechat/comments/14wrq4m/why_has_zendaya_been_getting_so_much_hate_since/,HiccupHaddockismine,Why has Zendaya been getting so much hate since the Challengers trailer dropped?,1153,0.92,309,,1689082818.0,False,False,False,False,False
81,14wro86,pokemon,/r/pokemon/comments/14wro86/day_24_of_fusing_every_gen_1_pokemon_into_one_by/,TB_Mumpitz,Day 24 of fusing every Gen 1 pokemon into one by adding the top comment. The hydra is now complete (through the addition of Arbok)! (24/151),1131,0.93,267,,1689082693.0,False,False,False,False,True
82,14wgn09,oddlyterrifying,/r/oddlyterrifying/comments/14wgn09/concept_art_for_bruce_from_finding_nemo/,Few_Republic1136,Concept art for Bruce from Finding Nemo,8491,0.96,77,,1689049416.0,False,False,False,False,False
83,14wlf5z,LeagueOfMemes,/r/LeagueOfMemes/comments/14wlf5z/vayne_top/,octobersveryown616,Vayne top 🤢,2926,0.95,161,,1689064757.0,False,False,False,False,False
84,14wjule,technicallythetruth,/r/technicallythetruth/comments/14wjule/what_is_it_actually/,SulkyAdver,What is it actually?,4009,0.98,98,,1689059443.0,False,False,False,False,False
85,14wee7l,OneOrangeBraincell,/r/OneOrangeBraincell/comments/14wee7l/definitely_orange_cat_behavior/,Teeeeedubbb,definitely orange cat behavior,12562,0.97,206,,1689043053.0,False,False,False,False,False
86,14wrfst,OldSchoolCool,/r/OldSchoolCool/comments/14wrfst/if_your_default_mental_photo_of_marilyn_monroe_is/,filmroses,"If your default mental photo of Marilyn Monroe is an over-saturated glamour shot of her with her mouth open, please take a moment to replace it with this one of her giving zero fucks about some bears eating garbage. 1953",1149,0.95,63,,1689082141.0,False,False,False,False,False
87,14wkfsi,MapPorn,/r/MapPorn/comments/14wkfsi/the_global_annual_movement_of_temperature/,il-yes13,The global annual movement of temperature,3337,0.94,244,,1689061395.0,False,False,False,False,False
88,14wmook,UkrainianConflict,/r/UkrainianConflict/comments/14wmook/breaking_france_will_transfer_longrange_missiles/,-Nikki-j,"BREAKING: ""France will transfer long-range missiles to Ukraine to support the counteroffensive,"" French President Macron just confirmed in Vilnius.",2122,0.97,86,,1689068983.0,False,False,False,False,False
89,14wp804,blackcats,/r/blackcats/comments/14wp804/so_many_beans/,nikki_nitrous,So many beans 🫘,1461,0.98,26,,1689076391.0,False,False,False,False,False
90,14wivlx,notmycat,/r/notmycat/comments/14wivlx/got_my_cat_a_microchip_activated_cat_flap_and_all/,Solid_Solid724,Got my cat a microchip activated cat flap and all the local NMCs that used to wander in through the open windows are wondering why they can't come in and ear his food anymore.,4253,0.97,160,,1689056387.0,False,False,False,False,False
91,14wpqdj,Eldenring,/r/Eldenring/comments/14wpqdj/if_elden_ring_had_multiple_mounts_it_would_be/,Another_Saint,"if Elden Ring had multiple mounts it would be cool if each one was unique, like this",1345,0.96,126,,1689077746.0,False,False,False,False,False
92,14wpjow,Fauxmoi,/r/Fauxmoi/comments/14wpjow/tom_sharing_his_thoughts_on_hollywood/,groovygyal,Tom sharing his thoughts on Hollywood,1366,0.96,153,I don’t know her,1689077249.0,False,False,False,False,False
93,14woerc,AnimalsBeingBros,/r/AnimalsBeingBros/comments/14woerc/the_ultimate_friendship/,lnfinity,The ultimate friendship,1592,0.96,18,,1689074152.0,False,False,False,False,False
94,14wqmza,Frugal,/r/Frugal/comments/14wqmza/prime_day_amazon_is_a_marketing_event_not_a_deal/,reloaded890,"Prime Day (Amazon) is a marketing event, not a deal day.",1166,0.93,167,,1689080149.0,False,False,False,False,False
95,14wtfgv,TwoXChromosomes,/r/TwoXChromosomes/comments/14wtfgv/am_i_being_manipulative_by_asking_for_a_vasectomy/,dontrockthejuicebox,Am I being manipulative by asking for a vasectomy?,858,0.94,431,,1689086916.0,False,False,False,False,False
96,14wmfug,wholesomegreentext,/r/wholesomegreentext/comments/14wmfug/oneeyed_anon_got_a_lot_of_support/,abutrekrl,One-eyed anon got a lot of support,2187,0.97,48,,1689068173.0,False,False,False,False,False
97,14wipxr,PublicFreakout,/r/PublicFreakout/comments/14wipxr/man_with_a_gun_hailed_hero_after_saving_an/,Blunt_Carolina,Man with a gun hailed hero after saving an elderly from a carjacker,4292,0.96,384,,1689055915.0,False,False,False,False,False
98,14wotbh,NoStupidQuestions,/r/NoStupidQuestions/comments/14wotbh/have_you_ever_secretly_felt_the_urge_to_just_go/,Hungry_Field3670,Have you ever secretly felt the urge to just go and live in a hut in the forest and hunt rabbits and forage for berries like a hermit?,1474,0.91,424,,1689075297.0,False,False,False,False,False
99,14wdqko,Whatcouldgowrong,/r/Whatcouldgowrong/comments/14wdqko/wcgw_opening_your_car_door_without_looking_first/,tefunka,WCGW Opening your car door without looking first in Beverley Hills,13262,0.95,1082,,1689041242.0,False,False,False,False,False
100,14wq39w,Jokes,/r/Jokes/comments/14wq39w/i_was_banging_this_hot_chick_on_her_kitchen_table/,HelpingHandsUs,I was banging this hot chick on her kitchen table when we heard the front door open..,1237,0.91,57,,1689078693.0,False,False,False,False,False
