rank,id,subreddit,permalink,author,title,score,upvote_ratio,num_comments,author_flair_text,created_utc,over_18,edited,stickied,locked,is_original_content
1,1538noh,WhitePeopleTwitter,/r/WhitePeopleTwitter/comments/1538noh/we_need_to_elect_adam_frisch_and_send_bobo_back/,Paneraiguy1,We need to elect Adam Frisch and send BoBo back to the trailer park,22253,0.97,743,,1689710392.0,False,False,False,False,False
2,15371q7,todayilearned,/r/todayilearned/comments/15371q7/til_momofuku_ando_the_inventor_of_insta_ramen/,Flares117,"TIL: Momofuku Ando, the inventor of insta ramen believed his noodles could cure world hunger. Over the decades he would shout quotes to his employees which includes, ""Mankind is noodlekind"", ""What are you doing now?"", and ""Peace will come when people have food"" which are in the employee handbook.",26073,0.97,851,,1689706748.0,False,False,False,False,False
3,1536w10,politics,/r/politics/comments/1536w10/democrats_planning_major_push_to_unseat_ted_cruz/,UWCG,"Democrats Planning Major Push to Unseat Ted Cruz, Josh Hawley in 2024 Race",13403,0.97,663,:flag-il: Illinois,1689706375.0,False,False,False,False,False
4,1539l7c,nottheonion,/r/nottheonion/comments/1539l7c/gop_lawmakers_predict_imminent_fistfight_between/,kevins_child,GOP lawmakers predict imminent ‘fistfight’ between Marjorie Taylor Greene and Lauren Boebert,8366,0.94,1012,,1689712479.0,False,False,False,False,False
5,1535zaz,facepalm,/r/facepalm/comments/1535zaz/those_poor_1_folk/,MassiveLabz,Those poor 1% folk…,17780,0.95,424,,1689704283.0,False,False,False,False,False
6,1534mgl,Damnthatsinteresting,/r/Damnthatsinteresting/comments/1534mgl/the_pinnacle_of_creativity/,Careful_Cup4484,The pinnacle of creativity,31158,0.92,867,,1689701120.0,False,False,False,False,False
7,153b4x6,OldSchoolCool,/r/OldSchoolCool/comments/153b4x6/an_extremely_brave_woman_jumps_from_plane_to/,ojodefiz,An extremely brave woman jumps from plane to plane to mid-air to change a landing gear. 1926.,5374,0.97,490,,1689716083.0,False,False,False,False,False
8,15399nl,news,/r/news/comments/15399nl/michigan_attorney_general_charges_false_electors/,Victorian_Robit,Michigan attorney general charges 'false electors' over efforts to overturn the 2020 election,6647,0.97,376,,1689711748.0,False,False,False,False,False
9,153c2ep,memes,/r/memes/comments/153c2ep/i_know_what_to_write_here/,Ok-Fail-540,I know what to write here,5483,0.97,157,,1689718228.0,False,False,False,False,False
10,1533g8t,nextfuckinglevel,/r/nextfuckinglevel/comments/1533g8t/fascinating_details_about_samuel_l_jackson/,esberat,Fascinating details about Samuel L. Jackson.,43351,0.93,1097,,1689698442.0,False,False,False,False,False
11,1538xk5,TikTokCringe,/r/TikTokCringe/comments/1538xk5/a_recently_transitioned_man_expresses/,Successful_Leek96,A recently transitioned man expresses disappointment with male social constructs,7412,0.9,2248,,1689710990.0,False,False,False,False,False
12,1537q3f,HumansBeingBros,/r/HumansBeingBros/comments/1537q3f/flight_attendant_helps_a_mom_and_baby/,westcoastcdn19,Flight attendant helps a mom and baby ,8678,0.96,176,,1689708257.0,False,False,False,False,False
13,1538x1b,worldnews,/r/worldnews/comments/1538x1b/russia_extends_eligibility_for_military_callup_by/,CosminFG,"Russia extends eligibility for military call-up by at least five years, senior officers to serve up to the age of 70",6125,0.97,502,,1689710955.0,False,False,False,False,False
14,1534z13,diablo4,/r/diablo4/comments/1534z13/patch_11_is_essentially_a_slowdown_to_every/,TheMorals,Patch 1.1 is essentially a slowdown to every single part of the game.,12904,0.92,5938,,1689701948.0,False,False,False,False,False
15,1532q5a,MadeMeSmile,/r/MadeMeSmile/comments/1532q5a/nonforced_snuggle/,fat_old_boy,Non-forced snuggle.,39536,0.97,540,,1689696774.0,False,False,False,False,False
16,153598u,BrandNewSentence,/r/BrandNewSentence/comments/153598u/what_prompted_this/,Falconx2020,What prompted this?,12336,0.97,215,,1689702615.0,False,False,False,False,False
17,1538jox,todayilearned,/r/todayilearned/comments/1538jox/til_that_after_colonel_sanders_sold_kfc_he_still/,ProbablySomeBoomer,"TIL that after Colonel Sanders sold KFC, he still made surprise visits to KFC restaurants. If the food disappointed him, he’d denounce it as ""God-damned slop"" or knock it on the floor. In 1973, KFC’s owner sued him for libel after he publicly called their gravy ""sludge"" with a ""wall-paper taste.”",14207,0.98,639,,1689710126.0,False,False,False,False,False
18,1533ell,BlackPeopleTwitter,/r/BlackPeopleTwitter/comments/1533ell/yall_need_to_stop_playing_lol/,MrBeez83,Y’all need to stop playing! LOL,15408,0.94,508,,1689698337.0,False,False,False,False,False
19,15392ux,WhitePeopleTwitter,/r/WhitePeopleTwitter/comments/15392ux/granny_is_straight_up_trash_plain_and_simple/,Tri734,"Granny is straight up trash, plain and simple,",11888,0.98,618,,1689711316.0,False,False,False,False,False
20,1536hr1,Unexpected,/r/Unexpected/comments/1536hr1/guess_how_much_is_it_now/,Azsnee09,Guess how much is it now? ,7963,0.94,738,,1689705454.0,False,False,False,False,False
21,1536cp0,PublicFreakout,/r/PublicFreakout/comments/1536cp0/i_thought_canadians_were_nice/,IdkHowToDie,I thought Canadians were nice.,7805,0.93,1637,,1689705126.0,False,False,False,False,False
22,1535ctm,Spiderman,/r/Spiderman/comments/1535ctm/thoughts_on_miguel_ohara_paralleling_kingpin/,yungdragvn,Thoughts on Miguel O’Hara paralleling Kingpin?,10199,0.96,187,,1689702850.0,False,False,False,False,False
23,1531ugo,gaming,/r/gaming/comments/1531ugo/study_says_7_out_of_10_players_avoid_playing/,Hard2DaC0re,Study Says 7 Out Of 10 Players Avoid Playing Certain Games Because Of Toxic Communities,22334,0.92,4332,,1689694791.0,False,False,False,False,False
24,1534c68,HolUp,/r/HolUp/comments/1534c68/selfdefence_kid/,bindukwe,self-defence kid,14258,0.93,246,,1689700461.0,False,False,False,False,False
25,1535h85,funny,/r/funny/comments/1535h85/never_leave_your_slushies_unattended/,JediWithAnM4A1,Never leave your slushies unattended,7694,0.96,163,,1689703139.0,False,False,False,False,False
26,1532seu,antiwork,/r/antiwork/comments/1532seu/this_is_the_third_workers_death_at_the/,julezrulez1234567,"This is the third workers death at the Hattiesburg, MS Mar-Jac Plant since 2020. He was in 8th grade and his name was Duvan Perez.",12522,0.97,629,,1689696918.0,False,False,False,False,False
27,15375r7,NonPoliticalTwitter,/r/NonPoliticalTwitter/comments/15375r7/lol/,lhomme21,Lol,6155,0.98,65,:blue1::blue2::1111::1112:,1689706988.0,False,False,False,False,False
28,1533suc,wholesomememes,/r/wholesomememes/comments/1533suc/hope_he_impressed_her/,blaze_uchiha999,Hope he impressed her,14094,0.92,571,,1689699250.0,False,False,False,False,False
29,1539exk,BeAmazed,/r/BeAmazed/comments/1539exk/nonforced_snuggle/,Fit_Jackfruit7887,Non-forced snuggle.,4318,0.97,170,,1689712078.0,False,False,False,False,False
30,1533yqp,cats,/r/cats/comments/1533yqp/random_cat_literally_followed_me_home_and_started/,Ok_Excitement_9103,Random cat literally followed me home and started sleeping on my couch (she’s been here for 2 days now),8653,0.98,426,,1689699636.0,False,False,False,False,False
31,1535stu,SipsTea,/r/SipsTea/comments/1535stu/no_exceptions/,MadalynHorner,No exceptions!,6893,0.95,143,,1689703869.0,False,False,False,False,False
32,15395iu,therewasanattempt,/r/therewasanattempt/comments/15395iu/to_steal/,MrX-MMAs,to steal,3986,0.97,434,,1689711485.0,False,False,False,False,False
33,1532ck0,mildlyinfuriating,/r/mildlyinfuriating/comments/1532ck0/my_driver_has_these_wireless_seatbelts_to_prevent/,4lways_Has_B33N,"My driver has these ""wireless seatbelts"" to prevent seatbelt alarms.",14077,0.9,1517,,1689695932.0,False,False,False,False,False
34,1537z1w,whenthe,/r/whenthe/comments/1537z1w/be_careful_little_eyes_what_you_see/,thepositivepandemic,be careful little eyes what you see,5101,0.97,338,[deleted],1689708816.0,False,False,False,False,False
35,1539vvi,ContagiousLaughter,/r/ContagiousLaughter/comments/1539vvi/2_guys_1_bull/,Boobglow,2 Guys 1 Bull,3450,0.96,138,,1689713189.0,False,False,False,False,False
36,1538weh,Serverlife,/r/Serverlife/comments/1538weh/throwback_to_when_a_client_asked_if_i_was_going/,MIA_Panther,Throwback to when a client asked if I was going to r*pe her.,3768,0.97,294,,1689710914.0,False,False,False,False,False
37,1530ql7,AITAH,/r/AITAH/comments/1530ql7/further_update_husband_accused_me_of_financial/,LadySavings,Further Update: Husband accused me of financial infidelity,16237,0.92,4880,,1689692244.0,False,False,False,False,False
38,1535864,PrequelMemes,/r/PrequelMemes/comments/1535864/nerra/,JediWithAnM4A1,Nerra 😭,7106,0.97,61,,1689702549.0,False,False,False,False,False
39,15301r0,NoStupidQuestions,/r/NoStupidQuestions/comments/15301r0/going_to_jail_in_7_hours_what_is_something_i/,ThrowRA4290,"Going to jail in 7 hours, what is something I should do before I go?",27162,0.92,6658,,1689690598.0,False,False,False,False,False
40,153ak5b,politics,/r/politics/comments/153ak5b/bidens_latest_campaign_tweet_is_simply_a_video_of/,Micurza,Biden’s latest campaign tweet is simply a video of Marjorie Taylor Greene speaking,5436,0.99,298,,1689714713.0,False,False,False,False,False
41,1537aw6,facepalm,/r/facepalm/comments/1537aw6/the_girl_equivalent_of_calling_margot_robbie_mid/,CartiDropWLRFucker,The girl equivalent of calling Margot Robbie mid,11459,0.96,1035,,1689707315.0,False,False,False,False,False
42,152zh9a,rareinsults,/r/rareinsults/comments/152zh9a/nft_people_deserve_it/,Cold_Initial1891,Nft people deserve it,30541,0.92,896,,1689689258.0,False,False,False,False,False
43,1535zi5,HonkaiStarRail,/r/HonkaiStarRail/comments/1535zi5/march_7_photo_by_hle/,DemetrNieA,March 7 photo (by Hle),5728,0.93,148,,1689704294.0,False,False,False,False,False
44,152znd8,tumblr,/r/tumblr/comments/152znd8/would_you/,Justthisdudeyaknow,Would you?,19691,0.98,181,,1689689663.0,False,False,False,False,False
45,1539rm7,Whatcouldgowrong,/r/Whatcouldgowrong/comments/1539rm7/sound_warning_when_you_dont_follow_lanes/,TheWhiteWalkerSpeaks,[Sound Warning ⚠️]  When you don't follow lanes.,3154,0.97,405,,1689712912.0,False,False,False,False,False
46,1533b60,CrazyFuckingVideos,/r/CrazyFuckingVideos/comments/1533b60/insane_waterspout_spotted_in_russia/,FinalSneak,Insane waterspout spotted in Russia,7782,0.97,365,,1689698110.0,False,False,False,False,False
47,1534u90,LeopardsAteMyFace,/r/LeopardsAteMyFace/comments/1534u90/corporate_funded_far_right_conspiracy_theorist/,AdUpstairs2992,"Corporate Funded Far Right Conspiracy Theorist, Steven Crowder, Who Fought for the Right of Private Businesses to Refuse Service, is Now Irate That He is Refused Service After Breaking YouTube's Community Guidelines and Policies.",5426,0.98,277,,1689701632.0,False,False,False,False,False
48,152zelb,clevercomebacks,/r/clevercomebacks/comments/152zelb/god_provides_for_everything_right/,E_ternalEclipse,"God provides for everything, right?",20706,0.95,434,,1689689090.0,False,False,False,False,False
49,1530dli,meirl,/r/meirl/comments/1530dli/meirl/,Jonny_Disco,Meirl,12728,0.98,304,,1689691389.0,False,False,False,False,False
50,1530s4z,AnimalsBeingDerps,/r/AnimalsBeingDerps/comments/1530s4z/get_off_my_lawn/,Baskerville84,Get off my lawn!,11089,0.98,154,,1689692351.0,False,False,False,False,False
51,1537bhz,Catswithjobs,/r/Catswithjobs/comments/1537bhz/screwdriver_helper/,curiousrandomstuff,Screwdriver helper,3860,0.98,41,,1689707355.0,False,False,False,False,False
52,153708d,TwoSentenceHorror,/r/TwoSentenceHorror/comments/153708d/when_my_dog_bit_my_two_year_old_son_we_had_to_put/,bl00d_luster,"When my dog bit my two year old son, we had to put him down.",4304,0.91,539,,1689706643.0,False,False,False,False,False
53,153azq9,comics,/r/comics/comments/153azq9/human_things/,reddot_comic,✨human things✨,2351,0.95,56,Finessed Impropriety,1689715747.0,False,False,False,False,False
54,1535vi5,TikTokCringe,/r/TikTokCringe/comments/1535vi5/i_do_my_own_research/,Artane_33,I dO mY oWn ReSeArCh,12514,0.85,3938,,1689704045.0,False,False,False,False,False
55,1530s9v,maybemaybemaybe,/r/maybemaybemaybe/comments/1530s9v/maybe_maybe_maybe/,Hypnoidz,Maybe Maybe Maybe,10382,0.96,417,,1689692361.0,False,False,False,False,False
56,153cvrb,JustGuysBeingDudes,/r/JustGuysBeingDudes/comments/153cvrb/the_boys_always_got_you/,Romulus3799,The boys always got you 🍉,1851,0.97,59,,1689720108.0,False,False,False,False,False
57,15365o9,LateStageCapitalism,/r/LateStageCapitalism/comments/15365o9/thanks_i_hate_living_in_a_system_where_the/,Distantmole,"Thanks, I hate living in a system where the plutocrats will punish and exploit you regardless of how well you play the game.",4014,0.99,144,,1689704682.0,False,False,False,False,False
58,1535gbd,Tinder,/r/Tinder/comments/1535gbd/update_to_my_previous_post_won_the_battle_but/,DarkFluffyThrowaway,Update to my previous post: Won the battle but lost the war,4401,0.97,205,,1689703077.0,False,False,False,False,False
59,15303b4,WTF,/r/WTF/comments/15303b4/a_train_full_of_passengers_collided_with_a_truck/,NosferatuWayne,A train full of passengers collided with a truck resulting in an insane explosion,9702,0.97,528,,1689690692.0,False,False,False,False,False
60,15369o1,diablo4,/r/diablo4/comments/15369o1/new_sorc_unique_is_intriguing/,arkhemlol,New sorc unique is intriguing..,7560,0.96,745,:sorc:,1689704940.0,False,False,False,False,False
61,1533moc,marvelmemes,/r/marvelmemes/comments/1533moc/this_is_the_way/,GAMMAGREEN62,This is the way...,5694,0.94,205,Avengers,1689698847.0,False,False,False,False,False
62,1539wd3,popculturechat,/r/popculturechat/comments/1539wd3/new_pictures_from_barbara_palvin_dylan_sprouses/,Ok-Doubt6658,new pictures from Barbara Palvin & Dylan Sprouse’s wedding,2361,0.92,157,Excluded from this narrative,1689713223.0,False,False,False,False,False
63,1535elo,news,/r/news/comments/1535elo/16yearold_dies_in_accident_at_marjac_poultry_plant/,ruste530,16-year-old dies in accident at Mar-Jac Poultry plant,8148,0.97,717,,1689702962.0,False,False,False,False,False
64,1533hvi,lotrmemes,/r/lotrmemes/comments/1533hvi/skipping_the_main_quest/,Epic_Rain,Skipping The Main Quest,5655,0.96,76,,1689698543.0,False,False,False,False,False
65,153051r,technicallythetruth,/r/technicallythetruth/comments/153051r/you_cant_say_its_not_salmon/,Sofosio,You can't say it's not salmon,10489,0.97,70,,1689690812.0,False,False,False,False,False
66,152ws8p,oddlyspecific,/r/oddlyspecific/comments/152ws8p/ok_tarantino/,Optimal_Test3280,Ok Tarantino,46443,0.93,1215,,1689682342.0,False,False,False,False,False
67,1530vxn,dankmemes,/r/dankmemes/comments/1530vxn/cgi_is_mostly_garbage_today/,Responsible-Pen-7939,CGI is mostly garbage today...,12195,0.89,484,,1689692571.0,False,False,False,False,False
68,153axii,iamatotalpieceofshit,/r/iamatotalpieceofshit/comments/153axii/canadian_woman_tells_canadian_citizen_to_go_back/,PlenitudeOpulence,Canadian woman tells Canadian citizen to go back to his country,2029,0.94,472,,1689715596.0,False,False,False,False,False
69,1539yrr,inthenews,/r/inthenews/comments/1539yrr/16_false_trump_electors_face_felony_charges_in/,libroll,16 false Trump electors face felony charges in Michigan,2239,0.98,192,,1689713382.0,False,False,False,False,False
70,1536x5g,PeterExplainsTheJoke,/r/PeterExplainsTheJoke/comments/1536x5g/peetah_none_of_my_friends_know_wtf_does_this_mean/,Waffle-Gaming,"Peetah, none of my friends know, wtf does this mean",3419,0.95,100,,1689706450.0,False,False,False,False,False
71,1538d7a,MadeMeSmile,/r/MadeMeSmile/comments/1538d7a/the_pinnacle_of_creativity/,Careful_Cup4484,The pinnacle of creativity ,5338,0.97,241,,1689709711.0,False,False,False,False,False
72,1534yk2,Superstonk,/r/Superstonk/comments/1534yk2/gary_gensler_mentions_drs_on_bird_app_kinda/,ShortHedgeFundATM,Gary Gensler mentions DRS on bird app. Kinda shocked here...,4988,0.96,325,,1689701914.0,False,False,False,False,False
73,1536q3g,discordVideos,/r/discordVideos/comments/1536q3g/the_sun_never_sets_in_the_british_empire/,Cirno_the_strongest,The sun never sets in the British empire,3505,0.97,131,,1689705985.0,False,False,False,False,False
74,1536n8b,DunderMifflin,/r/DunderMifflin/comments/1536n8b/i_cant_believe_phyllis_would_do_such_a_thing_im/,Hermit-Permit,I can't believe Phyllis would do such a thing. I'm with Angela on this one.,3262,0.95,177,MMMMMMILF,1689705808.0,False,False,False,False,False
75,1530p03,shitposting,/r/shitposting/comments/1530p03/anon_tries_science_praise_spez/,AutomaticPudding,"anon tries science, (praise spez)",10911,0.98,167,,1689692140.0,False,False,False,False,False
76,1533x51,Gamingcirclejerk,/r/Gamingcirclejerk/comments/1533x51/fuck_you_volvo_i_will_not_be_buying_artifact_the/,Reginald_Ogron,FUCK YOU VOLVO I WILL NOT BE BUYING ARTIFACT THE DOTA CARD GAME GET WOKE GO BROKE,4653,0.94,102,,1689699535.0,False,False,False,False,False
77,152wxhl,AskReddit,/r/AskReddit/comments/152wxhl/what_screams_we_are_not_going_to_last_long_for/,ADTID,"What screams ""we are not going to last long"" for couples?",16868,0.94,5643,,1689682753.0,True,False,False,False,False
78,1539pbx,sadcringe,/r/sadcringe/comments/1539pbx/somebody_tell_him/,nasallyRefuse,Somebody tell him,2056,0.96,93,,1689712763.0,False,False,False,False,False
79,152vndp,oddlysatisfying,/r/oddlysatisfying/comments/152vndp/proficient_generational_katmer_makers/,AnnihilationOrchid,Proficient generational katmer makers.,34432,0.95,726,,1689679136.0,False,False,False,False,False
80,1532vif,trees,/r/trees/comments/1532vif/he_hasnt_moved_in_an_hour_i_cant_eat_a_whole_30/,TreeThingThree,"He hasn't moved in an hour. I can't eat a whole 30 mg gummy at once, so I nibble on one all day. This little guy found my daily dose halfway through the day. Doesn't even respond to pokes. Can you imagine being stoned with 100 eye balls?",4627,0.97,269,,1689697112.0,False,False,False,False,False
81,1535t8t,memes,/r/memes/comments/1535t8t/software_joke_for_yall/,ApplePie123eat,Software joke for y'all,7921,0.97,187,Died of Ligma,1689703896.0,False,False,False,False,False
82,153cdlc,baseball,/r/baseball/comments/153cdlc/tyler_rogers_picks_off_elly_de_la_cruz/,sfan27,Tyler Rogers picks off Elly De La Cruz,1439,0.97,251,San Francisco Giants :sfg1:,1689718924.0,False,False,False,False,False
83,152zgqu,StupidFood,/r/StupidFood/comments/152zgqu/whats_people_obsession_on_eating_unhealthy/,luisjilo,What's people obsession on eating unhealthy amounts of butter?,10171,0.84,2323,,1689689223.0,False,False,False,False,False
84,153b8si,Damnthatsinteresting,/r/Damnthatsinteresting/comments/153b8si/an_extremely_brave_woman_jumps_from_plane_to/,ojodefiz,An extremely brave woman jumps from plane to plane to mid-air to change a landing gear. 1926.,3093,0.98,173,,1689716339.0,False,False,False,False,False
85,153ad3e,Terraria,/r/Terraria/comments/153ad3e/i_created_the_gigachad_meme_entirely_out_of_wires/,coalman7,"I created the GigaChad meme entirely out of wires, logic gates, and Pixelboxes.",1815,0.97,55,,1689714262.0,False,False,False,False,False
86,152yyci,NatureIsFuckingLit,/r/NatureIsFuckingLit/comments/152yyci/hiker_accidentally_stumbles_upon_a_hibernating/,Top-Evidence-2807,🔥 Hiker accidentally stumbles upon a hibernating bear.,8752,0.94,363,,1689688003.0,False,False,False,False,False
87,1532axa,Animemes,/r/Animemes/comments/1532axa/what_a_whiplash/,ihavebirb,What a whiplash,5285,0.97,121,,1689695822.0,False,False,False,False,False
88,1535ue6,Awww,/r/Awww/comments/1535ue6/happy_mother/,AnonymusJpg,happy mother. ,3078,0.99,53,,1689703972.0,False,False,False,False,False
89,153861q,oddlyterrifying,/r/oddlyterrifying/comments/153861q/exorcist_come_here/,Sblordo-Veciotto,Exorcist! Come here!,2274,0.97,85,,1689709259.0,False,False,False,False,False
90,1532t0g,OldSchoolCool,/r/OldSchoolCool/comments/1532t0g/circa_1985_katey_sagal_the_doublemint_twins_are/,solesamurai909,"Circa 1985. Katey Sagal, & The Doublemint twins are her elder sister’s.",8914,0.95,980,,1689696955.0,False,False,False,False,False
91,1539a44,NotHowGirlsWork,/r/NotHowGirlsWork/comments/1539a44/has_this_guy_ever_met_a_woman/,delightcupcake51,has this guy ever met a woman?,1945,0.97,348,,1689711778.0,False,False,False,False,False
92,1535o4w,freefromwork,/r/freefromwork/comments/1535o4w/americans_dont_need_to_they_care_about_us/,DoubleCaregiverz,Americans Don't Need To. They Care About Us.,3021,0.97,51,,1689703558.0,False,False,False,False,False
93,1538oe3,h3h3productions,/r/h3h3productions/comments/1538oe3/leave_her_alone_be_normal/,Apple_Witcher,"Leave her alone, be normal.",2082,0.93,387,,1689710431.0,False,False,False,False,False
94,15371cg,Hololive,/r/Hololive/comments/15371cg/gura_will_be_streaming_papas_freezeria_deluxe/,lightow,"Gura will be streaming Papa's Freezeria Deluxe, tonight at 8 PM EDT / 5 PM PDT!",2518,0.95,85,:Gura::Amelia::Inanis::Calliope::Kiara:,1689706719.0,False,False,False,False,False
95,1530aeh,ChatGPT,/r/ChatGPT/comments/1530aeh/ai_just_let_me_do_a_days_work_in_10_minutes/,BigDumbGreenMong,AI just let me do a day's work in 10 minutes.,6126,0.9,941,,1689691176.0,False,False,False,False,False
96,1533t7l,ProgrammerHumor,/r/ProgrammerHumor/comments/1533t7l/githubisbetterthanonlyfans/,givesmememes,gitHubIsBetterThanOnlyFans,3742,0.94,138,:powershell:,1689699276.0,False,False,False,False,False
97,1538kc5,aww,/r/aww/comments/1538kc5/oc_15_years_young_today/,jdipage,[OC] 15 years young today 🎉,2045,0.9,38,,1689710167.0,False,False,False,False,False
98,1532v0s,cursedcomments,/r/cursedcomments/comments/1532v0s/cursed_representation/,Zoccoletta,Cursed representation,5072,0.97,186,,1689697081.0,False,False,False,False,False
99,153bd94,conservativeterrorism,/r/conservativeterrorism/comments/153bd94/im_starting_to_think_trump_may_have_been_involved/,scuczu,I’m starting to think Trump may have been involved in a criminal conspiracy to overturn the election and illegally seize power.,1429,0.99,53,,1689716628.0,False,False,False,False,False
100,1535nfp,coolguides,/r/coolguides/comments/1535nfp/a_cool_guides_to_20_years_price_changes_in_us/,WelcomeDo,A cool guides to 20 years price changes in US.,2769,0.91,323,,1689703517.0,False,False,False,False,False
