rank,id,subreddit,permalink,author,title,score,upvote_ratio,num_comments,author_flair_text,created_utc,over_18,edited,stickied,locked,is_original_content
1,150bi12,memes,/r/memes/comments/150bi12/one_of_us/,LemonConnoiseur,One of us,20852,0.9,1054,,1689426108.0,False,False,False,False,False
2,150b8jv,funny,/r/funny/comments/150b8jv/simon_pegg_secretly_feeds_lines_to_pom/,holyfruits,Simon Pegg secretly feeds lines to Pom Klementieff to say to a reporter,10375,0.97,317,,1689425388.0,False,False,False,False,False
3,150awg1,therewasanattempt,/r/therewasanattempt/comments/150awg1/to_camp_alone/,VariousBasket125,To camp alone,10453,0.98,475,This is a flair,1689424420.0,False,False,False,False,False
4,15091ly,mildlyinfuriating,/r/mildlyinfuriating/comments/15091ly/my_wife_bought_this_to_get_some_hydrogen_into_our/,unexpected_hulk,My wife bought this to get some Hydrogen into our water,21768,0.95,2643,,1689418801.0,False,False,False,False,False
5,150c8f7,oddlysatisfying,/r/oddlysatisfying/comments/150c8f7/the_way_she_grooms_the_dog/,SonicAkshay_26,The way she grooms the dog. ,6485,0.94,296,,1689428118.0,False,False,False,False,False
6,150b304,technicallythetruth,/r/technicallythetruth/comments/150b304/well_that_was_so_easy/,directvolcano,Well that was so easy,9120,0.98,321,,1689424946.0,False,False,False,False,False
7,150b8ms,nextfuckinglevel,/r/nextfuckinglevel/comments/150b8ms/a_man_tries_to_make_a_chicken_sandwich_from/,JussVibes,A man tries to make a chicken sandwich from scratch: It costs $1500 and takes him 6 months.  ,8049,0.93,627,,1689425395.0,False,False,False,False,False
8,150a5ct,Damnthatsinteresting,/r/Damnthatsinteresting/comments/150a5ct/last_night_sabrina_ionescu_set_the_alltime_record/,Ocelot859,"Last night, Sabrina Ionescu set the all-time record for NBA or WNBA with a score of 37 points in the Final Round of the 3PT Contest. The previous record was 31 held by Stephen Curry who is considered to be the greatest shooter 3PT shooter in basketball history.",9167,0.94,349,,1689422194.0,False,False,False,False,False
9,150b6ab,politics,/r/politics/comments/150b6ab/rfk_jr_says_covid_was_ethnically_targeted_to/,The_Iceman2288,RFK Jr. says COVID was ‘ethnically targeted’ to spare Jews,6551,0.92,1672,,1689425200.0,False,False,False,False,False
10,150augh,tumblr,/r/tumblr/comments/150augh/if_i_were_a_monster_that_had_to_eat_people_i/,Sonic_the_hedgedog,"""If I were a monster that had to eat people, I would just eat horrible people.""",8195,0.97,300,,1689424258.0,False,False,False,False,False
11,150baf9,meirl,/r/meirl/comments/150baf9/meirl/,Limitless_yt89,meirl,6481,0.95,190,,1689425530.0,False,False,False,False,False
12,150a64n,MadeMeSmile,/r/MadeMeSmile/comments/150a64n/at_least_no_one_is_going_to_say_their_wedding_is/,AnnihilationOrchid,At least no one is going to say their wedding is fake.,7276,0.97,194,,1689422267.0,False,False,False,False,False
13,1507ag5,WhitePeopleTwitter,/r/WhitePeopleTwitter/comments/1507ag5/absolutely_sickening/,emilyblunt2023,Absolutely sickening,14302,0.94,559,,1689412973.0,False,False,False,False,False
14,150ara5,comics,/r/comics/comments/150ara5/captain_icebreaker/,neilkohney,Captain Icebreaker,4673,0.98,54,The Other End,1689423990.0,False,False,False,False,False
15,1505frs,todayilearned,/r/todayilearned/comments/1505frs/til_keanu_reeves_has_never_won_an_oscar_golden/,ColeBelthazorTurner,"TIL Keanu Reeves has never won an Oscar, Golden Globe, or Emmy award of any kind. In fact, he has never even been nominated for an Oscar, Golden Globe, or Emmy.",20908,0.86,2352,,1689406693.0,False,False,False,False,False
16,150bvr1,oddlyterrifying,/r/oddlyterrifying/comments/150bvr1/this_chart_showing_birth/,CouchTo5k,This chart showing birth.,3706,0.96,305,,1689427156.0,True,False,False,False,False
17,1508699,BeAmazed,/r/BeAmazed/comments/1508699/a_rocket_garden_sprinkler/,CoupwalObiWan,A rocket garden sprinkler,7242,0.95,287,,1689415932.0,False,False,False,False,False
18,1509e2s,me_irlgbt,/r/me_irlgbt/comments/1509e2s/me_irlgbt/,thatguy9684736255,me_irlgbt,5567,0.97,79,Ace/Rainbow :ace-rainbow:,1689419854.0,False,False,False,False,False
19,1507he8,SipsTea,/r/SipsTea/comments/1507he8/this_is_too_muchh/,Indeed2p,This is Too muchh🌚😂,7896,0.94,238,,1689413637.0,False,False,False,False,False
20,1508hao,AnimalsBeingDerps,/r/AnimalsBeingDerps/comments/1508hao/theres_really_no_way_those_goofballs_can_survive/,1Hate17Here,"There’s really no way, those goofballs can survive in the wild. xD",5904,0.96,174,,1689416968.0,False,False,False,False,False
21,1507f1b,antiwork,/r/antiwork/comments/1507f1b/i_gave_my_one_week_notice_my_line_manager_sat_me/,ctrl_alt_d1337,"I gave my one week notice. My line manager sat me down, belittled me, called me unprofessional and told me he was going to make my last week difficult.",6828,0.97,778,,1689413419.0,False,1689435061.0,False,False,False
22,1507gdp,midjourney,/r/midjourney/comments/1507gdp/modern_liza/,gianpaolorosa,Modern Liza,7641,0.84,513,,1689413536.0,False,False,False,False,False
23,150b0we,pics,/r/pics/comments/150b0we/john_oliver_says_reply_for_an_award_giving_away/,madbuda,John Oliver says reply for an award. Giving away all my Reddit coins,3721,0.75,7438,,1689424785.0,False,False,False,False,False
24,1504ghq,facepalm,/r/facepalm/comments/1504ghq/nft/,ExtensonAd,NFT,20507,0.95,916,,1689403504.0,False,False,False,False,False
25,15092w3,dankmemes,/r/dankmemes/comments/15092w3/you_get_an_award_you_get_an_award_everybody_gets/,RunnyRose,"You get an award, you get an award, everybody gets an award",4738,0.98,392,I will steal your nipples :pepeuhoh:,1689418895.0,False,False,False,False,False
26,1505ct6,ContagiousLaughter,/r/ContagiousLaughter/comments/1505ct6/guy_sings_about_his_first_love/,kojo92,Guy sings about his first love,8579,0.96,134,,1689406409.0,False,False,False,False,False
27,15091xo,worldnews,/r/worldnews/comments/15091xo/russia_closes_polish_consulate_due_to_unfriendly/,BubsyFanboy,"Russia closes Polish consulate due to “unfriendly” acts, Poland pledges “equivalent response”",3693,0.96,101,,1689418826.0,False,False,False,False,False
28,1508ohz,lgbt,/r/lgbt/comments/1508ohz/every_single_lesbian_and_transgender_woman_is_a/,Dangerous-Report-421,Every single lesbian and transgender woman is a woman.,4181,0.84,216,,1689417610.0,False,False,False,False,False
29,150aklg,NonPoliticalTwitter,/r/NonPoliticalTwitter/comments/150aklg/if_it_aint_the_consequences_of_my_own_actions/,KingFahad360,If it ain’t the consequences of my own actions.,2912,0.98,87,:blue1::blue2::1111::1112:,1689423441.0,False,False,False,False,False
30,15065xj,cats,/r/cats/comments/15065xj/anyone_elses_kitty_stick_their_butt_up_in_the_air/,Solid_Solid724,Anyone else's Kitty stick their butt up in the air like this when they're getting pets?,6887,0.96,448,,1689409130.0,False,False,False,False,False
31,150akcc,WTF,/r/WTF/comments/150akcc/sanatogen_wine_advert_from_1967_aimed_at/,peaceandloveandhippy,Sanatogen wine advert from 1967 aimed at housewives. Bury your misery with alcohol!,2805,0.95,278,,1689423420.0,False,False,False,False,False
32,150a821,Gunners,/r/Gunners/comments/150a821/declan_rice_completes_transfer_to_arsenal/,radhumandummy,Declan Rice completes transfer to Arsenal,2926,0.96,293,Robert Pires' finger wag,1689422431.0,False,False,True,False,False
33,150275n,wholesome,/r/wholesome/comments/150275n/father_makes_sure_his_autistic_son_doesnt_get_too/,Sufficient-Bug-9112,Father makes sure his autistic son doesn't get too close or touch the royal guard and then this happens...,34819,0.94,841,,1689396166.0,False,False,False,False,False
34,150ao9e,WorkReform,/r/WorkReform/comments/150ao9e/were_trapped_in_this_life/,KityKaty95,We're trapped in this life,2696,0.95,131,,1689423737.0,False,False,False,False,False
35,1509tfn,oddlyspecific,/r/oddlyspecific/comments/1509tfn/cant_stop_thinking_about_the_30_tip_because_this/,cerridwen_,cant stop thinking about the 30% tip because this is somehow true…,3099,0.97,75,,1689421184.0,False,False,False,False,False
36,15070wq,PrequelMemes,/r/PrequelMemes/comments/15070wq/blame_anakin_later/,QuantumDonuts257,Blame Anakin later,5288,0.97,20,Rebel Legion,1689412056.0,False,False,False,False,False
37,150abiq,malelivingspace,/r/malelivingspace/comments/150abiq/after_getting_my_first_place_to_myself_a_year_ago/,naveregnide,"After getting my first place to myself a year ago, I finally made my London flat into my London home",2616,0.96,248,,1689422686.0,False,False,False,False,False
38,150c8jd,Damnthatsinteresting,/r/Damnthatsinteresting/comments/150c8jd/the_university_of_kyoto_in_japan_allows_students/,Delicious-Let8429,The University of Kyoto in Japan allows students to wear anything they want for Graduation ceremony,4359,0.99,140,,1689428124.0,False,False,False,False,False
39,150467e,Unexpected,/r/Unexpected/comments/150467e/nothing_like_a_nice_cup_of_coffee_to_start_your/,v3621,Nothing like a nice cup of coffee to start your day!,11063,0.93,177,,1689402554.0,False,False,False,False,False
40,150avrq,WatchPeopleDieInside,/r/WatchPeopleDieInside/comments/150avrq/how_to_factory_reset_an_uber_driver/,dylan15766,How to factory reset an Uber driver.,2407,0.96,469,,1689424365.0,False,False,False,False,False
41,150c5ok,wholesomememes,/r/wholesomememes/comments/150c5ok/gifting_out_awards_till_the_end_of_this_fiasco/,Ashl3y95,Gifting out awards till the end of this fiasco!,1904,0.97,387,,1689427908.0,False,False,False,False,False
42,1509lvu,formuladank,/r/formuladank/comments/1509lvu/newey_correcting_mercs_mistake_as_a_hobby/,Merchant_of_Death04,Newey correcting Merc's mistake as a hobby. ,2751,0.97,89,🅱️altteri 🅱️ootass,1689420520.0,False,False,False,False,False
43,1509fpp,WhitePeopleTwitter,/r/WhitePeopleTwitter/comments/1509fpp/these_sound_like_decent_policies/,thatguy9684736255,These sound like decent policies,6079,0.98,139,,1689419997.0,False,False,False,False,False
44,1503hss,diablo4,/r/diablo4/comments/1503hss/to_the_dismay_of_some_d4_devs_have_no_plans_to/,TheGoodDoctor17,"To the dismay of some, D4 devs have no plans to disable PvP from a zone dedicated for PVP.",8808,0.93,1993,,1689400353.0,False,False,False,False,False
45,15011ej,Satisfyingasfuck,/r/Satisfyingasfuck/comments/15011ej/cleaning_up_a_beach_by_extracting_small_plastics/,JulianThompson5,Cleaning up a beach by extracting small plastics from sand,29577,0.95,658,,1689392611.0,False,False,False,False,False
46,1502o1z,shitposting,/r/shitposting/comments/1502o1z/death_praise_spez/,UltimateCumDispenser,Death :( Praise Spez,22296,0.95,196,,1689397655.0,False,False,False,False,False
47,1506ctx,lotrmemes,/r/lotrmemes/comments/1506ctx/samwise_the_brave/,oeco123,Samwise the Brave,4599,0.97,99,Théoden,1689409816.0,False,False,False,False,False
48,1506qd8,MadeMeSmile,/r/MadeMeSmile/comments/1506qd8/father_makes_sure_his_autistic_son_doesnt_get_too/,FoI2dFocus,Father makes sure his autistic son doesn't get too close or touch the royal guard and then this happens...,11514,0.96,245,,1689411090.0,False,False,False,False,False
49,1509o5u,ProgrammerHumor,/r/ProgrammerHumor/comments/1509o5u/yesmothersudoiwilleat/,2hno3,yesMotherSudoIWillEat,2393,0.91,25,:cp::py:,1689420704.0,False,False,False,False,False
50,1507pv2,Animemes,/r/Animemes/comments/1507pv2/50_chapters_to_hold_hands_seems_too_optimistic/,FidoMix_Felicia,50 chapters to Hold Hands? Seems too optimistic.,3357,0.97,115,⠀Big Anime Tiddies,1689414438.0,False,False,False,False,False
51,1506v56,nextfuckinglevel,/r/nextfuckinglevel/comments/1506v56/beluga_whale_uses_hydro_blast_to_retrieve_toy/,amit-gautam,Beluga Whale Uses Hydro Blast to Retrieve Toy,10984,0.96,291,,1689411570.0,False,False,False,False,False
52,150dggp,maybemaybemaybe,/r/maybemaybemaybe/comments/150dggp/maybe_maybe_maybe/,PlasticSwings,Maybe maybe maybe,1320,0.96,128,,1689431316.0,False,False,False,False,False
53,150c7av,whenthe,/r/whenthe/comments/150c7av/bruh/,Big-Cap4487,Bruh ,1579,0.94,73,,1689428039.0,False,False,False,False,False
54,150bd0q,iamatotalpieceofshit,/r/iamatotalpieceofshit/comments/150bd0q/a_youth_soccer_coach_forgot_his_phone_at_a/,s_y_s_t_e_m_i_c_,"A youth soccer coach forgot his phone at a restaurant. Employees found “hundreds of disturbing videos and pictures” on the phone. The man himself was in these videos, abusing children. Police say this is one of the ""most egregious and disturbing cases"" they've worked.",1701,0.98,197,,1689425737.0,False,False,False,False,False
55,1509jgu,StarWars,/r/StarWars/comments/1509jgu/correct_me_if_im_wrong_but_outside_of_video_games/,Plumbum158,correct me if I'm wrong but outside of video games we have not seen an SSD onscreen since 1986,2082,0.96,226,,1689420316.0,False,False,False,False,False
56,1506cks,ImTheMainCharacter,/r/ImTheMainCharacter/comments/1506cks/tourists_blocking_the_street/,shrimpcult,Tourist's blocking the street,3681,0.97,351,,1689409795.0,False,False,False,False,False
57,1508hiv,videos,/r/videos/comments/1508hiv/striking_actor_ron_perlman_responds_to_mother/,Pinkfatrat,STRIKING ACTOR RON PERLMAN RESPONDS TO MOTHER FUCKING STUDIO EXEC,2471,0.84,453,,1689416988.0,False,False,False,False,False
58,15033bd,PoliticalHumor,/r/PoliticalHumor/comments/15033bd/rebranding_has_been_largely_successful/,earthman34,Rebranding has been largely successful...,6630,0.92,260,,1689399049.0,False,False,False,False,False
59,1508e9y,mathmemes,/r/mathmemes/comments/1508e9y/when_i_was_in_4th_grade_i_had_no_idea_of_negative/,ThatFunnyGuy543,"When I was in 4th grade, I had no idea of negative numbers. But I had this",2457,0.96,96,,1689416682.0,False,False,False,False,False
60,14zzyee,news,/r/news/comments/14zzyee/an_alabama_woman_is_missing_after_stopping_to/,Repogirl27,"An Alabama woman is missing after stopping to help a toddler she saw walking on the interstate, police say",13977,0.96,1688,,1689389368.0,False,False,False,False,False
61,1500zsr,Fauxmoi,/r/Fauxmoi/comments/1500zsr/sean_gunn_criticizes_disney_ceo_bob_iger/,jaffacakes077,Sean Gunn criticizes Disney CEO Bob Iger,10148,0.96,443,,1689392470.0,False,False,False,False,False
62,1507n7s,Grimdank,/r/Grimdank/comments/1507n7s/hes_doing_his_best/,Quirky-Oven9475,He’s doing his best.,2726,0.92,65,,1689414186.0,False,False,False,False,False
63,1507ws4,CombatFootage,/r/CombatFootage/comments/1507ws4/assault_actions_of_the_1st_mechanized_battalion/,aarrte,"Assault actions of the 1st mechanized battalion of the 3rd SABr, uncensored drone video",2505,0.96,158,,1689415092.0,True,False,False,False,False
64,150dx5m,UkraineWarVideoReport,/r/UkraineWarVideoReport/comments/150dx5m/the_ukrainian_soldier_that_stepped_on_a_mine_in/,Accurate9638,⚡️The Ukrainian soldier that stepped on a mine in that viral video is out of the hospital.,1034,0.99,90,,1689432519.0,False,False,False,False,False
65,150a42s,Hololive,/r/Hololive/comments/150a42s/my_beloved_koyorichans_new_costume_is_kinda_lewd/,CuteIngenuity1745,My Beloved Koyori-chan's new costume is kinda lewd,1762,0.97,75,,1689422088.0,False,False,False,False,False
66,150b0pe,insanepeoplefacebook,/r/insanepeoplefacebook/comments/150b0pe/yes_thats_why/,NorthCalmz,"Yes, that's why",1495,0.98,29,,1689424769.0,False,False,False,False,False
67,150c3ir,TikTokCringe,/r/TikTokCringe/comments/150c3ir/scaring_scammers/,quadsclothesou,Scaring Scammers 😂,1278,0.97,73,,1689427756.0,False,False,False,False,False
68,1504vmy,discordVideos,/r/discordVideos/comments/1504vmy/proof_why_china_3hr_per_week_screen_time_policy/,andrewens,proof why china 3hr per week screen time policy,5054,0.94,152,Have Commited Several War Crimes,1689404792.0,False,False,False,False,False
69,1507fi7,lego,/r/lego/comments/1507fi7/name_a_bigger_downgrade/,nickomoss,Name a bigger downgrade ...,2649,0.96,164,:blue_stud: Verified Blue Stud Member,1689413454.0,False,False,False,False,False
70,150744z,gaming,/r/gaming/comments/150744z/my_the_legend_of_zelda_collection_a_bleach/,angelinazelda,My The Legend of Zelda collection + a bleach painting t-shirt I did of Ganondorf,2824,0.87,106,PlayStation,1689412371.0,False,False,False,True,False
71,150c79p,fixedbytheduet,/r/fixedbytheduet/comments/150c79p/i_need_this_to_be_an_olympic_sport/,pocoschick,I need this to be an Olympic sport.,1220,0.95,40,,1689428036.0,False,False,False,False,False
72,15068pn,golf,/r/golf/comments/15068pn/wife_so_youre_telling_me_you_played_golf_for_4/,The_Scrabbler,Wife: So you’re telling me you played golf for 4 hours and didn’t once ask your friends how their wives were doing?,3180,0.94,466,,1689409407.0,False,False,False,False,False
73,1507ouf,facepalm,/r/facepalm/comments/1507ouf/well_that_clears_that_up_nicely/,ElizabethEllaa,"Well, that clears that up nicely",5861,0.98,371,,1689414348.0,False,False,False,False,False
74,1509blv,Superstonk,/r/Superstonk/comments/1509blv/to_all_of_you_beautiful_zen_lurker_apes_and/,FreebidderIS,"To all of you beautiful zen lurker apes and APETTES. MAKE NO MISTAKES, WE ARE STILL HERE. WE ARE STILL STRONG. WE ARE STILL THE MOST POWERFUL PLAYER IN THIS LONG GAME!",2193,0.93,110,MOASS IS HERE,1689419657.0,False,False,False,False,False
75,150b8k7,ThatsInsane,/r/ThatsInsane/comments/150b8k7/a_diver_showing_the_change_in_air_pressure/,botcraft_net,A diver showing the change in air pressure,1372,0.93,118,,1689425389.0,False,False,False,False,False
76,1500jf5,BlackPeopleTwitter,/r/BlackPeopleTwitter/comments/1500jf5/we_should_probably_also_get_separate_water/,imjustheretodomyjob,"We should probably also get separate water fountains, and toilets....call it ""separate but equal"" smh",9663,0.96,245,☑️ Mod,1689391062.0,False,False,False,False,False
77,1508ylc,teenagers,/r/teenagers/comments/1508ylc/some_guy_is_arguing_with_me_a_woman_over_if/,Aeternum-Vivum,"Some GUY is arguing with me, a WOMAN over if breasts are fat or not 💀",1930,0.93,320,16,1689418516.0,True,False,False,False,False
78,15099ti,ChatGPT,/r/ChatGPT/comments/15099ti/i_have_been_messing_with_draw_yourself_for_some/,ThatRealG8L6,"I have been messing with ""draw yourself"" for some time. You usually get just some weird shapes, but this was the most disturbing thing It generated",1780,0.96,195,,1689419498.0,False,False,False,False,False
79,1506m98,CrazyFuckingVideos,/r/CrazyFuckingVideos/comments/1506m98/rage_against_climate_activists_blocking_roads_in/,Sufficient-Welder-32,Rage against climate activists blocking roads in Germany,2822,0.94,381,,1689410704.0,False,False,False,True,False
80,1505rnc,ukraine,/r/ukraine/comments/1505rnc/south_korean_president_yoon_seokyeol_arrived_in/,UNITED24Media,South Korean President Yoon Seok-yeol arrived in Ukraine on an unannounced visit,3182,0.97,82,:FlagUA: Ukraine Media,1689407815.0,False,False,False,False,False
81,1507iyy,madlads,/r/madlads/comments/1507iyy/madlad_gives_away_reddit_awards_due_to_recent/,ntn_98,Madlad gives away Reddit awards due to recent announcement,2369,0.97,265,,1689413777.0,False,False,False,False,False
82,1506821,therewasanattempt,/r/therewasanattempt/comments/1506821/to_get_back_together/,clearlythrill,To get back together,8776,0.83,866,,1689409337.0,False,False,False,False,False
83,150a7zt,rareinsults,/r/rareinsults/comments/150a7zt/eat_my_asphalt_cindy/,No_Fortune_1623,"Eat my asphalt, Cindy",1487,0.99,37,,1689422426.0,False,False,False,False,False
84,15095sm,Gamingcirclejerk,/r/Gamingcirclejerk/comments/15095sm/chon_deadleslayer/,HetmanOriginal,Chon Deadleslayer,1718,0.92,63,,1689419134.0,False,False,False,False,False
85,1504vwe,Eyebleach,/r/Eyebleach/comments/1504vwe/bearcat/,fat_old_boy,Bear-cat,3676,0.96,55,,1689404819.0,False,False,False,False,False
86,150bjd5,DunderMifflin,/r/DunderMifflin/comments/150bjd5/the_dwight_schrute_collection/,outroversion,The Dwight Schrute Collection,1179,0.97,31,,1689426198.0,False,False,False,False,False
87,1504rvt,comics,/r/comics/comments/1504rvt/abduction_attire/,NonRock,Abduction attire,9101,0.98,90,Hot Paper Comics,1689404483.0,False,False,False,False,False
88,1500ywn,PublicFreakout,/r/PublicFreakout/comments/1500ywn/unhinged_mother_threatens_school_after_getting/,NickfromLafayette92,Unhinged mother threatens school after getting barred from seeing her children,8447,0.93,1924,,1689392400.0,False,False,False,False,False
89,150b0t0,TwoHotTakes,/r/TwoHotTakes/comments/150b0t0/my_m27_wife_f28_showed_her_friends_our_sex_tapes/,throwawayratapes,My [M27] wife [F28] showed her friends our sex tapes,1245,0.96,599,,1689424778.0,False,False,False,False,False
90,1505glg,CasualUK,/r/CasualUK/comments/1505glg/so_ive_just_discovered_the_true_way_to_divide_up/,Appropriate-Divide64,So I've just discovered the true way to divide up England.,3226,0.88,464,,1689406779.0,False,False,False,False,False
91,1509eq6,OnePiece,/r/OnePiece/comments/1509eq6/chapter_1088_spoilers/,Raed_D_Artist,Chapter 1088 Spoilers,1583,0.96,109,,1689419913.0,False,False,False,False,False
92,150atff,Anticonsumption,/r/Anticonsumption/comments/150atff/this_board_should_be_placed_everywhere_dont_waste/,Tangieption,This board should be placed everywhere. Don’t Waste Food.,1256,0.98,63,,1689424179.0,False,False,False,False,False
93,1504d9h,Genshin_Impact,/r/Genshin_Impact/comments/1504d9h/nilou_crocheted_by_me/,cjlacrochet,Nilou crocheted by me 💙💙🧡🧡,4025,0.97,161,,1689403209.0,False,False,False,False,False
94,1507jj0,DiWHY,/r/DiWHY/comments/1507jj0/started_off_stupid_enough_but_it_gets_worse/,Truffle0214,"Started off stupid enough, but it gets worse",2155,0.93,214,,1689413832.0,False,False,False,False,False
95,150c1nu,natureismetal,/r/natureismetal/comments/150c1nu/skull_in_a_salt_lake/,outroversion,Skull in a salt lake,1047,0.96,17,,1689427607.0,False,False,False,False,False
96,1506iyb,FunnyAnimals,/r/FunnyAnimals/comments/1506iyb/i_never_thought_i_would/,plasma5550,I never thought I would ,2508,0.96,36,,1689410396.0,False,False,False,False,False
97,1507bbz,BikiniBottomTwitter,/r/BikiniBottomTwitter/comments/1507bbz/ayo_what_the_barnacle_nickelodeon/,Fulltime_Introvert,Ayo what the barnacle Nickelodeon!,2177,0.98,50,,1689413057.0,False,False,False,False,False
98,150c9qs,wallstreetbets,/r/wallstreetbets/comments/150c9qs/in_honor_of_the_first_cybertruck_built_at/,toydan,In honor of the First CyberTruck Built at GigaTexas - The Origin Story,1019,0.93,44,Puts on $JIM,1689428216.0,False,False,False,False,False
99,14zygjd,LateStageCapitalism,/r/LateStageCapitalism/comments/14zygjd/we_wont_let_you_keep_it/,EldritchSlut,We won't let you keep it,12406,0.97,307,Commie Trash🚩,1689385010.0,False,False,False,False,False
100,1501ibb,AskReddit,/r/AskReddit/comments/1501ibb/what_worst_possible_reply_to_im_pregnant/,Suspicious_Device609,"What Worst possible reply to ""I'm pregnant""?",7499,0.87,8761,,1689394016.0,False,False,False,False,False
