rank,id,subreddit,permalink,author,title,score,upvote_ratio,num_comments,author_flair_text,created_utc,over_18,edited,stickied,locked,is_original_content
1,14tgux9,facepalm,/r/facepalm/comments/14tgux9/how_to_fix_it/,MistakeFast1917,How to fix it?,14545,0.96,1529,,1688758153.0,False,False,False,False,False
2,14teaz2,Damnthatsinteresting,/r/Damnthatsinteresting/comments/14teaz2/using_owl_feathers_to_pet_an_owl/,ClaireDacloush,Using Owl feathers to pet an owl,23761,0.97,513,,1688752445.0,False,False,False,False,False
3,14tcrwk,MadeMeSmile,/r/MadeMeSmile/comments/14tcrwk/i_love_a_culture_where_the_customer_isnt_always/,Careful_Cup4484,I love a culture where the customer isn’t always right,19362,0.92,1191,,1688748921.0,False,False,False,False,False
4,14teirv,funny,/r/funny/comments/14teirv/apology_letter_from_exgf/,bigmikesbeingnice,Apology letter from ex-gf,9209,0.92,1128,,1688752911.0,False,False,False,False,False
5,14tbx9l,lotrmemes,/r/lotrmemes/comments/14tbx9l/such_a_good_actor/,UsernameLaugh,Such a good actor,18653,0.97,429,,1688747014.0,False,False,False,False,False
6,14tf2kb,Unexpected,/r/Unexpected/comments/14tf2kb/staying_under_the_radar/,5krunner,Staying under the radar,8874,0.96,165,,1688754171.0,True,False,False,False,False
7,14tdua6,PublicFreakout,/r/PublicFreakout/comments/14tdua6/a_tourist_restrains_a_pickpocket_in_italy/,ojodefiz,A tourist restrains a pickpocket in Italy 😳,9869,0.97,955,,1688751349.0,True,False,False,False,False
8,14tb2yr,nextfuckinglevel,/r/nextfuckinglevel/comments/14tb2yr/dad_builds_a_custom_adaptive_controller_so_his/,esberat,Dad builds a custom adaptive controller so his daughter can play Zelda- Breath Of The Wild.,19860,0.95,514,,1688745183.0,False,False,False,False,False
9,14tbby7,wholesomememes,/r/wholesomememes/comments/14tbby7/i_can_celebrate_lunar_new_year_now/,blaze_uchiha999,I can celebrate lunar new year now,16756,0.96,283,,1688745732.0,False,False,False,False,False
10,14tb64r,TikTokCringe,/r/TikTokCringe/comments/14tb64r/the_lack_of_self_awareness_is_as_funny_as_it_is/,AzulaOblongata,The lack of self awareness is as funny as it is sad.,13213,0.92,753,,1688745388.0,False,False,False,False,False
11,14taen9,WhitePeopleTwitter,/r/WhitePeopleTwitter/comments/14taen9/stating_facts_is_hate_speech_on_threads/,Shrek-2020,"Stating ""facts"" is hate speech on Threads",18150,0.88,1759,,1688743646.0,False,False,False,False,False
12,14temuc,nba,/r/nba/comments/14temuc/video_of_the_britney_spears_and_victor_wembanyama/,Vishion-8,Video of the Britney Spears and Victor Wembanyama incident via TMZ,5965,0.95,2665,:nba-1: NBA,1688753139.0,False,False,False,False,False
13,14te9oi,politics,/r/politics/comments/14te9oi/ocasiocortez_endorses_bidens_reelection_campaign/,Beckles28nz,"Ocasio-Cortez endorses Biden's reelection campaign, sending a strong signal of Democratic unity",6174,0.95,765,,1688752361.0,False,False,False,False,False
14,14tdo6r,therewasanattempt,/r/therewasanattempt/comments/14tdo6r/to_lie_about_your_weight_at_the_zipline/,Incredibly_Critical,... to lie about your weight at the zipline.,7655,0.95,494,,1688750956.0,False,False,False,False,False
15,14thwjk,SipsTea,/r/SipsTea/comments/14thwjk/salma_hayek_hit_25_million_followers_on_instagram/,berserkmanufacturer1,"Salma Hayek hit 25 million followers on Instagram. To celebrate, she posted this video. (She's 56!)",3995,0.93,308,,1688760470.0,False,False,False,False,False
16,14tdayz,gaming,/r/gaming/comments/14tdayz/pc_gamer_anger_from_voice_actors_as_nsfw_mods_use/,H377Spawn,[PC Gamer] Anger from voice actors as NSFW mods use AI deepfakes to replicate their voices: 'This is NOT okay.',7308,0.92,1684,Xbox,1688750124.0,True,False,False,False,False
17,14tdh0n,cats,/r/cats/comments/14tdh0n/1_month_of_cat_ownership_its_been_more_fun_than_i/,maxman87,"1 month of cat ownership, it’s been more fun than I ever imagined",6913,0.99,318,,1688750491.0,False,False,False,False,False
18,14t83xp,worldnews,/r/worldnews/comments/14t83xp/for_the_fourth_day_in_a_row_earth_has_broken_or/,Mr_Basketcase,"For the fourth day in a row, Earth has broken or equalled its hottest average temperature record",16983,0.95,1965,,1688738374.0,False,False,False,False,False
19,14tgc3n,tifu,/r/tifu/comments/14tgc3n/tifu_by_thinking_my_boyfriend_brought_condoms_to/,BurritoSupreme420,TIFU by thinking my boyfriend brought condoms to our Las Vegas vacation together and refusing to talk to him for a day cause of it,4361,0.88,674,,1688756988.0,True,1688757108.0,False,False,False
20,14tc25m,Eldenring,/r/Eldenring/comments/14tc25m/i_told_him_weve_all_been_there_buddy/,slamriffs,I told him we’ve all been there buddy,8272,0.96,539,,1688747330.0,False,False,False,False,False
21,14ti0lk,memes,/r/memes/comments/14ti0lk/freedom_units_metric/,LemonConnoiseur,Freedom units > metric,4356,0.82,347,,1688760706.0,True,False,False,False,False
22,14tak3e,OneOrangeBraincell,/r/OneOrangeBraincell/comments/14tak3e/her_brain_cell_is_used_for_loving/,causeimsammie,Her brain cell is used for loving,9773,0.98,145,,1688743973.0,False,False,False,False,False
23,14t7jf5,meirl,/r/meirl/comments/14t7jf5/me_irl/,Sonic_the_hedgedog,me_irl,27342,0.95,550,,1688736942.0,False,False,False,False,False
24,14tdtq0,Overwatch,/r/Overwatch/comments/14tdtq0/is_15249m_enough_to_make_talent_trees/,shiftup1772,Is $152.49M enough to make talent trees?,5681,0.96,371,,1688751314.0,False,False,False,False,False
25,14t9r56,todayilearned,/r/todayilearned/comments/14t9r56/til_shirley_temple_hated_the_mocktail_of/,Skeleton_Pilots,"TIL Shirley Temple hated the mocktail of lemon-lime soda/ginger ale and grenadine named after her, declaring it ""too sweet"". In 1988, she won a lawsuit to stop a bottled version from using her name.",9625,0.98,281,,1688742151.0,False,False,False,False,False
26,14t9pw4,news,/r/news/comments/14t9pw4/fox_faces_fcc_license_threat_over_false_election/,hcashew,Fox Faces FCC License Threat Over False Election Claims,8697,0.95,207,,1688742079.0,False,False,False,False,False
27,14tadrb,oddlysatisfying,/r/oddlysatisfying/comments/14tadrb/cathedral_stonemason/,Jmac0585,Cathedral stonemason,8785,0.96,172,,1688743591.0,False,False,False,False,False
28,14tanc2,oddlyterrifying,/r/oddlyterrifying/comments/14tanc2/xrays_taken_by_the_usmexico_border_patrol/,Diceyland,X-Rays taken by the US-Mexico border patrol,7712,0.97,230,,1688744187.0,False,False,False,False,False
29,14t87xx,LeopardsAteMyFace,/r/LeopardsAteMyFace/comments/14t87xx/republican_lawmaker_who_sponsored_a_bill_this/,Mamacrass,Republican lawmaker who sponsored a bill this year attempting to block minors from watching online pornography may have violated the state’s revenge porn law after publicly posting sexually explicit images of Hunter Biden.,9314,0.96,259,,1688738590.0,False,False,False,False,False
30,14tdzz5,MadeMeSmile,/r/MadeMeSmile/comments/14tdzz5/this_kinda_marriage/,King_Pee,This kinda marriage >>>,11589,0.94,209,,1688751724.0,False,False,False,False,False
31,14tfxzf,dankmemes,/r/dankmemes/comments/14tfxzf/i_dont_make_the_rules_i_just_enforce_them/,thepositivepandemic,"I don’t make the rules, I just enforce them.",3255,0.97,30,,1688756156.0,False,False,False,False,False
32,14tc4fb,movies,/r/movies/comments/14tc4fb/indiana_jones_5_it_took_100_vfx_industrial_light/,Key_Damage_9220,‘Indiana Jones 5’: It Took 100+ VFX Industrial Light and Magic Artists to De-Age Harrison Ford,4767,0.93,1031,,1688747468.0,False,False,False,False,False
33,14t8i9r,Funnymemes,/r/Funnymemes/comments/14t8i9r/would_you/,No_Stock160,Would you?,10598,0.95,461,,1688739291.0,False,False,False,False,False
34,14tccd5,mildlyinfuriating,/r/mildlyinfuriating/comments/14tccd5/signed_up_for_a_sleep_study_somehow_supposed_to/,youaremrbergstrom,"Signed up for a sleep study, somehow supposed to sleep like this tonight.",5031,0.91,481,,1688747971.0,False,False,False,False,False
35,14t8bl6,doordash,/r/doordash/comments/14t8bl6/some_of_us_do_actually_act_like_this_is_a_serious/,JSOFL,Some of US do actually act like this is a serious job and DO NOT BEG. I try to do my share of good deeds.,9262,0.95,281,,1688738825.0,False,False,False,False,False
36,14t92mx,BikiniBottomTwitter,/r/BikiniBottomTwitter/comments/14t92mx/no/,recordingheart,NO.,7143,0.97,103,,1688740574.0,False,False,False,False,False
37,14t6n2z,Breath_of_the_Wild,/r/Breath_of_the_Wild/comments/14t6n2z/i_think_they_do_it_on_purpose/,CrowHoonter,i think they do it on purpose,12658,0.98,171,,1688734765.0,False,False,False,False,False
38,14taosk,JustGuysBeingDudes,/r/JustGuysBeingDudes/comments/14taosk/practicing_chinese_like_a_dude/,meepmeepitsajeep,Practicing Chinese like a dude ,5822,0.94,147,,1688744281.0,False,False,False,False,False
39,14t5xzi,BeAmazed,/r/BeAmazed/comments/14t5xzi/zebra_be_like_bitch_i_bite_too/,XahidX,Zebra be like: Bitch I bite too,17642,0.96,357,,1688732932.0,False,False,False,False,False
40,14tak4m,Unexpected,/r/Unexpected/comments/14tak4m/you_stupid_fuc_nevermind_have_a_great_day/,PeevishBoi,"You stupid fuc..... nevermind, have a great day.",25909,0.9,697,,1688743975.0,True,False,False,False,False
41,14tgswk,Tinder,/r/Tinder/comments/14tgswk/the_drop_from_6_to_511_is_hilarious_66_seems_to/,chaminda_monster,The drop from 6’ to 5’11” is hilarious. 6’6” seems to be the ideal height for women apparently.,2483,0.97,654,,1688758023.0,False,False,False,False,False
42,14t5g35,DesignPorn,/r/DesignPorn/comments/14t5g35/blood_drops_pearl_necklace/,Furr_Fag,Blood drops pearl necklace,20154,0.9,329,,1688731605.0,False,False,False,False,False
43,14t7ziw,WTF,/r/WTF/comments/14t7ziw/x_ray_of_vibrator_stuck_in_rectum_plus_pair_of/,amanitavirosa247,X Ray of vibrator stuck in rectum plus pair of salad tongs which got stuck trying to remove vibrator,7780,0.95,546,,1688738079.0,True,False,False,False,False
44,14tceos,whenthe,/r/whenthe/comments/14tceos/double_budget_infinitely_dogshit_product/,proviking6000,double budget = infinitely dogshit product,4810,0.96,172,,1688748111.0,False,False,False,False,False
45,14tbs8a,AITAH,/r/AITAH/comments/14tbs8a/aitah_for_going_to_my_friends_iud_appointment/,Level_Green_6692,AITAH for going to my friends IUD appointment against my husbands wishes?,4314,0.96,1520,,1688746694.0,False,False,False,False,False
46,14t9yai,UpliftingNews,/r/UpliftingNews/comments/14t9yai/arizona_governor_oks_over_the_counter_birth/,Imchildfree,Arizona governor Ok's over the counter birth control,5124,0.96,163,,1688742569.0,False,False,False,False,False
47,14tccj8,shittymoviedetails,/r/shittymoviedetails/comments/14tccj8/american_psycho_2000_is_surprisingly_unoriginal/,xZOMBIETAGx,"American Psycho (2000) is surprisingly unoriginal. Not only is the entire story stolen from a book with the same name, many of the scenes are shot-for-shot copies of popular internet memes and gifs.",3872,0.97,24,,1688747982.0,False,False,False,False,False
48,14tc0oa,books,/r/books/comments/14tc0oa/george_rr_martin_dont_be_too_impatient_its_only/,RobertoSerrano2003,"George R.R. Martin: ""Don't be too impatient, it's only been 12 years since the last one""",3910,0.91,1176,,1688747230.0,False,False,False,False,False
49,14tef2j,comics,/r/comics/comments/14tef2j/fashion_flaws_oc/,blanche_draw,Fashion flaws [OC],2954,0.98,65,,1688752699.0,False,False,False,False,False
50,14ten0a,aww,/r/aww/comments/14ten0a/oc_everyone_says_he_looks_like_garfield_i_love_it/,loveme_lina,[OC] Everyone says he looks like Garfield! I love it!,2795,0.93,75,,1688753149.0,False,False,False,False,False
51,14tayfl,shitposting,/r/shitposting/comments/14tayfl/praise_spez_for_this_knowledge/,TipProfessional6057,Praise Spez for this knowledge,5241,0.98,60,,1688744884.0,False,False,False,False,False
52,14t8qc9,facepalm,/r/facepalm/comments/14t8qc9/i_love_democracy/,Captain1693,I love democracy,34359,0.96,244,,1688739828.0,False,False,False,False,False
53,14t6sf1,OldSchoolCool,/r/OldSchoolCool/comments/14t6sf1/michael_jordan_in_the_1984_olympics_wearing/,OregonTripleBeam,Michael Jordan in the 1984 Olympics wearing Converse shoes,7642,0.96,510,,1688735087.0,False,False,False,False,False
54,14t5j0o,TheLastAirbender,/r/TheLastAirbender/comments/14t5j0o/you_miscalculated_i_love_zuko_more_than_i_fear_you/,Recent-Sorbet,You miscalculated... I love Zuko more than I fear you,12205,0.95,427,,1688731833.0,False,False,False,False,False
55,14tcppo,PeterExplainsTheJoke,/r/PeterExplainsTheJoke/comments/14tcppo/why/,AdditionalCall5271,Why????,3494,0.95,141,,1688748778.0,False,False,False,False,False
56,14tfpe4,WhitePeopleTwitter,/r/WhitePeopleTwitter/comments/14tfpe4/elon_goes_full_q_never_go_full_q/,G-Unit11111,Elon goes full Q. Never go full Q.,4898,0.99,205,,1688755620.0,False,False,False,False,False
57,14t9pg5,starwarsmemes,/r/starwarsmemes/comments/14t9pg5/not_very_smart/,The_Alcoholic_Devil,Not very smart,5286,0.97,91,,1688742058.0,False,False,False,False,False
58,14t4hio,inthenews,/r/inthenews/comments/14t4hio/this_is_a_death_sentence_for_me_florida/,diacewrb,‘This is a death sentence for me’: Florida Republican women say they will switch parties after DeSantis approves alimony law,13116,0.89,1222,,1688729021.0,False,False,False,True,False
59,14t8x11,technology,/r/technology/comments/14t8x11/tech_execs_are_stressed_out_half_are_heavy/,Sorin61,"Tech execs are stressed out. Half are heavy drinkers and 45% take painkillers, a new study says",5145,0.93,1029,,1688740237.0,False,False,False,False,False
60,14tbs1g,ImTheMainCharacter,/r/ImTheMainCharacter/comments/14tbs1g/what_kind_of_welcome_was_he_expecting/,Vemonis,What kind of welcome was he expecting?,3613,0.96,650,,1688746682.0,False,False,False,False,False
61,14t6pmu,conservativeterrorism,/r/conservativeterrorism/comments/14t6pmu/not_even_hiding_it_anymore/,Throwawaytown33333,Not even hiding it anymore.,7154,0.93,482,,1688734920.0,False,False,False,False,False
62,14t8y61,DunderMifflin,/r/DunderMifflin/comments/14t8y61/when_i_was_12_years_old_im_37_now_i_met_this_gal/,travissetsfire,"When I was 12 years old (I'm 37 now) I met this gal at a summer camp that my mom sent me to. After that week ended, I lost contact with her. Last Friday, I found her again and it was an instant connection. Today, I bought her ring.",5999,0.8,967,,1688740301.0,False,False,False,False,False
63,14t7mi9,ContagiousLaughter,/r/ContagiousLaughter/comments/14t7mi9/here_we_go/,LaughBakery,Here we go,6561,0.94,239,,1688737175.0,False,False,False,False,False
64,14t8e1r,HolUp,/r/HolUp/comments/14t8e1r/no_he_didnt_say_that/,bindukwe,"No, he didn't say that",6560,0.96,54,,1688739003.0,False,False,False,False,False
65,14t6tem,Damnthatsinteresting,/r/Damnthatsinteresting/comments/14t6tem/cathedral_stonemason_at_work/,Vaanced,Cathedral stonemason at work,38466,0.95,959,,1688735152.0,False,False,False,False,False
66,14t9j96,pics,/r/pics/comments/14t9j96/hoooooollly_shit_is_john_oliver_rinterestingasfuck/,--Fawkes--,Hoooooollly Shit! Is John Oliver r/interestingasfuck,4456,0.85,213,,1688741676.0,False,False,False,False,False
67,14teeqn,memes,/r/memes/comments/14teeqn/does_anybody_know_their_names/,and14710,Does anybody know their names?,6440,0.96,239,,1688752680.0,False,False,False,False,False
68,14t893o,fixedbytheduet,/r/fixedbytheduet/comments/14t893o/big_facts/,mellabarbarella,Big facts,5389,0.94,170,,1688738657.0,False,False,False,False,False
69,14tfrb4,popculturechat,/r/popculturechat/comments/14tfrb4/jimmy_kimmels_dinner_party_posted_by_kristen_bell/,keine_fragen,"Jimmy Kimmel’s dinner party, posted by Kristen Bell",2034,0.92,693,,1688755740.0,False,False,False,False,False
70,14t3bjl,antiwork,/r/antiwork/comments/14t3bjl/boss_is_upset_that_i_have_a_second_job/,2eggsforbreakfast,Boss is upset that I have a second job,14195,0.96,808,,1688725656.0,False,False,False,False,False
71,14tbyiz,anime_irl,/r/anime_irl/comments/14tbyiz/anime_irl/,Narrow_Association43,anime_irl,3340,0.91,188,,1688747096.0,False,False,False,False,False
72,14tbfjo,Grimdank,/r/Grimdank/comments/14tbfjo/the_eldar_are_significantly_less_racist_than_the/,PanAfricanDream,The Eldar are significantly less racist than the Imperium but somehow always catch flak for being racist,3529,0.92,538,,1688745920.0,False,False,False,False,False
73,14t4ooe,NatureIsFuckingLit,/r/NatureIsFuckingLit/comments/14t4ooe/tiger_shark_attacks_boat/,thebigchil73,🔥 Tiger shark attacks boat,9494,0.96,608,,1688729581.0,False,False,False,False,False
74,14t8hlr,todayilearned,/r/todayilearned/comments/14t8hlr/til_upon_the_death_of_the_dalai_lama_a_search_for/,kickbackthisthat,"TIL Upon the death of the Dalai Lama, a search for his reincarnation is conducted where a child is identified through a series of 'tests' before being recognized as the succeeding Dalai Lama. The current Dalai Lama, Tenzin Gyatso, is the 14th.",14617,0.91,1345,,1688739243.0,False,False,False,False,False
75,14tfbzo,PoliticalCompassMemes,/r/PoliticalCompassMemes/comments/14tfbzo/the_supreme_court_needs_more_black_people_no_not/,Dissent-Against-Them,The Supreme Court needs more Black people... NO NOT LIKE THAT! NOOOOOOOOOO!!!1!,2094,0.91,284,:CENTG: - Centrist,1688754770.0,False,False,False,False,False
76,14t9atk,StupidFood,/r/StupidFood/comments/14t9atk/i_feel_really_sick_just_by_watching_this/,aridrawzstuff,I feel really sick just by watching this...,4524,0.86,1573,,1688741123.0,False,False,False,False,False
77,14tepv1,CuratedTumblr,/r/CuratedTumblr/comments/14tepv1/jesse_we_have_to_accept_my_old_business_partners/,CrypticBalcony,jesse we have to accept my old business partner’s offer to pay for my cancer treatment jesse,2219,0.98,49,kitty! :D,1688753329.0,False,False,False,False,False
78,14t393k,NonPoliticalTwitter,/r/NonPoliticalTwitter/comments/14t393k/doesnt_look_like_suffering_to_me/,Key-Power-9799,Doesn't look like suffering to me,15255,0.96,102,:blue1::blue2::1111::1112:,1688725446.0,False,False,False,False,False
79,14ta00j,BlackPeopleTwitter,/r/BlackPeopleTwitter/comments/14ta00j/and_she_stayed_like_a_real_woman/,jorginho20regista,And she stayed like a real woman,3866,0.88,243,,1688742677.0,False,False,False,False,False
80,14te3oq,technicallythetruth,/r/technicallythetruth/comments/14te3oq/they_only_go_up_to_9/,ok-i,They only go up to 9,2364,0.98,51,,1688751970.0,False,False,False,False,False
81,14t4k3c,AnimalsBeingDerps,/r/AnimalsBeingDerps/comments/14t4k3c/you_get_onion_you_become_disney_princess/,No-Assignment7129,"You get onion, you become Disney Princess. ",9880,0.96,340,,1688729228.0,False,False,False,False,False
82,14tai7i,WitchesVsPatriarchy,/r/WitchesVsPatriarchy/comments/14tai7i/supreme_court_orcas/,sailorjupiter28titan,Supreme Court Orcas,3488,0.95,38,☉ Apostate ✨ Witch of Aiaia ♀,1688743855.0,False,False,False,False,False
83,14tgbuq,formuladank,/r/formuladank/comments/14tgbuq/why_you_cant_hold_me_in_the_street/,UnquestionableDuck,Why You Can't Hold Me In The Street?,1717,0.97,78,Alonso deserved to be Champion in every season he has competed,1688756971.0,False,False,False,False,False
84,14tarwd,rareinsults,/r/rareinsults/comments/14tarwd/this_isnt_olive_garden/,FaithlessnessRare957,This isn't Olive Garden,3390,0.97,78,,1688744466.0,False,False,False,False,False
85,14tcxxh,PoliticalHumor,/r/PoliticalHumor/comments/14tcxxh/pure_insanity/,Confident_Prompt9494,Pure insanity.,2522,0.96,280,,1688749293.0,False,False,False,False,False
86,14th0ik,pettyrevenge,/r/pettyrevenge/comments/14th0ik/boyfriend_was_wrongfully_towed_from_our_complex_i/,Ok-Willow-2109,"Boyfriend was wrongfully towed from our complex, I got revenge",1562,0.97,71,,1688758508.0,False,False,False,False,False
87,14t9ska,distressingmemes,/r/distressingmemes/comments/14t9ska/its_dusty/,Old-Conversation-506,it's dusty,3982,0.97,118,,1688742235.0,False,False,False,False,False
88,14tcghf,EnoughMuskSpam,/r/EnoughMuskSpam/comments/14tcghf/not_surprising_behavior_from_elon/,thatguy9684736255,Not surprising behavior from Elon,2609,0.97,240,,1688748219.0,False,False,False,False,False
89,14t6g2k,ukraine,/r/ukraine/comments/14t6g2k/the_ministry_of_defense_of_ukriane_has_released_a/,UNITED24Media,The Ministry of Defense of Ukriane has released a mysterious video ,5919,0.94,285,:FlagUA: Ukraine Media,1688734233.0,False,False,False,False,False
90,14tbq2m,AskReddit,/r/AskReddit/comments/14tbq2m/serious_whats_something_that_happened_to_you_that/,Only-Carpenter-6689,(Serious) What's something that happened to you that sounds made up but isn't?,2874,0.96,2948,,1688746557.0,False,False,False,False,False
91,14tfydl,ChoosingBeggars,/r/ChoosingBeggars/comments/14tfydl/ferrari_not_good_enough/,Morrisboyyyy,Ferrari not good enough,1734,0.83,185,,1688756179.0,False,False,False,False,False
92,14tb3bi,FirstTimeHomeBuyer,/r/FirstTimeHomeBuyer/comments/14tb3bi/i_just_closed_197000_in_baltimore_md_i_nap_now_lol/,Ughburner,"I just closed! 197,000 in Baltimore MD. I nap now lol",3004,0.95,382,,1688745203.0,False,False,False,False,False
93,14t5i7o,politics,/r/politics/comments/14t5i7o/wendy_rogers_may_have_violated_arizonas_revenge/,hunter15991,Wendy Rogers may have violated Arizona’s ‘revenge porn’ law by tweeting x-rated pictures of Hunter Biden,21532,0.94,1249,:flag-il: Illinois,1688731775.0,False,False,False,False,False
94,14tapiz,educationalgifs,/r/educationalgifs/comments/14tapiz/how_windows_go_up_and_down_in_a_car/,volossaveroniki,How windows go up and down in a car.,3064,0.94,100,,1688744325.0,False,False,False,False,False
95,14t3vf5,tumblr,/r/tumblr/comments/14t3vf5/both_of_these_are_hilarious_for_entirely/,ElvirCrate,"Both of these are hilarious, for entirely different reasons",10658,0.96,159,,1688727276.0,False,False,False,False,False
96,14tbtbr,starterpacks,/r/starterpacks/comments/14tbtbr/the_annoying_hispanic_family_im_hispanic_out_in/,agizzy23,The annoying Hispanic family (I’m Hispanic) out in public starter pack,2703,0.91,299,,1688746767.0,False,False,False,False,False
97,14tdk0l,UkrainianConflict,/r/UkrainianConflict/comments/14tdk0l/ben_jerrys_founder_is_top_donor_of_group/,amcjkelly,Ben & Jerry’s Founder Is ‘Top Donor’ of Group Campaigning Against U.S. Military Support for Ukraine,2145,0.95,348,,1688750694.0,False,False,False,False,False
98,14tfsxq,CrazyFuckingVideos,/r/CrazyFuckingVideos/comments/14tfsxq/yesterdays_floods_in_zaragoza_spain/,idapitbwidiuatabip,"Yesterday's floods in Zaragoza, Spain",1620,0.99,166,,1688755836.0,False,False,False,False,False
99,14t7ywz,MemeVideos,/r/MemeVideos/comments/14t7ywz/_/,Select-Water-9655,🔥,4617,0.97,67,,1688738042.0,False,False,False,False,False
100,14tbmna,NotHowGirlsWork,/r/NotHowGirlsWork/comments/14tbmna/eggs_die_at_30_ladies/,DeanaOjeda,"Eggs die at 30, ladies.",2638,0.95,468,,1688746344.0,False,False,False,False,False
