rank,id,subreddit,permalink,author,title,score,upvote_ratio,num_comments,author_flair_text,created_utc,over_18,edited,stickied,locked,is_original_content
1,15091ly,mildlyinfuriating,/r/mildlyinfuriating/comments/15091ly/my_wife_bought_this_to_get_some_hydrogen_into_our/,unexpected_hulk,My wife bought this to get some Hydrogen into our water,11195,0.96,1678,,1689418801.0,False,False,False,False,False
2,1505fpw,facepalm,/r/facepalm/comments/1505fpw/rudy_giuliani_is_a_moron/,SophiaLuuna,Rudy Giuliani is a moron.,28550,0.95,428,,1689406689.0,False,False,False,False,False
3,150bi12,memes,/r/memes/comments/150bi12/one_of_us/,LemonConnoiseur,One of us,5185,0.94,303,,1689426108.0,True,False,False,False,False
4,1507ag5,WhitePeopleTwitter,/r/WhitePeopleTwitter/comments/1507ag5/absolutely_sickening/,emilyblunt2023,Absolutely sickening,9332,0.95,344,,1689412973.0,False,False,False,False,False
5,1505frs,todayilearned,/r/todayilearned/comments/1505frs/til_keanu_reeves_has_never_won_an_oscar_golden/,ColeBelthazorTurner,"TIL Keanu Reeves has never won an Oscar, Golden Globe, or Emmy award of any kind. In fact, he has never even been nominated for an Oscar, Golden Globe, or Emmy.",14858,0.88,1792,,1689406693.0,False,False,False,False,False
6,1506qd8,MadeMeSmile,/r/MadeMeSmile/comments/1506qd8/father_makes_sure_his_autistic_son_doesnt_get_too/,FoI2dFocus,Father makes sure his autistic son doesn't get too close or touch the royal guard and then this happens...,8123,0.97,188,,1689411090.0,False,False,False,False,False
7,1505lks,nextfuckinglevel,/r/nextfuckinglevel/comments/1505lks/macro_photography_is_incredible/,boredchipper,Macro photography is incredible,12091,0.94,284,,1689407242.0,False,False,False,False,False
8,150augh,tumblr,/r/tumblr/comments/150augh/if_i_were_a_monster_that_had_to_eat_people_i/,Sonic_the_hedgedog,"""If I were a monster that had to eat people, I would just eat horrible people.""",3115,0.98,130,,1689424258.0,False,False,False,False,False
9,1502g0j,Damnthatsinteresting,/r/Damnthatsinteresting/comments/1502g0j/jonathan_was_born_in_1832_in_the_seychelles_he/,OneHundredForcer,Jonathan was born in 1832 in the Seychelles. He has been living in Saint Helena since 1882 and just celebrated his 190th birthday.,27120,0.97,669,,1689396960.0,False,False,False,False,False
10,150275n,wholesome,/r/wholesome/comments/150275n/father_makes_sure_his_autistic_son_doesnt_get_too/,Sufficient-Bug-9112,Father makes sure his autistic son doesn't get too close or touch the royal guard and then this happens...,28884,0.94,739,,1689396166.0,False,False,False,False,False
11,1507gdp,midjourney,/r/midjourney/comments/1507gdp/modern_liza/,gianpaolorosa,Modern Liza,4692,0.85,366,,1689413536.0,False,False,False,False,False
12,150b6ab,politics,/r/politics/comments/150b6ab/rfk_jr_says_covid_was_ethnically_targeted_to/,The_Iceman2288,RFK Jr. says COVID was ‘ethnically targeted’ to spare Jews,2372,0.92,763,,1689425200.0,False,False,False,False,False
13,1507he8,SipsTea,/r/SipsTea/comments/1507he8/this_is_too_muchh/,Indeed2p,This is Too muchh🌚😂,4454,0.95,139,,1689413637.0,False,False,False,False,False
14,1508hao,AnimalsBeingDerps,/r/AnimalsBeingDerps/comments/1508hao/theres_really_no_way_those_goofballs_can_survive/,1Hate17Here,"There’s really no way, those goofballs can survive in the wild. xD",3448,0.96,101,,1689416968.0,False,False,False,False,False
15,1504rvt,comics,/r/comics/comments/1504rvt/abduction_attire/,NonRock,Abduction attire,7146,0.98,75,Hot Paper Comics,1689404483.0,False,False,False,False,False
16,1505ct6,ContagiousLaughter,/r/ContagiousLaughter/comments/1505ct6/guy_sings_about_his_first_love/,kojo92,Guy sings about his first love,6265,0.96,117,,1689406409.0,False,False,False,False,False
17,1508699,BeAmazed,/r/BeAmazed/comments/1508699/a_rocket_garden_sprinkler/,CoupwalObiWan,A rocket garden sprinkler,3645,0.95,167,,1689415932.0,False,False,False,False,False
18,150awg1,therewasanattempt,/r/therewasanattempt/comments/150awg1/to_camp_alone/,VariousBasket125,To camp alone,2319,0.99,181,This is a flair,1689424420.0,False,False,False,False,False
19,150a821,Gunners,/r/Gunners/comments/150a821/declan_rice_completes_transfer_to_arsenal/,radhumandummy,Declan Rice completes transfer to Arsenal,2335,0.96,274,Robert Pires' finger wag,1689422431.0,False,False,True,False,False
20,15011ej,Satisfyingasfuck,/r/Satisfyingasfuck/comments/15011ej/cleaning_up_a_beach_by_extracting_small_plastics/,JulianThompson5,Cleaning up a beach by extracting small plastics from sand,25939,0.95,570,,1689392611.0,False,False,False,False,False
21,1502o1z,shitposting,/r/shitposting/comments/1502o1z/death_praise_spez/,UltimateCumDispenser,Death :( Praise Spez,17569,0.95,169,,1689397655.0,False,False,False,False,False
22,1507f1b,antiwork,/r/antiwork/comments/1507f1b/i_gave_my_one_week_notice_my_line_manager_sat_me/,ctrl_alt_d1337,"I gave my one week notice. My line manager sat me down, belittled me, called me unprofessional and told me he was going to make my last week difficult.",3314,0.97,424,,1689413419.0,False,False,False,False,False
23,15070wq,PrequelMemes,/r/PrequelMemes/comments/15070wq/blame_anakin_later/,QuantumDonuts257,Blame Anakin later,3665,0.98,16,Rebel Legion,1689412056.0,False,False,False,False,False
24,150a1b5,marvelmemes,/r/marvelmemes/comments/150a1b5/odinbad_dad/,Loveanjelly,Odin...bad dad,2132,0.97,72,Avengers,1689421852.0,False,False,False,False,False
25,1503hss,diablo4,/r/diablo4/comments/1503hss/to_the_dismay_of_some_d4_devs_have_no_plans_to/,TheGoodDoctor17,"To the dismay of some, D4 devs have no plans to disable PvP from a zone dedicated for PVP.",6589,0.93,1615,,1689400353.0,False,False,False,False,False
26,15065xj,cats,/r/cats/comments/15065xj/anyone_elses_kitty_stick_their_butt_up_in_the_air/,Solid_Solid724,Anyone else's Kitty stick their butt up in the air like this when they're getting pets?,3982,0.97,272,,1689409130.0,False,False,False,False,False
27,14zzv81,wholesomememes,/r/wholesomememes/comments/14zzv81/shout_out_to_ron_perlman/,Darkshreaders3,shout out to ron perlman,21353,0.97,165,,1689389106.0,False,False,False,False,False
28,15092w3,dankmemes,/r/dankmemes/comments/15092w3/you_get_an_award_you_get_an_award_everybody_gets/,RunnyRose,"You get an award, you get an award, everybody gets an award",2276,0.99,190,I will steal your nipples :pepeuhoh:,1689418895.0,False,False,False,False,False
29,1508ohz,lgbt,/r/lgbt/comments/1508ohz/every_single_lesbian_and_transgender_woman_is_a/,Dangerous-Report-421,Every single lesbian and transgender woman is a woman.,2297,0.87,108,,1689417610.0,False,False,False,False,False
30,14zzyee,news,/r/news/comments/14zzyee/an_alabama_woman_is_missing_after_stopping_to/,Repogirl27,"An Alabama woman is missing after stopping to help a toddler she saw walking on the interstate, police say",11504,0.96,1448,,1689389368.0,False,False,False,False,False
31,1500zsr,Fauxmoi,/r/Fauxmoi/comments/1500zsr/sean_gunn_criticizes_disney_ceo_bob_iger/,jaffacakes077,Sean Gunn criticizes Disney CEO Bob Iger,8849,0.97,391,,1689392470.0,False,False,False,False,False
32,150b8jv,funny,/r/funny/comments/150b8jv/simon_pegg_secretly_feeds_lines_to_pom/,holyfruits,Simon Pegg secretly feeds lines to Pom Klementieff to say to a reporter,1505,0.96,56,,1689425388.0,False,False,False,False,False
33,1509e2s,me_irlgbt,/r/me_irlgbt/comments/1509e2s/me_irlgbt/,thatguy9684736255,me_irlgbt,1818,0.98,23,Ace/Rainbow :ace-rainbow:,1689419854.0,False,False,False,False,False
34,150b304,technicallythetruth,/r/technicallythetruth/comments/150b304/well_that_was_so_easy/,directvolcano,Well that was so easy,1360,0.99,92,,1689424946.0,False,False,False,False,False
35,1503v73,formuladank,/r/formuladank/comments/1503v73/the_curse_of_the_second_red_bull_seat/,ionutandreiciobotaru,The curse of the second Red Bull seat,4680,0.96,128, Nico Hüüüüüüüülkenberg,1689401548.0,False,False,False,False,False
36,1500jf5,BlackPeopleTwitter,/r/BlackPeopleTwitter/comments/1500jf5/we_should_probably_also_get_separate_water/,imjustheretodomyjob,"We should probably also get separate water fountains, and toilets....call it ""separate but equal"" smh",8282,0.96,213,☑️ Mod,1689391062.0,False,False,False,False,False
37,15099ag,MapPorn,/r/MapPorn/comments/15099ag/decline_of_celtic_languages_in_the_british_isles/,SCVMBXG100,Decline of Celtic Languages in the British Isles,1643,0.95,262,,1689419454.0,False,False,False,False,False
38,1504vmy,discordVideos,/r/discordVideos/comments/1504vmy/proof_why_china_3hr_per_week_screen_time_policy/,andrewens,proof why china 3hr per week screen time policy,3974,0.94,131,Have Commited Several War Crimes,1689404792.0,False,False,False,False,False
39,1506v56,nextfuckinglevel,/r/nextfuckinglevel/comments/1506v56/beluga_whale_uses_hydro_blast_to_retrieve_toy/,amit-gautam,Beluga Whale Uses Hydro Blast to Retrieve Toy,7389,0.96,214,,1689411570.0,False,False,False,False,False
40,14zxv27,meirl,/r/meirl/comments/14zxv27/meirl/,Luck_Beats_Skill,Meirl,27857,0.9,979,,1689383315.0,False,False,False,False,False
41,15033bd,PoliticalHumor,/r/PoliticalHumor/comments/15033bd/rebranding_has_been_largely_successful/,earthman34,Rebranding has been largely successful...,4597,0.93,181,,1689399049.0,False,False,False,False,False
42,1507n7s,Grimdank,/r/Grimdank/comments/1507n7s/hes_doing_his_best/,Quirky-Oven9475,He’s doing his best.,1981,0.91,58,,1689414186.0,False,False,False,False,False
43,15091xo,worldnews,/r/worldnews/comments/15091xo/russia_closes_polish_consulate_due_to_unfriendly/,BubsyFanboy,"Russia closes Polish consulate due to “unfriendly” acts, Poland pledges “equivalent response”",1564,0.97,59,,1689418826.0,False,False,False,False,False
44,14zygjd,LateStageCapitalism,/r/LateStageCapitalism/comments/14zygjd/we_wont_let_you_keep_it/,EldritchSlut,We won't let you keep it,11028,0.97,276,Commie Trash🚩,1689385010.0,False,False,False,False,False
45,1500ywn,PublicFreakout,/r/PublicFreakout/comments/1500ywn/unhinged_mother_threatens_school_after_getting/,NickfromLafayette92,Unhinged mother threatens school after getting barred from seeing her children,6696,0.93,1567,,1689392400.0,False,False,False,False,False
46,1504ghq,facepalm,/r/facepalm/comments/1504ghq/nft/,ExtensonAd,NFT,13593,0.96,689,,1689403504.0,False,False,False,False,False
47,1506ctx,lotrmemes,/r/lotrmemes/comments/1506ctx/samwise_the_brave/,oeco123,Samwise the Brave,2340,0.97,53,Théoden,1689409816.0,False,False,False,False,False
48,150b0we,pics,/r/pics/comments/150b0we/john_oliver_says_reply_for_an_award_giving_away/,madbuda,John Oliver says reply for an award. Giving away all my Reddit coins,1108,0.74,2503,,1689424785.0,False,False,False,False,False
49,1506cks,ImTheMainCharacter,/r/ImTheMainCharacter/comments/1506cks/tourists_blocking_the_street/,shrimpcult,Tourist's blocking the street,2293,0.98,228,,1689409795.0,False,False,False,False,False
50,1507ws4,CombatFootage,/r/CombatFootage/comments/1507ws4/assault_actions_of_the_1st_mechanized_battalion/,aarrte,"Assault actions of the 1st mechanized battalion of the 3rd SABr, uncensored drone video",1711,0.96,120,,1689415092.0,True,False,False,False,False
51,1507pv2,Animemes,/r/Animemes/comments/1507pv2/50_chapters_to_hold_hands_seems_too_optimistic/,FidoMix_Felicia,50 chapters to Hold Hands? Seems too optimistic.,1786,0.98,69,⠀Big Anime Tiddies,1689414438.0,False,False,False,False,False
52,1505rnc,ukraine,/r/ukraine/comments/1505rnc/south_korean_president_yoon_seokyeol_arrived_in/,UNITED24Media,South Korean President Yoon Seok-yeol arrived in Ukraine on an unannounced visit,2484,0.97,59,:FlagUA: Ukraine Media,1689407815.0,False,False,False,False,False
53,1504d9h,Genshin_Impact,/r/Genshin_Impact/comments/1504d9h/nilou_crocheted_by_me/,cjlacrochet,Nilou crocheted by me 💙💙🧡🧡,3319,0.97,141,,1689403209.0,False,False,False,False,False
54,14zwroh,oddlysatisfying,/r/oddlysatisfying/comments/14zwroh/the_way_this_cat_descends_this_ladder/,amish_novelty,The way this cat descends this ladder,19124,0.96,176,,1689380282.0,False,False,False,False,False
55,1501ibb,AskReddit,/r/AskReddit/comments/1501ibb/what_worst_possible_reply_to_im_pregnant/,Suspicious_Device609,"What Worst possible reply to ""I'm pregnant""?",5805,0.87,7055,,1689394016.0,False,False,False,False,False
56,1508e9y,mathmemes,/r/mathmemes/comments/1508e9y/when_i_was_in_4th_grade_i_had_no_idea_of_negative/,ThatFunnyGuy543,"When I was in 4th grade, I had no idea of negative numbers. But I had this",1524,0.97,59,,1689416682.0,False,False,False,False,False
57,14zzklv,TikTokCringe,/r/TikTokCringe/comments/14zzklv/insecure_big_girl_rejects_nice_guy/,AlertBreath2887,Insecure big girl rejects nice guy,9887,0.83,1973,,1689388226.0,False,False,False,False,False
58,1504vwe,Eyebleach,/r/Eyebleach/comments/1504vwe/bearcat/,fat_old_boy,Bear-cat,2768,0.96,47,,1689404819.0,False,False,False,False,False
59,15068pn,golf,/r/golf/comments/15068pn/wife_so_youre_telling_me_you_played_golf_for_4/,The_Scrabbler,Wife: So you’re telling me you played golf for 4 hours and didn’t once ask your friends how their wives were doing?,2133,0.95,337,,1689409407.0,False,False,False,False,False
60,1505glg,CasualUK,/r/CasualUK/comments/1505glg/so_ive_just_discovered_the_true_way_to_divide_up/,Appropriate-Divide64,So I've just discovered the true way to divide up England.,2430,0.88,404,,1689406779.0,False,False,False,False,False
61,1506m98,CrazyFuckingVideos,/r/CrazyFuckingVideos/comments/1506m98/rage_against_climate_activists_blocking_roads_in/,Sufficient-Welder-32,Rage against climate activists blocking roads in Germany,1934,0.95,381,,1689410704.0,False,False,False,True,False
62,150abiq,malelivingspace,/r/malelivingspace/comments/150abiq/after_getting_my_first_place_to_myself_a_year_ago/,naveregnide,"After getting my first place to myself a year ago, I finally made my London flat into my London home",1018,0.96,99,,1689422686.0,False,False,False,False,False
63,1507fi7,lego,/r/lego/comments/1507fi7/name_a_bigger_downgrade/,nickomoss,Name a bigger downgrade ...,1610,0.96,99,:blue_stud: Verified Blue Stud Member,1689413454.0,False,False,False,False,False
64,150akcc,WTF,/r/WTF/comments/150akcc/sanatogen_wine_advert_from_1967_aimed_at/,peaceandloveandhippy,Sanatogen wine advert from 1967 aimed at housewives. Bury your misery with alcohol!,978,0.95,105,,1689423420.0,False,False,False,False,False
65,1509blv,Superstonk,/r/Superstonk/comments/1509blv/to_all_of_you_beautiful_zen_lurker_apes_and/,FreebidderIS,"To all of you beautiful zen lurker apes and APETTES. MAKE NO MISTAKES, WE ARE STILL HERE. WE ARE STILL STRONG. WE ARE STILL THE MOST POWERFUL PLAYER IN THIS LONG GAME!",1322,0.93,63,MOASS IS HERE,1689419657.0,False,False,False,False,False
66,1506821,therewasanattempt,/r/therewasanattempt/comments/1506821/to_get_back_together/,clearlythrill,To get back together,5912,0.84,598,,1689409337.0,False,False,False,False,False
67,1508hiv,videos,/r/videos/comments/1508hiv/striking_actor_ron_perlman_responds_to_mother/,Pinkfatrat,STRIKING ACTOR RON PERLMAN RESPONDS TO MOTHER FUCKING STUDIO EXEC,1257,0.83,283,,1689416988.0,False,False,False,False,False
68,1509tfn,oddlyspecific,/r/oddlyspecific/comments/1509tfn/cant_stop_thinking_about_the_30_tip_because_this/,cerridwen_,cant stop thinking about the 30% tip because this is somehow true…,1042,0.97,27,,1689421184.0,False,False,False,False,False
69,14zz91z,doordash,/r/doordash/comments/14zz91z/been_giving_my_customers_semi_creepy_selfies_with/,prokiller9000,Been giving my customers semi creepy selfies with every order😂,7027,0.92,341,,1689387286.0,False,False,False,False,False
70,15038pg,Unexpected,/r/Unexpected/comments/15038pg/shit_got_serious/,Arudek,Shit got serious,11675,0.94,337,,1689399548.0,True,False,False,False,False
71,1509o5u,ProgrammerHumor,/r/ProgrammerHumor/comments/1509o5u/yesmothersudoiwilleat/,2hno3,yesMotherSudoIWillEat,1047,0.91,11,:cp::py:,1689420704.0,False,False,False,False,False
72,1509cmh,Hololive,/r/Hololive/comments/1509cmh/bae_has_added_her_signature_to_the_studio_wall/,lightow,Bae has added her signature to the studio wall.,1105,0.98,22,:Gura::Amelia::Inanis::Calliope::Kiara:,1689419739.0,False,False,False,False,False
73,1506t72,europe,/r/europe/comments/1506t72/colonel_kazimierz_szron_klimczak_died_yesterday/,PjeterPannos,"Colonel Kazimierz “Szron” Klimczak died yesterday at the age of 109: born just months before WW1, he was one of the soldiers who fought against Germany in 1939, joined the military underground & then fought again in the 1944 Warsaw Uprising.",1623,0.96,33,Veneto (Italy 🇮🇹),1689411368.0,False,False,False,False,False
74,1502x5t,whenthe,/r/whenthe/comments/1502x5t/rip_monty_he_was_too_good_for_us/,Kabe6900,"RIP Monty, he was too good for us :(",3517,0.98,90,,1689398472.0,False,False,False,False,False
75,1506iyb,FunnyAnimals,/r/FunnyAnimals/comments/1506iyb/i_never_thought_i_would/,plasma5550,I never thought I would ,1693,0.96,27,,1689410396.0,False,False,False,False,False
76,14zzj34,NatureIsFuckingLit,/r/NatureIsFuckingLit/comments/14zzj34/layan_albatross_looks_for_a_lifelong_mate_to/,EmptySpaceForAHeart,"🔥 Layan Albatross looks for a lifelong mate to raise a family, but there's a twist.",5947,0.96,279,,1689388102.0,False,False,False,False,False
77,1500jc7,funnyvideos,/r/funnyvideos/comments/1500jc7/this_kid_got_jedi_mind_tricks_up_his_sleeve/,DarthiusFatticus,This kid got Jedi mind tricks up his sleeve!,5173,0.96,31,,1689391054.0,False,False,False,False,False
78,1509jgu,StarWars,/r/StarWars/comments/1509jgu/correct_me_if_im_wrong_but_outside_of_video_games/,Plumbum158,correct me if I'm wrong but outside of video games we have not seen an SSD onscreen since 1986,968,0.96,115,,1689420316.0,False,False,False,False,False
79,1502lbm,HonkaiStarRail,/r/HonkaiStarRail/comments/1502lbm/so_which_side_are_you_on/,Mukimpo_baka,So which side are you on?,3425,0.94,450,,1689397409.0,False,False,False,False,False
80,14zwkn8,BrandNewSentence,/r/BrandNewSentence/comments/14zwkn8/had_to_read_this_a_few_times_i_still_dont_get_it/,gravelbee,Had to read this a few times & I still don't get it,12470,0.98,311,,1689379754.0,False,False,False,False,False
81,15071kc,OneOrangeBraincell,/r/OneOrangeBraincell/comments/15071kc/captain_dipshit_over_here_busted_out_a_window/,MagalyHogg,"Captain Dipshit™️ over here busted out a window screen to chase another cat, immediately regretted it and made me come rescue him… during a thunderstorm. We’re both absolutely drenched and questioning our life choices. That face has neither brain cells or regrets.",1449,0.93,37,,1689412125.0,False,False,False,False,False
82,150a64n,MadeMeSmile,/r/MadeMeSmile/comments/150a64n/at_least_no_one_is_going_to_say_their_wedding_is/,AnnihilationOrchid,At least no one is going to say their wedding is fake.,2140,0.97,85,,1689422267.0,False,False,False,False,False
83,1509hxt,UkraineWarVideoReport,/r/UkraineWarVideoReport/comments/1509hxt/the_m1_abrams_tanks_are_heading_towards_ukraine/,UNITED24Media,"The M1 Abrams tanks are heading towards Ukraine, as stated by the voiceover",959,0.96,61,Official Source,1689420180.0,False,False,False,False,False
84,14zzubz,shittytattoos,/r/shittytattoos/comments/14zzubz/the_artist_was_bragging_about_how_he_could_knock/,hellokylegoodbye,The artist was bragging about how he could knock out a full back piece in one sitting.,5094,0.94,519,,1689389026.0,False,False,False,False,False
85,1506wt3,WhatsWrongWithYourCat,/r/WhatsWrongWithYourCat/comments/1506wt3/hes_so_comfortable_tho/,violetgood,He's so comfortable tho,1444,0.97,17,,1689411694.0,False,False,False,False,False
86,1508es1,PoliticalCompassMemes,/r/PoliticalCompassMemes/comments/1508es1/authright_bad/,ETOS2006,AUTH-RIGHT = BAD?,1118,0.92,133,:lib: - Lib-Center,1689416729.0,False,False,False,False,False
87,1503kn4,shitposting,/r/shitposting/comments/1503kn4/heil_spez/,Designer-Yam-7170,Heil spez ,10666,0.96,52,Literally 1984 😡,1689400617.0,False,False,False,False,False
88,15061mx,TrueSTL,/r/TrueSTL/comments/15061mx/the_police_received_a_noise_complaint_from_our/,Ok-Bad6243,The police received a noise complaint from our downstairs neighbor and came by to ask us to keep it down. We then received a lease violation notice from our landlord and were told we have two more before we are evicted. Can we dispute this? If so do we talk to our police department or our landlord?,1630,0.94,158,,1689408726.0,True,1689410156.0,False,False,False
89,15073ey,WinStupidPrizes,/r/WinStupidPrizes/comments/15073ey/when_you_glue_your_hand_to_the_ground_in_protest/,Serious_Professor_51,When you glue your hand to the ground in protest...,1353,0.89,282,,1689412298.0,False,False,False,False,False
90,150ao9e,WorkReform,/r/WorkReform/comments/150ao9e/were_trapped_in_this_life/,KityKaty95,We're trapped in this life,767,0.98,54,,1689423737.0,False,False,False,False,False
91,1502h5k,animememes,/r/animememes/comments/1502h5k/cc_animememepage_on_instagram/,chivalrousfinale,Cc: anime.memepage on Instagram,3176,0.95,88,,1689397062.0,False,False,False,False,False
92,1509fpp,WhitePeopleTwitter,/r/WhitePeopleTwitter/comments/1509fpp/these_sound_like_decent_policies/,thatguy9684736255,These sound like decent policies,2231,0.99,68,,1689419997.0,False,False,False,False,False
93,150744z,gaming,/r/gaming/comments/150744z/my_the_legend_of_zelda_collection_a_bleach/,angelinazelda,My The Legend of Zelda collection + a bleach painting t-shirt I did of Ganondorf,1323,0.87,63,PlayStation,1689412371.0,False,False,False,False,False
94,15057py,TwoXChromosomes,/r/TwoXChromosomes/comments/15057py/i_got_rear_ended/,Low-Maintenance7684,I got rear ended.,1820,0.92,266,,1689405942.0,False,False,False,False,False
95,1504no4,Anticonsumption,/r/Anticonsumption/comments/1504no4/more_people_need_to_be_like_nick/,Suzcv,More people need to be like Nick,2002,0.92,187,,1689404129.0,False,False,False,False,False
96,1506zdv,MemeVideos,/r/MemeVideos/comments/1506zdv/bro_really_thinking/,Potential-Guitar-293,Bro really thinking ,1335,0.97,43,,1689411913.0,False,False,False,False,False
97,14zyzm6,pcmasterrace,/r/pcmasterrace/comments/14zyzm6/maybe_the_worst_ghosting_ive_ever_seen/,veqe33,Maybe the worst ghosting I've ever seen.,5973,0.91,588,:steam: Ryzen 7 1700 | GTX 1080,1689386509.0,False,False,False,False,False
98,1508ylc,teenagers,/r/teenagers/comments/1508ylc/some_guy_is_arguing_with_me_a_woman_over_if/,Aeternum-Vivum,"Some GUY is arguing with me, a WOMAN over if breasts are fat or not 💀",937,0.95,221,16,1689418516.0,True,False,False,False,False
99,14zymnq,HolUp,/r/HolUp/comments/14zymnq/hop_in/,Excellent_Andrea,Hop in!,6498,0.96,61,,1689385494.0,False,False,False,False,False
100,1507jj0,DiWHY,/r/DiWHY/comments/1507jj0/started_off_stupid_enough_but_it_gets_worse/,Truffle0214,"Started off stupid enough, but it gets worse",1169,0.94,131,,1689413832.0,False,False,False,False,False
