rank,id,subreddit,permalink,author,title,score,upvote_ratio,num_comments,author_flair_text,created_utc,over_18,edited,stickied,locked,is_original_content
1,14pbfqt,facepalm,/r/facepalm/comments/14pbfqt/imagine_being_this_confidently_stupid/,coarsecylinder,Imagine being this confidently stupid.,8818,0.97,680,,1688367120.0,False,False,False,False,False
2,14p5ev8,worldnews,/r/worldnews/comments/14p5ev8/norway_discovers_massive_underground_deposit_of/,HelloSlowly,"Norway discovers massive underground deposit of high-grade phosphate rock, big enough to satisfy world demand for fertilisers, solar panels and electric car batteries over the next 100 years",31015,0.97,1827,,1688348338.0,False,False,False,False,False
3,14p9nkv,CrazyFuckingVideos,/r/CrazyFuckingVideos/comments/14p9nkv/realistic_animation_showing_the_implosion_of_the/,ACProfessor,Realistic animation showing the implosion of the “Titan”,7166,0.92,861,,1688361185.0,True,False,False,False,False
4,14p9l7z,ContagiousLaughter,/r/ContagiousLaughter/comments/14p9l7z/how_to_dad_remakes_his_first_video_with_his_kiddo/,Spontanemoose,How To Dad remakes his first video with his kiddo,6708,0.97,129,,1688360967.0,False,False,False,False,False
5,14p6zr6,BrandNewSentence,/r/BrandNewSentence/comments/14p6zr6/the_forbidden_art_of_giving_crabs_knowledge/,Ryce_Byce,The forbidden art of giving crabs knowledge,12153,0.97,211,,1688352959.0,False,False,False,False,False
6,14p6hic,comics,/r/comics/comments/14p6hic/my_main/,shenanigansen,My Main,11859,0.96,232,Shen Comix,1688351464.0,False,False,False,False,True
7,14p6mpb,Damnthatsinteresting,/r/Damnthatsinteresting/comments/14p6mpb/natural_swimming_pools_or_ponds_are_filtered/,4reddityo,Natural swimming pools or ponds are filtered organically rather than by chemicals.,13297,0.92,421,,1688351891.0,False,False,False,False,False
8,14p8g2w,Genshin_Impact,/r/Genshin_Impact/comments/14p8g2w/overture_teaser_the_final_feast_genshin_impact/,genshinimpact,Overture Teaser: The Final Feast | Genshin Impact,6449,0.96,1023,:hoyo1::hoyo2: Official,1688357378.0,False,False,False,False,False
9,14p3vgr,gaming,/r/gaming/comments/14p3vgr/my_65_yr_old_father_in_law_has_played_one_game/,jagrbomb,My 65 yr old father in law has played one game for the last 15 yrs. These are his stats 😵‍💫,19541,0.94,1212,,1688343929.0,False,False,False,False,False
10,14p89g9,PrequelMemes,/r/PrequelMemes/comments/14p89g9/the_greatest_accomplishment_somebody_can_have_is/,GloriousBowli,The greatest accomplishment somebody can have is to rickroll Rick Astley.,6406,0.95,62,,1688356842.0,False,False,False,False,False
11,14p4wgt,nextfuckinglevel,/r/nextfuckinglevel/comments/14p4wgt/msg_sphere_in_las_vegas_says_hello_world/,picNsave,"MSG Sphere in Las Vegas says ""Hello World""",13094,0.94,549,,1688346877.0,False,False,False,False,False
12,14p4rzq,wholesomememes,/r/wholesomememes/comments/14p4rzq/memory_unlocked/,Naive_Establishment2,Memory unlocked!!,11788,0.97,174,,1688346501.0,False,False,False,False,False
13,14p8hn5,NatureIsFuckingLit,/r/NatureIsFuckingLit/comments/14p8hn5/twin_falls_idaho_usa/,iamayeshaerotica,"🔥 Twin Falls, Idaho, USA",4631,0.96,158,,1688357505.0,False,False,False,False,False
14,14p6as9,therewasanattempt,/r/therewasanattempt/comments/14p6as9/to_rob_a_jewelry_store/,FinalSneak,To rob a jewelry store,7968,0.96,570,This is a flair,1688350899.0,False,False,False,False,False
15,14p8v61,dankmemes,/r/dankmemes/comments/14p8v61/even_covers_arent_safe/,ZoomZombie1119,Even covers aren't safe,4888,0.99,26,"the very best, like no one ever was. ",1688358664.0,False,False,False,False,False
16,14pbis4,AnimalsBeingBros,/r/AnimalsBeingBros/comments/14pbis4/stray_dog_saves_girl/,Sizzlin9,Stray dog saves girl.,2642,0.97,84,,1688367399.0,False,False,False,False,False
17,14p2xvm,BlackPeopleTwitter,/r/BlackPeopleTwitter/comments/14p2xvm/if_you_take_the_low_road_youre_not_a_victim_when/,SmithNotASmith,"If you take the low road, you're not a victim when you're met there",12245,0.93,326,,1688341400.0,False,False,False,False,False
18,14pbjhm,HolUp,/r/HolUp/comments/14pbjhm/give_them_a_taste_of_their_own_medicine/,ImportantEffort4594,Give them a taste of their own medicine,2485,0.98,32,,1688367467.0,False,False,False,False,False
19,14p14le,WhitePeopleTwitter,/r/WhitePeopleTwitter/comments/14p14le/aoc_being_attacked_because_of_a_harmless_selfie/,Visqo,AOC being attacked because of a harmless selfie,28592,0.9,2167,,1688336652.0,False,False,False,False,False
20,14p43lp,mildlyinfuriating,/r/mildlyinfuriating/comments/14p43lp/my_cats_consider_this_an_empty_bowl/,kneaddough,My cats consider this an empty bowl.,10773,0.92,600,,1688344576.0,False,False,False,False,False
21,14p3j6t,oddlyterrifying,/r/oddlyterrifying/comments/14p3j6t/a_fraction_of_my_aunts_antique_doll_collection/,ohhhjamie,A *fraction* of my Aunt’s antique doll collection - there are hundreds. Guess who inherits them?,12329,0.97,1008,,1688342976.0,False,False,False,False,False
22,14p1ifk,OldSchoolCool,/r/OldSchoolCool/comments/14p1ifk/my_grandmas_first_picture_in_canada_after/,ComicDuhComic,My Grandma's first picture in Canada after surviving the holocaust. (1947),14193,0.95,232,,1688337649.0,False,False,False,False,False
23,14p53h0,antiwork,/r/antiwork/comments/14p53h0/there_seems_to_be_a_coordinated_antiwfh_campaign/,econbird,There seems to be a coordinated anti-WFH campaign happening,5702,0.98,388,,1688347433.0,False,False,False,False,False
24,14ozz0j,todayilearned,/r/todayilearned/comments/14ozz0j/til_a_man_was_awarded_7_million_in_damages_after/,Such-Track5369,TIL A man was awarded $7 million in damages after he developed a lung condition from eating two bags of popcorn every day and inhaling the steam from the bag,20201,0.95,747,,1688333731.0,False,False,False,False,False
25,14p66v3,facepalm,/r/facepalm/comments/14p66v3/what/,aluka_nwa,What?????,44823,0.91,2396,,1688350586.0,False,False,False,False,False
26,14oz03b,funny,/r/funny/comments/14oz03b/is_this_tasteless_well_yeah_its_subway/,D3T3KT,"Is this tasteless? Well yeah, its subway.",25036,0.93,901,,1688331367.0,False,False,False,False,False
27,14p56nr,Tinder,/r/Tinder/comments/14p56nr/never_taking_advice_from_pickuplines_on_a_discord/,WastedWhaleShark,Never taking advice from #pick-up-lines on a Discord Server again 🤦‍♀️,5641,0.94,259,,1688347692.0,False,False,False,False,False
28,14p3a6a,conservativeterrorism,/r/conservativeterrorism/comments/14p3a6a/well_young_people_its_time_for_you_to_sack_up/,t3lnet,"Well young people, it’s time for you to sack up…",7172,0.95,383,,1688342332.0,False,False,False,False,False
29,14p6jp8,pics,/r/pics/comments/14p6jp8/john_oliver_supports_the_wga/,annepng,John Oliver supports the WGA.,3976,0.89,73,,1688351646.0,False,False,False,False,False
30,14pb8ao,marvelmemes,/r/marvelmemes/comments/14pb8ao/the_cameraman/,Nikhil__P,The Cameraman ,1840,0.98,10,Avengers,1688366412.0,False,False,False,False,False
31,14p9uju,sadcringe,/r/sadcringe/comments/14p9uju/lmfao_the_way_the_dude_died_when_he_realized_she/,shanmikko,Lmfao the way the dude died when he realized she was referring to him,2294,0.94,120,,1688361836.0,False,False,False,False,False
32,14ozbal,LeopardsAteMyFace,/r/LeopardsAteMyFace/comments/14ozbal/this_is_a_death_sentence_for_me_sobs_republican/,imaginary_num6er,"“This is a death sentence for me” sobs, Republican woman who voted for DeSantis stripping away her permanent alimony",16646,0.94,1499,,1688332094.0,False,False,False,False,False
33,14p3b68,space,/r/space/comments/14p3b68/i_went_to_a_dark_sky_park_to_photograph_the_core/,theillini19,I went to a dark sky park to photograph the core of the Milky Way. By complete coincidence there were thousands of fireflies in the forest out for the summer. Here is a combination of long exposures I took that night of stars and fireflies.,6534,0.98,122,,1688342409.0,False,False,False,False,False
34,14p4tkd,MadeMeSmile,/r/MadeMeSmile/comments/14p4tkd/drove_my_girlfriend_2_hours_so_that_she_could_get/,mirk__,Drove my girlfriend 2 hours so that she could get her favourite cookies 🍪,7624,0.73,1445,,1688346635.0,False,False,False,False,False
35,14p8ad9,Genshin_Impact_Leaks,/r/Genshin_Impact_Leaks/comments/14p8ad9/overture_teaser_the_final_feast/,Junnielocked,Overture Teaser: The Final Feast,2783,0.93,1052,,1688356904.0,False,False,False,False,False
36,14p2iam,Catswithjobs,/r/Catswithjobs/comments/14p2iam/cat_manager/,decent694201,Cat manager,7769,0.98,91,,1688340225.0,False,False,False,False,False
37,14oy92g,politics,/r/politics/comments/14oy92g/fmr_trump_press_secretary_i_watched_him_show/,Lotus532,Fmr. Trump Press Secretary: I watched him show documents to people at Mar-a-Lago,17221,0.96,548,:flag-gb: United Kingdom,1688329547.0,False,False,False,False,False
38,14p0jp6,oddlysatisfying,/r/oddlysatisfying/comments/14p0jp6/cleaning_a_wax_station/,WhoStoleMyPassport,Cleaning a wax station,20005,0.81,500,,1688335189.0,False,False,False,False,False
39,14p71a6,lotrmemes,/r/lotrmemes/comments/14p71a6/your_neighbor_on_a_sunday_night_after_a_few_drinks/,CelestialFury,Your neighbor on a Sunday night after a few drinks,3203,0.98,29,,1688353083.0,False,False,False,False,False
40,14ozrei,news,/r/news/comments/14ozrei/police_arrest_mother_of_7yearold_girl_whose_body/,Cinnamon2017,Police arrest mother of 7-year-old girl whose body was found decaying in closet,11161,0.96,605,,1688333207.0,False,False,False,False,False
41,14p1a34,ThatsInsane,/r/ThatsInsane/comments/14p1a34/france_more_than_2000_cars_burned_more_than_700/,wats6831,"France: More than 2,000 cars burned, more than 700 businesses were damaged, and more than 3,000 people were arrested.",8916,0.96,236,,1688337052.0,False,False,False,True,False
42,14p168r,Unexpected,/r/Unexpected/comments/14p168r/popeye_the_sailorman/,DomesticatedCyborg,Popeye the Sailorman,10401,0.98,135,,1688336770.0,False,False,False,False,True
43,14p426j,maybemaybemaybe,/r/maybemaybemaybe/comments/14p426j/maybe_maybe_maybe/,Wide_Abroad1182,Maybe maybe maybe,5197,0.96,125,,1688344463.0,False,False,False,False,False
44,14p7p7d,shitposting,/r/shitposting/comments/14p7p7d/praise_spez_i_hate_spiders/,NCR_Veteran_Rangers,Praise Spez I Hate Spiders,2873,0.99,33,,1688355090.0,False,False,False,False,False
45,14p4mhf,meirl,/r/meirl/comments/14p4mhf/me_irl/,Faruzia,Me_irl,4625,0.92,214,,1688346082.0,False,False,False,False,False
46,14ozssv,WTF,/r/WTF/comments/14ozssv/i_drank_the_water_and_popped_it_open/,EnigmaEcstacy,I drank the water and popped it open.,10022,0.95,1120,,1688333309.0,False,False,False,False,False
47,14p0zld,NonPoliticalTwitter,/r/NonPoliticalTwitter/comments/14p0zld/terrifying_for_her/,burakalp34,Terrifying for her,8187,0.97,164,:blue1::blue2::1111::1112:,1688336297.0,False,False,False,False,False
48,14ozczi,PublicFreakout,/r/PublicFreakout/comments/14ozczi/this_restaurant_refused_to_seat_a_black_customer/,FuturisticFighting,"This restaurant refused to seat a black customer for wearing an informal attire, while the other seated white patrons were wearing informal attire but still given a table.",12017,0.9,806,,1688332211.0,False,False,False,False,False
49,14p4x7y,fightporn,/r/fightporn/comments/14p4x7y/bitches_gone_wild_well_almost/,J4ckSic4rio,"Bitches gone wild, well almost ",4117,0.91,204,,1688346933.0,False,False,False,False,False
50,14p6sr3,Hololive,/r/Hololive/comments/14p6sr3/i_love_you_ina/,Tyler_462,“I LOVE YOU INA- 🗣️🔥🔥🔥”,3010,0.96,33,:Achan::Achan::Achan::Achan::Achan:,1688352386.0,False,False,False,False,False
51,14p5p0o,DunderMifflin,/r/DunderMifflin/comments/14p5p0o/so_which_one_is_jim/,msoliz52,"""So which one is Jim?""",3436,0.95,78,,1688349158.0,False,False,False,False,False
52,14p2y8t,cats,/r/cats/comments/14p2y8t/does_anyone_have_experience_with_runts_this_guy/,Begonethot212,Does anyone have experience with runts? This guy looks quite a bit younger/different than the other kittens in the litter.,5468,0.98,360,,1688341429.0,False,False,False,False,False
53,14oxjvn,BeAmazed,/r/BeAmazed/comments/14oxjvn/cannot_repeat/,Odd-Tutor931,Cannot repeat!,18510,0.97,230,,1688327824.0,False,False,False,False,False
54,14paxtv,2westerneurope4u,/r/2westerneurope4u/comments/14paxtv/norwegian_imperialism/,simon_ceo_of_sex,Norwegian Imperialism,1422,0.99,180,:Germany: [redacted],1688365403.0,False,False,False,False,False
55,14p0jqu,memes,/r/memes/comments/14p0jqu/problem_solved/,MemeNoOffense,Problem solved,13040,0.95,380,,1688335193.0,False,False,False,False,False
56,14p8v00,TwoHotTakes,/r/TwoHotTakes/comments/14p8v00/my_husbands_best_friend_sexualized_my_daughter_at/,Smart_Elderberry_709,My husbands best friend sexualized my daughter at her sweet sixteen,1982,0.92,682,,1688358649.0,False,1688374994.0,False,False,False
57,14p0364,formuladank,/r/formuladank/comments/14p0364/ocons_cleanest_lap_in_austria/,BuddhaBongWater,Ocon's cleanest lap in Austria,8631,0.98,99,Alonso deserved to be Champion in every season he has competed,1688334023.0,False,False,False,False,False
58,14p1tjt,nba,/r/nba/comments/14p1tjt/drakes_comment_on_fred_vanvleets_thank_you_post/,OhmsLaw111,Drake’s comment on Fred Vanvleet’s thank you post.“ Good luck on the Guangdong Dragons…..I mean the Houston Rockets”,5590,0.94,636,:tor-4: Raptors,1688338446.0,False,False,False,False,False
59,14p3gyd,popheadscirclejerk,/r/popheadscirclejerk/comments/14p3gyd/let_them_cook/,makinishi_KINO,Let them cook,4450,0.94,150,Poggers Rae Jepsen,1688342797.0,False,False,False,False,False
60,14oyn8s,NewsOfTheStupid,/r/NewsOfTheStupid/comments/14oyn8s/man_named_in_supreme_courts_gay_wedding_website/,Misguided_Society,Man Named in Supreme Court's Gay Wedding Website Ruling is Married to a Woman and Never Even Contacted the Web Designer,9041,0.95,568,,1688330493.0,False,False,False,False,False
61,14p015k,tumblr,/r/tumblr/comments/14p015k/theyre_just_like_me_fr/,infinitysaga,They’re just like me fr,9329,0.96,84,,1688333883.0,False,False,False,False,False
62,14p1caf,technology,/r/technology/comments/14p1caf/over_100_artists_boycotting_venues_that_use/,geoxol,Over 100 artists boycotting venues that use face-scanning technology,5469,0.97,279,,1688337204.0,False,False,False,False,False
63,14p4y6g,Grimdank,/r/Grimdank/comments/14p4y6g/if_youre_going_to_be_a_dwarf_aim_for_deep_rock/,TheModernRouge,"If you’re going to be a dwarf, aim for Deep Rock Galactic instead of Vermintide",3177,0.97,121,I am Alpharius,1688347014.0,False,False,False,False,False
64,14oxklh,TikTokCringe,/r/TikTokCringe/comments/14oxklh/if_you_watch_only_one_video_today_let_this_be_the/,Rollyman1,"If you watch only one video today, let this be the one.",12200,0.88,786,,1688327880.0,False,False,False,False,False
65,14ox9v7,FunnyandSad,/r/FunnyandSad/comments/14ox9v7/people_should_work_hard_to_get_housed_every/,Devils_negotiator,“People should work hard to get housed” -every feudal landlord.,11854,0.93,522,,1688327115.0,False,False,False,False,False
66,14ozzoy,OneOrangeBraincell,/r/OneOrangeBraincell/comments/14ozzoy/two_cuties_sleeping/,SmallBirdInSky,Two cuties sleeping,6799,0.98,67,,1688333780.0,False,False,False,False,False
67,14p5zqc,destiny2,/r/destiny2/comments/14p5zqc/would_anyone_else_be_down_for_a_infinite_round/,G-man69420,Would anyone else be down for a infinite round “Horde Mode” in D2?,2596,0.95,257,[🔭Wayfarer Warlock🛰️],1688349991.0,False,False,False,False,False
68,14p8fpk,HonkaiStarRail,/r/HonkaiStarRail/comments/14p8fpk/version_12_livestream_planned_for_july_8_2023/,Xanek,"Version 1.2 Livestream planned for July 8, 2023 @ 19:30 (UTC+8) / Honkai: Star Rail Version 1.2 ""Even Immortality Ends"" Special Program",1740,0.97,114,,1688357345.0,False,False,False,False,False
69,14p5kh6,ChatGPT,/r/ChatGPT/comments/14p5kh6/do_we_really_sound_like_this/,youngdumbandbroke06,Do we really sound like this?,2745,0.95,394,,1688348794.0,False,False,False,False,False
70,14oujrt,clevercomebacks,/r/clevercomebacks/comments/14oujrt/maybe_hes_trying_to_wean_himself/,ElHanko,Maybe he’s trying to wean himself,31980,0.95,705,,1688320454.0,False,False,False,False,False
71,14p1ufy,movies,/r/movies/comments/14p1ufy/after_barbie_mattel_is_raiding_its_entire_toy_box/,indig0sixalpha,"After “Barbie,” Mattel Is Raiding Its Entire Toy Box",4648,0.92,935,,1688338513.0,False,False,False,False,False
72,14p1hf1,LivestreamFail,/r/LivestreamFail/comments/14p1hf1/bruce_argues_black_people_have_it_much_harder/,greenwhitehell,Bruce argues black people have it much harder than white people because he only made his first million at 20 years old,5066,0.86,765,,1688337581.0,False,False,False,False,False
73,14p3kfb,Damnthatsinteresting,/r/Damnthatsinteresting/comments/14p3kfb/triton_is_developing_the_130002_a_submersible/,skinte1,"TRITON is developing the 13000/2, a submersible with a full acrylic dome able to reach the Titanic at 12500ft.",16520,0.94,1379,,1688343068.0,False,False,False,False,False
74,14p9j31,blessedimages,/r/blessedimages/comments/14p9j31/bob/,Altacontuser_123,Bob,1402,0.88,100,,1688360773.0,False,False,False,False,False
75,14p4f3c,popculturechat,/r/popculturechat/comments/14p4f3c/taylor_swift_trashshamed_by_new_yorks_sanitation/,romeofantasy,Taylor Swift 'trash-shamed' by New York's Sanitation Department.,2999,0.92,238,,1688345478.0,False,False,False,False,False
76,14p8lys,Genshin_Impact,/r/Genshin_Impact/comments/14p8lys/shes_geo_fucking_finally/,dropnation40,SHE'S GEO FUCKING FINALLY,4161,0.98,361,:noelle: Making a shitton of regrettable builds:aloy:,1688357862.0,False,False,False,False,False
77,14oyif7,Eldenring,/r/Eldenring/comments/14oyif7/we_really_came_a_long_way_didnt_we/,Noxempire,We really came a long way didn't we?,8038,0.97,341,,1688330168.0,False,False,False,False,False
78,14p5p16,me_irlgbt,/r/me_irlgbt/comments/14p5p16/me_irlgbt/,burned_my_tongue,Me_irlgbt,2348,0.97,92,,1688349159.0,False,False,False,False,False
79,14p0wz0,baseball,/r/baseball/comments/14p0wz0/shohei_ohtani_hits_home_run_31_a_454ft_bomb_for/,Blazingbee98,"Shohei Ohtani hits home run #31, a 454ft bomb for the league leader in homers!",4634,0.96,557,TEAM CHAOS :CHAOS-wagon:,1688336119.0,False,False,False,False,False
80,14p28k2,Showerthoughts,/r/Showerthoughts/comments/14p28k2/it_must_be_really_humiliating_if_taylor_swift_or/,DokterZ,"It must be really humiliating if Taylor Swift or Adele dump you, but don't write a song about it.",3967,0.94,159,,1688339512.0,False,False,False,False,False
81,14p6lp8,BrandNewSentence,/r/BrandNewSentence/comments/14p6lp8/found_in_my_boyfriends_search_history_i_think_i/,South-Security-6664,found in my boyfriend's search history. i think i should break up w him.,6108,0.9,417,,1688351809.0,False,False,False,False,False
82,14owcor,starterpacks,/r/starterpacks/comments/14owcor/suburban_chain_restaurant_starter_pack/,DoritosDewItRight,Suburban chain restaurant starter pack,10396,0.96,745,,1688324857.0,False,False,False,False,False
83,14pcf98,ukraine,/r/ukraine/comments/14pcf98/kill_markings_on_the_german_provided_patriot/,Hannibal_Game,Kill Markings on the german provided Patriot battery in Ukraine,782,0.99,63,,1688370445.0,False,False,False,False,False
84,14p4zui,DeepRockGalactic,/r/DeepRockGalactic/comments/14p4zui/dont_know_if_anyones_posted_this_yet_but_i_had_a/,TwatToggler,"Don't know if anyone's posted this yet, but I had a laugh",2565,0.98,28,,1688347151.0,False,False,False,False,False
85,14ozjyf,whenthe,/r/whenthe/comments/14ozjyf/modern_gaming_is_dead_my_ass/,GroundbreakingAge225,Modern Gaming is dead my ass,8033,0.94,597,,1688332685.0,False,False,False,False,False
86,14p859u,anime_irl,/r/anime_irl/comments/14p859u/anime_irl/,canivola,anime_irl,1537,0.98,39,,1688356481.0,False,False,False,False,False
87,14p6p8m,distressingmemes,/r/distressingmemes/comments/14p6p8m/why_did_they_have_to_do_it/,lickmnut,Why did they have to do it,1927,0.98,64,,1688352092.0,False,False,False,False,False
88,14pcovp,Piracy,/r/Piracy/comments/14pcovp/its_just_a_small_monthly_payment_dude/,Itzmecaitlyn,"""Its just a small monthly payment dude""",718,0.95,43, ,1688371366.0,False,False,False,False,False
89,14p8txr,dankmemes,/r/dankmemes/comments/14p8txr/why_so_horny/,TimeWizardStudios,Why so horny?,3693,0.97,43,,1688358558.0,False,False,False,False,False
90,14p5ar4,HyruleEngineering,/r/HyruleEngineering/comments/14p5ar4/zelda_infinite_electricity_umpf_true_perpetual/,LunisequiouS,[Z.E.L.D.A.] INFINITE ELECTRICITY UMPF - True Perpetual Flight. Zero Battery Cost. No Despawning Parts. Fantastic Maneuverability. The Electrical Revolution is Here.,2304,0.98,150,,1688348005.0,False,False,False,False,False
91,14p7toq,HumansAreMetal,/r/HumansAreMetal/comments/14p7toq/rising_from_the_dead/,secretslut991,Rising from the dead,1567,0.96,27,,1688355474.0,False,False,False,False,False
92,14p8h6t,wholesomememes,/r/wholesomememes/comments/14p8h6t/upgrades_people/,DiligentKnocking,Upgrades people,3653,0.98,68,,1688357471.0,False,False,False,False,False
93,14p1e3u,leagueoflegends,/r/leagueoflegends/comments/14p1e3u/pov_you_dont_want_yuumi_as_your_support/,LexLawliet,POV you don't want Yuumi as your support,4156,0.96,194,,1688337336.0,False,False,False,False,False
94,14p03al,ATBGE,/r/ATBGE/comments/14p03al/the_garfield_bikini/,nerdy_birdie15,The Garfield Bikini,4766,0.95,114,,1688334032.0,True,False,False,False,False
95,14p7tk5,grandorder,/r/grandorder/comments/14p7tk5/tsukihime_confirmed_for_english_port/,AiasRider,Tsukihime confirmed for English port,1511,0.96,204,"
""Best Girl Since 2004""",1688355463.0,False,False,False,False,False
96,14parv2,ksi,/r/ksi/comments/14parv2/please_help_me/,Haiden9,Please help me,955,0.97,31,,1688364844.0,False,False,False,False,False
97,14pc0u2,CasualUK,/r/CasualUK/comments/14pc0u2/higgins_the_pheasant_update_shes_currently_sat_by/,thefreshbraincompany,Higgins the Pheasant update. She's currently sat by the window watching the bird table and the workmen next door. Tomorrow we begin the transfer over to her permanent residence.,753,0.97,22,,1688369022.0,False,False,False,False,False
98,14ovqhe,Whatcouldgowrong,/r/Whatcouldgowrong/comments/14ovqhe/laying_on_load_while_being_forklifted_up/,11stainless11,Laying on load while being forklifted up,10890,0.96,504,,1688323349.0,False,False,False,False,False
99,14pc2wc,pcmasterrace,/r/pcmasterrace/comments/14pc2wc/after_5_years_6162018_732023_my_precious_evga/,fray_27,"After 5 years (6/16/2018 - 7/3/2023), my precious EVGA 1080ti has finally bit the dust and may finally be at rest",754,0.97,104,,1688369220.0,False,False,False,False,False
100,14ovhk8,ProgrammerHumor,/r/ProgrammerHumor/comments/14ovhk8/offffaccurate/,huxx__,offffAccurate,10509,0.96,201,,1688322733.0,False,False,False,False,False
