rank,id,subreddit,permalink,author,title,score,upvote_ratio,num_comments,author_flair_text,created_utc,over_18,edited,stickied,locked,is_original_content
1,151gxot,Damnthatsinteresting,/r/Damnthatsinteresting/comments/151gxot/tom_cruises_movie_vanilla_sky_has_been_the_only/,Sami1398,"Tom Cruise's movie ""Vanilla Sky"" has been the only movie ever to get permission to shut down entire Times Square for any amount of time for shooting a movie, they paid $1 million and got 3 hours on a sunday morning to film Cruise running around in a dream sequence hallucinating an empty Times Square",13538,0.97,465,,1689539994.0,False,False,False,False,False
2,151gplj,funny,/r/funny/comments/151gplj/so_probably_not/,TheExtimate,So probably not,11445,0.94,335,,1689539459.0,True,False,False,False,False
3,151e739,WhitePeopleTwitter,/r/WhitePeopleTwitter/comments/151e739/if_you_create_a_rule_expect_it_to_be_used_against/,WhiteDiamondK,"If you create a rule, expect it to be used against you….",19624,0.95,643,,1689533594.0,False,False,False,False,False
4,151h0wf,clevercomebacks,/r/clevercomebacks/comments/151h0wf/straight_men_truly_couldnt_care_less_all/,Stoner4s3,Straight men truly couldn't care less all,8703,0.92,588,,1689540193.0,False,False,False,False,False
5,151f7wo,oddlysatisfying,/r/oddlysatisfying/comments/151f7wo/this_gentlemans_sheep_shearing_technique/,Rollo_Tomasi3000,This gentleman’s sheep shearing technique,10460,0.93,770,,1689535977.0,False,False,False,False,False
6,151cz37,nextfuckinglevel,/r/nextfuckinglevel/comments/151cz37/carlos_alcatraz_winning_his_first_wimbledon_at_20/,stinky_sardine,Carlos Alcatraz winning his first Wimbledon at 20 years of age! ,16352,0.94,574,,1689530674.0,False,False,False,False,False
7,151g43p,todayilearned,/r/todayilearned/comments/151g43p/til_nbc_offered_a_role_to_james_gandolfini_to/,AlbinNboat,"TIL NBC offered a role to James Gandolfini to replace Michael Scott on ""The Office"", but HBO paid him $3 million to not take the role",6301,0.97,256,,1689538070.0,False,False,False,False,False
8,151ih8x,facepalm,/r/facepalm/comments/151ih8x/it_is_amazing/,WoodenOpposites,It is amazing,4672,0.97,226,,1689543580.0,False,False,False,False,False
9,151a7nq,cats,/r/cats/comments/151a7nq/will_i_ever_be_able_to_eat_my_yogurt_alone_again/,alisongent,will i ever be able to eat my yogurt alone again???,23350,0.97,724,,1689524054.0,False,False,False,False,False
10,151j8z0,MadeMeSmile,/r/MadeMeSmile/comments/151j8z0/struggling_fan_meets_sean_astin_sam_gamgee_from/,TheKarmaFiend,Struggling fan meets Sean Astin (Sam Gamgee from Lord of the Rings),3597,0.99,185,,1689545448.0,False,False,False,False,False
11,151dot8,news,/r/news/comments/151dot8/tourists_flock_to_death_valley_to_experience/,ChocolateTsar,Tourists flock to Death Valley to experience possible world-record heat of 55C degrees,7330,0.96,1575,,1689532367.0,False,False,False,False,False
12,151cpow,worldnews,/r/worldnews/comments/151cpow/environmental_protesters_vandalize_superyacht_of/,mightydoomslayerca,Environmental protesters vandalize superyacht of Walmart heir Nancy Walton Laurie,7319,0.96,671,,1689530075.0,False,False,False,False,False
13,151a2si,TikTokCringe,/r/TikTokCringe/comments/151a2si/laundry_tips/,choganoga,Laundry tips,14024,0.89,1672,tHiS iSn’T cRiNgE,1689523713.0,False,False,False,False,False
14,1518wql,BeAmazed,/r/BeAmazed/comments/1518wql/amazing_variety_of_animals_come_to_drink_water_at/,CommercialBox4175,Amazing Variety Of Animals Come To Drink Water At Night,19879,0.97,604,,1689520808.0,False,False,False,False,False
15,151d0ae,mildlyinfuriating,/r/mildlyinfuriating/comments/151d0ae/my_dad_stepmom_and_stepsister_just_went_on/,Bro---really,"My dad, stepmom, and stepsister just went on vacation, leaving me with this mess (I reuse all my bowls, plates, etc, so NONE of this mess is mine)",7277,0.94,1278,,1689530747.0,False,False,False,False,False
16,1516z23,comics,/r/comics/comments/1516z23/ok_yeah_this_is_one_of_my_dumbest_oc/,TommySiegel,ok yeah this is one of my dumbest [OC],29143,0.95,247,,1689515919.0,False,False,False,False,False
17,151dwgn,Damnthatsinteresting,/r/Damnthatsinteresting/comments/151dwgn/the_puss_caterpillar_southern_flannel_moth_will/,Totally-avg,The Puss Caterpillar (Southern Flannel Moth) will fuck your world up. I grazed it twice while climbing on a float. NBD at first but an hour later I was hyperventilating on the bedroom floor. The pain was excruciating. DH took me to the ER and morphine did nothing.,24114,0.96,1368,,1689532879.0,False,False,False,False,False
18,151cyzm,PeterExplainsTheJoke,/r/PeterExplainsTheJoke/comments/151cyzm/i_dont_get_it/,Red_Neck_Slim_Jim,I don't get it,6608,0.96,94,,1689530668.0,False,False,False,False,False
19,151cnuj,tennis,/r/tennis/comments/151cnuj/wimbledon_mens_singles_final_1_c_alcaraz_d_2_n/,chespiotta,"Wimbledon, Men's Singles- Final - [1] C. Alcaraz d. [2] N. Djokovic 1-6, 7-6(6), 6-1, 3-6, 6-4",5723,0.95,2453,FAA-Dimi-Hubi-Med-Ruud-Matteo-Thiem-Big 3-DelPo-Cabal/Farah,1689529951.0,False,False,True,False,False
20,15181mo,memes,/r/memes/comments/15181mo/it_has_many_nutrient/,oranke_dino,It has many nutrient.,22303,0.97,308,Cringe Factory,1689518640.0,False,False,False,False,False
21,1518zgt,OneOrangeBraincell,/r/OneOrangeBraincell/comments/1518zgt/my_wife_took_this_amazing_photo/,Wettoasted,My wife took this amazing photo,10830,0.97,130,,1689520995.0,False,False,False,False,False
22,1519hc1,shitposting,/r/shitposting/comments/1519hc1/praise_spez_and_mrs_frizzle/,Gorotheninja,Praise Spez (and Mrs. Frizzle),12802,0.97,133,,1689522241.0,False,False,False,False,False
23,151fidi,oddlyterrifying,/r/oddlyterrifying/comments/151fidi/vegetables_shaped_like_humans/,Blueberry_Conscious_,Vegetables shaped like humans,3750,0.97,111,,1689536662.0,False,False,False,False,False
24,151d6r7,starterpacks,/r/starterpacks/comments/151d6r7/how_do_they_fuck_starter_pack/,Babufrak2,"""How do they fuck?"" starter pack",5361,0.92,214,,1689531184.0,False,False,False,False,False
25,151g6l0,ThatsInsane,/r/ThatsInsane/comments/151g6l0/after_winning_her_boxing_match_daniella_hemsley/,alanboston,After winning her boxing match Daniella Hemsley flashes her breasts on live TV,3276,0.91,267,,1689538231.0,True,False,False,False,False
26,15196j2,wholesomememes,/r/wholesomememes/comments/15196j2/free_sneks_or_another_awards_for_everyone/,----eclipse,free sneks or another awards for everyone!,15343,0.88,13811,,1689521485.0,False,False,False,False,False
27,1518pvp,WTF,/r/WTF/comments/1518pvp/i_have_no_fucking_idea/,AnnihilationOrchid,I have no fucking idea..,9824,0.92,713,,1689520322.0,False,False,False,False,False
28,15181bu,meirl,/r/meirl/comments/15181bu/me_irl/,Sonic_the_hedgedog,me_irl,12046,0.97,311,,1689518617.0,False,False,False,False,False
29,1518w2q,therewasanattempt,/r/therewasanattempt/comments/1518w2q/to_balance/,Dathird,to balance,9822,0.96,402,,1689520762.0,False,False,False,False,False
30,1518bgk,me_irlgbt,/r/me_irlgbt/comments/1518bgk/me_irlgbt/,thatguy9684736255,me_irlgbt,13727,0.88,337,Ace/Rainbow :ace-rainbow:,1689519332.0,False,False,False,False,False
31,1517pev,HolUp,/r/HolUp/comments/1517pev/luxury_car_security_feature/,Wololo--Wololo,Luxury car security feature,16416,0.95,340,,1689517780.0,False,False,False,False,False
32,1517jjm,politics,/r/politics/comments/1517jjm/donald_trump_brands_us_a_third_world_hellhole_run/,Key_Inevitable_2104,Donald Trump brands US a ‘third -world hellhole’ run by ‘perverts’ and ‘thugs’,10443,0.93,1787,:flag-ny: New York,1689517367.0,False,False,False,False,False
33,151hpj4,BlackPeopleTwitter,/r/BlackPeopleTwitter/comments/151hpj4/pronoun_game_is_strong_when_you_have_something_to/,Kelmo7,Pronoun game is strong when you have something to hide,2378,0.97,99,☑️,1689541747.0,False,False,False,False,False
34,151cork,AskReddit,/r/AskReddit/comments/151cork/what_is_one_thing_men_should_never_do_to_look/,siluoo,What is one thing men should never do to look attractive?,4279,0.92,2730,,1689530013.0,True,False,False,False,False
35,151crzt,Spiderman,/r/Spiderman/comments/151crzt/the_fact_this_is_my_favorite_mcu_spider_man/,Technical-Peak3394,The fact this is my favorite MCU Spider Man poster and i never knew this....,4246,0.96,69,,1689530233.0,False,False,False,False,False
36,15193so,space,/r/space/comments/15193so/analog_film_selfie_from_my_first_spacewalk_more/,astro_pettit,Analog film selfie from my first spacewalk. More details in comments.,6694,0.97,170,NASA Astronaut,1689521305.0,False,False,False,False,True
37,1516hx0,FunnyandSad,/r/FunnyandSad/comments/1516hx0/somebody_needs_to_check_for_a_pulse/,Comfortablejack,Somebody needs to check for a pulse,17485,0.9,232,,1689514606.0,False,False,False,False,False
38,151f8cx,anime_irl,/r/anime_irl/comments/151f8cx/anime_irl/,yokiyokin,anime_irl,2946,0.97,88,,1689536005.0,False,False,False,False,False
39,151dfjo,whenthe,/r/whenthe/comments/151dfjo/i_dont_think_no_rules_its_the_best_argument_in/,yoshbiscut69,I don’t think “no rules” it’s the best argument in court,4104,0.98,216,"what font is that, where are you people making these?",1689531760.0,False,False,False,False,False
40,151cqp5,WhitePeopleTwitter,/r/WhitePeopleTwitter/comments/151cqp5/moms_for_fascism_and_bullying_gay_kids_to_death/,TrumpterOFyvie,Moms For Fascism and Bullying Gay Kids To Death,11365,0.98,257,,1689530143.0,False,False,False,False,False
41,151bkte,PublicFreakout,/r/PublicFreakout/comments/151bkte/good_ole_texas/,fonsbark,Good ole Texas,4707,0.95,606,,1689527367.0,True,False,False,False,False
42,1516bsv,Unexpected,/r/Unexpected/comments/1516bsv/professional_musicians_wont_miss_a_beat/,jucapolito,Professional musicians won’t miss a beat,13421,0.96,430,,1689514141.0,False,False,False,False,False
43,151cnhb,sports,/r/sports/comments/151cnhb/carlos_alcaraz_defeats_novak_djokovic_in_five/,nolesfan2011,Carlos Alcaraz Defeats Novak Djokovic in Five Sets to Win Wimbledon,3864,0.95,321,:MLBnym: New York Mets,1689529926.0,False,False,False,False,False
44,1517f4l,OUTFITS,/r/OUTFITS/comments/1517f4l/is_this_fit_cute_for_a_bbq_or_too_much_my_crush/,moonlightfawn444,is this fit cute for a BBQ or too much? my crush is going to be there 🫠,30157,0.75,492,Newcomer (3 posts),1689517063.0,False,False,False,True,False
45,151g7or,inthenews,/r/inthenews/comments/151g7or/florida_losing_tourist_money_to_other_states/,audiomuse1,Florida losing tourist money to other states,2462,0.95,371,,1689538295.0,False,False,False,False,False
46,1517ynt,NoahGetTheBoat,/r/NoahGetTheBoat/comments/1517ynt/guy_pushes_61year_old_man_on_the_subway_and_this/,CEOofBiafra,Guy pushes 61-year old man on the subway and this is what he has to say for himself. Disgusting.,8879,0.95,1051,,1689518428.0,False,False,False,False,False
47,151656o,PrequelMemes,/r/PrequelMemes/comments/151656o/star_wars_is_for_all/,CaptainTechno_,Star wars is for all,15651,0.94,307,,1689513624.0,False,False,False,False,False
48,1519bi1,maybemaybemaybe,/r/maybemaybemaybe/comments/1519bi1/maybe_maybe_maybe/,licer71,Maybe Maybe Maybe,6805,0.92,1859,,1689521834.0,False,False,False,False,False
49,15180sx,BrandNewSentence,/r/BrandNewSentence/comments/15180sx/probably_not_a_good_idea/,Existentialidiot83,Probably not a good idea.,8604,0.95,175,,1689518578.0,False,False,False,False,False
50,151g8bt,LateStageCapitalism,/r/LateStageCapitalism/comments/151g8bt/when_you_look_at_the_most_vulnerable_people_in/,irate-librarian,When you look at the most vulnerable people in our society and just see skin sacks for art practice.,2357,0.98,86,,1689538335.0,False,False,False,False,False
51,1517gko,Jokes,/r/Jokes/comments/1517gko/a_man_walks_out_to_the_street_and_catches_a_taxi/,HelpingHandsUs,"A man walks out to the street and catches a taxi just going by. He gets into the taxi, and the cabbie says, ""Perfect timing. You're just like Frank.""",8191,0.95,155,,1689517167.0,False,False,False,False,False
52,1513uur,OldSchoolCool,/r/OldSchoolCool/comments/1513uur/the_animators_from_behind_the_scenes_of_akira/,MulciberTenebras,"The animators from behind the scenes of ""AKIRA"" (1988), showing the process of hand-painting the backgrounds and individual cel animations",25770,0.97,754,,1689506737.0,False,False,False,False,False
53,1514pr4,antiwork,/r/antiwork/comments/1514pr4/heat_exhaustion_killed_my_coworker_and_theyre/,LadyLee69,Heat exhaustion killed my coworker and they're covering it up,16783,0.94,984,,1689509461.0,False,1689528323.0,False,False,False
54,1516k8q,JustGuysBeingDudes,/r/JustGuysBeingDudes/comments/1516k8q/how_to_pick_up_girls_101/,flattenedbricks,How to pick up girls 101,10382,0.95,146,Lego Bricks,1689514789.0,False,False,False,False,False
55,151dzbm,2meirl4meirl,/r/2meirl4meirl/comments/151dzbm/2meirl4meirl/,hornmelon,2meirl4meirl,3004,0.98,26,,1689533067.0,False,False,False,False,False
56,151d591,DiWHY,/r/DiWHY/comments/151d591/flayer_of_thighs_cracker_of_nuts_cutter_of_toes/,balbertborring,"Flayer of Thighs, Cracker of Nuts, Cutter of Toes, Pincher of Butts",3159,0.95,113,,1689531078.0,False,False,False,False,False
57,151f00y,WorkReform,/r/WorkReform/comments/151f00y/we_need_a_nationwide_strike_for_all_industries/,ThatsMrPotatoHeadtoU,We need a nationwide strike for all industries,2456,0.97,48,,1689535459.0,False,False,False,False,False
58,151h4ds,PoliticalHumor,/r/PoliticalHumor/comments/151h4ds/sad_but_true/,Bertiers_Moma,"Sad, But True....",1899,0.92,182,,1689540412.0,False,False,False,False,False
59,151diex,technology,/r/technology/comments/151diex/finland_introduces_the_worlds_first_phonefree/,fchung,Finland introduces the world’s first phone-free tourist island,2925,0.92,158,,1689531948.0,False,False,False,False,False
60,151awqy,MadeMeSmile,/r/MadeMeSmile/comments/151awqy/squirrel_restaurant/,Godfathermafia,Squirrel Restaurant ,14602,0.95,442,,1689525755.0,False,False,False,False,False
61,1517wgf,oddlyspecific,/r/oddlyspecific/comments/1517wgf/a_drooling_socialist_cuck/,Existentialidiot83,A drooling socialist cuck 🤔,7112,0.96,222,,1689518273.0,False,False,False,False,False
62,151g31m,CrazyFuckingVideos,/r/CrazyFuckingVideos/comments/151g31m/compilation_of_beirut_warehouse_explosion_from/,blkmgk533,Compilation of Beirut Warehouse Explosion From Virtually Every Source of Recording,2143,0.97,137,,1689537999.0,False,False,False,False,False
63,1519d80,baseball,/r/baseball/comments/1519d80/woman_and_her_family_got_ejected_in_the_first/,GroMicroBloom,Woman and her family got ejected in the first game of the doubleheader for this catch,4976,0.95,1795,Tampa Bay Devil Rays :tbr3:,1689521960.0,False,False,False,False,False
64,151atxw,OrphanCrushingMachine,/r/OrphanCrushingMachine/comments/151atxw/clearly_cops_dont_have_the_budget_for_that/,jericho601,Clearly cops don't have the budget for that themselves...,4158,0.94,132,,1689525577.0,False,False,False,False,False
65,15144jq,NatureIsFuckingLit,/r/NatureIsFuckingLit/comments/15144jq/aerial_view_of_a_group_of_basking_sharks_a/,SinjiOnO,"🔥 Aerial view of a group of Basking Sharks, a relatively rare sighting as they're predominately solitary creatures",15891,0.97,246,:parrot:,1689507631.0,False,False,False,False,False
66,151gn8g,ContagiousLaughter,/r/ContagiousLaughter/comments/151gn8g/1_rep_for_20/,ValarMorcoolis,1 rep for $20,1904,0.97,41,,1689539307.0,False,False,False,False,False
67,1516qzm,wallstreetbets,/r/wallstreetbets/comments/1516qzm/cybertruck_spotted_in_the_wildloading_calls/,coryf03,Cybertruck spotted in the wild…loading calls,7554,0.95,294,,1689515304.0,False,False,False,False,False
68,151cdby,CasualUK,/r/CasualUK/comments/151cdby/am_i_being_thick/,dpm_259,Am I being thick?,3254,0.96,789,,1689529260.0,False,False,False,False,False
69,151cv1c,texas,/r/texas/comments/151cv1c/census_confirmed_latinos_now_the_majority_in_texas/,Lostlobster8,Census Confirmed. Latinos now the majority in Texas.,2947,0.94,472,,1689530430.0,False,False,False,False,False
70,151dyae,Tinder,/r/Tinder/comments/151dyae/is_this_a_weird_way_to_meet_someone_for_the_first/,100problemss,Is this a weird way to meet someone for the first time?,2595,0.97,400,,1689532999.0,False,False,False,False,False
71,1519kvr,facepalm,/r/facepalm/comments/1519kvr/look_how_clever_i_am_i_even_know_chess/,BaronVonBroccoli,"Look how clever I am, I even know Chess.",25401,0.9,2331,,1689522486.0,False,False,False,False,False
72,151gdde,NonPoliticalTwitter,/r/NonPoliticalTwitter/comments/151gdde/phew/,lhomme21,Phew,1944,0.98,65,:blue1::blue2::1111::1112:,1689538662.0,False,False,False,False,False
73,151beuk,DunderMifflin,/r/DunderMifflin/comments/151beuk/oscar_was_wild_for_this/,nikulmmadhu,Oscar was wild for this,3543,0.98,62,,1689526972.0,False,False,False,False,False
74,151cuyg,KingOfTheHill,/r/KingOfTheHill/comments/151cuyg/propane_propane_accessories_strickland_propane/,MiddleofInfinity,Propane & propane accessories. Strickland Propane,2857,0.97,146,,1689530425.0,False,False,False,False,False
75,15173pv,PS5,/r/PS5/comments/15173pv/phil_spencer_we_are_pleased_to_announce_that/,Turbostrider27,Phil Spencer: We are pleased to announce that Microsoft and @PlayStation have signed a binding agreement to keep Call of Duty on PlayStation following the acquisition of Activision Blizzard. We look forward to a future where players globally have more choice to play their favorite games.,6695,0.92,2897,,1689516236.0,False,False,False,False,False
76,1513zh5,NewsOfTheStupid,/r/NewsOfTheStupid/comments/1513zh5/donald_trump_claims_the_american_dream_is_dead/,Misguided_Society,Donald Trump claims the American dream is ‘dead’ - stating the US a ‘third -world hellhole’ run by ‘perverts’ and ‘thugs’,18740,0.85,4880,,1689507155.0,False,False,False,False,False
77,15152hu,tumblr,/r/tumblr/comments/15152hu/black_holes_arent_planet_gluttons_you_bitch/,SaraAnnabelle,"Black holes aren't planet gluttons, you bitch",11996,0.96,244,,1689510566.0,False,False,False,False,False
78,1519pnw,BeAmazed,/r/BeAmazed/comments/1519pnw/the_kiffness_the_roadrager_and_a_7_nation_army/,purple-circle,"The Kiffness, the road-rager and a 7 nation army",13453,0.95,227,,1689522820.0,False,False,False,False,False
79,1514g0o,marvelmemes,/r/marvelmemes/comments/1514g0o/they_couldve_used_a_prop_for_the_gun_atleast/,GAMMAGREEN62,They could've used a prop for the gun atleast...,17478,0.9,1163,Avengers,1689508663.0,False,False,False,False,False
80,151aibr,TheLastAirbender,/r/TheLastAirbender/comments/151aibr/im_not_the_only_one_right/,AvatarRohan2025,"I'm not the only one, right?",3800,0.97,177,,1689524778.0,False,False,False,False,False
81,1517s96,technicallythetruth,/r/technicallythetruth/comments/1517s96/to_be_fair_not_many_humans_know_either/,uguystookeveryname,"To be fair, not many humans know either.",5886,0.98,53,,1689517970.0,False,False,False,False,False
82,151g29m,Superstonk,/r/Superstonk/comments/151g29m/so_has_anyone_talked_about_citadel_securities/,jhs0108,So has anyone talked about Citadel Securities massive increase in the Notional Amount of their Derivatives over the last few years yet? Cause I just found out about it and holy cow this could be big.,2111,0.96,158,,1689537949.0,False,False,False,False,False
83,1517iyh,Genshin_Impact,/r/Genshin_Impact/comments/1517iyh/all_69_characters_specialist_dance_before_fontaine/,Stealthless,ALL 69 Characters Specialist Dance before Fontaine,6474,0.93,317,:keqing::kokomi:,1689517324.0,False,False,False,False,False
84,1516ij6,interesting,/r/interesting/comments/1516ij6/giant_squid_makes_an_appearance_in_tokyo_bay/,MetsX2000,Giant Squid makes an appearance in Tokyo Bay,7249,0.96,386,,1689514656.0,False,False,False,False,False
85,151632h,ImTheMainCharacter,/r/ImTheMainCharacter/comments/151632h/yelling_bomb_in_the_middle_of_the_busy_airport/,Best_Needleworker530,Yelling “bomb” in the middle of the busy airport for TikTok views,8795,0.79,712,,1689513464.0,False,False,False,True,False
86,151ebyg,pics,/r/pics/comments/151ebyg/well_john_oliver_says_i_need_to_burn_my_38k_coins/,topgun966,Well John Oliver says I need to burn my 38K coins I have been hoarding. So will be burning them here,2075,0.78,3123,,1689533923.0,False,False,False,False,False
87,151az1c,nextfuckinglevel,/r/nextfuckinglevel/comments/151az1c/how_this_guys_handles_the_alligator/,argetlam5,How this guys handles the alligator,9005,0.94,570,,1689525917.0,False,False,False,False,False
88,151c3pi,AnimalsBeingDerps,/r/AnimalsBeingDerps/comments/151c3pi/its_slippery_in_here_mom/,IUMogg,"It’s slippery in here, mom ",2669,0.96,33,,1689528625.0,False,False,False,False,False
89,151eg5q,discordVideos,/r/discordVideos/comments/151eg5q/cmon_you_sons_of_bitches_do_you_wanna_live_forever/,iammrpingas,C’mon you sons of bitches. Do you wanna live forever?,2041,0.97,123,,1689534170.0,False,False,False,False,False
90,15172o2,pettyrevenge,/r/pettyrevenge/comments/15172o2/had_the_roommate_from_hell_and_couldnt_get_rid_of/,ThisIsMyCircus40,Had the roommate from hell and couldn't get rid of her so I made living with me as miserable as possible.,5461,0.94,308,,1689516162.0,False,1689520547.0,False,False,False
91,151fq0s,LeopardsAteMyFace,/r/LeopardsAteMyFace/comments/151fq0s/fox_news_host_confronts_trump_over_his_failed/,MasterfulBJJ,Fox News host confronts Trump over his failed campaign promises: ‘You didn’t drain the swamp like you said you would’,1656,0.98,104,,1689537163.0,False,False,False,False,False
92,151b35w,mildlyinfuriating,/r/mildlyinfuriating/comments/151b35w/this_cheap_glass_we_bought_from_the_dollar_store/,chikinbizkit,"This cheap glass we bought from the dollar store fell out of our cabinet and onto the stove top today. Instead of the glass shattering, it put a sizeable dent in our metal stove top. Glass is still fully intact, not even scratched.",8269,0.95,387,,1689526208.0,False,False,False,False,False
93,151h7os,4chan,/r/4chan/comments/151h7os/bald_anon_wants_a_hot_gf/,ContentOpinionz,bald anon wants a hot gf,1393,0.96,79,,1689540622.0,False,False,False,False,False
94,151f5ja,19684,/r/19684/comments/151f5ja/investment_rule/,spoedle73,Investment rule,1805,0.98,67,,1689535828.0,False,False,False,False,False
95,151ezvg,formuladank,/r/formuladank/comments/151ezvg/newey_is_about_to_do_something_very_comical/,drsanandreas,Newey is about to do something very comical,1805,0.99,87,BWOAHHHHHHH ,1689535451.0,False,False,False,False,False
96,151biin,IllegallySmolCats,/r/IllegallySmolCats/comments/151biin/ophelia_the_day_i_picked_her_up/,destielwhitewolf,Ophelia the day I picked her up,2737,0.98,39,,1689527211.0,False,False,False,False,False
97,15173og,terriblefacebookmemes,/r/terriblefacebookmemes/comments/15173og/why_do_they_hate_therapy_so_much/,jeonteskar,Why do they hate therapy so much?,6003,0.88,550,,1689516233.0,False,False,False,False,False
98,151afo5,PoliticalCompassMemes,/r/PoliticalCompassMemes/comments/151afo5/2024_is_going_to_be_between_two_shitty_candidates/,mrducky78,2024 is going to be between two shitty candidates again. Same as it ever was.,3166,0.89,585,:left: - Left,1689524598.0,False,False,False,False,False
99,1519e8h,nba,/r/nba/comments/1519e8h/charania_phoenix_is_trading_g_cam_payne_a/,PlayaSlayaX,"[Charania] Phoenix is trading G Cam Payne, a second-round pick and cash to San Antonio, sources tell @TheAthletic @Stadium.",3477,0.96,604,:sas-3: Spurs,1689522028.0,False,False,False,False,False
100,1517jgs,yesyesyesyesno,/r/yesyesyesyesno/comments/1517jgs/trying_not_to_get_wet_while_popping_ballons/,habichuelacondulce,Trying not to get wet while popping ballons,4710,0.92,125,,1689517362.0,False,False,False,False,False
