rank,id,subreddit,permalink,author,title,score,upvote_ratio,num_comments,author_flair_text,created_utc,over_18,edited,stickied,locked,is_original_content
1,14iepeb,WhitePeopleTwitter,/r/WhitePeopleTwitter/comments/14iepeb/the_new_predator_movie_just_dropped/,rhodesleadnowhere,The new predator movie just dropped,9702,0.95,457,,1687673916.0,False,False,False,False,False
2,14icv54,antiwork,/r/antiwork/comments/14icv54/and_this_is_why_there_is_a_rush_to_get_us_back_in/,Vdaniels1,And this is why there is a rush to get us back in the office,9835,0.96,847,,1687667684.0,False,False,False,False,False
3,14ie2lj,memes,/r/memes/comments/14ie2lj/ghost_of_medieval_tsushima/,big-daddy-virgin,Ghost of Medieval Tsushima,10524,0.96,104,,1687671717.0,False,False,False,False,False
4,14ibzrf,PrequelMemes,/r/PrequelMemes/comments/14ibzrf/sucks_that_we_are_on_ewansposting_instead_of/,nickonreddit123,Sucks that we are on ewansposting instead of businesses as usual.,21902,0.92,157,,1687664862.0,False,False,False,False,False
5,14ifj46,shitposting,/r/shitposting/comments/14ifj46/glory_to_spez/,ligma-joe,Glory to Spez,5342,0.97,80,,1687676793.0,False,False,False,False,False
6,14idobu,facepalm,/r/facepalm/comments/14idobu/utilize_your_brain/,No_Incident8665,Utilize your brain… 🤔,9195,0.96,1314,,1687670408.0,False,False,False,False,False
7,14idjrl,BeAmazed,/r/BeAmazed/comments/14idjrl/amazing_octopus_stretching_its_tentacles_to_form/,XahidX,Amazing Octopus stretching its tentacles to form a huge balloon,6849,0.98,236,,1687669967.0,False,False,False,False,False
8,14id1l7,NonPoliticalTwitter,/r/NonPoliticalTwitter/comments/14id1l7/how_true_is_this/,lhomme21,How true is this,7231,0.94,335,:blue1::blue2::1111::1112:,1687668289.0,False,False,False,False,False
9,14i8s1q,Damnthatsinteresting,/r/Damnthatsinteresting/comments/14i8s1q/what_happens_when_you_throw_an_apple_from_an/,ledim35,What happens when you throw an apple from an offshore oil rig,56529,0.92,1462,,1687654922.0,False,False,False,False,False
10,14ibqfj,dankmemes,/r/dankmemes/comments/14ibqfj/fuck_this_shit_show/,thetruememeisbest,fuck this shit show,11880,0.97,159,:nu:☣️,1687664024.0,False,False,False,False,False
11,14i9cd2,gaming,/r/gaming/comments/14i9cd2/good_or_bad_games_it_doesnt_matter_i_have_massive/,Modo97,"Good or bad games? it doesn't matter, I have massive respect for games that still support Split-Screen ❤️",20736,0.92,757,,1687656612.0,False,False,False,False,False
12,14ifpzi,AnimalsBeingDerps,/r/AnimalsBeingDerps/comments/14ifpzi/baby_camel_wants_to_nurse/,jemahAeo,Baby camel wants to nurse,3676,0.97,48,,1687677483.0,False,False,False,False,False
13,14ihykp,HolUp,/r/HolUp/comments/14ihykp/dude_wtf/,esberat,"Dude, wtf...",2460,0.97,194,:zfg1::zfg2::zfg3::zfg4:,1687685454.0,False,False,False,False,False
14,14i9t97,ContagiousLaughter,/r/ContagiousLaughter/comments/14i9t97/its_on/,Cholai_214,It's on ,18992,0.92,594,,1687658016.0,False,False,False,False,False
15,14idvya,TikTokCringe,/r/TikTokCringe/comments/14idvya/stone_fish_venom/,Sylas1987,Stone fish venom,4910,0.97,306,,1687671104.0,False,False,False,False,False
16,14iaau6,meirl,/r/meirl/comments/14iaau6/me_irl/,RogalikYT,Me irl,11495,0.97,151,,1687659508.0,False,False,False,False,False
17,14iasvz,RandomThoughts,/r/RandomThoughts/comments/14iasvz/do_u_ever_feel_kinda_compelled_to_write_ur/,chesnutpraline,do u ever feel kinda compelled to write ur opinion in a comment but then get kinda tired while writing it and give up after deciding u dont really care enough in the moment to comment and erase it?,9296,0.92,1188,,1687661058.0,False,False,False,False,False
18,14ib9x3,comics,/r/comics/comments/14ib9x3/napsoc/,Sleepy-wun,Naps…[OC],7616,0.95,73,,1687662542.0,False,False,False,False,False
19,14ibngc,news,/r/news/comments/14ibngc/south_carolina_fire_chief_who_pointed_gun_at/,Molire,South Carolina fire chief who pointed gun at teens who turned in his driveway is being sued,6421,0.97,234,,1687663762.0,False,False,False,False,False
20,14i83ko,mildlyinfuriating,/r/mildlyinfuriating/comments/14i83ko/roofers_picked_all_my_fruit/,Bayareathrifted,Roofers picked all my fruit,24564,0.93,1781,,1687652877.0,False,False,False,False,False
21,14i8cnl,wallstreetbets,/r/wallstreetbets/comments/14i8cnl/found_my_new_side_hustle/,rylar,found my new side hustle,14595,0.95,218,Supports a 🅱️arfield Ethnostate :Barfield:,1687653638.0,False,False,False,False,False
22,14id129,funny,/r/funny/comments/14id129/shaq_pancake_art/,FlippinArtDude,Shaq pancake art,4916,0.94,72,,1687668234.0,False,False,False,False,False
23,14icqia,worldnews,/r/worldnews/comments/14icqia/canadians_will_no_longer_have_access_to_news/,N2929,"Canadians will no longer have access to news content on Facebook and Instagram, Meta says",4986,0.97,387,,1687667279.0,False,False,False,False,False
24,14if1na,TwoXChromosomes,/r/TwoXChromosomes/comments/14if1na/update_my_husband_left_me_at_the_hospital_after/,back2backjon,UPDATE My husband left me at the hospital after stillbirth,3216,0.93,201,,1687675091.0,False,1687675454.0,False,False,False
25,14iawpv,oddlyterrifying,/r/oddlyterrifying/comments/14iawpv/pet_king_cobra_gets_angry_at_owner/,RIPStengel,Pet king cobra gets angry at owner.,8812,0.95,421,,1687661397.0,False,False,False,False,False
26,14i7i01,MadeMeSmile,/r/MadeMeSmile/comments/14i7i01/helping_mommy/,IkilledRichieWhelan,Helping Mommy,40615,0.91,436,,1687651171.0,False,False,False,False,False
27,14ie1xe,lotrmemes,/r/lotrmemes/comments/14ie1xe/one_does_not_simply_assume_a_game_is_a_cash_grab/,BJ_Beamz,One does not simply assume a game is a cash grab,3866,0.96,133,Grond,1687671656.0,False,False,False,False,False
28,14ibf9l,cats,/r/cats/comments/14ibf9l/can_someone_explain_to_me_why_my_cat_will_just/,takeaabreath,Can someone explain to me why my cat will just sit and stare at me for minutes at a time? What does this mean in a cat’s world?,6377,0.98,557,,1687663019.0,False,False,False,False,False
29,14i7iu6,space,/r/space/comments/14i7iu6/i_grew_up_amazed_by_the_famous_pillars_of/,theillini19,I grew up amazed by the famous Pillars of Creation photo of the Hubble Space Telescope. I never imagined I would one day be able to capture this nebula from my backyard.,13853,0.96,186,,1687651234.0,False,False,False,False,False
30,14ijd92,todayilearned,/r/todayilearned/comments/14ijd92/til_that_sigourney_weaver_only_earned_35000_for/,Make_the_music_stop,"TIL that Sigourney Weaver only earned $35,000 for Alien (1979) but got $1,000,000 and a share of the profits for Aliens (1986)",1412,0.99,44,,1687690510.0,False,False,False,False,False
31,14ic6sh,HumansBeingBros,/r/HumansBeingBros/comments/14ic6sh/a_spooked_horse_found_itself_stuck_in_a_swimming/,alanboston,A spooked horse found itself stuck in a swimming pool in Florida. The county's fire rescue team jumped into action,4903,0.94,187,,1687665508.0,False,False,False,False,False
32,14i6935,oddlysatisfying,/r/oddlysatisfying/comments/14i6935/beautiful_4464ct_amethyst/,Gh0stDestr0y,Beautiful 44.64CT Amethyst,30919,0.95,358,Flair Loading...,1687647709.0,False,False,False,False,False
33,14id7jw,Superstonk,/r/Superstonk/comments/14id7jw/why_i_love_this_company/,GinoF2020,Why I love this company,4610,0.93,100,,1687668859.0,False,False,False,False,False
34,14ibjba,Weird,/r/Weird/comments/14ibjba/opened_a_can_of_peaches_and_they_were_black_and/,Elly_frog,opened a can of peaches and they were black and smelt like fish??,5282,0.94,1305,,1687663376.0,False,False,False,False,False
35,14ibsi7,PublicFreakout,/r/PublicFreakout/comments/14ibsi7/man_wielding_some_kind_of_massive_blade_almost/,NextRace6,Man Wielding Some Kind of Massive Blade Almost Finds Out During Road Rage in Texas,4789,0.98,336,,1687664221.0,False,False,False,False,False
36,14idq5f,clevercomebacks,/r/clevercomebacks/comments/14idq5f/stealing_is_wrong/,Evermoreunlive52,Stealing is wrong?,3336,0.97,30,,1687670572.0,False,False,False,False,False
37,14i6eo3,quityourbullshit,/r/quityourbullshit/comments/14i6eo3/the_reddit_admins_believe_that_this_sub_is_for/,Devonmartino,"The Reddit admins believe that this sub is for them, not ordinary Redditors, and we are happy to oblige: From now on, all QYBS posts must be related to lies/BS about Reddit, Reddit Inc., its admins, and related topics.",20483,0.85,908,Source: I made it up,1687648142.0,False,1687648383.0,True,False,False
38,14i6wnc,OldSchoolCool,/r/OldSchoolCool/comments/14i6wnc/one_of_my_friend_groups_from_high_school_class_of/,dustin91,"One of my friend groups from high school, class of ‘87 (pic from ‘88 or ‘89)",12879,0.94,678,,1687649487.0,False,False,False,False,False
39,14i994d,ukraine,/r/ukraine/comments/14i994d/least_year_russian_occupiers_kidnapped_16yo/,ibloodylovecider,"Least year, russian occupiers kidnapped 16yo Tigran Oganesyan and his friend. Today, they took revenge, two Russians occupiers in the Russian-occupied city of Berdyanskwete killed. This video was recorded before the teens were killed in a shoot-out with the police. RIP heroes that were too young 🌻",7114,0.94,201,UK,1687656341.0,True,False,False,False,False
40,14iamye,technicallythetruth,/r/technicallythetruth/comments/14iamye/it_does_indeed_look_just_like_ahem_a_quarter_note/,LucidCunning,It does indeed look just like... *ahem...* a quarter note.,5812,0.96,195,,1687660550.0,False,False,False,False,False
41,14ii258,ich_iel,/r/ich_iel/comments/14ii258/ich_iel/,hypefor8wasjustabait,ich_iel,1314,0.97,53,,1687685809.0,True,False,False,False,False
42,14iatn6,HyruleEngineering,/r/HyruleEngineering/comments/14iatn6/thatll_be_250k_please/,itsbildo,That'll be $250k please,4729,0.94,115,,1687661122.0,False,False,False,False,False
43,14i8ag8,TedLasso,/r/TedLasso/comments/14i8ag8/id_like_to_think_all_of_our_lives_changed_after/,fn_bot17,I’d like to think all of our lives changed after Ted Lasso,7616,0.92,315,,1687653444.0,False,False,False,False,False
44,14iavsq,baseball,/r/baseball/comments/14iavsq/david_fletcher_hr_makes_it_230_angels_in_the_4th/,TVloverCam,DAVID FLETCHER HR MAKES IT 23-0 ANGELS IN THE 4TH!!,4254,0.95,437,Los Angeles Angels :laa1:,1687661313.0,False,False,False,False,False
45,14iguum,NatureIsFuckingLit,/r/NatureIsFuckingLit/comments/14iguum/furcifer_pardalis_commonly_known_as_the_panther/,therra123,"🔥 Furcifer pardalis, commonly known as the panther chameleon, is primarily found in eastern and northern regions of Madagascar",1413,0.98,37,,1687681519.0,False,False,False,False,False
46,14iaqhi,Genshin_Impact,/r/Genshin_Impact/comments/14iaqhi/the_perfect_transition_of_71_characters_by/,soulsilk524,The Perfect Transition of 71 Characters by MMOJACKX57 YT,4615,0.94,94,,1687660857.0,False,False,False,False,False
47,14i5ro7,nextfuckinglevel,/r/nextfuckinglevel/comments/14i5ro7/a_protagonistlevel_shot/,TheDancingDoge,A Protagonist-Level Shot,13213,0.96,271,,1687646374.0,False,False,False,False,False
48,14ihh22,starterpacks,/r/starterpacks/comments/14ihh22/getting_the_flu_within_your_first_two_weeks_of/,confidentmilktoast,“Getting the flu within your first two weeks of starting a new job” Starter Pack.,1238,0.97,63,,1687683710.0,False,False,False,False,False
49,14i8oc3,Damnthatsinteresting,/r/Damnthatsinteresting/comments/14i8oc3/video_footage_from_a_previous_titan_journey/,BlueMagma212,Video footage from a previous Titan journey ,44374,0.9,2010,,1687654629.0,False,False,False,False,False
50,14id4ee,UpliftingNews,/r/UpliftingNews/comments/14id4ee/most_unionized_us_rail_workers_now_have_new_sick/,Karmanacht,Most unionized US rail workers now have new sick leave,2664,0.96,84,,1687668559.0,False,False,False,False,False
51,14i5m85,therewasanattempt,/r/therewasanattempt/comments/14i5m85/to_pet_a_snapping_turtle/,VariousBasket125,To pet a snapping turtle ,13008,0.95,833,This is a flair,1687645963.0,False,False,False,False,False
52,14i5twb,HydroHomies,/r/HydroHomies/comments/14i5twb/not_a_hydrohomie/,happyfuckincakeday,Not a Hydrohomie,11881,0.95,655,,1687646544.0,False,False,False,False,False
53,14ih1ec,technology,/r/technology/comments/14ih1ec/american_tiktok_user_data_stored_in_china_video/,callmeteji,"American TikTok user data stored in China, video app admits",1303,0.93,140,,1687682170.0,False,False,False,False,False
54,14ic2fe,Grimdank,/r/Grimdank/comments/14ic2fe/the_fire_of_vulcan_burns_brothers/,YaGrimboi,The fire of Vulcan burns brothers,3226,0.96,126,,1687665099.0,False,False,False,False,False
55,14i6y0l,AnarchyChess,/r/AnarchyChess/comments/14i6y0l/no_idea_how_this_is_still_happening_but_id_this/,Not_a_trowaway12323,"No idea how this is still happening, but I'd this post gets 65,536 comments I'll post again with double the amount of demented horses",12961,0.8,11938,:cutehorse:,1687649589.0,False,False,False,False,False
56,14idjlv,ThatsInsane,/r/ThatsInsane/comments/14idjlv/stone_fish_venom/,Sylas1987,Stone fish venom,2416,0.96,90,,1687669949.0,False,False,False,False,False
57,14i3oy1,agedlikemilk,/r/agedlikemilk/comments/14i3oy1/3200_year_old_cheese_found_in_an_egyptian_tomb/,ChanceryTheRapper,3200 year old cheese found in an Egyptian tomb,28209,0.94,1385,,1687640930.0,False,False,False,False,False
58,14i6aee,LateStageCapitalism,/r/LateStageCapitalism/comments/14i6aee/this_is_how_you_do_it/,futurefemboy3,This is how you do it,8558,0.95,253,,1687647803.0,False,False,False,False,False
59,14i90a1,nursing,/r/nursing/comments/14i90a1/anyone_hiring/,Frosty-Fact21,Anyone hiring?,5027,0.95,267,"BSN, RN 🍕",1687655629.0,False,False,False,False,False
60,14i9aey,WTF,/r/WTF/comments/14i9aey/uhh_wtf_is_this/,Full_Guava_4780,Uhh wtf is this,4900,0.94,814,,1687656444.0,False,False,False,False,False
61,14i7ycb,AmItheAsshole,/r/AmItheAsshole/comments/14i7ycb/aita_for_being_pissed_there_was_no_alcohol_at_a/,NoAlcWedding12345,AITA for being pissed there was no Alcohol at a wedding,8230,0.79,5720,,1687652446.0,False,False,False,False,False
62,14i6i11,conservativeterrorism,/r/conservativeterrorism/comments/14i6i11/the_enemy_within_as_this_anti_american_gorilla_is/,waxjammer,The enemy within as this Anti American gorilla is essentially undermining our intelligence and CIA with reckless disregard for our national security interests.,7773,0.92,591,,1687648397.0,False,False,False,False,False
63,14ib4q8,Satisfyingasfuck,/r/Satisfyingasfuck/comments/14ib4q8/this_automatically_adjusting_oxygen_mask_for/,EducationalAeries,This automatically adjusting oxygen mask for pilots,3569,0.97,94,,1687662087.0,False,False,False,False,False
64,14i28oi,JustGuysBeingDudes,/r/JustGuysBeingDudes/comments/14i28oi/saving_an_owl/,pun420,Saving an Owl,33405,0.96,515,,1687637172.0,False,False,False,False,False
65,14ibnv2,PeterExplainsTheJoke,/r/PeterExplainsTheJoke/comments/14ibnv2/petah_i_dont_drink_alcohol/,IslamLover69,Petah I don’t drink alcohol,3164,0.95,116,,1687663800.0,False,False,False,False,False
66,14i6k1y,Eyebleach,/r/Eyebleach/comments/14i6k1y/scribble_is_getting_so_big/,Starchscreech,Scribble is getting so big!,7612,0.97,97,,1687648552.0,False,False,False,False,False
67,14i9900,news,/r/news/comments/14i9900/mexico_city_holds_mass_celebration_for_samesex/,AgileNetwork7,"Mexico City holds mass celebration for same-sex weddings, gender ID changes",11307,0.89,172,,1687656332.0,False,False,False,False,False
68,14i61nh,tumblr,/r/tumblr/comments/14i61nh/whats_your_fave/,Justthisdudeyaknow,What's your fave?,10150,0.92,274,,1687647142.0,False,False,False,False,False
69,14i2tqd,BrandNewSentence,/r/BrandNewSentence/comments/14i2tqd/if_you_whacked_me_with_a_ford_explorer/,Fr3nchT0astCrunch,If you whacked me with a Ford Explorer,22469,0.96,226,,1687638703.0,False,False,False,False,False
70,14ifz75,natureismetal,/r/natureismetal/comments/14ifz75/in_finland_temperature_gets_as_low_as_40c_in/,bislut997,"In Finland temperature gets as low as -40C in winter, the trees are covered in so much snow and frost that it looks like landscape from another planet",1366,0.96,41,,1687678430.0,False,False,False,False,False
71,14iedba,ClashRoyale,/r/ClashRoyale/comments/14iedba/this_is_a_joke_right_what_has_supercell_become/,Max_SteeI,This is a joke right? What has supercell become?,1832,0.96,89,,1687672793.0,False,False,False,False,False
72,14i9iqp,inthenews,/r/inthenews/comments/14i9iqp/rfk_jr_lashes_out_at_rolling_stone_after_article/,lucerousb,RFK Jr. Lashes Out at Rolling Stone After Article Shows GOP Link to Presidential Run: ‘Establishment Propaganda’,4111,0.94,518,,1687657142.0,False,False,False,False,False
73,14i3y42,MurderedByWords,/r/MurderedByWords/comments/14i3y42/very_accurate_description/,cyaron12,very accurate description,12746,0.95,222,,1687641568.0,False,False,False,False,False
74,14idf5g,NotHowGirlsWork,/r/NotHowGirlsWork/comments/14idf5g/this_sub_made_me_feel_really_well/,mankyox,This sub made me feel really well,2082,0.96,151,,1687669546.0,False,False,False,False,False
75,14ih3ce,HumansAreMetal,/r/HumansAreMetal/comments/14ih3ce/theresa_kachindamoto_saving_the_children/,bislut997,Theresa Kachindamoto saving the children,1070,0.96,12,,1687682365.0,False,False,False,False,False
76,14ihbjv,MemePiece,/r/MemePiece/comments/14ihbjv/bruhhh/,LuckyUnification,Bruhhh,1030,0.98,48,,1687683178.0,False,False,False,False,False
77,14idt6s,soccercirclejerk,/r/soccercirclejerk/comments/14idt6s/football_is_back/,AwepHS,Football is back,1874,0.97,58,,1687670856.0,False,False,False,False,False
78,14i8ya4,anime_irl,/r/anime_irl/comments/14i8ya4/anime_irl/,Not_So_UwU,anime_irl,4432,0.96,57,,1687655454.0,False,False,False,False,False
79,14iifo7,PoliticalHumor,/r/PoliticalHumor/comments/14iifo7/this_all_makes_a_little_more_sense_now/,UnlimitedDuck,This all makes a little more sense now,819,0.96,59,,1687687196.0,False,False,False,False,False
80,14igorp,BikiniBottomTwitter,/r/BikiniBottomTwitter/comments/14igorp/this_is_so_true/,BeautifulSwan00,This is so true,1096,0.99,6,,1687680918.0,False,False,False,False,False
81,14igrdy,formuladank,/r/formuladank/comments/14igrdy/ive_made_my_choice/,Siffilus23,I've made my choice,1068,0.97,24,“It’s called a motor race. We went car racing”,1687681182.0,False,False,False,False,False
82,14i57pg,OneOrangeBraincell,/r/OneOrangeBraincell/comments/14i57pg/arthur_refused_to_leave_him_until_his_friend/,FloofySamoyed,Arthur refused to leave him until his friend crossed. He used the brain cell for good. ♥️,8550,0.96,115,,1687644888.0,False,False,False,False,False
83,14i9tgh,nba,/r/nba/comments/14i9tgh/victor_wembanyama_couldnt_ask_for_better_role/,krypto_the_husk,[Victor Wembanyama] Couldn’t ask for better role models 🖤,3536,0.96,453,:mia-2: [MIA] Duncan Robinson,1687658035.0,False,1687666013.0,False,False,False
84,14igzb3,sweden,/r/sweden/comments/14igzb3/tuffa_förhandlingar_på_blocket/,spiderpigbegins,Tuffa förhandlingar på Blocket,1013,0.97,64,Sverige,1687681961.0,False,False,False,False,False
85,14iaqgj,Breath_of_the_Wild,/r/Breath_of_the_Wild/comments/14iaqgj/just_got_my_copy_of_botw_signed_by_zelda_can/,PlatypusGuy613,Just got my copy of BOTW signed by Zelda. Can anyone translate the hylian she wrote?,3107,0.97,109,,1687660855.0,False,False,False,False,False
86,14ibyo6,TaylorSwift,/r/TaylorSwift/comments/14ibyo6/taylor_urged_fans_during_tonights_acoustic_set/,baeeeee91,"Taylor urged fans during tonight’s acoustic set, not to bully anyone online ahead of Speak Now’s release.",2403,0.92,512,":midnights: Ask me why so many fade, but I’m still here",1687664768.0,False,False,False,False,False
87,14i7q97,whenthe,/r/whenthe/comments/14i7q97/title/,thepositivepandemic,title,5908,0.97,202,[deleted],1687651815.0,False,False,False,False,False
88,14i8o03,MadeMeSmile,/r/MadeMeSmile/comments/14i8o03/nawww_uncle_is_too_cute/,BuguyaBriarLeigh,Nawww. Uncle is too cute!,12169,0.97,74,,1687654600.0,False,False,False,False,False
89,14i2la7,Animemes,/r/Animemes/comments/14i2la7/he_forgor/,IDontKnowANam3,He forgor,20309,0.93,467,,1687638078.0,False,False,False,False,False
90,14i9o6c,shittyfoodporn,/r/shittyfoodporn/comments/14i9o6c/pick_your_poison/,Ok-Software5073,Pick your poison,3539,0.9,1258,,1687657592.0,False,False,False,False,False
91,14i6rrc,terriblefacebookmemes,/r/terriblefacebookmemes/comments/14i6rrc/this_was_in_another_group/,Dinoman0101,This was in another group,6639,0.9,317,,1687649131.0,False,False,False,False,False
92,14i0xk8,pics,/r/pics/comments/14i0xk8/john_olivers_guide_to_a_more_effective_form_of/,WolfgangVolos,John Oliver's Guide To A More Effective Form of Protest,39054,0.86,1169,,1687633821.0,False,False,False,False,False
93,14ihtj9,ireland,/r/ireland/comments/14ihtj9/have_you_already_watch_philomena_cunk_lol/,XCEREALXKILLERX,Have you already watch Philomena Cunk? Lol,821,0.95,96,Dublin,1687684932.0,False,False,False,False,False
94,14i7l0v,StupidFood,/r/StupidFood/comments/14i7l0v/for_the_pasta_lovers/,BlessDisMess,For the pasta lovers 🇮🇹,5087,0.9,930,,1687651379.0,False,False,False,False,False
95,14i98px,wholesome,/r/wholesome/comments/14i98px/what_doin_baby/,GainRepulsive977,What doin’ baby?,3731,0.97,57,,1687656311.0,False,False,False,False,False
96,14ig1sw,marvelmemes,/r/marvelmemes/comments/14ig1sw/that_would_have_been_legendary/,SavoryAvarice,That would have been LEGENDARY,1097,0.98,11,Avengers,1687678678.0,False,False,False,False,False
97,14i2s6x,2westerneurope4u,/r/2westerneurope4u/comments/14i2s6x/that_is_the_most_underwhelming_end_of_a_civil_war/,FreakShowRed7,That is the most underwhelming end of a civil war I have ever seen. 0/10.,11481,0.96,410,:European: European,1687638592.0,False,False,False,False,False
98,14icy08,OnePunchMan,/r/OnePunchMan/comments/14icy08/become_what_you_eat_meme/,Deathbringer_Yasuo,Become what you eat: meme,1879,0.97,37,:Tatsumaki9:TatsuxTama enjoyer,1687667955.0,False,False,False,False,False
99,14i63hl,discordVideos,/r/discordVideos/comments/14i63hl/i_cant_listen_to_this_without_getting_emotional/,HallowLaser84,I cant listen to this without getting emotional,7488,0.95,159,,1687647293.0,False,False,False,False,False
100,14i9o4x,popculturechat,/r/popculturechat/comments/14i9o4x/margot_robbie_barbie_press/,HotChiTea,Margot Robbie / Barbie Press 🥵,3197,0.95,106,Good to hear from you bitch,1687657589.0,False,False,False,False,False
