rank,id,subreddit,permalink,author,title,score,upvote_ratio,num_comments,author_flair_text,created_utc,over_18,edited,stickied,locked,is_original_content
1,14r1aau,nextfuckinglevel,/r/nextfuckinglevel/comments/14r1aau/sharp_and_very_decent_human/,TenselyDazzling,Sharp and very decent human,11925,0.98,287,,1688535204.0,False,False,False,False,False
2,14r1xv8,HumansBeingBros,/r/HumansBeingBros/comments/14r1xv8/the_trapped_dog_doesnt_wait_a_bit_to_hug_the/,JettMe_Red,The trapped dog doesn't wait a bit to hug the rescuer after being freed..,8639,0.98,146,,1688537435.0,False,False,False,False,False
3,14r0r2n,meirl,/r/meirl/comments/14r0r2n/meirl/,Majestic-Unicorn33,meirl,9478,0.99,126,,1688533427.0,False,False,False,False,False
4,14r0moh,BeAmazed,/r/BeAmazed/comments/14r0moh/yep_thats_a_big_fat_10/,kimcutiepie,Yep! That's a big fat 10!,9342,0.98,166,,1688533072.0,False,False,False,False,False
5,14qxs5l,oddlysatisfying,/r/oddlysatisfying/comments/14qxs5l/submerging_eiderdown_in_water/,solateor,submerging eiderdown in water,20739,0.97,263,,1688523926.0,False,False,False,False,False
6,14qwtqf,WhitePeopleTwitter,/r/WhitePeopleTwitter/comments/14qwtqf/reddit_what_do_you_think/,seangolden06,"Reddit, what do you think?",36053,0.92,869,,1688520955.0,False,False,False,False,False
7,14qwazj,Damnthatsinteresting,/r/Damnthatsinteresting/comments/14qwazj/in_1970_dock_ellis_threw_a_nohitter_under_the/,Seraphenigma,"In 1970, Dock Ellis threw a no-hitter under the influence of LSD",23184,0.95,726,,1688519308.0,False,False,False,False,False
8,14qwnzk,MadeMeSmile,/r/MadeMeSmile/comments/14qwnzk/after_a_long_battle_my_dream_came_true_today_my/,simoonne,After a long battle. My dream came true today! My mom ie cancer free. So proud of her.,16091,0.94,198,,1688520452.0,False,False,False,False,False
9,14qxhyo,therewasanattempt,/r/therewasanattempt/comments/14qxhyo/to_ask_a_fashion_blogger_a_nuclear_weapon_question/,shurikien,To ask a fashion blogger a nuclear weapon question,12461,0.93,747,,1688523064.0,False,False,False,False,False
10,14qvc1k,facepalm,/r/facepalm/comments/14qvc1k/i_dont_understand_why_he_would_move_on/,NoPermissionaz,I don't understand why he would move on.,46652,0.9,2088,,1688516368.0,False,False,False,False,False
11,14r4an4,dankmemes,/r/dankmemes/comments/14r4an4/cant_help_it/,ChildhoodStreet1616,can't help it,2539,0.99,24,☣️,1688545120.0,False,False,False,False,False
12,14r3rj7,HolUp,/r/HolUp/comments/14r3rj7/wash_your_hands/,Quobl_69420,Wash your hands,2689,0.97,38,,1688543437.0,True,False,False,False,False
13,14qyvtg,OldSchoolCool,/r/OldSchoolCool/comments/14qyvtg/1940s_contraption_for_infant_leg_muscle/,wronghoIe,1940’s contraption for infant leg muscle development.,6384,0.98,276,,1688527365.0,False,False,False,False,False
14,14r3szk,UkraineWarVideoReport,/r/UkraineWarVideoReport/comments/14r3szk/drone_footage_of_yesterdays_massive_ammo_dump/,Repulsive-Pattern-57,Drone footage of yesterday’s massive ammo dump explosion in temporarily occupied Makiivka,2230,0.98,184,,1688543574.0,False,False,False,False,False
15,14qvviq,maybemaybemaybe,/r/maybemaybemaybe/comments/14qvviq/maybe_maybe_maybe/,50ShadesOfSpray_,Maybe maybe maybe,15857,0.84,1034,,1688518002.0,False,False,False,False,False
16,14qugij,madlads,/r/madlads/comments/14qugij/madlad_in_lecture_repost_because_of_new_rules/,littlerocky12,Madlad in Lecture (repost because of new rules),19112,0.95,223,,1688513828.0,False,False,False,False,False
17,14qtkbz,mildlyinfuriating,/r/mildlyinfuriating/comments/14qtkbz/kids_eat_free_lol/,hadtodoit_69,“Kids eat free” lol,28834,0.94,1260,,1688511335.0,False,False,False,False,False
18,14quv22,politics,/r/politics/comments/14quv22/republican_party_ridiculed_after_tweeting_wrong/,Oleg101,Republican Party ridiculed after tweeting wrong flag for Fourth of July,10657,0.96,434,,1688515000.0,False,False,False,False,False
19,14qzk9o,HonkaiStarRail,/r/HonkaiStarRail/comments/14qzk9o/official_character_announcement_fu_xuan_5_star/,Xanek,【Official】 Character Announcement: Fu Xuan (5 Star - Quantum / Preservation),4491,0.95,329,,1688529619.0,False,False,False,False,False
20,14qydmc,shitposting,/r/shitposting/comments/14qydmc/heil_dear_leader_spez/,OdinAurelius,Heil dear leader Spez,6372,0.95,88,William Dripfoe,1688525804.0,False,False,False,False,False
21,14qx6nu,oddlyterrifying,/r/oddlyterrifying/comments/14qx6nu/went_to_throw_something_in_the_little_recyling/,hunterorila,Went to throw something in the little recyling bin we have on the counter and...,7703,0.97,230,,1688522105.0,False,False,False,False,False
22,14quo8i,funny,/r/funny/comments/14quo8i/if_u_ever_feel_like_a_failure_remember_denmarks/,Fun_Bison_1693,If u ever feel like a failure remember Denmark's Travel agency made this advertisement to fight Denmark's low birth rate,10833,0.93,698,,1688514436.0,True,False,False,False,False
23,14qu65p,todayilearned,/r/todayilearned/comments/14qu65p/til_that_the_bbc_had_no_archival_policy_until/,PegPelvis,"TIL that the BBC had no archival policy until 1978, and many of its old broadcasts were only aired live. A number of BBC broadcasts are lost, including a show featuring a then-unknown Bob Dylan; 97 episodes of Dr. Who; and most of its coverage of the moon landing.",11146,0.97,357,,1688513053.0,False,False,False,False,False
24,14r1t9a,formuladank,/r/formuladank/comments/14r1t9a/most_sane_wdc_take/,simedr,Most sane WDC take,2500,0.96,83,Question.,1688537013.0,False,False,False,False,False
25,14qy9iw,tumblr,/r/tumblr/comments/14qy9iw/straight_to_jail/,caughtyoulookinn,Straight to jail,4685,0.99,25,,1688525441.0,False,False,False,False,False
26,14qzviy,AskReddit,/r/AskReddit/comments/14qzviy/if_poor_people_fantasize_about_winning_the/,more_bees_pleas,"If poor people fantasize about winning the lottery, then what do rich people fantasize about?",3315,0.94,2322,,1688530598.0,False,False,False,False,False
27,14qvrc3,aww,/r/aww/comments/14qvrc3/mini_taekwondo/,TrueSkyDemon,Mini Taekwondo,6999,0.87,165,,1688517657.0,False,False,False,False,False
28,14r20o1,TikTokCringe,/r/TikTokCringe/comments/14r20o1/pretty_much_child_abuse/,Fr0stRa1d,Pretty much child abuse,2114,0.92,533,"Sort by flair, dumbass",1688537703.0,False,False,False,False,False
29,14r1xw8,cursedcomments,/r/cursedcomments/comments/14r1xw8/cursed_ny_car/,UnknownSuxker,Cursed_NY car,2154,0.98,38,,1688537438.0,False,False,False,False,False
30,14r3h7g,JustGuysBeingDudes,/r/JustGuysBeingDudes/comments/14r3h7g/men_are_simple/,flattenedbricks,Men are simple,1516,0.98,27,Lego Bricks,1688542457.0,False,False,False,False,False
31,14qtkbs,memes,/r/memes/comments/14qtkbs/havent_seen_a_dollar_coin_in_a_long_time/,Sadboy_looking4memes,Haven't seen a dollar coin in a long time.,14128,0.96,453,OC Meme Maker,1688511335.0,False,False,False,False,False
32,14r1ji3,TrashTaste,/r/TrashTaste/comments/14r1ji3/american_boys/,YAGIboy,American boys,2077,0.95,40,Connoisseur of Trash,1688536098.0,False,False,False,False,False
33,14r35j7,whenthe,/r/whenthe/comments/14r35j7/i_live_in_slc_ut_but_we_used_to_live_in_w/,YoruDenftw,"""i live in SLC, UT 🤓 but we used to live in W-""",1580,0.97,73,,1688541396.0,False,False,False,False,False
34,14qq9ms,antiwork,/r/antiwork/comments/14qq9ms/my_boss_was_mad_at_me_for_posting_online_how_much/,Jacq1987,"My boss was mad at me for posting online how much I make per hour and threatened to fire me, so I quit.",24439,0.93,1850,,1688503045.0,False,False,False,False,False
35,14r01of,Damnthatsinteresting,/r/Damnthatsinteresting/comments/14r01of/recyling_discarded_bars_of_soap_from_hotels/,CantStopPoppin,Recyling discarded bars of soap from hotels.,6591,0.97,440,,1688531149.0,False,False,False,False,False
36,14r1ngt,discordVideos,/r/discordVideos/comments/14r1ngt/ayoooo_maybe_what_the_fuck_what_you_say/,Safe_Discipline_4926,Ayoooo Maybe what the fuck what you say,2055,0.88,209,,1688536479.0,True,False,False,False,False
37,14qtw8d,PrequelMemes,/r/PrequelMemes/comments/14qtw8d/beard/,Alternative_Serve368,Beard,9650,0.98,103,,1688512261.0,False,False,False,False,False
38,14qy2hp,doordash_drivers,/r/doordash_drivers/comments/14qy2hp/whyre_they_like_this/,grizzyber,why’re they like this 💀,3693,0.96,205,,1688524807.0,False,False,False,False,False
39,14r1tbo,ich_iel,/r/ich_iel/comments/14r1tbo/ichiel/,mingaflo,ich🧑‍🎓🤑iel,1918,0.86,299,,1688537018.0,True,False,False,False,False
40,14r0dlu,nextfuckinglevel,/r/nextfuckinglevel/comments/14r0dlu/the_vegas_sphere_is_live/,MyNameIsRJ,The Vegas Sphere is Live,5479,0.97,333,,1688532248.0,False,False,False,False,False
41,14qu6kj,NonPoliticalTwitter,/r/NonPoliticalTwitter/comments/14qu6kj/i_mean_seriously/,CattDawg2008,i mean seriously,7008,0.95,97,:blue1::blue2::1111::1112:,1688513086.0,False,False,False,False,False
42,14r3yk4,ukraine,/r/ukraine/comments/14r3yk4/drone_footage_of_the_recent_massive_ammunition/,ijnfrt,Drone footage of the recent massive ammunition detonation in occupied Makiivka,1195,0.99,107,,1688544071.0,False,False,False,False,False
43,14qqi4r,cats,/r/cats/comments/14qqi4r/give_him_everything_he_wants/,Small_Elf_Girl,Give him everything he wants 😿,15595,0.97,318,,1688503620.0,False,False,False,False,False
44,14qy4a4,CrazyFuckingVideos,/r/CrazyFuckingVideos/comments/14qy4a4/mans_does_not_get_paid_enough_for_this_response/,Caseyisweird,Mans does not get paid enough for this response. ,3158,0.9,890,,1688524970.0,False,False,False,False,False
45,14qytxl,facepalm,/r/facepalm/comments/14qytxl/physics_affirmation_gone_wrong/,OkTearx,Physics affirmation gone wrong 😂,7984,0.97,238,,1688527211.0,False,False,False,False,False
46,14qve1f,DesignPorn,/r/DesignPorn/comments/14qve1f/its_only_a_drain_but/,Organic-Squirm,It’s only a drain but…,4992,0.95,92,,1688516521.0,False,False,False,False,False
47,14quhi1,WorkReform,/r/WorkReform/comments/14quhi1/i_took_a_job_nobody_wanted_and_made_it_so_good_i/,BakerLovePie,I took a job nobody wanted and made it so good I got fired.,5624,0.97,257,,1688513906.0,False,False,False,False,False
48,14r19xa,distressingmemes,/r/distressingmemes/comments/14r19xa/first_meme/,IliftHeavyCircles-95,First meme,1759,0.95,72,"they were skinwalkers, not my family",1688535170.0,False,False,False,False,False
49,14qpzsq,worldnews,/r/worldnews/comments/14qpzsq/russia_rigs_znpp_reactor_buildings_with/,TheRealMykola,Russia rigs ZNPP reactor buildings with explosives – AFU,12937,0.94,1940,,1688502411.0,False,False,False,False,False
50,14qwxjs,nba,/r/nba/comments/14qwxjs/today_marks_7_years_ago_to_the_day_that_kevin/,CulturalRoll,Today marks 7 years ago to the day that Kevin Durant signed with the Golden State Warriors -- possibly the most infamous signing in NBA history,3567,0.93,766,:gsw-5: Warriors,1688521283.0,False,1688537073.0,False,False,False
51,14r15ms,Unexpected,/r/Unexpected/comments/14r15ms/why_the_food_takes_so_long_at_mcdonalds/,ge0oo,Why the food takes so long at Mcdonalds...,1734,0.95,31,,1688534769.0,False,False,False,False,True
52,14qr3lt,BrandNewSentence,/r/BrandNewSentence/comments/14qr3lt/yeah_this_will_probably_be_a_mature_conversation/,venmke,"Yeah, this will probably be a mature conversation.",13859,0.93,1214,,1688505058.0,False,False,False,False,False
53,14qypyo,Hololive,/r/Hololive/comments/14qypyo/i_love_these_dorks/,Customer-Sorry,I love these dorks,2661,0.96,31,:Matsuri::Okayu::Gura::Subaru::Matsuri:,1688526852.0,False,False,False,False,False
54,14r3417,SipsTea,/r/SipsTea/comments/14r3417/spawn_trap/,SuspectAny7428,Spawn trap,1191,0.99,26,,1688541266.0,False,False,False,False,False
55,14qp94o,gaming,/r/gaming/comments/14qp94o/nobody_is_playing_halo_infinite_as_steam_numbers/,PrinceDizzy,Nobody is playing Halo Infinite as Steam numbers drop to 2% of launch,18482,0.89,3012,Joystick,1688500675.0,False,False,False,False,False
56,14qyr8m,PublicFreakout,/r/PublicFreakout/comments/14qyr8m/woman_destroys_computers_at_airlines_counter_as_a/,mojitoix,"Woman destroys computers at airline's counter as a complaint of a cancelled flight she says ""Don't give me my money back, I don't give a damn, But this is gonna cost you""",2510,0.98,352,,1688526961.0,False,False,False,False,False
57,14qv539,animememes,/r/animememes/comments/14qv539/bitter_truth/,Con___artist,Bitter Truth,5449,0.92,163,,1688515803.0,False,False,False,False,False
58,14qzg0m,wholesomememes,/r/wholesomememes/comments/14qzg0m/happy_crying/,fala_shssfdsdsd,Happy crying,2195,0.99,30,,1688529219.0,False,False,False,False,False
59,14qxmle,BeAmazed,/r/BeAmazed/comments/14qxmle/no_one_told_me_moose_were_this_massive/,beastmodeChadF13,no one told me moose were THIS massive ,7848,0.95,672,,1688523441.0,False,False,False,False,False
60,14quux3,clevercomebacks,/r/clevercomebacks/comments/14quux3/family_is_everything/,mrl33602,Family is everything,5000,0.95,55,,1688514987.0,False,False,False,False,False
61,14quuxe,shittymoviedetails,/r/shittymoviedetails/comments/14quuxe/in_titanic_1997_rose_drops_her_priceless_necklace/,Mr_Westerfield,"In Titanic (1997), Rose drops her priceless necklace into the sea because she thinks that’s a better use for it than, like, leaving it to her family or paying the medical bills for a kid with cancer or something",4995,0.98,100,,1688514987.0,False,False,False,False,False
62,14qv8mr,ImTheMainCharacter,/r/ImTheMainCharacter/comments/14qv8mr/man_walks_in_the_middle_of_the_road/,FellowTravellers,Man walks in the middle of the road,4453,0.95,560,,1688516090.0,False,False,False,False,False
63,14qqy4v,PeterExplainsTheJoke,/r/PeterExplainsTheJoke/comments/14qqy4v/can_someone_help/,Responsible_Body5907,Can someone help,12097,0.91,940,,1688504683.0,False,False,False,False,False
64,14qzkxc,Genshin_Impact,/r/Genshin_Impact/comments/14qzkxc/happy_birthday_barbara/,genshinimpact,"Happy Birthday, Barbara!",2067,0.96,36,:hoyo1::hoyo2: Official,1688529670.0,False,False,False,False,False
65,14quz75,lotrmemes,/r/lotrmemes/comments/14quz75/why_does_he_always_die_tho/,Forest_folf,Why does he always die tho,4811,0.97,164,Dwarf,1688515334.0,False,False,False,False,False
66,14r68tb,reddevils,/r/reddevils/comments/14r68tb/bruno_on_ig_story_why_did_you_take_so_long_to/,DonscoMUFC,Bruno on IG story: “Why did you take so long to sign 😡 Welcome @masonmount”,668,0.99,72,:34:Donny van de Beek,1688551338.0,False,False,False,False,False
67,14r0vvg,IndianFootball,/r/IndianFootball/comments/14r0vvg/indian_sports_right_now/,Still-Deal-17,Indian sports right now,1641,0.95,96,,1688533858.0,False,False,False,False,False
68,14r5azv,MadeMeSmile,/r/MadeMeSmile/comments/14r5azv/a_brain_tumour_changed_her_life_her_nerves_are/,IanAgate,“A brain tumour changed her life. Her nerves are badly damaged! But today she opened a car door…..walked…..opened a gym door…..walked and sat down ..BY HERSELF 💪🏿💪🏿 what a lady”,1655,0.99,103,,1688548390.0,False,False,False,False,False
69,14qrsa6,pcmasterrace,/r/pcmasterrace/comments/14qrsa6/after_2_weeks_of_trying_to_fix_my_connectors/,Tomek3DS,"After 2 weeks of trying to fix my connectors, buying new fans, and going through mountains of support in an attempt to stop my cooling from sounding like an engine, I came to learn that I had to press the ""apply"" button.",7958,0.97,226,,1688506712.0,False,False,False,False,False
70,14r0p8k,oddlyspecific,/r/oddlyspecific/comments/14r0p8k/spaceship/,Mammoth-Medicine1385,Spaceship,1659,0.98,48,,1688533286.0,False,False,False,False,False
71,14r3hjf,2westerneurope4u,/r/2westerneurope4u/comments/14r3hjf/southwestern_europe_choosing_their_languages/,B33PIDYB00P,South-Western Europe choosing their languages,1008,0.95,261,:United_Kingdom: :England: Propa Brexit Geezer,1688542492.0,False,False,False,False,False
72,14qujpd,therewasanattempt,/r/therewasanattempt/comments/14qujpd/to_be_cute/,handilypulp96,to be cute,15200,0.95,516,,1688514072.0,False,False,False,False,False
73,14qun6f,HyruleEngineering,/r/HyruleEngineering/comments/14qun6f/gentlemen_the_age_of_jet_aircrafts_has_finally/,Ultrababouin,"Gentlemen, the age of jet aircrafts has finally arrived",4271,0.97,140,Mad scientist,1688514346.0,False,False,False,False,False
74,14qpb0x,comics,/r/comics/comments/14qpb0x/choose_your_weapon/,MurkyWay,Choose Your Weapon,13212,0.95,612,Swords,1688500807.0,False,False,False,False,False
75,14r00kl,explainlikeimfive,/r/explainlikeimfive/comments/14r00kl/eli5_if_a_regular_weight_person_and_an_obese/,bin_of_flowers,"ELI5 If a regular weight person and an obese person were left on a desert island with no food, would the obese person live a lot longer bc they have stored up energy as fat? Or does it not work like that?",1709,0.94,439,,1688531052.0,False,False,False,False,False
76,14qy6ev,pettyrevenge,/r/pettyrevenge/comments/14qy6ev/my_stepdad_wore_the_same_shirt_i_got_in_trouble/,PlotHole2017,My stepdad wore the same shirt I got in trouble for during the parent teacher meeting,2331,0.94,86,,1688525159.0,False,False,False,False,False
77,14qo9wu,doordash,/r/doordash/comments/14qo9wu/why_is_my_driver_in_georgia/,Takeapropaganda666,Why is my driver in Georgia,23232,0.92,1530,,1688498312.0,False,False,False,False,False
78,14qqf8r,Serverlife,/r/Serverlife/comments/14qqf8r/arrested_for_not_paying_a_tables_tab_that_walked/,HypocriticalHobbes,Arrested for not paying a tables tab that walked out,11697,0.81,2154,,1688503423.0,False,1688504727.0,False,False,False
79,14qs5c9,Showerthoughts,/r/Showerthoughts/comments/14qs5c9/humanity_has_put_so_many_safety_measures_in_place/,hanMan86,Humanity has put so many safety measures in place that natural selection can no longer eliminate stupid people at an effective rate.,6628,0.88,576,,1688507618.0,False,False,False,False,False
80,14qpkng,PoliticalHumor,/r/PoliticalHumor/comments/14qpkng/spot_the_billionaire/,phydeauxbreath,Spot the Billionaire,9467,0.94,356,,1688501410.0,False,False,False,False,False
81,14qnpha,NatureIsFuckingLit,/r/NatureIsFuckingLit/comments/14qnpha/a_snake_slithering_up_a_brick_wall/,amish_novelty,🔥 A snake slithering up a brick wall,16383,0.94,419,,1688496989.0,False,False,False,False,False
82,14r3pxw,WTF,/r/WTF/comments/14r3pxw/surviving_the_spaghetti_monster/,JamesChisolm,Surviving the spaghetti monster,889,0.98,49,,1688543289.0,False,False,False,False,False
83,14qzpd2,HonkaiStarRail_leaks,/r/HonkaiStarRail_leaks/comments/14qzpd2/fu_xuan_official_reveal/,Slight-Improvement84,Fu Xuan official reveal,1753,0.95,203,,1688530036.0,False,False,False,False,False
84,14qw4e2,teenagers,/r/teenagers/comments/14qw4e2/guys_this_girl_after_5_minutes_of_chatting_with/,ItzJustOriginal,Guys this girl after 5 minutes of chatting with me just sent a boob pic. what do I do,3548,0.93,889,15,1688518779.0,True,False,False,False,False
85,14qv6jg,terriblefacebookmemes,/r/terriblefacebookmemes/comments/14qv6jg/remember_when_we_had_0_unemployment_and_world/,speachtree,Remember when we had 0 unemployment and world peace? Wasn’t that nice?,3826,0.96,206,,1688515913.0,False,False,False,False,False
86,14r106y,gadgets,/r/gadgets/comments/14r106y/nasa_restores_contact_with_mars_helicopter_after/,MicroSofty88,NASA restores contact with Mars helicopter after nine weeks of silence,1362,0.97,59,,1688534250.0,False,False,False,False,False
87,14qua94,OneOrangeBraincell,/r/OneOrangeBraincell/comments/14qua94/some_of_my_favorite_photos_of_my_most_precious/,Eolssu,Some of my favorite photos of my most precious treasure. 🧡,4129,0.99,152,,1688513386.0,False,False,False,False,False
88,14r21t7,unitedstatesofindia,/r/unitedstatesofindia/comments/14r21t7/fans_singing_maa_tujhe_salaamvande_mataram_in/,LoinKing_,Fans singing Maa Tujhe Salaam/Vande Mataram in stadium after India beat Kuwait and win the SAFF championship final,1120,0.97,43,:Weed: Stoned at the Rooftop,1688537797.0,False,False,False,False,False
89,14r4g00,Awww,/r/Awww/comments/14r4g00/when_he_came_to_the_sea_for_the_first_time_in_a/,DustMurkyz,when he came to the sea for the first time in a year,747,0.99,21,,1688545618.0,False,False,False,False,False
90,14qmw0w,news,/r/news/comments/14qmw0w/suspicious_powder_found_at_the_white_house_when/,Swoltergeist,"Suspicious powder found at the White House when Biden was gone was cocaine, AP sources say",19020,0.89,2647,,1688495124.0,False,False,False,False,False
91,14qz874,oddlysatisfying,/r/oddlysatisfying/comments/14qz874/the_mirror_shine_of_a_cutlass_fish/,Douglasqqq,The mirror shine of a cutlass fish,4053,0.94,133,,1688528501.0,False,False,False,False,False
92,14qvuus,mildlyinfuriating,/r/mildlyinfuriating/comments/14qvuus/neighbor_keeps_breaking_windows_if_we_park_in_the/,PlayBoiPrada,Neighbor keeps breaking windows if we park in the ‘wrong’ spot on a public road.,9966,0.88,926,,1688517945.0,False,False,False,False,False
93,14qt3h0,Grimdank,/r/Grimdank/comments/14qt3h0/lets_pretend_that_didnt_happen/,Careful-Level,Let's pretend that didn't happen,5102,0.97,267,,1688510076.0,False,False,False,False,False
94,14qvlwa,diablo4,/r/diablo4/comments/14qvlwa/what_is_your_biggest_frustration_so_far_in_diablo/,IMSirDiaries,What is your biggest frustration so far in DIABLO IV?,3181,0.96,735,,1688517188.0,False,False,False,False,False
95,14qvpj9,DunderMifflin,/r/DunderMifflin/comments/14qvpj9/the_most_popular_oscar_line_was_besides_having/,goldenretreiverdude,"The most popular Oscar line was: “Besides having sex with men, I'd say the Finer Things Club is the gayest thing about me.” - Next up is Dwight Schrute (Mr Poop) - Comment your favorite Dwight line from the show! Only comment with Dwight lines and do not comment a line is someone else already has!",3259,0.92,713,:david: David Wallace,1688517510.0,False,False,False,False,False
96,14qyq21,technicallythetruth,/r/technicallythetruth/comments/14qyq21/you_have_my_word_officer_i_dont_drink_and_drive/,LucidCunning,"""You have my word, officer. I don't drink and drive.""",1913,0.98,31,,1688526859.0,False,False,False,False,False
97,14qp4zf,StupidFood,/r/StupidFood/comments/14qp4zf/2k_pizza_for_a_celeb/,danonck,"$2k ""pizza"" for a celeb",12452,0.82,2806,,1688500385.0,False,False,False,False,False
98,14qtis3,LifeProTips,/r/LifeProTips/comments/14qtis3/lpt_when_attending_a_party_at_someones_home_help/,bluegambit875,"LPT: When attending a party at someone's home, help pick up trash when things start winding down. Other people will start doing the same and the cleanup will go much faster. Plus you will be viewed as a thoughtful and considerate guest.",4225,0.96,100,,1688511218.0,False,False,False,False,False
99,14r4k2z,awfuleverything,/r/awfuleverything/comments/14r4k2z/a_taiwanese_dad_who_hit_his_daughter_40_times_and/,Sakuramochi_Chan,"A Taiwanese dad who hit his daughter 40 times and posted it online, because she got fifth place in her grade.",698,0.98,40,,1688545985.0,True,False,False,False,False
100,14qumzu,WhitePeopleTwitter,/r/WhitePeopleTwitter/comments/14qumzu/a_traitor/,Paneraiguy1,A traitor?,9462,0.97,340,,1688514333.0,False,False,False,False,False
