rank,id,subreddit,permalink,author,title,score,upvote_ratio,num_comments,author_flair_text,created_utc,over_18,edited,stickied,locked,is_original_content
1,14r8grz,mildlyinfuriating,/r/mildlyinfuriating/comments/14r8grz/self_service_continental_breakfast/,BabyBear1060,Self service continental breakfast,14711,0.94,1618,,1688557921.0,False,False,False,False,False
2,14r7ocp,therewasanattempt,/r/therewasanattempt/comments/14r7ocp/to_be_a_creep_on_the_flight_and_get_away_with_it/,Brain-Fiddler,To be a creep on the flight and get away with it ,25399,0.97,773,,1688555552.0,False,False,False,False,False
3,14r6yr7,Damnthatsinteresting,/r/Damnthatsinteresting/comments/14r6yr7/this_59yearold_chimpanzee_was_refusing_food_and/,Legitimate_Fee2683,This 59-year-old chimpanzee was refusing food and ready to die; until she has the last visit from an old friend,26961,0.96,586,,1688553464.0,False,False,False,False,False
4,14rc3yx,meirl,/r/meirl/comments/14rc3yx/meirl/,jmoonn,meirl,6002,0.96,239,,1688566973.0,False,False,False,False,False
5,14rafp8,MadeMeSmile,/r/MadeMeSmile/comments/14rafp8/ukrainian_soldiers_meeting_with_their_families/,WhiteLikeCocain,Ukrainian soldiers meeting with their families after the liberation of Kherson,7141,0.96,219,,1688563056.0,False,False,False,False,False
6,14r7z50,worldnews,/r/worldnews/comments/14r7z50/russians_die_under_mysterious_circumstances_in/,Beyond_The_Dim,Russians die under mysterious circumstances in Mariupol – City Council,9931,0.95,716,,1688556442.0,False,False,False,False,False
7,14rcvn0,oddlyterrifying,/r/oddlyterrifying/comments/14rcvn0/what_rip_current_looks_like/,zhangyuandyou,What rip current looks like,4716,0.97,154,,1688568696.0,False,False,False,False,False
8,14r846z,WhitePeopleTwitter,/r/WhitePeopleTwitter/comments/14r846z/investigate_the_secret_service_along_with_trump/,TrumpterOFyvie,Investigate the Secret Service along with Trump,11395,0.91,468,,1688556844.0,False,False,False,False,False
9,14r9k1r,facepalm,/r/facepalm/comments/14r9k1r/andrew_tate_speaks_on_drakes_new_painted_nails/,Gamer4Lyph,Andrew Tate speaks on Drake’s new Painted Nails,9292,0.88,1653,,1688560852.0,False,False,False,False,False
10,14r9rul,politics,/r/politics/comments/14r9rul/republican_party_called_out_for_july_4_tweet_with/,theindependentonline,Republican Party called out for July 4 tweet – with flag of Liberia not USA,5790,0.96,231,The Independent,1688561408.0,False,False,False,False,False
11,14ra0fy,FunnyandSad,/r/FunnyandSad/comments/14ra0fy/this_is_not_logical/,Sensitive-Jury-1456,This is not logical.,5364,0.94,413,,1688562031.0,False,False,False,False,False
12,14r8kul,shitposting,/r/shitposting/comments/14r8kul/praise_spez_for_making_our_sun_explode/,NCR_Veteran_Rangers,Praise Spez For Making Our Sun Explode,8155,0.95,77,,1688558256.0,False,False,False,False,False
13,14r7req,BeAmazed,/r/BeAmazed/comments/14r7req/a_roof_window_turning_into_a_small_balcony/,Interesting-Gear-819,A roof window turning into a small balcony,8069,0.92,241,,1688555806.0,False,False,False,False,False
14,14r9lh2,technology,/r/technology/comments/14r9lh2/massive_norwegian_phosphate_rock_deposit_can_meet/,Sorin61,"Massive Norwegian phosphate rock deposit can meet fertilizer, solar, and EV battery demand for 100 years",4651,0.96,339,,1688560959.0,False,False,False,False,False
15,14r8fma,antiwork,/r/antiwork/comments/14r8fma/i_really_need_you_to_train_your_replacement_right/,GentlyUsedOtter,"""I really need you to train your replacement right.""",5444,0.97,239,,1688557827.0,False,False,False,False,False
16,14r5m76,therewasanattempt,/r/therewasanattempt/comments/14r5m76/to_look_like_you_care_about_the_environment/,BloodiStag,To look like you care about the environment,59548,0.93,3009,,1688549395.0,False,False,False,False,False
17,14r7fs6,aww,/r/aww/comments/14r7fs6/john_oliver_says_that_continuing_to_use_a_website/,NotDavid-Jatt,"John Oliver says that continuing to use a website that you're ""protesting"" isn't really a protest.",6611,0.88,509,,1688554860.0,False,False,False,False,False
18,14ra813,Whatcouldgowrong,/r/Whatcouldgowrong/comments/14ra813/standing_in_front_of_a_car_drifting/,lou-iz,standing in front of a car drifting,4194,0.96,378,,1688562561.0,False,False,False,False,False
19,14r9ts1,memes,/r/memes/comments/14r9ts1/life_is_a_meme/,Overall-Relation-561,Life is a meme,4634,0.98,124,,1688561538.0,False,False,False,False,False
20,14r7hk2,wholesomememes,/r/wholesomememes/comments/14r7hk2/this_would_be_great/,Albina888,This would be great,6162,0.96,179,,1688554991.0,False,False,False,False,False
21,14r4an4,dankmemes,/r/dankmemes/comments/14r4an4/cant_help_it/,ChildhoodStreet1616,can't help it,20991,0.96,68,☣️,1688545120.0,False,False,False,False,False
22,14r4ls8,technicallythetruth,/r/technicallythetruth/comments/14r4ls8/well_they_are_for_sure/,GignacPL,"Well, they are for sure...",15954,0.97,241,,1688546139.0,False,False,False,False,False
23,14r7lgr,BlackPeopleTwitter,/r/BlackPeopleTwitter/comments/14r7lgr/they_need_to_lock_him_up_fast_because_he_is/,imjustheretodomyjob,they need to lock him up FAST because he is FURIOUS,5364,0.96,185,☑️ / Mod,1688555308.0,False,False,False,False,False
24,14r5azv,MadeMeSmile,/r/MadeMeSmile/comments/14r5azv/a_brain_tumour_changed_her_life_her_nerves_are/,IanAgate,“A brain tumour changed her life. Her nerves are badly damaged! But today she opened a car door…..walked…..opened a gym door…..walked and sat down ..BY HERSELF 💪🏿💪🏿 what a lady”,31227,0.95,808,,1688548390.0,False,False,False,False,False
25,14r573v,news,/r/news/comments/14r573v/tirade_over_cop_charged_with_tasering_95yo_great/,ani625,Tirade over cop charged with tasering 95yo great grandmother,8354,0.95,847,,1688548036.0,False,False,False,False,False
26,14r5crl,Damnthatsinteresting,/r/Damnthatsinteresting/comments/14r5crl/orcas_just_passing_by_two_kids_swimming/,LiteratureOk5964,Orcas just passing by two kids swimming ,24446,0.97,1419,,1688548540.0,False,False,False,False,False
27,14rb7ny,HonkaiStarRail,/r/HonkaiStarRail/comments/14rb7ny/basically_the_great_aeons/,AsaCocoPeko,Basically the Great Aeons,3185,0.96,126,All Hail the Master Diviner :Fuxuan:,1688564937.0,False,False,False,False,False
28,14r65kr,nextfuckinglevel,/r/nextfuckinglevel/comments/14r65kr/a_picture_of_the_beginning_of_the_universe/,3askaryyy,A picture of the beginning of the universe,7701,0.91,551,,1688551083.0,False,False,False,False,False
29,14r6vfj,todayilearned,/r/todayilearned/comments/14r6vfj/til_the_cofounder_of_encyclopædia_britannica_was/,tehflyboy,"TIL the co-founder of Encyclopædia Britannica was a 4'6"" tall Scot with crooked legs and an enormous nose that he would sometimes augment with a papier-mache version. He deliberately rode the tallest horse available in Edinburgh, dismounting by a ladder to the cheers of onlookers.",5724,0.98,113,,1688553166.0,False,False,False,False,False
30,14r48te,WhitePeopleTwitter,/r/WhitePeopleTwitter/comments/14r48te/never_being_told_no_makes_a_person_stupid/,nejicanspin,"Never being told ""no"" makes a person stupid.",30744,0.96,620,,1688544949.0,False,False,False,False,False
31,14r8khv,lgbt,/r/lgbt/comments/14r8khv/according_to_science_trans_and_cis_women_have_the/,Bisexual-Demigod,According to Science Trans and Cis Women have the Exact Same Breast Milk,4176,0.89,277,":genderqueer-bi:  Bi hun, I'm Genderqueer",1688558228.0,False,False,False,False,False
32,14r5zzv,facepalm,/r/facepalm/comments/14r5zzv/famous_gay_murderer_karl_marx/,QJnWo4Life,Famous Gay Murderer Karl Marx,19750,0.88,2308,,1688550587.0,False,False,False,False,False
33,14r3rj7,HolUp,/r/HolUp/comments/14r3rj7/wash_your_hands/,Quobl_69420,Wash your hands,15340,0.95,189,,1688543437.0,True,False,False,False,False
34,14r7noz,movies,/r/movies/comments/14r7noz/new_alien_movie_has_wrapped_filming_ahead_of_2024/,tylerthe-theatre,New Alien movie has wrapped filming ahead of 2024 release,4308,0.94,780,,1688555494.0,False,False,False,False,False
35,14r1xv8,HumansBeingBros,/r/HumansBeingBros/comments/14r1xv8/the_trapped_dog_doesnt_wait_a_bit_to_hug_the/,JettMe_Red,The trapped dog doesn't wait a bit to hug the rescuer after being freed..,27546,0.95,348,,1688537435.0,False,False,False,False,False
36,14r6rug,ContagiousLaughter,/r/ContagiousLaughter/comments/14r6rug/barbie_doll_dad_joke/,NauTWitcher,Barbie Doll dad joke,5336,0.91,83,,1688552861.0,True,False,False,False,False
37,14r9hhl,marvelmemes,/r/marvelmemes/comments/14r9hhl/whats_ur_favourite_song_moment_in_marvel/,ellycutexx,What`s ur favourite song moment in Marvel ?,3287,0.94,462,Avengers,1688560654.0,False,False,False,False,False
38,14r8544,OldSchoolCool,/r/OldSchoolCool/comments/14r8544/henry_mancini_plays_the_iconic_pink_panther_theme/,MulciberTenebras,"Henry Mancini plays the iconic ""Pink Panther Theme"" in 1983, with Plas Johnson (the original saxophone soloist who recorded the song) and the Terry Gibbs band",3770,0.98,167,,1688556915.0,False,False,False,False,False
39,14rbfh2,me_irlgbt,/r/me_irlgbt/comments/14rbfh2/me_irlgbt/,Sonic_the_hedgedog,me_irlgbt,2379,0.96,18,MLM/Ace :mlm_ace:,1688565451.0,False,False,False,False,False
40,14r5xv7,formuladank,/r/formuladank/comments/14r5xv7/official_interview_with_max_verstappens/,External-Duty-8190,Official interview with Max Verstappen's performance coach,5733,0.96,108,BWOAHHHHHHH ,1688550391.0,False,False,False,False,False
41,14r9sf6,oddlysatisfying,/r/oddlysatisfying/comments/14r9sf6/gorilla_sculpture_made_out_of_colored_pencils/,yourSAS,Gorilla sculpture made out of colored pencils,2896,0.97,49,,1688561442.0,False,False,False,False,False
42,14r6h00,Catswithjobs,/r/Catswithjobs/comments/14r6h00/we_seem_to_have_forgotten_a_major_detail_in_this/,freshkillcams,We seem to have forgotten a major detail in this computer assembly,4986,0.95,119,,1688551988.0,False,False,False,False,False
43,14rd7ia,AnimalsBeingBros,/r/AnimalsBeingBros/comments/14rd7ia/this_farmer_is_sad_and_first_dogs_try_to_cheer/,Careful_Cup4484,"This farmer is sad, and first, dogs try to cheer him. When they can't, they call cows & donkeys",1858,0.97,43,,1688569385.0,False,False,False,False,False
44,14r9438,LateStageCapitalism,/r/LateStageCapitalism/comments/14r9438/accurate/,HankScorpio42,Accurate,3013,0.95,79,,1688559681.0,False,False,False,False,False
45,14rbklm,funny,/r/funny/comments/14rbklm/im_not_actually_sure_what_to_title_this/,NMD_Animations,I’m not actually sure what to title this…,2213,0.89,128,,1688565778.0,False,False,False,False,False
46,14r5u8s,AITAH,/r/AITAH/comments/14r5u8s/aitah_for_refusing_to_see_my_dad_after_he/,OtherwisePea5543,AITAH for refusing to see my dad after he disowned me when he found out I'm not his biologocal daughter?,5247,0.94,1706,,1688550070.0,False,1688574452.0,False,False,False
47,14rb5i1,horror,/r/horror/comments/14rb5i1/simon_pegg_says_people_dont_fcking_need_shaun_of/,Neo2199,Simon Pegg Says People Don’t ‘F*cking Need’ ‘Shaun of the Dead 2:’ ‘Move On’,2234,0.97,313,,1688564779.0,False,False,False,False,False
48,14r9wg2,MaliciousCompliance,/r/MaliciousCompliance/comments/14r9wg2/management_thought_they_didnt_need_me_turns_out/,Hot-Wallaby-6402,"Management thought they didn't need me, turns out they decided to try and sue me",2534,0.97,77,,1688561728.0,False,False,False,False,True
49,14r3h7g,JustGuysBeingDudes,/r/JustGuysBeingDudes/comments/14r3h7g/men_are_simple/,flattenedbricks,Men are simple,8404,0.96,178,Lego Bricks,1688542457.0,False,False,False,False,False
50,14r782u,freefolk,/r/freefolk/comments/14r782u/this_gave_me_more_chills_than_the_entire_of/,SnooMacarons9592,This gave me more chills than the entire of season 8!!!,3730,0.94,176,We do not kneel,1688554240.0,True,False,False,False,False
51,14r3pxw,WTF,/r/WTF/comments/14r3pxw/surviving_the_spaghetti_monster/,JamesChisolm,Surviving the spaghetti monster,6897,0.96,291,,1688543289.0,False,False,False,False,False
52,14r3szk,UkraineWarVideoReport,/r/UkraineWarVideoReport/comments/14r3szk/drone_footage_of_yesterdays_massive_ammo_dump/,Repulsive-Pattern-57,Drone footage of yesterday’s massive ammo dump explosion in temporarily occupied Makiivka,6827,0.97,400,,1688543574.0,False,False,False,False,False
53,14r3fqm,comics,/r/comics/comments/14r3fqm/in_these_uncertain_times_find_a_support_crew_that/,spinachgreen,"In these uncertain times, find a support crew that always has your back",7563,0.96,44,,1688542315.0,False,False,False,False,True
54,14r85e3,LeopardsAteMyFace,/r/LeopardsAteMyFace/comments/14r85e3/swing_state_republicans_bleed_donors_and_cash/,GenghisHam,Swing state Republicans bleed donors and cash over Trump's false election claims,2965,0.97,97,,1688556931.0,False,False,False,False,False
55,14r8o5h,maybemaybemaybe,/r/maybemaybemaybe/comments/14r8o5h/maybe_maybe_maybe/,tactful_adelyn8,Maybe maybe maybe,2845,0.91,54,,1688558504.0,False,False,False,False,False
56,14rbu25,NonPoliticalTwitter,/r/NonPoliticalTwitter/comments/14rbu25/i_guess_we_could_try/,KingFahad360,I guess we could try.,1824,0.97,93,:blue1::blue2::1111::1112:,1688566375.0,False,False,False,False,False
57,14raq14,lotrmemes,/r/lotrmemes/comments/14raq14/whoa_see_that/,LovableConstable,whoa! see that?,2101,0.99,22,,1688563756.0,False,False,False,False,False
58,14r4l4s,nba,/r/nba/comments/14r4l4s/vernon_dillon_brooks_took_991_shots_last_year_he/,ErnehJohnson,[Vernon] Dillon Brooks took 991 shots last year. He shot 39.6%. There is only one player in the entire NBA that took more shots and hit less. That player? Fred Van Vleet. 😬,5300,0.97,478,:gsw-3: San Francisco Warriors,1688546083.0,False,1688550611.0,False,False,False
59,14ra9v3,iamatotalpieceofshit,/r/iamatotalpieceofshit/comments/14ra9v3/girl_pretends_to_clean_up_a_beach_for_her_social/,kakapoopoopeepeeshir,Girl pretends to clean up a beach for her social media content then proceeds to leave the trash bags on the beach. ,2174,0.98,150,,1688562682.0,False,False,False,False,False
60,14r6d3t,interesting,/r/interesting/comments/14r6d3t/how_to_skin_a_car/,No_Tax4450,"How to ""skin"" a car.",4047,0.97,430,,1688551671.0,False,False,False,False,False
61,14raer4,sewing,/r/sewing/comments/14raer4/i_made_a_boston_subway_seat_matching_set/,passthegoldenbutter,I made a Boston subway seat matching set,2070,0.97,71,,1688562990.0,False,False,False,False,False
62,14r8oi6,nextfuckinglevel,/r/nextfuckinglevel/comments/14r8oi6/the_developers_watching_a_speedrunner_finish_a/,SuperAlloyBerserker,The developers watching a speedrunner finish a mission in the game in just 6 seconds,4379,0.98,102,,1688558527.0,False,False,False,False,False
63,14r7til,PoliticalHumor,/r/PoliticalHumor/comments/14r7til/maybe_you_can_share_a_cell/,7dayweekendgirl,Maybe you can share a cell,2898,0.97,114,,1688555983.0,False,False,False,False,False
64,14r20o1,TikTokCringe,/r/TikTokCringe/comments/14r20o1/pretty_much_child_abuse/,Fr0stRa1d,Pretty much child abuse,12321,0.88,2588,"Sort by flair, dumbass",1688537703.0,False,False,False,False,False
65,14r9ldh,teenagers,/r/teenagers/comments/14r9ldh/how_do_you_come_up_with_that_though/,PheonixGalaxy,How do you come up with that though?,2348,0.98,93,16,1688560951.0,False,False,False,False,False
66,14r6bf0,politics,/r/politics/comments/14r6bf0/senate_republicans_fear_abortion_could_derail/,malcolm58,Senate Republicans fear abortion could derail hopes for majority,5895,0.96,636,,1688551527.0,False,False,False,False,False
67,14r4e87,AnimalsBeingDerps,/r/AnimalsBeingDerps/comments/14r4e87/hardworking_pupper/,stranger_in_the_boat,Hard-working pupper,5345,0.94,64,,1688545461.0,False,False,False,False,False
68,14r5fjk,Piracy,/r/Piracy/comments/14r5fjk/guess_whos_back_again/,Steelouuu,Guess who's back again,4206,0.95,210, ,1688548807.0,False,False,False,False,False
69,14r8qky,todayilearned,/r/todayilearned/comments/14r8qky/til_the_migratory_monarch_butterfly_known_for_its/,SuvenPan,TIL The migratory monarch butterfly known for its spectacular annual journey across the Americas was officially declared Endangered in 2022.,3786,0.99,119,,1688558668.0,False,False,False,False,False
70,14r4kgc,anime_irl,/r/anime_irl/comments/14r4kgc/anime_irl/,X3non13,anime_irl,5440,0.89,177,,1688546021.0,False,False,False,False,False
71,14r2tjx,cats,/r/cats/comments/14r2tjx/a_new_neighbor/,TraditionalElk781,A new neighbor.,7195,0.98,157,,1688540374.0,False,False,False,False,False
72,14r5ijb,europe,/r/europe/comments/14r5ijb/we_must_admit_brexit_is_a_mistake_and_rejoin_the/,SunEater888,"We must admit Brexit is a mistake and rejoin the single market, says senior Tory Tobias Ellwood",3937,0.93,567,,1688549071.0,False,False,False,False,False
73,14r4zu3,SipsTea,/r/SipsTea/comments/14r4zu3/the_massive_robot_bug_on_the_right_runs_into_the/,ClassicCrows,The massive ROBOT bug on the right runs into the actual issue.,4523,0.98,79,,1688547436.0,False,False,False,False,False
74,14r35j7,whenthe,/r/whenthe/comments/14r35j7/i_live_in_slc_ut_but_we_used_to_live_in_w/,YoruDenftw,"""i live in SLC, UT 🤓 but we used to live in W-""",7982,0.9,338,,1688541396.0,False,False,False,False,False
75,14r6dy8,tumblr,/r/tumblr/comments/14r6dy8/funky_mycelium/,Peter_Rodruigues,Funky mycelium,3376,0.98,92,,1688551743.0,False,False,False,False,False
76,14r84ed,pcmasterrace,/r/pcmasterrace/comments/14r84ed/another_sale_another_full_cart/,Jacksaur,"Another sale, another full cart...",2448,0.97,127,7700X | RTX 3080 | 32GB | 9.5 TB,1688556858.0,False,False,False,False,False
77,14r9v2y,WhitePeopleTwitter,/r/WhitePeopleTwitter/comments/14r9v2y/everything_trump_touches_dies/,JohnSheet69420,Everything Trump touches DIES,4678,0.99,238,,1688561634.0,False,False,False,False,False
78,14r15ms,Unexpected,/r/Unexpected/comments/14r15ms/why_the_food_takes_so_long_at_mcdonalds/,ge0oo,Why the food takes so long at Mcdonalds...,10618,0.94,126,,1688534769.0,False,False,False,False,True
79,14r8701,TwoSentenceHorror,/r/TwoSentenceHorror/comments/14r8701/i_sat_in_the_waiting_room_as_the_agonized_screams/,No_Cloud_7275,I sat in the waiting room as the agonized screams of my newborn echoed from the operating room.,2374,0.95,148,,1688557075.0,False,False,False,False,False
80,14r7507,HolUp,/r/HolUp/comments/14r7507/ayo_what/,Sujaan20,Ayo what !,5220,0.94,111,,1688553989.0,False,False,False,False,False
81,14r1xw8,cursedcomments,/r/cursedcomments/comments/14r1xw8/cursed_ny_car/,UnknownSuxker,Cursed_NY car,11247,0.96,270,,1688537438.0,False,False,False,False,False
82,14r6op0,chessbeginners,/r/chessbeginners/comments/14r6op0/why_didnt_the_game_end/,Red-Pony,“Why didn’t the game end?”,3009,0.96,171,,1688552602.0,False,False,False,False,False
83,14r8tgt,memes,/r/memes/comments/14r8tgt/ill_wait_2_years_for_that_appointment/,Carlbarat1,I'll wait 2 years for that appointment..,4603,0.78,545,,1688558897.0,False,False,False,False,False
84,14rb6my,BrandNewSentence,/r/BrandNewSentence/comments/14rb6my/good_lord/,TicTacTax2007,Good lord,1497,0.97,99,,1688564861.0,False,False,False,False,False
85,14r9tti,MemePiece,/r/MemePiece/comments/14r9tti/oh_hell_take_care_of_em_alright/,metalhiro,"Oh, he’ll take care of em, alright.",1786,0.98,30,,1688561541.0,False,False,False,False,False
86,14r5425,Hololive,/r/Hololive/comments/14r5425/jp_bro_came_all_the_way_from_japan_to_watch_the/,Buttermilkman,JP bro came all the way from Japan to watch the EN concert,3825,0.96,68,:Miko:,1688547784.0,False,False,False,False,False
87,14ra9qk,IllegallySmolCats,/r/IllegallySmolCats/comments/14ra9qk/update_on_the_illegally_smol_vagrant_in_our/,wednesdayMD6,Update on the illegally smol vagrant in our custody.,1653,0.98,32,,1688562674.0,False,False,False,False,False
88,14r7s5j,MoldyMemes,/r/MoldyMemes/comments/14r7s5j/cat/,Weak-Sherbert-9124,cat,2430,0.99,38,,1688555865.0,False,False,False,False,False
89,14r0r2n,meirl,/r/meirl/comments/14r0r2n/meirl/,Majestic-Unicorn33,meirl,40054,0.97,350,,1688533427.0,False,False,False,False,False
90,14rb75o,insanepeoplefacebook,/r/insanepeoplefacebook/comments/14rb75o/literally_1984_but_like_unironically_said/,velduz,Literally 1984 but like unironically said.,1457,0.98,109,,1688564898.0,False,False,False,False,False
91,14raash,diablo4,/r/diablo4/comments/14raash/why_30_persons_in_this_sub_always_trying_to/,lionblackwood,Why 30+ persons in this sub always trying to mention their age?,1636,0.79,1162,,1688562751.0,False,False,False,False,False
92,14rcjv1,OnePunchMan,/r/OnePunchMan/comments/14rcjv1/battle_of_the_brainrot/,GodNonon,Battle of the Brainrot,1236,0.97,58,Nonon One Punches Saitama,1688568008.0,False,False,False,False,False
93,14r8ros,Gunners,/r/Gunners/comments/14r8ros/david_ornstein_on_twitter_arsenal_have_now/,WeedScaper,David Ornstein on Twitter: 🚨 Arsenal have now reached full agreement with Ajax to sign Jurrien Timber. Negotiations completed on fee of €40m + €5m in largely realistic bonuses. 22yo defender granted permission to undergo medical & finalise personal terms @TheAthleticFC #AFC #Ajax,1937,0.96,174,,1688558751.0,False,False,False,False,False
94,14r8ztv,Breath_of_the_Wild,/r/Breath_of_the_Wild/comments/14r8ztv/nintendo_really_cooked_with_zelda_this_generation/,Crusty783,Nintendo really cooked with Zelda this generation,1876,0.95,115,,1688559374.0,False,False,False,False,False
95,14r5hbu,PublicFreakout,/r/PublicFreakout/comments/14r5hbu/why_only_get_a_ticket_when_you_can_get_tased_and/,1Hate17Here,Why only get a ticket when you can get tased and charged with a felony instead. ¯\(ツ)/¯,3283,0.92,454,,1688548954.0,False,False,False,False,False
96,14r3yk4,ukraine,/r/ukraine/comments/14r3yk4/drone_footage_of_the_recent_massive_ammunition/,ijnfrt,Drone footage of the recent massive ammunition detonation in occupied Makiivka,4229,0.97,258,,1688544071.0,False,False,False,False,False
97,14r7ul1,natureismetal,/r/natureismetal/comments/14r7ul1/norwegian_lamb_born_with_black_metal_corpse_paint/,dragonoid296,Norwegian lamb born with black metal corpse paint,2161,0.96,37,,1688556064.0,False,False,False,False,False
98,14r9qa2,furry_irl,/r/furry_irl/comments/14r9qa2/furry_irl/,BonnyDraws,Furry_irl,1658,0.91,257,"""It's just my art style""",1688561298.0,False,False,False,False,False
99,14qzviy,AskReddit,/r/AskReddit/comments/14qzviy/if_poor_people_fantasize_about_winning_the/,more_bees_pleas,"If poor people fantasize about winning the lottery, then what do rich people fantasize about?",11972,0.91,7152,,1688530598.0,False,False,False,False,False
100,14r9jnu,Eldenring,/r/Eldenring/comments/14r9jnu/small_haligtree_lifehack/,Brutalonym,Small Haligtree Lifehack,1661,0.99,54,,1688560823.0,False,False,False,False,True
