rank,id,subreddit,permalink,author,title,score,upvote_ratio,num_comments,author_flair_text,created_utc,over_18,edited,stickied,locked,is_original_content
1,14qefea,Unexpected,/r/Unexpected/comments/14qefea/heres_how_you_say_thanks_for_avoiding_a_traffic/,Xador3d,Here's how you say thanks for avoiding a traffic incident,19523,0.96,618,,1688475187.0,True,False,False,False,True
2,14qf9jb,funny,/r/funny/comments/14qf9jb/juno_a_beluga_whale_that_loves_scaring_people/,m3nation007,Juno a beluga whale that loves scaring people,10715,0.97,447,,1688477373.0,False,False,False,False,False
3,14qdjt6,Whatcouldgowrong,/r/Whatcouldgowrong/comments/14qdjt6/wcgw_driving_on_an_exclusive_bus_lane_ph/,DrownedGoddd,WCGW driving on an exclusive bus lane? (PH),13448,0.98,362,,1688472676.0,False,False,False,False,False
4,14qd3r1,wholesomememes,/r/wholesomememes/comments/14qd3r1/danny_trejo_and_the_muppets/,slimyrssocks,Danny Trejo and the Muppets,13829,0.97,168,,1688471334.0,False,False,False,False,False
5,14qe9ro,todayilearned,/r/todayilearned/comments/14qe9ro/til_that_when_robert_de_niro_was_in_the_process/,astarisaslave,"TIL that when Robert de Niro was in the process of receiving Italian citizenship, he faced opposition from the Italian American group Sons of Italy, who claimed that De Niro had damaged the public image of Italians by portraying criminals in his movies.",8620,0.97,523,,1688474773.0,False,False,False,False,False
6,14qextc,memes,/r/memes/comments/14qextc/he_didnt_deserve_the_harassment_i_wish_him_the/,We_Will_AlI_Die,he didn’t deserve the harassment. I wish him the best.,13249,0.93,360,🏳️‍🌈LGBTQ+🏳️‍🌈,1688476495.0,False,False,False,False,False
7,14qcrjy,WhitePeopleTwitter,/r/WhitePeopleTwitter/comments/14qcrjy/what_a_great_system_we_got_in_murica/,Paneraiguy1,What a great system we got in Murica 🤦🏽‍♂️,11366,0.95,624,,1688470312.0,False,False,False,False,False
8,14qcav9,antiwork,/r/antiwork/comments/14qcav9/amongst_the_other_things_of_course/,snowpie92,Amongst the other things of course...,11717,0.93,1039,,1688468956.0,False,False,False,False,False
9,14qdfqw,TikTokCringe,/r/TikTokCringe/comments/14qdfqw/latest_on_who_is_actually_hurting_kids_in_the_usa/,cak3crumbs,Latest on who is actually hurting kids in the USA,8082,0.92,576,,1688472330.0,False,False,False,False,False
10,14qg6a3,Damnthatsinteresting,/r/Damnthatsinteresting/comments/14qg6a3/a_goat_trying_to_get_rid_of_parasites/,Reincarneme,A goat trying to get rid of parasites,5305,0.96,333,,1688479562.0,False,False,False,False,False
11,14qdwf3,PrequelMemes,/r/PrequelMemes/comments/14qdwf3/it_is_kinda_weird_they_painted_her_face_on_their/,jokoil,It is kinda weird they painted her face on their helmet lol,8190,0.93,189,,1688473728.0,False,False,False,False,False
12,14qbjos,wholesome,/r/wholesome/comments/14qbjos/this_guy_saved_mans_life/,ReservedEmber,This guy saved man's life,12052,0.98,259,,1688466667.0,False,False,False,False,False
13,14qeoe6,politics,/r/politics/comments/14qeoe6/the_supreme_court_may_preemptively_ban_a_federal/,Thenotsogaypirate,The Supreme Court May Preemptively Ban a Federal Wealth Tax,5424,0.96,1015,:flag-co: Colorado,1688475814.0,False,False,False,False,False
14,14qdz2t,shitposting,/r/shitposting/comments/14qdz2t/a_taste_of_their_own_medicine_praise_spez/,fabioke,A taste of their own medicine (Praise Spez),8493,0.94,100,,1688473928.0,False,False,False,False,False
15,14qdo7r,WinStupidPrizes,/r/WinStupidPrizes/comments/14qdo7r/driving_on_an_exclusive_bus_lane_ph/,DrownedGoddd,.. driving on an exclusive bus lane. (PH),5932,0.97,259,,1688473053.0,False,False,False,False,False
16,14qa6sd,mildlyinfuriating,/r/mildlyinfuriating/comments/14qa6sd/after_talking_for_4_hours/,Bones231,After talking for 4 hours..,18330,0.92,2296,,1688462363.0,False,False,False,False,False
17,14qcpfv,facepalm,/r/facepalm/comments/14qcpfv/texas_be_like/,AccurateInteract,Texas be like.,7660,0.97,611,,1688470152.0,False,False,False,False,False
18,14qcwgv,WorkReform,/r/WorkReform/comments/14qcwgv/3_unrig_the_system/,Firm_Scene4556,#3 Unrig The System,5677,0.97,101,,1688470719.0,False,False,False,False,False
19,14qeyln,nextfuckinglevel,/r/nextfuckinglevel/comments/14qeyln/the_propagation_of_sound_wave_after_explosion/,h3_nryy,The propagation of sound wave after explosion..,4201,0.97,219,,1688476549.0,False,False,False,False,False
20,14q8m5w,MadeMeSmile,/r/MadeMeSmile/comments/14q8m5w/dog_seeks_help_from_a_random_person_to_rescue_his/,daas_hu_gurudev_ka,Dog seeks help from a random person to rescue his brother. ,26668,0.94,526,,1688457269.0,False,False,False,False,False
21,14qc9bs,news,/r/news/comments/14qc9bs/woman_dies_while_hiking_in_tripledigit_heat_at/,Bullingen,Woman dies while hiking in triple-digit heat at Grand Canyon National Park,6089,0.97,672,,1688468820.0,False,False,False,False,False
22,14qaptg,HolUp,/r/HolUp/comments/14qaptg/wait/,koka-kun,Wait...,11529,0.96,241,,1688464066.0,False,False,False,False,False
23,14qd6rp,worldnews,/r/worldnews/comments/14qd6rp/you_can_never_become_a_westerner_chinas_top/,Golmar_gaming227,‘You can never become a Westerner:’ China’s top diplomat urges Japan and South Korea to align with Beijing and ‘revitalize Asia’,4619,0.95,1161,,1688471590.0,False,False,False,False,False
24,14qbrub,therewasanattempt,/r/therewasanattempt/comments/14qbrub/to_use_escalator_as_a_convey_belt/,shurikien,To use escalator as a convey belt,6486,0.96,334,,1688467381.0,False,False,False,False,False
25,14qbugp,WTF,/r/WTF/comments/14qbugp/going_to_work_on_the_other_side_of_the_river/,demetri47,Going to work on the other side of the river,5770,0.95,187,,1688467612.0,True,False,False,False,False
26,14qfepw,dankmemes,/r/dankmemes/comments/14qfepw/still_pretty_good/,Unlucky_Process_6537,Still pretty good,3523,0.94,70,,1688477739.0,False,False,False,False,False
27,14q9nwe,oddlysatisfying,/r/oddlysatisfying/comments/14q9nwe/cleaning_out_a_clothes_dryer_vent/,BloodScumbag,Cleaning out a clothes dryer vent,10293,0.97,464,,1688460729.0,False,False,False,False,False
28,14q8ahw,lotrmemes,/r/lotrmemes/comments/14q8ahw/take_a_seat_boromir/,lord-of-the-bricks,Take a seat Boromir 😆,16101,0.97,213,,1688456170.0,False,False,False,False,False
29,14q9cu9,meirl,/r/meirl/comments/14q9cu9/meirl/,ccomie,meirl,11090,0.93,658,,1688459726.0,False,False,False,False,False
30,14qc8ig,ContagiousLaughter,/r/ContagiousLaughter/comments/14qc8ig/mock_interview/,Hypnoidz,Mock interview ,5080,0.94,213,,1688468753.0,False,False,False,False,False
31,14qe84b,WhitePeopleTwitter,/r/WhitePeopleTwitter/comments/14qe84b/trump_posting_at_230_am_that_he_won_the_election/,Travismatthew08,Trump posting at 2:30 am that he won the election…. Because we don’t wear Biden hats. FFS.,6965,0.97,892,,1688474649.0,False,False,False,False,False
32,14qegax,CrazyFuckingVideos,/r/CrazyFuckingVideos/comments/14qegax/women_claims_she_sees_someone_on_back_of_american/,QuietWest3764,Women claims she sees someone on back of American Airlines flight that isn’t “real” . Flight delayed 3 hours due to crew checking for any suspicious activity. ,3303,0.95,783,,1688475257.0,False,False,False,False,False
33,14qbvf8,LateStageCapitalism,/r/LateStageCapitalism/comments/14qbvf8/just_work_and_have_no_demands/,Common_Thinker,Just work and have no demands,4804,0.98,52,,1688467688.0,False,False,False,False,False
34,14qdpv2,OldSchoolCool,/r/OldSchoolCool/comments/14qdpv2/prince_roller_skating_on_his_tennis_court_at_home/,Unkie_Al,Prince roller skating on his tennis court at home (1989),3507,0.95,174,,1688473186.0,False,False,False,False,False
35,14qbkqz,Satisfyingasfuck,/r/Satisfyingasfuck/comments/14qbkqz/it_went_form_i_could_do_that_to_holy_shit_hes_good/,FirmJewelefg,"It went form I could do that to holy shit, he's good",5333,0.94,169,,1688466758.0,False,False,False,False,False
36,14qexrw,discordVideos,/r/discordVideos/comments/14qexrw/my_bad_guys_i_think_i_fucked_up/,I_am_Fang_Yuan_,"my bad guys, I think I fucked up...",3040,0.97,31,,1688476492.0,False,False,False,False,False
37,14qdr74,nba,/r/nba/comments/14qdr74/sidery_the_trail_blazers_are_not_impressed_with/,hc2919,"[Sidery] The Trail Blazers are “not impressed” with the Heat’s trade package for Damian Lillard, which could lead to a deal elsewhere now, per @wojespn:",3327,0.95,1334,,1688473295.0,False,False,False,False,False
38,14qex4u,Unexpected,/r/Unexpected/comments/14qex4u/how_to_get_a_womans_attention_in_the_gym/,Heymynameisdistance,How To Get A Woman's Attention In The Gym,6324,0.89,187,,1688476447.0,False,False,False,False,True
39,14q8c41,Showerthoughts,/r/Showerthoughts/comments/14q8c41/pants_are_more_practical_for_female_anatomy_while/,johnjmcmillion,"Pants are more practical for female anatomy while skirts and dresses are better suited for male anatomoy, yet we insist on the reverse.",11034,0.88,1129,,1688456324.0,False,False,False,False,False
40,14qds56,BeAmazed,/r/BeAmazed/comments/14qds56/the_msg_sphere_doing_tests_in_las_vegas/,MarionberryRight8261,The MSG sphere doing tests in Las Vegas,3243,0.97,330,,1688473375.0,False,False,False,False,False
41,14qbyx1,whenthe,/r/whenthe/comments/14qbyx1/the_fate_of_all_good_indie_games/,SirShadyVI,the fate of all good indie games,5243,0.95,374,local touhou poster (moriya shrine's #1 conspirator),1688467987.0,False,False,False,False,False
42,14qcus1,ImTheMainCharacter,/r/ImTheMainCharacter/comments/14qcus1/i_crave_attention/,Xxcloudy_mindzxX,I crave attention,3673,0.96,384,,1688470580.0,False,False,False,False,False
43,14qcmxm,comics,/r/comics/comments/14qcmxm/first_time_sharing_a_comic_on_here_but_i_was_kind/,MeikoV3NotSoStraight,First time sharing a comic on here but I was kind of proud of this one,3815,0.94,112,,1688469939.0,False,False,False,False,False
44,14qb4w5,pcmasterrace,/r/pcmasterrace/comments/14qb4w5/friend_works_at_a_pc_shop_customer_came_in/,themajod,"Friend works at a PC shop. Customer came in stating ""I upgraded my CPU and cooler, and it won't boot.""",4618,0.96,295,13900K + 7900XTX / 13600KF + 7900XT,1688465413.0,False,False,False,False,False
45,14qa25c,Animemes,/r/Animemes/comments/14qa25c/those_poor_isekai_people_dont_even_have_their/,Rashtrapateen,Those poor isekai people don't even have their Batman,5822,0.96,159,,1688461959.0,False,False,False,False,False
46,14qfl3g,BlackPeopleTwitter,/r/BlackPeopleTwitter/comments/14qfl3g/brocquaintances/,PrinceTaj97,“Brocquaintances”,2056,0.97,27,,1688478167.0,False,False,False,False,False
47,14qhd1v,SipsTea,/r/SipsTea/comments/14qhd1v/the_goat_is_back/,HorrorTroublez,The goat is back.,1680,0.98,25,,1688482407.0,False,False,False,False,False
48,14q8pp7,facepalm,/r/facepalm/comments/14q8pp7/tourist_at_yellowstone_national_park_illegally/,carrotwhirl,Tourist at Yellowstone National Park illegally dips her hand into a hot spring,25053,0.95,2869,,1688457602.0,False,False,False,False,False
49,14qbpxp,fightporn,/r/fightporn/comments/14qbpxp/drunk_man_hits_a_car_las_vegas_july_3_2023/,ScuffedA7IVphotog,"Drunk man hits a car - Las Vegas July 3, 2023",3609,0.95,360,,1688467209.0,False,False,False,False,True
50,14qg6st,tumblr,/r/tumblr/comments/14qg6st/welp/,competitive-dust,Welp!,1822,0.99,25,,1688479596.0,False,False,False,False,False
51,14qhvus,NonPoliticalTwitter,/r/NonPoliticalTwitter/comments/14qhvus/its_a_trap/,1Hate17Here,It’s a trap!,1474,0.99,14,:blue1::blue2::1111::1112:,1688483567.0,False,False,False,False,False
52,14qez3s,tifu,/r/tifu/comments/14qez3s/tifu_by_ignoring_every_hint_that_she_wanted_to/,NoExplanation3017,TIFU by ignoring every hint that she wanted to sleep with me.,2027,0.91,292,,1688476586.0,True,False,False,False,False
53,14q735l,PublicFreakout,/r/PublicFreakout/comments/14q735l/bald_guy_yeah_because_this_is_not_mexico/,BpImperial,Bald guy “yeah because this is not Mexico”,9089,0.94,1441,,1688452225.0,False,False,False,False,False
54,14qb46j,technology,/r/technology/comments/14qb46j/apple_is_reportedly_scaling_back_production_plans/,pecika,"Apple Is Reportedly Scaling Back Production Plans of Its $3,499 Vision Pro Mixed Reality Headset",3630,0.93,968,,1688465348.0,False,False,False,False,False
55,14qdbhb,Genshin_Impact,/r/Genshin_Impact/comments/14qdbhb/comic_hu_tao_and_the_i_love_you_game_translated/,theparacite,"(Comic) Hu Tao and the ""I Love You"" Game (Translated) [Pic Postcard]",2516,0.94,50,Yae Publishing's In-house Translator,1688472021.0,False,False,False,False,False
56,14qasld,worldnews,/r/worldnews/comments/14qasld/taliban_ban_womens_beauty_salons_in_afghanistan/,newnemo,Taliban ban women's beauty salons in Afghanistan,7070,0.96,926,,1688464314.0,False,False,False,False,False
57,14qa8di,Eldenring,/r/Eldenring/comments/14qa8di/its_called_a_giantcrusher_for_a_reason/,jdyhrberg,It's called a Giant-Crusher for a reason,3955,0.98,108,AKA - Sax Slave Gael  :platinum:,1688462497.0,False,False,False,False,False
58,14qf664,IASIP,/r/IASIP/comments/14qf664/whats_the_name_of_the_kid_who_plays_young_frank/,spewlingKing,What’s the name of the kid who plays young Frank?,1765,0.97,131,,1688477121.0,False,False,False,False,False
59,14qczo3,inthenews,/r/inthenews/comments/14qczo3/josh_hawleys_wife_faces_calls_to_be_sanctioned/,MOONL16H777,Josh Hawley's wife faces calls to be sanctioned over Supreme Court case,2394,0.97,189,,1688470979.0,False,False,False,False,False
60,14qbed2,MinecraftMemes,/r/MinecraftMemes/comments/14qbed2/i_know_its_a_bit_late/,JaanlewaBaba_69,I know it's a bit late,3568,0.94,99,,1688466217.0,False,False,False,False,False
61,14q96wy,oddlyterrifying,/r/oddlyterrifying/comments/14q96wy/xrays_of_hands_after_firework_accidents/,Wuz314159,X-Rays of hands after firework accidents,4913,0.97,212,,1688459146.0,True,False,False,False,False
62,14qcdxe,terriblefacebookmemes,/r/terriblefacebookmemes/comments/14qcdxe/assuming_all_women_only_get_piercings_to_attract/,brimarie03,Assuming all women only get piercings to attract a man,2723,0.9,307,,1688469206.0,False,False,False,False,False
63,14qetu2,formuladank,/r/formuladank/comments/14qetu2/red_bull_racing_being_a_comedy_club_austria/,Manonstop,Red Bull Racing being a comedy club - Austria,1820,0.98,81,BWOAHHHHHHH ,1688476203.0,False,False,False,False,False
64,14qhdc1,shittymoviedetails,/r/shittymoviedetails/comments/14qhdc1/at_the_end_of_oppenheimer_2023_the_main_character/,grichardson526,"At the end of ""Oppenheimer"" (2023), the main character comes home at night and a mysterious man steps out of the shadows. ""My name is Albert Einstein"" he says. ""I'm here to talk to you about the Physicists Initiative.""",1344,0.98,26,,1688482427.0,False,False,False,False,False
65,14qbkof,anime_irl,/r/anime_irl/comments/14qbkof/anime_irl/,6cheems9,anime_irl,3046,0.97,98,,1688466750.0,False,False,False,False,False
66,14qfoda,distressingmemes,/r/distressingmemes/comments/14qfoda/dont_move_dont_move_dont_move/,ListerineAfterOral,dont move dont move dont move,1583,0.98,43,☠️Not even death can save you from me☠️,1688478384.0,False,False,False,False,False
67,14qboze,ukraine,/r/ukraine/comments/14qboze/footage_of_a_mineroller_detonating_a_mine/,C00L_HAND,Footage of a Mineroller detonating a mine,2801,0.97,159,,1688467125.0,False,False,False,False,False
68,14qclbx,DnD,/r/DnD/comments/14qclbx/my_party_dont_realise_npcs_can_lie/,Nightblade81,My Party don't realise NPC's can lie...,2413,0.97,233,,1688469809.0,False,1688482018.0,False,False,False
69,14qa0yt,DunderMifflin,/r/DunderMifflin/comments/14qa0yt/cathy_was_a_bitch/,DiannSotelo,Cathy was a bitch.,3718,0.96,173,,1688461858.0,False,False,False,False,False
70,14q9ajj,HolUp,/r/HolUp/comments/14q9ajj/secret_handshakes_with_the_homies/,Cubelock,Secret handshakes with the homies,11459,0.93,153,,1688459502.0,False,False,False,False,False
71,14qextw,awfuleverything,/r/awfuleverything/comments/14qextw/joke/,MufuckinTurtleBear,"""joke""",1689,0.94,48,,1688476496.0,False,False,False,False,False
72,14qfj6i,AITAH,/r/AITAH/comments/14qfj6i/aitah_for_rejecting_a_transgender_woman_after_our/,pimpc3ss,AITAH for rejecting a transgender woman after our date?,1560,0.9,904,,1688478039.0,False,False,False,False,False
73,14q7wfd,Eyebleach,/r/Eyebleach/comments/14q7wfd/elephants_are_such_magical_creature/,MoniMokshith,Elephants are such magical creature..,5482,0.98,68,,1688454865.0,False,False,False,False,False
74,14q9q50,meirl,/r/meirl/comments/14q9q50/meirl/,juijii,meirl,8481,0.95,449,,1688460933.0,False,False,False,False,False
75,14qf089,memes,/r/memes/comments/14qf089/unanswerable_question/,Somedaysxs,Unanswerable Question,3172,0.97,243,OC Meme Maker,1688476674.0,False,False,False,False,False
76,14qfviw,WhitePeopleTwitter,/r/WhitePeopleTwitter/comments/14qfviw/so_they_didnt_see_any_red_flags_before_that/,thatguy9684736255,So they didn't see any red flags before that homophobic anti-trump ad?,4878,0.99,513,,1688478868.0,False,False,False,False,False
77,14q8phj,CasualUK,/r/CasualUK/comments/14q8phj/what_do_i_do/,LeopardVarious5740,WHAT DO I DO???,4323,0.97,276,,1688457584.0,False,False,False,False,False
78,14qc2x5,oddlyspecific,/r/oddlyspecific/comments/14qc2x5/i_wonder_what_happened/,frenchie04103,I wonder what happened...,2469,0.98,64,,1688468332.0,False,False,False,False,False
79,14q3qmf,cats,/r/cats/comments/14q3qmf/my_boyfriend_and_i_found_this_kitten_last_night/,khaleesi2305,"My boyfriend and I found this kitten last night out on the streets, clearly sick and starving. I spent 600$ taking her to the emergency today and my boyfriend is a bit unhappy with me about it. Please tell me I did the right thing.",25493,0.86,2221,,1688441844.0,False,False,False,True,False
80,14qep8i,instantkarma,/r/instantkarma/comments/14qep8i/the_last_samurai/,juzlez,The Last Samurai,1590,0.96,74,,1688475869.0,False,False,False,False,False
81,14qet62,PeterExplainsTheJoke,/r/PeterExplainsTheJoke/comments/14qet62/help_peter/,LemonBoyBeanie,Help Peter,1583,0.96,29,,1688476154.0,False,False,False,False,False
82,14qelct,PoliticalHumor,/r/PoliticalHumor/comments/14qelct/just_ask_the_president/,shychubby_kitty,Just ask the President,1585,0.98,80,,1688475622.0,False,False,False,False,False
83,14qd34t,Grimdank,/r/Grimdank/comments/14qd34t/unforgettable_pleasure/,FidoMix_Felicia,Unforgettable Pleasure...,1982,0.98,58,Victorus aut Mortis ,1688471276.0,False,False,False,False,False
84,14qgatv,MemePiece,/r/MemePiece/comments/14qgatv/robin_really_is_the_devil_child/,infinitysaga,Robin really is the devil child,1253,0.98,36,MARINE,1688479878.0,False,False,False,False,False
85,14qgbms,MapPorn,/r/MapPorn/comments/14qgbms/the_first_five_countries_that_recognized_the_us/,quindiassomigli,The first five countries that Recognized the US,1255,0.97,121,,1688479935.0,False,False,False,False,False
86,14qcrgx,MadeMeSmile,/r/MadeMeSmile/comments/14qcrgx/animals_come_a_running_for_snacks_with_their/,VariousBasket125,Animals come a running for snacks with their favorite visitor ,3868,0.98,128,,1688470307.0,False,False,False,False,False
87,14q4uzi,starterpacks,/r/starterpacks/comments/14q4uzi/35_year_old_veteran_starterpack/,FourthAge,35 year old veteran starterpack,10112,0.94,743,,1688445204.0,False,False,False,False,False
88,14qd96d,NewsOfTheStupid,/r/NewsOfTheStupid/comments/14qd96d/rightwings_bud_light_boycott_is_costing/,Misguided_Society,Right-wing's Bud Light boycott is costing Conservative workers their jobs in North Carolina and Louisiana,1844,0.88,399,,1688471811.0,False,False,False,False,False
89,14qea3l,TikTokCringe,/r/TikTokCringe/comments/14qea3l/im_never_vertical/,hec_ramsey,I’m never vertical,2877,0.96,135,,1688474800.0,False,False,False,False,False
90,14q7ic4,maybemaybemaybe,/r/maybemaybemaybe/comments/14q7ic4/maybe_maybe_maybe/,mostlyharmlessQ,Maybe maybe maybe,5261,0.94,239,,1688453631.0,False,False,False,False,False
91,14qfq2t,rareinsults,/r/rareinsults/comments/14qfq2t/holy_shit_u_killed_her_dude/,AlyceEscobar,Holy shit!! u killed her dude!!,1288,0.97,23,,1688478501.0,False,False,False,False,False
92,14qahpo,2meirl4meirl,/r/2meirl4meirl/comments/14qahpo/2meirl4meirl/,tHeBrUt3KiLLeR,2meirl4meirl,2836,0.95,20,,1688463322.0,False,False,False,False,False
93,14qbacb,4chan,/r/4chan/comments/14qbacb/runs_in_the_family/,Killer_queenpl,runs in the family,2391,0.96,42,,1688465879.0,False,False,False,False,False
94,14qedwo,BrandNewSentence,/r/BrandNewSentence/comments/14qedwo/why_does_this_sound_like_louise_from_bobs_burgers/,vdllvu,Why does this sound like Louise from Bob's Burgers?,1489,0.97,37,,1688475074.0,False,False,False,False,False
95,14q5j6s,oddlysatisfying,/r/oddlysatisfying/comments/14q5j6s/the_way_this_snake_moves_through_the_mortar/,purple-circle,The way this snake moves through the mortar courses,42864,0.95,642,,1688447271.0,False,False,False,False,False
96,14qasz4,NatureIsFuckingLit,/r/NatureIsFuckingLit/comments/14qasz4/dudhsagar_falls/,lonely_dude__,🔥 dudhsagar falls ,2573,0.97,36,,1688464347.0,False,False,False,False,False
97,14q8r76,2westerneurope4u,/r/2westerneurope4u/comments/14q8r76/im_not_even_surprised/,socrates04,I'm not even surprised,3790,0.93,400,:East_Germany: StaSi informant,1688457712.0,False,False,False,False,False
98,14qap15,ich_iel,/r/ich_iel/comments/14qap15/ichiel/,Flojo933,ich👩‍🦳iel,2700,0.97,106,,1688463994.0,True,False,False,False,False
99,14qeahz,trees,/r/trees/comments/14qeahz/first_bong/,thisisbojack,First bong!!,1447,0.98,136,,1688474825.0,False,False,False,False,False
100,14qcv21,CombatFootage,/r/CombatFootage/comments/14qcv21/fpv_of_mine_clearing_vehicle_clearing_the_way_for/,tomina69,"FPV of mine clearing vehicle clearing the way for the rest of the forces, presumably Ukrainian",1799,0.97,131,,1688470601.0,False,False,False,False,False
