rank,id,subreddit,permalink,author,title,score,upvote_ratio,num_comments,author_flair_text,created_utc,over_18,edited,stickied,locked,is_original_content
1,14j6k1f,facepalm,/r/facepalm/comments/14j6k1f/its_over_guys_musk_vs_zuck_cage_fight_is/,Tatarkingdom,"it's over guys, Musk vs Zuck cage fight is cancelled by Musk's mommy.",24585,0.95,1248,,1687752108.0,False,False,False,False,False
2,14j5rul,WhitePeopleTwitter,/r/WhitePeopleTwitter/comments/14j5rul/its_always_the_guns/,No-Diamond-5097,It's always the guns,25230,0.93,2201,,1687749704.0,False,False,False,False,False
3,14j55ri,TikTokCringe,/r/TikTokCringe/comments/14j55ri/remember_kids_the_internet_is_a_dangerous_place/,LordHamburguesa1,"Remember kids, the internet is a dangerous place. Especially if you share everything with everyone.",13749,0.97,559,,1687747899.0,False,False,False,False,False
4,14j5fxi,OldSchoolCool,/r/OldSchoolCool/comments/14j5fxi/prince_standing_victorious_over_charlie_murphy/,SecureSamurai,"Prince, standing victorious over Charlie Murphy during a game of basketball (1985).",10586,0.97,374,,1687748702.0,False,False,False,False,False
5,14j480r,Damnthatsinteresting,/r/Damnthatsinteresting/comments/14j480r/2x4_grandfather_and_grandson/,Redredworm88,2x4 Grandfather and Grandson,16968,0.95,380,,1687745182.0,False,False,False,False,False
6,14j0v2o,worldnews,/r/worldnews/comments/14j0v2o/russian_agents_threat_to_family_made_prigozhin/,addisonsimpson,Russian agents’ threat to family made Prigozhin call off Moscow advance,26926,0.93,1787,,1687735840.0,False,False,False,False,False
7,14j1jt9,nextfuckinglevel,/r/nextfuckinglevel/comments/14j1jt9/dam_opening_its_gates_due_to_heavy_rains_in_chile/,Izzynewt,Dam opening its gates due to heavy rains in Chile.,19259,0.97,577,,1687737691.0,False,False,False,False,False
8,14j5voj,oddlyterrifying,/r/oddlyterrifying/comments/14j5voj/kindergarten_pageants/,BellyScratchFTW,Kindergarten pageants.,6422,0.95,510,,1687750037.0,False,False,False,False,False
9,14j07cg,oddlysatisfying,/r/oddlysatisfying/comments/14j07cg/the_way_these_dam_gates_open/,amish_novelty,The way these dam gates open,38425,0.95,797,,1687734138.0,False,False,False,False,False
10,14j5mzn,WTF,/r/WTF/comments/14j5mzn/they_said_to_take_the_bull_by_the_horns/,Tunapiiano,They said to take the bull by the horns metaphorically but this guy took it literally.,5837,0.94,377,,1687749304.0,False,False,False,False,False
11,14j0290,politics,/r/politics/comments/14j0290/greg_abbott_duped_by_fake_news_story_mocking/,HandSack135,Greg Abbott duped by fake news story mocking Garth Brooks,20539,0.95,534,:flag-va: Virginia,1687733797.0,False,False,False,False,False
12,14j3kx1,PublicFreakout,/r/PublicFreakout/comments/14j3kx1/they_got_the_wrong_guy/,Courageous_Lauren2,They got the wrong guy,8571,0.93,284,,1687743356.0,False,False,False,False,False
13,14j0dvb,wallstreetbets,/r/wallstreetbets/comments/14j0dvb/elons_mommy_wont_let_him_fight/,Kengriffinspimp,Elon’s mommy won’t let him fight,16877,0.93,1561,,1687734602.0,False,False,False,False,False
14,14j3rc6,Whatcouldgowrong,/r/Whatcouldgowrong/comments/14j3rc6/wcgw_eating_the_wall_cotton_candy/,glitterclitor,WCGW eating the wall cotton candy,8179,0.93,586,,1687743872.0,False,False,False,False,False
15,14j0qs3,Tinder,/r/Tinder/comments/14j0qs3/she_told_me_this_20mins_before_our_date_after/,Corndawgptang,She told me this 20mins before our date after chatting on hinge for 4-5 days,13853,0.96,642,,1687735517.0,False,False,False,False,False
16,14iz2he,funny,/r/funny/comments/14iz2he/this_volunteer_fire_department_sign_near_my_house/,ImJustHereForABeer,This Volunteer Fire Department Sign Near My House,18319,0.97,319,,1687731330.0,False,False,False,False,False
17,14j05vm,tumblr,/r/tumblr/comments/14j05vm/welll/,Justthisdudeyaknow,Welll,14322,0.95,272,,1687734052.0,True,False,False,False,False
18,14j3v7c,shittymoviedetails,/r/shittymoviedetails/comments/14j3v7c/in_the_movie_blank_check_1994_the_33_year_old/,tombert512,"In the movie Blank Check (1994), the 33 year old female lead passionately kisses the 11 year old protagonist on the lips. This actually ok because he’s secretly a 300 year old anime vampire with stunted growth.",6671,0.95,195,,1687744175.0,False,False,False,False,False
19,14j71xb,facepalm,/r/facepalm/comments/14j71xb/you_are_free_to_go/,Hairy-Permission-582,"""You are free to go.""",14734,0.94,954,,1687753613.0,False,False,False,False,False
20,14j68xz,oddlyspecific,/r/oddlyspecific/comments/14j68xz/hes_got_a_point_there/,Mammoth-Medicine1385,He’s got a point there,3896,0.97,94,,1687751164.0,False,False,False,False,False
21,14j9gz1,ProgrammerHumor,/r/ProgrammerHumor/comments/14j9gz1/jobapplicationtroubles/,ultimatepro-grammer,jobApplicationTroubles,2179,0.99,62,:ts::js::py:,1687761485.0,False,False,False,False,False
22,14j6b96,CrazyFuckingVideos,/r/CrazyFuckingVideos/comments/14j6b96/5_cops_vs_2_guys_with_knifes/,dabbingfun,5 cops vs 2 guys with knifes,3843,0.97,279,,1687751374.0,True,False,False,False,False
23,14j2k3c,therewasanattempt,/r/therewasanattempt/comments/14j2k3c/to_shame_a_kid_for_throwing_a_party/,symbiosis-ecology,To shame a kid for throwing a party,7887,0.95,322,,1687740435.0,False,False,False,False,False
24,14j2wab,wholesomememes,/r/wholesomememes/comments/14j2wab/having_someone_with_you_through_the_up_and_downs/,Deep_Information2600,Having someone with you through the up and downs of life.,7011,0.99,41,,1687741401.0,False,False,False,False,False
25,14j77wa,discordVideos,/r/discordVideos/comments/14j77wa/video_title/,andrewens,video title,3089,0.97,79,Have Commited Several War Crimes,1687754149.0,False,False,False,False,False
26,14iy7qw,todayilearned,/r/todayilearned/comments/14iy7qw/til_that_every_employee_at_the_hanford_engineer/,Geeledouche52,"TIL that every employee at the Hanford Engineer Works in Richland, WA donated one day's worth of their pay to purchase a B-17 bomber, as their contribution to the WW2 effort. The plane was christened 'Day's Pay' and flew over 60 missions in Germany",14907,0.97,289,,1687729293.0,False,False,False,False,False
27,14j674g,HolUp,/r/HolUp/comments/14j674g/fuck_you_and_your_clout/,kya_ufufu,Fuck you and your clout,3595,0.98,88,,1687751011.0,False,False,False,False,False
28,14j6k1d,Genshin_Impact,/r/Genshin_Impact/comments/14j6k1d/happy_birthday_raiden_shogun/,genshinimpact,"Happy Birthday, Raiden Shogun!",3139,0.96,69,:hoyo1::hoyo2: Official,1687752108.0,False,False,False,False,False
29,14ixm1d,news,/r/news/comments/14ixm1d/a_man_and_his_stepson_die_after_hiking_in_big/,Kimber80,A man and his stepson die after hiking in Big Bend National Park in 119-degree heat,15592,0.96,1208,,1687727857.0,False,False,False,False,False
30,14iyrii,cats,/r/cats/comments/14iyrii/accidental_punch/,PewPewAnimeGirl,accidental punch! ,12443,0.97,158,Persian (modern),1687730590.0,False,False,False,False,False
31,14izmnt,dankmemes,/r/dankmemes/comments/14izmnt/got_him/,thepositivepandemic,Got him.,13960,0.97,52,,1687732702.0,False,False,False,False,False
32,14iz3qu,ATBGE,/r/ATBGE/comments/14iz3qu/mini_kiss_lamps/,Visual_Ad3724,mini kiss lamps,13895,0.85,1276,,1687731416.0,False,False,False,False,False
33,14izmpv,NatureIsFuckingLit,/r/NatureIsFuckingLit/comments/14izmpv/lightning_strikes_a_cook_pine/,iamayeshaerotica,🔥 Lightning strikes a cook pine,9514,0.96,274,,1687732706.0,False,False,False,False,False
34,14iz5ab,HermanCainAward,/r/HermanCainAward/comments/14iz5ab/this_is_my_shocked_face/,The_Patriot,"THIS IS MY ""SHOCKED"" FACE.",9605,0.96,411,A concerned redditor reached out to them about me,1687731529.0,False,False,False,False,False
35,14j1w1m,AdviceAnimals,/r/AdviceAnimals/comments/14j1w1m/no_health_insurance/,CivillyCrass,No Health Insurance? 💀,6212,0.92,167,,1687738577.0,False,False,False,False,False
36,14j2tal,nba,/r/nba/comments/14j2tal/victor_wembanyamas_starting_5_to_save_the_planet/,Curious_Success_377,"Victor Wembanyama's starting 5 to ""save the planet"": Stephen Curry, Michael Jordan, LeBron James, Tim Duncan, Shaquille O'Neal",4998,0.95,971,,1687741192.0,False,False,False,False,False
37,14j4o8z,shitposting,/r/shitposting/comments/14j4o8z/glory_to_spez/,TacoHunts,Glory to spez,4084,0.97,99,,1687746491.0,False,False,False,False,False
38,14j1lgz,comics,/r/comics/comments/14j1lgz/the_betrayal_oc/,rembobineur,The Betrayal [OC],6093,0.98,32,,1687737796.0,False,False,False,False,True
39,14j7l69,dataisbeautiful,/r/dataisbeautiful/comments/14j7l69/oc_the_top_100_most_pornified_media_franchises_of/,sugnimmingus,"[OC] The top 100 most ""pornified"" media franchises of all time. These are the franchises with the most of amount of fan-made adult content.",2125,0.9,435,OC: 7,1687755351.0,True,False,False,False,False
40,14j1u5g,BeAmazed,/r/BeAmazed/comments/14j1u5g/just_wow_absolutely_terrifying_and_amazing/,beastmodeChadF13,Just wow.  Absolutely terrifying and amazing ,5555,0.93,1130,,1687738441.0,False,False,False,False,False
41,14j1r1h,PeterExplainsTheJoke,/r/PeterExplainsTheJoke/comments/14j1r1h/peter_help/,shrimpfella,Peter help :-(,5818,0.96,74,,1687738210.0,False,False,False,False,False
42,14j1mg0,MadeMeSmile,/r/MadeMeSmile/comments/14j1mg0/an_army_or_crabs_form_a_barrier_to_protect_a_bbc/,bewarethechameleon,an army or crabs form a barrier to protect a BBC spy robot from being attacked by a nearby stingray,5617,0.98,175,,1687737864.0,False,False,False,False,False
43,14izd0i,mildlyinfuriating,/r/mildlyinfuriating/comments/14izd0i/my_friends_location_closed_permanently_with_no/,fireballhotchoccy,My friends location closed permanently with no notice. The workers found out today,8426,0.97,454,,1687732053.0,False,False,False,False,False
44,14j6kze,HonkaiStarRail,/r/HonkaiStarRail/comments/14j6kze/version_11_character_preview_yukong/,Bisentinel,Version 1.1 Character Preview: Yukong,2368,0.97,171,,1687752185.0,False,False,False,False,False
45,14iyx6y,antiwork,/r/antiwork/comments/14iyx6y/everyone_in_a_leadership_role_should_read_this/,Ne0nN1nja,Everyone in a leadership role should read this,7361,0.97,251,,1687730976.0,False,False,False,False,False
46,14iwd8j,CasualUK,/r/CasualUK/comments/14iwd8j/bit_harsh_from_the_bbc/,danl-uk,Bit harsh from the BBC,11476,0.96,132,,1687724902.0,False,False,False,False,False
47,14j5b5e,wholesome,/r/wholesome/comments/14j5b5e/lad_has_best_reaction_to_being_reunited_with_his/,FavoriteCouncilman,Lad has best reaction to being reunited with his dad,2763,0.93,69,,1687748345.0,False,False,False,False,False
48,14itfe5,BrandNewSentence,/r/BrandNewSentence/comments/14itfe5/homie_in_law/,iampunkitself,Homie in law,69631,0.96,222,,1687717884.0,False,False,False,False,False
49,14ivw3s,SipsTea,/r/SipsTea/comments/14ivw3s/it_needs_a_mans_touch/,IkilledRichieWhelan,It needs a mans touch.,18923,0.93,327,,1687723779.0,False,False,False,False,False
50,14itu6w,nottheonion,/r/nottheonion/comments/14itu6w/ukraine_managed_to_gain_ground_in_ukraine_as/,rstevens94,Ukraine managed to gain ground in Ukraine as Russia faced off against Russia in Russia,36417,0.91,692,,1687718861.0,False,False,False,False,False
51,14izfd1,meme,/r/meme/comments/14izfd1/try_and_name_someone_ill_wait/,More_Examination_895,"try and name someone, i'll wait",10502,0.87,5907,,1687732209.0,False,False,False,False,False
52,14iwsrk,inthenews,/r/inthenews/comments/14iwsrk/trump_quietly_changes_political_fundraising_site/,MOONL16H777,Trump quietly changes political fundraising site to funnel funds toward legal woes,9617,0.93,420,,1687725931.0,False,False,False,False,False
53,14iut3k,technology,/r/technology/comments/14iut3k/a_reddit_transcription_community_will_shut_down/,Exastiken,A Reddit transcription community will shut down over a 'lack of trust' in the platform,15854,0.93,1143,,1687721175.0,False,False,False,False,False
54,14iyeot,meirl,/r/meirl/comments/14iyeot/meirl/,33Fanste33,meirl,8548,0.99,109,,1687729760.0,False,False,False,False,False
55,14j2j9m,OldSchoolCool,/r/OldSchoolCool/comments/14j2j9m/im_34_now_but_i_peaked_5/,joshortiz,I’m 34 now but I peaked 5,11091,0.96,276,,1687740371.0,False,False,False,False,False
56,14j4s05,Fauxmoi,/r/Fauxmoi/comments/14j4s05/noah_schnapp_shares_photo_from_his_first_pride/,madsdab,Noah Schnapp shares photo from his first Pride,2525,0.9,61,Ask Taylor,1687746786.0,False,False,False,False,False
57,14iyofk,Justrolledintotheshop,/r/Justrolledintotheshop/comments/14iyofk/its_so_hot_in_texas_the_emblem_on_my_buddies/,2-tree,"It's so hot in Texas, the emblem on my buddies truck is melting",6286,0.96,400,,1687730403.0,False,False,False,False,False
58,14izu7h,PoliticalHumor,/r/PoliticalHumor/comments/14izu7h/come_on_in/,PhilDesenex,Come on in..,5189,0.92,86,,1687733229.0,False,False,False,False,False
59,14j0rge,TwoSentenceHorror,/r/TwoSentenceHorror/comments/14j0rge/grandma_i_finished_washing_the_dishes/,Boring-Notice-3749,"""Grandma I finished washing the dishes.""",4693,0.92,236,,1687735567.0,False,False,False,False,False
60,14j59qc,NonPoliticalTwitter,/r/NonPoliticalTwitter/comments/14j59qc/homie_in_law/,hot,homie in law,2248,0.96,7,ʕ⁎̯͡⁎ʔ,1687748229.0,False,False,False,False,False
61,14ivq3s,memes,/r/memes/comments/14ivq3s/how_to_train_your_dragon_is_not_landed/,WyvernByte,"""How To Train Your Dragon"" is not Landed",17400,0.95,360,,1687723377.0,False,False,False,False,False
62,14itiia,lotrmemes,/r/lotrmemes/comments/14itiia/why_is_denethor_like_that/,CaptainWisconsin,Why is Denethor like that?,28444,0.85,507,,1687718090.0,False,False,False,False,False
63,14j41z9,Futurology,/r/Futurology/comments/14j41z9/90_of_patients_respond_to_new_blood_cancer/,tonymmorley,90% of patients respond to new blood cancer treatment in trial,2590,0.96,72,,1687744713.0,False,False,False,False,False
64,14j2egx,doordash,/r/doordash/comments/14j2egx/unbelievable_70_wasted/,EriDeeri,Unbelievable. $70 wasted.,3343,0.95,713,,1687739989.0,False,False,False,False,False
65,14j7xfi,IndianDankMemes,/r/IndianDankMemes/comments/14j7xfi/title_irony_nhi_sheh_sakta/,iamkundan69,title irony nhi sheh sakta,1440,0.96,109,i love lesbian gay girls :troll_face:,1687756399.0,False,False,False,False,False
66,14j539y,maybemaybemaybe,/r/maybemaybemaybe/comments/14j539y/maybe_maybe_maybe/,gravityVT,Maybe Maybe Maybe,2230,0.95,130,,1687747700.0,False,False,False,False,False
67,14j6fak,LifeProTips,/r/LifeProTips/comments/14j6fak/lpt_only_1_best_man_vs_6_bridesmaids_in_my/,yeah_yeah_1201,LPT: Only 1 best man vs 6 bridesmaids in my wedding party. Here's why I recommend it.,1748,0.92,83,,1687751717.0,False,False,False,False,False
68,14j19g8,dank_meme,/r/dank_meme/comments/14j19g8/why_are_you_like_this/,McClendonGerald,Why are you like this?,4065,0.94,105,,1687736906.0,False,False,False,False,False
69,14j5fml,ClashRoyale,/r/ClashRoyale/comments/14j5fml/clasharama_predicted_the_actual_state_of_cr/,Miguelins,Clash-A-Rama predicted the actual state of CR 💀,2082,0.96,60,,1687748675.0,False,False,False,False,False
70,14ixw8j,conservativeterrorism,/r/conservativeterrorism/comments/14ixw8j/is_praising_hitler_not_a_political_red_flag/,scuczu,"Is praising Hitler not a political red flag anymore? Asking for America. “If you don't control education, you cannot control the future. And Stalin knew that, Mao knew that, Hitler knew that. We have to get that back for conservative values.""",6079,0.94,274,,1687728520.0,False,False,False,False,False
71,14j89lc,worldnews,/r/worldnews/comments/14j89lc/plan_to_blow_up_zaporizhzhia_nuclear_power_plant/,HydrolicKrane,"Plan to blow up Zaporizhzhia Nuclear Power Plant approved, situation has never been so severe before ― Chief of Defence Intelligence",3147,0.96,608,,1687757514.0,False,False,False,False,False
72,14j3hdv,Hololive,/r/Hololive/comments/14j3hdv/newsception_asamio_reporting_on_watson_weekly/,Superliminal96,Newsception - AsaMio reporting on Watson Weekly,2715,0.97,47,:Koyori::Nene::Luna:,1687743074.0,False,False,False,False,False
73,14iypao,Jokes,/r/Jokes/comments/14iypao/not_nsfw_how_many_apple_engineers_does_it_take_to/,lovejo1,Not NSFW: How many Apple engineers does it take to change a lightbulb?,5363,0.9,177,,1687730457.0,True,False,False,False,False
74,14iv83o,shittyfoodporn,/r/shittyfoodporn/comments/14iv83o/girlfriends_mom_is_using_a_frosting_bag_to/,Business_Bumblebee80,Girlfriend’s mom is using a frosting bag to squeeze beans onto our nachos,9324,0.94,482,,1687722186.0,False,False,False,False,False
75,14iucg4,UkraineWarVideoReport,/r/UkraineWarVideoReport/comments/14iucg4/russians_executing_one_of_their_paratroopers_who/,Judge_BobCat,Russians executing one of their paratroopers who showed support for Prigozhyn’ coup. Warning.,12357,0.88,1753,,1687720058.0,True,False,False,True,False
76,14iuw6g,Eldenring,/r/Eldenring/comments/14iuw6g/mohg_lord_of_blood_pixelart/,Mr3sk,"Mohg, Lord of Blood (Pixelart)",10567,0.96,118,:hollowed:,1687721388.0,False,False,False,False,True
77,14j3rmn,FunnyAnimals,/r/FunnyAnimals/comments/14j3rmn/this_photographer_takes_pictures_of_dogs_as/,DarthiusFatticus,This photographer takes pictures of Dogs as they're about to catch treats and they truly are amazing! 😁 --- Credit: @vieler.photography,2457,0.96,48,,1687743896.0,False,False,False,False,False
78,14j29le,FunnyandSad,/r/FunnyandSad/comments/14j29le/new_adventure_opportunity/,whippet66,New adventure opportunity,3114,0.95,52,,1687739608.0,False,False,False,False,False
79,14j0ww7,4chan,/r/4chan/comments/14j0ww7/anon_could_have_saved_them/,beyondthebarricade,Anon could have saved them,3761,0.96,299,,1687735976.0,False,False,False,False,False
80,14j38lu,BlackPeopleTwitter,/r/BlackPeopleTwitter/comments/14j38lu/some_people_dont_need_to_create_lifethreatening/,JennyBeckman,Some people don't need to create life-threatening situations for a thrill. It's called life.,2626,0.97,22,☑️ All of the above,1687742377.0,False,False,False,False,False
81,14iz96n,tifu,/r/tifu/comments/14iz96n/tifu_by_writing_a_1984_essay_that_was_mistaken_as/,Dolphin-of-Death,TIFU by writing a 1984 essay that was mistaken as a suicide note,4867,0.96,350,,1687731795.0,True,False,False,False,False
82,14ixbr9,Animemes,/r/Animemes/comments/14ixbr9/arnold_schwarzenegger_is_slowly_turning_into/,SmokingBouquets,Arnold Schwarzenegger is slowly turning into Master Roshi,6598,0.97,48,,1687727171.0,False,False,False,False,False
83,14j5wnz,teenagers,/r/teenagers/comments/14j5wnz/my_guess_is_fuck/,YawnMcie,my guess is “fuck”,1766,0.97,131,14,1687750127.0,False,False,False,False,False
84,14iwcc5,starterpacks,/r/starterpacks/comments/14iwcc5/student_problems_starter_pack/,spookycribbage,"""Student problems"" starter pack",7567,0.96,157,,1687724840.0,False,False,False,False,False
85,14iwaav,cyberpunkgame,/r/cyberpunkgame/comments/14iwaav/he_forgor/,Aman690,He forgor 💀,7839,0.91,205,,1687724712.0,False,False,False,False,False
86,14j1hmw,distressingmemes,/r/distressingmemes/comments/14j1hmw/from_the_smell_of_roses_to_rust/,R4XCC00N,From the smell of roses to rust,3547,0.94,150,,1687737543.0,False,False,False,False,False
87,14j6lfp,oddlyterrifying,/r/oddlyterrifying/comments/14j6lfp/scratched_a_scab_on_my_shin_and_ended_up_with_an/,Roy_the_Dude,Scratched a scab on my shin and ended up with an arterial spray,4359,0.96,142,,1687752217.0,True,False,False,False,False
88,14ix3xu,nope,/r/nope/comments/14ix3xu/no_room_for_error/,Otherwise-Island-512,No room for error,6666,0.96,191,,1687726679.0,False,False,False,False,False
89,14j4do0,DC_Cinematic,/r/DC_Cinematic/comments/14j4do0/bryan_cranston_says_peoples_fancasts_for_him_as/,Zepanda66,"Bryan Cranston says people’s fancasts for him as Lex Luthor were “lazy casting.” “I had a bald head, they go ‘Ah! Lex Luthor!’ It’s like, come on. Let’s think about this a little bit.”",2113,0.96,363,,1687745634.0,False,False,False,False,False
90,14iyn6y,WhitePeopleTwitter,/r/WhitePeopleTwitter/comments/14iyn6y/texas_republican_gov_greg_abbot_tweets_fake/,Go_Habs_Go31,Texas Republican Gov. Greg Abbot tweets fake article cause he’s an absolute moron who’s not fit to govern,23857,0.95,841,,1687730318.0,False,False,False,False,False
91,14j7iv5,ukraine,/r/ukraine/comments/14j7iv5/losses_of_the_russian_military_to_2662023/,MARTINELECA,Losses of the Russian military to 26.6.2023,1322,0.97,123,,1687755126.0,False,False,False,False,False
92,14j5sip,Gamingcirclejerk,/r/Gamingcirclejerk/comments/14j5sip/fellow_greek_gamer_here/,Nominalchord57,Fellow Greek Gamer here,1695,0.96,58,,1687749763.0,False,False,False,False,False
93,14j01dm,ChatGPT,/r/ChatGPT/comments/14j01dm/chatgpt_with_the_galaxy_brain_move/,ControlledSingular,ChatGPT with the galaxy brain move.,4049,0.96,166,,1687733736.0,False,False,False,False,False
94,14itv8f,LateStageCapitalism,/r/LateStageCapitalism/comments/14itv8f/wow_do_you_think/,heraldedProgram65,"Wow, do you think?",9866,0.94,165,,1687718933.0,False,False,False,False,False
95,14j1s4f,2meirl4meirl,/r/2meirl4meirl/comments/14j1s4f/2meirl4meirl/,hornmelon,2meirl4meirl,2995,0.99,22,,1687738286.0,False,False,False,False,False
96,14ixr1s,AmItheAsshole,/r/AmItheAsshole/comments/14ixr1s/aita_for_following_my_morning_routine_while_my_in/,Ok_Fee1565,AITA for following my morning routine while my in laws were staying with us?,5629,0.96,853,,1687728183.0,False,1687759590.0,False,False,False
97,14iraqx,pics,/r/pics/comments/14iraqx/john_olivers_guide_to_the_most_effective_form_of/,teamcoltra,John Oliver's Guide To The Most Effective Form of Protest,25429,0.87,398,,1687712600.0,False,False,False,False,False
98,14j6nu2,JustGuysBeingDudes,/r/JustGuysBeingDudes/comments/14j6nu2/gentlemen_it_has_happened/,Ok_Onion1418,"Gentlemen, it has happened.",1384,0.95,24,,1687752407.0,True,False,False,False,False
99,14iu9nz,AskReddit,/r/AskReddit/comments/14iu9nz/people_who_cut_off_their_family_what_did_they_to/,Alarming_Basil6205,"People who cut off their family, what did they to you?",9247,0.9,3849,,1687719874.0,False,False,False,False,False
100,14j5rzn,nevertellmetheodds,/r/nevertellmetheodds/comments/14j5rzn/like_a_glove/,Dr_Zol_Epstein_III,Like a Glove...,1538,0.95,26,,1687749717.0,False,False,False,False,False
