rank,id,subreddit,permalink,author,title,score,upvote_ratio,num_comments,author_flair_text,created_utc,over_18,edited,stickied,locked,is_original_content
1,152m59s,Damnthatsinteresting,/r/Damnthatsinteresting/comments/152m59s/this_is_how_much_food_you_can_get_for_the_cost_of/,Koolzx,This is how much food you can get for the cost of a pack of cigarettes in Australia,24788,0.94,1557,,1689648610.0,False,False,False,False,False
2,152oiei,nextfuckinglevel,/r/nextfuckinglevel/comments/152oiei/simply_riding_it_would_be_an_understatement/,ViktorSwimwell,simply “Riding It” would be an understatement,8030,0.93,355,,1689655499.0,False,False,False,False,False
3,152ktfa,meirl,/r/meirl/comments/152ktfa/meirl/,Poohbizzle79,meirl,20689,0.96,451,,1689644945.0,False,False,False,False,False
4,152lyyc,Unexpected,/r/Unexpected/comments/152lyyc/everything_is_just_fine/,ImAFuckinLiar,Everything is just fine,11506,0.95,485,,1689648108.0,False,False,False,False,False
5,152oqqv,ProgrammerHumor,/r/ProgrammerHumor/comments/152oqqv/howdoyoubreakthemostessentialfeature/,Dankinater,howDoYouBreakTheMostEssentialFeature,8309,0.95,186,:py:,1689656236.0,False,False,False,False,False
6,152l99w,NatureIsFuckingLit,/r/NatureIsFuckingLit/comments/152l99w/intelligent_rabbit_knows_the_dog_is_following_its/,CartridgeGenGamer,"🔥 Intelligent rabbit knows the dog is following its scent, so it doubles back",9586,0.96,208,,1689646156.0,False,False,False,False,False
7,152nbxl,oddlysatisfying,/r/oddlysatisfying/comments/152nbxl/calf_gets_a_relaxing_spa_treatment/,elimars,Calf gets a relaxing spa treatment ,6887,0.86,545,,1689651972.0,False,False,False,False,False
8,152mmgp,tumblr,/r/tumblr/comments/152mmgp/on_bombs_and_secrets/,izukaneki,On bombs and secrets,7238,0.99,132,,1689649920.0,False,False,False,False,False
9,152gpsw,WhitePeopleTwitter,/r/WhitePeopleTwitter/comments/152gpsw/god_bless_charles_barkley/,zzill6,"God Bless, Charles Barkley",44650,0.93,640,,1689634270.0,False,False,False,False,False
10,152key6,news,/r/news/comments/152key6/universal_studios_trims_trees_on_picket_line_to/,Gregistopal,Universal Studios trims trees on picket line to deprive strikers of shade,9003,0.96,794,,1689643831.0,False,False,False,False,False
11,152jo6x,todayilearned,/r/todayilearned/comments/152jo6x/til_that_during_his_development_nintendo_almost/,B0rtles,"TIL that during his development, Nintendo almost made Waluigi an evil version of Princess Peach named ""Warupichi,"" but he ultimately became the evil Luigi because Wario needed a doubles partner in Mario Tennis for the Nintendo 64",10592,0.96,292,,1689641793.0,False,False,False,False,False
12,152ntlc,pettyrevenge,/r/pettyrevenge/comments/152ntlc/want_my_girlfriend_threaten_me_take_my_whole/,hiyabankranger,Want my girlfriend? Threaten me? Take my whole shitty life.,4331,0.96,147,,1689653404.0,False,False,False,False,False
13,152jzma,lotrmemes,/r/lotrmemes/comments/152jzma/doesnt_offer_to_help/,Neither_Way_9353,Doesn’t offer to help,8734,0.96,253,,1689642648.0,False,False,False,False,False
14,152njkq,Damnthatsinteresting,/r/Damnthatsinteresting/comments/152njkq/51_years_old_tim_shaddock_and_his_dog_bella/,Delicious-Let8429,51 years old Tim Shaddock and his dog Bella rescued off the coast in Mexico after being stranded in the Pacific Ocean for months and they survived by consuming raw fish and drinking rainwater,11248,0.99,359,,1689652604.0,False,False,False,False,False
15,152hiu6,facepalm,/r/facepalm/comments/152hiu6/im_mad_for_him/,Auru256,I'm mad for him,19344,0.93,1391,,1689636240.0,False,False,False,False,False
16,152owqe,TikTokCringe,/r/TikTokCringe/comments/152owqe/passionate_about_backpacks/,PlenitudeOpulence,Passionate about backpacks,3109,0.97,219,,1689656723.0,False,False,False,False,False
17,152kd0u,LeopardsAteMyFace,/r/LeopardsAteMyFace/comments/152kd0u/guy_who_begged_for_elon_and_constantly_praised/,SlagginOff,Guy who begged for Elon and constantly praised Elon is now mad that Elon turned his favorite place into an even bigger shithole than it was before.,6488,0.95,237,,1689643686.0,False,False,False,False,False
18,152ghe1,funny,/r/funny/comments/152ghe1/little_man_wasnt_about_to_be_denied_again/,thejeffroc,Little man wasn't about to be denied again... ,21057,0.86,779,,1689633707.0,False,False,False,False,False
19,152nok3,therewasanattempt,/r/therewasanattempt/comments/152nok3/to_not_heed_the_multiple_warnings/,Sufficient-Bug-9112,to not heed the multiple warnings,3885,0.96,342,,1689652995.0,False,False,False,False,False
20,152mz5w,MadeMeSmile,/r/MadeMeSmile/comments/152mz5w/corey_taylor_giving_in_to_the_fans_and_singing/,xgodlesssaintx,Corey Taylor giving in to the fans and singing the SpongeBob theme song.,4371,0.99,52,,1689650933.0,False,False,False,False,False
21,152micf,worldnews,/r/worldnews/comments/152micf/ukraine_parliament_votes_268_to_137_to_legalize/,JamesAsher12,Ukraine Parliament Votes 268 to 137 to Legalize Medical Marijuana,4408,0.96,149,,1689649610.0,False,False,False,False,False
22,152of34,nextfuckinglevel,/r/nextfuckinglevel/comments/152of34/boxing_bully_bullied/,RightOfLifeIsRight,Boxing bully bullied!,7897,0.97,200,,1689655202.0,False,False,False,False,False
23,152hl5r,LateStageCapitalism,/r/LateStageCapitalism/comments/152hl5r/no_tree_shade_for_you_union_workers/,Polixxa,"No Tree Shade for You, Union Workers!",9502,0.98,370,,1689636400.0,False,False,False,False,False
24,152p5h9,whenthe,/r/whenthe/comments/152p5h9/been_such_a_struggle/,Co_kroach,Been such a struggle,2953,0.92,172,,1689657511.0,False,False,False,False,False
25,152g9x9,memes,/r/memes/comments/152g9x9/woman_destroyer/,thepositivepandemic,Woman destroyer.,27859,0.93,1052,OC Meme Maker,1689633209.0,False,False,False,False,False
26,152g39x,mildlyinfuriating,/r/mildlyinfuriating/comments/152g39x/wife_says_we_need_to_get_gas_when_we_leave/,UpdootDaSnootBoop,Wife says we need to get gas when we leave,16038,0.94,1427,,1689632773.0,False,False,False,False,False
27,152npph,baseball,/r/baseball/comments/152npph/shohei_ohtani_hits_a_2run_home_run_to_tie_the/,Blazingbee98,"Shohei Ohtani hits a 2-run home run to tie the game up for the Angels, his 35th homer of the season and his 3rd in the last 3 games!",3076,0.96,596,TEAM CHAOS :CHAOS-wagon:,1689653082.0,False,False,False,False,False
28,152fhcr,maybemaybemaybe,/r/maybemaybemaybe/comments/152fhcr/maybe_maybe_maybe/,IkilledRichieWhelan,Maybe Maybe Maybe,19334,0.91,212,,1689631314.0,True,False,False,False,False
29,152eton,politics,/r/politics/comments/152eton/supreme_court_republicans_to_blame_for_lack_of/,vbbryce,"Supreme Court, Republicans to blame for lack of debt forgiveness, students say in poll",14204,0.95,814,:flag-tx: Texas,1689629771.0,False,False,False,False,False
30,152gqim,BlackPeopleTwitter,/r/BlackPeopleTwitter/comments/152gqim/its_just_missing_the_neon_sign_from_etsy/,notjayson,It's just missing the neon sign from etsy.,9336,0.96,236,☑️,1689634315.0,False,False,False,False,False
31,152it5s,anime_irl,/r/anime_irl/comments/152it5s/anime_irl/,yolo_king_1,Anime_irl,7641,0.95,208,,1689639499.0,False,False,False,False,False
32,152d6a0,comics,/r/comics/comments/152d6a0/heal_turn/,MrLovens,Heal Turn,25077,0.96,317,Mr. Lovenstein,1689626059.0,False,False,False,False,False
33,152qq7y,Grimdank,/r/Grimdank/comments/152qq7y/brother_you_have_a_problem_by_mick19988/,Mayor_of_the_redline,Brother you have a problem by @Mick19988,1692,0.99,64,,1689662781.0,False,False,False,False,False
34,152imto,cats,/r/cats/comments/152imto/stray_kitten_after_a_bath_talking_while_eating/,cobaltberry,"Stray kitten after a bath, talking while eating",6466,0.99,257,,1689639047.0,False,False,False,False,False
35,152eg8p,ContagiousLaughter,/r/ContagiousLaughter/comments/152eg8p/dont_be_an_old_fart/,IkilledRichieWhelan,Don’t be an old fart.,16059,0.93,270,,1689628917.0,False,False,False,False,False
36,152jo8w,popculturechat,/r/popculturechat/comments/152jo8w/universal_studios_accused_of_trimming_trees_that/,Pizasdf,Universal Studios accused of trimming trees that gave WGA picket lines shade,4842,0.96,250,,1689641798.0,False,False,False,False,False
37,152lyto,dankmemes,/r/dankmemes/comments/152lyto/yay/,HugeT55,Yay!,3763,0.97,67,,1689648099.0,True,False,False,False,False
38,152fdwg,subway,/r/subway/comments/152fdwg/documenting_why_i_was_fired_a_thread/,Reb_Lodster,"documenting why i was fired, a thread",13704,0.92,766,,1689631099.0,False,False,False,False,False
39,152ng4a,shitposting,/r/shitposting/comments/152ng4a/lovely_praise_spez/,ninul3479,Lovely (praise spez),2717,0.98,89,,1689652316.0,False,False,False,False,False
40,152dldm,BeAmazed,/r/BeAmazed/comments/152dldm/10_orphaned_ducklings_adopted_by_a_mother_duck/,External_Industry739,10 orphaned ducklings adopted by a mother duck,15252,0.97,364,,1689627004.0,False,False,False,False,False
41,152lxek,WhitePeopleTwitter,/r/WhitePeopleTwitter/comments/152lxek/what_a_coincidence/,Monsur_Ausuhnom,What A Coincidence.,6784,0.99,202,,1689647995.0,False,False,False,False,False
42,152e8xp,DiWHY,/r/DiWHY/comments/152e8xp/my_boss_thought_these_were_a_good_idea/,Kattivakk,My boss thought these were a good idea,10449,0.97,1324,,1689628460.0,False,False,False,False,False
43,152ivtk,TwoXChromosomes,/r/TwoXChromosomes/comments/152ivtk/my_sister_died_because_doctors_didnt_believe_her/,gongacn07,My sister died because doctors didn’t believe her and I still feel so much rage.,4528,0.93,366,,1689639695.0,False,1689654549.0,False,False,False
44,152ko66,Unexpected,/r/Unexpected/comments/152ko66/someone_was_upset/,eddy9900,Someone was upset,8584,0.95,85,,1689644533.0,False,False,False,False,False
45,152ipdu,PeopleFuckingDying,/r/PeopleFuckingDying/comments/152ipdu/big_cat_salughters_unsuspecting_family_who_took/,StcStasi,"big CaT SalUgHterS uNsUsPECtinG FAMIly, wHO TOoK Him in fROm thE SnOw",4912,0.95,189,,1689639233.0,False,False,False,False,False
46,152gv2q,CrazyFuckingVideos,/r/CrazyFuckingVideos/comments/152gv2q/a_guy_tried_to_meet_a_13_yr_old_but_instead_meets/,Dyingtolivee,A guy tried to meet a 13 yr old but instead meets her dad and his dogs ,8306,0.79,665,,1689634633.0,False,False,False,False,False
47,152ofk6,cursedcomments,/r/cursedcomments/comments/152ofk6/cursed_sub/,imstuckingachahell,Cursed sub,1876,0.98,9,,1689655237.0,False,False,False,False,False
48,152nth8,madlads,/r/madlads/comments/152nth8/so_sad_over_a_paper_note/,leira27,"So sad!, over a paper note.",2055,0.97,44,,1689653394.0,False,False,False,False,False
49,152joln,rareinsults,/r/rareinsults/comments/152joln/snotzi_theme_plays/,Agreeable-Tree-604,*Snotzi theme plays*,3891,0.97,185,,1689641828.0,False,False,False,False,False
50,152lweb,me_irlgbt,/r/me_irlgbt/comments/152lweb/me_irlgbt/,conancat,me_irlgbt,2623,0.98,33,,1689647914.0,False,False,False,False,False
51,152q61m,SipsTea,/r/SipsTea/comments/152q61m/magic/,LinnContreras,Magic!?,1260,0.95,29,,1689660834.0,False,False,False,False,False
52,152fs5p,antiwork,/r/antiwork/comments/152fs5p/if_you_hear_nobody_wants_to_work_anymore_please/,xxrth,"If you hear “nobody wants to work anymore”, please call them out on their BS.",5798,0.97,498,,1689632037.0,False,False,False,False,False
53,152f63r,facepalm,/r/facepalm/comments/152f63r/my_old_church_sending_my_mom_hate_mail_for/,babyblueberry333,My old church sending my mom hate mail for divorcing my abusive dad,44960,0.9,5616,,1689630590.0,False,False,False,False,False
54,152q2hr,shittymoviedetails,/r/shittymoviedetails/comments/152q2hr/with_the_release_of_indiana_jones_and_the_dial_of/,theABKnetwork,"With the Release of ""Indiana Jones and the dial of destiny"" (2023) Mads Mikkelsen has now completed the trifecta of Wizard Nazi, Space Nazi, and Real Nazi",1236,0.99,18,,1689660500.0,False,False,False,False,False
55,1529kna,PublicFreakout,/r/PublicFreakout/comments/1529kna/climate_activists_spray_paint_on_megayacht_owned/,mushyrain,Climate activists spray paint on megayacht owned by heir to the Walmart fortune,26338,0.91,3099,,1689617892.0,False,False,False,False,False
56,152ljkz,2meirl4meirl,/r/2meirl4meirl/comments/152ljkz/2meirl4meirl/,3rdPartyRedditApp,2meirl4meirl,2457,0.99,25,,1689646928.0,False,False,False,False,False
57,152ad5j,gaming,/r/gaming/comments/152ad5j/boyfriend_wanted_totk_for_his_birthday_so_i_made/,marshmellers95,Boyfriend wanted TotK for his birthday so I made him a Link cake to go with it!,15353,0.92,276,,1689619716.0,False,False,False,False,False
58,152eysd,news,/r/news/comments/152eysd/aaa_pulls_back_from_offering_insurance_in_florida/,my2ndr,"AAA pulls back from offering insurance in Florida, following Farmers",17264,0.96,2050,,1689630112.0,False,False,False,False,False
59,152pdbd,MadeMeSmile,/r/MadeMeSmile/comments/152pdbd/little_guy_getting_it_done/,Palifaith,Little guy getting it done,2648,0.97,157,,1689658229.0,False,False,False,False,False
60,152gtoy,PeterExplainsTheJoke,/r/PeterExplainsTheJoke/comments/152gtoy/i_dont_get_it/,slycinth1,I don’t get it,5147,0.88,247,,1689634537.0,False,False,False,False,False
61,152o2y3,Superstonk,/r/Superstonk/comments/152o2y3/congress_goes_on_record_supporting_fraud_and/,TherealMicahlive,"CONGRESS goes on record SUPPORTING FRAUD AND LIMITING SWAP DATA DISSIMINATION TO THE PUBLIC! COMMENT POSTED TO S7-32-10! These are the people that ""REPRESENT US""!?!?!?",1848,0.98,115,Eew eew llams a evah I,1689654179.0,False,False,False,False,False
62,152l96k,pcmasterrace,/r/pcmasterrace/comments/152l96k/ryzen_processors_in_a_nutshell/,aleon4real,Ryzen processors in a nutshell,2417,0.96,66,,1689646149.0,False,False,False,False,False
63,152j2g6,animememes,/r/animememes/comments/152j2g6/anime_studios_ignore_us_the_way_we_ignore_manga/,Con___artist,Anime Studios ignore us the way we ignore manga reader,3455,0.96,172,,1689640184.0,False,False,False,False,False
64,152hsks,HonkaiStarRail,/r/HonkaiStarRail/comments/152hsks/the_baseball_and_the_bat_pun_rii_on_twitter/,_nitro_legacy_,The baseball and the bat @pun_rii on twitter,4176,0.97,66,:Caelus: i break rules and your kneecaps,1689636916.0,False,False,False,False,False
65,152o1g1,MemeVideos,/r/MemeVideos/comments/152o1g1/fire/,UnknOwn-9X,Fire,1569,0.97,11,,1689654056.0,False,False,False,False,False
66,152junj,discordVideos,/r/discordVideos/comments/152junj/yes_those_are_clays/,Kind-Ant-2350,"yes, those are clays",2977,0.98,68,,1689642274.0,False,False,False,False,False
67,152lfuo,ChainsawMan,/r/ChainsawMan/comments/152lfuo/is_fujimoto_the_most_consistent_shonen_mangaka_at/,Ficnkle,Is Fujimoto the most consistent shonen mangaka at writing women?,2252,0.95,241,:Pawa: ,1689646643.0,False,False,False,False,False
68,152c8pc,HolUp,/r/HolUp/comments/152c8pc/blind_experiment/,No-ConspiracyTheory,Blind experiment,13866,0.89,580,,1689623965.0,False,False,False,False,False
69,152aox3,PoliticalHumor,/r/PoliticalHumor/comments/152aox3/road_trip/,IAmAccutane,Road trip!!!,10343,0.97,110,,1689620450.0,False,False,False,False,False
70,152lvxw,Hololive,/r/Hololive/comments/152lvxw/gura_will_be_releasing_her_fully_animated_op_on/,lightow,"Gura will be releasing her fully Animated OP on July 20th, at 8PM EDT!",2009,0.97,32,:Gura::Amelia::Inanis::Calliope::Kiara:,1689647876.0,False,False,False,False,False
71,1527tlc,BrandNewSentence,/r/BrandNewSentence/comments/1527tlc/i_know_i_probably_shouldnt_laugh_about_this_but/,mecnev,I know I probably shouldn't laugh about this but damn,52613,0.92,2242,,1689613875.0,False,False,False,False,False
72,152bpwa,movies,/r/movies/comments/152bpwa/the_rock_has_to_be_the_most_overrated_movie_star/,finnjakefionnacake,The Rock has to be the most overrated movie star of our time,10333,0.78,2823,,1689622787.0,False,False,False,False,False
73,152cek1,starterpacks,/r/starterpacks/comments/152cek1/riding_a_bike_in_the_us_starter_pack/,CeeWitz,"""Riding a Bike in the US"" starter pack",8390,0.9,707,,1689624318.0,False,False,False,False,False
74,152mzbx,leagueoflegends,/r/leagueoflegends/comments/152mzbx/in_an_interview_for_soul_fighters_game_mode/,Boudynasr,"In an interview for Soul Fighters Game Mode, Ovilee asked Riot Maxw3ll whether he designed Yuumi, his response knocked her out",1641,0.95,110,:reksai:meta champ abuser to compensate my lack of skill:khazix:,1689650949.0,False,False,False,False,False
75,152au2d,PrequelMemes,/r/PrequelMemes/comments/152au2d/i_believe_you_watto/,Groslux,I believe you Watto.,11352,0.98,65,,1689620763.0,False,False,False,False,False
76,152ora5,ukraine,/r/ukraine/comments/152ora5/losses_of_the_russian_military_to_1872023/,MARTINELECA,Losses of the Russian military to 18.7.2023,1250,0.97,168,,1689656285.0,False,False,False,False,False
77,152gzj0,AbsoluteUnits,/r/AbsoluteUnits/comments/152gzj0/everyone_tells_me_to_post_my_pupper_here/,TslaNCorn,Everyone tells me to post my Pupper here,3911,0.97,217,,1689634920.0,False,False,False,False,False
78,152hntp,tf2,/r/tf2/comments/152hntp/tf2_is_in_the_steam_news_section_is_that_a_new/,-popgoes,TF2 is in the Steam news section! Is that a new render by Valve?!,3622,0.98,136,Demoman :democlass:,1689636600.0,False,False,False,False,False
79,152ll8n,Tinder,/r/Tinder/comments/152ll8n/first_time_ive_ever_been_left_speechless/,DoIt4Dael,first time i’ve ever been left speechless,1926,0.98,56,,1689647055.0,False,False,False,False,False
80,152e6cp,therewasanattempt,/r/therewasanattempt/comments/152e6cp/to_grab_someones_phone/,Wtf_happen,To grab someone’s phone.,23995,0.92,2228,,1689628285.0,False,False,False,False,False
81,152g7pf,Justrolledintotheshop,/r/Justrolledintotheshop/comments/152g7pf/rolled_out_today_boys_22_years_in_the_field_im/,fmlyjwls,"Rolled out today boys. 22 years in the field, I’m done. No idea what’s next.",3995,0.96,298,,1689633067.0,False,False,False,False,False
82,152gpl7,meirl,/r/meirl/comments/152gpl7/me_irl/,RogalikYT,Me irl,9120,0.98,271,,1689634255.0,False,False,False,False,False
83,152qbz0,oddlyterrifying,/r/oddlyterrifying/comments/152qbz0/my_kid_looking_directly_at_the_camera/,GentiKras,My kid looking directly at the camera,913,0.97,21,,1689661413.0,False,False,False,False,False
84,152dq1n,CombatFootage,/r/CombatFootage/comments/152dq1n/longer_version_of_the_chechen_ambush_in_russia/,z7strpurez7,Longer version of the Chechen ambush in Russia,5717,0.96,628,,1689627291.0,True,False,False,False,False
85,152jan4,WorkersStrikeBack,/r/WorkersStrikeBack/comments/152jan4/leslie_jones_all_of_us_needs_to_strike_against/,ADignifiedLife,"Leslie Jones : "" ALL OF US NEEDS TO STRIKE AGAINST THE FUCKING CORPORATIONS ! "" They Fing all of us!!",2643,0.93,68,,1689640781.0,False,False,False,False,False
86,152plde,gifs,/r/gifs/comments/152plde/parents_presence_means_everything/,TheTastyHomer,Parents' presence means everything,1020,0.94,41,,1689658958.0,False,False,False,False,False
87,152i4ag,WitchesVsPatriarchy,/r/WitchesVsPatriarchy/comments/152i4ag/i_cant_stop_laughing/,mordrathe,I can't stop laughing,3002,0.97,29,,1689637755.0,False,False,False,False,False
88,152f5zg,ThatsInsane,/r/ThatsInsane/comments/152f5zg/police_officer_distracted_by_his_phone_hits/,uchman365,Police Officer Distracted by His Phone Hits Cyclist with His Squad Car ,4610,0.95,334,,1689630582.0,False,False,False,False,False
89,152m5dq,Spiderman,/r/Spiderman/comments/152m5dq/witnesses_by_art_retr0/,Fehellogoodsir,"“Witnesses”, by @art_retr0",1696,0.99,45,,1689648616.0,False,False,False,False,False
90,152dijq,crochet,/r/crochet/comments/152dijq/most_relatable_comment/,e_j_west,Most relatable comment,5569,0.96,68,,1689626820.0,False,False,False,False,False
91,152impx,teenagers,/r/teenagers/comments/152impx/well_i_already_knew_i_was_underweight_but_damn_i/,Miserable-yak-5806,Well I already knew I was underweight but damn I didn't know i was THAT underweight :\,3034,0.94,865,13,1689639041.0,False,False,False,False,False
92,152hpz8,Breath_of_the_Wild,/r/Breath_of_the_Wild/comments/152hpz8/bro/,OutlandishnessNo6964,Bro...,3160,0.94,66,,1689636732.0,False,False,False,False,False
93,1527qgw,technicallythetruth,/r/technicallythetruth/comments/1527qgw/a_life_tip_from_betty_crocker/,0Ring-0,A life tip from Betty Crocker?,38759,0.92,501,,1689613677.0,False,False,False,False,False
94,152e9ub,nba,/r/nba/comments/152e9ub/phil_jackson_on_differences_between_jordan_and/,waynequit,"Phil Jackson on differences between Jordan and Kobe: “Michael was more charismatic and gregarious than Kobe. He loved hanging out with his teammates and security guards, playing cards, smoking cigars, and joking around.""",4783,0.96,907,,1689628517.0,False,False,False,False,False
95,152p9v0,arknights,/r/arknights/comments/152p9v0/maria_trying_out_uncles_drip_by_七铭的鲁迪乌斯/,NeinHans,Maria trying out Uncle's drip. [by 七铭的鲁迪乌斯],993,0.99,17,"Kazuhira ""one Deagle for every :beagle:"" Miller",1689657914.0,False,False,False,False,False
96,152a9fc,WTF,/r/WTF/comments/152a9fc/the_crane_is_going_place/,8wine,The crane is going place,8534,0.94,543,,1689619478.0,False,False,False,False,False
97,152g9ms,mildlyinfuriating,/r/mildlyinfuriating/comments/152g9ms/my_roommate_decided_i_needed_to_be_kicked_out/,Historical-List3360,My roommate decided I needed to be kicked out,10058,0.94,541,,1689633188.0,False,False,False,False,False
98,152mj2a,ClashRoyale,/r/ClashRoyale/comments/152mj2a/clash_royale_in_2023/,Rich-Grade-5980,Clash Royale in 2023,1488,0.97,70,,1689649667.0,False,False,False,False,False
99,152hutx,videogames,/r/videogames/comments/152hutx/who_remembers/,Gamemes,Who remembers?,2826,0.91,458,,1689637074.0,False,False,False,False,False
100,1527vsw,oddlyspecific,/r/oddlyspecific/comments/1527vsw/what_a_turn_of_events/,Optimal_Test3280,What a turn of events,21791,0.92,895,,1689614017.0,False,False,False,False,False
