rank,id,subreddit,permalink,author,title,score,upvote_ratio,num_comments,author_flair_text,created_utc,over_18,edited,stickied,locked,is_original_content
1,14xaeox,meirl,/r/meirl/comments/14xaeox/meirl/,Jimbo072,meirl,11799,0.98,330,,1689126538.0,False,False,False,False,False
2,14x70f8,WhitePeopleTwitter,/r/WhitePeopleTwitter/comments/14x70f8/no_connection_surely/,Tri734,No connection surely,19746,0.98,354,,1689117672.0,False,False,False,False,False
3,14xbuoo,facepalm,/r/facepalm/comments/14xbuoo/nice_one/,EarlyPangolinz,Nice one,6414,0.96,361,,1689130376.0,False,False,False,False,False
4,14x8ia9,Damnthatsinteresting,/r/Damnthatsinteresting/comments/14x8ia9/repairing_a_broken_tail_light_by_hand/,johnwayne2413,Repairing a broken tail light by hand,8901,0.97,246,,1689121453.0,False,False,False,False,False
5,14x6jvh,PublicFreakout,/r/PublicFreakout/comments/14x6jvh/blood_sweat_and_tears/,itsokayyoucanlaugh,"Blood, sweat and tears",11771,0.96,881,,1689116544.0,False,False,False,False,False
6,14x6amw,todayilearned,/r/todayilearned/comments/14x6amw/til_rocky_aoki_founder_of_benihana_restaurants/,gonejahman,"TIL Rocky Aoki, founder of Benihana restaurants, didn't know how to cook, was a Hall of Fame Wrestler, won a world title in backgammon, was deep-sea treasure hunter, set a record for the longest balloon flight, raced cars and boats, founded a softcore porn mag and is DJ Steve Aoki's dad.",10553,0.96,354,,1689115928.0,False,False,False,False,False
7,14x3ujy,tumblr,/r/tumblr/comments/14x3ujy/angry_ghosts_holding_grudges/,StraightOuttaOlaphis,Angry ghosts holding grudges,24597,0.97,324,,1689110304.0,False,False,False,False,False
8,14x6x7n,BeAmazed,/r/BeAmazed/comments/14x6x7n/cosplaying_as_ursula/,BVIRALofficial,Cosplaying as Ursula,10218,0.93,389,,1689117451.0,False,False,False,False,False
9,14x81oz,funny,/r/funny/comments/14x81oz/they_really_do_look_different/,elOriginalSpaceAgent,They really do look different,7381,0.96,146,,1689120277.0,False,False,False,False,False
10,14x3opt,mildlyinfuriating,/r/mildlyinfuriating/comments/14x3opt/parents_left_for_vacation_for_a_week_and_left_the/,DarthIsopod,Parents left for vacation for a week and left the neighbor’s daughter in charge of feeding them. Tank is basically dead,25173,0.95,1675,,1689109942.0,False,False,False,False,False
11,14x3uvh,politics,/r/politics/comments/14x3uvh/doj_no_longer_believes_trump_should_have_immunity/,Starkiller20140,DOJ no longer believes Trump should have immunity from E. Jean Carroll defamation lawsuit,13662,0.96,267,,1689110325.0,False,False,False,False,False
12,14x4gj6,HumansBeingBros,/r/HumansBeingBros/comments/14x4gj6/great_success/,xzotc,Great success 😎,12916,0.97,154,,1689111646.0,False,False,False,False,False
13,14x471t,marvelmemes,/r/marvelmemes/comments/14x471t/the_reason_why_hughs_suit_has_sleeves/,TheCoranger,The reason why Hugh's suit has sleeves:,17043,0.95,608,Avengers,1689111051.0,False,False,False,False,False
14,14x9suj,nextfuckinglevel,/r/nextfuckinglevel/comments/14x9suj/6yearold_lands_a_jet/,finnyy04,6-year-old lands a jet,4948,0.89,915,,1689124930.0,False,False,False,False,False
15,14x5bis,oddlyspecific,/r/oddlyspecific/comments/14x5bis/how_many_times_had_this_happened/,rplribeiro,How many times had this happened??,12032,0.94,657,,1689113596.0,False,False,False,False,False
16,14x25zz,MadeMeSmile,/r/MadeMeSmile/comments/14x25zz/this_made_me_smile/,oldsouliving,This made me smile,39089,0.94,841,,1689106562.0,False,False,False,False,False
17,14x64kg,lotrmemes,/r/lotrmemes/comments/14x64kg/ignore_the_fact_that_aragorn_probs_already_knew/,Warp_Legion,Ignore the fact that Aragorn probs already knew all this about Gandalf :P,8324,0.98,275,Uruk-hai,1689115524.0,False,False,False,False,False
18,14x1e64,gaming,/r/gaming/comments/14x1e64/too_accurate/,Deprobot21,Too accurate,24910,0.95,909,,1689104835.0,False,False,False,False,False
19,14xbj0q,wallstreetbets,/r/wallstreetbets/comments/14xbj0q/chose_your_fighter_in_the_battle_of_cucks_zuck_vs/,Responsible_Hotel_65,Chose your fighter in the battle of Cucks : Zuck vs Musk,3272,0.92,828,,1689129546.0,False,False,False,False,False
20,14x3dpy,TrueOffMyChest,/r/TrueOffMyChest/comments/14x3dpy/i_ruined_my_sisters_gender_reveal_out_of_spite/,Xpenditure,I ruined my sister's gender reveal out of spite.,13293,0.94,1077,,1689109274.0,False,False,False,False,False
21,14x9r7v,WhitePeopleTwitter,/r/WhitePeopleTwitter/comments/14x9r7v/i_cant_even_imagine/,CrunchM,I can't even imagine,8011,0.98,432,,1689124811.0,False,False,False,False,False
22,14x8nbn,pics,/r/pics/comments/14x8nbn/taking_the_new_john_oliver_template_out_for_a_spin/,Bwob,Taking the new John Oliver template out for a spin.,4581,0.86,243,,1689121851.0,False,False,False,False,False
23,14x4sp7,coolguides,/r/coolguides/comments/14x4sp7/a_cool_guide_to_fries_what_is_your_favourite/,erin214,A cool guide to fries. What is your favourite?,9243,0.9,2377,,1689112421.0,False,False,False,False,False
24,14x7sju,nba,/r/nba/comments/14x7sju/charania_just_in_the_nba_board_of_governors_has/,Michael_B_Lopez,"[Charania] Just in: The NBA Board of Governors has approved two new gameplay changes for the 2023-24 season, per sources: - In-game penalty for flops resulting in technical foul free throw - A second coach’s challenge awarded if first challenge is successful",4883,0.98,413,:gsw-1: Warriors,1689119671.0,False,False,False,False,False
25,14xa7sb,Superstonk,/r/Superstonk/comments/14xa7sb/rc_on_twitter/,Justbuster_,Rc on Twitter 🥳,3970,0.94,109,🦍Voted✅,1689126025.0,False,False,False,False,False
26,14x8nti,Whatcouldgowrong,/r/Whatcouldgowrong/comments/14x8nti/wcgw_if_i_climb_up_on_this_bucket/,Unlikely_Raccoon_199,WCGW if I climb up on this bucket?,4258,0.97,202,,1689121882.0,False,False,False,False,False
27,14x4if5,therewasanattempt,/r/therewasanattempt/comments/14x4if5/to_eat_while_driving/,TXVERAS,To eat while driving ,8643,0.97,418,Mr. Handsome,1689111769.0,False,False,False,False,False
28,14x3uj0,LeopardsAteMyFace,/r/LeopardsAteMyFace/comments/14x3uj0/the_incompetence_of_desantis_and_republicans/,Humble_Novice,"The Incompetence of DeSantis and Republicans Leads Farmers Insurance to Leave Florida, Negatively Affecting 100,000 Homeowners",7447,0.96,550,,1689110303.0,False,False,False,False,False
29,14x3qt2,rareinsults,/r/rareinsults/comments/14x3qt2/not_exactly_an_insult_but_pretty_fucking_good/,Ripefinder20,Not exactly an insult but pretty fucking good,9176,0.95,212,,1689110073.0,False,False,False,False,False
30,14xaor7,DunderMifflin,/r/DunderMifflin/comments/14xaor7/who_is_your_favorite_willy_wonka/,BIGD0G29585,Who is Your Favorite Willy Wonka?,2818,0.96,142,,1689127291.0,False,False,False,False,False
31,14x95eb,comics,/r/comics/comments/14x95eb/note_to_self/,MrLovens,note to self,3419,0.98,26,Mr. Lovenstein,1689123203.0,False,False,False,False,False
32,14x4pb1,memes,/r/memes/comments/14x4pb1/the_wonka_we_deserve/,QuicklyThisWay,The Wonka we deserve,9825,0.89,542,Nyan cat,1689112210.0,False,False,False,False,False
33,14x7jfm,AskReddit,/r/AskReddit/comments/14x7jfm/what_cheap_food_would_you_still_eat_no_matter_how/,UYScutiPuffJr,What “cheap” food would you still eat no matter how rich you got?,4204,0.94,6513,,1689119005.0,False,False,False,False,False
34,14x56o9,LifeProTips,/r/LifeProTips/comments/14x56o9/lpt_always_ask_to_see_the_bottle_being_opened/,Snxwe,LPT: Always ask to see the bottle being opened when getting bottle service in a club,5632,0.96,569,,1689113280.0,False,False,False,False,False
35,14x36lw,technology,/r/technology/comments/14x36lw/twitter_is_tanking_amid_threads_surging/,marketrent,"Twitter is “tanking” amid Threads’ surging popularity, analysts say",7513,0.9,913,,1689108826.0,False,False,False,False,False
36,14x7tkl,facepalm,/r/facepalm/comments/14x7tkl/health_counseling/,PrudentSalez,Health Counseling,9393,0.94,331,,1689119743.0,False,False,False,False,False
37,14x679c,TikTokCringe,/r/TikTokCringe/comments/14x679c/tfw_your_dad_peaked_in_high_school/,Buddhababy0107,TFW your dad peaked in high school,5078,0.91,722,,1689115705.0,False,False,False,False,False
38,14xdcce,shittymoviedetails,/r/shittymoviedetails/comments/14xdcce/in_wonka_2023_oh_for_fucks_sake_did_we_really/,fuzzy_dice_99,"In Wonka (2023)… oh for fuck’s sake, did we really need a Willy Wonka prequel?",1758,0.97,117,,1689134462.0,False,False,False,False,False
39,14x6eqx,cats,/r/cats/comments/14x6eqx/typical/,rifle-mel,TYPICAL,4686,0.99,135,,1689116207.0,False,False,False,False,False
40,14x3sgb,fightporn,/r/fightporn/comments/14x3sgb/road_rager_thought_he_was_a_badass/,MikeisTOOOTALLL,Road Rager thought he was a badass,6728,0.97,313,,1689110173.0,False,False,False,False,False
41,14x77wh,WitchesVsPatriarchy,/r/WitchesVsPatriarchy/comments/14x77wh/uhh_where_can_i_sign_up_for_this_schooling/,stonerspartanlady,Uhh where can I sign up for this schooling?!?!? 🧹🪄😈☠️,4149,0.96,126,,1689118206.0,False,False,False,False,False
42,14x2fhf,PoliticalHumor,/r/PoliticalHumor/comments/14x2fhf/all_hail_mother_russia/,Jeffreyxu0927,All hail mother Russia,7796,0.95,450,,1689107141.0,False,False,True,False,False
43,14wxse5,oddlysatisfying,/r/oddlysatisfying/comments/14wxse5/cutting_a_paper_with_this_thing_called_gyrocut/,zi-zu,cutting a paper with this thing called 'gyro-cut',34058,0.95,483,,1689096785.0,False,False,False,False,False
44,14x22p1,BlackPeopleTwitter,/r/BlackPeopleTwitter/comments/14x22p1/elon_aint_ready/,MikeisTOOOTALLL,Elon ain’t ready,8335,0.96,595,,1689106360.0,False,False,False,False,False
45,14x4a5y,conservativeterrorism,/r/conservativeterrorism/comments/14x4a5y/was_sarah_palin_the_beginning_of_the_end_to_the/,BuyOutWallStreet,Was Sarah Palin the beginning of the end to the modern conservative Republican party?,5747,0.94,650,,1689111252.0,False,False,False,False,False
46,14x5m0o,news,/r/news/comments/14x5m0o/new_arkansas_law_removes_work_permit_requirement/,SalamanderWithAHat,New Arkansas law removes work permit requirement for children under 16,4734,0.96,350,,1689114297.0,False,False,False,False,False
47,14x63rb,HolUp,/r/HolUp/comments/14x63rb/bruh_im_weak_stop/,beastmodeChadF13,bruh I'm weak stop ✋️  😭 😂 ,5162,0.92,139,,1689115473.0,False,False,False,False,False
48,14xay8e,unpopularopinion,/r/unpopularopinion/comments/14xay8e/women_sexualize_men_in_the_workplace_just_as_much/,Visual_Try_4269,"Women sexualize men in the workplace just as much, if not more, than men sexualize women",2293,0.81,585,,1689127969.0,False,1689128605.0,False,False,False
49,14wzunn,PrequelMemes,/r/PrequelMemes/comments/14wzunn/the_crossover_we_all_want/,ThrustBastard,The crossover we all want,14796,0.94,187,,1689101415.0,False,False,False,False,False
50,14x5zyr,meirl,/r/meirl/comments/14x5zyr/meirl/,Ullmic,meirl,11654,0.95,380,,1689115226.0,False,False,False,False,False
51,14x8rjw,OldSchoolCool,/r/OldSchoolCool/comments/14x8rjw/lynda_carter_battle_of_the_network_stars_1976/,kerouac-nin,Lynda Carter - Battle of the Network Stars - 1976,2990,0.94,176,,1689122169.0,False,False,False,False,False
52,14wz8j5,WorkReform,/r/WorkReform/comments/14wz8j5/the_united_states_has_about_700_billionaires_they/,kevinmrr,The United States has about 700 billionaires. They control federal and state politics. It is crazy to think about how a mere 700 people are screwing up hundreds of millions of lives.,12501,0.94,449,⛓️ Prison For Union Busters,1689099991.0,False,False,False,False,False
53,14x0u2z,ContagiousLaughter,/r/ContagiousLaughter/comments/14x0u2z/magic_trick_gone_wrong/,icameinyourburrito,Magic trick gone wrong,9988,0.96,100,,1689103564.0,False,False,False,False,False
54,14x69o0,AITAH,/r/AITAH/comments/14x69o0/aitah_for_telling_my_wife_to_fuck_off_and_that/,Bluemeanie04,AITAH for telling my wife to fuck off and that she’s a selfish bitch for letting her aunt take my daughter somewhere special I have been trying to take my daughter too for over 2 years?,4225,0.9,1750,,1689115863.0,False,1689134748.0,False,False,False
55,14x128p,wholesomememes,/r/wholesomememes/comments/14x128p/lets_all_spread_love_not_hate/,FunRaspberryz,Let's all spread love not hate.,9940,0.97,203,,1689104078.0,False,False,False,False,False
56,14x6fr3,antiwork,/r/antiwork/comments/14x6fr3/35hour_and_still_broke/,jru92,$35/hour and still broke,4005,0.87,1344,,1689116279.0,False,1689140143.0,False,False,False
57,14wxe8h,nottheonion,/r/nottheonion/comments/14wxe8h/mike_lindell_selling_off_mypillow_equipment_they/,Pineapple__Jews,Mike Lindell Selling Off MyPillow Equipment: They ‘Did Cancel Culture On Us’,19230,0.91,2319,,1689095892.0,False,False,False,False,False
58,14x1w4c,NatureIsFuckingLit,/r/NatureIsFuckingLit/comments/14x1w4c/hummingbird_and_the_video_shows_how_she_snores/,volossaveroniki,🔥 Hummingbird. And the video shows how she snores.,7186,0.98,133,,1689105951.0,False,False,False,False,False
59,14wz0zu,worldnews,/r/worldnews/comments/14wz0zu/twitter_better_for_freedom_of_speech_says_senior/,DegnarOskold,"Twitter better for ‘freedom of speech’, says senior Afghan Taliban official",11482,0.92,886,,1689099510.0,False,False,False,False,False
60,14x56sa,ThatsInsane,/r/ThatsInsane/comments/14x56sa/a_father_tells_his_daughter_that_a_man_is_coming/,BroBogan,A father tells his daughter that a man is coming and they immediately cover their faces,4725,0.89,921,,1689113288.0,False,False,False,False,False
61,14x0zmp,CrazyFuckingVideos,/r/CrazyFuckingVideos/comments/14x0zmp/skater_breaks_both_legs_in_failed_jump/,PearJolly6614,Skater breaks both legs in failed jump,8644,0.95,785,,1689103906.0,False,False,False,False,False
62,14x5tmr,anime_irl,/r/anime_irl/comments/14x5tmr/anime_irl/,heavyButtock66,anime_irl,4322,0.92,84,,1689114807.0,False,False,False,False,False
63,14x25a5,Damnthatsinteresting,/r/Damnthatsinteresting/comments/14x25a5/chikens_become_hypnotized_when_a_line_is_drawn_in/,Overall-Relation-561,Chikens become hypnotized When a line is drawn in front of them.,32286,0.94,961,,1689106521.0,False,False,False,False,False
64,14x23jo,cyberpunkgame,/r/cyberpunkgame/comments/14x23jo/saburo_arasaka150_years_and_of_all_fucking_days/,xeriax51,"Saburo Arasaka...150 years, and of all fucking days, today. -Jackie",6835,0.97,195,Arasaka,1689106416.0,True,False,False,False,False
65,14x4du6,oddlyterrifying,/r/oddlyterrifying/comments/14x4du6/this_9000yearold_stone_mask_is_the_oldest_mask_in/,-SimplyLemonade-,"This 9000-year-old stone mask is the oldest mask in the world, and was found in the Judean Desert in Israel [3000x4000]",4888,0.98,161,,1689111481.0,False,False,False,False,False
66,14wydz8,dankmemes,/r/dankmemes/comments/14wydz8/it_will_either_be_ridiculously_easier_than_it_was/,Wizzxd__,"It will either be ridiculously easier than it was before, or just as hard",19750,0.96,570,:nu:,1689098123.0,False,False,False,False,False
67,14x6han,terriblefacebookmemes,/r/terriblefacebookmemes/comments/14x6han/so_is_this_building_not_real_or_are_they_implying/,Sadboy_looking4memes,"So is this building not real, or are they implying it was built recently and no one noticed?",3423,0.97,246,,1689116393.0,False,False,False,False,False
68,14x1433,MadeMeSmile,/r/MadeMeSmile/comments/14x1433/when_a_child_is_shown_love_the_child_begins_to/,One_percentile,"When a child is shown love, the child begins to mirror and return the affection.",31348,0.94,793,,1689104186.0,False,False,False,False,False
69,14wvq3n,formuladank,/r/formuladank/comments/14wvq3n/meanwhile_at_the_alpha_tauri_hq/,SyiGG,Meanwhile at the Alpha Tauri HQ......,25300,0.95,325,BWOAHHHHHHH ,1689092170.0,False,False,False,False,False
70,14x5npu,teenagers,/r/teenagers/comments/14x5npu/top_comment_is_my_reply_to_this/,mitskilover12,top comment is my reply to this 😭,4176,0.97,398,16,1689114408.0,False,False,False,False,False
71,14x8zv7,HonkaiStarRail,/r/HonkaiStarRail/comments/14x8zv7/some_days_you_find_yourself_debating_whether/,thatguywithawatch,Some days you find yourself debating whether those last 15 jades are *really* that important.,2360,0.9,246,,1689122786.0,False,False,False,False,False
72,14x5jzt,popculturechat,/r/popculturechat/comments/14x5jzt/azealia_banks_demonstrating_how_to_respond_if_a/,whitemaleinamerica,Azealia Banks demonstrating how to respond if a fan throws something at a performer.,3533,0.95,362,,1689114156.0,False,False,False,False,False
73,14x194j,Unexpected,/r/Unexpected/comments/14x194j/bullseye/,fitemebtch,Bullseye,7114,0.97,154,,1689104508.0,False,False,False,False,False
74,14x8lo7,IllegallySmolCats,/r/IllegallySmolCats/comments/14x8lo7/biscuit_is_3_weeks_old_today_and_his_punishment/,catmmm,Biscuit is 3 weeks old today and his punishment for being so cute is....making biscuits,2248,0.99,73,,1689121727.0,False,False,False,False,False
75,14wzbi4,nonononoyes,/r/nonononoyes/comments/14wzbi4/man_jumps_from_moving_train_assuming_its_going_to/,RichardsonSheila,man jumps from moving train assuming it's going to crash.,8185,0.97,186,,1689100196.0,False,False,False,False,False
76,14xbtx4,movies,/r/movies/comments/14xbtx4/hollywood_studios_wga_strike_endgame_is_to_let/,getBusyChild,Hollywood Studios’ WGA Strike Endgame Is To Let Writers Go Broke Before Resuming Talks In Fall,1411,0.94,258,,1689130326.0,False,False,False,False,False
77,14x937w,geography,/r/geography/comments/14x937w/population_distribution_of_ireland_1841_vs_modern/,SuperPuggo105,Population Distribution of Ireland 1841 vs modern date.,2059,0.97,142,,1689123038.0,False,False,False,False,False
78,14x5q7l,doordash,/r/doordash/comments/14x5q7l/customer_gave_me_his_order/,ShadyAssBitch,customer gave me his order..,3253,0.99,187,,1689114577.0,False,False,False,False,False
79,14xclzm,baseball,/r/baseball/comments/14xclzm/the_nl_has_won_the_all_star_game_for_the_first/,HelpMeWithMyHWpls,The NL has won the All Star Game for the first time since 2012!,1240,0.97,226,Chicago Cubs :chc2:,1689132395.0,False,False,False,False,False
80,14x2rr7,ChoosingBeggars,/r/ChoosingBeggars/comments/14x2rr7/just_went_through_it_just_wow/,HotConsequencez,"Just went through it, just wow.",4615,0.96,366,,1689107887.0,False,False,False,False,False
81,14x4e7l,politics,/r/politics/comments/14x4e7l/marjorie_taylor_greene_introduces_amendment/,mclardass,Marjorie Taylor Greene introduces amendment directing Biden to withdraw from Nato,7704,0.9,1743,,1689111505.0,False,False,False,False,False
82,14x77k6,Spiderman,/r/Spiderman/comments/14x77k6/fun_fact_there_were_different_variations_of_atsv/,slientxx,"Fun fact: There were different variations of ATSV, here’s the ending in two versions:",2648,0.97,191,,1689118180.0,False,False,False,False,False
83,14x008j,europe,/r/europe/comments/14x008j/the_hungarian_entomological_society_recently/,ByGollie,The Hungarian Entomological Society recently posted this image highlighting the importance of diverse yards and the decline in insect diversity when shifting to monoculture,6640,0.96,371,,1689101748.0,False,False,False,False,False
84,14x7j39,weddingdress,/r/weddingdress/comments/14x7j39/double_dresses/,Prestigious-Chef3338,Double dresses!,2491,0.96,112,,1689118983.0,False,False,False,False,False
85,14wuapm,NewsOfTheStupid,/r/NewsOfTheStupid/comments/14wuapm/fox_news_regular_who_accused_hunter_biden_of/,Maximum-Toast,Fox News regular who accused Hunter Biden of having nefarious ties to China is now being charged with having nefarious ties to China,25268,0.91,1701,,1689088987.0,False,False,False,False,False
86,14xaeib,Genshin_Impact,/r/Genshin_Impact/comments/14xaeib/so_seeing_as_how_celestia_is_supposed_to_be/,Successful_Warthog49,"So seeing as how Celestia is supposed to be unreachable by normal people. What happens when someone invents the airplane, or hot air balloon?",1662,0.98,238,:venti: + :wanderer: Favs,1689126524.0,False,False,False,False,False
87,14x3euh,clevercomebacks,/r/clevercomebacks/comments/14x3euh/theres_something_happening_here/,Head-Gap8455,There’s something happening here 🎶,4193,0.95,103,,1689109335.0,False,False,False,False,False
88,14x48q3,fixedbytheduet,/r/fixedbytheduet/comments/14x48q3/dudes_gotta_protect_himself/,girolski07,Dude's gotta protect himself.,3838,0.94,117,,1689111155.0,False,False,False,False,False
89,14x5x73,BeAmazed,/r/BeAmazed/comments/14x5x73/biggest_eagle_ive_ever_seen_perches_on_womans/,beastmodeChadF13,biggest eagle I've ever seen perches on woman's hand.  is that a bald eagle?  ,6637,0.93,517,,1689115042.0,False,False,False,False,False
90,14wynb9,starterpacks,/r/starterpacks/comments/14wynb9/girls_get_so_many_compliments_how_come_no_one/,CleaningMySlate,"""girls get so many compliments, how come no one compliments me on my appearance?"" starter pack",12487,0.8,1413,,1689098661.0,False,False,False,False,True
91,14x25rg,whenthe,/r/whenthe/comments/14x25rg/he_got_what_he_deserved_imo/,Bandrbell,He got what he deserved imo,6698,0.87,344,,1689106548.0,False,False,False,False,False
92,14xadsn,Tinder,/r/Tinder/comments/14xadsn/i_saw_my_chance_and_i_took_it/,imjustadudeguy,I saw my chance and I took it,1612,0.82,233,,1689126467.0,False,False,False,False,False
93,14xc1h8,Eldenring,/r/Eldenring/comments/14xc1h8/finally_playing_elden_ring/,SurveyAccording5276,Finally playing elden ring,1290,0.98,92,,1689130895.0,False,False,False,False,False
94,14x4q8o,PeterExplainsTheJoke,/r/PeterExplainsTheJoke/comments/14x4q8o/explain_the_joke_peetah/,goremind,eXpLaIn ThE jOkE pEeTaH,3450,0.94,117,,1689112263.0,False,False,False,False,False
95,14x5a3l,Piracy,/r/Piracy/comments/14x5a3l/hp_printer_features_locked_to_accounts_typical/,NXGZ,"HP printer features locked to accounts, typical.",3128,0.97,136,Leecher,1689113502.0,False,False,False,False,False
96,14x7ayp,Jokes,/r/Jokes/comments/14x7ayp/a_man_answered_an_ad_that_read_hiring_welders/,HelpingHandsUs,"A man answered an ad that read ""Hiring welders $18-$24 per hour""..",2380,0.94,240,,1689118409.0,False,False,False,False,False
97,14wy7px,lgbt,/r/lgbt/comments/14wy7px/rip_jacob_williamson_he_was_only_18_years_old/,psychedelic666,RIP Jacob Williamson. He was only 18 years old.,8983,0.94,469,":trans-bi: ftm he/him • t, top, and hysto",1689097731.0,False,False,False,False,False
98,14x94dr,maybemaybemaybe,/r/maybemaybemaybe/comments/14x94dr/maybe_maybe_maybe/,nikamats,Maybe maybe maybe,1886,0.97,77,,1689123127.0,False,False,False,False,False
99,14xc65b,bangalore,/r/bangalore/comments/14xc65b/my_mom_passed_away_and_suddenly_i_feel_like_a/,mepelican,My mom passed away and suddenly I feel like a guest in my own city.,1221,0.98,127,,1689131216.0,False,False,False,False,False
100,14x05dx,nextfuckinglevel,/r/nextfuckinglevel/comments/14x05dx/unbelievable_flip/,Ok_Influence_4274,Unbelievable flip,19838,0.95,165,,1689102058.0,False,False,False,False,False
