rank,id,subreddit,permalink,author,title,score,upvote_ratio,num_comments,author_flair_text,created_utc,over_18,edited,stickied,locked,is_original_content
1,14wrnzv,mildlyinfuriating,/r/mildlyinfuriating/comments/14wrnzv/saved_this_to_my_cart_yesterday_but_decided_to/,QuickWrenn,Saved this to my cart yesterday but decided to wait until today to buy it to get a sale price on Amazon Prime day.,24266,0.98,1187,,1689082676.0,False,False,False,False,False
2,14wqgze,funny,/r/funny/comments/14wqgze/a_working_printer_certainly_seems_farfetched/,standardkillchain,A working printer certainly seems far-fetched,20610,0.97,426,,1689079708.0,False,False,False,False,False
3,14wtxbf,gaming,/r/gaming/comments/14wtxbf/microsoft_wins_ftc_fight_to_buy_activision/,Gab1024,Microsoft wins FTC fight to buy Activision Blizzard,7193,0.95,3735,,1689088101.0,False,False,False,False,False
4,14wtohr,WatchPeopleDieInside,/r/WatchPeopleDieInside/comments/14wtohr/playing_with_dog_leads_to_accidental_table/,Boojibs,Playing with dog leads to accidental table destruction ,7268,0.95,870,,1689087562.0,False,False,False,False,False
5,14ws36q,BeAmazed,/r/BeAmazed/comments/14ws36q/woman_tackles_fleeing_suspect/,CommercialBox4175,Woman Tackles Fleeing Suspect,8961,0.96,907,,1689083679.0,False,False,False,False,False
6,14wnxyn,facepalm,/r/facepalm/comments/14wnxyn/companies_dont_care/,Sensitive-Jury-1456,Companies DON'T care.,51755,0.95,1173,,1689072875.0,False,False,False,False,False
7,14wqp8z,nextfuckinglevel,/r/nextfuckinglevel/comments/14wqp8z/man_on_bed_suspended_by_parachutes_flies_away_and/,cutestudent,Man on bed suspended by parachutes flies away and takes a nap,14405,0.9,693,,1689080313.0,False,False,False,False,False
8,14wqcer,WhitePeopleTwitter,/r/WhitePeopleTwitter/comments/14wqcer/dont_look_up/,Adelu1219,Don’t look up,10416,0.97,788,:verified:,1689079373.0,False,False,False,False,False
9,14wqut8,ContagiousLaughter,/r/ContagiousLaughter/comments/14wqut8/be_careful_what_you_wish_for/,ButtMonkeySlap,Be careful what you wish for...,9041,0.95,95,,1689080676.0,False,False,False,False,False
10,14wqfqt,marvelmemes,/r/marvelmemes/comments/14wqfqt/so_basically_deadpool_was_the_one_who_fixed_the/,spidey20993,"So basically, Deadpool was the one who fixed the X-Men's outfit",10325,0.97,283,Spider-Man 🕷,1689079619.0,False,False,False,False,False
11,14wq61c,wholesomememes,/r/wholesomememes/comments/14wq61c/im_waiting/,ReynaAllman,I'm waiting...,12279,0.97,489,,1689078908.0,False,False,False,False,False
12,14wnngd,Damnthatsinteresting,/r/Damnthatsinteresting/comments/14wnngd/foal_had_close_call_the_dummy_foal_phenomenon/,Louna_Nova,Foal had close call - The dummy foal phenomenon,28262,0.96,699,,1689072035.0,False,False,False,False,False
13,14wsr47,politics,/r/politics/comments/14wsr47/ron_desantis_under_pressure_as_florida_malaria/,BelleAriel,Ron DeSantis under pressure as Florida malaria cases spread,4798,0.98,674,,1689085245.0,False,False,False,False,False
14,14wq3oa,todayilearned,/r/todayilearned/comments/14wq3oa/til_james_bradley_calculated_the_speed_of_light/,Kipperis,TIL James Bradley calculated the speed of light with a 0.4% error margin in 1729,7185,0.98,257,,1689078725.0,False,False,False,False,False
15,14woftj,community,/r/community/comments/14woftj/the_bear_writers_know_whazzup/,GhOsT_wRiTeR_XVI,“The Bear” writers know whazz-up!,10041,0.94,340,,1689074236.0,False,False,False,False,False
16,14wnfs4,dankmemes,/r/dankmemes/comments/14wnfs4/happened_during_my_first_12_hours_in_la/,DoktoorDre,Happened during my first 12 hours in LA 💀,20927,0.9,1540,,1689071385.0,False,False,False,False,False
17,14wt5zq,Tinder,/r/Tinder/comments/14wt5zq/i_guess_ice_cream_dates_are_considered_a_terrible/,Zhinii1,I guess ice cream dates are considered a terrible idea nowadays,4132,0.97,985,,1689086236.0,False,False,False,False,False
18,14wq4po,Animemes,/r/Animemes/comments/14wq4po/the_goat/,jjeg6804,THE G.O.A.T,7053,0.94,199,⠀,1689078801.0,False,False,False,False,False
19,14wrakh,tumblr,/r/tumblr/comments/14wrakh/thats_just_rabbits_vs_hares_all_over_again_lol/,Peter_Rodruigues,That's just rabbits vs hares all over again lol,5150,0.99,96,,1689081773.0,False,False,False,False,False
20,14wpfno,SipsTea,/r/SipsTea/comments/14wpfno/bro_playing_chess_while_we_play_cheekers/,Alternative_Serve368,Bro playing chess while we play cheekers,7227,0.94,253,,1689076959.0,False,False,False,False,False
21,14wn48x,worldnews,/r/worldnews/comments/14wn48x/nato_decision_on_moving_towards_ukraines/,MagnificentCat,NATO decision on moving towards Ukraine’s membership to be agreed in few hours – Secretary General,9318,0.96,751,,1689070344.0,False,False,False,False,False
22,14wo0fw,memes,/r/memes/comments/14wo0fw/if_you_came_to_australia_for_a_holiday_how_was_it/,K-boomX94,"If you came to Australia for a holiday, how was it?",10744,0.97,459,,1689073074.0,False,False,False,False,False
23,14wom09,unpopularopinion,/r/unpopularopinion/comments/14wom09/you_cant_rarelynever_have_sex_with_your_partner/,EquivalentEmotion950,You can’t rarely/never have sex with your partner and expect them to be faithful.,10176,0.78,3208,,1689074720.0,False,False,False,False,False
24,14wocph,MadeMeSmile,/r/MadeMeSmile/comments/14wocph/my_man_got_moves/,IllTechnician4571,My man got moves!,8063,0.96,85,,1689073993.0,False,False,False,False,False
25,14wnbxb,pcmasterrace,/r/pcmasterrace/comments/14wnbxb/getting_a_gaming_laptop_was_a_mistake_please_dont/,No_Locksmith_1458,Getting a gaming laptop was a mistake. Please don't buy a gaming laptop,10992,0.87,1790,Desktop,1689071035.0,False,False,False,False,False
26,14wrgfx,formuladank,/r/formuladank/comments/14wrgfx/honey_badger_what_happened/,Chell_the_assassin,"Honey Badger, what happened",4181,0.98,133,Mika ends his sa🅱️🅱️atical ,1689082182.0,False,False,False,False,False
27,14wkz1a,shitposting,/r/shitposting/comments/14wkz1a/you_guys_are_sick_af_glory_to_spez/,Notafuqin_Carrot211,You guys are sick af ( glory to spez),39720,0.95,261,We do a little trolling :snoo_trollface:,1689063194.0,False,False,False,False,False
28,14wkmz7,news,/r/news/comments/14wkmz7/14yearold_girl_missing_for_2_weeks_found_in/,ezikeo,"14-year-old girl missing for 2 weeks found in Marine barracks was ‘sold,’ says aunt",16725,0.96,1943,,1689062054.0,False,False,False,False,False
29,14wrfst,OldSchoolCool,/r/OldSchoolCool/comments/14wrfst/if_your_default_mental_photo_of_marilyn_monroe_is/,filmroses,"If your default mental photo of Marilyn Monroe is an over-saturated glamour shot of her with her mouth open, please take a moment to replace it with this one of her giving zero fucks about some bears eating garbage. 1953",3547,0.95,156,,1689082141.0,False,False,False,False,False
30,14wpnff,technology,/r/technology/comments/14wpnff/san_francisco_protestors_are_disabling_autonomous/,chrisdh79,"San Francisco protestors are disabling autonomous vehicles using traffic cones | ""It's a great time""",4374,0.94,721,,1689077532.0,False,False,False,False,False
31,14wmfu3,TikTokCringe,/r/TikTokCringe/comments/14wmfu3/why_dont_my_kids_trust_me_ive_never_did_something/,Arkatoshi,Why don’t my kids trust me? I‘ve never did something wrong in the education. Why won’t they tell me anything?,10714,0.85,1330,,1689068173.0,False,False,False,False,False
32,14wnl6h,clevercomebacks,/r/clevercomebacks/comments/14wnl6h/thats_not_acceptable/,romanystock99,That's not acceptable.,6592,0.9,397,,1689071837.0,False,False,False,False,False
33,14wo9fb,cats,/r/cats/comments/14wo9fb/this_is_true_love/,Melissa_Lewes,this is true love,5302,0.98,61,,1689073741.0,False,False,False,False,False
34,14wlwyr,comics,/r/comics/comments/14wlwyr/expressing_out/,GrumpyMashy,Expressing Out,10301,0.89,272,,1689066411.0,False,False,False,False,True
35,14wny99,TrueOffMyChest,/r/TrueOffMyChest/comments/14wny99/thought_he_stood_me_up_on_our_date_turns_out_he/,quanvuminhtran,"Thought he stood me up on our date, turns out he died...",5444,0.97,193,,1689072900.0,False,False,False,False,False
36,14wrb8p,ufc,/r/ufc/comments/14wrb8p/well_shit/,thehiguyz,Well Shit,3170,0.96,892,,1689081821.0,False,False,False,False,False
37,14wpmhe,LateStageCapitalism,/r/LateStageCapitalism/comments/14wpmhe/ask_corporations_why_theyre_paying_their/,Sensitive-Jury-1456,Ask corporations why they’re paying their employees low wages,3915,0.97,109,,1689077462.0,False,False,False,False,False
38,14ws7tk,me_irlgbt,/r/me_irlgbt/comments/14ws7tk/me_irlgbt/,Sonic_the_hedgedog,me_irlgbt,2832,0.95,33,MLM/Ace :mlm_ace:,1689083997.0,False,False,False,False,False
39,14wtfgv,TwoXChromosomes,/r/TwoXChromosomes/comments/14wtfgv/am_i_being_manipulative_by_asking_for_a_vasectomy/,dontrockthejuicebox,Am I being manipulative by asking for a vasectomy?,2344,0.93,1219,,1689086916.0,False,False,False,False,False
40,14wrj1x,oddlyterrifying,/r/oddlyterrifying/comments/14wrj1x/my_eyes_started_doing_a_this_really_cool_looking/,AHarris_poems,My eyes started doing a this really cool looking - different sizes thing. (Turns out it’s a tumour),3024,0.98,141,,1689082345.0,False,False,False,False,False
41,14wor7a,oddlysatisfying,/r/oddlysatisfying/comments/14wor7a/crystal_clear_water/,goldbutthole,Crystal clear water,4442,0.98,74,,1689075129.0,False,False,False,False,False
42,14wq5c6,curb,/r/curb/comments/14wq5c6/finding_your_roots/,nikamats,Finding Your Roots,3466,0.97,207,,1689078853.0,False,False,False,False,False
43,14wpd99,MemePiece,/r/MemePiece/comments/14wpd99/the_only_reason_he_couldve_possibly_put_that_on/,metalhiro,The only reason he could’ve possibly put that on,4003,0.94,79,,1689076806.0,False,False,False,False,False
44,14wowq7,Unexpected,/r/Unexpected/comments/14wowq7/disaster_save/,dtn4427,Disaster save ,4244,0.97,75,,1689075556.0,False,False,False,False,False
45,14wn8ur,LeopardsAteMyFace,/r/LeopardsAteMyFace/comments/14wn8ur/mypillow_is_auctioning_off_equipment_after/,ToffeeFever,MyPillow is auctioning off equipment after retailers pull its products: CEO Mike Lindell says annual sales fell $100 million after several big-box retailers cut ties following his election claims.,5145,0.97,450,,1689070770.0,False,False,False,False,False
46,14wpkri,WorkReform,/r/WorkReform/comments/14wpkri/ask_corporations_why_theyre_paying_their/,Sensitive-Jury-1456,Ask corporations why they’re paying their employees low wages,3477,0.97,82,,1689077334.0,False,False,False,False,False
47,14wqgdr,midjourney,/r/midjourney/comments/14wqgdr/cast_of_the_office_in_gta_v_style/,Dankuruma,Cast of 'The Office' in GTA V Style.,3103,0.92,279,,1689079664.0,False,False,False,False,False
48,14wle0k,ProgrammerHumor,/r/ProgrammerHumor/comments/14wle0k/kindoflogic/,Strange_Dragonfly964,kindOfLogic,8054,0.95,208,:py:,1689064642.0,False,False,False,False,False
49,14wsdum,Superstonk,/r/Superstonk/comments/14wsdum/citadel_securities_and_citadel_market_maker_have/,monkeyshinenyc,Citadel Securities and Citadel Market Maker Have been going after GG hard.,2748,0.95,229,tag u/Superstonk-Flairy for a flair,1689084358.0,False,False,False,False,False
50,14wslnw,lotrmemes,/r/lotrmemes/comments/14wslnw/i_made_this_on_my_phone_please_excuse_the_low/,AdventurousHallz,"I made this on my phone, please excuse the low resolution.",2292,0.97,157,,1689084883.0,False,False,False,False,False
51,14wqwmm,WhitePeopleTwitter,/r/WhitePeopleTwitter/comments/14wqwmm/remember_find_11780_votes_today_a_grand_jury_in/,Travismatthew08,"Remember ""Find 11,780 votes?"" Today a Grand Jury in Georgia decides whether to charge Trump with felony charges.",6700,0.98,299,,1689080803.0,False,False,False,False,False
52,14wp8m1,HolUp,/r/HolUp/comments/14wp8m1/hispanic_pitbull/,_Aladin,Hispanic pitbull,3840,0.99,68,,1689076435.0,False,False,False,False,False
53,14wrq4m,popculturechat,/r/popculturechat/comments/14wrq4m/why_has_zendaya_been_getting_so_much_hate_since/,HiccupHaddockismine,Why has Zendaya been getting so much hate since the Challengers trailer dropped?,2492,0.92,509,,1689082818.0,False,False,False,False,False
54,14wnw8b,whenthe,/r/whenthe/comments/14wnw8b/damn_bro_you_got_the_whole_squad_laughing/,Viggyry,"Damn bro, you got the whole squad laughing",5785,0.85,366,👨‍🦲🧑👨🧑 weezer,1689072735.0,False,False,False,False,False
55,14wr0cs,dataisbeautiful,/r/dataisbeautiful/comments/14wr0cs/oc_first_6_months_of_orbital_launch_attempts_in/,TK_Say,[OC] First 6 Months of orbital launch attempts in 2023. From launch site to orbit.,2628,0.97,149,,1689081071.0,False,False,False,False,False
56,14wq9v4,awfuleverything,/r/awfuleverything/comments/14wq9v4/i_guess_this_takes_the_meaning_of_shoey_to_the/,FreeDeterminism,I guess this takes the meaning of “shoey” to the next level…,2914,0.93,243,,1689079195.0,False,False,False,False,False
57,14wq617,LifeProTips,/r/LifeProTips/comments/14wq617/lpt_request_best_way_to_respond_to_people_who_ask/,rocketteefsfloor,LPT request: Best way to respond to people who ask for a beer when we have 25 beers on tap?,2734,0.87,1423,,1689078908.0,False,False,False,False,False
58,14woufn,science,/r/science/comments/14woufn/hospital_understaffing_and_poor_work_conditions/,mvea,Hospital understaffing and poor work conditions associated with physician and nurse burnout and intent to leave. The solutions are not resilience training for clinicians to better cope with adverse working conditions but organizational improvements for safe workloads and better work-life balance.,3180,0.97,233,MD/PhD/JD/MBA | Professor | Medicine,1689075376.0,False,False,False,False,False
59,14wni9x,meirl,/r/meirl/comments/14wni9x/meirl/,ukayukay69,Meirl,4062,0.99,94,,1689071589.0,False,False,False,False,False
60,14wmatw,Damnthatsinteresting,/r/Damnthatsinteresting/comments/14wmatw/mama_bird_protects_her_eggs_from_a_hailstorm_in/,PlantZenGuy,"Mama bird protects her eggs from a hailstorm in Boulder, Colorado",21161,0.98,246,,1689067721.0,False,False,False,False,False
61,14wq00k,WTF,/r/WTF/comments/14wq00k/welding/,ReturnOneWayTicket,Welding,2632,0.95,312,,1689078456.0,True,False,False,False,False
62,14wuapm,NewsOfTheStupid,/r/NewsOfTheStupid/comments/14wuapm/fox_news_regular_who_accused_hunter_biden_of/,Maximum-Toast,Fox News regular who accused Hunter Biden of having nefarious ties to China is now being charged with having nefarious ties to China,1518,0.97,137,,1689088987.0,False,False,False,False,False
63,14wsrdo,teenagers,/r/teenagers/comments/14wsrdo/say_what_now/,RacistJacob,Say what now?,1869,0.96,357,,1689085264.0,False,False,False,False,False
64,14wmw88,TheLastAirbender,/r/TheLastAirbender/comments/14wmw88/toph_for_sure/,IndependentEmploy661,Toph for sure,4246,0.96,196,,1689069671.0,False,False,False,False,False
65,14wqolf,PoliticalCompassMemes,/r/PoliticalCompassMemes/comments/14wqolf/something_something_student_loans/,lucimorningstar_,Something something student loans,2361,0.78,781,:libleft: - Lib-Left,1689080265.0,False,False,False,False,False
66,14wk6t7,therewasanattempt,/r/therewasanattempt/comments/14wk6t7/to_shame_meat_eaters/,StarkSlur48,To shame meat eaters,7365,0.94,360,,1689060586.0,False,False,False,False,False
67,14wrfyw,batman,/r/batman/comments/14wrfyw/an_umbrella_batman_three_jokers_1/,Cmyers1980,“An umbrella.” (Batman: Three Jokers #1),2010,0.98,109,,1689082152.0,False,False,False,False,False
68,14wnbrj,antiwork,/r/antiwork/comments/14wnbrj/americanshow_did_it_get_this_way/,Enkir,Americans...how did it get this way?,3546,0.92,1356,,1689071017.0,False,1689071201.0,False,False,False
69,14whtk4,BrandNewSentence,/r/BrandNewSentence/comments/14whtk4/would_like_to_buy_this_guy_a_beer_and_hear_his/,secretslut991,Would like to buy this guy a beer and hear his story,14832,0.96,101,,1689053067.0,False,False,False,False,False
70,14wqfoc,discordVideos,/r/discordVideos/comments/14wqfoc/clown/,HotFireBall,Clown,2242,0.98,47,,1689079613.0,False,False,False,False,False
71,14wpqdj,Eldenring,/r/Eldenring/comments/14wpqdj/if_elden_ring_had_multiple_mounts_it_would_be/,Another_Saint,"if Elden Ring had multiple mounts it would be cool if each one was unique, like this",2332,0.96,192,,1689077746.0,False,False,False,False,False
72,14wqgkq,Hololive,/r/Hololive/comments/14wqgkq/d/,woodenpony,:D,2105,0.96,70,:YAGOO::Suisei::Kronii::Koyori:,1689079678.0,False,False,False,False,False
73,14wmwi9,technews,/r/technews/comments/14wmwi9/a_proposed_massachusetts_law_would_ban_the_sale/,chrisdh79,A Proposed Massachusetts Law Would Ban the Sale of Cell Phone Location Data,3485,0.98,49,,1689069689.0,False,False,False,False,False
74,14wkm6v,europe,/r/europe/comments/14wkm6v/slovak_police_caught_a_guy_speeding_on_an/,mancko28,Slovak police caught a guy speeding on an e-scooter at 118 km/h (68 km/h over the speed limit),5491,0.96,459,Slovakia,1689061977.0,False,False,False,False,False
75,14wpwxp,facepalm,/r/facepalm/comments/14wpwxp/no_one_asks_for_my_pen_anymore/,SeniorPromotions,No one asks for my pen anymore,5673,0.98,54,,1689078220.0,False,False,False,False,False
76,14wngsl,politics,/r/politics/comments/14wngsl/republican_women_learn_the_hard_way_complicity/,Picture-unrelated,"Republican women learn the hard way: Complicity will not protect you — The Freedom Caucus ousts Marjorie Taylor Greene and Ron DeSantis ends alimony for older, mostly conservative women",7503,0.96,484,:flag-or: Oregon,1689071462.0,False,False,False,False,False
77,14wmnbh,Genshin_Impact,/r/Genshin_Impact/comments/14wmnbh/why_did_they_make_this_whole_boss_but_then_only/,Sussybeka,Why did they make this whole boss but then only make it temporary,3994,0.94,356,:cyno:,1689068855.0,False,False,False,False,False
78,14wol8j,DnD,/r/DnD/comments/14wol8j/oc_is_it_a_goose_is_it_an_ooze_yes/,michifromkmk,[OC] Is it a goose? Is it an ooze? Yes!,2579,0.97,66,,1689074657.0,False,False,False,False,True
79,14wjz0g,cursedcomments,/r/cursedcomments/comments/14wjz0g/cursed_op/,Quobl_69420,Cursed_op,8570,0.96,148,,1689059841.0,False,False,False,False,False
80,14woyw8,wallstreetbets,/r/wallstreetbets/comments/14woyw8/team_elon_or_mark/,TotherCanvas249,Team Elon or Mark,2491,0.89,577,,1689075715.0,False,False,False,False,False
81,14wsde5,terriblefacebookmemes,/r/terriblefacebookmemes/comments/14wsde5/because_liberals_are_dumb_you_know/,FashionLurkerGermany,Because Liberals are dumb you know🤣🤣🤣🤣🤣🤣,1546,0.92,103,,1689084328.0,False,False,False,False,False
82,14wqmza,Frugal,/r/Frugal/comments/14wqmza/prime_day_amazon_is_a_marketing_event_not_a_deal/,reloaded890,"Prime Day (Amazon) is a marketing event, not a deal day.",1855,0.94,223,,1689080149.0,False,False,False,False,False
83,14wro86,pokemon,/r/pokemon/comments/14wro86/day_24_of_fusing_every_gen_1_pokemon_into_one_by/,TB_Mumpitz,Day 24 of fusing every Gen 1 pokemon into one by adding the top comment. The hydra is now complete (through the addition of Arbok)! (24/151),1641,0.93,310,,1689082693.0,False,False,False,False,True
84,14wkszv,NatureIsFuckingLit,/r/NatureIsFuckingLit/comments/14wkszv/how_its_like_to_be_stalked_by_a_puma/,esberat,🔥 How it’s like to be stalked by a puma,5026,0.93,253,,1689062587.0,False,False,False,False,False
85,14wq39w,Jokes,/r/Jokes/comments/14wq39w/i_was_banging_this_hot_chick_on_her_kitchen_table/,HelpingHandsUs,I was banging this hot chick on her kitchen table when we heard the front door open..,1983,0.91,89,,1689078693.0,True,False,False,False,False
86,14wnwef,nba,/r/nba/comments/14wnwef/chris_paul_had_the_saddest_warriors_introduction/,_felagund,Chris Paul had the saddest Warriors introduction possible,2667,0.93,379,:sas-4: Spurs,1689072746.0,False,False,False,False,False
87,14wk3un,anime_irl,/r/anime_irl/comments/14wk3un/anime_irl/,maybeharu,anime_irl,5792,0.94,69,,1689060299.0,False,False,False,False,False
88,14wsp3l,inthenews,/r/inthenews/comments/14wsp3l/excongressman_suggests_hunter_biden_alleged/,PandaMuffin1,Ex-Congressman suggests Hunter Biden alleged laptop data fabricated,1411,0.93,286,,1689085110.0,False,False,False,False,False
89,14whi2c,Breath_of_the_Wild,/r/Breath_of_the_Wild/comments/14whi2c/well_excuuuuuuuuuuse_me/,DeeplyThirsty,Well excuuuuuuuuuuse me,11310,0.97,226,,1689052039.0,False,False,False,False,False
90,14wrs17,DunderMifflin,/r/DunderMifflin/comments/14wrs17/jim_was_no_company_man/,Hendo_____,Jim was no company man,1537,0.91,105,,1689082941.0,False,False,False,False,False
91,14wutyw,baseball,/r/baseball/comments/14wutyw/sny_mets_pete_alonso_signed_all_of_his_home_run/,swbl216,[SNY Mets] Pete Alonso signed all of his home run derby balls before hitting them into the stands,1049,0.98,103,New York Mets :nym2:,1689090193.0,False,False,False,False,False
92,14wm4z8,CrazyFuckingVideos,/r/CrazyFuckingVideos/comments/14wm4z8/drug_bust/,SweetyByHeart,Drug bust,3544,0.96,364,,1689067173.0,True,False,False,False,False
93,14wpjow,Fauxmoi,/r/Fauxmoi/comments/14wpjow/tom_sharing_his_thoughts_on_hollywood/,groovygyal,Tom sharing his thoughts on Hollywood,2018,0.95,194,I don’t know her,1689077249.0,False,False,False,False,False
94,14wmko3,ukraine,/r/ukraine/comments/14wmko3/explained_russian_commander_shot_dead_after/,RoninSolutions,"EXPLAINED: Russian Commander Shot Dead After Posting Runs on Strava Running App. Ukraine’s Defense Intelligence has confirmed the shooting and included some very specific details about what happened to Stanislav Rzhytsky, even the type of gun used.",3118,0.98,202,,1689068628.0,False,False,False,False,False
95,14wotbh,NoStupidQuestions,/r/NoStupidQuestions/comments/14wotbh/have_you_ever_secretly_felt_the_urge_to_just_go/,Hungry_Field3670,Have you ever secretly felt the urge to just go and live in a hut in the forest and hunt rabbits and forage for berries like a hermit?,2202,0.91,596,,1689075297.0,False,False,False,False,False
96,14wp804,blackcats,/r/blackcats/comments/14wp804/so_many_beans/,nikki_nitrous,So many beans 🫘,1997,0.98,29,,1689076391.0,False,False,False,False,False
97,14wluge,shittytattoos,/r/shittytattoos/comments/14wluge/sprinkle_freckles/,Pepper-Tea,Sprinkle freckles,3482,0.94,665,,1689066178.0,False,False,False,False,False
98,14wrlyi,WitchesVsPatriarchy,/r/WitchesVsPatriarchy/comments/14wrlyi/i_missed_this_sub_so_badly/,tteetth,I missed this sub so badly,1427,0.95,19,Kitchen Witch ☉,1689082534.0,False,False,False,False,False
99,14wl4cw,2meirl4meirl,/r/2meirl4meirl/comments/14wl4cw/2meirl4meirl/,LazyFlamingRooster,2meirl4meirl,3961,0.98,38,,1689063723.0,False,False,False,False,False
100,14wppsx,CasualUK,/r/CasualUK/comments/14wppsx/hows_everyone_elses_day_going/,vincentcorchoni,How’s everyone else’s day going?,1819,0.98,257,,1689077711.0,False,False,False,False,False
