rank,id,subreddit,permalink,author,title,score,upvote_ratio,num_comments,author_flair_text,created_utc,over_18,edited,stickied,locked,is_original_content
1,14njfn2,funny,/r/funny/comments/14njfn2/taylor_swift_fan_hides_identity_because_she/,ebradio,Taylor Swift Fan Hides Identity Because She Called in Sick to Work,6664,0.98,200,,1688179055.0,False,False,False,False,False
2,14ndmuy,WhitePeopleTwitter,/r/WhitePeopleTwitter/comments/14ndmuy/why_did_biden_try_to_help_people/,fuzzy_dice_99,Why did Biden try to help people?,19316,0.94,684,,1688162788.0,False,False,False,False,False
3,14nb5qs,apolloapp,/r/apolloapp/comments/14nb5qs/today_is_apollo_for_reddits_last_day_and_i_just/,iamthatis,"Today is Apollo for Reddit's last day, and I just released its last update. 🥹 I just wanted to say a big thank you to the folks who have used and supported Apollo over the years, it's been the dream of a lifetime to build this app over the last 9 years. ❤️ Read the eulogy inside! ❤️",53756,0.91,4226,Apollo Developer,1688156839.0,False,1688173709.0,False,False,False
4,14nbnkq,technicallythetruth,/r/technicallythetruth/comments/14nbnkq/doctor_giving_it_to_you_straight/,Manoodley,Doctor giving it to you straight,36510,0.97,408,,1688158031.0,False,False,False,False,False
5,14ni6lz,MadeMeSmile,/r/MadeMeSmile/comments/14ni6lz/this_ups_guy_understood_the_assignment_perfectly/,uchman365,This UPS guy understood the assignment perfectly ,5049,0.99,109,,1688175229.0,False,False,False,False,False
6,14nh6sw,nba,/r/nba/comments/14nh6sw/wojnarowski_free_agent_g_fred_vanvleet_has_agreed/,twistedlogicx,"[Wojnarowski] Free agent G Fred VanVleet has agreed on a three-year, $130 million contract with the Houston Rockets, @KlutchSports CEO Rich Paul and agent Erika Ruiz tell ESPN. Rockets land ex-Raptors All-Star in his prime at 29 years old.",5064,0.97,1580,Toronto Huskies,1688172231.0,False,False,False,False,False
7,14nf94h,coolguides,/r/coolguides/comments/14nf94h/a_cool_guide_for_turning_a_symbol_of_hate_into_a/,NeverMeantDuckin,A cool guide for turning a symbol of hate into a message of love,7808,0.84,510,,1688166927.0,False,False,False,False,False
8,14nb27x,politics,/r/politics/comments/14nb27x/biden_reveals_new_path_to_student_debt_relief/,theindependentonline,Biden reveals ‘new path’ to student debt relief after Supreme Court strikes down president’s plan,14874,0.95,1859,The Independent,1688156611.0,False,False,False,False,False
9,14nbg2a,comics,/r/comics/comments/14nbg2a/oh_no_dont_go/,Pizzacakecomic,"Oh no, don't go.",18517,0.82,366,PizzaCake,1688157532.0,False,False,False,True,True
10,14nem7n,therewasanattempt,/r/therewasanattempt/comments/14nem7n/to_get_away_with_making_that_bet/,TXVERAS,To get away with making that bet,7421,0.93,502,Mr. Handsome,1688165295.0,False,False,False,False,False
11,14nhin6,todayilearned,/r/todayilearned/comments/14nhin6/til_that_the_founder_of_the_notorious_bumfights/,vrphotosguy55,TIL that the founder of the notorious “Bumfights” video series was caught trying to ship stolen baby parts out of Thailand in 2018,3907,0.97,320,,1688173220.0,False,False,False,False,False
12,14n82sp,antiwork,/r/antiwork/comments/14n82sp/supreme_court_tossed_case_these_douchebags/,GraterofCheese,Supreme Court tossed case these douchebags (Alexander Taylor and Myra Brown) submitted against student loan forgiveness due to lack of standing. Let’s upvote and make their faces known.,53752,0.87,2165,,1688149503.0,False,False,False,False,False
13,14n7ev0,nextfuckinglevel,/r/nextfuckinglevel/comments/14n7ev0/domestic_violence_case_prosecutor_picks_up_on/,LambSauce246,Domestic violence case prosecutor picks up on clues that the abuser is in the same house as his ex during their court on Zoom,36551,0.95,758,,1688148006.0,False,False,False,False,False
14,14ne3av,marvelmemes,/r/marvelmemes/comments/14ne3av/im_not_saying_that_they_sent_their_best_skrull_he/,Dwingp,I’m not saying that they sent their best Skrull. He tried.,6020,0.97,103,Avengers,1688163949.0,False,False,False,False,False
15,14n8shx,worldnews,/r/worldnews/comments/14n8shx/billionaires_disappointed_after_superyachts/,LudovicoSpecs,Billionaires ‘disappointed’ after superyachts banned from Naples port,12799,0.96,762,,1688151160.0,False,False,False,False,False
16,14nap08,WatchPeopleDieInside,/r/WatchPeopleDieInside/comments/14nap08/police_officers_show_up_at_womans_house_after/,DarthiusFatticus,Police officers show up at Woman’s house after reports of something hanging from her car trunk 😂,9812,0.94,502,,1688155726.0,False,False,False,False,False
17,14ne9i1,FuckYouKaren,/r/FuckYouKaren/comments/14ne9i1/these_are_the_karens_who_sued_over_student_debt/,zuzuofthewolves,These are the Karen’s who sued over student debt relief and ruined it for all of us. Big time fuck you.,5024,0.91,365,,1688164361.0,False,False,False,False,False
18,14nap9l,HumansBeingBros,/r/HumansBeingBros/comments/14nap9l/helping_a_thirsty_squirrel/,westcoastcdn19,Helping a thirsty squirrel ,8904,0.97,107,,1688155745.0,False,False,False,False,False
19,14n6jio,WorkReform,/r/WorkReform/comments/14n6jio/todays_let_them_eat_cake/,zzill6,"Today's ""Let Them Eat Cake""",23646,0.94,361,🤝 Join A Union,1688145914.0,False,False,False,False,False
20,14n9l4y,Showerthoughts,/r/Showerthoughts/comments/14n9l4y/vertical_video_went_from_being_universally_hated/,Wrathofserenity,Vertical video went from being universally hated to the most popular form of video consumption.,11968,0.92,700,,1688153054.0,True,False,False,False,False
21,14n7kpm,Damnthatsinteresting,/r/Damnthatsinteresting/comments/14n7kpm/sydney_opera_house_design_candidates/,4reddityo,Sydney Opera House Design Candidates,22887,0.98,622,,1688148346.0,False,False,False,False,False
22,14n7dpg,nottheonion,/r/nottheonion/comments/14n7dpg/elon_musk_and_mark_zuckerberg_offered_romes/,No-Drawing-6975,Elon Musk and Mark Zuckerberg offered Rome's Colosseum as fight venue,20665,0.9,1395,,1688147926.0,False,False,False,False,False
23,14ndwgt,TikTokCringe,/r/TikTokCringe/comments/14ndwgt/server_confronts_teens_after_they_left_black_on/,Professional-Sea4132,Server Confronts Teens After They Left “Black” On The Tip Line,5055,0.94,570,,1688163468.0,False,False,False,False,False
24,14n7eir,pics,/r/pics/comments/14n7eir/met_john_oliver_at_the_wga_strike_rally_yesterday/,LegendaryGoji,Met John Oliver at the WGA strike rally yesterday outside WBD HQ! Genuinely swell guy!,18072,0.87,369,,1688147982.0,False,False,False,False,True
25,14n7l2t,BlackPeopleTwitter,/r/BlackPeopleTwitter/comments/14n7l2t/insert_video_from_family_guy_going_didnt_i_tell/,WVUGuy29,*insert video from Family Guy going “Didn’t I tell ya? Cuz I told ya!” line*,15231,0.9,741,,1688148370.0,False,False,False,False,False
26,14ndx3f,WTF,/r/WTF/comments/14ndx3f/how_far_did_it_fall_from_you_can_legit_see_a/,Killaxia,"How far did it fall from, you can legit see a shadow for 2 seconds.",4582,0.96,494,,1688163516.0,True,False,False,False,False
27,14n8y17,mildlyinfuriating,/r/mildlyinfuriating/comments/14n8y17/and_they_wonder_why_nobody_goes_to_the_movies/,Every-Cook5084,And they wonder why nobody goes to the movies anymore SMH,11314,0.95,2035,,1688151541.0,False,False,False,False,False
28,14nc5z1,shittytattoos,/r/shittytattoos/comments/14nc5z1/dear_god_in_heaven/,BishopGodDamnYou,Dear god in heaven,6070,0.94,557,,1688159229.0,False,False,False,False,False
29,14n96i5,HolUp,/r/HolUp/comments/14n96i5/he_regretted_that/,Fritz_Water_Bottle,He regretted that.,13059,0.94,473,,1688152084.0,False,False,False,False,False
30,14ndfou,OldSchoolCool,/r/OldSchoolCool/comments/14ndfou/last_four_couples_standing_in_a_chicago_dance/,Quick_Presentation11,Last four couples standing in a Chicago dance marathon. ca. 1930.,4593,0.98,286,,1688162343.0,False,False,False,False,False
31,14niiw5,Hololive,/r/Hololive/comments/14niiw5/vesper_20_is_here_everyone_and_oh_no_hes_hot/,_vincetheprince666,"Vesper 2.0 is here everyone! And oh no, he’s hot!!!",2254,0.92,174,:Kiara::Watame::Risu::Lui::Kronii:,1688176272.0,False,False,False,False,False
32,14na3dx,MarchAgainstNazis,/r/MarchAgainstNazis/comments/14na3dx/elections_matter/,MsSeraphim,elections matter,7610,0.94,421,,1688154297.0,False,False,False,False,False
33,14ng0es,diablo4,/r/diablo4/comments/14ng0es/i_just_know_this_mf_has_a_higher_kd_ratio_than/,Vauthry,I just know this mf has a higher KD ratio than the Butcher,3131,0.97,331,,1688168935.0,False,False,False,False,False
34,14nhh50,facepalm,/r/facepalm/comments/14nhh50/looks_like_weve_got_ourselves_a_white_enthusiast/,Piccolo-Sufficient,Looks like we’ve got ourselves a “white enthusiast” on Reddit,2617,0.96,211,,1688173090.0,False,False,False,False,False
35,14n59p2,PoliticalHumor,/r/PoliticalHumor/comments/14n59p2/all_students_left_behind/,IAmAccutane,ALL students left behind,21561,0.94,920,,1688142915.0,False,False,False,False,False
36,14n69i2,memes,/r/memes/comments/14n69i2/so_long_medieval_bois/,,"So long, medieval bois",28947,0.92,869,,1688145243.0,False,False,False,False,False
37,14nd33v,shitposting,/r/shitposting/comments/14nd33v/praise_spez_i_pee_on_some_ants/,NCR_Veteran_Rangers,Praise Spez I Pee On Some Ants,5217,0.98,89,,1688161471.0,False,False,False,False,False
38,14nawz3,meirl,/r/meirl/comments/14nawz3/meirl/,Jimbo072,meirl,6458,0.98,82,,1688156267.0,False,False,False,False,False
39,14n8a49,LeopardsAteMyFace,/r/LeopardsAteMyFace/comments/14n8a49/a_majority_of_republicans_with_student_loan_debt/,jarena009,A majority of Republicans with student loan debt approved of Biden's Student Loan debt forgiveness plan according to polling; now they're left with nothing thanks to the conservative Supreme Court which they enabled,8680,0.96,302,,1688149987.0,False,False,False,False,False
40,14n7do3,me_irlgbt,/r/me_irlgbt/comments/14n7do3/me_irlgbt/,lemangou,me_irlgbt,10897,0.95,74,,1688147923.0,False,False,False,False,False
41,14n4vns,BeAmazed,/r/BeAmazed/comments/14n4vns/intruder_wants_to_mate_with_her_but_she_calls_for/,XahidX,"Intruder wants to mate with her, but she calls for her man and he comes home.",53232,0.92,2224,,1688141995.0,False,False,False,False,False
42,14n9xdf,NoStupidQuestions,/r/NoStupidQuestions/comments/14n9xdf/cancel_student_debt_is_popular_but_why_isnt_stop/,TheGebelein,"""Cancel Student Debt"" is popular but why isn't ""Stop loaning high schoolers crippling amounts of debt"" talked about?",6735,0.92,1046,,1688153880.0,False,False,False,False,False
43,14nf8n2,trashy,/r/trashy/comments/14nf8n2/bathroom_break_in_walmart_parking_lot/,nabnig,bathroom break in Walmart parking lot,3150,0.94,314,,1688166896.0,True,False,False,False,False
44,14nagmw,tumblr,/r/tumblr/comments/14nagmw/let_my_guard_down_for_29_days_and_look_what/,infinitysaga,Let my guard down for 29 days and look what happens,7120,0.95,85,,1688155185.0,False,False,False,False,False
45,14nfc26,wholesomememes,/r/wholesomememes/comments/14nfc26/tried_to_let_my_mom_know_thats_the_surgery_was/,raining_jade,Tried to let my mom know that's the surgery was done while still under the influence of anesthesia,3118,0.99,33,,1688167144.0,False,False,False,False,False
46,14nb2xb,oddlyterrifying,/r/oddlyterrifying/comments/14nb2xb/what_my_fingers_look_like_when_i_get_out_of_the/,LORROTORRO,What my fingers look like when I get out of the bath after years of biting them.,6358,0.92,453,,1688156658.0,False,False,False,False,False
47,14n5529,ContagiousLaughter,/r/ContagiousLaughter/comments/14n5529/thiss_why_kerr_is_a_legend/,O_Mangopare,This’s why Kerr is a legend,16586,0.95,187,,1688142619.0,False,False,False,False,False
48,14nc7l2,anime_irl,/r/anime_irl/comments/14nc7l2/anime_irl/,Randymaple92,anime_irl,4469,0.97,80,,1688159342.0,False,False,False,False,False
49,14ncxbq,oddlysatisfying,/r/oddlysatisfying/comments/14ncxbq/making_sign_with_a_spray/,Administrative-Day76,making sign with a spray,3976,0.96,105,,1688161052.0,False,False,False,False,False
50,14n8hw2,PublicFreakout,/r/PublicFreakout/comments/14n8hw2/karen_wont_pay_for_her_and_boyfriends_haircut/,usernamefred,Karen won’t pay for her and boyfriend’s haircut,7501,0.95,808,,1688150499.0,False,False,False,False,False
51,14nh3sm,NonPoliticalTwitter,/r/NonPoliticalTwitter/comments/14nh3sm/amazing/,trevrichards,Amazing,2147,0.98,25,:blue1::blue2::1111::1112:,1688171979.0,False,False,False,False,False
52,14nc9zz,news,/r/news/comments/14nc9zz/supreme_court_leaves_intact_mississippi_law/,No_Idea_Guy,Supreme court leaves intact Mississippi law disenfranchising Black voters,3892,0.93,524,,1688159498.0,False,False,False,False,False
53,14neqom,WhitePeopleTwitter,/r/WhitePeopleTwitter/comments/14neqom/theres_almost_no_difference_now/,LoneShark81,There's almost no difference now,7091,0.99,223,,1688165613.0,False,False,False,False,False
54,14n60oc,cats,/r/cats/comments/14n60oc/took_a_photo_of_our_senior_boys_with_their/,thiccatlongcat,Took a photo of our senior boys with their painted portrait,11389,0.99,209,,1688144671.0,False,False,False,False,False
55,14nc1a9,inthenews,/r/inthenews/comments/14nc1a9/biden_reveals_new_path_to_student_debt_relief/,PandaMuffin1,Biden reveals ‘new path’ to student debt relief after Supreme Court strikes down president’s plan,3953,0.94,696,,1688158922.0,False,False,False,False,False
56,14n4tn4,aww,/r/aww/comments/14n4tn4/fidelity_cuts_reddit_valuation_again_thanks_john/,Burstar1,Fidelity cuts Reddit valuation again - Thanks John Oliver!,13042,0.87,557,,1688141857.0,False,False,False,False,False
57,14nb9o7,lifehacks,/r/lifehacks/comments/14nb9o7/made_a_baby_rocker_because_daddying_is_hard/,wendi_russell,Made a baby rocker because daddying is hard.,4080,0.93,161,,1688157099.0,False,False,False,False,False
58,14nbd0k,Chadtopia,/r/Chadtopia/comments/14nbd0k/the_beast/,PewPewAnimeGirl,the beast,4318,0.92,186,Here for the good vibes,1688157328.0,False,False,False,False,False
59,14nai06,MadeMeSmile,/r/MadeMeSmile/comments/14nai06/this_wholesome_relationship_between_milkshake_the/,Rollo_Tomasi3000,This wholesome relationship between milkshake the duck and dumpling the cow,16242,0.98,260,,1688155267.0,False,False,False,False,False
60,14naprk,atheism,/r/atheism/comments/14naprk/im_a_web_developer_and_i_refuse_to_design_sites/,NoMoreJesus,"I'm a web developer, and I refuse to design sites for Christians",4215,0.91,499,Strong Atheist,1688155781.0,False,False,False,False,False
61,14ndbx1,SipsTea,/r/SipsTea/comments/14ndbx1/evil/,PsychologicalSail799,"""Evil""",3099,0.98,59,,1688162092.0,False,False,False,False,False
62,14n9bsz,dataisbeautiful,/r/dataisbeautiful/comments/14n9bsz/tomorrow_reddits_api_changes_come_into_effect_how/,RaiderBDev,Tomorrow Reddits API changes come into effect. How have the subreddit protests developed so far and where are they now? [OC],4874,0.94,661,,1688152450.0,False,False,False,False,False
63,14nclij,Animemes,/r/Animemes/comments/14nclij/hope_they_are_paid_by_the_line/,Fifteen_inches,Hope they are paid by the line,3372,0.97,117,,1688160269.0,False,False,False,False,False
64,14nkep2,baseball,/r/baseball/comments/14nkep2/shohei_ohtani_hits_home_run_30_his_15th_in_the/,Blazingbee98,"Shohei Ohtani hits home run #30, his 15th in the month of June, as the Angels trail the Dbacks by 4 runs!",1016,0.97,281,TEAM CHAOS :CHAOS-wagon:,1688182092.0,False,False,False,False,False
65,14nbit1,Breath_of_the_Wild,/r/Breath_of_the_Wild/comments/14nbit1/they_can_run/,dazli69,They can run!?,3716,0.97,98,,1688157710.0,False,False,False,False,False
66,14ndujy,conservativeterrorism,/r/conservativeterrorism/comments/14ndujy/303_creative_has_never_sold_wedding_websites/,scuczu,"303 Creative has never sold wedding websites. There was no gay couple looking for her services. Still, she admits she entered the public market in order to discriminate against LGBT people, citing her faith and a ""calling from God.""",2637,0.95,163,,1688163331.0,False,False,False,False,False
67,14ncmvw,animememes,/r/animememes/comments/14ncmvw/what_is_that_one_anime_you_watch_all_over_again/,LeatherOpen8276,What is that one anime you watch all over again?,3313,0.95,505,,1688160359.0,False,False,False,False,False
68,14nd6pz,WinStupidPrizes,/r/WinStupidPrizes/comments/14nd6pz/trying_to_beat_a_guy_twice_your_size/,Gratis_Passion_,Trying to beat a guy twice your size.,2890,0.97,188,,1688161728.0,False,False,False,False,False
69,14ncyxp,LateStageCapitalism,/r/LateStageCapitalism/comments/14ncyxp/we_live_in_a_nightmare/,xFurorCelticax,We live in a nightmare,2905,0.99,126,,1688161168.0,False,False,False,False,False
70,14n1ckr,NatureIsFuckingLit,/r/NatureIsFuckingLit/comments/14n1ckr/a_field_of_grass_on_a_windy_day/,amish_novelty,🔥 A field of grass on a windy day,31470,0.95,853,,1688133881.0,False,False,False,False,False
71,14n6q2f,technology,/r/technology/comments/14n6q2f/reddits_valuation_has_fallen_even_further/,mitpatel7,"Reddit's Valuation Has Fallen Even Further, Fidelity Says",6399,0.94,436,,1688146346.0,False,False,False,False,False
72,14n4osk,Tinder,/r/Tinder/comments/14n4osk/now_shes_my_girlfriend_of_3_months_today/,WhoAreWeAndWhy,Now she’s my girlfriend of 3 months today,9096,0.95,336,,1688141537.0,False,False,False,False,False
73,14n5w7p,midjourney,/r/midjourney/comments/14n5w7p/chatgpt_describe_a_new_mascot_for_a_country/,marehori,"""ChatGPT, describe a new mascot for a country. Midjourney, visualize this nightmare""",7745,0.92,1314,,1688144414.0,False,False,False,False,False
74,14n0zpu,movies,/r/movies/comments/14n0zpu/alan_arkin_oscar_winner_for_little_miss_sunshine/,MarvelsGrantMan136,"Alan Arkin, Oscar Winner for ‘Little Miss Sunshine,’ Dies at 89",21898,0.94,1131,r/Movies contributor,1688133051.0,False,False,False,False,False
75,14ndhvn,nba,/r/nba/comments/14ndhvn/charania_free_agent_draymond_green_and_ceo_of/,twistedlogicx,"[Charania] Free agent Draymond Green and CEO of Klutch Sports Rich Paul have agreed on a four-year, $100 million contract to return to the Golden State Warriors, sources tell @TheAthletic @Stadium. The $100M deal contains a player option in Year 4.",5938,0.95,904,Toronto Huskies,1688162477.0,False,False,False,False,False
76,14nbfwo,whenthe,/r/whenthe/comments/14nbfwo/feeling_jealous_would_be_an_understatement/,Dzzplayz,“Feeling jealous” would be an understatement ,3613,0.98,113,Heart of the Cards,1688157521.0,False,False,False,False,False
77,14nbbsv,StupidFood,/r/StupidFood/comments/14nbbsv/little_mermaid_hot_dogs/,Remote_Specialist52,Little mermaid hot dogs ,3335,0.87,354,,1688157244.0,False,False,False,False,False
78,14n2ljn,Political_Revolution,/r/Political_Revolution/comments/14n2ljn/president_biden_must_utilize_the_higher_education/,north_canadian_ice,President Biden must utilize the Higher Education Act ASAP to cancel student debt,15239,0.83,1677,,1688136800.0,False,False,False,False,False
79,14n6lvb,PrequelMemes,/r/PrequelMemes/comments/14n6lvb/sequel_trilogy_has_a_few_years_to_go/,omicron_prime,Sequel trilogy has a few years to go 🙏,7869,0.87,810,,1688146073.0,False,False,False,False,False
80,14n5000,UkraineWarVideoReport,/r/UkraineWarVideoReport/comments/14n5000/a_russian_boat_was_spotted_attempting_to_perform/,RetroProxyGroup,"A Russian boat was spotted attempting to perform an evacuation but was thwarted by grenades dropped from a drone. Later, Ukrainian soldiers finished them off",7686,0.93,864,,1688142277.0,True,False,False,False,False
81,14n6o3k,AITAH,/r/AITAH/comments/14n6o3k/aita_for_refusing_to_take_my_kids_calls_after/,Throwawaypfraud,AITA for refusing to take my kids' calls after finding out my wife committed paternity fraud?,6665,0.87,3499,,1688146225.0,False,False,False,False,False
82,14ng7ij,nextfuckinglevel,/r/nextfuckinglevel/comments/14ng7ij/very_fit_and_impressive_elderly_gentleman/,DA-EL-MUSIC,Very fit and impressive elderly gentleman,3878,0.96,166,,1688169469.0,False,False,False,False,False
83,14n4qqf,batman,/r/batman/comments/14n4qqf/what_you_would_do/,ineffable_boy,What you would do?,8182,0.95,405,,1688141673.0,False,False,False,False,False
84,14nc54k,ukraine,/r/ukraine/comments/14nc54k/the_destruction_of_russian_sabotage/,buttmodel,The destruction of Russian sabotage reconnaissance group somewhere on the banks of the Dnipro river. Near Kherson.,2748,0.97,234,,1688159171.0,True,False,False,False,False
85,14n7s3s,HonkaiStarRail,/r/HonkaiStarRail/comments/14n7s3s/find_your_own_friends_dammit/,UnhappyStatistician2,Find your own friends dammit,5205,0.97,96,,1688148803.0,False,False,False,False,False
86,14nav0w,AnimalsBeingDerps,/r/AnimalsBeingDerps/comments/14nav0w/another_video_of_my_dog_drinking_weird/,Kvetinovejkid,Another video of my dog drinking weird,3173,0.98,83,,1688156132.0,False,False,False,False,False
87,14n6d9t,technews,/r/technews/comments/14n6d9t/the_fbi_has_formed_a_national_database_to_track/,thebelsnickle1991,The FBI has formed a national database to track and prevent 'swatting',5575,0.97,184,,1688145494.0,False,False,False,False,False
88,14nd6r0,popculturechat,/r/popculturechat/comments/14nd6r0/pov_meeting_a_little_girl_whos_gonna_marry_your/,Canes-Venaticii,POV: meeting a little girl who's gonna marry your husband in the future,2293,0.96,225,,1688161730.0,False,False,False,False,False
89,14nfaug,cursedcomments,/r/cursedcomments/comments/14nfaug/cursed_beast/,TruthGuardian_,Cursed_Beast,1785,0.98,17,,1688167052.0,False,False,False,False,False
90,14n280k,StudentLoans,/r/StudentLoans/comments/14n280k/well_its_over_i_have_to_admit_i_was_getting/,Betsy514,Well - it's over. I have to admit I was getting cautiously optimistic - but the SCOTUS has killed the Biden/Harris debt relief. Here's some practical FAQ's about the debt relief eligibility and implementation,12084,0.88,5345,President | The Institute of Student Loan Advisors (TISLA),1688135912.0,False,1688166015.0,True,False,False
91,14ncips,unpopularopinion,/r/unpopularopinion/comments/14ncips/the_taco_belldiarrhea_joke_is_overused_and/,RonBurgundysGooch,The “Taco Bell/Diarrhea” joke is overused and painfully unfunny.,2443,0.86,630,,1688160078.0,False,False,False,False,False
92,14n63qd,nonononoyes,/r/nonononoyes/comments/14n63qd/that_grin_speaks_volumes/,EileneGoldstein,That grin speaks volumes.,5748,0.96,111,,1688144872.0,False,False,False,False,False
93,14n1ny7,dankmemes,/r/dankmemes/comments/14n1ny7/shit_would_print_millions/,ZoomZombie1119,Shit would print millions,19785,0.93,351,"the very best, like no one ever was. ",1688134618.0,False,False,False,False,False
94,14ncnk2,Damnthatsinteresting,/r/Damnthatsinteresting/comments/14ncnk2/the_size_of_this_flag_flown_on_a_spanish_ship_at/,ElPolloPayaso,The Size Of This Flag Flown On A Spanish Ship At The Battle Of Trafalgar (1805) Compared To The Size Of People Around It,5668,0.99,117,,1688160401.0,False,False,False,False,False
95,14n7lw0,science,/r/science/comments/14n7lw0/physical_attractiveness_may_indicate_good_health/,HeinieKaboobler,Physical attractiveness may indicate good health. The study found that people who were rated as above-average in attractiveness tended to be noticeably healthier compared to those considered average-looking when assessed 10 years later.,4356,0.89,608,,1688148419.0,False,False,False,False,False
96,14nekf2,apolloapp,/r/apolloapp/comments/14nekf2/confirmed_apollo_peacefully_passed_away_a_few/,HelloSlowly,Confirmed: Apollo peacefully passed away a few seconds ago.,3870,0.97,544,,1688165163.0,False,False,False,False,False
97,14n5mof,ProgrammerHumor,/r/ProgrammerHumor/comments/14n5mof/itisashortcut/,huxx__,itIsAShortcut,5802,0.97,68,,1688143788.0,False,False,False,False,False
98,14n8op4,formuladank,/r/formuladank/comments/14n8op4/not_bad_for_a_no_2_driver/,Kernowder,̶N̶o̶t̶ bad for a no. 2 driver,3798,0.98,67,BWOAHHHHHHH ,1688150922.0,False,False,False,False,False
99,14n8yrb,AskReddit,/r/AskReddit/comments/14n8yrb/what_was_ruined_by_rich_people/,ElPolloPayaso,What was ruined by rich people?,3702,0.89,5872,,1688151591.0,False,False,False,False,False
100,14n2vxv,sadcringe,/r/sadcringe/comments/14n2vxv/is_this_a_threat_or_a_grindr_ad/,KirilForReal,Is this a threat or a Grindr ad ?,9087,0.95,274,,1688137457.0,False,False,False,False,False
