rank,id,subreddit,permalink,author,title,score,upvote_ratio,num_comments,author_flair_text,created_utc,over_18,edited,stickied,locked,is_original_content
1,1516z23,comics,/r/comics/comments/1516z23/ok_yeah_this_is_one_of_my_dumbest_oc/,TommySiegel,ok yeah this is one of my dumbest [OC],11074,0.97,129,,1689515919.0,False,False,False,False,False
2,151558z,todayilearned,/r/todayilearned/comments/151558z/til_that_in_2017_all_gps_coordinates_in_australia/,nacrosian,"TIL that in 2017 all GPS coordinates in Australia were shifted 1.8 m to account for continental drift since the last update in 1994. Moving north 7 cm a year, the Australian plate is one of the fastest-drifting plates in the world",18905,0.98,402,,1689510800.0,False,False,False,False,False
3,1513bti,WhitePeopleTwitter,/r/WhitePeopleTwitter/comments/1513bti/actor_john_cusack_calmly_explains_the_benefits_of/,VeryScaryTerry,Actor John Cusack ~calmly~ explains the benefits of social programs,26939,0.94,939,,1689504952.0,False,False,False,False,False
4,1513uur,OldSchoolCool,/r/OldSchoolCool/comments/1513uur/the_animators_from_behind_the_scenes_of_akira/,MulciberTenebras,"The animators from behind the scenes of ""AKIRA"" (1988), showing the process of hand-painting the backgrounds and individual cel animations",15033,0.98,452,,1689506737.0,False,False,False,False,False
5,1514jae,oddlysatisfying,/r/oddlysatisfying/comments/1514jae/cable_management_done_right/,AlwaysTheNoob,Cable management done right,11413,0.96,366,,1689508927.0,False,False,False,False,False
6,1513t1u,facepalm,/r/facepalm/comments/1513t1u/perfect_logic/,LovableConcur,Perfect logic,27966,0.85,2752,,1689506559.0,False,False,False,False,False
7,1514qu1,news,/r/news/comments/1514qu1/the_qanon_shaman_and_other_capitol_rioters_who/,AJMaid,The 'QAnon Shaman' and other Capitol rioters who regret pleading guilty,8346,0.92,1000,,1689509551.0,False,False,False,False,False
8,1513vsd,politics,/r/politics/comments/1513vsd/ocasiocortez_rallies_with_teamsters_and_rips_ups/,Picture-unrelated,"Ocasio-Cortez Rallies With Teamsters and Rips UPS Greed as Historic Strike Looms — ""Let's remind them who's actually the boss in this, and that's the workers.""",9802,0.95,532,:flag-or: Oregon,1689506820.0,False,False,False,False,False
9,1511ni3,MadeMeSmile,/r/MadeMeSmile/comments/1511ni3/big_brother_seeing_his_younger_brother_in_duty_as/,WhiteLikeCocain,Big brother seeing his younger brother in duty as a Queen’s guard for the first time,31893,0.95,418,,1689499118.0,False,False,False,False,False
10,15144jq,NatureIsFuckingLit,/r/NatureIsFuckingLit/comments/15144jq/aerial_view_of_a_group_of_basking_sharks_a/,SinjiOnO,"🔥 Aerial view of a group of Basking Sharks, a relatively rare sighting as they're predominately solitary creatures",8597,0.98,163,:parrot:,1689507631.0,False,False,False,False,False
11,1514pr4,antiwork,/r/antiwork/comments/1514pr4/heat_exhaustion_killed_my_coworker_and_theyre/,LadyLee69,Heat exhaustion killed my coworker and they're covering it up,7218,0.96,591,,1689509461.0,False,1689528323.0,False,False,False
12,15128op,Unexpected,/r/Unexpected/comments/15128op/my_worst_nightmare/,Saitama_ssa_Diciple,My worst nightmare,26384,0.93,1371,,1689501205.0,False,False,False,False,False
13,1513zh5,NewsOfTheStupid,/r/NewsOfTheStupid/comments/1513zh5/donald_trump_claims_the_american_dream_is_dead/,Misguided_Society,Donald Trump claims the American dream is ‘dead’ - stating the US a ‘third -world hellhole’ run by ‘perverts’ and ‘thugs’,8328,0.89,2855,,1689507155.0,False,False,False,False,False
14,1518bgk,me_irlgbt,/r/me_irlgbt/comments/1518bgk/me_irlgbt/,thatguy9684736255,me_irlgbt,3851,0.95,80,Ace/Rainbow :ace-rainbow:,1689519332.0,False,False,False,False,False
15,1513v7x,mildlyinfuriating,/r/mildlyinfuriating/comments/1513v7x/facebook_marketplace_can_be_infuriating_at_times/,asking_advice21,Facebook Marketplace can be infuriating at times.,9084,0.93,726,,1689506768.0,False,False,False,False,False
16,1517f4l,OUTFITS,/r/OUTFITS/comments/1517f4l/is_this_fit_cute_for_a_bbq_or_too_much_my_crush/,moonlightfawn444,is this fit cute for a BBQ or too much? my crush is going to be there 🫠,4439,0.89,401,Newcomer (3 posts),1689517063.0,False,False,False,True,False
17,15181mo,memes,/r/memes/comments/15181mo/it_has_many_nutrient/,oranke_dino,It has many nutrient.,4016,0.99,88,Cringe Factory,1689518640.0,False,False,False,False,False
18,151656o,PrequelMemes,/r/PrequelMemes/comments/151656o/star_wars_is_for_all/,CaptainTechno_,Star wars is for all,5157,0.96,167,,1689513624.0,False,False,False,False,False
19,1514g0o,marvelmemes,/r/marvelmemes/comments/1514g0o/they_couldve_used_a_prop_for_the_gun_atleast/,GAMMAGREEN62,They could've used a prop for the gun atleast...,7401,0.93,589,Avengers,1689508663.0,False,False,False,False,False
20,15163lv,worldnews,/r/worldnews/comments/15163lv/türkiye_supports_nato_expansion_including/,ledim35,"Türkiye supports NATO expansion, including Ukraine's membership",4573,0.95,397,,1689513506.0,False,False,False,False,False
21,151262k,funny,/r/funny/comments/151262k/damn_chairs/,TheKungFoSing,Damn chairs,11271,0.93,273,,1689500957.0,False,False,False,False,False
22,1514fgl,wholesomememes,/r/wholesomememes/comments/1514fgl/4_years_later/,padmanabhapillai,4 years later,6682,0.91,112,,1689508611.0,False,False,False,False,False
23,1518pvp,WTF,/r/WTF/comments/1518pvp/i_have_no_fucking_idea/,AnnihilationOrchid,I have no fucking idea..,2955,0.93,268,,1689520322.0,False,False,False,False,False
24,15152hu,tumblr,/r/tumblr/comments/15152hu/black_holes_arent_planet_gluttons_you_bitch/,SaraAnnabelle,"Black holes aren't planet gluttons, you bitch",5519,0.97,123,,1689510566.0,False,False,False,False,False
25,15137le,meirl,/r/meirl/comments/15137le/meirl/,Any-Analysis-9189,meirl,8400,0.97,513,,1689504552.0,False,False,False,False,False
26,15132xd,therewasanattempt,/r/therewasanattempt/comments/15132xd/to_go_out/,VariousBasket125,To go out ,7767,0.92,1169,This is a flair,1689504100.0,False,False,False,False,False
27,1513hgb,NonPoliticalTwitter,/r/NonPoliticalTwitter/comments/1513hgb/crypto_queen/,kirby-groot,Crypto Queen,6139,0.96,78,:blue1::blue2::1111::1112:,1689505467.0,False,False,False,False,False
28,1515nda,CrazyFuckingVideos,/r/CrazyFuckingVideos/comments/1515nda/idiots_decide_to_street_race_through_a_stop_light/,ThrowRA0069,Idiots Decide to Street Race Through a Stop Light,3996,0.97,482,,1689512265.0,False,False,False,False,False
29,1516qzm,wallstreetbets,/r/wallstreetbets/comments/1516qzm/cybertruck_spotted_in_the_wildloading_calls/,coryf03,Cybertruck spotted in the wild…loading calls,3376,0.96,166,,1689515304.0,False,False,False,False,False
30,1514frf,shitposting,/r/shitposting/comments/1514frf/praise_spez/,killianmasterbeast,Praise Spez,5876,0.94,265,,1689508637.0,True,False,False,False,False
31,1517gko,Jokes,/r/Jokes/comments/1517gko/a_man_walks_out_to_the_street_and_catches_a_taxi/,HelpingHandsUs,"A man walks out to the street and catches a taxi just going by. He gets into the taxi, and the cabbie says, ""Perfect timing. You're just like Frank.""",2861,0.96,68,,1689517167.0,False,False,False,False,False
32,150z46v,nextfuckinglevel,/r/nextfuckinglevel/comments/150z46v/border_collies_run_freely_and_at_full_speed/,flyingcatwithhorns,Border collies run freely and at full speed,29780,0.96,764,,1689490305.0,False,False,False,False,False
33,15135cs,BeAmazed,/r/BeAmazed/comments/15135cs/chefs_in_misono_are_professionally_trained_to_do/,Mr-Vince,Chefs in Misono are professionally trained to do this. ,5754,0.96,121,,1689504333.0,False,False,False,False,False
34,1511vpl,Spiderman,/r/Spiderman/comments/1511vpl/jessica_was_a_dick/,Ghost-of-melbourne,Jessica was a dick,8279,0.94,466,,1689499928.0,False,False,False,False,False
35,1517iyh,Genshin_Impact,/r/Genshin_Impact/comments/1517iyh/all_69_characters_specialist_dance_before_fontaine/,Stealthless,ALL 69 Characters Specialist Dance before Fontaine,2719,0.96,162,:keqing::kokomi:,1689517324.0,False,False,False,False,False
36,1516hx0,FunnyandSad,/r/FunnyandSad/comments/1516hx0/somebody_needs_to_check_for_a_pulse/,Comfortablejack,Somebody needs to check for a pulse,3083,0.93,55,,1689514606.0,False,False,False,False,False
37,1513dh1,formuladank,/r/formuladank/comments/1513dh1/very_interesting_static/,PoetSeaF1OD25,very interesting static,5358,0.96,101,"Pirelli good, debris bad ",1689505107.0,False,False,False,False,False
38,1511ptj,Damnthatsinteresting,/r/Damnthatsinteresting/comments/1511ptj/how_to_put_a_horse_to_sleep/,Curious_Strike3950,How to put a horse to sleep,8165,0.96,202,,1689499350.0,False,False,False,False,False
39,1516k8q,JustGuysBeingDudes,/r/JustGuysBeingDudes/comments/1516k8q/how_to_pick_up_girls_101/,flattenedbricks,How to pick up girls 101,2941,0.97,46,Lego Bricks,1689514789.0,False,False,False,False,False
40,151632h,ImTheMainCharacter,/r/ImTheMainCharacter/comments/151632h/yelling_bomb_in_the_middle_of_the_busy_airport/,Best_Needleworker530,Yelling “bomb” in the middle of the busy airport for TikTok views,3033,0.84,565,,1689513464.0,False,False,False,False,False
41,1516wal,gifs,/r/gifs/comments/1516wal/enemy_blinder_3000/,MaryAMilam,Enemy Blinder 3000,2481,0.95,186,,1689515709.0,False,False,False,False,False
42,15122nx,cursedcomments,/r/cursedcomments/comments/15122nx/cursed_dewgong/,Sjheuaksjd,Cursed_Dewgong,6803,0.96,45,,1689500616.0,False,False,False,False,False
43,1515uty,clevercomebacks,/r/clevercomebacks/comments/1515uty/im_a_doctor_so_believe_me/,dangerol,"I'm a doctor, so believe me!",2805,0.95,90,,1689512826.0,False,False,False,False,False
44,1510sls,PublicFreakout,/r/PublicFreakout/comments/1510sls/anti_lgbt_march_in_ontario_canada/,WeAreTheBaddiess,Anti LGBT march in Ontario Canada,7980,0.89,2762,,1689496106.0,False,False,False,True,False
45,15173pv,PS5,/r/PS5/comments/15173pv/phil_spencer_we_are_pleased_to_announce_that/,Turbostrider27,Phil Spencer: We are pleased to announce that Microsoft and @PlayStation have signed a binding agreement to keep Call of Duty on PlayStation following the acquisition of Activision Blizzard. We look forward to a future where players globally have more choice to play their favorite games.,2212,0.92,1492,,1689516236.0,False,False,False,False,False
46,15148r6,OneOrangeBraincell,/r/OneOrangeBraincell/comments/15148r6/i_bought_a_200_cat_exercise_wheel/,_FreddieLovesDelilah,I bought a £200 cat exercise wheel,3417,0.99,72,,1689508000.0,False,False,False,False,False
47,1512sg8,LeopardsAteMyFace,/r/LeopardsAteMyFace/comments/1512sg8/how_has_lets_refuse_to_address_climate_change_for/,Urso_Major,"How has ""let's refuse to address climate change for decades"" worked out for you..?",4441,0.94,296,,1689503122.0,False,False,False,False,False
48,15131if,HolUp,/r/HolUp/comments/15131if/why/,Quobl_69420,Why,4970,0.95,43,,1689503973.0,True,False,False,False,False
49,150x65j,ContagiousLaughter,/r/ContagiousLaughter/comments/150x65j/she_knows_her_short_king/,TurnedEvilAfterBan,She knows her short king,44151,0.94,212,,1689483812.0,False,False,False,False,False
50,1517ynt,NoahGetTheBoat,/r/NoahGetTheBoat/comments/1517ynt/guy_pushes_61year_old_man_on_the_subway_and_this/,CEOofBiafra,Guy pushes 61-year old man on the subway and this is what he has to say for himself. Disgusting.,1948,0.97,164,,1689518428.0,False,False,False,False,False
51,1510gc3,lotrmemes,/r/lotrmemes/comments/1510gc3/for_frodo/,JonDoeJoe,For Frodo,7463,0.96,66,,1689494860.0,True,False,False,False,False
52,15173og,terriblefacebookmemes,/r/terriblefacebookmemes/comments/15173og/why_do_they_hate_therapy_so_much/,jeonteskar,Why do they hate therapy so much?,2098,0.92,222,,1689516233.0,False,False,False,False,False
53,1514olx,AbsoluteUnits,/r/AbsoluteUnits/comments/1514olx/absolute_big_nice_dog/,TamerDubai,Absolute big nice dog,2884,0.97,168,,1689509363.0,False,False,False,False,False
54,1512gzs,facepalm,/r/facepalm/comments/1512gzs/im_not_political_but_this_is_funny_as_shit/,Marietsford,"I’m not political, but this is funny as shit",15215,0.96,266,,1689501978.0,False,False,False,False,False
55,1516ij6,interesting,/r/interesting/comments/1516ij6/giant_squid_makes_an_appearance_in_tokyo_bay/,MetsX2000,Giant Squid makes an appearance in Tokyo Bay,2164,0.97,149,,1689514656.0,False,False,False,False,False
56,1512z2n,HonkaiStarRail,/r/HonkaiStarRail/comments/1512z2n/ill_miss_you/,Peddrawm,I’ll miss you,4089,0.94,139,:Kafka:,1689503734.0,False,False,False,False,False
57,151525e,WhitePeopleTwitter,/r/WhitePeopleTwitter/comments/151525e/5_years_after_mlks_assassination_donald_trump_was/,Travismatthew08,"5 years after MLK’s assassination, Donald Trump was sued for refusing to rent apartments to black people.",5851,0.97,219,,1689510535.0,False,False,False,False,False
58,150zxun,ChatGPT,/r/ChatGPT/comments/150zxun/i_bet_you_got_it_wrong_in_first_glance/,joy-lol,I bet you got it wrong in first glance,7587,0.93,342,,1689493137.0,False,False,False,False,False
59,1510wue,cats,/r/cats/comments/1510wue/so_a_random_cat_came_into_our_apartment_and_stole/,Real-Pause6225,So a random cat came into our apartment and stole my cats toy,5702,0.98,209,,1689496535.0,False,False,False,False,False
60,1512qax,LifeProTips,/r/LifeProTips/comments/1512qax/lpt_prepare_all_your_things_the_night_before/,Aleriann,"LPT : Prepare all your things the night before, before going to bed. You will save time in the morning, and most likely won’t forget anything.",3712,0.92,138,,1689502906.0,False,1689510300.0,False,False,False
61,1517tau,antiwork,/r/antiwork/comments/1517tau/i_was_fired_for_discussing_wages_and_i_recorded/,JadedThrowie,I was fired for discussing wages and I recorded them telling me exactly that.,3516,0.99,513,,1689518049.0,True,1689523178.0,False,False,False
62,150x6g8,TikTokCringe,/r/TikTokCringe/comments/150x6g8/colloidal_silver/,choganoga,Colloidal silver ,14675,0.97,789,tHiS iSn’T cRiNgE,1689483838.0,False,False,False,False,False
63,1513txq,tifu,/r/tifu/comments/1513txq/tifu_sharing_my_sandwich_with_a_stray_dog_and_now/,Throwaway-5535,TIFU sharing my sandwich with a stray dog and now I have a dog.,2953,0.94,241,,1689506651.0,False,1689523694.0,False,False,False
64,1513s4n,Grimdank,/r/Grimdank/comments/1513s4n/big_blue_berry_right_now/,Milesrah,Big blue Berry right now,3003,0.97,114,My kitchen is corrupted by Nurgle ,1689506475.0,False,False,False,False,False
65,1519e8h,nba,/r/nba/comments/1519e8h/charania_phoenix_is_trading_g_cam_payne_a/,PlayaSlayaX,"[Charania] Phoenix is trading G Cam Payne, a second-round pick and cash to San Antonio, sources tell @TheAthletic @Stadium.",1297,0.98,332,:sas-3: Spurs,1689522028.0,False,False,False,False,False
66,1515726,okbuddychicanery,/r/okbuddychicanery/comments/1515726/who_is_the_airbender/,mven32699,Who is the Airbender?,2323,0.97,130,,1689510947.0,False,False,False,False,False
67,1516z06,SipsTea,/r/SipsTea/comments/1516z06/underrated_sport/,Comprehensive_Way_59,Underrated Sport,1792,0.88,128,,1689515915.0,False,False,False,False,False
68,15197zz,leagueoflegends,/r/leagueoflegends/comments/15197zz/reptile_fnatic_tq_adc_leaked_his_smurf_accounts/,Kerferkunde,"""Reptile"" Fnatic TQ Adc leaked his smurf accounts name being ""h*tler119""",1295,0.88,649,,1689521590.0,False,1689526380.0,False,False,False
69,1513hrv,whenthe,/r/whenthe/comments/1513hrv/peak_manga_just_dropped/,Germanaboo,Peak Manga just dropped,3188,0.95,72,,1689505503.0,False,False,False,False,False
70,1514o43,aviation,/r/aviation/comments/1514o43/every_foot_of_that_runway_was_used_that_day/,wadenelsonredditor,Every foot of that runway was used that day,2325,0.97,149,,1689509317.0,False,False,False,False,False
71,15146le,teenagers,/r/teenagers/comments/15146le/comment_and_you_have_a_50_chance_to_get_reddit/,Jalal445,Comment and You have a 50% chance to get reddit premium.,2694,0.85,8828,18,1689507810.0,False,1689517623.0,False,False,False
72,15133ey,pcmasterrace,/r/pcmasterrace/comments/15133ey/the_amount_of_cable_ties/,Eastern_Moose_1646,The amount of cable ties. ,3002,0.93,323,,1689504147.0,False,False,False,False,False
73,1514af9,movies,/r/movies/comments/1514af9/singer_and_actress_jane_birkin_has_died_aged_76/,LCX001,Singer and actress Jane Birkin has died aged 76,2374,0.91,79,,1689508157.0,False,False,False,False,False
74,1511sk5,hmmm,/r/hmmm/comments/1511sk5/hmmm/,Keplergamer,hmmm,3807,0.96,100,,1689499619.0,False,False,False,False,False
75,1516hl2,madlads,/r/madlads/comments/1516hl2/doing_donuts_next_to_the_gates_of_hell/,ClearlyEvanesce,Doing donuts next to the gates of hell,1716,0.97,21,,1689514581.0,False,False,False,False,False
76,1517hj0,femalelivingspace,/r/femalelivingspace/comments/1517hj0/you_guys_were_right_more_pink_is_always_the_answer/,puffer_bitch,You guys were right! More pink is always the answer.,1455,0.97,118,,1689517229.0,False,False,False,False,False
77,15133ku,memes,/r/memes/comments/15133ku/allosaurus_100/,somnum_osseus,"Allosaurus, 100%.",9341,0.96,536,OC Meme Maker,1689504167.0,False,False,False,False,False
78,151118e,RandomThoughts,/r/RandomThoughts/comments/151118e/ive_completely_lost_interest_in_marvel/,Always311,I’ve completely lost interest in Marvel,4496,0.87,1487,,1689496967.0,False,1689527403.0,False,False,False
79,1515cpb,MemeVideos,/r/MemeVideos/comments/1515cpb/my_coins_my_choose/,fra_poco,"My coins, my choose",2008,0.96,127,,1689511413.0,False,False,False,False,False
80,15172o2,pettyrevenge,/r/pettyrevenge/comments/15172o2/had_the_roommate_from_hell_and_couldnt_get_rid_of/,ThisIsMyCircus40,Had the roommate from hell and couldn't get rid of her so I made living with me as miserable as possible.,1506,0.96,107,,1689516162.0,False,1689520547.0,False,False,False
81,150zipe,oddlyterrifying,/r/oddlyterrifying/comments/150zipe/the_from_hell_letter_sent_by_jack_the_ripper_to/,silvercatbob,"The “From Hell” letter, sent by Jack the Ripper to the president of the Whitechapel Vigilance Committee that was pursuing him.",6833,0.97,351,,1689491674.0,False,False,False,False,False
82,151599d,Weird,/r/Weird/comments/151599d/crazy_tomato_in_my_yard/,SnooTigers9547,Crazy tomato in my yard,1955,0.97,392,,1689511135.0,False,False,False,False,False
83,151289j,Bossfight,/r/Bossfight/comments/151289j/infinishrew_the_never_ending/,burrittorose,"Infini-shrew, the never ending",3420,0.98,93,,1689501164.0,False,False,False,False,False
84,1514pa9,therewasanattempt,/r/therewasanattempt/comments/1514pa9/to_check_a_gun/,axlnotfound,To check a gun,4844,0.98,221,,1689509423.0,True,False,False,False,False
85,1511o75,Showerthoughts,/r/Showerthoughts/comments/1511o75/remarkable_how_free_stuff_for_poor_people/,-TheDerpinator-,Remarkable how free stuff for poor people triggers so much more (middle class) response than all freebies for the rich.,3600,0.9,518,,1689499198.0,False,False,False,False,False
86,1514bxk,PeterExplainsTheJoke,/r/PeterExplainsTheJoke/comments/1514bxk/i_dont_get_it/,milkknight7,I don't get it,2243,0.95,156,,1689508293.0,False,False,False,False,False
87,15180sx,BrandNewSentence,/r/BrandNewSentence/comments/15180sx/probably_not_a_good_idea/,Existentialidiot83,Probably not a good idea.,1292,0.98,33,,1689518578.0,False,False,False,False,False
88,1514lvz,news,/r/news/comments/1514lvz/alabama_woman_who_was_attempting_to_assist/,keepswimming08,Alabama woman who was attempting to assist toddler on interstate found alive.,4248,0.97,557,,1689509133.0,False,False,False,False,False
89,1517bhi,Nbamemes,/r/Nbamemes/comments/1517bhi/lets_debate_which_nba_city_has_the_weakest_food/,MrBeez83,Let’s Debate: Which NBA city has the weakest food?,1332,0.95,361,,1689516801.0,False,False,False,False,False
90,15189ac,popculturechat,/r/popculturechat/comments/15189ac/ari_jonathan_bailey_andrew_garfield_and_tom/,CuteNatural,"Ari, Jonathan Bailey, Andrew Garfield and Tom Hiddleston together at Wimbledon right now 💕",1183,0.93,330,,1689519177.0,False,False,False,False,False
91,15106g9,197,/r/197/comments/15106g9/rule/,secretslut991,rule,4767,0.98,72,,1689493948.0,False,False,False,False,False
92,1513955,nextfuckinglevel,/r/nextfuckinglevel/comments/1513955/man_carries_a_motorcycle_atop_his_head_while/,DevilCanyon,Man carries a motorcycle atop his head while climbing a ladder to place it onto the roof of a bus.,5980,0.97,351,,1689504690.0,False,False,False,False,False
93,15169fm,golf,/r/golf/comments/15169fm/with_a_birdie_on_the_18th_rory_mcilroy_wins_the/,BertrandsMate,"With a birdie on the 18th, Rory McIlroy wins the Genesis Scottish Open!",1511,0.96,140,,1689513948.0,False,False,False,False,False
94,1517w62,MadeMeSmile,/r/MadeMeSmile/comments/1517w62/man_with_cerebral_palsy_overcomes_the_odds_to/,CommercialBox4175,Man With Cerebral Palsy Overcomes The Odds To Become A Body Builder,2608,0.98,60,,1689518250.0,False,False,False,False,False
95,150zdwm,midjourney,/r/midjourney/comments/150zdwm/lets_face_it_this_is_the_most_stereotypical/,marehori,"Let's face it, THIS is the most stereotypical person of a *country*",5645,0.87,969,,1689491201.0,False,False,False,False,False
96,1514wi2,insanepeoplefacebook,/r/insanepeoplefacebook/comments/1514wi2/the_blacks_says_it_all_lmao/,njdkom,“The blacks” says it all lmao,1853,0.94,132,,1689510054.0,True,False,False,False,False
97,1517jgs,yesyesyesyesno,/r/yesyesyesyesno/comments/1517jgs/trying_not_to_get_wet_while_popping_ballons/,habichuelacondulce,Trying not to get wet while popping ballons,1268,0.92,47,,1689517362.0,False,False,False,False,False
98,150zllk,LateStageCapitalism,/r/LateStageCapitalism/comments/150zllk/slave_labor_is_a_selling_point_now_apparently/,Cruralbox,"Slave Labor Is A Selling Point Now, Apparently",4841,0.97,114,,1689491959.0,False,False,False,False,False
99,1514nc2,AccidentalAlly,/r/AccidentalAlly/comments/1514nc2/absolutely/,Leviathan369,Absolutely!,1891,0.96,56,,1689509248.0,False,False,False,False,False
100,1518fi9,BlackPeopleTwitter,/r/BlackPeopleTwitter/comments/1518fi9/depends_on_the_year_of_the_car/,MikeisTOOOTALLL,Depends on the year of the car,1116,0.97,129,,1689519620.0,False,False,False,False,False
