rank,id,subreddit,permalink,author,title,score,upvote_ratio,num_comments,author_flair_text,created_utc,over_18,edited,stickied,locked,is_original_content
1,14vxqyk,facepalm,/r/facepalm/comments/14vxqyk/sorry_wont_occur_again/,ParticularOvenz,Sorry won't occur again.,18365,0.96,495,,1689004148.0,False,False,False,False,False
2,14vxob4,WhitePeopleTwitter,/r/WhitePeopleTwitter/comments/14vxob4/go_home_meatball/,Tri734,"Go home, Meatball",8459,0.98,370,,1689003980.0,False,False,False,False,False
3,14vt1t2,mildlyinfuriating,/r/mildlyinfuriating/comments/14vt1t2/this_bundle_of_planks_being_passed_off_as_a/,obiedge,This bundle of planks being passed off as a coffee table.,27465,0.92,1461,,1688993156.0,False,False,False,False,False
4,14vslio,news,/r/news/comments/14vslio/former_us_gymnastics_doctor_larry_nassar/,Moonskaraos,"Former US gymnastics doctor Larry Nassar assaulted in prison, sources say",16661,0.96,2555,,1688991912.0,False,False,False,False,False
5,14vv49m,therewasanattempt,/r/therewasanattempt/comments/14vv49m/to_bully_an_asian_kid_half_your_size/,Alien__Yes,To bully an Asian kid half your size,11375,0.95,694,.,1688998174.0,False,False,False,False,False
6,14vvuod,oddlysatisfying,/r/oddlysatisfying/comments/14vvuod/a_black_heron_fishing/,Boojibs,A black heron fishing,8636,0.97,147,,1688999855.0,False,False,False,False,False
7,14vv0pu,Damnthatsinteresting,/r/Damnthatsinteresting/comments/14vv0pu/toddlers_regulate_their_behavior_to_avoid_making/,whated-23,Toddlers regulate their behavior to avoid making adults angry,10394,0.93,565,,1688997944.0,False,False,False,False,False
8,14vu9a2,MadeMeSmile,/r/MadeMeSmile/comments/14vu9a2/youre_on_a_flight_and_then_this_happens/,travjhawk,You’re on a flight and then this happens,12757,0.89,560,,1688996125.0,False,False,False,False,False
9,14vso3p,memes,/r/memes/comments/14vso3p/really_again/,hangben,Really? Again?,22647,0.97,473,,1688992104.0,False,False,False,False,False
10,14vwa8h,Unexpected,/r/Unexpected/comments/14vwa8h/its_just_water/,ff-dvl,It’s just water ,7096,0.97,519,,1689000840.0,False,False,False,False,False
11,14vsmez,politics,/r/politics/comments/14vsmez/police_taking_selfies_with_donald_trump_sparks/,BelleAriel,"Police taking selfies with Donald Trump sparks outrage: ""Disgraceful""",12538,0.92,1236,,1688991976.0,False,False,False,False,False
12,14vtl8p,wholesomememes,/r/wholesomememes/comments/14vtl8p/superwholesome/,Jelimanm,Super-wholesome,11696,0.96,115,,1688994479.0,False,False,False,False,False
13,14vz9fv,nextfuckinglevel,/r/nextfuckinglevel/comments/14vz9fv/with_only_a_3_chance_to_live_at_ten_months_old/,handlewithcareme,"With only a 3% chance to live at ten months old, ACL Pro Dayton Webber has spent his entire life defying the odds and inspiring others.",4218,0.98,180,,1689007570.0,False,False,False,False,False
14,14vxuxr,dankmemes,/r/dankmemes/comments/14vxuxr/like_i_never_left/,thepositivepandemic,Like I never left!,5693,0.97,44,,1689004398.0,False,False,False,False,False
15,14vrhj5,gaming,/r/gaming/comments/14vrhj5/31yearold_dad_with_two_fulltime_jobs_and_limited/,DefiantAds,31-year-old dad with two full-time jobs and limited practice beats pro Tekken god,29920,0.83,1193,,1688988839.0,False,False,False,False,False
16,14vw2st,meirl,/r/meirl/comments/14vw2st/me_irl/,Sonic_the_hedgedog,me_irl,6513,0.94,296,,1689000374.0,False,False,False,False,False
17,14vtpzv,funny,/r/funny/comments/14vtpzv/i_made_a_song_entirely_of_artists_singing_hey/,dustin1776,"I made a song entirely of artists singing ""hey""",7923,0.93,266,There I Ruined It,1688994817.0,False,False,False,False,False
18,14vsqow,HolUp,/r/HolUp/comments/14vsqow/mother_of_the_year_award/,bookmarked,Mother of the Year Award.,17016,0.93,421,,1688992288.0,False,False,False,False,False
19,14vtz1h,tumblr,/r/tumblr/comments/14vtz1h/ok_what/,Old_Specialist7892,Ok what-,8387,0.97,78,,1688995443.0,False,False,False,False,False
20,14vs01q,starterpacks,/r/starterpacks/comments/14vs01q/going_to_the_library_as_a_90s_kid_starterpack/,future_never,Going to the library as a 90s kid starterpack.,10403,0.97,270,,1688990323.0,False,False,False,False,False
21,14vse1y,shitposting,/r/shitposting/comments/14vse1y/yes_of_course_heil_spez/,Lilchowmein0945,Yes of course (heil spez),12228,0.96,62,,1688991350.0,False,False,False,False,False
22,14vssag,PublicFreakout,/r/PublicFreakout/comments/14vssag/man_jumps_headfirst_from_stage_into_audience_and/,GeneralXHD,Man jumps headfirst from stage into audience and they don't catch him.,8072,0.96,675,,1688992412.0,False,False,False,False,False
23,14vrwic,comics,/r/comics/comments/14vrwic/manager/,Pizzacakecomic,Manager,10607,0.85,282,PizzaCake,1688990040.0,False,False,False,False,True
24,14vtbff,OldSchoolCool,/r/OldSchoolCool/comments/14vtbff/the_special_effects_crew_from_stan_winston/,MulciberTenebras,"The special effects crew from Stan Winston Studios tests the puppets used in ""Small Soldiers"" (released 25 years ago today in 1998)",6229,0.98,269,,1688993834.0,False,False,False,False,False
25,14vtu16,cats,/r/cats/comments/14vtu16/does_it_hurt_my_cat_when_i_do_this/,soapman72,Does it hurt my cat when I do this?,6405,0.96,509,,1688995100.0,False,False,False,False,False
26,14vvqaa,CrazyFuckingVideos,/r/CrazyFuckingVideos/comments/14vvqaa/when_the_gate_gets_stuck_closed_at_the_running_of/,moonchance,when the gate gets stuck closed at the running of the bulls.,4353,0.97,482,,1688999578.0,False,False,False,False,False
27,14vsz65,sports,/r/sports/comments/14vsz65/report_larry_nassar_stabbed_multiple_times_at/,PrincessBananas85,Report: Larry Nassar stabbed multiple times at federal prison,6044,0.96,744,,1688992955.0,False,False,False,True,False
28,14vw66o,DesignPorn,/r/DesignPorn/comments/14vw66o/minimalism_is_king/,morallyUnleash81,minimalism is king,3965,0.96,207,,1689000587.0,False,False,False,False,False
29,14vs19a,movies,/r/movies/comments/14vs19a/napoleon_official_trailer/,indig0sixalpha,Napoleon — Official Trailer,6847,0.95,1862,,1688990420.0,False,False,False,False,False
30,14vytf8,ContagiousLaughter,/r/ContagiousLaughter/comments/14vytf8/pregnant_wife_has_pet_peeve_with_husband/,CleetisMcgee,Pregnant wife has pet peeve with husband,2785,0.9,208,,1689006562.0,False,False,False,False,False
31,14vtaa5,TikTokCringe,/r/TikTokCringe/comments/14vtaa5/the_trump_grift_game_is_uncanny/,Chocolat3City,The Trump grift game is uncanny. ,5829,0.89,1636,tHiS iSn’T cRiNgE,1688993756.0,False,False,False,False,False
32,14vuiw6,Fauxmoi,/r/Fauxmoi/comments/14vuiw6/ryan_gosling_pays_tribute_to_wife_eva_mendes_on/,AbsolutelyIris,Ryan Gosling Pays Tribute to Wife Eva Mendes on the Barbie Red Carpet,4650,0.93,195,,1688996772.0,False,False,False,False,False
33,14vshop,CasualUK,/r/CasualUK/comments/14vshop/just_opened_a_pack_of_fruit_pastilles_what_kind/,rickgdavies,Just opened a pack of fruit pastilles. What kind of bullshit is this??,6137,0.94,862,,1688991623.0,False,False,False,False,False
34,14vwo26,PrequelMemes,/r/PrequelMemes/comments/14vwo26/this_just_looks_wrong/,Any-Atmosphere-818,This just looks wrong,3397,0.96,128,,1689001679.0,False,False,False,False,False
35,14vqvst,AskReddit,/r/AskReddit/comments/14vqvst/what_turns_you_on_that_you_are_absolutely/,mcpogi,What turns you on that you are absolutely embarrassed about?,7747,0.9,6122,,1688987046.0,True,False,False,False,False
36,14vqlmj,antiwork,/r/antiwork/comments/14vqlmj/boss_wanted_me_to_come_in_and_i_refused_talk_of/,rvnender,Boss wanted me to come in and I refused - talk of termination,7504,0.95,1020,,1688986205.0,False,1689003838.0,False,False,False
37,14vvbod,TrueOffMyChest,/r/TrueOffMyChest/comments/14vvbod/my_best_friends_mistress_doesnt_know_that_he_is/,SorryNotSorryD,My best friend’s mistress doesn’t know that he is actually broke. My wife’s reaction to the whole thing really bummed me out,3502,0.95,876,,1688998654.0,False,1689008499.0,False,False,False
38,14vpsco,NonPoliticalTwitter,/r/NonPoliticalTwitter/comments/14vpsco/idk_but_i_remember_that_shit_would_warn_me_of_any/,1Hate17Here,"Idk, but I remember that shit would warn me of any incoming calls. ;)",8832,0.97,383,:blue1::blue2::1111::1112:,1688983670.0,False,False,False,False,False
39,14vungo,PoliticalCompassMemes,/r/PoliticalCompassMemes/comments/14vungo/common_san_francisco_l/,MannequinGothique,Common San Francisco L,3761,0.91,325,:auth: - Auth-Center,1688997076.0,False,False,False,False,False
40,14vrxom,WhitePeopleTwitter,/r/WhitePeopleTwitter/comments/14vrxom/is_this_prolife/,Sensitive-Jury-1456,Is this “pro-life?”,22111,0.95,644,,1688990136.0,False,False,False,False,False
41,14vnqob,BeAmazed,/r/BeAmazed/comments/14vnqob/softshelled_turtles_hitting_speeds_up_to_15_mph/,XahidX,Soft-shelled turtles: Hitting speeds up to 15 mph,19767,0.97,438,,1688976853.0,False,False,False,False,False
42,14vv5ff,MadeMeSmile,/r/MadeMeSmile/comments/14vv5ff/first_time_at_the_barbershop/,bindukwe,First time at the barbershop,9277,0.93,400,,1688998250.0,False,False,False,False,False
43,14vuv4z,ProgrammerHumor,/r/ProgrammerHumor/comments/14vuv4z/phonenumber/,ImMadeOutOfStalinium,phoneNumber,3129,0.97,58,,1688997614.0,False,False,False,False,False
44,14vuu3v,CombatFootage,/r/CombatFootage/comments/14vuu3v/ukrainian_soldiers_retrieving_the_russian_soldier/,drakka100,Ukrainian soldiers retrieving the Russian soldier who was wounded after triggering a mine while trying to surrender,3064,0.97,274,,1688997541.0,True,False,False,False,False
45,14vts25,cursedcomments,/r/cursedcomments/comments/14vts25/cursed_jew/,LeatherAdventurous77,Cursed J.E.W,3995,0.97,64,,1688994960.0,False,False,False,False,False
46,14vp8p4,pcmasterrace,/r/pcmasterrace/comments/14vp8p4/anyone_know_what_this_says_i_dont_know_how_to_read/,Dismiss,Anyone know what this says? I don't know how to read,8520,0.94,421,,1688981953.0,False,False,False,False,False
47,14vs4bl,inthenews,/r/inthenews/comments/14vs4bl/former_press_secretary_says_trump_showed/,cos,Former press secretary says Trump showed classified documents to people on Mar-a-Lago dining patio,4305,0.96,272,,1688990629.0,False,False,False,False,False
48,14vujgj,PoliticalHumor,/r/PoliticalHumor/comments/14vujgj/this_is_a_normal_wedding_photo_nothing_weird/,sarduchi,This is a normal wedding photo. Nothing weird going on. In fact YOU'RE weird for even bringing it up!,3077,0.96,276,,1688996808.0,True,False,False,False,False
49,14vnsw6,BlackPeopleTwitter,/r/BlackPeopleTwitter/comments/14vnsw6/maybe_their_hair_just_wanted_to_meet/,wetouchingbuttsornah,Maybe their hair just wanted to meet?,12442,0.87,1220,☑️ ,1688977067.0,False,False,False,False,False
50,14vq2uw,PeterExplainsTheJoke,/r/PeterExplainsTheJoke/comments/14vq2uw/petah_i_dont_get_it/,Thepotato635,Petah I don't get it,7408,0.94,267,,1688984589.0,False,False,False,False,False
51,14vn5un,technology,/r/technology/comments/14vn5un/instagram_threads_hits_100_million_users/,tylerthe-theatre,Instagram Threads hits 100 million users,14313,0.87,2565,,1688974906.0,False,False,False,False,False
52,14vsttf,formuladank,/r/formuladank/comments/14vsttf/omg_lando_is_one_of_us/,Not-Sofun,OMG Lando is one of US!,3872,0.98,84,BWOAHHHHHHH ,1688992539.0,False,False,False,False,False
53,14vvpp8,Eldenring,/r/Eldenring/comments/14vvpp8/tell_blaidd_and_ijii_love_them/,girl_snap_out_of_it,"“Tell Blaidd, and Iji…I love them.”",2577,0.98,90,,1688999540.0,False,False,False,False,False
54,14vtr1s,Catswithjobs,/r/Catswithjobs/comments/14vtr1s/the_official_prime_minister_of_the_uk_was_removed/,javier_aeoa,The official Prime Minister of the UK was removed from the red carpet last weekend. The country is in turmoil,3256,0.98,58,,1688994893.0,False,False,False,False,False
55,14vva53,worldnews,/r/worldnews/comments/14vva53/brussels_rejects_erdoğans_offer_eu_accession_and/,Zhukov-74,Brussels rejects Erdoğan's offer: EU accession and NATO membership are two 'separate' processes,2640,0.98,181,,1688998559.0,False,False,False,False,False
56,14vs1vu,MemePiece,/r/MemePiece/comments/14vs1vu/personal_space_never_heard_of_her/,metalhiro,Personal space? Never heard of her.,4214,0.96,68,,1688990463.0,False,False,False,False,False
57,14vy7k3,Grimdank,/r/Grimdank/comments/14vy7k3/my_wife_drew_the_hoarse_hearsay/,piebeatcake,My wife drew the Hoarse Hearsay,1832,0.98,61,,1689005188.0,False,False,False,False,False
58,14vnfw4,maybemaybemaybe,/r/maybemaybemaybe/comments/14vnfw4/maybe_maybe_maybe/,anitagreyy,maybe maybe maybe,13791,0.95,133,,1688975891.0,False,False,False,False,False
59,14vv2db,CuratedTumblr,/r/CuratedTumblr/comments/14vv2db/just_watch_something_else/,thecommunismwillwin,"""just watch something else""",2710,0.95,204,deprived of this nerdly honor by an opportunistic twat breeder,1688998050.0,False,False,False,False,False
60,14vs11u,nextfuckinglevel,/r/nextfuckinglevel/comments/14vs11u/saw_a_lost_sheep_while_fishing_with_my_dogs/,The_Wind_Cries,"Saw a lost sheep while fishing with my dogs. Luckily, they’re working border collies. 👍",13353,0.97,321,,1688990406.0,False,False,False,False,False
61,14vrbxa,technicallythetruth,/r/technicallythetruth/comments/14vrbxa/that_one_was_savage_but_true/,PoorlyGabby,That one was savage but true,4776,0.98,39,,1688988373.0,False,False,False,False,False
62,14vr2y9,facepalm,/r/facepalm/comments/14vr2y9/im_sorry_what/,CLubbr3X,"I'm sorry, what???",36200,0.92,3377,,1688987626.0,False,False,False,False,False
63,14vt0ab,insanepeoplefacebook,/r/insanepeoplefacebook/comments/14vt0ab/ukraine_is_gay_is_a_child_running_this_account/,FalconLynx13,“Ukraine is gay” Is a child running this account?,3441,0.96,218,,1688993044.0,False,False,False,False,False
64,14vxzu7,nba,/r/nba/comments/14vxzu7/russell_westbrook_getting_some_offseason_shots_up/,IWantMalaHotPot,Russell Westbrook getting some off-season shots up at a highschool gym,1840,0.96,250,,1689004717.0,False,False,False,False,False
65,14vsy35,todayilearned,/r/todayilearned/comments/14vsy35/til_that_panama_hats_may_take_a_master_weaver_up/,EtOHMartini,"TIL that Panama hats may take a master weaver up to 8 months to produce, at a price of $200. The best hats can sell outside of Ecuador for 50x what the weaver is paid",3391,0.97,157,,1688992876.0,False,False,False,False,False
66,14vpcs9,science,/r/science/comments/14vpcs9/a_new_study_found_several_people_with_learning/,Wagamaga,"A new study found several people with learning disabilities and autism in the Netherlands chose to die legally through euthanasia and assisted suicide due to feeling unable to cope with the world, changes around them or because they struggled to form friendships.",6027,0.95,814,,1688982326.0,False,False,False,False,False
67,14vr5kb,HumansAreMetal,/r/HumansAreMetal/comments/14vr5kb/rita_marley_natty_dread/,KeenlyNautical,"Rita Marley, Natty Dread!",4491,0.95,105,,1688987846.0,False,False,False,False,False
68,14vz75c,OnePiece,/r/OnePiece/comments/14vz75c/one_piece_chapter_1087_spoilers/,Kirosh2,One Piece Chapter 1087 Spoilers,1536,0.96,1070,Lookout,1689007429.0,False,1689007757.0,True,False,False
69,14vqewq,oddlyterrifying,/r/oddlyterrifying/comments/14vqewq/the_lethal_dose_of_fentanyl/,thelastfastbender,The lethal dose of fentanyl,5399,0.96,246,,1688985637.0,False,False,False,False,False
70,14vvamr,whenthe,/r/whenthe/comments/14vvamr/the_one_sure_thing_in_life/,SirShadyVI,the one sure thing in life,2502,0.98,97,local touhou poster (moriya shrine's #1 conspirator),1688998586.0,False,False,False,False,False
71,14vv0si,lego,/r/lego/comments/14vv0si/secret_bathroom/,munft,Secret Bathroom,2352,0.98,31,,1688997948.0,False,False,False,False,False
72,14vu1i9,LeopardsAteMyFace,/r/LeopardsAteMyFace/comments/14vu1i9/were_so_divided_says_republican_county_chairman/,LoveisBaconisLove,"""We're so divided,"" says Republican County Chairman from hospital after violent brawl at Michigan GOP committee meeting. ""I just wish we could come together.""",2610,0.97,302,,1688995601.0,False,False,False,False,False
73,14vzjdy,NatureIsFuckingLit,/r/NatureIsFuckingLit/comments/14vzjdy/mom_gives_ones_of_her_wolf_cubs_a_reassuring/,Thund3rbolt,🔥 Mom Gives Ones Of Her Wolf Cubs A Reassuring Embrace In The Den While Sleeping,1365,0.98,43,,1689008198.0,False,False,False,False,False
74,14voyrr,SuddenlyGay,/r/SuddenlyGay/comments/14voyrr/la_metro/,Visual_Ad3724,LA metro,6518,0.94,86,,1688981049.0,False,False,False,False,False
75,14vqqnd,Animemes,/r/Animemes/comments/14vqqnd/would_you/,AmphibianOk983,Would you,4578,0.95,297,,1688986641.0,False,False,False,False,False
76,14vsovj,WorkReform,/r/WorkReform/comments/14vsovj/congress_is_not_a_business_yet_it_makes_so_many/,Sensitive-Jury-1456,"Congress is not a business, yet it makes so many people rich",3022,0.98,57,,1688992166.0,False,False,False,False,False
77,14vrk3k,IASIP,/r/IASIP/comments/14vrk3k/people_talking_about_the_prolonged_full_nudity_in/,DonScanleone,"People talking about the ""prolonged full nudity"" in Oppenheimer",3524,0.96,117,:charlie-dayman:,1688989046.0,False,False,False,False,False
78,14vr7vy,RATS,/r/RATS/comments/14vr7vy/there_is_no_way/,PickyPrincessYeYo,There is NO WAY,3852,0.97,131,,1688988039.0,False,False,False,False,False
79,14vpkag,Bossfight,/r/Bossfight/comments/14vpkag/ninchilla_the_rodent_warrior/,LiptonIceTi-47,Ninchilla. The rodent warrior.,5281,0.97,31,,1688983007.0,False,False,False,False,False
80,14vr6eo,lotrmemes,/r/lotrmemes/comments/14vr6eo/ai_lord_of_the_rings_the_return_of_the_ai_king/,lotrfan2004,A.I. Lord of the Rings: The Return of the A.I. King,3899,0.9,247,,1688987922.0,False,False,False,False,False
81,14vvgrt,nope,/r/nope/comments/14vvgrt/pretty_sure_ive_lost_my_appetite_for_cream_cheese/,AppropriateVisit6994,Pretty sure I've lost my appetite for cream cheese after seeing this (it's mold),2081,0.94,230,,1688998976.0,False,False,False,False,False
82,14vpvxa,HonkaiStarRail,/r/HonkaiStarRail/comments/14vpvxa/heated_argument_by_mamaprofennn/,asilvertintedrose,Heated Argument (by @_mamaprofennn),5125,0.93,141,,1688983991.0,False,False,False,False,False
83,14vwfxn,aviation,/r/aviation/comments/14vwfxn/2_billion_dollars_of_freedom/,RespectTheReal,$2 billion dollars of freedom 🇺🇸,1802,0.88,270,,1689001206.0,False,False,False,False,False
84,14vyr8g,Unexpected,/r/Unexpected/comments/14vyr8g/astronaut_smuggles_a_full_gorilla_suit_onto_iss/,External_Industry739,Astronaut smuggles a full gorilla suit onto ISS space station without telling anybody,3285,0.95,89,,1689006424.0,False,False,False,False,False
85,14vpov5,mathmemes,/r/mathmemes/comments/14vpov5/the_power_of_math/,M-2-M,The power of math,5049,0.96,262,,1688983395.0,False,False,False,False,False
86,14vsc7i,batman,/r/batman/comments/14vsc7i/cant_believe_this_has_never_been_asked_before_who/,Transcendentalplan,Cant believe this has never been asked before: Who is the best live action Batman?,2966,0.93,343,,1688991216.0,False,False,False,False,False
87,14vurip,funny,/r/funny/comments/14vurip/i_mean_no_caption_is_needed/,moumenCR7,I mean no caption is needed,5156,0.91,619,,1688997359.0,False,False,False,False,False
88,14vptp3,awfuleverything,/r/awfuleverything/comments/14vptp3/tennessee_soccer_coach_arrested_after_leaving/,MastodonOk8087,Tennessee Soccer Coach Arrested After Leaving Behind Phone at Restaurant with Videos of Him Raping Unconscious Boys,4376,0.98,315,,1688983799.0,False,False,False,False,False
89,14vruty,UkraineWarVideoReport,/r/UkraineWarVideoReport/comments/14vruty/evacuation_of_an_russian_who_blew_himself_up_on/,DeepPanic3566,Evacuation of an Russian who blew himself up on his own mine! AFU soldiers are evacuating him.,3114,0.96,289,,1688989901.0,False,False,False,False,False
90,14vt8hz,Damnthatsinteresting,/r/Damnthatsinteresting/comments/14vt8hz/royal_caribbeans_icon_of_the_seas_will_be_the/,ILoveRegenHealth,"Royal Caribbean's ""Icon Of The Seas"" will be the largest cruise ship in the world when it sails Jan 2024. Holds 10,000 people (7,600 passengers). 5 times larger and heavier than the Titanic, 20 deck floors tall with more than 40 bars/restaurants, bowling alleys and live music & circus performances.",6600,0.92,1804,,1688993635.0,False,False,False,False,False
91,14vlbd3,clevercomebacks,/r/clevercomebacks/comments/14vlbd3/they_have_books_about_this_david/,DrLeonardMarvin,They have books about this David,26111,0.82,3575,,1688968700.0,False,False,False,False,False
92,14vsxol,ukraine,/r/ukraine/comments/14vsxol/drones_clearing_mines/,TotalSpaceNut,Drones clearing mines,2546,0.98,80,,1688992844.0,False,False,False,False,False
93,14vtqwf,AnimalsBeingDerps,/r/AnimalsBeingDerps/comments/14vtqwf/i_dont_even_know_what_this_look_is/,TheMaverickyMaverick,I don't even know what this look is.,2269,0.98,86,,1688994882.0,False,False,False,False,False
94,14vrypp,Breath_of_the_Wild,/r/Breath_of_the_Wild/comments/14vrypp/full_mooon/,QuickeChief,full mooon,2880,0.99,45,,1688990219.0,False,False,False,False,False
95,14vvent,scifi,/r/scifi/comments/14vvent/so_i_heard_someone_refer_to_elon_musk_as_reallife/,ghostsofplaylandpark,"So I heard someone refer to Elon Musk as ""real-life Tony Stark."" I don't know if they were joking or not, but it got me thinking about more accurate fictional analogues. I present: Jean-Baptiste Emanuel Musk.",1746,0.91,185,,1688998844.0,False,False,False,False,False
96,14vufl6,Hololive,/r/Hololive/comments/14vufl6/official_sallie_full_portrait/,SayuriUliana,Official Sallie full portrait,2007,0.99,45,:Kronii::IRyS::Mumei::Amelia::Ollie:,1688996547.0,False,False,False,False,False
97,14vx9uv,tennis,/r/tennis/comments/14vx9uv/wimbledon_r4_chris_eubanks_is_into_his_first/,slysonic7,"Wimbledon R4: Chris Eubanks is into his first major QF, defeating Stefanos Tsitsipas [5] | 3-6, 7-6(4), 3-6, 6-4, 6-4",1382,0.96,280,Rafa + Sinner,1689003072.0,False,False,False,False,False
98,14vrlsk,2westerneurope4u,/r/2westerneurope4u/comments/14vrlsk/this_bitch/,ridesharegai,This bitch,2947,0.95,740,:Greece: South Macedonian,1688989196.0,False,False,False,False,True
99,14vuncc,ChatGPT,/r/ChatGPT/comments/14vuncc/no/,zendrixate,No!,1880,0.96,48,I For One Welcome Our New AI Overlords 🫡,1688997069.0,False,False,False,False,False
100,14vvauv,diablo4,/r/diablo4/comments/14vvauv/sorcerer_starter_pack_in_diablo_4/,Ggthefiree2,Sorcerer Starter Pack in Diablo 4,1731,0.96,385,,1688998601.0,False,False,False,False,False
