rank,id,subreddit,permalink,author,title,score,upvote_ratio,num_comments,author_flair_text,created_utc,over_18,edited,stickied,locked,is_original_content
1,14ksd2q,confusing_perspective,/r/confusing_perspective/comments/14ksd2q/huge_triceps/,Successful_Pomelo701,Huge triceps?,11101,0.89,401,,1687906601.0,False,False,False,False,False
2,14kre6x,news,/r/news/comments/14kre6x/tourist_faces_24550_fine_for_carving_his_and/,IsThisAUserName86,"Tourist faces $24,550 fine for carving his and girlfriend’s name into Colosseum",10092,0.98,884,,1687904257.0,False,False,False,False,False
3,14kpjm2,awesome,/r/awesome/comments/14kpjm2/hatching_of_octopus_egg/,LoinKing_,Hatching of octopus egg,26454,0.97,587,,1687899956.0,False,False,False,False,False
4,14klqfq,WhitePeopleTwitter,/r/WhitePeopleTwitter/comments/14klqfq/special_counsel_jack_smith_has_called_for_tapes/,Travismatthew08,Special Counsel Jack Smith has called for tapes that implicate Ted Cruz in attempts to overturn Biden's certification.,24863,0.95,996,,1687891074.0,False,False,False,False,False
5,14knncy,oddlysatisfying,/r/oddlysatisfying/comments/14knncy/epoxy_resin_coffee_table_with_pine_cones/,Gh0stDestr0y,Epoxy resin coffee table with pine cones,11841,0.94,228,Flair Loading...,1687895774.0,False,False,False,False,False
6,14km5w9,facepalm,/r/facepalm/comments/14km5w9/wait_what/,Important_Fish2585,wait what?,26741,0.89,3238,,1687892060.0,False,False,False,False,False
7,14knb0o,Damnthatsinteresting,/r/Damnthatsinteresting/comments/14knb0o/nyakim_gatwech_is_a_south_sudanese_model_who_is/,Blue-Eyed-Sister,"Nyakim Gatwech is a South Sudanese model who is known as the Queen of The Dark because of her very dark skin, a result of high levels of melanin",11848,0.93,899,,1687894846.0,False,False,False,False,False
8,14kos8h,mildlyinfuriating,/r/mildlyinfuriating/comments/14kos8h/dont_park_in_visitor_parking_when_visiting_i_guess/,Omie_yourhomie,Don’t park in visitor parking when visiting I guess,8361,0.98,261,,1687898298.0,False,False,False,False,False
9,14kkm4j,tumblr,/r/tumblr/comments/14kkm4j/youre_banished/,alarmedlittlefroggy,You’re banished,22974,0.96,305,,1687888577.0,False,False,False,False,False
10,14kk9e1,MadeMeSmile,/r/MadeMeSmile/comments/14kk9e1/recreating_his_dads_old_modeling_photos/,iwanttoaskhere,Recreating his dads old modeling photos,22160,0.93,419,,1687887744.0,False,False,False,False,False
11,14kkfcm,nottheonion,/r/nottheonion/comments/14kkfcm/a_delaware_city_is_set_to_give_corporations_the/,King-of-New-York,A Delaware city is set to give corporations the right to vote in elections,16330,0.94,1401,,1687888142.0,False,False,False,False,False
12,14kmr8n,hockey,/r/hockey/comments/14kmr8n/connor_mcdavid_calls_out_nhls_move_to_ban_themed/,Soft-Rains,"Connor McDavid calls out NHL's move to ban themed jerseys. ""We strongly feel hockey is for everybody, and that includes the Pride nights.""",9656,0.9,756,TOR - NHL :60812:,1687893417.0,False,False,False,False,False
13,14kjw87,Tinder,/r/Tinder/comments/14kjw87/oh/,bashful-creature,oh,16410,0.96,213,,1687886909.0,False,False,False,False,False
14,14ko8ju,therewasanattempt,/r/therewasanattempt/comments/14ko8ju/to_drink_a_beer/,wondergom83,To drink a beer ,6940,0.97,334,,1687897067.0,False,False,False,False,False
15,14kid9b,wholesomememes,/r/wholesomememes/comments/14kid9b/his_family_understands_it_now/,blaze_uchiha999,His family understands it now,33674,0.96,269,,1687883438.0,False,False,False,False,False
16,14kinwf,meirl,/r/meirl/comments/14kinwf/meirl/,Signal-Top1208,Meirl,47017,0.89,1471,,1687884127.0,False,False,False,False,False
17,14kqpsf,PoliticalHumor,/r/PoliticalHumor/comments/14kqpsf/remember_this_comment/,Brassballs1976,Remember this comment?,4372,0.97,96,,1687902680.0,False,False,False,False,False
18,14knqxb,movies,/r/movies/comments/14knqxb/superman_legacy_james_gunn_taps_david_corenswet/,MarvelsGrantMan136,‘Superman: Legacy’: James Gunn Taps David Corenswet And Rachel Brosnahan For Clark Kent And Lois Lane In DC Studios Film,6151,0.89,1457,r/Movies contributor,1687895996.0,False,False,False,False,False
19,14khcc8,politics,/r/politics/comments/14khcc8/guns_banned_from_trump_speech_at_republican_dinner/,Afraid-Sky-5052,Guns banned from Trump speech at Republican dinner,23268,0.94,1462,,1687881052.0,False,False,False,False,False
20,14kiai2,LifeProTips,/r/LifeProTips/comments/14kiai2/lpt_tell_your_family_if_you_die_to_let_your_pet/,Anon293357,"LPT: tell your family, if you die, to let your pet see your dead body",21994,0.87,1149,,1687883262.0,False,False,False,False,False
21,14kkvpb,WTF,/r/WTF/comments/14kkvpb/meanwhile_while_on_safari/,Tunapiiano,Meanwhile while on safari.....,8879,0.95,614,,1687889144.0,False,False,False,False,False
22,14ki2h5,antiwork,/r/antiwork/comments/14ki2h5/or_go_homemade_you_will_still_not_afford_it_but/,Art_Renzy,"Or go homemade. You will still not afford it, but at least you are now a house-less in peace.",15277,0.97,343,,1687882751.0,False,False,False,False,False
23,14kjks7,nextfuckinglevel,/r/nextfuckinglevel/comments/14kjks7/embraced_by_the_fishes/,Thapee,Embraced by the fishes.,12818,0.96,438,,1687886182.0,False,False,False,False,False
24,14knw2k,CasualUK,/r/CasualUK/comments/14knw2k/today_i_visited_a_model_village_that_had_a_model/,thecustardgannet,Today I visited a model village that had a model of the model village that itself also had a model of the model of the model village,5308,0.98,244,,1687896274.0,False,False,False,False,False
25,14kimwu,ABoringDystopia,/r/ABoringDystopia/comments/14kimwu/cartiers_75bn_owner_says_fear_of_poor_rising_up/,LonelyGuyTheme,Cartier's $7.5bn owner says fear of poor rising up 'keeps him awake at night',11324,0.95,584,,1687884066.0,False,False,False,False,False
26,14kgjfc,pcmasterrace,/r/pcmasterrace/comments/14kgjfc/ive_been_searching_for_years/,Maskd-YT,I’ve been searching for years,22660,0.96,360,R5 5600X | RX 6600XT | 16GB 3600MHz RAM,1687879131.0,False,False,False,False,False
27,14kflnw,funny,/r/funny/comments/14kflnw/its_a_good_one/,jelly_good_show,It's a good one,41178,0.92,393,,1687876901.0,True,False,False,False,False
28,14kk205,OldSchoolCool,/r/OldSchoolCool/comments/14kk205/punk_rude_boy_and_a_skinhead_hanging_out_together/,haddock420,"Punk, “rude boy” and a skinhead hanging out together in England, 1980",8054,0.95,492,,1687887268.0,False,False,False,False,False
29,14kof53,todayilearned,/r/todayilearned/comments/14kof53/til_of_a_machine_lubricant_called_thames_mud/,DanYHKim,"TIL of a machine lubricant called Thames Mud Butter, made from fats that were skimmed from the sewage effluent of late 19th century London.",4193,0.97,171,,1687897472.0,False,False,False,False,False
30,14kgpkn,ufc,/r/ufc/comments/14kgpkn/offering_ufc_fighters_beer_after_they_fight_lol/,starfoxzeronie,Offering UFC fighters beer after they fight lol.,14609,0.96,381,,1687879532.0,False,False,False,False,False
31,14klzgo,BeAmazed,/r/BeAmazed/comments/14klzgo/just_two_friends/,Odd-Tutor931,Just two friends,6279,0.96,432,,1687891648.0,False,False,False,False,False
32,14kjrmc,memes,/r/memes/comments/14kjrmc/these_medieval_weapons_look_nothing_alike/,666thSuprisedPikachu,These medieval weapons look nothing alike,10621,0.94,209,,1687886611.0,False,False,False,False,False
33,14kiqiw,wholesome,/r/wholesome/comments/14kiqiw/how_to_become_a_hero/,AbsentDominance,How to become a hero! :),9584,0.96,125,,1687884300.0,False,False,False,False,False
34,14kkh0z,shitposting,/r/shitposting/comments/14kkh0z/glory_to_spez_i_think/,Least_Racist_Cat,Glory to spez i think,8737,0.95,313,,1687888244.0,False,False,False,False,False
35,14ki236,TikTokCringe,/r/TikTokCringe/comments/14ki236/zero/,Namastacia,ZE-RO.,10812,0.84,1504,,1687882725.0,False,False,False,False,False
36,14kjqr3,marvelmemes,/r/marvelmemes/comments/14kjqr3/this_community_in_a_nutshell/,leej851,This community in a nutshell,8007,0.94,580,Avengers,1687886555.0,False,False,False,False,False
37,14kn704,ukraine,/r/ukraine/comments/14kn704/kramatorsk_now/,Valuable_Umpire_6246,"Kramatorsk, now",4129,0.97,356,,1687894514.0,True,False,False,False,False
38,14kiqlu,ATBGE,/r/ATBGE/comments/14kiqlu/insane_technical_skill_but_whyyyyy_there/,Sassenacho,"Insane technical skill, but whyyyyy there??",7908,0.91,669,,1687884305.0,False,False,False,False,False
39,14kkmel,rareinsults,/r/rareinsults/comments/14kkmel/well_damn_when_you_put_it_like_that/,NeverEnoughSPF,"Well, damn, when you put it like that…",6227,0.97,159,,1687888594.0,False,False,False,False,False
40,14kfx2d,LeopardsAteMyFace,/r/LeopardsAteMyFace/comments/14kfx2d/on_the_same_day_rick_scott_says_socialists_and/,winterneuro,"On the same day Rick Scott says ""socialists"" and ""communists"" shouldn't go to Florida...",12901,0.96,738,,1687877673.0,False,False,False,False,False
41,14kf5ei,WorkReform,/r/WorkReform/comments/14kf5ei/just_move_to_a_place_you_can_afford/,IAmAccutane,"""Just move to a place you can afford""",16051,0.94,942,,1687875826.0,False,False,False,False,False
42,14kl1qq,NoStupidQuestions,/r/NoStupidQuestions/comments/14kl1qq/do_i_pay_the_model_or_does_she_pay_me/,Prize-Report6742,Do I pay the model or does she pay me?,5604,0.95,723,,1687889515.0,False,False,False,False,False
43,14kjt4b,worldnews,/r/worldnews/comments/14kjt4b/putin_claims_wagner_militants_were_fully_funded/,Ok-Stage-6981,Putin claims Wagner militants were fully funded by state and had received $1 billion between May 2022 and May 2023,6187,0.96,345,,1687886709.0,False,False,False,False,False
44,14kfunu,technology,/r/technology/comments/14kfunu/google_says_the_reddit_blackout_made_search_worse/,Breadstew,Google Says the Reddit Blackout Made Search Worse,12365,0.94,1103,,1687877507.0,False,False,False,False,False
45,14keb16,AnimalsBeingBros,/r/AnimalsBeingBros/comments/14keb16/guardian_doggo/,b_ub_u-1,Guardian doggo ❤️,19697,0.94,273,,1687873773.0,False,False,False,False,False
46,14kolvi,AmItheAsshole,/r/AmItheAsshole/comments/14kolvi/aita_for_forcing_my_18_year_old_daughter_to_spend/,Early-Tree-8225,"AITA for ""forcing"" my 18 year old daughter to spend time with her disabled sister",3274,0.85,1847,,1687897895.0,False,False,False,False,False
47,14kkx0w,pettyrevenge,/r/pettyrevenge/comments/14kkx0w/call_bylaw_on_me_because_im_too_sick_to_mow_my/,ultrasuperman1001,"Call bylaw on me because I'm too sick to mow my grass, enjoy your view of my 8ft fence",4815,0.96,282,,1687889225.0,False,False,False,False,False
48,14kfek5,nope,/r/nope/comments/14kfek5/giving_water_to_a_thirsty_cobra_is_pretty_high_on/,_ThatswhatXisaid_,Giving water to a thirsty cobra is pretty high on my nope list,15658,0.94,1020,,1687876435.0,False,False,False,False,False
49,14kn9xg,Animemes,/r/Animemes/comments/14kn9xg/tall_girls_are_a_blessing/,FidoMix_Felicia,Tall girls are a blessing,3564,0.96,87,⠀Big Anime Tiddies,1687894757.0,False,False,False,False,False
50,14khzyo,BlackPeopleTwitter,/r/BlackPeopleTwitter/comments/14khzyo/lifestyle_creep_will_ruin_you/,BPTeehee,Lifestyle creep will ruin you,6770,0.95,394,,1687882588.0,False,False,False,False,False
51,14khj6l,AdviceAnimals,/r/AdviceAnimals/comments/14khj6l/billionaires_in_a_nutshell/,sobes20,Billionaires in a Nutshell,8055,0.93,396,,1687881510.0,False,False,False,False,False
52,14kqyar,Gunners,/r/Gunners/comments/14kqyar/david_ornstein_exclusive_arsenal_have_tonight/,itsdanoodle,[David Ornstein] 🚨 EXCLUSIVE: Arsenal have tonight submitted a massive offer to West Ham for England midfielder Declan Rice. Proposal is for £100m + £5m in add-ons - would be a record for a British player as #AFC try to agree deal with #WHUFC for top target @TheAthleticFC,2088,0.96,755,lez doo dis,1687903229.0,False,False,False,False,False
53,14kl3uo,ProgrammerHumor,/r/ProgrammerHumor/comments/14kl3uo/somethingsareforever/,No-Shape-2751,someThingsAreForever,4354,0.97,85,,1687889650.0,False,False,False,False,False
54,14kpbq1,ThatsInsane,/r/ThatsInsane/comments/14kpbq1/just_minutes_after_the_russian_rocket_strike_on_a/,floatjoy,"Just Minutes after the Russian rocket strike on a cafe in Kramatorsk, June 27, 2023",2539,0.95,275,,1687899493.0,True,False,False,False,False
55,14kg68c,TwoXChromosomes,/r/TwoXChromosomes/comments/14kg68c/had_a_date_where_a_guy_made_a_ton_of_demands_for/,MaliciouslyMinty,Had a date where a guy made a ton of demands for his birthday week 😂,8898,0.92,1014,,1687878258.0,False,False,False,False,False
56,14kpo2j,nba,/r/nba/comments/14kpo2j/mizell_tobias_harris_on_his_name_being_in_trade/,pcwgussej,"[Mizell] Tobias Harris on his name being in trade rumors again: ""Casual Sixers fans, they’ll trade me for a Crumbl Cookie. But at the end of the day, they have to realize that you’re not getting a 6-9 forward back who can damn near shoot 40 percent from 3 guard the other team’s best player (cont.)",2362,0.97,477,,1687900239.0,False,False,False,False,False
57,14kmeef,gaming,/r/gaming/comments/14kmeef/its_good_time_to_play/,tupapirico1,It's good time to play,3583,0.93,187,,1687892600.0,False,False,False,False,False
58,14kphho,MemePiece,/r/MemePiece/comments/14kphho/the_future_of_the_marines/,iamamotherclucker,The Future of the Marines,2366,0.97,53,,1687899824.0,False,False,False,False,False
59,14khzcc,facepalm,/r/facepalm/comments/14khzcc/shouldnt_this_be_a_good_thing/,Shizueilvia,Shouldn't this be a good thing?,40985,0.96,587,,1687882548.0,False,False,False,False,False
60,14kmlyc,Grimdank,/r/Grimdank/comments/14kmlyc/not_subtle/,Kaczmarofil,not subtle,3428,0.96,333,Mongolian Biker Gang,1687893080.0,False,False,False,False,False
61,14kmydp,doordash,/r/doordash/comments/14kmydp/customer_just_threw_their_food_at_me_because_they/,XLookBehindYouX,Customer just threw their food at me because they didn’t get enough sauce,3206,0.93,861,,1687893876.0,False,False,False,False,False
62,14kkrdl,HolUp,/r/HolUp/comments/14kkrdl/so_it_seems_the_latest_chinese_food_trend_is_stir/,sewn_of_a_gun,So it seems the latest Chinese food trend is stir fried stones,4782,0.92,495,,1687888888.0,False,False,False,False,False
63,14kmeio,DiWHY,/r/DiWHY/comments/14kmeio/yep_that_seems_safe_enough_for_a_diy_project/,jojo9092,Yep that seems safe enough for a DIY project.,3381,0.92,330,,1687892607.0,False,False,False,False,False
64,14kitwf,bestof,/r/bestof/comments/14kitwf/reddit_is_killing_thirdparty_applications_and/,GodOfAtheism,Reddit is killing third-party applications (and itself). Read more in the comments.,6562,0.88,1,,1687884513.0,False,False,True,True,False
65,14kj2zs,clevercomebacks,/r/clevercomebacks/comments/14kj2zs/who_can_think_of_more/,Stoner4s3,Who can think of more?,5444,0.97,297,,1687885084.0,False,False,False,False,False
66,14knrsm,DC_Cinematic,/r/DC_Cinematic/comments/14knrsm/superman_legacy_james_gunn_taps_david_corenswet/,SpeedForce2022,‘Superman: Legacy’: James Gunn Taps David Corenswet And Rachel Brosnahan For Clark Kent And Lois Lane In DC Studios Film,2742,0.93,887,,1687896043.0,False,False,False,False,False
67,14kg5h5,Breath_of_the_Wild,/r/Breath_of_the_Wild/comments/14kg5h5/this_is_still_one_of_the_funniest_and_terrifying/,MuffinStraight4816,This is still one of the funniest and terrifying moment in BOTW. ,8477,0.95,203,,1687878211.0,False,False,False,False,False
68,14kh3rz,formuladank,/r/formuladank/comments/14kh3rz/that_beekeepers_name_adrian_newey/,rockinoutloud,That beekeeper's name? Adrian Newey.,7002,0.94,96,• WELL • DONE • BAKU •,1687880490.0,False,False,False,False,False
69,14kf5dv,offbeat,/r/offbeat/comments/14kf5dv/oregon_finally_legalizes_pumping_your_own_gas/,GroundbreakingSea960,Oregon Finally Legalizes Pumping Your Own Gas After 72 Years,8374,0.96,874,,1687875825.0,False,False,False,False,False
70,14ki6y7,oddlyterrifying,/r/oddlyterrifying/comments/14ki6y7/a_real_life_baby_griffin/,jaobodam,A real life baby Griffin,6195,0.92,167,,1687883035.0,False,False,False,False,False
71,14kkkip,WhitePeopleTwitter,/r/WhitePeopleTwitter/comments/14kkkip/scotus_rejects_independent_state_legislatures/,human_suitcase,"Scotus rejects independent state legislatures theory, 6-3 with Thomas, Alito and Gorsuch dissenting",10933,0.98,189,,1687888473.0,False,False,False,False,False
72,14kjf7u,diablo4,/r/diablo4/comments/14kjf7u/diablo_iv_patch_notes_103_build_42753_all/,mrmivo,"Diablo IV Patch Notes - 1.0.3 Build #42753 (All Platforms) - June 27, 2023",4669,0.92,3102,,1687885822.0,False,False,False,False,False
73,14kebxt,me_irlgbt,/r/me_irlgbt/comments/14kebxt/meirlgbt/,romeofantasy,me🥺irlgbt,20865,0.79,559,,1687873832.0,False,False,False,False,False
74,14kj1zo,CrazyFuckingVideos,/r/CrazyFuckingVideos/comments/14kj1zo/deep_in_the_heart_of_texas/,firefly99999,Deep in the heart of Texas,4998,0.95,767,,1687885018.0,False,False,False,False,False
75,14khji3,wholesomememes,/r/wholesomememes/comments/14khji3/austin_powers/,Additional_Ad1382,Austin Powers,40928,0.93,585,,1687881532.0,False,False,False,False,False
76,14kjmo3,meme,/r/meme/comments/14kjmo3/mcdonalds/,SmokingBouquets,McDonald’s,5593,0.88,192,,1687886306.0,False,False,False,False,False
77,14kby31,starterpacks,/r/starterpacks/comments/14kby31/the_truerateme_starterpack/,Dave78905,The truerateme starterpack,44017,0.9,2184,,1687867656.0,False,False,False,False,False
78,14khpbw,dankmemes,/r/dankmemes/comments/14khpbw/take_that_you_imperial_capitalist_scum/,LemonConnoiseur,Take that you imperial capitalist scum,7683,0.93,90,☣️,1687881887.0,True,False,False,False,False
79,14kgmbz,ANormalDayInRussia,/r/ANormalDayInRussia/comments/14kgmbz/porsche_parody/,juanwonone2,Porsche Parody,6727,0.94,129,,1687879319.0,False,False,False,False,False
80,14kml9d,mathmemes,/r/mathmemes/comments/14kml9d/i_dont_get_these_people/,yetanother234,I don't get these people,3118,0.96,189,,1687893039.0,False,False,False,False,False
81,14kpn3g,terriblefacebookmemes,/r/terriblefacebookmemes/comments/14kpn3g/hahaha_all_gamer_girlswoman_are_unfit_and_fat/,Jay0r,"Hahaha, all gamer girls/woman are unfit and fat.",2111,0.93,209,,1687900180.0,False,False,False,False,False
82,14kc6nl,lgbt,/r/lgbt/comments/14kc6nl/just_this/,MoveOn,Just This,27455,0.86,447,,1687868299.0,False,False,False,False,False
83,14khjzp,fixedbytheduet,/r/fixedbytheduet/comments/14khjzp/window_smash/,AlphaneRG,Window Smash,6067,0.95,250,,1687881564.0,False,False,False,False,False
84,14kbw5v,AskReddit,/r/AskReddit/comments/14kbw5v/medical_professionals_of_reddit_have_you_ever_had/,babyhippo01,"Medical professionals of Reddit, have you ever had a patient so lacking in common sense you wondered how they made it this far. If so, what is your story?",24968,0.93,10474,,1687867516.0,True,False,False,False,False
85,14kgjx6,fightporn,/r/fightporn/comments/14kgjx6/ref_was_willing_to_let_female_fighter_die_until/,Background_Piano7984,Ref was willing to let female fighter die until her coach came in to save her,6485,0.95,556,Keyboard warrior,1687879166.0,False,False,False,False,False
86,14klli6,skyrim,/r/skyrim/comments/14klli6/i_was_today_years_old_when_i_found_out_that_if/,Padzi,I was today years old when I found out that if you hit a spectre with Aetherial Shield you bring its old appearance back,3241,0.97,163,PC,1687890757.0,False,False,False,False,False
87,14kcfai,Whatcouldgowrong,/r/Whatcouldgowrong/comments/14kcfai/pretending_to_jump_off_a_cliff/,uchman365,Pretending to jump off a cliff,16781,0.93,665,,1687868959.0,False,False,False,False,False
88,14kngsl,chessbeginners,/r/chessbeginners/comments/14kngsl/had_this_interaction_today_which_i_thought_was/,xMcGTAx,Had this interaction today which i thought was quite funny,2521,0.95,147,,1687895312.0,False,False,False,False,False
89,14ki3g7,mildlyinfuriating,/r/mildlyinfuriating/comments/14ki3g7/my_parents_live_in_a_rural_area_this_is_the_only/,thebigbread42,"My parents live in a rural area, this is the only grocery store for about 20 miles. They charge about double and most people spend it because they have no other choice.",19191,0.9,2900,,1687882813.0,False,False,False,False,False
90,14km52d,iamatotalpieceofshit,/r/iamatotalpieceofshit/comments/14km52d/twitter_users_are_perfectly_fine_with_10_year/,Theweirdposidenchild,Twitter users are perfectly fine with 10 year olds forced to give birth and women dying just because they don't like abortions,2973,0.88,196,,1687892006.0,True,False,False,False,False
91,14kjbvp,whenthe,/r/whenthe/comments/14kjbvp/do_you_guys_have_any_game_suggestions/,EmilySuxAtUsernames,do you guys have any game suggestions,4636,0.96,290,the tran gener,1687885613.0,False,False,False,False,False
92,14klr97,PublicFreakout,/r/PublicFreakout/comments/14klr97/man_attacks_woman_and_gets_instant_justice/,Ur_not_involved,Man attacks woman and gets instant justice,3043,0.96,449,,1687891130.0,True,False,False,False,False
93,14kows4,discordVideos,/r/discordVideos/comments/14kows4/north_korea/,Fischi104,North Korea ,2087,0.99,28,Haven't Payed Taxes Since 2005🤣🤣,1687898582.0,False,False,False,False,False
94,14ko9ah,superman,/r/superman/comments/14ko9ah/its_official/,RoboIsLegend,It’s official!,2156,0.92,430,:SupermanFleischer:,1687897110.0,False,False,False,False,False
95,14kpcdf,popculturechat,/r/popculturechat/comments/14kpcdf/why_are_celebrities_so_entitled_or_are_they_not/,HogwartsZoologist,Why are celebrities so entitled? Or are they not aware what their planners pay (or lack of) vendors?,1894,0.96,231,,1687899535.0,False,False,False,False,False
96,14kmp9t,HonkaiStarRail,/r/HonkaiStarRail/comments/14kmp9t/silver_wolf_ready_to_surf_by_云开明/,Yuuki2628,Silver Wolf ready to surf [by 云开明],2655,0.95,47,,1687893294.0,False,False,False,False,False
97,14kgyex,distressingmemes,/r/distressingmemes/comments/14kgyex/_/,RecommendationNo985,💀,6226,0.95,270,,1687880129.0,False,False,False,False,False
98,14kkzez,halo,/r/halo/comments/14kkzez/perfect_circle_pricing_is_scummy/,Crespo2006,Perfect Circle pricing is scummy,3063,0.96,200,youtube.com/CrespoFTW,1687889378.0,False,False,False,False,False
99,14knvzf,OneOrangeBraincell,/r/OneOrangeBraincell/comments/14knvzf/helped_the_human_with_chores_today_by_laying_on/,iLikeMcChicken,Helped the human with chores today by laying on the mat so it stay in place while he sweep and clean.,2160,0.99,35,,1687896269.0,False,False,False,False,False
100,14kou2m,IASIP,/r/IASIP/comments/14kou2m/to_those_upset_about_the_mary_elizabeth_ellis_the/,Sensitive-Bag-4010,"To those upset about the Mary Elizabeth Ellis (the actress who plays the Waitress) post, the cast has clearly shown support for pride in the past.",1917,0.89,358,,1687898411.0,False,False,False,False,False
