rank,id,subreddit,permalink,author,title,score,upvote_ratio,num_comments,author_flair_text,created_utc,over_18,edited,stickied,locked,is_original_content
1,14hwfub,news,/r/news/comments/14hwfub/drunk_drivers_in_texas_who_kill_parents_of_a/,claire0,Drunk drivers in Texas who kill parents of a child will now be required to pay child support,19151,0.97,933,,1687622242.0,False,False,False,False,False
2,14hvfzg,worldnews,/r/worldnews/comments/14hvfzg/wagner_group_now_just_400_km_away_from_moscow/,ledim35,Wagner Group now just 400 km away from Moscow,27590,0.95,4038,,1687619573.0,False,False,False,False,False
3,14hvc15,Damnthatsinteresting,/r/Damnthatsinteresting/comments/14hvc15/it_is_reported_that_the_wagnerians_broke_through/,Smartercow,It is reported that the Wagnerians broke through the barricades on their way to Moscow,17475,0.96,1340,Interested,1687619277.0,False,False,False,False,False
4,14htix8,facepalm,/r/facepalm/comments/14htix8/sounds_like_a_plan/,Comfortablejack,Sounds like a plan.,33788,0.95,1829,,1687614445.0,False,False,False,False,False
5,14ht5r5,antiwork,/r/antiwork/comments/14ht5r5/ah_yesmaking_everyone_poor_so_that_society_can/,UnnaturalGeek,"Ah yes...making everyone poor so that society can function, that's how it all works right?!",24830,0.94,1157,,1687613446.0,False,False,False,False,False
6,14ht3fs,WhitePeopleTwitter,/r/WhitePeopleTwitter/comments/14ht3fs/the_entire_world_is_fortunate_trump_lost/,OrangeCone2011,The entire world is fortunate Trump lost,32253,0.88,1066,,1687613255.0,False,False,False,False,False
7,14hu2ob,meirl,/r/meirl/comments/14hu2ob/meirl/,immmuu,meirl,17759,0.96,954,,1687615899.0,False,False,False,False,False
8,14hxmu8,TikTokCringe,/r/TikTokCringe/comments/14hxmu8/savage/,Sufficient-Bug-9112,Savage,6507,0.9,483,,1687625297.0,False,False,False,False,False
9,14hsilw,DesignPorn,/r/DesignPorn/comments/14hsilw/alzheimer_awareness_ad/,Brone9,Alzheimer Awareness Ad,16899,0.96,248,,1687611692.0,False,False,False,False,False
10,14htgyx,BrandNewSentence,/r/BrandNewSentence/comments/14htgyx/when_everythings_pimply_nothing_is/,jnljed,"When everything's pimply, nothing is",16093,0.94,387,,1687614304.0,False,False,False,False,False
11,14hs4mq,MadeMeSmile,/r/MadeMeSmile/comments/14hs4mq/these_men_just_made_history_as_the_first_people/,UnitedLab6476,These men just made history as the first people to ever graduate from Yale while incarcerated,22471,0.93,886,,1687610587.0,False,False,False,False,False
12,14hrzf0,mildlyinfuriating,/r/mildlyinfuriating/comments/14hrzf0/what_even_is_the_point_of_these_things_they_poke/,____Maximus____,What even is the point of these things? They poke into my assigned spot...,30965,0.94,6326,,1687610163.0,False,False,False,False,False
13,14hr7i7,funny,/r/funny/comments/14hr7i7/this_is_art/,Deep_Information2600,This is art.,22416,0.95,295,,1687607906.0,False,False,False,False,False
14,14hrhr8,BeAmazed,/r/BeAmazed/comments/14hrhr8/cuteness_of_burrowing_owls/,PromotionSolid8285,Cuteness of Burrowing owls 🦉,49175,0.93,1129,,1687608721.0,False,False,False,False,False
15,14hvgoe,nba,/r/nba/comments/14hvgoe/reynolds_tim_duncan_david_robinson_sean_elliott/,Kimber80,"[Reynolds] Tim Duncan, David Robinson, Sean Elliott and Manu Ginobili had dinner with Victor Wembanyama last night after his arrival in San Antonio. Welcome, kid.",6831,0.97,599,,1687619623.0,False,False,False,False,False
16,14hs1zt,politics,/r/politics/comments/14hs1zt/desantis_calls_medical_marijuana_very/,HallucinogenicFish,DeSantis calls medical marijuana 'very controversial' after fighting for it in Florida,12330,0.95,981,:flag-ga: Georgia,1687610373.0,False,False,False,False,False
17,14hskgi,cats,/r/cats/comments/14hskgi/silky_a_10_year_old_senior_cat_adopted_after/,UnitedLab6476,"Silky, a 10 year old senior cat, adopted after someone previously gave up on her after only 24 hours",11694,0.97,445,,1687611818.0,False,False,False,False,False
18,14ht37c,oddlysatisfying,/r/oddlysatisfying/comments/14ht37c/crayon_river_table/,Gh0stDestr0y,Crayon River Table,11237,0.92,262,Flair Loading...,1687613236.0,False,False,False,False,False
19,14hvbx6,ukraine,/r/ukraine/comments/14hvbx6/watching_news_with_my_friends_from_the_72nd/,jesterboyd,Watching news with my friends from the 72nd Mechanized Brigade not far from occupied Donetsk,6201,0.96,161,I am Alpharius,1687619267.0,False,False,False,False,False
20,14hwqaz,tumblr,/r/tumblr/comments/14hwqaz/inspiring/,ReadIt-Reddit-,Inspiring?,4973,0.96,15,,1687622932.0,False,False,False,False,False
21,14hsm22,ProgrammerHumor,/r/ProgrammerHumor/comments/14hsm22/fateofthebrightestfellowfrommybatch/,smilingcarbon,fateOfTheBrightestFellowFromMyBatch,9581,0.97,227,,1687611940.0,False,False,False,False,False
22,14hrogc,pics,/r/pics/comments/14hrogc/john_oliver_accusing_israel_of_being_an_apartheid/,AlainAlam,John Oliver accusing Israel of being an apartheid state,16136,0.79,756,,1687609288.0,False,False,False,True,False
23,14hqffd,memes,/r/memes/comments/14hqffd/medieval_get_rich_quick_scheme/,johnlen1n,Medieval get rich quick scheme,30443,0.95,459,:MayMayMaker: MAYMAYMAKERS :MayMayMaker:,1687605475.0,False,False,False,False,False
24,14hptzu,technicallythetruth,/r/technicallythetruth/comments/14hptzu/aye_i_suppose_it_is/,Vass_Kallal,aye i suppose it is,44820,0.96,235,,1687603582.0,False,False,False,False,False
25,14htsgc,pcgaming,/r/pcgaming/comments/14htsgc/battlebit_remastered_is_dominating_steam_because/,Turbostrider27,BattleBit Remastered is dominating Steam because there's no catch: it's just a lot of game for $15,6676,0.94,888,,1687615162.0,False,False,False,False,False
26,14hwttm,AmItheAsshole,/r/AmItheAsshole/comments/14hwttm/aita_for_saying_no_to_my_wife_to_be_a_bridesmaid/,Maleficent_Glove_420,AITA for saying no to my wife to be a bridesmaid?,4190,0.93,886,,1687623187.0,False,1687624633.0,False,False,False
27,14ht1h4,FunnyandSad,/r/FunnyandSad/comments/14ht1h4/thats_how_you_solve_it/,LiveWithinYourMemes,That's how you solve it,8041,0.9,690,,1687613105.0,False,False,False,False,False
28,14hsqmi,ContagiousLaughter,/r/ContagiousLaughter/comments/14hsqmi/thats_a_big_win_for_me/,sophisticated_kayla,That's a big win for me,8378,0.96,59,,1687612283.0,False,False,False,False,False
29,14hris8,clevercomebacks,/r/clevercomebacks/comments/14hris8/why_do_they_have_to_do_oscar_the_grouch_like_that/,Flip_Speed,Why do they have to do Oscar the grouch like that?,11028,0.95,145,,1687608808.0,False,False,False,False,False
30,14hr9s3,comics,/r/comics/comments/14hr9s3/bbq_chips/,neilkohney,BBQ Chips,11129,0.97,128,The Other End,1687608082.0,False,False,False,False,False
31,14hw0d7,NatureIsFuckingLit,/r/NatureIsFuckingLit/comments/14hw0d7/mama_bear_relaxing_with_her_cub_on_her_tummy/,amish_novelty,🔥 Mama bear relaxing with her cub on her tummy,4481,0.98,79,,1687621085.0,False,False,False,False,False
32,14huhxf,coolguides,/r/coolguides/comments/14huhxf/a_cool_guides_landscape_architect_here/,IndelibleDamsel,A cool Guides Landscape architect here,5557,0.9,147,,1687617048.0,False,False,False,False,False
33,14httzo,todayilearned,/r/todayilearned/comments/14httzo/til_that_at_the_funeral_of_his_first_wife_kato/,VegemiteSucks,"TIL that at the funeral of his first wife, Kato Svanidze, Stalin said ""This creature softened my heart of stone. She died and with her died my last warm feelings for humanity."" During her burial, Stalin was so overcome with grief that he threw himself into her grave, and had to be dragged out.",6081,0.97,193,,1687615270.0,False,False,False,False,False
34,14hw1dj,OneOrangeBraincell,/r/OneOrangeBraincell/comments/14hw1dj/new_noise_who_dis/,Misguided_Society,"New noise, who dis?",4300,0.98,36,,1687621160.0,False,False,False,False,False
35,14htm9h,OldSchoolCool,/r/OldSchoolCool/comments/14htm9h/my_grandpas_class_photo_from_1938_his_family/,Holybull79,"My grandpa's class photo from 1938. His family didn't have enough money for shoes, but he's still the coolest kid on the block.",5913,0.97,303,,1687614691.0,False,False,False,False,False
36,14hpgom,movies,/r/movies/comments/14hpgom/he_made_a_mess_of_cnn_now_hes_ruining_turner/,harsh2k5,"He Made a Mess of CNN. Now He’s Ruining Turner Classic Movies Too. | David Zaslav, whose Chris Licht hire butchered CNN, is vandalizing TCM, a beloved cultural institution.",15782,0.92,972,,1687602317.0,False,False,False,False,False
37,14hqntk,Whatcouldgowrong,/r/Whatcouldgowrong/comments/14hqntk/liningup_weight_lifters_in_a_row_lifting_too_much/,Calembur,Lining-Up Weight Lifters in a Row + Lifting Too Much Weight,11159,0.95,553,,1687606204.0,False,False,False,False,False
38,14hpf5j,interesting,/r/interesting/comments/14hpf5j/a_girl_captures_the_moment_russian_heli_destroys/,UmarIrshad,A girl captures the moment Russian heli destroys oil depot in Voronezh to not let Wagner have control of it,17835,0.95,466,,1687602166.0,False,False,False,True,False
39,14hubj6,UkraineWarVideoReport,/r/UkraineWarVideoReport/comments/14hubj6/people_are_trying_to_leave_rostov_now_ruzzian/,stanskiii,People are trying to leave Rostov. Now Ruzzian people are in fear and desperation.,5022,0.96,551,,1687616569.0,False,False,False,False,False
40,14hvcdr,nextfuckinglevel,/r/nextfuckinglevel/comments/14hvcdr/heavy_machinery_operator_masters_a_delicate/,preppythugg,Heavy machinery operator masters a delicate transition,4207,0.97,90,,1687619302.0,False,False,False,False,False
41,14hy218,dankmemes,/r/dankmemes/comments/14hy218/least_destructive_prank/,thepositivepandemic,Least destructive prank.,2976,0.99,45,,1687626394.0,False,False,False,False,False
42,14ho3x1,PoliticalHumor,/r/PoliticalHumor/comments/14ho3x1/get_in_line_citizen/,mac-mcgreor,"Get in line, citizen!",25994,0.93,660,,1687597592.0,False,False,True,False,False
43,14hvyew,Animemes,/r/Animemes/comments/14hvyew/arguing_with_someone/,girlycharms,Arguing with someone..,3910,0.97,65,,1687620941.0,False,False,False,False,False
44,14hwedv,starterpacks,/r/starterpacks/comments/14hwedv/garbage_no_one_wants_on_youtube_starter_pack/,NorthernOakTree,garbage no one wants on youtube starter pack,3417,0.94,404,,1687622137.0,False,False,False,False,False
45,14hxvwa,wholesomememes,/r/wholesomememes/comments/14hxvwa/safer_with_family/,AccordingBiga,Safer with Family,2706,0.98,19,,1687625992.0,False,False,False,False,False
46,14hs4nh,gaming,/r/gaming/comments/14hs4nh/an_update_on_the_elder_scrolls_6_from_goron_city/,Level1Roshan,An update on The Elder Scrolls 6 from Goron City,6328,0.97,171,,1687610589.0,False,False,False,False,False
47,14hrema,eu4,/r/eu4/comments/14hrema/guys_i_need_help_25k_pretender_rebels_captured/,VladBarbuRo,"Guys, I need help. 25k Pretender Rebels captured Moskow in my Russia Game.",7226,0.94,209,,1687608467.0,False,False,False,False,False
48,14htgut,ImTheMainCharacter,/r/ImTheMainCharacter/comments/14htgut/influencers_when_there_is_public_in_public_place/,OkDoughnut1560,influencers when there is public in public place 🤯,4949,0.91,522,,1687614295.0,False,False,False,False,False
49,14hudov,BlackPeopleTwitter,/r/BlackPeopleTwitter/comments/14hudov/one_cannot_amass_such_wealth_without_exploiting/,Markual,"One cannot amass such wealth without exploiting, thieving, and killing people.",4180,0.94,148,☑️,1687616731.0,False,False,False,False,False
50,14hs8hs,Damnthatsinteresting,/r/Damnthatsinteresting/comments/14hs8hs/dropping_a_gopro_down_from_a_cruise_ship/,Siil_Udus,Dropping a gopro down from a cruise ship,27774,0.97,624,,1687610901.0,False,False,False,False,False
51,14hrsrz,WhitePeopleTwitter,/r/WhitePeopleTwitter/comments/14hrsrz/and_all_without_losing_a_single_american_troop/,TrumpterOFyvie,And all without losing a single American troop - thanks Biden,40454,0.89,1620,,1687609638.0,False,False,False,False,False
52,14homvz,therewasanattempt,/r/therewasanattempt/comments/14homvz/to_land_a_f35b/,Dimitri_Ostende,To land a F-35B,19594,0.92,1373,,1687599471.0,False,False,False,False,False
53,14hr547,insanepeoplefacebook,/r/insanepeoplefacebook/comments/14hr547/bold_of_him_to_think_that_hell_exists_and_assume/,Kcvine,Bold of him to think that hell exists and assume that he won't be burning for all eternity.,7454,0.96,276,,1687607704.0,False,False,False,False,False
54,14hrip2,2westerneurope4u,/r/2westerneurope4u/comments/14hrip2/can_any_luigis_out_there_explain_this_phenomenon/,Agricorps,Can any Luigis out there explain this phenomenon to me?,7343,0.92,579,:Sweden: Islam enjoyer,1687608799.0,False,False,False,False,False
55,14hwvuj,facepalm,/r/facepalm/comments/14hwvuj/who_needs_a_survey/,Ok_Distribution1503,Who needs a survey,6225,0.98,373,,1687623335.0,False,False,False,False,False
56,14hqxmg,AskReddit,/r/AskReddit/comments/14hqxmg/russians_of_reddit_what_do_you_think_of_wagners/,Mindless-Bones,"Russians of Reddit, what do you think of Wagner’s rebellion?",6888,0.91,1764,,1687607049.0,False,False,False,False,False
57,14hqxbo,news,/r/news/comments/14hqxbo/russian_helicopters_battle_rebel_mercenaries/,TheOnlyEn,Russian helicopters battle rebel mercenaries rolling towards Moscow,28067,0.96,2888,,1687607022.0,False,False,False,False,False
58,14hp3s0,PublicFreakout,/r/PublicFreakout/comments/14hp3s0/my_name_is_hu_mongus/,PUTINnTRUMP_arrest,“My name is HU - MONGUS”,12440,0.91,1318,,1687601095.0,False,False,False,False,False
59,14hv6s3,worldnews,/r/worldnews/comments/14hv6s3/putin_calls_kazakh_president_to_brief_him_on/,Seek_Adventure,"Putin calls Kazakh president to brief him on Wagner uprising but Tokayev says it is ""internal matter of Russia""",7028,0.98,382,,1687618902.0,False,False,False,False,False
60,14hoy1x,shitposting,/r/shitposting/comments/14hoy1x/glory_to_spez/,Ohno_cringhe,Glory to spez,18817,0.94,290,We do a little trolling :snoo_trollface:,1687600585.0,False,False,False,False,False
61,14htu4g,IASIP,/r/IASIP/comments/14htu4g/two_wars_in_russia/,Scooter_McLefty,TWO WARS IN RUSSIA?!,3946,0.97,61,:dennis-dart:,1687615277.0,False,False,False,False,False
62,14hp082,CasualUK,/r/CasualUK/comments/14hp082/sainsburys_seedless_tangerine_18_seeds_18_lies/,RedditorSlug,Sainsbury's 'seedless' tangerine. 18 seeds. 18 lies.,10286,0.96,210,,1687600807.0,False,False,False,False,False
63,14hsaq9,CombatFootage,/r/CombatFootage/comments/14hsaq9/second_angle_of_the_ka52_avoiding_an/,950771dd,Second angle of the Ka-52 avoiding an anti-air-missile ,5063,0.98,185,,1687611073.0,False,False,False,False,False
64,14hszfw,oddlyterrifying,/r/oddlyterrifying/comments/14hszfw/doctors_kept_chinese_factory_worker_xie_weis_hand/,Monsur_Ausuhnom,Doctors Kept Chinese Factory Worker Xie Wei's Hand Alive By Stitching It To Left Ankle.,4776,0.98,137,,1687612947.0,True,False,False,False,False
65,14hs0a7,apolloapp,/r/apolloapp/comments/14hs0a7/reddit_telling_blind_mods_they_will_be_replaced/,Pseudocrat,Reddit Telling Blind Mods They Will Be Replaced While Removing Crucial Tools They Need,5034,0.95,190,,1687610233.0,False,False,False,False,False
66,14htjpo,funnyvideos,/r/funnyvideos/comments/14htjpo/rode_mic/,DescriptionHuge6377,Rode mic,4107,0.91,129,,1687614506.0,False,False,False,False,False
67,14htq3a,WorkReform,/r/WorkReform/comments/14htq3a/karen_seems_to_think_workers_deserve_to_live_in/,UnitedLab6476,Karen Seems To Think Workers Deserve To Live In Poverty,3800,0.95,200,,1687614979.0,False,False,False,False,False
68,14hsuf0,TwoSentenceHorror,/r/TwoSentenceHorror/comments/14hsuf0/after_sex_i_always_feel_guilty/,Grouchy-Football-249,"After sex, I always feel guilty.",4862,0.93,255,,1687612568.0,False,False,False,False,False
69,14hq3h8,pcmasterrace,/r/pcmasterrace/comments/14hq3h8/what_8x_amd_instinct_mi200_gpus_can_do_with_a/,ProjectPhysX,"What 8x AMD Instinct MI200 GPUs can do with a combined 512GB VRAM: Bell 222 Helicopter in FluidX3D CFD - 10 Billion Cells, 75k Time Steps, 71TB vizualized - 6.4 hours compute+rendering with OpenCL",7759,0.96,405,,1687604439.0,False,False,False,False,False
70,14hp4cy,europe,/r/europe/comments/14hp4cy/wagner_mutiny_megathread/,KvalitetstidEnsam,Wagner mutiny megathread,8509,0.94,3649,På lang slik er alt midlertidig,1687601146.0,False,1687604683.0,True,False,False
71,14hv08z,19684,/r/19684/comments/14hv08z/rule/,hellogreeting,Rule,3056,0.93,234,,1687618431.0,False,False,False,False,False
72,14hp78t,NonPoliticalTwitter,/r/NonPoliticalTwitter/comments/14hp78t/i_would_definitely_want_to_see/,AssignmentBrief3038,I would definitely want to see...,8368,0.94,142,:blue1::blue2::1111::1112:,1687601421.0,False,False,False,False,False
73,14hswki,meme,/r/meme/comments/14hswki/thanks_putin/,Double-half-55,Thanks Putin!,4499,0.94,190,,1687612734.0,False,False,False,False,True
74,14huj3a,anime_irl,/r/anime_irl/comments/14huj3a/anime_irl/,History_DoT,anime_irl,3160,0.97,40,,1687617132.0,False,False,False,False,False
75,14hxe5q,marvelstudios,/r/marvelstudios/comments/14hxe5q/remembered_how_good_this_scene_is_while_watching/,Loose-Examination-39,Remembered how good this scene is while watching Hawkeye.The sadness and joy it brings,2059,0.97,57,Doctor Strange Supreme,1687624669.0,False,False,False,False,False
76,14ht11h,diablo4,/r/diablo4/comments/14ht11h/tumor_extraction_done_time_to_focus_on_the_other/,defekT1312,"Tumor extraction done, time to focus on the other Battle.",3755,0.9,218,,1687613072.0,False,False,False,False,False
77,14hpzrz,DunderMifflin,/r/DunderMifflin/comments/14hpzrz/idk_if_this_has_been_done_before/,E115lement,Idk if this has been done before,6597,0.95,138,,1687604110.0,False,False,False,False,False
78,14hui5p,meirl,/r/meirl/comments/14hui5p/meirl/,Jimbo072,meirl,8025,0.98,338,,1687617064.0,False,False,False,False,False
79,14hufxp,Jokes,/r/Jokes/comments/14hufxp/a_guy_walks_into_a_bar_in_mexico_and_sees_a_sign/,HelpingHandsUs,"A guy walks into a bar in Mexico, and sees a sign that says ""If you can make this donkey laugh we will give you $100""...",2943,0.92,87,,1687616899.0,True,False,False,False,False
80,14hov71,MapPorn,/r/MapPorn/comments/14hov71/map_of_roadblocks_on_main_road_between_rostov_and/,Money_Astronaut9789,Map of roadblocks on main road between Rostov and Moscow,8013,0.96,384,,1687600300.0,False,False,False,False,False
81,14hpncj,lotrmemes,/r/lotrmemes/comments/14hpncj/repost_but_a_classic/,kneebourobumeqs,Repost but a classic,6715,0.97,67,,1687602939.0,False,False,False,False,False
82,14hv8yz,antiwork,/r/antiwork/comments/14hv8yz/regret_bringing_more_slaves_into_the_world/,Infinite-Anxiety-267,Regret bringing more slaves into the world.,5795,0.94,529,,1687619049.0,False,False,False,False,False
83,14htniz,mildlyinfuriating,/r/mildlyinfuriating/comments/14htniz/junk_removal_places_thew_my_neighbors_soiled/,Rowsdower32,Junk removal places thew my neighbors soiled mattress off her balcony into our yard and broke our bird feeder,7923,0.98,551,,1687614786.0,False,False,False,False,False
84,14hu75b,LeagueOfMemes,/r/LeagueOfMemes/comments/14hu75b/fuck/,princessmisery,Fuck,3074,0.98,29,,1687616248.0,False,False,False,False,False
85,14hqftp,rareinsults,/r/rareinsults/comments/14hqftp/uncommon_fortnite_skins/,JesusShuttlesworth__,uncommon fortnite skins,5928,0.97,128,,1687605508.0,False,False,False,False,False
86,14hv45z,Stellaris,/r/Stellaris/comments/14hv45z/not_conforming_to_game_theory_is_the_new_meta_guys/,MrZnaczek,Not conforming to game theory is the new meta guys,2592,0.97,176,,1687618720.0,False,False,False,False,True
87,14hw9kv,bestof,/r/bestof/comments/14hw9kv/reddit_is_killing_thirdparty_applications_and/,GodOfAtheism,Reddit is killing third-party applications (and itself). Read more in the comments.,2248,0.89,1,,1687621781.0,False,False,True,True,False
88,14husgb,2meirl4meirl,/r/2meirl4meirl/comments/14husgb/2meirl4meirl/,Brajany,2meirl4meirl,2635,0.98,9,,1687617854.0,False,False,False,False,False
89,14hpl8s,UkrainianConflict,/r/UkrainianConflict/comments/14hpl8s/putin_has_fled_moscow_apparently/,TheVioletSpy,Putin has fled Moscow apparently,5746,0.97,486,,1687602743.0,False,False,False,False,False
90,14hucwu,Grimdank,/r/Grimdank/comments/14hucwu/levels_of_knowledge/,ArchivistOfInfinity,Levels of Knowledge,2702,0.98,105,"Swell guy, that Kharn",1687616675.0,False,False,False,False,False
91,14hs1sf,TwoXChromosomes,/r/TwoXChromosomes/comments/14hs1sf/maine_bill_proposing_one_of_countrys_least/,shallah,Maine bill proposing one of country's least restrictive abortion laws narrowly clears House vote The bill would allow abortions any time before birth if deemed necessary by a medical provider.,3711,0.97,79,,1687610356.0,False,False,False,False,False
92,14huso2,UrbanHell,/r/UrbanHell/comments/14huso2/bolton_england/,latenightdrive97,"Bolton, England.",2461,0.95,274,,1687617870.0,False,False,False,False,False
93,14horss,LeopardsAteMyFace,/r/LeopardsAteMyFace/comments/14horss/putin_vows_to_crush_armed_mutiny_after/,dele7ed,Putin vows to crush 'armed mutiny' after mercenaries seize southern Russian city,6581,0.97,405,,1687599963.0,False,False,False,False,False
94,14hwnf8,Justrolledintotheshop,/r/Justrolledintotheshop/comments/14hwnf8/this_took_him_a_long_time_he_said/,Uckster,This took him a long time he said ,1892,0.95,299,,1687622726.0,False,False,False,False,False
95,14hu3yq,Tinder,/r/Tinder/comments/14hu3yq/she_has_a_big_personality/,Humbled_Swordsman,She has a BIG personality,2701,0.94,197,,1687616013.0,False,False,False,False,False
96,14hqfp2,discordVideos,/r/discordVideos/comments/14hqfp2/lets_say_hypothetically_this_is_a_title/,hugeantsinmypants,lets say hypothetically this is a title,7068,0.87,430,Haven't Payed Taxes Since 2005🤣🤣,1687605498.0,False,False,False,False,False
97,14homfg,ukraine,/r/ukraine/comments/14homfg/reaction_from_the_frontline_to_the_news_from/,TotalSpaceNut,Reaction from the frontline to the news from russia,35278,0.94,738,,1687599423.0,False,False,False,False,False
98,14hwo91,DC_Cinematic,/r/DC_Cinematic/comments/14hwo91/i_was_bored_heres_the_late_90s_justice_league/,farben_blas,"I was bored. Here's the late 90s Justice League cast, just for the laughs.",1844,0.95,278,,1687622781.0,False,False,False,False,False
99,14hu5fj,me_irlgbt,/r/me_irlgbt/comments/14hu5fj/me_irlgbt/,Serious-Ad-8168,me_irlgbt,2601,0.97,58,pan cakes :pan:,1687616130.0,False,False,False,False,False
100,14hxeuk,Genshin_Impact_Leaks,/r/Genshin_Impact_Leaks/comments/14hxeuk/swimming_is_not_limited_to_traveler/,ukrisreng,Swimming is not limited to Traveler,1660,0.96,292,,1687624718.0,False,False,False,False,False
