rank,id,subreddit,permalink,author,title,score,upvote_ratio,num_comments,author_flair_text,created_utc,over_18,edited,stickied,locked,is_original_content
1,14y7l9p,Damnthatsinteresting,/r/Damnthatsinteresting/comments/14y7l9p/how_to_fold_and_wear_the_great_kilt/,bigpeeler,"How to fold and wear ""the great kilt"". ",28395,0.96,685,,1689213760.0,False,False,False,False,False
2,14y91fl,BeAmazed,/r/BeAmazed/comments/14y91fl/baby_octopus/,Budwsf,Baby Octopus,15255,0.98,361,,1689217797.0,False,False,False,False,False
3,14y6cy5,MadeMeSmile,/r/MadeMeSmile/comments/14y6cy5/this_wholesome_surprise_proposal_during_family/,Rollo_Tomasi3000,This wholesome surprise proposal during family night,27086,0.95,439,,1689210338.0,False,False,False,False,False
4,14y6sgr,facepalm,/r/facepalm/comments/14y6sgr/if_margot_robbie_is_mid_than_weve_collectively/,almonakinvader,If Margot Robbie is mid than we’ve collectively lost the plot,24777,0.88,2852,,1689211566.0,False,False,False,False,False
5,14y6d9g,maybemaybemaybe,/r/maybemaybemaybe/comments/14y6d9g/maybe_maybe_maybe/,Firm_Matter7435,Maybe maybe maybe,17369,0.96,531,,1689210365.0,False,False,False,False,False
6,14y9qs8,PublicFreakout,/r/PublicFreakout/comments/14y9qs8/raging_family_gets_educated_on_the_law/,homantify19,Raging family gets educated on the law…,6234,0.97,664,,1689219865.0,False,False,False,False,False
7,14y57sv,mildlyinfuriating,/r/mildlyinfuriating/comments/14y57sv/our_neighbors_solution_to_a_newly_poured_driveway/,UnethicalTesticle,Our neighbors solution to a newly poured driveway on a one-lane road.,25691,0.94,1711,,1689206926.0,False,False,False,False,False
8,14y7hmw,wholesomememes,/r/wholesomememes/comments/14y7hmw/grandparents/,King_Pee,Grandparents >>>,10075,0.98,39,,1689213504.0,False,False,False,False,False
9,14ycbs4,memes,/r/memes/comments/14ycbs4/good_advice/,depressed-n-awkward,Good advice,4042,0.99,85,,1689227891.0,False,False,False,False,False
10,14y5kp5,WhitePeopleTwitter,/r/WhitePeopleTwitter/comments/14y5kp5/he_doesnt_look_like_that_superhero_i_keep_seeing/,ofdefrrgelator4097,He doesn't look like that superhero I keep seeing in maga posts.,17088,0.84,1875,,1689207959.0,False,False,False,False,False
11,14y2xu9,oddlysatisfying,/r/oddlysatisfying/comments/14y2xu9/painting_chicken_wire_black/,nikamats,Painting chicken wire black,43248,0.95,773,,1689201220.0,False,False,False,False,False
12,14y55h4,todayilearned,/r/todayilearned/comments/14y55h4/til_sperm_whales_clicks_are_powerful_enough_to/,See_Em,TIL: Sperm whales’ clicks are powerful enough to penetrate and vibrate your entire body to death.,9790,0.96,504,,1689206736.0,False,False,False,False,False
13,14y60st,JustGuysBeingDudes,/r/JustGuysBeingDudes/comments/14y60st/yeah/,born__addict,Yeah,9384,0.93,278,,1689209353.0,False,False,False,False,False
14,14y34wt,wallstreetbets,/r/wallstreetbets/comments/14y34wt/twitter_and_elon_musk_face_736_million_lawsuit/,hussmann,Twitter and Elon Musk face $736 million lawsuit for allegedly refusing severance for fired employees,11626,0.94,1060,,1689201679.0,False,False,False,False,False
15,14yboo0,PrequelMemes,/r/PrequelMemes/comments/14yboo0/twice_the_prequel_double_the_memes/,enidbyars,"Twice the Prequel, double the memes",2682,0.98,107,,1689225806.0,False,False,False,False,False
16,14y8axa,Hololive,/r/Hololive/comments/14y8axa/uh_oh/,px1099,Uh oh,4856,0.95,93,:Fauna:,1689215746.0,False,False,False,False,False
17,14y4qxn,politics,/r/politics/comments/14y4qxn/minnesotas_republican_party_is_totally_broke/,Major_Loser,Minnesota’s Republican Party Is Totally Broke,7068,0.97,594,,1689205646.0,False,False,False,False,False
18,14y55bg,therewasanattempt,/r/therewasanattempt/comments/14y55bg/to_do_nothing_wrong/,Wtf_happen,To do “nothing wrong”.,7903,0.94,939,,1689206724.0,False,False,False,False,False
19,14ybe9r,TrueOffMyChest,/r/TrueOffMyChest/comments/14ybe9r/i_just_caught_my_husband_trying_to_cheat_and/,Moondoggy213,I just caught my husband trying to cheat… and every single woman he tried with had my back,2310,0.97,100,,1689224895.0,False,1689228195.0,False,False,False
20,14yaafg,SipsTea,/r/SipsTea/comments/14yaafg/if_you_buy_her_a_margarita/,Alirue,If you buy her a margarita..,2808,0.94,146,,1689221472.0,False,False,False,False,False
21,14y363k,BlackPeopleTwitter,/r/BlackPeopleTwitter/comments/14y363k/ignoring_it_doesnt_work/,zzill6,Ignoring It Doesn't Work,8663,0.94,147,,1689201757.0,False,False,False,False,False
22,14xz9k8,nextfuckinglevel,/r/nextfuckinglevel/comments/14xz9k8/michael_jordan_was_so_good_even_the_other_teams/,firstpc13,Michael Jordan was so good even the other team's bench couldn't contain themselves,26365,0.96,1123,,1689192720.0,False,False,False,False,False
23,14y6zu1,shitposting,/r/shitposting/comments/14y6zu1/least_destructive_prank_heil_spez/,bah_a,Least destructive prank (Heil spez),5049,0.98,69,,1689212134.0,False,False,False,False,False
24,14y3qib,rareinsults,/r/rareinsults/comments/14y3qib/piercing_green_eyes/,sorox123,Piercing green eyes!,8826,0.96,259,,1689203098.0,False,False,False,False,False
25,14y3rp4,NatureIsFuckingLit,/r/NatureIsFuckingLit/comments/14y3rp4/5_day_old_turtling_with_140_year_old_mom/,therra123,🔥 5 day old turtling with 140 year old mom,7177,0.96,130,,1689203177.0,False,False,False,False,False
26,14y5cjw,HolUp,/r/HolUp/comments/14y5cjw/scoliosis/,No-ConspiracyTheory,Scoliosis,6387,0.96,483,,1689207311.0,False,False,False,False,False
27,14y8jzg,Unexpected,/r/Unexpected/comments/14y8jzg/harley_go_brrrddddtt/,whiteNigAa,Harley go brrrddddtt,3017,0.94,28,,1689216455.0,True,False,False,False,False
28,14y6vf2,starwarsmemes,/r/starwarsmemes/comments/14y6vf2/could_you_imagine/,kelly_xm,could you imagine,3970,0.97,42,,1689211806.0,False,False,False,False,False
29,14y7qn0,mildlyinfuriating,/r/mildlyinfuriating/comments/14y7qn0/a_girl_i_use_to_date_reinsuring_me_that_i_made/,lemonjuice707,A girl I use to date reinsuring me that I made the right choice,10387,0.95,664,,1689214178.0,False,False,False,False,False
30,14xzl88,DiWHY,/r/DiWHY/comments/14xzl88/how_did_she_come_up_with_this/,Gusfeldt__,How did she come up with this?,23121,0.88,978,,1689193465.0,False,False,False,False,False
31,14y4n89,OnePunchMan,/r/OnePunchMan/comments/14y4n89/chapter_188_english/,VibhavM,Chapter 188 [English],5389,0.97,530,Retired From day2day Moderation. Contact Other Mods.,1689205376.0,False,False,True,False,False
32,14y1f0o,LeopardsAteMyFace,/r/LeopardsAteMyFace/comments/14y1f0o/trump_voter_sues_fox_news_after_tucker_carlson/,Ok_Dimension_4707,Trump Voter Sues Fox News After Tucker Carlson Lies Ruined His Life,8130,0.96,404,,1689197667.0,False,False,False,False,False
33,14ya8yh,tippytaps,/r/tippytaps/comments/14ya8yh/grandma_is_pawsome/,ostervan,Grandma is pawsome,2122,0.96,34,,1689221356.0,False,False,False,False,False
34,14y2kze,pcmasterrace,/r/pcmasterrace/comments/14y2kze/why_the_speed_of_my_internet_is_literally_faster/,CeskyDunaj,"Why, the speed of my internet is literally faster than the speed of light",7448,0.95,317,":steam: Ryzen 7 3700x, rx580 4GB, 16GB, [!CAT POWERED!]",1689200388.0,False,False,False,False,False
35,14y0hdw,OldSchoolCool,/r/OldSchoolCool/comments/14y0hdw/for_people_of_a_certain_age_almost_nothing/,Jack_Sandwich,"For people of a certain age, almost nothing compares to the beautiful Mia Sara (1986)",9219,0.92,507,,1689195526.0,False,False,False,False,False
36,14y5d83,popculturechat,/r/popculturechat/comments/14y5d83/margot_robbie_for_a_barbie_photo_call/,Ok-Doubt6658,Margot Robbie for a Barbie photo call,4185,0.94,306,Excluded from this narrative,1689207358.0,False,False,False,False,False
37,14y3co3,meirl,/r/meirl/comments/14y3co3/meirl/,secretslut991,Meirl,6028,0.99,127,,1689202194.0,False,False,False,False,False
38,14y3v3q,formuladank,/r/formuladank/comments/14y3v3q/formula_daniel_but_its_cursed_credit_to/,colinhomelite,Formula Daniel but it's cursed (credit to WowChickenTenders for the original meme),5230,0.98,106,BWOAHHHHHHH ,1689203411.0,False,False,False,False,False
39,14xxo6a,WTF,/r/WTF/comments/14xxo6a/just_making_out/,Steevo_no_jackass,Just making out,16607,0.91,1065,,1689189025.0,False,False,False,False,False
40,14y49h7,AskReddit,/r/AskReddit/comments/14y49h7/who_immediately_comes_to_mind_when_you_hear_the/,Caseated_Omentum,"Who immediately comes to mind when you hear the words ""insanely hot""?",5113,0.87,6795,,1689204399.0,True,False,False,False,False
41,14y79kk,news,/r/news/comments/14y79kk/cosmetic_surgeon_who_streamed_procedures_on/,notunek,Cosmetic surgeon who streamed procedures on TikTok loses medical license,2864,0.98,191,,1689212873.0,False,False,False,False,False
42,14xykpe,movies,/r/movies/comments/14xykpe/hulus_prey_nominated_for_emmy_under_best/,Cramtastic,Hulu's Prey nominated for Emmy under Best Television Movie,10819,0.95,673,,1689191121.0,False,False,False,False,False
43,14yaqap,OnePiece,/r/OnePiece/comments/14yaqap/one_piece_chapter_1087/,Kirosh2,One Piece: Chapter 1087,1662,0.96,1178,Lookout,1689222845.0,False,1689222914.0,True,False,False
44,14y4lek,TikTokCringe,/r/TikTokCringe/comments/14y4lek/as_a_trans_guy_i_went_to_jupiter_to_get_more/,lavenpuffin,"As a trans guy, I went to Jupiter to get more stupider 👍",4499,0.88,203,,1689205245.0,False,False,False,False,False
45,14xx8mm,oddlyterrifying,/r/oddlyterrifying/comments/14xx8mm/partially_submerged_statue_of_shiva_the_destroyer/,lonely_dude__,Partially submerged statue of shiva the destroyer during the flash flood in uttrakhand.,20006,0.95,289,,1689188067.0,False,False,False,False,False
46,14yc4b8,witcher,/r/witcher/comments/14yc4b8/pic_of_netflix_yen_booba_to_keep_the_subreddit/,MoodyCynosure,Pic of netflix Yen booba to keep the subreddit NSFW. Also could you please spoil 3rd season i don’t wanna watch it.,1327,0.94,82,,1689227199.0,True,False,False,False,False
47,14y3ac4,gaming,/r/gaming/comments/14y3ac4/tf2s_summer_update_was_released_an_hour_ago_16/,HeckingDoofus,"TF2s summer update was released an hour ago, 16 years after release its reaching its peak player count",5337,0.97,316,,1689202033.0,False,False,False,False,False
48,14y80o8,comics,/r/comics/comments/14y80o8/oc_twisted_metal/,bonebag_comics,(OC) TWISTED METAL,2483,0.96,23,,1689214937.0,False,False,False,False,False
49,14y6d9y,PeterExplainsTheJoke,/r/PeterExplainsTheJoke/comments/14y6d9y/petah_what_is_that_box/,NeoKaiser317,"Petah, what is that box?",3318,0.96,160,,1689210365.0,False,False,False,False,False
50,14y972i,Overwatch,/r/Overwatch/comments/14y972i/hello_blizzard/,FellowDominican,Hello Blizzard!,2040,0.96,99,,1689218233.0,False,False,False,False,False
51,14xx4vc,cats,/r/cats/comments/14xx4vc/when_i_go_swimming_they_come_with_me/,sweeet_baby_girl,"When I go swimming, they come with me",14844,0.94,330,,1689187827.0,False,False,False,False,False
52,14y2n1k,CasualConversation,/r/CasualConversation/comments/14y2n1k/im_a_cashier_who_switched_from_sirmam_to_my_dear/,radvelvet-,"I'm a cashier who switched from ""sir/mam"" to ""my dear"" and I have noticed something wonderful about that phrase.",5182,0.93,684,,1689200516.0,False,False,False,False,False
53,14xw0gr,clevercomebacks,/r/clevercomebacks/comments/14xw0gr/guess_he_missed_the_foot_job_video/,OlivierLeighton,Guess he missed the foot job video 😏,41588,0.86,2008,,1689185222.0,False,False,False,False,False
54,14y73k0,Eldenring,/r/Eldenring/comments/14y73k0/little_ranni/,btsao1,Little Ranni,2624,0.97,41,,1689212416.0,False,False,False,False,False
55,14xvhon,worldnews,/r/worldnews/comments/14xvhon/italian_uproar_over_judges_10second_groping_rule/,I-Am-Uncreative,Italian uproar over judge's 10-second groping rule,19352,0.95,1898,,1689184057.0,False,False,False,False,False
56,14y9vxq,Tinder,/r/Tinder/comments/14y9vxq/datingsofun/,DENNIS-me-pls,#DatingSoFun,1716,0.96,284,,1689220295.0,False,False,False,False,False
57,14y02rb,shittymoviedetails,/r/shittymoviedetails/comments/14y02rb/in_spiderman_across_the_spiderverse_2023_youre/,RoadmenInc,In Spider-Man: Across The Spiderverse (2023)... You're telling me this is 5 inches?,10104,0.93,302,,1689194598.0,False,False,False,False,False
58,14y483w,CrazyFuckingVideos,/r/CrazyFuckingVideos/comments/14y483w/fucked_around_and_found_out_in_las_vegas/,Confusing-Carrot-69,Fucked Around and Found Out in Las Vegas,3934,0.94,193,,1689204302.0,True,False,False,False,False
59,14y3qrt,lotrmemes,/r/lotrmemes/comments/14y3qrt/i_mean_im_not_complaining_it_just_raises_some/,Thendrail,"I mean I'm not complaining, it just raises some questions about the Rohirrim society",4357,0.98,183,,1689203116.0,False,False,False,False,False
60,14y8s83,YouShouldKnow,/r/YouShouldKnow/comments/14y8s83/ysk_that_mother_birds_cannot_smell_or_sense_in/,Imaginary_Gary,"YSK that mother birds cannot ""smell"" or sense in any way that their babies have been touched by human hands. And will absolutely care for any you place back in their nest.",1857,0.96,59,,1689217116.0,False,False,False,False,False
61,14xwkyw,tumblr,/r/tumblr/comments/14xwkyw/its_wednesday_my_dudes/,nejicanspin,It's Wednesday my dudes,15299,0.97,385,,1689186567.0,False,False,False,False,False
62,14y2dd5,HonkaiStarRail,/r/HonkaiStarRail/comments/14y2dd5/anyone_else_notice_how_stelle_was_casually_on_her/,Khuelen,Anyone else notice how Stelle was casually on her phone in the middle of chaos?,5437,0.95,178,:DanHeng:,1689199877.0,False,False,False,False,False
63,14y619o,DestinyTheGame,/r/DestinyTheGame/comments/14y619o/the_guy_who_harassed_a_bungie_community_manger_w/,kristijan1001,The guy who harassed a Bungie community manger w threatening voicemails to him and his wife and sent pizza to their home address has to pay almost $500K and new precedents were set about harassment like this in the industry..,2752,0.95,348,"""We've woken the Hive""",1689209395.0,False,1689210428.0,False,False,False
64,14y19cl,LateStageCapitalism,/r/LateStageCapitalism/comments/14y19cl/milk_is_4_a_gallon_where_i_live/,haloarh,Milk is $4 a gallon where I live,5384,0.98,320,,1689197304.0,False,False,False,False,False
65,14y0kn6,technology,/r/technology/comments/14y0kn6/a_lawsuit_claims_google_has_been_secretly/,Lakerlion,A lawsuit claims Google has been 'secretly stealing everything ever created and shared on the internet by hundreds of millions of Americans' to train its AI,5778,0.94,576,,1689195721.0,False,False,False,False,False
66,14xwetp,dankmemes,/r/dankmemes/comments/14xwetp/somethings_wrong_i_can_feel_it/,JohnSmith---,Something's wrong I can feel it,18102,0.97,313,,1689186158.0,False,False,False,False,False
67,14y5psb,Fauxmoi,/r/Fauxmoi/comments/14y5psb/cillian_murphy_will_be_going_to_see_barbie_100/,747291086299,Cillian Murphy will “be going to see Barbie 100%” and “can’t wait to see it.”,2823,0.95,110,jeremy strong enthusiast ,1689208384.0,False,False,False,False,False
68,14y4p5m,marvelmemes,/r/marvelmemes/comments/14y4p5m/why_didnt_black_bolt_say_anything_to_wanda_is_he/,i-was-ja,Why didn't Black Bolt say anything to Wanda? Is he shy?,3491,0.97,101,Avengers,1689205518.0,False,False,False,False,False
69,14xw13a,me_irlgbt,/r/me_irlgbt/comments/14xw13a/she_irlgbt/,MahouShoujoDysphoria,She_irlgbt,18480,0.89,529,:gq:Environmental Storytelling Moderator💀,1689185263.0,False,False,False,False,False
70,14y1z6a,nba,/r/nba/comments/14y1z6a/michael_porter_jr_when_i_first_got_drafted_to/,JohnLemonnn69,"[Michael Porter Jr.] ""When I first got drafted to Denver and I saw him in training camp, I thought Mason Plumlee was better… I was like, 'Why does Joker start over Mason? This dude is fat.'""",4691,0.96,396,:mke-5: Bucks,1689198966.0,False,1689199015.0,False,False,False
71,14yawau,tf2,/r/tf2/comments/14yawau/tf2_moment_at_dallas_fan_expo_23/,The-Great-Memelord,Tf2 moment at Dallas Fan Expo 23’,1285,1.0,32,,1689223366.0,False,False,False,False,False
72,14y89dm,pics,/r/pics/comments/14y89dm/a_warning_from_john_oliver/,Sylpheed_Gamma,"A warning, from John Oliver.",1908,0.86,195,,1689215624.0,False,False,False,False,False
73,14y2c3x,PoliticalHumor,/r/PoliticalHumor/comments/14y2c3x/new_covid_side_effect/,17recon,New Covid Side Effect,4342,0.94,85,,1689199802.0,False,False,False,False,False
74,14yaq1x,teenagers,/r/teenagers/comments/14yaq1x/i_accidentally_ate_my_own_cum/,Educational-Road-453,I accidentally ate my own cum.,1306,0.86,598,15,1689222820.0,True,False,False,False,False
75,14xzosf,technicallythetruth,/r/technicallythetruth/comments/14xzosf/you_caught_me_i_like_to_break_a_mental_sweat_too/,TasiaLucero,"“You caught me, I like to break a mental sweat too.”",7601,0.98,100,,1689193693.0,False,False,False,False,False
76,14y6m1z,MapPorn,/r/MapPorn/comments/14y6m1z/countries_which_can_enter_the_us_whitout_visa/,Adventurous-Snow-816,Countries which can enter the US whitout visa,2328,0.95,379,,1689211076.0,False,False,False,False,False
77,14y3srv,tifu,/r/tifu/comments/14y3srv/tifu_by_making_my_bully_coworker_cry/,Flyslayerr,TIFU by making my bully coworker cry,3530,0.96,451,,1689203251.0,False,False,False,False,False
78,14y1exq,ThatsInsane,/r/ThatsInsane/comments/14y1exq/leg_sweep/,ServisSuis,Leg Sweep!,4889,0.97,170,,1689197661.0,True,False,False,False,False
79,14xwj5k,antiwork,/r/antiwork/comments/14xwj5k/my_autistic_friend_got_hired_onto_a_lumber_mill/,Zen_Uru_,"My autistic friend got hired onto a lumber mill as a wood wrapper, this is his thighs after one day of work",11440,0.92,957,,1689186445.0,True,False,False,False,False
80,14y7b6j,confusing_perspective,/r/confusing_perspective/comments/14y7b6j/invisible_chair_leg/,Delightful-Dickhead,Invisible chair leg,1983,0.96,39,,1689213002.0,False,False,False,False,False
81,14y1ylv,relationship_advice,/r/relationship_advice/comments/14y1ylv/update_last_year_boyfriend_33m_quitted_his_job/,ThrowRA_blackberry1,"*Update* Last year, boyfriend (33m) quitted his job without telling me and now he refused to look for another job. I’m (31f) tired of paying for everything",4300,0.94,305,,1689198933.0,False,False,False,False,False
82,14y0stm,community,/r/community/comments/14y0stm/i_never_took_the_time_to_read_these_in_full_and/,Silkysylph,I never took the time to read these in full and that was a mistake,4862,0.96,274,,1689196239.0,False,False,False,False,False
83,14y7sgh,doodoofard,/r/doodoofard/comments/14y7sgh/tyler_the_creator/,ramen_up_my_nut,Tyler the Creator,1824,0.93,165,,1689214317.0,True,False,False,False,False
84,14y0fiu,Spiderman,/r/Spiderman/comments/14y0fiu/i_laughed_too_hard_reading_this/,Zlatanisthegoa,I laughed too hard reading this,5408,0.92,174,,1689195403.0,False,False,False,False,False
85,14y7ohr,WhitePeopleTwitter,/r/WhitePeopleTwitter/comments/14y7ohr/the_cons_are_coming_for_the_kids_and_arent_hiding/,EmptySpaceForAHeart,The Cons are coming for the kids and aren’t hiding it anymore.,4147,0.99,223,,1689213998.0,False,False,False,False,False
86,14ya5i9,arknights,/r/arknights/comments/14ya5i9/heart_attack_27/,ghihin28,(*~*) Heart Attack 27!!!,1209,0.98,24,,1689221068.0,False,False,False,False,True
87,14xxl5t,OneOrangeBraincell,/r/OneOrangeBraincell/comments/14xxl5t/smol_uneducated_bean/,Cautious-or-paranoid,smol uneducated bean,8064,0.97,132,,1689188838.0,False,False,False,False,False
88,14y89dl,FunnyAnimals,/r/FunnyAnimals/comments/14y89dl/he_wasnt_prepared_for_that/,m3nation007,He wasn't prepared for that,1586,0.98,33,,1689215624.0,False,False,False,False,False
89,14xvj7t,AdviceAnimals,/r/AdviceAnimals/comments/14xvj7t/i_was_always_told_labor_was_one_of_the_highest/,DoctorBa11s,I was always told labor was one of the highest costs of running a business.,9932,0.94,576,,1689184157.0,False,False,False,False,False
90,14y0u7o,distressingmemes,/r/distressingmemes/comments/14y0u7o/mfs_really_just_decapitated_people_and_went_noted/,Y4O1_3rdacc,"mfs really just decapitated people and went ""noted""",4838,0.96,132,,1689196324.0,False,False,False,False,False
91,14y4ys2,sadcringe,/r/sadcringe/comments/14y4ys2/message_sent_to_me_via_reddit_back_when_i_was_a/,ApricotPal,Message sent to me via Reddit back when I was a minor and made tiktoks,2565,0.98,154,,1689206243.0,False,False,False,False,False
92,14y4d5c,insanepeoplefacebook,/r/insanepeoplefacebook/comments/14y4d5c/flag_of_losers/,secretslut991,Flag of losers,2748,0.98,43,,1689204660.0,False,False,False,False,False
93,14y1f9r,whenthe,/r/whenthe/comments/14y1f9r/our_bad_yall/,UrNotBetterThanMe,our bad yall,4760,0.97,144,dm me pictures i can send to my mom,1689197685.0,False,False,False,False,False
94,14y3mzj,unpopularopinion,/r/unpopularopinion/comments/14y3mzj/stop_telling_people_just_leave_when_theyre/,RazberryJellyfish,"Stop telling people ""just leave"" when they're unhappy in their marriage.",3076,0.88,479,,1689202877.0,False,False,False,False,False
95,14xwj7r,awesome,/r/awesome/comments/14xwj7r/these_sand_curtains/,WhersucSugarplum,These sand curtains,10544,0.94,199,,1689186449.0,False,False,False,False,False
96,14y262a,691,/r/691/comments/14y262a/horseshoe_theorule/,Prestigious-Bug-3586,Horseshoe theorule,3881,0.93,78,,1689199401.0,False,False,False,False,False
97,14xuny8,SelfAwarewolves,/r/SelfAwarewolves/comments/14xuny8/bruh/,tiptiptoppy,Bruh,10798,0.96,389,,1689182163.0,False,False,False,False,False
98,14y4xsv,Damnthatsinteresting,/r/Damnthatsinteresting/comments/14y4xsv/eerie_tornado_warning_sirens_in_downtown_chicago/,chiboulevards,Eerie tornado warning sirens in downtown Chicago,6683,0.94,636,,1689206168.0,False,False,False,False,False
99,14y90xc,Satisfyingasfuck,/r/Satisfyingasfuck/comments/14y90xc/he_pulled_a_sneaky_one_on_the_weather_forecast/,darksbrunch,He pulled a sneaky one on the weather forecast,1346,0.99,28,,1689217755.0,False,False,False,False,False
100,14y3677,TIHI,/r/TIHI/comments/14y3677/thanks_i_hate_it_when_the_desk_clerk_cracks_wise/,12345-12345-,"Thanks, I hate it when the Desk Clerk cracks wise.",3118,0.93,87,,1689201764.0,False,False,False,False,False
