rank,id,subreddit,permalink,author,title,score,upvote_ratio,num_comments,author_flair_text,created_utc,over_18,edited,stickied,locked,is_original_content
1,14m68p7,WhitePeopleTwitter,/r/WhitePeopleTwitter/comments/14m68p7/i_do_not_understand_the_endgame/,ozmune,I do not understand the endgame.,11562,0.97,374,,1688048366.0,False,False,False,False,False
2,14m4x36,facepalm,/r/facepalm/comments/14m4x36/dumdum_spotted/,anantzzz,Dum-dum spotted,19506,0.97,1490,,1688044947.0,False,False,False,False,False
3,14m3hwh,MadeMeSmile,/r/MadeMeSmile/comments/14m3hwh/relax/,ff-dvl,Relax ,20915,0.96,332,,1688041030.0,False,False,False,False,False
4,14m4uxk,oddlysatisfying,/r/oddlysatisfying/comments/14m4uxk/worker_painting_a_wooden_toy/,yourSAS,Worker painting a wooden toy,12302,0.93,424,,1688044797.0,False,False,False,False,False
5,14m37ix,politics,/r/politics/comments/14m37ix/ron_desantis_the_worst_candidate_ive_ever/,BelleAriel,"Ron DeSantis the ""worst candidate I've ever seen""—Former GOP strategist",18261,0.93,1373,,1688040200.0,False,False,False,False,False
6,14m61u8,news,/r/news/comments/14m61u8/supreme_court_rules_against_affirmative_action/,chewymouse,Supreme Court Rules Against Affirmative Action,7686,0.96,3764,,1688047885.0,False,False,False,False,False
7,14m2vbp,PublicFreakout,/r/PublicFreakout/comments/14m2vbp/a_passenger_airdropped_a_bomb_threat_to_everyone/,Bihema,A passenger airdropped a bomb threat to everyone on the plane.,11789,0.96,1581,,1688039164.0,False,False,False,False,False
8,14m4nxo,lotrmemes,/r/lotrmemes/comments/14m4nxo/coincidence_i_think_not/,Alternative_Serve368,Coincidence i think not,6901,0.92,127,,1688044263.0,False,False,False,False,False
9,14m2ovv,cursedcomments,/r/cursedcomments/comments/14m2ovv/cursed_honeybee_sting/,Mr_BirchrWasntTaken,Cursed_honeybee sting,17566,0.95,174,,1688038618.0,False,False,False,False,False
10,14m3hjj,marvelmemes,/r/marvelmemes/comments/14m3hjj/sounds_like_a_good_idea/,UnpleasantRhinoceros,Sounds like a good idea,8850,0.97,58,Avengers,1688041001.0,False,False,False,False,False
11,14m29r1,comics,/r/comics/comments/14m29r1/freedom/,Pizzacakecomic,Freedom!,25344,0.73,2023,PizzaCake,1688037293.0,False,False,False,False,True
12,14m5hy3,tumblr,/r/tumblr/comments/14m5hy3/young_ben_shapiro_vs_elon_musk_death_battle/,Sonic_the_hedgedog,Young Ben Shapiro vs. Elon Musk Death Battle,5470,0.95,161,,1688046469.0,False,False,False,False,False
13,14m06lc,todayilearned,/r/todayilearned/comments/14m06lc/til_according_to_international_space_law_space_is/,dustofoblivion123,"TIL according to international space law, space is defined as common heritage of humanity, which makes territorial claims in space prohibited. The main purposes of this law are to prevent colonial claims and militarization of space.",21071,0.96,1139,,1688030274.0,False,False,False,False,False
14,14m0o19,BrandNewSentence,/r/BrandNewSentence/comments/14m0o19/youtuber_denies_grooming_allegations_in_lengthy/,mitcheg3k,Youtuber denies grooming allegations in lengthy ukelele video,21497,0.95,1158,,1688031930.0,False,False,False,False,False
15,14m3kuj,OldSchoolCool,/r/OldSchoolCool/comments/14m3kuj/four_typical_british_flatmates_1982/,id0ru,"Four typical British flatmates, 1982",6540,0.96,688,,1688041256.0,False,False,False,False,False
16,14m57b7,therewasanattempt,/r/therewasanattempt/comments/14m57b7/to_heckle_a_comic/,kazumicortez,to heckle a comic,4621,0.95,179,,1688045679.0,False,False,False,False,False
17,14m02nz,PrequelMemes,/r/PrequelMemes/comments/14m02nz/podracing/,QuantumDonuts257,Podracing,14110,0.96,212,Rebel Legion,1688029895.0,False,False,False,False,False
18,14m3joz,mildlyinfuriating,/r/mildlyinfuriating/comments/14m3joz/i_cant_finnish_half_of_my_large_5_caramel/,Kwaakku,"I can't finnish half of my large 5€ caramel frappuchino, since these cardboard straws just break in use.",6834,0.8,2041,,1688041175.0,False,False,False,False,False
19,14m41f6,IASIP,/r/IASIP/comments/14m41f6/i_dont_know_this_i_do_not_know_this_one/,awesomedan24,I don't know this. I do not know this one...,4892,0.97,108,,1688042552.0,False,False,False,False,False
20,14m2kji,nextfuckinglevel,/r/nextfuckinglevel/comments/14m2kji/any_archery_lovers/,singhsnehal,Any archery lovers?,7643,0.84,612,,1688038244.0,False,False,False,False,False
21,14m3axm,funny,/r/funny/comments/14m3axm/and_just_like_that_a_serial_killer_is_born/,Competitive-Ad1183,And just like that a serial killer is born,5554,0.93,194,,1688040464.0,False,False,False,False,False
22,14m0y4d,antiwork,/r/antiwork/comments/14m0y4d/nearly_1_in_5_workers_are_loud_quitting_at_their/,ThrowsiesAway4Life,"Nearly 1 in 5 workers are 'loud quitting' at their jobs, a new Gallup poll says — and it's way more extreme than 'quiet quitting'",8157,0.95,812,,1688032911.0,False,False,False,False,False
23,14m4nm5,MadeMeSmile,/r/MadeMeSmile/comments/14m4nm5/father_with_dementia_remembers_daughter_on_her/,UnitedLab6476,Father With Dementia Remembers Daughter On Her Wedding Day,11120,0.97,451,,1688044240.0,False,False,False,False,False
24,14lyi1u,worldnews,/r/worldnews/comments/14lyi1u/ukrainian_forces_advance_1300_metres_on_berdiansk/,MagnificentCat,"Ukrainian forces advance 1,300 metres on Berdiansk front – Ukrainian Deputy Defence Minister",16919,0.93,857,,1688024342.0,False,False,False,False,False
25,14m0c7s,LateStageCapitalism,/r/LateStageCapitalism/comments/14m0c7s/dont_know_if_this_was_posted_already/,jolurove,Don’t know if this was posted already,8462,0.96,449,,1688030824.0,False,False,False,False,False
26,14lys7o,BeAmazed,/r/BeAmazed/comments/14lys7o/craftsmen_have_created_the_lowest_car_in_the_world/,steady_as_a_rock,Craftsmen have created the lowest car in the world.,25175,0.88,1072,,1688025392.0,False,False,False,False,False
27,14m55ih,TikTokCringe,/r/TikTokCringe/comments/14m55ih/on_bathrooms/,thatguy9684736255,On bathrooms,3614,0.95,154,,1688045549.0,False,False,False,False,False
28,14m2gcu,BlackPeopleTwitter,/r/BlackPeopleTwitter/comments/14m2gcu/lion_was_like_its_not_what_it_looks_like/,trancatt,Lion was like “it’s not what it looks like” 😂,5376,0.95,108,,1688037878.0,False,False,False,False,False
29,14lyzhp,clevercomebacks,/r/clevercomebacks/comments/14lyzhp/hes_really_not_wrong_though/,Stoner4s3,He's really not wrong though,14085,0.95,269,,1688026098.0,False,False,False,False,False
30,14m394p,freefromwork,/r/freefromwork/comments/14m394p/biden_is_gonna_raise_my_taxes/,MarisaNeill,BiDeN iS gOnNa RaIsE mY tAxEs,4365,0.95,83,,1688040324.0,False,False,False,False,False
31,14m61ci,WTF,/r/WTF/comments/14m61ci/filed_under_not_my_job/,l0p29p0tdg,Filed under Not My Job.,2855,0.97,94,,1688047851.0,False,False,False,False,False
32,14m2rya,facepalm,/r/facepalm/comments/14m2rya/perfect_logic/,WonderfulSearche,Perfect logic,19064,0.9,2014,,1688038871.0,False,False,False,False,False
33,14ly8hf,SipsTea,/r/SipsTea/comments/14ly8hf/its_pretty_decent_tbh/,UnconfirmedCatholic,It's pretty decent tbh.,18382,0.96,439,,1688023374.0,False,False,False,False,False
34,14lylvw,memes,/r/memes/comments/14lylvw/medieval_disease/,Lightning-11,Medieval disease,23549,0.92,218,Medieval Meme Lord,1688024731.0,False,False,False,False,False
35,14lxfbe,wholesomememes,/r/wholesomememes/comments/14lxfbe/how_wholesome/,easilyBind59,How wholesome.,25387,0.93,471,,1688020588.0,False,False,False,False,False
36,14m1jsa,CrappyDesign,/r/CrappyDesign/comments/14m1jsa/architect_so_how_many_windows_we_thinking_client/,Any-Classic-5733,Architect: So how many windows we thinking? Client: Yes,5130,0.96,390,,1688034952.0,False,False,False,False,False
37,14m6f1m,tifu,/r/tifu/comments/14m6f1m/tifu_by_cracking_a_joke_at_my_wifes_doctor/,I-Am-Disturbed,TIFU by cracking a joke at my wife’s doctor appointment.,2435,0.92,78,,1688048801.0,True,False,False,False,False
38,14m291n,rareinsults,/r/rareinsults/comments/14m291n/battle_of_cultures/,MsSeraphim,battle of cultures,4550,0.96,27,,1688037225.0,False,False,False,False,False
39,14m0qz6,news,/r/news/comments/14m0qz6/bill_cosby_sued_by_9_more_women_in_nevada_for/,antihostile,Bill Cosby sued by 9 more women in Nevada for alleged decades-old sexual assaults,17735,0.95,736,,1688032219.0,False,False,False,False,False
40,14m02oj,WinStupidPrizes,/r/WinStupidPrizes/comments/14m02oj/guy_tries_to_assualt_bus_driver/,flunghigh,guy tries to assualt bus driver,7263,0.93,537,,1688029896.0,False,False,False,False,False
41,14lze63,shitposting,/r/shitposting/comments/14lze63/glory_to_spez/,RandomDude420-_-,Glory to spez,15959,0.89,101,,1688027558.0,False,False,False,False,False
42,14m1qtj,Grimdank,/r/Grimdank/comments/14m1qtj/i_didnt_say_anything_about_eldar_plotlines/,WantToKnowIfISurvive,I didn't say anything about Eldar plotlines.,4858,0.96,228,,1688035616.0,False,False,False,False,False
43,14m36vx,popculturechat,/r/popculturechat/comments/14m36vx/angelina_jolie_and_her_son_maddox/,Ok-Doubt6658,"Angelina Jolie and her son, Maddox.",3608,0.91,226,,1688040151.0,False,False,False,False,False
44,14m5ckv,movies,/r/movies/comments/14m5ckv/its_always_sunny_in_philadelphia_star_charlie/,Chemical-Ad-2694,‘It’s Always Sunny in Philadelphia’ Star Charlie Day’s Directorial Debut ‘Fool’s Paradise’ Snapped Up by Signature Entertainment (EXCLUSIVE),2538,0.92,350,,1688046067.0,False,False,False,False,False
45,14m24bh,NatureIsFuckingLit,/r/NatureIsFuckingLit/comments/14m24bh/ants_carrying_a_giant_spider_away/,VeryDrunkFish,🔥Ants carrying a giant spider away,4107,0.95,154,,1688036798.0,False,False,False,False,False
46,14m117e,Damnthatsinteresting,/r/Damnthatsinteresting/comments/14m117e/a_rare_video_of_shark_giving_birth_pregnant/,yourSAS,A rare video of shark giving birth. Pregnant sharks often go to shallow waters for giving birth and safety from large predators,5311,0.98,85,,1688033186.0,True,False,False,False,False
47,14m5zil,CrazyFuckingVideos,/r/CrazyFuckingVideos/comments/14m5zil/carnival_ride_plunges_50_feet_to_the_ground_in/,LuNoZzy,Carnival ride plunges 50 feet to the ground in India,2239,0.96,208,,1688047726.0,True,False,False,False,False
48,14m0cmd,anime_irl,/r/anime_irl/comments/14m0cmd/anime_irl/,History_DoT,anime_irl,5919,0.93,170,,1688030863.0,False,False,False,False,False
49,14m07tz,CasualUK,/r/CasualUK/comments/14m07tz/wtf_the_rental_agent_said_this_is_a_great/,No_Yak_3436,WTF? The rental agent said this is a great bathroom. WTF is wrong with these morons? I’m average height by the way.,5440,0.96,562,,1688030399.0,False,False,False,False,False
50,14lzhsh,WhitePeopleTwitter,/r/WhitePeopleTwitter/comments/14lzhsh/this_is_getting_out_of_control/,thatguy9684736255,This is getting out of control,18697,0.94,1354,,1688027911.0,False,False,False,False,False
51,14m40rj,atheism,/r/atheism/comments/14m40rj/ffrf_demands_colorado_school_district_ban_the/,mepper,"FFRF demands Colorado school district ban the Bible after Christian Nationalist group got the district to ban books for sex and violence. ""Religious zealots can’t scour books looking for sexual references or content to offend them...then say the obscenity in the Bible must be judged differently""",2454,0.97,56,agnostic atheist,1688042500.0,False,False,False,False,False
52,14m1hpj,whenthe,/r/whenthe/comments/14m1hpj/me_staring_at_the_screen_and_doing_anything_other/,SirShadyVI,me staring at the screen and doing anything other than opening the game,4042,0.98,67,local touhou poster (moriya shrine's #1 conspirator),1688034755.0,False,False,False,False,False
53,14m6ax8,LeopardsAteMyFace,/r/LeopardsAteMyFace/comments/14m6ax8/ron_desantis_vetoes_popular_criminal_justice_bill/,orijing,Ron DeSantis vetoes popular criminal justice bill sponsored by Republican house member who endorsed DeSantis for president,1799,0.97,99,,1688048514.0,False,False,False,False,False
54,14lz448,dankmemes,/r/dankmemes/comments/14lz448/silent_anger/,Positive_Day8842,Silent anger*,7267,0.97,192,,1688026557.0,False,False,False,False,False
55,14m3pwe,Hololive,/r/Hololive/comments/14m3pwe/i_worked_on_the_hololive_summer_2023_teaser/,kanauru,I worked on the Hololive Summer 2023 Teaser!,2569,0.96,40,,1688041664.0,False,False,False,False,False
56,14lxjm7,me_irlgbt,/r/me_irlgbt/comments/14lxjm7/meirlgbt/,Lux-xxv,Me🐷irlgbt,9781,0.9,295,YEEN DEGENERATE :demiro::lesbian::trans::degen:,1688021005.0,False,False,False,False,False
57,14lxzc3,ProgrammerHumor,/r/ProgrammerHumor/comments/14lxzc3/pythonandturtle/,sunrise_apps,pythonAndTurtle,7779,0.97,154,:sw::ru::dart:,1688022497.0,False,False,False,False,False
58,14m4xty,cursedcomments,/r/cursedcomments/comments/14m4xty/cursed_date/,Hammered-snail,Cursed_date,5309,0.99,83,,1688045003.0,False,False,False,False,False
59,14m5ano,Steam,/r/Steam/comments/14m5ano/valve_is_banning_games_with_ai_generated_assets/,tanku2222,Valve is banning games with AI generated assets.,2017,0.9,273,,1688045924.0,False,False,False,False,False
60,14lyr31,2westerneurope4u,/r/2westerneurope4u/comments/14lyr31/yes/,Euphoric_Ad_69,Yes,6532,0.94,882,:European: European,1688025268.0,False,False,False,False,False
61,14lzhdk,Tinder,/r/Tinder/comments/14lzhdk/first_time_ive_been_turned_down_due_to_my_height/,One_Telephone_9227,"First time I’ve been turned down due to my height, and I won’t lie it doesn’t feel good lol",5282,0.95,1244,,1688027870.0,False,False,False,False,False
62,14m0bds,MapPorn,/r/MapPorn/comments/14m0bds/breakup_of_yugoslavia_benefited_or_harmed_your/,quindiassomigli,Breakup of Yugoslavia: “Benefited or Harmed your country”? [Poll],4369,0.94,575,,1688030733.0,False,False,False,False,False
63,14m0wk4,UkraineWarVideoReport,/r/UkraineWarVideoReport/comments/14m0wk4/after_suffering_enormous_casualties_in_the/,Legalized_NSFW_Today,"After suffering enormous casualties in the battlefield, several Russian soldiers from the elite ""Storm Z"" unit released a video in which they declared their refusal to participate in combat missions.",3832,0.96,415,,1688032786.0,False,False,False,False,False
64,14m6jhb,PoliticalCompassMemes,/r/PoliticalCompassMemes/comments/14m6jhb/compass_reacts_to_the_end_of_affirmative_action/,ThePurpleNavi,Compass reacts to the end of affirmative action,1601,0.92,394,:right: - Right,1688049099.0,False,False,False,False,False
65,14m01on,technicallythetruth,/r/technicallythetruth/comments/14m01on/who_would_have_thought/,Xiaret,Who would have thought ?,4379,0.98,38,,1688029807.0,False,False,False,False,False
66,14lv92l,Satisfyingasfuck,/r/Satisfyingasfuck/comments/14lv92l/mans_been_waiting_his_whole_life_for_this_moment/,trashyoutdoors,Mans been waiting his whole life for this moment,14422,0.94,337,,1688013580.0,False,False,False,False,False
67,14m3bem,nextfuckinglevel,/r/nextfuckinglevel/comments/14m3bem/girl_climbing_the_wall_like_a_spider/,Administrative-Day76,Girl climbing the wall like a spider,5407,0.91,664,,1688040508.0,False,False,False,False,False
68,14m3nfw,cats,/r/cats/comments/14m3nfw/personal_space/,Shalayyy1990,Personal space?,2213,0.98,167,,1688041463.0,False,False,False,False,False
69,14luyuu,HolUp,/r/HolUp/comments/14luyuu/body_mass_index_begs_to_differ/,Available-Deer1723,Body mass index begs to differ💀,18417,0.95,196,,1688012688.0,False,False,False,False,False
70,14m56b3,gifs,/r/gifs/comments/14m56b3/john_oliver_teabagging_uspez/,Juntayuy,John Oliver teabagging u/spez,1817,0.74,132,,1688045606.0,True,False,False,False,False
71,14m3gso,Gunners,/r/Gunners/comments/14m3gso/david_ornstein_ethan_nwaneri_has_committed_future/,ZCast9,David Ornstein: 🚨 Ethan Nwaneri has committed future to Arsenal by signing scholarship terms + agreeing pro deal when turns 17. Major interest from other clubs but 16yo never wanted to leave - lifelong #AFC fan & Islington born/bred. Huge boost for Gunners @TheAthleticFC,2209,0.94,248,:7: David Rocastle,1688040944.0,False,False,False,False,False
72,14lupq9,baseball,/r/baseball/comments/14lupq9/domingo_germán_has_thrown_the_24th_perfect_game/,BaseballBot,Domingo Germán has thrown the 24th Perfect Game in MLB history!,15486,0.92,2748,Umpire :ump:,1688011909.0,False,1688012316.0,False,False,False
73,14m2xuh,2visegrad4you,/r/2visegrad4you/comments/14m2xuh/ok/,Yo_Mama_Disstrack,Ok,2438,0.9,216,:flag_pl: Winged Pole dancer,1688039388.0,False,False,False,False,False
74,14lypiw,PixelArt,/r/PixelArt/comments/14lypiw/goth_girl/,kisk123,Goth girl,5175,0.95,89,,1688025100.0,False,False,False,False,True
75,14m23kv,Genshin_Impact,/r/Genshin_Impact/comments/14m23kv/hu_tao_by_my_12_year_old_sister/,BolshoyBorz,Hu Tao by my 12 year old sister.,2794,0.95,61,,1688036737.0,False,False,False,False,False
76,14m4ggf,ask,/r/ask/comments/14m4ggf/what_is_something_you_can_say_im_with_the_boomers/,AnitaVodkasoda,"What is something you can say ""I'm with the boomers on this one"" about?",1891,0.89,1799,,1688043713.0,False,False,False,False,False
77,14m2r3l,Superstonk,/r/Superstonk/comments/14m2r3l/research_journal_may_2023_on_turning_the_buy/,throwawaylurker012,"RESEARCH JOURNAL (May 2023) on turning the buy button off: ""GameStopped: How Robinhood’s GameStop Trading Halt Reveals the Complexities of Retail Investor Protection""",2705,0.96,94,Tendietown is the new Flavortown & DRS Is my Guy Fieri,1688038802.0,False,1688051051.0,False,False,False
78,14m2ief,DiWHY,/r/DiWHY/comments/14m2ief/lowest_car_in_the_world/,edit12,Lowest car in the world..,2507,0.89,163,,1688038063.0,False,False,False,False,False
79,14ltvq4,AnimalsBeingBros,/r/AnimalsBeingBros/comments/14ltvq4/good_boy_is_a_lifeguard/,westcoastcdn19,Good boy is a lifeguard ,17962,0.96,225,,1688009435.0,False,False,False,False,False
80,14lz107,LifeProTips,/r/LifeProTips/comments/14lz107/lpt_never_ever_give_up_on_cooking_because_your/,EngLitIsLit,"LPT: Never, ever give up on cooking because your first try was bad. You will always eventually find that one key point commonly skipped that will turn your dish into perfection.",4683,0.92,277,,1688026249.0,False,False,False,False,False
81,14lz3u4,discordVideos,/r/discordVideos/comments/14lz3u4/job_slander/,CelebrationWild7276,Job Slander ,5362,0.93,75,,1688026530.0,False,False,False,False,False
82,14m51xa,funny,/r/funny/comments/14m51xa/big_daddy_in_god_of_war/,Ishnuporah,Big Daddy in God of War,3243,0.95,72,eli_handle_b․wav,1688045301.0,False,False,False,False,False
83,14m6iwp,nba,/r/nba/comments/14m6iwp/stein_it_has_reached_the_point_when_i_speak_to/,lopea182,[Stein] It has reached the point when I speak to various teams that it would be a legitimate leaguewide surprise now if Fred VanVleet and Dillon Brooks don’t strike verbal agreements to join the Houston Rockets by Friday night.,1341,0.97,491,:mia-2: Heat,1688049062.0,False,False,False,False,False
84,14m58i0,BlackPeopleTwitter,/r/BlackPeopleTwitter/comments/14m58i0/eat_the_rich_including_the_ones_that_look_like_us/,NYstate,"Eat the rich, including the ones that look like us",3126,0.97,242,☑️,1688045763.0,False,False,False,False,False
85,14lt4wl,ContagiousLaughter,/r/ContagiousLaughter/comments/14lt4wl/very_close/,LaughBakery,Very close,29512,0.94,314,,1688007287.0,False,False,False,False,False
86,14m1oj3,DeepRockGalactic,/r/DeepRockGalactic/comments/14m1oj3/watch_me_fly/,Possum_Soul,Watch me fly!,2653,0.97,96,For Karl!:rocknstone:,1688035400.0,False,False,False,False,False
87,14m3bw9,Rabbits,/r/Rabbits/comments/14m3bw9/for_over_two_years_ive_been_making_a_game_out_of/,_pank0,"For over two years, I’ve been making a game out of a love for bunnies! It’s going to be released in September this year!",2008,0.97,151,I :h: bunnies,1688040550.0,False,False,False,False,False
88,14m1a8w,WhatsWrongWithYourDog,/r/WhatsWrongWithYourDog/comments/14m1a8w/gf_said_my_dog_is_ugly/,egwxas,gf said my dog is ugly,2859,0.94,468,,1688034051.0,False,False,False,False,False
89,14lyn78,pokemon,/r/pokemon/comments/14lyn78/i_cant_be_the_only_one_who_sees_it/,Affectionate-Pop2353,i cant be the only one who sees it,4768,0.95,134,,1688024866.0,False,False,False,False,False
90,14m4ikk,pcgaming,/r/pcgaming/comments/14m4ikk/according_to_a_recent_post_valve_is_not_willing/,Turbostrider27,"According to a recent post, Valve is not willing to publish games with AI generated content anymore",1671,0.94,287,,1688043859.0,False,False,False,False,False
91,14m0box,sports,/r/sports/comments/14m0box/domingo_germán_has_thrown_the_24th_perfect_game/,EatSleepJeep,Domingo Germán has thrown the 24th Perfect Game in MLB history.,3308,0.94,229,:NHLnor: Minnesota North Stars,1688030770.0,False,False,False,False,False
92,14m3a3j,DogAdvice,/r/DogAdvice/comments/14m3a3j/found_a_newborn_dog_what_do_i_do/,ali_in_reallife,Found a newborn dog what do i do,2000,0.9,113,,1688040396.0,False,False,False,True,False
93,14lyrr1,therewasanattempt,/r/therewasanattempt/comments/14lyrr1/to_understand_taxes/,whitegirladdict,To understand taxes ,12470,0.95,1230,,1688025344.0,False,False,False,False,False
94,14m2qpq,ChatGPT,/r/ChatGPT/comments/14m2qpq/lets_drink_for_legends_and_ai/,adesigne,Let's drink for legends and AI,2171,0.96,61,,1688038769.0,False,False,False,False,False
95,14m0ich,starwarsmemes,/r/starwarsmemes/comments/14m0ich/what_would_happen_next_in_this_timeline/,Salami__Tsunami,What would happen next in this timeline?,3253,0.98,29,,1688031386.0,False,False,False,False,False
96,14lxn06,chessbeginners,/r/chessbeginners/comments/14lxn06/that_sounds_like_a_reason_to_me/,Stupid-Username420,That sounds like a reason to me,6214,0.96,155,,1688021333.0,False,False,False,False,False
97,14m05ca,ThatsInsane,/r/ThatsInsane/comments/14m05ca/komodo_dragon_swallows_an_entire_goat/,Shrewd_Alena69,Komodo dragon swallows an entire goat,3380,0.93,353,,1688030148.0,True,False,False,False,False
98,14m66ir,trees,/r/trees/comments/14m66ir/it_is_what_it_is/,jake1080,It is what it is,1311,0.99,51,,1688048210.0,False,False,False,False,False
99,14lzdd2,197,/r/197/comments/14lzdd2/beef_patty/,bangputis,Beef patty,4063,0.96,62,,1688027478.0,False,False,False,False,False
100,14m345i,MadeMeSmile,/r/MadeMeSmile/comments/14m345i/this_cops_reaction_to_being_dispatched_on_this/,VariousBasket125,This cops reaction to being dispatched on this 911 call ,10847,0.97,247,,1688039943.0,False,False,False,False,False
