rank,id,subreddit,permalink,author,title,score,upvote_ratio,num_comments,author_flair_text,created_utc,over_18,edited,stickied,locked,is_original_content
1,14nb5qs,apolloapp,/r/apolloapp/comments/14nb5qs/today_is_apollo_for_reddits_last_day_and_i_just/,iamthatis,"Today is Apollo for Reddit's last day, and I just released its last update. 🥹 I just wanted to say a big thank you to the folks who have used and supported Apollo over the years, it's been the dream of a lifetime to build this app over the last 9 years. ❤️ Read the eulogy inside! ❤️",41992,0.94,3569,Apollo Developer,1688156839.0,False,1688162733.0,False,False,False
2,14n8qg6,WhitePeopleTwitter,/r/WhitePeopleTwitter/comments/14n8qg6/bernies_response_today_about_the_supreme_court/,human_suitcase,Bernie’s response today about the Supreme Court,27755,0.96,430,,1688151032.0,False,False,False,False,False
3,14n82sp,antiwork,/r/antiwork/comments/14n82sp/supreme_court_tossed_case_these_douchebags/,GraterofCheese,Supreme Court tossed case these douchebags (Alexander Taylor and Myra Brown) submitted against student loan forgiveness due to lack of standing. Let’s upvote and make their faces known.,36923,0.91,1595,,1688149503.0,False,False,False,False,False
4,14nbg2a,comics,/r/comics/comments/14nbg2a/oh_no_dont_go/,Pizzacakecomic,"Oh no, don't go.",10957,0.86,372,PizzaCake,1688157532.0,False,False,False,True,True
5,14n7ev0,nextfuckinglevel,/r/nextfuckinglevel/comments/14n7ev0/domestic_violence_case_prosecutor_picks_up_on/,LambSauce246,Domestic violence case prosecutor picks up on clues that the abuser is in the same house as his ex during their court on Zoom,25770,0.96,559,,1688148006.0,False,False,False,False,False
6,14n84eh,facepalm,/r/facepalm/comments/14n84eh/omg/,Ok_Distribution1503,OMG,33767,0.91,1692,,1688149609.0,False,False,False,False,False
7,14nbnkq,technicallythetruth,/r/technicallythetruth/comments/14nbnkq/doctor_giving_it_to_you_straight/,Manoodley,Doctor giving it to you straight,7393,0.98,64,,1688158031.0,False,False,False,False,False
8,14n6jio,WorkReform,/r/WorkReform/comments/14n6jio/todays_let_them_eat_cake/,zzill6,"Today's ""Let Them Eat Cake""",17230,0.95,271,🤝 Join A Union,1688145914.0,False,False,False,False,False
9,14nb27x,politics,/r/politics/comments/14nb27x/biden_reveals_new_path_to_student_debt_relief/,theindependentonline,Biden reveals ‘new path’ to student debt relief after Supreme Court strikes down president’s plan,6847,0.97,1065,The Independent,1688156611.0,False,False,False,False,False
10,14n7dpg,nottheonion,/r/nottheonion/comments/14n7dpg/elon_musk_and_mark_zuckerberg_offered_romes/,No-Drawing-6975,Elon Musk and Mark Zuckerberg offered Rome's Colosseum as fight venue,14800,0.91,1075,,1688147926.0,False,False,False,False,False
11,14nai06,MadeMeSmile,/r/MadeMeSmile/comments/14nai06/this_wholesome_relationship_between_milkshake_the/,Rollo_Tomasi3000,This wholesome relationship between milkshake the duck and dumpling the cow,7773,0.99,139,,1688155267.0,False,False,False,False,False
12,14n7eir,pics,/r/pics/comments/14n7eir/met_john_oliver_at_the_wga_strike_rally_yesterday/,LegendaryGoji,Met John Oliver at the WGA strike rally yesterday outside WBD HQ! Genuinely swell guy!,12281,0.89,281,,1688147982.0,False,False,False,False,True
13,14ndhvn,nba,/r/nba/comments/14ndhvn/charania_free_agent_draymond_green_and_ceo_of/,twistedlogicx,"[Charania] Free agent Draymond Green and CEO of Klutch Sports Rich Paul have agreed on a four-year, $100 million contract to return to the Golden State Warriors, sources tell @TheAthletic @Stadium. The $100M deal contains a player option in Year 4.",4154,0.96,737,Toronto Huskies,1688162477.0,False,False,False,False,False
14,14n7l2t,BlackPeopleTwitter,/r/BlackPeopleTwitter/comments/14n7l2t/insert_video_from_family_guy_going_didnt_i_tell/,WVUGuy29,*insert video from Family Guy going “Didn’t I tell ya? Cuz I told ya!” line*,10602,0.92,561,,1688148370.0,False,False,False,False,False
15,14n4qdg,todayilearned,/r/todayilearned/comments/14n4qdg/til_that_japanese_actor_bandō_mitsugorō_viii/,outsidethecave,"TIL that Japanese actor Bandō Mitsugorō VIII claimed to be immune to fugu kimo, naturally toxic pufferfish liver. He ate 4 portions in a restaurant with his friends in Kyoto and died 8 hours later.",25285,0.95,1143,,1688141648.0,False,False,False,False,False
16,14n59p2,PoliticalHumor,/r/PoliticalHumor/comments/14n59p2/all_students_left_behind/,IAmAccutane,ALL students left behind,16251,0.95,742,,1688142915.0,False,False,False,False,False
17,14n69i2,memes,/r/memes/comments/14n69i2/so_long_medieval_bois/,,"So long, medieval bois",19330,0.94,646,,1688145243.0,False,False,False,False,False
18,14n4vns,BeAmazed,/r/BeAmazed/comments/14n4vns/intruder_wants_to_mate_with_her_but_she_calls_for/,XahidX,"Intruder wants to mate with her, but she calls for her man and he comes home.",37133,0.93,1692,,1688141995.0,False,False,False,False,False
19,14n7kpm,Damnthatsinteresting,/r/Damnthatsinteresting/comments/14n7kpm/sydney_opera_house_design_candidates/,4reddityo,Sydney Opera House Design Candidates,9361,0.99,239,,1688148346.0,False,False,False,False,False
20,14n96i5,HolUp,/r/HolUp/comments/14n96i5/he_regretted_that/,Fritz_Water_Bottle,He regretted that.,7346,0.96,271,,1688152084.0,False,False,False,False,False
21,14n5529,ContagiousLaughter,/r/ContagiousLaughter/comments/14n5529/thiss_why_kerr_is_a_legend/,O_Mangopare,This’s why Kerr is a legend,12493,0.95,160,,1688142619.0,False,False,False,False,False
22,14n9l4y,Showerthoughts,/r/Showerthoughts/comments/14n9l4y/vertical_video_went_from_being_universally_hated/,Wrathofserenity,Vertical video went from being universally hated to the most popular form of video consumption.,5912,0.93,404,,1688153054.0,True,False,False,False,False
23,14n3gl6,mildlyinfuriating,/r/mildlyinfuriating/comments/14n3gl6/getting_charged_by_a_landlord_for_all_repairs/,newbie_2022Foxy,"Getting Charged by a landlord for all repairs- including AC, Hot Water Heater going out.",25121,0.94,2726,,1688138745.0,False,False,False,False,False
24,14nap9l,HumansBeingBros,/r/HumansBeingBros/comments/14nap9l/helping_a_thirsty_squirrel/,westcoastcdn19,Helping a thirsty squirrel ,4764,0.98,67,,1688155745.0,False,False,False,False,False
25,14n29lw,news,/r/news/comments/14n29lw/supreme_court_blocks_bidens_student_loan/,ICumCoffee,Supreme Court blocks Biden's student loan forgiveness program,45809,0.91,7938,,1688136018.0,False,False,False,True,False
26,14n7do3,me_irlgbt,/r/me_irlgbt/comments/14n7do3/me_irlgbt/,lemangou,me_irlgbt,7404,0.96,55,,1688147923.0,False,False,False,False,False
27,14n8shx,worldnews,/r/worldnews/comments/14n8shx/billionaires_disappointed_after_superyachts/,LudovicoSpecs,Billionaires ‘disappointed’ after superyachts banned from Naples port,5824,0.97,393,,1688151160.0,False,False,False,False,False
28,14nap08,WatchPeopleDieInside,/r/WatchPeopleDieInside/comments/14nap08/police_officers_show_up_at_womans_house_after/,DarthiusFatticus,Police officers show up at Woman’s house after reports of something hanging from her car trunk 😂,4228,0.95,232,,1688155726.0,False,False,False,False,False
29,14n4tn4,aww,/r/aww/comments/14n4tn4/fidelity_cuts_reddit_valuation_again_thanks_john/,Burstar1,Fidelity cuts Reddit valuation again - Thanks John Oliver!,10764,0.88,478,,1688141857.0,False,False,False,False,False
30,14n8hw2,PublicFreakout,/r/PublicFreakout/comments/14n8hw2/karen_wont_pay_for_her_and_boyfriends_haircut/,usernamefred,Karen won’t pay for her and boyfriend’s haircut,5504,0.95,637,,1688150499.0,False,False,False,False,False
31,14n4njg,wholesomememes,/r/wholesomememes/comments/14n4njg/best_friend_things_a_classic/,h3_nryy,Best friend things.. a classic,13319,0.94,166,,1688141456.0,False,False,False,False,False
32,14n6rx8,meirl,/r/meirl/comments/14n6rx8/meirl/,Majestic-Unicorn33,meirl,7772,0.98,434,,1688146468.0,False,False,False,False,False
33,14n8a49,LeopardsAteMyFace,/r/LeopardsAteMyFace/comments/14n8a49/a_majority_of_republicans_with_student_loan_debt/,jarena009,A majority of Republicans with student loan debt approved of Biden's Student Loan debt forgiveness plan according to polling; now they're left with nothing thanks to the conservative Supreme Court which they enabled,5032,0.97,203,,1688149987.0,False,False,False,False,False
34,14n1ckr,NatureIsFuckingLit,/r/NatureIsFuckingLit/comments/14n1ckr/a_field_of_grass_on_a_windy_day/,amish_novelty,🔥 A field of grass on a windy day,26772,0.95,768,,1688133881.0,False,False,False,False,False
35,14n0zpu,movies,/r/movies/comments/14n0zpu/alan_arkin_oscar_winner_for_little_miss_sunshine/,MarvelsGrantMan136,"Alan Arkin, Oscar Winner for ‘Little Miss Sunshine,’ Dies at 89",19939,0.94,1070,r/Movies contributor,1688133051.0,False,False,False,False,False
36,14na3dx,MarchAgainstNazis,/r/MarchAgainstNazis/comments/14na3dx/elections_matter/,MsSeraphim,elections matter,3710,0.96,240,,1688154297.0,False,False,False,False,False
37,14n2ljn,Political_Revolution,/r/Political_Revolution/comments/14n2ljn/president_biden_must_utilize_the_higher_education/,north_canadian_ice,President Biden must utilize the Higher Education Act ASAP to cancel student debt,11799,0.85,1415,,1688136800.0,False,False,False,False,False
38,14n4osk,Tinder,/r/Tinder/comments/14n4osk/now_shes_my_girlfriend_of_3_months_today/,WhoAreWeAndWhy,Now she’s my girlfriend of 3 months today,6985,0.96,275,,1688141537.0,False,False,False,False,False
39,14n6ziu,oddlyterrifying,/r/oddlyterrifying/comments/14n6ziu/the_control_room_of_a_german_sm_ub110_submarine/,RaidensReturn,The control room of a German SM UB-110 submarine from 1918,5456,0.98,212,,1688146965.0,False,False,False,False,False
40,14n5000,UkraineWarVideoReport,/r/UkraineWarVideoReport/comments/14n5000/a_russian_boat_was_spotted_attempting_to_perform/,RetroProxyGroup,"A Russian boat was spotted attempting to perform an evacuation but was thwarted by grenades dropped from a drone. Later, Ukrainian soldiers finished them off",6644,0.94,796,,1688142277.0,True,False,False,False,False
41,14n590w,SipsTea,/r/SipsTea/comments/14n590w/vaccinating_a_street_dog/,flarengo,Vaccinating a Street Dog ,6779,0.96,233,,1688142870.0,False,False,False,False,False
42,14n4yzs,cats,/r/cats/comments/14n4yzs/i_called_everyone_to_a_meeting/,sun_gal88,I called everyone to a meeting.,6673,0.99,339,,1688142203.0,False,False,False,False,False
43,14n1bhr,oddlysatisfying,/r/oddlysatisfying/comments/14n1bhr/this_beautiful_field_of_long_grass_on_a_windy_day/,amish_novelty,This beautiful field of long grass on a windy day,14370,0.97,496,,1688133814.0,False,False,False,False,False
44,14n4qqf,batman,/r/batman/comments/14n4qqf/what_you_would_do/,ineffable_boy,What you would do?,6395,0.96,332,,1688141673.0,False,False,False,False,False
45,14n280k,StudentLoans,/r/StudentLoans/comments/14n280k/well_its_over_i_have_to_admit_i_was_getting/,Betsy514,Well - it's over. I have to admit I was getting cautiously optimistic - but the SCOTUS has killed the Biden/Harris debt relief. Here's some practical FAQ's about the debt relief eligibility and implementation,9785,0.9,4766,President | The Institute of Student Loan Advisors (TISLA),1688135912.0,False,1688166015.0,False,False,False
46,14n1ny7,dankmemes,/r/dankmemes/comments/14n1ny7/shit_would_print_millions/,ZoomZombie1119,Shit would print millions,15997,0.93,303,"the very best, like no one ever was. ",1688134618.0,False,False,False,False,False
47,14n5w7p,midjourney,/r/midjourney/comments/14n5w7p/chatgpt_describe_a_new_mascot_for_a_country/,marehori,"""ChatGPT, describe a new mascot for a country. Midjourney, visualize this nightmare""",5292,0.93,993,,1688144414.0,False,False,False,False,False
48,14n63uv,WTF,/r/WTF/comments/14n63uv/elephant_and_rhino_get_into_a_brutal_fight/,ZealousidealLuck6303,Elephant and Rhino get into a brutal fight.,4910,0.95,885,,1688144881.0,True,False,False,False,False
49,14n9bsz,dataisbeautiful,/r/dataisbeautiful/comments/14n9bsz/tomorrow_reddits_api_changes_come_into_effect_how/,RaiderBDev,Tomorrow Reddits API changes come into effect. How have the subreddit protests developed so far and where are they now? [OC],3166,0.94,472,,1688152450.0,False,False,False,False,False
50,14n11rp,doordash,/r/doordash/comments/14n11rp/my_doordash_driver_showed_up_to_my_place_the/,ConversationWhole197,My Doordash driver showed up to my place the following day after my delivery looking to hangout…,12458,0.92,2970,,1688133188.0,False,1688141679.0,False,False,False
51,14n4ve8,WhitePeopleTwitter,/r/WhitePeopleTwitter/comments/14n4ve8/thats_my_understanding_too/,ohnoh18,That's my understanding too,51464,0.92,1907,,1688141975.0,False,False,False,False,False
52,14mze8c,gaming,/r/gaming/comments/14mze8c/french_president_blames_riots_in_part_on_video/,moby323,French president blames riots in part on video games that have “intoxicated” the youth.,17090,0.91,2052,,1688129042.0,False,False,False,False,False
53,14n2vxv,sadcringe,/r/sadcringe/comments/14n2vxv/is_this_a_threat_or_a_grindr_ad/,KirilForReal,Is this a threat or a Grindr ad ?,7695,0.96,239,,1688137457.0,False,False,False,False,False
54,14n2159,PrequelMemes,/r/PrequelMemes/comments/14n2159/its_only_natural/,bsmith2123,It’s only natural,10466,0.93,109,,1688135473.0,False,False,False,False,False
55,14mycwl,iphone,/r/iphone/comments/14mycwl/today_we_bid_farewell_to_apollo_goodbye_old_friend/,SuitingUncle620,"Today we bid farewell to Apollo. Goodbye, old friend.",79411,0.83,3085,Moderator,1688126157.0,False,False,False,True,False
56,14n2ijt,whenthe,/r/whenthe/comments/14n2ijt/i_love_my_country/,themadkiller10,I love my country 😁,11734,0.88,946,,1688136608.0,False,False,False,False,False
57,14n6d9t,technews,/r/technews/comments/14n6d9t/the_fbi_has_formed_a_national_database_to_track/,thebelsnickle1991,The FBI has formed a national database to track and prevent 'swatting',4241,0.97,145,,1688145494.0,False,False,False,False,False
58,14mxrhu,OldSchoolCool,/r/OldSchoolCool/comments/14mxrhu/some_moments_from_the_1915_film_version_of_alice/,Star_Ship_55,"Some moments from the 1915 film version of ""Alice In Wonderland""",34827,0.95,1179,,1688124430.0,False,False,False,False,False
59,14n07r9,tumblr,/r/tumblr/comments/14n07r9/seriously/,PlayfulYetBored,Seriously,13207,0.95,426,,1688131117.0,False,False,False,False,False
60,14myf1i,lotrmemes,/r/lotrmemes/comments/14myf1i/every_time/,YoinkLord,Every. Time,26934,0.92,399,,1688126332.0,False,False,False,False,False
61,14mypci,apple,/r/apple/comments/14mypci/goodbye_apollo_20172023/,Drtysouth205,Goodbye Apollo 2017-2023,18518,0.92,780,,1688127087.0,False,False,False,False,False
62,14n6o3k,AITAH,/r/AITAH/comments/14n6o3k/aita_for_refusing_to_take_my_kids_calls_after/,Throwawaypfraud,AITA for refusing to take my kids' calls after finding out my wife committed paternity fraud?,4058,0.88,2333,,1688146225.0,False,False,False,False,False
63,14n4ubi,MaliciousCompliance,/r/MaliciousCompliance/comments/14n4ubi/cant_park_in_my_driveway_ok_ill_block_parking_in/,KartQueen,"Can't park in my driveway? OK, I'll block parking in front of your house.",4782,0.96,252,,1688141900.0,False,False,False,False,True
64,14n491f,CombatFootage,/r/CombatFootage/comments/14n491f/russian_tank_drives_into_mines_that_were_placed/,Blablish,Russian tank drives into mines that were placed on top of the asphalt road,5154,0.95,463,,1688140530.0,False,False,False,False,False
65,14n378b,wallstreetbets,/r/wallstreetbets/comments/14n378b/supreme_court_strikes_down_student_loan/,NoobInvester018,Supreme Court strikes down student loan forgiveness plan,6018,0.94,2016,,1688138161.0,False,False,False,False,False
66,14n7s3s,HonkaiStarRail,/r/HonkaiStarRail/comments/14n7s3s/find_your_own_friends_dammit/,UnhappyStatistician2,Find your own friends dammit,3335,0.97,76,,1688148803.0,False,False,False,False,False
67,14n523y,funny,/r/funny/comments/14n523y/thiss_why_kerr_is_a_legend/,O_Mangopare,This’s why Kerr is a legend ,4485,0.96,54,,1688142421.0,False,False,False,False,False
68,14nbfyf,TikTokCringe,/r/TikTokCringe/comments/14nbfyf/3_things_i_wish_i_knew/,choganoga,3 things I wish I knew,1961,0.97,77,tHiS iSn’T cRiNgE,1688157525.0,False,False,False,False,False
69,14n7d6e,nextfuckinglevel,/r/nextfuckinglevel/comments/14n7d6e/this_high_school_coach_disarms_a_student_with_a/,bendubberley_,This high school coach disarms a student with a gun and then embraces him after the student attempted to end his own life during a mental breakdown. ,10710,0.96,505,,1688147889.0,False,False,False,False,False
70,14n25pi,starterpacks,/r/starterpacks/comments/14n25pi/the_entire_population_of_australian_men_aged_2332/,michael14375,The entire population of Australian men aged 23-32 starter pack,6696,0.96,336,,1688135765.0,False,False,False,False,False
71,14n3f6w,dankruto,/r/dankruto/comments/14n3f6w/the_father_the_son_and_the_piece_of_shit/,Thisuserishalfalive,"The father, the son and the piece of shit",6323,0.88,411,,1688138660.0,False,False,False,False,False
72,14nbd0k,Chadtopia,/r/Chadtopia/comments/14nbd0k/the_beast/,PewPewAnimeGirl,the beast,1960,0.96,78,Here for the good vibes,1688157328.0,False,False,False,False,False
73,14n5mof,ProgrammerHumor,/r/ProgrammerHumor/comments/14n5mof/itisashortcut/,huxx__,itIsAShortcut,3918,0.97,51,,1688143788.0,False,False,False,False,False
74,14mxwkg,therewasanattempt,/r/therewasanattempt/comments/14mxwkg/to_stop_a_boat_trailer/,purple-circle,to stop a boat trailer,24677,0.88,2076,3rd Party App,1688124845.0,False,False,False,False,False
75,14n5acs,Futurology,/r/Futurology/comments/14n5acs/worlds_1st_tooth_regrowth_medicine_moves_toward/,Ezekiel_W,World's 1st 'tooth regrowth' medicine moves toward clinical trials in Japan - The Mainichi,3932,0.97,146,,1688142959.0,False,False,False,False,False
76,14n678f,shitposting,/r/shitposting/comments/14n678f/heil_spez/,Siil_Udus,heil spez,3978,0.97,30,,1688145094.0,False,False,False,False,False
77,14n6sav,fightporn,/r/fightporn/comments/14n6sav/you_might_need_a_cold_one/,Tps4848,“You might need a cold one.” 😂😂😂,3366,0.91,389,,1688146498.0,True,False,False,False,False
78,14mx8ma,maybemaybemaybe,/r/maybemaybemaybe/comments/14mx8ma/maybe_maybe_maybe/,SinjiOnO,maybe maybe maybe,27588,0.91,508,,1688122856.0,False,False,False,False,False
79,14n5w6i,Gamingcirclejerk,/r/Gamingcirclejerk/comments/14n5w6i/yall_need_to_touch_grass_for_real_upvotes_to_the/,TacoDangerously,"Y'all need to touch grass, for real. Upvotes to the left.",3769,0.97,133,🌮🌮🌮,1688144413.0,False,False,False,False,False
80,14n63qd,nonononoyes,/r/nonononoyes/comments/14n63qd/that_grin_speaks_volumes/,EileneGoldstein,That grin speaks volumes.,3585,0.96,83,,1688144872.0,False,False,False,False,False
81,14n39pb,Satisfyingasfuck,/r/Satisfyingasfuck/comments/14n39pb/a_bands_lighting_technician_signals_to_his/,NoBagge,A band’s lighting technician signals to his colleague as he tests the stage set-up - and the crowd copies him.,5229,0.96,86,,1688138316.0,False,False,False,False,False
82,14ndxa2,nba,/r/nba/comments/14ndxa2/wojnarowski_free_agent_bruce_brown_has_agreed_on/,twistedlogicx,"[Wojnarowski] Free agent Bruce Brown has agreed on a two-year, $45M deal with the Indiana Pacers, his agents Ty Sullivan and Steven Heumann of @CAASports tell ESPN. Denver — limited in what it could pay — loses a key piece to its repeat hopes.",3133,0.99,641,Toronto Huskies,1688163530.0,False,False,False,False,False
83,14n0w21,insanepeoplefacebook,/r/insanepeoplefacebook/comments/14n0w21/does_senator_blackburn_know_what_seized_means/,FalconLynx13,Does Senator Blackburn know what seized means?,7190,0.94,201,,1688132804.0,False,False,False,False,False
84,14n2rlv,Save3rdPartyApps,/r/Save3rdPartyApps/comments/14n2rlv/this_subreddit_is_the_doomsday_clock_of_reddit/,Batning,"This subreddit is the Doomsday Clock of Reddit. Tomorrow, that clock will strike. Good luck, everyone, and hope for the best.",5213,0.91,401,,1688137210.0,False,False,False,False,False
85,14nb9o7,lifehacks,/r/lifehacks/comments/14nb9o7/made_a_baby_rocker_because_daddying_is_hard/,wendi_russell,Made a baby rocker because daddying is hard.,1806,0.93,96,,1688157099.0,False,False,False,False,False
86,14naprk,atheism,/r/atheism/comments/14naprk/im_a_web_developer_and_i_refuse_to_design_sites/,NoMoreJesus,"I'm a web developer, and I refuse to design sites for Christians",1917,0.94,275,Strong Atheist,1688155781.0,False,False,False,False,False
87,14n4xsy,Teachers,/r/Teachers/comments/14n4xsy/as_a_teacher_im_devastated_by_the_scotus_decision/,Astronomy_1995,As a teacher I’m devastated by the SCOTUS decision on student loan forgiveness!,4081,0.83,1090,,1688142123.0,False,1688171425.0,False,False,False
88,14n7cry,politics,/r/politics/comments/14n7cry/the_supreme_court_just_made_me_a_secondclass/,theindependentonline,The Supreme Court just made me a second-class citizen,7691,0.92,1495,The Independent,1688147861.0,False,False,False,False,False
89,14n1b8i,shittymoviedetails,/r/shittymoviedetails/comments/14n1b8i/if_you_look_at_the_indiana_jones_posters_in_order/,CeltsGargle,"If you look at the Indiana Jones posters in order, you'll notice that Harrison Ford's expression gets less enthusiastic over time.",7015,0.97,145,,1688133798.0,False,False,False,False,False
90,14n69k2,facepalm,/r/facepalm/comments/14n69k2/your_baby_is_ugly/,Ok_Distribution1503,Your baby is ugly,13135,0.96,985,,1688145247.0,False,False,False,False,False
91,14nc54k,ukraine,/r/ukraine/comments/14nc54k/the_destruction_of_russian_sabotage/,buttmodel,The destruction of Russian sabotage reconnaissance group somewhere on the banks of the Dnipro river. Near Kherson.,1585,0.98,168,,1688159171.0,True,False,False,False,False
92,14n2l69,antiwork,/r/antiwork/comments/14n2l69/is_this_true/,Existentialidiot83,Is this true?,36263,0.91,1268,,1688136777.0,False,False,False,False,False
93,14n5jat,marvelmemes,/r/marvelmemes/comments/14n5jat/spiderman_shattered_dimensions_is_an_underrated/,VIRGIL69143,Spiderman shattered dimensions is an underrated game,3766,0.97,85,Hawkeye 🏹,1688143555.0,False,False,False,False,False
94,14n9xdf,NoStupidQuestions,/r/NoStupidQuestions/comments/14n9xdf/cancel_student_debt_is_popular_but_why_isnt_stop/,TheGebelein,"""Cancel Student Debt"" is popular but why isn't ""Stop loaning high schoolers crippling amounts of debt"" talked about?",2073,0.94,415,,1688153880.0,False,False,False,False,False
95,14nc5z1,shittytattoos,/r/shittytattoos/comments/14nc5z1/dear_god_in_heaven/,BishopGodDamnYou,Dear god in heaven,1569,0.96,240,,1688159229.0,False,False,False,False,False
96,14n7lw0,science,/r/science/comments/14n7lw0/physical_attractiveness_may_indicate_good_health/,HeinieKaboobler,Physical attractiveness may indicate good health. The study found that people who were rated as above-average in attractiveness tended to be noticeably healthier compared to those considered average-looking when assessed 10 years later.,2567,0.89,420,,1688148419.0,False,False,False,False,False
97,14n8rd5,SquaredCircle,/r/SquaredCircle/comments/14n8rd5/pwinsidercom_is_sad_to_report_the_passing_of/,AimarEraFutebol,"PWInsider.com is sad to report the passing of former WWF and ECW star Darren ""Droz"" Drozdov at the age of 54",2203,0.97,266,"SECTION 11, SUB-PARAGRAPH E",1688151085.0,False,False,False,False,False
98,14n7cms,todayilearned,/r/todayilearned/comments/14n7cms/til_that_upon_harry_houdinis_death_his_magic/,RexSueciae,"TIL that upon Harry Houdini's death, his magic equipment was inherited by his brother Theodore on the condition that it be ""burned and destroyed"" upon Theodore's death. Instead, the equipment ended up in the Houdini Magical Hall of Fame, a museum which burnt down in 1995.",6884,0.98,95,,1688147849.0,False,False,False,False,False
99,14ncmvw,animememes,/r/animememes/comments/14ncmvw/what_is_that_one_anime_you_watch_all_over_again/,LeatherOpen8276,What is that one anime you watch all over again?,1376,0.97,207,,1688160359.0,False,False,False,False,False
100,14n53zg,diablo4,/r/diablo4/comments/14n53zg/saw_this_at_work/,isacabbage,Saw this at work,3446,0.97,139,,1688142551.0,False,False,False,False,False
