rank,id,subreddit,permalink,author,title,score,upvote_ratio,num_comments,author_flair_text,created_utc,over_18,edited,stickied,locked,is_original_content
1,151dwgn,Damnthatsinteresting,/r/Damnthatsinteresting/comments/151dwgn/the_puss_caterpillar_southern_flannel_moth_will/,Totally-avg,The Puss Caterpillar (Southern Flannel Moth) will fuck your world up. I grazed it twice while climbing on a float. NBD at first but an hour later I was hyperventilating on the bedroom floor. The pain was excruciating. DH took me to the ER and morphine did nothing.,14759,0.97,901,,1689532879.0,False,False,False,False,False
2,151e739,WhitePeopleTwitter,/r/WhitePeopleTwitter/comments/151e739/if_you_create_a_rule_expect_it_to_be_used_against/,WhiteDiamondK,"If you create a rule, expect it to be used against you….",11567,0.97,302,,1689533594.0,False,False,False,False,False
3,151a7nq,cats,/r/cats/comments/151a7nq/will_i_ever_be_able_to_eat_my_yogurt_alone_again/,alisongent,will i ever be able to eat my yogurt alone again???,19495,0.98,651,,1689524054.0,False,False,False,False,False
4,151cz37,nextfuckinglevel,/r/nextfuckinglevel/comments/151cz37/carlos_alcatraz_winning_his_first_wimbledon_at_20/,stinky_sardine,Carlos Alcatraz winning his first Wimbledon at 20 years of age! ,10162,0.95,401,,1689530674.0,False,False,False,False,False
5,151gplj,funny,/r/funny/comments/151gplj/so_probably_not/,TheExtimate,So probably not,4963,0.94,182,,1689539459.0,True,False,False,False,False
6,151fl73,rareinsults,/r/rareinsults/comments/151fl73/midlife_crisis_elon/,Sad-Most8083,Midlife crisis Elon,6005,0.94,735,,1689536840.0,False,False,False,False,False
7,151f7wo,oddlysatisfying,/r/oddlysatisfying/comments/151f7wo/this_gentlemans_sheep_shearing_technique/,Rollo_Tomasi3000,This gentleman’s sheep shearing technique,5299,0.94,385,,1689535977.0,False,False,False,False,False
8,1519kvr,facepalm,/r/facepalm/comments/1519kvr/look_how_clever_i_am_i_even_know_chess/,BaronVonBroccoli,"Look how clever I am, I even know Chess.",20562,0.91,1926,,1689522486.0,False,False,False,False,False
9,151awqy,MadeMeSmile,/r/MadeMeSmile/comments/151awqy/squirrel_restaurant/,Godfathermafia,Squirrel Restaurant ,11087,0.96,364,,1689525755.0,False,False,False,False,False
10,1518wql,BeAmazed,/r/BeAmazed/comments/1518wql/amazing_variety_of_animals_come_to_drink_water_at/,CommercialBox4175,Amazing Variety Of Animals Come To Drink Water At Night,16238,0.97,526,,1689520808.0,False,False,False,False,False
11,151a2si,TikTokCringe,/r/TikTokCringe/comments/151a2si/laundry_tips/,choganoga,Laundry tips,11509,0.9,1473,tHiS iSn’T cRiNgE,1689523713.0,False,False,False,False,False
12,1516z23,comics,/r/comics/comments/1516z23/ok_yeah_this_is_one_of_my_dumbest_oc/,TommySiegel,ok yeah this is one of my dumbest [OC],26909,0.95,243,,1689515919.0,False,False,False,False,False
13,151cnuj,tennis,/r/tennis/comments/151cnuj/wimbledon_mens_singles_final_1_c_alcaraz_d_2_n/,chespiotta,"Wimbledon, Men's Singles- Final - [1] C. Alcaraz d. [2] N. Djokovic 1-6, 7-6(6), 6-1, 3-6, 6-4",5331,0.95,2344,FAA-Dimi-Hubi-Med-Ruud-Matteo-Thiem-Big 3-DelPo-Cabal/Farah,1689529951.0,False,False,True,False,False
14,15181mo,memes,/r/memes/comments/15181mo/it_has_many_nutrient/,oranke_dino,It has many nutrient.,19787,0.97,287,Cringe Factory,1689518640.0,False,False,False,False,False
15,151558z,todayilearned,/r/todayilearned/comments/151558z/til_that_in_2017_all_gps_coordinates_in_australia/,nacrosian,"TIL that in 2017 all GPS coordinates in Australia were shifted 1.8 m to account for continental drift since the last update in 1994. Moving north 7 cm a year, the Australian plate is one of the fastest-drifting plates in the world",30997,0.97,606,,1689510800.0,False,False,False,False,False
16,15196j2,wholesomememes,/r/wholesomememes/comments/15196j2/free_sneks_or_another_awards_for_everyone/,----eclipse,free sneks or another awards for everyone!,12669,0.89,12194,,1689521485.0,False,False,False,False,False
17,151dot8,news,/r/news/comments/151dot8/tourists_flock_to_death_valley_to_experience/,ChocolateTsar,Tourists flock to Death Valley to experience possible world-record heat of 55C degrees,4142,0.96,939,,1689532367.0,False,False,False,False,False
18,1518zgt,OneOrangeBraincell,/r/OneOrangeBraincell/comments/1518zgt/my_wife_took_this_amazing_photo/,Wettoasted,My wife took this amazing photo,8903,0.98,109,,1689520995.0,False,False,False,False,False
19,1518pvp,WTF,/r/WTF/comments/1518pvp/i_have_no_fucking_idea/,AnnihilationOrchid,I have no fucking idea..,8753,0.92,645,,1689520322.0,False,False,False,False,False
20,1518bgk,me_irlgbt,/r/me_irlgbt/comments/1518bgk/me_irlgbt/,thatguy9684736255,me_irlgbt,12263,0.89,303,Ace/Rainbow :ace-rainbow:,1689519332.0,False,False,False,False,False
21,1519hc1,shitposting,/r/shitposting/comments/1519hc1/praise_spez_and_mrs_frizzle/,Gorotheninja,Praise Spez (and Mrs. Frizzle),9509,0.98,102,,1689522241.0,False,False,False,False,False
22,151h0wf,clevercomebacks,/r/clevercomebacks/comments/151h0wf/straight_men_truly_couldnt_care_less_all/,Stoner4s3,Straight men truly couldn't care less all,2626,0.94,155,,1689540193.0,False,False,False,False,False
23,15181bu,meirl,/r/meirl/comments/15181bu/me_irl/,Sonic_the_hedgedog,me_irl,9905,0.97,253,,1689518617.0,False,False,False,False,False
24,1517pev,HolUp,/r/HolUp/comments/1517pev/luxury_car_security_feature/,Wololo--Wololo,Luxury car security feature,13700,0.95,287,,1689517780.0,False,False,False,False,False
25,1518w2q,therewasanattempt,/r/therewasanattempt/comments/1518w2q/to_balance/,Dathird,to balance,8079,0.97,349,,1689520762.0,False,False,False,False,False
26,151cyzm,PeterExplainsTheJoke,/r/PeterExplainsTheJoke/comments/151cyzm/i_dont_get_it/,Red_Neck_Slim_Jim,I don't get it,4265,0.97,55,,1689530668.0,False,False,False,False,False
27,151bcvv,WhitePeopleTwitter,/r/WhitePeopleTwitter/comments/151bcvv/is_it_just_me_or_is_this_incredibly_out_of_touch/,thatguy9684736255,"Is it just me, or is this incredibly out of touch?",11881,0.97,916,,1689526856.0,False,False,False,False,False
28,1517jjm,politics,/r/politics/comments/1517jjm/donald_trump_brands_us_a_third_world_hellhole_run/,Key_Inevitable_2104,Donald Trump brands US a ‘third -world hellhole’ run by ‘perverts’ and ‘thugs’,8516,0.93,1565,:flag-ny: New York,1689517367.0,False,False,False,False,False
29,1517f4l,OUTFITS,/r/OUTFITS/comments/1517f4l/is_this_fit_cute_for_a_bbq_or_too_much_my_crush/,moonlightfawn444,is this fit cute for a BBQ or too much? my crush is going to be there 🫠,26385,0.76,492,Newcomer (3 posts),1689517063.0,False,False,False,True,False
30,1516hx0,FunnyandSad,/r/FunnyandSad/comments/1516hx0/somebody_needs_to_check_for_a_pulse/,Comfortablejack,Somebody needs to check for a pulse,14332,0.91,209,,1689514606.0,False,False,False,False,False
31,151d6r7,starterpacks,/r/starterpacks/comments/151d6r7/how_do_they_fuck_starter_pack/,Babufrak2,"""How do they fuck?"" starter pack",3743,0.92,148,,1689531184.0,False,False,False,False,False
32,15163lv,worldnews,/r/worldnews/comments/15163lv/türkiye_supports_nato_expansion_including/,ledim35,"Türkiye supports NATO expansion, including Ukraine's membership",10802,0.93,833,,1689513506.0,False,False,False,False,False
33,1513uur,OldSchoolCool,/r/OldSchoolCool/comments/1513uur/the_animators_from_behind_the_scenes_of_akira/,MulciberTenebras,"The animators from behind the scenes of ""AKIRA"" (1988), showing the process of hand-painting the backgrounds and individual cel animations",24311,0.97,719,,1689506737.0,False,False,False,False,False
34,151656o,PrequelMemes,/r/PrequelMemes/comments/151656o/star_wars_is_for_all/,CaptainTechno_,Star wars is for all,14053,0.94,295,,1689513624.0,False,False,False,False,False
35,1516bsv,Unexpected,/r/Unexpected/comments/1516bsv/professional_musicians_wont_miss_a_beat/,jucapolito,Professional musicians won’t miss a beat,10985,0.97,351,,1689514141.0,False,False,False,False,False
36,1514pr4,antiwork,/r/antiwork/comments/1514pr4/heat_exhaustion_killed_my_coworker_and_theyre/,LadyLee69,Heat exhaustion killed my coworker and they're covering it up,15203,0.94,930,,1689509461.0,False,1689528323.0,False,False,False
37,1517gko,Jokes,/r/Jokes/comments/1517gko/a_man_walks_out_to_the_street_and_catches_a_taxi/,HelpingHandsUs,"A man walks out to the street and catches a taxi just going by. He gets into the taxi, and the cabbie says, ""Perfect timing. You're just like Frank.""",7330,0.95,134,,1689517167.0,False,False,False,False,False
38,151b35w,mildlyinfuriating,/r/mildlyinfuriating/comments/151b35w/this_cheap_glass_we_bought_from_the_dollar_store/,chikinbizkit,"This cheap glass we bought from the dollar store fell out of our cabinet and onto the stove top today. Instead of the glass shattering, it put a sizeable dent in our metal stove top. Glass is still fully intact, not even scratched.",4456,0.96,214,,1689526208.0,False,False,False,False,False
39,15193so,space,/r/space/comments/15193so/analog_film_selfie_from_my_first_spacewalk_more/,astro_pettit,Analog film selfie from my first spacewalk. More details in comments.,5318,0.97,142,NASA Astronaut,1689521305.0,False,False,False,False,True
40,1517ynt,NoahGetTheBoat,/r/NoahGetTheBoat/comments/1517ynt/guy_pushes_61year_old_man_on_the_subway_and_this/,CEOofBiafra,Guy pushes 61-year old man on the subway and this is what he has to say for himself. Disgusting.,7321,0.96,831,,1689518428.0,False,False,False,False,False
41,1516k8q,JustGuysBeingDudes,/r/JustGuysBeingDudes/comments/1516k8q/how_to_pick_up_girls_101/,flattenedbricks,How to pick up girls 101,9188,0.95,131,Lego Bricks,1689514789.0,False,False,False,False,False
42,15180sx,BrandNewSentence,/r/BrandNewSentence/comments/15180sx/probably_not_a_good_idea/,Existentialidiot83,Probably not a good idea.,7161,0.96,144,,1689518578.0,False,False,False,False,False
43,151a1ec,Satisfyingasfuck,/r/Satisfyingasfuck/comments/151a1ec/running_into_his_opponents_mom_moments_after/,TrueEmploxyer,Running into his opponents mom moments After beating him and taking his belt,4729,0.96,135,,1689523611.0,False,False,False,False,False
44,151cnhb,sports,/r/sports/comments/151cnhb/carlos_alcaraz_defeats_novak_djokovic_in_five/,nolesfan2011,Carlos Alcaraz Defeats Novak Djokovic in Five Sets to Win Wimbledon,3136,0.96,296,:MLBnym: New York Mets,1689529926.0,False,False,False,False,False
45,1519bi1,maybemaybemaybe,/r/maybemaybemaybe/comments/1519bi1/maybe_maybe_maybe/,licer71,Maybe Maybe Maybe,5268,0.93,1465,,1689521834.0,False,False,False,False,False
46,15144jq,NatureIsFuckingLit,/r/NatureIsFuckingLit/comments/15144jq/aerial_view_of_a_group_of_basking_sharks_a/,SinjiOnO,"🔥 Aerial view of a group of Basking Sharks, a relatively rare sighting as they're predominately solitary creatures",14862,0.97,237,:parrot:,1689507631.0,False,False,False,False,False
47,151bkte,PublicFreakout,/r/PublicFreakout/comments/151bkte/good_ole_texas/,fonsbark,Good ole Texas,3508,0.95,487,,1689527367.0,True,False,False,False,False
48,1516qzm,wallstreetbets,/r/wallstreetbets/comments/1516qzm/cybertruck_spotted_in_the_wildloading_calls/,coryf03,Cybertruck spotted in the wild…loading calls,6887,0.95,273,,1689515304.0,False,False,False,False,False
49,1513zh5,NewsOfTheStupid,/r/NewsOfTheStupid/comments/1513zh5/donald_trump_claims_the_american_dream_is_dead/,Misguided_Society,Donald Trump claims the American dream is ‘dead’ - stating the US a ‘third -world hellhole’ run by ‘perverts’ and ‘thugs’,17009,0.86,4606,,1689507155.0,False,False,False,False,False
50,1515nda,CrazyFuckingVideos,/r/CrazyFuckingVideos/comments/1515nda/idiots_decide_to_street_race_through_a_stop_light/,ThrowRA0069,Idiots Decide to Street Race Through a Stop Light,8991,0.96,929,,1689512265.0,False,False,False,False,False
51,1519pnw,BeAmazed,/r/BeAmazed/comments/1519pnw/the_kiffness_the_roadrager_and_a_7_nation_army/,purple-circle,"The Kiffness, the road-rager and a 7 nation army",10656,0.96,194,,1689522820.0,False,False,False,False,False
52,15152hu,tumblr,/r/tumblr/comments/15152hu/black_holes_arent_planet_gluttons_you_bitch/,SaraAnnabelle,"Black holes aren't planet gluttons, you bitch",10992,0.96,224,,1689510566.0,False,False,False,False,False
53,1514g0o,marvelmemes,/r/marvelmemes/comments/1514g0o/they_couldve_used_a_prop_for_the_gun_atleast/,GAMMAGREEN62,They could've used a prop for the gun atleast...,15740,0.9,1082,Avengers,1689508663.0,False,False,False,False,False
54,151dfjo,whenthe,/r/whenthe/comments/151dfjo/i_dont_think_no_rules_its_the_best_argument_in/,yoshbiscut69,I don’t think “no rules” it’s the best argument in court,2587,0.99,149,"what font is that, where are you people making these?",1689531760.0,False,False,False,False,False
55,1519d80,baseball,/r/baseball/comments/1519d80/woman_and_her_family_got_ejected_in_the_first/,GroMicroBloom,Woman and her family got ejected in the first game of the doubleheader for this catch,4020,0.96,1553,Tampa Bay Devil Rays :tbr3:,1689521960.0,False,False,False,False,False
56,15173pv,PS5,/r/PS5/comments/15173pv/phil_spencer_we_are_pleased_to_announce_that/,Turbostrider27,Phil Spencer: We are pleased to announce that Microsoft and @PlayStation have signed a binding agreement to keep Call of Duty on PlayStation following the acquisition of Activision Blizzard. We look forward to a future where players globally have more choice to play their favorite games.,5874,0.93,2742,,1689516236.0,False,False,False,False,False
57,1518afg,facepalm,/r/facepalm/comments/1518afg/classmate_i_havent_spoken_to_in_5_years_messages/,poplitte2,Classmate I haven’t spoken to in 5 years messages me out of the blue to delete a picture I posted of myself—because her boyfriend saw it. (More in comments),14619,0.97,1652,,1689519258.0,False,False,False,False,False
58,151atxw,OrphanCrushingMachine,/r/OrphanCrushingMachine/comments/151atxw/clearly_cops_dont_have_the_budget_for_that/,jericho601,Clearly cops don't have the budget for that themselves...,3217,0.95,105,,1689525577.0,False,False,False,False,False
59,1517iyh,Genshin_Impact,/r/Genshin_Impact/comments/1517iyh/all_69_characters_specialist_dance_before_fontaine/,Stealthless,ALL 69 Characters Specialist Dance before Fontaine,5907,0.93,289,:keqing::kokomi:,1689517324.0,False,False,False,False,False
60,151az1c,nextfuckinglevel,/r/nextfuckinglevel/comments/151az1c/how_this_guys_handles_the_alligator/,argetlam5,How this guys handles the alligator,7134,0.95,464,,1689525917.0,False,False,False,False,False
61,151632h,ImTheMainCharacter,/r/ImTheMainCharacter/comments/151632h/yelling_bomb_in_the_middle_of_the_busy_airport/,Best_Needleworker530,Yelling “bomb” in the middle of the busy airport for TikTok views,7733,0.81,715,,1689513464.0,False,False,False,True,False
62,151crzt,Spiderman,/r/Spiderman/comments/151crzt/the_fact_this_is_my_favorite_mcu_spider_man/,Technical-Peak3394,The fact this is my favorite MCU Spider Man poster and i never knew this....,2434,0.97,37,,1689530233.0,False,False,False,False,False
63,1516ij6,interesting,/r/interesting/comments/1516ij6/giant_squid_makes_an_appearance_in_tokyo_bay/,MetsX2000,Giant Squid makes an appearance in Tokyo Bay,6232,0.97,348,,1689514656.0,False,False,False,False,False
64,1517wgf,oddlyspecific,/r/oddlyspecific/comments/1517wgf/a_drooling_socialist_cuck/,Existentialidiot83,A drooling socialist cuck 🤔,4741,0.97,124,,1689518273.0,False,False,False,False,False
65,151cork,AskReddit,/r/AskReddit/comments/151cork/what_is_one_thing_men_should_never_do_to_look/,siluoo,What is one thing men should never do to look attractive?,2384,0.92,1714,,1689530013.0,True,False,False,False,False
66,151g6l0,ThatsInsane,/r/ThatsInsane/comments/151g6l0/after_winning_her_boxing_match_daniella_hemsley/,alanboston,After winning her boxing match Daniella Hemsley flashes her breasts on live TV,1546,0.91,143,,1689538231.0,True,False,False,False,False
67,151aibr,TheLastAirbender,/r/TheLastAirbender/comments/151aibr/im_not_the_only_one_right/,AvatarRohan2025,"I'm not the only one, right?",3140,0.97,155,,1689524778.0,False,False,False,False,False
68,1518fi9,BlackPeopleTwitter,/r/BlackPeopleTwitter/comments/1518fi9/depends_on_the_year_of_the_car/,MikeisTOOOTALLL,Depends on the year of the car,3912,0.94,269,,1689519620.0,False,False,False,False,False
69,1517w62,MadeMeSmile,/r/MadeMeSmile/comments/1517w62/man_with_cerebral_palsy_overcomes_the_odds_to/,CommercialBox4175,Man With Cerebral Palsy Overcomes The Odds To Become A Body Builder,12799,0.95,243,,1689518250.0,False,False,False,False,False
70,151d591,DiWHY,/r/DiWHY/comments/151d591/flayer_of_thighs_cracker_of_nuts_cutter_of_toes/,balbertborring,"Flayer of Thighs, Cracker of Nuts, Cutter of Toes, Pincher of Butts",2095,0.95,76,,1689531078.0,False,False,False,False,False
71,1513hgb,NonPoliticalTwitter,/r/NonPoliticalTwitter/comments/1513hgb/crypto_queen/,kirby-groot,Crypto Queen,10513,0.95,113,:blue1::blue2::1111::1112:,1689505467.0,False,False,False,False,False
72,15172o2,pettyrevenge,/r/pettyrevenge/comments/15172o2/had_the_roommate_from_hell_and_couldnt_get_rid_of/,ThisIsMyCircus40,Had the roommate from hell and couldn't get rid of her so I made living with me as miserable as possible.,4766,0.95,280,,1689516162.0,False,1689520547.0,False,False,False
73,1517s96,technicallythetruth,/r/technicallythetruth/comments/1517s96/to_be_fair_not_many_humans_know_either/,uguystookeveryname,"To be fair, not many humans know either.",4444,0.99,46,,1689517970.0,False,False,False,False,False
74,15173og,terriblefacebookmemes,/r/terriblefacebookmemes/comments/15173og/why_do_they_hate_therapy_so_much/,jeonteskar,Why do they hate therapy so much?,5361,0.89,492,,1689516233.0,False,False,False,False,False
75,151fidi,oddlyterrifying,/r/oddlyterrifying/comments/151fidi/vegetables_shaped_like_humans/,Blueberry_Conscious_,Vegetables shaped like humans,1575,0.98,43,,1689536662.0,False,False,False,False,False
76,151cdby,CasualUK,/r/CasualUK/comments/151cdby/am_i_being_thick/,dpm_259,Am I being thick?,2272,0.96,616,,1689529260.0,False,False,False,False,False
77,151gxot,Damnthatsinteresting,/r/Damnthatsinteresting/comments/151gxot/tom_cruises_movie_vanilla_sky_has_been_the_only/,Sami1398,"Tom Cruise's movie ""Vanilla Sky"" has been the only movie ever to get permission to shut down entire Times Square for any amount of time for shooting a movie, they paid $1 million and got 3 hours on a sunday morning to film Cruise running around in a dream sequence hallucinating an empty Times Square",2635,0.98,175,,1689539994.0,False,False,False,False,False
78,151cuyg,KingOfTheHill,/r/KingOfTheHill/comments/151cuyg/propane_propane_accessories_strickland_propane/,MiddleofInfinity,Propane & propane accessories. Strickland Propane,2076,0.97,120,,1689530425.0,False,False,False,False,False
79,151beuk,DunderMifflin,/r/DunderMifflin/comments/151beuk/oscar_was_wild_for_this/,nikulmmadhu,Oscar was wild for this,2517,0.99,48,,1689526972.0,False,False,False,False,False
80,151diex,technology,/r/technology/comments/151diex/finland_introduces_the_worlds_first_phonefree/,fchung,Finland introduces the world’s first phone-free tourist island,1921,0.92,123,,1689531948.0,False,False,False,False,False
81,1519e8h,nba,/r/nba/comments/1519e8h/charania_phoenix_is_trading_g_cam_payne_a/,PlayaSlayaX,"[Charania] Phoenix is trading G Cam Payne, a second-round pick and cash to San Antonio, sources tell @TheAthletic @Stadium.",3152,0.96,572,:sas-3: Spurs,1689522028.0,False,False,False,False,False
82,151afo5,PoliticalCompassMemes,/r/PoliticalCompassMemes/comments/151afo5/2024_is_going_to_be_between_two_shitty_candidates/,mrducky78,2024 is going to be between two shitty candidates again. Same as it ever was.,2775,0.9,512,:left: - Left,1689524598.0,False,False,False,False,False
83,1519q6d,memes,/r/memes/comments/1519q6d/winter_are_better/,snowchild3101,Winter are better,8974,0.95,353,:Capybara: Ok I Pull Up :Capybara:,1689522855.0,False,False,False,False,False
84,15187zz,diablo4,/r/diablo4/comments/15187zz/glyphs_needs_clearer_system/,Alexandurrrrr,Glyphs needs clearer system,3596,0.95,521,,1689519083.0,False,False,False,False,False
85,151by8g,therewasanattempt,/r/therewasanattempt/comments/151by8g/to_guilt_people_into_not_buying_meat/,calmlyAppear573,To guilt people into not buying meat,4738,0.95,579,,1689528254.0,False,False,False,False,False
86,1517jgs,yesyesyesyesno,/r/yesyesyesyesno/comments/1517jgs/trying_not_to_get_wet_while_popping_ballons/,habichuelacondulce,Trying not to get wet while popping ballons,4051,0.92,113,,1689517362.0,False,False,False,False,False
87,151dzbm,2meirl4meirl,/r/2meirl4meirl/comments/151dzbm/2meirl4meirl/,hornmelon,2meirl4meirl,1726,0.98,23,,1689533067.0,False,False,False,False,False
88,151cv1c,texas,/r/texas/comments/151cv1c/census_confirmed_latinos_now_the_majority_in_texas/,Lostlobster8,Census Confirmed. Latinos now the majority in Texas.,1922,0.95,335,,1689530430.0,False,False,False,False,False
89,151cqp5,WhitePeopleTwitter,/r/WhitePeopleTwitter/comments/151cqp5/moms_for_fascism_and_bullying_gay_kids_to_death/,TrumpterOFyvie,Moms For Fascism and Bullying Gay Kids To Death,8769,0.98,210,,1689530143.0,False,False,False,False,False
90,15197zz,leagueoflegends,/r/leagueoflegends/comments/15197zz/reptile_fnatic_tq_adc_leaked_his_smurf_accounts/,Kerferkunde,"""Reptile"" Fnatic TQ Adc leaked his smurf accounts name being ""h*tler119""",3003,0.86,1190,,1689521590.0,False,1689547327.0,False,False,False
91,1517ej0,SipsTea,/r/SipsTea/comments/1517ej0/hot_take_if_we_all_united_to_require_more/,Gadnerxi,"Hot take, if we all United to require more",3903,0.96,57,,1689517019.0,False,False,False,True,False
92,151g29m,Superstonk,/r/Superstonk/comments/151g29m/so_has_anyone_talked_about_citadel_securities/,jhs0108,So has anyone talked about Citadel Securities massive increase in the Notional Amount of their Derivatives over the last few years yet? Cause I just found out about it and holy cow this could be big.,1461,0.97,111,,1689537949.0,False,False,False,False,False
93,151biin,IllegallySmolCats,/r/IllegallySmolCats/comments/151biin/ophelia_the_day_i_picked_her_up/,destielwhitewolf,Ophelia the day I picked her up,2161,0.98,35,,1689527211.0,False,False,False,False,False
94,1514jae,oddlysatisfying,/r/oddlysatisfying/comments/1514jae/cable_management_done_right/,AlwaysTheNoob,Cable management done right,22947,0.94,556,,1689508927.0,False,False,False,False,False
95,151cpow,worldnews,/r/worldnews/comments/151cpow/environmental_protesters_vandalize_superyacht_of/,mightydoomslayerca,Environmental protesters vandalize superyacht of Walmart heir Nancy Walton Laurie,3631,0.96,315,,1689530075.0,False,False,False,False,False
96,151dyae,Tinder,/r/Tinder/comments/151dyae/is_this_a_weird_way_to_meet_someone_for_the_first/,100problemss,Is this a weird way to meet someone for the first time?,1575,0.98,278,,1689532999.0,False,False,False,False,False
97,151ebyg,pics,/r/pics/comments/151ebyg/well_john_oliver_says_i_need_to_burn_my_38k_coins/,topgun966,Well John Oliver says I need to burn my 38K coins I have been hoarding. So will be burning them here,1485,0.8,2540,,1689533923.0,False,False,False,False,False
98,1516cqm,ProgrammerHumor,/r/ProgrammerHumor/comments/1516cqm/fontsizenotforscaling/,Nveenkmar,fontSizeNotForScaling,4465,0.96,111,:snoo_smile::sloth::snoo_thoughtful::illuminati::redditgold:,1689514211.0,False,False,False,False,True
99,151aitz,197,/r/197/comments/151aitz/rule/,Real_FishGod,rule,2431,0.98,142,niche internet microcelebrity,1689524815.0,False,False,False,False,False
100,1514pkq,dankmemes,/r/dankmemes/comments/1514pkq/what_if/,Ok-Cod3750,What if...,7591,0.97,88,,1689509447.0,False,False,False,False,False
