rank,id,subreddit,permalink,author,title,score,upvote_ratio,num_comments,author_flair_text,created_utc,over_18,edited,stickied,locked,is_original_content
1,14ze8bk,Damnthatsinteresting,/r/Damnthatsinteresting/comments/14ze8bk/launch_of_chandrayaan3_sriharikota_india/,PromotionSolid8285,"Launch of Chandrayaan-3. Sriharikota, India 
",20799,0.93,530,,1689335101.0,False,False,False,True,False
2,14zdszk,WhitePeopleTwitter,/r/WhitePeopleTwitter/comments/14zdszk/utah_wants_female_athletes_period_info/,FalconLynx13,Utah wants female athletes’ period info,12741,0.97,1577,,1689333814.0,False,False,False,False,False
3,14zd64p,todayilearned,/r/todayilearned/comments/14zd64p/til_the_phantom_time_conspiracy_theory_claims_the/,Hashkovo,TIL the Phantom time Conspiracy theory claims the time period AD 614 to 911 never existed. The Theory claims these extra 300 years of History were fabricated in the middle ages to legitimise Otto's claim over the Holy Roman Empire. According to the theory we should be living in the year 1726.,10590,0.93,879,,1689331901.0,False,False,False,False,False
4,14zepr3,MadeMeSmile,/r/MadeMeSmile/comments/14zepr3/so_sweet/,IcecreamChuger,So sweet ,6033,0.95,102,,1689336513.0,False,False,False,False,False
5,14zecap,marvelmemes,/r/marvelmemes/comments/14zecap/really/,Melissaaaw,Really...,6582,0.97,147,Avengers,1689335435.0,False,False,False,False,False
6,14zeaze,meirl,/r/meirl/comments/14zeaze/me_irl/,StoneKidman,Me irl,6511,0.97,298,,1689335327.0,False,False,False,False,False
7,14zbn8j,PublicFreakout,/r/PublicFreakout/comments/14zbn8j/dog_abuser_gets_his_own_taste_of_medicine/,Confident_Doughnut54,Dog abuser gets his own taste of medicine,12788,0.94,811,,1689326826.0,True,False,False,False,False
8,14zg3im,facepalm,/r/facepalm/comments/14zg3im/guess_he_is_still_very_salty/,ShubhamG77,Guess he is still very salty,4676,0.95,579,,1689340281.0,False,False,False,False,False
9,14zcwev,worldnews,/r/worldnews/comments/14zcwev/russia_withdraws_almost_all_its_troops_from/,ledim35,Russia withdraws almost all its troops from Belarus – State Border Guard of Ukraine,6904,0.97,437,,1689331006.0,False,False,False,False,False
10,14zcx6q,MemePiece,/r/MemePiece/comments/14zcx6q/new_wave_of_piracy/,metalhiro,New wave of piracy,8273,0.95,143,,1689331086.0,False,False,False,False,False
11,14zc1sz,technology,/r/technology/comments/14zc1sz/producers_allegedly_sought_rights_to_replicate/,Sorin61,"Producers allegedly sought rights to replicate extras using AI, forever, for just $200",7756,0.97,852,,1689328201.0,False,False,False,False,False
12,14zcveg,Unexpected,/r/Unexpected/comments/14zcveg/lost_mrs_on_the_freeway/,NauTWitcher,Lost Mrs on the freeway,7238,0.96,129,,1689330922.0,False,False,False,False,False
13,14zbyus,politics,/r/politics/comments/14zbyus/domestic_abusers_are_using_abortion_bans_to/,Picture-unrelated,"Domestic Abusers Are Using Abortion Bans to Control Their Victims — After Roe v. Wade fell, the National Domestic Violence Hotline saw a 99-percent increase in callers reporting that people were trying to control their reproductive choices.",6764,0.97,226,:flag-or: Oregon,1689327923.0,False,False,False,False,False
14,14zdlg2,dankmemes,/r/dankmemes/comments/14zdlg2/meanwhile_in_switzerland/,Queasy_Network4385,Meanwhile in switzerland,5659,0.98,90,☣️,1689333186.0,False,False,False,False,False
15,14zbhos,IndiaSpeaks,/r/IndiaSpeaks/comments/14zbhos/chandrayaan_3_launched_successfully/,Dizzy_One3336,chandrayaan 3 launched successfully.,8823,0.92,622,,1689326305.0,False,False,False,False,False
16,14zbudg,news,/r/news/comments/14zbudg/johnson_johnson_sues_researchers_who_linked_talc/,rudhdogg,Johnson & Johnson sues researchers who linked talc to cancer,5814,0.97,565,,1689327505.0,False,False,False,False,False
17,14zafg1,memes,/r/memes/comments/14zafg1/its_weird_right/,NinjaBreadManOO,It's weird right?,11814,0.95,104,,1689322628.0,False,False,False,False,False
18,14ze71o,wholesomememes,/r/wholesomememes/comments/14ze71o/that_smile/,IcyPapayas,That smile :),3803,0.98,32,,1689334996.0,False,False,False,False,False
19,14zaxqx,comics,/r/comics/comments/14zaxqx/into_the_plugverse/,Miles_the_new_kid,Into the Plug-Verse,6488,0.95,83,,1689324425.0,False,False,False,False,True
20,14zfttq,tumblr,/r/tumblr/comments/14zfttq/on_the_fairness_of_life/,SaraAnnabelle,On the fairness of life,2668,0.97,72,,1689339594.0,False,False,False,False,False
21,14zb1ws,therewasanattempt,/r/therewasanattempt/comments/14zb1ws/to_doing_karen_activities/,el-proscrito,To doing karen activities ,6442,0.94,692,,1689324830.0,False,False,False,False,False
22,14z87cw,instantkarma,/r/instantkarma/comments/14z87cw/two_thieves_break_into_a_house_and_this_guy_ends/,NauTWitcher,"Two thieves break into a house, and this guy ends up inviting them back in to continue beating them",12540,0.95,644,,1689315051.0,False,False,False,False,False
23,14zfvuc,TikTokCringe,/r/TikTokCringe/comments/14zfvuc/pronouns/,ValarMorcoolis,Pronouns,2349,0.92,158,,1689339721.0,False,False,False,False,False
24,14za93r,BeAmazed,/r/BeAmazed/comments/14za93r/watching_fireworks_through_a_can/,OmerinoXsK123,Watching fireworks through a can,6059,0.95,56,,1689322004.0,False,False,False,False,False
25,14z9uwv,lotrmemes,/r/lotrmemes/comments/14z9uwv/stupid_fat_facebook/,WearyPixie,"Stupid, fat Facebook",6670,0.97,92,,1689320710.0,False,False,False,False,False
26,14z6s01,oddlysatisfying,/r/oddlysatisfying/comments/14z6s01/macro_view_of_boiling_water_and_salt/,SinjiOnO,Macro view of boiling water and salt,14802,0.96,229,,1689310503.0,False,False,False,False,False
27,14zdtp6,funny,/r/funny/comments/14zdtp6/he_got_fired_that_day_lol/,Azordax1988,He got fired that day lol 😂,2723,0.88,234,,1689333874.0,False,False,False,False,False
28,14zd6qp,ImTheMainCharacter,/r/ImTheMainCharacter/comments/14zd6qp/yeah_this_will_help_your_son/,InevitablePlne,"Yeah, this will help your son…",3012,0.91,558,,1689331952.0,False,False,False,False,False
29,14z7tmt,HolUp,/r/HolUp/comments/14z7tmt/does_it_still_counts/,GreedyHog2Fuk,Does it still counts?,12570,0.96,193,,1689313822.0,False,False,False,False,False
30,14zd4e1,PrequelMemes,/r/PrequelMemes/comments/14zd4e1/hhhmmm_3_will_do/,johnlen1n,Hhhmmm... 3 will do,3053,0.98,21,Good soldiers follow orders,1689331749.0,False,False,False,False,False
31,14z9xhy,Whatcouldgowrong,/r/Whatcouldgowrong/comments/14z9xhy/wcgw_taking_selfies_near_a_helicopter_about_to/,Dvorozhetskii,WCGW taking selfies near a helicopter about to take off.,5823,0.92,283,,1689320956.0,False,False,False,False,False
32,14zbybi,space,/r/space/comments/14zbybi/isro_successfully_launched_chandrayaan3_moon/,pinkcheems,ISRO successfully launched Chandrayaan-3 Moon Mission.,3558,0.94,241,,1689327875.0,False,False,False,False,False
33,14zc0h6,lotr,/r/lotr/comments/14zc0h6/we_have_lost_our_way_and_only_sam_can_help_us/,BeaAlighieri,We have lost our way and only Sam can help us find it!,3416,0.97,78,,1689328070.0,False,False,False,False,False
34,14zedra,AskReddit,/r/AskReddit/comments/14zedra/ladies_whats_your_equivalent_of_getting/,YouByYou,"Ladies, What’s your equivalent of getting distracted by boobs?",2349,0.9,1228,,1689335545.0,True,False,False,False,False
35,14zcdkt,ukraine,/r/ukraine/comments/14zcdkt/veteran_marries_his_sweetheart_never_forget/,lilmammamia,Veteran marries his sweetheart. Never forget Ukrainians’ resilience and never forgive Russia’s terror.,3159,0.94,87,,1689329251.0,False,False,False,False,False
36,14zagz4,NonPoliticalTwitter,/r/NonPoliticalTwitter/comments/14zagz4/wasnt_this_movie_failing_a_week_ago/,burakalp34,Wasn't this movie failing a week ago,4574,0.96,291,:blue1::blue2::1111::1112:,1689322789.0,False,False,False,False,False
37,14z89d2,nextfuckinglevel,/r/nextfuckinglevel/comments/14z89d2/robot_being_a_good_robot/,H_G_Bells,Robot being a good robot ,7609,0.97,232,,1689315242.0,False,False,False,False,False
38,14zdveo,shitposting,/r/shitposting/comments/14zdveo/glory_to_spez/,HailDialga,Glory to spez ,2428,0.97,55,,1689334025.0,False,False,False,False,False
39,14zdg1c,NatureIsFuckingLit,/r/NatureIsFuckingLit/comments/14zdg1c/kazakhstan_is_having_a_tiny_bit_of_a_bug_problem/,starstarstar42,🔥 Kazakhstan is having a *tiny* bit of a bug problem today,2469,0.98,261,,1689332725.0,False,False,False,False,False
40,14z73py,meme,/r/meme/comments/14z73py/murica/,Neoslayer,Murica 🇺🇲,13476,0.9,1300,,1689311495.0,False,False,False,False,False
41,14zey4l,pcmasterrace,/r/pcmasterrace/comments/14zey4l/how_high_do_you_think_this_will_go/,_Behemoth_,How high do you think this will go?,1890,0.99,160,,1689337179.0,False,False,False,False,False
42,14zch07,Genshin_Impact,/r/Genshin_Impact/comments/14zch07/hoyoverse_statement_regarding_the_missing_va/,TripleIVI,HoYoverse statement regarding the missing VA payments,2643,0.97,399,:kokomi:,1689329570.0,False,False,False,False,False
43,14z7tnp,WTF,/r/WTF/comments/14z7tnp/he_saw_things_he_never_forget/,Stepbro_canhelp,He saw things he never forget ,6101,0.95,187,,1689313824.0,False,False,False,False,False
44,14z9abe,Eldenring,/r/Eldenring/comments/14z9abe/look_at_this_super_safe_shortcut_out_of_fort/,Bubbles22486,look at this super safe shortcut out of fort laidd i very intentionally found,4806,0.98,85,,1689318695.0,False,False,False,False,False
45,14z8h8o,SipsTea,/r/SipsTea/comments/14z8h8o/bro_unlocked_the_ultimate_custom_skin/,UnconfirmedCatholic,Bro unlocked the ultimate custom skin. ,6021,0.96,187,,1689315975.0,False,False,False,False,False
46,14z3myl,subway,/r/subway/comments/14z3myl/since_were_on_the_topic_of_fuck_our_bosses_i/,alaskathunderfxck,since we’re on the topic of “fuck our bosses” i share the most satisfying text i’ve ever sent,30230,0.94,1607,,1689301078.0,False,False,False,True,False
47,14zf2kr,hockey,/r/hockey/comments/14zf2kr/sam_im_not_defending_galchenyuk_but_it_is_uh/,STLBooze3,"[Sam] I’m not defending Galchenyuk but it is, uh, interesting that damage to property and resisting arrest results in a pretty quick termination of contract, unlike some other allegations where the league is like, oh no what are we supposed to do",1625,0.96,352,STL - NHL :60711:,1689337521.0,False,False,False,False,False
48,14zajvj,facepalm,/r/facepalm/comments/14zajvj/i_guess_its_better_to_work_12_hours_7_days_a_week/,InvestmentPitiful335,"I guess it's better to work 12 hours, 7 days a week",15778,0.91,685,,1689323063.0,False,False,False,False,False
49,14zdldk,anime_irl,/r/anime_irl/comments/14zdldk/anime_irl/,Stetscopes,anime_irl,2058,0.97,58,:108:,1689333181.0,False,False,False,False,False
50,14zh60h,Gunners,/r/Gunners/comments/14zh60h/official_jurrien_timber_officially_signs_for/,MajedTF,[Official] Jurrien Timber officially signs for Arsenal,1223,0.98,145,,1689343052.0,False,False,False,False,False
51,14zc62t,CasualUK,/r/CasualUK/comments/14zc62t/just_put_our_dog_sitters_postcode_in_the_satnav/,BarryTownCouncil,Just put our dog sitters postcode in the satnav,2517,0.95,139,,1689328588.0,False,False,False,False,False
52,14zd9ub,TwoXChromosomes,/r/TwoXChromosomes/comments/14zd9ub/domestic_abusers_are_using_abortion_bans_to/,birdinthebush74,"Domestic Abusers Are Using Abortion Bans to Control Their Victims. After Roe v. Wade fell, the National Domestic Violence Hotline saw a 99-percent increase in callers reporting that people were trying to control their reproductive choices.",2103,0.98,76,=^..^=,1689332222.0,False,False,False,False,False
53,14zfhxo,conservativeterrorism,/r/conservativeterrorism/comments/14zfhxo/found_a_hive_of_deception_posted_this_gem_moments/,squeegeeking211,Found a hive of deception. Posted this gem moments ago; was I right???,1480,0.96,88,,1689338677.0,False,False,False,False,False
54,14zet03,oddlyterrifying,/r/oddlyterrifying/comments/14zet03/iceberg_near_a_community_in_newfoundland/,iamayeshaerotica,Iceberg near a community in Newfoundland,1608,0.95,59,,1689336775.0,False,False,False,False,False
55,14z8rgn,WhitePeopleTwitter,/r/WhitePeopleTwitter/comments/14z8rgn/to_absolutely_no_ones_surprise_that_qanon_movie/,JohnSheet69420,"To absolutely NO ONE’s surprise, that Qanon movie is being astroturfed",14900,0.93,1444,,1689316934.0,False,False,False,False,False
56,14ze6k7,videos,/r/videos/comments/14ze6k7/paul_rudd_announces_fucking_retirement/,LedoPizzaEater,PAUL RUDD ANNOUNCES FUCKING RETIREMENT!,1648,0.76,128,,1689334961.0,True,False,False,False,False
57,14zetor,whenthe,/r/whenthe/comments/14zetor/scratch_that/,johnlen1n,Scratch that,1487,0.98,29,Prepare to be disappointed,1689336828.0,False,False,False,False,False
58,14zfha8,UkraineWarVideoReport,/r/UkraineWarVideoReport/comments/14zfha8/ukrainian_wedding_glory_to_this_hero_glory_to/,Morfient,"Ukrainian wedding, glory to this hero, glory to Ukraine",1363,0.98,138,,1689338632.0,False,False,False,False,False
59,14z9f3u,rareinsults,/r/rareinsults/comments/14z9f3u/she_didnt_say_in_what_order/,toaster_shitter,she didn’t say in what order,3917,0.93,107,,1689319176.0,False,False,False,False,False
60,14zbvx1,gaming,/r/gaming/comments/14zbvx1/who_remembers_this_hidden_gem_never_finished_it/,maxchill1337,"Who remembers this hidden gem? Never finished it, but it was so unique and awesome",2237,0.87,415,,1689327651.0,False,False,False,False,False
61,14z443x,AnimalsBeingBros,/r/AnimalsBeingBros/comments/14z443x/blended_family/,westcoastcdn19,Blended family ,10588,0.97,132,,1689302496.0,False,False,False,False,False
62,14zcque,cats,/r/cats/comments/14zcque/guys_tell_me_should_i_adopt_him/,Nsra_,"Guys tell me , should I adopt him ??",1884,0.96,246,,1689330499.0,False,False,False,False,False
63,14zcd6d,JustGuysBeingDudes,/r/JustGuysBeingDudes/comments/14zcd6d/dudes_in_their_natural_habitat/,8wine,Dudes in their natural habitat,2037,0.98,34,,1689329209.0,False,False,False,False,False
64,14z9xd3,cursedcomments,/r/cursedcomments/comments/14z9xd3/cursed_shaving/,snowchild3101,Cursed_shaving,3445,0.96,68,,1689320944.0,False,False,False,False,False
65,14ze1lm,distressingmemes,/r/distressingmemes/comments/14ze1lm/shouldve_just_walked/,BrixProductions,Should've just walked.,1529,0.97,50,,1689334552.0,False,False,False,False,False
66,14ze84b,Futurology,/r/Futurology/comments/14ze84b/producers_allegedly_sought_rights_to_replicate/,ConsciousStop,"Producers allegedly sought rights to replicate extras using AI, forever, for just $200",1440,0.97,255,,1689335083.0,False,False,False,False,False
67,14zbuyn,weed,/r/weed/comments/14zbuyn/most_relatable_shit_ive_seen_in_a_while/,BuddyIWantTHAT,MOST RELATABLE SHIT I’VE SEEN IN A WHILE,2133,0.95,152,,1689327565.0,False,False,False,False,False
68,14zbceu,india,/r/india/comments/14zbceu/isros_chandrayaan3_successfully_launched/,shrigay,ISRO's Chandrayaan-3 successfully launched,2322,0.95,215,,1689325805.0,False,False,False,False,False
69,14zd1rf,popculturechat,/r/popculturechat/comments/14zd1rf/doja_cat_replying_a_fan_regarding_her_current/,Fun-Loss-4094,Doja cat replying a fan regarding her current boyfriend.,1708,0.95,199,,1689331512.0,False,False,False,False,False
70,14z9vk5,Unexpected,/r/Unexpected/comments/14z9vk5/russian_sam_fires_at_ukrainian_drone/,Penki-,Russian SAM fires at Ukrainian drone,8530,0.96,665,,1689320762.0,False,False,False,False,False
71,14z4hwb,ProgrammerHumor,/r/ProgrammerHumor/comments/14z4hwb/cantgethackedifyoucantusecomputer/,SmallPlayz,cantGetHackedIfYouCantUseComputer,9101,0.97,374,,1689303625.0,False,False,False,False,False
72,14z3gxp,HumansBeingBros,/r/HumansBeingBros/comments/14z3gxp/a_real_hero/,xzotc,A real hero,12237,0.94,170,,1689300600.0,False,False,False,False,False
73,14z7hs7,starterpacks,/r/starterpacks/comments/14z7hs7/reddit_rating_subs_starter_pack/,user19200281818,Reddit rating subs starter pack,4753,0.94,302,,1689312749.0,False,False,False,False,False
74,14zcb3z,TheLastAirbender,/r/TheLastAirbender/comments/14zcb3z/hello_zuko_gets_all_the_attention_but_can_we_just/,Xander_PrimeXXI,“Hello Zuko” gets all the attention but can we just appreciate how shocked and betrayed Aang looks when Appa licks Zuko?,1817,0.97,35,,1689329032.0,False,False,False,False,False
75,14zc3mw,fightporn,/r/fightporn/comments/14zc3mw/folded_like_a_lawn_chair/,frizzlemyshizzle,Folded like a lawn chair,1878,0.97,119,,1689328368.0,True,False,False,False,False
76,14z6m30,mildlyinfuriating,/r/mildlyinfuriating/comments/14z6m30/this_is_the_response_i_get_from_my_54_year_old/,QuirkyElderberry5672,this is the response i get from my 54 year old roommate to turn down the techno he plays at insane volumes…,5547,0.95,318,,1689309971.0,False,False,False,False,False
77,14ze4h4,LeopardsAteMyFace,/r/LeopardsAteMyFace/comments/14ze4h4/one_of_the_rightwingers_whos_been_supportive_but/,Turret_Run,One of the Rightwingers who's been supportive (but at times mildly critical) of Elon's actions on twitter apparently didn't get cut a check for it,1348,0.97,123,,1689334797.0,False,False,False,False,False
78,14zgmyt,Grimdank,/r/Grimdank/comments/14zgmyt/not_in_this_universe/,Luis-Dante,Not in this universe,957,0.96,368,Secretly 3 squats in a long coat,1689341699.0,False,False,False,False,False
79,14zczfm,politics,/r/politics/comments/14zczfm/dylan_mulvaney_has_higher_favorability_rating/,BelleAriel,"Dylan Mulvaney has higher favorability rating than Ron DeSantis, polls show",3741,0.93,325,,1689331298.0,False,False,False,False,False
80,14z17m6,toptalent,/r/toptalent/comments/14z17m6/longest_womens_elbow_plank_4_hours_20_minutes/,Crowxzn,"Longest women's elbow plank, 4 hours, 20 minutes (Dana Glowacka, 48)",55446,0.88,3020,,1689294229.0,False,False,False,False,False
81,14z8nwu,awfuleverything,/r/awfuleverything/comments/14z8nwu/monster_blames_young_girl_for_her_own_murder/,Prestigious_Gear_297,Monster blames young girl for her own murder,3463,0.97,129,,1689316602.0,True,False,False,False,False
82,14zdsml,science,/r/science/comments/14zdsml/research_found_body_mass_index_bmi_measurement_is/,giuliomagnifico,"Research found Body Mass Index (BMI) measurement is less sensitive to define obesity than we thought, instead, body fat percentage is a more reliable indicator of an individual's general health than BMI",1309,0.89,285,,1689333783.0,False,False,False,False,False
83,14zf5io,starwarsmemes,/r/starwarsmemes/comments/14zf5io/all_of_our_reactions_to_reading_that/,VacantlySavory,All of our reactions to reading that.,1101,0.98,35,,1689337743.0,False,False,False,False,False
84,14zbfek,4chan,/r/4chan/comments/14zbfek/anon_reflects_on_his_driving_experiences/,Escapist114,Anon reflects on his driving experiences,1950,0.95,95,/jp/edo,1689326094.0,False,False,False,False,False
85,14zfz1m,LifeProTips,/r/LifeProTips/comments/14zfz1m/lpt_dont_tell_people_youre_going_to_start/,DxDeadlockedxS,LPT- Don't tell people you're going to start something before you've done it,962,0.86,122,,1689339934.0,False,1689344418.0,False,False,False
86,14z11p2,BlackPeopleTwitter,/r/BlackPeopleTwitter/comments/14z11p2/somebody_needs_to_check_for_a_pulse/,districtcourt,Somebody needs to check for a pulse,17548,0.92,413,,1689293761.0,False,False,False,False,False
87,14zeqek,BikiniBottomTwitter,/r/BikiniBottomTwitter/comments/14zeqek/why_reddit_why/,elch3w,"Why Reddit, Why?",1109,0.96,67,:jelly:,1689336568.0,False,False,False,False,False
88,14zcrm9,LeagueOfMemes,/r/LeagueOfMemes/comments/14zcrm9/samira_who/,BerufsHartz4ler,Samira who?,1513,0.94,56,,1689330575.0,False,False,False,False,False
89,14z5wsu,LateStageCapitalism,/r/LateStageCapitalism/comments/14z5wsu/dont_threaten_me_with_a_good_time/,Distantmole,Don’t threaten me with a good time,5005,0.98,184,,1689307790.0,False,False,False,False,False
90,14za6lw,terriblefacebookmemes,/r/terriblefacebookmemes/comments/14za6lw/grandma_send_me_this_one/,RoseDragons,Grandma send me this one,2356,0.97,105,,1689321779.0,False,False,False,False,False
91,14z37js,movies,/r/movies/comments/14z37js/hollywoods_groundbreaking_ai_proposal_for_actors/,fungobat,Hollywood's 'Groundbreaking' AI Proposal for Actors Is a Nightmare,8080,0.95,1418,,1689299875.0,False,False,False,False,False
92,14zdc0q,GreenAndPleasant,/r/GreenAndPleasant/comments/14zdc0q/labour_party_just_lost_one_of_its_safest_council/,Overthrow_Capitalism,Labour Party just lost one of its safest council seats to an independent socialist candidate in Newham.,1310,0.96,92,,1689332420.0,False,False,False,False,False
93,14zbc5o,europe,/r/europe/comments/14zbc5o/on_this_day_1789_the_storming_of_the_bastille_has/,ledim35,"On this day 1789 - The Storming of the Bastille has taken place, the French revolution has begun",1845,0.96,140,Turkey,1689325781.0,False,False,False,False,False
94,14z4spi,HonkaiStarRail,/r/HonkaiStarRail/comments/14z4spi/this_is_how_yall_look_building_pity/,BaconBurritos,"this is how y'all look ""building pity""",7185,0.94,521,:Caelus::Kafka: aeon of misfortune,1689304497.0,False,False,False,False,False
95,14zbi2l,de,/r/de/comments/14zbi2l/schöne_sommerferien/,0711Markus,Schöne Sommerferien,1757,0.95,696,,1689326345.0,False,False,False,False,False
96,14z51m6,technicallythetruth,/r/technicallythetruth/comments/14z51m6/nono_he_is_correct/,sleslaying,"No,no He is correct",6909,0.97,219,,1689305205.0,False,False,False,False,False
97,14zecbn,lotrmemes,/r/lotrmemes/comments/14zecbn/i_think_spices_was_a_general_term_that_probably/,AssumptionBig1367,"I think ""Spices"" was a general term that probably included drugs like opium",2647,0.96,145,,1689335437.0,False,False,False,False,False
98,14z7pht,Overwatch,/r/Overwatch/comments/14z7pht/the_lucio_voice_actor_johnny_cruz_receives_a_dva/,ameliasedleyzt,The Lucio voice actor Johnny Cruz receives a Dva body pillow from a fan.,3595,0.97,59,,1689313458.0,False,False,False,False,False
99,14z4dw5,shittymoviedetails,/r/shittymoviedetails/comments/14z4dw5/elementals_has_the_second_worst_wait_what_the_fuck/,Dependent_Way_1038,"Elementals has the second worst- wait, what the fuck?",7711,0.96,502,,1689303300.0,False,False,False,False,False
100,14zbkmd,Awww,/r/Awww/comments/14zbkmd/siblings/,carebearstarefear,siblings,1701,0.97,55,,1689326585.0,False,False,False,False,False
