rank,id,subreddit,permalink,author,title,score,upvote_ratio,num_comments,author_flair_text,created_utc,over_18,edited,stickied,locked,is_original_content
1,14wrnzv,mildlyinfuriating,/r/mildlyinfuriating/comments/14wrnzv/saved_this_to_my_cart_yesterday_but_decided_to/,QuickWrenn,Saved this to my cart yesterday but decided to wait until today to buy it to get a sale price on Amazon Prime day.,43941,0.97,1856,,1689082676.0,False,False,False,False,False
2,14wtxbf,gaming,/r/gaming/comments/14wtxbf/microsoft_wins_ftc_fight_to_buy_activision/,Gab1024,Microsoft wins FTC fight to buy Activision Blizzard,12200,0.94,5343,,1689088101.0,False,False,False,False,False
3,14wvq3n,formuladank,/r/formuladank/comments/14wvq3n/meanwhile_at_the_alpha_tauri_hq/,SyiGG,Meanwhile at the Alpha Tauri HQ......,8092,0.98,155,BWOAHHHHHHH ,1689092170.0,False,False,False,False,False
4,14wqgze,funny,/r/funny/comments/14wqgze/a_working_printer_certainly_seems_farfetched/,standardkillchain,A working printer certainly seems far-fetched,29745,0.96,560,,1689079708.0,False,False,False,False,False
5,14ws36q,BeAmazed,/r/BeAmazed/comments/14ws36q/woman_tackles_fleeing_suspect/,CommercialBox4175,Woman Tackles Fleeing Suspect,16442,0.95,1429,,1689083679.0,False,False,False,False,False
6,14wsr47,politics,/r/politics/comments/14wsr47/ron_desantis_under_pressure_as_florida_malaria/,BelleAriel,Ron DeSantis under pressure as Florida malaria cases spread,9831,0.97,1267,,1689085245.0,False,False,False,False,False
7,14wt5zq,Tinder,/r/Tinder/comments/14wt5zq/i_guess_ice_cream_dates_are_considered_a_terrible/,Zhinii1,I guess ice cream dates are considered a terrible idea nowadays,9332,0.96,2063,,1689086236.0,False,False,False,False,False
8,14wqcer,WhitePeopleTwitter,/r/WhitePeopleTwitter/comments/14wqcer/dont_look_up/,Adelu1219,Don’t look up,18038,0.96,1523,:verified:,1689079373.0,False,False,False,False,False
9,14wuapm,NewsOfTheStupid,/r/NewsOfTheStupid/comments/14wuapm/fox_news_regular_who_accused_hunter_biden_of/,Maximum-Toast,Fox News regular who accused Hunter Biden of having nefarious ties to China is now being charged with having nefarious ties to China,6697,0.94,560,,1689088987.0,False,False,False,False,False
10,14wqp8z,nextfuckinglevel,/r/nextfuckinglevel/comments/14wqp8z/man_on_bed_suspended_by_parachutes_flies_away_and/,cutestudent,Man on bed suspended by parachutes flies away and takes a nap,24238,0.88,1049,,1689080313.0,False,False,False,False,False
11,14wqfqt,marvelmemes,/r/marvelmemes/comments/14wqfqt/so_basically_deadpool_was_the_one_who_fixed_the/,spidey20993,"So basically, Deadpool was the one who fixed the X-Men's outfit",16512,0.96,469,Spider-Man 🕷,1689079619.0,False,False,False,False,False
12,14wq61c,wholesomememes,/r/wholesomememes/comments/14wq61c/im_waiting/,ReynaAllman,I'm waiting...,20917,0.96,805,,1689078908.0,False,False,False,False,False
13,14wutri,memes,/r/memes/comments/14wutri/do_some_people_seriously_drink_coke_instead_of/,MrBloodyHyphen,Do some people seriously drink Coke instead of water everyday?,6797,0.97,713,,1689090180.0,False,False,False,False,False
14,14wt270,meirl,/r/meirl/comments/14wt270/meirl/,MaeLinkv,meirl,7535,0.97,195,,1689085983.0,False,False,False,False,False
15,14wq3oa,todayilearned,/r/todayilearned/comments/14wq3oa/til_james_bradley_calculated_the_speed_of_light/,Kipperis,TIL James Bradley calculated the speed of light with a 0.4% error margin in 1729,11839,0.97,420,,1689078725.0,False,False,False,False,False
16,14wuy8p,shitposting,/r/shitposting/comments/14wuy8p/praise_spez_for_forest_puppies/,NCR_Veteran_Rangers,Praise Spez For Forest Puppies,5838,0.98,99,,1689090461.0,False,False,False,False,False
17,14wrfst,OldSchoolCool,/r/OldSchoolCool/comments/14wrfst/if_your_default_mental_photo_of_marilyn_monroe_is/,filmroses,"If your default mental photo of Marilyn Monroe is an over-saturated glamour shot of her with her mouth open, please take a moment to replace it with this one of her giving zero fucks about some bears eating garbage. 1953",7745,0.94,298,,1689082141.0,False,False,False,False,False
18,14wrakh,tumblr,/r/tumblr/comments/14wrakh/thats_just_rabbits_vs_hares_all_over_again_lol/,Peter_Rodruigues,That's just rabbits vs hares all over again lol,9459,0.98,166,,1689081773.0,False,False,False,False,False
19,14wt5eu,facepalm,/r/facepalm/comments/14wt5eu/for_me_it_feels_weird_to_see_600_instead_if_1800/,clorastallworth,For me it feels weird to see 6:00 instead if 18:00..,6658,0.95,847,,1689086196.0,False,False,False,False,False
20,14wnngd,Damnthatsinteresting,/r/Damnthatsinteresting/comments/14wnngd/foal_had_close_call_the_dummy_foal_phenomenon/,Louna_Nova,Foal had close call - The dummy foal phenomenon,36035,0.96,835,,1689072035.0,False,False,False,False,False
21,14woftj,community,/r/community/comments/14woftj/the_bear_writers_know_whazzup/,GhOsT_wRiTeR_XVI,“The Bear” writers know whazz-up!,12914,0.94,402,,1689074236.0,False,False,False,False,False
22,14wtfgv,TwoXChromosomes,/r/TwoXChromosomes/comments/14wtfgv/am_i_being_manipulative_by_asking_for_a_vasectomy/,dontrockthejuicebox,Am I being manipulative by asking for a vasectomy?,4884,0.9,2496,,1689086916.0,False,False,False,False,False
23,14wuzor,BlackPeopleTwitter,/r/BlackPeopleTwitter/comments/14wuzor/the_key_to_being_a_successful_criminal_in_america/,sebeku2,The key to being a successful criminal in America is to be a rich person who doesn’t steal from other rich people.,3818,0.97,72,,1689090556.0,False,False,False,False,False
24,14wwbfl,MadeMeSmile,/r/MadeMeSmile/comments/14wwbfl/hero_woman_attempting_to_save_baby_ducks_from/,Unique_District_9381,Hero woman attempting to save baby ducks from storm drain,3402,0.99,110,,1689093484.0,False,False,False,False,False
25,14wpfno,SipsTea,/r/SipsTea/comments/14wpfno/bro_playing_chess_while_we_play_cheekers/,Alternative_Serve368,Bro playing chess while we play cheekers,9728,0.93,350,,1689076959.0,False,False,False,False,False
26,14wq4po,Animemes,/r/Animemes/comments/14wq4po/the_goat/,jjeg6804,THE G.O.A.T,9015,0.93,230,⠀,1689078801.0,False,False,False,False,False
27,14wnfs4,dankmemes,/r/dankmemes/comments/14wnfs4/happened_during_my_first_12_hours_in_la/,DoktoorDre,Happened during my first 12 hours in LA 💀,26508,0.89,1932,,1689071385.0,False,False,False,False,False
28,14ws7tk,me_irlgbt,/r/me_irlgbt/comments/14ws7tk/me_irlgbt/,Sonic_the_hedgedog,me_irlgbt,5386,0.92,60,MLM/Ace :mlm_ace:,1689083997.0,False,False,False,False,False
29,14wrj1x,oddlyterrifying,/r/oddlyterrifying/comments/14wrj1x/my_eyes_started_doing_a_this_really_cool_looking/,AHarris_poems,My eyes started doing a this really cool looking - different sizes thing. (Turns out it’s a tumour),6235,0.97,273,,1689082345.0,False,False,False,False,False
30,14wucft,oddlysatisfying,/r/oddlysatisfying/comments/14wucft/swan_family_using_pedestrian_crossing_to_cross/,yourSAS,Swan family using pedestrian crossing to cross the road,3697,0.97,103,,1689089096.0,False,False,False,False,False
31,14wn48x,worldnews,/r/worldnews/comments/14wn48x/nato_decision_on_moving_towards_ukraines/,MagnificentCat,NATO decision on moving towards Ukraine’s membership to be agreed in few hours – Secretary General,12047,0.95,943,,1689070344.0,False,False,False,False,False
32,14wpnff,technology,/r/technology/comments/14wpnff/san_francisco_protestors_are_disabling_autonomous/,chrisdh79,"San Francisco protestors are disabling autonomous vehicles using traffic cones | ""It's a great time""",6808,0.94,1032,,1689077532.0,False,False,False,False,False
33,14wtao4,WhitePeopleTwitter,/r/WhitePeopleTwitter/comments/14wtao4/gop_women_flip_more_than_a_jail_house_rat/,Tri734,GOP women flip more than a jail house rat,7395,0.99,235,,1689086560.0,False,False,False,False,False
34,14wom09,unpopularopinion,/r/unpopularopinion/comments/14wom09/you_cant_rarelynever_have_sex_with_your_partner/,EquivalentEmotion950,You can’t rarely/never have sex with your partner and expect them to be faithful.,15531,0.76,4507,,1689074720.0,False,False,False,False,False
35,14wowq7,Unexpected,/r/Unexpected/comments/14wowq7/disaster_save/,dtn4427,Disaster save ,8631,0.96,124,,1689075556.0,False,False,False,False,False
36,14wthlf,Whatcouldgowrong,/r/Whatcouldgowrong/comments/14wthlf/wcgw_using_a_printed_bag_while_coloring_your_hair/,Boojibs,WCGW using a printed bag while coloring your hair,3627,0.97,73,,1689087067.0,False,False,False,False,False
37,14wtrmg,news,/r/news/comments/14wtrmg/bank_of_america_fined_150_million_for_consumer/,cnbc_official,"Bank of America fined $150 million for consumer abuses including fake accounts, bogus fees",3351,0.98,257,,1689087751.0,False,False,False,False,False
38,14wnbxb,pcmasterrace,/r/pcmasterrace/comments/14wnbxb/getting_a_gaming_laptop_was_a_mistake_please_dont/,No_Locksmith_1458,Getting a gaming laptop was a mistake. Please don't buy a gaming laptop,13688,0.87,2066,Desktop,1689071035.0,False,False,False,False,False
39,14wq5c6,curb,/r/curb/comments/14wq5c6/finding_your_roots/,nikamats,Finding Your Roots,5647,0.96,341,,1689078853.0,False,False,False,False,False
40,14wtgg9,WTF,/r/WTF/comments/14wtgg9/so_many_questions/,kakapoopoopeepeeshir,So many questions,3461,0.96,475,,1689086992.0,False,False,False,False,False
41,14wnl6h,clevercomebacks,/r/clevercomebacks/comments/14wnl6h/thats_not_acceptable/,romanystock99,That's not acceptable.,11326,0.88,669,,1689071837.0,False,False,False,False,False
42,14wrb8p,ufc,/r/ufc/comments/14wrb8p/well_shit/,thehiguyz,Well Shit,4545,0.95,1103,,1689081821.0,False,False,False,False,False
43,14wvb9r,StarWars,/r/StarWars/comments/14wvb9r/ahsoka_official_trailer_disney/,indig0sixalpha,Ahsoka | Official Trailer | Disney+,2627,0.94,879,,1689091261.0,False,False,True,False,False
44,14wrq4m,popculturechat,/r/popculturechat/comments/14wrq4m/why_has_zendaya_been_getting_so_much_hate_since/,HiccupHaddockismine,Why has Zendaya been getting so much hate since the Challengers trailer dropped?,4338,0.91,776,,1689082818.0,False,False,False,False,False
45,14wp8m1,HolUp,/r/HolUp/comments/14wp8m1/hispanic_pitbull/,_Aladin,Hispanic pitbull,7120,0.98,114,,1689076435.0,False,False,False,False,False
46,14wpkri,WorkReform,/r/WorkReform/comments/14wpkri/ask_corporations_why_theyre_paying_their/,Sensitive-Jury-1456,Ask corporations why they’re paying their employees low wages,5572,0.96,142,,1689077334.0,False,False,False,False,False
47,14wpmhe,LateStageCapitalism,/r/LateStageCapitalism/comments/14wpmhe/ask_corporations_why_theyre_paying_their/,Sensitive-Jury-1456,Ask corporations why they’re paying their employees low wages,5453,0.97,185,,1689077462.0,False,False,False,False,False
48,14wo9fb,cats,/r/cats/comments/14wo9fb/this_is_true_love/,Melissa_Lewes,this is true love,7327,0.98,85,,1689073741.0,False,False,False,False,False
49,14wvddw,TrueUnpopularOpinion,/r/TrueUnpopularOpinion/comments/14wvddw/its_not_transphobic_to_say_trans_women_shouldnt/,AphidCraft,It's not transphobic to say trans women shouldn't be allowed in women's sports and I'm tired of people saying otherwise.,2793,0.73,2352,,1689091371.0,False,False,False,False,False
50,14wugnl,diablo4,/r/diablo4/comments/14wugnl/me_during_legion_event/,jakartaundercover,Me during Legion Event: ,2783,0.98,196,,1689089366.0,False,False,False,False,False
51,14wqgdr,midjourney,/r/midjourney/comments/14wqgdr/cast_of_the_office_in_gta_v_style/,Dankuruma,Cast of 'The Office' in GTA V Style.,4900,0.92,410,,1689079664.0,False,False,False,False,False
52,14wulw5,anime_irl,/r/anime_irl/comments/14wulw5/anime_irl/,Narrow_Association43,anime_irl,2781,0.93,201,,1689089697.0,False,False,False,False,False
53,14wny99,TrueOffMyChest,/r/TrueOffMyChest/comments/14wny99/thought_he_stood_me_up_on_our_date_turns_out_he/,quanvuminhtran,"Thought he stood me up on our date, turns out he died...",7373,0.97,237,,1689072900.0,False,False,False,False,False
54,14wt663,doordash,/r/doordash/comments/14wt663/should_i_be_worried/,ItsPittz,Should I be worried?,3209,0.97,359,,1689086248.0,False,False,False,False,False
55,14wutyw,baseball,/r/baseball/comments/14wutyw/sny_mets_pete_alonso_signed_all_of_his_home_run/,swbl216,[SNY Mets] Pete Alonso signed all of his home run derby balls before hitting them into the stands,2519,0.98,176,New York Mets :nym2:,1689090193.0,False,False,False,False,False
56,14wunuf,NonPoliticalTwitter,/r/NonPoliticalTwitter/comments/14wunuf/its_make_sense/,hystericalAylin52,It's Make Sense,2603,0.98,10,:blue1::blue2::1111::1112:,1689089812.0,False,False,False,False,False
57,14wsi6f,AITAH,/r/AITAH/comments/14wsi6f/aitah_for_not_allowing_my_parents_to_sleep_in_the/,ResponsibleWinter758,AITAH for not allowing my parents to sleep in the same bed?,3372,0.95,846,,1689084652.0,False,False,False,False,False
58,14wsdum,Superstonk,/r/Superstonk/comments/14wsdum/citadel_securities_and_citadel_market_maker_have/,monkeyshinenyc,Citadel Securities and Citadel Market Maker Have been going after GG hard.,3995,0.94,280,tag u/Superstonk-Flairy for a flair,1689084358.0,False,False,False,False,False
59,14wmfu3,TikTokCringe,/r/TikTokCringe/comments/14wmfu3/why_dont_my_kids_trust_me_ive_never_did_something/,Arkatoshi,Why don’t my kids trust me? I‘ve never did something wrong in the education. Why won’t they tell me anything?,13905,0.83,1652,,1689068173.0,False,False,False,False,False
60,14wsp3l,inthenews,/r/inthenews/comments/14wsp3l/excongressman_suggests_hunter_biden_alleged/,PandaMuffin1,Ex-Congressman suggests Hunter Biden alleged laptop data fabricated,3105,0.92,511,,1689085110.0,False,False,False,False,False
61,14ww9s6,IllegallySmolCats,/r/IllegallySmolCats/comments/14ww9s6/smol_uneducated_bean/,Cautious-or-paranoid,smol uneducated bean,2011,0.98,55,,1689093378.0,False,False,False,False,False
62,14wr0cs,dataisbeautiful,/r/dataisbeautiful/comments/14wr0cs/oc_first_6_months_of_orbital_launch_attempts_in/,TK_Say,[OC] First 6 Months of orbital launch attempts in 2023. From launch site to orbit.,3705,0.97,209,,1689081071.0,False,False,False,False,False
63,14wrfyw,batman,/r/batman/comments/14wrfyw/an_umbrella_batman_three_jokers_1/,Cmyers1980,“An umbrella.” (Batman: Three Jokers #1),3606,0.98,198,,1689082152.0,False,False,False,False,False
64,14wxtov,Grimdank,/r/Grimdank/comments/14wxtov/theyre_on_the_us/,CandidateEuphoric917,They're on the us,1640,0.94,152,,1689096868.0,False,False,False,False,False
65,14wn8ur,LeopardsAteMyFace,/r/LeopardsAteMyFace/comments/14wn8ur/mypillow_is_auctioning_off_equipment_after/,ToffeeFever,MyPillow is auctioning off equipment after retailers pull its products: CEO Mike Lindell says annual sales fell $100 million after several big-box retailers cut ties following his election claims.,6606,0.97,541,,1689070770.0,False,False,False,False,False
66,14wpd99,MemePiece,/r/MemePiece/comments/14wpd99/the_only_reason_he_couldve_possibly_put_that_on/,metalhiro,The only reason he could’ve possibly put that on,5111,0.94,88,,1689076806.0,False,False,False,False,False
67,14wt4v5,whenthe,/r/whenthe/comments/14wt4v5/what_the_fuck/,SirShadyVI,what the fuck,2960,0.98,74,local touhou poster (moriya shrine's #1 conspirator),1689086162.0,False,False,False,False,False
68,14wlwyr,comics,/r/comics/comments/14wlwyr/expressing_out/,GrumpyMashy,Expressing Out,12066,0.89,307,,1689066411.0,False,False,False,False,True
69,14wq9v4,awfuleverything,/r/awfuleverything/comments/14wq9v4/i_guess_this_takes_the_meaning_of_shoey_to_the/,FreeDeterminism,I guess this takes the meaning of “shoey” to the next level…,4422,0.93,319,,1689079195.0,False,False,False,False,False
70,14wpbfy,lotrmemes,/r/lotrmemes/comments/14wpbfy/witchcraft/,nsfw_lotr_memes__,Witchcraft.,4719,0.95,64,,1689076657.0,False,False,False,False,False
71,14wr86i,Damnthatsinteresting,/r/Damnthatsinteresting/comments/14wr86i/the_last_ford_fiesta_at_the_production_line_it/,UnlikeUday,The last Ford Fiesta at the production line. It has the signatures of all the staff that were involved with this car.,6656,0.98,177,,1689081616.0,False,False,False,False,False
72,14wsyet,ContagiousLaughter,/r/ContagiousLaughter/comments/14wsyet/clearly_her_priorities_are_different/,colorless_man,clearly her priorities are different ,2717,0.97,71,,1689085737.0,False,False,False,False,False
73,14wsug9,antiwork,/r/antiwork/comments/14wsug9/it_annoys_me_that_there_is_a_false_sense_of/,brx9446,It annoys me that there is a false sense of urgency in corporate jobs,2691,0.99,259,,1689085467.0,False,False,False,False,False
74,14wrs17,DunderMifflin,/r/DunderMifflin/comments/14wrs17/jim_was_no_company_man/,Hendo_____,Jim was no company man,3046,0.91,168,,1689082941.0,False,False,False,False,False
75,14woufn,science,/r/science/comments/14woufn/hospital_understaffing_and_poor_work_conditions/,mvea,Hospital understaffing and poor work conditions associated with physician and nurse burnout and intent to leave. The solutions are not resilience training for clinicians to better cope with adverse working conditions but organizational improvements for safe workloads and better work-life balance.,4313,0.97,295,MD/PhD/JD/MBA | Professor | Medicine,1689075376.0,False,False,False,False,False
76,14wocph,MadeMeSmile,/r/MadeMeSmile/comments/14wocph/my_man_got_moves/,IllTechnician4571,My man got moves!,12156,0.95,125,,1689073993.0,False,False,False,False,False
77,14wqfoc,discordVideos,/r/discordVideos/comments/14wqfoc/clown/,HotFireBall,Clown,3708,0.97,68,,1689079613.0,False,False,False,False,False
78,14wrgfx,formuladank,/r/formuladank/comments/14wrgfx/honey_badger_what_happened/,Chell_the_assassin,"Honey Badger, what happened",5601,0.98,157,Mika ends his sa🅱️🅱️atical ,1689082182.0,False,False,False,False,False
79,14wqolf,PoliticalCompassMemes,/r/PoliticalCompassMemes/comments/14wqolf/something_something_student_loans/,lucimorningstar_,Something something student loans,3427,0.79,1013,:libleft: - Lib-Left,1689080265.0,False,False,False,False,False
80,14wo0fw,memes,/r/memes/comments/14wo0fw/if_you_came_to_australia_for_a_holiday_how_was_it/,K-boomX94,"If you came to Australia for a holiday, how was it?",14424,0.97,549,,1689073074.0,False,False,False,False,False
81,14wvbju,movies,/r/movies/comments/14wvbju/wonka_official_trailer/,ICumCoffee,Wonka | Official Trailer,1759,0.83,1286,,1689091275.0,False,False,False,False,False
82,14wle0k,ProgrammerHumor,/r/ProgrammerHumor/comments/14wle0k/kindoflogic/,Strange_Dragonfly964,kindOfLogic,9116,0.95,230,:py:,1689064642.0,False,False,False,False,False
83,14wsde5,terriblefacebookmemes,/r/terriblefacebookmemes/comments/14wsde5/because_liberals_are_dumb_you_know/,FashionLurkerGermany,Because Liberals are dumb you know🤣🤣🤣🤣🤣🤣,2564,0.92,197,,1689084328.0,False,False,False,False,False
84,14wpqdj,Eldenring,/r/Eldenring/comments/14wpqdj/if_elden_ring_had_multiple_mounts_it_would_be/,Another_Saint,"if Elden Ring had multiple mounts it would be cool if each one was unique, like this",3620,0.96,268,,1689077746.0,False,False,False,False,False
85,14wujyh,Eyebleach,/r/Eyebleach/comments/14wujyh/cisco_feeling_handsome/,GanjaLogic,Cisco feeling handsome,1816,0.98,28,,1689089572.0,False,False,False,False,False
86,14wvgus,Serverlife,/r/Serverlife/comments/14wvgus/love_this_job_how_do_i_quit/,DOJayShay,Love This Job! How Do I Quit??,1638,0.91,434,,1689091575.0,False,False,False,False,False
87,14wriz1,Catswithjobs,/r/Catswithjobs/comments/14wriz1/too_much_work_must_eep/,Typical_Connection98,Too... much work... must... eep,2660,0.98,22,,1689082339.0,False,False,False,False,False
88,14wuckl,ThatsInsane,/r/ThatsInsane/comments/14wuckl/bullet_came_through_my_house/,Anxiety_Enthusiast,Bullet came through my house.,1851,0.98,360,,1689089105.0,False,False,False,False,False
89,14wqi7l,PeterExplainsTheJoke,/r/PeterExplainsTheJoke/comments/14wqi7l/i_sent_this_5_friends_none_of_them_could_explain/,ExquitsiteLibertaria,"I sent this 5 friends, none of them could explain me the joke.",3166,0.94,372,,1689079803.0,False,False,False,False,False
90,14wtvyh,maybemaybemaybe,/r/maybemaybemaybe/comments/14wtvyh/maybe_maybe_maybe/,ff-dvl,Maybe Maybe Maybe,1932,0.97,27,,1689088011.0,False,False,False,False,False
91,14wqmza,Frugal,/r/Frugal/comments/14wqmza/prime_day_amazon_is_a_marketing_event_not_a_deal/,reloaded890,"Prime Day (Amazon) is a marketing event, not a deal day.",2860,0.94,297,,1689080149.0,False,False,False,False,False
92,14wq9b3,facepalm,/r/facepalm/comments/14wq9b3/mid_century_modern_prison_cell/,almonakinvader,Mid century modern prison cell,6053,0.99,242,,1689079154.0,False,False,False,False,False
93,14wxqt6,MaliciousCompliance,/r/MaliciousCompliance/comments/14wxqt6/gonna_call_the_cops_over_a_toilet_sure_enjoy/,Colt_kun,Gonna call the cops over a toilet? Sure. Enjoy signing off that OT.,1198,0.92,173,,1689096682.0,False,1689097168.0,False,False,True
94,14wngsl,politics,/r/politics/comments/14wngsl/republican_women_learn_the_hard_way_complicity/,Picture-unrelated,"Republican women learn the hard way: Complicity will not protect you — The Freedom Caucus ousts Marjorie Taylor Greene and Ron DeSantis ends alimony for older, mostly conservative women",8701,0.95,591,:flag-or: Oregon,1689071462.0,False,False,False,False,False
95,14wrok5,todayilearned,/r/todayilearned/comments/14wrok5/til_that_the_impact_of_boxing_gloves_on_the/,davrob60-2,"TIL that the impact of boxing gloves on the injuries is a controversial issue, a report by the British Medical Association concluded that glove do not reduce brain injuries and may even increase them.",4374,0.97,259,,1689082714.0,False,False,False,False,False
96,14wxe8h,nottheonion,/r/nottheonion/comments/14wxe8h/mike_lindell_selling_off_mypillow_equipment_they/,Pineapple__Jews,Mike Lindell Selling Off MyPillow Equipment: They ‘Did Cancel Culture On Us’,1238,0.96,279,,1689095892.0,False,False,False,False,False
97,14wqwmm,WhitePeopleTwitter,/r/WhitePeopleTwitter/comments/14wqwmm/remember_find_11780_votes_today_a_grand_jury_in/,Travismatthew08,"Remember ""Find 11,780 votes?"" Today a Grand Jury in Georgia decides whether to charge Trump with felony charges.",9519,0.98,392,,1689080803.0,False,False,False,False,False
98,14wtyrf,ukraine,/r/ukraine/comments/14wtyrf/just_in_case_you_needed_any_more_proof_that/,asseatingleech,Just in case you needed any more proof that Lithuania is absolutely based. This is one of the buses specifically for visitors to the NATO summit.,1798,0.98,53,UK,1689088199.0,False,False,False,False,False
99,14wu412,PS5,/r/PS5/comments/14wu412/microsoft_has_won_their_case_against_the_ftc_to/,hybroid,Microsoft has won their case against the FTC to acquire Activision Blizzard as Judge Corley has denied the FTC's preliminary injunction request (PDF link),1740,0.9,2059,,1689088546.0,False,False,False,False,False
100,14wsrt2,wholesomememes,/r/wholesomememes/comments/14wsrt2/crow_friend/,King_Pee,Crow friend,3773,0.99,51,,1689085290.0,False,False,False,False,False
