rank,id,subreddit,permalink,author,title,score,upvote_ratio,num_comments,author_flair_text,created_utc,over_18,edited,stickied,locked,is_original_content
1,14rffsz,Damnthatsinteresting,/r/Damnthatsinteresting/comments/14rffsz/jeanclaude_van_damme_in_the_original_predator/,vitoskito,"Jean-Claude Van Damme in the original Predator suit design before he was fired from the film, 1987.",20683,0.98,809,,1688574085.0,False,False,False,False,False
2,14rel63,mildlyinfuriating,/r/mildlyinfuriating/comments/14rel63/the_waiter_charging_me_87_for_what_should_have/,thetownslore,The Waiter charging me $87 for what should have been a $7 tip despite me writing the total at the bottom ($45.23),19584,0.95,1939,,1688572327.0,False,False,False,False,False
3,14remxg,WhitePeopleTwitter,/r/WhitePeopleTwitter/comments/14remxg/why_do_so_many_americans_oppose_something_that/,TrumpterOFyvie,Why do so many Americans oppose something that will absolutely improve everyone’s quality of life?,13992,0.96,1997,,1688572420.0,False,False,False,False,False
4,14rgrpo,facepalm,/r/facepalm/comments/14rgrpo/i_hope_this_is_satire_of_not_someone_has_never/,Ghost_Hunter45,I hope this is satire. Of not someone has never picked a book up,12532,0.9,1696,,1688576831.0,False,False,False,False,False
5,14rh7mo,todayilearned,/r/todayilearned/comments/14rh7mo/til_in_2011_abercrombie_fitch_offered_mike_the/,Texas_Rockets,"TIL in 2011 Abercrombie & Fitch offered Mike ‘The Situation’ Sorrentino (from ‘Jersey Shore’) $10,000 not to wear the company's clothes because they felt it would cause “significant damage” to their image.",7652,0.97,302,,1688577772.0,True,False,False,False,False
6,14rcvn0,oddlyterrifying,/r/oddlyterrifying/comments/14rcvn0/what_rip_current_looks_like/,zhangyuandyou,What rip current looks like,20276,0.95,677,,1688568696.0,False,False,False,False,False
7,14rdagn,oddlysatisfying,/r/oddlysatisfying/comments/14rdagn/shiba_spa_treatment/,nikamats,Shiba spa treatment,18754,0.91,390,,1688569562.0,False,False,False,False,False
8,14reoiq,Unexpected,/r/Unexpected/comments/14reoiq/crazy_arms_from_hell/,Antony_2805,crazy arms from hell,11939,0.91,133,,1688572508.0,False,False,False,False,True
9,14rcmim,gaming,/r/gaming/comments/14rcmim/n64_rug_i_made/,gandostar,N64 Rug I made,11782,0.97,282,,1688568172.0,False,False,False,False,False
10,14rdmv8,nextfuckinglevel,/r/nextfuckinglevel/comments/14rdmv8/a_guy_collapsing_a_building_that_had_been_damaged/,Kartalnout,"A guy collapsing a building that had been damaged by the recent earthquake in Malatya/Turkey by throwing a stone, yes stone.",12808,0.92,585,,1688570312.0,False,False,False,False,False
11,14rafp8,MadeMeSmile,/r/MadeMeSmile/comments/14rafp8/ukrainian_soldiers_meeting_with_their_families/,WhiteLikeCocain,Ukrainian soldiers meeting with their families after the liberation of Kherson,25031,0.92,849,,1688563056.0,False,False,False,False,False
12,14rdz9b,HolUp,/r/HolUp/comments/14rdz9b/where_can_i_find/,Year-20-20,Where can I find?,9321,0.96,402,  :q1::q2::q3::q4:,1688571041.0,False,False,False,False,False
13,14rfhvx,tumblr,/r/tumblr/comments/14rfhvx/flamingos_are/,Old_Specialist7892,Flamingos are....,6234,0.98,77,,1688574199.0,False,False,False,False,False
14,14rd7ia,AnimalsBeingBros,/r/AnimalsBeingBros/comments/14rd7ia/this_farmer_is_sad_and_first_dogs_try_to_cheer/,Careful_Cup4484,"This farmer is sad, and first, dogs try to cheer him. When they can't, they call cows & donkeys",8098,0.96,205,,1688569385.0,False,False,False,False,False
15,14ra0fy,FunnyandSad,/r/FunnyandSad/comments/14ra0fy/this_is_not_logical/,Sensitive-Jury-1456,This is not logical.,17510,0.91,1362,,1688562031.0,False,False,False,False,False
16,14rfi8r,CrazyFuckingVideos,/r/CrazyFuckingVideos/comments/14rfi8r/here_come_the_firework_videos/,_Deerake,Here come the firework videos…,5554,0.98,582,,1688574219.0,True,False,False,False,False
17,14riry5,clevercomebacks,/r/clevercomebacks/comments/14riry5/this_man_did_not_mess_around_respect/,FormalHearta,This man did not mess around. Respect.,3614,0.96,149,,1688581087.0,False,False,False,False,False
18,14rdvx6,memes,/r/memes/comments/14rdvx6/underwater_new_york_city/,thepositivepandemic,Underwater New York City.,9331,0.98,53,OC Meme Maker,1688570834.0,False,False,False,False,False
19,14rbtmk,TikTokCringe,/r/TikTokCringe/comments/14rbtmk/fill_in_the_blank_dr_brady_is_my/,Devz0r,Fill in the blank: Dr Brady is my _____,9539,0.93,694,,1688566346.0,False,False,False,False,False
20,14rb1f6,wholesomememes,/r/wholesomememes/comments/14rb1f6/mister_smitten/,King_Pee,Mister Smitten,11171,0.98,46,,1688564514.0,False,False,False,False,False
21,14rgnm9,Whatcouldgowrong,/r/Whatcouldgowrong/comments/14rgnm9/not_looking_before_reversing_out_of_your_driveway/,uchman365,Not looking before reversing out of your driveway ,4544,0.97,692,,1688576595.0,False,False,False,False,False
22,14r7ocp,therewasanattempt,/r/therewasanattempt/comments/14r7ocp/to_be_a_creep_on_the_flight_and_get_away_with_it/,Brain-Fiddler,To be a creep on the flight and get away with it ,56688,0.95,1501,,1688555552.0,False,False,False,False,False
23,14rd1fm,OldSchoolCool,/r/OldSchoolCool/comments/14rd1fm/the_ice_man_man_delivering_a_25lb_block_of_ice/,gegorb,"The ice man man delivering a 25lb block of ice. Photograph taken in 1928 in Houston, Texas. Circa 1928",5990,0.98,492,,1688569045.0,False,False,False,False,False
24,14rc2ns,WTF,/r/WTF/comments/14rc2ns/felon_elbows_lawyer_in_the_face_after_conviction/,JuicySpark,Felon elbows lawyer in the face after conviction.,6637,0.96,471,,1688566891.0,False,False,False,False,False
25,14r9lh2,technology,/r/technology/comments/14r9lh2/massive_norwegian_phosphate_rock_deposit_can_meet/,Sorin61,"Massive Norwegian phosphate rock deposit can meet fertilizer, solar, and EV battery demand for 100 years",9676,0.96,714,,1688560959.0,False,False,False,False,False
26,14r7z50,worldnews,/r/worldnews/comments/14r7z50/russians_die_under_mysterious_circumstances_in/,Beyond_The_Dim,Russians die under mysterious circumstances in Mariupol – City Council,14428,0.94,1012,,1688556442.0,False,False,False,False,False
27,14rellz,WhitePeopleTwitter,/r/WhitePeopleTwitter/comments/14rellz/the_most_iconic_4th_of_july_anthem_is_also_the/,JediRunner13,The most Iconic 4th of July anthem is also the most ironic,10679,0.99,384,,1688572348.0,False,False,False,False,False
28,14rbu25,NonPoliticalTwitter,/r/NonPoliticalTwitter/comments/14rbu25/i_guess_we_could_try/,KingFahad360,I guess we could try.,6503,0.96,333,:blue1::blue2::1111::1112:,1688566375.0,False,False,False,False,False
29,14r8fma,antiwork,/r/antiwork/comments/14r8fma/i_really_need_you_to_train_your_replacement_right/,GentlyUsedOtter,"""I really need you to train your replacement right.""",11566,0.96,483,,1688557827.0,False,False,False,False,False
30,14rdcot,pcmasterrace,/r/pcmasterrace/comments/14rdcot/is_there_a_dlc_to_get_more_fps/,space0watch,Is there a DLC to get more fps?,5132,0.94,453,,1688569695.0,False,False,False,False,False
31,14rbfh2,me_irlgbt,/r/me_irlgbt/comments/14rbfh2/me_irlgbt/,Sonic_the_hedgedog,me_irlgbt,6788,0.94,54,MLM/Ace :mlm_ace:,1688565451.0,False,False,False,False,False
32,14rcm9b,shitposting,/r/shitposting/comments/14rcm9b/how_i_met_your_mother_praise_spez/,Top-Evidence-2807,How I met your mother (praise Spez),6611,0.96,83,,1688568155.0,False,False,True,False,False
33,14r7fs6,aww,/r/aww/comments/14r7fs6/john_oliver_says_that_continuing_to_use_a_website/,NotDavid-Jatt,"John Oliver says that continuing to use a website that you're ""protesting"" isn't really a protest.",17042,0.86,1175,,1688554860.0,False,False,False,False,False
34,14ra9v3,iamatotalpieceofshit,/r/iamatotalpieceofshit/comments/14ra9v3/girl_pretends_to_clean_up_a_beach_for_her_social/,kakapoopoopeepeeshir,Girl pretends to clean up a beach for her social media content then proceeds to leave the trash bags on the beach. ,7563,0.97,406,,1688562682.0,False,False,False,False,False
35,14rb6my,BrandNewSentence,/r/BrandNewSentence/comments/14rb6my/good_lord/,TicTacTax2007,Good lord,6597,0.95,306,,1688564861.0,False,False,False,False,False
36,14raeps,LateStageCapitalism,/r/LateStageCapitalism/comments/14raeps/xpost_this_protest_sign_against_police_brutality/,FuckingContinue278,[X-post] This protest sign against police brutality.,6489,0.97,94,,1688562987.0,False,False,False,False,False
37,14rb5i1,horror,/r/horror/comments/14rb5i1/simon_pegg_says_people_dont_fcking_need_shaun_of/,Neo2199,Simon Pegg Says People Don’t ‘F*cking Need’ ‘Shaun of the Dead 2:’ ‘Move On’,5764,0.96,586,,1688564779.0,False,False,False,False,False
38,14rib3i,todayilearned,/r/todayilearned/comments/14rib3i/til_that_chuck_e_cheese_secretly_sold_pizzas_on/,Public_Basil_4416,TIL That Chuck E. Cheese Secretly Sold Pizzas on Delivery Apps During the Pandemic Under the Name “Pasqually Pizza”,5024,0.96,365,,1688580089.0,False,False,False,False,False
39,14r7req,BeAmazed,/r/BeAmazed/comments/14r7req/a_roof_window_turning_into_a_small_balcony/,Interesting-Gear-819,A roof window turning into a small balcony,14905,0.91,371,,1688555806.0,False,False,False,False,False
40,14rbr90,whenthe,/r/whenthe/comments/14rbr90/what_the_actual_fuck_has_the_world_come_to/,UpsidownZZ,What the actual fuck has the world come to?,6470,0.96,292,,1688566196.0,False,False,False,False,False
41,14rc6pm,facepalm,/r/facepalm/comments/14rc6pm/its_not_that_hard_he_says_to_a_parody_account/,HamstersBoobsPizza,"""It's not that hard"" He says to a parody account",14327,0.97,384,,1688567142.0,False,False,False,False,False
42,14rb7ny,HonkaiStarRail,/r/HonkaiStarRail/comments/14rb7ny/basically_the_great_aeons/,AsaCocoPeko,Basically the Great Aeons,6566,0.94,222,All Hail the Master Diviner :Fuxuan:,1688564937.0,False,False,False,False,False
43,14rb75o,insanepeoplefacebook,/r/insanepeoplefacebook/comments/14rb75o/literally_1984_but_like_unironically_said/,velduz,Literally 1984 but like unironically said.,5464,0.96,303,,1688564898.0,False,False,False,False,False
44,14r8o5h,maybemaybemaybe,/r/maybemaybemaybe/comments/14r8o5h/maybe_maybe_maybe/,tactful_adelyn8,Maybe maybe maybe,8866,0.89,132,,1688558504.0,False,False,False,False,False
45,14reoiz,AskReddit,/r/AskReddit/comments/14reoiz/you_accidentally_left_your_cocaine_at_the_white/,Alaskan_Lost,You accidentally left your cocaine at the White House. What do you do now?,3151,0.91,1898,,1688572509.0,False,False,False,False,False
46,14r9wg2,MaliciousCompliance,/r/MaliciousCompliance/comments/14r9wg2/management_thought_they_didnt_need_me_turns_out/,Hot-Wallaby-6402,"Management thought they didn't need me, turns out they decided to try and sue me",5480,0.96,159,,1688561728.0,False,False,False,False,True
47,14r7lgr,BlackPeopleTwitter,/r/BlackPeopleTwitter/comments/14r7lgr/they_need_to_lock_him_up_fast_because_he_is/,imjustheretodomyjob,they need to lock him up FAST because he is FURIOUS,8309,0.95,254,☑️ / Mod,1688555308.0,False,False,False,False,False
48,14rg6a3,comics,/r/comics/comments/14rg6a3/invention/,JimKB,invention,2490,0.99,37,Jim Benton Cartoons,1688575596.0,False,False,False,False,False
49,14rcjv1,OnePunchMan,/r/OnePunchMan/comments/14rcjv1/battle_of_the_brainrot/,GodNonon,Battle of the Brainrot,3773,0.96,115,Nonon One Punches Saitama,1688568008.0,False,False,False,False,False
50,14r9hhl,marvelmemes,/r/marvelmemes/comments/14r9hhl/whats_ur_favourite_song_moment_in_marvel/,ellycutexx,What`s ur favourite song moment in Marvel ?,6513,0.92,889,Avengers,1688560654.0,False,False,False,False,False
51,14r7noz,movies,/r/movies/comments/14r7noz/new_alien_movie_has_wrapped_filming_ahead_of_2024/,tylerthe-theatre,New Alien movie has wrapped filming ahead of 2024 release,7553,0.94,1183,,1688555494.0,False,False,False,False,False
52,14ra6n4,PrequelMemes,/r/PrequelMemes/comments/14ra6n4/you_remember_of_me/,seguace_di_hog_rider,You Remember of me,5353,0.98,73,#1 Jar Jar fan,1688562456.0,False,False,False,False,False
53,14r9ldh,teenagers,/r/teenagers/comments/14r9ldh/how_do_you_come_up_with_that_though/,PheonixGalaxy,How do you come up with that though?,6578,0.97,254,16,1688560951.0,False,False,False,False,False
54,14rbquf,Damnthatsinteresting,/r/Damnthatsinteresting/comments/14rbquf/real_life_mermaid_in_farglory_ocean_park_hualien/,flyingcatwithhorns,"Real life mermaid in Farglory Ocean Park, Hualien, Taiwan",11647,0.92,575,,1688566168.0,False,False,False,False,False
55,14rai80,science,/r/science/comments/14rai80/fewer_teens_now_perceive_themselves_as_overweight/,MotherHolle,"Fewer teens now perceive themselves as overweight, according to international study of more than 745,000 adolescents. On weight: ""The increase in underestimation might be a sign for the need for interventions to strengthen correct weight perception,"" said the authors.",4508,0.92,1015,MA | Criminal Justice | MS | Psychology,1688563233.0,False,False,False,False,False
56,14raash,diablo4,/r/diablo4/comments/14raash/why_30_persons_in_this_sub_always_trying_to/,lionblackwood,Why 30+ persons in this sub always trying to mention their age?,5035,0.8,2618,,1688562751.0,False,False,False,False,False
57,14r8khv,lgbt,/r/lgbt/comments/14r8khv/according_to_science_trans_and_cis_women_have_the/,Bisexual-Demigod,According to Science Trans and Cis Women have the Exact Same Breast Milk,7280,0.86,480,":genderqueer-bi:  Bi hun, I'm Genderqueer",1688558228.0,False,False,False,False,False
58,14recca,Tinder,/r/Tinder/comments/14recca/some_romantic_axe_action_in_the_woods/,alexisonfire04,Some romantic axe action in the woods,2781,0.97,180,,1688571808.0,True,False,False,False,False
59,14r8grz,mildlyinfuriating,/r/mildlyinfuriating/comments/14r8grz/self_service_continental_breakfast/,BabyBear1060,Self service continental breakfast,25904,0.92,2419,,1688557921.0,False,False,False,False,False
60,14rf9es,nba,/r/nba/comments/14rf9es/haynes_portland_trail_blazers_rfa_matisse/,DepressedT-wolvesFan,"[Haynes] Portland Trail Blazers RFA Matisse Thybulle intends to sign an offer sheet with the Dallas Mavericks, league sources tell @NBAonTNT, @BleacherReport.",2438,0.97,550,:min-4: [MIN] Anthony Edwards,1688573734.0,False,False,False,False,False
61,14rbq9u,197,/r/197/comments/14rbq9u/rule/,moitso,Rule?,3863,0.97,77,,1688566134.0,False,False,False,False,False
62,14r573v,news,/r/news/comments/14r573v/tirade_over_cop_charged_with_tasering_95yo_great/,ani625,Tirade over cop charged with tasering 95yo great grandmother,11987,0.95,1073,,1688548036.0,False,False,False,False,False
63,14rftoo,MadeMeSmile,/r/MadeMeSmile/comments/14rftoo/enjoying_the_music/,Careful_Cup4484,Enjoying the music,4754,0.99,234,,1688574857.0,False,False,False,False,False
64,14r6bf0,politics,/r/politics/comments/14r6bf0/senate_republicans_fear_abortion_could_derail/,malcolm58,Senate Republicans fear abortion could derail hopes for majority,8645,0.96,887,,1688551527.0,False,False,False,False,False
65,14rgb6q,TikTokCringe,/r/TikTokCringe/comments/14rgb6q/ai_generated_joe_biden_ad_by_the_daily_show/,geo_jam,AI generated Joe Biden ad by the daily show,4226,0.97,192,,1688575894.0,False,False,False,False,False
66,14raer4,sewing,/r/sewing/comments/14raer4/i_made_a_boston_subway_seat_matching_set/,passthegoldenbutter,I made a Boston subway seat matching set,4267,0.96,116,,1688562990.0,False,False,False,False,False
67,14r97tb,meirl,/r/meirl/comments/14r97tb/meirl/,redcobra762,meirl,5362,0.99,45,,1688559945.0,False,False,False,False,False
68,14ri1gn,memes,/r/memes/comments/14ri1gn/oh_god_im_in_danger/,lukinhas_02,Oh god i'm in danger,3793,0.98,61,I touched grass,1688579533.0,False,False,False,False,False
69,14reesc,AITAH,/r/AITAH/comments/14reesc/aitah_for_leaving_in_the_middle_of_a_date/,TheQuietOne9891,AITAH for leaving in the middle of a date?,2525,0.95,795,,1688571946.0,False,False,False,False,False
70,14rit2q,Unexpected,/r/Unexpected/comments/14rit2q/dont_kiss_the_mirror/,Suitable_Carrot5413,don't kiss the mirror,3109,0.9,56,,1688581159.0,False,False,False,False,True
71,14rdwmu,19684,/r/19684/comments/14rdwmu/rule/,Zathar4,Rule,2624,0.97,78,,1688570884.0,False,False,False,False,False
72,14r4ls8,technicallythetruth,/r/technicallythetruth/comments/14r4ls8/well_they_are_for_sure/,GignacPL,"Well, they are for sure...",22767,0.96,324,,1688546139.0,False,False,False,False,False
73,14r4an4,dankmemes,/r/dankmemes/comments/14r4an4/cant_help_it/,ChildhoodStreet1616,can't help it,27714,0.96,85,☣️,1688545120.0,False,False,False,False,False
74,14r8oi6,nextfuckinglevel,/r/nextfuckinglevel/comments/14r8oi6/the_developers_watching_a_speedrunner_finish_a/,SuperAlloyBerserker,The developers watching a speedrunner finish a mission in the game in just 6 seconds,16199,0.97,301,,1688558527.0,False,False,False,False,False
75,14rb615,TwoSentenceHorror,/r/TwoSentenceHorror/comments/14rb615/ive_killed_my_firstborn_son_with_my_own_hands_i/,AceQuire,"""I've killed my firstborn son with my own hands,"" I cried to the devil, ""why won't you give the wealth that you promised?""",3537,0.95,142,,1688564820.0,False,False,False,False,False
76,14r9tti,MemePiece,/r/MemePiece/comments/14r9tti/oh_hell_take_care_of_em_alright/,metalhiro,"Oh, he’ll take care of em, alright.",4262,0.97,70,,1688561541.0,False,False,False,False,False
77,14rbqox,WorkersStrikeBack,/r/WorkersStrikeBack/comments/14rbqox/the_ones_that_you_dont_feel_comfortable_calling/,ClturalAd,The ones that you don't feel comfortable calling sociopaths are also still bad people who have convinced themselves that they aren't.,3136,0.95,88,,1688566157.0,False,False,False,False,False
78,14rev2y,PeopleFuckingDying,/r/PeopleFuckingDying/comments/14rev2y/doctor_gets_brutally_assaulted_by_patient/,ultradespairthot,DoCtOr gEtS BRuTaLLY AsSaULTeD By pAtieNt,2192,0.98,27,,1688572876.0,False,False,False,False,False
79,14r6d3t,interesting,/r/interesting/comments/14r6d3t/how_to_skin_a_car/,No_Tax4450,"How to ""skin"" a car.",8211,0.96,702,,1688551671.0,False,False,False,False,False
80,14rfb6g,nonononoyes,/r/nonononoyes/comments/14rfb6g/you_almost_a_biker_sandwich/,Tantofaz101,You almost a biker sandwich.,2013,0.96,206,,1688573833.0,False,False,False,False,False
81,14r94p2,TwoHotTakes,/r/TwoHotTakes/comments/14r94p2/aita_for_not_throwing_away_my_favourite_hoodie/,bonyonyx,AITA for not throwing away my favourite hoodie because my boyfriend doesn't believe how I got it? Sorry,4477,0.91,2713,,1688559727.0,False,False,False,False,False
82,14r7til,PoliticalHumor,/r/PoliticalHumor/comments/14r7til/maybe_you_can_share_a_cell/,7dayweekendgirl,Maybe you can share a cell,5162,0.96,169,,1688555983.0,False,False,False,False,False
83,14rga31,3Dprinting,/r/3Dprinting/comments/14rga31/triggering_lego_fans/,Bulky_Association229,Triggering Lego Fans,1795,0.95,85,,1688575832.0,False,False,False,False,False
84,14r9jnu,Eldenring,/r/Eldenring/comments/14r9jnu/small_haligtree_lifehack/,Brutalonym,Small Haligtree Lifehack,4065,0.98,91,,1688560823.0,False,False,False,False,True
85,14r782u,freefolk,/r/freefolk/comments/14r782u/this_gave_me_more_chills_than_the_entire_of/,SnooMacarons9592,This gave me more chills than the entire of season 8!!!,5817,0.94,268,We do not kneel,1688554240.0,True,False,False,False,False
86,14rdie0,WhitePeopleTwitter,/r/WhitePeopleTwitter/comments/14rdie0/republicans_everywhere_but_its_summer_its/,imnotlookingaturbutt,"(Republicans everywhere) ""bUt It'S sUmMeR iT's SuPpOsEd tO bE hOT!!""",12427,0.97,434,,1688570033.0,False,False,False,False,False
87,14r7hwx,NoStupidQuestions,/r/NoStupidQuestions/comments/14r7hwx/is_it_reasonable_to_take_a_sick_day_off_from_work/,captainechinoid,Is it reasonable to take a sick day off from work due to straight up grief?,5495,0.94,1256,,1688555021.0,False,False,False,False,False
88,14r85e3,LeopardsAteMyFace,/r/LeopardsAteMyFace/comments/14r85e3/swing_state_republicans_bleed_donors_and_cash/,GenghisHam,Swing state Republicans bleed donors and cash over Trump's false election claims,4752,0.96,148,,1688556931.0,False,False,False,False,False
89,14r8vbd,Animemes,/r/Animemes/comments/14r8vbd/censorship_in_china/,26muel,Censorship in China,4497,0.96,177,Flame Daddy's Dummy Thicc 🍑🔥 :69::179::103:,1688559038.0,True,False,False,False,False
90,14ra9qk,IllegallySmolCats,/r/IllegallySmolCats/comments/14ra9qk/update_on_the_illegally_smol_vagrant_in_our/,wednesdayMD6,Update on the illegally smol vagrant in our custody.,3415,0.97,51,,1688562674.0,False,False,False,False,False
91,14r6eyw,PublicFreakout,/r/PublicFreakout/comments/14r6eyw/ip2_live_streamer_saves_an_asian_man_from_being/,Legitimate_Fee2683,IP2 Live Streamer saves an Asian man from being mugged,6730,0.97,347,,1688551822.0,False,False,False,False,False
92,14r5xv7,formuladank,/r/formuladank/comments/14r5xv7/official_interview_with_max_verstappens/,External-Duty-8190,Official interview with Max Verstappen's performance coach,7423,0.95,138,BWOAHHHHHHH ,1688550391.0,False,False,False,False,False
93,14r8bn1,anime_irl,/r/anime_irl/comments/14r8bn1/anime_irl/,6cheems9,anime_irl,4704,0.97,131,,1688557483.0,False,False,False,False,False
94,14rehv0,TheMajorityReport,/r/TheMajorityReport/comments/14rehv0/honestly_shocked_how_awful_divorced_from_reality/,vitalbumhole,Honestly shocked how awful & divorced from reality she’s become so fast,1971,0.86,894,,1688572131.0,False,False,False,False,False
95,14rdtbi,StupidFood,/r/StupidFood/comments/14rdtbi/who_tf_orders_this/,IowaPineapple,Who TF orders this? ,2140,0.94,439,,1688570687.0,False,False,False,False,False
96,14rc0f4,Fauxmoi,/r/Fauxmoi/comments/14rc0f4/michelle_yeoh_calling_jackie_chan_a_male/,jaffacakes077,Michelle Yeoh calling Jackie Chan a 'male chauvinistic pig' in an old interview with David Letterman,2579,0.94,197,,1688566763.0,False,False,False,False,False
97,14r8ztv,Breath_of_the_Wild,/r/Breath_of_the_Wild/comments/14r8ztv/nintendo_really_cooked_with_zelda_this_generation/,Crusty783,Nintendo really cooked with Zelda this generation,4077,0.93,252,,1688559374.0,False,False,False,False,False
98,14r5m76,therewasanattempt,/r/therewasanattempt/comments/14r5m76/to_look_like_you_care_about_the_environment/,BloodiStag,To look like you care about the environment,86768,0.91,3948,,1688549395.0,False,False,False,False,False
99,14rea8k,Terraria,/r/Terraria/comments/14rea8k/i_made_an_isometric_terraria_world/,Daydreamer94,I made an isometric Terraria world,1998,0.98,56,,1688571688.0,False,False,False,False,False
100,14rdtiu,bald,/r/bald/comments/14rdtiu/should_i_shave_my_head_once_for_all/,chozov,Should i shave my head once for all?,2100,0.93,1544,,1688570699.0,False,False,False,False,False
