rank,id,subreddit,permalink,author,title,score,upvote_ratio,num_comments,author_flair_text,created_utc,over_18,edited,stickied,locked,is_original_content
1,14xgzoa,shitposting,/r/shitposting/comments/14xgzoa/ronaldo_heil_spez/,cavemanpiggy,"Ronaldo, heil spez",13266,0.96,156,,1689146095.0,False,False,False,False,False
2,14xkf94,PewdiepieSubmissions,/r/PewdiepieSubmissions/comments/14xkf94/110723_welcome_björn/,bobduncanswerve7,11/07/23 - Welcome Björn,4104,0.94,222,:FWP1:,1689157076.0,False,False,False,False,False
3,14xg110,therewasanattempt,/r/therewasanattempt/comments/14xg110/to_be_a_bully/,TXVERAS,To be a Bully,9654,0.96,605,Mr. Handsome,1689142883.0,False,False,False,False,False
4,14xdcce,shittymoviedetails,/r/shittymoviedetails/comments/14xdcce/in_wonka_2023_oh_for_fucks_sake_did_we_really/,fuzzy_dice_99,"In Wonka (2023)… oh for fuck’s sake, did we really need a Willy Wonka prequel?",12561,0.94,878,,1689134462.0,False,False,False,False,False
5,14xaeox,meirl,/r/meirl/comments/14xaeox/meirl/,Jimbo072,meirl,37177,0.95,706,,1689126538.0,False,False,False,False,False
6,14xedl3,oddlysatisfying,/r/oddlysatisfying/comments/14xedl3/world_largest_and_highest_glass_bridge/,Lele20111,"World largest and highest glass bridge: Zhangjiajie National Park, China",5836,0.93,294,,1689137641.0,False,False,False,False,False
7,14x9r7v,WhitePeopleTwitter,/r/WhitePeopleTwitter/comments/14x9r7v/i_cant_even_imagine/,CrunchM,I can't even imagine,15433,0.97,754,,1689124811.0,False,False,False,False,False
8,14xatjx,Damnthatsinteresting,/r/Damnthatsinteresting/comments/14xatjx/spanish_police_finding_1000_kilograms_of_cocaine/,midas617,"Spanish Police finding 1,000 kilograms of cocaine hidden inside of rocks...",15249,0.97,622,,1689127630.0,False,False,False,False,False
9,14xip9e,todayilearned,/r/todayilearned/comments/14xip9e/til_about_albert_severin_roche_a_distinguished/,Huge_Buddy_2216,"TIL about Albert Severin Roche, a distinguished French soldier who was found sleeping during duty and sentenced to death for it. A messenger arrived right before his execution and told the true story: Albert had crawled 10 hours under fire to rescue his captain and then collapsed from exhaustion.",2541,0.99,105,,1689151878.0,False,False,False,False,False
10,14xfiki,FunnyandSad,/r/FunnyandSad/comments/14xfiki/that_is_a_fact/,MarthaLuccy,That Is a Fact,4507,0.93,233,,1689141251.0,False,False,False,False,False
11,14xgdcg,meme,/r/meme/comments/14xgdcg/why_does_this_happen/,Manoodley,Why does this happen?,3650,0.91,248,,1689144036.0,False,False,False,False,False
12,14xdg1v,memes,/r/memes/comments/14xdg1v/i_cant_be_the_only_one/,wheredatacos,I can’t be the only one,6974,0.92,472,,1689134723.0,False,False,False,False,False
13,14xe2h4,Genshin_Impact,/r/Genshin_Impact/comments/14xe2h4/genshin_digital_billboard_in_changsha/,tommos,Genshin digital billboard in Changsha,5023,0.95,106,,1689136664.0,False,False,False,False,False
14,14x81oz,funny,/r/funny/comments/14x81oz/they_really_do_look_different/,elOriginalSpaceAgent,They really do look different,15963,0.94,284,,1689120277.0,False,False,False,False,False
15,14xewwm,nextfuckinglevel,/r/nextfuckinglevel/comments/14xewwm/this_mans_tips_for_fostering_children_with_a_fear/,JeremiahDeetsGuthrie,This man's tips for fostering children with a fear of men. o7,3874,0.95,124,,1689139303.0,False,False,False,False,False
16,14xaey8,MadeMeSmile,/r/MadeMeSmile/comments/14xaey8/oc_a_drawing_for_a_couple_at_a_bar/,slick-skills,[OC] A drawing for a couple at a bar☺️🤌,9624,0.96,95,,1689126555.0,False,False,False,False,False
17,14x7tkl,facepalm,/r/facepalm/comments/14x7tkl/health_counseling/,PrudentSalez,Health Counseling,22667,0.91,705,,1689119743.0,False,False,False,False,False
18,14xej7e,PrequelMemes,/r/PrequelMemes/comments/14xej7e/laughs_in_sith_lord/,geneguerin,*laughs in Sith Lord*,3475,0.98,69,,1689138109.0,False,False,False,False,False
19,14x6jvh,PublicFreakout,/r/PublicFreakout/comments/14x6jvh/blood_sweat_and_tears/,itsokayyoucanlaugh,"Blood, sweat and tears",16432,0.95,1085,,1689116544.0,False,False,False,False,False
20,14xj4zi,ireland,/r/ireland/comments/14xj4zi/man_injures_himself_trying_to_burn_a_tricolour/,scubasteve254,Man injures himself trying to burn a tricolour.,1507,0.97,469,,1689153140.0,False,False,False,False,False
21,14x6x7n,BeAmazed,/r/BeAmazed/comments/14x6x7n/cosplaying_as_ursula/,BVIRALofficial,Cosplaying as Ursula,17737,0.91,573,,1689117451.0,False,False,False,False,False
22,14xh6ey,formuladank,/r/formuladank/comments/14xh6ey/brad_pitt_has_the_hollywood_version_of_the/,Healthy_Guidance_473,Brad Pitt has the Hollywood version of the Max-hairdo.,2042,0.98,84,Trust the El 🅱️lan,1689146750.0,False,False,False,False,False
23,14xd5jo,worldnews,/r/worldnews/comments/14xd5jo/north_korea_fires_intercontinental_ballistic/,redcccp,North Korea fires intercontinental ballistic missile after threatening US,3892,0.94,615,,1689133917.0,False,False,False,False,False
24,14xaor7,DunderMifflin,/r/DunderMifflin/comments/14xaor7/who_is_your_favorite_willy_wonka/,BIGD0G29585,Who is Your Favorite Willy Wonka?,5863,0.95,265,,1689127291.0,False,False,False,False,False
25,14x8nbn,pics,/r/pics/comments/14x8nbn/taking_the_new_john_oliver_template_out_for_a_spin/,Bwob,Taking the new John Oliver template out for a spin.,8645,0.84,402,,1689121851.0,False,False,False,False,False
26,14xh5aj,lostredditors,/r/lostredditors/comments/14xh5aj/how_is_this_facepalm/,NathanPatty08,How is this facepalm,1931,0.96,193,,1689146642.0,False,False,False,False,False
27,14xigcl,LeagueOfMemes,/r/LeagueOfMemes/comments/14xigcl/cant_be_the_only_one_that_feels_like_that/,garlicroastchicken22,Can't be the only one that feels like that,1524,0.96,107,,1689151065.0,False,False,False,False,False
28,14xcjne,Showerthoughts,/r/Showerthoughts/comments/14xcjne/of_all_the_women_in_the_world_theres_one_who_has/,MrBrian22,"Of all the women in the world, there's one who has the realest looking fake boobs, and one who has the fakest looking real boobs.",4450,0.86,224,,1689132223.0,True,False,False,False,False
29,14xc1h8,Eldenring,/r/Eldenring/comments/14xc1h8/finally_playing_elden_ring/,SurveyAccording5276,Finally playing elden ring,4610,0.96,189,,1689130895.0,False,False,False,False,False
30,14x8nti,Whatcouldgowrong,/r/Whatcouldgowrong/comments/14x8nti/wcgw_if_i_climb_up_on_this_bucket/,Unlikely_Raccoon_199,WCGW if I climb up on this bucket?,7899,0.97,304,,1689121882.0,False,False,False,False,False
31,14xay8e,unpopularopinion,/r/unpopularopinion/comments/14xay8e/women_sexualize_men_in_the_workplace_just_as_much/,Visual_Try_4269,"Women sexualize men in the workplace just as much, if not more, than men sexualize women",6001,0.8,1244,,1689127969.0,False,1689128605.0,False,False,False
32,14x95eb,comics,/r/comics/comments/14x95eb/note_to_self/,MrLovens,note to self,6840,0.97,41,Mr. Lovenstein,1689123203.0,False,False,False,False,False
33,14xbtx4,movies,/r/movies/comments/14xbtx4/hollywood_studios_wga_strike_endgame_is_to_let/,getBusyChild,Hollywood Studios’ WGA Strike Endgame Is To Let Writers Go Broke Before Resuming Talks In Fall,4245,0.94,620,,1689130326.0,False,False,False,False,False
34,14xhfnu,pcmasterrace,/r/pcmasterrace/comments/14xhfnu/all_gaming_laptop_owners_know_this_is_never_true/,CodeSqueak,All gaming laptop owners know this is never true...,1730,0.98,166,i7-11800h | RTX 3070 | 32gb DDR4 3200,1689147651.0,False,False,False,False,False
35,14x64kg,lotrmemes,/r/lotrmemes/comments/14x64kg/ignore_the_fact_that_aragorn_probs_already_knew/,Warp_Legion,Ignore the fact that Aragorn probs already knew all this about Gandalf :P,13437,0.97,391,Uruk-hai,1689115524.0,False,False,False,False,False
36,14x3ujy,tumblr,/r/tumblr/comments/14x3ujy/angry_ghosts_holding_grudges/,StraightOuttaOlaphis,Angry ghosts holding grudges,31082,0.97,378,,1689110304.0,False,False,False,False,False
37,14x9ul1,wholesomememes,/r/wholesomememes/comments/14x9ul1/the_bananas/,King_Pee,The bananas,6051,0.98,36,,1689125064.0,False,False,False,False,False
38,14x3uvh,politics,/r/politics/comments/14x3uvh/doj_no_longer_believes_trump_should_have_immunity/,Starkiller20140,DOJ no longer believes Trump should have immunity from E. Jean Carroll defamation lawsuit,16235,0.95,331,,1689110325.0,False,False,False,False,False
39,14x4gj6,HumansBeingBros,/r/HumansBeingBros/comments/14x4gj6/great_success/,xzotc,Great success 😎,17231,0.96,184,,1689111646.0,False,False,False,False,False
40,14x3opt,mildlyinfuriating,/r/mildlyinfuriating/comments/14x3opt/parents_left_for_vacation_for_a_week_and_left_the/,DarthIsopod,Parents left for vacation for a week and left the neighbor’s daughter in charge of feeding them. Tank is basically dead,33869,0.94,2127,,1689109942.0,False,False,False,False,False
41,14x5bis,oddlyspecific,/r/oddlyspecific/comments/14x5bis/how_many_times_had_this_happened/,rplribeiro,How many times had this happened??,19993,0.93,945,,1689113596.0,False,False,False,False,False
42,14xa7sb,Superstonk,/r/Superstonk/comments/14xa7sb/rc_on_twitter/,Justbuster_,Rc on Twitter 🥳,5850,0.93,128,🦍Voted✅,1689126025.0,False,False,False,False,False
43,14x471t,marvelmemes,/r/marvelmemes/comments/14x471t/the_reason_why_hughs_suit_has_sleeves/,TheCoranger,The reason why Hugh's suit has sleeves:,22921,0.95,727,Avengers,1689111051.0,False,False,False,False,False
44,14x94dr,maybemaybemaybe,/r/maybemaybemaybe/comments/14x94dr/maybe_maybe_maybe/,nikamats,Maybe maybe maybe,5955,0.96,182,,1689123127.0,False,False,False,False,False
45,14xas6j,HolUp,/r/HolUp/comments/14xas6j/horse_is_down_bad/,axlnotfound,horse is down bad,4765,0.96,110,,1689127533.0,False,False,False,False,False
46,14xc2mj,whenthe,/r/whenthe/comments/14xc2mj/if_you_can_guess_what_game_this_is_about_without/,DarkandDanker,If you can guess what game this is about without checking my account I will blow you,3697,0.98,160,,1689130969.0,False,False,False,False,False
47,14x6eqx,cats,/r/cats/comments/14x6eqx/typical/,rifle-mel,TYPICAL,8829,0.99,192,,1689116207.0,False,False,False,False,False
48,14xgmkn,CombatFootage,/r/CombatFootage/comments/14xgmkn/russian_armored_vehicle_hits_a_mine_near_bakhmut/,tomina69,Russian armored vehicle hits a mine near Bakhmut,1618,0.98,143,,1689144873.0,False,False,False,False,False
49,14x7jfm,AskReddit,/r/AskReddit/comments/14x7jfm/what_cheap_food_would_you_still_eat_no_matter_how/,UYScutiPuffJr,What “cheap” food would you still eat no matter how rich you got?,7069,0.93,9292,,1689119005.0,False,False,False,False,False
50,14xen2h,ChainsawMan,/r/ChainsawMan/comments/14xen2h/the_horsemen_of_apocalypse_and_their_strange/,SpyghettiGhetti,The Horsemen of Apocalypse and their strange passion for plain bread,2207,0.98,91,Asa Mitaka Biggest Defender,1689138422.0,False,False,False,False,False
51,14xadsn,Tinder,/r/Tinder/comments/14xadsn/i_saw_my_chance_and_i_took_it/,imjustadudeguy,I saw my chance and I took it,5342,0.75,459,,1689126467.0,False,False,False,False,False
52,14x7sju,nba,/r/nba/comments/14x7sju/charania_just_in_the_nba_board_of_governors_has/,Michael_B_Lopez,"[Charania] Just in: The NBA Board of Governors has approved two new gameplay changes for the 2023-24 season, per sources: - In-game penalty for flops resulting in technical foul free throw - A second coach’s challenge awarded if first challenge is successful",5915,0.98,470,:gsw-1: Warriors,1689119671.0,False,False,False,False,False
53,14x1e64,gaming,/r/gaming/comments/14x1e64/too_accurate/,Deprobot21,Too accurate,32129,0.94,1054,,1689104835.0,False,False,False,False,False
54,14x4sp7,coolguides,/r/coolguides/comments/14x4sp7/a_cool_guide_to_fries_what_is_your_favourite/,erin214,A cool guide to fries. What is your favourite?,13283,0.88,2932,,1689112421.0,False,False,False,False,False
55,14x77wh,WitchesVsPatriarchy,/r/WitchesVsPatriarchy/comments/14x77wh/uhh_where_can_i_sign_up_for_this_schooling/,stonerspartanlady,Uhh where can I sign up for this schooling?!?!? 🧹🪄😈☠️,7021,0.95,195,,1689118206.0,False,False,False,False,False
56,14x679c,TikTokCringe,/r/TikTokCringe/comments/14x679c/tfw_your_dad_peaked_in_high_school/,Buddhababy0107,TFW your dad peaked in high school,9114,0.89,1211,,1689115705.0,False,False,False,False,False
57,14x8rjw,OldSchoolCool,/r/OldSchoolCool/comments/14x8rjw/lynda_carter_battle_of_the_network_stars_1976/,kerouac-nin,Lynda Carter - Battle of the Network Stars - 1976,4882,0.93,231,,1689122169.0,False,False,False,False,False
58,14x5m0o,news,/r/news/comments/14x5m0o/new_arkansas_law_removes_work_permit_requirement/,SalamanderWithAHat,New Arkansas law removes work permit requirement for children under 16,7678,0.96,520,,1689114297.0,False,False,False,False,False
59,14xia37,CasualUK,/r/CasualUK/comments/14xia37/if_you_need_this_information/,Winter_Tip_9591,If you need this information,1072,0.97,63,,1689150488.0,False,False,False,False,False
60,14x3uj0,LeopardsAteMyFace,/r/LeopardsAteMyFace/comments/14x3uj0/the_incompetence_of_desantis_and_republicans/,Humble_Novice,"The Incompetence of DeSantis and Republicans Leads Farmers Insurance to Leave Florida, Negatively Affecting 100,000 Homeowners",9248,0.96,621,,1689110303.0,False,False,False,False,False
61,14xgt24,Animemes,/r/Animemes/comments/14xgt24/let_me_die_first/,cringe_chad2,Let me Die first! ,1295,0.97,29,,1689145444.0,False,False,False,False,False
62,14x56o9,LifeProTips,/r/LifeProTips/comments/14x56o9/lpt_always_ask_to_see_the_bottle_being_opened/,Snxwe,LPT: Always ask to see the bottle being opened when getting bottle service in a club,7705,0.95,711,,1689113280.0,False,False,False,False,False
63,14xfan2,dankmemes,/r/dankmemes/comments/14xfan2/what_would_they_do_without_me/,Zealousideal-Arm5570,What would they do without me??,1693,0.98,10,,1689140521.0,False,False,False,False,False
64,14xg5sb,OneOrangeBraincell,/r/OneOrangeBraincell/comments/14xg5sb/just_adopted_this_little_fella/,drfeelgood8,Just adopted this little fella,1433,0.99,45,,1689143337.0,False,False,False,False,False
65,14xgyf3,Grimdank,/r/Grimdank/comments/14xgyf3/whats_your_favorite_xeno/,Stupiditygoesbrrr,What’s your favorite xeno?,1237,0.98,85,I am Alpharius,1689145966.0,False,False,False,False,False
66,14xf7me,DeepRockGalactic,/r/DeepRockGalactic/comments/14xf7me/my_friends_and_i_thinking_we_are_a_safe_distance/,Harold-Kingsbane,My friends and I thinking we are a safe distance from the Bulk Detonator,1604,0.98,35,,1689140262.0,False,False,False,False,False
67,14x937w,geography,/r/geography/comments/14x937w/population_distribution_of_ireland_1841_vs_modern/,SuperPuggo105,Population Distribution of Ireland 1841 vs modern date.,3978,0.97,316,,1689123038.0,False,False,False,False,False
68,14x36lw,technology,/r/technology/comments/14x36lw/twitter_is_tanking_amid_threads_surging/,marketrent,"Twitter is “tanking” amid Threads’ surging popularity, analysts say",10007,0.89,1240,,1689108826.0,False,False,False,False,False
69,14xg1ju,cursedcomments,/r/cursedcomments/comments/14xg1ju/cursed_tabasco/,Project_K92,Cursed Tabasco,1386,0.98,13,,1689142932.0,False,False,False,False,False
70,14xf28q,diablo4,/r/diablo4/comments/14xf28q/some_things_never_change/,Surreptum,Some Things Never Change,1600,0.98,251,,1689139795.0,False,False,False,False,False
71,14xfag2,clevercomebacks,/r/clevercomebacks/comments/14xfag2/man_is_refused_service_in_municipality_building/,OnlineReviewer,"Man is refused service in municipality building for wearing shorts, so he came back in a nightgown",1535,0.99,24,,1689140503.0,False,False,False,False,False
72,14xc7se,FunnyAnimals,/r/FunnyAnimals/comments/14xc7se/move_aside_and_let_the_master_baker_show_you_how/,OptimalDare4983,Move aside and let the master baker show you how it’s done.,2422,0.98,18,,1689131337.0,False,False,False,False,False
73,14xjgza,rareinsults,/r/rareinsults/comments/14xjgza/thats_a_no/,OrganicAdz,That's a no,750,0.97,20,,1689154169.0,False,False,False,False,False
74,14xc65b,bangalore,/r/bangalore/comments/14xc65b/my_mom_passed_away_and_suddenly_i_feel_like_a/,mepelican,My mom passed away and suddenly I feel like a guest in my own city.,2453,0.96,234,,1689131216.0,False,1689149092.0,False,False,False
75,14x3sgb,fightporn,/r/fightporn/comments/14x3sgb/road_rager_thought_he_was_a_badass/,MikeisTOOOTALLL,Road Rager thought he was a badass,8532,0.97,368,,1689110173.0,False,False,False,False,False
76,14xgyre,sweden,/r/sweden/comments/14xgyre/allt_fler_konsumenter_fastnar_i_abbonemangsfällor/,arturiaminilab,Allt fler konsumenter fastnar i abbonemangsfällor.,1095,0.98,87,,1689146001.0,False,False,False,False,False
77,14x70f8,WhitePeopleTwitter,/r/WhitePeopleTwitter/comments/14x70f8/no_connection_surely/,Tri734,No connection surely,33370,0.97,512,,1689117672.0,False,False,False,False,False
78,14x5q7l,doordash,/r/doordash/comments/14x5q7l/customer_gave_me_his_order/,ShadyAssBitch,customer gave me his order..,6340,0.97,239,,1689114577.0,False,False,False,False,False
79,14xcwn0,blessedimages,/r/blessedimages/comments/14xcwn0/moth_day/,H_G_Bells,Moth Day,2127,0.98,4,,1689133224.0,False,False,False,False,False
80,14xcde2,therewasanattempt,/r/therewasanattempt/comments/14xcde2/to_be_given_a_job_by_a_youtuber/,Arro,to be given a job by a YouTuber,8097,0.92,547,,1689131752.0,False,False,False,False,False
81,14xg8ki,sadcringe,/r/sadcringe/comments/14xg8ki/i_regret_nothing/,ArtieZiffsCat,I regret nothing...,1226,0.99,36,,1689143592.0,False,False,False,False,False
82,14x6fr3,antiwork,/r/antiwork/comments/14x6fr3/35hour_and_still_broke/,jru92,$35/hour and still broke,5835,0.82,1974,,1689116279.0,False,1689140143.0,False,False,False
83,14x4a5y,conservativeterrorism,/r/conservativeterrorism/comments/14x4a5y/was_sarah_palin_the_beginning_of_the_end_to_the/,BuyOutWallStreet,Was Sarah Palin the beginning of the end to the modern conservative Republican party?,7083,0.93,745,,1689111252.0,False,False,False,False,False
84,14x2fhf,PoliticalHumor,/r/PoliticalHumor/comments/14x2fhf/all_hail_mother_russia/,Jeffreyxu0927,All hail mother Russia,9665,0.95,526,,1689107141.0,False,False,False,False,False
85,14xjnro,Hololive,/r/Hololive/comments/14xjnro/let_me_tell_you_what_just_happened_i_washed_my/,Sasaki_Kei,"""Let me tell you what just happened. I washed my face with toothpaste, mistaking it for facial cleansing foam.""",711,1.0,24,:Suisei::Miko::Ayame::Haato::Iroha:,1689154755.0,False,False,False,False,False
86,14x8lo7,IllegallySmolCats,/r/IllegallySmolCats/comments/14x8lo7/biscuit_is_3_weeks_old_today_and_his_punishment/,catmmm,Biscuit is 3 weeks old today and his punishment for being so cute is....making biscuits,3831,0.98,101,,1689121727.0,False,False,False,False,False
87,14xcq34,instantkarma,/r/instantkarma/comments/14xcq34/im_gonna_pick_a_fight_and_then_run_away/,basedrattt,I’m gonna pick a fight and then run away.,2166,0.92,60,,1689132691.0,False,False,False,False,False
88,14xeogk,Damnthatsinteresting,/r/Damnthatsinteresting/comments/14xeogk/clothes_preserved_from_burial_of_the_bronze_age/,4reddityo,"Clothes preserved from burial of the bronze age Egtved Girl, buried circa 1370 BC in Denmark, right a modern recreation of her clothes.",4463,0.98,282,,1689138553.0,False,False,False,False,False
89,14x69o0,AITAH,/r/AITAH/comments/14x69o0/aitah_for_telling_my_wife_to_fuck_off_and_that/,Bluemeanie04,AITAH for telling my wife to fuck off and that she’s a selfish bitch for letting her aunt take my daughter somewhere special I have been trying to take my daughter too for over 2 years?,5754,0.88,2319,,1689115863.0,False,1689134748.0,False,False,False
90,14x22p1,BlackPeopleTwitter,/r/BlackPeopleTwitter/comments/14x22p1/elon_aint_ready/,MikeisTOOOTALLL,Elon ain’t ready,10456,0.95,668,,1689106360.0,False,False,False,False,False
91,14x8zv7,HonkaiStarRail,/r/HonkaiStarRail/comments/14x8zv7/some_days_you_find_yourself_debating_whether/,thatguywithawatch,Some days you find yourself debating whether those last 15 jades are *really* that important.,3982,0.89,352,,1689122786.0,False,False,False,False,False
92,14x6han,terriblefacebookmemes,/r/terriblefacebookmemes/comments/14x6han/so_is_this_building_not_real_or_are_they_implying/,Sadboy_looking4memes,"So is this building not real, or are they implying it was built recently and no one noticed?",5657,0.97,318,,1689116393.0,False,False,False,False,False
93,14x4du6,oddlyterrifying,/r/oddlyterrifying/comments/14x4du6/this_9000yearold_stone_mask_is_the_oldest_mask_in/,-SimplyLemonade-,"This 9000-year-old stone mask is the oldest mask in the world, and was found in the Judean Desert in Israel [3000x4000]",8061,0.97,242,,1689111481.0,False,False,False,False,False
94,14x5tmr,anime_irl,/r/anime_irl/comments/14x5tmr/anime_irl/,heavyButtock66,anime_irl,6375,0.91,109,,1689114807.0,False,False,False,False,False
95,14xfm5s,pokemon,/r/pokemon/comments/14xfm5s/i_liked_the_weirdlooking_but_kinda_cool_designs/,Kingkrool1994,"I liked the weird-looking but kinda cool designs that all of the former Pokedex had, and to see it be replaced by generic Rotom Phones sucks.",1251,0.94,190,Number One Gharchomp Fan:443: :444: :445:  :445-M:,1689141581.0,False,False,False,False,False
96,14xjlw3,natureismetal,/r/natureismetal/comments/14xjlw3/on_the_importance_of_trees/,Obiektyw1855,On the importance of trees,654,0.94,31,,1689154585.0,False,False,False,False,False
97,14xetlk,ContagiousLaughter,/r/ContagiousLaughter/comments/14xetlk/jamie_foxx_tries_to_return_a_pro_tennis_serve/,Updownspinaround,Jamie Foxx tries to return a pro tennis serve,1428,0.98,50,,1689138997.0,False,False,False,False,False
98,14xevfv,australia,/r/australia/comments/14xevfv/bin_chicken_cake_i_made_a_few_years_ago/,CityoftheMoon17,Bin Chicken cake I made a few years ago.,1361,0.95,84,,1689139171.0,False,False,False,False,False
99,14xclzm,baseball,/r/baseball/comments/14xclzm/the_nl_has_won_the_all_star_game_for_the_first/,HelpMeWithMyHWpls,The NL has won the All Star Game for the first time since 2012!,1900,0.96,290,Chicago Cubs :chc2:,1689132395.0,False,False,False,False,False
100,14xfn2n,ImTheMainCharacter,/r/ImTheMainCharacter/comments/14xfn2n/streamer_goes_on_rant_after_being_turned_down_to/,Imaginary-Hand-3176,Streamer goes on rant after being turned down to cut line with money,1188,0.92,196,,1689141653.0,False,False,False,False,False
