rank,id,subreddit,permalink,author,title,score,upvote_ratio,num_comments,author_flair_text,created_utc,over_18,edited,stickied,locked,is_original_content
1,14yukp3,toptalent,/r/toptalent/comments/14yukp3/with_3_chance_to_live_at_birth_dayton_webber_has/,LetsFindSomeTalent,"With 3% chance to live at birth, Dayton Webber has spent his life defying odds and inspiring others",8179,0.93,335,,1689277869.0,False,False,False,False,False
2,14yqyfn,facepalm,/r/facepalm/comments/14yqyfn/journalist_think_the_red_barons_aircraft_is_a/,Aki008035,Journalist think The Red Baron's Aircraft is a Nazi Aircraft,14981,0.96,1248,,1689269392.0,False,False,False,False,False
3,14ynyyx,Damnthatsinteresting,/r/Damnthatsinteresting/comments/14ynyyx/a_debit_card_skimmer_at_a_shady_convenience_store/,MaximumJones,A debit card skimmer at a shady convenience store,40015,0.94,1597,,1689262315.0,False,False,False,False,False
4,14yr3s4,nextfuckinglevel,/r/nextfuckinglevel/comments/14yr3s4/steve_irwin_talks_about_his_first_meeting_with/,Key-Bedroom-4615,Steve Irwin talks about his first meeting with wife Terri,10392,0.97,317,,1689269725.0,False,False,False,False,False
5,14ypnmm,WhitePeopleTwitter,/r/WhitePeopleTwitter/comments/14ypnmm/republicans_just_lost_their_gerrymandered/,Travismatthew08,Republicans just lost their gerrymandered advantage in New York.,10137,0.98,374,,1689266276.0,False,False,False,False,False
6,14ylvuz,MadeMeSmile,/r/MadeMeSmile/comments/14ylvuz/another_comparison_pic_not_there_yet_but_down_115/,MetalJunkie101,"Another comparison pic. Not there yet, but down 115 pounds.",37944,0.94,1376,,1689257317.0,False,False,False,False,False
7,14ym98p,LeopardsAteMyFace,/r/LeopardsAteMyFace/comments/14ym98p/transphobic_michigan_salon_owner_declares_she/,wdcmsnbcgay,"Transphobic Michigan Salon Owner Declares She Won’t Serve Trans or Queer People, Says They Should Seek Services at Pet Groomer…Now Her Suppliers Are Dropping Her Salon",15827,0.93,1312,,1689258226.0,False,False,False,False,False
8,14yr8uz,comics,/r/comics/comments/14yr8uz/a_different_kind_of_coming_out_details_in_comment/,Main-Salamander-6687,A different kind of coming out (details in comment),6182,0.94,164,,1689270061.0,False,False,False,False,False
9,14yojb5,TikTokCringe,/r/TikTokCringe/comments/14yojb5/when_see_something_say_something_goes_wrong/,Sufficient-Bug-9112,When see something say something goes wrong,9356,0.94,1102,,1689263672.0,False,False,False,False,False
10,14ylude,todayilearned,/r/todayilearned/comments/14ylude/til_that_although_we_are_warned_to_be_most_afraid/,harlsey,"TIL that although we are warned to be most afraid of a mother bear and her cubs, nearly 90% of fatal bear attacks are at the paws of lone male bears.",15190,0.96,714,,1689257215.0,False,False,False,False,False
11,14ys1mq,nottheonion,/r/nottheonion/comments/14ys1mq/rfk_jr_press_dinner_screaming_match_over_climate/,goatofmind,RFK Jr press dinner screaming match over climate crisis ends with columnist launching his own natural gas,4951,0.95,577,,1689271905.0,False,False,False,False,False
12,14yrqi0,cats,/r/cats/comments/14yrqi0/my_boy_glenn_has_had_quite_the_glow_up_over_the/,sweatpantsandwhiskey,My boy Glenn has had quite the glow up over the last couple weeks!,5225,0.97,162,,1689271223.0,True,False,False,False,False
13,14yrptt,memes,/r/memes/comments/14yrptt/i_really_dont_understand/,InFoggusKagernIstKul,I really don't understand,6252,0.98,201,,1689271182.0,False,False,False,False,False
14,14ykrp7,meirl,/r/meirl/comments/14ykrp7/me_irl/,Sonic_the_hedgedog,me_irl,28554,0.95,481,,1689254555.0,False,False,False,False,False
15,14yu0jf,antiwork,/r/antiwork/comments/14yu0jf/breaking_the_160000_actors_recording_artists/,theworkeragency,"BREAKING: The 160,000 actors, recording artists, stunt performers & media professionals of @sagaftra are officially on strike. It’s the first time since 1960 that writers and actors have been on strike at the same time. They’re shutting Hollywood down.",3599,0.98,272,,1689276516.0,False,False,False,False,False
16,14ykesh,news,/r/news/comments/14ykesh/fda_approves_first_overthecounter_birth_control/,Tdanger78,FDA approves first over-the-counter birth control pill in the U.S.,16079,0.97,838,,1689253651.0,False,False,False,False,False
17,14yprx3,technology,/r/technology/comments/14yprx3/its_official_smartphones_will_need_to_have/,f50ci31y,It's official: Smartphones will need to have replaceable batteries by 2027,5753,0.97,685,,1689266559.0,False,False,False,False,False
18,14ymrwl,mildlyinfuriating,/r/mildlyinfuriating/comments/14ymrwl/gas_pumps_that_play_loud_advertisements_and/,comfortably__dum,Gas pumps that play loud advertisements and videos while you pump,9743,0.96,1351,,1689259484.0,False,False,False,False,False
19,14yr5ct,facepalm,/r/facepalm/comments/14yr5ct/wtf/,OutrageusCorner,Wtf 🤦🏾,11960,0.93,3083,,1689269831.0,False,False,False,False,False
20,14ylygu,worldnews,/r/worldnews/comments/14ylygu/ioc_does_not_plan_to_invite_russia_and_belarus_to/,MagnificentCat,IOC does not plan to invite Russia and Belarus to Olympics-2024,9069,0.96,398,,1689257495.0,False,False,False,False,False
21,14yjuss,gaming,/r/gaming/comments/14yjuss/2007_a_little_game_called_halo_3_came_out_i_met_a/,THATwasSMART210,"2007 a little game called “Halo 3” came out, I met a guy online who became one of my first gamer friends. 16 years later we got to meet IRL. Tx to PA",17076,0.92,511,,1689252193.0,False,False,False,False,False
22,14yklyf,PoliticalHumor,/r/PoliticalHumor/comments/14yklyf/almost_got_me/,Right_Treat691,Almost got me,11487,0.95,245,,1689254152.0,False,False,False,False,False
23,14ynhpk,TheLastAirbender,/r/TheLastAirbender/comments/14ynhpk/seems_natural_for_this_scene/,Ghdude1,Seems natural for this scene.,7642,0.95,430,,1689261180.0,False,False,False,False,False
24,14ymw55,PrequelMemes,/r/PrequelMemes/comments/14ymw55/his_ship_got_blown_up_in_order_66/,ukiloi,His ship got blown up in Order 66,8406,0.96,272,,1689259772.0,False,False,False,False,False
25,14yqm8q,tifu,/r/tifu/comments/14yqm8q/tifu_by_sleeping_with_my_hr_manager/,desperatewatcher,TIFU by sleeping with my HR manager,4116,0.91,582,,1689268545.0,True,1689274309.0,False,False,False
26,14ys2z4,PeterExplainsTheJoke,/r/PeterExplainsTheJoke/comments/14ys2z4/petah_why_is_the_father_traumatised/,Lapis_District,"Petah, why is the father traumatised?",3497,0.97,158,,1689271995.0,False,False,False,False,False
27,14ynlq3,WTF,/r/WTF/comments/14ynlq3/car_pool/,JackFunk,Car pool,5929,0.96,307,,1689261455.0,False,False,False,False,False
28,14ymui7,nextfuckinglevel,/r/nextfuckinglevel/comments/14ymui7/rescue_the_goat_stuck_with_asphalt_after_3_days/,CPReals,Rescue the goat stuck with asphalt after 3 days.,23168,0.94,832,,1689259656.0,False,False,False,False,False
29,14yjesk,therewasanattempt,/r/therewasanattempt/comments/14yjesk/to_get_an_asian_boyfriend/,Heymynameisdistance,To Get An Asian Boyfriend,35102,0.84,3300,,1689250959.0,False,False,False,False,False
30,14ynf69,NonPoliticalTwitter,/r/NonPoliticalTwitter/comments/14ynf69/seems_legit/,steepattraction,Seems Legit,6220,0.96,67,:blue1::blue2::1111::1112:,1689261008.0,False,False,False,False,False
31,14ynv4d,movies,/r/movies/comments/14ynv4d/disney_pulling_back_on_making_marvel_star_wars/,KillerCroc1234567,"Disney pulling back on making Marvel, Star Wars content, Iger says",5397,0.95,1490,,1689262070.0,False,False,False,False,False
32,14yso3f,Fauxmoi,/r/Fauxmoi/comments/14yso3f/christopher_nolan_has_announced_that_the_cast_of/,Ximiso,Christopher Nolan has announced that the cast of ‘OPPENHEIMER’ has left the premiere to ‘go and write their pickets’ and join the strike.,2839,0.97,201,societal collapse is in the air,1689273379.0,False,False,False,False,False
33,14yke7m,shitposting,/r/shitposting/comments/14yke7m/what_a_godly_way_to_meet_god_glory_to_spez/,Notafuqin_Carrot211,What a godly way to meet god (glory to spez),14911,0.96,133,We do a little trolling :snoo_trollface:,1689253609.0,False,False,False,False,False
34,14ym66k,WhitePeopleTwitter,/r/WhitePeopleTwitter/comments/14ym66k/for_starters_elons_not_worth_245_billion_anymore/,AllumaNoir,"For starters, ELon's not worth $245 billion anymore...",24885,0.92,1834,,1689258023.0,False,False,False,False,False
35,14ysiwg,funny,/r/funny/comments/14ysiwg/poor_juanje/,Khroneos,Poor Juanje...,2843,0.89,152,,1689273035.0,False,False,False,False,False
36,14yho1f,politics,/r/politics/comments/14yho1f/gop_chair_caught_on_camera_saying_we_need_to/,BelleAriel,"GOP chair caught on camera saying ""we need to extinguish the left""",21367,0.92,2451,,1689245916.0,False,False,False,False,False
37,14ykofp,tumblr,/r/tumblr/comments/14ykofp/i_pirated_my_ethics_textbook_was_this_wrong_of_me/,Sonic_the_hedgedog,I Pirated My Ethics Textbook. Was this wrong of me?,10165,0.98,95,,1689254332.0,False,False,False,False,False
38,14ykwmr,HolUp,/r/HolUp/comments/14ykwmr/wait_what_did_i_just_do/,No-Alfalfa2412,Wait.. what did i just do...?,13434,0.86,376,,1689254904.0,False,False,False,False,False
39,14yskye,formuladank,/r/formuladank/comments/14yskye/just_a_reminder_who_the_actual_scientifically/,ExactCollege3,"Just a reminder who the actual scientifically proven best driver is, in equal machinery",2707,0.98,104,BWOAHHHHHHH ,1689273162.0,False,False,False,False,False
40,14yhzls,2meirl4meirl,/r/2meirl4meirl/comments/14yhzls/2meirl4meirl/,idlystep,2meirl4meirl,29865,0.95,354,,1689246884.0,False,False,False,False,False
41,14yrfq3,insanepeoplefacebook,/r/insanepeoplefacebook/comments/14yrfq3/found_on_fb/,VibratingPickle2,Found on FB 🤣,3063,0.97,267,,1689270523.0,False,False,False,False,False
42,14yhfzq,BrandNewSentence,/r/BrandNewSentence/comments/14yhfzq/what_a_time_to_be_alive/,almonakinvader,What a time to be alive,26156,0.97,449,,1689245173.0,False,False,False,False,False
43,14yhtrw,funnyvideos,/r/funnyvideos/comments/14yhtrw/just_a_tiktok_dumb_video_pt2/,HelMort,Just a TikTok dumb video pt2,20647,0.95,279,,1689246381.0,False,False,False,False,False
44,14yk066,Unexpected,/r/Unexpected/comments/14yk066/one_amazing_thing_about_australia/,EvaRaw666,One amazing thing about Australia!,9788,0.98,161,,1689252603.0,False,False,False,False,False
45,14ynws4,Tinder,/r/Tinder/comments/14ynws4/first_message_i_dont_hate_it/,Femme_Royale,First message… I don’t hate it,4566,0.96,242,,1689262180.0,False,False,False,False,False
46,14yrog4,ChatGPT,/r/ChatGPT/comments/14yrog4/vp_product_openai/,HOLUPREDICTIONS,VP Product @OpenAI,2746,0.95,400,:SpinAI:,1689271092.0,False,False,False,False,False
47,14ynaij,tattoos,/r/tattoos/comments/14ynaij/my_dad_passed_away_a_month_ago_got_his_tattoo_by/,livlev420,My dad passed away a month ago.. got his tattoo! by Patrick at Shapeworld in NYC,4858,0.95,181,,1689260693.0,False,False,False,False,False
48,14ygyim,oddlysatisfying,/r/oddlysatisfying/comments/14ygyim/that_landing_is_satisfying/,amy2kim22,That landing is satisfying.,30402,0.94,335,,1689243607.0,False,False,False,False,False
49,14yipax,SipsTea,/r/SipsTea/comments/14yipax/he_pulled_a_sneaky_one_on_the_weather_forecast/,Own_Transition4095,He pulled a sneaky one on the weather forecast,12144,0.97,185,,1689248966.0,False,False,False,False,False
50,14yp1l5,nba,/r/nba/comments/14yp1l5/joel_embiid_is_really_lucky_that_ben_simmons_took/,BigDaddyJuno,Joel Embiid is really lucky that Ben Simmons took the flak after the Hawks choke in 2021. He had 16 turnovers in the final 2 games of that series,3513,0.89,619,:tor-5: Toronto Huskies,1689264839.0,False,False,False,False,False
51,14ypix6,NatureIsFuckingLit,/r/NatureIsFuckingLit/comments/14ypix6/this_little_cougar_cub_is_so_proud_of_its_mom/,Molly107,🔥 This little cougar cub is so proud of its mom.,3318,0.96,29,:paw-prints:,1689265962.0,False,False,False,False,False
52,14yjb3p,ProgrammerHumor,/r/ProgrammerHumor/comments/14yjb3p/intruderlol/,Strange_Dragonfly964,intruderLol,8880,0.97,72,:py:,1689250678.0,False,False,False,False,False
53,14ymbev,OldSchoolCool,/r/OldSchoolCool/comments/14ymbev/taiwanese_frogmen_during_the_second_taiwan/,hyperchimpchallenger,Taiwanese frogmen during the Second Taiwan Straight Crisis in 1958. Rocking some Rolex Submarines,4784,0.97,215,,1689258368.0,False,False,False,False,False
54,14ykwny,sadcringe,/r/sadcringe/comments/14ykwny/glad_or_sad/,ScientifiK_SaucE_314,Glad or sad,6670,0.94,177,,1689254907.0,False,False,False,False,False
55,14ym20u,dankmemes,/r/dankmemes/comments/14ym20u/i_need_white_sketchers/,MrBl0bfish04,I need White Sketchers,6009,0.98,33,Blobfish 👏Supremacy 👏,1689257740.0,False,False,False,False,False
56,14yiftm,BlackPeopleTwitter,/r/BlackPeopleTwitter/comments/14yiftm/bought_and_paid_for/,districtcourt,Bought and paid for,9460,0.91,637,,1689248210.0,False,False,False,False,False
57,14yn9oq,memes,/r/memes/comments/14yn9oq/sharks_are_just_the_pit_bulls_of_the_ocean/,Little_Dude_Guy,Sharks are just the Pit Bulls of the ocean,15492,0.89,732,,1689260636.0,False,False,False,False,False
58,14yghu5,BeAmazed,/r/BeAmazed/comments/14yghu5/watch_my_bird_rescuing_my_plushie/,TheOriginals_1,Watch my bird rescuing my plushie ,23528,0.94,606,,1689242118.0,False,False,False,False,False
59,14ystxa,Instagramreality,/r/Instagramreality/comments/14ystxa/popular_models_real_face_shows_up_for_12_second/,br0ck,Popular model's real face shows up for 1/2 second?,1967,0.93,232,,1689273773.0,False,False,False,True,False
60,14yhwu8,LateStageCapitalism,/r/LateStageCapitalism/comments/14yhwu8/it_was_always_about_control/,HankScorpio42,It was always about control,9180,0.97,197,,1689246652.0,False,False,False,False,False
61,14ypxcb,NoahGetTheBoat,/r/NoahGetTheBoat/comments/14ypxcb/let_the_waters_rise/,brosb4hoes666,Let the waters rise......,2887,0.92,243,,1689266909.0,False,False,False,False,False
62,14ypo6a,WorkReform,/r/WorkReform/comments/14ypo6a/asking_for_fair_compensation_is_not_being/,north_canadian_ice,Asking for fair compensation is NoT bEiNg ReAliStIc according to Disney CEO Bob Iger (who makes $25 million a year),2838,0.97,142,💸 National Rent Control,1689266315.0,False,False,False,False,False
63,14yp76a,pettyrevenge,/r/pettyrevenge/comments/14yp76a/i_spent_5000_to_inconvenience_and_embarrass_a/,Outrageous_Rise,"I spent $5,000+ to inconvenience and embarrass a competitor who treated me like crap. It was worth it.",2972,0.94,150,,1689265213.0,False,False,False,False,False
64,14yjrqo,maybemaybemaybe,/r/maybemaybemaybe/comments/14yjrqo/maybe_maybe_maybe/,Consistent_Smile6292,Maybe maybe maybe,8096,0.89,661,,1689251974.0,False,False,False,False,False
65,14ylmln,Funnymemes,/r/Funnymemes/comments/14ylmln/crawling_in_my_skin_these_wounds_they_will_not/,Proof-Oil-7716,"“Crawling in my skin, these wounds they will not heal”",5192,0.93,2917,,1689256707.0,False,False,False,False,False
66,14ymjkh,oddlyterrifying,/r/oddlyterrifying/comments/14ymjkh/why/,ShameTwo,Why,4372,0.95,217,,1689258920.0,False,False,False,False,False
67,14yowux,iamatotalpieceofshit,/r/iamatotalpieceofshit/comments/14yowux/plastic_surgeon_who_livestreamed_procedures_on/,s_y_s_t_e_m_i_c_,Plastic surgeon who live-streamed procedures on TikTok banned from practicing medicine in Ohio. Three former patients suffered severe complications & needed intense medical care after she operated on them.,3010,0.97,126,,1689264533.0,True,False,False,False,False
68,14yqb54,facepalm,/r/facepalm/comments/14yqb54/as_opposed_to_what/,FeCandle,As opposed to what?,14554,0.84,3732,,1689267782.0,False,False,False,False,False
69,14yoegd,whenthe,/r/whenthe/comments/14yoegd/transphobes_try_not_to_be_idiots_challenge/,SirShadyVI,transphobes try not to be idiots challenge,3853,0.78,386,local touhou poster (moriya shrine's #1 conspirator),1689263356.0,False,False,False,False,False
70,14yqw3o,Eldenring,/r/Eldenring/comments/14yqw3o/rune_bear_insta_kill/,JolynJarrett,Rune Bear insta kill,2197,0.99,89,,1689269226.0,False,False,False,False,False
71,14yklbd,LifeProTips,/r/LifeProTips/comments/14yklbd/lpt_if_a_voice_in_your_head_ever_says_its_been/,AlwaysTheNoob,"LPT: If a voice in your head ever says ""it's been too long since I've reached out to X, I should see how they are"", do not put it off. Listen to that voice.",4924,0.93,168,,1689254112.0,False,False,False,False,False
72,14ypm4d,UkraineWarVideoReport,/r/UkraineWarVideoReport/comments/14ypm4d/ukraine_will_legalise_cannabis_to_help_war/,TheTelegraph,Ukraine will legalise cannabis to help war wounded cope with trauma,2544,0.98,173,Official Source,1689266172.0,False,False,False,False,False
73,14yn4my,HonkaiStarRail,/r/HonkaiStarRail/comments/14yn4my/caelus_and_his_very_normal_friends_chatting_on/,AsaCocoPeko,Caelus and his very normal friends chatting on Whats App,3749,0.94,144,All Hail the Master Diviner :Fuxuan:,1689260330.0,False,False,False,False,False
74,14yqocv,wallstreetbets,/r/wallstreetbets/comments/14yqocv/275m_day_just_hit_my_10m_goal/,Fausterion18,"+$2.75m day, just hit my $10m goal",2360,0.88,695,NASDAQ's #1 Fan,1689268697.0,False,False,True,False,False
75,14yhh2y,AskReddit,/r/AskReddit/comments/14yhh2y/whats_a_type_youre_attracted_to_but_too/,MyPasswordIsABC999,What’s a “type” you’re attracted to but too embarrassed to tell anyone?,10881,0.89,11927,,1689245276.0,False,False,False,False,False
76,14yp3ds,Overwatch,/r/Overwatch/comments/14yp3ds/she_never_saw_it_coming/,NotMitchu,She never saw it coming 💀,2718,0.97,87,Pixel Torbjörn,1689264956.0,False,False,False,False,False
77,14yh8dc,AnimalsBeingDerps,/r/AnimalsBeingDerps/comments/14yh8dc/i_love_how_unbothered_the_mom_is/,thelonelyasshole,I love how unbothered the mom is,9972,0.97,176,,1689244493.0,False,False,False,False,False
78,14ynroy,Hololive,/r/Hololive/comments/14ynroy/this_is_how_achan_looks_without_glasses/,MalkynRei78,This is how A-chan looks without glasses,3251,0.97,61,,1689261844.0,False,False,False,False,False
79,14yl83g,ContagiousLaughter,/r/ContagiousLaughter/comments/14yl83g/news_anchors_fail_to_contain_laughter_what_do_you/,em-dot,"News anchors fail to contain laughter, ""what do you think goes wrong in your relationships?""",4394,0.97,75,,1689255699.0,False,False,False,False,False
80,14ylgbk,teenagers,/r/teenagers/comments/14ylgbk/come_on_guys/,pm-ur-tiny-titties,Come on guys,4977,0.96,269,,1689256267.0,False,False,False,False,False
81,14ykzz3,PublicFreakout,/r/PublicFreakout/comments/14ykzz3/you_dont_belong_here_this_is_amurica/,domobooty,You dont belong here .. this is amurica ,4552,0.94,658,,1689255130.0,False,False,False,False,False
82,14yriin,deadbydaylight,/r/deadbydaylight/comments/14yriin/thoughts_on_this_idea_twitter_post_from_gorejira/,juliacorco,thoughts on this idea? twitter post from gorejira,1942,0.96,331,:FLAGL: demodog :FLAGL:,1689270701.0,False,False,False,False,False
83,14yly0g,clevercomebacks,/r/clevercomebacks/comments/14yly0g/delete_your_comment/,fortebe,Delete your comment.,3888,0.97,127,,1689257469.0,False,False,False,False,False
84,14yqi86,CrazyFuckingVideos,/r/CrazyFuckingVideos/comments/14yqi86/man_climbs_building_to_save_mom_from_fire/,Sufard,Man climbs building to save mom from fire,2184,0.96,141,,1689268262.0,False,False,False,False,False
85,14ym15c,anime_irl,/r/anime_irl/comments/14ym15c/anime_irl/,Cayennesan,anime_irl,3858,0.96,83,:070:,1689257687.0,False,False,False,False,False
86,14ykyfj,DIY,/r/DIY/comments/14ykyfj/my_wife_wanted_to_buy_a_plant_stand_online_i_told/,factoryal21,My wife wanted to buy a plant stand online. I told her if she gave me 6 months I could do much better.,4239,0.94,351,,1689255031.0,False,False,False,False,False
87,14yv3xg,Superstonk,/r/Superstonk/comments/14yv3xg/i_cant_hear_you_closed_with_190_mil_volume_drs/,edgar510,I CAN'T HEAR YOU: Closed with 1.90 Mil Volume!! 🟣🟣🟣🟣***DRS***🟣🟣🟣🟣,1399,0.98,46,👂 I CAN'T HEAR YOU 👂 - Wen Volume,1689279134.0,False,False,False,False,False
88,14ynyob,StupidFood,/r/StupidFood/comments/14ynyob/hey_japan_and_italy_greetings_from_brazil/,ZacaBR,"Hey Japan and Italy, greetings from Brazil.",2923,0.9,481,,1689262296.0,False,False,False,False,False
89,14yr8vv,MemeVideos,/r/MemeVideos/comments/14yr8vv/technique/,Select-Water-9655,Technique 💯,1944,0.98,29,,1689270063.0,False,False,False,False,False
90,14yrx4q,NotHowGirlsWork,/r/NotHowGirlsWork/comments/14yrx4q/little_girl_sits_on_a_table_clearly_asking_for_it/,Balarezok2,Little girl… sits on a table. Clearly asking for it,1771,0.99,180,,1689271616.0,False,False,False,False,False
91,14yhqsr,wholesomememes,/r/wholesomememes/comments/14yhqsr/puzzle_pieces_for_a_perfect_friendship/,Dazzjh,Puzzle pieces for a perfect friendship...,8807,0.94,97,,1689246139.0,False,False,False,False,False
92,14yizua,Damnthatsinteresting,/r/Damnthatsinteresting/comments/14yizua/this_is_what_320lbs_of_weight_loss_looks_like/,lumberjackfans,This is what 320lbs of weight loss looks like,18318,0.92,967,,1689249803.0,True,False,False,True,False
93,14yqoiu,awfuleverything,/r/awfuleverything/comments/14yqoiu/this_thing_flew_into_my_ear_and_died_deep_inside/,tiberius_danger,"This thing flew into my ear and died deep inside my ear canal. It flew in I spazzed, slapped it thought I killed it and was on the ground til 30 seconds later it started buzzing again deep inside my ear. Freaked out stuck my finger way up there and then took the last 30 minutes to get it out.",2039,0.97,107,,1689268707.0,True,False,False,False,False
94,14yoqx8,WhitePeopleTwitter,/r/WhitePeopleTwitter/comments/14yoqx8/disney_ceo_bob_iger_thinks_writers_and_actors/,TommyShelbyPFB,"Disney CEO Bob Iger thinks writers and actors strike is ""very disturbing"" and they are not being ""realistic""",9385,0.99,274,,1689264150.0,False,False,False,False,False
95,14yk81b,discordVideos,/r/discordVideos/comments/14yk81b/wtf/,LyghtsOut,wtf?,5536,0.94,143,,1689253199.0,False,False,False,False,False
96,14ym4ru,AnimalsBeingBros,/r/AnimalsBeingBros/comments/14ym4ru/sometimes_little_things_occupy_the_biggest_part/,daas_hu_gurudev_ka,Sometimes little things occupy the biggest part of their hearts.,3450,0.97,26,,1689257931.0,False,False,False,False,False
97,14ynn4t,PewdiepieSubmissions,/r/PewdiepieSubmissions/comments/14ynn4t/pewds_revealed_björns_name_long_time_back_in_a/,zhongli_sama,Pewds revealed Björn's name long time back in a QnA with Marzia💕,3071,0.95,68,,1689261549.0,False,False,False,False,False
98,14ymb2h,Genshin_Impact,/r/Genshin_Impact/comments/14ymb2h/the_most_beautiful_and_wellwritten_npcs_in/,Luc_128,The most beautiful and well-written NPCs in Genshin Impact,3620,0.94,327,,1689258345.0,False,False,False,False,False
99,14yfsx7,JustGuysBeingDudes,/r/JustGuysBeingDudes/comments/14yfsx7/bro_got_wife/,Serious_Ad_5233,Bro got wife,16502,0.9,410,,1689239751.0,False,False,False,False,False
100,14ygxuf,OneOrangeBraincell,/r/OneOrangeBraincell/comments/14ygxuf/trying_to_look_cute_after_attacking_my_feet/,Ihros_Tea,Trying to look cute after attacking my feet,8545,0.98,132,,1689243549.0,False,False,False,False,False
