rank,id,subreddit,permalink,author,title,score,upvote_ratio,num_comments,author_flair_text,created_utc,over_18,edited,stickied,locked,is_original_content
1,14o3fl5,mildlyinfuriating,/r/mildlyinfuriating/comments/14o3fl5/contractor_drills_through_ceiling_right_into_my/,dead_meat101,Contractor drills through ceiling right into my bathtub,13050,0.98,987,,1688239713.0,False,False,False,False,False
2,14o3qot,facepalm,/r/facepalm/comments/14o3qot/american_dream/,worthwhile_mobi,American dream,12859,0.89,1142,,1688240541.0,False,False,False,False,False
3,14o0c5x,nextfuckinglevel,/r/nextfuckinglevel/comments/14o0c5x/florence_welch_brings_a_miniconcert_to_young_girl/,dcijluther,Florence Welch brings a mini-concert to young girl battling cancer who wanted to attend one of her concerts but couldn't due to her illness and eventually passing away. May she rest in peace.,30999,0.95,722,,1688231686.0,False,False,False,False,False
4,14o0ab5,WhitePeopleTwitter,/r/WhitePeopleTwitter/comments/14o0ab5/this_has_to_be_the_worst_fucking_update_of_all/,Ok-Tennis330,This has to be the worst fucking update of all time,26430,0.94,2715,,1688231546.0,False,False,False,False,False
5,14o11sh,news,/r/news/comments/14o11sh/twitter_temporarily_restricts_tweets_users_can/,VengenaceIsMyName,"Twitter temporarily restricts tweets users can see, Elon Musk announces",14308,0.95,2745,,1688233532.0,False,False,False,False,False
6,14o1kt9,todayilearned,/r/todayilearned/comments/14o1kt9/til_of_kevin_budden_who_caught_a_deadly_taipan_by/,a2soup,"TIL of Kevin Budden, who caught a deadly taipan by hand and hitchhiked to town still holding the snake. He lost his grip and was bitten, but bagged the snake and made the driver promise to get it to researchers. Kevin died the next day, but the snake was used to create the first taipan antivenom.",11333,0.98,299,,1688234867.0,False,False,False,False,False
7,14o64gt,memes,/r/memes/comments/14o64gt/thou_gentry_trying_to_destroy_thine_kingdoms_as/,Therenegadegamer,Thou gentry trying to destroy thine kingdoms as quickly as possible,5715,0.97,147,,1688246574.0,False,False,False,False,False
8,14o0dd8,Damnthatsinteresting,/r/Damnthatsinteresting/comments/14o0dd8/the_engine_of_a_117year_old_swiss_steamboat/,SirLucky7,The Engine of a 117-Year old Swiss Steamboat,16132,0.98,419,,1688231771.0,False,False,False,False,False
9,14o2i7a,oddlyterrifying,/r/oddlyterrifying/comments/14o2i7a/brine_pools_at_the_bottom_of_the_sea/,Rumhed,Brine pools at the bottom of the sea.,8551,0.98,241,,1688237284.0,False,False,False,False,False
10,14o1m7a,worldnews,/r/worldnews/comments/14o1m7a/russians_cremate_their_dead_without_keeping/,Kimber80,Russians cremate their dead without keeping record to not pay compensation – General Staff,8159,0.97,386,,1688234971.0,False,False,False,False,False
11,14o412b,therewasanattempt,/r/therewasanattempt/comments/14o412b/to_be_a_pervert/,Killaxia,To be a pervert,6130,0.91,960,,1688241288.0,True,False,False,False,False
12,14nyilb,nba,/r/nba/comments/14nyilb/haynes_breaking_news_portland_trail_blazers/,SpiritedSuccess5675,"[Haynes] BREAKING NEWS: Portland Trail Blazers superstar Damian Lillard has requested a trade this morning, league sources tell @NBAonTNT, @BleacherReport.",16716,0.94,3117,:lal-2: Lakers,1688227013.0,False,False,False,False,False
13,14nz3w7,technicallythetruth,/r/technicallythetruth/comments/14nz3w7/i_hope_i_still_find_this_funny_on_wednesday/,authorized_join31,I hope I still find this funny on Wednesday,17918,0.97,207,,1688228496.0,False,False,False,False,False
14,14nxlrd,MadeMeSmile,/r/MadeMeSmile/comments/14nxlrd/in_the_longer_version_pup_never_leaves_his/,1Hate17Here,"In the longer version, pup never leaves his brother’s side for two hours until, finally, a hooman shows up.",30575,0.97,355,,1688224632.0,False,False,False,False,False
15,14o1do7,tumblr,/r/tumblr/comments/14o1do7/squirtle_wtf/,ExpertAccident,Squirtle wtf,9241,0.98,120,,1688234385.0,False,False,False,False,False
16,14o4jwn,PublicFreakout,/r/PublicFreakout/comments/14o4jwn/racist_cameraman_loses_his_cool_and_wants_a_hand/,PCartman,Racist cameraman loses his cool and wants a “hand on hand combat” with an Army guy.,4423,0.96,418,,1688242609.0,False,False,False,False,False
17,14o0gab,assholedesign,/r/assholedesign/comments/14o0gab/why_though/,datsnotright0,Why though?,9577,0.91,1097,,1688231987.0,False,False,False,False,False
18,14o28y6,lotrmemes,/r/lotrmemes/comments/14o28y6/a_momentous_event_on_the_verge_of_resurfacing/,RaccoonEmbarrasseda,A Momentous Event on the Verge of Resurfacing,6185,0.97,125,,1688236608.0,False,False,False,False,False
19,14o1szb,Terraria,/r/Terraria/comments/14o1szb/did_i_miss_something_playing_terraria/,billsn0w,Did I miss something playing Terraria?,7687,0.93,196,,1688235448.0,False,False,False,False,False
20,14o0pb4,shitposting,/r/shitposting/comments/14o0pb4/cant_spell_human_without_man_praise_spez/,MinisterCrack,can't spell human without man (Praise Spez),9711,0.96,186,:nooo:dumbass:nooo:,1688232632.0,False,False,False,False,False
21,14nw266,politics,/r/politics/comments/14nw266/cesspool_of_corruption_dems_reintroduce_bill_to/,newnemo,'Cesspool of Corruption': Dems Reintroduce Bill to Impose Supreme Court Term Limits,21156,0.95,1016,:flag-vt: Vermont,1688220557.0,False,False,False,False,False
22,14ny7mk,pcmasterrace,/r/pcmasterrace/comments/14ny7mk/asked_a_fb_seller_if_he_could_take_a_pic_w_my/,Nine_TTV,Asked a FB seller if he could take a pic w/ my name + date with his 4090...,11879,0.96,480,,1688226200.0,False,False,False,False,False
23,14o2osg,cats,/r/cats/comments/14o2osg/look_at_this_little_cookie_on_his_stomach_adopted/,kiwhyy,Look at this little cookie on his stomach! Adopted him yesterday and love him so much already,4601,0.99,143,,1688237756.0,False,False,False,False,False
24,14o3cxg,wholesomegreentext,/r/wholesomegreentext/comments/14o3cxg/anons_girlfriend_is_so_good/,TechnicalWayx,Anon's girlfriend is so good,4103,0.97,47,,1688239513.0,False,False,False,False,False
25,14nzsn8,todayilearned,/r/todayilearned/comments/14nzsn8/til_scientists_in_a_restricted_zone_closed_off_to/,UniqueThrowaway6664,"TIL scientists in a restricted zone, closed off to the public, discovered a plant grown out of the solidified lava. It was a tomato plant. Further research concluded it was from a tomato seed grown from the defecation of a scientist",16525,0.97,464,,1688230281.0,False,False,False,False,False
26,14nz8o1,PeterExplainsTheJoke,/r/PeterExplainsTheJoke/comments/14nz8o1/im_confused_a_racist_spider_man/,SkepticDrinker,"I'm confused, a racist spider man?",10046,0.91,527,,1688228837.0,False,False,False,False,False
27,14o0ifz,mildlyinfuriating,/r/mildlyinfuriating/comments/14o0ifz/twitter_limiting_the_number_of_post_you_can_view/,Woofer210,Twitter limiting the number of post you can view in a day,18411,0.91,2561,,1688232134.0,False,False,False,False,False
28,14o2f0c,antiwork,/r/antiwork/comments/14o2f0c/anyone_else/,Content_Pineapple_85,Anyone else?,4489,0.98,157,,1688237051.0,False,False,False,False,False
29,14nz64h,nottheonion,/r/nottheonion/comments/14nz64h/united_airlines_ceo_apologizes_for_insensitive/,tjerome1994,United Airlines CEO apologizes for 'insensitive' decision to fly private as airline was canceling flights,7299,0.95,434,,1688228655.0,False,False,False,False,False
30,14o4yvk,TikTokCringe,/r/TikTokCringe/comments/14o4yvk/same_person/,VibratingPickle2,“Same person”,3092,0.9,474,,1688243699.0,False,False,False,False,False
31,14o1a40,oddlysatisfying,/r/oddlysatisfying/comments/14o1a40/the_puddle_of_tar_on_fire_looks_like_a_portal_to/,zi-zu,The puddle of tar on fire looks like a portal to hell,5284,0.95,227,,1688234121.0,False,False,False,False,False
32,14o0mnc,facepalm,/r/facepalm/comments/14o0mnc/are_you_for_real/,Solopeerless,Are you for real,15081,0.94,1180,,1688232442.0,False,False,False,False,False
33,14nz6s9,gaming,/r/gaming/comments/14nz6s9/level_1_quests/,Yellyvi,Level 1 Quests,6848,0.97,135,,1688228703.0,False,False,False,False,False
34,14o3bm5,terriblefacebookmemes,/r/terriblefacebookmemes/comments/14o3bm5/quite_sure_that_is_not_the_logic/,Glass-Fan111,Quite sure that is not the logic…,3691,0.92,189,,1688239407.0,False,False,False,False,False
35,14o10k2,WhitePeopleTwitter,/r/WhitePeopleTwitter/comments/14o10k2/twitter_is_done/,JohnSheet69420,Twitter is DONE.,10001,0.96,835,,1688233446.0,False,False,False,False,False
36,14ny6qm,Tinder,/r/Tinder/comments/14ny6qm/can_gay_men_stop_fucking_making_girl_profiles_you/,SexyTruckDriver,Can gay men stop fucking making girl profiles? You aren’t turning a straight man gay. You’re just getting reported,8063,0.94,185,,1688226140.0,False,False,False,True,False
37,14nyfdb,meirl,/r/meirl/comments/14nyfdb/meirl/,Jimbo072,meirl,8364,0.95,272,,1688226770.0,False,False,False,False,False
38,14nxnwf,pics,/r/pics/comments/14nxnwf/john_olivers_reaction_to_nothing_changing/,joylfendar,John Oliver's reaction to nothing changing,8969,0.84,389,,1688224795.0,False,False,False,False,False
39,14nvlig,WorkReform,/r/WorkReform/comments/14nvlig/the_root_of_the_problem_is_colleges_are_too/,hazardousmug,The root of the problem is colleges are too expensive. This problem is never going to go away until colleges become more affordable.,13011,0.95,343,⛓️ Prison For Union Busters,1688219299.0,False,False,False,False,False
40,14o2frh,clevercomebacks,/r/clevercomebacks/comments/14o2frh/shots_fired/,1Hate17Here,Shots fired.,3800,0.95,157,,1688237105.0,False,False,False,False,False
41,14o1qbr,insanepeoplefacebook,/r/insanepeoplefacebook/comments/14o1qbr/what_did_you_think_would_happen/,maybesaydie,What did you think would happen?,4008,0.96,159,,1688235265.0,False,False,False,False,False
42,14o4wbe,comics,/r/comics/comments/14o4wbe/princesss_cousin_oc/,ASliceofAlan4U,Princess’s Cousin [OC],2512,0.96,25,,1688243507.0,False,False,False,False,False
43,14o1c0v,me_irlgbt,/r/me_irlgbt/comments/14o1c0v/meirlgbt/,AkuaDaLotl,Me🔥irlgbt,4101,0.96,71,:ace-bi: BiAce fire emblem warriors DEGENERATE ⚔️,1688234260.0,False,False,False,False,False
44,14nu278,BlackPeopleTwitter,/r/BlackPeopleTwitter/comments/14nu278/turn_around_is_fair_play/,Kelmo7,Turn around is fair play,16611,0.94,373,☑️,1688214922.0,False,False,False,False,False
45,14nwei7,BeAmazed,/r/BeAmazed/comments/14nwei7/a_fan_that_produces_a_threedimensional/,XahidX,A fan that produces a three-dimensional holographic images,11242,0.94,280,,1688221488.0,False,False,False,False,False
46,14o2rq5,PeopleFuckingDying,/r/PeopleFuckingDying/comments/14o2rq5/weiner_dog_bites_owner_so_owner_bites_back/,Odd_Candy1878,WeInEr DoG bItEs OwNeR sO oWnEr BiTeS bAcK,3145,0.97,24,,1688237981.0,False,False,False,False,False
47,14o2bm7,ContagiousLaughter,/r/ContagiousLaughter/comments/14o2bm7/potato_gun/,Accomplished-Law-592,Potato gun,3291,0.98,64,,1688236808.0,False,False,False,False,False
48,14o2ic5,Animemes,/r/Animemes/comments/14o2ic5/whats_your_best_argument_against_them/,Lisanro,what's your best argument against them?,3146,0.97,460,,1688237294.0,False,False,False,False,False
49,14o1a7w,bestof,/r/bestof/comments/14o1a7w/they_finally_did_it_reddit_made_it_impossible_for/,soupyhands,"""They finally did it: Reddit made it impossible for blind Redditors to moderate their own sub"" /r/Blind's mod team discusses the fallout of the reddit's CEO-initiated API changes.",3629,0.95,96,,1688234129.0,False,False,False,False,False
50,14nw1g8,HolUp,/r/HolUp/comments/14nw1g8/title_has_many_friends/,Past_Significance984,Title has many friends,10350,0.97,51,,1688220500.0,False,False,False,False,False
51,14o601y,dataisbeautiful,/r/dataisbeautiful/comments/14o601y/oc_how_well_the_richest_top_1_have_been_doing_the/,rubenbmathisen,[OC] How well the richest Top 1% have been doing the past 200 years,1830,0.93,205,OC: 17,1688246264.0,False,False,False,False,False
52,14o6mk8,HumansBeingBros,/r/HumansBeingBros/comments/14o6mk8/man_saves_a_turtle_outcast_from_the_water/,CC20057,Man saves a turtle outcast from the water,1699,0.97,64,,1688247866.0,False,False,False,False,False
53,14o2v83,nba,/r/nba/comments/14o2v83/charania_rfa_austin_reaves_has_agreed_to_return/,twistedlogicx,"[Charania] RFA Austin Reaves has agreed to return to the Los Angeles Lakers on a four-year, $56 million Early Bird maximum contract, sources tell @TheAthletic @Stadium. Agents Aaron Reilly and Reggie Berry of AMR Agency negotiated the new deal to keep Reaves in L.A. long term.",4656,0.97,1141,Toronto Huskies,1688238200.0,False,False,False,False,False
54,14nv7tx,LeopardsAteMyFace,/r/LeopardsAteMyFace/comments/14nv7tx/3000_republican_women_ready_to_campaign_against/,General_Tso75,3000 Republican women ready to campaign against the GOP and DeSantis after he takes away their alimony payments,8327,0.96,857,,1688218228.0,False,False,False,False,False
55,14o22tm,nbacirclejerk,/r/nbacirclejerk/comments/14o22tm/portland_fans_in_their_1500_a_month_apartment/,Micome,"Portland fans in their $1,500 a month apartment watching their star player leave",2833,0.98,79,,1688236171.0,False,False,False,False,False
56,14nyqma,marvelmemes,/r/marvelmemes/comments/14nyqma/reposting_an_oldie_of_mine/,fishbishmemes,Reposting an oldie of mine,4977,0.97,29,Spider-Man 🕷,1688227544.0,False,False,False,False,False
57,14nzjc6,fightporn,/r/fightporn/comments/14nzjc6/amateur_boxer_gets_beat_down_from_an_instructor/,lhwang0320,Amateur boxer gets beat down from an instructor,4306,0.89,257,,1688229622.0,False,False,False,False,False
58,14nux74,OldSchoolCool,/r/OldSchoolCool/comments/14nux74/70_years_ago_today_gentlemen_prefer_blondes_1953/,filmroses,"70 years ago today, Gentlemen Prefer Blondes (1953) was released and turned Marilyn Monroe into a global superstar. Here's her iconic musical number from it, ""Diamonds Are a Girl's Best Friend"". 70 years later and she is still so captivating.",8834,0.93,480,,1688217394.0,False,False,False,False,False
59,14nui23,lgbt,/r/lgbt/comments/14nui23/in_honor_of_the_christian_winning_their_case/,Future-Ad2802,In honor of the Christian winning their case against the LGBT community,10612,0.92,190,:ace: Ace as Cake,1688216241.0,False,False,False,False,False
60,14nu5xp,ProgrammerHumor,/r/ProgrammerHumor/comments/14nu5xp/somethingsomethinglayer8/,xFlumel_,somethingSomethingLayer8,11333,0.97,155,,1688215237.0,False,False,False,False,False
61,14nzkr9,worldnews,/r/worldnews/comments/14nzkr9/orca_rams_into_yacht_near_scotland_suggesting_the/,ScoMoTrudeauApricot,"Orca Rams Into Yacht Near Scotland, Suggesting the Behavior May Be Spreading",7025,0.98,861,,1688229721.0,False,False,False,False,False
62,14nts3a,funny,/r/funny/comments/14nts3a/the_path_and_lamps_are_not_on_speaking_terms/,Snoo_90160,The path and lamps are not on speaking terms.,10843,0.97,343,,1688214078.0,False,False,False,False,False
63,14nt5li,BrandNewSentence,/r/BrandNewSentence/comments/14nt5li/if_only_theyd_had_some_indication/,CinemaslaveJoe,If only they’d had some indication…,16024,0.98,225,,1688212189.0,False,False,False,False,False
64,14nywfs,anime_irl,/r/anime_irl/comments/14nywfs/anime_irl/,DeathPercept10n,anime_irl,4411,0.96,58,,1688227961.0,True,False,False,False,False
65,14nzgka,WTF,/r/WTF/comments/14nzgka/found_driving_down_a_remote_country_road_in_front/,VirtualLife76,Found driving down a remote country road in front of someones house.,3758,0.96,151,,1688229413.0,False,False,False,False,False
66,14o2pem,wallstreetbets,/r/wallstreetbets/comments/14o2pem/when_it_dips_to_400_buy_calls/,hisenbearg,"When it dips to 400, buy calls",2442,0.95,174,,1688237804.0,False,False,False,False,False
67,14nu757,technology,/r/technology/comments/14nu757/california_man_creates_ai_chatbot_to_waste_the/,Sariel007,California man creates AI chatbot to waste the time of telemarketers,8698,0.97,292,,1688215345.0,False,False,False,False,False
68,14o6cbr,oddlysatisfying,/r/oddlysatisfying/comments/14o6cbr/bully_girl_gets_what_she_deserves_for_being/,M3ANDMYSELF,Bully girl gets what she deserves for being disrespectful.,2533,0.92,96,,1688247129.0,False,False,False,False,False
69,14o2vii,lakers,/r/lakers/comments/14o2vii/shams_rfa_austin_reaves_has_agreed_to_return_to/,TVloverCam,"[Shams] RFA Austin Reaves has agreed to return to the Los Angeles Lakers on a four-year, $56 million Early Bird maximum contract, sources tell @TheAthletic @Stadium. Agents Aaron Reilly and Reggie Berry of AMR Agency negotiated the new deal to keep Reaves in L.A. long term.",2232,0.95,548,,1688238218.0,False,False,False,False,False
70,14nv2nj,AnimalsBeingDerps,/r/AnimalsBeingDerps/comments/14nv2nj/doggo_making_bread/,Bihema,Doggo making bread,7750,0.97,80,,1688217821.0,False,False,False,False,False
71,14nvmrf,NatureIsFuckingLit,/r/NatureIsFuckingLit/comments/14nvmrf/the_secret_coexistence_of_hippos_and_crocodiles/,EmptySpaceForAHeart,🔥 The Secret Coexistence of Hippos and Crocodiles.,6785,0.97,244,,1688219400.0,False,False,False,False,False
72,14o03mn,lotrmemes,/r/lotrmemes/comments/14o03mn/wisest_and_fairest_of_all_beings/,bsmith2123,Wisest and fairest of all beings..,6320,0.98,23,,1688231063.0,False,False,False,False,False
73,14ny8td,2meirl4meirl,/r/2meirl4meirl/comments/14ny8td/2meirl4meirl/,1Hate17Here,2meirl4meirl,4384,0.97,57,,1688226292.0,False,False,False,False,False
74,14o3ie4,ChoosingBeggars,/r/ChoosingBeggars/comments/14o3ie4/cb_believes_that_paying_45_to_have_her_nails_done/,sentialhappines,CB believes that paying $45 to have her nails done is excessive.,1999,0.96,207,,1688239920.0,False,False,False,False,False
75,14nv0xb,MadeMeSmile,/r/MadeMeSmile/comments/14nv0xb/a_4_year_old_discussing_his_emotions_with_his_mom/,NationYell,A 4 year old discussing his emotions with his mom. ,28121,0.96,981,,1688217693.0,False,False,False,False,False
76,14o0eht,PrequelMemes,/r/PrequelMemes/comments/14o0eht/its_not_over_yet/,ThisIsNotMyPornVideo,It's not over yet 🏳️‍⚧️🏳️‍🌈🏳️‍🌈🏳️‍🌈🏳️‍🌈🏳️‍⚧️,3389,0.85,95,,1688231853.0,False,False,False,False,False
77,14nxam5,formuladank,/r/formuladank/comments/14nxam5/me_watching_this_sprint_race/,Thamba24,Me watching this sprint race,5035,0.96,179,Vettel Cult,1688223828.0,False,False,False,False,False
78,14nu42f,Eldenring,/r/Eldenring/comments/14nu42f/i_am_excited_as_i_am_afraid_folks/,Huge-Swing-7137,I am excited as I am afraid folks...,10057,0.97,626,,1688215082.0,False,False,False,False,False
79,14o2avw,Breath_of_the_Wild,/r/Breath_of_the_Wild/comments/14o2avw/you_shouldnt_have_done_that/,SenaCurrn,You shouldn't have done that.,2332,0.97,36,,1688236751.0,False,False,False,False,False
80,14nybpz,wholesomememes,/r/wholesomememes/comments/14nybpz/he_loves_his_sister/,blaze_uchiha999,He loves his sister,4185,0.97,24,,1688226509.0,False,False,False,False,False
81,14nx50i,dankmemes,/r/dankmemes/comments/14nx50i/buh_bye/,notgordonbombay,buh bye,5779,0.96,106,,1688223449.0,False,False,False,False,False
82,14ny3ke,Serverlife,/r/Serverlife/comments/14ny3ke/maybe_know_what_sushi_is_before_dropping/,tanksandthefunkybun,Maybe know what sushi is before dropping $$$$,4185,0.96,678,,1688225911.0,False,False,False,False,False
83,14nysm9,Damnthatsinteresting,/r/Damnthatsinteresting/comments/14nysm9/2_snakes_fighting_in_the_water/,AristonD,2 snakes fighting in the water. ,7866,0.98,252,,1688227689.0,False,False,False,False,False
84,14o4rlq,AdviceAnimals,/r/AdviceAnimals/comments/14o4rlq/my_personal_thoughts_on_the_twitter_news/,ClutchReverie,My personal thoughts on the Twitter news,1653,0.83,141,,1688243174.0,False,False,False,False,False
85,14nudu8,atheism,/r/atheism/comments/14nudu8/dutch_government_to_ban_police_officers_from/,Leeming,"Dutch government to ban police officers from wearing religious symbols as part of uniforms in public. ‘Religious neutrality of the police should be explicit,’ according to minister for justice Dilan Yesilgoz.",7198,0.96,353,Strong Atheist,1688215896.0,False,False,False,False,False
86,14nzwnj,UkraineWarVideoReport,/r/UkraineWarVideoReport/comments/14nzwnj/former_deputy_russian_prosecutor_of_crimea_andrey/,woodsberry,"Former Deputy Russian Prosecutor of Crimea Andrey Fomin drowned while swimming in the Volga. July 1, 2023",3123,0.98,321,,1688230580.0,False,False,False,False,False
87,14nukb7,Hololive,/r/Hololive/comments/14nukb7/holotori_is_now_considered_an_official_unit/,extralie,HoloTori is now considered an official unit!,9099,0.92,281,:Kiara::Amelia::Kiara::Reine::Kiara:,1688216421.0,False,False,False,False,False
88,14o2dzn,Genshin_Impact,/r/Genshin_Impact/comments/14o2dzn/cant_believe_were_nearly_halfway_into_finishing/,asaness,Cant believe were nearly halfway into finishing the game,2257,0.97,209,,1688236974.0,False,False,False,False,False
89,14nx6nh,WhatsWrongWithYourDog,/r/WhatsWrongWithYourDog/comments/14nx6nh/double_standards/,fat_old_boy,Double standards.,4541,0.97,29,,1688223572.0,False,False,False,False,False
90,14o3yba,HonkaiStarRail,/r/HonkaiStarRail/comments/14o3yba/poor_pompom/,MatiasKratos97,Poor Pom-pom,1781,0.98,32,,1688241091.0,False,False,False,False,False
91,14nssum,pettyrevenge,/r/pettyrevenge/comments/14nssum/use_my_email_lose_your_kohls_cash/,uber765,"Use my email, lose your Kohl's Cash",11542,0.96,919,,1688211028.0,False,False,False,False,False
92,14nw4sg,meirl,/r/meirl/comments/14nw4sg/meirl/,iamcoollife1994,meirl,13707,0.97,229,,1688220745.0,False,False,False,False,False
93,14nytfl,projectzomboid,/r/projectzomboid/comments/14nytfl/my_neighbor_called_the_cops_on_me_over_zomboid/,GoodWeedReddit,My neighbor called the cops on me over zomboid.,3657,0.96,190,Zombie Killer,1688227749.0,False,1688229090.0,False,False,False
94,14o35eh,facepalm,/r/facepalm/comments/14o35eh/flat_earthers_train_children_from_birth_to/,Ilontersen,Flat Earthers train children from birth to…,6727,0.97,1633,,1688238929.0,False,False,False,False,False
95,14nxllu,ThatsInsane,/r/ThatsInsane/comments/14nxllu/steve_irwin_casually_reacts_to_being_bitten_by_a/,ojodefiz,Steve Irwin casually reacts to being bitten by a snake live on Australian TV in 1991.,4373,0.97,197,,1688224622.0,False,False,False,False,False
96,14nu8hh,ImTheMainCharacter,/r/ImTheMainCharacter/comments/14nu8hh/who_is_the_main_character_in_this_one/,Sharkmasterfl3x,Who is the main character in this one?,9682,0.84,1718,,1688215466.0,False,False,False,False,False
97,14o2k0z,WhitePeopleTwitter,/r/WhitePeopleTwitter/comments/14o2k0z/this_mf_barely_even_raised_the_rate_limit_hes/,Ok-Tennis330,"This mf barely even raised the rate limit, he's that fucking stupid",6574,0.98,469,,1688237417.0,False,False,False,False,False
98,14nxm4o,CleaningTips,/r/CleaningTips/comments/14nxm4o/having_guests_from_out_of_town_over_would_you/,Salt-Ice-9721,Having guests from out of town over. Would you feel comfortable with the cleanliness of my house ?,4177,0.89,1023,,1688224658.0,False,False,False,False,False
99,14o4xh5,trashy,/r/trashy/comments/14o4xh5/in_the_wild/,nobodysbestfriendd,In the wild,1470,0.97,101,,1688243592.0,True,False,False,False,False
100,14nue2i,TikTokCringe,/r/TikTokCringe/comments/14nue2i/who_is_actually_hurting_kids/,cak3crumbs,Who is actually hurting kids,22037,0.88,1453,,1688215912.0,False,False,False,False,False
