rank,id,subreddit,permalink,author,title,score,upvote_ratio,num_comments,author_flair_text,created_utc,over_18,edited,stickied,locked,is_original_content
1,151gplj,funny,/r/funny/comments/151gplj/so_probably_not/,TheExtimate,So probably not,9416,0.94,297,,1689539459.0,True,False,False,False,False
2,151e739,WhitePeopleTwitter,/r/WhitePeopleTwitter/comments/151e739/if_you_create_a_rule_expect_it_to_be_used_against/,WhiteDiamondK,"If you create a rule, expect it to be used against you….",17179,0.96,546,,1689533594.0,False,False,False,False,False
3,151dwgn,Damnthatsinteresting,/r/Damnthatsinteresting/comments/151dwgn/the_puss_caterpillar_southern_flannel_moth_will/,Totally-avg,The Puss Caterpillar (Southern Flannel Moth) will fuck your world up. I grazed it twice while climbing on a float. NBD at first but an hour later I was hyperventilating on the bedroom floor. The pain was excruciating. DH took me to the ER and morphine did nothing.,21383,0.96,1222,,1689532879.0,False,False,False,False,False
4,151f7wo,oddlysatisfying,/r/oddlysatisfying/comments/151f7wo/this_gentlemans_sheep_shearing_technique/,Rollo_Tomasi3000,This gentleman’s sheep shearing technique,8769,0.94,637,,1689535977.0,False,False,False,False,False
5,151h0wf,clevercomebacks,/r/clevercomebacks/comments/151h0wf/straight_men_truly_couldnt_care_less_all/,Stoner4s3,Straight men truly couldn't care less all,6477,0.93,414,,1689540193.0,False,False,False,False,False
6,151cz37,nextfuckinglevel,/r/nextfuckinglevel/comments/151cz37/carlos_alcatraz_winning_his_first_wimbledon_at_20/,stinky_sardine,Carlos Alcatraz winning his first Wimbledon at 20 years of age! ,14431,0.94,516,,1689530674.0,False,False,False,False,False
7,151a7nq,cats,/r/cats/comments/151a7nq/will_i_ever_be_able_to_eat_my_yogurt_alone_again/,alisongent,will i ever be able to eat my yogurt alone again???,22128,0.97,701,,1689524054.0,False,False,False,False,False
8,151g43p,todayilearned,/r/todayilearned/comments/151g43p/til_nbc_offered_a_role_to_james_gandolfini_to/,AlbinNboat,"TIL NBC offered a role to James Gandolfini to replace Michael Scott on ""The Office"", but HBO paid him $3 million to not take the role",4689,0.98,203,,1689538070.0,False,False,False,False,False
9,151awqy,MadeMeSmile,/r/MadeMeSmile/comments/151awqy/squirrel_restaurant/,Godfathermafia,Squirrel Restaurant ,13590,0.95,418,,1689525755.0,False,False,False,False,False
10,151dot8,news,/r/news/comments/151dot8/tourists_flock_to_death_valley_to_experience/,ChocolateTsar,Tourists flock to Death Valley to experience possible world-record heat of 55C degrees,6321,0.96,1360,,1689532367.0,False,False,False,False,False
11,1519kvr,facepalm,/r/facepalm/comments/1519kvr/look_how_clever_i_am_i_even_know_chess/,BaronVonBroccoli,"Look how clever I am, I even know Chess.",23949,0.9,2201,,1689522486.0,False,False,False,False,False
12,151a2si,TikTokCringe,/r/TikTokCringe/comments/151a2si/laundry_tips/,choganoga,Laundry tips,13264,0.9,1615,tHiS iSn’T cRiNgE,1689523713.0,False,False,False,False,False
13,1518wql,BeAmazed,/r/BeAmazed/comments/1518wql/amazing_variety_of_animals_come_to_drink_water_at/,CommercialBox4175,Amazing Variety Of Animals Come To Drink Water At Night,18693,0.97,574,,1689520808.0,False,False,False,False,False
14,1516z23,comics,/r/comics/comments/1516z23/ok_yeah_this_is_one_of_my_dumbest_oc/,TommySiegel,ok yeah this is one of my dumbest [OC],28460,0.95,246,,1689515919.0,False,False,False,False,False
15,151cpow,worldnews,/r/worldnews/comments/151cpow/environmental_protesters_vandalize_superyacht_of/,mightydoomslayerca,Environmental protesters vandalize superyacht of Walmart heir Nancy Walton Laurie,6046,0.96,512,,1689530075.0,False,False,False,False,False
16,151gxot,Damnthatsinteresting,/r/Damnthatsinteresting/comments/151gxot/tom_cruises_movie_vanilla_sky_has_been_the_only/,Sami1398,"Tom Cruise's movie ""Vanilla Sky"" has been the only movie ever to get permission to shut down entire Times Square for any amount of time for shooting a movie, they paid $1 million and got 3 hours on a sunday morning to film Cruise running around in a dream sequence hallucinating an empty Times Square",9221,0.98,319,,1689539994.0,False,False,False,False,False
17,151cnuj,tennis,/r/tennis/comments/151cnuj/wimbledon_mens_singles_final_1_c_alcaraz_d_2_n/,chespiotta,"Wimbledon, Men's Singles- Final - [1] C. Alcaraz d. [2] N. Djokovic 1-6, 7-6(6), 6-1, 3-6, 6-4",5611,0.95,2421,FAA-Dimi-Hubi-Med-Ruud-Matteo-Thiem-Big 3-DelPo-Cabal/Farah,1689529951.0,False,False,True,False,False
18,15181mo,memes,/r/memes/comments/15181mo/it_has_many_nutrient/,oranke_dino,It has many nutrient.,21562,0.97,305,Cringe Factory,1689518640.0,False,False,False,False,False
19,151d0ae,mildlyinfuriating,/r/mildlyinfuriating/comments/151d0ae/my_dad_stepmom_and_stepsister_just_went_on/,Bro---really,"My dad, stepmom, and stepsister just went on vacation, leaving me with this mess (I reuse all my bowls, plates, etc, so NONE of this mess is mine)",5586,0.95,1033,,1689530747.0,False,False,False,False,False
20,151cyzm,PeterExplainsTheJoke,/r/PeterExplainsTheJoke/comments/151cyzm/i_dont_get_it/,Red_Neck_Slim_Jim,I don't get it,5824,0.96,84,,1689530668.0,False,False,False,False,False
21,1518zgt,OneOrangeBraincell,/r/OneOrangeBraincell/comments/1518zgt/my_wife_took_this_amazing_photo/,Wettoasted,My wife took this amazing photo,10225,0.97,121,,1689520995.0,False,False,False,False,False
22,1519hc1,shitposting,/r/shitposting/comments/1519hc1/praise_spez_and_mrs_frizzle/,Gorotheninja,Praise Spez (and Mrs. Frizzle),11763,0.98,121,,1689522241.0,False,False,False,False,False
23,15196j2,wholesomememes,/r/wholesomememes/comments/15196j2/free_sneks_or_another_awards_for_everyone/,----eclipse,free sneks or another awards for everyone!,14502,0.89,13291,,1689521485.0,False,False,False,False,False
24,1518pvp,WTF,/r/WTF/comments/1518pvp/i_have_no_fucking_idea/,AnnihilationOrchid,I have no fucking idea..,9504,0.92,693,,1689520322.0,False,False,False,False,False
25,151d6r7,starterpacks,/r/starterpacks/comments/151d6r7/how_do_they_fuck_starter_pack/,Babufrak2,"""How do they fuck?"" starter pack",4828,0.92,193,,1689531184.0,False,False,False,False,False
26,1518bgk,me_irlgbt,/r/me_irlgbt/comments/1518bgk/me_irlgbt/,thatguy9684736255,me_irlgbt,13282,0.88,333,Ace/Rainbow :ace-rainbow:,1689519332.0,False,False,False,False,False
27,15181bu,meirl,/r/meirl/comments/15181bu/me_irl/,Sonic_the_hedgedog,me_irl,11350,0.97,292,,1689518617.0,False,False,False,False,False
28,1518w2q,therewasanattempt,/r/therewasanattempt/comments/1518w2q/to_balance/,Dathird,to balance,9270,0.96,379,,1689520762.0,False,False,False,False,False
29,1517pev,HolUp,/r/HolUp/comments/1517pev/luxury_car_security_feature/,Wololo--Wololo,Luxury car security feature,15610,0.95,326,,1689517780.0,False,False,False,False,False
30,1517jjm,politics,/r/politics/comments/1517jjm/donald_trump_brands_us_a_third_world_hellhole_run/,Key_Inevitable_2104,Donald Trump brands US a ‘third -world hellhole’ run by ‘perverts’ and ‘thugs’,9816,0.93,1714,:flag-ny: New York,1689517367.0,False,False,False,False,False
31,151fidi,oddlyterrifying,/r/oddlyterrifying/comments/151fidi/vegetables_shaped_like_humans/,Blueberry_Conscious_,Vegetables shaped like humans,2982,0.97,89,,1689536662.0,False,False,False,False,False
32,151g6l0,ThatsInsane,/r/ThatsInsane/comments/151g6l0/after_winning_her_boxing_match_daniella_hemsley/,alanboston,After winning her boxing match Daniella Hemsley flashes her breasts on live TV,2701,0.91,223,,1689538231.0,True,False,False,False,False
33,151bcvv,WhitePeopleTwitter,/r/WhitePeopleTwitter/comments/151bcvv/is_it_just_me_or_is_this_incredibly_out_of_touch/,thatguy9684736255,"Is it just me, or is this incredibly out of touch?",14271,0.97,1016,,1689526856.0,False,False,False,False,False
34,1516hx0,FunnyandSad,/r/FunnyandSad/comments/1516hx0/somebody_needs_to_check_for_a_pulse/,Comfortablejack,Somebody needs to check for a pulse,16419,0.91,225,,1689514606.0,False,False,False,False,False
35,1517f4l,OUTFITS,/r/OUTFITS/comments/1517f4l/is_this_fit_cute_for_a_bbq_or_too_much_my_crush/,moonlightfawn444,is this fit cute for a BBQ or too much? my crush is going to be there 🫠,29033,0.75,492,Newcomer (3 posts),1689517063.0,False,False,False,True,False
36,15193so,space,/r/space/comments/15193so/analog_film_selfie_from_my_first_spacewalk_more/,astro_pettit,Analog film selfie from my first spacewalk. More details in comments.,6231,0.97,163,NASA Astronaut,1689521305.0,False,False,False,False,True
37,1516bsv,Unexpected,/r/Unexpected/comments/1516bsv/professional_musicians_wont_miss_a_beat/,jucapolito,Professional musicians won’t miss a beat,12625,0.96,407,,1689514141.0,False,False,False,False,False
38,151656o,PrequelMemes,/r/PrequelMemes/comments/151656o/star_wars_is_for_all/,CaptainTechno_,Star wars is for all,15149,0.94,305,,1689513624.0,False,False,False,False,False
39,151bkte,PublicFreakout,/r/PublicFreakout/comments/151bkte/good_ole_texas/,fonsbark,Good ole Texas,4355,0.95,553,,1689527367.0,True,False,False,False,False
40,1513uur,OldSchoolCool,/r/OldSchoolCool/comments/1513uur/the_animators_from_behind_the_scenes_of_akira/,MulciberTenebras,"The animators from behind the scenes of ""AKIRA"" (1988), showing the process of hand-painting the backgrounds and individual cel animations",25296,0.97,746,,1689506737.0,False,False,False,False,False
41,1517ynt,NoahGetTheBoat,/r/NoahGetTheBoat/comments/1517ynt/guy_pushes_61year_old_man_on_the_subway_and_this/,CEOofBiafra,Guy pushes 61-year old man on the subway and this is what he has to say for himself. Disgusting.,8360,0.96,997,,1689518428.0,False,False,False,False,False
42,151cnhb,sports,/r/sports/comments/151cnhb/carlos_alcaraz_defeats_novak_djokovic_in_five/,nolesfan2011,Carlos Alcaraz Defeats Novak Djokovic in Five Sets to Win Wimbledon,3609,0.95,316,:MLBnym: New York Mets,1689529926.0,False,False,False,False,False
43,151dfjo,whenthe,/r/whenthe/comments/151dfjo/i_dont_think_no_rules_its_the_best_argument_in/,yoshbiscut69,I don’t think “no rules” it’s the best argument in court,3650,0.98,203,"what font is that, where are you people making these?",1689531760.0,False,False,False,False,False
44,1517gko,Jokes,/r/Jokes/comments/1517gko/a_man_walks_out_to_the_street_and_catches_a_taxi/,HelpingHandsUs,"A man walks out to the street and catches a taxi just going by. He gets into the taxi, and the cabbie says, ""Perfect timing. You're just like Frank.""",7917,0.95,151,,1689517167.0,False,False,False,False,False
45,15180sx,BrandNewSentence,/r/BrandNewSentence/comments/15180sx/probably_not_a_good_idea/,Existentialidiot83,Probably not a good idea.,8110,0.95,166,,1689518578.0,False,False,False,False,False
46,151cork,AskReddit,/r/AskReddit/comments/151cork/what_is_one_thing_men_should_never_do_to_look/,siluoo,What is one thing men should never do to look attractive?,3687,0.92,2437,,1689530013.0,True,False,False,False,False
47,151crzt,Spiderman,/r/Spiderman/comments/151crzt/the_fact_this_is_my_favorite_mcu_spider_man/,Technical-Peak3394,The fact this is my favorite MCU Spider Man poster and i never knew this....,3633,0.97,55,,1689530233.0,False,False,False,False,False
48,1514pr4,antiwork,/r/antiwork/comments/1514pr4/heat_exhaustion_killed_my_coworker_and_theyre/,LadyLee69,Heat exhaustion killed my coworker and they're covering it up,16325,0.94,972,,1689509461.0,False,1689528323.0,False,False,False
49,1519bi1,maybemaybemaybe,/r/maybemaybemaybe/comments/1519bi1/maybe_maybe_maybe/,licer71,Maybe Maybe Maybe,6272,0.92,1696,,1689521834.0,False,False,False,False,False
50,1516k8q,JustGuysBeingDudes,/r/JustGuysBeingDudes/comments/1516k8q/how_to_pick_up_girls_101/,flattenedbricks,How to pick up girls 101,10020,0.95,144,Lego Bricks,1689514789.0,False,False,False,False,False
51,151f8cx,anime_irl,/r/anime_irl/comments/151f8cx/anime_irl/,yokiyokin,anime_irl,2329,0.97,73,,1689536005.0,False,False,False,False,False
52,15144jq,NatureIsFuckingLit,/r/NatureIsFuckingLit/comments/15144jq/aerial_view_of_a_group_of_basking_sharks_a/,SinjiOnO,"🔥 Aerial view of a group of Basking Sharks, a relatively rare sighting as they're predominately solitary creatures",15553,0.97,243,:parrot:,1689507631.0,False,False,False,False,False
53,1519d80,baseball,/r/baseball/comments/1519d80/woman_and_her_family_got_ejected_in_the_first/,GroMicroBloom,Woman and her family got ejected in the first game of the doubleheader for this catch,4643,0.96,1701,Tampa Bay Devil Rays :tbr3:,1689521960.0,False,False,False,False,False
54,1516qzm,wallstreetbets,/r/wallstreetbets/comments/1516qzm/cybertruck_spotted_in_the_wildloading_calls/,coryf03,Cybertruck spotted in the wild…loading calls,7330,0.95,289,,1689515304.0,False,False,False,False,False
55,1515nda,CrazyFuckingVideos,/r/CrazyFuckingVideos/comments/1515nda/idiots_decide_to_street_race_through_a_stop_light/,ThrowRA0069,Idiots Decide to Street Race Through a Stop Light,9833,0.96,1005,,1689512265.0,False,False,False,False,False
56,151dzbm,2meirl4meirl,/r/2meirl4meirl/comments/151dzbm/2meirl4meirl/,hornmelon,2meirl4meirl,2543,0.98,24,,1689533067.0,False,False,False,False,False
57,151g8bt,LateStageCapitalism,/r/LateStageCapitalism/comments/151g8bt/when_you_look_at_the_most_vulnerable_people_in/,irate-librarian,When you look at the most vulnerable people in our society and just see skin sacks for art practice.,1942,0.98,72,,1689538335.0,False,False,False,False,False
58,1517wgf,oddlyspecific,/r/oddlyspecific/comments/1517wgf/a_drooling_socialist_cuck/,Existentialidiot83,A drooling socialist cuck 🤔,6350,0.96,201,,1689518273.0,False,False,False,False,False
59,151atxw,OrphanCrushingMachine,/r/OrphanCrushingMachine/comments/151atxw/clearly_cops_dont_have_the_budget_for_that/,jericho601,Clearly cops don't have the budget for that themselves...,3847,0.94,121,,1689525577.0,False,False,False,False,False
60,151d591,DiWHY,/r/DiWHY/comments/151d591/flayer_of_thighs_cracker_of_nuts_cutter_of_toes/,balbertborring,"Flayer of Thighs, Cracker of Nuts, Cutter of Toes, Pincher of Butts",2797,0.95,98,,1689531078.0,False,False,False,False,False
61,1513zh5,NewsOfTheStupid,/r/NewsOfTheStupid/comments/1513zh5/donald_trump_claims_the_american_dream_is_dead/,Misguided_Society,Donald Trump claims the American dream is ‘dead’ - stating the US a ‘third -world hellhole’ run by ‘perverts’ and ‘thugs’,18208,0.85,4788,,1689507155.0,False,False,False,False,False
62,1519pnw,BeAmazed,/r/BeAmazed/comments/1519pnw/the_kiffness_the_roadrager_and_a_7_nation_army/,purple-circle,"The Kiffness, the road-rager and a 7 nation army",12560,0.96,224,,1689522820.0,False,False,False,False,False
63,151diex,technology,/r/technology/comments/151diex/finland_introduces_the_worlds_first_phonefree/,fchung,Finland introduces the world’s first phone-free tourist island,2585,0.92,146,,1689531948.0,False,False,False,False,False
64,15173pv,PS5,/r/PS5/comments/15173pv/phil_spencer_we_are_pleased_to_announce_that/,Turbostrider27,Phil Spencer: We are pleased to announce that Microsoft and @PlayStation have signed a binding agreement to keep Call of Duty on PlayStation following the acquisition of Activision Blizzard. We look forward to a future where players globally have more choice to play their favorite games.,6425,0.92,2841,,1689516236.0,False,False,False,False,False
65,151g7or,inthenews,/r/inthenews/comments/151g7or/florida_losing_tourist_money_to_other_states/,audiomuse1,Florida losing tourist money to other states,1844,0.96,283,,1689538295.0,False,False,False,False,False
66,15152hu,tumblr,/r/tumblr/comments/15152hu/black_holes_arent_planet_gluttons_you_bitch/,SaraAnnabelle,"Black holes aren't planet gluttons, you bitch",11652,0.96,239,,1689510566.0,False,False,False,False,False
67,151cdby,CasualUK,/r/CasualUK/comments/151cdby/am_i_being_thick/,dpm_259,Am I being thick?,2934,0.96,729,,1689529260.0,False,False,False,False,False
68,1514g0o,marvelmemes,/r/marvelmemes/comments/1514g0o/they_couldve_used_a_prop_for_the_gun_atleast/,GAMMAGREEN62,They could've used a prop for the gun atleast...,16907,0.9,1133,Avengers,1689508663.0,False,False,False,False,False
69,151beuk,DunderMifflin,/r/DunderMifflin/comments/151beuk/oscar_was_wild_for_this/,nikulmmadhu,Oscar was wild for this,3210,0.99,58,,1689526972.0,False,False,False,False,False
70,151cuyg,KingOfTheHill,/r/KingOfTheHill/comments/151cuyg/propane_propane_accessories_strickland_propane/,MiddleofInfinity,Propane & propane accessories. Strickland Propane,2616,0.97,139,,1689530425.0,False,False,False,False,False
71,151hpj4,BlackPeopleTwitter,/r/BlackPeopleTwitter/comments/151hpj4/pronoun_game_is_strong_when_you_have_something_to/,Kelmo7,Pronoun game is strong when you have something to hide,1491,0.98,69,☑️,1689541747.0,False,False,False,False,False
72,151f00y,WorkReform,/r/WorkReform/comments/151f00y/we_need_a_nationwide_strike_for_all_industries/,ThatsMrPotatoHeadtoU,We need a nationwide strike for all industries,2008,0.97,44,,1689535459.0,False,False,False,False,False
73,151cv1c,texas,/r/texas/comments/151cv1c/census_confirmed_latinos_now_the_majority_in_texas/,Lostlobster8,Census Confirmed. Latinos now the majority in Texas.,2582,0.94,414,,1689530430.0,False,False,False,False,False
74,151dyae,Tinder,/r/Tinder/comments/151dyae/is_this_a_weird_way_to_meet_someone_for_the_first/,100problemss,Is this a weird way to meet someone for the first time?,2260,0.97,373,,1689532999.0,False,False,False,False,False
75,151aibr,TheLastAirbender,/r/TheLastAirbender/comments/151aibr/im_not_the_only_one_right/,AvatarRohan2025,"I'm not the only one, right?",3595,0.97,173,,1689524778.0,False,False,False,False,False
76,1517iyh,Genshin_Impact,/r/Genshin_Impact/comments/1517iyh/all_69_characters_specialist_dance_before_fontaine/,Stealthless,ALL 69 Characters Specialist Dance before Fontaine,6302,0.93,307,:keqing::kokomi:,1689517324.0,False,False,False,False,False
77,1518afg,facepalm,/r/facepalm/comments/1518afg/classmate_i_havent_spoken_to_in_5_years_messages/,poplitte2,Classmate I haven’t spoken to in 5 years messages me out of the blue to delete a picture I posted of myself—because her boyfriend saw it. (More in comments),19328,0.97,2048,,1689519258.0,False,False,False,False,False
78,151az1c,nextfuckinglevel,/r/nextfuckinglevel/comments/151az1c/how_this_guys_handles_the_alligator/,argetlam5,How this guys handles the alligator,8420,0.95,524,,1689525917.0,False,False,False,False,False
79,1517s96,technicallythetruth,/r/technicallythetruth/comments/1517s96/to_be_fair_not_many_humans_know_either/,uguystookeveryname,"To be fair, not many humans know either.",5442,0.98,52,,1689517970.0,False,False,False,False,False
80,1516ij6,interesting,/r/interesting/comments/1516ij6/giant_squid_makes_an_appearance_in_tokyo_bay/,MetsX2000,Giant Squid makes an appearance in Tokyo Bay,6897,0.96,377,,1689514656.0,False,False,False,False,False
81,151632h,ImTheMainCharacter,/r/ImTheMainCharacter/comments/151632h/yelling_bomb_in_the_middle_of_the_busy_airport/,Best_Needleworker530,Yelling “bomb” in the middle of the busy airport for TikTok views,8424,0.8,713,,1689513464.0,False,False,False,True,False
82,151g29m,Superstonk,/r/Superstonk/comments/151g29m/so_has_anyone_talked_about_citadel_securities/,jhs0108,So has anyone talked about Citadel Securities massive increase in the Notional Amount of their Derivatives over the last few years yet? Cause I just found out about it and holy cow this could be big.,1911,0.96,151,,1689537949.0,False,False,False,False,False
83,15172o2,pettyrevenge,/r/pettyrevenge/comments/15172o2/had_the_roommate_from_hell_and_couldnt_get_rid_of/,ThisIsMyCircus40,Had the roommate from hell and couldn't get rid of her so I made living with me as miserable as possible.,5247,0.94,304,,1689516162.0,False,1689520547.0,False,False,False
84,151ebyg,pics,/r/pics/comments/151ebyg/well_john_oliver_says_i_need_to_burn_my_38k_coins/,topgun966,Well John Oliver says I need to burn my 38K coins I have been hoarding. So will be burning them here,1874,0.78,2934,,1689533923.0,False,False,False,False,False
85,151b35w,mildlyinfuriating,/r/mildlyinfuriating/comments/151b35w/this_cheap_glass_we_bought_from_the_dollar_store/,chikinbizkit,"This cheap glass we bought from the dollar store fell out of our cabinet and onto the stove top today. Instead of the glass shattering, it put a sizeable dent in our metal stove top. Glass is still fully intact, not even scratched.",7164,0.95,340,,1689526208.0,False,False,False,False,False
86,15173og,terriblefacebookmemes,/r/terriblefacebookmemes/comments/15173og/why_do_they_hate_therapy_so_much/,jeonteskar,Why do they hate therapy so much?,5809,0.88,528,,1689516233.0,False,False,False,False,False
87,151h4ds,PoliticalHumor,/r/PoliticalHumor/comments/151h4ds/sad_but_true/,Bertiers_Moma,"Sad, But True....",1356,0.94,130,,1689540412.0,False,False,False,False,False
88,1513hgb,NonPoliticalTwitter,/r/NonPoliticalTwitter/comments/1513hgb/crypto_queen/,kirby-groot,Crypto Queen,11053,0.95,114,:blue1::blue2::1111::1112:,1689505467.0,False,False,False,False,False
89,151558z,todayilearned,/r/todayilearned/comments/151558z/til_that_in_2017_all_gps_coordinates_in_australia/,nacrosian,"TIL that in 2017 all GPS coordinates in Australia were shifted 1.8 m to account for continental drift since the last update in 1994. Moving north 7 cm a year, the Australian plate is one of the fastest-drifting plates in the world",32184,0.97,621,,1689510800.0,False,False,False,False,False
90,1519e8h,nba,/r/nba/comments/1519e8h/charania_phoenix_is_trading_g_cam_payne_a/,PlayaSlayaX,"[Charania] Phoenix is trading G Cam Payne, a second-round pick and cash to San Antonio, sources tell @TheAthletic @Stadium.",3380,0.96,591,:sas-3: Spurs,1689522028.0,False,False,False,False,False
91,151afo5,PoliticalCompassMemes,/r/PoliticalCompassMemes/comments/151afo5/2024_is_going_to_be_between_two_shitty_candidates/,mrducky78,2024 is going to be between two shitty candidates again. Same as it ever was.,3044,0.9,558,:left: - Left,1689524598.0,False,False,False,False,False
92,1517jgs,yesyesyesyesno,/r/yesyesyesyesno/comments/1517jgs/trying_not_to_get_wet_while_popping_ballons/,habichuelacondulce,Trying not to get wet while popping ballons,4495,0.92,123,,1689517362.0,False,False,False,False,False
93,151biin,IllegallySmolCats,/r/IllegallySmolCats/comments/151biin/ophelia_the_day_i_picked_her_up/,destielwhitewolf,Ophelia the day I picked her up,2543,0.98,37,,1689527211.0,False,False,False,False,False
94,15187zz,diablo4,/r/diablo4/comments/15187zz/glyphs_needs_clearer_system/,Alexandurrrrr,Glyphs needs clearer system,3907,0.95,555,,1689519083.0,False,False,False,False,False
95,151c3pi,AnimalsBeingDerps,/r/AnimalsBeingDerps/comments/151c3pi/its_slippery_in_here_mom/,IUMogg,"It’s slippery in here, mom ",2347,0.96,26,,1689528625.0,False,False,False,False,False
96,151eg5q,discordVideos,/r/discordVideos/comments/151eg5q/cmon_you_sons_of_bitches_do_you_wanna_live_forever/,iammrpingas,C’mon you sons of bitches. Do you wanna live forever?,1798,0.98,118,,1689534170.0,False,False,False,False,False
97,1517ej0,SipsTea,/r/SipsTea/comments/1517ej0/hot_take_if_we_all_united_to_require_more/,Gadnerxi,"Hot take, if we all United to require more",4647,0.95,57,,1689517019.0,False,False,False,True,False
98,1517w62,MadeMeSmile,/r/MadeMeSmile/comments/1517w62/man_with_cerebral_palsy_overcomes_the_odds_to/,CommercialBox4175,Man With Cerebral Palsy Overcomes The Odds To Become A Body Builder,13770,0.95,256,,1689518250.0,False,False,False,False,False
99,151gn8g,ContagiousLaughter,/r/ContagiousLaughter/comments/151gn8g/1_rep_for_20/,ValarMorcoolis,1 rep for $20,1342,0.97,30,,1689539307.0,False,False,False,False,False
100,151aitz,197,/r/197/comments/151aitz/rule/,Real_FishGod,rule,2835,0.97,170,niche internet microcelebrity,1689524815.0,False,False,False,False,False
