rank,id,subreddit,permalink,author,title,score,upvote_ratio,num_comments,author_flair_text,created_utc,over_18,edited,stickied,locked,is_original_content
1,14rn8zd,pics,/r/pics/comments/14rn8zd/the_rpics_moderators_cant_respond_to_reddit/,pics-moderator,"The /r/PICS moderators can't respond to Reddit directly, so we're surfacing a reply here.",21941,0.91,2,,1688590884.0,True,1688610545.0,True,True,False
2,14rndd1,nextfuckinglevel,/r/nextfuckinglevel/comments/14rndd1/its_an_ad_but_an_ad_for_a_really_damn_good_product/,esberat,It's an ad but an ad for a really damn good product.,22322,0.91,725,,1688591130.0,False,False,False,False,False
3,14rnhcm,facepalm,/r/facepalm/comments/14rnhcm/i_have_no_words/,TheGrimReefah,I have no words…,22204,0.95,1183,,1688591386.0,False,False,False,False,False
4,14rmitv,todayilearned,/r/todayilearned/comments/14rmitv/til_two_of_kurt_cobains_closest_friends_mark/,Ainsley-Sorsby,"TIL Two of Kurt Cobain's closest friends, Mark Lanegan and Dylan Carlson credit Courtney Love with saving their lives in the years after his death. She felt he would want them to be saved and decided to support them both morally and financially so they can go to rehab and turn their lives around",13390,0.96,620,,1688589303.0,False,False,False,False,False
5,14rpw42,WhitePeopleTwitter,/r/WhitePeopleTwitter/comments/14rpw42/kind_of_wish_i_hadnt_fact_checked_this/,shah_mazing,Kind of wish I hadn’t fact checked this,6894,0.98,135,,1688596865.0,False,False,False,False,False
6,14rksbn,Damnthatsinteresting,/r/Damnthatsinteresting/comments/14rksbn/special_copy_of_fahrenheit451_reveals_text_when/,jokoons25,Special copy of Fahrenheit-451 reveals text when exposed to intense heat.,25520,0.93,759,,1688585427.0,False,False,False,False,False
7,14rjoen,politics,/r/politics/comments/14rjoen/trump_posted_what_he_said_was_obamas_address/,keigo199013,"Trump posted what he said was Obama's address, prosecutors say. An armed man was soon arrested there",16186,0.96,1293,:flag-al: Alabama,1688583024.0,False,False,False,False,False
8,14rljsi,worldnews,/r/worldnews/comments/14rljsi/prigozhin_arrives_in_st_petersburg_takes_back/,WRW_And_GB,"Prigozhin arrives in St Petersburg, takes back seized weapons",10334,0.96,1142,,1688587160.0,False,False,False,False,False
9,14riry5,clevercomebacks,/r/clevercomebacks/comments/14riry5/this_man_did_not_mess_around_respect/,FormalHearta,This man did not mess around. Respect.,26354,0.92,779,,1688581087.0,False,False,False,False,False
10,14rnt14,cyberpunkgame,/r/cyberpunkgame/comments/14rnt14/the_reddit_admins_have_threatened_us_demanding_we/,Tabnam,"The Reddit admins have threatened us, demanding we change back from NSFW ‘or else’",6290,0.94,513,🔥Beta Tester 🌈,1688592124.0,True,1688606553.0,True,False,False
11,14rrtrm,MadeMeSmile,/r/MadeMeSmile/comments/14rrtrm/woman_has_been_feeding_the_same_family_of_foxes/,Ocelot859,Woman has been feeding the same family of foxes every morning for over 25 years now.,3718,0.96,154,,1688601527.0,False,False,False,False,False
12,14rgqhk,antiwork,/r/antiwork/comments/14rgqhk/ups_walked_from_contract_negotiations_with_the/,wahday,"UPS walked from contract negotiations with the Teamsters union yesterday... 340,000 UPS workers now set to stop work on August 1st, with 97% voting yes on union authorization to strike!",16268,0.97,838,"workers of the world, unite! ",1688576758.0,False,1688611059.0,False,False,False
13,14ro0w9,inthenews,/r/inthenews/comments/14ro0w9/rapist_of_10yearold_girl_who_traveled_to_indiana/,YokedMF,Rapist of 10-year-old girl who traveled to Indiana for abortion gets 25 years in prison,4786,0.97,263,,1688592625.0,False,False,False,True,False
14,14ro2ax,maybemaybemaybe,/r/maybemaybemaybe/comments/14ro2ax/maybe_maybe_maybe/,RespectMyAuthoriteh,Maybe Maybe Maybe,5154,0.91,457,,1688592713.0,False,False,False,False,False
15,14rqkbz,nba,/r/nba/comments/14rqkbz/charania_sources_the_dallas_mavericks_san_antonio/,Professor_Finn,"[Charania] Sources: The Dallas Mavericks, San Antonio Spurs and Boston Celtics are finalizing a three-team trade: - Mavs: Grant Williams - Spurs: Reggie Bullock and an unprotected Dallas pick swap in 2030 - Celtics: Multiple second-round picks",3371,0.96,887,:phi-2: 76ers,1688598398.0,False,False,False,False,False
16,14rgb6q,TikTokCringe,/r/TikTokCringe/comments/14rgb6q/ai_generated_joe_biden_ad_by_the_daily_show/,geo_jam,AI generated Joe Biden ad by the daily show,17644,0.93,1103,,1688575894.0,False,False,False,False,False
17,14rlr8m,comics,/r/comics/comments/14rlr8m/no_holding_back/,NonRock,No holding back,6421,0.98,53,Hot Paper Comics,1688587596.0,False,False,False,False,False
18,14rnuv3,Unexpected,/r/Unexpected/comments/14rnuv3/hands_in_the_steering_wheel_all_the_time_or_else/,terransLoc,hands in the steering wheel all the time. or else..,4884,0.95,322,,1688592238.0,False,False,False,False,True
19,14rm61q,BlackPeopleTwitter,/r/BlackPeopleTwitter/comments/14rm61q/no_choice_but_to_get_off_the_flight/,Wild-Iceberg,No choice but to get off the flight,5622,0.96,179,,1688588499.0,False,False,False,False,False
20,14rkgkq,doordash,/r/doordash/comments/14rkgkq/doordash_is_hiring_anybody_nowadays/,whitneychewston,Doordash is hiring anybody nowadays,7292,0.97,227,,1688584718.0,False,False,False,False,False
21,14rslla,news,/r/news/comments/14rslla/ohio_man_sentenced_to_life_in_prison_for_rape_of/,Awkward-Action2853,Ohio man sentenced to life in prison for rape of 10-year-old girl who traveled to Indiana for abortion,2387,0.98,187,,1688603619.0,False,False,False,False,False
22,14rnyk7,facepalm,/r/facepalm/comments/14rnyk7/why_are_ppl_calling_him_woke_hes_not_lying/,Suspicious_County_24,Why are ppl calling him woke? He’s not lying.,13680,0.89,2041,,1688592471.0,False,False,False,False,False
23,14rql5j,OneOrangeBraincell,/r/OneOrangeBraincell/comments/14rql5j/look_how_cute_the_bite_is/,Ok_Power56,Look how cute the bite is,3006,0.99,21,,1688598453.0,False,False,False,False,False
24,14rel63,mildlyinfuriating,/r/mildlyinfuriating/comments/14rel63/the_waiter_charging_me_87_for_what_should_have/,thetownslore,The Waiter charging me $87 for what should have been a $7 tip despite me writing the total at the bottom ($45.23),38777,0.93,3087,,1688572327.0,False,False,False,False,False
25,14rgnm9,Whatcouldgowrong,/r/Whatcouldgowrong/comments/14rgnm9/not_looking_before_reversing_out_of_your_driveway/,uchman365,Not looking before reversing out of your driveway ,14675,0.95,1841,,1688576595.0,False,False,False,False,False
26,14rlvur,ProgrammerHumor,/r/ProgrammerHumor/comments/14rlvur/wellnamingagitbranchaftersomeoneiskindahot/,huxx__,wellNamingAGitBranchAfterSomeoneIsKindaHot,5107,0.96,204,,1688587883.0,False,False,False,False,False
27,14ri1gn,memes,/r/memes/comments/14ri1gn/oh_god_im_in_danger/,lukinhas_02,Oh god i'm in danger,18053,0.94,315,I touched grass,1688579533.0,False,False,False,False,False
28,14rf09x,meirl,/r/meirl/comments/14rf09x/meirl/,Jimbo072,meirl,17651,0.98,265,,1688573160.0,False,False,False,False,False
29,14rntye,PublicFreakout,/r/PublicFreakout/comments/14rntye/woman_has_a_breakdown_after_the_owner_of_the/,Kawamatsu__,woman has a breakdown after the owner of the puppies tell her not to give the puppies water ,3896,0.91,661,,1688592182.0,False,False,False,False,False
30,14rfhvx,tumblr,/r/tumblr/comments/14rfhvx/flamingos_are/,Old_Specialist7892,Flamingos are....,15802,0.97,199,,1688574199.0,False,False,False,False,False
31,14rfi8r,CrazyFuckingVideos,/r/CrazyFuckingVideos/comments/14rfi8r/here_come_the_firework_videos/,_Deerake,Here come the firework videos…,12241,0.97,1021,,1688574219.0,False,False,False,False,False
32,14rcvn0,oddlyterrifying,/r/oddlyterrifying/comments/14rcvn0/what_rip_current_looks_like/,zhangyuandyou,What rip current looks like,31305,0.94,948,,1688568696.0,False,False,False,False,False
33,14rhl5v,lotrmemes,/r/lotrmemes/comments/14rhl5v/aita/,UltraMagat,AITA?,8085,0.96,118,,1688578543.0,False,False,False,False,False
34,14rqi6o,dankmemes,/r/dankmemes/comments/14rqi6o/a_horror_story/,Aboudhijab,A horror story,2563,0.98,21,,1688598256.0,False,False,False,False,False
35,14rjgx1,Tinder,/r/Tinder/comments/14rjgx1/valid/,stibnite00,Valid?,6678,0.84,748,,1688582575.0,False,False,False,False,False
36,14rknhj,MemePiece,/r/MemePiece/comments/14rknhj/the_hygiene_issue_could_be_far_worse_than_we/,metalhiro,The hygiene issue could be far worse than we realize,5364,0.93,136,,1688585135.0,False,False,False,False,False
37,14rjyag,PoliticalHumor,/r/PoliticalHumor/comments/14rjyag/cool_story_bro/,pinkrantz,Cool story bro,5318,0.95,392,,1688583608.0,False,False,False,False,False
38,14rq3ww,WhitePeopleTwitter,/r/WhitePeopleTwitter/comments/14rq3ww/hags_for_hitler_so_much_for_the_tolerant_left/,politicalthrow99,"Hags for Hitler: ""So much for the tolerant left!""",4752,0.97,466,,1688597383.0,False,False,False,False,False
39,14rdagn,oddlysatisfying,/r/oddlysatisfying/comments/14rdagn/shiba_spa_treatment/,nikamats,Shiba spa treatment,35155,0.87,621,,1688569562.0,False,False,False,False,False
40,14rd1fm,OldSchoolCool,/r/OldSchoolCool/comments/14rd1fm/the_ice_man_man_delivering_a_25lb_block_of_ice/,gegorb,"The ice man man delivering a 25lb block of ice. Photograph taken in 1928 in Houston, Texas. Circa 1928",15514,0.97,1077,,1688569045.0,False,False,False,False,False
41,14rhtsg,BeAmazed,/r/BeAmazed/comments/14rhtsg/the_rain_and_wind_create_that_effects/,XahidX,The rain and wind create that effects.,8437,0.84,422,,1688579078.0,False,False,False,False,False
42,14rfmt0,therewasanattempt,/r/therewasanattempt/comments/14rfmt0/to_attempt_to_sing_chandelier_by_sia/,cloudtdaz,To attempt to sing chandelier by sia,11092,0.91,1550,,1688574462.0,False,False,False,False,False
43,14rktoa,Damnthatsinteresting,/r/Damnthatsinteresting/comments/14rktoa/hummingbird_mistakes_hunters_hat_as_some_kind_of/,jokoons25,Hummingbird mistakes hunter’s hat as some kind of flower. ,11923,0.99,159,,1688585505.0,False,False,False,False,False
44,14reoiz,AskReddit,/r/AskReddit/comments/14reoiz/you_accidentally_left_your_cocaine_at_the_white/,Alaskan_Lost,You accidentally left your cocaine at the White House. What do you do now?,10940,0.89,4573,,1688572509.0,False,False,False,False,False
45,14rdz9b,HolUp,/r/HolUp/comments/14rdz9b/where_can_i_find/,Year-20-20,Where can I find?,18263,0.93,674,  :q1::q2::q3::q4:,1688571041.0,False,False,False,False,False
46,14rilxb,LateStageCapitalism,/r/LateStageCapitalism/comments/14rilxb/times_have_changed/,bracingSqueeze491,Times have changed,5672,0.94,287,,1688580718.0,False,False,False,False,False
47,14rko3z,nextfuckinglevel,/r/nextfuckinglevel/comments/14rko3z/the_way_this_cow_secured_its_own_freedom/,Finkenn,The way this cow secured its own freedom,10369,0.98,373,,1688585172.0,False,False,False,False,False
48,14rh7mo,todayilearned,/r/todayilearned/comments/14rh7mo/til_in_2011_abercrombie_fitch_offered_mike_the/,Texas_Rockets,"TIL in 2011 Abercrombie & Fitch offered Mike ‘The Situation’ Sorrentino (from ‘Jersey Shore’) $10,000 not to wear the company's clothes because they felt it would cause “significant damage” to their image.",20724,0.96,685,,1688577772.0,True,False,False,False,False
49,14rirvx,MadeMeSmile,/r/MadeMeSmile/comments/14rirvx/genuinely_adorable_conversation/,qwbif,Genuinely adorable conversation ,14216,0.94,224,,1688581084.0,False,False,False,False,False
50,14rpulk,blackmagicfuckery,/r/blackmagicfuckery/comments/14rpulk/there_is_a_23_billion_msg_sphere_in_las_vegas/,Darkshreaders3,There is a $2.3 billion MSG Sphere in Las Vegas,2140,0.91,289,,1688596764.0,False,False,False,False,False
51,14rb1f6,wholesomememes,/r/wholesomememes/comments/14rb1f6/mister_smitten/,King_Pee,Mister Smitten,25227,0.97,94,,1688564514.0,False,False,False,False,False
52,14rdtiu,bald,/r/bald/comments/14rdtiu/should_i_shave_my_head_once_for_all/,chozov,Should i shave my head once for all?,12444,0.91,5769,,1688570699.0,False,False,False,False,False
53,14rk3vs,TwoXChromosomes,/r/TwoXChromosomes/comments/14rk3vs/ohio_abortion_rights_backers_submit_nearly_double/,rpaul9578,Ohio abortion rights backers submit nearly double needed signatures for fall ballot measure,3968,0.97,86,,1688583923.0,False,False,False,False,False
54,14rhqb2,gaming,/r/gaming/comments/14rhqb2/battlebit_the_overnight_success_six_years_in_the/,Spadical,"Battlebit, the overnight success six years in the making, has sold just shy of two million in two weeks",5262,0.96,493,,1688578863.0,False,False,False,False,False
55,14rl0jt,Spiderman,/r/Spiderman/comments/14rl0jt/get_back_here_shocker/,dazli69,GET BACK HERE SHOCKER!,3539,0.95,150,,1688585958.0,False,False,False,False,False
56,14rhn4n,whenthe,/r/whenthe/comments/14rhn4n/one_of_my_favorite_moments/,Zavionoteryx,One of my favorite moments,6514,0.97,297,,1688578667.0,False,False,False,False,False
57,14rri87,PrequelMemes,/r/PrequelMemes/comments/14rri87/yes_absolutly/,nuvlik,"Yes, absolutly",1625,0.98,43,,1688600713.0,False,False,False,False,False
58,14rkjob,unpopularopinion,/r/unpopularopinion/comments/14rkjob/having_a_spouse_who_is_naked_all_the_time_is_not/,bogus_gasman2,Having a spouse who is naked all the time is not as great as it sounds.,3954,0.82,1233,,1688584909.0,False,False,False,False,False
59,14rev2y,PeopleFuckingDying,/r/PeopleFuckingDying/comments/14rev2y/doctor_gets_brutally_assaulted_by_patient/,ultradespairthot,DoCtOr gEtS BRuTaLLY AsSaULTeD By pAtieNt,8022,0.97,74,,1688572876.0,False,False,False,False,False
60,14rc2ns,WTF,/r/WTF/comments/14rc2ns/felon_elbows_lawyer_in_the_face_after_conviction/,JuicySpark,Felon elbows lawyer in the face after conviction.,11432,0.96,704,,1688566891.0,False,False,False,False,False
61,14rn7s5,Superstonk,/r/Superstonk/comments/14rn7s5/todays_news_about_mainstar_sending_drs_shares/,RAMBO_JESUS,Today's news about mainstar sending DRS shares back to the DTCC should be a wake up call. These people are doing everything in their power to stop DRS.,2994,0.96,151,🦍 Attempt Vote 💯,1688590824.0,False,False,False,False,False
62,14rhwk9,Overwatch,/r/Overwatch/comments/14rhwk9/this_is_the_best_reaction_ive_gotten_to_my/,Bpdpunk,This is the best reaction I've gotten to my username so far.,4923,0.96,46,:Ana: Ana,1688579248.0,False,False,False,False,False
63,14reesc,AITAH,/r/AITAH/comments/14reesc/aitah_for_leaving_in_the_middle_of_a_date/,TheQuietOne9891,AITAH for leaving in the middle of a date?,8265,0.91,2127,,1688571946.0,False,False,False,False,False
64,14rha1l,PeterExplainsTheJoke,/r/PeterExplainsTheJoke/comments/14rha1l/petah_help_i_legit_dont_get_it/,MrAlbinoNinja,Petah help I legit don't get it,5637,0.96,91,,1688577910.0,False,False,False,False,False
65,14ra0fy,FunnyandSad,/r/FunnyandSad/comments/14ra0fy/this_is_not_logical/,Sensitive-Jury-1456,This is not logical.,29222,0.89,1859,,1688562031.0,False,False,False,False,False
66,14rqmbo,technicallythetruth,/r/technicallythetruth/comments/14rqmbo/hes_kind_of_got_a_point/,FamiliarCatfish,He’s kind of got a point.,1617,0.97,40,,1688598534.0,False,False,False,False,False
67,14rjrxl,NatureIsFuckingLit,/r/NatureIsFuckingLit/comments/14rjrxl/female_leopard_wakes_up_male_only_to_seek/,peenutbuttherNjelly,🔥🔥 Female leopard wakes up male only to seek attention ,3502,0.93,357,,1688583221.0,False,False,False,False,False
68,14rr3iw,ContagiousLaughter,/r/ContagiousLaughter/comments/14rr3iw/coolest_dog_on_the_planet/,Tourmalinwolf,Coolest dog on the planet,1476,0.99,21,,1688599696.0,False,False,False,False,False
69,14ribt0,SipsTea,/r/SipsTea/comments/14ribt0/never_gonna_give_you_up/,footedSeeder,Never gonna give you up,4275,0.96,34,,1688580127.0,False,False,False,False,False
70,14rn09s,politics,/r/politics/comments/14rn09s/trump_calls_for_sick_puppet_jack_smith_to_be_put/,PuterstheBallgagTsar,"Trump calls for ""sick puppet"" Jack Smith to be ""put out to rest""",4353,0.96,688,,1688590378.0,False,False,False,False,False
71,14rlwyg,news,/r/news/comments/14rlwyg/teen_boy_dies_following_industrial_accident_at/,AudibleNod,Teen boy dies following industrial accident at northern Wisconsin sawmill,4964,0.97,574,,1688587950.0,False,False,False,False,False
72,14rqlv5,popculturechat,/r/popculturechat/comments/14rqlv5/keke_palmers_boyfriend_publicly_shames_her_for/,Forsaken-Version9238,Keke Palmer’s boyfriend publicly shames her for wearing ‘revealing’ clothes despite being a mother…,1481,0.93,586,,1688598504.0,False,False,False,False,False
73,14rnjey,PoliticalCompassMemes,/r/PoliticalCompassMemes/comments/14rnjey/alternate_headline_companies_protect_themselves/,atheisteaster,Alternate Headline: “Companies protect themselves from future litigation”,2134,0.88,360,:libright: - Lib-Right,1688591514.0,False,False,False,False,False
74,14rquiw,conservativeterrorism,/r/conservativeterrorism/comments/14rquiw/hags_for_hitler_so_much_for_the_tolerant_left/,politicalthrow99,"Hags for Hitler: ""So much for the tolerant left!""",1413,0.96,191,,1688599085.0,False,False,False,False,False
75,14rns5s,DunderMifflin,/r/DunderMifflin/comments/14rns5s/the_most_popular_dwight_line_was_security_in_this/,goldenretreiverdude,The most popular Dwight line was “Security in this office park is a joke. Last year I came to work with my spud gun in a duffel bag. I sat at my desk all day with a rifle that shoots potatoes at 60 pounds per square inch. Can you imagine if I was deranged?” See next round in body text!,2021,0.92,543,:david: David Wallace,1688592071.0,False,False,False,False,False
76,14rbu25,NonPoliticalTwitter,/r/NonPoliticalTwitter/comments/14rbu25/i_guess_we_could_try/,KingFahad360,I guess we could try.,10428,0.96,526,:blue1::blue2::1111::1112:,1688566375.0,False,False,False,False,False
77,14rcm9b,shitposting,/r/shitposting/comments/14rcm9b/how_i_met_your_mother_praise_spez/,Top-Evidence-2807,How I met your mother (praise Spez),14057,0.94,161,,1688568155.0,False,False,True,False,False
78,14rivsv,calvinandhobbes,/r/calvinandhobbes/comments/14rivsv/happy_birthday_mr_bill_watterson/,damagedgoodz99824,Happy Birthday Mr. Bill Watterson!,3523,0.97,84,,1688581320.0,False,False,False,False,False
79,14rmuyi,technology,/r/technology/comments/14rmuyi/twitter_silently_removes_login_requirement_for/,hawlc,Twitter silently removes login requirement for viewing tweets,2225,0.96,247,,1688590061.0,False,False,False,False,False
80,14rkin0,Hololive,/r/Hololive/comments/14rkin0/mumei_and_kronii_are_not_letting_irys_sleep/,Anyacchi,Mumei and Kronii are not letting IRyS sleep,3026,0.94,60,:Mumei::Pekora::Marine::Pekora::Kronii:,1688584842.0,True,False,False,False,False
81,14ru8oa,Genshin_Impact_Leaks,/r/Genshin_Impact_Leaks/comments/14ru8oa/lyney_gameplay_via_dim/,iyad08,Lyney gameplay via Dim,904,0.98,296,:WandererWave: humans can't be trusted (except arlecchino),1688608008.0,False,False,False,False,False
82,14rb5i1,horror,/r/horror/comments/14rb5i1/simon_pegg_says_people_dont_fcking_need_shaun_of/,Neo2199,Simon Pegg Says People Don’t ‘F*cking Need’ ‘Shaun of the Dead 2:’ ‘Move On’,9596,0.96,790,,1688564779.0,False,False,False,False,False
83,14rptbj,fightporn,/r/fightporn/comments/14rptbj/one_punch_man/,xniteowlz,one punch man,1563,0.97,124,,1688596675.0,False,False,False,False,False
84,14rmey8,Grimdank,/r/Grimdank/comments/14rmey8/literally_had_this_interaction_today/,brokensilence32,Literally had this interaction today.,2308,0.97,222,Depressed Death Guard,1688589046.0,False,False,False,False,False
85,14rlfoa,sadposting,/r/sadposting/comments/14rlfoa/real/,NBGamingH7,Real,2694,0.94,135,,1688586907.0,False,False,False,False,False
86,14rg6a3,comics,/r/comics/comments/14rg6a3/invention/,JimKB,invention,10761,0.97,137,Jim Benton Cartoons,1688575596.0,False,False,False,False,False
87,14rkcg4,woahdude,/r/woahdude/comments/14rkcg4/fireworks_over_la_seen_last_night_from_my_flight/,inanimatus_conjurus,Fireworks over LA seen last night from my flight,2861,0.96,84,,1688584458.0,False,False,False,False,False
88,14rbwe7,BrandNewSentence,/r/BrandNewSentence/comments/14rbwe7/to_be_fair_weather_has_gotten_a_bit_hotter/,Keknoo,To be fair weather has gotten a bit hotter recently...,10736,0.96,245,,1688566522.0,False,False,False,False,False
89,14rjtn4,antiwork,/r/antiwork/comments/14rjtn4/ten_of_us_left_our_work_on_monday_and_it_feels_so/,UnoriginallyGeneric,"Ten of us left our work on Monday, and it feels so good. (warning: long story)",6165,0.97,412,,1688583325.0,False,False,False,False,False
90,14rga31,3Dprinting,/r/3Dprinting/comments/14rga31/triggering_lego_fans/,Bulky_Association229,Triggering Lego Fans,4623,0.94,147,,1688575832.0,False,False,False,False,False
91,14ra9v3,iamatotalpieceofshit,/r/iamatotalpieceofshit/comments/14ra9v3/girl_pretends_to_clean_up_a_beach_for_her_social/,kakapoopoopeepeeshir,Girl pretends to clean up a beach for her social media content then proceeds to leave the trash bags on the beach. ,12552,0.96,538,,1688562682.0,False,False,False,True,False
92,14rkyzd,DesignPorn,/r/DesignPorn/comments/14rkyzd/this_customizable_table_lamp/,ExhilaratedFo,This Customizable Table Lamp,2627,0.94,101,,1688585853.0,False,False,False,False,False
93,14rbfh2,me_irlgbt,/r/me_irlgbt/comments/14rbfh2/me_irlgbt/,Sonic_the_hedgedog,me_irlgbt,10695,0.93,77,MLM/Ace :mlm_ace:,1688565451.0,False,False,False,False,False
94,14rm4vq,cursedcomments,/r/cursedcomments/comments/14rm4vq/cursed_twitter/,rileyadamsmith,Cursed_twitter,2304,0.98,25,,1688588429.0,False,False,False,False,False
95,14reoiq,Unexpected,/r/Unexpected/comments/14reoiq/crazy_arms_from_hell/,Antony_2805,crazy arms from hell,31668,0.86,335,,1688572508.0,False,False,False,False,True
96,14rj522,Animemes,/r/Animemes/comments/14rj522/aquas_gif/,NationalStrategy,Aqua's GIF,3234,0.96,49,,1688581858.0,False,False,False,False,False
97,14rb75o,insanepeoplefacebook,/r/insanepeoplefacebook/comments/14rb75o/literally_1984_but_like_unironically_said/,velduz,Literally 1984 but like unironically said.,9209,0.95,436,,1688564898.0,False,False,False,False,False
98,14re3r9,sadcringe,/r/sadcringe/comments/14re3r9/this_is_tragic/,sumit131995,This is tragic ,5784,0.96,169,,1688571310.0,False,False,False,False,False
99,14rfzzr,worldnews,/r/worldnews/comments/14rfzzr/macrons_call_to_cut_off_social_media_during_riots/,DoremusJessup,Macron's call to 'cut off' social media during riots sparks backlash in France,8976,0.97,704,,1688575223.0,False,False,False,False,False
100,14rmibt,Justrolledintotheshop,/r/Justrolledintotheshop/comments/14rmibt/a_letter_from_gm_to_my_great_aunt/,Better-Literature-56,A letter from GM to my great Aunt.,2011,0.98,237,,1688589271.0,False,False,False,False,False
