rank,id,subreddit,permalink,author,title,score,upvote_ratio,num_comments,author_flair_text,created_utc,over_18,edited,stickied,locked,is_original_content
1,14to71c,worldnews,/r/worldnews/comments/14to71c/biden_told_xi_after_putin_meeting_be_careful_your/,Tnargkiller,"Biden told Xi after Putin meeting: Be careful, your economy depends on Western investment",10851,0.95,1533,,1688775338.0,False,False,False,False,False
2,14tlt1y,mildlyinfuriating,/r/mildlyinfuriating/comments/14tlt1y/why_did_they_have_to_design_it_like_this/,doriscrockford_canem,Why did they have to design it like this,15118,0.91,2617,,1688769469.0,False,False,False,False,False
3,14tixjz,MadeMeSmile,/r/MadeMeSmile/comments/14tixjz/this_little_boy_found_an_older_skater_to_hold_his/,Soloflow786,"This little boy found an older skater to hold his hand as he attempted a trick. And when he landed it, he had the sweetest reaction 😭",37932,0.94,484,,1688762826.0,False,False,False,False,False
4,14tk0k1,news,/r/news/comments/14tk0k1/dc_court_of_appeals_committee_recommends_giuliani/,IcyMike1782,D.C. Court of Appeals committee recommends Giuliani be disbarred,13227,0.97,325,,1688765310.0,False,False,False,False,False
5,14tmdoq,Damnthatsinteresting,/r/Damnthatsinteresting/comments/14tmdoq/curious_fly/,Cold_Zero_,Curious fly,10889,0.95,497,,1688770829.0,False,False,False,False,False
6,14tk3st,facepalm,/r/facepalm/comments/14tk3st/science_is_too_hard_for_you_stew/,Visqo,"Science is too hard for you, Stew",18313,0.97,790,,1688765524.0,False,False,False,False,False
7,14tlppj,nextfuckinglevel,/r/nextfuckinglevel/comments/14tlppj/man_has_seizure_while_skydiving_and_is_saved_by/,Closed_Aperture,Man has seizure while skydiving and is saved by instructor during free fall.,10581,0.97,488,,1688769245.0,False,False,False,False,False
8,14tjcna,todayilearned,/r/todayilearned/comments/14tjcna/til_that_there_are_approximately_299_people/,seaweed_blunt,"TIL that there are approximately 299 people cryogenically frozen in Scottsdale, Arizona",13621,0.96,1244,,1688763794.0,False,False,False,False,False
9,14to4hx,oddlysatisfying,/r/oddlysatisfying/comments/14to4hx/this_camera_filter_makes_it_look_like_the_cat_has/,MyNameGifOreilly,This camera filter makes it look like the cat has lava spots on him,5854,0.96,104,,1688775139.0,False,False,False,False,False
10,14tq9kk,therewasanattempt,/r/therewasanattempt/comments/14tq9kk/to_stretch_the_legs_on_a_flight/,_swuaksa8242211,to stretch the legs on a flight ,3745,0.99,120,A Flair?,1688780937.0,False,False,False,False,False
11,14tpid6,nba,/r/nba/comments/14tpid6/highlight_jabari_smith_jr_hits_a_crazy_3_to_win/,Thimit22,[Highlight] Jabari Smith Jr. hits a crazy 3 to win their first summer league game!,3990,0.97,347,:min-1: Timberwolves,1688778812.0,False,False,False,False,False
12,14tke2i,Eldenring,/r/Eldenring/comments/14tke2i/the_true_endgame/,Rase57,The True Endgame,9229,0.98,261,:restored:,1688766191.0,False,False,False,False,False
13,14tml8y,OldSchoolCool,/r/OldSchoolCool/comments/14tml8y/gentlemen_this_is_democracy_manifest_1991/,OceanBreezeAU,"Gentlemen, this is democracy manifest! 1991",5575,0.97,396,,1688771331.0,False,False,False,False,False
14,14tfpe4,WhitePeopleTwitter,/r/WhitePeopleTwitter/comments/14tfpe4/elon_goes_full_q_never_go_full_q/,G-Unit11111,Elon goes full Q. Never go full Q.,28855,0.94,1090,,1688755620.0,False,False,False,False,False
15,14tiexx,LeopardsAteMyFace,/r/LeopardsAteMyFace/comments/14tiexx/get_poor_quick_scheme_investing_in_trump_companies/,feel_your_feelings_,Get Poor Quick Scheme: Investing in Trump Companies,9602,0.96,830,,1688761653.0,False,False,False,False,False
16,14tkpbt,CrazyFuckingVideos,/r/CrazyFuckingVideos/comments/14tkpbt/100_round_fully_auto_glock/,FinalSneak,100 round fully auto Glock 🫨,7028,0.92,806,,1688766884.0,False,False,False,False,False
17,14tk5u9,politics,/r/politics/comments/14tk5u9/activists_want_to_disqualify_trump_from_ballot_in/,Rafdoc,Activists want to disqualify Trump from ballot in key states under 14th Amendment,6501,0.97,287,"Rafael Bernal, The Hill",1688765668.0,False,False,False,False,False
18,14tnp6y,BlackPeopleTwitter,/r/BlackPeopleTwitter/comments/14tnp6y/37_years_of_consistency/,EvonyR,37 years of consistency.,3987,0.95,196,☑️ ,1688774088.0,False,False,False,False,False
19,14tk265,meirl,/r/meirl/comments/14tk265/me_irl/,rainbowarriorhere,me_irl,6857,0.97,93,,1688765421.0,False,False,False,False,False
20,14tf2kb,Unexpected,/r/Unexpected/comments/14tf2kb/staying_under_the_radar/,5krunner,Staying under the radar,24009,0.93,502,,1688754171.0,True,False,False,False,False
21,14ti7hb,antiwork,/r/antiwork/comments/14ti7hb/woman_90_retires_from_dillards_job_after_74_years/,berserk539,"Woman, 90, retires from Dillard’s job after 74 years — and no missed days",8699,0.95,912,,1688761152.0,False,False,False,False,False
22,14tlj7t,shitposting,/r/shitposting/comments/14tlj7t/praise_spez_for_he_isnt_a_predditor/,dace154288,Praise spez for he isn’t a predditor,6572,0.94,123,,1688768810.0,False,False,False,False,False
23,14tq18k,tumblr,/r/tumblr/comments/14tq18k/good_news/,caughtyoulookinn,Good news,2710,0.97,18,,1688780287.0,False,False,False,False,False
24,14teirv,funny,/r/funny/comments/14teirv/apology_letter_from_exgf/,bigmikesbeingnice,Apology letter from ex-gf,24147,0.89,2152,,1688752911.0,False,False,False,False,False
25,14tmkgw,popculturechat,/r/popculturechat/comments/14tmkgw/she_would_totally_nail_it/,Spirited_Most6626,She would totally nail it!,3812,0.97,91,,1688771276.0,False,False,False,False,False
26,14ti0lk,memes,/r/memes/comments/14ti0lk/freedom_units_metric/,LemonConnoiseur,Freedom units > metric,19064,0.78,1171,,1688760706.0,True,False,False,False,False
27,14tdua6,PublicFreakout,/r/PublicFreakout/comments/14tdua6/a_tourist_restrains_a_pickpocket_in_italy/,ojodefiz,A tourist restrains a pickpocket in Italy 😳,18226,0.96,1553,,1688751349.0,True,False,False,False,False
28,14tgc3n,tifu,/r/tifu/comments/14tgc3n/tifu_by_thinking_my_boyfriend_brought_condoms_to/,BurritoSupreme420,TIFU by thinking my boyfriend brought condoms to our Las Vegas vacation together and refusing to talk to him for a day cause of it,12786,0.85,1436,,1688756988.0,True,1688757108.0,False,False,False
29,14tm3vl,sadcringe,/r/sadcringe/comments/14tm3vl/incel_moment/,lambda_2001,Incel Moment,4193,0.95,328,,1688770208.0,True,False,False,False,False
30,14tqeqs,BeAmazed,/r/BeAmazed/comments/14tqeqs/distant_view_of_people_entering_the_sea_its_like/,therra123,Distant view of people entering the sea... It’s like we’re the bacteria of the world,2158,0.96,128,,1688781350.0,False,False,False,False,False
31,14tmt0b,ukraine,/r/ukraine/comments/14tmt0b/it_is_so_strange_that_those_who_are_now_so/,Espressodimare,It is so strange that those who are now so triggered by the U.S. transfer of cluster munitions to Ukraine just couldn’t care less when Russia was pounding Ukraine with cluster munitions in the first place. Must be nothing but pure coincidence.,3315,0.94,235,,1688771891.0,False,False,False,False,False
32,14tm4xe,Baking,/r/Baking/comments/14tm4xe/i_made_my_grandma_her_peanut_butter_fudge_recipe/,SeanCole2,I made my grandma her peanut butter fudge recipe,3613,0.94,173,,1688770271.0,False,False,False,False,False
33,14tdh0n,cats,/r/cats/comments/14tdh0n/1_month_of_cat_ownership_its_been_more_fun_than_i/,maxman87,"1 month of cat ownership, it’s been more fun than I ever imagined",15081,0.98,575,,1688750491.0,False,False,False,False,False
34,14tbx9l,lotrmemes,/r/lotrmemes/comments/14tbx9l/such_a_good_actor/,UsernameLaugh,Such a good actor,29854,0.96,584,,1688747014.0,False,False,False,False,False
35,14tk7u6,LateStageCapitalism,/r/LateStageCapitalism/comments/14tk7u6/theyll_just_be_here_to_colonize_and_exploit/,merRedditor,"They'll just be here to colonize and exploit resources, then, won't they.",4431,0.97,111,,1688765788.0,False,False,False,False,False
36,14th0ik,pettyrevenge,/r/pettyrevenge/comments/14th0ik/boyfriend_was_wrongfully_towed_from_our_complex_i/,Ok-Willow-2109,"Boyfriend was wrongfully towed from our complex, I got revenge",7052,0.95,299,,1688758508.0,False,False,False,False,False
37,14tnlm2,rareinsults,/r/rareinsults/comments/14tnlm2/the_predator_is_coming/,OwlishlyGoogle99,The predator is coming,2841,0.96,46,,1688773853.0,False,False,False,False,False
38,14tfxzf,dankmemes,/r/dankmemes/comments/14tfxzf/i_dont_make_the_rules_i_just_enforce_them/,thepositivepandemic,"I don’t make the rules, I just enforce them.",11470,0.94,74,,1688756156.0,False,False,False,False,False
39,14tin8z,facepalm,/r/facepalm/comments/14tin8z/plant_based_beer/,Lisa_Sbs,Plant based beer,18326,0.96,1904,,1688762184.0,False,False,False,False,False
40,14tm5z4,PeterExplainsTheJoke,/r/PeterExplainsTheJoke/comments/14tm5z4/petah_what_am_i_missing/,electricaltoaster666,Petah what am I missing?,3489,0.92,143,,1688770338.0,False,False,False,False,False
41,14tdayz,gaming,/r/gaming/comments/14tdayz/pc_gamer_anger_from_voice_actors_as_nsfw_mods_use/,H377Spawn,[PC Gamer] Anger from voice actors as NSFW mods use AI deepfakes to replicate their voices: 'This is NOT okay.',15443,0.89,2718,Xbox,1688750124.0,False,False,False,False,False
42,14tp1h0,oddlysatisfying,/r/oddlysatisfying/comments/14tp1h0/the_way_this_golden_so_elegantly_and_effortlessly/,Thund3rbolt,The Way This Golden So Elegantly And Effortlessly Homs Into The Back Of A Jeep,4584,0.94,108,,1688777574.0,False,False,False,False,False
43,14tef2j,comics,/r/comics/comments/14tef2j/fashion_flaws_oc/,blanche_draw,Fashion flaws [OC],10714,0.96,413,,1688752699.0,False,False,False,False,False
44,14tbby7,wholesomememes,/r/wholesomememes/comments/14tbby7/i_can_celebrate_lunar_new_year_now/,blaze_uchiha999,I can celebrate lunar new year now,36214,0.94,460,,1688745732.0,False,False,False,False,False
45,14tpg9g,Damnthatsinteresting,/r/Damnthatsinteresting/comments/14tpg9g/up_close_view_of_landspout_in_alberta/,VariousBasket125,Up close view of landspout in Alberta ,4123,0.99,196,,1688778644.0,False,False,False,False,False
46,14thb9p,PrequelMemes,/r/PrequelMemes/comments/14thb9p/i_hate_you/,Dranem78,"""I HATE YOU!""",6134,0.97,75,,1688759166.0,False,False,False,False,False
47,14tkxb1,iamatotalpieceofshit,/r/iamatotalpieceofshit/comments/14tkxb1/dixie_was_a_sweet_and_friendly_dog_who_loved/,CantStopPoppin,"Dixie was a sweet and friendly dog who loved everyone. She was only 3 years old when a police officer in Lorain, Ohio, shot her dead. The officer had muted his body cam and called her over before pulling the trigger multiple times",3582,0.95,550,,1688767403.0,False,False,False,False,False
48,14tg657,TikTokCringe,/r/TikTokCringe/comments/14tg657/what_conservatives_think_trans_women_are/,MikeTony713,What conservatives think trans women are,7523,0.86,747,,1688756624.0,False,False,False,False,False
49,14tomhz,baseball,/r/baseball/comments/14tomhz/alek_manoah_vs_detroit_tigers_in_his_first_start/,ColoradoHotel,Alek Manoah vs Detroit Tigers in his first start since being sent down: 6.0 IP 1 ER 5 H 0 BB 8 K,2065,0.95,292,Toronto Blue Jays :tor1:,1688776455.0,False,False,False,False,False
50,14tlh88,Hololive,/r/Hololive/comments/14tlh88/koyoris_latest_scheme_to_gain_more_subscribers/,Superliminal96,Koyori's latest scheme to gain more subscribers: turning herself blue,3276,0.97,102,:Koyori:,1688768697.0,False,False,False,False,False
51,14timhv,DunderMifflin,/r/DunderMifflin/comments/14timhv/to_the_guy_whos_planning_on_proposing_after_a_week/,kNyne,To the guy who's planning on proposing after a week,4348,0.98,159,,1688762138.0,False,False,False,False,False
52,14tmqdb,WhitePeopleTwitter,/r/WhitePeopleTwitter/comments/14tmqdb/it_would_be_pretty_funny/,rNBA_Mods_Be_Better,It would be pretty funny,5198,0.99,83,,1688771707.0,False,False,False,False,False
53,14to4q9,wholesome,/r/wholesome/comments/14to4q9/she_understood_the_assignment/,Sufficient-Bug-9112,She understood the assignment,2073,0.98,17,,1688775161.0,False,False,False,False,False
54,14tpm6r,PoliticalHumor,/r/PoliticalHumor/comments/14tpm6r/please/,SampsonHart,Please.,1687,0.98,26,,1688779113.0,False,False,True,False,False
55,14tjt4d,discordVideos,/r/discordVideos/comments/14tjt4d/breathe/,justBarrels,Breathe,3978,0.94,172,Professional Shitter🧐,1688764810.0,False,False,False,False,False
56,14tfr7k,AskReddit,/r/AskReddit/comments/14tfr7k/whats_the_best_example_of_it_takes_20_years_to/,nastrohan,What’s the best example of “it takes 20 years to build a reputation and five minutes to ruin it” that you know of?,6211,0.95,3471,,1688755732.0,False,False,False,False,False
57,14tjtun,TwoXChromosomes,/r/TwoXChromosomes/comments/14tjtun/what_is_wrong_with_people_these_days/,Griffinsilver,What is wrong with people these days?,3485,0.94,291,,1688764851.0,False,False,False,False,False
58,14te3oq,technicallythetruth,/r/technicallythetruth/comments/14te3oq/they_only_go_up_to_9/,ok-i,They only go up to 9,9736,0.96,109,,1688751970.0,False,False,False,False,False
59,14tkgu7,MadeMeSmile,/r/MadeMeSmile/comments/14tkgu7/he_looks_happy_that_he_got_to_talk_about_his_book/,dewey_did_me,He looks happy that he got to talk about his book :),7894,0.99,94,,1688766358.0,False,False,False,False,False
60,14tgqrd,OneOrangeBraincell,/r/OneOrangeBraincell/comments/14tgqrd/i_had_to_put_a_sign_on_my_door_so_my_neighbors/,dragonessofages,I had to put a sign on my door so my neighbors didn't think ill of me.,5413,0.99,85,Proud owner of an orange brain cell,1688757895.0,False,False,False,False,False
61,14ten0a,aww,/r/aww/comments/14ten0a/oc_everyone_says_he_looks_like_garfield_i_love_it/,loveme_lina,[OC] Everyone says he looks like Garfield! I love it!,7074,0.92,127,,1688753149.0,False,False,False,False,False
62,14tke49,NonPoliticalTwitter,/r/NonPoliticalTwitter/comments/14tke49/rip_brenda/,jeckles,RIP Brenda,3220,0.96,64,:blue1::blue2::1111::1112:,1688766194.0,False,False,False,False,False
63,14tlqdu,worldnews,/r/worldnews/comments/14tlqdu/turkeys_erdogan_says_ukraine_deserves_nato/,analiia_cox,Turkey’s Erdogan says Ukraine deserves NATO membership,5352,0.96,421,,1688769289.0,False,False,False,False,False
64,14ts1i5,MaliciousCompliance,/r/MaliciousCompliance/comments/14ts1i5/my_roommate_told_me_not_to_walk_out_of_the/,Throwaway_22002,My roommate told me not to walk out of the bathroom in my towel so I didn’t.,1102,0.95,83,,1688785888.0,False,False,False,False,True
65,14tq96u,nbacirclejerk,/r/nbacirclejerk/comments/14tq96u/this_dude_fucking_sucks/,Party-Ad-7077,This dude fucking sucks,1427,0.98,128,,1688780900.0,False,False,False,False,False
66,14tmkaq,HonkaiStarRail,/r/HonkaiStarRail/comments/14tmkaq/i_know_what_i_have_to_do_but_i_dont_know_if_i/,Red_Naxela_,"I know what I have to do, but I don’t know if I have the strength to do it",2371,0.95,156,,1688771263.0,False,False,False,False,False
67,14tn6oi,mildlyinfuriating,/r/mildlyinfuriating/comments/14tn6oi/when_companies_ask_for_the_exact_day_during_an/,FailuresUseRobinhood,When Companies Ask for the Exact Day During an Application,4439,0.97,196,,1688772788.0,False,False,False,False,False
68,14tlu5d,lotr,/r/lotr/comments/14tlu5d/eowyn_and_the_witch_king_signed_my_artwork_i_can/,LongFineArt,Eowyn and the Witch King signed my artwork 😭 I can die happy,2448,0.97,58,,1688769549.0,False,False,False,False,False
69,14ts0rr,nba,/r/nba/comments/14ts0rr/victor_wembanyama_finishes_his_night_213_9pts_8/,IndependentScore3857,"Victor Wembanyama finishes his night 2-13, 9pts, 8 rebounds, 3 assists, 5 blocks, 3 TO's in 27 minutes",2028,0.95,1096,:den-1: Nuggets,1688785831.0,False,1688786865.0,False,False,False
70,14tqm17,leagueoflegends,/r/leagueoflegends/comments/14tqm17/bengi_resigns_as_t1_head_coach_replaced_with_tom/,Blaikiri7,"Bengi resigns as T1 Head Coach, replaced with Tom as interim",1264,0.98,279,:koskt: SKTSinceS3,1688781869.0,False,False,False,False,False
71,14tc4fb,movies,/r/movies/comments/14tc4fb/indiana_jones_5_it_took_100_vfx_industrial_light/,Key_Damage_9220,‘Indiana Jones 5’: It Took 100+ VFX Industrial Light and Magic Artists to De-Age Harrison Ford,8668,0.93,1514,,1688747468.0,False,False,False,False,False
72,14toyeu,Superstonk,/r/Superstonk/comments/14toyeu/fuckers/,BaronVA,Fuckers.,1772,0.98,166,"Fuck the Fed, Fuck the 🔴",1688777348.0,False,False,False,False,False
73,14tanc2,oddlyterrifying,/r/oddlyterrifying/comments/14tanc2/xrays_taken_by_the_usmexico_border_patrol/,Diceyland,X-Rays taken by the US-Mexico border patrol,15696,0.96,413,,1688744187.0,False,False,False,False,False
74,14thrvn,YouShouldKnow,/r/YouShouldKnow/comments/14thrvn/ysk_texans_since_youre_in_a_time_of_heat_waves/,k4ndlej4ck,YSK Texans: Since you're in a time of heat waves and no mandated water breaks. Access to water to prevent dehydration is a federally protected right,3747,0.95,163,,1688760193.0,False,False,False,False,False
75,14tikqg,ProgrammerHumor,/r/ProgrammerHumor/comments/14tikqg/whosgonnatellhim/,huxx__,whosGonnaTellHim,3448,0.96,136,,1688762033.0,False,False,False,False,False
76,14tpum5,TaylorSwift,/r/TaylorSwift/comments/14tpum5/taylor_lautner_is_at_tonights_show/,IssaMeJ,Taylor Lautner is at tonight's show,1319,0.95,115,,1688779766.0,False,False,False,False,False
77,14tgl55,whenthe,/r/whenthe/comments/14tgl55/the_thought_was_in_the_back_of_my_head_the_whole/,Gatt__,The thought was in the back of my head the whole time ngl,5220,0.97,93,,1688757551.0,False,False,False,False,False
78,14tmpsw,UkrainianConflict,/r/UkrainianConflict/comments/14tmpsw/to_those_rightly_raising_questions_about_the_us/,themimeofthemollies,"“To those rightly raising questions about the US decision to send cluster munitions to 🇺🇦, your concerns about “war crimes” & international law today would have had a lot more credibility if you raised similar concerns the previous 499 days about 🇷🇺 using such weapons against 🇺🇦.” Michael McFaul",1976,0.95,190,,1688771662.0,False,False,False,False,False
79,14tk4id,NatureIsFuckingLit,/r/NatureIsFuckingLit/comments/14tk4id/close_up_of_the_beach_on_fernandina_island/,TheStormborn1,"🔥 Close up of the beach on Fernandina island, Galápagos.",2715,0.98,106,,1688765574.0,False,False,False,False,False
80,14tnnub,atheism,/r/atheism/comments/14tnnub/i_somehow_personally_offended_a_pastor_simply_by/,Outrageous_Fig_3105,I somehow personally offended a pastor simply by being an atheist,1714,0.95,310,,1688773996.0,False,False,False,False,False
81,14tmin1,StupidFood,/r/StupidFood/comments/14tmin1/nachos_in_a_tub/,Mrdeathkills69,Nachos in a tub…,2001,0.87,963,,1688771148.0,False,False,False,False,False
82,14tc0oa,books,/r/books/comments/14tc0oa/george_rr_martin_dont_be_too_impatient_its_only/,RobertoSerrano2003,"George R.R. Martin: ""Don't be too impatient, it's only been 12 years since the last one""",7989,0.91,1229,,1688747230.0,False,False,False,True,False
83,14te9oi,politics,/r/politics/comments/14te9oi/ocasiocortez_endorses_bidens_reelection_campaign/,Beckles28nz,"Ocasio-Cortez endorses Biden's reelection campaign, sending a strong signal of Democratic unity",16594,0.9,1939,,1688752361.0,False,False,False,False,False
84,14tccj8,shittymoviedetails,/r/shittymoviedetails/comments/14tccj8/american_psycho_2000_is_surprisingly_unoriginal/,xZOMBIETAGx,"American Psycho (2000) is surprisingly unoriginal. Not only is the entire story stolen from a book with the same name, many of the scenes are shot-for-shot copies of popular internet memes and gifs.",8101,0.96,39,,1688747982.0,False,False,False,False,False
85,14tmiaw,Satisfyingasfuck,/r/Satisfyingasfuck/comments/14tmiaw/dudes_trying_to_reenact_scenes_from_action_film/,pungentflora43,Dudes trying to re-enact scenes from action film,1992,0.97,88,,1688771125.0,False,False,False,False,False
86,14trigw,Breath_of_the_Wild,/r/Breath_of_the_Wild/comments/14trigw/am_i_the_only_dumbass_who_thought_vah_ruta_was_an/,Captain_Jackalope,Am I the only dumbass who thought Vah Ruta was an elephant?,993,0.93,139,,1688784431.0,False,False,False,False,False
87,14tgbuq,formuladank,/r/formuladank/comments/14tgbuq/why_you_cant_hold_me_in_the_street/,UnquestionableDuck,Why You Can't Hold Me In The Street?,4368,0.95,130,Alonso deserved to be Champion in every season he has competed,1688756971.0,False,False,False,False,False
88,14tmq3f,marvelmemes,/r/marvelmemes/comments/14tmq3f/what_is_wrong_with_you_people/,Hescrete,What is wrong with you people!??!,1907,0.97,59,Avengers,1688771686.0,False,False,False,False,False
89,14tgbug,IASIP,/r/IASIP/comments/14tgbug/what_are_the_best_roasts_on_the_show_ill_start/,cdbriggs,What are the best roasts on the show? I'll start...,4016,0.96,328,,1688756970.0,False,False,False,False,False
90,14tmpjo,ufc,/r/ufc/comments/14tmpjo/aw_shit_were_in_this_now_fellas/,Ok-Walk7881,"AW SHIT, WE'RE IN THIS NOW FELLAS!",1827,0.96,304,,1688771646.0,False,False,False,False,False
91,14tk5to,funnyvideos,/r/funnyvideos/comments/14tk5to/man_trying_on_suit_for_friends_wedding/,bigpeeler,Man Trying On Suit For Friend's Wedding. ,2541,0.94,38,,1688765667.0,False,False,False,False,False
92,14tgd2j,witcher,/r/witcher/comments/14tgd2j/the_real_butcher_of_blaviken/,NennisDedry,The real Butcher of Blaviken*,3888,0.95,223,,1688757042.0,True,False,False,False,False
93,14tmh8a,videos,/r/videos/comments/14tmh8a/reddit_fucking_ceo_steve_spez_huffman_apology/,papapudding,Reddit Fucking CEO Steve 'Spez' Huffman apology video,1889,0.8,82,,1688771054.0,False,False,False,False,False
94,14tdplv,Tinder,/r/Tinder/comments/14tdplv/men_scare_me/,Clean-Cheetah4222,men scare me 😟,5795,0.92,1043,,1688751041.0,False,False,False,False,False
95,14tf5sa,todayilearned,/r/todayilearned/comments/14tf5sa/til_5080_of_the_population_has_herpes/,Healthy_Manager5881,TIL 50-80% of the population has herpes,11888,0.92,1132,,1688754390.0,False,False,False,False,False
96,14taosk,JustGuysBeingDudes,/r/JustGuysBeingDudes/comments/14taosk/practicing_chinese_like_a_dude/,meepmeepitsajeep,Practicing Chinese like a dude ,10001,0.93,212,,1688744281.0,False,False,False,False,False
97,14tbs1g,ImTheMainCharacter,/r/ImTheMainCharacter/comments/14tbs1g/what_kind_of_welcome_was_he_expecting/,Vemonis,What kind of welcome was he expecting?,7533,0.95,1058,,1688746682.0,False,False,False,False,False
98,14tepv1,CuratedTumblr,/r/CuratedTumblr/comments/14tepv1/jesse_we_have_to_accept_my_old_business_partners/,CrypticBalcony,jesse we have to accept my old business partner’s offer to pay for my cancer treatment jesse,4982,0.98,164,kitty! :D,1688753329.0,False,False,False,False,False
99,14tddyz,Weird,/r/Weird/comments/14tddyz/i_woke_up_to_a_pickle_on_my_front_door/,kuromifan333,I woke up to a pickle on my front door?,6336,0.95,1221,,1688750310.0,False,False,False,False,False
100,14tnus4,197,/r/197/comments/14tnus4/absolutely_down_tremendous_rule/,TheOnnomise,Absolutely down tremendous Rule,1507,0.98,42,,1688774466.0,False,False,False,False,False
