rank,id,subreddit,permalink,author,title,score,upvote_ratio,num_comments,author_flair_text,created_utc,over_18,edited,stickied,locked,is_original_content
1,14y6cy5,MadeMeSmile,/r/MadeMeSmile/comments/14y6cy5/this_wholesome_surprise_proposal_during_family/,Rollo_Tomasi3000,This wholesome surprise proposal during family night,9219,0.97,213,,1689210338.0,False,False,False,False,False
2,14y2xu9,oddlysatisfying,/r/oddlysatisfying/comments/14y2xu9/painting_chicken_wire_black/,nikamats,Painting chicken wire black,24504,0.97,584,,1689201220.0,False,False,False,False,False
3,14y57sv,mildlyinfuriating,/r/mildlyinfuriating/comments/14y57sv/our_neighbors_solution_to_a_newly_poured_driveway/,UnethicalTesticle,Our neighbors solution to a newly poured driveway on a one-lane road.,8066,0.96,768,,1689206926.0,False,False,False,False,False
4,14y5kp5,WhitePeopleTwitter,/r/WhitePeopleTwitter/comments/14y5kp5/he_doesnt_look_like_that_superhero_i_keep_seeing/,ofdefrrgelator4097,He doesn't look like that superhero I keep seeing in maga posts.,7230,0.9,1025,,1689207959.0,False,False,False,False,False
5,14y7l9p,Damnthatsinteresting,/r/Damnthatsinteresting/comments/14y7l9p/how_to_fold_and_wear_the_great_kilt/,bigpeeler,"How to fold and wear ""the great kilt"". ",4722,0.98,184,,1689213760.0,False,False,False,False,False
6,14xz9k8,nextfuckinglevel,/r/nextfuckinglevel/comments/14xz9k8/michael_jordan_was_so_good_even_the_other_teams/,firstpc13,Michael Jordan was so good even the other team's bench couldn't contain themselves,18181,0.96,931,,1689192720.0,False,False,False,False,False
7,14xy9b9,todayilearned,/r/todayilearned/comments/14xy9b9/til_that_nearly_16000_covid_cases_went_unreported/,dies-IRS,"TIL that nearly 16,000 COVID cases went unreported in England because Public Health England used a legacy .xls Excel spreadsheet file that can only handle up to 65536 rows to record cases instead of a proper database.",24679,0.93,1245,,1689190382.0,False,False,False,False,False
8,14y0qlx,meirl,/r/meirl/comments/14y0qlx/meirl/,Ulikio,meirl,13389,0.94,916,,1689196100.0,False,False,False,False,False
9,14y34wt,wallstreetbets,/r/wallstreetbets/comments/14y34wt/twitter_and_elon_musk_face_736_million_lawsuit/,hussmann,Twitter and Elon Musk face $736 million lawsuit for allegedly refusing severance for fired employees,6412,0.94,693,,1689201679.0,False,False,False,False,False
10,14xzl88,DiWHY,/r/DiWHY/comments/14xzl88/how_did_she_come_up_with_this/,Gusfeldt__,How did she come up with this?,15882,0.9,778,,1689193465.0,False,False,False,False,False
11,14xzaa0,funny,/r/funny/comments/14xzaa0/relative_sent_me_this_on_instagram_thought_it_was/,Anusbagels,"Relative sent me this on Instagram. Thought it was a funny, rare prank that doesn’t involve being an A-hole 😂",10801,0.95,202,,1689192768.0,False,False,False,False,False
12,14y6d9g,maybemaybemaybe,/r/maybemaybemaybe/comments/14y6d9g/maybe_maybe_maybe/,Firm_Matter7435,Maybe maybe maybe,3477,0.98,157,,1689210365.0,False,False,False,False,False
13,14xx2ij,therewasanattempt,/r/therewasanattempt/comments/14xx2ij/to_enjoy_paris_vacation/,Sufficient-Bug-9112,to enjoy Paris vacation ,48057,0.87,3382,,1689187675.0,False,False,False,False,False
14,14xwi0s,facepalm,/r/facepalm/comments/14xwi0s/gottem/,ThenLawx,Gottem.,34528,0.95,1172,,1689186371.0,False,False,False,False,False
15,14y5cgc,Unexpected,/r/Unexpected/comments/14y5cgc/scoliosis/,No-ConspiracyTheory,Scoliosis,4037,0.92,661,,1689207303.0,False,False,False,False,False
16,14xxo6a,WTF,/r/WTF/comments/14xxo6a/just_making_out/,Steevo_no_jackass,Just making out,13347,0.91,921,,1689189025.0,False,False,False,False,False
17,14xw0gr,clevercomebacks,/r/clevercomebacks/comments/14xw0gr/guess_he_missed_the_foot_job_video/,OlivierLeighton,Guess he missed the foot job video 😏,31640,0.88,1712,,1689185222.0,False,False,False,False,False
18,14y363k,BlackPeopleTwitter,/r/BlackPeopleTwitter/comments/14y363k/ignoring_it_doesnt_work/,zzill6,Ignoring It Doesn't Work,4631,0.96,87,,1689201757.0,False,False,False,False,False
19,14xx8mm,oddlyterrifying,/r/oddlyterrifying/comments/14xx8mm/partially_submerged_statue_of_shiva_the_destroyer/,lonely_dude__,Partially submerged statue of shiva the destroyer during the flash flood in uttrakhand.,15175,0.96,243,,1689188067.0,False,False,False,False,False
20,14y0hdw,OldSchoolCool,/r/OldSchoolCool/comments/14y0hdw/for_people_of_a_certain_age_almost_nothing/,Jack_Sandwich,"For people of a certain age, almost nothing compares to the beautiful Mia Sara (1986)",6320,0.93,395,,1689195526.0,False,False,False,False,False
21,14xw7r3,politics,/r/politics/comments/14xw7r3/senate_democrats_take_aim_at_investor_home/,Prcrstntr,Senate Democrats take aim at investor home purchases,12464,0.98,1204,,1689185702.0,False,False,False,False,False
22,14xvhon,worldnews,/r/worldnews/comments/14xvhon/italian_uproar_over_judges_10second_groping_rule/,I-Am-Uncreative,Italian uproar over judge's 10-second groping rule,15443,0.96,1599,,1689184057.0,False,False,False,False,False
23,14xykpe,movies,/r/movies/comments/14xykpe/hulus_prey_nominated_for_emmy_under_best/,Cramtastic,Hulu's Prey nominated for Emmy under Best Television Movie,7959,0.95,511,,1689191121.0,False,False,False,False,False
24,14y1f0o,LeopardsAteMyFace,/r/LeopardsAteMyFace/comments/14y1f0o/trump_voter_sues_fox_news_after_tucker_carlson/,Ok_Dimension_4707,Trump Voter Sues Fox News After Tucker Carlson Lies Ruined His Life,5208,0.97,292,,1689197667.0,False,False,False,False,False
25,14xx4vc,cats,/r/cats/comments/14xx4vc/when_i_go_swimming_they_come_with_me/,sweeet_baby_girl,"When I go swimming, they come with me",11148,0.96,274,,1689187827.0,False,False,False,False,False
26,14y1bac,PublicFreakout,/r/PublicFreakout/comments/14y1bac/black_men_working_on_gutters_get_police_called_on/,BigDaddyJuno,Black men working on gutters get police called on them for “kidnapping an old man” ,5377,0.96,560,,1689197427.0,False,False,False,False,False
27,14xvm1d,memes,/r/memes/comments/14xvm1d/my_poor_hawaiian_rolls/,KBlake1982,My poor Hawaiian rolls,19857,0.97,322,Lives in a Van Down by the River,1689184340.0,False,False,False,False,False
28,14y4n89,OnePunchMan,/r/OnePunchMan/comments/14y4n89/chapter_188_english/,VibhavM,Chapter 188 [English],3188,0.97,382,Retired From day2day Moderation. Contact Other Mods.,1689205376.0,False,False,True,False,False
29,14xw13a,me_irlgbt,/r/me_irlgbt/comments/14xw13a/she_irlgbt/,MahouShoujoDysphoria,She_irlgbt,15013,0.9,453,:gq:Environmental Storytelling Moderator💀,1689185263.0,False,False,False,False,False
30,14xz2fh,BeAmazed,/r/BeAmazed/comments/14xz2fh/the_ocean_cleanup_scooping_literal_truckloads_of/,MrScatterBrained,The Ocean Cleanup scooping literal truckloads of plastic out of the Rio Las Vacas river,6700,0.97,473,,1689192269.0,False,False,False,False,False
31,14xwkyw,tumblr,/r/tumblr/comments/14xwkyw/its_wednesday_my_dudes/,nejicanspin,It's Wednesday my dudes,11915,0.97,348,,1689186567.0,False,False,False,False,False
32,14xznwq,PeterExplainsTheJoke,/r/PeterExplainsTheJoke/comments/14xznwq/whos_that_what_did_he_do/,VoxinCariba,Who’s that? What did he do?,6523,0.93,262,,1689193635.0,False,False,False,False,False
33,14y60st,JustGuysBeingDudes,/r/JustGuysBeingDudes/comments/14y60st/yeah/,born__addict,Yeah,2389,0.95,71,,1689209353.0,False,False,False,False,False
34,14y02rb,shittymoviedetails,/r/shittymoviedetails/comments/14y02rb/in_spiderman_across_the_spiderverse_2023_youre/,RoadmenInc,In Spider-Man: Across The Spiderverse (2023)... You're telling me this is 5 inches?,6176,0.94,218,,1689194598.0,False,False,False,False,False
35,14xwqqt,lotrmemes,/r/lotrmemes/comments/14xwqqt/never_forget_that_the_witch_king_had_gandalf_on_a/,Claire-dat-Saurian-7,"Never forget that the Witch King had Gandalf on a platter, but decided the Rohirrim charge was too epic to miss.",9727,0.97,389,,1689186931.0,False,False,False,False,False
36,14xyh4m,shitposting,/r/shitposting/comments/14xyh4m/glory_to_spez/,bah_a,Glory to spez,8907,0.96,208,,1689190888.0,False,False,False,False,False
37,14y3rp4,NatureIsFuckingLit,/r/NatureIsFuckingLit/comments/14y3rp4/5_day_old_turtling_with_140_year_old_mom/,therra123,🔥 5 day old turtling with 140 year old mom,2965,0.97,71,,1689203177.0,False,False,False,False,False
38,14y1z6a,nba,/r/nba/comments/14y1z6a/michael_porter_jr_when_i_first_got_drafted_to/,JohnLemonnn69,"[Michael Porter Jr.] ""When I first got drafted to Denver and I saw him in training camp, I thought Mason Plumlee was better… I was like, 'Why does Joker start over Mason? This dude is fat.'""",3557,0.97,339,:mke-5: Bucks,1689198966.0,False,1689199015.0,False,False,False
39,14xtpy3,wholesomememes,/r/wholesomememes/comments/14xtpy3/happy_anniversary/,blaze_uchiha999,Happy anniversary,17494,0.97,164,,1689180065.0,False,False,False,False,False
40,14xwj5k,antiwork,/r/antiwork/comments/14xwj5k/my_autistic_friend_got_hired_onto_a_lumber_mill/,Zen_Uru_,"My autistic friend got hired onto a lumber mill as a wood wrapper, this is his thighs after one day of work",7993,0.93,771,,1689186445.0,True,False,False,False,False
41,14y5d83,popculturechat,/r/popculturechat/comments/14y5d83/margot_robbie_for_a_barbie_photo_call/,Ok-Doubt6658,Margot Robbie for a Barbie photo call,2225,0.97,206,Excluded from this narrative,1689207358.0,False,False,False,False,False
42,14xwetp,dankmemes,/r/dankmemes/comments/14xwetp/somethings_wrong_i_can_feel_it/,JohnSmith---,Something's wrong I can feel it,9058,0.97,183,,1689186158.0,False,False,False,False,False
43,14xsij9,news,/r/news/comments/14xsij9/lawyers_with_supreme_court_business_paid_clarence/,Good-Expression-4433,Lawyers with supreme court business paid Clarence Thomas aide via Venmo,14762,0.94,560,,1689177448.0,False,False,False,False,False
44,14xtd91,gaming,/r/gaming/comments/14xtd91/just_to_clear_up_any_confusion/,TheUndeadGunslinger,Just to clear up any confusion,14693,0.91,1187,PC,1689179290.0,False,False,False,False,False
45,14xuny8,SelfAwarewolves,/r/SelfAwarewolves/comments/14xuny8/bruh/,tiptiptoppy,Bruh,9184,0.96,319,,1689182163.0,False,False,False,False,False
46,14xvj7t,AdviceAnimals,/r/AdviceAnimals/comments/14xvj7t/i_was_always_told_labor_was_one_of_the_highest/,DoctorBa11s,I was always told labor was one of the highest costs of running a business.,7937,0.94,503,,1689184157.0,False,False,False,False,False
47,14y2dd5,HonkaiStarRail,/r/HonkaiStarRail/comments/14y2dd5/anyone_else_notice_how_stelle_was_casually_on_her/,Khuelen,Anyone else notice how Stelle was casually on her phone in the middle of chaos?,3186,0.96,116,:DanHeng:,1689199877.0,False,False,False,False,False
48,14xvzzx,Breath_of_the_Wild,/r/Breath_of_the_Wild/comments/14xvzzx/i_know_these_are_called_combat_training_but_still/,Morderca_Bidej,"I know these are called ""combat training"" but still are lame imo",8453,0.92,379,,1689185189.0,False,False,False,False,False
49,14y2kze,pcmasterrace,/r/pcmasterrace/comments/14y2kze/why_the_speed_of_my_internet_is_literally_faster/,CeskyDunaj,"Why, the speed of my internet is literally faster than the speed of light",2880,0.95,164,":steam: Ryzen 7 3700x, rx580 4GB, 16GB, [!CAT POWERED!]",1689200388.0,False,False,False,False,False
50,14y19cl,LateStageCapitalism,/r/LateStageCapitalism/comments/14y19cl/milk_is_4_a_gallon_where_i_live/,haloarh,Milk is $4 a gallon where I live,3296,0.98,221,,1689197304.0,False,False,False,False,False
51,14xwc96,Whatcouldgowrong,/r/Whatcouldgowrong/comments/14xwc96/wcgw_driving_on_the_edge_of_a_cliff/,iMakeUrageQuit,WCGW driving on the edge of a cliff ,6824,0.96,532,,1689186000.0,False,False,False,False,False
52,14xxtz5,nope,/r/nope/comments/14xxtz5/nope/,SilentEnginering,Nope,5501,0.94,397,,1689189394.0,False,False,False,False,False
53,14xq044,BrandNewSentence,/r/BrandNewSentence/comments/14xq044/the_whole_sentence/,almonakinvader,The whole sentence,39873,0.94,449,,1689171811.0,False,False,False,False,False
54,14y16re,doordash,/r/doordash/comments/14y16re/the_heck_is_happening_out_here/,drwormypants,The heck is happening out here?,3273,0.95,686,,1689197135.0,False,False,False,False,False
55,14y035d,WhitePeopleTwitter,/r/WhitePeopleTwitter/comments/14y035d/sometimes_you_just_gotta_throw_the_whole_kid_away/,muldim,Sometimes you just gotta throw the whole kid away.,10678,0.97,621,,1689194626.0,False,False,False,False,False
56,14y3qib,rareinsults,/r/rareinsults/comments/14y3qib/piercing_green_eyes/,sorox123,Piercing green eyes!,2369,0.98,87,,1689203098.0,False,False,False,False,False
57,14y123d,tf2,/r/tf2/comments/14y123d/finally/,Guy_Who_Uses-Reddit,Finally…,3322,0.96,383,Engineer :engieclass:,1689196834.0,False,False,True,False,False
58,14xxl5t,OneOrangeBraincell,/r/OneOrangeBraincell/comments/14xxl5t/smol_uneducated_bean/,Cautious-or-paranoid,smol uneducated bean,5387,0.98,112,,1689188838.0,False,False,False,False,False
59,14y0fiu,Spiderman,/r/Spiderman/comments/14y0fiu/i_laughed_too_hard_reading_this/,Zlatanisthegoa,I laughed too hard reading this,3623,0.93,130,,1689195403.0,False,False,False,False,False
60,14xwj7r,awesome,/r/awesome/comments/14xwj7r/these_sand_curtains/,WhersucSugarplum,These sand curtains,6679,0.94,139,,1689186449.0,False,False,False,False,False
61,14y0stm,community,/r/community/comments/14y0stm/i_never_took_the_time_to_read_these_in_full_and/,Silkysylph,I never took the time to read these in full and that was a mistake,3245,0.97,206,,1689196239.0,False,False,False,False,False
62,14y0u7o,distressingmemes,/r/distressingmemes/comments/14y0u7o/mfs_really_just_decapitated_people_and_went_noted/,Y4O1_3rdacc,"mfs really just decapitated people and went ""noted""",3384,0.96,79,,1689196324.0,False,False,False,False,False
63,14y2n1k,CasualConversation,/r/CasualConversation/comments/14y2n1k/im_a_cashier_who_switched_from_sirmam_to_my_dear/,radvelvet-,"I'm a cashier who switched from ""sir/mam"" to ""my dear"" and I have noticed something wonderful about that phrase.",2544,0.95,410,,1689200516.0,False,False,False,False,False
64,14y8axa,Hololive,/r/Hololive/comments/14y8axa/uh_oh/,px1099,Uh oh,1181,0.99,34,:Fauna:,1689215746.0,False,False,False,False,False
65,14xs7tm,StarWars,/r/StarWars/comments/14xs7tm/andor_is_nominated_for_best_drama_series_at_the/,jsun31,Andor is nominated for Best Drama Series at the 2023 Emmys,10065,0.95,414,Cassian Andor,1689176799.0,False,False,False,False,False
66,14y6wvx,CozyPlaces,/r/CozyPlaces/comments/14y6wvx/bedroom_with_a_view/,cloudtdaz,Bedroom with a view,1367,0.91,46,,1689211908.0,False,False,False,False,False
67,14y262a,691,/r/691/comments/14y262a/horseshoe_theorule/,Prestigious-Bug-3586,Horseshoe theorule,2669,0.95,48,,1689199401.0,False,False,False,False,False
68,14y49h7,AskReddit,/r/AskReddit/comments/14y49h7/who_immediately_comes_to_mind_when_you_hear_the/,Caseated_Omentum,"Who immediately comes to mind when you hear the words ""insanely hot""?",1995,0.9,3242,,1689204399.0,True,False,False,False,False
69,14xv9qc,conservativeterrorism,/r/conservativeterrorism/comments/14xv9qc/heres_another_maga_pro_russian_enemy_within/,waxjammer,Here’s another MAGA pro Russian enemy within.,6168,0.95,392,,1689183555.0,False,False,False,False,False
70,14y0kn6,technology,/r/technology/comments/14y0kn6/a_lawsuit_claims_google_has_been_secretly/,Lakerlion,A lawsuit claims Google has been 'secretly stealing everything ever created and shared on the internet by hundreds of millions of Americans' to train its AI,3074,0.94,309,,1689195721.0,False,False,False,False,False
71,14y619o,DestinyTheGame,/r/DestinyTheGame/comments/14y619o/the_guy_who_harassed_a_bungie_community_manger_w/,kristijan1001,The guy who harassed a Bungie community manger w threatening voicemails to him and his wife and sent pizza to their home address has to pay almost $500K and new precedents were set about harassment like this in the industry..,1514,0.95,244,"""We've woken the Hive""",1689209395.0,False,1689210428.0,False,False,False
72,14xuc7t,ContagiousLaughter,/r/ContagiousLaughter/comments/14xuc7t/ticklish/,_makoccino_,Ticklish ,7370,0.96,168,,1689181433.0,False,False,False,False,False
73,14xryjv,wholesomegreentext,/r/wholesomegreentext/comments/14xryjv/anon_on_being_called_a_fat_loser/,ActiveEagles,Anon on being called a fat loser.,12010,0.96,146,,1689176242.0,False,False,False,False,False
74,14xupel,HolUp,/r/HolUp/comments/14xupel/i_was_6_years_old_in_1988/,Suspicious_Smell_562,I was 6 years old in 1988,7922,0.96,138,,1689182262.0,False,False,False,False,False
75,14xwrb6,sadcringe,/r/sadcringe/comments/14xwrb6/thinking_this_was_a_good_idea_to_upload/,joemamma8393,Thinking this was a good idea to upload...,5175,0.95,352,,1689186968.0,False,False,False,False,False
76,14xwl9d,whenthe,/r/whenthe/comments/14xwl9d/i_hate_this_highly_specific_trope_so_much_and_i/,SWR24,I hate this highly specific trope so much and I don’t know why,6509,0.95,362,,1689186587.0,False,False,False,False,False
77,14y3v3q,formuladank,/r/formuladank/comments/14y3v3q/formula_daniel_but_its_cursed_credit_to/,colinhomelite,Formula Daniel but it's cursed (credit to WowChickenTenders for the original meme),1970,0.99,63,BWOAHHHHHHH ,1689203411.0,False,False,False,False,False
78,14y2c3x,PoliticalHumor,/r/PoliticalHumor/comments/14y2c3x/new_covid_side_effect/,17recon,New Covid Side Effect,2355,0.96,56,,1689199802.0,False,False,False,False,False
79,14xztcx,fightporn,/r/fightporn/comments/14xztcx/i_dont_even_know_what_to_say_honestly/,Apprehensive_Fly3282,I dont even know what to say honestly,3300,0.95,598,,1689193989.0,False,False,False,False,False
80,14xsp3c,lgbt,/r/lgbt/comments/14xsp3c/we_got_married/,Bipolarslut-,We got married! 🥰,9259,0.93,213,:nb-lesbian: Non-Binary Lesbian,1689177826.0,False,False,False,False,False
81,14y6sgr,facepalm,/r/facepalm/comments/14y6sgr/if_margot_robbie_is_mid_than_weve_collectively/,almonakinvader,If Margot Robbie is mid than we’ve collectively lost the plot,3099,0.95,574,,1689211566.0,False,False,False,False,False
82,14xy8vu,starterpacks,/r/starterpacks/comments/14xy8vu/suburban_pickup_truck_starter_pack/,kabukistar,Suburban pickup truck starter pack,3896,0.94,311,,1689190351.0,False,False,False,False,False
83,14xrr53,Showerthoughts,/r/Showerthoughts/comments/14xrr53/we_pay_taxes_on_money_we_make_taxes_on_money_we/,wolf805,"We pay taxes on money we make, taxes on money we spend, and taxes on things we own, that we already paid taxes on, with already taxed money.",10790,0.88,1255,,1689175805.0,False,False,False,False,False
84,14xqmfm,TikTokCringe,/r/TikTokCringe/comments/14xqmfm/whats_your_least_favorite_hair_trend/,Tua-Lipa,What’s your least favorite hair trend?,13231,0.94,446,,1689173237.0,False,False,False,False,False
85,14y1ylv,relationship_advice,/r/relationship_advice/comments/14y1ylv/update_last_year_boyfriend_33m_quitted_his_job/,ThrowRA_blackberry1,"*Update* Last year, boyfriend (33m) quitted his job without telling me and now he refused to look for another job. I’m (31f) tired of paying for everything",2317,0.94,207,,1689198933.0,False,False,False,False,False
86,14xv3gv,texas,/r/texas/comments/14xv3gv/fk_greg_abbott_paramore_singer_calls_out_governor/,snesdreams,'F--k Greg Abbott': Paramore singer calls out governor at Houston show,5560,0.9,501,born and bred,1689183143.0,False,False,False,False,False
87,14xx0tu,Satisfyingasfuck,/r/Satisfyingasfuck/comments/14xx0tu/ancient_papermaking/,AcurateAgency,Ancient papermaking,4432,0.96,229,,1689187566.0,False,False,False,False,False
88,14y1exq,ThatsInsane,/r/ThatsInsane/comments/14y1exq/leg_sweep/,ServisSuis,Leg Sweep!,2417,0.97,98,,1689197661.0,True,False,False,False,False
89,14xz9kk,Superstonk,/r/Superstonk/comments/14xz9kk/i_cant_hear_you_closed_with_172_mil_volume_drs/,edgar510,I CAN'T HEAR YOU: Closed with 1.72 Mil Volume!! 🟣🟣🟣🟣***DRS***🟣🟣🟣🟣,3879,0.93,106,👂 I CAN'T HEAR YOU 👂 - Wen Volume,1689192721.0,False,False,False,False,False
90,14y2hmf,golf,/r/golf/comments/14y2hmf/now_you_know/,1017BRD,Now You Know,2088,0.97,136,,1689200160.0,False,False,False,False,False
91,14xyw3h,197,/r/197/comments/14xyw3h/noodles/,timtay6,Noodles,3402,0.96,178,,1689191878.0,False,False,False,False,False
92,14xrgap,inthenews,/r/inthenews/comments/14xrgap/farmers_insurance_becomes_fourth_insurer_to_pull/,BugOperator,"Farmers Insurance becomes fourth insurer to pull out of Florida, roughly 100,000 policies to be terminated",8867,0.97,853,,1689175107.0,False,False,False,False,False
93,14xtut4,oddlyspecific,/r/oddlyspecific/comments/14xtut4/fetish/,Northdingo126,Fetish,7055,0.94,106,,1689180362.0,False,False,False,False,False
94,14xsp9n,AnimalsBeingBros,/r/AnimalsBeingBros/comments/14xsp9n/sometimes_all_you_need_is_a_hug/,westcoastcdn19,Sometimes all you need is a hug ,7720,0.97,59,,1689177839.0,False,False,False,False,False
95,14y5psb,Fauxmoi,/r/Fauxmoi/comments/14y5psb/cillian_murphy_will_be_going_to_see_barbie_100/,747291086299,Cillian Murphy will “be going to see Barbie 100%” and “can’t wait to see it.”,1325,0.97,72,jeremy strong enthusiast ,1689208384.0,False,False,False,False,False
96,14xx9e5,Overwatch,/r/Overwatch/comments/14xx9e5/yesterdays_patch_secretly_added_giant_null_sector/,Hadditor,Yesterday's patch secretly added giant Null Sector ships to several maps,4065,0.96,249,Cute Zarya,1689188118.0,False,False,False,False,False
97,14xyby3,wholesome,/r/wholesome/comments/14xyby3/only_12_summers/,dogememes_dinoruby,Only 12 summers 🥺 ,3392,0.97,57,,1689190551.0,False,False,False,False,False
98,14xwwqh,ImTheMainCharacter,/r/ImTheMainCharacter/comments/14xwwqh/performance_in_the_middle_of_the_crossroad/,Kenarfu,Performance in the middle of the crossroad ,3988,0.96,397,,1689187313.0,False,False,False,False,False
99,14xwtpy,marvelmemes,/r/marvelmemes/comments/14xwtpy/new_lineup_of_power_rangers/,KlausLoganWard,New line-up of Power Rangers,4152,0.98,97,Avengers,1689187126.0,False,False,False,False,False
100,14xsi2n,comics,/r/comics/comments/14xsi2n/memes/,Anime_4000,MEMES,7867,0.95,162,Weekends Off,1689177421.0,False,False,False,False,False
