rank,id,subreddit,permalink,author,title,score,upvote_ratio,num_comments,author_flair_text,created_utc,over_18,edited,stickied,locked,is_original_content
1,14spkc3,Damnthatsinteresting,/r/Damnthatsinteresting/comments/14spkc3/amputee_practicing_with_her_robotic_prosthetics/,VariousBasket125,Amputee practicing with her robotic prosthetics ,25854,0.97,959,,1688686027.0,False,False,False,False,False
2,14sqla1,todayilearned,/r/todayilearned/comments/14sqla1/til_rick_james_cameo_in_chappelles_show_was_so/,mankls3,TIl Rick James’ cameo in chappelle’s show was so successful it caused him to return to touring and performing. He died a few months into the tour.,11116,0.97,475,,1688688456.0,False,False,False,False,False
3,14spvui,comics,/r/comics/comments/14spvui/hope/,sellyourcomputer,hope,13258,0.97,209,Extra Fabulous Comics,1688686779.0,False,False,False,False,False
4,14snrec,WhitePeopleTwitter,/r/WhitePeopleTwitter/comments/14snrec/elon_sarcastically_waving_goodbye_to_fired/,mattmild27,Elon sarcastically waving goodbye to fired employees back in November,26258,0.96,778,,1688681874.0,False,False,False,False,False
5,14st5gn,meirl,/r/meirl/comments/14st5gn/meirl/,idrawdickks,Meirl,7074,0.96,768,,1688695040.0,False,False,False,False,False
6,14sp178,mildlyinfuriating,/r/mildlyinfuriating/comments/14sp178/old_toilet_seat_broke_from_wear_tear_so_landlord/,jinswoon_,"Old toilet seat broke from wear & tear, so landlord replaced it with this….",18716,0.92,2529,,1688684735.0,False,False,False,False,False
7,14sln59,therewasanattempt,/r/therewasanattempt/comments/14sln59/to_throw_her_into_the_pool/,icameinyourburrito,To throw her into the pool,32437,0.96,669,,1688677224.0,False,False,False,False,False
8,14skmxu,OldSchoolCool,/r/OldSchoolCool/comments/14skmxu/gary_sinise_here_here_are_some_more/,GarySiniseOfficial,Gary Sinise here. Here are some more behind-the-scenes photos of filming the movie Forrest Gump from my personal collection. Happy 29th anniversary! (1994),46713,0.95,1349,,1688674970.0,False,False,False,False,False
9,14so8wz,pics,/r/pics/comments/14so8wz/update_rpics_is_being_forced_to_break_the/,pics-moderator,UPDATE: /r/PICS is being forced to break the site-wide rules.,10700,0.88,2016,,1688682928.0,False,1688705080.0,True,False,False
10,14spsev,nextfuckinglevel,/r/nextfuckinglevel/comments/14spsev/using_the_wax_on_an_apple_and_a_broken_lighter_to/,zi-zu,using the wax on an apple and a broken lighter to start a fire,9146,0.89,434,,1688686550.0,False,False,False,False,False
11,14sm2b5,worldnews,/r/worldnews/comments/14sm2b5/deforestation_in_brazils_amazon_drops_34_in_first/,vitorgrs,Deforestation in Brazil's Amazon drops 34% in first half 2023,14102,0.97,351,,1688678130.0,False,False,False,False,False
12,14sm6iw,PublicFreakout,/r/PublicFreakout/comments/14sm6iw/north_dakotas_first_openly_lesbian_official/,ExpertModes,North Dakota's first openly lesbian official defends her right to have the Pride flag flown in the city??,13204,0.89,977,,1688678393.0,False,False,False,False,False
13,14st2r0,funny,/r/funny/comments/14st2r0/i_will_never_forgive_you/,TheExtimate,I will never forgive you.,3781,0.97,189,,1688694831.0,False,False,False,False,False
14,14skkwj,news,/r/news/comments/14skkwj/18monthold_dies_when_parents_leave_her_in_hot_car/,mumpiiitz,"18-month-old dies when parents leave her in hot car overnight after Fourth of July party, Florida police say",14412,0.94,1357,,1688674843.0,False,False,False,False,False
15,14sn2o7,papermoney,/r/papermoney/comments/14sn2o7/i_work_for_a_bank_i_got_a_message_from_one_of_the/,Forcedexile,I work for a bank. I got a message from one of the branches that these have been sitting in their vault for as long as they can remember. They're too far for me to pickup so I asked them to take the funds out of my account and send them to me. We'll see what happens.,10770,0.93,850,,1688680383.0,False,False,False,False,False
16,14so9u7,LateStageCapitalism,/r/LateStageCapitalism/comments/14so9u7/thats_a_problem/,Overthrow_Capitalism,That's a . . . problem . . .,6799,0.97,222,,1688682986.0,False,False,False,False,False
17,14sqrho,oddlysatisfying,/r/oddlysatisfying/comments/14sqrho/this_guys_precision_skills_while_operating_heavy/,Rollo_Tomasi3000,This guy's precision & skills while operating heavy machinery,4476,0.97,83,,1688688893.0,False,False,False,False,False
18,14shrl9,politics,/r/politics/comments/14shrl9/rep_marjorie_taylor_greene_booted_from_rightwing/,HandSack135,Rep. Marjorie Taylor Greene Booted From Right-Wing House Freedom Caucus,24280,0.96,1443,:flag-md: Maryland,1688668520.0,False,False,False,False,False
19,14sszf8,AskReddit,/r/AskReddit/comments/14sszf8/serious_what_is_the_fastest_way_you_have_seen/,fluffy_upvote,[serious] What is the fastest way you have seen someone ruin their life?,3143,0.95,2072,,1688694582.0,True,False,False,False,False
20,14ss9bl,facepalm,/r/facepalm/comments/14ss9bl/deserved_what_do_you_think/,Solopeerless,Deserved?. what do you think,3600,0.97,1195,,1688692695.0,False,False,False,False,False
21,14sswuu,Damnthatsinteresting,/r/Damnthatsinteresting/comments/14sswuu/the_size_of_the_titanic_wreck_site/,Andy-roo77,The size of the Titanic wreck site,6731,0.95,459,,1688694380.0,False,False,False,False,False
22,14spged,ask,/r/ask/comments/14spged/whats_a_dead_give_away_you_grew_up_poor/,Tired0fW8ting,What’s a dead give away you grew up poor?,5136,0.94,5481,,1688685751.0,False,False,False,False,False
23,14snc79,Fauxmoi,/r/Fauxmoi/comments/14snc79/britney_spears_speaks_out_after_being_slapped_by/,superdevin64,Britney Spears speaks out after being slapped by Victor Wembanyama's security guard,6185,0.95,484,,1688680932.0,False,False,False,False,False
24,14sp8ov,shittytattoos,/r/shittytattoos/comments/14sp8ov/got_told_it_was_bad_but_i_kinda_like_it/,sidepugs,"Got told it was bad, but I kinda like it",5139,0.96,779,,1688685235.0,False,False,False,False,False
25,14srj0a,me_irlgbt,/r/me_irlgbt/comments/14srj0a/meirlgbt/,karinasnooodles_,Me🙈irlgbt,3489,0.96,67,,1688690796.0,False,False,False,False,False
26,14sra7g,wallstreetbets,/r/wallstreetbets/comments/14sra7g/take_my_money_elon/,ohnoh18,tAkE mY MoNeY eLoN,3430,0.93,310,,1688690200.0,False,False,False,False,False
27,14su2on,dankmemes,/r/dankmemes/comments/14su2on/is_nobody_else_concerned_about_this_damned_orb/,CallMeJeeJ,Is nobody else concerned about this damned orb?,2342,0.99,70,,1688697457.0,False,False,False,False,False
28,14skl5c,MadeMeSmile,/r/MadeMeSmile/comments/14skl5c/after_years_of_collecting_problems_with_arcade/,imvii,"After years of collecting, problems with arcade bylaws, and a pandemic, I've finally quit my career in IT and opened a pinball arcade (one year update)",8785,0.98,252,,1688674861.0,False,False,False,False,False
29,14sp7nq,LeopardsAteMyFace,/r/LeopardsAteMyFace/comments/14sp7nq/meanwhile_over_at_rconservative_an_excellent/,During_theMeanwhilst,Meanwhile over at r/Conservative an excellent practical plan for every Conservative household is being unhatched…,4153,0.97,449,,1688685164.0,False,False,False,False,False
30,14sprqr,NatureIsFuckingLit,/r/NatureIsFuckingLit/comments/14sprqr/thick_ass_redwood/,Alaric_Darconville,🔥Thick ass redwood,3817,0.98,128,,1688686507.0,False,False,False,False,False
31,14ss45f,wholesomememes,/r/wholesomememes/comments/14ss45f/old_man_gots_game/,secretslut991,Old man gots game,2818,0.98,32,,1688692291.0,False,False,False,False,False
32,14sk40w,maybemaybemaybe,/r/maybemaybemaybe/comments/14sk40w/maybe_maybe_maybe/,Competitive-Ad1183,maybe maybe maybe,8895,0.96,256,,1688673790.0,False,False,False,False,False
33,14sr2vo,TikTokCringe,/r/TikTokCringe/comments/14sr2vo/casually_speedrunning_ninja_warrior_obstacles_is/,cupcake51whole,Casually speedrunning Ninja warrior obstacles is menace behaviour and he deserves all the medals,3132,0.96,129,,1688689695.0,False,False,False,False,False
34,14sui0k,nba,/r/nba/comments/14sui0k/conspiracy_theory_dame_is_intentionally_ruining/,Used_Pizza6453,Conspiracy Theory: Dame is intentionally ruining his relationship with the Blazers due to his irrational fear of statues.,1915,0.93,118,,1688698635.0,False,False,False,False,False
35,14sfkam,madlads,/r/madlads/comments/14sfkam/spitting_image/,Boojibs,Spitting image,58908,0.93,634,,1688663672.0,False,False,False,False,False
36,14sh1xm,PoliticalHumor,/r/PoliticalHumor/comments/14sh1xm/tell_me_why/,JediRunner13,Tell me why…,12915,0.97,138,,1688666909.0,False,False,False,False,False
37,14snwxd,therewasanattempt,/r/therewasanattempt/comments/14snwxd/to_finish_asking_mama_a_risky_question/,Miser-Mike,To finish asking Mama a risky question…,12657,0.94,555,,1688682226.0,True,False,False,False,False
38,14sr9hk,NonPoliticalTwitter,/r/NonPoliticalTwitter/comments/14sr9hk/butthole_surfers/,sandyduncansglasseye,Butthole Surfers,2963,0.96,588,:blue1::blue2::1111::1112:,1688690152.0,False,False,False,False,False
39,14sgj2s,WorkReform,/r/WorkReform/comments/14sgj2s/union_dues_are_a_good_investment_fyi_michigan/,zzill6,"Union Dues Are A Good Investment (FYI Michigan Repealed Their ""Right To Work"" Law)",13921,0.96,409,🤝 Join A Union,1688665786.0,False,False,False,False,False
40,14snn2q,AnimalsBeingBros,/r/AnimalsBeingBros/comments/14snn2q/dragonbro_protects_golfer_from_hornets/,SuspiciousJellyfish,dragonbro protects golfer from hornets,4503,0.98,107,,1688681610.0,False,False,False,False,False
41,14sqd7b,ChoosingBeggars,/r/ChoosingBeggars/comments/14sqd7b/a_magazine_asked_me_to_write_for_them_this_was/,danlev,A magazine asked me to write for them. This was their response when I asked about pay.,3117,0.97,227,,1688687989.0,False,False,False,False,False
42,14sol8h,Animemes,/r/Animemes/comments/14sol8h/what_was_your_first_anime/,Con___artist,what was your first anime,4210,0.98,872,,1688683745.0,False,False,False,False,False
43,14siylm,WTF,/r/WTF/comments/14siylm/what_king_of_priest_is_that/,RelationshipFun6760,What king of priest is that ?,8805,0.93,1065,,1688671235.0,False,False,False,False,False
44,14so72j,PeterExplainsTheJoke,/r/PeterExplainsTheJoke/comments/14so72j/peter_i_need_more_info_on_the_portuguese_part/,NewTopu9,"Peter, I need more info on the Portuguese part",4494,0.94,190,,1688682809.0,False,False,False,False,False
45,14skcqh,technicallythetruth,/r/technicallythetruth/comments/14skcqh/what_a_bright_life/,Yippieyappie02,What a bright life!,7994,0.97,705,,1688674315.0,False,False,False,False,False
46,14sm5jk,ProgrammerHumor,/r/ProgrammerHumor/comments/14sm5jk/bnarycounter/,VitaminnCPP,bnaryCounter,5140,0.95,134,:cp:,1688678331.0,False,False,False,False,False
47,14sodih,WatchPeopleDieInside,/r/WatchPeopleDieInside/comments/14sodih/elite_runner_in_a_10k_race_took_a_wrong_turn/,uchman365,Elite runner in a 10K race took a wrong turn meters from the finish that cost her thousands in prize money,3782,0.95,321,,1688683231.0,False,False,False,False,False
48,14si04z,BlackPeopleTwitter,/r/BlackPeopleTwitter/comments/14si04z/ejectulate/,Imtheguywhosdrunk,Eject-ulate,8395,0.96,201,,1688669068.0,False,False,False,False,False
49,14siv9s,WhitePeopleTwitter,/r/WhitePeopleTwitter/comments/14siv9s/elon_fires_all_his_employees_and_meta_hires_them/,TheSparklyNinja,Elon fires all his employees and meta hires them and creates a better platform; Elon gets mad,36052,0.93,2175,,1688671023.0,False,False,False,False,False
50,14srdf7,shitposting,/r/shitposting/comments/14srdf7/glory_to_spez/,bah_a,Glory to spez,2426,0.99,59,,1688690414.0,False,False,False,False,False
51,14sj9hz,HolUp,/r/HolUp/comments/14sj9hz/a_timeless_battle/,HarryCallahan19,A Timeless Battle,9436,0.94,180,,1688671879.0,False,False,False,False,False
52,14sizl3,memes,/r/memes/comments/14sizl3/seriously_how_do_they_keep_doing_this/,Ultimatwo,seriously how do they keep doing this,9625,0.99,190,,1688671298.0,False,False,False,False,False
53,14sfx7i,tumblr,/r/tumblr/comments/14sfx7i/what_the_hell/,ExpertAccident,What the hell,16212,0.96,320,,1688664456.0,False,False,False,False,False
54,14sml5h,technology,/r/technology/comments/14sml5h/doordash_ubereats_and_grubhub_sue_new_york_city/,Imdumbstiff,"DoorDash, UberEats, and Grubhub sue New York City over a new $18 an hour minimum wage for delivery driver",4028,0.96,549,,1688679235.0,False,False,False,False,False
55,14swj4c,TaylorSwift,/r/TaylorSwift/comments/14swj4c/speak_now_taylors_version/,WitchRen,Speak Now (Taylor’s Version),1074,0.98,224,:reputation: king of my heart :reputation: ,1688704272.0,False,False,False,False,False
56,14si7qu,todayilearned,/r/todayilearned/comments/14si7qu/til_of_the_business_plot_of_1933_a_failed_attempt/,phironuthi,"TIL of The Business Plot of 1933, a failed attempt to overthrow FDR and install a dictator. Led by a covertly bankrolled Wall Street coalition of affluent businessmen",22580,0.96,1157,,1688669564.0,False,False,False,False,False
57,14sjoat,oddlyterrifying,/r/oddlyterrifying/comments/14sjoat/cactus_dome_marshall_islands/,Monsur_Ausuhnom,"Cactus Dome, Marshall Islands",6511,0.96,218,,1688672845.0,False,False,False,False,False
58,14shu7b,diablo4,/r/diablo4/comments/14shu7b/no_thanks_im_good/,LyckaYK,"No, thanks. I'm good...",7330,0.94,515,,1688668694.0,False,False,False,False,False
59,14ssph7,ContagiousLaughter,/r/ContagiousLaughter/comments/14ssph7/what_is_that/,jkaiser10,What is that??,1830,0.92,108,,1688693846.0,False,False,False,False,False
60,14srcm1,motorcycles,/r/motorcycles/comments/14srcm1/18_wheeler_ran_me_over_today/,Mother-Sun-139,18 wheeler ran me over today.,2108,0.95,615,,1688690361.0,False,False,False,False,False
61,14sis7b,Whatcouldgowrong,/r/Whatcouldgowrong/comments/14sis7b/wcgw_throwing_a_firework_into_someones_truck/,mcjord,WCGW throwing a firework into someone's truck,6526,0.94,669,,1688670838.0,False,False,False,False,False
62,14shl4k,CrazyFuckingVideos,/r/CrazyFuckingVideos/comments/14shl4k/may_g_force_be_with_you/,No-Library4559,May G Force be with you,8245,0.95,755,,1688668117.0,False,False,False,False,False
63,14skqr0,fixedbytheduet,/r/fixedbytheduet/comments/14skqr0/highest_rated_safety_locks_money_can_buy/,Extra-Lie489,“Highest rated safety locks money can buy”,4803,0.98,127,,1688675206.0,False,False,False,False,False
64,14soxtd,4chan,/r/4chan/comments/14soxtd/literally_every_opinion_on_music_ever/,enjoyshade,Literally every opinion on music ever,2677,0.97,102,,1688684547.0,False,False,False,False,False
65,14su175,australia,/r/australia/comments/14su175/unpopular_opinion_tradies_are_soft_whiny/,HuntingSmiths,"Unpopular opinion- Tradies are soft, whiny, unprofessional and bitchy.",1377,0.89,549,,1688697343.0,False,False,False,False,False
66,14shr8o,golf,/r/golf/comments/14shr8o/whats_your_play_here/,TheRimmerodJobs,What’s your play here?,7218,0.92,1750,,1688668500.0,False,False,False,False,False
67,14se9n9,HumansBeingBros,/r/HumansBeingBros/comments/14se9n9/baby_raccoon_rescued_from_this_couples_pool/,westcoastcdn19,Baby raccoon rescued from this couple’s pool,14142,0.97,279,,1688660929.0,False,False,False,False,False
68,14so643,Hololive,/r/Hololive/comments/14so643/who_let_this_man_cook/,SGTBookWorm,WHO LET THIS MAN COOK?!?!,3141,0.93,97,:Inanis::IRyS::Calliope::Gura::Amelia:,1688682750.0,False,False,False,False,False
69,14so5yg,castiron,/r/castiron/comments/14so5yg/i_realized_im_24_and_never_cooked_steak_so_i_went/,Time-Fix-586,I realized I’m 24 and never cooked steak so I went out and bought a skillet during my lunch break. How did I do?,3064,0.79,1089,,1688682741.0,False,False,False,False,False
70,14sumit,HonkaiStarRail,/r/HonkaiStarRail/comments/14sumit/asta_and_stelle_chillin/,AsaCocoPeko,Asta and Stelle Chillin',1248,0.99,24,All Hail the Master Diviner :Fuxuan:,1688698963.0,False,False,False,False,False
71,14snjuh,cursedcomments,/r/cursedcomments/comments/14snjuh/cursed_feminist/,TonyStork2,Cursed feminist,3447,0.95,95,,1688681411.0,False,False,False,False,False
72,14sp99h,AnimalsBeingDerps,/r/AnimalsBeingDerps/comments/14sp99h/if_you_gotta_itch_you_gotta_scratch/,MyNameGifOreilly,"If you gotta itch, you gotta scratch...",2531,0.98,53,,1688685276.0,False,False,False,False,False
73,14sfmj1,lotrmemes,/r/lotrmemes/comments/14sfmj1/galadriel_is_really_tall_and_strong/,Zestyclose_Tax_2118,Galadriel is really tall and strong,10654,0.97,278,,1688663812.0,False,False,False,False,False
74,14sfyqs,BeAmazed,/r/BeAmazed/comments/14sfyqs/art_in_the_walnut/,XahidX,Art in the walnut,10151,0.96,141,,1688664557.0,False,False,False,False,False
75,14sjbvu,politics,/r/politics/comments/14sjbvu/mike_pence_mocked_for_saying_i_dont_really_buy/,ghqwertt,Mike Pence mocked for saying ‘I don’t really buy into the rich need to pay their fair share’,11607,0.96,688,,1688672015.0,False,False,False,False,False
76,14sfpbf,SipsTea,/r/SipsTea/comments/14sfpbf/the_more_you_know/,Boojibs,The more you know,11826,0.9,231,,1688663999.0,False,False,False,False,False
77,14sp7pc,Damnthatsinteresting,/r/Damnthatsinteresting/comments/14sp7pc/in_china_the_final_scene_of_fight_club_right/,Ocelot859,"In China, the final scene of ""Fight Club"" right before Edward Norton Jr. and Helena Bonham Carter watch the explosions go off... you instead get a black screen which fades into these captions explaining how the story ended.",12176,0.97,488,,1688685167.0,False,False,False,False,False
78,14sl2lm,wholesome,/r/wholesome/comments/14sl2lm/dont_we_all/,Zerberus_01,Don't we all..,4163,0.97,194,,1688675907.0,False,False,False,False,False
79,14skjfg,fightporn,/r/fightporn/comments/14skjfg/what_happened_here_brain_damage/,_Spaxx,What happened here - Brain Damage,4367,0.95,446,,1688674752.0,False,False,False,False,False
80,14skpjq,whenthe,/r/whenthe/comments/14skpjq/smh/,lexahex,Smh,5225,0.92,228,,1688675137.0,False,False,False,False,False
81,14sqe52,baseball,/r/baseball/comments/14sqe52/mlb_life_julio_rodríguez_explains_why_he_loves/,Waaaaaaaaaasuup,"[MLB Life] Julio Rodríguez explains why he loves Naruto: “Naruto is my favorite anime. He was basically a nobody & he became the most important person when he was nobody” “A lot of people would say, ‘Oh, you’re watching a cartoon.’ But, are you listening to what this cartoon is saying?”",2011,0.95,283,Major League Baseball :mlb:,1688688037.0,False,False,False,False,False
82,14skk98,firstimpression,/r/firstimpression/comments/14skk98/hungover_and_dying_from_heat_yesterday_first/,HappyNovel,Hungover and dying from heat yesterday. First impression?,5307,0.76,1795,Verified ,1688674806.0,False,False,False,True,False
83,14smuf7,news,/r/news/comments/14smuf7/twitter_sends_meta_ceaseanddesist_letter_over_new/,Ktulu0616,Twitter sends Meta cease-and-desist letter over new Threads app: Sources,6005,0.96,1014,,1688679837.0,False,False,False,False,False
84,14sqnap,marvelmemes,/r/marvelmemes/comments/14sqnap/is_that_true/,Heidixoxo1,Is that true?,1947,0.99,28,Deadpool,1688688611.0,False,False,False,False,False
85,14srf46,pcmasterrace,/r/pcmasterrace/comments/14srf46/borg_cube_build_completed_finally/,Lantzalot,Borg Cube Build Completed (Finally),1722,0.98,70,,1688690526.0,False,False,False,False,False
86,14sqw7o,facepalm,/r/facepalm/comments/14sqw7o/lol/,MacGruber77,Lol.,3568,0.98,138,,1688689210.0,False,False,False,False,False
87,14srjxs,sadcringe,/r/sadcringe/comments/14srjxs/my_friends_daughter_just_died_giveaway_time/,Onunstring,My friends daughter just died ... GIVEAWAY TIME!!,1652,0.98,50,,1688690861.0,False,False,False,False,False
88,14sd1f9,FunnyandSad,/r/FunnyandSad/comments/14sd1f9/probably_the_best_meal_those_guys_have_had_in_a/,sapphirestar411,Probably the best meal those guys have had in a while...,14978,0.97,471,,1688658345.0,False,False,False,False,False
89,14sjmzq,Teachers,/r/Teachers/comments/14sjmzq/stop_it_teacher_martyrs/,Leading-Yellow1036,"Stop it, teacher martyrs!",4417,0.93,407,,1688672760.0,False,False,False,False,False
90,14svux8,kpop,/r/kpop/comments/14svux8/newjeans_super_shy/,GodJihyo7983,NewJeans - Super Shy,901,0.91,271,IU|BP|BTS|Twice|RV|WJSN|ITZY|(G)-IDLE|LOOΠΔ|IVE|DC|EG|LSFM|NWJNS,1688702400.0,False,False,False,False,False
91,14sseid,cats,/r/cats/comments/14sseid/help_my_husband_and_i_pick_a_name_for_our_new/,Fearless-Problem1220,Help my husband and I pick a name for our new kitty,1421,0.97,431,,1688693082.0,False,False,False,False,False
92,14six54,nextfuckinglevel,/r/nextfuckinglevel/comments/14six54/chimpanzee_helps_out_a_mechanic/,Real_JJPlays,Chimpanzee helps out a mechanic,11975,0.95,507,,1688671146.0,False,False,False,False,False
93,14smm41,UkraineWarVideoReport,/r/UkraineWarVideoReport/comments/14smm41/45_malnourished_afu_fighters_return_from_captivity/,Melitopol2023,45 Malnourished AFU fighters return from captivity,2869,0.98,139,,1688679298.0,False,False,False,False,False
94,14sgopn,anime_irl,/r/anime_irl/comments/14sgopn/anime_irl/,Cayennesan,anime_irl,6563,0.96,97,:070:,1688666130.0,False,False,False,False,False
95,14sl22y,teenagers,/r/teenagers/comments/14sl22y/the_fit_today_was_immaculate_i_think/,itsnaonao,the fit today was ✨immaculate✨ (i think? 😅),3908,0.85,847,18,1688675875.0,False,False,False,False,False
96,14sp1ne,PublicFreakout,/r/PublicFreakout/comments/14sp1ne/someone_in_a_truck_throws_a_firecracker_at_a/,Dirtyfaction,"Someone in a truck throws a firecracker at a family on their porch in Ybor City, Florida",3922,0.98,562,,1688684762.0,True,False,False,False,False
97,14sp2bm,lgbt,/r/lgbt/comments/14sp2bm/tomorrow_is_officially_24_mo_of_hrt_this_43_yo/,natsw79,Tomorrow is officially 24 mo of HRT. This 43 yo celebrated by getting a root touch-up at the salon to cover up the gray.,2055,0.93,44,:lesbian: Lesbian the Good Place,1688684801.0,False,False,False,False,False
98,14sn92t,ExplainTheJoke,/r/ExplainTheJoke/comments/14sn92t/my_girlfriend_works_at_a_hospital_and_this_was/,thetreebobb,My girlfriend works at a hospital and this was sent in a generic work email. No context.,2575,0.96,92,,1688680759.0,False,False,False,False,False
99,14smq2h,YouShouldKnow,/r/YouShouldKnow/comments/14smq2h/ysk_if_you_look_ugly_in_photos_it_doesnt_mean_you/,Jerry_007,YSK: If you look ugly in photos it doesn't mean you are ugly in real life.,2687,0.91,283,,1688679553.0,False,False,False,False,False
100,14sm74h,antiwork,/r/antiwork/comments/14sm74h/i_got_fired_and_boss_was_mad_i_wouldnt_have_a_sit/,WorpyPorpy,I got fired and boss was mad I wouldn't have a sit down with him after,2869,0.98,162,,1688678424.0,False,1688678851.0,False,False,False
