rank,id,subreddit,permalink,author,title,score,upvote_ratio,num_comments,author_flair_text,created_utc,over_18,edited,stickied,locked,is_original_content
1,14tixjz,MadeMeSmile,/r/MadeMeSmile/comments/14tixjz/this_little_boy_found_an_older_skater_to_hold_his/,Soloflow786,"This little boy found an older skater to hold his hand as he attempted a trick. And when he landed it, he had the sweetest reaction 😭",16440,0.97,278,,1688762826.0,False,False,False,False,False
2,14tgux9,facepalm,/r/facepalm/comments/14tgux9/how_to_fix_it/,MistakeFast1917,How to fix it?,28344,0.94,2903,,1688758153.0,False,False,False,False,False
3,14tfpe4,WhitePeopleTwitter,/r/WhitePeopleTwitter/comments/14tfpe4/elon_goes_full_q_never_go_full_q/,G-Unit11111,Elon goes full Q. Never go full Q.,14548,0.97,592,,1688755620.0,False,False,False,False,False
4,14teaz2,Damnthatsinteresting,/r/Damnthatsinteresting/comments/14teaz2/using_owl_feathers_to_pet_an_owl/,ClaireDacloush,Using Owl feathers to pet an owl,35341,0.96,681,,1688752445.0,False,False,False,False,False
5,14tf2kb,Unexpected,/r/Unexpected/comments/14tf2kb/staying_under_the_radar/,5krunner,Staying under the radar,14881,0.95,320,,1688754171.0,True,False,False,False,False
6,14teirv,funny,/r/funny/comments/14teirv/apology_letter_from_exgf/,bigmikesbeingnice,Apology letter from ex-gf,14826,0.91,1575,,1688752911.0,False,False,False,False,False
7,14tdua6,PublicFreakout,/r/PublicFreakout/comments/14tdua6/a_tourist_restrains_a_pickpocket_in_italy/,ojodefiz,A tourist restrains a pickpocket in Italy 😳,13352,0.97,1239,,1688751349.0,True,False,False,False,False
8,14te9oi,politics,/r/politics/comments/14te9oi/ocasiocortez_endorses_bidens_reelection_campaign/,Beckles28nz,"Ocasio-Cortez endorses Biden's reelection campaign, sending a strong signal of Democratic unity",10350,0.93,1235,,1688752361.0,False,False,False,False,False
9,14tbx9l,lotrmemes,/r/lotrmemes/comments/14tbx9l/such_a_good_actor/,UsernameLaugh,Such a good actor,23703,0.97,521,,1688747014.0,False,False,False,False,False
10,14ti0lk,memes,/r/memes/comments/14ti0lk/freedom_units_metric/,LemonConnoiseur,Freedom units > metric,9944,0.8,753,,1688760706.0,True,False,False,False,False
11,14tgc3n,tifu,/r/tifu/comments/14tgc3n/tifu_by_thinking_my_boyfriend_brought_condoms_to/,BurritoSupreme420,TIFU by thinking my boyfriend brought condoms to our Las Vegas vacation together and refusing to talk to him for a day cause of it,7665,0.87,1010,,1688756988.0,True,1688757108.0,False,False,False
12,14tin8d,HolUp,/r/HolUp/comments/14tin8d/tell_us_how_you_really_feel_ai/,Loose-Recover-9142,Tell us how you really feel AI,5262,0.98,72,,1688762183.0,False,False,False,False,False
13,14tdo6r,therewasanattempt,/r/therewasanattempt/comments/14tdo6r/to_lie_about_your_weight_at_the_zipline/,Incredibly_Critical,... to lie about your weight at the zipline.,12354,0.95,720,,1688750956.0,False,False,False,False,False
14,14tbby7,wholesomememes,/r/wholesomememes/comments/14tbby7/i_can_celebrate_lunar_new_year_now/,blaze_uchiha999,I can celebrate lunar new year now,24262,0.95,369,,1688745732.0,False,False,False,False,False
15,14tb2yr,nextfuckinglevel,/r/nextfuckinglevel/comments/14tb2yr/dad_builds_a_custom_adaptive_controller_so_his/,esberat,Dad builds a custom adaptive controller so his daughter can play Zelda- Breath Of The Wild.,25330,0.95,647,,1688745183.0,False,False,False,False,False
16,14tf5sa,todayilearned,/r/todayilearned/comments/14tf5sa/til_5080_of_the_population_has_herpes/,Healthy_Manager5881,TIL 50-80% of the population has herpes,7763,0.94,798,,1688754390.0,False,False,False,False,False
17,14temuc,nba,/r/nba/comments/14temuc/video_of_the_britney_spears_and_victor_wembanyama/,Vishion-8,Video of the Britney Spears and Victor Wembanyama incident via TMZ,7599,0.94,3080,:nba-1: NBA,1688753139.0,False,False,False,False,False
18,14tdh0n,cats,/r/cats/comments/14tdh0n/1_month_of_cat_ownership_its_been_more_fun_than_i/,maxman87,"1 month of cat ownership, it’s been more fun than I ever imagined",10110,0.98,441,,1688750491.0,False,False,False,False,False
19,14tiexx,LeopardsAteMyFace,/r/LeopardsAteMyFace/comments/14tiexx/get_poor_quick_scheme_investing_in_trump_companies/,feel_your_feelings_,Get Poor Quick Scheme: Investing in Trump Companies,4340,0.98,438,,1688761653.0,False,False,False,False,False
20,14tb64r,TikTokCringe,/r/TikTokCringe/comments/14tb64r/the_lack_of_self_awareness_is_as_funny_as_it_is/,AzulaOblongata,The lack of self awareness is as funny as it is sad.,15792,0.92,883,,1688745388.0,False,False,False,False,False
21,14tdayz,gaming,/r/gaming/comments/14tdayz/pc_gamer_anger_from_voice_actors_as_nsfw_mods_use/,H377Spawn,[PC Gamer] Anger from voice actors as NSFW mods use AI deepfakes to replicate their voices: 'This is NOT okay.',9845,0.91,2193,Xbox,1688750124.0,True,False,False,False,False
22,14tdtq0,Overwatch,/r/Overwatch/comments/14tdtq0/is_15249m_enough_to_make_talent_trees/,shiftup1772,Is $152.49M enough to make talent trees?,7900,0.96,502,,1688751314.0,False,False,False,False,False
23,14tke2i,Eldenring,/r/Eldenring/comments/14tke2i/the_true_endgame/,Rase57,The True Endgame,3097,0.99,118,:restored:,1688766191.0,False,False,False,False,False
24,14tfxzf,dankmemes,/r/dankmemes/comments/14tfxzf/i_dont_make_the_rules_i_just_enforce_them/,thepositivepandemic,"I don’t make the rules, I just enforce them.",6306,0.96,52,,1688756156.0,False,False,False,False,False
25,14t83xp,worldnews,/r/worldnews/comments/14t83xp/for_the_fourth_day_in_a_row_earth_has_broken_or/,Mr_Basketcase,"For the fourth day in a row, Earth has broken or equalled its hottest average temperature record",21782,0.94,2404,,1688738374.0,False,False,False,False,False
26,14tkpbt,CrazyFuckingVideos,/r/CrazyFuckingVideos/comments/14tkpbt/100_round_fully_auto_glock/,FinalSneak,100 round fully auto Glock 🫨,2667,0.94,353,,1688766884.0,False,False,False,False,False
27,14tak3e,OneOrangeBraincell,/r/OneOrangeBraincell/comments/14tak3e/her_brain_cell_is_used_for_loving/,causeimsammie,Her brain cell is used for loving,11568,0.98,162,,1688743973.0,False,False,False,False,False
28,14tef2j,comics,/r/comics/comments/14tef2j/fashion_flaws_oc/,blanche_draw,Fashion flaws [OC],6036,0.97,207,,1688752699.0,False,False,False,False,False
29,14t9pw4,news,/r/news/comments/14t9pw4/fox_faces_fcc_license_threat_over_false_election/,hcashew,Fox Faces FCC License Threat Over False Election Claims,11277,0.95,259,,1688742079.0,False,False,False,False,False
30,14tadrb,oddlysatisfying,/r/oddlysatisfying/comments/14tadrb/cathedral_stonemason/,Jmac0585,Cathedral stonemason,12117,0.96,222,,1688743591.0,False,False,False,False,False
31,14tccd5,mildlyinfuriating,/r/mildlyinfuriating/comments/14tccd5/signed_up_for_a_sleep_study_somehow_supposed_to/,youaremrbergstrom,"Signed up for a sleep study, somehow supposed to sleep like this tonight.",8571,0.89,778,,1688747971.0,False,False,False,False,False
32,14t7jf5,meirl,/r/meirl/comments/14t7jf5/me_irl/,Sonic_the_hedgedog,me_irl,31209,0.94,602,,1688736942.0,False,False,False,False,False
33,14tin8z,facepalm,/r/facepalm/comments/14tin8z/plant_based_beer/,Lisa_Sbs,Plant based beer,7633,0.97,1054,,1688762184.0,False,False,False,False,False
34,14tanc2,oddlyterrifying,/r/oddlyterrifying/comments/14tanc2/xrays_taken_by_the_usmexico_border_patrol/,Diceyland,X-Rays taken by the US-Mexico border patrol,10854,0.97,316,,1688744187.0,False,False,False,False,False
35,14th0ik,pettyrevenge,/r/pettyrevenge/comments/14th0ik/boyfriend_was_wrongfully_towed_from_our_complex_i/,Ok-Willow-2109,"Boyfriend was wrongfully towed from our complex, I got revenge",3352,0.96,141,,1688758508.0,False,False,False,False,False
36,14tc4fb,movies,/r/movies/comments/14tc4fb/indiana_jones_5_it_took_100_vfx_industrial_light/,Key_Damage_9220,‘Indiana Jones 5’: It Took 100+ VFX Industrial Light and Magic Artists to De-Age Harrison Ford,6175,0.93,1271,,1688747468.0,False,False,False,False,False
37,14ten0a,aww,/r/aww/comments/14ten0a/oc_everyone_says_he_looks_like_garfield_i_love_it/,loveme_lina,[OC] Everyone says he looks like Garfield! I love it!,4369,0.92,97,,1688753149.0,False,False,False,False,False
38,14tir88,Genshin_Impact,/r/Genshin_Impact/comments/14tir88/might_be_unpopular_but_i_love_that_she_doesnt/,Romapolitan,"Might be unpopular, but I love that she doesn't have tons of exposed skin and just rocks her suit",2676,0.89,351,,1688762422.0,False,False,False,False,False
39,14te3oq,technicallythetruth,/r/technicallythetruth/comments/14te3oq/they_only_go_up_to_9/,ok-i,They only go up to 9,4829,0.97,70,,1688751970.0,False,False,False,False,False
40,14tiikg,shitposting,/r/shitposting/comments/14tiikg/praise_spez/,some_random_online,Praise Spez,2605,0.97,63,,1688761889.0,False,False,False,False,False
41,14tcrwk,MadeMeSmile,/r/MadeMeSmile/comments/14tcrwk/i_love_a_culture_where_the_customer_isnt_always/,Careful_Cup4484,I love a culture where the customer isn’t always right,24866,0.91,1448,,1688748921.0,False,False,False,False,False
42,14taosk,JustGuysBeingDudes,/r/JustGuysBeingDudes/comments/14taosk/practicing_chinese_like_a_dude/,meepmeepitsajeep,Practicing Chinese like a dude ,7488,0.93,167,,1688744281.0,False,False,False,False,False
43,14tccj8,shittymoviedetails,/r/shittymoviedetails/comments/14tccj8/american_psycho_2000_is_surprisingly_unoriginal/,xZOMBIETAGx,"American Psycho (2000) is surprisingly unoriginal. Not only is the entire story stolen from a book with the same name, many of the scenes are shot-for-shot copies of popular internet memes and gifs.",5550,0.97,33,,1688747982.0,False,False,False,False,False
44,14tc0oa,books,/r/books/comments/14tc0oa/george_rr_martin_dont_be_too_impatient_its_only/,RobertoSerrano2003,"George R.R. Martin: ""Don't be too impatient, it's only been 12 years since the last one""",5516,0.91,1232,,1688747230.0,False,False,False,True,False
45,14t92mx,BikiniBottomTwitter,/r/BikiniBottomTwitter/comments/14t92mx/no/,recordingheart,NO.,8613,0.97,134,,1688740574.0,False,False,False,False,False
46,14t8i9r,Funnymemes,/r/Funnymemes/comments/14t8i9r/would_you/,No_Stock160,Would you?,12333,0.94,516,,1688739291.0,False,False,False,False,False
47,14t8bl6,doordash,/r/doordash/comments/14t8bl6/some_of_us_do_actually_act_like_this_is_a_serious/,JSOFL,Some of US do actually act like this is a serious job and DO NOT BEG. I try to do my share of good deeds.,10567,0.95,304,,1688738825.0,False,False,False,False,False
48,14tfrb4,popculturechat,/r/popculturechat/comments/14tfrb4/jimmy_kimmels_dinner_party_posted_by_kristen_bell/,keine_fragen,"Jimmy Kimmel’s dinner party, posted by Kristen Bell",3202,0.89,940,,1688755740.0,False,False,False,False,False
49,14tbs8a,AITAH,/r/AITAH/comments/14tbs8a/aitah_for_going_to_my_friends_iud_appointment/,Level_Green_6692,AITAH for going to my friends IUD appointment against my husbands wishes?,5480,0.95,1882,,1688746694.0,False,False,False,False,False
50,14tceos,whenthe,/r/whenthe/comments/14tceos/double_budget_infinitely_dogshit_product/,proviking6000,double budget = infinitely dogshit product,6285,0.95,231,,1688748111.0,False,False,False,False,False
51,14thb9p,PrequelMemes,/r/PrequelMemes/comments/14thb9p/i_hate_you/,Dranem78,"""I HATE YOU!""",2621,0.98,29,,1688759166.0,False,False,False,False,False
52,14ti7hb,antiwork,/r/antiwork/comments/14ti7hb/woman_90_retires_from_dillards_job_after_74_years/,berserk539,"Woman, 90, retires from Dillard’s job after 74 years — and no missed days",2322,0.97,268,,1688761152.0,False,False,False,False,False
53,14t6n2z,Breath_of_the_Wild,/r/Breath_of_the_Wild/comments/14t6n2z/i_think_they_do_it_on_purpose/,CrowHoonter,i think they do it on purpose,14447,0.97,192,,1688734765.0,False,False,False,False,False
54,14the2d,OldSchoolCool,/r/OldSchoolCool/comments/14the2d/pam_grier_watching_a_portable_sony_tv_circa_1972/,eaglemaxie,"Pam Grier watching a Portable SONY TV, circa 1972",2515,0.96,114,,1688759344.0,True,False,False,False,False
55,14thwlc,LateStageCapitalism,/r/LateStageCapitalism/comments/14thwlc/this_is_so_disgusting/,Long_Beautiful6367,This is so disgusting,2360,0.96,104,,1688760473.0,False,False,False,False,False
56,14t7ziw,WTF,/r/WTF/comments/14t7ziw/x_ray_of_vibrator_stuck_in_rectum_plus_pair_of/,amanitavirosa247,X Ray of vibrator stuck in rectum plus pair of salad tongs which got stuck trying to remove vibrator,8914,0.95,612,,1688738079.0,True,False,False,False,False
57,14t9yai,UpliftingNews,/r/UpliftingNews/comments/14t9yai/arizona_governor_oks_over_the_counter_birth/,Imchildfree,Arizona governor Ok's over the counter birth control,6190,0.95,189,,1688742569.0,False,False,False,False,False
58,14t5xzi,BeAmazed,/r/BeAmazed/comments/14t5xzi/zebra_be_like_bitch_i_bite_too/,XahidX,Zebra be like: Bitch I bite too,20783,0.95,397,,1688732932.0,False,False,False,False,False
59,14tbs1g,ImTheMainCharacter,/r/ImTheMainCharacter/comments/14tbs1g/what_kind_of_welcome_was_he_expecting/,Vemonis,What kind of welcome was he expecting?,5013,0.95,835,,1688746682.0,False,False,False,False,False
60,14tdplv,Tinder,/r/Tinder/comments/14tdplv/men_scare_me/,Clean-Cheetah4222,men scare me 😟,3767,0.94,797,,1688751041.0,False,False,False,False,False
61,14tgbuq,formuladank,/r/formuladank/comments/14tgbuq/why_you_cant_hold_me_in_the_street/,UnquestionableDuck,Why You Can't Hold Me In The Street?,2724,0.95,102,Alonso deserved to be Champion in every season he has competed,1688756971.0,False,False,False,False,False
62,14tepv1,CuratedTumblr,/r/CuratedTumblr/comments/14tepv1/jesse_we_have_to_accept_my_old_business_partners/,CrypticBalcony,jesse we have to accept my old business partner’s offer to pay for my cancer treatment jesse,3309,0.98,92,kitty! :D,1688753329.0,False,False,False,False,False
63,14thlee,discordVideos,/r/discordVideos/comments/14thlee/sword_fights_in_america_be_like/,NerY_05,sword fights in america be like,2302,0.97,77,,1688759794.0,False,False,False,False,True
64,14tcxxh,PoliticalHumor,/r/PoliticalHumor/comments/14tcxxh/pure_insanity/,Confident_Prompt9494,Pure insanity.,3943,0.96,382,,1688749293.0,False,False,True,False,False
65,14t5g35,DesignPorn,/r/DesignPorn/comments/14t5g35/blood_drops_pearl_necklace/,Furr_Fag,Blood drops pearl necklace,21623,0.89,349,,1688731605.0,False,False,False,False,False
66,14thfj5,Hololive,/r/Hololive/comments/14thfj5/achan_has_a_threads_account_now/,SFTSmileTy,Achan has a threads account now,2306,0.98,135,,1688759427.0,False,False,False,False,False
67,14tjcna,todayilearned,/r/todayilearned/comments/14tjcna/til_that_there_are_approximately_299_people/,seaweed_blunt,"TIL that there are approximately 299 people cryogenically frozen in Scottsdale, Arizona",3995,0.98,431,,1688763794.0,False,False,False,False,False
68,14t9t6i,TheLastAirbender,/r/TheLastAirbender/comments/14t9t6i/yep_that_pretty_much_proves_it/,ProperAtmospherea,"Yep, that pretty much proves it.",6681,0.99,168,,1688742270.0,False,False,False,False,False
69,14tcppo,PeterExplainsTheJoke,/r/PeterExplainsTheJoke/comments/14tcppo/why/,AdditionalCall5271,Why????,4359,0.95,182,,1688748778.0,True,False,False,False,False
70,14t8x11,technology,/r/technology/comments/14t8x11/tech_execs_are_stressed_out_half_are_heavy/,Sorin61,"Tech execs are stressed out. Half are heavy drinkers and 45% take painkillers, a new study says",6635,0.93,1217,,1688740237.0,False,False,False,False,False
71,14tbq2m,AskReddit,/r/AskReddit/comments/14tbq2m/serious_whats_something_that_happened_to_you_that/,Only-Carpenter-6689,(Serious) What's something that happened to you that sounds made up but isn't?,4659,0.95,4576,,1688746557.0,False,False,False,False,False
72,14tgbug,IASIP,/r/IASIP/comments/14tgbug/what_are_the_best_roasts_on_the_show_ill_start/,cdbriggs,What are the best roasts on the show? I'll start...,2513,0.97,236,,1688756970.0,False,False,False,False,False
73,14tak4m,Unexpected,/r/Unexpected/comments/14tak4m/you_stupid_fuc_nevermind_have_a_great_day/,PeevishBoi,"You stupid fuc..... nevermind, have a great day.",29613,0.9,730,,1688743975.0,True,False,False,False,False
74,14tbyiz,anime_irl,/r/anime_irl/comments/14tbyiz/anime_irl/,Narrow_Association43,anime_irl,4571,0.9,254,,1688747096.0,False,False,False,False,False
75,14t9pg5,starwarsmemes,/r/starwarsmemes/comments/14t9pg5/not_very_smart/,The_Alcoholic_Devil,Not very smart,6368,0.96,109,,1688742058.0,False,False,False,False,False
76,14tarwd,rareinsults,/r/rareinsults/comments/14tarwd/this_isnt_olive_garden/,FaithlessnessRare957,This isn't Olive Garden,5058,0.97,117,,1688744466.0,False,False,False,False,False
77,14tfeu9,Damnthatsinteresting,/r/Damnthatsinteresting/comments/14tfeu9/multiple_buildings_being_simultaneously/,yourSAS,Multiple buildings being simultaneously demolished in China,6751,0.98,587,,1688754950.0,False,False,False,False,False
78,14t9j96,pics,/r/pics/comments/14t9j96/hoooooollly_shit_is_john_oliver_rinterestingasfuck/,--Fawkes--,Hoooooollly Shit! Is John Oliver r/interestingasfuck,5764,0.85,250,,1688741676.0,False,False,False,False,False
79,14tkewt,Spiderman,/r/Spiderman/comments/14tkewt/which_universe_did_you_like_the_most_so_far/,slientxx,which universe did you like the most so far?,1466,0.98,148,,1688766246.0,False,False,False,False,False
80,14tfbzo,PoliticalCompassMemes,/r/PoliticalCompassMemes/comments/14tfbzo/the_supreme_court_needs_more_black_people_no_not/,Dissent-Against-Them,The Supreme Court needs more Black people... NO NOT LIKE THAT! NOOOOOOOOOO!!!1!,2735,0.87,390,:CENTG: - Centrist,1688754770.0,False,False,False,False,False
81,14tddyz,Weird,/r/Weird/comments/14tddyz/i_woke_up_to_a_pickle_on_my_front_door/,kuromifan333,I woke up to a pickle on my front door?,3473,0.96,810,,1688750310.0,False,False,False,False,False
82,14tgd2j,witcher,/r/witcher/comments/14tgd2j/the_real_butcher_of_blaviken/,NennisDedry,The real Butcher of Blaviken*,2313,0.96,113,,1688757042.0,True,False,False,False,False
83,14tb3bi,FirstTimeHomeBuyer,/r/FirstTimeHomeBuyer/comments/14tb3bi/i_just_closed_197000_in_baltimore_md_i_nap_now_lol/,Ughburner,"I just closed! 197,000 in Baltimore MD. I nap now lol",4467,0.95,522,,1688745203.0,False,False,False,False,False
84,14t6pmu,conservativeterrorism,/r/conservativeterrorism/comments/14t6pmu/not_even_hiding_it_anymore/,Throwawaytown33333,Not even hiding it anymore.,8191,0.93,521,,1688734920.0,False,False,False,False,False
85,14taen9,WhitePeopleTwitter,/r/WhitePeopleTwitter/comments/14taen9/stating_facts_is_hate_speech_on_threads/,Shrek-2020,"Stating ""facts"" is hate speech on Threads",21201,0.86,2004,,1688743646.0,False,False,False,False,False
86,14t893o,fixedbytheduet,/r/fixedbytheduet/comments/14t893o/big_facts/,mellabarbarella,Big facts,6504,0.94,205,,1688738657.0,False,False,False,False,False
87,14t8y61,DunderMifflin,/r/DunderMifflin/comments/14t8y61/when_i_was_12_years_old_im_37_now_i_met_this_gal/,travissetsfire,"When I was 12 years old (I'm 37 now) I met this gal at a summer camp that my mom sent me to. After that week ended, I lost contact with her. Last Friday, I found her again and it was an instant connection. Today, I bought her ring.",7157,0.78,1111,,1688740301.0,False,False,False,False,False
88,14t7mi9,ContagiousLaughter,/r/ContagiousLaughter/comments/14t7mi9/here_we_go/,LaughBakery,Here we go,7461,0.94,266,,1688737175.0,False,False,False,False,False
89,14t4hio,inthenews,/r/inthenews/comments/14t4hio/this_is_a_death_sentence_for_me_florida/,diacewrb,‘This is a death sentence for me’: Florida Republican women say they will switch parties after DeSantis approves alimony law,14459,0.89,1223,,1688729021.0,False,False,False,True,False
90,14tbfjo,Grimdank,/r/Grimdank/comments/14tbfjo/the_eldar_are_significantly_less_racist_than_the/,PanAfricanDream,The Eldar are significantly less racist than the Imperium but somehow always catch flak for being racist,4176,0.92,587,,1688745920.0,False,False,False,False,False
91,14tgsgw,4chan,/r/4chan/comments/14tgsgw/anon_is_a_little_acoustic/,supremegentlemale,Anon is a little acoustic,2031,0.98,64,,1688757995.0,False,False,False,False,False
92,14thrvn,YouShouldKnow,/r/YouShouldKnow/comments/14thrvn/ysk_texans_since_youre_in_a_time_of_heat_waves/,k4ndlej4ck,YSK Texans: Since you're in a time of heat waves and no mandated water breaks. Access to water to prevent dehydration is a federally protected right,1815,0.96,58,,1688760193.0,False,False,False,False,False
93,14teeqn,memes,/r/memes/comments/14teeqn/does_anybody_know_their_names/,and14710,Does anybody know their names?,8997,0.96,329,,1688752680.0,False,False,False,False,False
94,14t9atk,StupidFood,/r/StupidFood/comments/14t9atk/i_feel_really_sick_just_by_watching_this/,aridrawzstuff,I feel really sick just by watching this...,5648,0.85,1889,,1688741123.0,False,False,False,False,False
95,14tc25m,Eldenring,/r/Eldenring/comments/14tc25m/i_told_him_weve_all_been_there_buddy/,slamriffs,I told him we’ve all been there buddy,9995,0.95,621,,1688747330.0,False,False,False,False,False
96,14ta00j,BlackPeopleTwitter,/r/BlackPeopleTwitter/comments/14ta00j/and_she_stayed_like_a_real_woman/,jorginho20regista,And she stayed like a real woman,4587,0.88,272,,1688742677.0,False,False,False,False,False
97,14tai7i,WitchesVsPatriarchy,/r/WitchesVsPatriarchy/comments/14tai7i/supreme_court_orcas/,sailorjupiter28titan,Supreme Court Orcas,4152,0.95,44,☉ Apostate ✨ Witch of Aiaia ♀,1688743855.0,False,False,False,False,False
98,14tdk0l,UkrainianConflict,/r/UkrainianConflict/comments/14tdk0l/ben_jerrys_founder_is_top_donor_of_group/,amcjkelly,Ben & Jerry’s Founder Is ‘Top Donor’ of Group Campaigning Against U.S. Military Support for Ukraine,2853,0.94,425,,1688750694.0,False,False,False,False,False
99,14th0we,destiny2,/r/destiny2/comments/14th0we/having_trouble_staying_alive_in_grandmaster_are/,lol_Socks,"Having trouble staying alive in grandmaster, are these good stats for a hunter?",1928,0.94,256,,1688758528.0,False,False,False,False,False
100,14tcdpv,WorkReform,/r/WorkReform/comments/14tcdpv/so_many_starbucks_baristas_won_their_union/,seiu-org,SO many Starbucks baristas won their union yesterday 💅,3171,0.98,62,SEIU Official Account,1688748057.0,False,False,True,False,False
