rank,id,subreddit,permalink,author,title,score,upvote_ratio,num_comments,author_flair_text,created_utc,over_18,edited,stickied,locked,is_original_content
1,14tixjz,MadeMeSmile,/r/MadeMeSmile/comments/14tixjz/this_little_boy_found_an_older_skater_to_hold_his/,Soloflow786,"This little boy found an older skater to hold his hand as he attempted a trick. And when he landed it, he had the sweetest reaction 😭",24659,0.96,372,,1688762826.0,False,False,False,False,False
2,14tgux9,facepalm,/r/facepalm/comments/14tgux9/how_to_fix_it/,MistakeFast1917,How to fix it?,35923,0.92,3607,,1688758153.0,False,False,False,False,False
3,14tfpe4,WhitePeopleTwitter,/r/WhitePeopleTwitter/comments/14tfpe4/elon_goes_full_q_never_go_full_q/,G-Unit11111,Elon goes full Q. Never go full Q.,20467,0.95,829,,1688755620.0,False,False,False,False,False
4,14tjcna,todayilearned,/r/todayilearned/comments/14tjcna/til_that_there_are_approximately_299_people/,seaweed_blunt,"TIL that there are approximately 299 people cryogenically frozen in Scottsdale, Arizona",7790,0.97,794,,1688763794.0,False,False,False,False,False
5,14teaz2,Damnthatsinteresting,/r/Damnthatsinteresting/comments/14teaz2/using_owl_feathers_to_pet_an_owl/,ClaireDacloush,Using Owl feathers to pet an owl,41949,0.96,754,,1688752445.0,False,False,False,False,False
6,14tk0k1,news,/r/news/comments/14tk0k1/dc_court_of_appeals_committee_recommends_giuliani/,IcyMike1782,D.C. Court of Appeals committee recommends Giuliani be disbarred,6108,0.97,204,,1688765310.0,False,False,False,False,False
7,14tf2kb,Unexpected,/r/Unexpected/comments/14tf2kb/staying_under_the_radar/,5krunner,Staying under the radar,18419,0.94,410,,1688754171.0,True,False,False,False,False
8,14teirv,funny,/r/funny/comments/14teirv/apology_letter_from_exgf/,bigmikesbeingnice,Apology letter from ex-gf,18193,0.91,1836,,1688752911.0,False,False,False,False,False
9,14tke2i,Eldenring,/r/Eldenring/comments/14tke2i/the_true_endgame/,Rase57,The True Endgame,5375,0.99,186,:restored:,1688766191.0,False,False,False,False,False
10,14tiexx,LeopardsAteMyFace,/r/LeopardsAteMyFace/comments/14tiexx/get_poor_quick_scheme_investing_in_trump_companies/,feel_your_feelings_,Get Poor Quick Scheme: Investing in Trump Companies,6277,0.97,578,,1688761653.0,False,False,False,False,False
11,14te9oi,politics,/r/politics/comments/14te9oi/ocasiocortez_endorses_bidens_reelection_campaign/,Beckles28nz,"Ocasio-Cortez endorses Biden's reelection campaign, sending a strong signal of Democratic unity",12771,0.92,1538,,1688752361.0,False,False,False,False,False
12,14tdua6,PublicFreakout,/r/PublicFreakout/comments/14tdua6/a_tourist_restrains_a_pickpocket_in_italy/,ojodefiz,A tourist restrains a pickpocket in Italy 😳,15231,0.96,1383,,1688751349.0,True,False,False,False,False
13,14tlt1y,mildlyinfuriating,/r/mildlyinfuriating/comments/14tlt1y/why_did_they_have_to_design_it_like_this/,doriscrockford_canem,Why did they have to design it like this,4067,0.94,943,,1688769469.0,False,False,False,False,False
14,14ti0lk,memes,/r/memes/comments/14ti0lk/freedom_units_metric/,LemonConnoiseur,Freedom units > metric,13320,0.8,934,,1688760706.0,True,False,False,False,False
15,14tgc3n,tifu,/r/tifu/comments/14tgc3n/tifu_by_thinking_my_boyfriend_brought_condoms_to/,BurritoSupreme420,TIFU by thinking my boyfriend brought condoms to our Las Vegas vacation together and refusing to talk to him for a day cause of it,9634,0.86,1213,,1688756988.0,True,1688757108.0,False,False,False
16,14tbx9l,lotrmemes,/r/lotrmemes/comments/14tbx9l/such_a_good_actor/,UsernameLaugh,Such a good actor,26295,0.96,544,,1688747014.0,False,False,False,False,False
17,14tkpbt,CrazyFuckingVideos,/r/CrazyFuckingVideos/comments/14tkpbt/100_round_fully_auto_glock/,FinalSneak,100 round fully auto Glock 🫨,4221,0.93,535,,1688766884.0,False,False,False,False,False
18,14tdo6r,therewasanattempt,/r/therewasanattempt/comments/14tdo6r/to_lie_about_your_weight_at_the_zipline/,Incredibly_Critical,... to lie about your weight at the zipline.,14742,0.94,809,,1688750956.0,False,False,False,False,False
19,14tdh0n,cats,/r/cats/comments/14tdh0n/1_month_of_cat_ownership_its_been_more_fun_than_i/,maxman87,"1 month of cat ownership, it’s been more fun than I ever imagined",12072,0.98,503,,1688750491.0,False,False,False,False,False
20,14temuc,nba,/r/nba/comments/14temuc/video_of_the_britney_spears_and_victor_wembanyama/,Vishion-8,Video of the Britney Spears and Victor Wembanyama incident via TMZ,8584,0.94,3283,:nba-1: NBA,1688753139.0,False,False,False,False,False
21,14tbby7,wholesomememes,/r/wholesomememes/comments/14tbby7/i_can_celebrate_lunar_new_year_now/,blaze_uchiha999,I can celebrate lunar new year now,28623,0.95,413,,1688745732.0,False,False,False,False,False
22,14tb2yr,nextfuckinglevel,/r/nextfuckinglevel/comments/14tb2yr/dad_builds_a_custom_adaptive_controller_so_his/,esberat,Dad builds a custom adaptive controller so his daughter can play Zelda- Breath Of The Wild.,28212,0.94,704,,1688745183.0,False,False,False,False,False
23,14tdayz,gaming,/r/gaming/comments/14tdayz/pc_gamer_anger_from_voice_actors_as_nsfw_mods_use/,H377Spawn,[PC Gamer] Anger from voice actors as NSFW mods use AI deepfakes to replicate their voices: 'This is NOT okay.',11401,0.9,2350,Xbox,1688750124.0,True,False,False,False,False
24,14tfxzf,dankmemes,/r/dankmemes/comments/14tfxzf/i_dont_make_the_rules_i_just_enforce_them/,thepositivepandemic,"I don’t make the rules, I just enforce them.",8140,0.95,63,,1688756156.0,False,False,False,False,False
25,14tb64r,TikTokCringe,/r/TikTokCringe/comments/14tb64r/the_lack_of_self_awareness_is_as_funny_as_it_is/,AzulaOblongata,The lack of self awareness is as funny as it is sad.,17219,0.91,943,,1688745388.0,False,False,False,False,False
26,14ti7hb,antiwork,/r/antiwork/comments/14ti7hb/woman_90_retires_from_dillards_job_after_74_years/,berserk539,"Woman, 90, retires from Dillard’s job after 74 years — and no missed days",4596,0.96,523,,1688761152.0,False,False,False,False,False
27,14tlqdu,worldnews,/r/worldnews/comments/14tlqdu/turkeys_erdogan_says_ukraine_deserves_nato/,analiia_cox,Turkey’s Erdogan says Ukraine deserves NATO membership,2884,0.97,259,,1688769289.0,False,False,False,False,False
28,14tdtq0,Overwatch,/r/Overwatch/comments/14tdtq0/is_15249m_enough_to_make_talent_trees/,shiftup1772,Is $152.49M enough to make talent trees?,9037,0.96,562,,1688751314.0,False,False,False,False,False
29,14tef2j,comics,/r/comics/comments/14tef2j/fashion_flaws_oc/,blanche_draw,Fashion flaws [OC],7876,0.96,272,,1688752699.0,False,False,False,False,False
30,14tlj7t,shitposting,/r/shitposting/comments/14tlj7t/praise_spez_for_he_isnt_a_predditor/,dace154288,Praise spez for he isn’t a predditor,3033,0.97,44,,1688768810.0,False,False,False,False,False
31,14tin8z,facepalm,/r/facepalm/comments/14tin8z/plant_based_beer/,Lisa_Sbs,Plant based beer,11493,0.97,1443,,1688762184.0,False,False,False,False,False
32,14th0ik,pettyrevenge,/r/pettyrevenge/comments/14th0ik/boyfriend_was_wrongfully_towed_from_our_complex_i/,Ok-Willow-2109,"Boyfriend was wrongfully towed from our complex, I got revenge",4740,0.96,198,,1688758508.0,False,False,False,False,False
33,14tak3e,OneOrangeBraincell,/r/OneOrangeBraincell/comments/14tak3e/her_brain_cell_is_used_for_loving/,causeimsammie,Her brain cell is used for loving,12642,0.97,171,,1688743973.0,False,False,False,False,False
34,14tadrb,oddlysatisfying,/r/oddlysatisfying/comments/14tadrb/cathedral_stonemason/,Jmac0585,Cathedral stonemason,14218,0.96,246,,1688743591.0,False,False,False,False,False
35,14the2d,OldSchoolCool,/r/OldSchoolCool/comments/14the2d/pam_grier_watching_a_portable_sony_tv_circa_1972/,eaglemaxie,"Pam Grier watching a Portable SONY TV, circa 1972",3945,0.94,163,,1688759344.0,True,False,False,False,False
36,14tir88,Genshin_Impact,/r/Genshin_Impact/comments/14tir88/might_be_unpopular_but_i_love_that_she_doesnt/,Romapolitan,"Might be unpopular, but I love that she doesn't have tons of exposed skin and just rocks her suit",3611,0.87,426,,1688762422.0,False,False,False,False,False
37,14ten0a,aww,/r/aww/comments/14ten0a/oc_everyone_says_he_looks_like_garfield_i_love_it/,loveme_lina,[OC] Everyone says he looks like Garfield! I love it!,5342,0.92,108,,1688753149.0,False,False,False,False,False
38,14te3oq,technicallythetruth,/r/technicallythetruth/comments/14te3oq/they_only_go_up_to_9/,ok-i,They only go up to 9,6597,0.96,79,,1688751970.0,False,False,False,False,False
39,14tanc2,oddlyterrifying,/r/oddlyterrifying/comments/14tanc2/xrays_taken_by_the_usmexico_border_patrol/,Diceyland,X-Rays taken by the US-Mexico border patrol,12614,0.96,362,,1688744187.0,False,False,False,False,False
40,14thb9p,PrequelMemes,/r/PrequelMemes/comments/14thb9p/i_hate_you/,Dranem78,"""I HATE YOU!""",3799,0.97,47,,1688759166.0,False,False,False,False,False
41,14thwlc,LateStageCapitalism,/r/LateStageCapitalism/comments/14thwlc/this_is_so_disgusting/,Long_Beautiful6367,This is so disgusting,3315,0.95,159,,1688760473.0,False,False,False,False,False
42,14t7jf5,meirl,/r/meirl/comments/14t7jf5/me_irl/,Sonic_the_hedgedog,me_irl,33409,0.94,627,,1688736942.0,False,False,False,False,False
43,14tc4fb,movies,/r/movies/comments/14tc4fb/indiana_jones_5_it_took_100_vfx_industrial_light/,Key_Damage_9220,‘Indiana Jones 5’: It Took 100+ VFX Industrial Light and Magic Artists to De-Age Harrison Ford,7032,0.93,1361,,1688747468.0,False,False,False,False,False
44,14tkewt,Spiderman,/r/Spiderman/comments/14tkewt/which_universe_did_you_like_the_most_so_far/,slientxx,which universe did you like the most so far?,2305,0.97,214,,1688766246.0,False,False,False,False,False
45,14tfrb4,popculturechat,/r/popculturechat/comments/14tfrb4/jimmy_kimmels_dinner_party_posted_by_kristen_bell/,keine_fragen,"Jimmy Kimmel’s dinner party, posted by Kristen Bell",4071,0.88,1126,,1688755740.0,False,False,False,False,False
46,14tm3vl,sadcringe,/r/sadcringe/comments/14tm3vl/incel_moment/,lambda_2001,Incel Moment,1843,0.97,140,,1688770208.0,True,False,False,False,False
47,14tj0m4,Damnthatsinteresting,/r/Damnthatsinteresting/comments/14tj0m4/anybody_knows_the_name_of_this_mechanism/,BlessDisMess,Anybody knows the name of this mechanism?,6393,0.93,610,,1688763022.0,False,False,False,False,False
48,14tccj8,shittymoviedetails,/r/shittymoviedetails/comments/14tccj8/american_psycho_2000_is_surprisingly_unoriginal/,xZOMBIETAGx,"American Psycho (2000) is surprisingly unoriginal. Not only is the entire story stolen from a book with the same name, many of the scenes are shot-for-shot copies of popular internet memes and gifs.",6545,0.96,35,,1688747982.0,False,False,False,False,False
49,14tc0oa,books,/r/books/comments/14tc0oa/george_rr_martin_dont_be_too_impatient_its_only/,RobertoSerrano2003,"George R.R. Martin: ""Don't be too impatient, it's only been 12 years since the last one""",6432,0.91,1230,,1688747230.0,False,False,False,True,False
50,14tjt4d,discordVideos,/r/discordVideos/comments/14tjt4d/breathe/,justBarrels,Breathe,2450,0.96,106,Professional Shitter🧐,1688764810.0,False,False,False,False,False
51,14tdzz5,MadeMeSmile,/r/MadeMeSmile/comments/14tdzz5/this_kinda_marriage/,King_Pee,This kinda marriage >>>,18739,0.93,285,,1688751724.0,False,False,False,False,False
52,14taosk,JustGuysBeingDudes,/r/JustGuysBeingDudes/comments/14taosk/practicing_chinese_like_a_dude/,meepmeepitsajeep,Practicing Chinese like a dude ,8486,0.93,189,,1688744281.0,False,False,False,False,False
53,14tlh88,Hololive,/r/Hololive/comments/14tlh88/koyoris_latest_scheme_to_gain_more_subscribers/,Superliminal96,Koyori's latest scheme to gain more subscribers: turning herself blue,1905,0.99,69,:Koyori:,1688768697.0,False,False,False,False,False
54,14tnp6y,BlackPeopleTwitter,/r/BlackPeopleTwitter/comments/14tnp6y/37_years_of_consistency/,EvonyR,37 years of consistency.,1413,0.97,125,☑️ ,1688774088.0,False,False,False,False,False
55,14tgl55,whenthe,/r/whenthe/comments/14tgl55/the_thought_was_in_the_back_of_my_head_the_whole/,Gatt__,The thought was in the back of my head the whole time ngl,3716,0.98,76,,1688757551.0,False,False,False,False,False
56,14tm4xe,Baking,/r/Baking/comments/14tm4xe/i_made_my_grandma_her_peanut_butter_fudge_recipe/,SeanCole2,I made my grandma her peanut butter fudge recipe,1697,0.96,115,,1688770271.0,False,False,False,False,False
57,14tomhz,baseball,/r/baseball/comments/14tomhz/alek_manoah_vs_detroit_tigers_in_his_first_start/,ColoradoHotel,Alek Manoah vs Detroit Tigers in his first start since being sent down: 6.0 IP 1 ER 5 H 0 BB 8 K,1197,0.96,218,Toronto Blue Jays :tor1:,1688776455.0,False,False,False,False,False
58,14t92mx,BikiniBottomTwitter,/r/BikiniBottomTwitter/comments/14t92mx/no/,recordingheart,NO.,9512,0.97,149,,1688740574.0,False,False,False,False,False
59,14tf5sa,todayilearned,/r/todayilearned/comments/14tf5sa/til_5080_of_the_population_has_herpes/,Healthy_Manager5881,TIL 50-80% of the population has herpes,9534,0.93,959,,1688754390.0,False,False,False,False,False
60,14tmt0b,ukraine,/r/ukraine/comments/14tmt0b/it_is_so_strange_that_those_who_are_now_so/,Espressodimare,It is so strange that those who are now so triggered by the U.S. transfer of cluster munitions to Ukraine just couldn’t care less when Russia was pounding Ukraine with cluster munitions in the first place. Must be nothing but pure coincidence.,1512,0.97,133,,1688771891.0,False,False,False,False,False
61,14tbs8a,AITAH,/r/AITAH/comments/14tbs8a/aitah_for_going_to_my_friends_iud_appointment/,Level_Green_6692,AITAH for going to my friends IUD appointment against my husbands wishes?,6230,0.95,2105,,1688746694.0,False,False,False,False,False
62,14tgbuq,formuladank,/r/formuladank/comments/14tgbuq/why_you_cant_hold_me_in_the_street/,UnquestionableDuck,Why You Can't Hold Me In The Street?,3312,0.95,109,Alonso deserved to be Champion in every season he has competed,1688756971.0,False,False,False,False,False
63,14tbs1g,ImTheMainCharacter,/r/ImTheMainCharacter/comments/14tbs1g/what_kind_of_welcome_was_he_expecting/,Vemonis,What kind of welcome was he expecting?,5960,0.95,924,,1688746682.0,False,False,False,False,False
64,14tbq2m,AskReddit,/r/AskReddit/comments/14tbq2m/serious_whats_something_that_happened_to_you_that/,Only-Carpenter-6689,(Serious) What's something that happened to you that sounds made up but isn't?,5956,0.94,5820,,1688746557.0,False,False,False,False,False
65,14tkxb1,iamatotalpieceofshit,/r/iamatotalpieceofshit/comments/14tkxb1/dixie_was_a_sweet_and_friendly_dog_who_loved/,CantStopPoppin,"Dixie was a sweet and friendly dog who loved everyone. She was only 3 years old when a police officer in Lorain, Ohio, shot her dead. The officer had muted his body cam and called her over before pulling the trigger multiple times",1827,0.95,314,,1688767403.0,False,False,False,False,False
66,14tcxxh,PoliticalHumor,/r/PoliticalHumor/comments/14tcxxh/pure_insanity/,Confident_Prompt9494,Pure insanity.,4842,0.96,436,,1688749293.0,False,False,True,False,False
67,14tepv1,CuratedTumblr,/r/CuratedTumblr/comments/14tepv1/jesse_we_have_to_accept_my_old_business_partners/,CrypticBalcony,jesse we have to accept my old business partner’s offer to pay for my cancer treatment jesse,3962,0.98,116,kitty! :D,1688753329.0,False,False,False,False,False
68,14tdplv,Tinder,/r/Tinder/comments/14tdplv/men_scare_me/,Clean-Cheetah4222,men scare me 😟,4496,0.93,899,,1688751041.0,False,False,False,False,False
69,14tgbug,IASIP,/r/IASIP/comments/14tgbug/what_are_the_best_roasts_on_the_show_ill_start/,cdbriggs,What are the best roasts on the show? I'll start...,3107,0.97,277,,1688756970.0,False,False,False,False,False
70,14t8i9r,Funnymemes,/r/Funnymemes/comments/14t8i9r/would_you/,No_Stock160,Would you?,13243,0.94,546,,1688739291.0,False,False,False,False,False
71,14t8bl6,doordash,/r/doordash/comments/14t8bl6/some_of_us_do_actually_act_like_this_is_a_serious/,JSOFL,Some of US do actually act like this is a serious job and DO NOT BEG. I try to do my share of good deeds.,11205,0.95,317,,1688738825.0,False,False,False,False,False
72,14t9yai,UpliftingNews,/r/UpliftingNews/comments/14t9yai/arizona_governor_oks_over_the_counter_birth/,Imchildfree,Arizona governor Ok's over the counter birth control,6906,0.96,197,,1688742569.0,False,False,False,False,False
73,14timhv,DunderMifflin,/r/DunderMifflin/comments/14timhv/to_the_guy_whos_planning_on_proposing_after_a_week/,kNyne,To the guy who's planning on proposing after a week,2301,0.98,100,,1688762138.0,False,False,False,False,False
74,14thrvn,YouShouldKnow,/r/YouShouldKnow/comments/14thrvn/ysk_texans_since_youre_in_a_time_of_heat_waves/,k4ndlej4ck,YSK Texans: Since you're in a time of heat waves and no mandated water breaks. Access to water to prevent dehydration is a federally protected right,2488,0.95,99,,1688760193.0,False,False,False,False,False
75,14t6n2z,Breath_of_the_Wild,/r/Breath_of_the_Wild/comments/14t6n2z/i_think_they_do_it_on_purpose/,CrowHoonter,i think they do it on purpose,15424,0.97,197,,1688734765.0,False,False,False,False,False
76,14tgd2j,witcher,/r/witcher/comments/14tgd2j/the_real_butcher_of_blaviken/,NennisDedry,The real Butcher of Blaviken*,2943,0.95,143,,1688757042.0,True,False,False,False,False
77,14t7ziw,WTF,/r/WTF/comments/14t7ziw/x_ray_of_vibrator_stuck_in_rectum_plus_pair_of/,amanitavirosa247,X Ray of vibrator stuck in rectum plus pair of salad tongs which got stuck trying to remove vibrator,9601,0.95,648,,1688738079.0,True,False,False,False,False
78,14tddyz,Weird,/r/Weird/comments/14tddyz/i_woke_up_to_a_pickle_on_my_front_door/,kuromifan333,I woke up to a pickle on my front door?,4493,0.95,986,,1688750310.0,False,False,False,False,False
79,14t8x11,technology,/r/technology/comments/14t8x11/tech_execs_are_stressed_out_half_are_heavy/,Sorin61,"Tech execs are stressed out. Half are heavy drinkers and 45% take painkillers, a new study says",7678,0.93,1306,,1688740237.0,False,False,False,False,False
80,14tb3bi,FirstTimeHomeBuyer,/r/FirstTimeHomeBuyer/comments/14tb3bi/i_just_closed_197000_in_baltimore_md_i_nap_now_lol/,Ughburner,"I just closed! 197,000 in Baltimore MD. I nap now lol",5677,0.95,588,,1688745203.0,False,False,False,False,False
81,14tlppj,nextfuckinglevel,/r/nextfuckinglevel/comments/14tlppj/man_has_seizure_while_skydiving_and_is_saved_by/,Closed_Aperture,Man has seizure while skydiving and is saved by instructor during free fall.,3117,0.98,224,,1688769245.0,False,False,False,False,False
82,14t5xzi,BeAmazed,/r/BeAmazed/comments/14t5xzi/zebra_be_like_bitch_i_bite_too/,XahidX,Zebra be like: Bitch I bite too,22709,0.95,418,,1688732932.0,False,False,False,False,False
83,14t9t6i,TheLastAirbender,/r/TheLastAirbender/comments/14t9t6i/yep_that_pretty_much_proves_it/,ProperAtmospherea,"Yep, that pretty much proves it.",7420,0.98,181,,1688742270.0,False,False,False,False,False
84,14tarwd,rareinsults,/r/rareinsults/comments/14tarwd/this_isnt_olive_garden/,FaithlessnessRare957,This isn't Olive Garden,6083,0.97,131,,1688744466.0,False,False,False,False,False
85,14tjtun,TwoXChromosomes,/r/TwoXChromosomes/comments/14tjtun/what_is_wrong_with_people_these_days/,Griffinsilver,What is wrong with people these days?,1791,0.96,171,,1688764851.0,False,False,False,False,False
86,14tcppo,PeterExplainsTheJoke,/r/PeterExplainsTheJoke/comments/14tcppo/why/,AdditionalCall5271,Why????,4692,0.94,194,,1688748778.0,True,False,False,False,False
87,14tfwi4,therewasanattempt,/r/therewasanattempt/comments/14tfwi4/to_taze_a_suspect/,iLoveWenTheyRun,To taze a suspect ,7043,0.96,578,,1688756059.0,False,False,False,False,False
88,14tbyiz,anime_irl,/r/anime_irl/comments/14tbyiz/anime_irl/,Narrow_Association43,anime_irl,5234,0.9,278,,1688747096.0,False,False,False,False,False
89,14tfbzo,PoliticalCompassMemes,/r/PoliticalCompassMemes/comments/14tfbzo/the_supreme_court_needs_more_black_people_no_not/,Dissent-Against-Them,The Supreme Court needs more Black people... NO NOT LIKE THAT! NOOOOOOOOOO!!!1!,3112,0.86,451,:CENTG: - Centrist,1688754770.0,False,False,False,False,False
90,14t5g35,DesignPorn,/r/DesignPorn/comments/14t5g35/blood_drops_pearl_necklace/,Furr_Fag,Blood drops pearl necklace,22400,0.89,356,,1688731605.0,False,False,False,False,False
91,14t9j96,pics,/r/pics/comments/14t9j96/hoooooollly_shit_is_john_oliver_rinterestingasfuck/,--Fawkes--,Hoooooollly Shit! Is John Oliver r/interestingasfuck,6550,0.84,273,,1688741676.0,False,False,False,False,False
92,14tak4m,Unexpected,/r/Unexpected/comments/14tak4m/you_stupid_fuc_nevermind_have_a_great_day/,PeevishBoi,"You stupid fuc..... nevermind, have a great day.",31836,0.9,748,,1688743975.0,True,False,False,False,False
93,14tgsgw,4chan,/r/4chan/comments/14tgsgw/anon_is_a_little_acoustic/,supremegentlemale,Anon is a little acoustic,2458,0.98,73,,1688757995.0,False,False,False,False,False
94,14to71c,worldnews,/r/worldnews/comments/14to71c/biden_told_xi_after_putin_meeting_be_careful_your/,Tnargkiller,"Biden told Xi after Putin meeting: Be careful, your economy depends on Western investment",2048,0.96,353,,1688775338.0,False,False,False,False,False
95,14tikqg,ProgrammerHumor,/r/ProgrammerHumor/comments/14tikqg/whosgonnatellhim/,huxx__,whosGonnaTellHim,1989,0.96,108,,1688762033.0,False,False,False,False,False
96,14tlomv,Genshin_Impact_Leaks,/r/Genshin_Impact_Leaks/comments/14tlomv/lynette_drip_with_pipe_sword_from_fishing/,vivliz,Lynette drip with pipe sword from fishing (Crossing of Fleuve Cendre),1380,0.97,169,,1688769167.0,False,False,False,False,False
97,14t9pg5,starwarsmemes,/r/starwarsmemes/comments/14t9pg5/not_very_smart/,The_Alcoholic_Devil,Not very smart,6986,0.96,114,,1688742058.0,False,False,False,False,False
98,14te6c1,StupidFood,/r/StupidFood/comments/14te6c1/new_super_cool_chef/,nkawbdfdffddf,New super cool chef,3289,0.95,124,,1688752152.0,False,False,False,False,False
99,14tf4j3,shittytattoos,/r/shittytattoos/comments/14tf4j3/bro/,macyliene,Bro 😭😭😭,2905,0.97,300,,1688754311.0,False,False,False,False,False
100,14tedne,politics,/r/politics/comments/14tedne/dont_say_gay_gop_lawmaker_accused_of_sexual/,PirateCodingMonkey,“Don’t Say Gay” GOP lawmaker accused of sexual harassment by 2 male staffers,6683,0.98,294,:flag-tn: Tennessee,1688752608.0,False,False,False,False,False
