rank,id,subreddit,permalink,author,title,score,upvote_ratio,num_comments,author_flair_text,created_utc,over_18,edited,stickied,locked,is_original_content
1,14lylvw,memes,/r/memes/comments/14lylvw/medieval_disease/,Lightning-11,Medieval disease,9838,0.94,131,Medieval Meme Lord,1688024731.0,False,False,False,False,False
2,14lyhxe,facepalm,/r/facepalm/comments/14lyhxe/good_for_him/,Inevitable-Cellist23,Good for him,8713,0.95,543,,1688024327.0,False,False,False,False,False
3,14lw31r,Damnthatsinteresting,/r/Damnthatsinteresting/comments/14lw31r/a_dress_that_changes_color_when_exposed_to/,Patient_Island_2080,A dress that changes color when exposed to sunlight.,15366,0.9,909,,1688016170.0,False,False,False,False,False
4,14lxfbe,wholesomememes,/r/wholesomememes/comments/14lxfbe/how_wholesome/,easilyBind59,How wholesome.,7731,0.96,188,,1688020588.0,False,False,False,False,False
5,14ly8hf,SipsTea,/r/SipsTea/comments/14ly8hf/its_pretty_decent_tbh/,UnconfirmedCatholic,It's pretty decent tbh.,5999,0.97,137,,1688023374.0,False,False,False,False,False
6,14lupq9,baseball,/r/baseball/comments/14lupq9/domingo_germán_has_thrown_the_24th_perfect_game/,BaseballBot,Domingo Germán has thrown the 24th Perfect Game in MLB history!,11585,0.93,2352,Umpire :ump:,1688011909.0,False,1688012316.0,True,False,False
7,14lyi1u,worldnews,/r/worldnews/comments/14lyi1u/ukrainian_forces_advance_1300_metres_on_berdiansk/,MagnificentCat,"Ukrainian forces advance 1,300 metres on Berdiansk front – Ukrainian Deputy Defence Minister",4829,0.96,297,,1688024342.0,False,False,False,False,False
8,14lt329,MadeMeSmile,/r/MadeMeSmile/comments/14lt329/this_guy_who_is_a_social_worker_coach_and_fitness/,daas_hu_gurudev_ka,"This guy who is a social worker, coach and fitness instructor brings fun games for the residents of this nursing home...",23403,0.98,299,,1688007134.0,False,False,False,False,False
9,14lrwfj,WhitePeopleTwitter,/r/WhitePeopleTwitter/comments/14lrwfj/and_none_of_her_supporters_know_this/,Manakanda413,And none of her supporters know this,41941,0.96,610,,1688003725.0,False,False,False,False,False
10,14lze63,shitposting,/r/shitposting/comments/14lze63/glory_to_spez/,RandomDude420-_-,Glory to spez,4231,0.95,31,,1688027558.0,False,False,False,False,False
11,14lys7o,BeAmazed,/r/BeAmazed/comments/14lys7o/craftsmen_have_created_the_lowest_car_in_the_world/,steady_as_a_rock,Craftsmen have created the lowest car in the world.,4132,0.93,240,,1688025392.0,False,False,False,False,False
12,14lt4wl,ContagiousLaughter,/r/ContagiousLaughter/comments/14lt4wl/very_close/,LaughBakery,Very close,16648,0.95,207,,1688007287.0,False,False,False,False,False
13,14ltvq4,AnimalsBeingBros,/r/AnimalsBeingBros/comments/14ltvq4/good_boy_is_a_lifeguard/,westcoastcdn19,Good boy is a lifeguard ,10850,0.97,135,,1688009435.0,False,False,False,False,False
14,14luyuu,HolUp,/r/HolUp/comments/14luyuu/body_mass_index_begs_to_differ/,Available-Deer1723,Body mass index begs to differ💀,8273,0.96,95,,1688012688.0,False,False,False,False,False
15,14ltix4,ukraine,/r/ukraine/comments/14ltix4/what_love_looks_like_by_journalist_tetiana_bezruk/,Lincoin02202,What love looks like (by journalist Tetiana Bezruk),9591,0.94,272,,1688008370.0,False,False,False,False,False
16,14lyr31,2westerneurope4u,/r/2westerneurope4u/comments/14lyr31/yes/,Euphoric_Ad_69,Yes,3251,0.96,558,:European: European,1688025268.0,False,False,False,False,False
17,14lq6fs,PublicFreakout,/r/PublicFreakout/comments/14lq6fs/hero_cop_goes_from_giving_a_speech_to_kids_about/,ticklemypicklesir,Hero cop goes from giving a speech to kids about wearing seatbelts to running towards gun fire to stop an active shooter at the Allen Outlet Mall in Texas,28680,0.89,2410,,1687998911.0,True,False,False,False,False
18,14lv92l,Satisfyingasfuck,/r/Satisfyingasfuck/comments/14lv92l/mans_been_waiting_his_whole_life_for_this_moment/,trashyoutdoors,Mans been waiting his whole life for this moment,5464,0.95,148,,1688013580.0,False,False,False,False,False
19,14lxj5z,memes,/r/memes/comments/14lxj5z/medieval_sleepover_with_the_boys/,ILikeMemes522,Medieval sleepover with the boys,8490,0.96,200,,1688020958.0,False,False,False,False,False
20,14m08kh,Damnthatsinteresting,/r/Damnthatsinteresting/comments/14m08kh/this_homeless_mans_rabbit_was_thrown_over_a/,EpicNerdGuy,"This Homeless man's rabbit was thrown over a bridge by a passerby and he immediately jumped into the river to save her. He won an award, was given animal food and a job, and the passerby was charged with animal cruelty.",3601,0.97,88,,1688030464.0,False,False,False,False,False
21,14m02oj,WinStupidPrizes,/r/WinStupidPrizes/comments/14m02oj/guy_tries_to_assualt_bus_driver/,flunghigh,guy tries to assualt bus driver,2123,0.94,189,,1688029896.0,False,False,False,False,False
22,14m0pcm,facepalm,/r/facepalm/comments/14m0pcm/what_a_terrible_day_to_be_literate/,FragrantShoppings,What a terrible day to be literate,3482,0.98,346,,1688032060.0,False,False,False,False,False
23,14lpq8u,WatchPeopleDieInside,/r/WatchPeopleDieInside/comments/14lpq8u/woman_commits_cardinal_sin_by_picking_up_players/,TheRealPW,Woman commits cardinal sin by picking up player’s golf ball,26295,0.94,2273,,1687997705.0,False,False,False,False,False
24,14ltygt,OldSchoolCool,/r/OldSchoolCool/comments/14ltygt/june_13_1986mike_tysons_left_hook_kod_reggie/,LivingInMatrix,"June 13, 1986-Mike Tyson’s left hook KO’d Reggie Gross – a hitman and mob enforcer now serving life in prison in South Carolina ",6238,0.97,389,,1688009657.0,False,False,False,False,False
25,14ls6er,pcmasterrace,/r/pcmasterrace/comments/14ls6er/have_they_truly_given_up_on_us/,BullmooseTheocracy,Have they truly given up on us?,9957,0.95,954,,1688004487.0,False,False,False,False,False
26,14ls47d,therewasanattempt,/r/therewasanattempt/comments/14ls47d/to_demolish_a_house/,hisprerogative,To demolish a house,11714,0.94,558,,1688004315.0,False,False,False,False,False
27,14lotwn,mildlyinfuriating,/r/mildlyinfuriating/comments/14lotwn/amtrak_customer_service_after_derailment_today/,reetofu,Amtrak customer service after derailment today,24806,0.97,624,,1687995377.0,False,False,False,False,False
28,14m29r1,comics,/r/comics/comments/14m29r1/freedom/,Pizzacakecomic,Freedom!,1443,0.89,55,PizzaCake,1688037293.0,False,False,False,False,True
29,14lq7nm,meirl,/r/meirl/comments/14lq7nm/meirl/,xJkurtz,Meirl,16540,0.98,192,,1687999004.0,False,False,False,False,False
30,14lwtkk,formuladank,/r/formuladank/comments/14lwtkk/good_old_days/,rider_6666,Good old days,3462,0.97,106,BWOAHHHHHHH ,1688018555.0,False,False,False,False,False
31,14log1a,nextfuckinglevel,/r/nextfuckinglevel/comments/14log1a/hawk_makes_a_grave_mistake_after_trying_to_steal/,MrBonelessPizza24,Hawk makes a grave mistake after trying to steal chicks on a farm ,38980,0.93,2474,,1687994356.0,False,False,False,False,False
32,14lqwuk,todayilearned,/r/todayilearned/comments/14lqwuk/til_the_x_games_have_never_drug_tested_athletes/,thesmartass1,TIL The X Games have never drug tested athletes,9786,0.96,518,,1688000918.0,False,False,False,False,False
33,14lpv55,politics,/r/politics/comments/14lpv55/trump_demanded_my_documents_back_even_after_his/,Beckles28nz,Trump Demanded ‘My Documents’ Back Even After His Lawyers Told Him He’d Be Indicted,11440,0.97,727,,1687998061.0,False,False,False,False,False
34,14lz3u4,discordVideos,/r/discordVideos/comments/14lz3u4/job_slander/,CelebrationWild7276,Job Slander ,2150,0.96,34,,1688026530.0,False,False,False,False,False
35,14lxmh6,dankmemes,/r/dankmemes/comments/14lxmh6/you_would_make_millions_on_this_device/,CeskyDunaj,You would make millions on this device,2831,0.97,23,,1688021282.0,False,False,False,False,False
36,14lwa2g,Animemes,/r/Animemes/comments/14lwa2g/oh_no/,TakoFry,Oh no...,3568,0.95,100,,1688016800.0,False,False,False,False,False
37,14m2ovv,cursedcomments,/r/cursedcomments/comments/14m2ovv/cursed_honeybee_sting/,Mr_BirchrWasntTaken,Cursed_honeybee sting,1135,0.99,13,,1688038618.0,False,False,False,False,False
38,14lxjm7,me_irlgbt,/r/me_irlgbt/comments/14lxjm7/meirlgbt/,Lux-xxv,Me🐷irlgbt,2546,0.96,91,YEEN DEGENERATE :demiro::lesbian::trans::degen:,1688021005.0,False,False,False,False,False
39,14ltjvo,funny,/r/funny/comments/14ltjvo/leave_boo_boo_alone/,ItsAlecito,Leave boo boo alone,4874,0.92,65,,1688008450.0,False,False,False,False,False
40,14lrlkb,AskReddit,/r/AskReddit/comments/14lrlkb/what_is_the_stupidest_thing_youve_heard_someone/,JasperMidnight,What is the stupidest thing you’ve heard someone say that they were 100% serious about?,6647,0.95,7481,,1688002838.0,False,False,False,False,False
41,14lpfv3,technology,/r/technology/comments/14lpfv3/as_reddit_protests_turn_to_pornbombing/,gabestonewall,"As Reddit protests turn to porn-bombing, advertisers face increasing brand safety concerns",9469,0.95,550,,1687996942.0,False,False,False,False,False
42,14lyzhp,clevercomebacks,/r/clevercomebacks/comments/14lyzhp/hes_really_not_wrong_though/,Stoner4s3,He's really not wrong though,1764,0.97,43,,1688026098.0,False,False,False,False,False
43,14lmjes,StarWars,/r/StarWars/comments/14lmjes/my_fangirl_moment_cosplaying_bo_katan_and_meeting/,Vampisaurus,My fangirl moment: cosplaying Bo Katan and meeting Katee Sackhoff on her birthday,17254,0.94,270,,1687989642.0,False,False,False,False,False
44,14lo443,apple,/r/apple/comments/14lo443/reddit_plagued_with_1star_app_store_reviews_over/,Illustrious_Risk3732,Reddit plagued with 1-star App Store reviews over API debacle as users search for 0-star button,11246,0.94,550,,1687993494.0,False,False,False,False,False
45,14m0qz6,news,/r/news/comments/14m0qz6/bill_cosby_sued_by_9_more_women_in_nevada_for/,antihostile,Bill Cosby sued by 9 more women in Nevada for alleged decades-old sexual assaults,1248,0.97,64,,1688032219.0,False,False,False,False,False
46,14lxn06,chessbeginners,/r/chessbeginners/comments/14lxn06/that_sounds_like_a_reason_to_me/,Stupid-Username420,That sounds like a reason to me,2078,0.98,59,,1688021333.0,False,False,False,False,False
47,14lx7hz,ich_iel,/r/ich_iel/comments/14lx7hz/ich_iel/,DDogma5,Ich_iel,2203,0.96,156,,1688019848.0,True,False,False,False,False
48,14lxzc3,ProgrammerHumor,/r/ProgrammerHumor/comments/14lxzc3/pythonandturtle/,sunrise_apps,pythonAndTurtle,1893,0.98,51,:sw::ru::dart:,1688022497.0,False,False,False,False,False
49,14llegr,CrazyFuckingVideos,/r/CrazyFuckingVideos/comments/14llegr/in_the_span_of_5_minutes_a_police_officer_goes/,Tuopehm,"In the Span of 5 Minutes, a Police Officer Goes From Telling Kids to Wear Their Seatbelts, to Killing Heavily Armed Mass Shooter Who Killed 8 People",36298,0.91,3195,,1687986948.0,False,False,False,False,False
50,14lvlwj,whenthe,/r/whenthe/comments/14lvlwj/how_could_this_have_happened/,Other_Combination136,How could this have happened,2960,0.98,63,,1688014698.0,False,False,False,False,False
51,14luec0,AbruptChaos,/r/AbruptChaos/comments/14luec0/today_we_celebrate_our_indepocalypse_day/,PhelesDragon,Today we celebrate our Indepocalypse Day,3410,0.93,202,,1688010976.0,False,False,False,False,False
52,14ltsgr,ChoosingBeggars,/r/ChoosingBeggars/comments/14ltsgr/whats_wrong_with_public_poolsbeaches/,Schiissdraeck,What's wrong with public pools/beaches?,3696,0.94,348,,1688009162.0,False,False,False,False,False
53,14lqnhs,cats,/r/cats/comments/14lqnhs/what_do_you_guys_call_this_position/,jinzo_23,What do you guys call this position?,6491,0.97,418,,1688000227.0,False,False,False,False,False
54,14loef1,PeopleFuckingDying,/r/PeopleFuckingDying/comments/14loef1/cat_gets_brutally_beaten_by_crool_human_screams/,grichardson526,"cAt Gets bRUTALLY BEaTeN bY crool hUMAn, ScReamS FoR HELp",12125,0.95,211,,1687994234.0,False,False,False,False,False
55,14lwgpg,BeAmazed,/r/BeAmazed/comments/14lwgpg/encountering_a_big_sea_snake/,ekoaham,Encountering a big sea snake,3936,0.96,252,,1688017384.0,False,False,False,False,False
56,14lohp7,doordash,/r/doordash/comments/14lohp7/well_this_happened/,Pale_Ad2148,Well this Happened 🤣🤣🤣,10394,0.93,548,,1687994477.0,False,False,False,False,False
57,14ln6id,gaming,/r/gaming/comments/14ln6id/if_you_had_a_child_after_skyrim_released_that/,PapaOogie,"If you had a child after Skyrim released, that child would grow up and graduate highschool before Elder Scrolls 6 releases",11469,0.94,710,,1687991164.0,False,False,False,False,False
58,14lrhgv,DunderMifflin,/r/DunderMifflin/comments/14lrhgv/its_the_little_things/,littletrevas,It's the little things...,5006,0.98,88,,1688002510.0,False,False,False,False,False
59,14lp0j8,conservativeterrorism,/r/conservativeterrorism/comments/14lp0j8/but_the_greatest_threat_we_face_as_a_nation/,Distantmole,But the greatest threat we face as a nation is…*checks notes*…drag queens reading to children?,7438,0.9,313,,1687995858.0,False,False,False,False,False
60,14lt1fa,ChildrenFallingOver,/r/ChildrenFallingOver/comments/14lt1fa/running_to_show_mom_his_finished_lego_xwing/,icameinyourburrito,Running to show mom his finished LEGO X-Wing,3826,0.96,128,,1688007009.0,False,False,False,False,False
61,14ly5li,4chan,/r/4chan/comments/14ly5li/insult_to_injury/,isiqiwx,Insult to injury,1636,0.96,18,,1688023099.0,False,False,False,False,False
62,14lypiw,PixelArt,/r/PixelArt/comments/14lypiw/goth_girl/,kisk123,Goth girl,1453,0.96,40,,1688025100.0,False,False,False,False,True
63,14lz67y,Hololive,/r/Hololive/comments/14lz67y/cover_corp_and_anycolor_known_for_nijisanji_have/,SenorSantiago_8363,COVER Corp and ANYCOLOR (known for NIJISANJI) have formed an anti-defamation working committee with Google LLC Japan and content management firms UUUM and note inc. (News article attached to Tweet is written in Japanese),1357,0.96,109,:Sora::AZKi::Suisei::Calliope::IRyS:,1688026770.0,False,False,False,False,False
64,14m02nz,PrequelMemes,/r/PrequelMemes/comments/14m02nz/podracing/,QuantumDonuts257,Podracing,1189,0.98,28,Rebel Legion,1688029895.0,False,False,False,False,False
65,14lxx5t,shitposting,/r/shitposting/comments/14lxx5t/heil_spez/,Siil_Udus,heil spez,3006,0.99,22,,1688022281.0,False,False,False,False,False
66,14lus2y,MaliciousCompliance,/r/MaliciousCompliance/comments/14lus2y/if_he_says_its_his_its_his_you_sure_you_wanna_go/,LocalLiBEARian,"“If he says it’s his, it’s his.” You sure you wanna go with that?",2784,0.95,157,,1688012110.0,False,False,False,False,True
67,14ltaas,LeagueOfMemes,/r/LeagueOfMemes/comments/14ltaas/someone_said_something_about_creativity/,Ninja_Cezar,Someone said something about creativity,3728,0.97,44,,1688007703.0,False,False,False,False,False
68,14luca6,MarchAgainstNazis,/r/MarchAgainstNazis/comments/14luca6/holy_shit/,WebModeratorSyndrome,Holy shit,2918,0.97,125,,1688010797.0,False,False,False,False,False
69,14lqti9,teenagers,/r/teenagers/comments/14lqti9/is_my_dad_a_little_crazy_im_14_and_get_one_minute/,terrairiaplayer,Is my dad a little crazy? I’m 14 and get one minute a day on everything,6567,0.94,854,14,1688000666.0,False,False,False,False,False
70,14lkfam,tumblr,/r/tumblr/comments/14lkfam/ancient_emojis/,MyNameGifOreilly,Ancient Emojis,26198,0.95,152,,1687984671.0,False,False,False,False,False
71,14louoa,OnePunchMan,/r/OnePunchMan/comments/14louoa/chapter_187_english/,VibhavM,Chapter 187 [English],7108,0.96,703,Retired From day2day Moderation. Contact Other Mods.,1687995433.0,False,False,True,False,False
72,14lyn78,pokemon,/r/pokemon/comments/14lyn78/i_cant_be_the_only_one_who_sees_it/,Affectionate-Pop2353,i cant be the only one who sees it,1348,0.96,53,,1688024866.0,False,False,False,False,False
73,14lq1xk,fightporn,/r/fightporn/comments/14lq1xk/these_college_students_have_no_fuckin_chill/,Icarus2515,These College Students Have No Fuckin Chill,5724,0.93,698,,1687998570.0,True,False,False,False,False
74,14lqawm,thisismylifenow,/r/thisismylifenow/comments/14lqawm/i_caught_a_wild_mouse_in_my_kitchen_awhile_back/,I_might_be_weasel,I caught a wild mouse in my kitchen awhile back and kept him in a hamster cage with some pet store mice. He seems to have acclimated.,5319,0.97,184,,1687999247.0,False,False,False,False,False
75,14lsrk2,AmItheAsshole,/r/AmItheAsshole/comments/14lsrk2/aita_for_reporting_a_mother_and_her_glitter/,Fit-Lab5312,AITA for reporting a mother and her glitter monster to a flight attendant?,3601,0.95,752,,1688006202.0,False,False,False,False,False
76,14lozds,todayilearned,/r/todayilearned/comments/14lozds/til_that_originally_the_barbie_movie_was_supposed/,Purplethrowaway_,"TIL that originally the Barbie movie was supposed to come out in 2018, with Amy Schumer as Barbie.",21946,0.85,2359,,1687995774.0,False,False,False,False,False
77,14lw0wx,HonkaiStarRail,/r/HonkaiStarRail/comments/14lw0wx/out_of_the_three_new_companion_missions_we_just/,Any-Individual-4046,"out of the three new companion missions we just got, which one was your favorite?",2033,0.96,269,,1688015996.0,False,False,False,False,False
78,14lqoke,WhitePeopleTwitter,/r/WhitePeopleTwitter/comments/14lqoke/well_well_well_how_the_turntables/,KyloRenKardashian,well. well.. well.. how the turntables...,10295,0.96,752,,1688000313.0,False,False,False,False,False
79,14m0bds,MapPorn,/r/MapPorn/comments/14m0bds/breakup_of_yugoslavia_benefited_or_harmed_your/,quindiassomigli,Breakup of Yugoslavia: “Benefited or Harmed your country”? [Poll],956,0.96,146,,1688030733.0,False,False,False,False,False
80,14lpgec,TwoSentenceHorror,/r/TwoSentenceHorror/comments/14lpgec/i_was_born_with_the_ability_to_psychically/,tasteofhemlock,I was born with the ability to psychically experience the happiest memories of any human by merely touching their skin.,6192,0.95,174,,1687996974.0,False,False,False,False,False
81,14lmlrg,maybemaybemaybe,/r/maybemaybemaybe/comments/14lmlrg/maybe_maybe_maybe/,rclippi,Maybe maybe maybe,13389,0.85,239,,1687989774.0,True,False,False,False,False
82,14lzrlx,NotHowGirlsWork,/r/NotHowGirlsWork/comments/14lzrlx/men_in_the_comments_be_like_their_intentions_are/,vjayjam,"Men in the comments be like ""Their intentions are not hostile.. they are just complimenting her."" ",1021,0.96,172,I boobed boobily down the stairs ,1688028871.0,False,False,False,False,False
83,14ltbni,assholedesign,/r/assholedesign/comments/14ltbni/dont_remind_him/,vulpinerespite,Don’t remind him!!,3072,0.94,29,,1688007795.0,False,False,False,False,False
84,14lnfqc,food,/r/food/comments/14lnfqc/homemade_salami_pepperoni_ham_provolone/,softrotten,"[Homemade] Salami, pepperoni, ham, provolone, pepperoncini, pesto sliders topped w/ garlic butter",7192,0.95,137,,1687991811.0,False,False,False,False,True
85,14llul6,wholesome,/r/wholesome/comments/14llul6/my_wife_painted_a_mural_for_our_sons_room_of_his/,bloodraven11,"My wife painted a mural for our sons room of his favorite show but she's feeling down about it. She has alot of self-esteem issues, but I think it's awesome!",10760,0.93,630,,1687988004.0,False,False,False,False,False
86,14lr9fh,sanfrancisco,/r/sanfrancisco/comments/14lr9fh/today_i_woke_up_to_this_note_on_my_car/,kiryat,Today I woke up to this note on my car,3903,0.94,559,,1688001893.0,False,False,False,False,False
87,14lsqke,Genshin_Impact,/r/Genshin_Impact/comments/14lsqke/huge_carrot/,Amirizuki,Huge Carrot.,3253,0.97,70,":noelle: : ""Time to shut up !""",1688006125.0,False,False,False,False,False
88,14lyz7d,Jokes,/r/Jokes/comments/14lyz7d/a_man_is_sitting_on_a_flight_from_nyc_to_london/,kfiri,A man is sitting on a flight from NYC to London,1079,0.91,57,,1688026069.0,True,False,False,False,False
89,14lswmj,facepalm,/r/facepalm/comments/14lswmj/patience_what/,NoCovered,Patience. What ?,17137,0.9,2461,,1688006611.0,False,False,False,False,False
90,14lu4r5,PoliticalCompassMemes,/r/PoliticalCompassMemes/comments/14lu4r5/bourgeoisie/,cocacola_drinker,Bourgeoisie,2381,0.96,86,:authleft: - Auth-Left,1688010174.0,False,False,False,False,False
91,14lz1rh,de,/r/de/comments/14lz1rh/aus_der_reihe_grafiken_die_einfach_richtig_sein/,Faehr_Vieh_Fass,Aus der Reihe: Grafiken die einfach richtig sein müssen.,1022,0.95,83,,1688026329.0,False,False,False,False,False
92,14lqxhq,instantkarma,/r/instantkarma/comments/14lqxhq/woman_steals_ice_cream_and_gets_hit_by_a_bus/,AccomplishedCup140,Woman steals ice cream and gets hit by a bus,4039,0.94,197,,1688000969.0,False,False,False,False,False
93,14lv2x5,mildlyinfuriating,/r/mildlyinfuriating/comments/14lv2x5/went_to_walmart_to_get_a_replacement_brake_light/,Snapy1,Went to Walmart to get a replacement brake light bulb only to discover them locked up. After finding a associate and getting the bulb I was escorted to the register to check out. Good precautions incase I run off with my $4.48 bulb.,3599,0.93,427,,1688013037.0,False,False,False,False,False
94,14llyj0,aww,/r/aww/comments/14llyj0/raww_is_making_a_mockery_of_the_protest/,Cantora,R/aww is making a mockery of the protest. Submissions are now just normal pics but with small John Oliver's in the corner. Either do it properly or just stop...,17757,0.72,1229,,1687988275.0,False,False,False,False,False
95,14lr35g,lostredditors,/r/lostredditors/comments/14lr35g/can_someone_help_me_out_and_tell_me_what/,Independent-Lie6616,Can someone help me out and tell me what happening here?,4320,0.91,670,,1688001402.0,False,False,False,False,False
96,14lq3v3,Baking,/r/Baking/comments/14lq3v3/first_time_entering_the_local_county_fair/,cuppiecakejams,First time entering the local county fair competition and I won first!,4252,0.96,157,,1687998712.0,False,False,False,False,False
97,14m1qtj,Grimdank,/r/Grimdank/comments/14m1qtj/i_didnt_say_anything_about_eldar_plotlines/,WantToKnowIfISurvive,I didn't say anything about Eldar plotlines.,647,0.99,49,,1688035616.0,False,False,False,False,False
98,14lpwik,shittymoviedetails,/r/shittymoviedetails/comments/14lpwik/took_a_wild_turn_at_the_sequel/,osfbamf,Took a wild turn at the sequel.,4672,0.97,28,,1687998152.0,False,False,False,False,False
99,14lmpbm,animememes,/r/animememes/comments/14lmpbm/who_else_is_like_this/,WeaknessQuiet4930,Who else is like this?,8787,0.94,269,,1687990005.0,False,False,False,False,False
100,14lnq81,me_irlgbt,/r/me_irlgbt/comments/14lnq81/meirlgbt/,lowkeyterrible,me🦚irlgbt,14747,0.94,145,:lesbian: mods r gay lol,1687992557.0,False,False,False,False,False
