rank,id,subreddit,permalink,author,title,score,upvote_ratio,num_comments,author_flair_text,created_utc,over_18,edited,stickied,locked,is_original_content
1,14ikq4s,WhitePeopleTwitter,/r/WhitePeopleTwitter/comments/14ikq4s/i_wish_this_was_surprising/,CrunchM,I wish this was surprising,14154,0.97,1020,,1687695017.0,False,False,False,False,False
2,14iki9r,facepalm,/r/facepalm/comments/14iki9r/camera_flash_causes_tuna_to_crash_into_aquarium/,Infinite-Captain-622,Camera flash causes tuna to crash into aquarium glass,19544,0.95,1335,,1687694346.0,False,False,False,False,False
3,14ijd92,todayilearned,/r/todayilearned/comments/14ijd92/til_that_sigourney_weaver_only_earned_35000_for/,Make_the_music_stop,"TIL that Sigourney Weaver only earned $35,000 for Alien (1979) but got $1,000,000 and a share of the profits for Aliens (1986)",22367,0.96,773,,1687690510.0,False,False,False,False,False
4,14ij3jw,Damnthatsinteresting,/r/Damnthatsinteresting/comments/14ij3jw/baloo_from_jungle_book_is_actually_based_on_the/,lonely_dude__,Baloo from jungle book is actually based on the sloth bear found in India which is considered to be the most agressive bear species in the world.,15346,0.97,487,Creator,1687689548.0,False,False,False,False,False
5,14ijqjl,therewasanattempt,/r/therewasanattempt/comments/14ijqjl/to_hang_out/,VariousBasket125,To hang out ,11382,0.93,2635,This is a flair,1687691762.0,False,False,False,False,False
6,14ik8p2,comics,/r/comics/comments/14ik8p2/pimple_boy/,neilkohney,Pimple boy,8268,0.96,87,The Other End,1687693469.0,False,False,False,False,False
7,14iifo7,PoliticalHumor,/r/PoliticalHumor/comments/14iifo7/this_all_makes_a_little_more_sense_now/,UnlimitedDuck,This all makes a little more sense now,12860,0.94,560,,1687687196.0,False,False,False,False,False
8,14ijn99,politics,/r/politics/comments/14ijn99/why_the_right_is_so_terrified_of_woke_there_are/,Picture-unrelated,Why the right is so terrified of “woke”: There are truths it just can’t face — Conservatives didn’t want to hear about white privilege. So they abandoned reality and joined the orange man’s cult,9133,0.84,1039,:flag-or: Oregon,1687691445.0,False,False,False,False,False
9,14ijqw3,AmItheAsshole,/r/AmItheAsshole/comments/14ijqw3/aita_for_giving_back_everything_my_family_bought/,Free-Scallion-2274,AITA for giving back everything my family bought for my son?,8832,0.94,1369,,1687691794.0,False,False,False,False,False
10,14ijxre,PublicFreakout,/r/PublicFreakout/comments/14ijxre/dog_saves_girl_from_a_kidnapper/,Genesis_001,Dog saves girl from a kidnapper.,6661,0.97,248,,1687692436.0,False,False,False,False,False
11,14ikmd8,nextfuckinglevel,/r/nextfuckinglevel/comments/14ikmd8/the_kyoto_tachibana_shs_band_performing_sing_sing/,MulciberTenebras,"The Kyoto Tachibana SHS Band performing ""Sing Sing Sing""",5552,0.97,184,,1687694673.0,False,False,False,False,False
12,14ik4qw,nba,/r/nba/comments/14ik4qw/chelsea_gray_with_a_crazy_assist_last_night_in/,srgntalpowell,Chelsea Gray with a crazy assist last night in the WNBA,5901,0.89,527,,1687693091.0,False,False,False,False,False
13,14ijykz,dankmemes,/r/dankmemes/comments/14ijykz/their_battle_will_be_legendary/,chaosgiantmemes,Their battle will be legendary!,7199,0.89,88,:runescape1:trash-tier meme lord :runescape2:,1687692520.0,False,False,False,False,False
14,14ika87,pics,/r/pics/comments/14ika87/john_olivers_advice_in_protesting_maybe_uspez/,Additional-Gift529,John Oliver's advice in protesting: Maybe u/spez will care about that,5314,0.88,422,,1687693605.0,False,False,False,False,False
15,14ih1ec,technology,/r/technology/comments/14ih1ec/american_tiktok_user_data_stored_in_china_video/,callmeteji,"American TikTok user data stored in China, video app admits",10787,0.92,1124,,1687682170.0,False,False,False,False,False
16,14ihh22,starterpacks,/r/starterpacks/comments/14ihh22/getting_the_flu_within_your_first_two_weeks_of/,confidentmilktoast,“Getting the flu within your first two weeks of starting a new job” Starter Pack.,9264,0.95,320,,1687683710.0,False,False,False,False,False
17,14ikwzy,OneOrangeBraincell,/r/OneOrangeBraincell/comments/14ikwzy/neighbors_orange_gets_lost_and_walks_into_our/,RatDitch,Neighbors orange gets lost and walks into our house instead of his own. Frequently.,3940,0.98,79,,1687695621.0,False,False,False,False,False
18,14iit9t,science,/r/science/comments/14iit9t/men_who_perform_just_a_few_minutes_of_strenuous/,Wagamaga,"Men who perform just a few minutes of strenuous exercise are more likely to feel aroused than those who do not work out. Heightened physical responses to exercise, such as elevated heart rate and breathing, lend themselves to an even greater physical response to sexual stimuli.",5765,0.95,205,,1687688520.0,False,False,False,False,False
19,14ijmsa,worldnews,/r/worldnews/comments/14ijmsa/donald_trump_warns_that_if_president_vladimir/,green_flash,"Donald Trump warns that if President Vladimir Putin is overthrown from power, ""unintended consequences"" would follow",5018,0.82,1342,,1687691401.0,False,False,False,False,False
20,14iks9b,oddlysatisfying,/r/oddlysatisfying/comments/14iks9b/steam_of_boiled_corn/,Gh0stDestr0y,Steam of boiled corn,3982,0.95,85,Flair Loading...,1687695197.0,False,False,False,False,False
21,14ifj46,shitposting,/r/shitposting/comments/14ifj46/glory_to_spez/,ligma-joe,Glory to Spez,20194,0.95,154,,1687676793.0,False,False,True,False,False
22,14ijqu7,MadeMeSmile,/r/MadeMeSmile/comments/14ijqu7/i_used_to_tutor_special_needs_kids_in_highschool/,fg10037,I used to tutor special needs kids in highschool and one came to surprise me at work today!,4531,0.93,256,,1687691790.0,False,False,False,False,False
23,14ijcb5,memes,/r/memes/comments/14ijcb5/anything_can_be_medieval_i_guess/,Acomplished_Bacteria,Anything can be medieval I guess,5512,0.98,62,,1687690413.0,False,False,False,False,False
24,14ik7wp,Tinder,/r/Tinder/comments/14ik7wp/am_i_the_crazy_one/,Post-pre-mortem,Am I the crazy one?,3837,0.94,691,,1687693395.0,False,False,False,False,False
25,14ij6c3,rareinsults,/r/rareinsults/comments/14ij6c3/shoutout_my_anaemic_friends/,TheRealCalT,Shoutout My Anaemic Friends,4735,0.96,20,,1687689819.0,False,False,False,False,False
26,14ifpzi,AnimalsBeingDerps,/r/AnimalsBeingDerps/comments/14ifpzi/baby_camel_wants_to_nurse/,jemahAeo,Baby camel wants to nurse,11023,0.96,121,,1687677483.0,False,False,False,False,False
27,14im4tx,ContagiousLaughter,/r/ContagiousLaughter/comments/14im4tx/oh_hi_mom/,colorless_man,oh! hi mom.,2774,0.97,80,,1687699166.0,False,False,False,False,False
28,14igorp,BikiniBottomTwitter,/r/BikiniBottomTwitter/comments/14igorp/this_is_so_true/,BeautifulSwan00,This is so true,7442,0.97,35,,1687680918.0,False,False,False,False,False
29,14iguum,NatureIsFuckingLit,/r/NatureIsFuckingLit/comments/14iguum/furcifer_pardalis_commonly_known_as_the_panther/,therra123,"🔥 Furcifer pardalis, commonly known as the panther chameleon, is primarily found in eastern and northern regions of Madagascar",7000,0.97,124,,1687681519.0,False,False,False,False,False
30,14iinyz,HermanCainAward,/r/HermanCainAward/comments/14iinyz/someone_please_make_it_make_sense/,HotPinkLollyWimple,Someone please make it make sense,4554,0.95,277,Phucked around and Phound out,1687687997.0,False,False,False,False,False
31,14iliu0,mildlyinfuriating,/r/mildlyinfuriating/comments/14iliu0/my_brother_left_his_soda_can_overnight_in_the/,NamTiiddies,My brother left his soda can overnight in the freezer and it exploded and ruined the whole freezer and now I have to clean it cause MeN dOn'T cLeAn,2984,0.87,799,,1687697464.0,False,False,False,False,False
32,14iiptx,PrequelMemes,/r/PrequelMemes/comments/14iiptx/thats_life/,johnlen1n,That's life,4794,0.99,50,Good soldiers follow orders,1687688183.0,False,False,False,False,False
33,14ih3ce,HumansAreMetal,/r/HumansAreMetal/comments/14ih3ce/theresa_kachindamoto_saving_the_children/,bislut997,Theresa Kachindamoto saving the children,5908,0.95,89,,1687682365.0,False,False,False,False,False
34,14id129,funny,/r/funny/comments/14id129/shaq_pancake_art/,FlippinArtDude,Shaq pancake art,23041,0.92,301,,1687668234.0,False,False,False,False,False
35,14im6r5,antiwork,/r/antiwork/comments/14im6r5/very_weird/,Monsur_Ausuhnom,Very Weird.,2321,0.99,73,,1687699317.0,False,False,False,False,False
36,14idjrl,BeAmazed,/r/BeAmazed/comments/14idjrl/amazing_octopus_stretching_its_tentacles_to_form/,XahidX,Amazing Octopus stretching its tentacles to form a huge balloon,16497,0.97,474,,1687669967.0,False,False,False,False,False
37,14idvya,TikTokCringe,/r/TikTokCringe/comments/14idvya/stone_fish_venom/,Sylas1987,Stone fish venom,14816,0.95,772,,1687671104.0,False,False,False,False,False
38,14il0ce,ProgrammerHumor,/r/ProgrammerHumor/comments/14il0ce/networkingstarterpack/,VitaminnCPP,networkingStarterPack,2622,0.94,56,:cp:,1687695910.0,False,False,False,False,False
39,14ih308,facepalm,/r/facepalm/comments/14ih308/society_explained_in_29_seconds/,stiffspectacls,Society explained in 29 seconds,29502,0.96,788,,1687682331.0,False,False,False,False,False
40,14id1l7,NonPoliticalTwitter,/r/NonPoliticalTwitter/comments/14id1l7/how_true_is_this/,lhomme21,How true is this,16490,0.93,660,:blue1::blue2::1111::1112:,1687668289.0,False,False,False,False,False
41,14idq5f,clevercomebacks,/r/clevercomebacks/comments/14idq5f/stealing_is_wrong/,Evermoreunlive52,Stealing is wrong?,12186,0.96,85,,1687670572.0,False,False,False,False,False
42,14iixc1,wholesomememes,/r/wholesomememes/comments/14iixc1/i_am_the_streets/,esberat,I am the streets.,3243,0.97,24,,1687688932.0,False,False,False,False,False
43,14ie1xe,lotrmemes,/r/lotrmemes/comments/14ie1xe/one_does_not_simply_assume_a_game_is_a_cash_grab/,BJ_Beamz,One does not simply assume a game is a cash grab,10173,0.95,351,Grond,1687671656.0,False,False,False,False,False
44,14ibngc,news,/r/news/comments/14ibngc/south_carolina_fire_chief_who_pointed_gun_at/,Molire,South Carolina fire chief who pointed gun at teens who turned in his driveway is being sued,17312,0.96,579,,1687663762.0,False,False,False,False,False
45,14iid1n,movies,/r/movies/comments/14iid1n/comiccon_crisis_marvel_netflix_sony_hbo_and/,tylerthe-theatre,"Comic-Con Crisis: Marvel, Netflix, Sony, HBO and Universal to Skip SDCC as Fest Faces Another Existential Threat",3388,0.9,372,,1687686911.0,False,False,False,False,False
46,14ilsou,MurderedByWords,/r/MurderedByWords/comments/14ilsou/murdered_by_the_cops/,Multiplybead97,Murdered by the cops,1905,0.97,28,,1687698228.0,False,False,False,False,False
47,14il94v,GreenAndPleasant,/r/GreenAndPleasant/comments/14il94v/1000_percent_this/,HankScorpio42,1000 percent this,1910,0.94,68,,1687696656.0,False,False,False,False,False
48,14igcbf,WorkReform,/r/WorkReform/comments/14igcbf/based_on_a_true_story/,HumorousHelper,Based on a true story,4613,0.98,58,,1687679734.0,False,False,False,False,False
49,14ifvr8,meirl,/r/meirl/comments/14ifvr8/meirl/,LateRendition,Meirl,5713,0.96,333,,1687678071.0,False,False,False,False,False
50,14iilft,UkraineWarVideoReport,/r/UkraineWarVideoReport/comments/14iilft/the_russian_army_special_unit_storm_z_which/,CatsofUkraine,"The Russian Army special unit ""Storm Z,"" which supported Wagner Group CEO Prigozhin in yesterday's attempted coup d'état against Russian President Vladimir Putin, is a little dismayed that Prigozhin abandoned them.",2974,0.97,287,,1687687746.0,False,False,False,False,False
51,14ifz75,natureismetal,/r/natureismetal/comments/14ifz75/in_finland_temperature_gets_as_low_as_40c_in/,bislut997,"In Finland temperature gets as low as -40C in winter, the trees are covered in so much snow and frost that it looks like landscape from another planet",4885,0.95,134,,1687678430.0,False,False,False,False,False
52,14ii258,ich_iel,/r/ich_iel/comments/14ii258/ich_iel/,hypefor8wasjustabait,ich_iel,3377,0.95,90,,1687685809.0,True,False,False,False,False
53,14ih98r,ImTheMainCharacter,/r/ImTheMainCharacter/comments/14ih98r/yeah_lets_just_be_thr_most_annoying_people_at_the/,Snake_Plissken224,"Yeah, let's just be thr most annoying people at the home depot....",3756,0.89,474,,1687682946.0,False,False,False,False,False
54,14igawl,Animemes,/r/Animemes/comments/14igawl/netflix_one_piece_new_cast_reveal/,SmokingBouquets,Netflix One Piece new cast reveal,4760,0.94,74,,1687679591.0,False,False,False,False,False
55,14ij9l0,CombatFootage,/r/CombatFootage/comments/14ij9l0/translated_disbandment_of_the_57th_motorized/,CatsofUkraine,Translated: Disbandment of the 57th motorized rifle brigade of the Russian Federation. The publication of some details of yesterday's operation Go-Pro video of soldiers of the 1st company of the 1st mechanized battalion of the Third Assault Brigade.,2456,0.96,153,,1687690146.0,False,False,False,False,False
56,14iivk2,OnePunchMan,/r/OnePunchMan/comments/14iivk2/went_to_a_convention_and_this_happened/,ghoubi,Went to a convention and this happened....,2677,0.94,86,,1687688754.0,False,False,False,False,False
57,14ihzke,insanepeoplefacebook,/r/insanepeoplefacebook/comments/14ihzke/a_bakerys_evaluation/,SnowWarms,A bakery's evaluation...,2961,0.97,101,,1687685543.0,False,False,False,False,False
58,14iiicp,Whatcouldgowrong,/r/Whatcouldgowrong/comments/14iiicp/taking_your_child_to_soft_play/,saboteur2011,Taking your child to soft play,2675,0.92,83,,1687687419.0,False,False,False,False,False
59,14imewq,ukraine,/r/ukraine/comments/14imewq/the_russians_dropped_a_prohibited_asphyxiating/,TotalSpaceNut,"The russians dropped a prohibited asphyxiating aerosol ammunition on one of the positions of the Armed Forces of Ukraine. However, the wind was blowing towards the enemy",1409,0.98,66,,1687699969.0,False,False,False,False,False
60,14ikax0,shittymoviedetails,/r/shittymoviedetails/comments/14ikax0/in_oppenheimer_2023_oppenheimer_looks_miserable/,Xxstevefromminecraft,In Oppenheimer (2023) Oppenheimer looks miserable in every poster and Screen-cap he’s in. This is probably due to the fact he built fucking bombs that killed thousands of people,1934,0.95,73,,1687693674.0,False,False,False,False,False
61,14igs3u,MemeVideos,/r/MemeVideos/comments/14igs3u/_/,Naymar083,🧊️ 👍,4113,0.94,71,,1687681249.0,False,False,False,False,False
62,14iez5a,aww,/r/aww/comments/14iez5a/the_way_my_cat_gets_into_the_narrowest_place_in/,marehori,The way my cat gets into the narrowest place in the house (with John's reaction) [OC],5167,0.92,63,,1687674851.0,False,False,False,False,True
63,14iepeb,WhitePeopleTwitter,/r/WhitePeopleTwitter/comments/14iepeb/the_new_predator_movie_just_dropped/,rhodesleadnowhere,The new predator movie just dropped,27574,0.91,1172,,1687673916.0,False,False,False,False,False
64,14ihtj9,ireland,/r/ireland/comments/14ihtj9/have_you_already_watch_philomena_cunk_lol/,XCEREALXKILLERX,Have you already watch Philomena Cunk? Lol,2872,0.93,230,Dublin,1687684932.0,False,False,False,False,False
65,14ik5qa,OldSchoolCool,/r/OldSchoolCool/comments/14ik5qa/mark_hamill_and_annie_potts_on_the_set_of/,MilagrsGerra,"Mark Hamill and Annie Potts on the set of 'Corvette Summer', 1978",1858,0.97,116,,1687693192.0,False,False,False,False,False
66,14iasvz,RandomThoughts,/r/RandomThoughts/comments/14iasvz/do_u_ever_feel_kinda_compelled_to_write_ur/,chesnutpraline,do u ever feel kinda compelled to write ur opinion in a comment but then get kinda tired while writing it and give up after deciding u dont really care enough in the moment to comment and erase it?,17139,0.91,1844,,1687661058.0,False,False,False,False,False
67,14ikcjw,CasualUK,/r/CasualUK/comments/14ikcjw/id_like_to_share_this_absolutely_banging_bargain/,borderlinebaggage,I’d like to share this absolutely banging bargain I just got from a British heart foundation charity shop. Full leather recliner for £5. I feel like I’ve won the lottery,1739,0.97,231,,1687693828.0,False,False,False,False,False
68,14ibf9l,cats,/r/cats/comments/14ibf9l/can_someone_explain_to_me_why_my_cat_will_just/,takeaabreath,Can someone explain to me why my cat will just sit and stare at me for minutes at a time? What does this mean in a cat’s world?,11830,0.97,961,,1687663019.0,False,False,False,False,False
69,14ig2yb,FunnyandSad,/r/FunnyandSad/comments/14ig2yb/uber_is_a_better_choice/,CuteAngryGirl,Uber is a better choice,3745,0.95,105,,1687678795.0,False,False,False,False,False
70,14iht5d,Rabbits,/r/Rabbits/comments/14iht5d/we_let_our_widowed_bun_choose_a_new_wife_turns/,Epiphany7777,"We let our widowed bun choose a new wife, turns out he likes big ladies!",2679,0.97,53,:dol:,1687684892.0,False,False,False,False,False
71,14ijm56,marvelstudios,/r/marvelstudios/comments/14ijm56/mcu_moments_that_will_always_make_you_cheer/,TheJack0fDiamonds,MCU moments that will always make you cheer everytime you see it,1921,0.8,433,Scarlet Witch,1687691335.0,False,False,False,False,False
72,14imbrw,discordVideos,/r/discordVideos/comments/14imbrw/imma_finna_go_to_hell/,Boddup,Imma finna go to hell,1288,0.92,76,,1687699729.0,False,False,False,False,False
73,14ikaun,Genshin_Impact,/r/Genshin_Impact/comments/14ikaun/sisters/,2bells1ravine,Sisters,1670,0.97,26,,1687693667.0,False,False,False,False,False
74,14imbtk,MadeMeSmile,/r/MadeMeSmile/comments/14imbtk/courteous_elephant_picking_up_trash/,RunKind4141,Courteous Elephant Picking Up Trash,2776,0.99,56,,1687699732.0,False,False,False,False,False
75,14ikxgr,lgbt,/r/lgbt/comments/14ikxgr/i_just_remembered_that_bit_from_high_school_that/,Twighdark,"I just remembered that bit from High School. That woman was great, really strict, but just a cool human.",1525,0.98,31,:lesbian:/:grace-flag:/:Demigirl-flag:  Lesbian-Grace-demigirl,1687695659.0,False,False,False,False,False
76,14ijwq2,EarthPorn,/r/EarthPorn/comments/14ijwq2/snapped_this_on_a_open_door_helicopter_ride/,ronhairabx,Snapped this on a open door helicopter ride through the Nā Pali Coast yesterday. [OC] [1920x1080],1751,0.97,28,,1687692339.0,False,False,False,False,False
77,14id4ee,UpliftingNews,/r/UpliftingNews/comments/14id4ee/most_unionized_us_rail_workers_now_have_new_sick/,Karmanacht,Most unionized US rail workers now have new sick leave,6349,0.96,282,,1687668559.0,False,False,False,False,False
78,14i9cd2,gaming,/r/gaming/comments/14i9cd2/good_or_bad_games_it_doesnt_matter_i_have_massive/,Modo97,"Good or bad games? it doesn't matter, I have massive respect for games that still support Split-Screen ❤️",29055,0.9,970,,1687656612.0,False,False,False,False,False
79,14iln2o,Damnthatsinteresting,/r/Damnthatsinteresting/comments/14iln2o/sorvagsvatn_the_lake_that_hangs_over_the_ocean/,Realistic-Song-199,"Sorvagsvatn, the lake that hangs over the ocean. Faroe islands.",2960,0.97,101,,1687697800.0,False,False,False,False,False
80,14ihxq6,meme,/r/meme/comments/14ihxq6/sir_yes_sir_i_dont_know_sir/,Hambruhgah,"Sir, yes sir. I don't know, sir",2567,0.98,17,,1687685369.0,False,False,False,False,False
81,14id7jw,Superstonk,/r/Superstonk/comments/14id7jw/why_i_love_this_company/,GinoF2020,Why I love this company,7557,0.91,169,,1687668859.0,False,False,False,False,False
82,14ibjba,Weird,/r/Weird/comments/14ibjba/opened_a_can_of_peaches_and_they_were_black_and/,Elly_frog,opened a can of peaches and they were black and smelt like fish??,11351,0.91,2592,,1687663376.0,False,False,False,False,False
83,14iawpv,oddlyterrifying,/r/oddlyterrifying/comments/14iawpv/pet_king_cobra_gets_angry_at_owner/,RIPStengel,Pet king cobra gets angry at owner.,14651,0.93,599,,1687661397.0,False,False,False,False,False
84,14iivjn,trippinthroughtime,/r/trippinthroughtime/comments/14iivjn/what_a_great_diplomat/,esberat,What a great diplomat.,2034,0.95,3,,1687688753.0,False,False,False,False,False
85,14ic6sh,HumansBeingBros,/r/HumansBeingBros/comments/14ic6sh/a_spooked_horse_found_itself_stuck_in_a_swimming/,alanboston,A spooked horse found itself stuck in a swimming pool in Florida. The county's fire rescue team jumped into action,8008,0.93,279,,1687665508.0,False,False,False,False,False
86,14iho3b,Hololive,/r/Hololive/comments/14iho3b/rack_to_the_future/,V-Faction,Rack to the Future,2614,0.95,43,:AkiRose::Amelia::Nene::Polka::Haato:,1687684384.0,False,False,False,False,False
87,14ilmcu,WitchesVsPatriarchy,/r/WitchesVsPatriarchy/comments/14ilmcu/you_were_built_for_pleasure/,polkadotska,You were built for pleasure!,1266,0.96,16,✨Glitter Witch✨:kakuma:,1687697742.0,False,False,False,False,False
88,14imbbo,formuladank,/r/formuladank/comments/14imbbo/totally_unbiased_opinion_from_lh44tobeyy_f1/,biryani-man,Totally unbiased opinion from LH44Tobeyy. F1 twitter is undefeated.,1166,0.93,158,BWOAHHHHHHH ,1687699694.0,False,False,False,False,False
89,14igtsr,nextfuckinglevel,/r/nextfuckinglevel/comments/14igtsr/artist_creating_perspective_art/,Siil_Udus,Artist creating perspective art,7428,0.95,107,,1687681411.0,False,False,False,False,False
90,14ijvop,maybemaybemaybe,/r/maybemaybemaybe/comments/14ijvop/maybe_maybe_maybe/,GeneralAlex,Maybe Maybe Maybe,1651,0.97,33,,1687692245.0,False,False,False,False,False
91,14idjlv,ThatsInsane,/r/ThatsInsane/comments/14idjlv/stone_fish_venom/,Sylas1987,Stone fish venom,5413,0.95,211,,1687669949.0,False,False,False,False,False
92,14ifqd4,terriblefacebookmemes,/r/terriblefacebookmemes/comments/14ifqd4/my_uncle_posted_this/,SmokyDoky876,My uncle posted this,3623,0.92,190,,1687677523.0,False,False,False,False,False
93,14igx0r,MoldyMemes,/r/MoldyMemes/comments/14igx0r/yeah_i_play_genshin_impact/,shitpostH0F,“Yeah I play Genshin Impact”,2909,0.95,71,,1687681735.0,False,False,False,False,False
94,14iiq0e,anime_irl,/r/anime_irl/comments/14iiq0e/anime_irl/,the__daydream,ANIME_IRL,1947,0.99,64,,1687688201.0,False,False,False,False,False
95,14ijtoc,tifu,/r/tifu/comments/14ijtoc/tifu_by_calling_out_another_mans_name_while_i/,Expensive_highland,TIFU by calling out another man’s name while I slept,1565,0.91,383,,1687692058.0,False,False,False,False,False
96,14ik9ww,WhatsWrongWithYourCat,/r/WhatsWrongWithYourCat/comments/14ik9ww/tasty_water_mmmm/,evahotie,Tasty water mmmm,1451,0.98,20,,1687693577.0,False,False,False,False,False
97,14iia92,todayilearned,/r/todayilearned/comments/14iia92/til_about_bill_benter_a_gambler_who_wrote_an/,autumn-knight,"TIL about Bill Benter, a gambler who wrote an algorithm that helped him win nearly $1 billion on horse races.",4667,0.98,144,,1687686631.0,False,False,False,False,False
98,14ilan2,oddlyspecific,/r/oddlyspecific/comments/14ilan2/thats_a_lot_of_dicks/,Mammoth-Medicine1385,That’s a lot of dicks,1208,0.93,119,,1687696795.0,True,False,False,False,False
99,14icv54,antiwork,/r/antiwork/comments/14icv54/and_this_is_why_there_is_a_rush_to_get_us_back_in/,Vdaniels1,And this is why there is a rush to get us back in the office,21611,0.94,1734,,1687667684.0,False,False,False,False,False
100,14i8cnl,wallstreetbets,/r/wallstreetbets/comments/14i8cnl/found_my_new_side_hustle/,rylar,found my new side hustle,18115,0.95,261,Supports a 🅱️arfield Ethnostate :Barfield:,1687653638.0,False,False,False,False,False
