rank,id,subreddit,permalink,author,title,score,upvote_ratio,num_comments,author_flair_text,created_utc,over_18,edited,stickied,locked,is_original_content
1,14m68p7,WhitePeopleTwitter,/r/WhitePeopleTwitter/comments/14m68p7/i_do_not_understand_the_endgame/,ozmune,I do not understand the endgame.,21631,0.95,735,,1688048366.0,False,False,False,False,False
2,14m4x36,facepalm,/r/facepalm/comments/14m4x36/dumdum_spotted/,anantzzz,Dum-dum spotted,29945,0.96,2041,,1688044947.0,False,False,False,False,False
3,14m61u8,news,/r/news/comments/14m61u8/supreme_court_rules_against_affirmative_action/,chewymouse,Supreme Court Rules Against Affirmative Action,14130,0.95,5864,,1688047885.0,False,False,False,False,False
4,14m4uxk,oddlysatisfying,/r/oddlysatisfying/comments/14m4uxk/worker_painting_a_wooden_toy/,yourSAS,Worker painting a wooden toy,17271,0.91,534,,1688044797.0,False,False,False,False,False
5,14m3hwh,MadeMeSmile,/r/MadeMeSmile/comments/14m3hwh/relax/,ff-dvl,Relax ,28375,0.95,429,,1688041030.0,False,False,False,False,False
6,14m37ix,politics,/r/politics/comments/14m37ix/ron_desantis_the_worst_candidate_ive_ever/,BelleAriel,"Ron DeSantis the ""worst candidate I've ever seen""—Former GOP strategist",21621,0.92,1608,,1688040200.0,False,False,False,False,False
7,14m57b7,therewasanattempt,/r/therewasanattempt/comments/14m57b7/to_heckle_a_comic/,kazumicortez,to heckle a comic,11397,0.93,412,,1688045679.0,False,False,False,False,False
8,14m5hy3,tumblr,/r/tumblr/comments/14m5hy3/young_ben_shapiro_vs_elon_musk_death_battle/,Sonic_the_hedgedog,Young Ben Shapiro vs. Elon Musk Death Battle,9017,0.95,285,,1688046469.0,False,False,False,False,False
9,14m4nxo,lotrmemes,/r/lotrmemes/comments/14m4nxo/coincidence_i_think_not/,Alternative_Serve368,Coincidence i think not,10546,0.92,165,,1688044263.0,False,False,False,False,False
10,14m7tzs,cursedcomments,/r/cursedcomments/comments/14m7tzs/cursed_cap/,animesh__zlatan,Cursed_cap,8486,0.97,281,,1688052229.0,False,False,False,False,False
11,14m2vbp,PublicFreakout,/r/PublicFreakout/comments/14m2vbp/a_passenger_airdropped_a_bomb_threat_to_everyone/,Bihema,A passenger airdropped a bomb threat to everyone on the plane.,15210,0.96,1975,,1688039164.0,False,False,False,False,False
12,14m3hjj,marvelmemes,/r/marvelmemes/comments/14m3hjj/sounds_like_a_good_idea/,UnpleasantRhinoceros,Sounds like a good idea,13933,0.97,81,Avengers,1688041001.0,False,False,False,False,False
13,14m55ih,TikTokCringe,/r/TikTokCringe/comments/14m55ih/on_bathrooms/,thatguy9684736255,On bathrooms,7589,0.94,400,,1688045549.0,False,False,False,False,False
14,14m58i0,BlackPeopleTwitter,/r/BlackPeopleTwitter/comments/14m58i0/eat_the_rich_including_the_ones_that_look_like_us/,NYstate,"Eat the rich, including the ones that look like us",6583,0.96,389,☑️,1688045763.0,False,False,False,False,False
15,14m6x3g,PeopleFuckingDying,/r/PeopleFuckingDying/comments/14m6x3g/fuzzy_noodle_is_waterboarded_and_tortured/,QuicklyThisWay,FuZzY nOOdLE iS wAtErBoArDed aNd tOrTuReD,5273,0.97,146,,1688050044.0,False,False,False,False,False
16,14m41f6,IASIP,/r/IASIP/comments/14m41f6/i_dont_know_this_i_do_not_know_this_one/,awesomedan24,I don't know this. I do not know this one...,7554,0.97,168,,1688042552.0,False,False,False,False,False
17,14m3axm,funny,/r/funny/comments/14m3axm/and_just_like_that_a_serial_killer_is_born/,Competitive-Ad1183,And just like that a serial killer is born,8422,0.92,308,,1688040464.0,False,False,False,False,False
18,14m0o19,BrandNewSentence,/r/BrandNewSentence/comments/14m0o19/youtuber_denies_grooming_allegations_in_lengthy/,mitcheg3k,Youtuber denies grooming allegations in lengthy ukelele video,26289,0.95,1338,,1688031930.0,False,False,False,False,False
19,14m06lc,todayilearned,/r/todayilearned/comments/14m06lc/til_according_to_international_space_law_space_is/,dustofoblivion123,"TIL according to international space law, space is defined as common heritage of humanity, which makes territorial claims in space prohibited. The main purposes of this law are to prevent colonial claims and militarization of space.",24639,0.95,1318,,1688030274.0,False,False,False,False,False
20,14m394p,freefromwork,/r/freefromwork/comments/14m394p/biden_is_gonna_raise_my_taxes/,MarisaNeill,BiDeN iS gOnNa RaIsE mY tAxEs,7804,0.95,152,,1688040324.0,False,False,False,False,False
21,14m8hu1,WhitePeopleTwitter,/r/WhitePeopleTwitter/comments/14m8hu1/honestly_he_looks_like_he_would_skin_a_dude_and/,jociol,Honestly he looks like he would skin a dude and wear the skin to pretend to be him,8351,0.97,315,,1688053784.0,False,False,False,False,False
22,14m61ci,WTF,/r/WTF/comments/14m61ci/filed_under_not_my_job/,l0p29p0tdg,Filed under Not My Job.,4827,0.96,152,,1688047851.0,False,False,False,False,False
23,14m29r1,comics,/r/comics/comments/14m29r1/freedom/,Pizzacakecomic,Freedom!,29360,0.71,2229,PizzaCake,1688037293.0,False,False,False,False,True
24,14m34ua,worldnews,/r/worldnews/comments/14m34ua/new_zealand_bans_thin_plastic_fruit_and_vegetable/,newnemo,New Zealand bans thin plastic fruit and vegetable bags in world first | The ban is expected to reduce the use of 150 million bags a year,7368,0.97,388,,1688040004.0,False,False,False,False,False
25,14m6f1m,tifu,/r/tifu/comments/14m6f1m/tifu_by_cracking_a_joke_at_my_wifes_doctor/,I-Am-Disturbed,TIFU by cracking a joke at my wife’s doctor appointment.,4505,0.91,152,,1688048801.0,True,False,False,False,False
26,14m3joz,mildlyinfuriating,/r/mildlyinfuriating/comments/14m3joz/i_cant_finnish_half_of_my_large_5_caramel/,Kwaakku,"I can't finnish half of my large 5€ caramel frappuchino, since these cardboard straws just break in use.",10661,0.77,2962,,1688041175.0,False,False,False,False,False
27,14m2kji,nextfuckinglevel,/r/nextfuckinglevel/comments/14m2kji/any_archery_lovers/,singhsnehal,Any archery lovers?,10384,0.83,751,,1688038244.0,False,False,False,False,False
28,14m5zil,CrazyFuckingVideos,/r/CrazyFuckingVideos/comments/14m5zil/carnival_ride_plunges_50_feet_to_the_ground_in/,LuNoZzy,Carnival ride plunges 50 feet to the ground in India,4467,0.95,376,,1688047726.0,True,False,False,False,False
29,14m5d2e,Damnthatsinteresting,/r/Damnthatsinteresting/comments/14m5d2e/william_james_sidis_was_a_mathematical_genius/,Rit832144,"William James Sidis was a mathematical genius. With an IQ of 250 to 300. He read the New York Times at 18 months, wrote French poetry at 5 years old, spoke 8 languages at 6 years old, and enrolled at Harvard at 11.",5258,0.93,313,,1688046101.0,False,False,False,False,False
30,14m0y4d,antiwork,/r/antiwork/comments/14m0y4d/nearly_1_in_5_workers_are_loud_quitting_at_their/,ThrowsiesAway4Life,"Nearly 1 in 5 workers are 'loud quitting' at their jobs, a new Gallup poll says — and it's way more extreme than 'quiet quitting'",10700,0.94,1048,,1688032911.0,False,False,False,False,False
31,14m02nz,PrequelMemes,/r/PrequelMemes/comments/14m02nz/podracing/,QuantumDonuts257,Podracing,16425,0.96,250,Rebel Legion,1688029895.0,False,False,False,False,False
32,14m78hg,dankmemes,/r/dankmemes/comments/14m78hg/math_doesnt_add_up/,Ajawad87,Math doesn’t add up,3702,0.95,96,:kesha_port: :kp1::kp2::kp3:’s Favorite MayMay :maymay:,1688050806.0,False,False,False,False,False
33,14m5ckv,movies,/r/movies/comments/14m5ckv/its_always_sunny_in_philadelphia_star_charlie/,Chemical-Ad-2694,‘It’s Always Sunny in Philadelphia’ Star Charlie Day’s Directorial Debut ‘Fool’s Paradise’ Snapped Up by Signature Entertainment (EXCLUSIVE),4178,0.92,483,,1688046067.0,False,False,False,False,False
34,14m819f,AnimalsBeingDerps,/r/AnimalsBeingDerps/comments/14m819f/please_can_i_have_one_little_lick/,5krunner,Please can I have one little lick?,2788,0.96,26,,1688052692.0,False,False,False,False,False
35,14m291n,rareinsults,/r/rareinsults/comments/14m291n/battle_of_cultures/,MsSeraphim,battle of cultures,6706,0.96,50,,1688037225.0,False,False,False,False,False
36,14m0c7s,LateStageCapitalism,/r/LateStageCapitalism/comments/14m0c7s/dont_know_if_this_was_posted_already/,jolurove,Don’t know if this was posted already,9801,0.96,503,,1688030824.0,False,False,False,False,False
37,14m5y1i,AskReddit,/r/AskReddit/comments/14m5y1i/if_it_came_out_that_we_were_100_living_in_a/,DawsonD43,"If it came out that we were 100% living in a simulation, what would be the biggest indicator looking back?",3558,0.93,2766,,1688047612.0,False,False,False,False,False
38,14m6ax8,LeopardsAteMyFace,/r/LeopardsAteMyFace/comments/14m6ax8/ron_desantis_vetoes_popular_criminal_justice_bill/,orijing,Ron DeSantis vetoes popular criminal justice bill sponsored by Republican house member who endorsed DeSantis for president,3184,0.96,159,,1688048514.0,False,False,False,False,False
39,14lyzhp,clevercomebacks,/r/clevercomebacks/comments/14lyzhp/hes_really_not_wrong_though/,Stoner4s3,He's really not wrong though,16988,0.95,320,,1688026098.0,False,False,False,False,False
40,14lys7o,BeAmazed,/r/BeAmazed/comments/14lys7o/craftsmen_have_created_the_lowest_car_in_the_world/,steady_as_a_rock,Craftsmen have created the lowest car in the world.,29513,0.87,1210,,1688025392.0,False,False,False,False,False
41,14m5ano,Steam,/r/Steam/comments/14m5ano/valve_is_banning_games_with_ai_generated_assets/,tanku2222,Valve is banning games with AI generated assets.,3610,0.89,470,,1688045924.0,False,False,False,False,False
42,14m1jsa,CrappyDesign,/r/CrappyDesign/comments/14m1jsa/architect_so_how_many_windows_we_thinking_client/,Any-Classic-5733,Architect: So how many windows we thinking? Client: Yes,6452,0.95,458,,1688034952.0,False,False,False,False,False
43,14m55rd,facepalm,/r/facepalm/comments/14m55rd/what/,AndyNotAndi,What?,9946,0.98,605,,1688045568.0,False,False,False,False,False
44,14m4ggf,ask,/r/ask/comments/14m4ggf/what_is_something_you_can_say_im_with_the_boomers/,AnitaVodkasoda,"What is something you can say ""I'm with the boomers on this one"" about?",4042,0.89,3177,,1688043713.0,False,False,False,False,False
45,14m345i,MadeMeSmile,/r/MadeMeSmile/comments/14m345i/this_cops_reaction_to_being_dispatched_on_this/,VariousBasket125,This cops reaction to being dispatched on this 911 call ,15093,0.97,283,,1688039943.0,False,False,False,False,False
46,14m36vx,popculturechat,/r/popculturechat/comments/14m36vx/angelina_jolie_and_her_son_maddox/,Ok-Doubt6658,"Angelina Jolie and her son, Maddox.",4571,0.91,261,,1688040151.0,False,False,False,False,False
47,14ly8hf,SipsTea,/r/SipsTea/comments/14ly8hf/its_pretty_decent_tbh/,UnconfirmedCatholic,It's pretty decent tbh.,20519,0.95,485,,1688023374.0,False,False,False,False,False
48,14lylvw,memes,/r/memes/comments/14lylvw/medieval_disease/,Lightning-11,Medieval disease,25799,0.92,238,Medieval Meme Lord,1688024731.0,False,False,False,False,False
49,14m9w56,nba,/r/nba/comments/14m9w56/haynes_nba_star_kyrie_irving_intends_to_meet_with/,Michael_B_Lopez,"[Haynes] NBA star Kyrie Irving intends to meet with the Phoenix Suns when the free agency period begins on June 30, league sources tell @NBAonTNT, @BleacherReport.",1776,0.97,800,:gsw-1: Warriors,1688057110.0,False,False,False,False,False
50,14m24bh,NatureIsFuckingLit,/r/NatureIsFuckingLit/comments/14m24bh/ants_carrying_a_giant_spider_away/,VeryDrunkFish,🔥Ants carrying a giant spider away,5089,0.95,182,,1688036798.0,False,False,False,False,False
51,14m6j3b,AmItheAsshole,/r/AmItheAsshole/comments/14m6j3b/aita_for_being_loud_at_a_campsite_with_boy_scout/,JoeyMooyay,AITA for being loud at a campsite with Boy Scout neighbors?,2665,0.86,1403,,1688049074.0,False,1688052044.0,False,False,False
52,14lxfbe,wholesomememes,/r/wholesomememes/comments/14lxfbe/how_wholesome/,easilyBind59,How wholesome.,28698,0.92,522,,1688020588.0,False,False,False,False,False
53,14m02oj,WinStupidPrizes,/r/WinStupidPrizes/comments/14m02oj/guy_tries_to_assualt_bus_driver/,flunghigh,guy tries to assualt bus driver,8201,0.93,601,,1688029896.0,False,False,False,False,False
54,14m1qtj,Grimdank,/r/Grimdank/comments/14m1qtj/i_didnt_say_anything_about_eldar_plotlines/,WantToKnowIfISurvive,I didn't say anything about Eldar plotlines.,5466,0.96,246,,1688035616.0,False,False,False,False,False
55,14m6jhb,PoliticalCompassMemes,/r/PoliticalCompassMemes/comments/14m6jhb/compass_reacts_to_the_end_of_affirmative_action/,ThePurpleNavi,Compass reacts to the end of affirmative action,2500,0.89,647,:right: - Right,1688049099.0,False,False,False,False,False
56,14m2ovv,cursedcomments,/r/cursedcomments/comments/14m2ovv/cursed_honeybee_sting/,Mr_BirchrWasntTaken,Cursed_honeybee sting,20406,0.94,200,,1688038618.0,False,False,False,False,False
57,14m40rj,atheism,/r/atheism/comments/14m40rj/ffrf_demands_colorado_school_district_ban_the/,mepper,"FFRF demands Colorado school district ban the Bible after Christian Nationalist group got the district to ban books for sex and violence. ""Religious zealots can’t scour books looking for sexual references or content to offend them...then say the obscenity in the Bible must be judged differently""",3444,0.97,78,agnostic atheist,1688042500.0,False,False,False,False,False
58,14lze63,shitposting,/r/shitposting/comments/14lze63/glory_to_spez/,RandomDude420-_-,Glory to spez,17941,0.89,119,,1688027558.0,False,False,False,False,False
59,14m07tz,CasualUK,/r/CasualUK/comments/14m07tz/wtf_the_rental_agent_said_this_is_a_great/,No_Yak_3436,WTF? The rental agent said this is a great bathroom. WTF is wrong with these morons? I’m average height by the way.,6742,0.96,652,,1688030399.0,False,False,False,False,False
60,14m0qz6,news,/r/news/comments/14m0qz6/bill_cosby_sued_by_9_more_women_in_nevada_for/,antihostile,Bill Cosby sued by 9 more women in Nevada for alleged decades-old sexual assaults,18789,0.95,777,,1688032219.0,False,False,False,False,False
61,14m66ir,trees,/r/trees/comments/14m66ir/it_is_what_it_is/,jake1080,It is what it is,2403,0.97,80,,1688048210.0,False,False,False,False,False
62,14m5f6q,Animemes,/r/Animemes/comments/14m5f6q/poor_kid/,Lisanro,poor kid,2782,0.96,130,,1688046263.0,False,False,False,False,False
63,14m16xn,meirl,/r/meirl/comments/14m16xn/meirl/,SureSmella,Meirl,5963,0.97,122,,1688033729.0,False,False,False,False,False
64,14m0cmd,anime_irl,/r/anime_irl/comments/14m0cmd/anime_irl/,History_DoT,anime_irl,7016,0.93,188,,1688030863.0,False,False,False,False,False
65,14m3nfw,cats,/r/cats/comments/14m3nfw/personal_space/,Shalayyy1990,Personal space?,3422,0.97,293,,1688041463.0,False,False,False,False,False
66,14m56b3,gifs,/r/gifs/comments/14m56b3/john_oliver_teabagging_uspez/,Juntayuy,John Oliver teabagging u/spez,2849,0.75,171,,1688045606.0,True,False,False,False,False
67,14m01on,technicallythetruth,/r/technicallythetruth/comments/14m01on/who_would_have_thought/,Xiaret,Who would have thought ?,6876,0.97,43,,1688029807.0,False,False,False,False,False
68,14m1hpj,whenthe,/r/whenthe/comments/14m1hpj/me_staring_at_the_screen_and_doing_anything_other/,SirShadyVI,me staring at the screen and doing anything other than opening the game,5163,0.98,74,local touhou poster (moriya shrine's #1 conspirator),1688034755.0,False,False,False,False,False
69,14m79wu,oddlyterrifying,/r/oddlyterrifying/comments/14m79wu/abdandoned_houses_porch_looks_like_a_mouth_with/,allthecoffeesDP,Abdandoned house's porch looks like a mouth with fangs,1908,0.97,74,,1688050880.0,False,False,False,False,False
70,14lzhdk,Tinder,/r/Tinder/comments/14lzhdk/first_time_ive_been_turned_down_due_to_my_height/,One_Telephone_9227,"First time I’ve been turned down due to my height, and I won’t lie it doesn’t feel good lol",7046,0.95,1618,,1688027870.0,False,False,False,False,False
71,14m3pwe,Hololive,/r/Hololive/comments/14m3pwe/i_worked_on_the_hololive_summer_2023_teaser/,kanauru,I worked on the Hololive Summer 2023 Teaser!,3108,0.95,49,,1688041664.0,False,False,False,False,False
72,14m51xa,funny,/r/funny/comments/14m51xa/big_daddy_in_god_of_war/,Ishnuporah,Big Daddy in God of War,4997,0.95,102,eli_handle_b․wav,1688045301.0,False,False,False,False,False
73,14m3eak,maybemaybemaybe,/r/maybemaybemaybe/comments/14m3eak/maybe_maybe_maybe/,ff-dvl,Maybe Maybe Maybe,3145,0.92,183,,1688040746.0,False,False,False,False,False
74,14m63wz,LeagueOfMemes,/r/LeagueOfMemes/comments/14m63wz/they_gave_her_ultimate_tier_to_milk_rp_out_of/,octobersveryown616,They gave her ultimate tier to milk rp out of samira mains,2131,0.96,113,,1688048035.0,False,False,False,False,False
75,14m5a9k,StarWars,/r/StarWars/comments/14m5a9k/why_were_the_stormtroopers_riding_dewbacks_on/,Dragonic_Overlord_,Why were the Stormtroopers riding Dewbacks on Tatooine instead of using speeders?,2316,0.96,616,Jedi,1688045896.0,False,False,False,False,False
76,14m5k1q,lego,/r/lego/comments/14m5k1q/found_dozens_of_og_bionicles_in_a_small_shanty/,Sir_Leafus,Found dozens of OG Bionicles in a small shanty Market in Africa.,2207,0.98,143,,1688046629.0,False,False,False,False,False
77,14m2qpq,ChatGPT,/r/ChatGPT/comments/14m2qpq/lets_drink_for_legends_and_ai/,adesigne,Let's drink for legends and AI,3290,0.95,93,,1688038769.0,False,False,False,False,False
78,14m5lfl,oddlyspecific,/r/oddlyspecific/comments/14m5lfl/marriage_counseling/,Northdingo126,Marriage counseling,2156,0.97,15,,1688046734.0,False,False,False,False,False
79,14m3bem,nextfuckinglevel,/r/nextfuckinglevel/comments/14m3bem/girl_climbing_the_wall_like_a_spider/,Administrative-Day76,Girl climbing the wall like a spider,7677,0.91,864,,1688040508.0,False,False,False,False,False
80,14m4hxz,technology,/r/technology/comments/14m4hxz/valve_is_reportedly_banning_games_featuring_ai/,DemiFiendRSA,Valve is reportedly banning games featuring AI generated content,2489,0.94,248,,1688043815.0,False,False,False,False,False
81,14m59du,ukraine,/r/ukraine/comments/14m59du/66yearold_ihor_serving_in_the_ua_army_seen_here/,305FUN,66-year-old Ihor serving in the UA army. Seen here having a smoke while repairing a captured enemy’s IFV.,2238,0.97,67,,1688045829.0,False,False,False,False,False
82,14m0wk4,UkraineWarVideoReport,/r/UkraineWarVideoReport/comments/14m0wk4/after_suffering_enormous_casualties_in_the/,Legalized_NSFW_Today,"After suffering enormous casualties in the battlefield, several Russian soldiers from the elite ""Storm Z"" unit released a video in which they declared their refusal to participate in combat missions.",4448,0.96,453,,1688032786.0,False,False,False,False,False
83,14lxzc3,ProgrammerHumor,/r/ProgrammerHumor/comments/14lxzc3/pythonandturtle/,sunrise_apps,pythonAndTurtle,8796,0.97,179,:sw::ru::dart:,1688022497.0,False,False,False,False,False
84,14m0bds,MapPorn,/r/MapPorn/comments/14m0bds/breakup_of_yugoslavia_benefited_or_harmed_your/,quindiassomigli,Breakup of Yugoslavia: “Benefited or Harmed your country”? [Poll],5006,0.94,678,,1688030733.0,False,False,False,False,False
85,14lxjm7,me_irlgbt,/r/me_irlgbt/comments/14lxjm7/meirlgbt/,Lux-xxv,Me🐷irlgbt,10972,0.89,333,YEEN DEGENERATE :demiro::lesbian::trans::degen:,1688021005.0,False,False,False,False,False
86,14m2ief,DiWHY,/r/DiWHY/comments/14m2ief/lowest_car_in_the_world/,edit12,Lowest car in the world..,3280,0.89,185,,1688038063.0,False,False,False,False,False
87,14m607q,Damnthatsinteresting,/r/Damnthatsinteresting/comments/14m607q/honey_bees_kill_the_queen_bee_when_she_is_not/,flyingcatwithhorns,Honey bees kill the queen bee when she is not laying eggs any longer or is an imposter from another hive,4217,0.97,263,,1688047778.0,False,False,False,False,False
88,14m547v,baseball,/r/baseball/comments/14m547v/andrew_mccutchen_furries/,Ryuuken1789,[Andrew McCutchen] Furries,2144,0.98,227,New York Mets :nym3:,1688045460.0,False,False,False,False,False
89,14m67ou,pics,/r/pics/comments/14m67ou/i_see_someone_is_disliking_the_john_oliver_posts/,AmandaSirex,"I see someone is disliking the John Oliver posts. Well, I'll add mooore",1870,0.76,111,,1688048295.0,False,False,False,False,False
90,14m3bw9,Rabbits,/r/Rabbits/comments/14m3bw9/for_over_two_years_ive_been_making_a_game_out_of/,_pank0,"For over two years, I’ve been making a game out of a love for bunnies! It’s going to be released in September this year!",2766,0.96,208,I :h: bunnies,1688040550.0,False,False,False,False,False
91,14lyr31,2westerneurope4u,/r/2westerneurope4u/comments/14lyr31/yes/,Euphoric_Ad_69,Yes,7142,0.93,916,:European: European,1688025268.0,False,False,False,False,False
92,14m4ikk,pcgaming,/r/pcgaming/comments/14m4ikk/according_to_a_recent_post_valve_is_not_willing/,Turbostrider27,"According to a recent post, Valve is not willing to publish games with AI generated content anymore",2224,0.93,371,,1688043859.0,False,False,False,False,False
93,14m23kv,Genshin_Impact,/r/Genshin_Impact/comments/14m23kv/hu_tao_by_my_12_year_old_sister/,BolshoyBorz,Hu Tao by my 12 year old sister.,3425,0.95,71,,1688036737.0,False,False,False,False,False
94,14m2gcu,BlackPeopleTwitter,/r/BlackPeopleTwitter/comments/14m2gcu/lion_was_like_its_not_what_it_looks_like/,trancatt,Lion was like “it’s not what it looks like” 😂,6599,0.95,128,,1688037878.0,False,False,False,False,False
95,14m2xuh,2visegrad4you,/r/2visegrad4you/comments/14m2xuh/ok/,Yo_Mama_Disstrack,Ok,2854,0.89,253,:flag_pl: Winged Pole dancer,1688039388.0,False,False,False,False,False
96,14m96uk,distressingmemes,/r/distressingmemes/comments/14m96uk/human_cruelty_truly_has_no_limits/,DepressedRifle,Human cruelty truly has no limits.,1218,0.95,86,,1688055431.0,False,False,False,False,False
97,14m65d4,Conservative,/r/Conservative/comments/14m65d4/supreme_court_rejects_affirmative_action_in/,f1sh98,Supreme Court rejects affirmative action in ruling on universities using race in admissions decisions,1710,0.78,521,Beltway Republican,1688048129.0,False,False,True,False,False
98,14lz107,LifeProTips,/r/LifeProTips/comments/14lz107/lpt_never_ever_give_up_on_cooking_because_your/,EngLitIsLit,"LPT: Never, ever give up on cooking because your first try was bad. You will always eventually find that one key point commonly skipped that will turn your dish into perfection.",5564,0.92,331,,1688026249.0,False,False,False,False,False
99,14m2r3l,Superstonk,/r/Superstonk/comments/14m2r3l/research_journal_may_2023_on_turning_the_buy/,throwawaylurker012,"RESEARCH JOURNAL (May 2023) on turning the buy button off: ""GameStopped: How Robinhood’s GameStop Trading Halt Reveals the Complexities of Retail Investor Protection""",3095,0.95,110,Tendietown is the new Flavortown & DRS Is my Guy Fieri,1688038802.0,False,1688051051.0,False,False,False
100,14lypiw,PixelArt,/r/PixelArt/comments/14lypiw/goth_girl/,kisk123,Goth girl,5854,0.95,98,,1688025100.0,False,False,False,False,True
