rank,id,subreddit,permalink,author,title,score,upvote_ratio,num_comments,author_flair_text,created_utc,over_18,edited,stickied,locked,is_original_content
1,14zv5jx,nextfuckinglevel,/r/nextfuckinglevel/comments/14zv5jx/sabrina_ionescu_makes_history_by_scoring_37/,MidoriTea,Sabrina Ionescu makes history by scoring 37 points in the 3 point contest ,14955,0.95,922,,1689376085.0,False,False,False,False,False
2,14zthx2,MadeMeSmile,/r/MadeMeSmile/comments/14zthx2/dear_coach/,jeffers0n_steelflex,Dear coach…,23890,0.97,482,,1689371926.0,False,False,False,False,False
3,14zuqqf,WhitePeopleTwitter,/r/WhitePeopleTwitter/comments/14zuqqf/ron_perlman_has_had_enough_knows_where_you_live/,zzill6,Ron Perlman Has Had Enough & Knows Where You Live,12066,0.97,619,,1689375034.0,False,False,False,False,False
4,14zt4wg,facepalm,/r/facepalm/comments/14zt4wg/i_have_107000_coins_and_60_days_to_use_them_who/,sboger,"I have 107,000 coins and 60 days to use them. Who wants an award?",30068,0.92,20656,,1689371053.0,False,False,False,False,False
5,14zum7r,BeAmazed,/r/BeAmazed/comments/14zum7r/i_wanted_to_share_a_drawing_that_took_all_my/,tfoust10,I wanted to share a drawing that took all my brain power to create. This is one non-intersecting line,10531,0.96,377,,1689374715.0,False,False,False,False,False
6,14zsgi9,nba,/r/nba/comments/14zsgi9/wnba_sabrina_ionescu_just_set_the_alltime_record/,Remdawg,[WNBA] Sabrina Ionescu just set the all-time record for NBA or WNBA with a score of 37 PTS in the FINAL ROUND of the 3PT Contest 🏆,12897,0.93,1343,Grizzlies,1689369472.0,False,False,False,False,False
7,14zuf2z,mildlyinfuriating,/r/mildlyinfuriating/comments/14zuf2z/caught_a_complete_stranger_beginning_to_key_my/,Rilybear,Caught a complete stranger beginning to key my car while I was inside paying for gas.,9189,0.98,628,,1689374202.0,False,False,False,False,False
8,14zxgwy,todayilearned,/r/todayilearned/comments/14zxgwy/til_in_2008_a_single_basketball_shot_may_have/,SonicSingularity,"TIL in 2008, a single basketball shot may have saved hundreds of lives. Alabama player Mykal Riley made a 3-point-shot that pushed the game into overtime minutes before an EF-2 Tornado passed by. If he had missed that shot, hundreds of fans could have been in the parking lot when the tornado hit.",4802,0.98,60,,1689382223.0,False,False,False,False,False
9,14zttfy,antiwork,/r/antiwork/comments/14zttfy/ron_perlman_the_absolute_fucking_legend/,Ok-Seaworthiness2235,"Ron Perlman, the absolute fucking legend",8579,0.97,474,,1689372696.0,False,False,False,False,False
10,14zqixg,Damnthatsinteresting,/r/Damnthatsinteresting/comments/14zqixg/after_a_visitor_threw_food_at_an_orangutan/,Ainsley-Sorsby,"After a visitor threw food at an Orangutan enclosure at a safari park, leading one of them towards the moat(which they'd normally avoid as they can't swim), a zookeeper jumped in, pulled him out and performed cpr to save his life",23916,0.96,155,,1689364939.0,False,False,False,True,False
11,14zqgvu,gaming,/r/gaming/comments/14zqgvu/oh_the_horror/,NeoFury84,Oh the horror...,12972,0.96,881,,1689364829.0,False,False,False,False,False
12,14zpkcj,worldnews,/r/worldnews/comments/14zpkcj/putin_wants_to_attend_an_august_summit_host/,ExactlySorta,Putin wants to attend an August summit. Host country South Africa doesn't want to have to arrest him,13552,0.96,1026,,1689362692.0,False,False,False,False,False
13,14zsc1i,comics,/r/comics/comments/14zsc1i/wtf_reddit/,robertissimple9323,WTF REDDIT!?,8047,0.92,849,,1689369185.0,False,False,False,False,True
14,14zt841,oddlyterrifying,/r/oddlyterrifying/comments/14zt841/sinkhole_in_turkey/,j3ffr33d0m,Sinkhole in Turkey,6514,0.97,247,,1689371268.0,False,False,False,False,False
15,14zpjpf,politics,/r/politics/comments/14zpjpf/democratic_lawmaker_loses_his_cool_with_matt/,theindependentonline,Democratic lawmaker loses his cool with Matt Gaetz during House floor speech: ‘You are exhausting!’,9756,0.96,663,The Independent,1689362649.0,False,False,False,False,False
16,14zo7mu,doordash,/r/doordash/comments/14zo7mu/lmao_like_wtf/,No_Tap_3428,Lmao like wtf,16280,0.97,652,,1689359499.0,False,False,False,False,False
17,14zslkl,TikTokCringe,/r/TikTokCringe/comments/14zslkl/iconic/,jjf27,Iconic,6356,0.84,726,,1689369771.0,False,False,False,False,False
18,14zn5el,Tinder,/r/Tinder/comments/14zn5el/think_weed/,Land-a-hoeCalRizzian,Think weed,17138,0.96,394,,1689356973.0,False,False,False,False,False
19,14zmp5u,funny,/r/funny/comments/14zmp5u/meanwhile_in_finland_the_hobby_horse_championship/,SinjiOnO,Meanwhile in Finland: The Hobby Horse Championship,19037,0.91,2057,,1689355885.0,False,False,False,False,False
20,14zqs7y,WTF,/r/WTF/comments/14zqs7y/fella_getting_a_refreshing_drink/,urban-railing,Fella getting a refreshing drink,7143,0.94,609,,1689365573.0,True,False,False,False,False
21,14zrj4q,BrandNewSentence,/r/BrandNewSentence/comments/14zrj4q/whatre_the_odds/,urbex_prov,What’re the odds?,6877,0.96,310,,1689367350.0,False,False,False,False,False
22,14zmbs7,Unexpected,/r/Unexpected/comments/14zmbs7/when_she_says_guess_her_height/,VariousBasket125,When she says guess her height. ,27200,0.92,628,,1689355087.0,False,False,False,False,False
23,14znmee,wholesomememes,/r/wholesomememes/comments/14znmee/its_cute_but_why/,DogeDoRight,"It's cute, but why?",14746,0.96,251,,1689358096.0,False,False,False,False,False
24,14zpvmt,memes,/r/memes/comments/14zpvmt/spotify_free_is_ridiculous/,INVWVZ,Spotify Free is ridiculous.,10838,0.97,403,,1689363433.0,False,False,False,False,False
25,14zrv6b,ProgrammerHumor,/r/ProgrammerHumor/comments/14zrv6b/jaywassecond/,huxx__,jayWasSecond,5583,0.95,151,,1689368124.0,False,False,False,False,False
26,14zohum,2meirl4meirl,/r/2meirl4meirl/comments/14zohum/2meirl4meirl/,Threecan,2meirl4meirl,11945,0.96,1171,,1689360181.0,False,False,False,False,False
27,14zm84t,ContagiousLaughter,/r/ContagiousLaughter/comments/14zm84t/girl_challenges_her_friend_to_shotgun_whiteclaw/,Muffinlette,Girl challenges her friend to shotgun whiteclaw ,16637,0.94,397,,1689354848.0,False,False,False,False,False
28,14zsmen,tumblr,/r/tumblr/comments/14zsmen/all_aboard_the_barbenheimer_hypetrain/,TheDustOfMen,all aboard the barbenheimer hypetrain,5117,0.98,65,,1689369828.0,False,False,False,False,False
29,14zna63,HolUp,/r/HolUp/comments/14zna63/when_you_have_meeting_after_russian_delegation/,MYMExodus,When you have meeting after Russian Delegation.,16647,0.95,421,,1689357295.0,False,False,False,False,False
30,14zlua2,WatchPeopleDieInside,/r/WatchPeopleDieInside/comments/14zlua2/guy_drops_his_new_bottle_of_johnnie_walker_black/,sakamoto__,Guy drops his new bottle of johnnie walker black label on the floor,22412,0.91,2993,,1689354028.0,False,False,False,False,False
31,14ztuu5,TerrifyingAsFuck,/r/TerrifyingAsFuck/comments/14ztuu5/google/,Low_Distance_673,Google ,4035,0.97,406,,1689372795.0,False,False,False,False,False
32,14zn6sw,PublicFreakout,/r/PublicFreakout/comments/14zn6sw/georgia_man_accused_of_putting_victim_in/,11stainless11,Georgia man accused of putting victim in chokehold in pizza store parking lot,10219,0.96,2072,,1689357060.0,True,False,False,False,False
33,14zr57f,dankmemes,/r/dankmemes/comments/14zr57f/that_a_is_mine/,johnlen1n,That A is mine,5874,0.97,37,,1689366434.0,False,False,False,False,False
34,14zkyjw,rareinsults,/r/rareinsults/comments/14zkyjw/nothing_cringier_than_these_pickup_artist_threads/,MattDean748,Nothing cringier than these pickup artist threads,28388,0.92,2495,,1689351994.0,False,False,False,False,False
35,14zqaej,cats,/r/cats/comments/14zqaej/is_my_cat_fat/,Flimsy_Style_3163,Is my cat fat?,6004,0.98,1028,,1689364394.0,False,False,False,False,False
36,14zsxi1,OneOrangeBraincell,/r/OneOrangeBraincell/comments/14zsxi1/is_mona_allowed_here_her_fur_is_only_partly/,flolibri,"Is Mona allowed here? Her fur is only partly orange, but I feel like; the orange spirit is strong with this one",4024,0.97,180,,1689370548.0,False,False,False,False,False
37,14zmnec,meirl,/r/meirl/comments/14zmnec/meirl/,its_jason_mf,meirl,13503,0.97,288,,1689355798.0,False,False,False,False,False
38,14zkhwt,oddlysatisfying,/r/oddlysatisfying/comments/14zkhwt/restoring_a_ww2_dday_normandy_commemorative_zippo/,rco888,Restoring a WW2 D-Day Normandy Commemorative Zippo lighter,23791,0.92,515,,1689350910.0,False,False,False,False,False
39,14zw2jm,OldSchoolCool,/r/OldSchoolCool/comments/14zw2jm/newsradio_cast_photo_1995/,Djf47021,Newsradio Cast Photo 1995,2472,0.97,457,,1689378407.0,False,False,False,False,False
40,14zsz13,PrequelMemes,/r/PrequelMemes/comments/14zsz13/milflek/,neuenu,Milflek,4026,0.96,58,,1689370655.0,False,False,False,False,False
41,14zkm55,WorkReform,/r/WorkReform/comments/14zkm55/4700000000000/,sillychillly,"$4,700,000,000,000",13603,0.96,264,🗳️ Register @ Vote.gov,1689351198.0,False,False,False,False,False
42,14zp9no,AnimalsBeingBros,/r/AnimalsBeingBros/comments/14zp9no/humpback_whale_saves_marine_biologist_nan_huaser/,Sufficient-Bug-9112,"Humpback whale saves marine biologist, Nan Huaser, from a shark....",6237,0.96,140,,1689361983.0,False,False,False,False,False
43,14zsljr,TrueOffMyChest,/r/TrueOffMyChest/comments/14zsljr/i_think_my_husband_cheated_on_my_with_his_sister/,pitamzadrugara,I think my husband cheated on my with his sister,3964,0.94,1111,,1689369770.0,True,False,False,False,False
44,14zl40y,maybemaybemaybe,/r/maybemaybemaybe/comments/14zl40y/maybe_maybe_maybe/,50ShadesOfSpray_,Maybe Maybe Maybe,15211,0.94,370,,1689352360.0,False,False,False,False,False
45,14zqws2,BlackPeopleTwitter,/r/BlackPeopleTwitter/comments/14zqws2/i_thought_actors_acted_but_thats_just_me/,WVUGuy29,I thought actors acted but that’s just me… 🤷‍♂️,4596,0.95,400,,1689365881.0,False,False,False,False,False
46,14zrszu,Rabbits,/r/Rabbits/comments/14zrszu/update_bunny_has_been_rescued_thank_you_all/,Additional_Win3920,UPDATE: Bunny has been rescued! Thank you all!!,4019,0.98,124,,1689367984.0,False,False,False,False,False
47,14zkjw5,shittyfoodporn,/r/shittyfoodporn/comments/14zkjw5/and_heres_my_boyfriends_carbonara_attempt/,vertigoism,And here's my boyfriend's carbonara attempt,18616,0.88,4578,Paper Mache Carbonara,1689351045.0,False,False,False,False,False
48,14zpi09,mildlyinfuriating,/r/mildlyinfuriating/comments/14zpi09/i_got_my_friend_art_made_of_him_and_his_dog_that/,SuperiorXTuftsX,I got my friend art made of him and his dog that recently passed and he is upset i didn't get him more,33814,0.92,4780,,1689362532.0,False,False,False,False,False
49,14zng6e,UFOs,/r/UFOs/comments/14zng6e/unidentified_anomalous_phenomena_disclosure_act/,IrishSpring4522,UNIDENTIFIED ANOMALOUS PHENOMENA DISCLOSURE ACT OF 2023,7074,0.92,1562,,1689357690.0,False,False,False,False,False
50,14zsha8,NonPoliticalTwitter,/r/NonPoliticalTwitter/comments/14zsha8/wow/,lhomme21,Wow,3587,0.96,184,:blue1::blue2::1111::1112:,1689369516.0,False,False,False,False,False
51,14zpgxn,news,/r/news/comments/14zpgxn/utah_boarding_school_loses_license_following/,ninjascotsman,Utah boarding school loses license following death of Washington teen Taylor Goodridge,4909,0.97,206,,1689362461.0,False,False,False,False,False
52,14zp4rm,shitposting,/r/shitposting/comments/14zp4rm/taser_napkin_praise_spez/,WeDoSomeTrolling_12,Taser Napkin (Praise Spez),6535,0.97,43,,1689361650.0,False,False,False,False,False
53,14zogjo,AITAH,/r/AITAH/comments/14zogjo/aitah_for_not_inviting_my_sister_to_my_wedding/,Plane-Gur7354,AITAH for not inviting my sister to my wedding because she didn't invite me to hers?,6073,0.93,1551,,1689360095.0,False,False,False,False,False
54,14zwdyc,nbacirclejerk,/r/nbacirclejerk/comments/14zwdyc/moriah_back_from_the_allstar_break_with_an/,FireMattNagy1,Moriah back from the All-Star break with an All-Time Jerk,1958,0.97,159,,1689379269.0,False,False,False,False,False
55,14zm9n5,PeterExplainsTheJoke,/r/PeterExplainsTheJoke/comments/14zm9n5/excuse_me_peter/,ToeSniffer245,"Excuse me, Peter?",9898,0.94,520,,1689354942.0,False,False,False,False,False
56,14zu7oy,chicago,/r/chicago/comments/14zu7oy/breaking_workers_at_the_chicago_roastery_the/,theworkeragency,"BREAKING: Workers at the Chicago Roastery, the biggest Starbucks in the WORLD, just filed for a union election. When they win, every Starbucks Roastery in North America will be union.",2413,0.93,182,,1689373695.0,False,False,False,False,False
57,14zlzey,DOG,/r/DOG/comments/14zlzey/just_chilling/,EvaRaw666,Just chilling..,8486,0.98,155,,1689354304.0,False,False,False,False,False
58,14zv9r8,unpopularopinion,/r/unpopularopinion/comments/14zv9r8/if_you_have_a_work_wife_or_work_husband_youre_an/,webosite,"If you have a “work wife” or “work husband”, you’re an awful person who needs to take a step back and reevaluate their own life",2207,0.77,697,,1689376386.0,False,False,False,False,False
59,14zkwzz,NatureIsFuckingLit,/r/NatureIsFuckingLit/comments/14zkwzz/frog_feast/,xpawn2002,🔥 Frog Feast,9453,0.97,340,,1689351899.0,False,False,False,False,False
60,14zsbze,Eldenring,/r/Eldenring/comments/14zsbze/poor_godrick_nobody_likes_him/,FooManTheGreat,Poor Godrick nobody likes him,3095,0.98,105,,1689369182.0,False,False,False,False,False
61,14zobc4,oddlyspecific,/r/oddlyspecific/comments/14zobc4/holy_phallus/,step6666,Holy phallus,5318,0.97,93,,1689359753.0,False,False,False,False,False
62,14zt48t,facepalm,/r/facepalm/comments/14zt48t/wheres_my_10000/,LibrarianBigz,"Where's my £10,000?",7351,0.97,134,,1689371006.0,False,False,False,False,False
63,14zp64y,nottheonion,/r/nottheonion/comments/14zp64y/78_pilot_whales_were_slaughtered_near_a_cruise/,Ezek210,78 pilot whales were slaughtered near a cruise ship carrying marine conservationists,4489,0.95,478,,1689361746.0,False,False,False,False,False
64,14zo4m7,Damnthatsinteresting,/r/Damnthatsinteresting/comments/14zo4m7/a_coyote_and_a_badger_traveling_together_through/,Papppi-56,A coyote and a badger traveling together through a tunnel,27910,0.95,795,,1689359303.0,False,False,False,False,False
65,14zpnqv,iamatotalpieceofshit,/r/iamatotalpieceofshit/comments/14zpnqv/man_allegly_chokes_out_pizza_guy_for_not_smiling/,BitschWack,Man allegly chokes out pizza guy for not smiling at him. ,4366,0.94,802,,1689362913.0,False,False,False,False,False
66,14zh848,technicallythetruth,/r/technicallythetruth/comments/14zh848/was_this_really_a_surprise/,sapnation,Was this really a surprise?,42150,0.96,582,,1689343205.0,False,False,False,False,False
67,14zygjd,LateStageCapitalism,/r/LateStageCapitalism/comments/14zygjd/we_wont_let_you_keep_it/,EldritchSlut,We won't let you keep it,1301,0.99,39,Commie Trash🚩,1689385010.0,False,False,False,False,False
68,14zy8ux,SipsTea,/r/SipsTea/comments/14zy8ux/i_am_learning_respectfully/,sandwichmclee,I am learning respectfully ,1333,0.94,117,,1689384396.0,False,False,False,False,False
69,14zqmvl,popculturechat,/r/popculturechat/comments/14zqmvl/do_not_ask_ben_platt_about_nepotism/,HerRoyalRedness,DO NOT ask Ben Platt about nepotism,3562,0.97,309,,1689365209.0,False,False,False,False,False
70,14zserg,3Dprinting,/r/3Dprinting/comments/14zserg/my_son_was_born_with_limited_use_of_his_right/,trammeloratreasure,My son was born with limited use of his right hand... today he can play video games! (links in the first comment),2737,0.97,104,,1689369356.0,False,False,False,False,False
71,14zrcks,gaming,/r/gaming/comments/14zrcks/i_found_my_childhood_ds_that_went_missing_16/,Ryebredrox,I found my childhood DS that went missing 16 years ago,7719,0.96,610,,1689366916.0,False,False,False,False,False
72,14zx5t6,marvelmemes,/r/marvelmemes/comments/14zx5t6/you_cant_do_that/,Historical-Prompt701,You can't do that,1456,0.97,55,Avengers,1689381367.0,False,False,False,False,False
73,14zsn0c,CrazyFuckingVideos,/r/CrazyFuckingVideos/comments/14zsn0c/wrestler_overshoots_elbow_drop_from_20_feet_up/,___dlb15___,Wrestler overshoots elbow drop from 20 Feet up onto concrete floor.,2640,0.96,338,,1689369867.0,False,False,False,False,False
74,14zw6k2,ExplainTheJoke,/r/ExplainTheJoke/comments/14zw6k2/ive_seen_black_and_latino_people_use_the_divider/,flossingjonah,"I've seen Black and Latino people use the divider too, why is this supposedly a ""White"" thing?",1676,0.94,105,,1689378707.0,False,False,False,False,False
75,14zrk59,instantkarma,/r/instantkarma/comments/14zrk59/teesdale_farmer_flips_car_that_parked_on_his_land/,4nts,Teesdale farmer flips car that parked on his land. The farmer was later cleared by a jury of dangerous driving and criminal damage after going through “months of hell”,3024,0.94,189,,1689367419.0,False,False,False,False,False
76,14zt7ui,PoliticalCompassMemes,/r/PoliticalCompassMemes/comments/14zt7ui/there_arent_even_memes_making_fun_of_rightoid_so/,RandomUserName076,there aren't even memes making fun of rightoid so here.,2387,0.92,156,:auth: - Auth-Center,1689371251.0,False,False,False,False,False
77,14zvtr3,therewasanattempt,/r/therewasanattempt/comments/14zvtr3/to_twerk/,edvsa,To twerk,1763,0.81,225,,1689377768.0,False,False,False,False,False
78,14ziakq,PoliticalHumor,/r/PoliticalHumor/comments/14ziakq/a_cherry_pickin_good_time/,ValkyriesOnStation,a cherry pickin' good time,10660,0.97,183,,1689345795.0,False,False,False,False,False
79,14zsdwg,WhitePeopleTwitter,/r/WhitePeopleTwitter/comments/14zsdwg/i_think_at_this_point_it_turns_from_a_problem/,G-Unit11111,I think at this point it turns from a problem into an addiction.,6092,0.96,624,,1689369308.0,False,False,False,False,False
80,14znz84,DiWHY,/r/DiWHY/comments/14znz84/man_invents_new_way_to_sleep/,dyzzy,Man invents new way to sleep!,5314,0.81,1154,,1689358946.0,False,False,False,False,False
81,14zvux2,baseball,/r/baseball/comments/14zvux2/matt_olson_smashes_a_grand_slam_for_his_30th_hr/,AlexanderWun,Matt Olson smashes a Grand Slam for his 30th HR of 2023 as the Braves lead 4-0 in the 1st,1615,0.94,217,Seattle Mariners :sea4:,1689377851.0,False,False,False,False,False
82,14zvfaa,nextfuckinglevel,/r/nextfuckinglevel/comments/14zvfaa/this_ridiculous_putt_by_steph_curry/,a1_1rep,this ridiculous putt by Steph Curry,3828,0.96,180,,1689376764.0,False,False,False,False,False
83,14zxugh,Hololive,/r/Hololive/comments/14zxugh/fauna_will_be_taking_some_time_off_from_streaming/,lightow,"Fauna will be taking some time off from streaming, ""to prepare for some things!""",1247,0.99,84,:Gura::Amelia::Inanis::Calliope::Kiara:,1689383267.0,False,False,False,False,False
84,14zvr4f,rupaulsdragrace,/r/rupaulsdragrace/comments/14zvr4f/sasha_colby_with_vp_kamala_harris/,Affectionate-Ask5262,Sasha Colby with VP Kamala Harris,1611,0.96,64,Sasha Colby,1689377589.0,False,False,False,False,False
85,14zjnuf,StupidFood,/r/StupidFood/comments/14zjnuf/hate_spaghetti_dog/,TajuanaFish,hate spaghetti dog.,10144,0.9,1500,,1689348995.0,False,False,False,False,False
86,14zwh08,Breath_of_the_Wild,/r/Breath_of_the_Wild/comments/14zwh08/playing_botw_for_the_first_time_and_just_met_this/,cosmothetoastghost,Playing BotW for the first time and just met this guy. He's their leader?? It's like if Doofenshmirtz was a Yiga,1444,0.96,164,:triforce:,1689379476.0,False,False,False,False,False
87,14zp9yn,WitchesVsPatriarchy,/r/WitchesVsPatriarchy/comments/14zp9yn/are_mermaids_welcome_here_p_transition_progress/,Daniduenna85,Are mermaids welcome here? :p transition progress pic cause why not. 5 years apart.,3689,0.88,127,,1689362003.0,False,False,False,False,False
88,14zmz0u,NoahGetTheBoat,/r/NoahGetTheBoat/comments/14zmz0u/what_the_actual_fuck/,Historical_Luck3576,What the actual fuck?,5218,0.96,320,,1689356536.0,True,False,False,False,False
89,14zntqr,Serverlife,/r/Serverlife/comments/14zntqr/an_interesting_note_a_customer_left_on_a/,The_Nuckles,An interesting note a customer left on a reservation lol,4237,0.97,166,,1689358580.0,False,False,False,False,False
90,14zq2np,shittymoviedetails,/r/shittymoviedetails/comments/14zq2np/in_zootopia_2016_during_the_scene_where_judy_is/,mauswaffles,"In Zootopia (2016), during the scene where Judy is scrolling on her iPod, among other pun names is Fur Fighters. This implies that there is an anthropomorphic equivalent to Kurt Cobain who offed himself in this universe.",3234,0.98,102,,1689363887.0,False,False,False,False,False
91,14zwao2,IllegallySmolCats,/r/IllegallySmolCats/comments/14zwao2/new_manager_at_work/,PewPewAnimeGirl,new manager at work!,1408,0.98,27,Smol Criminal Warden,1689379025.0,False,False,False,False,False
92,14zlbff,pettyrevenge,/r/pettyrevenge/comments/14zlbff/allow_your_kids_to_scream_all_day_every_day_its/,SpookyGirl0123,Allow your kids to scream all day every day? It’s time for some revenge…,6065,0.96,373,,1689352859.0,False,1689389052.0,False,False,False
93,14zldeu,shittytattoos,/r/shittytattoos/comments/14zldeu/my_wife_doesnt_draw_she_drew_me_a_camel_so_i_got/,ClearAboveVis10SM,"My wife doesn't draw. She drew me a camel. So I got it tattooed. (Tattoo is good, drawing is debatable but I love her)",6039,0.97,328,,1689352987.0,False,False,False,False,False
94,14zronb,worldnewsvideo,/r/worldnewsvideo/comments/14zronb/mike_pence_gets_smacked_in_the_head_by_a_water/,PlenitudeOpulence,Mike Pence gets smacked in the head by a water balloon,2491,0.91,221,Plenty 🩺🧬💜,1689367709.0,False,False,False,False,False
95,14zqevq,HydroHomies,/r/HydroHomies/comments/14zqevq/these_absolute_lies_by_cnn/,KatDude66,These absolute lies by CNN,2981,0.96,280,,1689364691.0,True,False,False,False,False
96,14zolts,golf,/r/golf/comments/14zolts/the_man_that_won_his_2018_club_championship/,Stag328,The man that won his 2018 Club Championship,3593,0.91,666,,1689360436.0,False,False,False,False,False
97,14zpwk4,destiny2,/r/destiny2/comments/14zpwk4/fun_fact_when_playing_gambit_this_is_where_you/,That-Guy59,"Fun fact: When playing Gambit, this is where you deposit motes",3108,0.97,217,Dead Orbit,1689363494.0,False,False,False,False,False
98,14zj7p8,Animemes,/r/Animemes/comments/14zj7p8/need/,ARZZZIO,need.,9978,0.93,215,,1689347956.0,False,False,False,False,False
99,14zkl1g,me_irlgbt,/r/me_irlgbt/comments/14zkl1g/me_irlgbt/,Thedepressionoftrees,Me_irlgbt,6823,0.97,27,Genderqueer/Ace|Finished the fight on Halo (not finished yet),1689351119.0,False,False,False,False,False
100,14zqjk4,witcher,/r/witcher/comments/14zqjk4/the_witcher_season_3_suffers_30_drop_in/,littletodd3,The Witcher Season 3 suffers 30% drop in viewership compared to Season 2.,2718,0.96,369,,1689364983.0,False,False,False,False,False
