rank,id,subreddit,permalink,author,title,score,upvote_ratio,num_comments,author_flair_text,created_utc,over_18,edited,stickied,locked,is_original_content
1,14ikq4s,WhitePeopleTwitter,/r/WhitePeopleTwitter/comments/14ikq4s/i_wish_this_was_surprising/,CrunchM,I wish this was surprising,17647,0.97,1353,,1687695017.0,False,False,False,False,False
2,14iki9r,facepalm,/r/facepalm/comments/14iki9r/camera_flash_causes_tuna_to_crash_into_aquarium/,Infinite-Captain-622,Camera flash causes tuna to crash into aquarium glass,24611,0.94,1628,,1687694346.0,False,False,False,False,False
3,14ijd92,todayilearned,/r/todayilearned/comments/14ijd92/til_that_sigourney_weaver_only_earned_35000_for/,Make_the_music_stop,"TIL that Sigourney Weaver only earned $35,000 for Alien (1979) but got $1,000,000 and a share of the profits for Aliens (1986)",24590,0.95,839,,1687690510.0,False,False,False,False,False
4,14ij3jw,Damnthatsinteresting,/r/Damnthatsinteresting/comments/14ij3jw/baloo_from_jungle_book_is_actually_based_on_the/,lonely_dude__,Baloo from jungle book is actually based on the sloth bear found in India which is considered to be the most agressive bear species in the world.,18696,0.97,581,Creator,1687689548.0,False,False,False,False,False
5,14ik8p2,comics,/r/comics/comments/14ik8p2/pimple_boy/,neilkohney,Pimple boy,10269,0.95,94,The Other End,1687693469.0,False,False,False,False,False
6,14ijqjl,therewasanattempt,/r/therewasanattempt/comments/14ijqjl/to_hang_out/,VariousBasket125,To hang out ,13407,0.93,2995,This is a flair,1687691762.0,False,False,False,False,False
7,14iifo7,PoliticalHumor,/r/PoliticalHumor/comments/14iifo7/this_all_makes_a_little_more_sense_now/,UnlimitedDuck,This all makes a little more sense now,14465,0.94,622,,1687687196.0,False,False,True,False,False
8,14ijqw3,AmItheAsshole,/r/AmItheAsshole/comments/14ijqw3/aita_for_giving_back_everything_my_family_bought/,Free-Scallion-2274,AITA for giving back everything my family bought for my son?,9890,0.93,1493,,1687691794.0,False,False,False,False,False
9,14ijn99,politics,/r/politics/comments/14ijn99/why_the_right_is_so_terrified_of_woke_there_are/,Picture-unrelated,Why the right is so terrified of “woke”: There are truths it just can’t face — Conservatives didn’t want to hear about white privilege. So they abandoned reality and joined the orange man’s cult,10457,0.83,1228,:flag-or: Oregon,1687691445.0,False,False,False,False,False
10,14ijxre,PublicFreakout,/r/PublicFreakout/comments/14ijxre/dog_saves_girl_from_a_kidnapper/,Genesis_001,Dog saves girl from a kidnapper.,8568,0.97,293,,1687692436.0,False,False,False,False,False
11,14ikmd8,nextfuckinglevel,/r/nextfuckinglevel/comments/14ikmd8/the_kyoto_tachibana_shs_band_performing_sing_sing/,MulciberTenebras,"The Kyoto Tachibana SHS Band performing ""Sing Sing Sing""",7311,0.96,249,,1687694673.0,False,False,False,False,False
12,14ik4qw,nba,/r/nba/comments/14ik4qw/chelsea_gray_with_a_crazy_assist_last_night_in/,srgntalpowell,Chelsea Gray with a crazy assist last night in the WNBA,6958,0.89,584,,1687693091.0,False,False,False,False,False
13,14ijykz,dankmemes,/r/dankmemes/comments/14ijykz/their_battle_will_be_legendary/,chaosgiantmemes,Their battle will be legendary!,9370,0.87,112,:runescape1:trash-tier meme lord :runescape2:,1687692520.0,False,False,False,False,False
14,14im6r5,antiwork,/r/antiwork/comments/14im6r5/very_weird/,Monsur_Ausuhnom,Very Weird.,4502,0.98,137,,1687699317.0,False,False,False,False,False
15,14imbtk,MadeMeSmile,/r/MadeMeSmile/comments/14imbtk/courteous_elephant_picking_up_trash/,RunKind4141,Courteous Elephant Picking Up Trash,4433,0.99,70,,1687699732.0,False,False,False,False,False
16,14im4tx,ContagiousLaughter,/r/ContagiousLaughter/comments/14im4tx/oh_hi_mom/,colorless_man,oh! hi mom.,4378,0.96,118,,1687699166.0,False,False,False,False,False
17,14ikwzy,OneOrangeBraincell,/r/OneOrangeBraincell/comments/14ikwzy/neighbors_orange_gets_lost_and_walks_into_our/,RatDitch,Neighbors orange gets lost and walks into our house instead of his own. Frequently.,5361,0.98,116,,1687695621.0,False,False,False,False,False
18,14iks9b,oddlysatisfying,/r/oddlysatisfying/comments/14iks9b/steam_of_boiled_corn/,Gh0stDestr0y,Steam of boiled corn,5450,0.95,110,Flair Loading...,1687695197.0,False,False,False,False,False
19,14iliu0,mildlyinfuriating,/r/mildlyinfuriating/comments/14iliu0/my_brother_left_his_soda_can_overnight_in_the/,NamTiiddies,My brother left his soda can overnight in the freezer and it exploded and ruined the whole freezer and now I have to clean it cause MeN dOn'T cLeAn,4853,0.86,1122,,1687697464.0,False,False,False,False,False
20,14ijmsa,worldnews,/r/worldnews/comments/14ijmsa/donald_trump_warns_that_if_president_vladimir/,green_flash,"Donald Trump warns that if President Vladimir Putin is overthrown from power, ""unintended consequences"" would follow",6693,0.8,1623,,1687691401.0,False,False,False,False,False
21,14ih1ec,technology,/r/technology/comments/14ih1ec/american_tiktok_user_data_stored_in_china_video/,callmeteji,"American TikTok user data stored in China, video app admits",12019,0.92,1254,,1687682170.0,False,False,False,False,False
22,14ihh22,starterpacks,/r/starterpacks/comments/14ihh22/getting_the_flu_within_your_first_two_weeks_of/,confidentmilktoast,“Getting the flu within your first two weeks of starting a new job” Starter Pack.,10410,0.95,354,,1687683710.0,False,False,False,False,False
23,14iit9t,science,/r/science/comments/14iit9t/men_who_perform_just_a_few_minutes_of_strenuous/,Wagamaga,"Men who perform just a few minutes of strenuous exercise are more likely to feel aroused than those who do not work out. Heightened physical responses to exercise, such as elevated heart rate and breathing, lend themselves to an even greater physical response to sexual stimuli.",6824,0.95,243,,1687688520.0,False,False,False,False,False
24,14ik7wp,Tinder,/r/Tinder/comments/14ik7wp/am_i_the_crazy_one/,Post-pre-mortem,Am I the crazy one?,4783,0.93,811,,1687693395.0,False,False,False,False,False
25,14ij6c3,rareinsults,/r/rareinsults/comments/14ij6c3/shoutout_my_anaemic_friends/,TheRealCalT,Shoutout My Anaemic Friends,5821,0.96,24,,1687689819.0,False,False,False,False,False
26,14ijcb5,memes,/r/memes/comments/14ijcb5/anything_can_be_medieval_i_guess/,Acomplished_Bacteria,Anything can be medieval I guess,6732,0.97,78,,1687690413.0,False,False,False,False,False
27,14ifj46,shitposting,/r/shitposting/comments/14ifj46/glory_to_spez/,ligma-joe,Glory to Spez,21772,0.94,157,,1687676793.0,False,False,True,False,False
28,14ilsou,MurderedByWords,/r/MurderedByWords/comments/14ilsou/murdered_by_the_cops/,Multiplybead97,Murdered by the cops,3152,0.96,40,,1687698228.0,False,False,False,False,False
29,14iinyz,HermanCainAward,/r/HermanCainAward/comments/14iinyz/someone_please_make_it_make_sense/,HotPinkLollyWimple,Someone please make it make sense,5263,0.95,344,Phucked around and Phound out,1687687997.0,False,False,False,False,False
30,14il0ce,ProgrammerHumor,/r/ProgrammerHumor/comments/14il0ce/networkingstarterpack/,VitaminnCPP,networkingStarterPack,3511,0.94,71,:cp:,1687695910.0,False,False,False,False,False
31,14ifpzi,AnimalsBeingDerps,/r/AnimalsBeingDerps/comments/14ifpzi/baby_camel_wants_to_nurse/,jemahAeo,Baby camel wants to nurse,11834,0.96,134,,1687677483.0,False,False,False,False,False
32,14igorp,BikiniBottomTwitter,/r/BikiniBottomTwitter/comments/14igorp/this_is_so_true/,BeautifulSwan00,This is so true,8443,0.97,38,,1687680918.0,False,False,False,False,False
33,14iguum,NatureIsFuckingLit,/r/NatureIsFuckingLit/comments/14iguum/furcifer_pardalis_commonly_known_as_the_panther/,therra123,"🔥 Furcifer pardalis, commonly known as the panther chameleon, is primarily found in eastern and northern regions of Madagascar",7716,0.97,124,,1687681519.0,False,False,False,False,False
34,14iiptx,PrequelMemes,/r/PrequelMemes/comments/14iiptx/thats_life/,johnlen1n,That's life,5551,0.98,50,Good soldiers follow orders,1687688183.0,False,False,False,False,False
35,14ih3ce,HumansAreMetal,/r/HumansAreMetal/comments/14ih3ce/theresa_kachindamoto_saving_the_children/,bislut997,Theresa Kachindamoto saving the children,6764,0.95,98,,1687682365.0,False,False,False,False,False
36,14iixc1,wholesomememes,/r/wholesomememes/comments/14iixc1/i_am_the_streets/,esberat,I am the streets.,4508,0.97,30,,1687688932.0,False,False,False,False,False
37,14ih308,facepalm,/r/facepalm/comments/14ih308/society_explained_in_29_seconds/,stiffspectacls,Society explained in 29 seconds,32930,0.96,844,,1687682331.0,False,False,False,False,False
38,14idjrl,BeAmazed,/r/BeAmazed/comments/14idjrl/amazing_octopus_stretching_its_tentacles_to_form/,XahidX,Amazing Octopus stretching its tentacles to form a huge balloon,17503,0.97,496,,1687669967.0,False,False,False,False,False
39,14idvya,TikTokCringe,/r/TikTokCringe/comments/14idvya/stone_fish_venom/,Sylas1987,Stone fish venom,16053,0.95,813,,1687671104.0,False,False,False,False,False
40,14id129,funny,/r/funny/comments/14id129/shaq_pancake_art/,FlippinArtDude,Shaq pancake art,25201,0.91,323,,1687668234.0,False,False,False,False,False
41,14il94v,GreenAndPleasant,/r/GreenAndPleasant/comments/14il94v/1000_percent_this/,HankScorpio42,1000 percent this,2501,0.94,81,,1687696656.0,False,False,False,False,False
42,14iikkk,lotrmemes,/r/lotrmemes/comments/14iikkk/let_the_ring_bearer_decide/,Far_Huckleberry_355,Let the ring bearer decide...,4131,0.98,49,,1687687646.0,False,False,False,False,False
43,14iid1n,movies,/r/movies/comments/14iid1n/comiccon_crisis_marvel_netflix_sony_hbo_and/,tylerthe-theatre,"Comic-Con Crisis: Marvel, Netflix, Sony, HBO and Universal to Skip SDCC as Fest Faces Another Existential Threat",4017,0.9,425,,1687686911.0,False,False,False,False,False
44,14inpa9,diablo4,/r/diablo4/comments/14inpa9/posted_this_11_years_ago_sadly_still_relevant/,regisfrost,"Posted this 11 years ago, sadly still relevant",1690,0.94,169,,1687703436.0,False,False,False,False,False
45,14idq5f,clevercomebacks,/r/clevercomebacks/comments/14idq5f/stealing_is_wrong/,Evermoreunlive52,Stealing is wrong?,13338,0.96,89,,1687670572.0,False,False,False,False,False
46,14imewq,ukraine,/r/ukraine/comments/14imewq/the_russians_dropped_a_prohibited_asphyxiating/,TotalSpaceNut,"The russians dropped a prohibited asphyxiating aerosol ammunition on one of the positions of the Armed Forces of Ukraine. However, the wind was blowing towards the enemy",1971,0.98,88,,1687699969.0,False,False,False,False,False
47,14id1l7,NonPoliticalTwitter,/r/NonPoliticalTwitter/comments/14id1l7/how_true_is_this/,lhomme21,How true is this,17512,0.93,696,:blue1::blue2::1111::1112:,1687668289.0,False,False,False,False,False
48,14igcbf,WorkReform,/r/WorkReform/comments/14igcbf/based_on_a_true_story/,HumorousHelper,Based on a true story,5722,0.98,67,,1687679734.0,False,False,False,False,False
49,14im6zt,therewasanattempt,/r/therewasanattempt/comments/14im6zt/to_smuggle_drugs/,GuccixGerm,to smuggle drugs,4246,0.97,415,,1687699336.0,False,False,False,False,False
50,14imbrw,discordVideos,/r/discordVideos/comments/14imbrw/imma_finna_go_to_hell/,Boddup,Imma finna go to hell,2011,0.91,99,,1687699729.0,False,False,False,False,False
51,14ik5qa,OldSchoolCool,/r/OldSchoolCool/comments/14ik5qa/mark_hamill_and_annie_potts_on_the_set_of/,MilagrsGerra,"Mark Hamill and Annie Potts on the set of 'Corvette Summer', 1978",2655,0.97,160,,1687693192.0,False,False,False,False,False
52,14ikax0,shittymoviedetails,/r/shittymoviedetails/comments/14ikax0/in_oppenheimer_2023_oppenheimer_looks_miserable/,Xxstevefromminecraft,In Oppenheimer (2023) Oppenheimer looks miserable in every poster and Screen-cap he’s in. This is probably due to the fact he built fucking bombs that killed thousands of people,2597,0.94,104,,1687693674.0,False,False,False,False,False
53,14ifvr8,meirl,/r/meirl/comments/14ifvr8/meirl/,LateRendition,Meirl,6873,0.96,404,,1687678071.0,False,False,False,False,False
54,14iilft,UkraineWarVideoReport,/r/UkraineWarVideoReport/comments/14iilft/the_russian_army_special_unit_storm_z_which/,CatsofUkraine,"The Russian Army special unit ""Storm Z,"" which supported Wagner Group CEO Prigozhin in yesterday's attempted coup d'état against Russian President Vladimir Putin, is a little dismayed that Prigozhin abandoned them.",3398,0.96,334,,1687687746.0,False,False,False,False,False
55,14ibngc,news,/r/news/comments/14ibngc/south_carolina_fire_chief_who_pointed_gun_at/,Molire,South Carolina fire chief who pointed gun at teens who turned in his driveway is being sued,18532,0.96,615,,1687663762.0,False,False,False,False,False
56,14io06h,HumansBeingBros,/r/HumansBeingBros/comments/14io06h/bros_helping_an_owl_friend/,QuicklyThisWay,Bros helping an owl friend,1435,0.98,27,,1687704219.0,False,False,False,False,False
57,14iivk2,OnePunchMan,/r/OnePunchMan/comments/14iivk2/went_to_a_convention_and_this_happened/,ghoubi,Went to a convention and this happened....,3207,0.94,95,,1687688754.0,False,False,False,False,False
58,14ij9l0,CombatFootage,/r/CombatFootage/comments/14ij9l0/translated_disbandment_of_the_57th_motorized/,CatsofUkraine,Translated: Disbandment of the 57th motorized rifle brigade of the Russian Federation. The publication of some details of yesterday's operation Go-Pro video of soldiers of the 1st company of the 1st mechanized battalion of the Third Assault Brigade.,2831,0.95,173,,1687690146.0,False,False,False,False,False
59,14ijqu7,MadeMeSmile,/r/MadeMeSmile/comments/14ijqu7/i_used_to_tutor_special_needs_kids_in_highschool/,fg10037,I used to tutor special needs kids in highschool and one came to surprise me at work today!,5654,0.93,304,,1687691790.0,False,False,False,False,False
60,14ih98r,ImTheMainCharacter,/r/ImTheMainCharacter/comments/14ih98r/yeah_lets_just_be_thr_most_annoying_people_at_the/,Snake_Plissken224,"Yeah, let's just be thr most annoying people at the home depot....",4244,0.88,518,,1687682946.0,False,False,False,False,False
61,14ifz75,natureismetal,/r/natureismetal/comments/14ifz75/in_finland_temperature_gets_as_low_as_40c_in/,bislut997,"In Finland temperature gets as low as -40C in winter, the trees are covered in so much snow and frost that it looks like landscape from another planet",5362,0.95,146,,1687678430.0,False,False,False,False,False
62,14ihzke,insanepeoplefacebook,/r/insanepeoplefacebook/comments/14ihzke/a_bakerys_evaluation/,SnowWarms,A bakery's evaluation...,3510,0.97,111,,1687685543.0,False,False,False,False,False
63,14ikxgr,lgbt,/r/lgbt/comments/14ikxgr/i_just_remembered_that_bit_from_high_school_that/,Twighdark,"I just remembered that bit from High School. That woman was great, really strict, but just a cool human.",2077,0.97,42,:lesbian:/:grace-flag:/:Demigirl-flag:  Lesbian-Grace-demigirl,1687695659.0,False,False,False,False,False
64,14imbbo,formuladank,/r/formuladank/comments/14imbbo/totally_unbiased_opinion_from_lh44tobeyy_f1/,biryani-man,Totally unbiased opinion from LH44Tobeyy. F1 twitter is undefeated.,1688,0.93,220,BWOAHHHHHHH ,1687699694.0,False,False,False,False,False
65,14ii258,ich_iel,/r/ich_iel/comments/14ii258/ich_iel/,hypefor8wasjustabait,ich_iel,3539,0.95,93,,1687685809.0,True,False,False,False,False
66,14igawl,Animemes,/r/Animemes/comments/14igawl/netflix_one_piece_new_cast_reveal/,SmokingBouquets,Netflix One Piece new cast reveal,5192,0.94,78,,1687679591.0,False,False,False,False,False
67,14iiicp,Whatcouldgowrong,/r/Whatcouldgowrong/comments/14iiicp/taking_your_child_to_soft_play/,saboteur2011,Taking your child to soft play,3066,0.92,87,,1687687419.0,False,False,False,False,False
68,14ikcjw,CasualUK,/r/CasualUK/comments/14ikcjw/id_like_to_share_this_absolutely_banging_bargain/,borderlinebaggage,I’d like to share this absolutely banging bargain I just got from a British heart foundation charity shop. Full leather recliner for £5. I feel like I’ve won the lottery,2147,0.97,254,,1687693828.0,False,False,False,False,False
69,14iln2o,Damnthatsinteresting,/r/Damnthatsinteresting/comments/14iln2o/sorvagsvatn_the_lake_that_hangs_over_the_ocean/,Realistic-Song-199,"Sorvagsvatn, the lake that hangs over the ocean. Faroe islands.",3591,0.97,110,,1687697800.0,False,False,False,False,False
70,14ilan2,oddlyspecific,/r/oddlyspecific/comments/14ilan2/thats_a_lot_of_dicks/,Mammoth-Medicine1385,That’s a lot of dicks,1907,0.92,197,,1687696795.0,True,False,False,False,False
71,14ijwq2,EarthPorn,/r/EarthPorn/comments/14ijwq2/snapped_this_on_a_open_door_helicopter_ride/,ronhairabx,Snapped this on a open door helicopter ride through the Nā Pali Coast yesterday. [OC] [1920x1080],2271,0.96,43,,1687692339.0,False,False,False,False,False
72,14iepeb,WhitePeopleTwitter,/r/WhitePeopleTwitter/comments/14iepeb/the_new_predator_movie_just_dropped/,rhodesleadnowhere,The new predator movie just dropped,29027,0.9,1238,,1687673916.0,False,False,False,False,False
73,14iez5a,aww,/r/aww/comments/14iez5a/the_way_my_cat_gets_into_the_narrowest_place_in/,marehori,The way my cat gets into the narrowest place in the house (with John's reaction) [OC],5795,0.92,70,,1687674851.0,False,False,False,False,True
74,14ilmcu,WitchesVsPatriarchy,/r/WitchesVsPatriarchy/comments/14ilmcu/you_were_built_for_pleasure/,polkadotska,You were built for pleasure!,1647,0.96,19,✨Glitter Witch✨:kakuma:,1687697742.0,False,False,False,False,False
75,14igs3u,MemeVideos,/r/MemeVideos/comments/14igs3u/_/,Naymar083,🧊️ 👍,4553,0.94,79,,1687681249.0,False,False,False,False,False
76,14ihtj9,ireland,/r/ireland/comments/14ihtj9/have_you_already_watch_philomena_cunk_lol/,XCEREALXKILLERX,Have you already watch Philomena Cunk? Lol,3124,0.93,237,Dublin,1687684932.0,False,False,False,False,False
77,14ijm56,marvelstudios,/r/marvelstudios/comments/14ijm56/mcu_moments_that_will_always_make_you_cheer/,TheJack0fDiamonds,MCU moments that will always make you cheer everytime you see it,2256,0.79,502,Scarlet Witch,1687691335.0,False,False,False,False,False
78,14iht5d,Rabbits,/r/Rabbits/comments/14iht5d/we_let_our_widowed_bun_choose_a_new_wife_turns/,Epiphany7777,"We let our widowed bun choose a new wife, turns out he likes big ladies!",3129,0.97,64,:dol:,1687684892.0,False,False,False,False,False
79,14ijvop,maybemaybemaybe,/r/maybemaybemaybe/comments/14ijvop/maybe_maybe_maybe/,GeneralAlex,Maybe Maybe Maybe,2135,0.97,35,,1687692245.0,False,False,False,False,False
80,14ihxq6,meme,/r/meme/comments/14ihxq6/sir_yes_sir_i_dont_know_sir/,Hambruhgah,"Sir, yes sir. I don't know, sir",3241,0.97,20,,1687685369.0,False,False,False,False,False
81,14ikaun,Genshin_Impact,/r/Genshin_Impact/comments/14ikaun/sisters/,2bells1ravine,Sisters,1977,0.96,31,,1687693667.0,False,False,False,False,False
82,14iiq0e,anime_irl,/r/anime_irl/comments/14iiq0e/anime_irl/,the__daydream,ANIME_IRL,2534,0.98,77,,1687688201.0,False,False,False,False,False
83,14ig2yb,FunnyandSad,/r/FunnyandSad/comments/14ig2yb/uber_is_a_better_choice/,CuteAngryGirl,Uber is a better choice,4065,0.95,115,,1687678795.0,False,False,False,False,False
84,14igtsr,nextfuckinglevel,/r/nextfuckinglevel/comments/14igtsr/artist_creating_perspective_art/,Siil_Udus,Artist creating perspective art,7944,0.95,111,,1687681411.0,False,False,False,False,False
85,14ik9ww,WhatsWrongWithYourCat,/r/WhatsWrongWithYourCat/comments/14ik9ww/tasty_water_mmmm/,evahotie,Tasty water mmmm,1805,0.98,21,,1687693577.0,False,False,False,False,False
86,14ikfvi,AmItheAsshole,/r/AmItheAsshole/comments/14ikfvi/aita_for_not_telling_my_sister_i_put_chocolate_in/,ThrowawayCurrys,AITA for not telling my sister I put chocolate in my curry,3648,0.96,1300,,1687694125.0,False,False,False,False,False
87,14iivjn,trippinthroughtime,/r/trippinthroughtime/comments/14iivjn/what_a_great_diplomat/,esberat,What a great diplomat.,2299,0.94,3,,1687688753.0,False,False,False,False,False
88,14iia92,todayilearned,/r/todayilearned/comments/14iia92/til_about_bill_benter_a_gambler_who_wrote_an/,autumn-knight,"TIL about Bill Benter, a gambler who wrote an algorithm that helped him win nearly $1 billion on horse races.",5436,0.97,164,,1687686631.0,False,False,False,False,False
89,14iasvz,RandomThoughts,/r/RandomThoughts/comments/14iasvz/do_u_ever_feel_kinda_compelled_to_write_ur/,chesnutpraline,do u ever feel kinda compelled to write ur opinion in a comment but then get kinda tired while writing it and give up after deciding u dont really care enough in the moment to comment and erase it?,18157,0.91,1938,,1687661058.0,False,False,False,False,False
90,14ibf9l,cats,/r/cats/comments/14ibf9l/can_someone_explain_to_me_why_my_cat_will_just/,takeaabreath,Can someone explain to me why my cat will just sit and stare at me for minutes at a time? What does this mean in a cat’s world?,12570,0.97,1023,,1687663019.0,False,False,False,False,False
91,14ijtoc,tifu,/r/tifu/comments/14ijtoc/tifu_by_calling_out_another_mans_name_while_i/,Expensive_highland,TIFU by calling out another man’s name while I slept,1891,0.9,440,,1687692058.0,False,False,False,False,False
92,14id4ee,UpliftingNews,/r/UpliftingNews/comments/14id4ee/most_unionized_us_rail_workers_now_have_new_sick/,Karmanacht,Most unionized US rail workers now have new sick leave,6759,0.96,302,,1687668559.0,False,False,False,False,False
93,14ik2ue,memes,/r/memes/comments/14ik2ue/all_hail_our_noble_gentry/,PandoraNyxie,All hail our noble gentry 🧐 ,4076,0.97,36,🐼,1687692913.0,False,False,False,False,False
94,14iho3b,Hololive,/r/Hololive/comments/14iho3b/rack_to_the_future/,V-Faction,Rack to the Future,2838,0.95,46,:AkiRose::Amelia::Nene::Polka::Haato:,1687684384.0,False,False,False,False,False
95,14iluxk,oddlyterrifying,/r/oddlyterrifying/comments/14iluxk/sinking_of_amoco_cadiz_in_brittany_1978_looks/,Monsur_Ausuhnom,Sinking of Amoco Cadiz In Brittany 1978 Looks Like A Giant Whale Surfacing,1329,0.99,27,,1687698396.0,False,False,False,False,False
96,14i9cd2,gaming,/r/gaming/comments/14i9cd2/good_or_bad_games_it_doesnt_matter_i_have_massive/,Modo97,"Good or bad games? it doesn't matter, I have massive respect for games that still support Split-Screen ❤️",30040,0.9,996,,1687656612.0,False,False,False,False,False
97,14id7jw,Superstonk,/r/Superstonk/comments/14id7jw/why_i_love_this_company/,GinoF2020,Why I love this company,7825,0.91,176,,1687668859.0,False,False,False,False,False
98,14ifqd4,terriblefacebookmemes,/r/terriblefacebookmemes/comments/14ifqd4/my_uncle_posted_this/,SmokyDoky876,My uncle posted this,4076,0.92,225,,1687677523.0,False,False,False,False,False
99,14ibjba,Weird,/r/Weird/comments/14ibjba/opened_a_can_of_peaches_and_they_were_black_and/,Elly_frog,opened a can of peaches and they were black and smelt like fish??,12168,0.9,2713,,1687663376.0,False,False,False,False,False
100,14igx0r,MoldyMemes,/r/MoldyMemes/comments/14igx0r/yeah_i_play_genshin_impact/,shitpostH0F,“Yeah I play Genshin Impact”,3255,0.95,88,,1687681735.0,False,False,False,False,False
