rank,id,subreddit,permalink,author,title,score,upvote_ratio,num_comments,author_flair_text,created_utc,over_18,edited,stickied,locked,is_original_content
1,150x65j,ContagiousLaughter,/r/ContagiousLaughter/comments/150x65j/she_knows_her_short_king/,TurnedEvilAfterBan,She knows her short king,19320,0.96,115,,1689483812.0,False,False,False,False,False
2,150y1d5,facepalm,/r/facepalm/comments/150y1d5/the_power_of_unions_that_boomers_tend_to_forget/,PhysicalSeatz,The power of unions that boomers tend to forget,10284,0.97,138,,1689486652.0,False,False,False,False,False
3,150y1i0,Damnthatsinteresting,/r/Damnthatsinteresting/comments/150y1i0/shockwaves_from_an_explosion_from_different_angles/,_swuaksa8242211,Shockwaves from an explosion from different angles ,10190,0.95,491,Creator,1689486664.0,False,False,False,False,False
4,150z46v,nextfuckinglevel,/r/nextfuckinglevel/comments/150z46v/border_collies_run_freely_and_at_full_speed/,flyingcatwithhorns,Border collies run freely and at full speed,4952,0.98,175,,1689490305.0,False,False,False,False,False
5,150svoq,WhitePeopleTwitter,/r/WhitePeopleTwitter/comments/150svoq/going_down_with_the_ship/,Twelve-Majestic-Lies,Going down with the ship,28633,0.93,1086,,1689470509.0,False,False,False,False,False
6,150ui4f,MadeMeSmile,/r/MadeMeSmile/comments/150ui4f/taking_their_96yearold_grandpa_back_to_ireland/,handlewithcareme,Taking their 96-year-old grandpa back to Ireland 🇮🇪 credit: juliethulll,14349,0.97,370,,1689475354.0,False,False,False,False,False
7,150yo2j,memes,/r/memes/comments/150yo2j/this_is_getting_absurd/,blurry_face_exe,This is getting absurd,4184,0.98,237,,1689488740.0,False,False,False,False,False
8,150wznf,oddlysatisfying,/r/oddlysatisfying/comments/150wznf/the_clearest_water_that_i_have_ever_seen_besides/,Lele20111,The clearest water that I have ever seen (besides tap water),5158,0.95,160,,1689483245.0,False,False,False,False,False
9,150vtsa,AnimalsBeingDerps,/r/AnimalsBeingDerps/comments/150vtsa/monday_mornings/,MikeR_Incredible,Monday mornings,5902,0.98,80,,1689479499.0,False,False,False,False,False
10,150rffh,CrazyFuckingVideos,/r/CrazyFuckingVideos/comments/150rffh/boxer_flashes_the_crowd_on_live_tv_after_first_win/,Grace_God,Boxer flashes the crowd on live tv after first win,20597,0.92,1389,,1689466359.0,True,False,False,False,False
11,150ska3,nba,/r/nba/comments/150ska3/a_drunk_charles_barkley_delivers_a_sequel_to_an/,Sp_Gamer_Live,A drunk Charles Barkley delivers a sequel to an all time moment and defends the LGBTQ+ community again,10421,0.92,711,:min-1: Timberwolves,1689469581.0,False,False,False,False,False
12,150q89x,todayilearned,/r/todayilearned/comments/150q89x/til_there_are_consumers_who_are_known_as/,laik72,"TIL There are consumers who are known as Harbingers of Failure. They have a knack for buying products that turn out to be market flops. ""when the harbingers buy a product at least three times, it’s really bad news: The probability of success for that product drops 56 percent.""",19513,0.95,2423,,1689463150.0,False,False,False,False,False
13,15117u9,anime_irl,/r/anime_irl/comments/15117u9/anime_irl/,sloppyKnob_69,anime_irl,1819,0.98,44,,1689497625.0,False,False,False,False,False
14,150x6g8,TikTokCringe,/r/TikTokCringe/comments/150x6g8/colloidal_silver/,choganoga,Colloidal silver ,3662,0.98,216,tHiS iSn’T cRiNgE,1689483838.0,False,False,False,False,False
15,150ozmc,news,/r/news/comments/150ozmc/twitter_has_lost_50_in_ad_revenue_and_is_now_cash/,smiledrs,Twitter has lost 50% in ad revenue and is now cash flow negative.,40789,0.91,3202,,1689459989.0,False,False,False,False,False
16,150ouqq,antiwork,/r/antiwork/comments/150ouqq/ppp_fraud_is_worst_in_history_200b_stolen_and/,IcyHeartWarmSmile,"PPP fraud is ‘worst in history’: $200B stolen and blown on Lamborghinis, beach houses and bling",24021,0.96,1039,,1689459655.0,False,False,False,False,False
17,150qwjs,maybemaybemaybe,/r/maybemaybemaybe/comments/150qwjs/maybe_maybe_maybe/,Firm_Matter7435,Maybe Maybe Maybe,18691,0.92,242,,1689464938.0,False,False,False,True,False
18,150u3xl,WatchPeopleDieInside,/r/WatchPeopleDieInside/comments/150u3xl/man_struggling_against_a_dryer_for_dominion_over/,Fyroth,Man struggling against a dryer for dominion over his soul.,6444,0.96,208,"Not mad, just disappointed",1689474167.0,False,False,False,False,False
19,150v06r,BrandNewSentence,/r/BrandNewSentence/comments/150v06r/even_the_kkk_is_getting_woke_these_days/,AlfredusRexSaxonum,Even the KKK is getting woke these days,4930,0.98,253,,1689476887.0,False,False,False,False,False
20,1510l9f,marvelmemes,/r/marvelmemes/comments/1510l9f/when_you_are_an_immortal_and_the_other_two_isnt/,chasing_enigma,When you are an immortal and the other two isn't.,1751,0.96,25,Avengers,1689495349.0,False,False,False,False,False
21,150yjy3,HolUp,/r/HolUp/comments/150yjy3/what_was_he_thinking/,flyingcatwithhorns,What was he thinking,2609,0.93,281,,1689488346.0,False,False,False,False,False
22,150sggw,mildlyinfuriating,/r/mildlyinfuriating/comments/150sggw/i_spent_months_working_building_and_painting_in/,Psynts,I spent months working building and painting in an immersive art experience and this guy is selling prints of AI art there.,11949,0.8,1392,,1689469290.0,False,False,False,False,False
23,150u9df,therewasanattempt,/r/therewasanattempt/comments/150u9df/to_teach_to_say_no_to_strangers/,SweetyByHeart,To teach to say no to strangers,5311,0.96,137,,1689474629.0,False,False,False,False,False
24,150viow,Damnthatsinteresting,/r/Damnthatsinteresting/comments/150viow/brilliant_but_cruel_at_least_feed_it_one_last_time/,TurnedEvilAfterBan,"Brilliant but cruel, at least feed it one last time",21986,0.94,706,,1689478511.0,False,False,False,False,False
25,15127xg,gifs,/r/gifs/comments/15127xg/heres_something_to_brighten_up_your_day/,OscarWoods5,Here's something to brighten up your day,1234,0.91,33,,1689501132.0,False,False,False,False,False
26,150uzpw,StupidFood,/r/StupidFood/comments/150uzpw/the_most_deranged_katsudon_you_will_ever_see/,TemporaryAttacker,The most deranged Katsudon you will ever see,4293,0.87,1110,,1689476843.0,False,False,False,False,False
27,150o598,PublicFreakout,/r/PublicFreakout/comments/150o598/thats_one_way_to_celebrate_a_win/,panserstrek,That’s one way to celebrate a win,20251,0.93,942,,1689457904.0,True,False,False,False,False
28,150yumm,formuladank,/r/formuladank/comments/150yumm/totos_young_apprentice/,NaduvanaKrmaca,Toto's young apprentice.,2039,0.98,44,BWOAHHHHHHH ,1689489379.0,False,False,False,False,False
29,150yjvv,dankmemes,/r/dankmemes/comments/150yjvv/do_not_pass_go_do_not_collect_200/,LoveThieves,"Do not pass GO, do not collect $200",2185,0.98,39,,1689488341.0,False,False,False,False,False
30,150sxkn,politics,/r/politics/comments/150sxkn/its_not_fair_florida_vocal_coach_turned_capitol/,Aprilias,‘It’s Not Fair’: Florida Vocal Coach Turned Capitol Rioter Gets 6 Years,5402,0.97,690,,1689470667.0,False,False,False,False,False
31,150zxun,ChatGPT,/r/ChatGPT/comments/150zxun/i_bet_you_got_it_wrong_in_first_glance/,joy-lol,I bet you got it wrong in first glance,1606,0.95,95,,1689493137.0,False,False,False,False,False
32,150pi1c,goldenretrievers,/r/goldenretrievers/comments/150pi1c/lost_my_boy_today_ill_remember_him_like_this/,jsmith19977,"Lost my boy today, I'll remember him like this",10346,0.96,244,,1689461298.0,False,False,False,False,False
33,150rhf5,OneOrangeBraincell,/r/OneOrangeBraincell/comments/150rhf5/i_dont_know_who_needs_to_hear_this_but_walter/,whateverislovely,I don’t know who needs to hear this but Walter Cronkat wants you to know it’s gonna be okay,6551,0.97,118,,1689466517.0,False,False,False,False,False
34,150re5a,technology,/r/technology/comments/150re5a/musk_says_a_50_drop_in_ad_revenue_for_twitter_is/,lucerousb,Musk says a 50% drop in ad revenue for Twitter is causing negative cash flow,6295,0.95,1051,,1689466260.0,False,False,False,False,False
35,150q28y,tifu,/r/tifu/comments/150q28y/tifu_sucking_dick/,watwatwahwah,TIFU sucking dick,11777,0.81,2473,,1689462712.0,True,False,False,False,False
36,150rlkf,tumblr,/r/tumblr/comments/150rlkf/the_power_of_friendship/,DrAldrin,The power of friendship,7050,0.98,30,,1689466833.0,False,False,False,False,False
37,150ydo3,shitposting,/r/shitposting/comments/150ydo3/those_were_the_days_glory_to_spez/,itshimstarwarrior,Those were the days (Glory to Spez),1985,0.98,26,I want pee in my ass :slitheen:,1689487772.0,False,False,False,False,False
38,150rrmr,Satisfyingasfuck,/r/Satisfyingasfuck/comments/150rrmr/worker_unclogs_drain_causing_highway_flood/,AuthorizedDrummi,Worker unclogs drain causing highway flood,6123,0.96,266,,1689467304.0,False,False,False,False,False
39,150qaiq,meirl,/r/meirl/comments/150qaiq/meirl/,astralrig96,meirl,8827,0.99,63,,1689463310.0,False,False,False,False,False
40,150ug49,2meirl4meirl,/r/2meirl4meirl/comments/150ug49/2meirl4meirl/,Brent_Fox,2meirl4meirl,3660,0.95,80,,1689475194.0,False,False,False,False,False
41,150y4q9,HonkaiStarRail,/r/HonkaiStarRail/comments/150y4q9/so_we_are_shipping_yaoshi_and_lan_now_huh/,Boss_of_babylonia,So we are shipping yaoshi and Lan now huh???,1892,0.94,164,,1689486964.0,False,False,False,False,False
42,150y2xa,DiWHY,/r/DiWHY/comments/150y2xa/fixing_a_car_door/,tjger,Fixing a car door,1879,0.87,114,,1689486799.0,False,False,False,False,False
43,150uv8x,gaming,/r/gaming/comments/150uv8x/am_i_the_only_one_who_legit_hasnt_been_this/,joezcoolio,Am I the only one who legit hasn't been this excited for gaming in about a decade?,3425,0.77,1161,,1689476470.0,False,False,False,False,False
44,150ru0c,space,/r/space/comments/150ru0c/rugged_mars_has_taken_big_bites_out_of_the/,Davicho77,Rugged Mars has taken big bites out of the Curiosity rover's wheels. Credit: NASA/JPL-Caltech,5053,0.97,269,,1689467484.0,False,False,False,False,False
45,150nvug,HumansBeingBros,/r/HumansBeingBros/comments/150nvug/window_washers_wear_superhero_costumes_for_the/,westcoastcdn19,Window washers wear superhero costumes for the kids at Norton Children’s hospital,11474,0.97,109,,1689457256.0,False,False,False,False,False
46,150labs,subway,/r/subway/comments/150labs/someone_forgot_to_put_the_bread_in_the_fridge/,xoze44,Someone forgot to put the bread in the fridge last night...,45291,0.96,1495,,1689450792.0,False,False,False,False,False
47,150owch,shittymoviedetails,/r/shittymoviedetails/comments/150owch/in_barbie_2023_many_characters_look_at_barbies/,Hendrick_Davies64,"In Barbie (2023), many characters look at Barbie’s feet with amazement, this is a reference to Morgot Robbie having the highest rating on wikifeet",10346,0.95,241,,1689459765.0,False,False,False,False,False
48,150o32b,BlackPeopleTwitter,/r/BlackPeopleTwitter/comments/150o32b/auntie_is_cookin/,PhotosByVicky,Auntie is cookin’!,9855,0.94,678,☑️,1689457761.0,False,False,False,False,False
49,150rjo4,comics,/r/comics/comments/150rjo4/reflective_man/,LastPlaceComics,Reflective Man,5375,0.97,39,,1689466685.0,False,False,False,False,True
50,150tzp6,Weird,/r/Weird/comments/150tzp6/accidentally_left_my_car_unlocked_and_when_i_came/,Snarkovic,"Accidentally left my car unlocked and when I came back, I found a bunch of plastic babies",3517,0.95,353,,1689473815.0,False,False,False,False,False
51,150puhl,WorkReform,/r/WorkReform/comments/150puhl/lets_do_it_again/,zzill6,Let's Do It Again!,6457,0.98,79,🤝 Join A Union,1689462162.0,False,False,False,False,False
52,150tiee,PeterExplainsTheJoke,/r/PeterExplainsTheJoke/comments/150tiee/hey_petah_saw_this_on_the_musk_network_can_you/,GCDice,"Hey Petah, saw this on the Musk network, can you help and explain this?",3820,0.95,142,,1689472401.0,False,False,False,False,False
53,151025c,Hololive,/r/Hololive/comments/151025c/mori_lovelia/,V-Faction,Mori + Lovelia,1164,0.97,27,:AkiRose::Amelia::Nene::Polka::Haato:,1689493537.0,False,False,False,False,False
54,150rz05,facepalm,/r/facepalm/comments/150rz05/earth_half_day_and_half_night/,CarolineGreyson,Earth half day and half night,32006,0.96,1627,,1689467876.0,False,False,False,False,False
55,150x6xp,Genshin_Impact,/r/Genshin_Impact/comments/150x6xp/a_normal_day_in_not_teyvat/,RkSHaaN249,A normal day in not Teyvat,1866,0.98,37,,1689483880.0,False,False,False,False,False
56,1511jtb,arknights,/r/arknights/comments/1511jtb/akss_unkindled/,Octodeco,[AK-SS] Unkindled,836,0.98,55,,1689498755.0,False,False,False,False,False
57,150kobh,pettyrevenge,/r/pettyrevenge/comments/150kobh/i_put_vegetables_in_all_my_food_to_stop_my/,veggieevengeance,I put vegetables in all my food to stop my roommate's kid from eating it. Mom threatens LEGAL action,22450,0.94,2798,,1689449214.0,False,1689449781.0,False,False,False
58,150yo8p,JustGuysBeingDudes,/r/JustGuysBeingDudes/comments/150yo8p/watching_old_videos_of_dad_on_fathers_day/,ironsteel9011,Watching old videos of dad on father's day,1395,0.99,18,,1689488757.0,False,False,False,False,False
59,150nyix,BeAmazed,/r/BeAmazed/comments/150nyix/just_a_chick_in_a_skatepark_doing_flips_on/,No_Stock160,Just a chick in a skatepark doing flips on rollerskates,8829,0.93,476,,1689457442.0,False,False,False,False,False
60,150ww4j,UpliftingNews,/r/UpliftingNews/comments/150ww4j/carlee_russell_who_disappeared_from_alabama_i459/,SomeToLaughAt,Carlee Russell who disappeared from Alabama I459 after stopping to help a child has been found alive,1846,0.97,145,,1689482927.0,False,False,False,False,False
61,150qf0l,IllegallySmolCats,/r/IllegallySmolCats/comments/150qf0l/the_gremlins_in_my_garage_are_3_weeks_old_today/,budhorse4,The gremlins in my garage are 3 weeks old today,5372,0.98,105,,1689463634.0,False,False,False,False,False
62,15128op,Unexpected,/r/Unexpected/comments/15128op/my_worst_nightmare/,Saitama_ssa_Diciple,My worst nightmare,774,0.97,79,,1689501205.0,False,False,False,False,False
63,150saiq,whenthe,/r/whenthe/comments/150saiq/india_why_that_wasnt_necessary/,Arrow_of_time6,India why? That wasn’t necessary.,4384,0.98,108,,1689468813.0,False,False,False,False,False
64,150oii4,ThatsInsane,/r/ThatsInsane/comments/150oii4/guy_goes_to_the_waterpark_but_doesnt_know_how_to/,WeAreTheBaddiess,Guy goes to the waterpark but doesn't know how to swim,7574,0.96,610,,1689458800.0,False,False,False,False,False
65,150ujl9,ufc,/r/ufc/comments/150ujl9/funniest_shit_ive_seen_in_awhile/,EAZ480,Funniest shit I’ve seen in awhile,2638,0.95,230,,1689475484.0,False,False,False,False,False
66,150wxg5,CozyPlaces,/r/CozyPlaces/comments/150wxg5/the_greenhouse_my_husband_built/,westymama,The greenhouse my husband built.,1776,0.98,28,,1689483045.0,False,False,False,False,True
67,150ucc3,discordVideos,/r/discordVideos/comments/150ucc3/faded_my_personal_number_1/,MarkDecent656,Faded my personal number 1,2813,0.97,93,,1689474877.0,False,False,False,False,False
68,150m4e2,worldnews,/r/worldnews/comments/150m4e2/ukraine_rejects_bulgarian_presidents_claims_that/,green_flash,Ukraine Rejects Bulgarian President’s Claims That Kyiv Is to Be Blamed for Russia’s Ongoing War,9680,0.94,556,,1689452873.0,False,False,False,False,False
69,150vt0w,memes,/r/memes/comments/150vt0w/fooking_damn_skynet/,SpottyJaggy,fooking damn skynet,6604,0.97,90,,1689479440.0,False,False,False,False,False
70,150k18f,golf,/r/golf/comments/150k18f/steph_curry_with_a_hole_in_one_at_the_american/,B_M_Fahrtz,Steph Curry with a Hole in One at the American Century Championship,15985,0.94,845,,1689447651.0,False,False,False,False,False
71,150vkwi,pics,/r/pics/comments/150vkwi/john_oliver_and_i_have_14000_cookies_to_share/,JacksmackDave,"John Oliver and I have 14,000 cookies to share with everyone... Reply for some empty calories.",2073,0.84,2299,,1689478712.0,False,False,False,False,False
72,150w8sp,teenagers,/r/teenagers/comments/150w8sp/what_is_your_honest_opinion_of_the_idea_that/,YourMomsMemeWhore,What is your honest opinion of the idea that women should be able to walk around topless?,1914,0.93,1022,,1689480838.0,True,1689485814.0,False,False,False
73,150uddl,LeopardsAteMyFace,/r/LeopardsAteMyFace/comments/150uddl/elon_musk_says_twitters_ad_revenue_is_down_50_and/,pobregatito,Elon Musk says Twitter's ad revenue is down 50% and cash flow is negative | CNN Business,2481,0.97,317,,1689474957.0,False,False,False,False,False
74,150zdwm,midjourney,/r/midjourney/comments/150zdwm/lets_face_it_this_is_the_most_stereotypical/,marehori,"Let's face it, THIS is the most stereotypical person of a *country*",1073,0.93,251,,1689491201.0,False,False,False,False,False
75,150robv,distressingmemes,/r/distressingmemes/comments/150robv/recreated_this_meme_with_an_ambience/,stranded_patriot,recreated this meme with an ambience,4082,0.97,68,,1689467046.0,False,False,False,False,False
76,150os6z,Economics,/r/Economics/comments/150os6z/ppp_fraud_is_worst_in_history_200b_stolen_and/,IcyHeartWarmSmile,"PPP fraud is ‘worst in history’: $200B stolen and blown on Lamborghinis, beach houses and bling",5565,0.96,462,,1689459478.0,False,False,False,False,False
77,150jtie,funny,/r/funny/comments/150jtie/the_ultimate_weapon/,Alucard__07,The ultimate weapon,15446,0.95,453,,1689447097.0,False,False,False,False,False
78,150udgm,baseball,/r/baseball/comments/150udgm/highlight_the_mets_allow_a_run_in_the_9th_as/,amatom27,[Highlight] The Mets allow a run in the 9th as Brett Baty misjudges a routine popup,2352,0.95,589,Philadelphia Phillies :phi2:,1689474965.0,False,False,False,False,False
79,150obyh,technicallythetruth,/r/technicallythetruth/comments/150obyh/got_to_give_it_to_them_never_seen_a_20_year_old/,FoobarWreck,Got to give it to them. Never seen a 20 year old with a teen pregnancy,7129,0.99,74,,1689458382.0,False,False,False,False,False
80,150rbcf,WhitePeopleTwitter,/r/WhitePeopleTwitter/comments/150rbcf/mark_cuban_absolutely_dragging_elon_is_class/,districtcourt,Mark Cuban absolutely dragging Elon is class warfare I can get behind,12681,0.98,282,,1689466041.0,False,False,False,False,False
81,150w34a,funnyvideos,/r/funnyvideos/comments/150w34a/finally_found_his_love/,padmanabhapillai,Finally found his love ,1806,0.94,31,,1689480308.0,False,False,False,False,False
82,150x5mp,AbsoluteUnits,/r/AbsoluteUnits/comments/150x5mp/osaka_aquarium_just_stepped_up_their_gift_shop/,EstherRWhittle,Osaka Aquarium just stepped up their gift shop game with these fat seal plushies,1488,0.96,40,,1689483771.0,False,False,False,False,False
83,150s6uo,Eldenring,/r/Eldenring/comments/150s6uo/wyd_in_this_situation/,Distantfutures,wyd in this situation?,3373,0.97,220,,1689468511.0,False,False,False,False,False
84,150ty8h,Tattoocoverups,/r/Tattoocoverups/comments/150ty8h/before_and_after_thank_you_all_for_the_kind_words/,CodeMoo42,"Before and after, thank you all for the kind words :)",2419,0.92,287,,1689473699.0,False,False,False,False,False
85,150wvvf,oddlysatisfying,/r/oddlysatisfying/comments/150wvvf/filling_the_space_with_a_bouncing_square/,1wdcvfe23rgbnht4,filling the space with a bouncing square,3843,0.94,45,,1689482904.0,False,False,False,False,False
86,150pv99,PrequelMemes,/r/PrequelMemes/comments/150pv99/only_a_sith_deals_in_absolutes/,stunk_funky,Only a Sith deals in absolutes.,4879,0.95,84,,1689462214.0,False,False,False,False,False
87,150v2t4,diablo4,/r/diablo4/comments/150v2t4/after_330_hours_playing_sorceress/,HiTmAn4777,After 330 hours playing Sorceress,2001,0.93,528,,1689477113.0,False,1689487549.0,False,False,False
88,150vrju,AnarchyChess,/r/AnarchyChess/comments/150vrju/new_response_just_dropped/,Beautiful-Iron-2,New Response Just dropped,1803,0.98,52,":fischer:  Mod - He who declines en passant, accepts dishonor",1689479307.0,False,False,False,False,False
89,150us1i,TwoXChromosomes,/r/TwoXChromosomes/comments/150us1i/boyfriend_said_he_wanted_a_break_in_our/,Unknownreality7,Boyfriend said he wanted a break in our relationship to focus on his career. I broke up with him.,2069,0.93,136,,1689476207.0,False,False,False,False,False
90,15100tv,Catswithjobs,/r/Catswithjobs/comments/15100tv/archaeological_site_guard/,BTNTR,Archaeological site guard,850,0.99,17,,1689493413.0,False,False,False,False,False
91,150vm9h,wholesomememes,/r/wholesomememes/comments/150vm9h/thats_nice_of_them/,Brent_Fox,That's nice of them:,1812,0.97,28,,1689478840.0,False,False,False,False,False
92,150yka2,CombatFootage,/r/CombatFootage/comments/150yka2/russia_shooting_at_ukrainian_surface_drone_attack/,oblivion_bound,Russia shooting at Ukrainian surface drone attack in Sevastopol this morning,1088,0.98,97,,1689488380.0,False,False,False,False,False
93,150l0es,lotrmemes,/r/lotrmemes/comments/150l0es/today_i_discovered_the_fellowships_matching/,nirnrootsandwich,Today I discovered the Fellowship's matching tattoos,11561,0.96,361,,1689450067.0,False,False,False,False,False
94,15109qz,ClashRoyale,/r/ClashRoyale/comments/15109qz/baby_dragon_evolution_concept/,MehmetSalihKoten,Baby Dragon Evolution Concept,809,0.97,60,The Log :TheLog:,1689494263.0,False,False,False,False,False
95,150uz5l,SipsTea,/r/SipsTea/comments/150uz5l/playing_her_cello/,sandwichmclee,Playing her cello ,1960,0.93,165,,1689476788.0,False,False,False,False,False
96,15118kj,CasualUK,/r/CasualUK/comments/15118kj/scaffolders_turned_up_at_my_house_at_8am_on_a/,sockhead99,Scaffolders turned up at my house at 8am on a Sunday. They should have been here 3 weeks ago. I declared war by talking to them with a brew in hand and not offering them one.,662,0.96,93,,1689497695.0,False,False,False,False,False
97,150joqz,FunnyandSad,/r/FunnyandSad/comments/150joqz/1_rich_people_ignored_to_pay_their_taxes/,LongjumpingCanz,1% rich people ignored to pay their taxes,13732,0.94,339,,1689446765.0,False,False,False,False,False
98,150uuv0,popculturechat,/r/popculturechat/comments/150uuv0/whos_the_most_stunning_woman_youve_ever_seen_from/,MacaroniMistress,Who’s the most stunning woman you’ve ever seen from any era?,1948,0.88,1391,oh my god you look like the 4th of july 🧨🌭,1689476441.0,False,False,False,False,False
99,150zbrh,MadeMeSmile,/r/MadeMeSmile/comments/150zbrh/you_matter_man_or_girl_whoever_you_are/,Ocelot859,"""You matter, man... or girl... whoever you are""",2239,0.97,82,,1689490998.0,False,False,False,False,False
100,150z44w,WinStupidPrizes,/r/WinStupidPrizes/comments/150z44w/more_geniuslevel_protesting/,griptuba,More genius-level protesting...,959,0.88,165,,1689490300.0,False,False,False,False,False
