rank,id,subreddit,permalink,author,title,score,upvote_ratio,num_comments,author_flair_text,created_utc,over_18,edited,stickied,locked,is_original_content
1,14z17m6,toptalent,/r/toptalent/comments/14z17m6/longest_womens_elbow_plank_4_hours_20_minutes/,Crowxzn,"Longest women's elbow plank, 4 hours, 20 minutes (Dana Glowacka, 48)",14749,0.95,1009,,1689294229.0,False,False,False,False,False
2,14yyuif,MadeMeSmile,/r/MadeMeSmile/comments/14yyuif/we_can_all_be_heroes/,Solo_Odyssey,We can all be heroes,30944,0.96,563,,1689288031.0,False,False,False,False,False
3,14yxku2,Damnthatsinteresting,/r/Damnthatsinteresting/comments/14yxku2/the_bees_in_candyman_are_real_including_the_ones/,Connecting_to_audio,"The bees in Candyman are real including the ones in Tony Todds's mouth. The actor agreed to the stunt on the condition he would receive $1,000 for every bee sting he endured, which ended up being 23.",37838,0.97,655,,1689284947.0,False,False,False,False,False
4,14yy5uo,subway,/r/subway/comments/14yy5uo/yall_im_fucked/,sleepparalysisagain,Y’all i’m fucked,49140,0.93,3615,,1689286349.0,False,False,False,True,False
5,14yz80m,BrandNewSentence,/r/BrandNewSentence/comments/14yz80m/teen_mom_adds_fentanyl_to_bottle_thinking_it_was/,FitzyFarseer,Teen mom adds fentanyl to bottle thinking it was cocaine,11299,0.96,721,,1689288985.0,False,False,False,False,False
6,14ywkvb,politics,/r/politics/comments/14ywkvb/house_ethics_committee_revives_matt_gaetz_sex/,elisart,House Ethics Committee Revives Matt Gaetz Sex Misconduct Probe,16192,0.97,432,,1689282516.0,False,False,False,False,False
7,14yx0hp,WhitePeopleTwitter,/r/WhitePeopleTwitter/comments/14yx0hp/anything_other_than_a_manwoman_to_seek_services/,Ladydi-bds,"""anything other than a man/woman"" to ""seek services at a local pet groomer.""",16315,0.95,1531,,1689283561.0,False,False,False,False,False
8,14yzupc,TikTokCringe,/r/TikTokCringe/comments/14yzupc/drag_queens_on_a_college_campus_how_dare_they_s/,Boring_Cobbler7058,Drag Queens On a College Campus???!!! How dare they!! /s ,8201,0.86,892,,1689290586.0,False,False,False,False,False
9,14z0gqi,funny,/r/funny/comments/14z0gqi/ladies_are_they_always_this_uh_descriptive_when/,shadhead1981,"Ladies, are they always this, uh, descriptive when taking down waxing instructions?",6568,0.96,597,,1689292206.0,False,False,False,False,False
10,14yyxl1,worldnews,/r/worldnews/comments/14yyxl1/biden_orders_3000_reservists_to_be_ready_for/,VictorEmmanuelIV,"Biden orders 3,000 reservists to be ready for Europe deployments",8311,0.94,684,,1689288250.0,False,False,False,False,False
11,14yu0jf,antiwork,/r/antiwork/comments/14yu0jf/breaking_the_160000_actors_recording_artists/,theworkeragency,"BREAKING: The 160,000 actors, recording artists, stunt performers & media professionals of @sagaftra are officially on strike. It’s the first time since 1960 that writers and actors have been on strike at the same time. They’re shutting Hollywood down.",33081,0.93,2198,,1689276516.0,False,False,False,False,False
12,14ywflu,JustGuysBeingDudes,/r/JustGuysBeingDudes/comments/14ywflu/hello_there/,mo_aly1907,Hello there,12706,0.96,182,,1689282180.0,False,False,False,False,False
13,14z2901,nextfuckinglevel,/r/nextfuckinglevel/comments/14z2901/rainbow_above_clouds/,Standard-Salt-6628,Rainbow above clouds,4200,0.98,123,,1689297136.0,False,False,False,False,False
14,14yzz0s,todayilearned,/r/todayilearned/comments/14yzz0s/til_dan_savage_the_american_author_who_founded/,dustofoblivion123,"TIL Dan Savage, the American author who founded the non-profit organization ""It Gets Better Project"" in 2010, is also known for coining, in 2001, the term 'pegging"" to describe a woman anally penetrating a man with a strap-on dildo.",5813,0.94,348,,1689290906.0,True,False,False,False,False
15,14z11p2,BlackPeopleTwitter,/r/BlackPeopleTwitter/comments/14z11p2/somebody_needs_to_check_for_a_pulse/,districtcourt,Somebody needs to check for a pulse,4743,0.95,76,,1689293761.0,False,False,False,False,False
16,14yxi40,Weird,/r/Weird/comments/14yxi40/my_friend_found_this_sign_in_a_cabin_which_freaks/,shingooshmoojiii,My friend found this sign in a cabin which freaks me out...? Any idea...?,9375,0.96,1141,,1689284754.0,False,False,False,False,False
17,14ytdwf,news,/r/news/comments/14ytdwf/twitter_owes_exemployees_500_million_in_severance/,JustJohn8,"Twitter owes ex-employees $500 million in severance, lawsuit claims",20052,0.94,888,,1689275061.0,False,False,False,False,False
18,14z1w8z,ThatsInsane,/r/ThatsInsane/comments/14z1w8z/wet_ass_pussy_vs_baby_its_cold_outside/,That-Security9642,Wet Ass Pussy vs Baby It's Cold Outside...,3961,0.88,574,,1689296155.0,False,False,False,False,False
19,14yu2ho,doordash,/r/doordash/comments/14yu2ho/caught_red_handed/,tatted_gamer_666,Caught red handed 😂,16210,0.97,448,,1689276641.0,False,False,False,False,False
20,14yuhet,oddlyterrifying,/r/oddlyterrifying/comments/14yuhet/poor_matthew/,smoothloam,Poor Matthew,15074,0.98,334,,1689277615.0,False,False,False,False,False
21,14z3gxp,HumansBeingBros,/r/HumansBeingBros/comments/14z3gxp/a_real_hero/,xzotc,A real hero,2674,0.96,69,,1689300600.0,False,False,False,False,False
22,14yuv2h,wholesome,/r/wholesome/comments/14yuv2h/just_batman_doin_batman_stuff/,icutfarts,just batman doin' batman stuff,12297,0.95,240,,1689278551.0,False,False,False,False,False
23,14yz1h5,Unexpected,/r/Unexpected/comments/14yz1h5/i_think_i_had_enough_internet_for_today/,PsychoDDRQ,i think i had enough internet for today,5569,0.89,352,,1689288526.0,True,False,False,False,False
24,14ytv8q,NoStupidQuestions,/r/NoStupidQuestions/comments/14ytv8q/what_does_it_mean_when_people_from_canada_and_us/,NibbleMyRectum,What does it mean when people from Canada and US say chamungus in meetings?,10791,0.93,2701,,1689276170.0,False,False,False,False,False
25,14yyy8c,mildlyinfuriating,/r/mildlyinfuriating/comments/14yyy8c/been_wondering_why_my_measurements_been_off/,NewCrazyReality,Been wondering why my measurements been off.,4729,0.97,258,,1689288296.0,False,False,False,False,False
26,14yqyfn,facepalm,/r/facepalm/comments/14yqyfn/journalist_think_the_red_barons_aircraft_is_a/,Aki008035,Journalist think The Red Baron's Aircraft is a Nazi Aircraft,40310,0.93,2888,,1689269392.0,False,False,False,False,False
27,14ywl3c,memes,/r/memes/comments/14ywl3c/anyone_not_experience_this_during_their_childhood/,pantherghast,Anyone not experience this during their childhood?,7167,0.99,172,,1689282533.0,False,False,False,False,False
28,14ys1mq,nottheonion,/r/nottheonion/comments/14ys1mq/rfk_jr_press_dinner_screaming_match_over_climate/,goatofmind,RFK Jr press dinner screaming match over climate crisis ends with columnist launching his own natural gas,12932,0.93,1252,,1689271905.0,False,False,False,False,False
29,14yso3f,Fauxmoi,/r/Fauxmoi/comments/14yso3f/christopher_nolan_has_announced_that_the_cast_of/,Ximiso,Christopher Nolan has announced that the cast of ‘OPPENHEIMER’ has left the premiere to ‘go and write their pickets’ and join the strike.,10352,0.96,462,societal collapse is in the air,1689273379.0,False,False,False,False,False
30,14ywmql,BeAmazed,/r/BeAmazed/comments/14ywmql/wait_for_it/,BG_fourteen,Wait for it.,5964,0.93,437,,1689282636.0,False,False,False,False,False
31,14yt5jj,nba,/r/nba/comments/14yt5jj/comedian_ryan_davis_tells_no_lies_about_kevin/,MTRIFE,Comedian Ryan Davis tells no lies about Kevin Durant,9279,0.94,1134,,1689274538.0,True,False,False,False,False
32,14z349d,rupaulsdragrace,/r/rupaulsdragrace/comments/14z349d/shes_got_my_vote/,adrianna1903,She’s got my vote,2128,0.97,146,Mother Sasha,1689299615.0,False,False,False,False,False
33,14yv4zr,cats,/r/cats/comments/14yv4zr/first_time_adopting_two_brothers_they_wont_leave/,forteborte,"first time adopting, two brothers, they wont leave my sight when i use the restroom?",7303,0.99,534,,1689279207.0,False,False,False,False,False
34,14yprx3,technology,/r/technology/comments/14yprx3/its_official_smartphones_will_need_to_have/,f50ci31y,It's official: Smartphones will need to have replaceable batteries by 2027,20479,0.96,1983,,1689266559.0,False,False,False,False,False
35,14yr8uz,comics,/r/comics/comments/14yr8uz/a_different_kind_of_coming_out_details_in_comment/,Main-Salamander-6687,A different kind of coming out (details in comment),19657,0.88,516,,1689270061.0,False,False,False,False,False
36,14yuv3k,therewasanattempt,/r/therewasanattempt/comments/14yuv3k/to_escape/,Wtf_happen,To escape.,7598,0.95,462,,1689278553.0,False,False,False,False,False
37,14yzdev,marvelmemes,/r/marvelmemes/comments/14yzdev/i_got_a_lot_in_mind_lol/,BuddyLoud6062,I got a lot in mind lol.,3771,0.92,3195,Avengers,1689289355.0,False,False,False,False,False
38,14z38rz,oddlysatisfying,/r/oddlysatisfying/comments/14z38rz/replacing_a_horseshoe/,rco888,Replacing a horseshoe,2007,0.97,187,,1689299974.0,False,False,False,False,False
39,14z4151,Hololive,/r/Hololive/comments/14z4151/fauna_outfit_swap/,FumaTofu,Fauna Outfit Swap!,1779,0.99,42,:Inanis:,1689302251.0,False,False,False,False,False
40,14yua4u,AskReddit,/r/AskReddit/comments/14yua4u/should_a_man_shave_his_balls_or_not_and_why/,SuspectingCarl,"Should a man shave his balls or not, and why?",7830,0.88,4361,,1689277129.0,True,False,False,False,False
41,14yw9c7,PublicFreakout,/r/PublicFreakout/comments/14yw9c7/minor_dog_attack_leads_to_a_bottle_being_smashed/,homantify19,Minor dog attack leads to a bottle being smashed over a man’s head,5350,0.96,780,,1689281798.0,True,False,False,False,False
42,14z0o34,MadeMeSmile,/r/MadeMeSmile/comments/14z0o34/what_a_time_to_be_alive/,Rguezlp2031,What a time to be alive!,5752,0.98,563,,1689292761.0,False,False,False,False,False
43,14ystxa,Instagramreality,/r/Instagramreality/comments/14ystxa/popular_models_real_face_shows_up_for_12_second/,br0ck,Popular model's real face shows up for 1/2 second?,8448,0.93,800,,1689273773.0,False,False,False,False,False
44,14yrr9m,dankmemes,/r/dankmemes/comments/14yrr9m/tip_culture_is_going_to_bleed_into_every_job/,Justhuman963,Tip culture is going to bleed into every job,12834,0.95,678,Its Morbing Time :dogestronk:,1689271268.0,False,False,False,False,False
45,14yym0y,wholesomememes,/r/wholesomememes/comments/14yym0y/what_a_nice_dad/,casuallyCamp54,What a nice dad,3488,0.97,135,,1689287454.0,False,False,False,False,False
46,14yuuhm,pcmasterrace,/r/pcmasterrace/comments/14yuuhm/its_probably_horrible_for_my_pc_to_let_her_sleep/,prahl_hp,It’s probably horrible for my pc to let her sleep on it but i don’t have the heart to move her,5820,0.95,318,,1689278519.0,False,False,False,False,False
47,14yukp3,toptalent,/r/toptalent/comments/14yukp3/with_3_chance_to_live_at_birth_dayton_webber_has/,LetsFindSomeTalent,"With 3% chance to live at birth, Dayton Webber has spent his life defying odds and inspiring others",40545,0.87,1185,,1689277869.0,False,False,False,False,False
48,14yt6n1,tumblr,/r/tumblr/comments/14yt6n1/never_forget/,SaraAnnabelle,Never forget,8234,0.96,51,,1689274609.0,False,False,False,False,False
49,14ytmyc,SipsTea,/r/SipsTea/comments/14ytmyc/this_fcking_dog/,Falstgf,This f*cking dog,7179,0.98,77,,1689275643.0,False,False,False,False,False
50,14yvpbj,OldSchoolCool,/r/OldSchoolCool/comments/14yvpbj/my_uncle_trying_to_shank_captain_picard_1991/,repulsive-ardor,"My uncle trying to shank Captain Picard, 1991",4711,0.98,274,,1689280514.0,False,False,False,False,False
51,14ys2z4,PeterExplainsTheJoke,/r/PeterExplainsTheJoke/comments/14ys2z4/petah_why_is_the_father_traumatised/,Lapis_District,"Petah, why is the father traumatised?",11141,0.94,851,,1689271995.0,False,False,False,False,False
52,14z21o1,AnimalsBeingDerps,/r/AnimalsBeingDerps/comments/14z21o1/petting_your_dog_can_be_relaxing/,sco-go,Petting your dog can be relaxing,1952,0.96,70,,1689296568.0,False,False,False,False,False
53,14yudqi,clevercomebacks,/r/clevercomebacks/comments/14yudqi/found_in_another_sub/,mrl33602,Found in another sub,5916,0.97,233,,1689277353.0,False,False,False,False,False
54,14yz7l5,Damnthatsinteresting,/r/Damnthatsinteresting/comments/14yz7l5/transformer_blows_up/,sTx-Togica,Transformer blows up,6165,0.99,276,,1689288958.0,False,False,False,False,False
55,14z0x86,rareinsults,/r/rareinsults/comments/14z0x86/hes_not_wrong/,GameOfLevels,He’s not wrong,2283,0.97,37,,1689293420.0,False,False,False,False,False
56,14yskye,formuladank,/r/formuladank/comments/14yskye/just_a_reminder_who_the_actual_scientifically/,ExactCollege3,"Just a reminder who the actual scientifically proven best driver is, in equal machinery",7606,0.96,267,BWOAHHHHHHH ,1689273162.0,False,False,False,False,False
57,14yr1mq,lotrmemes,/r/lotrmemes/comments/14yr1mq/its_rough_out_here_being_from_the_late_1900s/,VetraVex_,It’s rough out here being from the late 1900’s.,9269,0.97,198,,1689269590.0,False,False,False,False,False
58,14ytvdi,popculturechat,/r/popculturechat/comments/14ytvdi/oppenheimer_actors_walk_out_of_uk_premiere_as/,jennibeam,Oppenheimer actors walk out of UK premiere as Hollywood stars join writer strike,5349,0.97,275,,1689276179.0,False,False,False,False,False
59,14yrog4,ChatGPT,/r/ChatGPT/comments/14yrog4/vp_product_openai/,HOLUPREDICTIONS,VP Product @OpenAI,7910,0.93,867,:SpinAI:,1689271092.0,False,False,False,False,False
60,14yydph,Breath_of_the_Wild,/r/Breath_of_the_Wild/comments/14yydph/i_dont_think_this_was_the_intended_way/,Azarathos,I don’t think this was the intended way,2913,0.98,116,,1689286889.0,False,False,False,False,False
61,14ywmeq,gaming,/r/gaming/comments/14ywmeq/finally_getting_into_pc_gaming_and_installing/,InforMedic,Finally getting into PC gaming and installing this bad boy!,3595,0.95,222,,1689282617.0,False,False,False,False,False
62,14yyp97,BlackPeopleComedy,/r/BlackPeopleComedy/comments/14yyp97/is_this_all_yall_males/,emmgdac,Is this all y’all males?? 👀👀👀,2790,0.96,101,✊🏽✊🏾✊🏿 verified,1689287664.0,False,False,False,False,False
63,14yp9uq,meirl,/r/meirl/comments/14yp9uq/meirl/,Varinak-,Meirl,16016,0.9,707,,1689265376.0,False,False,False,False,False
64,14ywac7,HydroHomies,/r/HydroHomies/comments/14ywac7/my_employer_installed_a_spicy_water_dispenser_in/,htmlcody,My employer installed a spicy water dispenser in our break room.,3712,0.98,253,,1689281867.0,False,False,False,False,False
65,14yzn2a,DiWHY,/r/DiWHY/comments/14yzn2a/stairway_slide/,pun420,Stairway Slide,2399,0.96,226,,1689290038.0,False,False,False,False,False
66,14yx386,shitposting,/r/shitposting/comments/14yx386/looks_functional_to_me_heil_spez/,bah_a,Looks functional to me (Heil spez),3657,0.97,16,,1689283746.0,False,False,False,False,False
67,14yx2zo,HolUp,/r/HolUp/comments/14yx2zo/it_happened_again/,BlessDisMess,It happened again ,3568,0.97,40,,1689283729.0,False,False,False,False,False
68,14yvep9,Justrolledintotheshop,/r/Justrolledintotheshop/comments/14yvep9/customer_states_tire_light_is_on_inspect_for_leaks/,Due-Cheesecake9086,"Customer states: Tire light is on, inspect for leaks",4130,0.95,198,,1689279838.0,False,False,False,False,False
69,14yt06q,WhitePeopleTwitter,/r/WhitePeopleTwitter/comments/14yt06q/one_nation_under_guns/,Go_Habs_Go31,One nation under guns,15272,0.97,740,,1689274198.0,False,False,False,False,False
70,14ysujy,ImTheMainCharacter,/r/ImTheMainCharacter/comments/14ysujy/wholesome_main_character/,InitialChad,Wholesome main character,5820,0.95,107,,1689273817.0,False,False,False,False,False
71,14ysg40,CrazyFuckingVideos,/r/CrazyFuckingVideos/comments/14ysg40/this_is_where_your_carboat_battery_goes_when_its/,Johnsnoz,This is where your car/boat battery goes when it's recycles,6427,0.94,828,,1689272846.0,False,False,False,False,False
72,14yrx4q,NotHowGirlsWork,/r/NotHowGirlsWork/comments/14yrx4q/little_girl_sits_on_a_table_clearly_asking_for_it/,Balarezok2,Little girl… sits on a table. Clearly asking for it,6866,0.96,525,,1689271616.0,False,False,False,False,False
73,14yvuax,Catswhoyell,/r/Catswhoyell/comments/14yvuax/our_local_shelter_just_took_in_this_little_guy_he/,Carichey,Our local shelter just took in this little guy. He yells while he eats.,3658,0.98,101,,1689280834.0,False,False,False,False,False
74,14ypix6,NatureIsFuckingLit,/r/NatureIsFuckingLit/comments/14ypix6/this_little_cougar_cub_is_so_proud_of_its_mom/,Molly107,🔥 This little cougar cub is so proud of its mom.,9657,0.95,78,:paw-prints:,1689265962.0,False,False,False,False,False
75,14yqm8q,tifu,/r/tifu/comments/14yqm8q/tifu_by_sleeping_with_my_hr_manager/,desperatewatcher,TIFU by sleeping with my HR manager,8347,0.89,915,,1689268545.0,True,1689274309.0,False,False,False
76,14yvgkv,NewsOfTheStupid,/r/NewsOfTheStupid/comments/14yvgkv/actor_jim_caviezel_claims_liberal_elites_drink/,Misguided_Society,"Actor Jim Caviezel claims liberal elites drink the blood of infants - also stating, ‘I believe Donald Trump was selected by God Almighty, and I'm talking about the Father, Son, and Holy Spirit God,’ Caviezel said.",3759,0.88,1378,,1689279956.0,False,False,False,False,False
77,14yto22,movies,/r/movies/comments/14yto22/sagaftra_votes_to_strike_after_negotiations_end/,MarvelsGrantMan136,SAG-AFTRA Votes to Strike After Negotiations End With No Deal,4685,0.96,813,r/Movies contributor,1689275716.0,False,False,False,False,False
78,14ym98p,LeopardsAteMyFace,/r/LeopardsAteMyFace/comments/14ym98p/transphobic_michigan_salon_owner_declares_she/,wdcmsnbcgay,"Transphobic Michigan Salon Owner Declares She Won’t Serve Trans or Queer People, Says They Should Seek Services at Pet Groomer…Now Her Suppliers Are Dropping Her Salon",24771,0.9,1696,,1689258226.0,False,False,False,False,False
79,14yr3s4,nextfuckinglevel,/r/nextfuckinglevel/comments/14yr3s4/steve_irwin_talks_about_his_first_meeting_with/,Key-Bedroom-4615,Steve Irwin talks about his first meeting with wife Terri,38167,0.94,891,,1689269725.0,False,False,False,False,False
80,14z13vc,conservativeterrorism,/r/conservativeterrorism/comments/14z13vc/idaho_opts_out_of_nearly_15_million_that_would/,MacGruber77,Idaho opts out of nearly $15 million that would feed children this summer. Why?,1757,0.97,108,,1689293942.0,False,False,False,False,False
81,14z09hy,TrueOffMyChest,/r/TrueOffMyChest/comments/14z09hy/update_my_brother_in_law_called_me_the_one_who/,Ok_Heart7923,[Update] My brother in law called me the one who got away in his speech and my husband is very hurt and it is my all fault.,1981,0.96,206,,1689291679.0,False,1689297133.0,False,False,False
82,14ytqbu,whenthe,/r/whenthe/comments/14ytqbu/why_does_this_always_happen/,DN-838,Why does this always happen?,5623,0.96,164,,1689275858.0,False,False,False,False,False
83,14z1ykz,ContagiousLaughter,/r/ContagiousLaughter/comments/14z1ykz/her_laughter_made_me_smile/,QuestionableSpoon,Her laughter made me smile!😊,1505,0.96,47,,1689296353.0,False,False,False,False,False
84,14yvado,UkraineWarVideoReport,/r/UkraineWarVideoReport/comments/14yvado/an_inexperienced_russian_soldier/,Morfient,An inexperienced russian soldier,3692,0.97,383,,1689279563.0,False,False,False,False,False
85,14yupfm,Showerthoughts,/r/Showerthoughts/comments/14yupfm/there_are_breathtakingly_beautiful_sights_on/,TGMcGonigle,There are breathtakingly beautiful sights on uninhabited planets all over the universe that no one will ever see.,3859,0.96,260,,1689278194.0,False,False,False,False,False
86,14yu619,shittymoviedetails,/r/shittymoviedetails/comments/14yu619/into_the_spiderverse_2018_has_one_uncredited/,LiminalSh0ck,"Into the Spider-Verse (2018) has one uncredited, unnamed director. Their only contribution to the film is this shot.",4386,0.97,62,:GoldenShit:,1689276858.0,False,False,False,False,False
87,14yz0x6,doordash_drivers,/r/doordash_drivers/comments/14yz0x6/does_this_feel_invasive_to_anybody_else/,teknophyle,Does this feel invasive to anybody else?,2186,0.93,311,,1689288485.0,False,False,False,False,False
88,14ynf69,NonPoliticalTwitter,/r/NonPoliticalTwitter/comments/14ynf69/seems_legit/,steepattraction,Seems Legit,13800,0.95,156,:blue1::blue2::1111::1112:,1689261008.0,False,False,False,False,False
89,14z07yd,furry_irl,/r/furry_irl/comments/14z07yd/furryirl/,FreddieGamer2004,Furry😁irl,1851,0.95,96,,1689291569.0,False,False,False,False,False
90,14yuq5a,IllegallySmolCats,/r/IllegallySmolCats/comments/14yuq5a/dangerous_fluffy_gang/,MarshmallowBabee,dangerous fluffy gang,3723,0.98,89,,1689278247.0,False,False,False,False,False
91,14ywg78,ukraine,/r/ukraine/comments/14ywg78/freeing_ukrainian_territory_it_cannot_be_fast/,buttmodel,Freeing Ukrainian territory! 🇺🇦💪 It cannot be fast because everywhere are traps and we wanna go forward smartly #Ukraine #counteroffensive,3015,0.97,97,,1689282220.0,False,False,False,False,False
92,14ywugs,australia,/r/australia/comments/14ywugs/will_not_fit_a_small_child_kmart_20l_microwave/,GrannyMatt,"Will not fit a small child; Kmart 20L Microwave. Stay classy, Australia.",2754,0.96,192,,1689283167.0,False,False,False,False,False
93,14yxjzn,Baking,/r/Baking/comments/14yxjzn/this_maybe_my_favorite_cake_i_have_every_made_for/,Bunnystrawbery,This maybe my favorite cake I have every made for a customer. They wanted to celebrate getting their degree in marine biology. So I made them a Whale shark cake.,2490,0.98,42,,1689284887.0,False,False,False,False,False
94,14yv708,mildlyinfuriating,/r/mildlyinfuriating/comments/14yv708/in_italy_its_legal_for_a_66_year_old_man_to_grope/,hrryyss,In Italy it’s legal for a 66 year old man to grope a 17 year old girl as long as it lasts less than 10 seconds,7519,0.96,643,,1689279336.0,False,False,False,False,False
95,14yxc4t,hockey,/r/hockey/comments/14yxc4t/strang_news_scottsdale_police_department_has/,nobokov22,"[Strang] NEWS: Scottsdale Police Department has confirmed to The Athletic that Alex Galchenyuk was arrested on July 9 on a number of charges including private property hit and run, disorderly conduct, failure to obey, resisting arrest, Threatening or Intimidating",2507,0.96,682,MTL - NHL :61707:,1689284349.0,False,False,False,False,False
96,14yr68k,facepalm,/r/facepalm/comments/14yr68k/words_fail_me/,NewParticularz,Words fail me.,24034,0.94,2128,,1689269891.0,False,False,False,False,False
97,14yuz3z,blackcats,/r/blackcats/comments/14yuz3z/she_looks_like_a_baby_dragon/,Ill-Water-8741,She looks like a baby dragon🖤,3398,0.97,59,,1689278816.0,False,False,False,False,False
98,14z18yi,lgbt,/r/lgbt/comments/14z18yi/i_am_african_i_am_black_and_i_am_gay_i_exist_and/,Alone_Werewolf_5626,"I am African, I am Black, and I am Gay. I exist and I am valid. 💪🖤",1494,0.94,55,,1689294337.0,False,False,False,False,False
99,14z0j8j,gifsthatkeepongiving,/r/gifsthatkeepongiving/comments/14z0j8j/pure_birthday_rage/,CoupwalObiWan,Pure birthday rage.,1637,0.93,110,,1689292386.0,False,False,False,False,False
100,14ynhpk,TheLastAirbender,/r/TheLastAirbender/comments/14ynhpk/seems_natural_for_this_scene/,Ghdude1,Seems natural for this scene.,12931,0.94,621,,1689261180.0,False,False,False,False,False
