rank,id,subreddit,permalink,author,title,score,upvote_ratio,num_comments,author_flair_text,created_utc,over_18,edited,stickied,locked,is_original_content
1,14lrwfj,WhitePeopleTwitter,/r/WhitePeopleTwitter/comments/14lrwfj/and_none_of_her_supporters_know_this/,Manakanda413,And none of her supporters know this,29015,0.97,400,,1688003725.0,False,False,False,False,False
2,14lupq9,baseball,/r/baseball/comments/14lupq9/domingo_germán_has_thrown_the_24th_perfect_game/,BaseballBot,Domingo Germán has thrown the 24th Perfect Game in MLB history!,8883,0.94,2138,Umpire :ump:,1688011909.0,False,1688012316.0,True,False,False
3,14lt329,MadeMeSmile,/r/MadeMeSmile/comments/14lt329/this_guy_who_is_a_social_worker_coach_and_fitness/,daas_hu_gurudev_ka,"This guy who is a social worker, coach and fitness instructor brings fun games for the residents of this nursing home...",12170,0.99,173,,1688007134.0,False,False,False,False,False
4,14lt4wl,ContagiousLaughter,/r/ContagiousLaughter/comments/14lt4wl/very_close/,LaughBakery,Very close,9257,0.96,135,,1688007287.0,False,False,False,False,False
5,14lq6fs,PublicFreakout,/r/PublicFreakout/comments/14lq6fs/hero_cop_goes_from_giving_a_speech_to_kids_about/,ticklemypicklesir,Hero cop goes from giving a speech to kids about wearing seatbelts to running towards gun fire to stop an active shooter at the Allen Outlet Mall in Texas,24464,0.91,2153,,1687998911.0,True,False,False,False,False
6,14lsyki,WTF,/r/WTF/comments/14lsyki/a_9yearold_white_boy_shows_up_to_his_black/,SamuraiPanda3AMP,A 9-year-old white boy shows up to his black neighbor's front door cracking a whip.,8717,0.89,737,,1688006770.0,False,False,False,False,False
7,14ltvq4,AnimalsBeingBros,/r/AnimalsBeingBros/comments/14ltvq4/good_boy_is_a_lifeguard/,westcoastcdn19,Good boy is a lifeguard ,6761,0.97,95,,1688009435.0,False,False,False,False,False
8,14lswmj,facepalm,/r/facepalm/comments/14lswmj/patience_what/,NoCovered,Patience. What ?,11369,0.92,1646,,1688006611.0,False,False,False,False,False
9,14ltix4,ukraine,/r/ukraine/comments/14ltix4/what_love_looks_like_by_journalist_tetiana_bezruk/,Lincoin02202,What love looks like (by journalist Tetiana Bezruk),6662,0.95,197,,1688008370.0,False,False,False,False,False
10,14lylvw,memes,/r/memes/comments/14lylvw/medieval_disease/,Lightning-11,Medieval disease,2762,0.97,43,Medieval Meme Lord,1688024731.0,False,False,False,False,False
11,14lpq8u,WatchPeopleDieInside,/r/WatchPeopleDieInside/comments/14lpq8u/woman_commits_cardinal_sin_by_picking_up_players/,TheRealPW,Woman commits cardinal sin by picking up player’s golf ball,19714,0.95,1733,,1687997705.0,False,False,False,False,False
12,14lotwn,mildlyinfuriating,/r/mildlyinfuriating/comments/14lotwn/amtrak_customer_service_after_derailment_today/,reetofu,Amtrak customer service after derailment today,18119,0.98,469,,1687995377.0,False,False,False,False,False
13,14log1a,nextfuckinglevel,/r/nextfuckinglevel/comments/14log1a/hawk_makes_a_grave_mistake_after_trying_to_steal/,MrBonelessPizza24,Hawk makes a grave mistake after trying to steal chicks on a farm ,32480,0.94,2175,,1687994356.0,False,False,False,False,False
14,14lozds,todayilearned,/r/todayilearned/comments/14lozds/til_that_originally_the_barbie_movie_was_supposed/,Purplethrowaway_,"TIL that originally the Barbie movie was supposed to come out in 2018, with Amy Schumer as Barbie.",18706,0.86,2109,,1687995774.0,False,False,False,False,False
15,14ls6er,pcmasterrace,/r/pcmasterrace/comments/14ls6er/have_they_truly_given_up_on_us/,BullmooseTheocracy,Have they truly given up on us?,7285,0.96,700,,1688004487.0,False,False,False,False,False
16,14lo7k3,Damnthatsinteresting,/r/Damnthatsinteresting/comments/14lo7k3/cleveland_has_straight_up_just_disappeared_today/,moeburn,Cleveland has straight up just disappeared today because of the Canadian wildfire smoke,18073,0.96,1063,,1687993742.0,False,False,False,False,False
17,14ls47d,therewasanattempt,/r/therewasanattempt/comments/14ls47d/to_demolish_a_house/,hisprerogative,To demolish a house,7790,0.95,393,,1688004315.0,False,False,False,False,False
18,14lq7nm,meirl,/r/meirl/comments/14lq7nm/meirl/,xJkurtz,Meirl,9823,0.98,127,,1687999004.0,False,False,False,False,False
19,14lpv55,politics,/r/politics/comments/14lpv55/trump_demanded_my_documents_back_even_after_his/,Beckles28nz,Trump Demanded ‘My Documents’ Back Even After His Lawyers Told Him He’d Be Indicted,7323,0.97,534,,1687998061.0,False,False,False,False,False
20,14lmjes,StarWars,/r/StarWars/comments/14lmjes/my_fangirl_moment_cosplaying_bo_katan_and_meeting/,Vampisaurus,My fangirl moment: cosplaying Bo Katan and meeting Katee Sackhoff on her birthday,15477,0.94,248,,1687989642.0,False,False,False,False,False
21,14llegr,CrazyFuckingVideos,/r/CrazyFuckingVideos/comments/14llegr/in_the_span_of_5_minutes_a_police_officer_goes/,Tuopehm,"In the Span of 5 Minutes, a Police Officer Goes From Telling Kids to Wear Their Seatbelts, to Killing Heavily Armed Mass Shooter Who Killed 8 People",32203,0.92,2977,,1687986948.0,False,False,False,False,False
22,14lnq81,me_irlgbt,/r/me_irlgbt/comments/14lnq81/meirlgbt/,lowkeyterrible,me🦚irlgbt,12186,0.95,119,:lesbian: mods r gay lol,1687992557.0,False,False,False,False,False
23,14luyuu,HolUp,/r/HolUp/comments/14luyuu/body_mass_index_begs_to_differ/,Available-Deer1723,Body mass index begs to differ💀,3252,0.97,40,,1688012688.0,False,False,False,False,False
24,14ltlbd,shitposting,/r/shitposting/comments/14ltlbd/i_dont_make_the_rules_pal_glory_to_spez/,Dick-TheCock-Johnson,"I don’t make the rules, Pal. “Glory to Spez”",4308,0.97,91,,1688008563.0,True,False,False,False,False
25,14lo443,apple,/r/apple/comments/14lo443/reddit_plagued_with_1star_app_store_reviews_over/,Illustrious_Risk3732,Reddit plagued with 1-star App Store reviews over API debacle as users search for 0-star button,9144,0.94,444,,1687993494.0,False,False,False,False,False
26,14lkegh,antiwork,/r/antiwork/comments/14lkegh/us_725_million_classaction_settlement_when_you/,S3ndD1ckP1cs,"U.S. $72.5 million class-action settlement: “When you control an employee’s time, you must pay them.”",21413,0.97,752,SocDem :dems:,1687984615.0,False,False,False,False,False
27,14loef1,PeopleFuckingDying,/r/PeopleFuckingDying/comments/14loef1/cat_gets_brutally_beaten_by_crool_human_screams/,grichardson526,"cAt Gets bRUTALLY BEaTeN bY crool hUMAn, ScReamS FoR HELp",9400,0.95,161,,1687994234.0,False,False,False,False,False
28,14lkfam,tumblr,/r/tumblr/comments/14lkfam/ancient_emojis/,MyNameGifOreilly,Ancient Emojis,23619,0.95,143,,1687984671.0,False,False,False,False,False
29,14llf9s,Whatcouldgowrong,/r/Whatcouldgowrong/comments/14llf9s/to_show_off_your_weed/,SirIvanHoe0,To show off your weed,14277,0.92,520,,1687986999.0,False,False,False,False,False
30,14lohp7,doordash,/r/doordash/comments/14lohp7/well_this_happened/,Pale_Ad2148,Well this Happened 🤣🤣🤣,7924,0.93,456,,1687994477.0,False,False,False,False,False
31,14lp0j8,conservativeterrorism,/r/conservativeterrorism/comments/14lp0j8/but_the_greatest_threat_we_face_as_a_nation/,Distantmole,But the greatest threat we face as a nation is…*checks notes*…drag queens reading to children?,6193,0.9,243,,1687995858.0,False,False,False,False,False
32,14ln6id,gaming,/r/gaming/comments/14ln6id/if_you_had_a_child_after_skyrim_released_that/,PapaOogie,"If you had a child after Skyrim released, that child would grow up and graduate highschool before Elder Scrolls 6 releases",8413,0.94,573,,1687991164.0,False,False,False,False,False
33,14lqnhs,cats,/r/cats/comments/14lqnhs/what_do_you_guys_call_this_position/,jinzo_23,What do you guys call this position?,4762,0.98,326,,1688000227.0,False,False,False,False,False
34,14louoa,OnePunchMan,/r/OnePunchMan/comments/14louoa/chapter_187_english/,VibhavM,Chapter 187 [English],6424,0.96,645,Retired From day2day Moderation. Contact Other Mods.,1687995433.0,False,False,True,False,False
35,14lmlrg,maybemaybemaybe,/r/maybemaybemaybe/comments/14lmlrg/maybe_maybe_maybe/,rclippi,Maybe maybe maybe,11668,0.86,220,,1687989774.0,True,False,False,False,False
36,14lk234,clevercomebacks,/r/clevercomebacks/comments/14lk234/bill_bur_is_a_legend/,Promptlyfret812,Bill Bur is a legend,19597,0.91,173,,1687983815.0,False,False,False,False,False
37,14lqti9,teenagers,/r/teenagers/comments/14lqti9/is_my_dad_a_little_crazy_im_14_and_get_one_minute/,terrairiaplayer,Is my dad a little crazy? I’m 14 and get one minute a day on everything,4998,0.96,715,14,1688000666.0,False,False,False,False,False
38,14lteuz,distressingmemes,/r/distressingmemes/comments/14lteuz/back_to_the_drawing_board/,Designerdripdrip,Back to the drawing board,2913,0.94,113,,1688008040.0,False,False,False,False,False
39,14lrlkb,AskReddit,/r/AskReddit/comments/14lrlkb/what_is_the_stupidest_thing_youve_heard_someone/,JasperMidnight,What is the stupidest thing you’ve heard someone say that they were 100% serious about?,3741,0.96,4642,,1688002838.0,False,False,False,False,False
40,14lxfbe,wholesomememes,/r/wholesomememes/comments/14lxfbe/how_wholesome/,easilyBind59,How wholesome.,1479,0.98,59,,1688020588.0,False,False,False,False,False
41,14lxj5z,memes,/r/memes/comments/14lxj5z/medieval_sleepover_with_the_boys/,ILikeMemes522,Medieval sleepover with the boys,3059,0.98,93,,1688020958.0,False,False,False,False,False
42,14lq1xk,fightporn,/r/fightporn/comments/14lq1xk/these_college_students_have_no_fuckin_chill/,Icarus2515,These College Students Have No Fuckin Chill,4677,0.93,573,,1687998570.0,True,False,False,False,False
43,14llyj0,aww,/r/aww/comments/14llyj0/raww_is_making_a_mockery_of_the_protest/,Cantora,R/aww is making a mockery of the protest. Submissions are now just normal pics but with small John Oliver's in the corner. Either do it properly or just stop...,15194,0.74,1071,,1687988275.0,False,False,False,False,False
44,14llul6,wholesome,/r/wholesome/comments/14llul6/my_wife_painted_a_mural_for_our_sons_room_of_his/,bloodraven11,"My wife painted a mural for our sons room of his favorite show but she's feeling down about it. She has alot of self-esteem issues, but I think it's awesome!",9356,0.93,577,,1687988004.0,False,False,False,False,False
45,14liton,SipsTea,/r/SipsTea/comments/14liton/wait_a_minute_now/,Backgrounding,Wait a minute now,20618,0.96,343,,1687980928.0,False,False,False,False,False
46,14lpfv3,technology,/r/technology/comments/14lpfv3/as_reddit_protests_turn_to_pornbombing/,gabestonewall,"As Reddit protests turn to porn-bombing, advertisers face increasing brand safety concerns",4691,0.95,338,,1687996942.0,False,False,False,False,False
47,14lpgec,TwoSentenceHorror,/r/TwoSentenceHorror/comments/14lpgec/i_was_born_with_the_ability_to_psychically/,tasteofhemlock,I was born with the ability to psychically experience the happiest memories of any human by merely touching their skin.,4991,0.96,136,,1687996974.0,False,False,False,False,False
48,14ltsgr,ChoosingBeggars,/r/ChoosingBeggars/comments/14ltsgr/whats_wrong_with_public_poolsbeaches/,Schiissdraeck,What's wrong with public pools/beaches?,2414,0.95,234,,1688009162.0,False,False,False,False,False
49,14ltaas,LeagueOfMemes,/r/LeagueOfMemes/comments/14ltaas/someone_said_something_about_creativity/,Ninja_Cezar,Someone said something about creativity,2660,0.98,31,,1688007703.0,False,False,False,False,False
50,14lv92l,Satisfyingasfuck,/r/Satisfyingasfuck/comments/14lv92l/mans_been_waiting_his_whole_life_for_this_moment/,trashyoutdoors,Mans been waiting his whole life for this moment,1903,0.97,63,,1688013580.0,False,False,False,False,False
51,14lnfqc,food,/r/food/comments/14lnfqc/homemade_salami_pepperoni_ham_provolone/,softrotten,"[Homemade] Salami, pepperoni, ham, provolone, pepperoncini, pesto sliders topped w/ garlic butter",6183,0.95,125,,1687991811.0,False,False,False,False,True
52,14lhlji,worldnews,/r/worldnews/comments/14lhlji/russian_general_who_may_have_known_about_wagner/,Beyond_The_Dim,Russian general who may have known about Wagner mutiny goes missing | Russia,24460,0.94,970,,1687978005.0,False,False,False,False,False
53,14lx7hz,ich_iel,/r/ich_iel/comments/14lx7hz/ich_iel/,DDogma5,Ich_iel,1372,0.97,110,,1688019848.0,True,False,False,False,False
54,14liodq,videos,/r/videos/comments/14liodq/body_cam_of_police_officer_shows_him_tracking_and/,ViciousNakedMoleRat,Body cam of police officer shows him tracking and killing the fucking mass shooter at Allen Outlet Mall in Texas. (NSFW but no gore or injured people visible.),22496,0.87,3980,,1687980584.0,True,False,False,False,False
55,14lyr31,2westerneurope4u,/r/2westerneurope4u/comments/14lyr31/yes/,Euphoric_Ad_69,Yes,1036,0.98,253,:European: European,1688025268.0,False,False,False,False,False
56,14ltygt,OldSchoolCool,/r/OldSchoolCool/comments/14ltygt/june_13_1986mike_tysons_left_hook_kod_reggie/,LivingInMatrix,"June 13, 1986-Mike Tyson’s left hook KO’d Reggie Gross – a hitman and mob enforcer now serving life in prison in South Carolina ",2177,0.98,186,,1688009657.0,False,False,False,False,False
57,14lmpbm,animememes,/r/animememes/comments/14lmpbm/who_else_is_like_this/,WeaknessQuiet4930,Who else is like this?,7616,0.94,234,,1687990005.0,False,False,False,False,False
58,14lwtkk,formuladank,/r/formuladank/comments/14lwtkk/good_old_days/,rider_6666,Good old days,1362,0.98,48,BWOAHHHHHHH ,1688018555.0,False,False,False,False,False
59,14lhwfd,BeAmazed,/r/BeAmazed/comments/14lhwfd/most_effective_tick_removal_method/,creydth,Most effective tick removal method ,26923,0.93,789,,1687978732.0,False,False,False,False,False
60,14lrgam,terriblefacebookmemes,/r/terriblefacebookmemes/comments/14lrgam/infuriating_and_just_plain_appalling/,CinemaslaveJoe,Infuriating and just plain appalling,3174,0.96,221,,1688002416.0,True,False,False,False,False
61,14lrhgv,DunderMifflin,/r/DunderMifflin/comments/14lrhgv/its_the_little_things/,littletrevas,It's the little things...,3113,0.98,59,,1688002510.0,False,False,False,False,False
62,14lqoke,WhitePeopleTwitter,/r/WhitePeopleTwitter/comments/14lqoke/well_well_well_how_the_turntables/,KyloRenKardashian,well. well.. well.. how the turntables...,8159,0.96,639,,1688000313.0,False,False,False,False,False
63,14lt1fa,ChildrenFallingOver,/r/ChildrenFallingOver/comments/14lt1fa/running_to_show_mom_his_finished_lego_xwing/,icameinyourburrito,Running to show mom his finished LEGO X-Wing,2395,0.96,89,,1688007009.0,False,False,False,False,False
64,14llabn,wallstreetbets,/r/wallstreetbets/comments/14llabn/musk_vs_zuckerberg_the_fight_of_the_century/,Akumetsu_971,Musk vs Zuckerberg. The fight of the Century !!!,8068,0.92,366,,1687986686.0,False,False,False,False,False
65,14lm3ue,Eyebleach,/r/Eyebleach/comments/14lm3ue/my_20_year_old_cat_getting_vacuumed_its_her/,Antique-Scar-7721,"My 20 year old cat getting vacuumed, it's her favorite thing.",6636,0.97,67,,1687988623.0,False,False,False,False,False
66,14lq3v3,Baking,/r/Baking/comments/14lq3v3/first_time_entering_the_local_county_fair/,cuppiecakejams,First time entering the local county fair competition and I won first!,3648,0.96,147,,1687998712.0,False,False,False,False,False
67,14lfxqs,news,/r/news/comments/14lfxqs/justice_department_charges_78_people_with_25/,cnbc_official,Justice Department charges 78 people with $2.5 billion in health-care fraud,32881,0.96,1113,,1687974102.0,False,False,False,False,False
68,14lqwuk,todayilearned,/r/todayilearned/comments/14lqwuk/til_the_x_games_have_never_drug_tested_athletes/,thesmartass1,TIL The X Games have never drug tested athletes,6833,0.96,386,,1688000918.0,False,False,False,False,False
69,14lus2y,MaliciousCompliance,/r/MaliciousCompliance/comments/14lus2y/if_he_says_its_his_its_his_you_sure_you_wanna_go/,LocalLiBEARian,"“If he says it’s his, it’s his.” You sure you wanna go with that?",1762,0.96,108,,1688012110.0,False,False,False,False,True
70,14luec0,AbruptChaos,/r/AbruptChaos/comments/14luec0/today_we_celebrate_our_indepocalypse_day/,PhelesDragon,Today we celebrate our Indepocalypse Day,1874,0.94,114,,1688010976.0,False,False,False,False,False
71,14lqxhq,instantkarma,/r/instantkarma/comments/14lqxhq/woman_steals_ice_cream_and_gets_hit_by_a_bus/,AccomplishedCup140,Woman steals ice cream and gets hit by a bus,3224,0.94,157,,1688000969.0,False,False,False,False,False
72,14li9v1,oddlysatisfying,/r/oddlysatisfying/comments/14li9v1/removing_the_spines_from_a_cactus_pad/,colapepsikinnie,Removing the spines from a cactus pad,15498,0.95,414,,1687979597.0,False,False,False,False,False
73,14lj9a2,lotrmemes,/r/lotrmemes/comments/14lj9a2/i_mean_we_all_have_dysfunctional_families/,fatkiddown,"I mean, we all have dysfunctional families",10821,0.97,117,,1687981958.0,False,False,False,False,False
74,14lr9fh,sanfrancisco,/r/sanfrancisco/comments/14lr9fh/today_i_woke_up_to_this_note_on_my_car/,kiryat,Today I woke up to this note on my car,2887,0.95,495,,1688001893.0,False,False,False,False,False
75,14lvv0b,CarsIndia,/r/CarsIndia/comments/14lvv0b/finally_got_my_first_car_guys/,IndianaC0NES,Finally got my first car guys 🙏,1436,0.95,98,Leg-Day Enthusiast,1688015465.0,False,False,False,False,False
76,14lsqke,Genshin_Impact,/r/Genshin_Impact/comments/14lsqke/huge_carrot/,Amirizuki,Huge Carrot.,2381,0.98,54,":noelle: : ""Time to shut up !""",1688006125.0,False,False,False,False,False
77,14lqawm,thisismylifenow,/r/thisismylifenow/comments/14lqawm/i_caught_a_wild_mouse_in_my_kitchen_awhile_back/,I_might_be_weasel,I caught a wild mouse in my kitchen awhile back and kept him in a hamster cage with some pet store mice. He seems to have acclimated.,3236,0.97,116,,1687999247.0,False,False,False,False,False
78,14ljhpn,LateStageCapitalism,/r/LateStageCapitalism/comments/14ljhpn/you_cant_expect_the_rich_to_take_the_train/,No_Buddy_4655,"You can't expect the rich to take the train together with the rest of us, can you?",8603,0.98,83,,1687982505.0,False,False,False,False,False
79,14lib1x,science,/r/science/comments/14lib1x/new_research_flatly_rejects_a_longstanding_myth/,MistWeaver80,"New research flatly rejects a long-standing myth that men hunt, women gather, and that this division runs deep in human history. The researchers found that women hunted in nearly 80% of surveyed forager societies.",11566,0.88,1002,,1687979686.0,False,False,False,False,False
80,14lwa2g,Animemes,/r/Animemes/comments/14lwa2g/oh_no/,TakoFry,Oh no...,1293,0.97,34,,1688016800.0,False,False,False,False,False
81,14lpwik,shittymoviedetails,/r/shittymoviedetails/comments/14lpwik/took_a_wild_turn_at_the_sequel/,osfbamf,Took a wild turn at the sequel.,3446,0.97,21,,1687998152.0,False,False,False,False,False
82,14lw31r,Damnthatsinteresting,/r/Damnthatsinteresting/comments/14lw31r/a_dress_that_changes_color_when_exposed_to/,Patient_Island_2080,A dress that changes color when exposed to sunlight.,2680,0.94,172,,1688016170.0,False,False,False,False,False
83,14lksc9,MadeMeSmile,/r/MadeMeSmile/comments/14lksc9/came_across_a_tiktok_of_the_guy_who_opened_a/,Soloflow786,Came across a TikTok of the guy who opened a special needs barber shop and it’s so precious🥹 the patience and care is overwhelming,65461,0.92,1177,,1687985535.0,False,False,False,False,False
84,14lvnnd,ProgrammerHumor,/r/ProgrammerHumor/comments/14lvnnd/somepeoplearentsad/,CherryBomb808_,somePeopleArentSad,1356,0.97,53,,1688014853.0,False,False,False,False,False
85,14ljwvk,HumansBeingBros,/r/HumansBeingBros/comments/14ljwvk/lewis_capaldi_who_has_recently_opened_up_about/,Mint_Perspective,"Lewis Capaldi, who has recently opened up about his struggles with Tourette’s Syndrome, leans on his fans for Glastonbury 2023",8221,0.93,171,,1687983469.0,False,False,False,False,False
86,14lw0wx,HonkaiStarRail,/r/HonkaiStarRail/comments/14lw0wx/out_of_the_three_new_companion_missions_we_just/,Any-Individual-4046,"out of the three new companion missions we just got, which one was your favorite?",1272,0.97,207,,1688015996.0,False,False,False,False,False
87,14lm3k4,apolloapp,/r/apolloapp/comments/14lm3k4/i_just_released_an_important_apollo_update_that/,iamthatis,"📣 I just released an important Apollo update that allows users with remaining subscription time to decline automatic refunds. Devs pay refunds out-of-pocket, this will be $250K, so thank you if you do. ❤️ Also, the amazing ""Goodbye Apollo Wallpaper Set"" is out, proceeds toward refund costs! 🎆",5401,0.94,585,Apollo Developer,1687988605.0,False,False,False,False,False
88,14lk9kw,Bossfight,/r/Bossfight/comments/14lk9kw/the_goat_of_all_goats_does_not_let_gravity_stop/,Aware_Initiative_912,The goat of all goats. Does not let gravity stop him.,7609,0.95,76,,1687984305.0,False,False,False,False,False
89,14ltjvo,funny,/r/funny/comments/14ltjvo/leave_boo_boo_alone/,ItsAlecito,Leave boo boo alone,1826,0.93,36,,1688008450.0,False,False,False,False,False
90,14lppay,PrequelMemes,/r/PrequelMemes/comments/14lppay/thats_just_peak_improv/,asilvertintedrose,That's just peak improv,3359,0.97,37,I'm THE General Reposti (with some OC memes here & there),1687997638.0,False,False,False,False,False
91,14lhtvq,BrandNewSentence,/r/BrandNewSentence/comments/14lhtvq/flesh_ledges/,Transmasc_Blahaj,"""Flesh Ledges""",13637,0.92,940,,1687978555.0,False,False,False,False,False
92,14luca6,MarchAgainstNazis,/r/MarchAgainstNazis/comments/14luca6/holy_shit/,WebModeratorSyndrome,Holy shit,1569,0.97,64,,1688010797.0,False,False,False,False,False
93,14lkb06,nba,/r/nba/comments/14lkb06/katz_unprompted_text_i_just_received_from_one/,pcwgussej,"[Katz] Unprompted text I just received from one team's cap person: ""Fuck my life.""",6582,0.95,562,,1687984394.0,False,False,False,False,False
94,14lf9a9,rareinsults,/r/rareinsults/comments/14lf9a9/police_brutality_and_sour_warheads/,bours18,Police brutality and sour warheads,25725,0.94,361,,1687972460.0,False,False,False,False,False
95,14lkjwd,politics,/r/politics/comments/14lkjwd/biden_says_hes_not_big_on_abortion_since_hes/,Beckles28nz,"Biden Says He’s ‘Not Big On Abortion’ Since He's Catholic, But Roe ‘Got It Right",22382,0.93,1698,,1687984982.0,False,False,False,False,False
96,14lgdsi,marvelmemes,/r/marvelmemes/comments/14lgdsi/one_of_the_best_characters/,M3ANDMYSELF,One of the best characters. ,19165,0.95,283,Avengers,1687975185.0,False,False,False,False,False
97,14lohw9,ExplainTheJoke,/r/ExplainTheJoke/comments/14lohw9/i_get_jokes_i_dont_get_this/,MegaRadCoolDad,I get jokes. I don't get this.,3654,0.91,366,,1687994489.0,False,False,False,False,False
98,14lr35g,lostredditors,/r/lostredditors/comments/14lr35g/can_someone_help_me_out_and_tell_me_what/,Independent-Lie6616,Can someone help me out and tell me what happening here?,2585,0.92,453,,1688001402.0,False,False,False,False,False
99,14lqs10,UkraineWarVideoReport,/r/UkraineWarVideoReport/comments/14lqs10/japan_sends_to_ukraine_its_first_two_mitsubishi/,tpseng,Japan sends to Ukraine its first two Mitsubishi Type 73 tactical vehicles,2492,0.98,133,,1688000560.0,False,False,False,False,False
100,14lsrk2,AmItheAsshole,/r/AmItheAsshole/comments/14lsrk2/aita_for_reporting_a_mother_and_her_glitter/,Fit-Lab5312,AITA for reporting a mother and her glitter monster to a flight attendant?,1894,0.96,462,,1688006202.0,False,False,False,False,False
