rank,id,subreddit,permalink,author,title,score,upvote_ratio,num_comments,author_flair_text,created_utc,over_18,edited,stickied,locked,is_original_content
1,14pbfqt,facepalm,/r/facepalm/comments/14pbfqt/imagine_being_this_confidently_stupid/,coarsecylinder,Imagine being this confidently stupid.,24611,0.94,1639,,1688367120.0,False,False,False,False,False
2,14pb1iq,Damnthatsinteresting,/r/Damnthatsinteresting/comments/14pb1iq/cats_that_sailed_on_ships_until_the_mid20th/,chickennoudelsoup,Cats that sailed on ships until the mid-20th century to catch rodents had passports signed with their paw prints,10693,0.98,173,,1688365759.0,False,False,False,False,False
3,14p9l7z,ContagiousLaughter,/r/ContagiousLaughter/comments/14p9l7z/how_to_dad_remakes_his_first_video_with_his_kiddo/,Spontanemoose,How To Dad remakes his first video with his kiddo,12314,0.96,202,,1688360967.0,False,False,False,False,False
4,14pbjhm,HolUp,/r/HolUp/comments/14pbjhm/give_them_a_taste_of_their_own_medicine/,ImportantEffort4594,Give them a taste of their own medicine,8087,0.96,99,,1688367467.0,False,False,False,False,False
5,14pb8ao,marvelmemes,/r/marvelmemes/comments/14pb8ao/the_cameraman/,Nikhil__P,The Cameraman ,7876,0.98,33,Avengers,1688366412.0,False,False,False,False,False
6,14pbis4,AnimalsBeingBros,/r/AnimalsBeingBros/comments/14pbis4/stray_dog_saves_girl/,Sizzlin9,Stray dog saves girl.,6364,0.97,177,,1688367399.0,False,False,False,False,False
7,14p5ev8,worldnews,/r/worldnews/comments/14p5ev8/norway_discovers_massive_underground_deposit_of/,HelloSlowly,"Norway discovers massive underground deposit of high-grade phosphate rock, big enough to satisfy world demand for fertilisers, solar panels and electric car batteries over the next 100 years",37229,0.97,2197,,1688348338.0,False,False,False,False,False
8,14p6zr6,BrandNewSentence,/r/BrandNewSentence/comments/14p6zr6/the_forbidden_art_of_giving_crabs_knowledge/,Ryce_Byce,The forbidden art of giving crabs knowledge,20183,0.97,324,,1688352959.0,False,False,False,False,False
9,14p8v61,dankmemes,/r/dankmemes/comments/14p8v61/even_covers_arent_safe/,ZoomZombie1119,Even covers aren't safe,9611,0.98,64,"the very best, like no one ever was. ",1688358664.0,False,False,False,False,False
10,14pemck,nextfuckinglevel,/r/nextfuckinglevel/comments/14pemck/kid_goes_down_a_well_to_save_a_toddler_that_fell/,sewn_of_a_gun,Kid goes down a well to save a toddler that fell in,2402,0.97,151,,1688378079.0,False,False,False,False,False
11,14p6hic,comics,/r/comics/comments/14p6hic/my_main/,shenanigansen,My Main,15239,0.95,285,Shen Comix,1688351464.0,False,False,False,False,True
12,14p8h6t,wholesomememes,/r/wholesomememes/comments/14p8h6t/upgrades_people/,DiligentKnocking,Upgrades people,8370,0.98,117,,1688357471.0,False,False,False,False,False
13,14p8hn5,NatureIsFuckingLit,/r/NatureIsFuckingLit/comments/14p8hn5/twin_falls_idaho_usa/,iamayeshaerotica,"🔥 Twin Falls, Idaho, USA",7351,0.96,217,,1688357505.0,False,False,False,False,False
14,14p8g2w,Genshin_Impact,/r/Genshin_Impact/comments/14p8g2w/overture_teaser_the_final_feast_genshin_impact/,genshinimpact,Overture Teaser: The Final Feast | Genshin Impact,7436,0.95,1104,:hoyo1::hoyo2: Official,1688357378.0,False,False,False,False,False
15,14p3vgr,gaming,/r/gaming/comments/14p3vgr/my_65_yr_old_father_in_law_has_played_one_game/,jagrbomb,My 65 yr old father in law has played one game for the last 15 yrs. These are his stats 😵‍💫,22801,0.94,1381,,1688343929.0,False,False,False,False,False
16,14pcovp,Piracy,/r/Piracy/comments/14pcovp/its_just_a_small_monthly_payment_dude/,Itzmecaitlyn,"""Its just a small monthly payment dude""",2604,0.95,149, ,1688371366.0,False,False,False,False,False
17,14p6as9,therewasanattempt,/r/therewasanattempt/comments/14p6as9/to_rob_a_jewelry_store/,FinalSneak,To rob a jewelry store,11678,0.96,796,This is a flair,1688350899.0,False,False,False,False,False
18,14p9uju,sadcringe,/r/sadcringe/comments/14p9uju/lmfao_the_way_the_dude_died_when_he_realized_she/,shanmikko,Lmfao the way the dude died when he realized she was referring to him,4332,0.92,257,,1688361836.0,False,False,False,False,False
19,14pex4o,Genshin_Impact_Leaks,/r/Genshin_Impact_Leaks/comments/14pex4o/freminet_drip/,Junnielocked,Freminet drip,1584,0.96,383,,1688379037.0,False,False,False,False,False
20,14p53h0,antiwork,/r/antiwork/comments/14p53h0/there_seems_to_be_a_coordinated_antiwfh_campaign/,econbird,There seems to be a coordinated anti-WFH campaign happening,9703,0.97,644,,1688347433.0,False,False,False,False,False
21,14pd5e0,wholesome,/r/wholesome/comments/14pd5e0/onions/,Devoted_Mike90,Onions..,2084,0.96,32,,1688373006.0,False,False,False,False,False
22,14p7yo2,Unexpected,/r/Unexpected/comments/14p7yo2/getting_hit_with_the_full_force_of_these_fireworks/,Jeffrey_Friedl,Getting hit with the full force of these fireworks,5572,0.97,91,,1688355905.0,False,False,False,False,False
23,14p979c,PublicFreakout,/r/PublicFreakout/comments/14p979c/drunk_lady_gets_kicked_off_plane/,usernamefred,Drunk lady gets kicked off plane,4030,0.98,447,,1688359779.0,False,False,False,False,False
24,14pc2wc,pcmasterrace,/r/pcmasterrace/comments/14pc2wc/after_5_years_6162018_732023_my_precious_evga/,fray_27,"After 5 years (6/16/2018 - 7/3/2023), my precious EVGA 1080ti has finally bit the dust and may finally be at rest",2318,0.96,285,,1688369220.0,False,False,False,False,False
25,14p43lp,mildlyinfuriating,/r/mildlyinfuriating/comments/14p43lp/my_cats_consider_this_an_empty_bowl/,kneaddough,My cats consider this an empty bowl.,13271,0.92,684,,1688344576.0,False,False,False,False,False
26,14p7p7d,shitposting,/r/shitposting/comments/14p7p7d/praise_spez_i_hate_spiders/,NCR_Veteran_Rangers,Praise Spez I Hate Spiders,6108,0.98,71,,1688355090.0,False,False,False,False,False
27,14p2xvm,BlackPeopleTwitter,/r/BlackPeopleTwitter/comments/14p2xvm/if_you_take_the_low_road_youre_not_a_victim_when/,SmithNotASmith,"If you take the low road, you're not a victim when you're met there",13886,0.93,357,,1688341400.0,False,False,False,False,False
28,14pffpj,oddlysatisfying,/r/oddlysatisfying/comments/14pffpj/this_college_countdown/,amy2kim22,This college countdown,1298,0.96,17,,1688380775.0,False,False,False,False,False
29,14p3j6t,oddlyterrifying,/r/oddlyterrifying/comments/14p3j6t/a_fraction_of_my_aunts_antique_doll_collection/,ohhhjamie,A *fraction* of my Aunt’s antique doll collection - there are hundreds. Guess who inherits them?,14207,0.96,1129,,1688342976.0,False,False,False,False,False
30,14p71a6,lotrmemes,/r/lotrmemes/comments/14p71a6/your_neighbor_on_a_sunday_night_after_a_few_drinks/,CelestialFury,Your neighbor on a Sunday night after a few drinks,5391,0.98,50,,1688353083.0,False,False,False,False,False
31,14pcf98,ukraine,/r/ukraine/comments/14pcf98/kill_markings_on_the_german_provided_patriot/,Hannibal_Game,Kill Markings on the german provided Patriot battery in Ukraine,1998,0.97,120,,1688370445.0,False,False,False,False,False
32,14pf11u,CombatFootage,/r/CombatFootage/comments/14pf11u/russian_soldier_blowing_himself_up_with_grenade/,Witness2211,"Russian soldier blowing himself up with grenade in front of ukrainian soldier POV [June, Bakhmut area]",1270,0.97,160,,1688379390.0,True,False,False,False,False
33,14pazmx,formuladank,/r/formuladank/comments/14pazmx/f1_twitter_will_nevet_cease_to_amaze_me/,DaDf10,F1 twitter will nevet cease to amaze me,2589,0.95,347,BWOAHHHHHHH ,1688365570.0,False,False,False,False,False
34,14p14le,WhitePeopleTwitter,/r/WhitePeopleTwitter/comments/14p14le/aoc_being_attacked_because_of_a_harmless_selfie/,Visqo,AOC being attacked because of a harmless selfie,31722,0.89,2376,,1688336652.0,False,False,False,False,False
35,14p1ifk,OldSchoolCool,/r/OldSchoolCool/comments/14p1ifk/my_grandmas_first_picture_in_canada_after/,ComicDuhComic,My Grandma's first picture in Canada after surviving the holocaust. (1947),15882,0.95,260,,1688337649.0,False,False,False,False,False
36,14paxtv,2westerneurope4u,/r/2westerneurope4u/comments/14paxtv/norwegian_imperialism/,simon_ceo_of_sex,Norwegian Imperialism,2463,0.98,275,:Germany: [redacted],1688365403.0,False,False,False,False,False
37,14p6jp8,pics,/r/pics/comments/14p6jp8/john_oliver_supports_the_wga/,annepng,John Oliver supports the WGA.,5193,0.88,90,,1688351646.0,False,False,False,False,False
38,14p56nr,Tinder,/r/Tinder/comments/14p56nr/never_taking_advice_from_pickuplines_on_a_discord/,WastedWhaleShark,Never taking advice from #pick-up-lines on a Discord Server again 🤦‍♀️,7427,0.94,334,,1688347692.0,False,False,False,False,False
39,14p9v99,memes,/r/memes/comments/14p9v99/anybodypleasei_dont_give_a_shit_what_its_about/,Ulquiorr4_,Anybody…..please…..I don’t give a shit what it’s about…..,3176,0.9,176,,1688361906.0,False,False,False,False,False
40,14pelj4,whenthe,/r/whenthe/comments/14pelj4/i_did_nothing_wrong/,NevGuy,I did nothing wrong.,1248,0.98,33,yellow like an EPIC banana ,1688377998.0,False,False,False,False,False
41,14p8v00,TwoHotTakes,/r/TwoHotTakes/comments/14p8v00/my_husbands_best_friend_sexualized_my_daughter_at/,Smart_Elderberry_709,My husbands best friend sexualized my daughter at her sweet sixteen,3422,0.9,1079,,1688358649.0,False,1688379608.0,False,False,False
42,14pb410,facepalm,/r/facepalm/comments/14pb410/american_dream/,ScaredAde,American dream,7108,0.92,572,,1688365989.0,False,False,False,False,False
43,14pd6ri,shittymoviedetails,/r/shittymoviedetails/comments/14pd6ri/the_screaming_nurse_in_the_flash_2023_wasnt/,helpful__explorer,The screaming nurse in The Flash (2023) wasn't scripted. This was just her natural reaction upon coming face to face with Ezra Miller,1539,0.97,24,,1688373131.0,False,False,False,False,False
44,14p3b68,space,/r/space/comments/14p3b68/i_went_to_a_dark_sky_park_to_photograph_the_core/,theillini19,I went to a dark sky park to photograph the core of the Milky Way. By complete coincidence there were thousands of fireflies in the forest out for the summer. Here is a combination of long exposures I took that night of stars and fireflies.,8037,0.98,135,,1688342409.0,False,False,False,False,False
45,14pcv92,discordVideos,/r/discordVideos/comments/14pcv92/this_cured_my_depression_no_cap_jaden_williams/,DuskyFlunky,this cured my depression no cap 👍🏼 <jaden williams>,1607,0.88,105,,1688371987.0,False,False,False,False,False
46,14p3a6a,conservativeterrorism,/r/conservativeterrorism/comments/14p3a6a/well_young_people_its_time_for_you_to_sack_up/,t3lnet,"Well young people, it’s time for you to sack up…",8349,0.94,435,,1688342332.0,False,False,False,False,False
47,14pdasc,MadeMeSmile,/r/MadeMeSmile/comments/14pdasc/when_my_husband_found_out_that_id_never_had_legos/,shireengul,"When my husband found out that I’d never had Legos (because people around me said they were only for boys), he immediately bought me the sets I was admiring. At 34 y.o., I completed my first builds!",1472,1.0,48,,1688373551.0,False,False,False,False,False
48,14ozz0j,todayilearned,/r/todayilearned/comments/14ozz0j/til_a_man_was_awarded_7_million_in_damages_after/,Such-Track5369,TIL A man was awarded $7 million in damages after he developed a lung condition from eating two bags of popcorn every day and inhaling the steam from the bag,22310,0.94,805,,1688333731.0,False,False,False,False,False
49,14pdmfw,LeagueOfMemes,/r/LeagueOfMemes/comments/14pdmfw/riot_elon/,insta_brokenleague,Riot Elon,1303,0.97,75,,1688374693.0,False,False,False,False,False
50,14pc36l,australia,/r/australia/comments/14pc36l/why_are_these_houses_so_freaking_cold/,Ok_loop,Why are these houses so freaking cold ?!?!,1677,0.93,752,,1688369246.0,False,False,False,False,False
51,14oz03b,funny,/r/funny/comments/14oz03b/is_this_tasteless_well_yeah_its_subway/,D3T3KT,"Is this tasteless? Well yeah, its subway.",27658,0.93,943,,1688331367.0,False,False,False,False,False
52,14p426j,maybemaybemaybe,/r/maybemaybemaybe/comments/14p426j/maybe_maybe_maybe/,Wide_Abroad1182,Maybe maybe maybe,7056,0.96,158,,1688344463.0,False,False,False,False,False
53,14p9occ,Eldenring,/r/Eldenring/comments/14p9occ/the_disrespect_is_crazy/,cluelesstobes,the disrespect is crazy,2464,0.99,45,,1688361259.0,False,False,False,False,False
54,14p2iam,Catswithjobs,/r/Catswithjobs/comments/14p2iam/cat_manager/,decent694201,Cat manager,9492,0.98,103,,1688340225.0,False,False,False,False,False
55,14ozbal,LeopardsAteMyFace,/r/LeopardsAteMyFace/comments/14ozbal/this_is_a_death_sentence_for_me_sobs_republican/,imaginary_num6er,"“This is a death sentence for me” sobs, Republican woman who voted for DeSantis stripping away her permanent alimony",18582,0.94,1637,,1688332094.0,False,False,False,False,False
56,14pcg7n,tifu,/r/tifu/comments/14pcg7n/tifu_by_giving_my_bf_head_in_my_moms_bed/,InterestInevitable70,TIFU by giving my bf head in my moms bed,1451,0.91,203,,1688370545.0,True,1688370868.0,False,False,False
57,14p9j31,blessedimages,/r/blessedimages/comments/14p9j31/bob/,Altacontuser_123,Bob,2525,0.87,166,,1688360773.0,False,False,False,False,False
58,14parv2,ksi,/r/ksi/comments/14parv2/please_help_me/,Haiden9,Please help me,1945,0.96,54,,1688364844.0,False,False,False,False,False
59,14p8jv0,Hololive,/r/Hololive/comments/14p8jv0/bro_absolutely_killed_it/,Alcatraz1331,Bro absolutely killed it.,2873,0.98,31,:Kiara:,1688357688.0,False,False,False,False,False
60,14p4mhf,meirl,/r/meirl/comments/14p4mhf/me_irl/,Faruzia,Me_irl,5505,0.92,233,,1688346082.0,False,False,False,False,False
61,14pc0u2,CasualUK,/r/CasualUK/comments/14pc0u2/higgins_the_pheasant_update_shes_currently_sat_by/,thefreshbraincompany,Higgins the Pheasant update. She's currently sat by the window watching the bird table and the workmen next door. Tomorrow we begin the transfer over to her permanent residence.,1473,0.97,37,,1688369022.0,False,False,False,False,False
62,14p5p0o,DunderMifflin,/r/DunderMifflin/comments/14p5p0o/so_which_one_is_jim/,msoliz52,"""So which one is Jim?""",4311,0.95,89,,1688349158.0,False,False,False,False,False
63,14oy92g,politics,/r/politics/comments/14oy92g/fmr_trump_press_secretary_i_watched_him_show/,Lotus532,Fmr. Trump Press Secretary: I watched him show documents to people at Mar-a-Lago,18435,0.95,584,:flag-gb: United Kingdom,1688329547.0,False,False,False,False,False
64,14p1a34,ThatsInsane,/r/ThatsInsane/comments/14p1a34/france_more_than_2000_cars_burned_more_than_700/,wats6831,"France: More than 2,000 cars burned, more than 700 businesses were damaged, and more than 3,000 people were arrested.",10217,0.96,236,,1688337052.0,False,False,False,True,False
65,14p6mpb,Damnthatsinteresting,/r/Damnthatsinteresting/comments/14p6mpb/natural_swimming_pools_or_ponds_are_filtered/,4reddityo,Natural swimming pools or ponds are filtered organically rather than by chemicals.,20345,0.91,614,,1688351891.0,False,False,False,False,False
66,14ozrei,news,/r/news/comments/14ozrei/police_arrest_mother_of_7yearold_girl_whose_body/,Cinnamon2017,Police arrest mother of 7-year-old girl whose body was found decaying in closet,12317,0.96,651,,1688333207.0,False,False,False,False,False
67,14pcgse,ich_iel,/r/ich_iel/comments/14pcgse/ich_iel/,hell-schwarz,Ich_iel,1312,0.99,7,:milleniumsraetsel: Milleniumsrätsel Löser :F35:,1688370605.0,True,False,False,False,False
68,14p4x7y,fightporn,/r/fightporn/comments/14p4x7y/bitches_gone_wild_well_almost/,J4ckSic4rio,"Bitches gone wild, well almost ",5020,0.91,246,,1688346933.0,False,False,False,False,False
69,14pcmx7,SipsTea,/r/SipsTea/comments/14pcmx7/who_are_you/,Chaqquesa,...who are you ?!,1242,0.97,11,,1688371210.0,False,False,False,False,False
70,14p5kh6,ChatGPT,/r/ChatGPT/comments/14p5kh6/do_we_really_sound_like_this/,youngdumbandbroke06,Do we really sound like this?,4200,0.95,539,,1688348794.0,False,False,False,False,False
71,14p2y8t,cats,/r/cats/comments/14p2y8t/does_anyone_have_experience_with_runts_this_guy/,Begonethot212,Does anyone have experience with runts? This guy looks quite a bit younger/different than the other kittens in the litter.,6474,0.98,381,,1688341429.0,False,False,False,False,False
72,14p0zld,NonPoliticalTwitter,/r/NonPoliticalTwitter/comments/14p0zld/terrifying_for_her/,burakalp34,Terrifying for her,9439,0.97,170,:blue1::blue2::1111::1112:,1688336297.0,False,False,False,False,False
73,14ozssv,WTF,/r/WTF/comments/14ozssv/i_drank_the_water_and_popped_it_open/,EnigmaEcstacy,I drank the water and popped it open.,11013,0.95,1206,,1688333309.0,False,False,False,False,False
74,14pa2al,dankmemes,/r/dankmemes/comments/14pa2al/gottem/,CameraGunPizza,gottem!,5838,0.98,68,,1688362545.0,False,False,False,False,False
75,14p3gyd,popheadscirclejerk,/r/popheadscirclejerk/comments/14p3gyd/let_them_cook/,makinishi_KINO,Let them cook,5313,0.94,163,Poggers Rae Jepsen,1688342797.0,False,False,False,False,False
76,14p7kfr,BeAmazed,/r/BeAmazed/comments/14p7kfr/did_you_know_that_in_oklahoma_the_manhole_covers/,skumati99,"Did you know that in Oklahoma, the manhole covers have a map of the city on them? And get this, there's a little white dot on the map that shows you where you are! Pretty cool, huh?",2649,0.97,80,,1688354680.0,False,False,False,False,False
77,14p8fpk,HonkaiStarRail,/r/HonkaiStarRail/comments/14p8fpk/version_12_livestream_planned_for_july_8_2023/,Xanek,"Version 1.2 Livestream planned for July 8, 2023 @ 19:30 (UTC+8) / Honkai: Star Rail Version 1.2 ""Even Immortality Ends"" Special Program",2239,0.97,150,,1688357345.0,False,False,False,False,False
78,14pd5hb,pettyrevenge,/r/pettyrevenge/comments/14pd5hb/i_got_revenge_on_my_bully/,GoldenPotato38,I got revenge on my bully,976,0.97,56,,1688373014.0,False,False,False,False,False
79,14pfcdt,UkraineWarVideoReport,/r/UkraineWarVideoReport/comments/14pfcdt/translated_a_firstperson_video_from_the_ukrainian/,Legalized_NSFW_Today,"Translated: A first-person video from the Ukrainian commander, Comrade Datsyk from the 3rd Assault Brigade (3 OSHBr), shows ""The Decepticon"" in the direction of Bakhmut.",688,0.99,86,,1688380457.0,False,False,False,False,False
80,14pa9xm,LivestreamFail,/r/LivestreamFail/comments/14pa9xm/kick_has_implemented_feature_to_censor_the_slots/,Nojoboy,"Kick Has Implemented Feature to Censor the Slots & Casino and/or the Pool, Hot Tub & Bikinis sections.",1596,0.9,441,:),1688363222.0,False,False,False,False,False
81,14oyn8s,NewsOfTheStupid,/r/NewsOfTheStupid/comments/14oyn8s/man_named_in_supreme_courts_gay_wedding_website/,Misguided_Society,Man Named in Supreme Court's Gay Wedding Website Ruling is Married to a Woman and Never Even Contacted the Web Designer,10461,0.95,654,,1688330493.0,False,False,False,False,False
82,14p2fux,tumblr,/r/tumblr/comments/14p2fux/tumblr_poster/,lord_braleigh,Tumblr poster,6321,0.99,48,,1688340043.0,False,False,False,False,False
83,14p4y6g,Grimdank,/r/Grimdank/comments/14p4y6g/if_youre_going_to_be_a_dwarf_aim_for_deep_rock/,TheModernRouge,"If you’re going to be a dwarf, aim for Deep Rock Galactic instead of Vermintide",3833,0.97,133,I am Alpharius,1688347014.0,False,False,False,False,False
84,14p1caf,technology,/r/technology/comments/14p1caf/over_100_artists_boycotting_venues_that_use/,geoxol,Over 100 artists boycotting venues that use face-scanning technology,6392,0.96,335,,1688337204.0,False,False,False,False,False
85,14p859u,anime_irl,/r/anime_irl/comments/14p859u/anime_irl/,canivola,anime_irl,2223,0.97,68,,1688356481.0,False,False,False,False,False
86,14p4rzq,wholesomememes,/r/wholesomememes/comments/14p4rzq/memory_unlocked/,Naive_Establishment2,Memory unlocked!!,14359,0.97,201,,1688346501.0,False,False,False,False,False
87,14p4wgt,nextfuckinglevel,/r/nextfuckinglevel/comments/14p4wgt/msg_sphere_in_las_vegas_says_hello_world/,picNsave,"MSG Sphere in Las Vegas says ""Hello World""",16181,0.94,665,,1688346877.0,False,False,False,False,False
88,14p1tjt,nba,/r/nba/comments/14p1tjt/drakes_comment_on_fred_vanvleets_thank_you_post/,OhmsLaw111,Drake’s comment on Fred Vanvleet’s thank you post.“ Good luck on the Guangdong Dragons…..I mean the Houston Rockets”,5890,0.93,655,:tor-4: Raptors,1688338446.0,False,False,False,False,False
89,14p5zqc,destiny2,/r/destiny2/comments/14p5zqc/would_anyone_else_be_down_for_a_infinite_round/,G-man69420,Would anyone else be down for a infinite round “Horde Mode” in D2?,3028,0.95,298,[🔭Wayfarer Warlock🛰️],1688349991.0,False,False,False,False,False
90,14p4f3c,popculturechat,/r/popculturechat/comments/14p4f3c/taylor_swift_trashshamed_by_new_yorks_sanitation/,romeofantasy,Taylor Swift 'trash-shamed' by New York's Sanitation Department.,3813,0.92,293,,1688345478.0,False,False,False,False,False
91,14p7toq,HumansAreMetal,/r/HumansAreMetal/comments/14p7toq/rising_from_the_dead/,secretslut991,Rising from the dead,2143,0.96,29,,1688355474.0,False,False,False,False,False
92,14p1ufy,movies,/r/movies/comments/14p1ufy/after_barbie_mattel_is_raiding_its_entire_toy_box/,indig0sixalpha,"After “Barbie,” Mattel Is Raiding Its Entire Toy Box",5414,0.92,1029,,1688338513.0,False,False,False,False,False
93,14p9088,197,/r/197/comments/14p9088/rule/,Improvement1708,rule,1773,0.98,15,,1688359130.0,False,False,False,False,False
94,14p5p16,me_irlgbt,/r/me_irlgbt/comments/14p5p16/me_irlgbt/,burned_my_tongue,Me_irlgbt,3029,0.96,115,,1688349159.0,False,False,False,False,False
95,14ozzoy,OneOrangeBraincell,/r/OneOrangeBraincell/comments/14ozzoy/two_cuties_sleeping/,SmallBirdInSky,Two cuties sleeping,7466,0.98,70,,1688333780.0,False,False,False,False,False
96,14ox9v7,FunnyandSad,/r/FunnyandSad/comments/14ox9v7/people_should_work_hard_to_get_housed_every/,Devils_negotiator,“People should work hard to get housed” -every feudal landlord.,13618,0.93,549,,1688327115.0,False,False,False,False,False
97,14p5w1i,CrazyFuckingVideos,/r/CrazyFuckingVideos/comments/14p5w1i/a_visitor_at_a_north_carolina_amusement_park/,rCarmar,A visitor at a North Carolina amusement park spotted a large crack on a roller coaster's pillar,2829,0.98,192,,1688349711.0,False,False,False,False,False
98,14p7u59,cursedcomments,/r/cursedcomments/comments/14p7u59/cursed_advice/,XqueezeMePlease,Cursed_advice,2203,0.99,38,,1688355511.0,False,False,False,False,False
99,14p4zui,DeepRockGalactic,/r/DeepRockGalactic/comments/14p4zui/dont_know_if_anyones_posted_this_yet_but_i_had_a/,TwatToggler,"Don't know if anyone's posted this yet, but I had a laugh",3306,0.98,30,,1688347151.0,False,False,False,False,False
100,14oxklh,TikTokCringe,/r/TikTokCringe/comments/14oxklh/if_you_watch_only_one_video_today_let_this_be_the/,Rollyman1,"If you watch only one video today, let this be the one.",13671,0.87,867,,1688327880.0,False,False,False,False,False
