rank,id,subreddit,permalink,author,title,score,upvote_ratio,num_comments,author_flair_text,created_utc,over_18,edited,stickied,locked,is_original_content
1,14qwtqf,WhitePeopleTwitter,/r/WhitePeopleTwitter/comments/14qwtqf/reddit_what_do_you_think/,seangolden06,"Reddit, what do you think?",31970,0.93,818,,1688520955.0,False,False,False,False,False
2,14r1aau,nextfuckinglevel,/r/nextfuckinglevel/comments/14r1aau/sharp_and_very_decent_human/,TenselyDazzling,Sharp and very decent human,6703,0.98,179,,1688535204.0,False,False,False,False,False
3,14qxs5l,oddlysatisfying,/r/oddlysatisfying/comments/14qxs5l/submerging_eiderdown_in_water/,solateor,submerging eiderdown in water,17025,0.97,226,,1688523926.0,False,False,False,False,False
4,14r1xv8,HumansBeingBros,/r/HumansBeingBros/comments/14r1xv8/the_trapped_dog_doesnt_wait_a_bit_to_hug_the/,JettMe_Red,The trapped dog doesn't wait a bit to hug the rescuer after being freed..,4587,0.98,79,,1688537435.0,False,False,False,False,False
5,14qxf9g,wholesomememes,/r/wholesomememes/comments/14qxf9g/it_was_and_still_is_one_of_the_best_feelings/,utterbreakerjy,It was and still is one of the best feelings,14935,0.97,172,,1688522829.0,False,False,False,False,False
6,14qwazj,Damnthatsinteresting,/r/Damnthatsinteresting/comments/14qwazj/in_1970_dock_ellis_threw_a_nohitter_under_the/,Seraphenigma,"In 1970, Dock Ellis threw a no-hitter under the influence of LSD",20115,0.95,672,,1688519308.0,False,False,False,False,False
7,14r0moh,BeAmazed,/r/BeAmazed/comments/14r0moh/yep_thats_a_big_fat_10/,kimcutiepie,Yep! That's a big fat 10!,5222,0.98,110,,1688533072.0,False,False,False,False,False
8,14qwnzk,MadeMeSmile,/r/MadeMeSmile/comments/14qwnzk/after_a_long_battle_my_dream_came_true_today_my/,simoonne,After a long battle. My dream came true today! My mom ie cancer free. So proud of her.,13894,0.95,185,,1688520452.0,False,False,False,False,False
9,14qvc1k,facepalm,/r/facepalm/comments/14qvc1k/i_dont_understand_why_he_would_move_on/,NoPermissionaz,I don't understand why he would move on.,39098,0.91,1829,,1688516368.0,False,False,False,False,False
10,14qxhyo,therewasanattempt,/r/therewasanattempt/comments/14qxhyo/to_ask_a_fashion_blogger_a_nuclear_weapon_question/,shurikien,To ask a fashion blogger a nuclear weapon question,8232,0.94,561,,1688523064.0,False,False,False,False,False
11,14qtkbz,mildlyinfuriating,/r/mildlyinfuriating/comments/14qtkbz/kids_eat_free_lol/,hadtodoit_69,“Kids eat free” lol,25560,0.95,1145,,1688511335.0,False,False,False,False,False
12,14qugij,madlads,/r/madlads/comments/14qugij/madlad_in_lecture_repost_because_of_new_rules/,littlerocky12,Madlad in Lecture (repost because of new rules),16903,0.95,207,,1688513828.0,False,False,False,False,False
13,14qvviq,maybemaybemaybe,/r/maybemaybemaybe/comments/14qvviq/maybe_maybe_maybe/,50ShadesOfSpray_,Maybe maybe maybe,13154,0.86,876,,1688518002.0,False,False,False,False,False
14,14r0r2n,meirl,/r/meirl/comments/14r0r2n/meirl/,Majestic-Unicorn33,meirl,3330,0.99,55,,1688533427.0,False,False,False,False,False
15,14quv22,politics,/r/politics/comments/14quv22/republican_party_ridiculed_after_tweeting_wrong/,Oleg101,Republican Party ridiculed after tweeting wrong flag for Fourth of July,9337,0.96,399,,1688515000.0,False,False,False,False,False
16,14quo8i,funny,/r/funny/comments/14quo8i/if_u_ever_feel_like_a_failure_remember_denmarks/,Fun_Bison_1693,If u ever feel like a failure remember Denmark's Travel agency made this advertisement to fight Denmark's low birth rate,9566,0.93,616,,1688514436.0,True,False,False,False,False
17,14qzk9o,HonkaiStarRail,/r/HonkaiStarRail/comments/14qzk9o/official_character_announcement_fu_xuan_5_star/,Xanek,【Official】 Character Announcement: Fu Xuan (5 Star - Quantum / Preservation),3813,0.96,287,,1688529619.0,False,False,False,False,False
18,14qu65p,todayilearned,/r/todayilearned/comments/14qu65p/til_that_the_bbc_had_no_archival_policy_until/,PegPelvis,"TIL that the BBC had no archival policy until 1978, and many of its old broadcasts were only aired live. A number of BBC broadcasts are lost, including a show featuring a then-unknown Bob Dylan; 97 episodes of Dr. Who; and most of its coverage of the moon landing.",9877,0.98,296,,1688513053.0,False,False,False,False,False
19,14qx6nu,oddlyterrifying,/r/oddlyterrifying/comments/14qx6nu/went_to_throw_something_in_the_little_recyling/,hunterorila,Went to throw something in the little recyling bin we have on the counter and...,6093,0.97,205,,1688522105.0,False,False,False,False,False
20,14qyvtg,OldSchoolCool,/r/OldSchoolCool/comments/14qyvtg/1940s_contraption_for_infant_leg_muscle/,wronghoIe,1940’s contraption for infant leg muscle development.,3703,0.99,192,,1688527365.0,False,False,False,False,False
21,14qydmc,shitposting,/r/shitposting/comments/14qydmc/heil_dear_leader_spez/,OdinAurelius,Heil dear leader Spez,4592,0.95,65,William Dripfoe,1688525804.0,False,False,False,False,False
22,14qvrc3,aww,/r/aww/comments/14qvrc3/mini_taekwondo/,TrueSkyDemon,Mini Taekwondo,6024,0.88,147,,1688517657.0,False,False,False,False,False
23,14qtkbs,memes,/r/memes/comments/14qtkbs/havent_seen_a_dollar_coin_in_a_long_time/,Sadboy_looking4memes,Haven't seen a dollar coin in a long time.,12671,0.97,417,OC Meme Maker,1688511335.0,False,False,False,False,False
24,14qq9ms,antiwork,/r/antiwork/comments/14qq9ms/my_boss_was_mad_at_me_for_posting_online_how_much/,Jacq1987,"My boss was mad at me for posting online how much I make per hour and threatened to fire me, so I quit.",23012,0.93,1747,,1688503045.0,False,False,False,False,False
25,14qtw8d,PrequelMemes,/r/PrequelMemes/comments/14qtw8d/beard/,Alternative_Serve368,Beard,8201,0.98,95,,1688512261.0,False,False,False,False,False
26,14qqi4r,cats,/r/cats/comments/14qqi4r/give_him_everything_he_wants/,Small_Elf_Girl,Give him everything he wants 😿,14219,0.97,302,,1688503620.0,False,False,False,False,False
27,14qu6kj,NonPoliticalTwitter,/r/NonPoliticalTwitter/comments/14qu6kj/i_mean_seriously/,CattDawg2008,i mean seriously,6093,0.95,88,:blue1::blue2::1111::1112:,1688513086.0,False,False,False,False,False
28,14qsjdc,tumblr,/r/tumblr/comments/14qsjdc/the_second_and_third_coming/,StraightOuttaOlaphis,The second and third coming,9089,0.97,132,,1688508613.0,False,False,False,False,False
29,14qpzsq,worldnews,/r/worldnews/comments/14qpzsq/russia_rigs_znpp_reactor_buildings_with/,TheRealMykola,Russia rigs ZNPP reactor buildings with explosives – AFU,12039,0.95,1819,,1688502411.0,False,False,False,False,False
30,14qrlmf,HolUp,/r/HolUp/comments/14qrlmf/literally_my_hero/,MeteoXavier,Literally My Hero,10915,0.95,39,,1688506260.0,False,False,False,False,False
31,14qr3lt,BrandNewSentence,/r/BrandNewSentence/comments/14qr3lt/yeah_this_will_probably_be_a_mature_conversation/,venmke,"Yeah, this will probably be a mature conversation.",12543,0.93,1117,,1688505058.0,False,False,False,False,False
32,14r01of,Damnthatsinteresting,/r/Damnthatsinteresting/comments/14r01of/recyling_discarded_bars_of_soap_from_hotels/,CantStopPoppin,Recyling discarded bars of soap from hotels.,4166,0.97,325,,1688531149.0,False,False,False,False,False
33,14qp94o,gaming,/r/gaming/comments/14qp94o/nobody_is_playing_halo_infinite_as_steam_numbers/,PrinceDizzy,Nobody is playing Halo Infinite as Steam numbers drop to 2% of launch,17430,0.9,2888,Joystick,1688500675.0,False,False,False,False,False
34,14qxmle,BeAmazed,/r/BeAmazed/comments/14qxmle/no_one_told_me_moose_were_this_massive/,beastmodeChadF13,no one told me moose were THIS massive ,6663,0.95,599,,1688523441.0,False,False,False,False,False
35,14qve1f,DesignPorn,/r/DesignPorn/comments/14qve1f/its_only_a_drain_but/,Organic-Squirm,It’s only a drain but…,4216,0.95,82,,1688516521.0,False,False,False,False,False
36,14qujpd,therewasanattempt,/r/therewasanattempt/comments/14qujpd/to_be_cute/,handilypulp96,to be cute,13927,0.95,491,,1688514072.0,False,False,False,False,False
37,14quhi1,WorkReform,/r/WorkReform/comments/14quhi1/i_took_a_job_nobody_wanted_and_made_it_so_good_i/,BakerLovePie,I took a job nobody wanted and made it so good I got fired.,4727,0.97,221,,1688513906.0,False,False,False,False,False
38,14qqy4v,PeterExplainsTheJoke,/r/PeterExplainsTheJoke/comments/14qqy4v/can_someone_help/,Responsible_Body5907,Can someone help,11421,0.91,908,,1688504683.0,False,False,False,False,False
39,14qwxjs,nba,/r/nba/comments/14qwxjs/today_marks_7_years_ago_to_the_day_that_kevin/,CulturalRoll,Today marks 7 years ago to the day that Kevin Durant signed with the Golden State Warriors -- possibly the most infamous signing in NBA history,3118,0.94,728,:gsw-5: Warriors,1688521283.0,False,1688537073.0,False,False,False
40,14qzviy,AskReddit,/r/AskReddit/comments/14qzviy/if_poor_people_fantasize_about_winning_the/,more_bees_pleas,"If poor people fantasize about winning the lottery, then what do rich people fantasize about?",1920,0.94,1496,,1688530598.0,False,False,False,False,False
41,14r0dlu,nextfuckinglevel,/r/nextfuckinglevel/comments/14r0dlu/the_vegas_sphere_is_live/,MyNameIsRJ,The Vegas Sphere is Live,3445,0.98,228,,1688532248.0,False,False,False,False,False
42,14qvwln,facepalm,/r/facepalm/comments/14qvwln/only_fans_vs_twitch/,LadyBirdDavis,Only Fans vs. Twitch,9975,0.94,252,,1688518098.0,False,False,False,False,False
43,14r1tbo,ich_iel,/r/ich_iel/comments/14r1tbo/ichiel/,mingaflo,ich🧑‍🎓🤑iel,1322,0.85,232,,1688537018.0,True,False,False,False,False
44,14qv539,animememes,/r/animememes/comments/14qv539/bitter_truth/,Con___artist,Bitter Truth,4528,0.92,133,,1688515803.0,False,False,False,False,False
45,14qy4a4,CrazyFuckingVideos,/r/CrazyFuckingVideos/comments/14qy4a4/mans_does_not_get_paid_enough_for_this_response/,Caseyisweird,Mans does not get paid enough for this response. ,2444,0.9,687,,1688524970.0,False,False,False,False,False
46,14r3szk,UkraineWarVideoReport,/r/UkraineWarVideoReport/comments/14r3szk/drone_footage_of_yesterdays_massive_ammo_dump/,Repulsive-Pattern-57,Drone footage of yesterday’s massive ammo dump explosion in temporarily occupied Makiivka,932,0.99,104,,1688543574.0,False,False,False,False,False
47,14qy2hp,doordash_drivers,/r/doordash_drivers/comments/14qy2hp/whyre_they_like_this/,grizzyber,why’re they like this 💀,2426,0.96,151,,1688524807.0,False,False,False,False,False
48,14qypyo,Hololive,/r/Hololive/comments/14qypyo/i_love_these_dorks/,Customer-Sorry,I love these dorks,2187,0.97,29,:Matsuri::Okayu::Gura::Subaru::Matsuri:,1688526852.0,False,False,False,False,False
49,14qo9wu,doordash,/r/doordash/comments/14qo9wu/why_is_my_driver_in_georgia/,Takeapropaganda666,Why is my driver in Georgia,22329,0.93,1487,,1688498312.0,False,False,False,False,False
50,14qrsa6,pcmasterrace,/r/pcmasterrace/comments/14qrsa6/after_2_weeks_of_trying_to_fix_my_connectors/,Tomek3DS,"After 2 weeks of trying to fix my connectors, buying new fans, and going through mountains of support in an attempt to stop my cooling from sounding like an engine, I came to learn that I had to press the ""apply"" button.",7053,0.97,213,,1688506712.0,False,False,False,False,False
51,14qpb0x,comics,/r/comics/comments/14qpb0x/choose_your_weapon/,MurkyWay,Choose Your Weapon,12388,0.95,587,Swords,1688500807.0,False,False,False,False,False
52,14quojl,TikTokCringe,/r/TikTokCringe/comments/14quojl/yoooo/,xella64,Yoooo 💀,4153,0.96,299,,1688514461.0,False,False,False,False,False
53,14r1t9a,formuladank,/r/formuladank/comments/14r1t9a/most_sane_wdc_take/,simedr,Most sane WDC take,1239,0.97,58,Question.,1688537013.0,False,False,False,False,False
54,14qv8mr,ImTheMainCharacter,/r/ImTheMainCharacter/comments/14qv8mr/man_walks_in_the_middle_of_the_road/,FellowTravellers,Man walks in the middle of the road,3771,0.95,484,,1688516090.0,False,False,False,False,False
55,14r1ngt,discordVideos,/r/discordVideos/comments/14r1ngt/ayoooo_maybe_what_the_fuck_what_you_say/,Safe_Discipline_4926,Ayoooo Maybe what the fuck what you say,1284,0.89,153,,1688536479.0,True,False,False,False,False
56,14qqf8r,Serverlife,/r/Serverlife/comments/14qqf8r/arrested_for_not_paying_a_tables_tab_that_walked/,HypocriticalHobbes,Arrested for not paying a tables tab that walked out,10904,0.82,2008,,1688503423.0,False,1688504727.0,False,False,False
57,14qnpha,NatureIsFuckingLit,/r/NatureIsFuckingLit/comments/14qnpha/a_snake_slithering_up_a_brick_wall/,amish_novelty,🔥 A snake slithering up a brick wall,15787,0.94,406,,1688496989.0,False,False,False,False,False
58,14quz75,lotrmemes,/r/lotrmemes/comments/14quz75/why_does_he_always_die_tho/,Forest_folf,Why does he always die tho,3929,0.97,148,Dwarf,1688515334.0,False,False,False,False,False
59,14r1ji3,TrashTaste,/r/TrashTaste/comments/14r1ji3/american_boys/,YAGIboy,American boys,1255,0.97,30,Connoisseur of Trash,1688536098.0,False,False,False,False,False
60,14qq56t,PublicFreakout,/r/PublicFreakout/comments/14qq56t/fafo_arrest_me_i_dare_you/,binks922,FAFO - Arrest Me! I Dare You!,9742,0.94,1016,,1688502755.0,True,False,False,False,False
61,14qpkng,PoliticalHumor,/r/PoliticalHumor/comments/14qpkng/spot_the_billionaire/,phydeauxbreath,Spot the Billionaire,8964,0.94,335,,1688501410.0,False,False,False,False,False
62,14qun6f,HyruleEngineering,/r/HyruleEngineering/comments/14qun6f/gentlemen_the_age_of_jet_aircrafts_has_finally/,Ultrababouin,"Gentlemen, the age of jet aircrafts has finally arrived",3858,0.97,130,Mad scientist,1688514346.0,False,False,False,False,False
63,14qmw0w,news,/r/news/comments/14qmw0w/suspicious_powder_found_at_the_white_house_when/,Swoltergeist,"Suspicious powder found at the White House when Biden was gone was cocaine, AP sources say",18113,0.9,2566,,1688495124.0,False,False,False,False,False
64,14qzkxc,Genshin_Impact,/r/Genshin_Impact/comments/14qzkxc/happy_birthday_barbara/,genshinimpact,"Happy Birthday, Barbara!",1677,0.97,32,:hoyo1::hoyo2: Official,1688529670.0,False,False,False,False,False
65,14qvuus,mildlyinfuriating,/r/mildlyinfuriating/comments/14qvuus/neighbor_keeps_breaking_windows_if_we_park_in_the/,PlayBoiPrada,Neighbor keeps breaking windows if we park in the ‘wrong’ spot on a public road.,7993,0.89,783,,1688517945.0,False,False,False,False,False
66,14quux3,clevercomebacks,/r/clevercomebacks/comments/14quux3/family_is_everything/,mrl33602,Family is everything,3670,0.95,49,,1688514987.0,False,False,False,False,False
67,14qs5c9,Showerthoughts,/r/Showerthoughts/comments/14qs5c9/humanity_has_put_so_many_safety_measures_in_place/,hanMan86,Humanity has put so many safety measures in place that natural selection can no longer eliminate stupid people at an effective rate.,5671,0.88,500,,1688507618.0,False,False,False,False,False
68,14qp4zf,StupidFood,/r/StupidFood/comments/14qp4zf/2k_pizza_for_a_celeb/,danonck,"$2k ""pizza"" for a celeb",11463,0.83,2678,,1688500385.0,False,False,False,False,False
69,14qw4e2,teenagers,/r/teenagers/comments/14qw4e2/guys_this_girl_after_5_minutes_of_chatting_with/,ItzJustOriginal,Guys this girl after 5 minutes of chatting with me just sent a boob pic. what do I do,3085,0.94,798,15,1688518779.0,True,False,False,False,False
70,14quuxe,shittymoviedetails,/r/shittymoviedetails/comments/14quuxe/in_titanic_1997_rose_drops_her_priceless_necklace/,Mr_Westerfield,"In Titanic (1997), Rose drops her priceless necklace into the sea because she thinks that’s a better use for it than, like, leaving it to her family or paying the medical bills for a kid with cancer or something",3533,0.98,72,,1688514987.0,False,False,False,False,False
71,14qzpd2,HonkaiStarRail_leaks,/r/HonkaiStarRail_leaks/comments/14qzpd2/fu_xuan_official_reveal/,Slight-Improvement84,Fu Xuan official reveal,1530,0.96,189,,1688530036.0,False,False,False,False,False
72,14qt3h0,Grimdank,/r/Grimdank/comments/14qt3h0/lets_pretend_that_didnt_happen/,Careful-Level,Let's pretend that didn't happen,4621,0.97,249,,1688510076.0,False,False,False,False,False
73,14qua94,OneOrangeBraincell,/r/OneOrangeBraincell/comments/14qua94/some_of_my_favorite_photos_of_my_most_precious/,Eolssu,Some of my favorite photos of my most precious treasure. 🧡,3628,0.99,147,,1688513386.0,False,False,False,False,False
74,14qqa9c,Spiderman,/r/Spiderman/comments/14qqa9c/mexican_revolution_spiderman_by_percodine_on/,Competitive_Yak1988,Mexican Revolution Spider-Man by @Percodine on Twitter,7218,0.96,277,,1688503088.0,False,False,False,False,False
75,14qv6jg,terriblefacebookmemes,/r/terriblefacebookmemes/comments/14qv6jg/remember_when_we_had_0_unemployment_and_world/,speachtree,Remember when we had 0 unemployment and world peace? Wasn’t that nice?,3217,0.96,179,,1688515913.0,False,False,False,False,False
76,14qy6ev,pettyrevenge,/r/pettyrevenge/comments/14qy6ev/my_stepdad_wore_the_same_shirt_i_got_in_trouble/,PlotHole2017,My stepdad wore the same shirt I got in trouble for during the parent teacher meeting,1874,0.95,77,,1688525159.0,False,False,False,False,False
77,14qp9yt,WTF,/r/WTF/comments/14qp9yt/welcome_to_zombieland/,sirblackhand,Welcome To Zombieland ,7833,0.91,894,,1688500734.0,False,False,False,False,False
78,14r19xa,distressingmemes,/r/distressingmemes/comments/14r19xa/first_meme/,IliftHeavyCircles-95,First meme,1127,0.96,39,"they were skinwalkers, not my family",1688535170.0,False,False,False,False,False
79,14qumzu,WhitePeopleTwitter,/r/WhitePeopleTwitter/comments/14qumzu/a_traitor/,Paneraiguy1,A traitor?,7534,0.98,287,,1688514333.0,False,False,False,False,False
80,14qvpj9,DunderMifflin,/r/DunderMifflin/comments/14qvpj9/the_most_popular_oscar_line_was_besides_having/,goldenretreiverdude,"The most popular Oscar line was: “Besides having sex with men, I'd say the Finer Things Club is the gayest thing about me.” - Next up is Dwight Schrute (Mr Poop) - Comment your favorite Dwight line from the show! Only comment with Dwight lines and do not comment a line is someone else already has!",2866,0.92,661,:david: David Wallace,1688517510.0,False,False,False,False,False
81,14qoc4v,dankmemes,/r/dankmemes/comments/14qoc4v/from_mickey_mouse_club_to_lou_ferrigno/,LemonConnoiseur,From Mickey Mouse Club to Lou Ferrigno,13259,0.95,488,☣️,1688498460.0,False,False,False,False,False
82,14qohwj,ProgrammerHumor,/r/ProgrammerHumor/comments/14qohwj/thanksforthefork/,huxx__,thanksForTheFork,9008,0.97,108,,1688498845.0,False,False,False,False,False
83,14qvlwa,diablo4,/r/diablo4/comments/14qvlwa/what_is_your_biggest_frustration_so_far_in_diablo/,IMSirDiaries,What is your biggest frustration so far in DIABLO IV?,2690,0.97,628,,1688517188.0,False,False,False,False,False
84,14qr9lq,OldSchoolCool,/r/OldSchoolCool/comments/14qr9lq/penelope_cruz_and_salma_hayek_in_90s/,cliptemnestra,Penelope Cruz and Salma Hayek in 90s,13186,0.95,578,,1688505466.0,False,False,False,False,False
85,14qucx1,Eyebleach,/r/Eyebleach/comments/14qucx1/my_wonderful_and_beautiful_grandma_i_love_you_3/,SophiaElvenKitten,My wonderful and beautiful grandma!! I love you :) <3 Akochan!!!,3257,0.94,55,,1688513569.0,False,False,False,False,False
86,14qsnas,NewsOfTheStupid,/r/NewsOfTheStupid/comments/14qsnas/republican_party_forced_to_delete_fourth_of_july/,Misguided_Society,Republican Party forced to delete Fourth of July tweet after the flags they used in the graphic were not the American flag. They were the West African Liberian flag.,4002,0.94,178,,1688508896.0,False,False,False,False,False
87,14qwq6u,19684,/r/19684/comments/14qwq6u/rule/,OutrageousPomelo7,rule,2175,0.96,71,,1688520648.0,False,False,False,False,False
88,14qm3gz,Tinder,/r/Tinder/comments/14qm3gz/almost_found_my_perfect_woman/,proffesaur,Almost found my perfect woman,12782,0.96,233,,1688493319.0,False,False,False,False,False
89,14qtis3,LifeProTips,/r/LifeProTips/comments/14qtis3/lpt_when_attending_a_party_at_someones_home_help/,bluegambit875,"LPT: When attending a party at someone's home, help pick up trash when things start winding down. Other people will start doing the same and the cleanup will go much faster. Plus you will be viewed as a thoughtful and considerate guest.",3466,0.96,82,,1688511218.0,False,False,False,False,False
90,14qox80,ThatsInsane,/r/ThatsInsane/comments/14qox80/american_cop_attacks_woman_filming_her_husbands/,LouisSaintJust1789,American Cop attacks woman filming her husbands arrest and puts his knee on her neck.,7270,0.91,665,,1688499876.0,False,False,False,False,False
91,14qvldt,Animemes,/r/Animemes/comments/14qvldt/aqua_x_ruby_ship/,WIN---,Aqua x Ruby Ship ❣️,2675,0.89,154,,1688517139.0,False,False,False,False,False
92,14r00kl,explainlikeimfive,/r/explainlikeimfive/comments/14r00kl/eli5_if_a_regular_weight_person_and_an_obese/,bin_of_flowers,"ELI5 If a regular weight person and an obese person were left on a desert island with no food, would the obese person live a lot longer bc they have stored up energy as fat? Or does it not work like that?",1197,0.94,328,,1688531052.0,False,False,False,False,False
93,14qtjbu,meirl,/r/meirl/comments/14qtjbu/meirl/,AMCBUYANDHOLD,Meirl,12885,0.82,231,,1688511261.0,False,False,False,False,False
94,14qt3qb,satisfying,/r/satisfying/comments/14qt3qb/30mph_rearend_test_suv_edition/,make--it--happen,30mph Rear-End Test (SUV Edition),3879,0.88,372,,1688510096.0,False,False,False,False,False
95,14qpmdu,politics,/r/politics/comments/14qpmdu/fascists_go_home_philadelphians_reject_far_right/,newnemo,“Fascists Go Home!”: Philadelphians Reject Far Right “Moms for Liberty” | Over 50 local and national organizations joined to counter the harmful messaging from the far right group’s conference.,15409,0.94,833,:flag-vt: Vermont,1688501522.0,False,False,False,False,False
96,14qwg2k,FunnyAnimals,/r/FunnyAnimals/comments/14qwg2k/cat_found_out_where_the_light_switch_is/,Subzerocool9,Cat found out where the light switch is ,2104,0.97,34,,1688519755.0,False,False,False,False,False
97,14qz874,oddlysatisfying,/r/oddlysatisfying/comments/14qz874/the_mirror_shine_of_a_cutlass_fish/,Douglasqqq,The mirror shine of a cutlass fish,2616,0.94,107,,1688528501.0,False,False,False,False,False
98,14qqsli,AITAH,/r/AITAH/comments/14qqsli/aita_for_breaking_my_promise_and_ruining_my_kids/,UnusualEarth5833,AITA for breaking my promise and ruining my kids realtionship with their dad,5068,0.93,1338,,1688504336.0,False,1688505633.0,False,False,False
99,14qzwc0,IndianDankMemes,/r/IndianDankMemes/comments/14qzwc0/weve_risen_from_the_trenches/,birbal_ki_maggi,we've risen from the trenches 😤,1165,0.97,33,,1688530674.0,False,False,False,False,False
100,14qu1vs,whenthe,/r/whenthe/comments/14qu1vs/bbut_muh_ideology/,IRageQuit06,"""b-but muh ideology""",3260,0.9,141,,1688512719.0,False,False,False,False,False
