rank,id,subreddit,permalink,author,title,score,upvote_ratio,num_comments,author_flair_text,created_utc,over_18,edited,stickied,locked,is_original_content
1,1502g0j,Damnthatsinteresting,/r/Damnthatsinteresting/comments/1502g0j/jonathan_was_born_in_1832_in_the_seychelles_he/,OneHundredForcer,Jonathan was born in 1832 in the Seychelles. He has been living in Saint Helena since 1882 and just celebrated his 190th birthday.,14207,0.98,423,,1689396960.0,False,False,False,False,False
2,150275n,wholesome,/r/wholesome/comments/150275n/father_makes_sure_his_autistic_son_doesnt_get_too/,Sufficient-Bug-9112,Father makes sure his autistic son doesn't get too close or touch the royal guard and then this happens...,14842,0.96,427,,1689396166.0,False,False,False,False,False
3,1502twm,facepalm,/r/facepalm/comments/1502twm/american_healthcare_system_is_broken/,NoAmphibianz,American healthcare system is broken,10563,0.94,2225,,1689398178.0,False,False,False,False,False
4,15011ej,Satisfyingasfuck,/r/Satisfyingasfuck/comments/15011ej/cleaning_up_a_beach_by_extracting_small_plastics/,JulianThompson5,Cleaning up a beach by extracting small plastics from sand,13757,0.96,321,,1689392611.0,False,False,False,False,False
5,14zzv81,wholesomememes,/r/wholesomememes/comments/14zzv81/shout_out_to_ron_perlman/,Darkshreaders3,shout out to ron perlman,12132,0.98,98,,1689389106.0,False,False,False,False,False
6,1502o1z,shitposting,/r/shitposting/comments/1502o1z/death_praise_spez/,UltimateCumDispenser,Death :( Praise Spez,6674,0.97,80,,1689397655.0,False,False,False,False,False
7,14zxgwy,todayilearned,/r/todayilearned/comments/14zxgwy/til_in_2008_a_single_basketball_shot_may_have/,SonicSingularity,"TIL in 2008, a single basketball shot may have saved hundreds of lives. Alabama player Mykal Riley made a 3-point-shot that pushed the game into overtime minutes before an EF-2 Tornado passed by. If he had missed that shot, hundreds of fans could have been in the parking lot when the tornado hit.",20360,0.95,236,,1689382223.0,False,False,False,False,False
8,15038pg,Unexpected,/r/Unexpected/comments/15038pg/shit_got_serious/,Arudek,Shit got serious,4588,0.96,141,,1689399548.0,True,False,False,False,False
9,14zxv27,meirl,/r/meirl/comments/14zxv27/meirl/,Luck_Beats_Skill,Meirl,18416,0.93,707,,1689383315.0,False,False,False,False,False
10,14zzyee,news,/r/news/comments/14zzyee/an_alabama_woman_is_missing_after_stopping_to/,Repogirl27,"An Alabama woman is missing after stopping to help a toddler she saw walking on the interstate, police say",6916,0.96,939,,1689389368.0,False,False,False,False,False
11,15035zi,lotrmemes,/r/lotrmemes/comments/15035zi/what_could_have_been/,IntelligentPanice,What could have been...,4084,0.97,194,,1689399300.0,False,False,False,False,False
12,14zv5jx,nextfuckinglevel,/r/nextfuckinglevel/comments/14zv5jx/sabrina_ionescu_makes_history_by_scoring_37/,MidoriTea,Sabrina Ionescu makes history by scoring 37 points in the 3 point contest ,30580,0.92,1323,,1689376085.0,False,False,False,False,False
13,1500bog,memes,/r/memes/comments/1500bog/god_i_hate_people_with_stupid_usernames/,IcameInDadsCoffee,"God, i hate people with stupid usernames",11343,0.84,1315,,1689390414.0,False,False,False,False,False
14,1500zsr,Fauxmoi,/r/Fauxmoi/comments/1500zsr/sean_gunn_criticizes_disney_ceo_bob_iger/,jaffacakes077,Sean Gunn criticizes Disney CEO Bob Iger,5033,0.97,254,,1689392470.0,False,False,False,False,False
15,14zwroh,oddlysatisfying,/r/oddlysatisfying/comments/14zwroh/the_way_this_cat_descends_this_ladder/,amish_novelty,The way this cat descends this ladder,13484,0.97,138,,1689380282.0,False,False,False,False,False
16,14zygjd,LateStageCapitalism,/r/LateStageCapitalism/comments/14zygjd/we_wont_let_you_keep_it/,EldritchSlut,We won't let you keep it,7664,0.98,225,Commie Trash🚩,1689385010.0,False,False,False,False,False
17,14zuqqf,WhitePeopleTwitter,/r/WhitePeopleTwitter/comments/14zuqqf/ron_perlman_has_had_enough_knows_where_you_live/,zzill6,Ron Perlman Has Had Enough & Knows Where You Live,23836,0.94,1137,,1689375034.0,False,False,False,False,False
18,14zum7r,BeAmazed,/r/BeAmazed/comments/14zum7r/i_wanted_to_share_a_drawing_that_took_all_my/,tfoust10,I wanted to share a drawing that took all my brain power to create. This is one non-intersecting line,26379,0.94,580,,1689374715.0,False,False,False,False,False
19,14zthx2,MadeMeSmile,/r/MadeMeSmile/comments/14zthx2/dear_coach/,jeffers0n_steelflex,Dear coach…,48364,0.96,754,,1689371926.0,False,False,False,False,False
20,14zuf2z,mildlyinfuriating,/r/mildlyinfuriating/comments/14zuf2z/caught_a_complete_stranger_beginning_to_key_my/,Rilybear,Caught a complete stranger beginning to key my car while I was inside paying for gas.,26257,0.96,1158,,1689374202.0,False,False,False,False,False
21,1500jf5,BlackPeopleTwitter,/r/BlackPeopleTwitter/comments/1500jf5/we_should_probably_also_get_separate_water/,imjustheretodomyjob,"We should probably also get separate water fountains, and toilets....call it ""separate but equal"" smh",4487,0.96,121,☑️ Mod,1689391062.0,False,False,False,False,False
22,1503hss,diablo4,/r/diablo4/comments/1503hss/to_the_dismay_of_some_d4_devs_have_no_plans_to/,TheGoodDoctor17,"To the dismay of some, D4 devs have no plans to disable PvP from a zone dedicated for PVP.",2626,0.94,786,,1689400353.0,False,False,False,False,False
23,14zttfy,antiwork,/r/antiwork/comments/14zttfy/ron_perlman_the_absolute_fucking_legend/,Ok-Seaworthiness2235,"Ron Perlman, the absolute fucking legend",18171,0.95,778,,1689372696.0,False,False,False,False,False
24,14zy8ux,SipsTea,/r/SipsTea/comments/14zy8ux/i_am_learning_respectfully/,sandwichmclee,I am learning respectfully ,7784,0.91,418,,1689384396.0,False,False,False,False,False
25,1503v73,formuladank,/r/formuladank/comments/1503v73/the_curse_of_the_second_red_bull_seat/,ionutandreiciobotaru,The curse of the second Red Bull seat,2384,0.98,73, Nico Hüüüüüüüülkenberg,1689401548.0,False,False,False,False,False
26,14zzafw,rareinsults,/r/rareinsults/comments/14zzafw/wow_i_never_thought_of_it_like_that/,DimensionAfter7034,"Wow, I never thought of it like that...",5565,0.96,200,,1689387389.0,False,False,False,False,False
27,14zzklv,TikTokCringe,/r/TikTokCringe/comments/14zzklv/insecure_big_girl_rejects_nice_guy/,AlertBreath2887,Insecure big girl rejects nice guy,5182,0.86,1153,,1689388226.0,False,False,False,False,False
28,14zx5t6,marvelmemes,/r/marvelmemes/comments/14zx5t6/you_cant_do_that/,Historical-Prompt701,You can't do that,7858,0.96,185,Avengers,1689381367.0,False,False,False,False,False
29,1500ywn,PublicFreakout,/r/PublicFreakout/comments/1500ywn/unhinged_mother_threatens_school_after_getting/,NickfromLafayette92,Unhinged mother threatens school after getting barred from seeing her children,3506,0.94,857,,1689392400.0,False,False,False,False,False
30,14zwkn8,BrandNewSentence,/r/BrandNewSentence/comments/14zwkn8/had_to_read_this_a_few_times_i_still_dont_get_it/,gravelbee,Had to read this a few times & I still don't get it,8538,0.98,252,,1689379754.0,False,False,False,False,False
31,14zsgi9,nba,/r/nba/comments/14zsgi9/wnba_sabrina_ionescu_just_set_the_alltime_record/,Remdawg,[WNBA] Sabrina Ionescu just set the all-time record for NBA or WNBA with a score of 37 PTS in the FINAL ROUND of the 3PT Contest 🏆,17104,0.92,1569,Grizzlies,1689369472.0,False,False,False,False,False
32,1503shd,oddlyterrifying,/r/oddlyterrifying/comments/1503shd/shouldve_done_the_honors_means_honor_killing/,Canes-Venaticii,"""Should've done the honors"" means honor killing",2094,0.96,286,,1689401303.0,False,False,False,False,False
33,1505ct6,ContagiousLaughter,/r/ContagiousLaughter/comments/1505ct6/guy_sings_about_his_first_love/,kojo92,Guy sings about his first love,1480,0.97,49,,1689406409.0,False,False,False,False,False
34,1502lbm,HonkaiStarRail,/r/HonkaiStarRail/comments/1502lbm/so_which_side_are_you_on/,Mukimpo_baka,So which side are you on?,2323,0.95,331,,1689397409.0,False,False,False,False,False
35,1501ibb,AskReddit,/r/AskReddit/comments/1501ibb/what_worst_possible_reply_to_im_pregnant/,Suspicious_Device609,"What Worst possible reply to ""I'm pregnant""?",2761,0.9,3762,,1689394016.0,False,False,False,False,False
36,1504rvt,comics,/r/comics/comments/1504rvt/abduction_attire/,NonRock,Abduction attire,1555,0.99,14,Hot Paper Comics,1689404483.0,False,False,False,False,False
37,14zy1o8,whenthe,/r/whenthe/comments/14zy1o8/cat/,Ostrich_Eater,cat,5071,0.98,29,has not touched grass since 2017,1689383824.0,False,False,False,False,False
38,1502kt7,dankmemes,/r/dankmemes/comments/1502kt7/we_gotta_step_it_up/,ToeSniffer245,We gotta step it up,2260,0.98,39,,1689397365.0,False,False,False,False,False
39,1503kn4,shitposting,/r/shitposting/comments/1503kn4/heil_spez/,Designer-Yam-7170,Heil spez ,5049,0.96,28,Literally 1984 😡,1689400617.0,False,False,False,False,False
40,1504d9h,Genshin_Impact,/r/Genshin_Impact/comments/1504d9h/nilou_crocheted_by_me/,cjlacrochet,Nilou crocheted by me 💙💙🧡🧡,1591,0.99,85,,1689403209.0,False,False,False,False,False
41,14zyzm6,pcmasterrace,/r/pcmasterrace/comments/14zyzm6/maybe_the_worst_ghosting_ive_ever_seen/,veqe33,Maybe the worst ghosting I've ever seen.,4079,0.92,456,:steam: Ryzen 7 1700 | GTX 1080,1689386509.0,False,False,False,False,False
42,14zvtr3,therewasanattempt,/r/therewasanattempt/comments/14zvtr3/to_twerk/,edvsa,To twerk,10432,0.77,625,,1689377768.0,False,False,False,False,False
43,14zwf1t,maybemaybemaybe,/r/maybemaybemaybe/comments/14zwf1t/maybe_maybe_maybe/,Firm_Matter7435,Maybe maybe maybe,6346,0.89,517,,1689379336.0,False,False,False,False,False
44,14zz91z,doordash,/r/doordash/comments/14zz91z/been_giving_my_customers_semi_creepy_selfies_with/,prokiller9000,Been giving my customers semi creepy selfies with every order😂,3533,0.93,199,,1689387286.0,False,False,False,False,False
45,14zqgvu,gaming,/r/gaming/comments/14zqgvu/oh_the_horror/,NeoFury84,Oh the horror...,20569,0.95,1199,,1689364829.0,False,False,False,False,False
46,14zymnq,HolUp,/r/HolUp/comments/14zymnq/hop_in/,Excellent_Andrea,Hop in!,4027,0.97,33,,1689385494.0,False,False,False,False,False
47,14zw2jm,OldSchoolCool,/r/OldSchoolCool/comments/14zw2jm/newsradio_cast_photo_1995/,Djf47021,Newsradio Cast Photo 1995,5354,0.95,796,,1689378407.0,False,False,False,False,False
48,14zy259,CrazyFuckingVideos,/r/CrazyFuckingVideos/comments/14zy259/guy_gets_hit_in_the_face_for_saying_the_n_word/,Kelvin0420,Guy gets hit in the face for saying the N word,4342,0.89,725,,1689383862.0,True,False,False,False,False
49,14zsmen,tumblr,/r/tumblr/comments/14zsmen/all_aboard_the_barbenheimer_hypetrain/,TheDustOfMen,all aboard the barbenheimer hypetrain,11973,0.97,155,,1689369828.0,False,False,False,False,False
50,14zpkcj,worldnews,/r/worldnews/comments/14zpkcj/putin_wants_to_attend_an_august_summit_host/,ExactlySorta,Putin wants to attend an August summit. Host country South Africa doesn't want to have to arrest him,18919,0.95,1389,,1689362692.0,False,False,False,False,False
51,1504vmy,discordVideos,/r/discordVideos/comments/1504vmy/proof_why_china_3hr_per_week_screen_time_policy/,andrewens,proof why china 3hr per week screen time policy,1275,0.98,60,Have Commited Several War Crimes,1689404792.0,False,False,False,False,False
52,14zyiif,LeopardsAteMyFace,/r/LeopardsAteMyFace/comments/14zyiif/veterans_quit_desantis_florida_state_guard_over/,bettinafairchild,Veterans quit DeSantis’ Florida State Guard over militialike training,3389,0.97,207,,1689385167.0,False,False,False,False,False
53,150187b,Animemes,/r/Animemes/comments/150187b/the_real_mvp/,TakoFry,The Real MVP,2237,0.97,73,,1689393207.0,False,False,False,False,False
54,14zznt9,ImTheMainCharacter,/r/ImTheMainCharacter/comments/14zznt9/floyd_making_it_about_himself/,Hobbescrownest,Floyd making it about himself.,2755,0.93,190,,1689388480.0,False,False,False,False,False
55,14zw6k2,ExplainTheJoke,/r/ExplainTheJoke/comments/14zw6k2/ive_seen_black_and_latino_people_use_the_divider/,flossingjonah,"I've seen Black and Latino people use the divider too, why is this supposedly a ""White"" thing?",5011,0.92,346,,1689378707.0,False,False,False,False,False
56,14ztuu5,TerrifyingAsFuck,/r/TerrifyingAsFuck/comments/14ztuu5/google/,Low_Distance_673,Google ,7137,0.96,607,,1689372795.0,False,False,False,False,False
57,14zrv6b,ProgrammerHumor,/r/ProgrammerHumor/comments/14zrv6b/jaywassecond/,huxx__,jayWasSecond,9697,0.95,217,,1689368124.0,False,False,False,False,False
58,14zxugh,Hololive,/r/Hololive/comments/14zxugh/fauna_will_be_taking_some_time_off_from_streaming/,lightow,"Fauna will be taking some time off from streaming, ""to prepare for some things!""",3591,0.97,148,:Gura::Amelia::Inanis::Calliope::Kiara:,1689383267.0,False,False,False,False,False
59,14zzubz,shittytattoos,/r/shittytattoos/comments/14zzubz/the_artist_was_bragging_about_how_he_could_knock/,hellokylegoodbye,The artist was bragging about how he could knock out a full back piece in one sitting.,2506,0.96,327,,1689389026.0,False,False,False,False,False
60,14zzj34,NatureIsFuckingLit,/r/NatureIsFuckingLit/comments/14zzj34/layan_albatross_looks_for_a_lifelong_mate_to/,EmptySpaceForAHeart,"🔥 Layan Albatross looks for a lifelong mate to raise a family, but there's a twist.",2603,0.96,135,,1689388102.0,False,False,False,False,False
61,1503bdy,CasualUK,/r/CasualUK/comments/1503bdy/the_moon_rising_behind_dunstanburgh_castle/,dantheplutoid,"The moon rising behind Dunstanburgh Castle, Northumberland",1395,0.98,41,,1689399783.0,False,False,False,False,False
62,14zpjpf,politics,/r/politics/comments/14zpjpf/democratic_lawmaker_loses_his_cool_with_matt/,theindependentonline,Democratic lawmaker loses his cool with Matt Gaetz during House floor speech: ‘You are exhausting!’,12751,0.95,791,The Independent,1689362649.0,False,False,False,False,False
63,1504t2b,Gunners,/r/Gunners/comments/1504t2b/west_ham_official_account_on_twitter/,guro7,West Ham official account on Twitter!!!🤝🚨,1078,0.96,242,:14: Thierry Henry,1689404574.0,False,False,False,False,False
64,1502xkf,bangalore,/r/bangalore/comments/1502xkf/finally_drove_through_the_eiffel_tower/,SnoopyScone,Finally drove through the Eiffel tower,1466,0.98,95,,1689398504.0,False,False,False,False,False
65,1501h7m,zelda,/r/zelda/comments/1501h7m/botw_crying_my_eyeballs_out_pulled_out_the_sword/,Lonely-Blacksmith-17,[BOTW] Crying my eyeballs out. Pulled out the sword for ONE second…,1833,0.97,47,,1689393922.0,False,False,False,False,False
66,14zqs7y,WTF,/r/WTF/comments/14zqs7y/fella_getting_a_refreshing_drink/,urban-railing,Fella getting a refreshing drink,9846,0.94,755,,1689365573.0,True,False,False,False,False
67,14zsxi1,OneOrangeBraincell,/r/OneOrangeBraincell/comments/14zsxi1/is_mona_allowed_here_her_fur_is_only_partly/,flolibri,"Is Mona allowed here? Her fur is only partly orange, but I feel like; the orange spirit is strong with this one",7173,0.96,232,,1689370548.0,False,False,False,False,False
68,1500cqz,Whatcouldgowrong,/r/Whatcouldgowrong/comments/1500cqz/hand_feed_wild_bear/,BorisYeltsen,Hand feed wild bear.,2176,0.96,139,,1689390510.0,False,False,False,False,False
69,1501ld5,baseball,/r/baseball/comments/1501ld5/the_new_york_yankees_are_now_currently_in_last/,Rand_Boston90,The New York Yankees are now currently in Last Place in the AL East.,1725,0.96,279,Boston Red Sox :bos2:,1689394283.0,False,False,False,False,False
70,14zsha8,NonPoliticalTwitter,/r/NonPoliticalTwitter/comments/14zsha8/wow/,lhomme21,Wow,8024,0.95,405,:blue1::blue2::1111::1112:,1689369516.0,False,False,False,False,False
71,15000uc,assholedesign,/r/assholedesign/comments/15000uc/this_tiny_shit_text_reads_up_to/,Dead-Ninja,"This tiny shit text reads ""up to""",2231,0.98,71,,1689389570.0,False,False,False,False,False
72,1505frs,todayilearned,/r/todayilearned/comments/1505frs/til_keanu_reeves_has_never_won_an_oscar_golden/,ColeBelthazorTurner,"TIL Keanu Reeves has never won an Oscar, Golden Globe, or Emmy award of any kind. In fact, he has never even been nominated for an Oscar, Golden Globe, or Emmy.",2147,0.92,275,,1689406693.0,False,False,False,False,False
73,1502n3a,arknights,/r/arknights/comments/1502n3a/extra_heart_attack_27/,ghihin28,Extra!! Heart Attack 27!!!,1449,0.96,46,,1689397566.0,False,False,False,False,True
74,14zzd9g,funny,/r/funny/comments/14zzd9g/the_cash_cab_guy/,Scottiedoesntno,The Cash Cab Guy,2393,0.94,113,,1689387632.0,False,False,False,False,False
75,14zsljr,TrueOffMyChest,/r/TrueOffMyChest/comments/14zsljr/i_think_my_husband_cheated_on_my_with_his_sister/,pitamzadrugara,I think my husband cheated on my with his sister,7635,0.92,1816,,1689369770.0,True,1689418326.0,False,False,False
76,14zv9r8,unpopularopinion,/r/unpopularopinion/comments/14zv9r8/if_you_have_a_work_wife_or_work_husband_youre_an/,webosite,"If you have a “work wife” or “work husband”, you’re an awful person who needs to take a step back and reevaluate their own life",5956,0.73,1446,,1689376386.0,False,False,False,False,False
77,1500had,cats,/r/cats/comments/1500had/i_need_to_get_rid_of_my_coins_before_reddit_yeets/,LordCactopus,I need to get rid of my coins before Reddit yeets them - Comment a pic of your kitty and I’ll give them an award!,1967,0.99,695,,1689390894.0,False,False,False,False,False
78,14zwao2,IllegallySmolCats,/r/IllegallySmolCats/comments/14zwao2/new_manager_at_work/,PewPewAnimeGirl,new manager at work!,3695,0.97,35,Smol Criminal Warden,1689379025.0,False,False,False,False,False
79,1500jc7,funnyvideos,/r/funnyvideos/comments/1500jc7/this_kid_got_jedi_mind_tricks_up_his_sleeve/,DarthiusFatticus,This kid got Jedi mind tricks up his sleeve!,1953,0.97,20,,1689391054.0,False,False,False,False,False
80,14zohum,2meirl4meirl,/r/2meirl4meirl/comments/14zohum/2meirl4meirl/,Threecan,2meirl4meirl,25917,0.94,2330,,1689360181.0,False,False,False,False,False
81,14zvsk6,technology,/r/technology/comments/14zvsk6/families_of_buffalo_massacre_victims_sue_meta/,marketrent,"Families of Buffalo massacre victims sue Meta, Reddit, and Google over conspiracy theories",3856,0.93,215,,1689377693.0,False,False,False,False,False
82,1502h5k,animememes,/r/animememes/comments/1502h5k/cc_animememepage_on_instagram/,chivalrousfinale,Cc: anime.memepage on Instagram,1421,0.97,45,,1689397062.0,False,False,False,False,False
83,14zygdg,Damnthatsinteresting,/r/Damnthatsinteresting/comments/14zygdg/boiling_water_and_salt/,Aldo-1212,Boiling water and salt,7454,0.98,146,,1689384998.0,False,False,False,False,False
84,14zn5el,Tinder,/r/Tinder/comments/14zn5el/think_weed/,Land-a-hoeCalRizzian,Think weed,21688,0.96,436,,1689356973.0,False,False,False,False,False
85,1505aj3,LeagueOfMemes,/r/LeagueOfMemes/comments/1505aj3/by_popular_request_list_of_champions_chinese/,Akarthus,By Popular Request: List of Champion's Chinese Nickname,863,0.97,113,,1689406211.0,False,False,False,False,False
86,14zwf4c,popculturechat,/r/popculturechat/comments/14zwf4c/man_behind_viral_blueblack_dress_illusion_charged/,man_itsahot_one,Man behind viral blue-black dress illusion charged with trying to kill wife,3453,0.97,227,,1689379340.0,False,False,False,False,False
87,14zwx11,wallstreetbets,/r/wallstreetbets/comments/14zwx11/saw_this_and_thought_of_you_nvidia_bros_assume/,Mister_Lonely_,"Saw this and thought of you Nvidia bros, assume this was the DD? Wen beach party? ",3299,0.96,237,,1689380699.0,False,False,False,False,False
88,14zy8t8,mildlyinfuriating,/r/mildlyinfuriating/comments/14zy8t8/a_small_flag_in_the_background_of_a/,skippydinglechalk115,"a small flag in the background of a movie=propaganda, apparently.",8674,0.83,1179,,1689384391.0,False,False,False,False,False
89,14zwdyc,nbacirclejerk,/r/nbacirclejerk/comments/14zwdyc/moriah_back_from_the_allstar_break_with_an/,FireMattNagy1,Moriah back from the All-Star break with an All-Time Jerk,3418,0.95,234,,1689379269.0,False,False,False,False,False
90,1505rnc,ukraine,/r/ukraine/comments/1505rnc/south_korean_president_yoon_seokyeol_arrived_in/,UNITED24Media,South Korean President Yoon Seok-yeol arrived in Ukraine on an unannounced visit,768,0.99,27,:FlagUA: Ukraine Media,1689407815.0,False,False,False,False,False
91,1504vwe,Eyebleach,/r/Eyebleach/comments/1504vwe/bearcat/,fat_old_boy,Bear-cat,883,0.97,18,,1689404819.0,False,False,False,False,False
92,1503wc3,ClashOfClans,/r/ClashOfClans/comments/1503wc3/judo_sloths_acceptance_speech_for_mobile_content/,spencersaurous,Judo Sloth’s Acceptance Speech for Mobile Content Creator of the Year,1028,0.97,44,Clan Leader - Level 23,1689401653.0,False,False,False,False,False
93,14zwh08,Breath_of_the_Wild,/r/Breath_of_the_Wild/comments/14zwh08/playing_botw_for_the_first_time_and_just_met_this/,cosmothetoastghost,Playing BotW for the first time and just met this guy. He's their leader?? It's like if Doofenshmirtz was a Yiga,3343,0.95,249,:triforce:,1689379476.0,False,False,False,False,False
94,14zyxc3,WhitePeopleTwitter,/r/WhitePeopleTwitter/comments/14zyxc3/another_blue_tick_wanker/,Tara_is_a_Potato,Another blue tick wanker,6003,0.97,491,,1689386352.0,False,False,False,False,False
95,14zy16v,madlads,/r/madlads/comments/14zy16v/madlad_costume/,secretslut991,Madlad Costume,2641,0.98,29,,1689383781.0,False,False,False,False,False
96,14zvqy2,PeterExplainsTheJoke,/r/PeterExplainsTheJoke/comments/14zvqy2/peeeeter_whats_a_petj/,lumpylemonmilk,Peeeeter! What's a petj?,3831,0.86,368,,1689377575.0,False,False,False,False,False
97,1500li1,crochet,/r/crochet/comments/1500li1/couldnt_afford_a_gift_for_my_daughters_birthday/,Ok-Ad4375,Couldn't afford a gift for my daughters birthday so I made her a snake.,1696,0.95,59,"crocheting is my alibi, officer. ",1689391244.0,False,False,False,False,False
98,1501r6s,IndiaSpeaks,/r/IndiaSpeaks/comments/1501r6s/chandrayan_3_liftoff_captured_from_an_airplane/,gojjuavalaki,Chandrayan -3 Liftoff captured from an airplane ,1419,0.97,52,,1689394801.0,False,False,False,False,False
99,14zznft,197,/r/197/comments/14zznft/rule/,CT-4426,Rule,1982,0.97,27,,1689388452.0,False,False,False,False,False
100,14zycoi,fightporn,/r/fightporn/comments/14zycoi/woman_keeps_trying_to_taser_guy_whos_attempting/,Ipunishdogabusers,"woman keeps trying to taser guy who's attempting to break up 2 girls fighting . He warns her several times about tasering him, she ignores him and gets the Shoryuken!",2366,0.96,194,,1689384708.0,False,False,False,False,False
