rank,id,subreddit,permalink,author,title,score,upvote_ratio,num_comments,author_flair_text,created_utc,over_18,edited,stickied,locked,is_original_content
1,151mahg,Damnthatsinteresting,/r/Damnthatsinteresting/comments/151mahg/fake_luxury_shoe_store_prank_proves_luxury_is/,OneHundredForcer,Fake Luxury Shoe Store Prank proves Luxury is just Perception,24520,0.95,995,,1689553072.0,False,False,False,False,False
2,151j8z0,MadeMeSmile,/r/MadeMeSmile/comments/151j8z0/struggling_fan_meets_sean_astin_sam_gamgee_from/,TheKarmaFiend,Struggling fan meets Sean Astin (Sam Gamgee from Lord of the Rings),38488,0.96,956,,1689545448.0,False,False,False,False,False
3,151jtol,facepalm,/r/facepalm/comments/151jtol/he_felt_very_smart_for_27_minutes/,BoringPlumz,He felt very smart for 2.7 minutes.,23306,0.96,255,,1689546841.0,False,False,False,True,False
4,151o8x0,nextfuckinglevel,/r/nextfuckinglevel/comments/151o8x0/man_stays_dry_despite_all_odds/,The1Matthan,Man stays dry despite all odds,6471,0.98,127,,1689558376.0,False,False,False,False,False
5,151iixt,meirl,/r/meirl/comments/151iixt/meirl/,OreoSnorty69,Meirl,18319,0.98,205,,1689543686.0,False,False,False,False,False
6,151jqlr,politics,/r/politics/comments/151jqlr/chris_christie_says_trump_deserved_to_be_indicted/,Bluerecyclecan,Chris Christie says Trump deserved to be indicted and is misleading his supporters: 'He's a liar and a coward',9275,0.96,496,:flag-va: Virginia,1689546622.0,False,False,False,False,False
7,151i9h0,BeAmazed,/r/BeAmazed/comments/151i9h0/new_puppy_stopped_breathing_owner_bring_it_back/,watcher2390,"New Puppy stopped breathing, owner bring it back to life ",22942,0.89,1069,,1689543043.0,False,False,False,False,False
8,151m459,mildlyinfuriating,/r/mildlyinfuriating/comments/151m459/the_amount_of_pillows_on_my_sisters_couch/,Scherzoh,The amount of pillows on my sister's couch.,6100,0.97,1016,,1689552611.0,False,False,False,False,False
9,151mlno,OneOrangeBraincell,/r/OneOrangeBraincell/comments/151mlno/he_is_in_time_out_because_he_ate_a_whole_bowl_of/,GingaNinja1427,He is in time out because he ate a whole bowl of chicken fat,5424,0.97,245,,1689553878.0,False,False,False,False,False
10,151h0wf,clevercomebacks,/r/clevercomebacks/comments/151h0wf/straight_men_truly_couldnt_care_less_all/,Stoner4s3,Straight men truly couldn't care less all,27643,0.87,1259,,1689540193.0,False,False,False,False,False
11,151pblm,shitposting,/r/shitposting/comments/151pblm/glory_to_spez_our_lord_spez_is_removing_awards/,Jalal445,"Glory to spez, our lord spez is removing awards and i have a ton of reddit coins that are worthless now, up vote and comment and claim your award.",3551,0.94,2750,,1689561439.0,False,False,False,False,False
12,151kkeg,WhitePeopleTwitter,/r/WhitePeopleTwitter/comments/151kkeg/but_its_cold_in_the_winter/,Adelu1219,BuT iTS cOld iN thE WiNtER,7077,0.98,537,:verified:,1689548689.0,False,False,False,False,False
13,151g43p,todayilearned,/r/todayilearned/comments/151g43p/til_nbc_offered_a_role_to_james_gandolfini_to/,AlbinNboat,"TIL NBC offered a role to James Gandolfini to replace Michael Scott on ""The Office"", but HBO paid him $3 million to not take the role",17659,0.96,568,,1689538070.0,False,False,False,False,False
14,151n1o6,Satisfyingasfuck,/r/Satisfyingasfuck/comments/151n1o6/what_would_you_name_this_trick/,Puzzled_Glass_4405,What would you name this trick 🪀🤯,4614,0.96,692,,1689555084.0,False,False,False,False,False
15,151hpj4,BlackPeopleTwitter,/r/BlackPeopleTwitter/comments/151hpj4/pronoun_game_is_strong_when_you_have_something_to/,Kelmo7,Pronoun game is strong when you have something to hide,11067,0.94,295,☑️,1689541747.0,False,False,False,False,False
16,151ncdo,HumansBeingBros,/r/HumansBeingBros/comments/151ncdo/men_rescuing_sloth_bear_in_the_jungle/,lethal_bsp,Men rescuing sloth bear in the jungle,4165,0.94,169,,1689555861.0,False,False,False,False,False
17,151nozt,funny,/r/funny/comments/151nozt/scientific_justification_of_why_women_live_longer/,emma_roose,Scientific justification of why women live longer.,3812,0.95,97,,1689556819.0,False,False,False,False,False
18,151f7wo,oddlysatisfying,/r/oddlysatisfying/comments/151f7wo/this_gentlemans_sheep_shearing_technique/,Rollo_Tomasi3000,This gentleman’s sheep shearing technique,25106,0.91,1462,,1689535977.0,False,False,False,False,False
19,151jxtg,PublicFreakout,/r/PublicFreakout/comments/151jxtg/security_guard_peppers_crowd_over_slur/,PrimeMeathead,Security guard peppers crowd over slur,6427,0.95,883,,1689547125.0,False,False,False,False,False
20,151kzoy,ContagiousLaughter,/r/ContagiousLaughter/comments/151kzoy/he_replaced_her_soap_with_a_potato/,PutoFixe,He replaced her soap with a potato,5300,0.96,111,,1689549754.0,False,False,False,False,False
21,151i6rl,therewasanattempt,/r/therewasanattempt/comments/151i6rl/to_give_medication/,HornyDiggler,to give medication ,8758,0.95,923,Therewasanattemp,1689542862.0,False,False,False,False,False
22,151imfz,LifeProTips,/r/LifeProTips/comments/151imfz/lpt_dont_buy_a_hp_printer/,plexuses,LPT: Don't buy a HP Printer,6524,0.95,559,,1689543930.0,False,False,False,False,False
23,151i0fw,OldSchoolCool,/r/OldSchoolCool/comments/151i0fw/simon_garfunkel_sound_of_silence_1965/,No-Paramedic-8735,Simon & Garfunkel - Sound of Silence (1965),6823,0.96,378,,1689542445.0,False,False,False,False,False
24,151dot8,news,/r/news/comments/151dot8/tourists_flock_to_death_valley_to_experience/,ChocolateTsar,Tourists flock to Death Valley to experience possible world-record heat of 55C degrees,16689,0.95,3114,,1689532367.0,False,False,False,False,False
25,151l51c,blursedimages,/r/blursedimages/comments/151l51c/blursed_ceo/,FiddlerOfTheForest,Blursed CEO,4865,0.96,57,blursed snitch,1689550141.0,False,False,False,False,False
26,151o61g,ukraine,/r/ukraine/comments/151o61g/part_of_the_kerch_bridge_has_collapsed_near_the/,TheRealMykola,Part of the Kerch Bridge has collapsed near the 145th pillar.,2718,0.98,256,,1689558147.0,False,False,False,False,False
27,151il3q,lotrmemes,/r/lotrmemes/comments/151il3q/2690_years_is_no_barrier_for_true_love/,Dorf_On,"2,690 years is no barrier for true love",6525,0.95,101,,1689543838.0,False,False,False,False,False
28,151ffny,doordash,/r/doordash/comments/151ffny/wtf_is_my_driver_on/,Dleifnesor,WTF is my driver on,12490,0.96,461,,1689536480.0,False,False,False,False,False
29,151on3u,cursedcomments,/r/cursedcomments/comments/151on3u/cursed_conversation/,DOPENHElMER,Cursed conversation,2647,0.98,65,,1689559482.0,False,False,False,False,False
30,151m2ek,Showerthoughts,/r/Showerthoughts/comments/151m2ek/thanks_to_bluey_theres_a_entire_generation_of_non/,WretchedMotorcade,Thanks to Bluey there's a entire generation of non Aussie kids that will be using Aussie slang.,3522,0.94,535,,1689552480.0,False,False,False,False,False
31,151fidi,oddlyterrifying,/r/oddlyterrifying/comments/151fidi/vegetables_shaped_like_humans/,Blueberry_Conscious_,Vegetables shaped like humans,11045,0.95,248,,1689536662.0,False,False,False,False,False
32,151nlwf,WinStupidPrizes,/r/WinStupidPrizes/comments/151nlwf/ladys_car_rolls_away_after_getting_out_of_car_to/,Dunkableballs,Lady’s car rolls away after getting out of car to yell at employees,2721,0.96,291,,1689556573.0,False,False,False,False,False
33,151gdde,NonPoliticalTwitter,/r/NonPoliticalTwitter/comments/151gdde/phew/,lhomme21,Phew,8274,0.97,318,:blue1::blue2::1111::1112:,1689538662.0,False,False,False,False,False
34,151oony,gifs,/r/gifs/comments/151oony/studying_together/,KenMarshall8,Studying Together!,2228,0.95,22,,1689559597.0,False,False,False,False,False
35,151jxwu,maybemaybemaybe,/r/maybemaybemaybe/comments/151jxwu/maybe_maybe_maybe/,Firm_Matter7435,Maybe Maybe Maybe,4589,0.94,161,,1689547133.0,False,False,False,False,False
36,151g31m,CrazyFuckingVideos,/r/CrazyFuckingVideos/comments/151g31m/compilation_of_beirut_warehouse_explosion_from/,blkmgk533,Compilation of Beirut Warehouse Explosion From Virtually Every Source of Recording,7906,0.95,486,,1689537999.0,False,False,False,False,False
37,151gt55,technicallythetruth,/r/technicallythetruth/comments/151gt55/cant_be_diagnosed_if_you_dont_go_to_the_doctor/,Tri734,Can’t be diagnosed if you don’t go to the doctor,7813,0.95,154,,1689539693.0,False,False,False,False,False
38,151f00y,WorkReform,/r/WorkReform/comments/151f00y/we_need_a_nationwide_strike_for_all_industries/,ThatsMrPotatoHeadtoU,We need a nationwide strike for all industries,8439,0.95,121,,1689535459.0,False,False,False,False,False
39,151jydw,ProgrammerHumor,/r/ProgrammerHumor/comments/151jydw/aninfiniteloop/,huxx__,anInfiniteLoop,3980,0.97,43,,1689547166.0,False,False,False,False,False
40,151f4rb,worldnews,/r/worldnews/comments/151f4rb/zelenskyy_when_ukraines_air_defence_becomes/,Espressodimare,"Zelenskyy: When Ukraine's air defence becomes strong enough, we will protect the whole Europe",7984,0.9,594,,1689535781.0,False,False,False,False,False
41,151jp67,Angryupvote,/r/Angryupvote/comments/151jp67/god_damn_it/,ImportantSelfs,God damn it,4126,0.96,87,,1689546524.0,False,False,False,False,False
42,151juop,tumblr,/r/tumblr/comments/151juop/pay_attention_to_the_top_and_bottom_of_the_post/,angelholme,Pay attention to the top and bottom of the post,4092,0.96,43,,1689546913.0,False,False,False,False,False
43,151f8cx,anime_irl,/r/anime_irl/comments/151f8cx/anime_irl/,yokiyokin,anime_irl,8680,0.94,221,,1689536005.0,False,False,False,False,False
44,151nsi5,facepalm,/r/facepalm/comments/151nsi5/this_instagram_influencer_that_pretended_to_be_in/,mulix90,This instagram influencer that pretended to be in Emirates business class,5570,0.98,278,,1689557091.0,False,False,False,False,False
45,151k9jw,PoliticalHumor,/r/PoliticalHumor/comments/151k9jw/car_wash_on_avoiding_trump_grifters_and_groomers/,oxcart001,"Car wash on avoiding Trump grifters and groomers ---- ""No Vehicles with Trump stickers allowed""",3574,0.95,120,,1689547932.0,False,False,False,False,False
46,151kouz,Grimdank,/r/Grimdank/comments/151kouz/they_did_it_by_mixuen/,Amratat,They did it by Mixuen,3375,0.96,134,Secretly 3 squats in a long coat,1689549005.0,False,False,False,False,False
47,151a7nq,cats,/r/cats/comments/151a7nq/will_i_ever_be_able_to_eat_my_yogurt_alone_again/,alisongent,will i ever be able to eat my yogurt alone again???,32339,0.97,888,,1689524054.0,False,False,False,False,False
48,151oopt,Hololive,/r/Hololive/comments/151oopt/ina_is_melting_and_nearly_exploded_when_she_met/,lightow,Ina is melting and nearly exploded when she met up with Suisei,1838,0.98,46,:Gura::Amelia::Inanis::Calliope::Kiara:,1689559601.0,False,False,False,False,False
49,151g8bt,LateStageCapitalism,/r/LateStageCapitalism/comments/151g8bt/when_you_look_at_the_most_vulnerable_people_in/,irate-librarian,When you look at the most vulnerable people in our society and just see skin sacks for art practice.,5690,0.96,165,,1689538335.0,False,False,False,False,False
50,151dzbm,2meirl4meirl,/r/2meirl4meirl/comments/151dzbm/2meirl4meirl/,hornmelon,2meirl4meirl,8231,0.97,50,,1689533067.0,False,False,False,False,False
51,151dmxe,Unexpected,/r/Unexpected/comments/151dmxe/the_nerve_of_some_people/,izacktorres,The nerve of some people ,9530,0.96,159,,1689532252.0,False,False,False,False,False
52,151kgah,TrueOffMyChest,/r/TrueOffMyChest/comments/151kgah/failed_date_because_i_told_the_guy_he_should_get/,StariOnline,Failed date because I told the guy he should get a prostitute,3228,0.93,323,,1689548408.0,False,1689557744.0,False,False,False
53,151ix55,mildlyinfuriating,/r/mildlyinfuriating/comments/151ix55/just_some_entitled_stranger_in_the_bus/,Infamous-Adeptness43,Just some entitled stranger in the bus 🙄,20916,0.82,2039,,1689544663.0,False,False,False,True,False
54,151iin4,antiwork,/r/antiwork/comments/151iin4/is_it_insanely_stupid_of_me_to_not_give_a_fck/,broadcityx,Is it insanely stupid of me to not give a f*ck about my student loans?,3973,0.91,1610,,1689543667.0,False,False,False,False,False
55,151cyzm,PeterExplainsTheJoke,/r/PeterExplainsTheJoke/comments/151cyzm/i_dont_get_it/,Red_Neck_Slim_Jim,I don't get it,12019,0.95,151,,1689530668.0,False,False,False,False,False
56,151nca3,inthenews,/r/inthenews/comments/151nca3/chris_wallace_swiftly_pulls_brakes_on_rnc_chairs/,1000000students,"Chris Wallace Swiftly Pulls Brakes On RNC Chair's Biden Vacation Concerns - Trump played golf at his properties at least 289 times during his presidency to the tune of a “tab” that cost $151.5 million, according to a HuffPost analysis in December 2020.",1994,0.96,142,,1689555854.0,False,False,False,False,False
57,151l70h,HolUp,/r/HolUp/comments/151l70h/thanks_mike/,Fhoxyd22,Thanks Mike,2854,0.98,15,,1689550277.0,False,False,False,False,False
58,151ka0i,aww,/r/aww/comments/151ka0i/those_eyes/,OneHundredForcer,Those eyes 🤩,2873,0.92,49,,1689547962.0,False,False,False,False,False
59,151cork,AskReddit,/r/AskReddit/comments/151cork/what_is_one_thing_men_should_never_do_to_look/,siluoo,What is one thing men should never do to look attractive?,9619,0.9,5156,,1689530013.0,True,False,False,False,False
60,151fq0s,LeopardsAteMyFace,/r/LeopardsAteMyFace/comments/151fq0s/fox_news_host_confronts_trump_over_his_failed/,MasterfulBJJ,Fox News host confronts Trump over his failed campaign promises: ‘You didn’t drain the swamp like you said you would’,5044,0.97,213,,1689537163.0,False,False,False,False,False
61,151nnsl,fixedbytheduet,/r/fixedbytheduet/comments/151nnsl/when_you_get_your_advice_about_men_from_women/,dominic_l,When you get your advice about men from women,1775,0.96,38,,1689556724.0,False,False,False,False,False
62,151m458,comics,/r/comics/comments/151m458/veronica_mona_put_a_ring_on_it/,DoctorLoops,"Veronica & Mona: ""Put a Ring on it""",2210,0.91,34,,1689552611.0,True,False,False,False,True
63,151crzt,Spiderman,/r/Spiderman/comments/151crzt/the_fact_this_is_my_favorite_mcu_spider_man/,Technical-Peak3394,The fact this is my favorite MCU Spider Man poster and i never knew this....,9064,0.95,137,,1689530233.0,False,False,False,False,False
64,151a2si,TikTokCringe,/r/TikTokCringe/comments/151a2si/laundry_tips/,choganoga,Laundry tips,21741,0.86,2283,tHiS iSn’T cRiNgE,1689523713.0,False,False,False,False,False
65,151hc93,distressingmemes,/r/distressingmemes/comments/151hc93/one_of_the_worst_ways_to_die_allegedly/,Thick_Trouble_6206,"One of the worst ways to die, allegedly",4449,0.94,87,,1689540910.0,False,False,False,False,False
66,151fpqe,dankmemes,/r/dankmemes/comments/151fpqe/how_fast_can_you_run_son/,johnlen1n,"How fast can you run, son?",5742,0.96,40,,1689537145.0,False,False,False,False,False
67,151n99y,me_irlgbt,/r/me_irlgbt/comments/151n99y/me_irlgbt/,travischickencoop,me_irlgbt,1830,0.95,89,Polygender Polysexual Monogamous Creature of the Deep Ocean,1689555651.0,False,False,False,False,False
68,151ih65,WhitePeopleTwitter,/r/WhitePeopleTwitter/comments/151ih65/every_republican_voted_against_the_inflation/,Travismatthew08,‘Every Republican voted against the Inflation Reduction Act. That hasn’t stopped them from claiming credit. ‘,8686,0.99,108,,1689543575.0,False,False,False,False,False
69,151hyfw,WhatsWrongWithYourDog,/r/WhatsWrongWithYourDog/comments/151hyfw/draw_me_like_one_of_your_french_girls/,JunkyJunco,“Draw me like one of your French girls.”,3576,0.96,30,,1689542313.0,False,False,False,False,False
70,151cv1c,texas,/r/texas/comments/151cv1c/census_confirmed_latinos_now_the_majority_in_texas/,Lostlobster8,Census Confirmed. Latinos now the majority in Texas.,7008,0.94,917,,1689530430.0,False,False,False,False,False
71,151oc0x,UkraineWarVideoReport,/r/UkraineWarVideoReport/comments/151oc0x/kerch_bridge_traffic_stopped_due_to_collapse_of/,enthyy,Kerch Bridge traffic stopped due to collapse of the bridge,1505,0.98,222,,1689558633.0,False,False,False,False,False
72,151mf9g,nope,/r/nope/comments/151mf9g/just_me_or_is_this_a_big_nope/,SimlarMethod,"Just me, or is this a big nope?",1940,0.95,277,,1689553414.0,False,False,False,False,False
73,151kodo,terriblefacebookmemes,/r/terriblefacebookmemes/comments/151kodo/what_the_actual_hell/,thefakerealdrpepper,What the actual Hell,2463,0.96,265,,1689548972.0,False,False,False,False,False
74,151ir4c,movies,/r/movies/comments/151ir4c/guillermo_del_toros_frankenstein_producer_teases/,The_Odd_One27,Guillermo del Toro's Frankenstein Producer Teases a 'Deeply Emotional' Adaptation,3035,0.94,224,,1689544247.0,False,False,False,False,False
75,151cnuj,tennis,/r/tennis/comments/151cnuj/wimbledon_mens_singles_final_1_c_alcaraz_d_2_n/,chespiotta,"Wimbledon, Men's Singles- Final - [1] C. Alcaraz d. [2] N. Djokovic 1-6, 7-6(6), 6-1, 3-6, 6-4",6954,0.93,2641,FAA-Dimi-Hubi-Med-Ruud-Matteo-Thiem-Big 3-DelPo-Cabal/Farah,1689529951.0,False,False,True,False,False
76,151jcuj,whenthe,/r/whenthe/comments/151jcuj/im_too_funny/,myPPissmall47,im too funny,2896,0.97,58,I LOVE BOOBS! I LOVE BOOBS! I LOVE BOOBS! I LOVE BOOBS! I LOVE B,1689545709.0,False,False,False,False,False
77,151h7os,4chan,/r/4chan/comments/151h7os/bald_anon_wants_a_hot_gf/,ContentOpinionz,bald anon wants a hot gf,3582,0.95,220,,1689540622.0,False,False,False,False,False
78,151ck2o,wholesomememes,/r/wholesomememes/comments/151ck2o/for_once_reddits_ideas_benefit_the_community/,Brainjarmen104,For once reddits ideas benefit the community,7688,0.97,577,,1689529703.0,False,False,False,False,False
79,151dwgn,Damnthatsinteresting,/r/Damnthatsinteresting/comments/151dwgn/the_puss_caterpillar_southern_flannel_moth_will/,Totally-avg,The Puss Caterpillar (Southern Flannel Moth) will fuck your world up. I grazed it twice while climbing on a float. NBD at first but an hour later I was hyperventilating on the bedroom floor. The pain was excruciating. DH took me to the ER and morphine did nothing.,43576,0.94,2145,,1689532879.0,False,False,False,False,False
80,151iyfq,WitchesVsPatriarchy,/r/WitchesVsPatriarchy/comments/151iyfq/_/,rubbergloves44,🏳️‍🌈♥️,2840,0.95,26,,1689544751.0,False,False,False,False,False
81,151diex,technology,/r/technology/comments/151diex/finland_introduces_the_worlds_first_phonefree/,fchung,Finland introduces the world’s first phone-free tourist island,5912,0.91,232,,1689531948.0,False,False,False,False,False
82,151b4e7,memes,/r/memes/comments/151b4e7/new_yawk/,thepositivepandemic,New Yawk.,14061,0.98,78,OC Meme Maker,1689526284.0,False,False,False,False,False
83,151d591,DiWHY,/r/DiWHY/comments/151d591/flayer_of_thighs_cracker_of_nuts_cutter_of_toes/,balbertborring,"Flayer of Thighs, Cracker of Nuts, Cutter of Toes, Pincher of Butts",6190,0.94,210,,1689531078.0,False,False,False,False,False
84,151jrzx,DestinyTheGame,/r/DestinyTheGame/comments/151jrzx/do_not_buy_the_trials_sweater_on_the_bungie_store/,Lonecard19,DO NOT Buy the Trials Sweater on The Bungie Store.,2502,0.93,420,,1689546716.0,False,1689555534.0,False,False,False
85,151mms7,politics,/r/politics/comments/151mms7/can_we_please_make_presidential_elections_shorter/,Politics_Knower,"Can We Please Make Presidential Elections Shorter and Less Stupid? | There is no reason campaigns should run for a year and a half, and Congress actually has the power to end this political insanity.",3734,0.98,251,,1689553960.0,False,False,False,False,False
86,151clzx,NatureIsFuckingLit,/r/NatureIsFuckingLit/comments/151clzx/what_lurks_below_the_surface/,amish_novelty,🔥 What lurks below the surface,6648,0.96,220,,1689529830.0,False,False,False,False,False
87,151j5o2,nba,/r/nba/comments/151j5o2/steph_curry_with_the_clutch_eagle_on_the_last/,im____new____here,Steph Curry with the clutch eagle on the last hole for the win,2644,0.91,412,:bkn-1: Nets,1689545217.0,False,False,False,False,False
88,151hg8h,IASIP,/r/IASIP/comments/151hg8h/the_ending_of_the_gang_gets_cursed_saved_my_life/,y2k_angel,The ending of “The Gang Gets Cursed” saved my life by informing me about a health issue I didn’t know I had,3116,0.96,126,,1689541181.0,False,False,False,False,False
89,151muak,science,/r/science/comments/151muak/individuals_with_adhd_are_more_likely_to/,chrisdh79,"Individuals with ADHD are more likely to participate in politics, study finds",1563,0.95,174,,1689554515.0,False,False,False,False,False
90,151k9m4,HermanCainAward,/r/HermanCainAward/comments/151k9m4/get_well_soon_bill/,The_Patriot,"GET WELL SOON, BILL!",2167,0.96,187,A concerned redditor reached out to them about me,1689547936.0,False,False,False,False,False
91,15193so,space,/r/space/comments/15193so/analog_film_selfie_from_my_first_spacewalk_more/,astro_pettit,Analog film selfie from my first spacewalk. More details in comments.,10481,0.97,250,NASA Astronaut,1689521305.0,False,False,False,False,True
92,151dyae,Tinder,/r/Tinder/comments/151dyae/is_this_a_weird_way_to_meet_someone_for_the_first/,100problemss,Is this a weird way to meet someone for the first time?,5045,0.96,640,,1689532999.0,False,False,False,False,False
93,151p9w3,baseball,/r/baseball/comments/151p9w3/shohei_ohtani_hits_home_run_34_on_the_season_to/,Blazingbee98,Shohei Ohtani hits home run #34 on the season to bring the Angels within one in the bottom of the 9th!,1074,0.97,135,TEAM CHAOS :CHAOS-wagon:,1689561307.0,False,False,False,False,False
94,1518pvp,WTF,/r/WTF/comments/1518pvp/i_have_no_fucking_idea/,AnnihilationOrchid,I have no fucking idea..,12580,0.91,846,,1689520322.0,False,False,False,False,False
95,151i5ia,CuratedTumblr,/r/CuratedTumblr/comments/151i5ia/how_dare_you_infringe_on_my_right_to_be/,Silvermoon424,How dare you infringe on my right to be misogynistic and hateful to children!!,2875,0.9,335,,1689542772.0,False,False,False,False,False
96,151cnhb,sports,/r/sports/comments/151cnhb/carlos_alcaraz_defeats_novak_djokovic_in_five/,nolesfan2011,Carlos Alcaraz Defeats Novak Djokovic in Five Sets to Win Wimbledon,5665,0.95,386,:MLBnym: New York Mets,1689529926.0,False,False,False,False,False
97,151iry9,OneSecondBeforeDisast,/r/OneSecondBeforeDisast/comments/151iry9/best_dad/,Plastic_Ambition_759,Best dad,2649,0.97,75,,1689544302.0,False,False,False,False,False
98,151oewj,Catswithjobs,/r/Catswithjobs/comments/151oewj/hired_a_mover_and_he_is_taking_a_break_on_my_boxes/,lilsheeeep_,Hired a mover and he is taking a break on my boxes,1186,0.99,21,,1689558861.0,False,False,False,False,False
99,151gn8g,ContagiousLaughter,/r/ContagiousLaughter/comments/151gn8g/1_rep_for_20/,ValarMorcoolis,1 rep for $20,8472,0.95,170,,1689539307.0,False,False,False,False,False
100,151cz37,nextfuckinglevel,/r/nextfuckinglevel/comments/151cz37/carlos_alcatraz_winning_his_first_wimbledon_at_20/,stinky_sardine,Carlos Alcatraz winning his first Wimbledon at 20 years of age! ,29843,0.92,862,,1689530674.0,False,False,False,False,False
