rank,id,subreddit,permalink,author,title,score,upvote_ratio,num_comments,author_flair_text,created_utc,over_18,edited,stickied,locked,is_original_content
1,14i8s1q,Damnthatsinteresting,/r/Damnthatsinteresting/comments/14i8s1q/what_happens_when_you_throw_an_apple_from_an/,ledim35,What happens when you throw an apple from an offshore oil rig,32192,0.94,1101,,1687654922.0,False,False,False,False,False
2,14i9t97,ContagiousLaughter,/r/ContagiousLaughter/comments/14i9t97/its_on/,Cholai_214,It's on ,8580,0.95,319,,1687658016.0,False,False,False,False,False
3,14i7i01,MadeMeSmile,/r/MadeMeSmile/comments/14i7i01/helping_mommy/,IkilledRichieWhelan,Helping Mommy,22893,0.94,278,,1687651171.0,False,False,False,False,False
4,14i9cd2,gaming,/r/gaming/comments/14i9cd2/good_or_bad_games_it_doesnt_matter_i_have_massive/,Modo97,"Good or bad games? it doesn't matter, I have massive respect for games that still support Split-Screen ❤️",8477,0.94,388,,1687656612.0,False,False,False,False,False
5,14i83ko,mildlyinfuriating,/r/mildlyinfuriating/comments/14i83ko/roofers_picked_all_my_fruit/,Bayareathrifted,Roofers picked all my fruit,12885,0.95,1131,,1687652877.0,False,False,False,False,False
6,14i6935,oddlysatisfying,/r/oddlysatisfying/comments/14i6935/beautiful_4464ct_amethyst/,Gh0stDestr0y,Beautiful 44.64CT Amethyst,19235,0.96,272,Flair Loading...,1687647709.0,False,False,False,False,False
7,14i8cnl,wallstreetbets,/r/wallstreetbets/comments/14i8cnl/found_my_new_side_hustle/,rylar,found my new side hustle,8377,0.96,134,Supports a 🅱️arfield Ethnostate :Barfield:,1687653638.0,False,False,False,False,False
8,14i6eo3,quityourbullshit,/r/quityourbullshit/comments/14i6eo3/the_reddit_admins_believe_that_this_sub_is_for/,Devonmartino,"The Reddit admins believe that this sub is for them, not ordinary Redditors, and we are happy to oblige: From now on, all QYBS posts must be related to lies/BS about Reddit, Reddit Inc., its admins, and related topics.",14040,0.87,630,Source: I made it up,1687648142.0,False,1687648383.0,True,False,False
9,14i5e3x,meirl,/r/meirl/comments/14i5e3x/meirl/,420orsomething-,Meirl,17519,0.97,523,,1687645363.0,False,False,False,False,False
10,14ibzrf,PrequelMemes,/r/PrequelMemes/comments/14ibzrf/sucks_that_we_are_on_ewansposting_instead_of/,nickonreddit123,Sucks that we are on ewansposting instead of businesses as usual.,3900,0.96,45,,1687664862.0,False,False,False,False,False
11,14i7iu6,space,/r/space/comments/14i7iu6/i_grew_up_amazed_by_the_famous_pillars_of/,theillini19,I grew up amazed by the famous Pillars of Creation photo of the Hubble Space Telescope. I never imagined I would one day be able to capture this nebula from my backyard.,7881,0.97,129,,1687651234.0,False,False,False,False,False
12,14i3nun,todayilearned,/r/todayilearned/comments/14i3nun/til_michael_jacksons_billy_jean_was_a_real/,ultimateunbannable,"TIL Michael Jackson's ""Billy Jean"" was a real stalker who sent Jackson multiple letters claiming he was the father of one of her twins, culminating in sending him a handgun and an invitation to a murder-suicide. It was also based on multiple women who harassed his brothers while in the Jackson 5.",27191,0.94,685,,1687640847.0,True,False,False,False,False
13,14i45th,PublicFreakout,/r/PublicFreakout/comments/14i45th/unhinged_woman_feels_harassed/,lplarryp,Unhinged woman feels harassed ,17076,0.95,2120,,1687642119.0,False,False,False,True,False
14,14i6wnc,OldSchoolCool,/r/OldSchoolCool/comments/14i6wnc/one_of_my_friend_groups_from_high_school_class_of/,dustin91,"One of my friend groups from high school, class of ‘87 (pic from ‘88 or ‘89)",7487,0.95,517,,1687649487.0,False,False,False,False,False
15,14i28oi,JustGuysBeingDudes,/r/JustGuysBeingDudes/comments/14i28oi/saving_an_owl/,pun420,Saving an Owl,28244,0.96,458,,1687637172.0,False,False,False,False,False
16,14i2pwb,funny,/r/funny/comments/14i2pwb/these_kids_have_got_vibe/,DevilCanyon,These kids have got vibe.,24616,0.87,631,,1687638421.0,False,False,False,False,False
17,14i5m85,therewasanattempt,/r/therewasanattempt/comments/14i5m85/to_pet_a_snapping_turtle/,VariousBasket125,To pet a snapping turtle ,9197,0.96,725,This is a flair,1687645963.0,False,False,False,False,False
18,14i8ag8,TedLasso,/r/TedLasso/comments/14i8ag8/id_like_to_think_all_of_our_lives_changed_after/,fn_bot17,I’d like to think all of our lives changed after Ted Lasso,5031,0.93,222,,1687653444.0,False,False,False,False,False
19,14i2csj,facepalm,/r/facepalm/comments/14i2csj/theres_no_way_it_could_get_any_worseright/,Flaky-Air-9219,There's no way it could get any worse...right?,24916,0.96,659,,1687637474.0,False,False,False,False,False
20,14iavsq,baseball,/r/baseball/comments/14iavsq/david_fletcher_hr_makes_it_230_angels_in_the_4th/,TVloverCam,DAVID FLETCHER HR MAKES IT 23-0 ANGELS IN THE 4TH!!,3116,0.97,375,Los Angeles Angels :laa1:,1687661313.0,False,False,False,False,False
21,14i9900,news,/r/news/comments/14i9900/mexico_city_holds_mass_celebration_for_samesex/,AgileNetwork7,"Mexico City holds mass celebration for same-sex weddings, gender ID changes",4110,0.92,57,,1687656332.0,False,False,False,False,False
22,14iasvz,RandomThoughts,/r/RandomThoughts/comments/14iasvz/do_u_ever_feel_kinda_compelled_to_write_ur/,chesnutpraline,do u ever feel kinda compelled to write ur opinion in a comment but then get kinda tired while writing it and give up after deciding u dont really care enough in the moment to comment and erase it?,3185,0.95,547,,1687661058.0,False,False,False,False,False
23,14i8oc3,Damnthatsinteresting,/r/Damnthatsinteresting/comments/14i8oc3/video_footage_from_a_previous_titan_journey/,BlueMagma212,Video footage from a previous Titan journey ,20168,0.94,1085,,1687654629.0,False,False,False,False,False
24,14i2fwd,antiwork,/r/antiwork/comments/14i2fwd/this_should_be_posted_in_every_workplace/,jatnj,This should be posted in every workplace,15012,0.96,244,,1687637701.0,False,False,False,False,False
25,14i3h6l,HolUp,/r/HolUp/comments/14i3h6l/no_one_has_gotten_as_far_as_he_did/,Cr33p3rFri3nd,No one has gotten as far as he did,16911,0.95,220,,1687640407.0,False,False,False,False,False
26,14i2tqd,BrandNewSentence,/r/BrandNewSentence/comments/14i2tqd/if_you_whacked_me_with_a_ford_explorer/,Fr3nchT0astCrunch,If you whacked me with a Ford Explorer,15512,0.97,189,,1687638703.0,False,False,False,False,False
27,14i61nh,tumblr,/r/tumblr/comments/14i61nh/whats_your_fave/,Justthisdudeyaknow,What's your fave?,7586,0.93,236,,1687647142.0,False,False,False,False,False
28,14i5twb,HydroHomies,/r/HydroHomies/comments/14i5twb/not_a_hydrohomie/,happyfuckincakeday,Not a Hydrohomie,7288,0.96,478,,1687646544.0,False,False,False,False,False
29,14i1kuy,WhitePeopleTwitter,/r/WhitePeopleTwitter/comments/14i1kuy/nepo_baby_on_nepo_baby_violence_is_tearing_this/,thatguy9684736255,Nepo baby on Nepo baby violence is tearing this country apart,18750,0.95,443,,1687635494.0,False,False,False,False,False
30,14i994d,ukraine,/r/ukraine/comments/14i994d/least_year_russian_occupiers_kidnapped_16yo/,ibloodylovecider,"Least year, russian occupiers kidnapped 16yo Tigran Oganesyan and his friend. Today, they took revenge, two Russians occupiers in the Russian-occupied city of Berdyanskwete killed. This video was recorded before the teens were killed in a shoot-out with the police. RIP heroes that were too young 🌻",3767,0.96,118,UK,1687656341.0,True,False,False,False,False
31,14i6i11,conservativeterrorism,/r/conservativeterrorism/comments/14i6i11/the_enemy_within_as_this_anti_american_gorilla_is/,waxjammer,The enemy within as this Anti American gorilla is essentially undermining our intelligence and CIA with reckless disregard for our national security interests.,5809,0.93,470,,1687648397.0,False,False,False,False,False
32,14i0xk8,pics,/r/pics/comments/14i0xk8/john_olivers_guide_to_a_more_effective_form_of/,WolfgangVolos,John Oliver's Guide To A More Effective Form of Protest,32283,0.88,1019,,1687633821.0,False,False,False,False,False
33,14i45bv,TikTokCringe,/r/TikTokCringe/comments/14i45bv/actual_footage_of_redditors_today/,Chocolat3City,Actual footage of redditors today!,8831,0.95,129,tHiS iSn’T cRiNgE,1687642081.0,False,False,False,False,False
34,14i6y0l,AnarchyChess,/r/AnarchyChess/comments/14i6y0l/no_idea_how_this_is_still_happening_but_id_this/,Not_a_trowaway12323,"No idea how this is still happening, but I'd this post gets 65,536 comments I'll post again with double the amount of demented horses",6127,0.83,7240,:cutehorse:,1687649589.0,False,False,False,False,False
35,14i29hu,lotrmemes,/r/lotrmemes/comments/14i29hu/cause_fck_them_old_people/,Alternative_Serve368,'Cause f*ck them old people ,13053,0.96,52,,1687637231.0,False,False,False,False,False
36,14i2la7,Animemes,/r/Animemes/comments/14i2la7/he_forgor/,IDontKnowANam3,He forgor,15154,0.94,372,,1687638078.0,False,False,False,False,False
37,14i7wmg,shitposting,/r/shitposting/comments/14i7wmg/praise_spez_the_fishing_king/,FourBloodMoons,Praise Spez the fishing king,4741,0.98,33,,1687652313.0,False,False,False,False,False
38,14i6aee,LateStageCapitalism,/r/LateStageCapitalism/comments/14i6aee/this_is_how_you_do_it/,futurefemboy3,This is how you do it,5309,0.96,160,,1687647803.0,False,False,False,False,False
39,14i06vl,politics,/r/politics/comments/14i06vl/ron_desantis_campaign_close_to_being_overexgop/,Miguenzo,Ron DeSantis campaign 'close to being over'—Ex-GOP governor,23470,0.92,2033,,1687631907.0,False,False,False,False,False
40,14i3y42,MurderedByWords,/r/MurderedByWords/comments/14i3y42/very_accurate_description/,cyaron12,very accurate description,8138,0.95,129,,1687641568.0,False,False,False,False,False
41,14i12vs,diablo4,/r/diablo4/comments/14i12vs/so_i_started_a_queue_and_random_people_just_joined/,doislan,So I started a queue and random people just joined,14297,0.94,457,,1687634198.0,False,False,False,False,False
42,14i3usr,worldnews,/r/worldnews/comments/14i3usr/billions_of_roubles_prigozhin_claims_russian/,SaintBiggusDickus,Billions of roubles: Prigozhin claims Russian forces have found a van and 2 buses containing boxes of his money,7190,0.97,571,,1687641338.0,False,False,False,False,False
43,14i8bkk,blackcats,/r/blackcats/comments/14i8bkk/are_you_serious_right_now/,LimiXStill,“Are you serious right now”,3533,0.95,90,,1687653543.0,False,False,False,False,False
44,14i7ycb,AmItheAsshole,/r/AmItheAsshole/comments/14i7ycb/aita_for_being_pissed_there_was_no_alcohol_at_a/,NoAlcWedding12345,AITA for being pissed there was no Alcohol at a wedding,3993,0.83,2946,,1687652446.0,False,False,False,False,False
45,14iawpv,oddlyterrifying,/r/oddlyterrifying/comments/14iawpv/pet_king_cobra_gets_angry_at_owner/,RIPStengel,Pet king cobra gets angry at owner.,2318,0.98,156,,1687661397.0,False,False,False,False,False
46,14i57pg,OneOrangeBraincell,/r/OneOrangeBraincell/comments/14i57pg/arthur_refused_to_leave_him_until_his_friend/,FloofySamoyed,Arthur refused to leave him until his friend crossed. He used the brain cell for good. ♥️,5643,0.97,82,,1687644888.0,False,False,False,False,False
47,14i6k1y,Eyebleach,/r/Eyebleach/comments/14i6k1y/scribble_is_getting_so_big/,Starchscreech,Scribble is getting so big!,4386,0.97,62,,1687648552.0,False,False,False,False,False
48,14i5ro7,nextfuckinglevel,/r/nextfuckinglevel/comments/14i5ro7/a_protagonistlevel_shot/,TheDancingDoge,A Protagonist-Level Shot,5320,0.98,141,,1687646374.0,False,False,False,False,False
49,14ic6sh,HumansBeingBros,/r/HumansBeingBros/comments/14ic6sh/a_spooked_horse_found_itself_stuck_in_a_swimming/,alanboston,A spooked horse found itself stuck in a swimming pool in Florida. The county's fire rescue team jumped into action,1751,0.94,83,,1687665508.0,False,False,False,False,False
50,14iaqhi,Genshin_Impact,/r/Genshin_Impact/comments/14iaqhi/the_perfect_transition_of_71_characters_by/,soulsilk524,The Perfect Transition of 71 Characters by MMOJACKX57 YT,2273,0.96,60,,1687660857.0,False,False,False,False,False
51,14i2s6x,2westerneurope4u,/r/2westerneurope4u/comments/14i2s6x/that_is_the_most_underwhelming_end_of_a_civil_war/,FreakShowRed7,That is the most underwhelming end of a civil war I have ever seen. 0/10.,7958,0.96,273,:European: European,1687638592.0,False,False,False,False,False
52,14i6rrc,terriblefacebookmemes,/r/terriblefacebookmemes/comments/14i6rrc/this_was_in_another_group/,Dinoman0101,This was in another group,4354,0.91,228,,1687649131.0,False,False,False,False,False
53,14i1lex,woahdude,/r/woahdude/comments/14i1lex/this_turtle_is_just_chilling_and_making_bubbles/,fabioke,This turtle is just chilling and making bubbles,9478,0.96,231,,1687635538.0,False,False,False,False,False
54,14i90a1,nursing,/r/nursing/comments/14i90a1/anyone_hiring/,Frosty-Fact21,Anyone hiring?,2811,0.95,183,"BSN, RN 🍕",1687655629.0,False,False,False,False,False
55,14i7zds,MadeMeSmile,/r/MadeMeSmile/comments/14i7zds/had_one_of_the_most_untraditional_weddings_we_can/,SheepDog91,"Had one of the most untraditional weddings we can think of, and we couldn't be happier. ,(OC)",10291,0.92,791,,1687652526.0,False,False,False,False,False
56,14i32qg,WinStupidPrizes,/r/WinStupidPrizes/comments/14i32qg/cyclist_brake_checks_a_bus/,DevilCanyon,Cyclist brake checks a bus,7638,0.93,420,,1687639357.0,False,False,False,False,False
57,14ib9x3,comics,/r/comics/comments/14ib9x3/napsoc/,Sleepy-wun,Naps…[OC],1949,0.97,26,,1687662542.0,False,False,False,False,False
58,14i8c6t,agedlikemilk,/r/agedlikemilk/comments/14i8c6t/only_one_way_to_defend_against_milk_attack/,EmperorTacitus,Only one way to defend against milk attack.,3105,0.93,85,,1687653603.0,False,False,False,False,False
59,14i63hl,discordVideos,/r/discordVideos/comments/14i63hl/i_cant_listen_to_this_without_getting_emotional/,HallowLaser84,I cant listen to this without getting emotional,4796,0.96,117,,1687647293.0,False,False,False,False,False
60,14i95b5,MovieDetails,/r/MovieDetails/comments/14i95b5/incredibles_2004_a_character_named_oliver/,lirecela,"Incredibles (2004): A character named Oliver Sansweet attempts suicide. In French, ""sans suite"" means nothing after, or without a future.",2595,0.95,46,,1687656034.0,False,False,False,False,False
61,14i2lwa,videos,/r/videos/comments/14i2lwa/fucking_rick_astley_absolutely_killing_it_at/,Johannes_Keppler,Fucking Rick Astley absolutely killing it at fucking Glastonbury today with the 36 year old song we all know by fucking heart!,8186,0.85,525,,1687638124.0,False,False,False,False,False
62,14i9iqp,inthenews,/r/inthenews/comments/14i9iqp/rfk_jr_lashes_out_at_rolling_stone_after_article/,lucerousb,RFK Jr. Lashes Out at Rolling Stone After Article Shows GOP Link to Presidential Run: ‘Establishment Propaganda’,2380,0.94,319,,1687657142.0,False,False,False,False,False
63,14hxvwa,wholesomememes,/r/wholesomememes/comments/14hxvwa/safer_with_family/,AccordingBiga,Safer with Family,34240,0.94,237,,1687625992.0,False,False,False,False,False
64,14i414x,WhatsWrongWithYourCat,/r/WhatsWrongWithYourCat/comments/14i414x/my_cat_is_possessed_by_some_demon/,too_rxcklxss,My cat is possessed by some demon,5584,0.97,174,,1687641768.0,False,False,False,False,False
65,14i6rcs,animememes,/r/animememes/comments/14i6rcs/unwanted_rizz/,Con___artist,Unwanted rizz,3874,0.94,52,,1687649104.0,False,False,False,False,False
66,14i0pkb,CrazyFuckingVideos,/r/CrazyFuckingVideos/comments/14i0pkb/wagner_soldiers_purchasing_some_vodka_before/,doughb0ii,Wagner soldiers purchasing some vodka before their final push onto Moscow,10212,0.95,362,,1687633262.0,False,False,False,False,False
67,14i1rfx,aww,/r/aww/comments/14i1rfx/john_oliver_makes_an_awwdorable_muppet/,QuicklyThisWay,John Oliver makes an awwdorable muppet,9264,0.79,233,,1687635964.0,False,False,False,False,False
68,14i3hb1,nba,/r/nba/comments/14i3hb1/first_look_at_wembanyama_shooting_around_in_a/,pcwgussej,First look at Wembanyama shooting around in a Spurs uniform (via @TheoQuintard),5670,0.96,1040,,1687640415.0,False,False,False,False,False
69,14id7jw,Superstonk,/r/Superstonk/comments/14id7jw/why_i_love_this_company/,GinoF2020,Why I love this company,1419,0.97,34,,1687668859.0,False,False,False,False,False
70,14i7q97,whenthe,/r/whenthe/comments/14i7q97/title/,thepositivepandemic,title,3175,0.98,133,[deleted],1687651815.0,False,False,False,False,False
71,14i4p2t,popculturechat,/r/popculturechat/comments/14i4p2t/rina_sawayama_calls_out_matty_healy_on_stage_at/,storminthedark,Rina Sawayama calls out Matty Healy on stage at Glastonbury for being racist and owning her masters,4550,0.9,375,,1687643514.0,False,False,False,False,False
72,14hyvom,memes,/r/memes/comments/14hyvom/first_medieval_world_problems/,Erosiiion,First (medieval) world problems,24774,0.95,138,,1687628513.0,False,False,False,False,False
73,14i0p7x,cats,/r/cats/comments/14i0p7x/people_say_i_pet_her_too_strong_but_she_looks/,necroubikon,"People say I pet her too strong, but she looks preased. Your thoughts? ",9357,0.95,1242,,1687633240.0,False,False,False,False,False
74,14i7l0v,StupidFood,/r/StupidFood/comments/14i7l0v/for_the_pasta_lovers/,BlessDisMess,For the pasta lovers 🇮🇹,2840,0.92,562,,1687651379.0,False,False,False,False,False
75,14i6w4a,lgbt,/r/lgbt/comments/14i6w4a/i_got_engayged_to_my_boyfriend_at_baltimore_pride/,whitmanpatroclus,"I got enGAYged to my boyfriend at Baltimore pride!!! I’m lucky I’m gay, it means I get to spend the rest of my life with him",3151,0.92,117,:Gay_Man_5_stripe: Havin' A Gay Time!,1687649449.0,False,False,False,False,False
76,14i9aey,WTF,/r/WTF/comments/14i9aey/uhh_wtf_is_this/,Full_Guava_4780,Uhh wtf is this,2126,0.95,452,,1687656444.0,False,False,False,False,False
77,14i5521,PeterExplainsTheJoke,/r/PeterExplainsTheJoke/comments/14i5521/i_dont_know_peter/,Locomotive_Nausea,I don’t know Peter,4187,0.95,118,,1687644687.0,False,False,False,False,False
78,14hy218,dankmemes,/r/dankmemes/comments/14hy218/least_destructive_prank/,thepositivepandemic,Least destructive prank.,27235,0.95,411,,1687626394.0,False,False,False,False,False
79,14ibyo6,TaylorSwift,/r/TaylorSwift/comments/14ibyo6/taylor_urged_fans_during_tonights_acoustic_set/,baeeeee91,"Taylor urged fans during tonight’s acoustic set, not to bully anyone online ahead of Speak Now’s release.",1335,0.96,339,":midnights: Ask me why so many fade, but I’m still here",1687664768.0,False,False,False,False,False
80,14i57ez,TwoSentenceHorror,/r/TwoSentenceHorror/comments/14i57ez/i_had_always_dreamed_of_traveling_the_world_with/,SRH_64,"I had always dreamed of traveling the world with my boyfriend, meeting new people every day.",3924,0.95,49,,1687644863.0,False,False,False,False,False
81,14i8ya4,anime_irl,/r/anime_irl/comments/14i8ya4/anime_irl/,Not_So_UwU,anime_irl,2148,0.98,38,,1687655454.0,False,False,False,False,False
82,14i5xs4,fightporn,/r/fightporn/comments/14i5xs4/country_boys_go_at_it_0/,studiousbeanr,Country boys go at it :0,3354,0.93,353,,1687646845.0,False,False,False,False,False
83,14i6ikh,mildlyinfuriating,/r/mildlyinfuriating/comments/14i6ikh/applied_to_a_job_on_upwork_and_this_was_their/,jchao745,Applied to a job on Upwork and this was their reply,8591,0.97,403,,1687648442.0,False,False,False,False,False
84,14iatn6,HyruleEngineering,/r/HyruleEngineering/comments/14iatn6/thatll_be_250k_please/,itsbildo,That'll be $250k please,1569,0.96,63,,1687661122.0,False,False,False,False,False
85,14i6oaw,LeopardsAteMyFace,/r/LeopardsAteMyFace/comments/14i6oaw/conservative_black_labor_union_supporter/,reddits_lead_pervert,"Conservative Black Labor Union supporter complains that ""anti-woke"" politicians that he would normally support only offer ""anti-woke"" ideas and nothing else useful as a platform",2912,0.98,118,,1687648872.0,False,False,False,False,False
86,14i9dl9,ProgrammerHumor,/r/ProgrammerHumor/comments/14i9dl9/theword/,shaongit,theWord,1941,0.98,12,,1687656704.0,False,False,False,False,False
87,14hynx4,BeAmazed,/r/BeAmazed/comments/14hynx4/uncovering_the_insane_world_of_the_largest/,girlycharms,Uncovering the insane World of the largest Underground Chamber on Earth,11602,0.96,295,,1687627977.0,False,False,False,False,False
88,14i8lzl,AITAH,/r/AITAH/comments/14i8lzl/aitah_for_not_telling_my_wife_i_got_a_vasectomy/,Power-H,AITAH for not telling my wife I got a vasectomy?,2136,0.94,920,,1687654426.0,False,False,False,False,False
89,14hy5wp,SelfAwarewolves,/r/SelfAwarewolves/comments/14hy5wp/its_always_about_sex_with_you_liberals/,C-n0te,It's always about sex with you Liberals.,11045,0.92,291,,1687626669.0,False,False,False,False,False
90,14i0dsc,Breath_of_the_Wild,/r/Breath_of_the_Wild/comments/14i0dsc/seriously_dude_i_just_wanted_a_nice_pic_of_the/,cosmothetoastghost,Seriously dude? I just wanted a nice pic of the sunset,7130,0.96,103,:triforce:,1687632407.0,False,False,False,False,False
91,14iaat3,rareinsults,/r/rareinsults/comments/14iaat3/panini_head_please_dont_be_a_repost/,longestIndent740,Panini head (please don’t be a repost),1527,0.96,17,,1687659505.0,False,False,False,False,False
92,14i9o6c,shittyfoodporn,/r/shittyfoodporn/comments/14i9o6c/pick_your_poison/,Ok-Software5073,Pick your poison,1672,0.91,761,,1687657592.0,False,False,False,False,False
93,14i828a,ATBGE,/r/ATBGE/comments/14i828a/saw_this_and_thought_you_guys_would_appreciate_it/,RandomFPVPilot,Saw this and thought you guys would appreciate it,2152,0.94,78,,1687652764.0,False,False,False,False,False
94,14i3e0w,Eldenring,/r/Eldenring/comments/14i3e0w/behold_mortal_as_i_walk_three_steps_to_the_right/,The-Jack-Niles,"Behold, mortal, as I walk three steps to the right!",4414,0.99,158,FLAIR INFO: SEE SIDEBAR,1687640173.0,False,False,False,False,False
95,14hw0d7,NatureIsFuckingLit,/r/NatureIsFuckingLit/comments/14hw0d7/mama_bear_relaxing_with_her_cub_on_her_tummy/,amish_novelty,🔥 Mama bear relaxing with her cub on her tummy,19098,0.96,247,,1687621085.0,False,False,False,False,False
96,14i414b,Catswithjobs,/r/Catswithjobs/comments/14i414b/very_affordable_therapy/,Obvious-Band-1149,Very affordable therapy!,3755,0.97,54,,1687641767.0,False,False,False,False,False
97,14hwzhe,CasualUK,/r/CasualUK/comments/14hwzhe/local_house_had_a_make_over_does_anybody_here/,Knillish,"Local house had a ""make over"". Does anybody here actually prefer the outcome over the original? Poor house 😞",15092,0.93,2651,,1687623598.0,False,False,False,False,False
98,14i140m,formuladank,/r/formuladank/comments/14i140m/true_legend/,matchbaby,True Legend,6042,0.95,74,BWOAHHHHHHH ,1687634287.0,False,False,False,False,False
99,14i30t9,sports,/r/sports/comments/14i30t9/shotput_competitor_jolien_maliga_boumkwo_bel_took/,ednorog,"Shot-put competitor Jolien Maliga Boumkwo (BEL) took part in the 100m hurdles run at the European Games. She ended about 20 seconds behind winner, but still won points for her team.",4206,0.95,221,,1687639227.0,False,False,False,False,False
100,14i98px,wholesome,/r/wholesome/comments/14i98px/what_doin_baby/,GainRepulsive977,What doin’ baby?,1717,0.97,34,,1687656311.0,False,False,False,False,False
