rank,id,subreddit,permalink,author,title,score,upvote_ratio,num_comments,author_flair_text,created_utc,over_18,edited,stickied,locked,is_original_content
1,14wfbk8,Damnthatsinteresting,/r/Damnthatsinteresting/comments/14wfbk8/hope_our_bridge_survives_the_night_alstead_nh/,Keeptryan_,Hope our bridge survives the night - Alstead N.H. ,10505,0.97,445,,1689045598.0,False,False,False,False,False
2,14waqxs,WhitePeopleTwitter,/r/WhitePeopleTwitter/comments/14waqxs/concerning/,Naive_Cartographer71,Concerning! 😂,31757,0.95,642,,1689033417.0,False,False,False,False,False
3,14wce75,MadeMeSmile,/r/MadeMeSmile/comments/14wce75/the_best_day_ever/,King_Pee,The best day ever,17927,0.97,297,,1689037677.0,False,False,False,False,False
4,14wavra,politics,/r/politics/comments/14wavra/whistleblower_who_accused_bidens_of_corruption_is/,poop_scallions,‘Whistleblower’ who accused Bidens of corruption is charged with arms trafficking and violating Iran sanctions,19920,0.96,907,,1689033742.0,False,False,False,False,False
5,14wdcs1,facepalm,/r/facepalm/comments/14wdcs1/what_a_great_idea/,Inevitable-Cellist23,What a great idea,14882,0.95,469,,1689040252.0,False,False,False,False,False
6,14we30c,nextfuckinglevel,/r/nextfuckinglevel/comments/14we30c/terminator_in_the_flesh/,Standard-Salt-6628,Terminator in the flesh,12201,0.92,512,,1689042189.0,False,False,False,False,False
7,14wby2w,BlackPeopleTwitter,/r/BlackPeopleTwitter/comments/14wby2w/this_shouldnt_be_rocket_science/,Alive-Ad-4164,This shouldn’t be rocket science,12423,0.94,335,,1689036485.0,False,False,False,False,False
8,14wd1f6,meirl,/r/meirl/comments/14wd1f6/meirl/,Piccolo-Sufficient,Meirl,11232,0.98,200,,1689039426.0,False,False,False,False,False
9,14wh0e9,WTF,/r/WTF/comments/14wh0e9/out_of_anywhere_that_they_couldve_went/,Sad_Implement_8017,Out of anywhere that they could’ve went.,3605,0.96,276,,1689050545.0,True,False,False,False,False
10,14w95ir,todayilearned,/r/todayilearned/comments/14w95ir/til_after_losing_63lbs_for_his_role_in_the/,f_GOD,"TIL after losing 63lbs for his role in ""The Machinist"" where he weighed 120lbs, Christian Bale had to gain 100lbs in 6 months to star in ""Batman Begins"" but then had to lose 30lbs again before filming because he bulked up too much.",15488,0.94,945,,1689029527.0,False,False,False,False,False
11,14w9wag,inthenews,/r/inthenews/comments/14w9wag/whistleblower_who_accused_bidens_of_corruption_is/,burning_dawn,‘Whistleblower’ who accused Bidens of corruption is charged with arms trafficking and violating Iran sanctions,11365,0.94,599,,1689031317.0,False,False,False,False,False
12,14w9zox,therewasanattempt,/r/therewasanattempt/comments/14w9zox/to_rob_a_car/,WeAreTheBaddiess,To rob a car,12112,0.96,850,,1689031563.0,False,False,False,False,False
13,14wdqko,Whatcouldgowrong,/r/Whatcouldgowrong/comments/14wdqko/wcgw_opening_your_car_door_without_looking_first/,tefunka,WCGW Opening your car door without looking first in Beverley Hills,5448,0.96,561,,1689041242.0,False,False,False,False,False
14,14wc8n6,IASIP,/r/IASIP/comments/14wc8n6/a_post_from_rob/,beetlegu,A post from Rob!,6291,0.95,555,:charlie-dayman:,1689037275.0,False,False,False,False,False
15,14wgic9,Unexpected,/r/Unexpected/comments/14wgic9/can_you_say/,Winter_Ad4517,Can you say?,3470,0.94,326,,1689049029.0,False,False,False,False,False
16,14wgxsq,mildlyinfuriating,/r/mildlyinfuriating/comments/14wgxsq/what_a_way_to_appreciate_someone_for_giving_you/,Lazy_Mouse3803,What a way to appreciate someone for giving you money /s,3102,0.94,564,,1689050338.0,False,False,False,False,False
17,14wbzxv,me_irlgbt,/r/me_irlgbt/comments/14wbzxv/me_irlgbt/,Thedepressionoftrees,Me_irlgbt,6970,0.96,90,Genderqueer/Ace|Finished the fight on Halo (not finished yet),1689036624.0,False,False,False,False,False
18,14wbx66,memes,/r/memes/comments/14wbx66/normal_anime_girl/,farawayValerian,Normal anime girl,8450,0.97,147,,1689036417.0,False,False,False,False,False
19,14wby3i,sadcringe,/r/sadcringe/comments/14wby3i/incel_wants_to_sabotage_his_brother_from_getting/,lady-picture-show,"Incel wants to sabotage his brother from getting pregnant because the kid might become a ""mAnLeT""",6434,0.95,483,,1689036487.0,True,False,False,False,False
20,14wa6fq,antiwork,/r/antiwork/comments/14wa6fq/company_picked_disaster_instead_of_8_raise/,theredranger132,Company Picked Disaster Instead of 8% Raise,7610,0.97,812,,1689032027.0,False,1689048228.0,False,False,False
21,14w9p6c,technicallythetruth,/r/technicallythetruth/comments/14w9p6c/negative_numbers_dont_count/,superson182,Negative numbers don’t count,11874,0.94,1079,,1689030838.0,False,False,False,False,False
22,14wf2k8,oddlysatisfying,/r/oddlysatisfying/comments/14wf2k8/cleaning_window_glass_in_style/,yourSAS,Cleaning window glass in style,3797,0.82,301,,1689044923.0,False,False,False,False,False
23,14w6ja8,comics,/r/comics/comments/14w6ja8/billions_of_dollars_later/,DanbyDraws,Billions of Dollars Later,15464,0.95,319,Danby Draws Comics,1689023550.0,False,False,False,False,True
24,14w7gwg,nba,/r/nba/comments/14w7gwg/andre_drummonds_message_to_young_hoopers_pouting/,MyMindWasAFortress,"Andre Drummond's message to young hoopers: “Pouting on the bench, making faces, not cheering your teammates… I was that guy. I was a 100 million dollar guy. I had a bad attitude. I went from $100 million to a f--king league minimum.”",10346,0.97,692,:gsw-3: San Francisco Warriors,1689025578.0,False,False,False,False,False
25,14w6ptw,HumansBeingBros,/r/HumansBeingBros/comments/14w6ptw/new_car_came_with_a_small_surprise/,westcoastcdn19,New car came with a small surprise ,14409,0.96,248,,1689023943.0,False,False,False,False,False
26,14w6wot,cats,/r/cats/comments/14w6wot/i_found_this_cat_outside_3_days_ago_and_brought/,Melodic_General8379,"I found this cat outside 3 days ago and brought him in, my bf is saying to throw him back outside because he looks creepy anyone know what breed this is?",16577,0.92,3108,,1689024355.0,False,False,False,False,False
27,14w5crl,Satisfyingasfuck,/r/Satisfyingasfuck/comments/14w5crl/a_difficult_circus_trick_performed_flawlessly/,HelpfullyWret,A difficult circus trick performed flawlessly,22334,0.95,818,,1689021000.0,False,False,False,False,False
28,14wee7l,OneOrangeBraincell,/r/OneOrangeBraincell/comments/14wee7l/definitely_orange_cat_behavior/,Teeeeedubbb,definitely orange cat behavior,3381,0.98,72,,1689043053.0,False,False,False,False,False
29,14w3li7,worldnews,/r/worldnews/comments/14w3li7/turkey_agrees_to_swedens_nato_bid/,MagnificentCat,Turkey Agrees to Sweden’s NATO Bid,28657,0.95,1787,,1689017178.0,False,False,False,False,False
30,14waiiq,shittytattoos,/r/shittytattoos/comments/14waiiq/am_i_crazy_or_does_the_hand_look_really_bad/,Twistedbeatz89,Am I crazy or does the hand look really bad?,6416,0.95,2109,,1689032832.0,False,False,False,False,False
31,14w6voh,wholesomememes,/r/wholesomememes/comments/14w6voh/quality_conversation/,secretslut991,Quality conversation,13075,0.98,90,,1689024297.0,False,False,False,False,False
32,14w7ccl,dankmemes,/r/dankmemes/comments/14w7ccl/why_cant_we_have_that_here/,Left-Twix420,Why can’t we have that here :(,14054,0.95,421,☣️,1689025306.0,False,False,False,False,False
33,14wcyj3,StarWars,/r/StarWars/comments/14wcyj3/a_simple_man_in_london_today/,Heavy-Ostrich-7781,A simple man in london today,3514,0.97,73,,1689039218.0,False,False,False,False,False
34,14w9wk3,TikTokCringe,/r/TikTokCringe/comments/14w9wk3/the_truth_about_your_shampoo_and_conditioner/,abbiebe89,The truth about your shampoo and conditioner,5888,0.91,683,,1689031336.0,False,False,False,False,False
35,14w3xse,MurderedByWords,/r/MurderedByWords/comments/14w3xse/you_do_mine_and_ill_do_yours/,AtmosphereMassive887,You do mine and I'll do yours,22489,0.94,774,,1689017933.0,False,False,False,False,False
36,14waadq,funny,/r/funny/comments/14waadq/this_show_was_completely_absurd/,zaquerie,This show was completely absurd,5032,0.96,250,,1689032287.0,False,False,False,False,False
37,14wdrn9,politics,/r/politics/comments/14wdrn9/gops_missing_biden_witness_charged_with_being/,RandomAccount_OU812,GOP’s ‘Missing’ Biden Witness Charged With Being Chinese Spy,5859,0.98,229,,1689041325.0,False,False,False,False,False
38,14wdbhw,DunderMifflin,/r/DunderMifflin/comments/14wdbhw/apparently_this_guy_was_put_in_the_episode/,CrimsonShadowYT,apparently this guy was put in the episode because chili's was unhappy about pam being shown drunk in their restaurant.,3220,0.97,139,sex with a terrorist,1689040160.0,False,False,False,False,False
39,14wby4i,Damnthatsinteresting,/r/Damnthatsinteresting/comments/14wby4i/cocacola_bottle_designs_from_1899_to_1986/,4reddityo,Coca-Cola bottle designs from 1899 to 1986.,9981,0.98,259,,1689036489.0,False,False,False,False,False
40,14w9arh,rareinsults,/r/rareinsults/comments/14w9arh/my_husbands_rank/,Death-Chan98,My husband's rank,6335,0.98,111,,1689029878.0,False,False,False,False,False
41,14wccf3,LeopardsAteMyFace,/r/LeopardsAteMyFace/comments/14wccf3/views_for_tucker_carlsons_new_twitter_show_have/,MasterfulBJJ,Views for Tucker Carlson’s new Twitter show have dropped 86 percent since its launch,3573,0.97,223,,1689037539.0,False,False,False,False,False
42,14w5f15,PoliticalHumor,/r/PoliticalHumor/comments/14w5f15/come_on_barbie_lets_cancel_barbie/,semaforic,Come on Barbie let’s cancel Barbie!,10103,0.95,595,,1689021129.0,False,False,False,False,False
43,14welz5,Hololive,/r/Hololive/comments/14welz5/adventures_of_yabairys/,kanauru,adventures of yabairys,2646,0.97,42,,1689043654.0,False,False,False,False,False
44,14wdtby,BeAmazed,/r/BeAmazed/comments/14wdtby/giant_malaysian_katydids_are_incredibly_loud/,xyzerb,Giant Malaysian Katydids are incredibly loud,2918,0.98,201,,1689041459.0,False,False,False,False,False
45,14w8waz,WhitePeopleTwitter,/r/WhitePeopleTwitter/comments/14w8waz/i_dont_think_jack_whites_going_to_be_be_playing/,Hot-Bint,I don't think Jack White's going to be be playing at Trump's inauguration if he wins,15551,0.94,798,,1689028910.0,False,False,False,False,False
46,14w71md,facepalm,/r/facepalm/comments/14w71md/this_is_a_huge_red_flag/,Soaphed9997,This is a huge red flag,65882,0.94,1416,,1689024659.0,False,False,False,False,False
47,14wc718,PublicFreakout,/r/PublicFreakout/comments/14wc718/uber_rider_tries_to_lie_to_police_but_dash_camera/,AtcherBriensten,Uber Rider Tries To Lie To Police But Dash Camera Clears Driver,3548,0.98,282,,1689037168.0,False,False,False,False,False
48,14w8bxj,lotrmemes,/r/lotrmemes/comments/14w8bxj/always_bothered_me_how_pippin_skates/,fatkiddown,Always bothered me how Pippin skates,6386,0.98,145,,1689027546.0,False,False,False,False,False
49,14w53vm,technology,/r/technology/comments/14w53vm/majority_of_americans_say_tiktok_is_a_threat_to/,tylerthe-theatre,Majority of Americans Say TikTok Is a Threat to U.S. National Security,9832,0.88,1304,,1689020465.0,False,False,False,False,False
50,14w9ii8,todayilearned,/r/todayilearned/comments/14w9ii8/til_muhammad_alis_speaking_rate_slowed_16_percent/,nategolon,TIL Muhammad Ali’s speaking rate slowed 16 percent after his 1977 15-round fight against Ernie Shavers,11147,0.98,257,,1689030381.0,False,False,False,False,False
51,14w3i56,pettyrevenge,/r/pettyrevenge/comments/14w3i56/ex_lies_during_divorce_to_have_me_jailed_and/,DittoJ,Ex lies during divorce to have me jailed and instead he is left with remorse.,14216,0.94,285,,1689016975.0,False,False,False,False,False
52,14wcetc,HonkaiStarRail,/r/HonkaiStarRail/comments/14wcetc/how_would_the_plot_change_if_nobody_stopped/,Any-Individual-4046,how would the plot change if nobody stopped natasha from blowing up svarog?,3323,0.97,216,,1689037727.0,False,False,False,False,False
53,14wfaqo,madlads,/r/madlads/comments/14wfaqo/protesting_against_film_censorship/,secretslut991,Protesting against film censorship,2047,0.98,23,,1689045537.0,False,False,False,False,False
54,14w6ar4,pcmasterrace,/r/pcmasterrace/comments/14w6ar4/sad_but_true/,dauratian6969,Sad but true,8212,0.94,711,,1689023037.0,False,False,False,False,False
55,14wbjsm,discordVideos,/r/discordVideos/comments/14wbjsm/you_guys_are_not_gonna_believe_what_i_found/,Golden_Racer_99,You guys are not gonna believe what I found…,3843,0.96,169,,1689035455.0,False,False,False,False,False
56,14w7ch3,ukraine,/r/ukraine/comments/14w7ch3/ukrainian_combat_medic_natalia_depa_from_lviv_was/,ibloodylovecider,"Ukrainian Combat Medic Natalia Depa from Lviv was killed on the frontline. She volunteered to join the armed forces on the first days of the big war. Rest in glory, heroine. 🇺🇦🫡",6032,0.95,141,UK,1689025314.0,False,False,False,False,False
57,14w9ndt,shitposting,/r/shitposting/comments/14w9ndt/heil_spez/,Red_Gemm,Heil Spez,5356,0.93,531,:nooo:dumbass:nooo:,1689030712.0,False,False,False,False,False
58,14w2v3q,BrandNewSentence,/r/BrandNewSentence/comments/14w2v3q/not_that_bad_really/,uvucem,Not that bad really.,14256,0.98,122,,1689015576.0,False,False,False,False,False
59,14wekku,baseball,/r/baseball/comments/14wekku/vladimir_guerrero_jr_is_your_2023_home_run_derby/,Baybears,Vladimir Guerrero Jr. Is Your 2023 Home Run Derby Champion! Joining His Father As A Derby Champion!,2088,0.96,307,Chicago Cubs :chc2:,1689043541.0,False,False,False,False,False
60,14w27tr,news,/r/news/comments/14w27tr/trumpappointed_judge_gives_a_break_to_jan_6/,AudibleNod,Trump-appointed judge gives a 'break' to Jan. 6 rioter who wants to be a police officer,14107,0.91,719,,1689014141.0,False,False,False,False,False
61,14wd07n,marvelmemes,/r/marvelmemes/comments/14wd07n/better_or_worse/,TheCoranger,Better or Worse?,2730,0.97,111,Avengers,1689039339.0,False,False,False,False,False
62,14wc576,tumblr,/r/tumblr/comments/14wc576/i_would_look_straight_into_gods_face_and_tell_him/,UselessAltThing,I would look straight into God's face and tell him only God could help him.,3062,0.99,30,,1689037025.0,False,False,False,False,False
63,14wego0,maybemaybemaybe,/r/maybemaybemaybe/comments/14wego0/maybe_maybe_maybe/,DukeOfBagels,maybe maybe maybe,2118,0.95,28,,1689043244.0,False,False,False,False,False
64,14wa9sn,HolUp,/r/HolUp/comments/14wa9sn/maddy/,bindukwe,“Maddy”,4160,0.95,34,,1689032245.0,False,False,False,False,False
65,14w64mp,MadeMeSmile,/r/MadeMeSmile/comments/14w64mp/started_as_a_prank_ended_up_wholesome/,popolenzi,"Started as a prank, ended up wholesome",39632,0.89,2046,,1689022690.0,False,False,False,False,False
66,14w25yp,shittymoviedetails,/r/shittymoviedetails/comments/14w25yp/during_the_nude_painting_scene_in_titanic_only/,Thatguy755,"During the nude painting scene in Titanic, only one of Rose’s breasts is visible. This is because there is only one tit in Titanic.",14862,0.96,230,,1689014023.0,True,False,False,False,False
67,14wg62w,Tinder,/r/Tinder/comments/14wg62w/apparently_its_immature_and_pathetic_to_not_want/,ThePen_TheNeedlez,Apparently it’s immature and pathetic to not want kids and not be married by 30. Any guesses why she’s single?,1583,0.97,125,,1689048061.0,False,False,False,False,False
68,14wcmqt,starterpacks,/r/starterpacks/comments/14wcmqt/porn_ad_starterpack/,TheRealCliffjumper38,Porn Ad Starterpack,2616,0.97,172,,1689038317.0,True,False,False,False,False
69,14w95j9,whenthe,/r/whenthe/comments/14w95j9/he_will_now_change_and_grow_as_a_person/,DeificAtom93993,He will now change and grow as a person,4902,0.97,68,,1689029528.0,False,False,False,False,False
70,14w4xig,ContagiousLaughter,/r/ContagiousLaughter/comments/14w4xig/trying_to_catch_mustang/,brownsun,Trying to catch Mustang,8074,0.98,227,,1689020083.0,False,False,False,False,False
71,14w8gx6,ThatsInsane,/r/ThatsInsane/comments/14w8gx6/swans_addicted_to_poppy_cant_fly_anymore/,rCarmar,Swans addicted to poppy can’t fly anymore. ,4645,0.98,243,,1689027867.0,False,False,False,False,False
72,14w2oig,StupidFood,/r/StupidFood/comments/14w2oig/we_all_know_how_to_sear_a_steak_right/,JustKindaShimmy,"""We all know how to sear a steak, right?""",13444,0.9,2674,,1689015161.0,False,False,False,False,False
73,14w7nnk,mildlyinfuriating,/r/mildlyinfuriating/comments/14w7nnk/delayed_for_3_hours_just_to_have_this_ah_blasting/,spidermonkey2947,Delayed for 3 hours… Just to have this AH blasting a movie on his phone the whole flight…. Flight attendants did nothing…,16434,0.93,1776,,1689026011.0,False,False,False,False,False
74,14w96kv,WorkReform,/r/WorkReform/comments/14w96kv/suffocating_the_working_class/,zzill6,Suffocating The Working Class,3908,0.98,66,🤝 Join A Union,1689029597.0,False,False,False,False,False
75,14wc9w8,terriblefacebookmemes,/r/terriblefacebookmemes/comments/14wc9w8/you_ever_use_your_own_post_to_make_a_post/,TheRealHogshead,You ever use your own post to make a post?,2624,0.97,148,,1689037359.0,False,False,False,False,False
76,14w9yj9,AskReddit,/r/AskReddit/comments/14w9yj9/what_still_has_not_recovered_from_the_covid_19/,SPQRomanSparticus,What still has not recovered from the Covid 19 shutdown?,3465,0.94,3579,,1689031482.0,False,False,False,False,False
77,14we2vj,Grimdank,/r/Grimdank/comments/14we2vj/tzeentch_is_a_big_dummy/,Worth-Dog7827,Tzeentch is a big dummy.,1945,0.97,100,,1689042179.0,False,False,False,False,False
78,14wcwvh,NotHowGirlsWork,/r/NotHowGirlsWork/comments/14wcwvh/do_they_really_think_these_are_the_reasons_why/,Konjonashipirate,Do they really think these are the reasons why women won't date them?,2255,0.94,245,,1689039094.0,False,False,False,False,False
79,14wd04p,Superstonk,/r/Superstonk/comments/14wd04p/there_are_no_shares_left/,apianti,There are no shares left.,2683,0.95,220,I missed Flair Friday again?!? 🤷🏻‍♂️,1689039334.0,False,1689056247.0,False,False,False
80,14w4gmd,OldSchoolCool,/r/OldSchoolCool/comments/14w4gmd/pattie_boyd_was_married_to_george_harrison_and/,SilentWalrus92,"Pattie Boyd was married to George Harrison and Eric Clapton. Some of their most famous songs were written about her: Something, If I Needed Someone, For You Blue, I Need You, Layla, Bell Bottom Blues, Wonderful Tonight... 1960s",6844,0.97,472,,1689019088.0,False,False,False,False,False
81,14w8ogn,DeepRockGalactic,/r/DeepRockGalactic/comments/14w8ogn/somewhat_new_to_the_game_about_150_hours_is_this/,comp_hoovy_main,Somewhat new to the game (about 150 hours) is this common knowledge or am I a genius?,4018,0.97,282,Platform here :gold:,1689028363.0,False,False,False,False,False
82,14wcfsr,MoldyMemes,/r/MoldyMemes/comments/14wcfsr/sispyhus/,markedsa,sispyhus,2391,0.99,59,,1689037804.0,False,False,False,False,False
83,14wi21e,IndiaSpeaks,/r/IndiaSpeaks/comments/14wi21e/beggars_seen_in_white_uniform/,Purple_Alakazam,Beggars seen in white uniform.,1022,0.98,88,,1689053838.0,False,False,False,False,False
84,14wdr9a,ClashOfClans,/r/ClashOfClans/comments/14wdr9a/hopped_on_to_attack_earlier_and_stumbled_across/,No_Association_9110,Hopped on to attack earlier and stumbled across this in clan chat…,1946,0.98,57,,1689041294.0,False,False,False,False,False
85,14wgjon,teenagers,/r/teenagers/comments/14wgjon/i_stopped_watching_porn_6_months_ago_with_23/,Peanise,I stopped watching porn 6 months ago (with 2-3 relapses). Here's what improvements I saw in myself.,1267,0.97,169,18,1689049146.0,True,False,False,False,False
86,14w2f17,bald,/r/bald/comments/14w2f17/found_this_sub_last_night_and_you_convinced_me_to/,NotMonicaLewinsky95,Found this sub last night and you convinced me to unleash my inner Jesse Pinkman,10401,0.95,1279,,1689014587.0,False,False,False,False,False
87,14we7gl,ATBGE,/r/ATBGE/comments/14we7gl/is_there_any_reason_for_this/,fuzion_food,Is there any reason for this,1765,0.93,381,,1689042532.0,False,False,False,False,False
88,14w2awj,AnimalsBeingDerps,/r/AnimalsBeingDerps/comments/14w2awj/doggo_doesnt_want_his_day_at_the_brewery_to_end/,Bihema,Doggo doesn’t want his day at the brewery to end ,9693,0.97,151,,1689014334.0,False,False,False,False,False
89,14w89nb,TwoXChromosomes,/r/TwoXChromosomes/comments/14w89nb/my_16_yr_old_daughter_was_followed_by_a_car_and/,trobo84,My 16 yr old daughter was followed by a car and then chased on foot by two men,3892,0.95,314,,1689027389.0,False,False,False,False,False
90,14wcbo9,2007scape,/r/2007scape/comments/14wcbo9/can_we_please_get_a_2b_bank_value_or_higher_world/,Leg_Locker,Can we please get a 2b bank value or higher world? The amount of times I have to share an activity with poor people is really frustrating.,2264,0.94,138,,1689037487.0,False,False,False,False,False
91,14wbi5c,shittytattoos,/r/shittytattoos/comments/14wbi5c/i_mostly_just_regret_how_large_i_got_this_one/,M0xFu1der,I mostly just regret how large I got this one. What are your thoughts?,5252,0.97,1012,,1689035345.0,False,False,False,False,False
92,14w5df5,ExplainTheJoke,/r/ExplainTheJoke/comments/14w5df5/i_dont_get_it/,salnirvana,i don’t get it,5822,0.94,129,,1689021035.0,False,False,False,False,False
93,14w9he7,SuddenlyGay,/r/SuddenlyGay/comments/14w9he7/i_expected_a_lot/,Glass-Building9904,i expected a lot,3300,0.98,33,,1689030308.0,False,False,False,False,False
94,14weuqy,ChatGPT,/r/ChatGPT/comments/14weuqy/okay_holy_fuck_i_wont_jailbreak_it_anymore_i_dont/,where_tf_are_we,"OKAY, holy fuck, I won't jailbreak it anymore. I don't think I can ever leave this conversation without becoming a monster.",1516,0.91,214,,1689044345.0,False,False,False,False,False
95,14wechu,cursedcomments,/r/cursedcomments/comments/14wechu/cursed_fix/,Alex_The_Deer,Cursed_fix,1665,0.98,32,,1689042917.0,False,False,False,False,False
96,14wbcax,food,/r/food/comments/14wbcax/homemade_cookie_monster_cookies/,CaptainWisconsin,[Homemade] Cookie Monster Cookies,2413,0.97,51,,1689034912.0,False,False,False,False,True
97,14wc5y9,WinStupidPrizes,/r/WinStupidPrizes/comments/14wc5y9/playing_a_stupid_game_called_to_rob/,Flip_Speed,Playing a stupid game called To Rob…,2189,0.96,134,,1689037085.0,False,False,False,False,False
98,14vzjdy,NatureIsFuckingLit,/r/NatureIsFuckingLit/comments/14vzjdy/mom_gives_ones_of_her_wolf_cubs_a_reassuring/,Thund3rbolt,🔥 Mom Gives Ones Of Her Wolf Cubs A Reassuring Embrace In The Den While Sleeping,15903,0.96,193,,1689008198.0,False,False,False,False,False
99,14w4vzn,197,/r/197/comments/14w4vzn/rule/,muammargaddafisghost,Rule,6064,0.94,208,,1689019990.0,False,False,False,False,False
100,14wbsoe,BatmanArkham,/r/BatmanArkham/comments/14wbsoe/what_are_your_thoughts_on_the/,Lucho23433,"what are your thoughts on ""the""?",2236,0.98,143,,1689036089.0,False,False,False,False,False
