rank,id,subreddit,permalink,author,title,score,upvote_ratio,num_comments,author_flair_text,created_utc,over_18,edited,stickied,locked,is_original_content
1,14mqq8q,Damnthatsinteresting,/r/Damnthatsinteresting/comments/14mqq8q/a_man_and_a_monkey_share_a_watermelon_together/,ClaireDacloush,A man and a monkey share a watermelon together,15272,0.97,329,,1688100890.0,False,False,False,False,False
2,14mqbq2,todayilearned,/r/todayilearned/comments/14mqbq2/til_in_japan_raw_eggs_are_generally_safe_to_eat/,dustofoblivion123,"TIL in Japan raw eggs are generally safe to eat. This is because the country has developed a ""super egg machine"" that checks the inside of the eggs for salmonella using spectroscopic analysis. It also cleans the eggs without breaking their shells, dries them, and packages them so they are safe.",10855,0.94,850,,1688099585.0,False,False,False,False,False
3,14mo2g0,wallstreetbets,/r/wallstreetbets/comments/14mo2g0/the_future_of_investment_expertise/,AdMaleficent2789,The Future of investment expertise,15477,0.96,366,Sideline Shit Talker,1688092713.0,False,False,False,False,False
4,14mndix,mildlyinfuriating,/r/mildlyinfuriating/comments/14mndix/got_charged_9k_for_doctor_to_tell_me_it_was_just/,Carlpoppa1738,"Got charged 9k for doctor to tell me it was just period cramps, and after going to another doctor it was a ruptured ovarian cyst",26911,0.95,2821,,1688090665.0,False,False,False,False,False
5,14mqcpk,ProgrammerHumor,/r/ProgrammerHumor/comments/14mqcpk/productiontesting/,Hairy_Computer_3000,productionTesting,8000,0.97,194,,1688099681.0,False,False,False,False,False
6,14mn5f1,funny,/r/funny/comments/14mn5f1/an_apology/,TheDutchYeti,An apology,19322,0.91,541,,1688090039.0,True,False,False,False,False
7,14mmzrd,WhitePeopleTwitter,/r/WhitePeopleTwitter/comments/14mmzrd/every_centrist_on_twitter_is_like/,mlynnnnn,"every ""centrist"" on twitter is like:",18486,0.92,802,,1688089584.0,False,False,False,False,False
8,14mp762,cursedcomments,/r/cursedcomments/comments/14mp762/cursed_beast/,ThenuraRathnayake,cursed_beast,17220,0.96,348,,1688096106.0,False,False,False,False,False
9,14mrz07,meirl,/r/meirl/comments/14mrz07/meirl/,RapidlyTrained,Meirl,4615,0.97,160,,1688104920.0,False,False,False,False,False
10,14moagt,shitposting,/r/shitposting/comments/14moagt/heil_spez/,Physical_Spare_534,Heil spez,12750,0.95,143,,1688093387.0,False,False,False,False,False
11,14mo7wf,oddlysatisfying,/r/oddlysatisfying/comments/14mo7wf/red_panda_just_chillin/,m3nation007,Red Panda just chillin,10084,0.97,73,,1688093168.0,False,False,False,False,False
12,14muz6m,HonkaiStarRail,/r/HonkaiStarRail/comments/14muz6m/its_star_railing_time_manga/,Soju2nite,It's Star Railing Time! [Manga],2399,0.97,115,,1688115128.0,False,False,False,False,False
13,14mlsdf,facepalm,/r/facepalm/comments/14mlsdf/nyc_woman_84_who_eric_adams_compared_to_slave/,coochalini,"NYC woman, 84, who Eric Adams compared to slave owner is tenant advocate who fled Nazis",15122,0.95,794,,1688086134.0,False,False,False,False,False
14,14mkswk,MadeMeSmile,/r/MadeMeSmile/comments/14mkswk/repost_from_earlier_i_finally_can_afford_to_fix/,kala1234567890,Repost from earlier - I finally can afford to fix my teeth after a childhood of no dental help.,41717,0.85,1180,,1688083379.0,False,False,False,False,False
15,14mmtuz,oddlyterrifying,/r/oddlyterrifying/comments/14mmtuz/out_of_nowhere_alone_and_abandoned/,Homunculus_316,"Out of nowhere, alone and abandoned",11286,0.94,333,,1688089105.0,False,False,False,False,False
16,14mnpvt,diablo4,/r/diablo4/comments/14mnpvt/blizzard_we_are_a_us_based_company_china_does_not/,ChanceSize9153,"Blizzard: We are a US based company, China does not own us. Also Blizzard:",7905,0.84,618,,1688091670.0,False,False,False,False,False
17,14mowl9,PublicFreakout,/r/PublicFreakout/comments/14mowl9/southwest_stewardess_bars_couple_from_boarding/,pandabatron,Southwest Stewardess bars couple from boarding their flight. ,5471,0.96,748,,1688095204.0,False,False,False,False,False
18,14mtelm,dankmemes,/r/dankmemes/comments/14mtelm/hes_not_wrong/,CryptographerSalty18,He's not wrong,2486,0.96,62,,1688109711.0,False,False,False,False,False
19,14mq6i7,trashy,/r/trashy/comments/14mq6i7/why/,Azurebluenomad,WHY,4467,0.91,384,,1688099124.0,False,False,False,False,False
20,14ms96s,JustGuysBeingDudes,/r/JustGuysBeingDudes/comments/14ms96s/passing_out_around_the_homies/,dilbosweggns,Passing out around the homies,2955,0.95,44,,1688105868.0,False,False,False,False,False
21,14msa69,memes,/r/memes/comments/14msa69/hold_the_medieval_frick_up/,Infinix_007,Hold the medieval frick up,3078,0.97,54,,1688105965.0,False,False,False,False,False
22,14miial,worldnews,/r/worldnews/comments/14miial/ukrainian_soldiers_say_they_owe_lives_to/,NG06,Ukrainian soldiers say they owe lives to US-supplied Bradley vehicles,25733,0.91,1667,,1688077518.0,False,False,False,False,False
23,14mkgzb,therewasanattempt,/r/therewasanattempt/comments/14mkgzb/to_stay_awake_at_work/,Kalunda2,To stay awake at work.,13296,0.91,1489,,1688082542.0,True,False,False,False,False
24,14mian8,LateStageCapitalism,/r/LateStageCapitalism/comments/14mian8/minimum_wage/,bad1o8o,minimum wage,17884,0.96,218,,1688077020.0,False,False,False,False,False
25,14mjevm,Breath_of_the_Wild,/r/Breath_of_the_Wild/comments/14mjevm/my_5yr_old_finally_pulled_the_master_sword_today/,Overlay,My 5yr old finally pulled the Master Sword today. He was so excited!,15391,0.93,457,,1688079793.0,False,False,False,False,False
26,14mkdi6,SipsTea,/r/SipsTea/comments/14mkdi6/a_hero/,IU8gZQy0k8hsQy76,a hero! ,14247,0.94,297,,1688082284.0,False,False,False,False,False
27,14moeiw,tumblr,/r/tumblr/comments/14moeiw/an_unorthodox_take_but_one_i_happen_to_agree_with/,VLenin2291,"An unorthodox take, but one I happen to agree with",5126,0.98,54,,1688093714.0,False,False,False,False,False
28,14miyf8,technology,/r/technology/comments/14miyf8/reddit_is_going_to_remove_mods_of_private/,marketrent,Reddit is going to remove mods of private communities unless they reopen — ‘This is a courtesy notice to let you know that you will lose moderator status in the community by end of week.’,14065,0.95,1673,,1688078637.0,False,False,False,False,False
29,14mhi1l,clevercomebacks,/r/clevercomebacks/comments/14mhi1l/texas_come_get_your_drunk_uncle/,whenitpours3,Texas come get your drunk uncle,26945,0.93,687,,1688075092.0,False,False,False,False,False
30,14mgrz0,antiwork,/r/antiwork/comments/14mgrz0/south_parks_creators_have_eliminated_tipping_at/,thisisinsider,South Park's creators have eliminated tipping at Denver's famed Casa Bonita. Servers now make $30 an hour — and some are mad.,38962,0.93,3183,,1688073351.0,False,False,False,False,False
31,14mphd9,HolUp,/r/HolUp/comments/14mphd9/tfw_you_get_knifed_in_call_of_duty/,-Hyperactive-Sloth-,TFW you get knifed in Call of Duty…,3884,0.98,21,,1688096990.0,False,False,False,False,False
32,14mji2l,nba,/r/nba/comments/14mji2l/charles_barkley_surprises_congratulates_ernie/,NokCha_,Charles Barkley Surprises & Congratulates Ernie Johnson for getting into the Sports Broadcasting Hall of Fame live on TV,9835,0.98,386,:gsw-5: Warriors,1688080012.0,False,False,False,False,False
33,14mls3d,Damnthatsinteresting,/r/Damnthatsinteresting/comments/14mls3d/scuba_divers_find_oarfish/,moistureon,Scuba divers find oarfish,43132,0.94,1343,,1688086110.0,False,False,False,False,False
34,14mgprl,nextfuckinglevel,/r/nextfuckinglevel/comments/14mgprl/lucky_dude_lost_at_sea_found_by_family/,poyoso,Lucky dude lost at sea found by family!,34245,0.94,783,,1688073210.0,False,False,False,False,False
35,14mgsao,news,/r/news/comments/14mgsao/man_with_weapons_and_jan_6_warrant_arrested_after/,GonzoVeritas,Man with weapons and Jan. 6 warrant arrested after running toward Obamas' D.C. home - CBS News,20320,0.93,1067,,1688073375.0,False,False,False,False,False
36,14mp7jp,MaliciousCompliance,/r/MaliciousCompliance/comments/14mp7jp/you_want_me_to_work_95_got_it/,lawdiscord,You want me to work 9-5? Got it.,3479,0.97,169,,1688096135.0,False,1688096778.0,False,False,True
37,14mkle6,comics,/r/comics/comments/14mkle6/stiff_competition/,MrLovens,Stiff Competition,8297,0.93,91,Mr. Lovenstein,1688082858.0,False,False,False,False,False
38,14ml53h,StupidFood,/r/StupidFood/comments/14ml53h/ok_but_its_also_kind_of_impressive/,MadOvid,Ok but... It's also kind of impressive.,7331,0.93,470,,1688084320.0,False,False,False,False,False
39,14mje7t,PoliticalHumor,/r/PoliticalHumor/comments/14mje7t/you_dont_need_that_ladder/,flyart,You don't need that ladder,10956,0.84,612,,1688079747.0,False,False,False,False,False
40,14mgtyl,BrandNewSentence,/r/BrandNewSentence/comments/14mgtyl/kirby_has_no_ankles_because_the_goddess_athena/,SovietPanzerCopter,Kirby has no ankles because the Goddess Athena saw what became of Achilles...,22161,0.96,122,How to train your sentence,1688073485.0,False,False,False,False,False
41,14ml90a,lotrmemes,/r/lotrmemes/comments/14ml90a/plot_twist_samwise_the_savage/,Affectionate-Sun3184,"Plot twist, Samwise the savage.",6999,0.97,136,,1688084622.0,False,False,False,False,False
42,14mlman,trees,/r/trees/comments/14mlman/so_high_rn_made_a_cheese_and_rice_sandwich_its_so/,FPGN,"So high rn, made a cheese and rice sandwich , it's so good",6208,0.91,605,,1688085664.0,False,False,False,False,False
43,14mqr8h,pics,/r/pics/comments/14mqr8h/guess_this_is_it_see_you_later_reddit_john_oliver/,ihatethelivingdead,"Guess this is it, see you later Reddit. John Oliver",2641,0.85,139,,1688100982.0,False,False,False,False,False
44,14msy1g,CasualUK,/r/CasualUK/comments/14msy1g/saw_the_14_mile_frogs_sign_and_thought_id_post_my/,scarronline,Saw the '1/4 mile frogs' sign and thought I'd post my own unusual sign found in scotland,1727,0.98,67,,1688108242.0,False,False,False,False,False
45,14mpfw6,ChatGPT,/r/ChatGPT/comments/14mpfw6/fantastic_work_being_done_at_google_openai_is/,RadioRats,Fantastic work being done at Google. OpenAI is shaking in fear right now.,3169,0.97,117,,1688096861.0,False,False,False,False,False
46,14mlis3,maybemaybemaybe,/r/maybemaybemaybe/comments/14mlis3/maybe_maybe_maybe/,MaRkInHo__,Maybe maybe maybe,6647,0.95,342,,1688085381.0,False,False,False,False,False
47,14mnor1,cursedcomments,/r/cursedcomments/comments/14mnor1/cursed_sub/,ultimately_normal51,Cursed_sub,16525,0.95,693,,1688091585.0,False,False,False,False,False
48,14motbf,mildlyinfuriating,/r/mildlyinfuriating/comments/14motbf/uber_charged_me_29k_for_a_ride_and_both_altura/,Executive-111,Uber charged me 29k for a ride and both Altura credit union and Uber don’t want to comply. Ludicrous,7735,0.98,453,,1688094924.0,False,False,False,False,False
49,14mp19f,Piracy,/r/Piracy/comments/14mp19f/so_apparently_youtube_is_testing_out_blocking/,marinluv,So apparently YouTube is testing out blocking adblockers,3214,0.97,512,Seeder,1688095597.0,False,False,False,False,False
50,14mhda1,ThatsInsane,/r/ThatsInsane/comments/14mhda1/a_17_years_old_boy_got_shot_and_killed_by_a/,Gibrar,"A 17 years old boy got shot and killed by a policeman while fleeing from a police check in France, and this is what the whole country looks like 48h later.",15019,0.91,1222,,1688074774.0,False,False,False,True,False
51,14mlhut,doordash,/r/doordash/comments/14mlhut/wtf_maybe_provide_a_gate_code/,thewhat962,Wtf maybe provide a gate code?,5878,0.98,340,,1688085310.0,False,False,False,False,False
52,14mmu0x,ukraine,/r/ukraine/comments/14mmu0x/ukrainian_soldiers_say_they_owe_lives_to/,TurretLauncher,Ukrainian soldiers say they owe lives to US-supplied Bradley vehicles,4437,0.96,234,,1688089119.0,False,False,False,False,False
53,14mhpyf,CrackheadCraigslist,/r/CrackheadCraigslist/comments/14mhpyf/tv_mount/,throfoed69,tv mount,18374,0.93,496,,1688075635.0,False,False,False,False,False
54,14mfv16,Whatcouldgowrong,/r/Whatcouldgowrong/comments/14mfv16/hey_jorge_how_much_you_pay_for_the_new_guy/,the89delta,“Hey Jorge. How much you pay for the new guy?”,21056,0.95,700,,1688071221.0,False,False,False,False,False
55,14mghio,apolloapp,/r/apolloapp/comments/14mghio/been_using_apollo_exclusively_to_browse_reddit/,iliketurtles223,"Been using Apollo exclusively to browse Reddit since 2016, farewell old friend",12459,0.95,463,,1688072675.0,False,False,False,False,False
56,14mquey,Animemes,/r/Animemes/comments/14mquey/its_outcomes_my_boy_outcomes_are_what_matter_most/,SMmania,"It's outcomes my boy, outcomes are what matter most!",2130,0.97,30,,1688101262.0,False,False,False,False,False
57,14mu2a9,OneOrangeBraincell,/r/OneOrangeBraincell/comments/14mu2a9/this_is_bigfoot_a_12_year_old_gentleman_who_lives/,AmandaMartine,"This is Bigfoot, a 12 year old gentleman who lives a retired life on my dad's farm. He has 28 toes total, 2 extra on each foot. He is actually pretty smart for an orange.",1244,0.99,31,,1688111941.0,False,False,False,False,False
58,14mr42a,Hololive,/r/Hololive/comments/14mr42a/ame_playing_with_bugs_in_japan/,overDere,Ame playing with bugs in Japan,2052,0.98,24,:Amelia::Amelia::Amelia:,1688102088.0,False,False,False,False,False
59,14mrddv,vancouver,/r/vancouver/comments/14mrddv/16_yearold_missing_hiker_in_golden_ears_found/,Flames06,16 year-old Missing Hiker in Golden Ears found ALIVE,1956,0.95,156,,1688102944.0,False,False,False,False,False
60,14ml3ln,AnimalsBeingJerks,/r/AnimalsBeingJerks/comments/14ml3ln/selling_them_dirt_cheap/,Cultural_Magician105,Selling them dirt cheap ....,5236,0.96,64,,1688084207.0,False,False,False,False,False
61,14me7e1,technicallythetruth,/r/technicallythetruth/comments/14me7e1/heart_rate_at_987_c/,Administrative-Day76,Heart rate at 98.7° C,45448,0.97,506,,1688067366.0,False,False,False,False,False
62,14mo85h,LivestreamFail,/r/LivestreamFail/comments/14mo85h/cdawgvas_charity_auction_ends_with_328k_raised/,DiaGuy_,CDawgVA's Charity Auction ends with 328k raised for the Immune Deficiency Foundation and 14k for Make-a-Wish,3140,0.93,108,:HYPERS:,1688093189.0,False,False,False,False,False
63,14ms0hl,ich_iel,/r/ich_iel/comments/14ms0hl/ichiel/,Nethippie,ich🇯🇵iel,1615,0.94,120,,1688105047.0,True,False,False,False,False
64,14mln0n,WhitePeopleTwitter,/r/WhitePeopleTwitter/comments/14mln0n/trump_doxxed_president_obama_to_his_antiamerican/,rhino910,Trump Doxxed President Obama to his anti-American followers,11185,0.98,222,,1688085719.0,False,False,False,False,False
65,14mmzd4,TikTokCringe,/r/TikTokCringe/comments/14mmzd4/quiet_quitting/,adorablecupcake51,"""quiet quitting""",3636,0.95,98,,1688089548.0,False,False,False,False,False
66,14ml7zn,MadeMeSmile,/r/MadeMeSmile/comments/14ml7zn/after_13_years_of_higher_education_i_finally/,tfburns,"After 13 years of higher education, I finally became a Dr!",16215,0.94,598,,1688084542.0,False,False,False,False,False
67,14mj3uj,todayilearned,/r/todayilearned/comments/14mj3uj/til_that_despite_a_growing_population_full_time/,kw0711,"TIL that despite a growing population, full time college enrollment peaked in 2010 and has been dropping ever since",21144,0.95,816,,1688079023.0,False,False,False,False,False
68,14ml00z,instantkarma,/r/instantkarma/comments/14ml00z/she_landed_real_nice_real_proper/,uenomo,"She landed real nice, real proper.",5064,0.96,156,,1688083928.0,False,False,False,False,False
69,14mmj46,BlackPeopleTwitter,/r/BlackPeopleTwitter/comments/14mmj46/cant_help_it/,Annual_Bodybuilder_6,Can’t help it,3612,0.96,69,,1688088239.0,False,False,False,False,False
70,14mgyng,IllegallySmolCats,/r/IllegallySmolCats/comments/14mgyng/someone_said_hes_illegalysmolcats_material_so/,Planet-of-the-ood,Someone said he’s illegalysmolcats material so ☺️ here is dumpling ❤️,9157,0.96,174,,1688073793.0,False,False,False,False,False
71,14mhm3l,WTF,/r/WTF/comments/14mhm3l/what_are_you_doing_with_this_coming_straight_at/,Amy_Cole,What are you doing with this coming straight at you?,7918,0.95,1182,,1688075365.0,False,False,False,False,False
72,14mq0f1,facepalm,/r/facepalm/comments/14mq0f1/ah_yes_christianity/,LaveraHartan,"Ah yes, Christianity",4407,0.98,71,,1688098575.0,False,False,False,False,False
73,14mm1v4,whenthe,/r/whenthe/comments/14mm1v4/oh_hell_no_they_are_normal_people_where_are_my/,Tenebris_Rositen,"OH HELL NO THEY ARE NORMAL PEOPLE, WHERE ARE MY HELLO KITTY GIRLS",4540,0.98,101,,1688086875.0,False,False,False,False,False
74,14mkw6f,fightporn,/r/fightporn/comments/14mkw6f/dude_catches_guy_that_put_hands_on_his_sister/,Icarus2515,Dude Catches Guy That Put Hands on His Sister,4579,0.96,334,,1688083624.0,False,False,False,False,False
75,14mg7e4,ImTheMainCharacter,/r/ImTheMainCharacter/comments/14mg7e4/why_i_just_dont_understand/,k3wfr,"Why, I just don’t understand",11293,0.9,1953,,1688072030.0,False,False,False,False,False
76,14mj77m,freefromwork,/r/freefromwork/comments/14mj77m/corporate_greed_is_out_of_control/,LegalInvestmen,Corporate greed is out of control,5727,0.95,82,,1688079259.0,False,False,False,False,False
77,14mhyjd,oddlysatisfying,/r/oddlysatisfying/comments/14mhyjd/reviving_a_very_old_parquet_flooring_hidden_under/,uchman365,Reviving a very old parquet flooring hidden under a carpet,35097,0.94,597,,1688076194.0,False,False,False,False,False
78,14mggxs,NonPoliticalTwitter,/r/NonPoliticalTwitter/comments/14mggxs/pour_one_out_for_my_man/,lhomme21,Pour one out for my man,9461,0.95,44,:blue1::blue2::1111::1112:,1688072636.0,False,False,False,False,False
79,14mi7es,uber,/r/uber/comments/14mi7es/following_up_on_my_29k_charge_from_uber_i_just/,Executive-111,Following up on my 29k charge from Uber. I just tweeted it.,6190,0.97,416,,1688076814.0,False,False,False,False,False
80,14ml7hb,Superstonk,/r/Superstonk/comments/14ml7hb/ryan_cohen_on_twitter/,4four7,RYAN COHEN on twitter,5084,0.92,434,🎮7four1💜,1688084501.0,False,False,False,False,False
81,14mc4a1,politics,/r/politics/comments/14mc4a1/prosecutors_are_prepared_to_hit_trump_and_his/,theindependentonline,"Prosecutors are prepared to hit Trump and his allies with new charges, sources say",30992,0.92,1946,The Independent,1688062398.0,False,False,False,False,False
82,14mlz16,bi_irl,/r/bi_irl/comments/14mlz16/biirl/,NoSocietys,bi🤔irl,3569,0.96,73,,1688086659.0,False,False,False,False,False
83,14mldes,CrazyFuckingVideos,/r/CrazyFuckingVideos/comments/14mldes/hawk_flies_into_girls_home_with_back_door_open/,QuietWest3764,hawk flies into girls home with back door open while she’s playing guitar,3851,0.95,264,,1688084965.0,False,False,False,False,False
84,14mokbj,SipsTea,/r/SipsTea/comments/14mokbj/wait_a_damn_minute/,QuickTaping,Wait a damn minute!,5183,0.96,51,,1688094176.0,False,False,False,False,False
85,14mop33,h3h3productions,/r/h3h3productions/comments/14mop33/howie_finally_apologized/,Sianallama,Howie finally apologized!,2261,0.96,136,,1688094567.0,False,False,False,False,False
86,14mctxp,cats,/r/cats/comments/14mctxp/sweet_boy_is_3_12_weeks_today/,Planet-of-the-ood,Sweet boy is 3 1/2 weeks today,18981,0.96,368,,1688064111.0,False,False,False,False,False
87,14mkoqf,SelfAwarewolves,/r/SelfAwarewolves/comments/14mkoqf/boycotting_cancel_culture/,trickyelf,Boycotting Cancel Culture,4113,0.96,89,,1688083104.0,False,False,False,False,False
88,14mf5is,texas,/r/texas/comments/14mf5is/a_texas_family_passed_up_millions_to_turn_their/,tledwar,A Texas Family Passed Up Millions to Turn Their Ranch Into a Nature Preserve,10082,0.95,291,,1688069566.0,False,False,False,False,False
89,14mlo33,TwoSentenceHorror,/r/TwoSentenceHorror/comments/14mlo33/my_husband_will_be_home_any_minute_and_hes_gonna/,W0nk0_the_Sane00,“My husband will be home any minute and he’s gonna kick your ass!” she said to the man who had just broken into her home.,3795,0.91,125,,1688085804.0,False,False,False,False,False
90,14mqmgr,terriblefacebookmemes,/r/terriblefacebookmemes/comments/14mqmgr/who_needs_to_be_correct_when_you_can_lift/,strip_club_dj,Who needs to be correct when you can lift.,1615,0.93,107,,1688100562.0,False,False,False,False,False
91,14mn9bd,HumansBeingBros,/r/HumansBeingBros/comments/14mn9bd/nieces_needed_help_rescuing_ducklings_that_fell/,PenaMan1987,Nieces needed help rescuing ducklings that fell down the drain,2634,0.96,36,,1688090355.0,False,False,False,False,False
92,14mncmd,ChoosingBeggars,/r/ChoosingBeggars/comments/14mncmd/wherein_the_mother_of_the_bride_wonders_why_the/,Urgullibl,Wherein the mother of the bride wonders why the uncle she disinvited isn't gifting her daughter any money for her wedding.,2603,0.93,287,,1688090590.0,False,False,False,False,False
93,14ml4kj,worldnews,/r/worldnews/comments/14ml4kj/mystery_in_moscow_as_russian_bank_vicepresident/,ArtLover357,Mystery In Moscow As Russian Bank Vice-President ‘Falls Out Of A Window’,7641,0.96,744,,1688084281.0,False,False,False,False,False
94,14ms88c,IndiaSpeaks,/r/IndiaSpeaks/comments/14ms88c/legend_irrfan_khan_on_slaughtering_of_innocent/,BlowwFishh,Legend Irrfan Khan on slaughtering of innocent animals on Eid.,1176,0.93,120,,1688105777.0,False,False,False,False,False
95,14mkh4m,NatureIsFuckingLit,/r/NatureIsFuckingLit/comments/14mkh4m/pesquets_parrot_also_known_as_the_dracula_parrot/,Has-No-Name,"🔥 Pesquet's parrot, also known as the Dracula parrot",3918,0.97,61,,1688082552.0,False,False,False,False,False
96,14mhuiw,NoStupidQuestions,/r/NoStupidQuestions/comments/14mhuiw/why_doesnt_the_irs_just_send_you_a_bill_stating/,needs_more_yoy,Why doesn't the IRS just send you a bill stating how much you owe?,5741,0.93,1102,,1688075952.0,False,False,False,False,False
97,14mr37k,discordVideos,/r/discordVideos/comments/14mr37k/dad_jokes/,HelMort,Dad Jokes ,1389,0.99,12,,1688102007.0,False,False,False,False,False
98,14mq71c,19684,/r/19684/comments/14mq71c/friit_snacks/,lazygenius999,friit snacks,1608,0.98,22,,1688099172.0,False,False,False,False,False
99,14mncz6,TwoHotTakes,/r/TwoHotTakes/comments/14mncz6/update_aita_for_telling_my_gf_the_reason_shes/,throwRAdirtygf,UPDATE: AITA for telling my gf the reason she's always sick of because of her poor hygiene?,2478,0.95,304,,1688090621.0,False,False,False,False,False
100,14mrzkb,UkraineWarVideoReport,/r/UkraineWarVideoReport/comments/14mrzkb/ukrainian_himars_taking_out_russian_artillery/,justme78734,Ukrainian HIMARs taking out Russian artillery. Leaves one soldier smoking mad...,1170,0.97,116,,1688104968.0,False,False,False,False,False
