rank,id,subreddit,permalink,author,title,score,upvote_ratio,num_comments,author_flair_text,created_utc,over_18,edited,stickied,locked,is_original_content
1,14v8zwf,politics,/r/politics/comments/14v8zwf/investigation_uncovers_more_of_clarence_thomas/,YourUncleBuck,Investigation Uncovers More of Clarence Thomas’ Undisclosed Freebies from Wealthy Pals,11440,0.97,360,,1688934886.0,False,False,False,False,False
2,14v7zqw,meirl,/r/meirl/comments/14v7zqw/me_irl/,LyingResignation,me irl,16933,0.98,353,,1688932510.0,False,False,False,False,False
3,14v5966,WhitePeopleTwitter,/r/WhitePeopleTwitter/comments/14v5966/hes_handling_it_well/,Tara_is_a_Potato,He's handling it well,31679,0.94,1876,,1688925941.0,False,False,False,False,False
4,14v6ta0,nextfuckinglevel,/r/nextfuckinglevel/comments/14v6ta0/kitty_hanging_on_for_dear_life_didnt_realize_the/,beastmodeChadF13,"kitty hanging on for dear life, didn't realize the stadium had some angels watching over...",16126,0.95,551,,1688929657.0,False,False,False,False,False
5,14v6pz9,mildlyinfuriating,/r/mildlyinfuriating/comments/14v6pz9/neighbors_teenage_daughter_wont_stop_parking_on/,TheBeatnikBunny,Neighbors teenage daughter won't stop parking on our side of the driveway,14410,0.95,1409,,1688929444.0,False,False,False,False,False
6,14v4xg7,MadeMeSmile,/r/MadeMeSmile/comments/14v4xg7/he_got_her_dads_permission_to_propose_three_days/,Bihema,He got her dad's permission to propose three days before he died,41173,0.89,1093,,1688925181.0,False,False,False,False,False
7,14v41nf,facepalm,/r/facepalm/comments/14v41nf/even_us_heathens_know_that_one/,ExactlySorta,Even us heathens know that one,52735,0.94,2111,,1688922992.0,False,False,False,False,False
8,14v6cib,Damnthatsinteresting,/r/Damnthatsinteresting/comments/14v6cib/a_japanese_sculptor_immortalized_lionel_messis/,uchman365,A Japanese sculptor immortalized Lionel Messi’s left foot in solid gold worth $5M,17331,0.91,831,,1688928583.0,False,False,False,False,False
9,14v4y5u,therewasanattempt,/r/therewasanattempt/comments/14v4y5u/to_leave_after_paying_for_your_food/,ArteHokage,To leave after paying for your food,25032,0.91,4167,,1688925232.0,False,False,False,False,False
10,14v70xa,PublicFreakout,/r/PublicFreakout/comments/14v70xa/father_of_three_girls_who_were_rped_by_olympics/,Bbqwings23,Father of three girls who were r@ped by Olympics coach lunges at their abuser in court ,8607,0.94,761,,1688930169.0,False,False,False,False,False
11,14v6qda,Unexpected,/r/Unexpected/comments/14v6qda/shit_that_didnt_work/,10milkshake,"""Shit that didn't work""",9598,0.95,605,,1688929465.0,False,False,False,False,False
12,14v9n7m,memes,/r/memes/comments/14v9n7m/jokes_on_you_im_not_a_dyslexic_goth_clown/,JayFury55,"Jokes on you, I'm not a dyslexic goth clown",5883,0.98,191,,1688936417.0,False,False,False,False,False
13,14v3i6y,worldnews,/r/worldnews/comments/14v3i6y/the_founder_of_perus_profamily_prolife_movement/,DoremusJessup,"The founder of Peru’s Pro-Family Pro-Life Movement has been accused of systematically abusing his daughter. She gave birth in 2003, when she was only 13-years-old",12958,0.96,471,,1688921706.0,False,False,False,False,False
14,14v25rj,wholesomememes,/r/wholesomememes/comments/14v25rj/forgiveness_is_healing/,blaze_uchiha999,Forgiveness is healing,28518,0.94,284,,1688918420.0,False,False,False,False,False
15,14vaaf3,news,/r/news/comments/14vaaf3/marine_taken_into_custody_after_missing_14yearold/,Awkward-Action2853,Marine taken into custody after missing 14-year-old girl found in barracks of California base camp,3925,0.98,406,,1688937877.0,False,False,False,False,False
16,14v7huy,gifs,/r/gifs/comments/14v7huy/cool_bird_ahem/,OneZookee_pergame,Cool bird. ahem.,5658,0.93,199,,1688931294.0,False,False,False,False,False
17,14v6lys,comics,/r/comics/comments/14v6lys/when_tony_is_dead_and_you_gotta_pay_your_bills/,SpaceboyCantLol_,When Tony is dead and you gotta pay your bills like normal people.[OC],6582,0.95,44,,1688929211.0,False,False,False,False,False
18,14v3ydm,doordash_drivers,/r/doordash_drivers/comments/14v3ydm/anybody_else_get_a_little_nervous_walking_up_to/,ImaginationExact6471,Anybody else get a little nervous walking up to houses with these type of signs?,17637,0.82,3519,,1688922777.0,False,False,False,False,False
19,14v1qsi,starterpacks,/r/starterpacks/comments/14v1qsi/generic_teenage_boy_in_2023_starterpack/,Porchie12,"""Generic Teenage Boy in 2023"" Starterpack",20828,0.92,1425,,1688917387.0,False,False,False,False,False
20,14v9ph8,NatureIsFuckingLit,/r/NatureIsFuckingLit/comments/14v9ph8/unusual_moments_between_a_leopard_and_a_baby/,therra123,🔥 Unusual moments between a leopard and a baby gazelle...,3698,0.9,211,,1688936540.0,False,False,False,False,False
21,14v3v8j,doordash,/r/doordash/comments/14v3v8j/this_was_in_my_dd_notes/,Clawmachineskills,This was in my DD notes,9748,0.95,297,,1688922565.0,False,False,False,False,False
22,14v1ihd,BeAmazed,/r/BeAmazed/comments/14v1ihd/phenakistiscopes_illusion_effects/,XahidX,Phenakistiscopes: illusion effects,16043,0.96,120,,1688916801.0,False,False,False,False,False
23,14v5dit,ImTheMainCharacter,/r/ImTheMainCharacter/comments/14v5dit/this_girls_youtube_content_is_like_she_falls_down/,yenasunbaenim,This girl’s youtube content is like she falls down in public,6623,0.9,844,,1688926239.0,False,False,False,False,False
24,14v1bit,Tinder,/r/Tinder/comments/14v1bit/matching_with_your_friends_on_tinder/,averagepeter,Matching with your friends on Tinder >>>,15160,0.95,320,,1688916328.0,False,False,False,False,False
25,14uzntd,todayilearned,/r/todayilearned/comments/14uzntd/til_the_average_single_male_changes_his_sheets/,smoke-season,TIL: The average single male changes his sheets just four times a year.,37579,0.89,4798,,1688912112.0,False,False,False,False,False
26,14v5zcn,OldSchoolCool,/r/OldSchoolCool/comments/14v5zcn/my_dad_swears_he_was_the_coolest_kid_in_school/,tattoovtwin,My dad swears he was the coolest kid in school 1979,5279,0.97,471,,1688927697.0,False,False,False,False,False
27,14v4lrf,WorkReform,/r/WorkReform/comments/14v4lrf/strikes_are_supposed_to_be_disruptive/,zzill6,Strikes Are Supposed To Be Disruptive,6282,0.96,116,🤝 Join A Union,1688924397.0,False,False,False,False,False
28,14v51xe,Whatcouldgowrong,/r/Whatcouldgowrong/comments/14v51xe/wcgw_driving_a_little_red_car_seeing_another/,MarthaFarcuss,"WCGW driving a little red car, seeing another little red car stranded in a flooded road, and then proceeding into that same flooded road?",6115,0.97,494,,1688925487.0,False,False,False,False,False
29,14v2ley,shittytattoos,/r/shittytattoos/comments/14v2ley/my_friends_tattoo_he_got_in_bangkok_sober/,Jojaaa,"My friends tattoo he got in Bangkok, sober",11172,0.91,896,,1688919466.0,False,False,False,False,False
30,14v7z9w,AskReddit,/r/AskReddit/comments/14v7z9w/what_is_something_thats_way_too_sexualized/,liomars,What is something that's way too sexualized?,3992,0.92,3886,,1688932479.0,True,False,False,False,False
31,14v2377,formuladank,/r/formuladank/comments/14v2377/this_week_on_the_max_verstappen_experience_ep/,Influence-Fragrant,This week on The Max Verstappen Experience (Ep. S23E11 ),10530,0.96,163,Certified Kimoaposter,1688918239.0,False,False,False,False,False
32,14uzdcu,oddlysatisfying,/r/oddlysatisfying/comments/14uzdcu/lioness_and_black_panther_cuddling/,yourSAS,Lioness and black panther cuddling,34825,0.95,715,,1688911375.0,False,False,False,False,False
33,14v3n8l,tumblr,/r/tumblr/comments/14v3n8l/amrica/,SaraAnnabelle,Am*rica,8690,0.95,185,,1688922045.0,False,False,False,False,False
34,14v92bu,facepalm,/r/facepalm/comments/14v92bu/certainly_not_the_best_idea/,Ladydi-bds,Certainly not the best idea,7739,0.97,1266,,1688935039.0,False,False,False,False,False
35,14v91sk,HonkaiStarRail,/r/HonkaiStarRail/comments/14v91sk/gullible_silver_wolf/,derpynano,Gullible Silver Wolf,3229,0.94,99,,1688935005.0,False,False,False,False,False
36,14v71c7,UkrainianConflict,/r/UkrainianConflict/comments/14v71c7/turkey_appears_to_have_run_out_of_patience_it_has/,TurretLauncher,"Turkey appears to have run out of patience. it has just announced that the Turkish Navy will protect ships in the Black Sea from Russian navy/terrorists, even if Russia withdraws from the grain deal",3654,0.96,338,,1688930196.0,False,False,False,False,False
37,14v5bo3,Breath_of_the_Wild,/r/Breath_of_the_Wild/comments/14v5bo3/saw_this_and_had_to_share_it/,Bradley06232005,Saw this and had to share it,4740,0.97,34,collected all korok seeds,1688926116.0,False,False,False,False,False
38,14v82cb,TwoXChromosomes,/r/TwoXChromosomes/comments/14v82cb/wtf_does_my_boyfriend_stand_to_accomplish_by/,apocaIypseArisen,Wtf does my boyfriend stand to accomplish by telling me I’m “not that pretty”?,3071,0.94,845,,1688932688.0,False,False,False,False,False
39,14v4e7y,HolUp,/r/HolUp/comments/14v4e7y/oh_hell_nahhh/,hornmelon,OH HELL NAHHH,5803,0.97,130,,1688923874.0,False,False,False,False,False
40,14v2hec,OneOrangeBraincell,/r/OneOrangeBraincell/comments/14v2hec/i_am_the_orangest_cat_youve_never_seen_a_cat/,BlondeCult,"“I am the orangest cat, you’ve never seen a cat oranger than me.”",6658,0.97,134,,1688919187.0,False,False,False,False,False
41,14v6ikd,PeterExplainsTheJoke,/r/PeterExplainsTheJoke/comments/14v6ikd/the_numbers_peter_what_do_they_mean/,Weeb_Doggo2,"The numbers, Peter, what do they mean?",3776,0.95,168,,1688928974.0,False,False,False,False,False
42,14v63h9,BrandNewSentence,/r/BrandNewSentence/comments/14v63h9/this_something_i_would_pay_for/,teddytherian,This something I would pay for.,3655,0.98,124,,1688927975.0,False,False,False,False,False
43,14v34kq,oddlyterrifying,/r/oddlyterrifying/comments/14v34kq/the_packaging_of_these_barbies/,shah_mazing,The packaging of these Barbies,5794,0.97,141,,1688920777.0,False,False,False,False,False
44,14v1fme,Damnthatsinteresting,/r/Damnthatsinteresting/comments/14v1fme/in_2010_a_japanese_man_completed_a_gps_drawing_by/,Delicious-Let8429,"In 2010, a Japanese man completed a GPS drawing by travelling across Japan to propose to his girlfriend. It's been since certified as World's largest GPS drawing",60369,0.95,768,,1688916611.0,False,False,False,False,False
45,14v586r,PeopleFuckingDying,/r/PeopleFuckingDying/comments/14v586r/woman_mauled_to_death_by_rabbit/,Content-Bathroom-434,wOmAn mAuLeD tO dEaTh By RabBit,4129,0.96,169,,1688925878.0,False,False,False,False,False
46,14uz1ik,clevercomebacks,/r/clevercomebacks/comments/14uz1ik/i_feel_bad_for_ben/,SplitNaja369,I feel bad for ben,17157,0.83,355,,1688910520.0,False,False,False,False,False
47,14v602f,wallstreetbets,/r/wallstreetbets/comments/14v602f/wsb_regards_when_they_make_10_in_profit_after/,ss_400401,WSB regards when they make $10 in profit after losing thousands,3693,0.92,389,,1688927740.0,False,False,False,False,False
48,14v18d5,ContagiousLaughter,/r/ContagiousLaughter/comments/14v18d5/he_ded_for_a_few_seconds/,ff-dvl,He ded for a few seconds ,7531,0.97,101,,1688916099.0,False,False,False,False,False
49,14uzh28,SipsTea,/r/SipsTea/comments/14uzh28/steve/,nihonlights,Steve.,12894,0.95,162,,1688911616.0,False,False,False,False,False
50,14v0ky1,shitposting,/r/shitposting/comments/14v0ky1/getting_a_taste_of_my_own_medicine_praise_spez/,fabioke,Getting a taste of my own medicine (Praise Spez),12437,0.92,150,,1688914509.0,False,False,False,False,False
51,14v9rm3,ukraine,/r/ukraine/comments/14v9rm3/maori_men_performed_the_traditional_haka_dance_as/,UNITED24Media,Maori men performed the traditional Haka dance as a tribute to the warrior Kane Te Tai. He died while rescuing his Ukrainian comrade. Glory to the Hero!,2158,0.97,62,:FlagUA: Ukraine Media,1688936665.0,False,False,False,False,False
52,14v0s4c,whenthe,/r/whenthe/comments/14v0s4c/why_does_this_happen_so_often/,XFalzar,why does this happen so often?,10854,0.96,399,The shadow demons enlighten me,1688914989.0,False,False,False,False,False
53,14v69ej,691,/r/691/comments/14v69ej/mr_breast_rule_hope_grace_recovers_easily/,cityliqhts,mr breast rule (hope grace recovers easily),3428,0.95,31,,1688928366.0,False,False,False,False,False
54,14uzb9v,BlackPeopleTwitter,/r/BlackPeopleTwitter/comments/14uzb9v/because_why_am_i_out_here_paying_20_for_6_wings/,Cleonce12,Because why am I out here paying $20 for 6 wings?!?,9113,0.97,248,☑️,1688911241.0,False,False,False,False,False
55,14uxgu5,shittymoviedetails,/r/shittymoviedetails/comments/14uxgu5/in_saving_private_ryan_1998_vin_diesel_is_unable/,fuzzy_dice_99,"In Saving Private Ryan (1998), Vin Diesel is unable to stop the Nazis because he didn’t have his car with him",18390,0.96,230,,1688905994.0,False,False,False,False,False
56,14uxr8r,antiwork,/r/antiwork/comments/14uxr8r/starbucks_removes_tip_option_at_union_stores/,FallenPillar,Starbucks removes tip option at Union stores:,12851,0.96,1248,"Autistic, brace for impact",1688906911.0,False,False,False,False,False
57,14v06z9,maybemaybemaybe,/r/maybemaybemaybe/comments/14v06z9/maybe_maybe_maybe/,ff-dvl,Maybe Maybe Maybe,8293,0.94,123,,1688913511.0,False,False,False,False,False
58,14v5ijh,WhitePeopleTwitter,/r/WhitePeopleTwitter/comments/14v5ijh/at_the_us_museum_of_holocaust/,dustofoblivion123,At the U.S. Museum of Holocaust,7743,0.99,233,,1688926582.0,False,False,False,False,False
59,14uyd1i,LeopardsAteMyFace,/r/LeopardsAteMyFace/comments/14uyd1i/texan_dude_thought_climate_change_would_only/,Bulky-Ad4466,"Texan dude thought climate change would only impact “faraway places”, is now shocked to see consequences in his own area.",11097,0.93,1104,,1688908641.0,False,False,False,False,False
60,14uz7ds,pcmasterrace,/r/pcmasterrace/comments/14uz7ds/found_these_laying_around_surprised_it_works_well/,Xander9393,Found these laying around. Surprised it works well as gpu anti-sag,12556,0.89,996,i7-12700 | RTX 3080Ti | 16GB RAM,1688910957.0,False,False,False,False,False
61,14v7ojz,HumansAreMetal,/r/HumansAreMetal/comments/14v7ojz/grandpa_with_the_no_look_trip/,justbubbu,Grandpa with the no look trip.,2642,0.95,76,,1688931747.0,False,False,False,False,False
62,14v7ha7,awesome,/r/awesome/comments/14v7ha7/these_guys_carving_a_block_of_stone/,WhersucSugarplum,These guys carving a block of stone,2702,0.97,50,,1688931252.0,False,False,False,False,False
63,14v0bko,Weird,/r/Weird/comments/14v0bko/something_darksided_going_on_in_that_household_im/,caitlinjudge,Something darksided going on in that household I’m sorry.,8437,0.93,806,,1688913839.0,False,False,False,False,False
64,14v0ekq,Satisfyingasfuck,/r/Satisfyingasfuck/comments/14v0ekq/jamal_shead_cleaning_up_after_his_squad_following/,curlymayhe,Jamal Shead cleaning up after his squad following a controversial loss to Alabama,7764,0.97,233,,1688914053.0,False,False,False,False,False
65,14v9jm2,madlads,/r/madlads/comments/14v9jm2/this_kid/,secretslut991,This kid,2053,0.96,49,,1688936182.0,False,False,False,False,False
66,14vakia,nope,/r/nope/comments/14vakia/the_forbidden_bread/,iagovcosta,The forbidden bread,1802,0.97,67,,1688938530.0,False,False,False,False,False
67,14v8l2r,MemeVideos,/r/MemeVideos/comments/14v8l2r/3rd_world_action_movies/,Select-Water-9655,3rd world action movies,2299,0.97,73,,1688933898.0,False,False,False,False,False
68,14v2x91,BikiniBottomTwitter,/r/BikiniBottomTwitter/comments/14v2x91/oh_thats_real_nice_lol/,DiamondsAlmond,Oh thats real nice lol,4770,0.98,50,,1688920278.0,False,False,False,False,False
69,14v74vk,cats,/r/cats/comments/14v74vk/why_is_my_kitty_doing_this_he_seems_to_love_it/,0nLineeee,Why is my kitty doing this? He seems to love it ,2649,0.96,299,,1688930434.0,False,False,False,False,False
70,14uyte6,me_irlgbt,/r/me_irlgbt/comments/14uyte6/meirlgbt/,atleast8courics,me👶irlgbt,10542,0.92,173,resident cismale diversity hire,1688909918.0,False,False,False,False,False
71,14v5xi7,PoliticalHumor,/r/PoliticalHumor/comments/14v5xi7/indeed/,LiveWithinYourMemes,Indeed,2958,0.98,51,I ☑oted 2024,1688927572.0,False,False,False,False,False
72,14v6lp4,CrazyFuckingVideos,/r/CrazyFuckingVideos/comments/14v6lp4/dad_vs_kangaroo_fiiight/,BlessDisMess,"Dad vs Kangaroo, fiiight!",2773,0.97,216,,1688929194.0,False,False,False,False,False
73,14uzgex,LateStageCapitalism,/r/LateStageCapitalism/comments/14uzgex/child_labor_in_2023/,vreweensy,Child labor in 2023,7531,0.98,241,,1688911569.0,False,False,False,False,False
74,14v1yew,CasualUK,/r/CasualUK/comments/14v1yew/update_my_son_won_1st_prize_3_garden_centre/,Amygdali_lama,Update! My son won 1st prize (£3 garden centre voucher 🥳) and the chutney came in 2nd place - an altogether excellent family day :).,5048,0.95,204,,1688917905.0,False,False,False,False,False
75,14v32o3,dankmemes,/r/dankmemes/comments/14v32o3/i_am_now_in_serious_debt/,thepositivepandemic,I am now in serious debt.,5146,0.97,36,,1688920642.0,False,False,False,False,False
76,14v49k2,notinteresting,/r/notinteresting/comments/14v49k2/rip_his_karma/,PW6YLenen,Rip his karma,3716,0.94,272,,1688923550.0,False,False,False,False,False
77,14v72ia,Funnymemes,/r/Funnymemes/comments/14v72ia/its_so_annoying/,The69erisback,It’s so annoying,2428,0.96,119,,1688930277.0,False,False,False,False,False
78,14v06hd,ThatsInsane,/r/ThatsInsane/comments/14v06hd/the_titanic_divers_knew/,redlurkerNY,The Titanic divers knew...,6711,0.95,391,,1688913474.0,False,False,False,False,False
79,14v3noh,NoStupidQuestions,/r/NoStupidQuestions/comments/14v3noh/do_people_actually_pee_in_the_shower/,megacerealcrunch,Do people actually pee in the shower?,5183,0.7,4054,,1688922072.0,False,1688941407.0,False,False,False
80,14v5eej,news,/r/news/comments/14v5eej/3_georgia_teens_charged_with_murder_after_plot_to/,Moonskaraos,"3 Georgia teens charged with murder after plot to egg a home goes wrong, police say",5965,0.97,1108,,1688926298.0,False,False,False,False,False
81,14v4ocq,Fauxmoi,/r/Fauxmoi/comments/14v4ocq/thinking_about_when_will_poulter_dressed_up_as/,madsdab,Thinking About When Will Poulter Dressed Up as Sid From Toy Story for Halloween to Support an Anti-Bullying Campaign,3185,0.96,111,Ask Taylor,1688924562.0,False,False,False,False,False
82,14v4rpn,ChoosingBeggars,/r/ChoosingBeggars/comments/14v4rpn/no_is_a_complete_sentence_this_guy_used_to_be_a/,Jen_With_Just_One_N,"“No” is a complete sentence! This guy used to be a friend but now he only calls me when he wants something. Also, he claims he needs to buy diapers but I know for a fact he has no kids.",3166,0.95,545,,1688924788.0,True,False,False,False,False
83,14uwov0,TikTokCringe,/r/TikTokCringe/comments/14uwov0/that_bbc/,sexONaStDick,That BBC ,18091,0.89,3219,,1688903582.0,False,False,False,False,False
84,14v2kpz,CozyPlaces,/r/CozyPlaces/comments/14v2kpz/my_bedroom_views_during_golden_hour/,spiritualaroma,my bedroom views during golden hour,4247,0.95,188,,1688919414.0,False,False,False,False,True
85,14v7w1h,terriblefacebookmemes,/r/terriblefacebookmemes/comments/14v7w1h/boomers_jokes_are_out_of_control_and_quite/,Glass-Fan111,Boomers jokes are out of control. And quite repetitive.,2099,0.95,167,,1688932263.0,False,False,False,False,False
86,14uv6lh,funny,/r/funny/comments/14uv6lh/he_must_be_a_big_fan/,LiteratureOk5964,He must be a big fan,29437,0.94,434,,1688898532.0,False,False,False,False,False
87,14v78gp,rarepuppers,/r/rarepuppers/comments/14v78gp/i_impulsively_bought_my_dog_a_paw_patrol_collar/,dogememes_dinoruby,I impulsively bought my dog a paw patrol collar. Kids always run up to him excitedly and shout “Marshall!”,2193,0.97,26,,1688930668.0,False,False,False,False,False
88,14v3zc9,nba,/r/nba/comments/14v3zc9/spurstalk_san_antonios_coaches_including_popovich/,TimDunkinDonut,[Spurstalk] San Antonio’s coaches (including Popovich himself) gave Wemby one simple mandate: Experiment,3275,0.96,387,:sas-5: Spurs,1688922845.0,False,False,False,False,False
89,14uz3a9,lotrmemes,/r/lotrmemes/comments/14uz3a9/poor_elrond/,No-Peace4554,Poor Elrond,7519,0.97,208,,1688910647.0,False,False,False,False,False
90,14v1ppy,PhotoshopRequest,/r/PhotoshopRequest/comments/14v1ppy/can_someone_make_my_birthday_wish_come_true_i/,grantsmith304,Can someone make my birthday wish come true? I can’t swim and I’m afraid of heights. Hope someone can use these photos to make it look like I’m skydiving and riding a jet ski. Would love to show my grandkids that grandma is lots of fun.,4533,0.94,409,,1688917304.0,False,False,False,False,False
91,14uysay,marvelmemes,/r/marvelmemes/comments/14uysay/hugh_jackman_vs_wolverine/,GAMMAGREEN62,Hugh Jackman vs Wolverine...,8230,0.98,46,Avengers,1688909828.0,False,False,False,False,False
92,14uzkhn,AnimalsBeingDerps,/r/AnimalsBeingDerps/comments/14uzkhn/dance_partners/,nihonlights,Dance partners 🕺 💃 ,6306,0.97,59,,1688911860.0,False,False,False,False,False
93,14v4zrl,worldnews,/r/worldnews/comments/14v4zrl/trumps_claim_that_he_could_end_ukraines_war_in_a/,dashpog,"Trump's claim that he could end Ukraine's war in a day is a 'beautiful' thought but not true, Zelenskyy says",5547,0.94,574,,1688925338.0,False,False,False,False,False
94,14v420i,NonPoliticalTwitter,/r/NonPoliticalTwitter/comments/14v420i/who_let_this_man_in_the_kitchen/,JJ5Gaming,who let this man in the kitchen,3237,0.98,92,:blue1::blue2::1111::1112:,1688923017.0,False,False,False,False,False
95,14uzldm,iamatotalpieceofshit,/r/iamatotalpieceofshit/comments/14uzldm/theres_poop_everywhere_police_react_with_disgust/,s_y_s_t_e_m_i_c_,‘There’s poop everywhere’: Police react with disgust – spitting and gagging – as child abuse investigation leads to house of filth & horrors in bodycam footage.,6146,0.96,461,,1688911929.0,False,False,False,False,False
96,14v9lwb,tumblr,/r/tumblr/comments/14v9lwb/tumblr_teaches_conflict_resolution/,izukaneki,Tumblr teaches conflict resolution,3006,0.99,57,,1688936336.0,False,False,False,False,False
97,14v3y5a,BeAmazed,/r/BeAmazed/comments/14v3y5a/basic_lego_structures_can_endure_extreme_pressure/,itsfrustratedmonk,Basic Lego structures can endure extreme pressure,7056,0.98,441,,1688922759.0,False,False,False,False,False
98,14v0c7o,meirl,/r/meirl/comments/14v0c7o/meirl/,iamcoollife1994,meirl,15926,0.97,109,,1688913891.0,False,False,False,False,False
99,14v4fm7,gaming,/r/gaming/comments/14v4fm7/the_last_time_we_had_a_decent_xenomorph_game_was/,IntrovertBiSaiyan,The last time we had a decent xenomorph game was in 2014.,2871,0.86,363,,1688923970.0,False,False,False,False,False
100,14v54s4,tifu,/r/tifu/comments/14v54s4/tifu_by_laying_an_egg_during_sex/,heyitsaubrey,TIFU by laying an egg during sex,2539,0.91,175,,1688925673.0,False,1688942182.0,False,False,False
