rank,id,subreddit,permalink,author,title,score,upvote_ratio,num_comments,author_flair_text,created_utc,over_18,edited,stickied,locked,is_original_content
1,14tq9kk,therewasanattempt,/r/therewasanattempt/comments/14tq9kk/to_stretch_the_legs_on_a_flight/,_swuaksa8242211,to stretch the legs on a flight ,12090,0.98,224,A Flair?,1688780937.0,False,False,False,False,False
2,14to71c,worldnews,/r/worldnews/comments/14to71c/biden_told_xi_after_putin_meeting_be_careful_your/,Tnargkiller,"Biden told Xi after Putin meeting: Be careful, your economy depends on Western investment",15591,0.94,2130,,1688775338.0,False,False,False,False,False
3,14tqq9w,Unexpected,/r/Unexpected/comments/14tqq9w/soccer_mom/,icutfarts,soccer mom,8355,0.97,364,,1688782214.0,False,False,False,False,False
4,14tqeqs,BeAmazed,/r/BeAmazed/comments/14tqeqs/distant_view_of_people_entering_the_sea_its_like/,therra123,Distant view of people entering the sea... It’s like we’re the bacteria of the world,8131,0.95,366,,1688781350.0,False,False,False,False,False
5,14tp8nq,meirl,/r/meirl/comments/14tp8nq/meirl/,StockCameras,Meirl,11247,0.98,153,,1688778081.0,False,False,False,False,False
6,14tpg9g,Damnthatsinteresting,/r/Damnthatsinteresting/comments/14tpg9g/up_close_view_of_landspout_in_alberta/,VariousBasket125,Up close view of landspout in Alberta ,9331,0.98,347,,1688778644.0,False,False,False,False,False
7,14to4hx,oddlysatisfying,/r/oddlysatisfying/comments/14to4hx/this_camera_filter_makes_it_look_like_the_cat_has/,MyNameGifOreilly,This camera filter makes it look like the cat has lava spots on him,11942,0.95,181,,1688775139.0,False,False,False,False,False
8,14tq18k,tumblr,/r/tumblr/comments/14tq18k/good_news/,caughtyoulookinn,Good news,7107,0.97,74,,1688780287.0,False,False,False,False,False
9,14tmqdb,WhitePeopleTwitter,/r/WhitePeopleTwitter/comments/14tmqdb/it_would_be_pretty_funny/,rNBA_Mods_Be_Better,It would be pretty funny,11776,0.98,189,,1688771707.0,False,False,False,False,False
10,14tlt1y,mildlyinfuriating,/r/mildlyinfuriating/comments/14tlt1y/why_did_they_have_to_design_it_like_this/,doriscrockford_canem,Why did they have to design it like this,22681,0.89,3496,,1688769469.0,False,False,False,False,False
11,14tlppj,nextfuckinglevel,/r/nextfuckinglevel/comments/14tlppj/man_has_seizure_while_skydiving_and_is_saved_by/,Closed_Aperture,Man has seizure while skydiving and is saved by instructor during free fall.,17216,0.97,672,,1688769245.0,False,False,False,False,False
12,14tsglo,funny,/r/funny/comments/14tsglo/you_think_your_job_is_stressful/,I_Say_I_Say,You think your job is stressful??,3817,0.96,392,,1688787084.0,False,False,False,False,False
13,14ttbxv,HumansAreMetal,/r/HumansAreMetal/comments/14ttbxv/danny_hodge_former_boxer_and_wrestler_crushing_an/,okayInfect397,"Danny Hodge, former boxer and wrestler, crushing an apple with his bare hand at 80 years old",3402,0.98,111,,1688789573.0,False,False,False,False,False
14,14tt7qo,todayilearned,/r/todayilearned/comments/14tt7qo/til_king_louis_xi_plotted_to_kill_a_court/,f_GOD,"TIL King Louis XI plotted to kill a court astrologer who correctly predicted a death in his court fearing he'd done it himself. Before giving his guards the signal he asked if he knew when he'd die and the astrologer responded ""I shall die just three days before your Majesty."" He lived a full life.",3297,0.99,53,,1688789223.0,False,False,False,False,False
15,14tk0k1,news,/r/news/comments/14tk0k1/dc_court_of_appeals_committee_recommends_giuliani/,IcyMike1782,D.C. Court of Appeals committee recommends Giuliani be disbarred,16179,0.96,405,,1688765310.0,False,False,False,False,False
16,14tml8y,OldSchoolCool,/r/OldSchoolCool/comments/14tml8y/gentlemen_this_is_democracy_manifest_1991/,OceanBreezeAU,"Gentlemen, this is democracy manifest! 1991",9614,0.96,570,,1688771331.0,False,False,False,False,False
17,14tk3st,facepalm,/r/facepalm/comments/14tk3st/science_is_too_hard_for_you_stew/,Visqo,"Science is too hard for you, Stew",27287,0.96,1033,,1688765524.0,False,False,False,False,False
18,14tixjz,MadeMeSmile,/r/MadeMeSmile/comments/14tixjz/this_little_boy_found_an_older_skater_to_hold_his/,Soloflow786,"This little boy found an older skater to hold his hand as he attempted a trick. And when he landed it, he had the sweetest reaction 😭",47830,0.94,555,,1688762826.0,False,False,False,False,False
19,14tv5if,ukraine,/r/ukraine/comments/14tv5if/zelensky_visited_snake_island_on_the_500th_day_of/,IgorVozMkUA,Zelensky visited Snake Island on the 500th day of the full-scale war,2185,0.99,128,:Verified: Verified,1688795036.0,False,False,False,False,False
20,14tpid6,nba,/r/nba/comments/14tpid6/highlight_jabari_smith_jr_hits_a_crazy_3_to_win/,Thimit22,[Highlight] Jabari Smith Jr. hits a crazy 3 to win their first summer league game!,4905,0.96,393,:min-1: Timberwolves,1688778812.0,False,False,False,False,False
21,14ts1i5,MaliciousCompliance,/r/MaliciousCompliance/comments/14ts1i5/my_roommate_told_me_not_to_walk_out_of_the/,Throwaway_22002,My roommate told me not to walk out of the bathroom in my towel so I didn’t.,3361,0.93,286,,1688785888.0,False,False,False,False,True
22,14tke2i,Eldenring,/r/Eldenring/comments/14tke2i/the_true_endgame/,Rase57,The True Endgame,12375,0.98,302,:restored:,1688766191.0,False,False,False,False,False
23,14tmkgw,popculturechat,/r/popculturechat/comments/14tmkgw/she_would_totally_nail_it/,Spirited_Most6626,She would totally nail it!,6468,0.97,116,,1688771276.0,False,False,False,False,False
24,14tk5u9,politics,/r/politics/comments/14tk5u9/activists_want_to_disqualify_trump_from_ballot_in/,Rafdoc,Activists want to disqualify Trump from ballot in key states under 14th Amendment,8907,0.96,366,"Rafael Bernal, The Hill",1688765668.0,False,False,False,False,False
25,14tnp6y,BlackPeopleTwitter,/r/BlackPeopleTwitter/comments/14tnp6y/37_years_of_consistency/,EvonyR,37 years of consistency.,5213,0.94,230,☑️ ,1688774088.0,False,False,False,False,False
26,14tr7l4,discordVideos,/r/discordVideos/comments/14tr7l4/the_bard_has_entered_the_chat/,Weenbell,the bard has entered the chat,3262,0.98,147,,1688783545.0,False,False,False,False,False
27,14tp1h0,oddlysatisfying,/r/oddlysatisfying/comments/14tp1h0/the_way_this_golden_so_elegantly_and_effortlessly/,Thund3rbolt,The Way This Golden So Elegantly And Effortlessly Homs Into The Back Of A Jeep,8767,0.93,167,,1688777574.0,False,False,False,False,False
28,14tkpbt,CrazyFuckingVideos,/r/CrazyFuckingVideos/comments/14tkpbt/100_round_fully_auto_glock/,FinalSneak,100 round fully auto Glock 🫨,8865,0.92,896,,1688766884.0,False,False,False,False,False
29,14trigw,Breath_of_the_Wild,/r/Breath_of_the_Wild/comments/14trigw/am_i_the_only_dumbass_who_thought_vah_ruta_was_an/,Captain_Jackalope,Am I the only dumbass who thought Vah Ruta was an elephant?,2828,0.92,260,,1688784431.0,False,False,False,False,False
30,14tnlm2,rareinsults,/r/rareinsults/comments/14tnlm2/the_predator_is_coming/,OwlishlyGoogle99,The predator is coming,5260,0.96,73,,1688773853.0,False,False,False,False,False
31,14tiexx,LeopardsAteMyFace,/r/LeopardsAteMyFace/comments/14tiexx/get_poor_quick_scheme_investing_in_trump_companies/,feel_your_feelings_,Get Poor Quick Scheme: Investing in Trump Companies,11355,0.96,922,,1688761653.0,False,False,False,False,False
32,14tmdoq,Damnthatsinteresting,/r/Damnthatsinteresting/comments/14tmdoq/curious_fly/,Cold_Zero_,Curious fly,20691,0.94,772,,1688770829.0,False,False,False,False,False
33,14tlj7t,shitposting,/r/shitposting/comments/14tlj7t/praise_spez_for_he_isnt_a_predditor/,dace154288,Praise spez for he isn’t a predditor,9855,0.94,172,,1688768810.0,False,False,False,False,False
34,14ti7hb,antiwork,/r/antiwork/comments/14ti7hb/woman_90_retires_from_dillards_job_after_74_years/,berserk539,"Woman, 90, retires from Dillard’s job after 74 years — and no missed days",11126,0.95,1065,,1688761152.0,False,False,False,False,False
35,14tpm6r,PoliticalHumor,/r/PoliticalHumor/comments/14tpm6r/please/,SampsonHart,Please.,3404,0.96,47,,1688779113.0,False,False,True,False,False
36,14tm3vl,sadcringe,/r/sadcringe/comments/14tm3vl/incel_moment/,lambda_2001,Incel Moment,5872,0.95,439,,1688770208.0,True,False,False,False,False
37,14tr9hx,HolUp,/r/HolUp/comments/14tr9hx/what_does_your_state_have/,Throwaway_Thrills,What does your state have?,2553,0.98,138,,1688783709.0,False,False,False,False,False
38,14tsp70,Animemes,/r/Animemes/comments/14tsp70/mid_slayer/,TakoFry,MID Slayer,2037,0.87,182,,1688787804.0,False,False,False,False,False
39,14tq96u,nbacirclejerk,/r/nbacirclejerk/comments/14tq96u/this_dude_fucking_sucks/,Party-Ad-7077,This dude fucking sucks,2677,0.95,204,,1688780900.0,False,False,False,False,False
40,14tn6oi,mildlyinfuriating,/r/mildlyinfuriating/comments/14tn6oi/when_companies_ask_for_the_exact_day_during_an/,FailuresUseRobinhood,When Companies Ask for the Exact Day During an Application,8752,0.97,318,,1688772788.0,False,False,False,False,False
41,14tqo72,starterpacks,/r/starterpacks/comments/14tqo72/i_had_no_idea_this_animal_was_that_size_starter/,Dr_FeetFucker_MD,"""I had no idea this animal was that size"" starter pack",2539,0.97,159,,1688782036.0,False,False,False,False,True
42,14tqgx8,cats,/r/cats/comments/14tqgx8/update_because_you_reached_out/,Accomplished_Foot891,Update!!!!!!!!! Because you reached out,2578,0.99,104,,1688781528.0,False,False,False,False,False
43,14to4q9,wholesome,/r/wholesome/comments/14to4q9/she_understood_the_assignment/,Sufficient-Bug-9112,She understood the assignment,3603,0.97,27,,1688775161.0,False,False,False,False,False
44,14tv4gy,Genshin_Impact_Leaks,/r/Genshin_Impact_Leaks/comments/14tv4gy/artifact_limit_to_be_increased_to_1800_in_40/,No-Lifeguard4399,Artifact limit to be increased to 1800 in 4.0,1249,0.98,259,,1688794941.0,False,False,False,False,False
45,14tm4xe,Baking,/r/Baking/comments/14tm4xe/i_made_my_grandma_her_peanut_butter_fudge_recipe/,SeanCole2,I made my grandma her peanut butter fudge recipe,4668,0.93,191,,1688770271.0,False,False,False,False,False
46,14ts0rr,nba,/r/nba/comments/14ts0rr/victor_wembanyama_finishes_his_night_213_9pts_8/,IndependentScore3857,"Victor Wembanyama finishes his night 2-13, 9pts, 8 rebounds, 3 assists, 5 blocks, 3 TO's in 27 minutes",3349,0.95,1465,:den-1: Nuggets,1688785831.0,False,1688786865.0,False,False,False
47,14tnngi,OneOrangeBraincell,/r/OneOrangeBraincell/comments/14tnngi/i_live_in_az_and_its_114_degrees_right_now_and/,agentdoubleohio,I live in az and it’s 114 degrees right now and this handsome girl might have adopted me,3780,0.99,67,,1688773971.0,False,False,False,False,False
48,14tsqq9,Genshin_Impact,/r/Genshin_Impact/comments/14tsqq9/back_at_it_again_with_more_pokemon_based_on/,JhayAlejo,Back at it again with more Pokemon based on Genshin characters!,1766,0.97,89,,1688787941.0,False,False,False,False,False
49,14tjcna,todayilearned,/r/todayilearned/comments/14tjcna/til_that_there_are_approximately_299_people/,seaweed_blunt,"TIL that there are approximately 299 people cryogenically frozen in Scottsdale, Arizona",16681,0.96,1429,,1688763794.0,False,False,False,False,False
50,14ttily,oddlyterrifying,/r/oddlyterrifying/comments/14ttily/something_interesting_has_crossed_my_path/,LucidCunning,Something interesting has crossed my path.,1590,0.98,75,,1688790117.0,False,False,False,False,False
51,14tk7u6,LateStageCapitalism,/r/LateStageCapitalism/comments/14tk7u6/theyll_just_be_here_to_colonize_and_exploit/,merRedditor,"They'll just be here to colonize and exploit resources, then, won't they.",5822,0.97,152,,1688765788.0,False,False,False,False,False
52,14tm5z4,PeterExplainsTheJoke,/r/PeterExplainsTheJoke/comments/14tm5z4/petah_what_am_i_missing/,electricaltoaster666,Petah what am I missing?,4599,0.91,176,,1688770338.0,False,False,False,False,False
53,14tin8z,facepalm,/r/facepalm/comments/14tin8z/plant_based_beer/,Lisa_Sbs,Plant based beer,22894,0.96,2134,,1688762184.0,False,False,False,False,False
54,14tgc3n,tifu,/r/tifu/comments/14tgc3n/tifu_by_thinking_my_boyfriend_brought_condoms_to/,BurritoSupreme420,TIFU by thinking my boyfriend brought condoms to our Las Vegas vacation together and refusing to talk to him for a day cause of it,15040,0.84,1584,,1688756988.0,True,1688757108.0,False,False,False
55,14tdua6,PublicFreakout,/r/PublicFreakout/comments/14tdua6/a_tourist_restrains_a_pickpocket_in_italy/,ojodefiz,A tourist restrains a pickpocket in Italy 😳,20477,0.96,1674,,1688751349.0,True,False,False,False,False
56,14tjodj,wholesomememes,/r/wholesomememes/comments/14tjodj/hayden_christensen_is_a_beauty/,drconniehenley,Hayden Christensen is a beauty!,6326,0.98,57,,1688764511.0,False,False,False,False,False
57,14tqrng,anime_irl,/r/anime_irl/comments/14tqrng/anime_irl/,History_DoT,anime_irl,2163,0.98,19,,1688782323.0,False,False,False,False,False
58,14tkgu7,MadeMeSmile,/r/MadeMeSmile/comments/14tkgu7/he_looks_happy_that_he_got_to_talk_about_his_book/,dewey_did_me,He looks happy that he got to talk about his book :),14173,0.98,137,,1688766358.0,False,False,False,False,False
59,14tkxb1,iamatotalpieceofshit,/r/iamatotalpieceofshit/comments/14tkxb1/dixie_was_a_sweet_and_friendly_dog_who_loved/,CantStopPoppin,"Dixie was a sweet and friendly dog who loved everyone. She was only 3 years old when a police officer in Lorain, Ohio, shot her dead. The officer had muted his body cam and called her over before pulling the trigger multiple times",4934,0.95,657,,1688767403.0,False,False,False,False,False
60,14ti0lk,memes,/r/memes/comments/14ti0lk/freedom_units_metric/,LemonConnoiseur,Freedom units > metric,23558,0.76,1337,,1688760706.0,True,False,False,False,False
61,14th0ik,pettyrevenge,/r/pettyrevenge/comments/14th0ik/boyfriend_was_wrongfully_towed_from_our_complex_i/,Ok-Willow-2109,"Boyfriend was wrongfully towed from our complex, I got revenge",8300,0.95,340,,1688758508.0,False,False,False,False,False
62,14tjhtq,TrueOffMyChest,/r/TrueOffMyChest/comments/14tjhtq/my_gf_wants_to_spend_my_inheritance_in_a_house/,,My gf wants to spend my inheritance in a house down payment and I don’t,5947,0.98,1278,,1688764104.0,False,False,False,False,False
63,14tvxqg,Whatcouldgowrong,/r/Whatcouldgowrong/comments/14tvxqg/wcgw_trying_to_steal_from_a_drugstore/,Rizzo360,WCGW trying to steal from a drugstore,940,0.96,175,,1688797466.0,False,False,False,False,False
64,14tfxzf,dankmemes,/r/dankmemes/comments/14tfxzf/i_dont_make_the_rules_i_just_enforce_them/,thepositivepandemic,"I don’t make the rules, I just enforce them.",14816,0.94,81,,1688756156.0,False,False,False,False,False
65,14tsz90,ContagiousLaughter,/r/ContagiousLaughter/comments/14tsz90/seeing_a_cool_car_on_the_street/,sellman347,Seeing a cool car on the street,1422,0.97,29,,1688788645.0,False,False,False,False,False
66,14tk265,meirl,/r/meirl/comments/14tk265/me_irl/,rainbowarriorhere,me_irl,10493,0.97,130,,1688765421.0,False,False,False,False,False
67,14trgli,marvelmemes,/r/marvelmemes/comments/14trgli/its_his_canon_event/,AssassinBoi394,It's his canon event ,1777,0.98,30,Leo Fitz,1688784301.0,False,False,False,False,False
68,14tlqdu,worldnews,/r/worldnews/comments/14tlqdu/turkeys_erdogan_says_ukraine_deserves_nato/,analiia_cox,Turkey’s Erdogan says Ukraine deserves NATO membership,6811,0.96,527,,1688769289.0,False,False,False,False,False
69,14thb9p,PrequelMemes,/r/PrequelMemes/comments/14thb9p/i_hate_you/,Dranem78,"""I HATE YOU!""",7807,0.97,88,,1688759166.0,False,False,False,False,False
70,14to12d,whenthe,/r/whenthe/comments/14to12d/at_least_nimona_got_picked_up_by_another_studio/,Dzzplayz,At least Nimona got picked up by another studio,2998,0.99,51,Heart of the Cards,1688774885.0,False,False,False,False,False
71,14tbx9l,lotrmemes,/r/lotrmemes/comments/14tbx9l/such_a_good_actor/,UsernameLaugh,Such a good actor,32262,0.96,615,,1688747014.0,False,False,False,False,False
72,14tlh88,Hololive,/r/Hololive/comments/14tlh88/koyoris_latest_scheme_to_gain_more_subscribers/,Superliminal96,Koyori's latest scheme to gain more subscribers: turning herself blue,4122,0.96,118,:Koyori:,1688768697.0,False,False,False,False,False
73,14tqvy5,WhitePeopleTwitter,/r/WhitePeopleTwitter/comments/14tqvy5/amtrak_throwing_shade/,2u3e9v,Amtrak throwing shade,3185,0.99,115,,1688782658.0,False,False,False,False,False
74,14toyeu,Superstonk,/r/Superstonk/comments/14toyeu/fuckers/,BaronVA,Fuckers.,2825,0.97,235,"Fuck the Fed, Fuck the 🔴",1688777348.0,False,False,False,False,False
75,14tpnu4,NatureIsFuckingLit,/r/NatureIsFuckingLit/comments/14tpnu4/the_beautiful_opalescent_nudibranch_hermissenda/,padmanabhapillai,"🔥The beautiful opalescent nudibranch (Hermissenda opalescens), one of the most colorful species of sea slug, filmed off the coast of California by Aron Sanchez-Baranda.
",2161,0.98,47,:paw-prints:,1688779241.0,False,False,False,False,False
76,14tef2j,comics,/r/comics/comments/14tef2j/fashion_flaws_oc/,blanche_draw,Fashion flaws [OC],12646,0.95,451,,1688752699.0,False,False,False,False,False
77,14tqm17,leagueoflegends,/r/leagueoflegends/comments/14tqm17/bengi_resigns_as_t1_head_coach_replaced_with_tom/,Blaikiri7,"Bengi resigns as T1 Head Coach, replaced with Tom as interim",1831,0.96,374,:koskt: SKTSinceS3,1688781869.0,False,False,False,False,False
78,14tdayz,gaming,/r/gaming/comments/14tdayz/pc_gamer_anger_from_voice_actors_as_nsfw_mods_use/,H377Spawn,[PC Gamer] Anger from voice actors as NSFW mods use AI deepfakes to replicate their voices: 'This is NOT okay.',18203,0.88,2974,Xbox,1688750124.0,False,False,False,False,False
79,14timhv,DunderMifflin,/r/DunderMifflin/comments/14timhv/to_the_guy_whos_planning_on_proposing_after_a_week/,kNyne,To the guy who's planning on proposing after a week,5474,0.98,173,,1688762138.0,False,False,False,False,False
80,14tg657,TikTokCringe,/r/TikTokCringe/comments/14tg657/what_conservatives_think_trans_women_are/,MikeTony713,What conservatives think trans women are,9547,0.84,902,,1688756624.0,False,False,False,False,False
81,14tsbrf,Damnthatsinteresting,/r/Damnthatsinteresting/comments/14tsbrf/a_simple_toy_demo_shows_the_effect_of_lifting/,yourSAS,A simple toy demo shows the effect of lifting posture on our back,4306,0.99,73,,1688786717.0,False,False,False,False,False
82,14tjtun,TwoXChromosomes,/r/TwoXChromosomes/comments/14tjtun/what_is_wrong_with_people_these_days/,Griffinsilver,What is wrong with people these days?,4487,0.94,357,,1688764851.0,False,False,False,False,False
83,14tmld6,amiugly,/r/amiugly/comments/14tmld6/i_posted_here_last_week_about_low_self_esteem/,Ok-Branch3685,I posted here last week about low self esteem from cheating husband. I was told to change my goth makeup/black lipstick (last 2 pics).,3213,0.91,1337,,1688771341.0,False,False,False,False,False
84,14tomhz,baseball,/r/baseball/comments/14tomhz/alek_manoah_vs_detroit_tigers_in_his_first_start/,ColoradoHotel,Alek Manoah vs Detroit Tigers in his first start since being sent down: 6.0 IP 1 ER 5 H 0 BB 8 K,2318,0.94,305,Toronto Blue Jays :tor1:,1688776455.0,False,False,False,False,False
85,14tlu5d,lotr,/r/lotr/comments/14tlu5d/eowyn_and_the_witch_king_signed_my_artwork_i_can/,LongFineArt,Eowyn and the Witch King signed my artwork 😭 I can die happy,3390,0.97,67,,1688769549.0,False,False,False,False,False
86,14tt1ja,TaylorSwift,/r/TaylorSwift/comments/14tt1ja/taylor_swift_i_can_see_you_taylors_version_from/,Lyd_Euh,Taylor Swift - I Can See You (Taylor’s Version) (From The Vault) (Official Video),1228,0.93,765,:reputation: I'm getting tired even for a phoenix,1688788807.0,False,False,False,False,False
87,14tfr7k,AskReddit,/r/AskReddit/comments/14tfr7k/whats_the_best_example_of_it_takes_20_years_to/,nastrohan,What’s the best example of “it takes 20 years to build a reputation and five minutes to ruin it” that you know of?,8124,0.95,4359,,1688755732.0,False,False,False,False,False
88,14tmkaq,HonkaiStarRail,/r/HonkaiStarRail/comments/14tmkaq/i_know_what_i_have_to_do_but_i_dont_know_if_i/,Red_Naxela_,"I know what I have to do, but I don’t know if I have the strength to do it",3207,0.94,196,,1688771263.0,False,False,False,False,False
89,14tmpsw,UkrainianConflict,/r/UkrainianConflict/comments/14tmpsw/to_those_rightly_raising_questions_about_the_us/,themimeofthemollies,"“To those rightly raising questions about the US decision to send cluster munitions to 🇺🇦, your concerns about “war crimes” & international law today would have had a lot more credibility if you raised similar concerns the previous 499 days about 🇷🇺 using such weapons against 🇺🇦.” Michael McFaul",2915,0.95,279,,1688771662.0,False,False,False,False,False
90,14ttc4x,Grimdank,/r/Grimdank/comments/14ttc4x/say_auf_wiedersehen_to_your_furry_balls_space/,FN7307,"Say auf wiedersehen to your furry balls, space wolves.",1155,0.99,42,NEEEEEEEEEEEEEEERD!,1688789589.0,False,False,False,False,False
91,14tmin1,StupidFood,/r/StupidFood/comments/14tmin1/nachos_in_a_tub/,Mrdeathkills69,Nachos in a tub…,3124,0.85,1302,,1688771148.0,False,False,False,False,False
92,14toa7u,therewasanattempt,/r/therewasanattempt/comments/14toa7u/to_be_a_victim/,MrwangJr,To be a victim,4208,0.96,577,,1688775578.0,False,False,False,False,False
93,14toh6f,Catswithjobs,/r/Catswithjobs/comments/14toh6f/contractor_came_out_to_the_site_today/,Extension-Border-345,Contractor came out to the site today,2241,0.98,26,,1688776067.0,False,False,False,False,False
94,14tqj12,terriblefacebookmemes,/r/terriblefacebookmemes/comments/14tqj12/every_generation_thinks_theyre_the_coolest/,sillyintellectual61,Every generation thinks they're the coolest,1664,0.97,157,,1688781660.0,False,False,False,False,False
95,14tmt0b,ukraine,/r/ukraine/comments/14tmt0b/it_is_so_strange_that_those_who_are_now_so/,Espressodimare,It is so strange that those who are now so triggered by the U.S. transfer of cluster munitions to Ukraine just couldn’t care less when Russia was pounding Ukraine with cluster munitions in the first place. Must be nothing but pure coincidence.,4767,0.94,316,,1688771891.0,False,False,False,False,False
96,14tikqg,ProgrammerHumor,/r/ProgrammerHumor/comments/14tikqg/whosgonnatellhim/,huxx__,whosGonnaTellHim,4791,0.96,175,,1688762033.0,False,False,False,False,False
97,14tk5to,funnyvideos,/r/funnyvideos/comments/14tk5to/man_trying_on_suit_for_friends_wedding/,bigpeeler,Man Trying On Suit For Friend's Wedding. ,3890,0.94,45,,1688765667.0,False,False,False,False,False
98,14tsf7i,technology,/r/technology/comments/14tsf7i/sacramento_sheriff_is_sharing_license_plate/,digital-didgeridoo,"Sacramento Sheriff is sharing license plate reader data with anti-abortion states, records show",1209,0.95,49,,1688786984.0,False,False,False,False,False
99,14toknl,maybemaybemaybe,/r/maybemaybemaybe/comments/14toknl/maybe_maybe_maybe/,Cold_Zero_,Maybe Maybe Maybe,2121,0.96,80,,1688776315.0,False,False,False,False,False
100,14tf2kb,Unexpected,/r/Unexpected/comments/14tf2kb/staying_under_the_radar/,5krunner,Staying under the radar,27544,0.93,550,,1688754171.0,True,False,False,False,False
