rank,id,subreddit,permalink,author,title,score,upvote_ratio,num_comments,author_flair_text,created_utc,over_18,edited,stickied,locked,is_original_content
1,14i3nun,todayilearned,/r/todayilearned/comments/14i3nun/til_michael_jacksons_billy_jean_was_a_real/,ultimateunbannable,"TIL Michael Jackson's ""Billy Jean"" was a real stalker who sent Jackson multiple letters claiming he was the father of one of her twins, culminating in sending him a handgun and an invitation to a murder-suicide. It was also based on multiple women who harassed his brothers while in the Jackson 5.",17649,0.95,479,,1687640847.0,True,False,False,False,False
2,14i5j3k,facepalm,/r/facepalm/comments/14i5j3k/how_much_stupid_can_fit_in_one_person/,CecilleSoria,How much stupid can fit in one person?,12388,0.85,2233,,1687645744.0,False,False,False,False,False
3,14i8s1q,Damnthatsinteresting,/r/Damnthatsinteresting/comments/14i8s1q/what_happens_when_you_throw_an_apple_from_an/,ledim35,What happens when you throw an apple from an offshore oil rig,5115,0.98,310,,1687654922.0,False,False,False,False,False
4,14i28oi,JustGuysBeingDudes,/r/JustGuysBeingDudes/comments/14i28oi/saving_an_owl/,pun420,Saving an Owl,20630,0.97,352,,1687637172.0,False,False,False,False,False
5,14i45th,PublicFreakout,/r/PublicFreakout/comments/14i45th/unhinged_woman_feels_harassed/,lplarryp,Unhinged woman feels harassed ,10797,0.96,1648,,1687642119.0,False,False,False,False,False
6,14i2pwb,funny,/r/funny/comments/14i2pwb/these_kids_have_got_vibe/,DevilCanyon,These kids have got vibe.,11973,0.9,389,,1687638421.0,False,False,False,False,False
7,14i11dp,mildlyinfuriating,/r/mildlyinfuriating/comments/14i11dp/well_safe_to_say_i_dont_need_him_as_a_friend/,Lobsterboiiiii,Well safe to say I don’t need him as a friend.,30142,0.92,2555,,1687634098.0,False,False,False,False,False
8,14i7i01,MadeMeSmile,/r/MadeMeSmile/comments/14i7i01/helping_mommy/,IkilledRichieWhelan,Helping Mommy,5184,0.97,56,,1687651171.0,False,False,False,False,False
9,14i0xk8,pics,/r/pics/comments/14i0xk8/john_olivers_guide_to_a_more_effective_form_of/,WolfgangVolos,John Oliver's Guide To A More Effective Form of Protest,22151,0.9,765,,1687633821.0,False,False,False,False,False
10,14i1kuy,WhitePeopleTwitter,/r/WhitePeopleTwitter/comments/14i1kuy/nepo_baby_on_nepo_baby_violence_is_tearing_this/,thatguy9684736255,Nepo baby on Nepo baby violence is tearing this country apart,12089,0.97,305,,1687635494.0,False,False,False,False,False
11,14i06vl,politics,/r/politics/comments/14i06vl/ron_desantis_campaign_close_to_being_overexgop/,Miguenzo,Ron DeSantis campaign 'close to being over'—Ex-GOP governor,18625,0.93,1619,,1687631907.0,False,False,False,False,False
12,14i6935,oddlysatisfying,/r/oddlysatisfying/comments/14i6935/beautiful_4464ct_amethyst/,Gh0stDestr0y,Beautiful 44.64CT Amethyst,4939,0.98,112,Flair Loading...,1687647709.0,False,False,False,False,False
13,14i2fwd,antiwork,/r/antiwork/comments/14i2fwd/this_should_be_posted_in_every_workplace/,jatnj,This should be posted in every workplace,8355,0.97,176,,1687637701.0,False,False,False,False,False
14,14i12vs,diablo4,/r/diablo4/comments/14i12vs/so_i_started_a_queue_and_random_people_just_joined/,doislan,So I started a queue and random people just joined,10906,0.94,351,,1687634198.0,False,False,False,False,False
15,14hyuko,worldnews,/r/worldnews/comments/14hyuko/wagner_chief_prigozhin_agrees_to_halt_advance_of/,GuiltySigurdsson,"Wagner chief Prigozhin agrees to halt advance of fighters in Russia, Belarus says",23521,0.94,3246,,1687628442.0,False,False,False,False,False
16,14i3h6l,HolUp,/r/HolUp/comments/14i3h6l/no_one_has_gotten_as_far_as_he_did/,Cr33p3rFri3nd,No one has gotten as far as he did,8178,0.96,114,,1687640407.0,False,False,False,False,False
17,14i2la7,Animemes,/r/Animemes/comments/14i2la7/he_forgor/,IDontKnowANam3,He forgor,9020,0.95,255,,1687638078.0,False,False,False,False,False
18,14hzi1n,nextfuckinglevel,/r/nextfuckinglevel/comments/14hzi1n/guy_nails_every_engine_sound/,R_slicker03,Guy nails every engine sound,21549,0.91,885,,1687630132.0,False,False,False,False,False
19,14i29hu,lotrmemes,/r/lotrmemes/comments/14i29hu/cause_fck_them_old_people/,Alternative_Serve368,'Cause f*ck them old people ,8078,0.96,33,,1687637231.0,False,False,False,False,False
20,14i6eo3,quityourbullshit,/r/quityourbullshit/comments/14i6eo3/the_reddit_admins_believe_that_this_sub_is_for/,Devonmartino,"The Reddit admins believe that this sub is for them, not ordinary Redditors, and we are happy to oblige: From now on, all QYBS posts must be related to lies/BS about Reddit, Reddit Inc., its admins, and related topics.",4034,0.87,259,Source: I made it up,1687648142.0,False,1687648383.0,True,False,False
21,14hxvwa,wholesomememes,/r/wholesomememes/comments/14hxvwa/safer_with_family/,AccordingBiga,Safer with Family,26883,0.95,211,,1687625992.0,False,False,False,False,False
22,14i45dq,Damnthatsinteresting,/r/Damnthatsinteresting/comments/14i45dq/drivers_in_beijing_pay_ppl_to_deal_with_traffic/,zhangyuandyou,Drivers in Beijing pay ppl to deal with traffic for them,10893,0.97,193,,1687642085.0,False,False,False,False,False
23,14i283c,AmItheAsshole,/r/AmItheAsshole/comments/14i283c/aita_for_giving_away_my_wifes_espresso_machine/,Old_Scientist4252,AITA for giving away my wife's espresso machine and grinder without her permission?,8599,0.83,3588,,1687637127.0,False,1687652716.0,False,False,False
24,14i61nh,tumblr,/r/tumblr/comments/14i61nh/whats_your_fave/,Justthisdudeyaknow,What's your fave?,4033,0.96,154,,1687647142.0,False,False,False,False,False
25,14hwfub,news,/r/news/comments/14hwfub/drunk_drivers_in_texas_who_kill_parents_of_a/,claire0,Drunk drivers in Texas who kill parents of a child will now be required to pay child support,54938,0.94,2217,,1687622242.0,False,False,False,False,False
26,14i2tqd,BrandNewSentence,/r/BrandNewSentence/comments/14i2tqd/if_you_whacked_me_with_a_ford_explorer/,Fr3nchT0astCrunch,If you whacked me with a Ford Explorer,6105,0.98,77,,1687638703.0,False,False,False,False,False
27,14i5m85,therewasanattempt,/r/therewasanattempt/comments/14i5m85/to_pet_a_snapping_turtle/,VariousBasket125,To pet a snapping turtle ,3919,0.97,405,This is a flair,1687645963.0,False,False,False,False,False
28,14hyvom,memes,/r/memes/comments/14hyvom/first_medieval_world_problems/,Erosiiion,First (medieval) world problems,19598,0.95,122,,1687628513.0,False,False,False,False,False
29,14i32qg,WinStupidPrizes,/r/WinStupidPrizes/comments/14i32qg/cyclist_brake_checks_a_bus/,DevilCanyon,Cyclist brake checks a bus,5087,0.94,257,,1687639357.0,False,False,False,False,False
30,14hy218,dankmemes,/r/dankmemes/comments/14hy218/least_destructive_prank/,thepositivepandemic,Least destructive prank.,21733,0.96,361,,1687626394.0,False,False,False,False,False
31,14hxmu8,TikTokCringe,/r/TikTokCringe/comments/14hxmu8/savage/,Sufficient-Bug-9112,Savage,27859,0.8,1446,,1687625297.0,False,False,False,False,False
32,14hyvbn,oddlyterrifying,/r/oddlyterrifying/comments/14hyvbn/dendrocnide_moroides_or_deadly_stinger_is_one_of/,SynChronNic,"Dendrocnide Moroides, or Deadly Stinger, is one of the most dangerous shrubs in the world and even morphine is rendered ineffective against its venom",11173,0.97,623,,1687628489.0,False,False,False,False,False
33,14i0pkb,CrazyFuckingVideos,/r/CrazyFuckingVideos/comments/14i0pkb/wagner_soldiers_purchasing_some_vodka_before/,doughb0ii,Wagner soldiers purchasing some vodka before their final push onto Moscow,6942,0.95,267,,1687633262.0,False,False,False,False,False
34,14i1rfx,aww,/r/aww/comments/14i1rfx/john_oliver_makes_an_awwdorable_muppet/,QuicklyThisWay,John Oliver makes an awwdorable muppet,5923,0.81,175,,1687635964.0,False,False,False,False,False
35,14i2s6x,2westerneurope4u,/r/2westerneurope4u/comments/14i2s6x/that_is_the_most_underwhelming_end_of_a_civil_war/,FreakShowRed7,That is the most underwhelming end of a civil war I have ever seen. 0/10.,4713,0.96,207,:European: European,1687638592.0,False,False,False,False,False
36,14i1lex,woahdude,/r/woahdude/comments/14i1lex/this_turtle_is_just_chilling_and_making_bubbles/,fabioke,This turtle is just chilling and making bubbles,5474,0.96,160,,1687635538.0,False,False,False,False,False
37,14i2csj,facepalm,/r/facepalm/comments/14i2csj/theres_no_way_it_could_get_any_worseright/,Flaky-Air-9219,There's no way it could get any worse...right?,11447,0.97,388,,1687637474.0,False,False,False,False,False
38,14i2lwa,videos,/r/videos/comments/14i2lwa/fucking_rick_astley_absolutely_killing_it_at/,Johannes_Keppler,Fucking Rick Astley absolutely killing it at fucking Glastonbury today with the 36 year old song we all know by fucking heart!,4896,0.86,363,,1687638124.0,False,False,False,False,False
39,14hytxg,LateStageCapitalism,/r/LateStageCapitalism/comments/14hytxg/theyre_already_working_on_a_sequel_to_the_sub/,yuritopiaposadism,they're already working on a sequel to the sub.,8385,0.96,342,,1687628401.0,False,False,False,False,False
40,14i9gio,PrequelMemes,/r/PrequelMemes/comments/14i9gio/makes_it_more_and_more_tragic/,OmegaBoi420,Makes it more and more tragic,1759,0.97,42,,1687656953.0,False,False,False,False,False
41,14i4kak,NonPoliticalTwitter,/r/NonPoliticalTwitter/comments/14i4kak/ok_but_why/,CapableBall1815,ok but why???!!!???,3557,0.94,100,:blue1::blue2::1111::1112:,1687643178.0,False,False,False,False,False
42,14hy5wp,SelfAwarewolves,/r/SelfAwarewolves/comments/14hy5wp/its_always_about_sex_with_you_liberals/,C-n0te,It's always about sex with you Liberals.,9150,0.92,257,,1687626669.0,False,False,False,False,False
43,14hw0d7,NatureIsFuckingLit,/r/NatureIsFuckingLit/comments/14hw0d7/mama_bear_relaxing_with_her_cub_on_her_tummy/,amish_novelty,🔥 Mama bear relaxing with her cub on her tummy,16099,0.97,220,,1687621085.0,False,False,False,False,False
44,14i0p7x,cats,/r/cats/comments/14i0p7x/people_say_i_pet_her_too_strong_but_she_looks/,necroubikon,"People say I pet her too strong, but she looks preased. Your thoughts? ",6147,0.96,951,,1687633240.0,False,False,False,False,False
45,14i6i11,conservativeterrorism,/r/conservativeterrorism/comments/14i6i11/the_enemy_within_as_this_anti_american_gorilla_is/,waxjammer,The enemy within as this Anti American gorilla is essentially undermining our intelligence and CIA with reckless disregard for our national security interests.,2447,0.94,241,,1687648397.0,False,False,False,False,False
46,14i2kzn,baseball,/r/baseball/comments/14i2kzn/derek_jeter_is_gifted_a_jeter_red_sox_jersey_by/,kansashotwings,Derek Jeter is gifted a Jeter Red Sox jersey by David Ortiz,4235,0.96,322,Yomiuri Giants :ymg2:,1687638061.0,False,False,False,False,False
47,14hwzhe,CasualUK,/r/CasualUK/comments/14hwzhe/local_house_had_a_make_over_does_anybody_here/,Knillish,"Local house had a ""make over"". Does anybody here actually prefer the outcome over the original? Poor house 😞",11930,0.94,2337,,1687623598.0,False,False,False,False,False
48,14hzp2y,OldSchoolCool,/r/OldSchoolCool/comments/14hzp2y/1968_team_mary_ann_or_team_ginger/,myvotedoesntmatter,1968 Team Mary Ann or Team Ginger?,6726,0.92,1621,,1687630640.0,False,False,False,False,False
49,14hz7i2,shitposting,/r/shitposting/comments/14hz7i2/glory_to_spez_spetsnaz/,Leirnis,"Glory to Spez, Spetsnaz",8661,0.96,188,Literally 1984 😡,1687629380.0,False,False,False,False,False
50,14i3hb1,nba,/r/nba/comments/14i3hb1/first_look_at_wembanyama_shooting_around_in_a/,pcwgussej,First look at Wembanyama shooting around in a Spurs uniform (via @TheoQuintard),3564,0.97,834,,1687640415.0,False,False,False,False,False
51,14i3y42,MurderedByWords,/r/MurderedByWords/comments/14i3y42/very_accurate_description/,cyaron12,very accurate description,3376,0.96,51,,1687641568.0,False,False,False,False,False
52,14i0dsc,Breath_of_the_Wild,/r/Breath_of_the_Wild/comments/14i0dsc/seriously_dude_i_just_wanted_a_nice_pic_of_the/,cosmothetoastghost,Seriously dude? I just wanted a nice pic of the sunset,5692,0.96,87,,1687632407.0,False,False,False,False,False
53,14hw1dj,OneOrangeBraincell,/r/OneOrangeBraincell/comments/14hw1dj/new_noise_who_dis/,Misguided_Society,"New noise, who dis?",13077,0.97,120,,1687621160.0,False,False,False,False,False
54,14i5e3x,meirl,/r/meirl/comments/14i5e3x/meirl/,420orsomething-,Meirl,2788,0.99,124,,1687645363.0,False,False,False,False,False
55,14i4p2t,popculturechat,/r/popculturechat/comments/14i4p2t/rina_sawayama_calls_out_matty_healy_on_stage_at/,storminthedark,Rina Sawayama calls out Matty Healy on stage at Glastonbury for being racist and owning her masters,2882,0.92,294,,1687643514.0,False,False,False,False,False
56,14hzfv2,blackmagicfuckery,/r/blackmagicfuckery/comments/14hzfv2/snake_head/,nitinCV,Snake head,6881,0.87,267,,1687629972.0,False,False,False,False,False
57,14i7zds,MadeMeSmile,/r/MadeMeSmile/comments/14i7zds/had_one_of_the_most_untraditional_weddings_we_can/,SheepDog91,"Had one of the most untraditional weddings we can think of, and we couldn't be happier. ,(OC)",3182,0.95,331,,1687652526.0,False,False,False,False,False
58,14i2vj6,WhitePeopleTwitter,/r/WhitePeopleTwitter/comments/14i2vj6/this_subhuman_tweet_was_made_just_to_insult_a/,Striking-Comb-1547,This subhuman tweet was made just to insult a woman of color,7969,0.85,964,,1687638838.0,False,False,False,False,False
59,14i8cnl,wallstreetbets,/r/wallstreetbets/comments/14i8cnl/found_my_new_side_hustle/,rylar,found my new side hustle,1652,0.97,43,Supports a 🅱️arfield Ethnostate :Barfield:,1687653638.0,False,False,False,False,False
60,14hxfsf,TwoXChromosomes,/r/TwoXChromosomes/comments/14hxfsf/ghosted_after_x_years_of_relationship/,Gwerch,"""Ghosted after X years of relationship""",8894,0.84,476,Basically Kimmy Schmidt,1687624789.0,False,False,False,False,False
61,14hvbx6,ukraine,/r/ukraine/comments/14hvbx6/watching_news_with_my_friends_from_the_72nd/,jesterboyd,Watching news with my friends from the 72nd Mechanized Brigade not far from occupied Donetsk,12066,0.93,245,I am Alpharius,1687619267.0,False,False,False,False,False
62,14hxe5q,marvelstudios,/r/marvelstudios/comments/14hxe5q/remembered_how_good_this_scene_is_while_watching/,Loose-Examination-39,Remembered how good this scene is while watching Hawkeye.The sadness and joy it brings,8102,0.93,247,Doctor Strange Supreme,1687624669.0,False,False,False,False,False
63,14hzjti,Eldenring,/r/Eldenring/comments/14hzjti/i_made_my_husband_an_elden_ring_themed_matching/,bagelbingo,I made my husband an Elden Ring themed matching set for Father’s Day!,5538,0.93,66,,1687630261.0,False,False,False,False,False
64,14i140m,formuladank,/r/formuladank/comments/14i140m/true_legend/,matchbaby,True Legend,4358,0.96,58,BWOAHHHHHHH ,1687634287.0,False,False,False,False,False
65,14hynx4,BeAmazed,/r/BeAmazed/comments/14hynx4/uncovering_the_insane_world_of_the_largest/,girlycharms,Uncovering the insane World of the largest Underground Chamber on Earth,6369,0.97,182,,1687627977.0,False,False,False,False,False
66,14i153n,worldnews,/r/worldnews/comments/14i153n/wagner_group_fighters_prepare_to_leave_the_centre/,ledim35,Wagner Group fighters prepare to leave the centre of Rostov-on-Don,7755,0.96,938,,1687634364.0,False,False,False,False,False
67,14hxv0b,iamatotalpieceofshit,/r/iamatotalpieceofshit/comments/14hxv0b/letting_your_baby_starve_to_death_so_you_can_have/,beers4l,Letting your baby starve to death so you can have a little vacay,7087,0.96,384,,1687625923.0,False,False,False,False,False
68,14i414x,WhatsWrongWithYourCat,/r/WhatsWrongWithYourCat/comments/14i414x/my_cat_is_possessed_by_some_demon/,too_rxcklxss,My cat is possessed by some demon,2750,0.97,94,,1687641768.0,False,False,False,False,False
69,14i3vxz,mildlyinfuriating,/r/mildlyinfuriating/comments/14i3vxz/our_dishwasher_sucks_so_i_tell_my_boyfriend_every/,tbgmdhc278,"Our dishwasher sucks so I tell my boyfriend every single time he does the dishes that before he puts them in, he needs to scrub until there is no debris left at all. He always insists he does. When I unload and see this, I have to do a deep breath and hold the mild rage in.",5547,0.9,1851,,1687641416.0,False,False,False,False,False
70,14i2di5,WTF,/r/WTF/comments/14i2di5/welcome_to_florida/,FL_man_child,Welcome to Florida ,3406,0.92,344,,1687637527.0,True,False,False,False,False
71,14i01uy,me_irlgbt,/r/me_irlgbt/comments/14i01uy/me_irlgbt/,Mhsweithelm,Me_irlgbt,4916,0.95,134,Thembo Opossum God :nb-ainbow:,1687631549.0,False,False,False,False,False
72,14hy016,doordash,/r/doordash/comments/14hy016/made_a_friend_i_guess/,Unusual_Guest8394,Made a friend I guess?,6890,0.96,502,,1687626261.0,False,False,False,False,False
73,14hx889,ContagiousLaughter,/r/ContagiousLaughter/comments/14hx889/the_rock/,Iretehoshii,The rock,8129,0.94,146,,1687624244.0,False,False,False,False,False
74,14hy15a,lifehacks,/r/lifehacks/comments/14hy15a/life_hack_to_iron_clothes_when_theres_no_clothe/,CodeAsus,Life hack to iron clothes when there's no clothe iron.,6396,0.92,282,,1687626334.0,False,False,False,False,False
75,14i2ked,DiWHY,/r/DiWHY/comments/14i2ked/advertised_as_1000_shirts_on_facebook/,Metronom3,Advertised as $1000 shirts on Facebook...,4447,0.65,1720,,1687638017.0,False,False,False,False,False
76,14i0afz,PublicFreakout,/r/PublicFreakout/comments/14i0afz/woman_confronts_tenants_who_have_not_paid_their/,colapepsikinnie,"Woman confronts tenant’s who have not paid their rent in five months (New York, USA)",9631,0.91,2762,,1687632159.0,False,False,False,False,False
77,14i1gel,LeopardsAteMyFace,/r/LeopardsAteMyFace/comments/14i1gel/arizona_gop_election_official_suing_kari_lake_for/,rettribution,Arizona GOP Election Official suing Kari Lake for defamation after she pushed election fraud conspiracy theories.,3638,0.98,71,,1687635181.0,False,False,False,False,False
78,14hx026,technology,/r/technology/comments/14hx026/california_senate_approves_wave_and_tidal/,Wagamaga,California Senate approves wave and tidal renewable energy bill,7330,0.95,274,,1687623638.0,False,False,False,False,False
79,14i30t9,sports,/r/sports/comments/14i30t9/shotput_competitor_jolien_maliga_boumkwo_bel_took/,ednorog,"Shot-put competitor Jolien Maliga Boumkwo (BEL) took part in the 100m hurdles run at the European Games. She ended about 20 seconds behind winner, but still won points for her team.",2844,0.95,151,,1687639227.0,False,False,False,False,False
80,14hsilw,DesignPorn,/r/DesignPorn/comments/14hsilw/alzheimer_awareness_ad/,Brone9,Alzheimer Awareness Ad,27440,0.95,391,,1687611692.0,False,False,False,False,False
81,14hxwp5,PeterExplainsTheJoke,/r/PeterExplainsTheJoke/comments/14hxwp5/help_me_petahhhh/,TheGloriousPenis,Help me petahhhh,6525,0.96,157,,1687626046.0,False,False,False,False,False
82,14i6rrc,terriblefacebookmemes,/r/terriblefacebookmemes/comments/14i6rrc/this_was_in_another_group/,Dinoman0101,This was in another group,1704,0.94,136,,1687649131.0,False,False,False,False,False
83,14i63hl,discordVideos,/r/discordVideos/comments/14i63hl/i_cant_listen_to_this_without_getting_emotional/,HallowLaser84,I cant listen to this without getting emotional,1877,0.98,59,,1687647293.0,False,False,False,False,False
84,14i7iu6,space,/r/space/comments/14i7iu6/i_grew_up_amazed_by_the_famous_pillars_of/,theillini19,I grew up amazed by the famous Pillars of Creation photo of the Hubble Space Telescope. I never imagined I would one day be able to capture this nebula from my backyard.,1519,0.97,50,,1687651234.0,False,False,False,False,False
85,14i033v,Grimdank,/r/Grimdank/comments/14i033v/i_can_change_almost_anything_but_i_cant_change/,emwattnot,"""I can change almost anything... but I can't change human nature.""",4348,0.97,62,,1687631647.0,False,False,False,False,False
86,14hwnf8,Justrolledintotheshop,/r/Justrolledintotheshop/comments/14hwnf8/this_took_him_a_long_time_he_said/,Uckster,This took him a long time he said ,7328,0.94,755,,1687622726.0,False,False,False,False,False
87,14i8ag8,TedLasso,/r/TedLasso/comments/14i8ag8/id_like_to_think_all_of_our_lives_changed_after/,fn_bot17,I’d like to think all of our lives changed after Ted Lasso,1358,0.97,51,,1687653444.0,False,False,False,False,False
88,14hxuej,oddlysatisfying,/r/oddlysatisfying/comments/14hxuej/skier_sliding_over_lakes_surface_using_momentum/,yourSAS,Skier sliding over lake's surface using momentum,15125,0.95,204,,1687625874.0,False,False,False,False,False
89,14htsgc,pcgaming,/r/pcgaming/comments/14htsgc/battlebit_remastered_is_dominating_steam_because/,Turbostrider27,BattleBit Remastered is dominating Steam because there's no catch: it's just a lot of game for $15,14495,0.93,1449,,1687615162.0,False,False,False,False,False
90,14i57ez,TwoSentenceHorror,/r/TwoSentenceHorror/comments/14i57ez/i_had_always_dreamed_of_traveling_the_world_with/,SRH_64,"I had always dreamed of traveling the world with my boyfriend, meeting new people every day.",1990,0.98,28,,1687644863.0,False,False,False,False,False
91,14i01hl,pcmasterrace,/r/pcmasterrace/comments/14i01hl/seriously_why/,yo229no,"Seriously, WHY?",4223,0.9,267,,1687631522.0,False,False,False,False,False
92,14huv55,AskReddit,/r/AskReddit/comments/14huv55/what_screams_poorly_educated/,Animeking1108,"What screams ""poorly educated""?",12358,0.87,13262,,1687618060.0,False,False,False,False,False
93,14hvui0,BikiniBottomTwitter,/r/BikiniBottomTwitter/comments/14hvui0/unironically_yes/,123thealchemist,"Unironically, yes.",8208,0.95,177,,1687620646.0,False,False,False,False,False
94,14hw9kv,bestof,/r/bestof/comments/14hw9kv/reddit_is_killing_thirdparty_applications_and/,GodOfAtheism,Reddit is killing third-party applications (and itself). Read more in the comments.,9385,0.89,1,,1687621781.0,False,False,True,True,False
95,14hyrz5,IllegallySmolCats,/r/IllegallySmolCats/comments/14hyrz5/hes_chilling_being_cared_away_like_that/,Emma_Thedoll,he's chilling being cared away like that,4759,0.97,33,,1687628266.0,False,False,False,False,False
96,14i5twb,HydroHomies,/r/HydroHomies/comments/14i5twb/not_a_hydrohomie/,happyfuckincakeday,Not a Hydrohomie,1765,0.98,167,,1687646544.0,False,False,False,False,False
97,14i38de,Hololive,/r/Hololive/comments/14i38de/la_holoenconnect_concert_fan_meetup_slander/,ArtOfBlart,LA HoloENConnect Concert Fan Meetup Slander,2532,0.97,57,:Kanata::Coco::Haato::Miko::Suisei:,1687639767.0,False,False,False,False,False
98,14hv01n,maybemaybemaybe,/r/maybemaybemaybe/comments/14hv01n/maybe_maybe_maybe/,khaerusineyf,maybe maybe maybe,10007,0.95,131,,1687618416.0,False,False,False,False,False
99,14i7qtp,tumblr,/r/tumblr/comments/14i7qtp/what_if/,Justthisdudeyaknow,What if,2297,0.99,20,,1687651857.0,False,False,False,False,False
100,14hsm22,ProgrammerHumor,/r/ProgrammerHumor/comments/14hsm22/fateofthebrightestfellowfrommybatch/,smilingcarbon,fateOfTheBrightestFellowFromMyBatch,15989,0.96,354,,1687611940.0,False,False,False,False,False
