rank,id,subreddit,permalink,author,title,score,upvote_ratio,num_comments,author_flair_text,created_utc,over_18,edited,stickied,locked,is_original_content
1,14qk3mf,facepalm,/r/facepalm/comments/14qk3mf/this_unfortunately_happens_a_lot_in_the_military/,DazzlingGarages,This unfortunately happens a lot in the military.,19463,0.95,818,,1688488685.0,False,False,False,False,False
2,14qh6ll,WhitePeopleTwitter,/r/WhitePeopleTwitter/comments/14qh6ll/right_wing_cruelty_is_all_fun_and_games_until/,darthphallic,Right wing cruelty is all fun and games until they inevitably turn on you too.,24574,0.95,993,,1688481999.0,False,False,False,False,False
3,14qjmap,MadeMeSmile,/r/MadeMeSmile/comments/14qjmap/the_best_reenactment_ive_seen_of_titanic_they/,mindyour,The best reenactment I've seen of Titanic. They really committed to their roles.,9821,0.95,264,,1688487565.0,False,False,False,False,False
4,14qf9jb,funny,/r/funny/comments/14qf9jb/juno_a_beluga_whale_that_loves_scaring_people/,m3nation007,Juno a beluga whale that loves scaring people,20441,0.95,725,,1688477373.0,False,False,False,False,False
5,14qg6a3,Damnthatsinteresting,/r/Damnthatsinteresting/comments/14qg6a3/a_goat_trying_to_get_rid_of_parasites/,Reincarneme,A goat trying to get rid of parasites,24113,0.93,1131,,1688479562.0,False,False,False,False,False
6,14qefea,Unexpected,/r/Unexpected/comments/14qefea/heres_how_you_say_thanks_for_avoiding_a_traffic/,Xador3d,Here's how you say thanks for avoiding a traffic incident,35393,0.94,893,,1688475187.0,True,False,False,False,True
7,14qhdc1,shittymoviedetails,/r/shittymoviedetails/comments/14qhdc1/at_the_end_of_oppenheimer_2023_the_main_character/,grichardson526,"At the end of ""Oppenheimer"" (2023), the main character comes home at night and a mysterious man steps out of the shadows. ""My name is Albert Einstein"" he says. ""I'm here to talk to you about the Physicists Initiative.""",9267,0.96,152,,1688482427.0,False,False,False,False,False
8,14qe9ro,todayilearned,/r/todayilearned/comments/14qe9ro/til_that_when_robert_de_niro_was_in_the_process/,astarisaslave,"TIL that when Robert de Niro was in the process of receiving Italian citizenship, he faced opposition from the Italian American group Sons of Italy, who claimed that De Niro had damaged the public image of Italians by portraying criminals in his movies.",16885,0.96,923,,1688474773.0,False,False,False,False,False
9,14qdjt6,Whatcouldgowrong,/r/Whatcouldgowrong/comments/14qdjt6/wcgw_driving_on_an_exclusive_bus_lane_ph/,DrownedGoddd,WCGW driving on an exclusive bus lane? (PH),25738,0.97,605,,1688472676.0,False,False,False,False,False
10,14qd3r1,wholesomememes,/r/wholesomememes/comments/14qd3r1/danny_trejo_and_the_muppets/,slimyrssocks,Danny Trejo and the Muppets,24402,0.96,270,,1688471334.0,False,False,False,False,False
11,14qextc,memes,/r/memes/comments/14qextc/he_didnt_deserve_the_harassment_i_wish_him_the/,We_Will_AlI_Die,he didn’t deserve the harassment. I wish him the best.,28883,0.91,645,🏳️‍🌈LGBTQ+🏳️‍🌈,1688476495.0,False,False,False,False,False
12,14qj5i1,therewasanattempt,/r/therewasanattempt/comments/14qj5i1/to_cause_mass_hysteria/,VariousBasket125,To cause mass hysteria,5678,0.94,1019,This is a flair,1688486528.0,False,False,False,False,False
13,14qdfqw,TikTokCringe,/r/TikTokCringe/comments/14qdfqw/latest_on_who_is_actually_hurting_kids_in_the_usa/,cak3crumbs,Latest on who is actually hurting kids in the USA,15301,0.89,1119,,1688472330.0,False,False,False,False,False
14,14qk32e,cats,/r/cats/comments/14qk32e/im_not_a_cat_person/,-Hyperactive-Sloth-,I’m not a cat person….,4149,0.98,160,,1688488647.0,False,False,False,False,False
15,14qg6st,tumblr,/r/tumblr/comments/14qg6st/welp/,competitive-dust,Welp!,8360,0.97,66,,1688479596.0,False,False,False,False,False
16,14qd6rp,worldnews,/r/worldnews/comments/14qd6rp/you_can_never_become_a_westerner_chinas_top/,Golmar_gaming227,‘You can never become a Westerner:’ China’s top diplomat urges Japan and South Korea to align with Beijing and ‘revitalize Asia’,11889,0.94,2508,,1688471590.0,False,False,False,False,False
17,14qfl3g,BlackPeopleTwitter,/r/BlackPeopleTwitter/comments/14qfl3g/brocquaintances/,PrinceTaj97,“Brocquaintances”,6890,0.97,80,,1688478167.0,False,False,False,False,False
18,14qilqv,shitposting,/r/shitposting/comments/14qilqv/heil_spez/,Siil_Udus,Heil spez,5189,0.97,31,,1688485277.0,False,False,False,False,False
19,14qfepw,dankmemes,/r/dankmemes/comments/14qfepw/still_pretty_good/,Unlucky_Process_6537,Still pretty good,10236,0.91,216,,1688477739.0,False,False,False,False,False
20,14qj7rx,AskReddit,/r/AskReddit/comments/14qj7rx/what_feels_like_an_orgasm_but_isnt_an_orgasm/,Delicious-One3028,What feels like an orgasm but isn't an orgasm?,4095,0.89,5559,,1688486651.0,True,False,False,False,False
21,14qgbms,MapPorn,/r/MapPorn/comments/14qgbms/the_first_five_countries_that_recognized_the_us/,quindiassomigli,The first five countries that Recognized the US,5569,0.95,459,,1688479935.0,False,False,False,False,False
22,14qdo7r,WinStupidPrizes,/r/WinStupidPrizes/comments/14qdo7r/driving_on_an_exclusive_bus_lane_ph/,DrownedGoddd,.. driving on an exclusive bus lane. (PH),9052,0.96,344,,1688473053.0,False,False,False,False,False
23,14qbjos,wholesome,/r/wholesome/comments/14qbjos/this_guy_saved_mans_life/,ReservedEmber,This guy saved man's life,17966,0.97,360,,1688466667.0,False,False,False,False,False
24,14qi9id,meirl,/r/meirl/comments/14qi9id/meirl/,Jimbo072,meirl,4305,0.97,83,,1688484501.0,False,False,False,False,False
25,14qegax,CrazyFuckingVideos,/r/CrazyFuckingVideos/comments/14qegax/women_claims_she_sees_someone_on_back_of_american/,QuietWest3764,Women claims she sees someone on back of American Airlines flight that isn’t “real” . Flight delayed 3 hours due to crew checking for any suspicious activity. ,7567,0.94,1470,,1688475257.0,False,False,False,False,False
26,14qds56,BeAmazed,/r/BeAmazed/comments/14qds56/the_msg_sphere_doing_tests_in_las_vegas/,MarionberryRight8261,The MSG sphere doing tests in Las Vegas,7816,0.96,796,,1688473375.0,False,False,False,False,False
27,14qg9v9,OldSchoolCool,/r/OldSchoolCool/comments/14qg9v9/kids_cheering_on_the_way_out_the_door_on_the_last/,Quick_Presentation11,"Kids cheering on the way out the door on the last day of school, 1977",5084,0.98,297,,1688479813.0,False,False,False,False,False
28,14qgk0q,marvelmemes,/r/marvelmemes/comments/14qgk0q/tom_hiddleston_and_the_multiverse/,No-Chipmunk-1524,Tom Hiddleston and the multiverse.,5237,0.96,88,Avengers,1688480498.0,False,False,False,False,False
29,14qipkh,Breath_of_the_Wild,/r/Breath_of_the_Wild/comments/14qipkh/if_a_hinox_grabs_a_palmbent_tree_it_will_not_hit/,MuffinStraight4816,"If a Hinox grabs a palm/bent tree, it will not hit you. ",3688,0.98,69,,1688485524.0,False,False,False,False,False
30,14qelct,PoliticalHumor,/r/PoliticalHumor/comments/14qelct/just_ask_the_president/,shychubby_kitty,Just ask the President,6171,0.97,186,,1688475622.0,False,False,False,False,False
31,14qjrpa,LeopardsAteMyFace,/r/LeopardsAteMyFace/comments/14qjrpa/florida_passed_a_draconian_antiimmigrant_law_now/,WhistleblowerGoWoo,"Florida passed a Draconian anti-immigrant law. Now, GOP legislators are mad that the state agriculture industry, which is heavily dependent on immigrants, can’t find enough workers.",3039,0.97,230,,1688487915.0,False,False,False,False,False
32,14qexrw,discordVideos,/r/discordVideos/comments/14qexrw/my_bad_guys_i_think_i_fucked_up/,I_am_Fang_Yuan_,"my bad guys, I think I fucked up...",6854,0.96,57,,1688476492.0,False,False,False,False,False
33,14qf90v,comics,/r/comics/comments/14qf90v/oc_the_ocean_is_soup/,Afraid_Reflection890,"[OC] ""The ocean is soup""",5913,0.9,198,,1688477338.0,False,False,False,False,False
34,14qfq2t,rareinsults,/r/rareinsults/comments/14qfq2t/holy_shit_u_killed_her_dude/,AlyceEscobar,Holy shit!! u killed her dude!!,5574,0.95,81,,1688478501.0,False,False,False,False,False
35,14qjbhh,politics,/r/politics/comments/14qjbhh/trump_marks_independence_day_by_sharing_vulgar/,theindependentonline,Trump marks Independence Day by sharing vulgar attack on Biden and ominous 2024 warning,3108,0.93,497,The Independent,1688486885.0,False,False,False,False,False
36,14qi73r,technicallythetruth,/r/technicallythetruth/comments/14qi73r/yes_the_lightning_mcthor/,ogkerung,Yes the Lightning McThor,3417,0.98,40,,1688484334.0,False,False,False,False,False
37,14qa6sd,mildlyinfuriating,/r/mildlyinfuriating/comments/14qa6sd/after_talking_for_4_hours/,Bones231,After talking for 4 hours..,26821,0.89,2994,,1688462363.0,False,False,False,False,False
38,14qfj6i,AITAH,/r/AITAH/comments/14qfj6i/aitah_for_rejecting_a_transgender_woman_after_our/,pimpc3ss,AITAH for rejecting a transgender woman after our date?,4855,0.86,2896,,1688478039.0,False,1688499207.0,False,False,False
39,14qbugp,WTF,/r/WTF/comments/14qbugp/going_to_work_on_the_other_side_of_the_river/,demetri47,Going to work on the other side of the river,8859,0.94,256,,1688467612.0,True,False,False,False,False
40,14qaptg,HolUp,/r/HolUp/comments/14qaptg/wait/,koka-kun,Wait...,19387,0.94,360,,1688464066.0,False,False,False,False,False
41,14qjav2,lotrmemes,/r/lotrmemes/comments/14qjav2/george_washington_invented_them/,FunyunCream,George Washington invented them!,2744,0.96,44,,1688486842.0,False,False,False,False,False
42,14qc8ig,ContagiousLaughter,/r/ContagiousLaughter/comments/14qc8ig/mock_interview/,Hypnoidz,Mock interview ,8667,0.94,301,,1688468753.0,False,False,False,False,False
43,14qcus1,ImTheMainCharacter,/r/ImTheMainCharacter/comments/14qcus1/i_crave_attention/,Xxcloudy_mindzxX,I crave attention,7161,0.95,579,,1688470580.0,False,False,False,False,False
44,14qjhaa,starwarsmemes,/r/starwarsmemes/comments/14qjhaa/war_crimes_intensify/,MaderaArt,(war crimes intensify),2682,0.97,140,,1688487251.0,False,False,False,False,False
45,14qez3s,tifu,/r/tifu/comments/14qez3s/tifu_by_ignoring_every_hint_that_she_wanted_to/,NoExplanation3017,TIFU by ignoring every hint that she wanted to sleep with me.,4799,0.91,552,,1688476586.0,True,False,False,False,False
46,14qgatv,MemePiece,/r/MemePiece/comments/14qgatv/robin_really_is_the_devil_child/,infinitysaga,Robin really is the devil child,3928,0.96,83,MARINE,1688479878.0,False,False,False,False,False
47,14qbvf8,LateStageCapitalism,/r/LateStageCapitalism/comments/14qbvf8/just_work_and_have_no_demands/,Common_Thinker,Just work and have no demands,7571,0.97,87,,1688467688.0,False,False,False,False,False
48,14qhmxp,DeepRockGalactic,/r/DeepRockGalactic/comments/14qhmxp/this_is_so_sad_can_i_get_a_rock_and_stone/,BigNutzBrank,This is so sad can I get a rock and stone?,3246,0.97,82,,1688483005.0,False,False,False,False,False
49,14q9nwe,oddlysatisfying,/r/oddlysatisfying/comments/14q9nwe/cleaning_out_a_clothes_dryer_vent/,BloodScumbag,Cleaning out a clothes dryer vent,18447,0.96,701,,1688460729.0,False,False,False,False,False
50,14qetu2,formuladank,/r/formuladank/comments/14qetu2/red_bull_racing_being_a_comedy_club_austria/,Manonstop,Red Bull Racing being a comedy club - Austria,4624,0.97,138,BWOAHHHHHHH ,1688476203.0,False,False,False,False,False
51,14qh0to,Jokes,/r/Jokes/comments/14qh0to/why_condoms_come_in_packs_of_3_6_and_12/,HelpingHandsUs,"Why condoms come in packs of 3, 6 and 12!",3319,0.91,157,,1688481623.0,True,False,False,False,False
52,14qj5al,Damnthatsinteresting,/r/Damnthatsinteresting/comments/14qj5al/a_baby_inside_of_kangaroo_pouch/,padmanabhapillai,A baby inside of kangaroo pouch.,6926,0.98,190,,1688486516.0,True,False,False,False,False
53,14qbkqz,Satisfyingasfuck,/r/Satisfyingasfuck/comments/14qbkqz/it_went_form_i_could_do_that_to_holy_shit_hes_good/,FirmJewelefg,"It went form I could do that to holy shit, he's good",9411,0.93,235,,1688466758.0,False,False,False,False,False
54,14qjs8q,WhitePeopleTwitter,/r/WhitePeopleTwitter/comments/14qjs8q/minnesota_makes_public_college_and_university/,seangolden06,Minnesota makes public college and university tuition free for thousands of residents.,5881,1.0,161,,1688487946.0,False,False,False,False,False
55,14qhd3q,OneOrangeBraincell,/r/OneOrangeBraincell/comments/14qhd3q/his_reaction_to_being_a_full_time_indoor_kitten/,lax048,His reaction to being a full time “indoor kitten”,3103,0.98,41,,1688482410.0,False,False,False,False,False
56,14qdhow,pcmasterrace,/r/pcmasterrace/comments/14qdhow/welp_that_is_it_for_me_then/,saberapollo,"welp, that is it for me then.",5977,0.96,377,RYZEN 5 5500 + RTX 3060 Ti,1688472500.0,False,False,False,False,False
57,14qf664,IASIP,/r/IASIP/comments/14qf664/whats_the_name_of_the_kid_who_plays_young_frank/,spewlingKing,What’s the name of the kid who plays young Frank?,4074,0.96,222,,1688477121.0,False,False,False,False,False
58,14qhvya,Eldenring,/r/Eldenring/comments/14qhvya/when_ragdolls_collide/,rebelscum591,When ragdolls collide.,2819,0.98,92,So fresh and so clean,1688483573.0,False,False,False,False,False
59,14qg907,PeterExplainsTheJoke,/r/PeterExplainsTheJoke/comments/14qg907/guys_i_dont_understand/,DeltaCantGame,"Guys, I don't understand",3629,0.97,234,,1688479752.0,False,False,False,False,False
60,14qg0lf,curb,/r/curb/comments/14qg0lf/accidental_racism/,mistermeek67,Accidental racism,3487,0.97,89,,1688479219.0,False,False,False,False,False
61,14qhmp2,PrequelMemes,/r/PrequelMemes/comments/14qhmp2/do_they_both_just_have_acrophobia_or_something/,Rithrius88,Do they both just have acrophobia or something?,2968,0.96,115,I have the high ground,1688482993.0,False,False,False,False,False
62,14qedwo,BrandNewSentence,/r/BrandNewSentence/comments/14qedwo/why_does_this_sound_like_louise_from_bobs_burgers/,vdllvu,Why does this sound like Louise from Bob's Burgers?,4486,0.97,117,,1688475074.0,False,False,False,False,False
63,14qdr74,nba,/r/nba/comments/14qdr74/sidery_the_trail_blazers_are_not_impressed_with/,hc2919,"[Sidery] The Trail Blazers are “not impressed” with the Heat’s trade package for Damian Lillard, which could lead to a deal elsewhere now, per @wojespn:",4819,0.94,1705,,1688473295.0,False,False,False,False,False
64,14qfoda,distressingmemes,/r/distressingmemes/comments/14qfoda/dont_move_dont_move_dont_move/,ListerineAfterOral,dont move dont move dont move,3921,0.95,99,☠️Not even death can save you from me☠️,1688478384.0,False,False,False,False,False
65,14qc2x5,oddlyspecific,/r/oddlyspecific/comments/14qc2x5/i_wonder_what_happened/,frenchie04103,I wonder what happened...,7482,0.97,171,,1688468332.0,False,False,False,False,False
66,14qn11c,PublicFreakout,/r/PublicFreakout/comments/14qn11c/what_threat_does_this_older_black_lady_present/,taylor212834,What threat does this older black lady present?,1448,0.95,258,,1688495440.0,True,False,False,False,False
67,14qjdsl,videos,/r/videos/comments/14qjdsl/roughly_the_first_five_fucking_seconds_of_never/,PKghost,"Roughly the first five fucking seconds of ""Never Gonna Give You Up"" is now a silent Sony Music title card that displays copyright and licensing information, essentially fucking ruining Rick Rolling",2185,0.86,113,,1688487031.0,False,1688487351.0,False,False,False
68,14qi3bf,baseball,/r/baseball/comments/14qi3bf/andrew_mccutchen_met_up_with_the_same_fans_eight/,vectorix108,Andrew McCutchen met up with the same fans eight years later!,2456,0.97,104,Texas Rangers :tex2:,1688484072.0,False,False,False,False,False
69,14qex4u,Unexpected,/r/Unexpected/comments/14qex4u/how_to_get_a_womans_attention_in_the_gym/,Heymynameisdistance,How To Get A Woman's Attention In The Gym,22844,0.84,511,,1688476447.0,False,False,False,False,True
70,14qd8yw,gaming,/r/gaming/comments/14qd8yw/this_game_seems_appropriate_for_today/,Dethproof814,This game seems appropriate for today,5077,0.86,661,,1688471792.0,False,False,False,False,False
71,14qiki1,facepalm,/r/facepalm/comments/14qiki1/god_forbid_we_let_our_children_learn_about_things/,CalmToth,God forbid we let our children learn about things that actually exist.,6045,0.98,514,,1688485203.0,False,False,False,False,False
72,14qbyx1,whenthe,/r/whenthe/comments/14qbyx1/the_fate_of_all_good_indie_games/,SirShadyVI,the fate of all good indie games,8453,0.94,511,local touhou poster (moriya shrine's #1 conspirator),1688467987.0,False,False,False,False,False
73,14qb46j,technology,/r/technology/comments/14qb46j/apple_is_reportedly_scaling_back_production_plans/,pecika,"Apple Is Reportedly Scaling Back Production Plans of Its $3,499 Vision Pro Mixed Reality Headset",6833,0.93,1417,,1688465348.0,False,False,False,False,False
74,14qbpxp,fightporn,/r/fightporn/comments/14qbpxp/drunk_man_hits_a_car_las_vegas_july_3_2023/,ScuffedA7IVphotog,"Drunk man hits a car - Las Vegas July 3, 2023",6165,0.95,559,,1688467209.0,False,False,False,False,True
75,14qjvas,Superstonk,/r/Superstonk/comments/14qjvas/opening_up_the_curiosity_of_outside_investors_and/,baseballmal21,Opening up the curiosity of outside investors and educating them in the comments.,2203,0.96,49,💻 ComputerShared 🦍,1688488155.0,False,False,False,False,False
76,14qe70g,NoStupidQuestions,/r/NoStupidQuestions/comments/14qe70g/whats_something_that_people_dont_understand_until/,Frosty-Fact21,What’s something that people don’t understand until they experience themselves?,3917,0.92,4815,,1688474562.0,False,False,False,False,False
77,14qhx93,UkraineWarVideoReport,/r/UkraineWarVideoReport/comments/14qhx93/president_zelenskys_4th_of_july_message_to/,vectorix108,President Zelensky’s 4th of July message to Americans.,2296,0.95,127,,1688483658.0,False,False,False,False,False
78,14qj2gp,Grimdank,/r/Grimdank/comments/14qj2gp/nurgle/,wafflehabitsquad,NURGLE!!,1949,0.98,69,,1688486350.0,False,False,False,False,False
79,14qgwx5,wallstreetbets,/r/wallstreetbets/comments/14qgwx5/options_level_4_granted/,rylar,options level 4 granted,2579,0.97,110,Supports a 🅱️arfield Ethnostate :Barfield:,1688481355.0,False,False,False,False,False
80,14qfrdo,diablo4,/r/diablo4/comments/14qfrdo/maximum_number_of_side_quests_reachedwhy_whats/,Moosplauze,Maximum Number of Side Quests reached....why? What's the point?,2876,0.92,560,,1688478588.0,False,False,False,False,False
81,14qczo3,inthenews,/r/inthenews/comments/14qczo3/josh_hawleys_wife_faces_calls_to_be_sanctioned/,MOONL16H777,Josh Hawley's wife faces calls to be sanctioned over Supreme Court case,4238,0.96,308,,1688470979.0,False,False,False,False,False
82,14qhnhb,awfuleverything,/r/awfuleverything/comments/14qhnhb/urghhh/,Puzzled-Star-9116,Urghhh,2310,0.97,192,,1688483034.0,False,False,False,False,False
83,14qnpha,NatureIsFuckingLit,/r/NatureIsFuckingLit/comments/14qnpha/a_snake_slithering_up_a_brick_wall/,amish_novelty,🔥 A snake slithering up a brick wall,1104,0.97,78,,1688496989.0,False,False,False,False,False
84,14qh5e8,me_irlgbt,/r/me_irlgbt/comments/14qh5e8/me_irlgbt/,TheHunter234,me_irlgbt,2354,0.98,66,Trans/Lesbian :trans-lesbian: :nonbinary:,1688481921.0,False,False,False,False,False
85,14qf6hj,anime_irl,/r/anime_irl/comments/14qf6hj/anime_irl/,Cayennesan,anime_irl,3091,0.94,94,:070:,1688477142.0,True,False,False,False,False
86,14qfzdi,MadeMeSmile,/r/MadeMeSmile/comments/14qfzdi/shelter_dog_adopted_after_500_days/,UnitedLab6476,Shelter Dog Adopted After 500 Days,7854,0.95,219,,1688479137.0,False,False,False,False,False
87,14qfn26,wholesomegreentext,/r/wholesomegreentext/comments/14qfn26/good_anon/,InterestingCharts,Good anon,2845,0.92,43,,1688478304.0,False,False,False,False,False
88,14qgded,ukraine,/r/ukraine/comments/14qgded/happy_4th_of_july_america_only_the_brave_gain/,TotalSpaceNut,"Happy 4th of July, America! Only the brave gain independence and only the best of the brave are able to pass the freedom from generation to generation. It is an honor for us to be an ally of such dream, bravery and freedom",2580,0.97,117,,1688480058.0,False,False,False,False,False
89,14qnafg,CombatFootage,/r/CombatFootage/comments/14qnafg/destruction_of_a_russian_ammunition_depot_in/,sagakino,Destruction of a russian ammunition depot in Donetsk City,1104,0.98,110,,1688496063.0,False,False,False,False,False
90,14qhuas,clevercomebacks,/r/clevercomebacks/comments/14qhuas/damn_tough_crowd_lmaooo/,1Hate17Here,Damn. Tough crowd. lmaooo,2042,0.96,67,,1688483466.0,False,False,False,False,False
91,14qg73a,nbacirclejerk,/r/nbacirclejerk/comments/14qg73a/my_911_i_have_to_listen_to_a_woman_talking/,gethechange,my 9/11 (I have to listen to a woman talking),2467,0.91,270,,1688479618.0,False,False,False,False,False
92,14ql3zf,Catswithjobs,/r/Catswithjobs/comments/14ql3zf/office_worker/,chespitv,Office worker,1360,0.99,23,,1688491005.0,False,False,False,False,False
93,14qcdxe,terriblefacebookmemes,/r/terriblefacebookmemes/comments/14qcdxe/assuming_all_women_only_get_piercings_to_attract/,brimarie03,Assuming all women only get piercings to attract a man,4804,0.88,529,,1688469206.0,False,False,False,False,False
94,14qhltf,FunnyandSad,/r/FunnyandSad/comments/14qhltf/at_least_we_got_freedom_right/,KenzoAtreides,"At least we got freedom, right?",1969,0.92,94,,1688482945.0,False,False,False,False,False
95,14qerzd,aviation,/r/aviation/comments/14qerzd/hes_behind_you/,HeavyPsychology3533,He's behind you,2838,0.98,135,,1688476066.0,False,False,False,False,False
96,14qawr0,antiwork,/r/antiwork/comments/14qawr0/remember_when_we_flooded_kelloggs_with_fake/,Effective-Curve-72,Remember when we flooded Kellogg’s with fake applications so they’d have trouble hiring scabs?,5499,0.95,461,,1688464691.0,False,1688501674.0,False,False,False
97,14qep8i,instantkarma,/r/instantkarma/comments/14qep8i/the_last_samurai/,juzlez,The Last Samurai,2898,0.96,116,,1688475869.0,False,False,False,False,False
98,14qizdd,todayilearned,/r/todayilearned/comments/14qizdd/til_that_in_the_1980s_tom_fogerty_rhythm/,hugefuckingdeal,"TIL that in the 1980s, Tom Fogerty, rhythm guitarist for Creedence Clearwater Revival, underwent back surgery, and was given a blood transfusion that was not screened for HIV causing him to become infected with the virus. He later contracted AIDS and died from tuberculosis.",3916,0.99,128,,1688486145.0,False,False,False,False,False
99,14qeahz,trees,/r/trees/comments/14qeahz/first_bong/,thisisbojack,First bong!!,2950,0.97,207,,1688474825.0,False,False,False,False,False
100,14qf1eu,ThatsInsane,/r/ThatsInsane/comments/14qf1eu/guy_rams_people_with_a_car_and_then_jumps_out_and/,bluebunnys,Guy rams people with a car and then jumps out and starts stabbing others,2726,0.94,512,,1688476766.0,True,False,False,False,False
