rank,id,subreddit,permalink,author,title,score,upvote_ratio,num_comments,author_flair_text,created_utc,over_18,edited,stickied,locked,is_original_content
1,14h4hmf,OldSchoolCool,/r/OldSchoolCool/comments/14h4hmf/in_1996_i_was_18_and_i_worked_at_a_used_cd_store/,DurantaPhant7,In 1996 I was 18 and I worked at a used CD store.,17987,0.96,1119,,1687541373.0,False,False,False,False,False
2,14h3k2n,facepalm,/r/facepalm/comments/14h3k2n/fair_enough/,Ok_Distribution1503,Fair enough,41234,0.93,2230,,1687539148.0,False,False,False,False,False
3,14h5kza,worldnews,/r/worldnews/comments/14h5kza/us_senate_proposes_that_radioactive_contamination/,VictorEmmanuelIV,US Senate proposes that radioactive contamination of NATO territory caused by Russia be considered as attack on Alliance,9682,0.97,975,,1687544072.0,False,False,False,False,False
4,14h3xii,nottheonion,/r/nottheonion/comments/14h3xii/elon_musk_and_mark_zuckerberg_agree_to_hold_cage/,Empress_of_Lucite,Elon Musk and Mark Zuckerberg agree to hold cage fight,16440,0.89,2376,,1687540028.0,False,False,False,False,False
5,14h0qbm,NonPoliticalTwitter,/r/NonPoliticalTwitter/comments/14h0qbm/couldnt_agree_more/,LowVermicelli6464,Couldnt agree more,21471,0.96,329,:blue1::blue2::1111::1112:,1687532245.0,False,False,False,False,False
6,14h3fbe,todayilearned,/r/todayilearned/comments/14h3fbe/til_that_adolf_hitler_favored_clark_gable_above/,LadyWarrior73,"TIL that Adolf Hitler favored Clark Gable above all other actors. During World War II, Hitler offered a sizable reward to anyone who could capture and bring Gable to him unscathed.",9669,0.97,372,,1687538826.0,False,False,False,False,False
7,14h249p,oddlysatisfying,/r/oddlysatisfying/comments/14h249p/fisherman_perfectly_deploying_fishnet/,yourSAS,Fisherman perfectly deploying fishnet,13480,0.95,167,,1687535623.0,False,False,False,False,False
8,14h28yf,funny,/r/funny/comments/14h28yf/dream_neighbour/,Matt_Odlum,Dream Neighbour ,10815,0.96,221,,1687535959.0,False,False,False,False,False
9,14h0i7c,nextfuckinglevel,/r/nextfuckinglevel/comments/14h0i7c/cowboy_stops_armed_robber/,Not_Arkangel,Cowboy stops armed robber,25670,0.94,1453,,1687531689.0,False,False,False,False,False
10,14h462e,news,/r/news/comments/14h462e/infowars_war_room_host_owen_shroyer_pleads_guilty/,3baechu,Infowars 'War Room' host Owen Shroyer pleads guilty to entering restricted area during Capitol riot,7456,0.96,277,,1687540598.0,False,False,False,False,False
11,14gzgcz,wholesomememes,/r/wholesomememes/comments/14gzgcz/big_w_congrats_buddy/,davrosado12,Big W congrats buddy.,29361,0.94,433,,1687529086.0,False,False,False,False,False
12,14gzvfv,BrandNewSentence,/r/BrandNewSentence/comments/14gzvfv/learn_by_example_they_say/,AdFeisty8840,Learn by example they say.,21286,0.96,875,,1687530118.0,False,False,False,False,False
13,14gzg8h,MadeMeSmile,/r/MadeMeSmile/comments/14gzg8h/excited_dog_refuses_to_be_denied_its_pool_time/,EcstaticSociety4040,Excited Dog Refuses To Be Denied Its Pool Time,24857,0.93,652,,1687529077.0,False,False,False,False,False
14,14gzayn,StarWars,/r/StarWars/comments/14gzayn/til_palpatine_actor_ian_mcdiarmid_is_actually/,imthecook1,TIL Palpatine actor Ian McDiarmid is actually younger than Harrison Ford,16172,0.96,456,,1687528740.0,False,False,False,False,False
15,14h48c7,WhitePeopleTwitter,/r/WhitePeopleTwitter/comments/14h48c7/he_is_literally_one_of_the_worst/,CrunchM,He is literally one of the worst.,6145,0.99,338,,1687540751.0,False,False,False,False,False
16,14h12md,LeopardsAteMyFace,/r/LeopardsAteMyFace/comments/14h12md/didnt_you_vote_for_this/,tokenkinesis,Didn’t you vote for this??,9860,0.96,740,,1687533037.0,False,False,False,False,False
17,14h1nlt,therewasanattempt,/r/therewasanattempt/comments/14h1nlt/to_beat_woman_in_front_of_public/,OfficerMagnate,To beat woman in front of public,10050,0.96,658,,1687534473.0,False,False,False,False,False
18,14h2ok9,pics,/r/pics/comments/14h2ok9/john_oliver_has_a_quick_tip_for_the_folks_at/,IronSentinel,John Oliver has a quick tip for the folks at /r/Videos.,7052,0.92,155,,1687536992.0,False,False,False,False,False
19,14gz2ms,PublicFreakout,/r/PublicFreakout/comments/14gz2ms/airbnb_owner_gets_attacked_after_he_confronts/,Individual-Union-258,Airbnb owner gets attacked after he confronts teens throwing a party at his home,16245,0.93,2474,,1687528140.0,False,False,False,True,False
20,14h09gv,AskReddit,/r/AskReddit/comments/14h09gv/the_loudest_voice_in_the_room_is_usually_the/,Generalmogar,“The loudest voice in the room is usually the dumbest” what an example of this you have seen?,10227,0.92,5082,,1687531063.0,False,False,False,False,False
21,14gycuc,SipsTea,/r/SipsTea/comments/14gycuc/a_gen_z_reporter/,NovelRoughx,A Gen Z Reporter,19829,0.94,475,,1687526250.0,False,False,False,False,False
22,14h2nky,ArtefactPorn,/r/ArtefactPorn/comments/14h2nky/a_very_well_preserved_3000yearold_bronze_sword/,Fuckoff555,"A very well preserved 3,000-year-old bronze sword was recently discovered in the southern Bavarian town of Nördlingen in Germany [1136x1704]",6185,0.95,250,,1687536929.0,True,False,False,False,False
23,14gzkez,memes,/r/memes/comments/14gzkez/medieval_art_is_a_gift_that_keeps_on_giving/,whatsaroni,Medieval art is a gift that keeps on giving,16555,0.94,328,,1687529374.0,False,False,False,False,False
24,14h2ik3,mildlyinfuriating,/r/mildlyinfuriating/comments/14h2ik3/every_train_has_been_cancelled_or_delayed_over/,desolate_atrium,"Every train has been cancelled or delayed over the past two weeks, now all trains and buses are cancelled, leaving me with no way home",6904,0.96,535,,1687536581.0,False,False,False,False,False
25,14h2nuu,TikTokCringe,/r/TikTokCringe/comments/14h2nuu/racist_karen_to_black_man_picking_up_his/,DrummerSteve,Racist Karen to black man picking up his daughter:“I’m white. We rule.”,6542,0.92,1072,,1687536947.0,False,False,False,False,False
26,14gwyoa,politics,/r/politics/comments/14gwyoa/trumps_tv_confessions_pave_path_to_prison_jack/,mountaintop111,Trump’s TV confessions pave path to prison: Jack Smith sends Trump his own interviews in new filing,27832,0.94,1820,,1687522318.0,False,False,False,False,False
27,14h2ye9,maybemaybemaybe,/r/maybemaybemaybe/comments/14h2ye9/maybe_maybe_maybe/,OkImprovement90,Maybe Maybe Maybe,6194,0.94,287,,1687537683.0,False,False,False,False,False
28,14h5t3l,dankmemes,/r/dankmemes/comments/14h5t3l/time_to_take_a_break/,LoveThieves,Time to take a break,4605,0.86,451,,1687544656.0,False,False,False,False,False
29,14gxq6g,technicallythetruth,/r/technicallythetruth/comments/14gxq6g/this_is_an_outstanding_move/,JasoNMas73R,This is an outstanding move 😎,30226,0.94,693,I don't know what I expected,1687524533.0,False,False,False,False,False
30,14h24bu,lotrmemes,/r/lotrmemes/comments/14h24bu/and_now_perfected/,Virtootles,And now... Perfected,6687,0.94,91,,1687535627.0,False,False,False,False,False
31,14gx8nd,BeAmazed,/r/BeAmazed/comments/14gx8nd/baby_gets_ear_cochlear_implant_and_hears_for_the/,Wololo--Wololo,Baby gets ear (cochlear) implant and hears for the first time,33654,0.92,766,,1687523119.0,False,False,False,False,False
32,14h09zp,shitposting,/r/shitposting/comments/14h09zp/glory_to_spez_please_have_sex_with_me_mr_huffman/,GreenZapZ,Glory to Spez (Please have sex with me Mr. Huffman),13452,0.94,124,:happyday: I came! :happyday:,1687531101.0,False,False,False,False,False
33,14gzlfy,AmItheAsshole,/r/AmItheAsshole/comments/14gzlfy/aita_for_kicking_my_sil_out_for_making_my_drunk/,QueasyReserve2981,AITA for kicking my SIL out for making my drunk husband feel like shit?,10469,0.93,2052,,1687529444.0,False,1687530028.0,False,False,False
34,14h1gkg,HolUp,/r/HolUp/comments/14h1gkg/insta_influence/,considerate_aaliyah,Insta influence..,7912,0.96,74,,1687533985.0,False,False,False,False,False
35,14gyf1o,antiwork,/r/antiwork/comments/14gyf1o/it_occurred_to_me_that_those_rich_people_probably/,Guerrillablackdog,"It occurred to me that those rich people probably paid much less in taxes compared to the average Joe, yet got 3 national agencies to go looking for them.",14360,0.84,1474,,1687526417.0,False,False,False,False,False
36,14h40js,rareinsults,/r/rareinsults/comments/14h40js/crimson_chin_looking_ass/,Antique_Map_1233,Crimson chin looking ass,4904,0.92,568,,1687540236.0,False,False,False,False,False
37,14h2gar,oddlyterrifying,/r/oddlyterrifying/comments/14h2gar/miss_piggy_of_the_muppet_show_makes_a_special/,doublebarreldarrel,Miss Piggy of ‘The Muppet Show’ makes a special appearance in a children’s hospital.,5434,0.96,179,,1687536424.0,False,False,False,False,False
38,14h40xt,CrazyFuckingVideos,/r/CrazyFuckingVideos/comments/14h40xt/guy_takes_his_truck_back_off_of_a_moving_tow_truck/,georgialucy,Guy takes his truck back off of a moving tow truck,3949,0.96,237,,1687540261.0,False,False,False,False,False
39,14h2s50,philadelphia,/r/philadelphia/comments/14h2s50/we_may_not_have_gotten_a_world_series_or_super/,TheHans215,"We may not have gotten a World Series or Super Bowl parade, but we got an I-95 reopening parade today!",4333,0.97,239,,1687537244.0,False,False,False,False,False
40,14h1r5x,worldnews,/r/worldnews/comments/14h1r5x/russia_is_a_cancer_that_could_destroy_the_world/,river-beaver,"Russia is a ‘cancer’ that could destroy the world, Lithuania’s first post-Soviet leader says",13556,0.93,760,,1687534716.0,False,False,False,False,False
41,14h2670,videos,/r/videos/comments/14h2670/fuck_steve_huffman_and_fuck_the_reddit_board/,grybskia,"Fuck Steve Huffman and fuck the Reddit board. Anyway, here's some drone footage that some Reddit advertisers wouldn't want to see on the front page",4847,0.92,265,,1687535758.0,False,False,False,False,False
42,14h2is8,Damnthatsinteresting,/r/Damnthatsinteresting/comments/14h2is8/transparent_piston/,b_ub_u-1,Transparent piston ,4618,0.98,88,,1687536597.0,False,False,False,False,False
43,14gwiwq,cats,/r/cats/comments/14gwiwq/give_him_everything_everything_he_wants_right_now/,zykrom,"Give him everything everything he wants, right now!",14103,0.97,350,,1687521039.0,False,False,False,False,False
44,14h2s0l,bestof,/r/bestof/comments/14h2s0l/reddit_is_killing_thirdparty_applications_and/,GodOfAtheism,Reddit is killing third-party applications (and itself). Read more in the comments.,4648,0.9,1,,1687537237.0,False,False,True,True,False
45,14gvvwx,malelivingspace,/r/malelivingspace/comments/14gvvwx/what_do_you_call_those_high_ceiling_old_warehouse/,Fit-Bird-1601,What do you call those high ceiling old warehouse type apartment that you see in movies?,16523,0.95,1681,,1687519079.0,False,False,False,False,False
46,14h06ne,facepalm,/r/facepalm/comments/14h06ne/oceangate_ceo_stockton_rush_said_in_2021_he_knew/,Maximum-Toast,OceanGate CEO Stockton Rush said in 2021 he knew he'd 'broken some rules' by making the Titanic submersible out of carbon fiber and not pure metal: 'You're remembered for the rules you break',23934,0.97,2512,,1687530869.0,False,False,False,False,False
47,14h01n9,wallstreetbets,/r/wallstreetbets/comments/14h01n9/this_fight_needs_to_happen_elon_has_size_and/,rocket6733,This fight needs to happen. Elon has size and South African but Mark has training,6028,0.94,455,,1687530533.0,False,False,False,False,False
48,14gz2ve,Catswithjobs,/r/Catswithjobs/comments/14gz2ve/the_vet/,b_ub_u-1,The vet,6814,0.97,54,,1687528156.0,False,False,False,False,False
49,14gwcyi,MurderedByWords,/r/MurderedByWords/comments/14gwcyi/call_an_ambulance_someone_was_murdered/,ThatGirl_BeWriting,Call an ambulance! Someone was murdered!,13135,0.96,320,,1687520537.0,False,False,False,False,False
50,14gxol1,OneOrangeBraincell,/r/OneOrangeBraincell/comments/14gxol1/the_brain_cell_does_not_want_to_be_disturbed/,Misguided_Society,The brain cell does not want to be disturbed,8234,0.97,152,,1687524399.0,False,False,False,False,False
51,14gvql7,PoliticalHumor,/r/PoliticalHumor/comments/14gvql7/mom_please_stop/,7dayweekendgirl,MOM. PLEASE. STOP.,11671,0.93,463,,1687518615.0,False,False,False,False,False
52,14h0ijz,NoStupidQuestions,/r/NoStupidQuestions/comments/14h0ijz/what_do_americans_who_live_in_the_suburbs_do_if/,BruhDontFuckWithMe,What do Americans who live in the suburbs do if they need something random like milk or frozen fries?,5178,0.84,4440,,1687531713.0,False,False,False,False,False
53,14h4ubw,PeterExplainsTheJoke,/r/PeterExplainsTheJoke/comments/14h4ubw/is_she_going_to_shot_him_or_what/,NorisMotor,Is she going to shot him or what,2749,0.95,112,,1687542246.0,False,False,False,False,False
54,14gyqjy,ToiletPaperUSA,/r/ToiletPaperUSA/comments/14gyqjy/cry_more/,rebelliousmuse,Cry more,5959,0.95,233,:queer-pentagram:,1687527252.0,False,False,False,False,False
55,14gw9r1,ContagiousLaughter,/r/ContagiousLaughter/comments/14gw9r1/nick_and_schmidt_interview/,RayInRed,Nick and Schmidt interview ,9528,0.96,227,,1687520264.0,False,False,False,False,False
56,14h3sg4,JustGuysBeingDudes,/r/JustGuysBeingDudes/comments/14h3sg4/the_slap_was_personal/,lordarthur77,The slap was personal ,2956,0.96,35,,1687539706.0,False,False,False,False,False
57,14h1x7r,JeffArcuri,/r/JeffArcuri/comments/14h1x7r/guy_space/,Smartastic,Guy Space,3535,0.95,92,The Short King,1687535141.0,False,False,False,False,False
58,14gx0ml,AnarchyChess,/r/AnarchyChess/comments/14gx0ml/here_we_go_again_if_you_madlads_get_32768/,Not_a_trowaway12323,"Here we go again, if you madlads get 32,768 comments I'll post again with double the amount of demented horses",12785,0.78,15228,:cutehorse:,1687522487.0,False,False,False,False,False
59,14gx1to,LifeProTips,/r/LifeProTips/comments/14gx1to/lpt_procrastination_turn_off_your_phone_now_get/,EnergyFighter,LPT: (procrastination) - Turn off your phone NOW. Get bored.,7897,0.87,515,,1687522580.0,False,False,False,False,False
60,14h1xdw,awfuleverything,/r/awfuleverything/comments/14h1xdw/why_does_someone_with_the_mind_of_a_9year_old/,Cilantro_terracotta,Why does someone with the mind of a 9-year old have a baby?…,3629,0.93,261,,1687535153.0,False,False,False,False,False
61,14gyrzz,WhitePeopleTwitter,/r/WhitePeopleTwitter/comments/14gyrzz/conservative_tears/,rebelliousmuse,Conservative Tears,20493,0.93,569,,1687527358.0,False,False,False,False,False
62,14gu66d,hmmm,/r/hmmm/comments/14gu66d/hmmm/,adamlm,hmmm,19690,0.9,316,,1687513364.0,False,False,False,False,False
63,14gvwde,comics,/r/comics/comments/14gvwde/exchange_words/,MrLovens,Exchange Words,9270,0.98,56,Mr. Lovenstein,1687519123.0,False,False,False,False,False
64,14h0mb6,pokemon,/r/pokemon/comments/14h0mb6/i_sure_hope_they_dont_add_more_eeveelutions/,ElderFoundry,I sure hope they don't add more eeveelutions anytime soon. [OC],3957,0.96,100,,1687531971.0,False,False,False,False,True
65,14h1wuk,discordVideos,/r/discordVideos/comments/14h1wuk/thats_why_those_discord_mods_never_go_outside/,Kind-Ant-2350,That's why those discord mods never go outside 😔,3694,0.94,239,,1687535116.0,False,False,False,False,False
66,14gxxxf,AnimalsBeingDerps,/r/AnimalsBeingDerps/comments/14gxxxf/my_cat_is_the_opposite_of_photogenic/,DareForNot,My cat is the opposite of photogenic,5887,0.96,69,,1687525159.0,False,False,False,False,False
67,14h4mmu,baseball,/r/baseball/comments/14h4mmu/clifford_the_reds_are_now_sold_out_for_tonight/,WhoDey42,[Clifford] The #Reds are now sold out for tonight and tomorrow against Atlanta *with the exception* of $25 standing room only tickets. The most anticipated regular season series in years has arrived in Cincinnati.,2290,0.98,351,Cincinnati Reds :cin3:,1687541715.0,False,False,False,False,False
68,14gyi5f,MaliciousCompliance,/r/MaliciousCompliance/comments/14gyi5f/coffee_karen/,javiba64,Coffee Karen,5155,0.94,292,,1687526641.0,False,False,False,False,True
69,14h2eqt,AdviceAnimals,/r/AdviceAnimals/comments/14h2eqt/ah_the_class_divide/,Davyjones274,"Ah, the class divide",3141,0.83,331,,1687536322.0,False,False,False,False,False
70,14h1g9e,formuladank,/r/formuladank/comments/14h1g9e/the_apple_doesnt_fall_far_from_the_tree/,vash___stampede,The apple doesn't fall far from the tree,3436,0.98,52,pubes 😂😂😂😂😂😂😂😂😂😂😂😂😂😂😂😂😂😂😂😂😂😂😂😂😂😂😂😂😂,1687533966.0,False,False,False,False,False
71,14gz7yg,inthenews,/r/inthenews/comments/14gz7yg/more_conservative_jury_pool_judge_signals_shell/,oliverkloezoff,“More conservative jury pool”: Judge signals she'll hold Mar-a-Lago trial in “solid Trump country”,4493,0.94,1032,,1687528521.0,False,False,False,False,False
72,14gxomd,DIY,/r/DIY/comments/14gxomd/just_finished_small_bathroom_remodel_before_after/,BulkySector5256,Just finished small bathroom remodel (before / after),5630,0.96,451,,1687524402.0,False,False,False,False,False
73,14gyi4w,Eldenring,/r/Eldenring/comments/14gyi4w/this_sub_be_like/,Fatg0d,this sub be like,5554,0.89,494,:hollowed:,1687526640.0,False,False,False,False,False
74,14h48xx,ProgrammerHumor,/r/ProgrammerHumor/comments/14h48xx/iamnotjoking/,OnderGok,iAmNotJoking,2304,0.97,345,:py::js::j:,1687540794.0,False,False,False,False,False
75,14h4m29,Justrolledintotheshop,/r/Justrolledintotheshop/comments/14h4m29/those_are_pee_pads_the_cousin_is_handicapped_and/,Titan-uranus,Those are pee pads. The cousin is handicapped and urinates in the seat while driving. His complaint? Seat malfunction. No one can get near the car without gagging.,2157,0.96,192,Certified Technician ,1687541673.0,False,False,False,False,False
76,14gudoz,NatureIsFuckingLit,/r/NatureIsFuckingLit/comments/14gudoz/robin_snatches_a_bumble_bee_flying_by_the_nest/,yourSAS,🔥 Robin snatches a bumble bee flying by the nest,11821,0.97,444,:polar-bear:,1687514127.0,False,False,False,False,False
77,14h0l9b,Tinder,/r/Tinder/comments/14h0l9b/should_i_swipe_right_ngl_im_kinda_nervous_about/,diplomatt313,Should I swipe right? Ngl I’m kinda nervous about getting… REPLACED,3544,0.97,547,,1687531899.0,False,False,False,False,False
78,14h4996,Superstonk,/r/Superstonk/comments/14h4996/deleted_due_to_title_in_typo_according_to_vickers/,ConorMcGriddle,Deleted due to title in Typo: According to Vickers Research Insiders and Retail hold an estimated 81% of GME,2583,0.97,142,,1687540815.0,False,False,False,False,False
79,14gyr73,Animemes,/r/Animemes/comments/14gyr73/life_is_not_fair_for_everyone/,Con___artist,Life is not fair for everyone,4921,0.97,282,,1687527300.0,False,False,False,False,False
80,14gthf7,meirl,/r/meirl/comments/14gthf7/me_irl/,swarley_14,Me_irl,23463,0.92,190,,1687510921.0,False,False,False,False,False
81,14h3ye5,Grimdank,/r/Grimdank/comments/14h3ye5/the_emperor_protects_by_angry_cesar/,WelcometoNightvale2,The Emperor protects by @Angry_ceSar,2224,0.98,66,,1687540089.0,False,False,False,False,False
82,14h0h5r,Wellthatsucks,/r/Wellthatsucks/comments/14h0h5r/well_that_sucks/,Special_Commercial_2,Well that sucks,3491,0.95,58,,1687531614.0,False,False,False,False,False
83,14h1x5g,ukraine,/r/ukraine/comments/14h1x5g/34yo_olha_taran_killed_in_mortar_attack_at_illich/,asseatingleech,"34yo Olha Taran killed in mortar attack at Illich Plant in Mariupol on Apr 12, 2022. Served as Sr Sgt & combat medic in 36th Marine Brigade. RIP Heroine 🇺🇦💛💙",2897,0.96,57,UK,1687535136.0,False,False,False,False,False
84,14h24uh,Overwatch,/r/Overwatch/comments/14h24uh/widowmaker_noire_skin_at_thrift_store/,miguelsuks21x,Widowmaker Noire skin at thrift store,2827,0.96,155,:Grandmaster: Grandmaster :Grandmaster:,1687535665.0,False,False,False,False,False
85,14h3k9o,OnePiece,/r/OnePiece/comments/14h3k9o/my_take_on_nefertari_vivi_3/,Desiluted,My take on Nefertari Vivi :3,2299,0.95,117,,1687539163.0,False,False,False,False,False
86,14gzj34,TwoSentenceHorror,/r/TwoSentenceHorror/comments/14gzj34/suicide_booths_have_finally_become_available_to/,Qliphort_Genius,Suicide booths have finally become available to the public.,4130,0.95,242,,1687529278.0,False,False,False,False,False
87,14gwvd1,whenthe,/r/whenthe/comments/14gwvd1/better_than_getting_heat_stroke/,Uncle_Touchy_Feely,Better than getting heat stroke 😎,8146,0.92,365,yellow like an EPIC banana ,1687522034.0,False,False,False,False,False
88,14gxt41,meme,/r/meme/comments/14gxt41/not_my_fault_that_they_are_funny_tho/,esberat,Not my fault that they are funny tho.,5858,0.95,126,,1687524769.0,False,False,False,False,False
89,14gt5e6,ImTheMainCharacter,/r/ImTheMainCharacter/comments/14gt5e6/fk_pedestrians_and_fk_your_child_im_training/,BlackmanNthrobbin,"F**k pedestrians and f**k your child, I’m training",20401,0.9,2278,,1687509682.0,False,False,False,False,False
90,14gvqj2,pcmasterrace,/r/pcmasterrace/comments/14gvqj2/ive_been_working_on_this_samurai_game_for_years/,Archive_11,I've been working on this samurai game for years. Thoughts?,8070,0.93,557,,1687518611.0,False,False,False,False,False
91,14gxfea,Genshin_Impact,/r/Genshin_Impact/comments/14gxfea/fontaine_locations_sneak_peek/,genshinimpact,Fontaine Locations Sneak Peek,6094,0.95,515,:hoyo1::hoyo2: Official,1687523666.0,False,False,False,False,False
92,14h4nts,nba,/r/nba/comments/14h4nts/atlanta_hawks_46_pick_seth_lundy_with_a_great/,pcwgussej,Atlanta Hawks #46 pick Seth Lundy with a great draft party reaction video (via @PennStateMBB),1964,0.98,115,,1687541794.0,False,False,False,False,False
93,14h02qa,politics,/r/politics/comments/14h02qa/house_freedom_caucus_might_boot_out_marjorie/,WhileFalseRepeat,House Freedom Caucus Might Boot Out Marjorie Taylor Greene: Report,7798,0.97,549,:ivoted: I voted,1687530609.0,False,False,False,False,False
94,14h0bt3,ChoosingBeggars,/r/ChoosingBeggars/comments/14h0bt3/3_months_notice/,szntix,3 months notice,3284,0.95,653,,1687531232.0,False,False,False,False,False
95,14gvs6c,AbsoluteUnits,/r/AbsoluteUnits/comments/14gvs6c/body_builders_wearing_clothes/,JoyfullyCylindri,Body Builders Wearing Clothes,7121,0.95,457,,1687518751.0,False,False,False,False,False
96,14gvm4l,nonononoyes,/r/nonononoyes/comments/14gvm4l/beast_mode_activated/,gjkg4908rfg,Beast mode activated,7082,0.96,217,,1687518234.0,False,False,False,False,False
97,14gxspg,Whatcouldgowrong,/r/Whatcouldgowrong/comments/14gxspg/404_load_securing_not_found/,oldanemia,404 Load securing not found,4719,0.96,225,,1687524738.0,False,False,False,False,False
98,14gxdqz,marvelmemes,/r/marvelmemes/comments/14gxdqz/what_if_he_chose_the_other_option/,Effective_Score_4806,What if... he chose the other option?,5519,0.96,40,Avengers,1687523530.0,False,False,False,False,False
99,14gusi0,oddlyspecific,/r/oddlyspecific/comments/14gusi0/phineas_really_knew_what_the_billionaires_were/,geodethrowaway,Phineas really knew what the billionaires were gonna do that day,9249,0.96,212,,1687515539.0,False,False,False,False,False
100,14h5zh8,aviation,/r/aviation/comments/14h5zh8/apparently_the_carbon_fiber_used_to_build_the/,Raybanned4lyfe,"Apparently the carbon fiber used to build the Titan's hull was bought by OceanGate from Boeing at a discount, because it was ‘past its shelf-life’",1547,0.98,374,,1687545094.0,False,False,False,False,False
