rank,id,subreddit,permalink,author,title,score,upvote_ratio,num_comments,author_flair_text,created_utc,over_18,edited,stickied,locked,is_original_content
1,14rn8zd,pics,/r/pics/comments/14rn8zd/the_rpics_moderators_cant_respond_to_reddit/,pics-moderator,"The /r/PICS moderators can't respond to Reddit directly, so we're surfacing a reply here.",14564,0.92,2,,1688590884.0,True,1688591280.0,True,True,False
2,14rndd1,nextfuckinglevel,/r/nextfuckinglevel/comments/14rndd1/its_an_ad_but_an_ad_for_a_really_damn_good_product/,esberat,It's an ad but an ad for a really damn good product.,11192,0.94,393,,1688591130.0,False,False,False,False,False
3,14rnhcm,facepalm,/r/facepalm/comments/14rnhcm/i_have_no_words/,TheGrimReefah,I have no words…,9365,0.97,586,,1688591386.0,False,False,False,False,False
4,14rksbn,Damnthatsinteresting,/r/Damnthatsinteresting/comments/14rksbn/special_copy_of_fahrenheit451_reveals_text_when/,jokoons25,Special copy of Fahrenheit-451 reveals text when exposed to intense heat.,17560,0.94,591,,1688585427.0,False,False,False,False,False
5,14riry5,clevercomebacks,/r/clevercomebacks/comments/14riry5/this_man_did_not_mess_around_respect/,FormalHearta,This man did not mess around. Respect.,20271,0.93,673,,1688581087.0,False,False,False,False,False
6,14rjoen,politics,/r/politics/comments/14rjoen/trump_posted_what_he_said_was_obamas_address/,keigo199013,"Trump posted what he said was Obama's address, prosecutors say. An armed man was soon arrested there",11370,0.97,946,:flag-al: Alabama,1688583024.0,False,False,False,False,False
7,14rh7mo,todayilearned,/r/todayilearned/comments/14rh7mo/til_in_2011_abercrombie_fitch_offered_mike_the/,Texas_Rockets,"TIL in 2011 Abercrombie & Fitch offered Mike ‘The Situation’ Sorrentino (from ‘Jersey Shore’) $10,000 not to wear the company's clothes because they felt it would cause “significant damage” to their image.",18564,0.96,646,,1688577772.0,True,False,False,False,False
8,14rljsi,worldnews,/r/worldnews/comments/14rljsi/prigozhin_arrives_in_st_petersburg_takes_back/,WRW_And_GB,"Prigozhin arrives in St Petersburg, takes back seized weapons",7103,0.97,823,,1688587160.0,False,False,False,False,False
9,14rgb6q,TikTokCringe,/r/TikTokCringe/comments/14rgb6q/ai_generated_joe_biden_ad_by_the_daily_show/,geo_jam,AI generated Joe Biden ad by the daily show,13891,0.94,865,,1688575894.0,False,False,False,False,False
10,14rgqhk,antiwork,/r/antiwork/comments/14rgqhk/ups_walked_from_contract_negotiations_with_the/,wahday,"UPS walked from contract negotiations with the Teamsters union yesterday... 340,000 UPS workers now set to stop work on August 1st, with 97% voting yes on union authorization to strike!",11361,0.97,640,"workers of the world, unite! ",1688576758.0,False,1688599828.0,False,False,False
11,14rel63,mildlyinfuriating,/r/mildlyinfuriating/comments/14rel63/the_waiter_charging_me_87_for_what_should_have/,thetownslore,The Waiter charging me $87 for what should have been a $7 tip despite me writing the total at the bottom ($45.23),34002,0.93,2829,,1688572327.0,False,False,False,False,False
12,14remxg,WhitePeopleTwitter,/r/WhitePeopleTwitter/comments/14remxg/why_do_so_many_americans_oppose_something_that/,TrumpterOFyvie,Why do so many Americans oppose something that will absolutely improve everyone’s quality of life?,24702,0.92,3114,,1688572420.0,False,False,False,False,False
13,14rirvx,MadeMeSmile,/r/MadeMeSmile/comments/14rirvx/genuinely_adorable_conversation/,qwbif,Genuinely adorable conversation ,8708,0.96,154,,1688581084.0,False,False,False,False,False
14,14rgnm9,Whatcouldgowrong,/r/Whatcouldgowrong/comments/14rgnm9/not_looking_before_reversing_out_of_your_driveway/,uchman365,Not looking before reversing out of your driveway ,11747,0.96,1541,,1688576595.0,False,False,False,False,False
15,14ri1gn,memes,/r/memes/comments/14ri1gn/oh_god_im_in_danger/,lukinhas_02,Oh god i'm in danger,14243,0.94,255,I touched grass,1688579533.0,False,False,False,False,False
16,14rfhvx,tumblr,/r/tumblr/comments/14rfhvx/flamingos_are/,Old_Specialist7892,Flamingos are....,13463,0.98,174,,1688574199.0,False,False,False,False,False
17,14reoiq,Unexpected,/r/Unexpected/comments/14reoiq/crazy_arms_from_hell/,Antony_2805,crazy arms from hell,26788,0.87,297,,1688572508.0,False,False,False,False,True
18,14rcvn0,oddlyterrifying,/r/oddlyterrifying/comments/14rcvn0/what_rip_current_looks_like/,zhangyuandyou,What rip current looks like,28409,0.94,871,,1688568696.0,False,False,False,False,False
19,14rg6a3,comics,/r/comics/comments/14rg6a3/invention/,JimKB,invention,8732,0.98,114,Jim Benton Cartoons,1688575596.0,False,False,False,False,False
20,14rfi8r,CrazyFuckingVideos,/r/CrazyFuckingVideos/comments/14rfi8r/here_come_the_firework_videos/,_Deerake,Here come the firework videos…,10463,0.97,919,,1688574219.0,False,False,False,False,False
21,14rdagn,oddlysatisfying,/r/oddlysatisfying/comments/14rdagn/shiba_spa_treatment/,nikamats,Shiba spa treatment,31074,0.88,566,,1688569562.0,False,False,False,False,False
22,14rd1fm,OldSchoolCool,/r/OldSchoolCool/comments/14rd1fm/the_ice_man_man_delivering_a_25lb_block_of_ice/,gegorb,"The ice man man delivering a 25lb block of ice. Photograph taken in 1928 in Houston, Texas. Circa 1928",12656,0.97,920,,1688569045.0,False,False,False,False,False
23,14rnt14,cyberpunkgame,/r/cyberpunkgame/comments/14rnt14/the_reddit_admins_have_threatened_us_demanding_we/,Tabnam,"The Reddit admins have threatened us, demanding we change back from NSFW ‘or else’",2897,0.94,328,🔥Beta Tester 🌈,1688592124.0,True,False,True,False,False
24,14rizor,meme,/r/meme/comments/14rizor/oh_grandma_what_have_you_done/,sortedlycopene849,Oh Grandma what have you done...,5952,0.94,307,,1688581542.0,False,False,False,False,False
25,14rdz9b,HolUp,/r/HolUp/comments/14rdz9b/where_can_i_find/,Year-20-20,Where can I find?,16173,0.94,621,  :q1::q2::q3::q4:,1688571041.0,False,False,False,False,False
26,14rf09x,meirl,/r/meirl/comments/14rf09x/meirl/,Jimbo072,meirl,9779,0.99,141,,1688573160.0,False,False,False,False,False
27,14rknhj,MemePiece,/r/MemePiece/comments/14rknhj/the_hygiene_issue_could_be_far_worse_than_we/,metalhiro,The hygiene issue could be far worse than we realize,4154,0.94,107,,1688585135.0,False,False,False,False,False
28,14rkgkq,doordash,/r/doordash/comments/14rkgkq/doordash_is_hiring_anybody_nowadays/,whitneychewston,Doordash is hiring anybody nowadays,4160,0.97,162,,1688584718.0,False,False,False,False,False
29,14rqkbz,nba,/r/nba/comments/14rqkbz/charania_sources_the_dallas_mavericks_san_antonio/,Professor_Finn,"[Charania] Sources: The Dallas Mavericks, San Antonio Spurs and Boston Celtics are finalizing a three-team trade: - Mavs: Grant Williams - Spurs: Reggie Bullock and an unprotected Dallas pick swap in 2030 - Celtics: Multiple second-round picks",1914,0.98,649,:phi-2: 76ers,1688598398.0,False,False,False,False,False
30,14rfmt0,therewasanattempt,/r/therewasanattempt/comments/14rfmt0/to_attempt_to_sing_chandelier_by_sia/,cloudtdaz,To attempt to sing chandelier by sia,8450,0.92,1278,,1688574462.0,False,False,False,False,False
31,14rm61q,BlackPeopleTwitter,/r/BlackPeopleTwitter/comments/14rm61q/no_choice_but_to_get_off_the_flight/,Wild-Iceberg,No choice but to get off the flight,3144,0.97,116,,1688588499.0,False,False,False,False,False
32,14rlvur,ProgrammerHumor,/r/ProgrammerHumor/comments/14rlvur/wellnamingagitbranchaftersomeoneiskindahot/,huxx__,wellNamingAGitBranchAfterSomeoneIsKindaHot,3272,0.97,141,,1688587883.0,False,False,False,False,False
33,14rj3rs,facepalm,/r/facepalm/comments/14rj3rs/now_your_own_decisions_belong_to_a_man_you_havent/,LethalAbsen,Now your own decisions belong to a man you havent met,18158,0.92,1544,,1688581782.0,False,False,False,False,False
34,14reoiz,AskReddit,/r/AskReddit/comments/14reoiz/you_accidentally_left_your_cocaine_at_the_white/,Alaskan_Lost,You accidentally left your cocaine at the White House. What do you do now?,8513,0.9,3886,,1688572509.0,False,False,False,False,False
35,14rb1f6,wholesomememes,/r/wholesomememes/comments/14rb1f6/mister_smitten/,King_Pee,Mister Smitten,21452,0.98,87,,1688564514.0,False,False,False,False,False
36,14rhl5v,lotrmemes,/r/lotrmemes/comments/14rhl5v/aita/,UltraMagat,AITA?,5394,0.97,87,,1688578543.0,False,False,False,False,False
37,14rmitv,todayilearned,/r/todayilearned/comments/14rmitv/til_two_of_kurt_cobains_closest_friends_mark/,Ainsley-Sorsby,"TIL Two of Kurt Cobain's closest friends, Mark Lanegan and Dylan Carlson credit Courtney Love with saving their lives in the years after his death. She felt he would want them to be saved and decided to support them both morally and financially so they can go to rehab and turn their lives around",6402,0.97,272,,1688589303.0,False,False,False,False,False
38,14repgk,news,/r/news/comments/14repgk/8yearold_victim_of_prank_at_target_surprised_with/,Cinnamon2017,8-year-old victim of prank at Target surprised with shopping spree,7119,0.94,707,,1688572551.0,False,False,False,False,False
39,14rilxb,LateStageCapitalism,/r/LateStageCapitalism/comments/14rilxb/times_have_changed/,bracingSqueeze491,Times have changed,4333,0.95,198,,1688580718.0,False,False,False,False,False
40,14rhtsg,BeAmazed,/r/BeAmazed/comments/14rhtsg/the_rain_and_wind_create_that_effects/,XahidX,The rain and wind create that effects.,5260,0.86,289,,1688579078.0,False,False,False,False,False
41,14rc2ns,WTF,/r/WTF/comments/14rc2ns/felon_elbows_lawyer_in_the_face_after_conviction/,JuicySpark,Felon elbows lawyer in the face after conviction.,10141,0.96,651,,1688566891.0,False,False,False,False,False
42,14ra0fy,FunnyandSad,/r/FunnyandSad/comments/14ra0fy/this_is_not_logical/,Sensitive-Jury-1456,This is not logical.,25690,0.9,1744,,1688562031.0,False,False,False,False,False
43,14rdtiu,bald,/r/bald/comments/14rdtiu/should_i_shave_my_head_once_for_all/,chozov,Should i shave my head once for all?,8769,0.92,4452,,1688570699.0,False,False,False,False,False
44,14rjyag,PoliticalHumor,/r/PoliticalHumor/comments/14rjyag/cool_story_bro/,pinkrantz,Cool story bro,3409,0.96,284,,1688583608.0,False,False,False,False,False
45,14rko3z,nextfuckinglevel,/r/nextfuckinglevel/comments/14rko3z/the_way_this_cow_secured_its_own_freedom/,Finkenn,The way this cow secured its own freedom,8275,0.98,322,,1688585172.0,False,False,False,False,False
46,14rffsz,Damnthatsinteresting,/r/Damnthatsinteresting/comments/14rffsz/jeanclaude_van_damme_in_the_original_predator/,vitoskito,"Jean-Claude Van Damme in the original Predator suit design before he was fired from the film, 1987.",36834,0.96,1287,,1688574085.0,False,False,False,False,False
47,14rhn4n,whenthe,/r/whenthe/comments/14rhn4n/one_of_my_favorite_moments/,Zavionoteryx,One of my favorite moments,5320,0.98,245,,1688578667.0,False,False,False,False,False
48,14rev2y,PeopleFuckingDying,/r/PeopleFuckingDying/comments/14rev2y/doctor_gets_brutally_assaulted_by_patient/,ultradespairthot,DoCtOr gEtS BRuTaLLY AsSaULTeD By pAtieNt,6258,0.97,61,,1688572876.0,False,False,False,False,False
49,14reesc,AITAH,/r/AITAH/comments/14reesc/aitah_for_leaving_in_the_middle_of_a_date/,TheQuietOne9891,AITAH for leaving in the middle of a date?,6660,0.92,1740,,1688571946.0,False,False,False,False,False
50,14rjgx1,Tinder,/r/Tinder/comments/14rjgx1/valid/,stibnite00,Valid?,3471,0.86,426,,1688582575.0,False,False,False,False,False
51,14rcm9b,shitposting,/r/shitposting/comments/14rcm9b/how_i_met_your_mother_praise_spez/,Top-Evidence-2807,How I met your mother (praise Spez),12177,0.94,139,,1688568155.0,False,False,True,False,False
52,14rbu25,NonPoliticalTwitter,/r/NonPoliticalTwitter/comments/14rbu25/i_guess_we_could_try/,KingFahad360,I guess we could try.,9491,0.96,484,:blue1::blue2::1111::1112:,1688566375.0,False,False,False,False,False
53,14rhwk9,Overwatch,/r/Overwatch/comments/14rhwk9/this_is_the_best_reaction_ive_gotten_to_my/,Bpdpunk,This is the best reaction I've gotten to my username so far.,3908,0.97,40,:Ana: Ana,1688579248.0,False,False,False,False,False
54,14r9lh2,technology,/r/technology/comments/14r9lh2/massive_norwegian_phosphate_rock_deposit_can_meet/,Sorin61,"Massive Norwegian phosphate rock deposit can meet fertilizer, solar, and EV battery demand for 100 years",12986,0.95,877,,1688560959.0,False,False,False,False,False
55,14rntye,PublicFreakout,/r/PublicFreakout/comments/14rntye/woman_has_a_breakdown_after_the_owner_of_the/,Kawamatsu__,woman has a breakdown after the owner of the puppies tell her not to give the puppies water ,1938,0.91,306,,1688592182.0,False,False,False,False,False
56,14rha1l,PeterExplainsTheJoke,/r/PeterExplainsTheJoke/comments/14rha1l/petah_help_i_legit_dont_get_it/,MrAlbinoNinja,Petah help I legit don't get it,4337,0.97,58,,1688577910.0,False,False,False,False,False
57,14rellz,WhitePeopleTwitter,/r/WhitePeopleTwitter/comments/14rellz/the_most_iconic_4th_of_july_anthem_is_also_the/,JediRunner13,The most Iconic 4th of July anthem is also the most ironic,22886,0.97,721,,1688572348.0,False,False,False,False,False
58,14rb5i1,horror,/r/horror/comments/14rb5i1/simon_pegg_says_people_dont_fcking_need_shaun_of/,Neo2199,Simon Pegg Says People Don’t ‘F*cking Need’ ‘Shaun of the Dead 2:’ ‘Move On’,8475,0.96,754,,1688564779.0,False,False,False,False,False
59,14rl0jt,Spiderman,/r/Spiderman/comments/14rl0jt/get_back_here_shocker/,dazli69,GET BACK HERE SHOCKER!,2549,0.96,122,,1688585958.0,False,False,False,False,False
60,14ro0w9,inthenews,/r/inthenews/comments/14ro0w9/rapist_of_10yearold_girl_who_traveled_to_indiana/,YokedMF,Rapist of 10-year-old girl who traveled to Indiana for abortion gets 25 years in prison,1794,0.98,194,,1688592625.0,False,False,False,False,False
61,14rb6my,BrandNewSentence,/r/BrandNewSentence/comments/14rb6my/good_lord/,TicTacTax2007,Good lord,9924,0.95,425,,1688564861.0,False,False,False,False,False
62,14ra9v3,iamatotalpieceofshit,/r/iamatotalpieceofshit/comments/14ra9v3/girl_pretends_to_clean_up_a_beach_for_her_social/,kakapoopoopeepeeshir,Girl pretends to clean up a beach for her social media content then proceeds to leave the trash bags on the beach. ,11158,0.97,540,,1688562682.0,False,False,False,True,False
63,14rbfh2,me_irlgbt,/r/me_irlgbt/comments/14rbfh2/me_irlgbt/,Sonic_the_hedgedog,me_irlgbt,9790,0.93,77,MLM/Ace :mlm_ace:,1688565451.0,False,False,False,False,False
64,14rkjob,unpopularopinion,/r/unpopularopinion/comments/14rkjob/having_a_spouse_who_is_naked_all_the_time_is_not/,bogus_gasman2,Having a spouse who is naked all the time is not as great as it sounds.,2703,0.84,892,,1688584909.0,False,False,False,False,False
65,14rn7s5,Superstonk,/r/Superstonk/comments/14rn7s5/todays_news_about_mainstar_sending_drs_shares/,RAMBO_JESUS,Today's news about mainstar sending DRS shares back to the DTCC should be a wake up call. These people are doing everything in their power to stop DRS.,2211,0.97,110,🦍 Attempt Vote 💯,1688590824.0,False,False,False,False,False
66,14rhqb2,gaming,/r/gaming/comments/14rhqb2/battlebit_the_overnight_success_six_years_in_the/,Spadical,"Battlebit, the overnight success six years in the making, has sold just shy of two million in two weeks",3382,0.96,359,,1688578863.0,False,False,False,False,False
67,14rb75o,insanepeoplefacebook,/r/insanepeoplefacebook/comments/14rb75o/literally_1984_but_like_unironically_said/,velduz,Literally 1984 but like unironically said.,8248,0.96,399,,1688564898.0,False,False,False,False,False
68,14rga31,3Dprinting,/r/3Dprinting/comments/14rga31/triggering_lego_fans/,Bulky_Association229,Triggering Lego Fans,3773,0.94,134,,1688575832.0,False,False,False,False,False
69,14rgu9j,dankmemes,/r/dankmemes/comments/14rgu9j/thomas_sowell_approved/,Naturally_Fragrant,Thomas Sowell approved,4082,0.94,247,,1688576993.0,False,False,False,False,False
70,14rk3vs,TwoXChromosomes,/r/TwoXChromosomes/comments/14rk3vs/ohio_abortion_rights_backers_submit_nearly_double/,rpaul9578,Ohio abortion rights backers submit nearly double needed signatures for fall ballot measure,2352,0.97,52,,1688583923.0,False,False,False,False,False
71,14rkevf,tumblr,/r/tumblr/comments/14rkevf/death_note/,Darkshreaders3,Death note,5749,0.98,86,,1688584609.0,False,False,False,False,False
72,14re3r9,sadcringe,/r/sadcringe/comments/14re3r9/this_is_tragic/,sumit131995,This is tragic ,4774,0.96,139,,1688571310.0,False,False,False,False,False
73,14rk1nz,LeopardsAteMyFace,/r/LeopardsAteMyFace/comments/14rk1nz/donald_trump_jr_had_sex_with_her_in_gay_club/,wdcmsnbcgay,"Donald Trump Jr. Had Sex With Her in Gay Club, Claims Pop Star Aubrey O'Day",2249,0.94,197,,1688583790.0,False,False,False,False,False
74,14rivsv,calvinandhobbes,/r/calvinandhobbes/comments/14rivsv/happy_birthday_mr_bill_watterson/,damagedgoodz99824,Happy Birthday Mr. Bill Watterson!,2562,0.98,59,,1688581320.0,False,False,False,False,False
75,14r7fs6,aww,/r/aww/comments/14r7fs6/john_oliver_says_that_continuing_to_use_a_website/,NotDavid-Jatt,"John Oliver says that continuing to use a website that you're ""protesting"" isn't really a protest.",24396,0.83,1442,,1688554860.0,False,False,False,False,False
76,14rai80,science,/r/science/comments/14rai80/fewer_teens_now_perceive_themselves_as_overweight/,MotherHolle,"Fewer teens now perceive themselves as overweight, according to international study of more than 745,000 adolescents. On weight: ""The increase in underestimation might be a sign for the need for interventions to strengthen correct weight perception,"" said the authors.",7118,0.92,1331,MA | Criminal Justice | MS | Psychology,1688563233.0,False,False,False,False,False
77,14ro2ax,maybemaybemaybe,/r/maybemaybemaybe/comments/14ro2ax/maybe_maybe_maybe/,RespectMyAuthoriteh,Maybe Maybe Maybe,1414,0.91,203,,1688592713.0,False,False,False,False,False
78,14rildy,projectzomboid,/r/projectzomboid/comments/14rildy/im_the_low_population_guy/,Toxi300,I’m the low population guy,2598,0.96,164,,1688580682.0,False,False,False,False,False
79,14rkin0,Hololive,/r/Hololive/comments/14rkin0/mumei_and_kronii_are_not_letting_irys_sleep/,Anyacchi,Mumei and Kronii are not letting IRyS sleep,2085,0.95,42,:Mumei::Pekora::Marine::Pekora::Kronii:,1688584842.0,True,False,False,False,False
80,14rfb6g,nonononoyes,/r/nonononoyes/comments/14rfb6g/you_almost_a_biker_sandwich/,Tantofaz101,You almost a biker sandwich.,3701,0.95,334,,1688573833.0,False,False,False,False,False
81,14rj522,Animemes,/r/Animemes/comments/14rj522/aquas_gif/,NationalStrategy,Aqua's GIF,2442,0.97,43,,1688581858.0,False,False,False,False,False
82,14rb7ny,HonkaiStarRail,/r/HonkaiStarRail/comments/14rb7ny/basically_the_great_aeons/,AsaCocoPeko,Basically the Great Aeons,8225,0.94,248,All Hail the Master Diviner :Fuxuan:,1688564937.0,False,False,False,False,False
83,14rjrxl,NatureIsFuckingLit,/r/NatureIsFuckingLit/comments/14rjrxl/female_leopard_wakes_up_male_only_to_seek/,peenutbuttherNjelly,🔥🔥 Female leopard wakes up male only to seek attention ,2206,0.94,222,,1688583221.0,False,False,False,False,False
84,14ra6n4,PrequelMemes,/r/PrequelMemes/comments/14ra6n4/you_remember_of_me/,seguace_di_hog_rider,You Remember of me,8496,0.97,95,#1 Jar Jar fan,1688562456.0,False,False,False,False,False
85,14rkuwh,4chan,/r/4chan/comments/14rkuwh/therapy_session/,Dychab100,Therapy session,1921,0.97,40,/b/tard,1688585587.0,False,False,False,False,False
86,14rnjey,PoliticalCompassMemes,/r/PoliticalCompassMemes/comments/14rnjey/alternate_headline_companies_protect_themselves/,atheisteaster,Alternate Headline: “Companies protect themselves from future litigation”,1410,0.93,233,:libright: - Lib-Right,1688591514.0,False,False,False,False,False
87,14r9wg2,MaliciousCompliance,/r/MaliciousCompliance/comments/14r9wg2/management_thought_they_didnt_need_me_turns_out/,Hot-Wallaby-6402,"Management thought they didn't need me, turns out they decided to try and sue me",7332,0.96,199,,1688561728.0,False,False,False,False,True
88,14rkyzd,DesignPorn,/r/DesignPorn/comments/14rkyzd/this_customizable_table_lamp/,ExhilaratedFo,This Customizable Table Lamp,1874,0.94,77,,1688585853.0,False,False,False,False,False
89,14rfzzr,worldnews,/r/worldnews/comments/14rfzzr/macrons_call_to_cut_off_social_media_during_riots/,DoremusJessup,Macron's call to 'cut off' social media during riots sparks backlash in France,7688,0.97,633,,1688575223.0,False,False,False,False,False
90,14rbq9u,197,/r/197/comments/14rbq9u/rule/,moitso,Rule?,6100,0.97,94,,1688566134.0,False,False,False,False,False
91,14rmey8,Grimdank,/r/Grimdank/comments/14rmey8/literally_had_this_interaction_today/,brokensilence32,Literally had this interaction today.,1551,0.98,179,Depressed Death Guard,1688589046.0,False,False,False,False,False
92,14rctss,mildlyinfuriating,/r/mildlyinfuriating/comments/14rctss/the_little_free_library_i_jog_past_every_morning/,Dahlinluv,The Little Free Library I jog past every morning was destroyed,16363,0.98,1206,,1688568594.0,False,False,False,False,False
93,14rcjv1,OnePunchMan,/r/OnePunchMan/comments/14rcjv1/battle_of_the_brainrot/,GodNonon,Battle of the Brainrot,5024,0.96,158,Nonon One Punches Saitama,1688568008.0,False,False,False,False,False
94,14rdtbi,StupidFood,/r/StupidFood/comments/14rdtbi/who_tf_orders_this/,IowaPineapple,Who TF orders this? ,4152,0.93,720,,1688570687.0,False,False,False,False,False
95,14rlfoa,sadposting,/r/sadposting/comments/14rlfoa/real/,NBGamingH7,Real,1725,0.95,81,,1688586907.0,False,False,False,False,False
96,14retwb,TheRightCantMeme,/r/TheRightCantMeme/comments/14retwb/doesnt_even_bother_hiding_it/,NoLawsNoGoverrnment,Doesn't even bother hiding it,3627,0.95,106,,1688572811.0,False,False,False,False,False
97,14rdnb2,Bossfight,/r/Bossfight/comments/14rdnb2/paul_the_undefeatable/,PritoriusSalvage,PAUL THE UNDEFEATABLE,4251,0.97,142,,1688570342.0,False,False,False,False,False
98,14rghqk,Rabbits,/r/Rabbits/comments/14rghqk/is_she_okay_not_sure_if_the_twitch_is_a_normal/,blutari,Is she okay? Not sure if the twitch is a normal binky or not. New bun owner and still getting to know her 🥺,2930,0.98,139,,1688576265.0,False,False,False,False,False
99,14raash,diablo4,/r/diablo4/comments/14raash/why_30_persons_in_this_sub_always_trying_to/,lionblackwood,Why 30+ persons in this sub always trying to mention their age?,7310,0.8,3280,,1688562751.0,False,False,False,False,False
100,14rdwmu,19684,/r/19684/comments/14rdwmu/rule/,Zathar4,Rule,4134,0.96,91,,1688570884.0,False,False,False,False,False
