rank,id,subreddit,permalink,author,title,score,upvote_ratio,num_comments,author_flair_text,created_utc,over_18,edited,stickied,locked,is_original_content
1,14hiw0j,worldnews,/r/worldnews/comments/14hiw0j/wagner_boss_says_hes_en_route_to_moscow_and_ready/,GeoPoliticsMyThang11,"Wagner Boss Says He’s En Route to Moscow and ‘Ready to Die’ With 25,000 Fighters",18751,0.97,2257,,1687579595.0,False,False,False,False,False
2,14hgqwv,WhitePeopleTwitter,/r/WhitePeopleTwitter/comments/14hgqwv/looks_like_a_coup_is_happening_in_russia/,seangolden06,Looks like a coup is happening in Russia,24048,0.96,1071,,1687573024.0,False,False,False,False,False
3,14hff09,facepalm,/r/facepalm/comments/14hff09/oceangate_ceo_stockton_rush_email_exchange_with/,Dapper_Commission915,OceanGate CEO Stockton Rush email exchange with Submersible Operations Expert (Rob McCallum),49422,0.97,3071,,1687569043.0,False,False,False,False,False
4,14hhe0v,politics,/r/politics/comments/14hhe0v/us_says_wagner_coup_is_real_and_serious_as_white/,Haltopen,US says Wagner coup is ‘real’ and ‘serious’ as White House consults allies,10476,0.98,1445,:flag-ma: Massachusetts,1687574951.0,False,False,False,False,False
5,14hhrb8,gaming,/r/gaming/comments/14hhrb8/the_elder_scrolls_6_is_still_5_to_6_years_away/,blackwolf57,The Elder Scrolls 6 is still 5 to 6 years away and it is not yet decided if there will be a PlayStation version. Mentioned by Phil Spencer during the FTC trial.,8575,0.96,1495,,1687576051.0,False,False,False,False,False
6,14hgoid,cats,/r/cats/comments/14hgoid/the_black_one_ran_away_for_2_days_and_the_fat_one/,Basil_Minimum,The black one ran away for 2 days and the fat one did this as soon as she came home … why?,9862,0.97,428,,1687572829.0,False,False,False,False,False
7,14hdebp,mildlyinfuriating,/r/mildlyinfuriating/comments/14hdebp/airbnb_host_tried_to_charge_us_for_changing/,ViberNaut,Airbnb host tried to charge us for changing settings on a thermostat,29914,0.95,1737,,1687563503.0,False,False,False,False,False
8,14hh824,TikTokCringe,/r/TikTokCringe/comments/14hh824/he_crushed_this_explanation/,Snoo-33732,He crushed this explanation 🌊,7474,0.96,349,,1687574469.0,False,False,False,False,False
9,14hdohd,news,/r/news/comments/14hdohd/iowa_meteorologist_chris_gloninger_quits_18year/,Steel9966,Iowa meteorologist Chris Gloninger quits 18-year career after death threat over climate coverage,17395,0.95,652,,1687564255.0,False,False,False,False,False
10,14hg793,CombatFootage,/r/CombatFootage/comments/14hg793/pmc_wagner_convoy_driving_around_a_road_block_in/,klas228,PMC Wagner Convoy driving around a road block in Rostov,7891,0.97,717,,1687571414.0,False,False,False,False,False
11,14hdunm,wallstreetbets,/r/wallstreetbets/comments/14hdunm/choose_your_fighter/,QuirkyAverageJoe,Choose Your Fighter 🚨,15633,0.93,1546,,1687564725.0,False,False,False,False,False
12,14hi2o1,wholesomememes,/r/wholesomememes/comments/14hi2o1/no_matter_are_you_deaf_or_not/,MrArsikk,No matter are you deaf or not!,6004,0.97,150,,1687577014.0,False,False,False,False,False
13,14hi1jp,nextfuckinglevel,/r/nextfuckinglevel/comments/14hi1jp/unique_serving_way_in_a_restaurant/,amit-gautam,Unique serving way in a restaurant ,5958,0.9,461,,1687576916.0,False,False,False,False,False
14,14hcyxn,oddlysatisfying,/r/oddlysatisfying/comments/14hcyxn/cutting_polymer_clay_and_reshaping/,Gh0stDestr0y,Cutting polymer clay and reshaping,23208,0.94,134,Flair Loading...,1687562367.0,False,False,False,False,False
15,14hhmi7,todayilearned,/r/todayilearned/comments/14hhmi7/til_the_founders_of_outback_steakhouse/,helpmeredditimbored,"TIL the founders of Outback Steakhouse intentionally decided not to visit Australia, as they were concerned that having too much authenticity would confuse customers",5328,0.97,408,,1687575661.0,False,False,False,False,False
16,14hf6k3,baseball,/r/baseball/comments/14hf6k3/de_la_cruz_triples_to_complete_the_cycle/,carlsaganfedoraswag,De La Cruz triples to complete the cycle,8074,0.95,975,Cincinnati Reds :cin3:,1687568403.0,False,False,False,False,False
17,14hey3x,UkraineWarVideoReport,/r/UkraineWarVideoReport/comments/14hey3x/alleged_firefight_on_m4_highway_outside_of_rostov/,Demither10,Alleged Firefight on M4 Highway outside of Rostov between Wagner fighters and Russian National Guard,8325,0.97,782,,1687567730.0,False,False,False,False,False
18,14hcs15,OldSchoolCool,/r/OldSchoolCool/comments/14hcs15/my_parents_at_prom_in_the_80s/,ScallionMaximum234,My parents at prom in the 80s,11499,0.95,895,,1687561868.0,False,False,False,False,False
19,14himhl,shittymoviedetails,/r/shittymoviedetails/comments/14himhl/elemental_2023_is_doing_so_badly_in_the_box/,CoolJoshido,"Elemental (2023) is doing so badly in the Box Office, Pixar has resorted to making fake audience reactions with a fake camrip to promote it. This is cringe™️. ",4004,0.96,228,,1687578771.0,False,False,False,False,False
20,14hdn9g,AskReddit,/r/AskReddit/comments/14hdn9g/which_celebrity_gives_off_vibes_that_they_have/,GreenerPeach01,"Which celebrity gives off vibes that they have committed crimes but keep getting away with it, and you're just waiting for them to get officially caught/charged?",9962,0.9,6445,,1687564168.0,True,False,False,False,False
21,14he8d4,inthenews,/r/inthenews/comments/14he8d4/wagner_chief_prigozhin_marches_his_troops_into/,AuthorTomFrost,"Wagner chief Prigozhin marches his troops into Russia, declares war on Russian military leadership, says ‘we will destroy everything’",7516,0.97,944,,1687565742.0,False,False,False,False,False
22,14hclbk,OneOrangeBraincell,/r/OneOrangeBraincell/comments/14hclbk/brain_cell_malfunctioned_floof_belly_defenses_are/,LeninaCrowneIn2020,Brain cell malfunctioned. Floof belly defenses are down. Now's my chance to touch the floof.,10390,0.97,133,,1687561376.0,False,False,False,False,False
23,14hjtxd,WTF,/r/WTF/comments/14hjtxd/splitted/,yudoit,Splitted,2714,0.94,263,,1687582658.0,False,False,False,False,False
24,14h9sca,MadeMeSmile,/r/MadeMeSmile/comments/14h9sca/weather_reporters_fun_idea_to_dress_up_as_cloud/,astralrig96,Weather reporter’s fun idea to dress up as cloud!,24595,0.96,180,,1687554347.0,False,False,False,False,False
25,14hgpwd,PublicFreakout,/r/PublicFreakout/comments/14hgpwd/the_wagner_pmc_has_now_mutinied_en_masse_tanks/,LouisSaintJust1789,The Wagner PMC has now mutinied en masse. Tanks have surrounded the Defence Ministry building in Rostov-on-Don,4505,0.98,253,,1687572939.0,False,False,False,False,False
26,14hc63t,shitposting,/r/shitposting/comments/14hc63t/that_thousand_yard_stare_worship_spez/,Hondipo,That thousand yard stare | Worship Spez,20179,0.95,296,,1687560281.0,False,False,False,False,False
27,14hbtt2,Damnthatsinteresting,/r/Damnthatsinteresting/comments/14hbtt2/watch_jack_nicholson_get_into_character_for_the/,bindukwe,Watch Jack Nicholson get into character for The Shining,15867,0.97,271,,1687559392.0,False,False,False,False,False
28,14hhhkv,unpopularopinion,/r/unpopularopinion/comments/14hhhkv/the_most_comfortable_clothing_to_sleep_in_is/,teaspoon96atl,The most comfortable clothing to sleep in is stiff jeans,3954,0.87,561,,1687575243.0,False,False,False,False,False
29,14hetqe,HolUp,/r/HolUp/comments/14hetqe/happy_drum_noises/,esberat,*Happy drum noises*,7116,0.98,49,:zfg1::zfg2::zfg3::zfg4:,1687567392.0,False,False,False,False,False
30,14hgkt7,ThatsInsane,/r/ThatsInsane/comments/14hgkt7/civil_war_has_begun_in_russia_tonight_reports_of/,ResJustRes,"Civil war has begun in Russia, tonight reports of 25k Wagner mercs on route to Moscow, FSB trying to stop them in Rostov",4332,0.96,367,,1687572533.0,False,False,False,False,False
31,14hfvwb,antiwork,/r/antiwork/comments/14hfvwb/down_with_the_system/,Fluid_Bad_1340,Down with the system,4625,0.98,108,,1687570446.0,False,False,False,False,False
32,14h90f5,LateStageCapitalism,/r/LateStageCapitalism/comments/14h90f5/if_youre_not_trying_to_save_only_rich_parasites/,ADignifiedLife,"If you're not trying to save only rich parasites, you'll get punished for it. Bizarro world!!",19489,0.92,455,Basic human needs shouldn't be commodified ,1687552512.0,False,False,False,True,False
33,14h9d8q,WorkReform,/r/WorkReform/comments/14h9d8q/you_get_taxed_on_everything_here/,CapableSwordfishs,You get taxed on everything here,15345,0.96,432,,1687553376.0,False,False,False,False,False
34,14hew78,awfuleverything,/r/awfuleverything/comments/14hew78/negligent_parents_and_the_horrific_consequences/,Alien__Yes,Negligent parents and the horrific consequences,5797,0.97,383,,1687567578.0,False,False,False,False,False
35,14ha1lb,me_irlgbt,/r/me_irlgbt/comments/14ha1lb/me_irlgbt/,Murky_Height_4407,me_irlgbt,14591,0.93,138,,1687554974.0,True,False,False,False,False
36,14hgoc4,nba,/r/nba/comments/14hgoc4/kevin_durant_hops_into_a_twitter_space_called_kd/,IMKudaimi123,Kevin Durant hops into a Twitter space called “KD is not top 5”,3829,0.96,546,:chi-2: Bulls,1687572814.0,False,1687573775.0,False,False,False
37,14hibws,dankmemes,/r/dankmemes/comments/14hibws/submarine_is_old_news_new_wagner_album_just/,PicklesTheHamster,"Submarine is old news, new Wagner album just dropped.",2936,0.98,46,,1687577832.0,False,False,False,False,False
38,14hdl0g,comics,/r/comics/comments/14hdl0g/sonic_adventure_swipe/,LastPlaceComics,Sonic Adventure ( SWIPE ---> ),6184,0.95,80,,1687563999.0,False,False,False,False,False
39,14h7ru1,StupidFood,/r/StupidFood/comments/14h7ru1/petition_to_make_fake_salt_bae_the_avatar_of/,emoteriyaki,Petition to make FAKE Salt Bae the avatar of stupid food,25530,0.91,591,,1687549502.0,False,False,False,False,False
40,14he8ed,ukraine,/r/ukraine/comments/14he8ed/lets_not_forget_the_price_of_freedom_anton/,Lysychka-,"Let's not forget the price of freedom: Anton Prasolenko, He played in the theater, loved life, lived next to us, and died for us in Bakhmut.",5015,0.97,57,Скажи паляниця,1687565744.0,False,False,False,False,False
41,14hh5fz,marvelstudios,/r/marvelstudios/comments/14hh5fz/logan_director_james_mangold_wishes_wolverine/,Louis_DCVN,"LOGAN director James Mangold wishes Wolverine wasn't in DEADPOOL 3 but he isn't surprised: ""There was always going to be another Wolverine ... As much liquid as they can squeeze out of that rag, they're going to try to""",3098,0.91,317,,1687574252.0,False,False,False,False,False
42,14hefgt,animememes,/r/animememes/comments/14hefgt/love_him_or_hate_him_but_you_have_to_admit_that/,Con___artist,Love him or hate him but you have to admit that he is a true King,5601,0.94,131,,1687566284.0,False,False,False,False,False
43,14hgg1j,IASIP,/r/IASIP/comments/14hgg1j/the_show_needs_to_bring_back_the_only_person_who/,columbo928s4,The show needs to bring back the only person who ever understood Dennis...,3365,0.95,167,,1687572136.0,False,False,False,False,False
44,14hdae6,AccidentalAlly,/r/AccidentalAlly/comments/14hdae6/bro_turned_him_amab/,WestCountryGayBoy,Bro turned him amab,5912,0.95,114,,1687563202.0,False,False,False,False,False
45,14he2fs,memes,/r/memes/comments/14he2fs/another_medieval_loophole_to_add_to_the_collection/,Significant_Toe277,Another medieval loophole to add to the collection,6611,0.95,108,,1687565276.0,False,False,False,False,False
46,14hbqan,therewasanattempt,/r/therewasanattempt/comments/14hbqan/to_sunbath_in_peace/,ilovekerma,To sunbath in peace.,7721,0.96,829,,1687559142.0,False,False,False,False,False
47,14hh8en,UkrainianConflict,/r/UkrainianConflict/comments/14hh8en/wagner_coup_us_says_situation_is_serious_as_white/,ByeLassMyLove,Wagner coup: US says situation is ‘serious’ as White House consults allies,2858,0.98,429,,1687574496.0,False,False,False,False,False
48,14h8o7c,popculturechat,/r/popculturechat/comments/14h8o7c/im_sick_of_lusting_after_pricks_and_cheaters_so/,pannonica,"I'm sick of lusting after pricks and cheaters, so let's DO THIS: who's your favorite *non-problematic* man in entertainment?",15319,0.86,2497,,1687551674.0,False,False,False,True,False
49,14hd9kv,fightporn,/r/fightporn/comments/14hd9kv/rollin_40s_crip_protects_a_student_getting_jumped/,dupey69,Rollin 40’s crip protects a student getting jumped,5436,0.95,354,,1687563140.0,False,False,False,False,False
50,14hdt7r,AmItheAsshole,/r/AmItheAsshole/comments/14hdt7r/aita_for_kicking_the_majority_of_my_husbands/,snoopgoop7,AITA for kicking the majority of my husbands family out of our wedding when they celebrated their traditions but violated many of my personal rules and boundaries?,5176,0.96,686,,1687564607.0,False,1687573383.0,False,False,False
51,14hj2ff,funny,/r/funny/comments/14hj2ff/this_new_version_of_water_hit_the_streets/,car0003,This new version of water hit the streets.,2065,0.85,326,,1687580148.0,False,False,False,False,False
52,14hczx4,worldnews,/r/worldnews/comments/14hczx4/wagner_mercenary_chief_calls_for_armed_rebellion/,GiantSalt95,Wagner mercenary chief calls for armed rebellion against Russian military leadership,38528,0.96,2722,,1687562437.0,False,False,False,False,False
53,14hfs5y,shittytattoos,/r/shittytattoos/comments/14hfs5y/this_poor_soul_knell_for_the_cross/,Hammy-Cheeks,This poor soul. Knell for the cross....,3601,0.94,514,,1687570142.0,False,False,False,False,False
54,14hdxyd,MurderedByWords,/r/MurderedByWords/comments/14hdxyd/both_silenced_and_debate_me_crowd/,whenitpours3,Both Silenced and Debate Me Crowd,4722,0.96,106,,1687564944.0,False,False,False,False,False
55,14hg2dx,Hololive,/r/Hololive/comments/14hg2dx/cant_belive_she_really_said/,Madraccy,Can't belive she really said 🙂,3467,0.94,42,,1687570994.0,False,False,False,False,False
56,14hexfn,lotrmemes,/r/lotrmemes/comments/14hexfn/no_better_way_to_spend_friday_night_alone/,OsjosisMoans,No better way to spend Friday night alone,3977,0.97,197,,1687567676.0,False,False,False,False,False
57,14h8sg7,CrazyFuckingVideos,/r/CrazyFuckingVideos/comments/14h8sg7/he_got_him/,Mirror24568,He got him,11633,0.96,283,,1687551960.0,False,False,False,False,False
58,14hlkix,de,/r/de/comments/14hlkix/was_ist_eben_passiert/,Faehr_Vieh_Fass,Was ist eben passiert?,1267,0.97,130,,1687588549.0,True,False,False,False,False
59,14hdma6,WhitePeopleTwitter,/r/WhitePeopleTwitter/comments/14hdma6/900_miles_10_minute_charge_rip_tesla/,KyloRenKardashian,"+900 miles, 10 minute charge. RiP tEsla",24139,0.93,1484,,1687564092.0,False,False,False,False,False
60,14hdc2r,BrandNewSentence,/r/BrandNewSentence/comments/14hdc2r/team_congee_masterrace/,innvme,Team Congee Masterrace,5002,0.98,40,,1687563334.0,False,False,False,False,False
61,14hcv7w,technicallythetruth,/r/technicallythetruth/comments/14hcv7w/never_asking_my_friend_for_advice_again/,Terryblepun,Never asking my friend for advice again,5581,0.98,37,,1687562100.0,False,False,False,False,False
62,14hb8dd,Eyebleach,/r/Eyebleach/comments/14hb8dd/aint_she_precious/,Pretty_Average-,Ain’t she precious,6628,0.97,48,,1687557904.0,False,False,False,False,False
63,14hf3c2,discordVideos,/r/discordVideos/comments/14hf3c2/someone_know_the_song/,Dramatic_Gap_6177,someone know the song?,4195,0.9,390,,1687568142.0,True,False,False,False,False
64,14heui8,TheLastAirbender,/r/TheLastAirbender/comments/14heui8/katara_in_air_nomad_outfit_by_hrlshnv/,asilvertintedrose,Katara in Air Nomad outfit [By @hrlshnv],3781,0.96,75,,1687567455.0,False,False,False,False,False
65,14hgxv5,facepalm,/r/facepalm/comments/14hgxv5/the_go_woke_go_broke_crowd_turned_a_mexican/,Mr__O__,The ‘go woke go broke’ crowd turned a Mexican import beer into the top US beer,9962,0.89,1698,,1687573617.0,False,False,False,False,False
66,14hiw73,Breath_of_the_Wild,/r/Breath_of_the_Wild/comments/14hiw73/my_game_has_a_lot_of_unloaded_textures_apparently/,kyxst,My game has a lot of unloaded textures apparently. So here's a rainbow lynel.,1961,0.98,87,,1687579612.0,False,False,False,False,False
67,14he7jv,terriblefacebookmemes,/r/terriblefacebookmemes/comments/14he7jv/special_of_the_day_i_guess/,Texgymratdad,Special of the day I guess,4220,0.9,249,,1687565675.0,True,False,False,False,False
68,14h8994,oddlyterrifying,/r/oddlyterrifying/comments/14h8994/former_nba_player_manute_bol_height_77_swimming/,AccomplishedBig7666,Former NBA player Manute Bol height 7’7 swimming in a pool in first pic (1987),14321,0.95,413,,1687550666.0,False,False,False,False,False
69,14hclkc,BeAmazed,/r/BeAmazed/comments/14hclkc/at_103_years_old_this_woman_has_been_lobstering/,KimCureAll,"At 103 years old, this woman has been lobstering for 95 years",5035,0.94,194,,1687561391.0,False,False,False,False,False
70,14hjske,HonkaiStarRail,/r/HonkaiStarRail/comments/14hjske/i_swear_sampo_is_like_the_most_divisive_character/,ScarHydreigon87,I swear Sampo is like the most divisive character among the fandom,1605,0.95,97,,1687582527.0,False,False,False,False,False
71,14hax9s,instantkarma,/r/instantkarma/comments/14hax9s/random_public_beatdown_for_beating_woman_x/,Fayiette,Random Public Beatdown for beating woman :x,7141,0.94,221,,1687557129.0,True,False,False,False,False
72,14heqga,nope,/r/nope/comments/14heqga/okay_bye/,jedisk8er945,"Okay, bye…",3601,0.99,196,,1687567137.0,False,False,False,False,False
73,14hbqfv,politics,/r/politics/comments/14hbqfv/federal_court_halts_floridas_drag_ban_calling_it/,theindependentonline,"Federal court halts Florida’s drag ban, calling it attempt to ‘suppress the speech’ rights of performers",39852,0.94,869,The Independent,1687559153.0,False,False,False,False,False
74,14h5zh8,aviation,/r/aviation/comments/14h5zh8/apparently_the_carbon_fiber_used_to_build_the/,Raybanned4lyfe,"Apparently the carbon fiber used to build the Titan's hull was bought by OceanGate from Boeing at a discount, because it was ‘past its shelf-life’",15684,0.95,1424,,1687545094.0,False,False,False,False,False
75,14h7a6v,meirl,/r/meirl/comments/14h7a6v/meirl/,Jimbo072,meirl,16177,0.93,413,,1687548260.0,False,False,False,False,False
76,14hfitz,aww,/r/aww/comments/14hfitz/oc_my_cat_loafing_with_a_whole_bakery_in_his_trunk/,reessies,[OC] my cat loafing with a whole bakery in his trunk,2940,0.94,29,,1687569349.0,False,False,False,False,False
77,14hbg1t,BlackPeopleTwitter,/r/BlackPeopleTwitter/comments/14hbg1t/adult_swim/,SpectacularOtter,Adult Swim,5174,0.95,228,☑️  Horny Police 🚔🚨,1687558430.0,False,False,False,False,False
78,14hg3bj,DeepRockGalactic,/r/DeepRockGalactic/comments/14hg3bj/deep_rock_galactic_really_needs_to_invest_in_some/,Shidskit,Deep Rock Galactic really needs to invest in some better equipment,2625,0.96,96,,1687571073.0,False,False,False,False,False
79,14hf7lk,pcmasterrace,/r/pcmasterrace/comments/14hf7lk/first_build_went_great/,BeanMotorsport,First build went great,2948,0.96,103,,1687568474.0,False,False,False,False,False
80,14h6aea,Whatcouldgowrong,/r/Whatcouldgowrong/comments/14h6aea/overinflating_your_tyre/,uchman365,Over-inflating your tyre,13606,0.95,873,,1687545852.0,False,False,False,False,False
81,14hg357,TerrifyingAsFuck,/r/TerrifyingAsFuck/comments/14hg357/hand_fed_a_shark/,3wayiii,Hand Fed a Shark ,2510,0.97,153,,1687571059.0,True,False,False,False,False
82,14hiolo,starterpacks,/r/starterpacks/comments/14hiolo/main_street_in_a_small_american_town_starter_pack/,tourmalinefigurine,Main street in a small (American) town starter pack,1623,0.95,109,,1687578971.0,False,False,False,False,False
83,14hecq7,Animemes,/r/Animemes/comments/14hecq7/we_are_sorry_king_zanac/,Con___artist,We are Sorry King Zanac,3294,0.98,81,,1687566076.0,False,False,False,False,False
84,14hdgss,maybemaybemaybe,/r/maybemaybemaybe/comments/14hdgss/maybe_maybe_maybe/,H_G_Bells,Maybe maybe maybe,3573,0.95,62,,1687563693.0,False,False,False,False,False
85,14hhif9,SquaredCircle,/r/SquaredCircle/comments/14hhif9/bowens_if_ya_told_me_years_ago_id_have_an_arena/,goodgollygopher,"Bowens: ""If ya told me years ago, I’d have an arena chanting HE’S GAY at me in the most POSITIVE of ways, I’d say you’re crazy. It’s pretty cool to see how far we’ve come. Still more work to do. Happy Pride""",1850,0.93,104,YO! YO! LISTEN! LISTEN!,1687575314.0,False,False,False,False,False
86,14hdhzi,ATBGE,/r/ATBGE/comments/14hdhzi/this_suit/,catherineshere,This suit 💀,3424,0.95,213,,1687563786.0,False,False,False,False,False
87,14hcsl1,Weird,/r/Weird/comments/14hcsl1/this_guy_with_horns_who_stands_on_the_side_of_the/,forthunt,This guy with horns who stands on the side of the highway by my house,3744,0.95,504,,1687561905.0,False,False,False,False,False
88,14hea8a,doordash_drivers,/r/doordash_drivers/comments/14hea8a/delivered_to_a_grieving_child_today/,Pitiful_Chef5879,Delivered to a grieving child today….,2957,0.98,141,,1687565888.0,False,False,False,False,False
89,14h9try,AnarchyChess,/r/AnarchyChess/comments/14h9try/bro_premoved_his_opening/,SlowlyElite,Bro premoved his opening💀,6048,0.97,70,,1687554440.0,False,False,False,False,False
90,14hb231,Superstonk,/r/Superstonk/comments/14hb231/rc_tweet/,weenythebooty,Rc tweet,5443,0.92,362,Gamecock,1687557479.0,False,False,False,False,False
91,14h551l,Tinder,/r/Tinder/comments/14h551l/went_for_it/,ObviouslyAnAlias7,Went for it?,11447,0.97,283,,1687542982.0,False,False,False,False,False
92,14h89w6,marvelmemes,/r/marvelmemes/comments/14h89w6/just_gonna_ignore_that/,Disastrous_Eye9123,Just gonna ignore that,7833,0.96,151,Spider-Man (Homemade),1687550713.0,False,False,False,False,False
93,14h4oej,ProgrammerHumor,/r/ProgrammerHumor/comments/14h4oej/thingsthatkeepmeupatnight/,huxx__,thingsThatKeepMeUpAtNight,13678,0.95,257,,1687541833.0,False,False,False,False,False
94,14h3xii,nottheonion,/r/nottheonion/comments/14h3xii/elon_musk_and_mark_zuckerberg_agree_to_hold_cage/,Empress_of_Lucite,Elon Musk and Mark Zuckerberg agree to hold cage fight,43420,0.81,4483,,1687540028.0,False,False,False,False,False
95,14h8hdf,ContagiousLaughter,/r/ContagiousLaughter/comments/14h8hdf/water_bottle_on_fan_challenge_with_dad/,Xman71105,Water bottle on fan challenge with dad,6335,0.97,120,,1687551222.0,False,False,False,False,False
96,14hey7z,MemeVideos,/r/MemeVideos/comments/14hey7z/4_combo/,RafidUwU,+4 Combo,2563,0.98,74,,1687567739.0,False,False,False,False,False
97,14hbpnj,Fauxmoi,/r/Fauxmoi/comments/14hbpnj/kim_there_are_people_striking/,queen_queef420,"Kim, there are people striking…",3689,0.95,91,,1687559098.0,False,False,False,False,False
98,14hdz2q,australia,/r/australia/comments/14hdz2q/bad_timing_for_the_scheduling_this_morning/,uhohsarahh,"Bad timing for the scheduling this morning, Playschool ",2665,0.94,231,,1687565019.0,False,False,False,False,False
99,14hcqxc,TwoXChromosomes,/r/TwoXChromosomes/comments/14hcqxc/have_the_girl_go_get_coffee/,pissrightoutmyass,"""Have the girl go get coffee""",3154,0.95,135,,1687561795.0,False,False,False,False,False
100,14hfjxa,MemePiece,/r/MemePiece/comments/14hfjxa/act_like_this_chapter_just_dropped/,IceThePokemonTrainer,Act like this chapter just dropped.,2137,0.95,244,,1687569440.0,False,False,False,False,False
