rank,id,subreddit,permalink,author,title,score,upvote_ratio,num_comments,author_flair_text,created_utc,over_18,edited,stickied,locked,is_original_content
1,14uwyyb,facepalm,/r/facepalm/comments/14uwyyb/guy_thinks_he_is_a_holocaust_survivor_because_his/,NewBlackberry9,Guy thinks he is a Holocaust survivor because his grandma survived the Holocaust,9027,0.96,988,,1688904437.0,False,False,False,False,False
2,14uv6lh,funny,/r/funny/comments/14uv6lh/he_must_be_a_big_fan/,LiteratureOk5964,He must be a big fan,8955,0.96,169,,1688898532.0,False,False,False,False,False
3,14uvj5n,mildlyinfuriating,/r/mildlyinfuriating/comments/14uvj5n/how_my_partner_opens_and_leaves_bags_of_dog/,k0nstruktiv,"How my partner opens and leaves bags of dog treats. She leaves such things around all the time, every day. When i say something we often get in an argument about how ""everything must be perfect"" in my world.",8221,0.95,1303,,1688899724.0,False,False,False,False,False
4,14utwih,MadeMeSmile,/r/MadeMeSmile/comments/14utwih/never_grow_up/,rosseepoo,Never grow up,9591,0.98,226,,1688894006.0,False,False,False,False,False
5,14urd1c,meirl,/r/meirl/comments/14urd1c/meirl/,Aromatic_Dig_3102,Meirl,44028,0.95,620,,1688885177.0,False,False,False,False,False
6,14uu7ro,memes,/r/memes/comments/14uu7ro/protect_her_at_any_cost/,professorparadox69,Protect her at any cost !!!,12043,0.93,90,,1688895166.0,False,False,False,False,False
7,14urbx6,todayilearned,/r/todayilearned/comments/14urbx6/til_after_living_in_london_for_14_years_cillian/,Majorpain2006,"TIL After living in London for 14 years, Cillian Murphy moved back to his native Ireland in order to prevent his children from having posh English accents",20104,0.88,766,,1688885077.0,False,False,False,False,False
8,14uwfwa,nextfuckinglevel,/r/nextfuckinglevel/comments/14uwfwa/nothing_stops_a_brit_getting_a_pint_floods_in/,RightOfLifeIsRight,Nothing stops a Brit getting a pint! Floods in Birmingham yesterday.,4240,0.96,275,,1688902760.0,False,False,False,False,False
9,14uvtl5,marvelmemes,/r/marvelmemes/comments/14uvtl5/for_thanos_2017_year_was_lucky/,Feelingfadedxd,For Thanos 2017 year was lucky,4883,0.96,215,Avengers,1688900664.0,False,False,False,False,False
10,14uwov0,TikTokCringe,/r/TikTokCringe/comments/14uwov0/that_bbc/,sexONaStDick,That BBC ,3803,0.94,872,,1688903582.0,False,False,False,False,False
11,14uufpw,OneOrangeBraincell,/r/OneOrangeBraincell/comments/14uufpw/even_the_big_ones/,babyjo1982,Even the big ones,5919,0.97,112,,1688895980.0,False,False,False,False,False
12,14uu5wc,Unexpected,/r/Unexpected/comments/14uu5wc/random_acts_of_kindness/,SamJasper7,Random acts of... kindness?,6980,0.93,163,,1688894986.0,False,False,False,False,False
13,14urlsn,Damnthatsinteresting,/r/Damnthatsinteresting/comments/14urlsn/swan_family_crossing_the_road/,Autisten1996,Swan family crossing the road,12790,0.98,447,,1688886027.0,False,False,False,False,False
14,14uvqix,popculturechat,/r/popculturechat/comments/14uvqix/mrs_taylor_lautner_living_the_dream/,herinaus,Mrs Taylor Lautner living the dream,3897,0.94,147,,1688900424.0,False,False,False,False,False
15,14usx4b,technicallythetruth,/r/technicallythetruth/comments/14usx4b/its_an_eagle_not_soccer/,Liiskamato,"it's an eagle, not soccer",8556,0.95,248,the inventor of subreddit rickrolling,1688890577.0,False,False,False,False,False
16,14uvtt3,mumbai,/r/mumbai/comments/14uvtt3/current_state_of_marine_drive_people_making_reels/,aaysi31,"Current state of marine drive, people making reels every 20 meters😭😭",3653,0.94,379,,1688900682.0,False,False,False,False,False
17,14uqw81,dankmemes,/r/dankmemes/comments/14uqw81/most_celebrities_are_assholes/,RunnyRose,Most celebrities are assholes,16362,0.94,198,I will steal your nipples :pepeuhoh:,1688883502.0,False,False,False,False,False
18,14uwi5u,wholesomememes,/r/wholesomememes/comments/14uwi5u/chips_and_drinks_kind_of_day/,King_Pee,Chips and drinks kind of day,3082,0.99,22,,1688902965.0,False,False,False,False,False
19,14uvesm,cursedcomments,/r/cursedcomments/comments/14uvesm/cursed_analysis/,Captain_Yarn,Cursed_ANALysis,3406,0.97,57,,1688899308.0,False,False,False,False,False
20,14usczq,ChatGPT,/r/ChatGPT/comments/14usczq/threads_beat_chatgpt_to_reach_1m_users_in_a_hour/,Flat_Physics_3082,Threads beat chatgpt to reach 1M users in a hour.,5904,0.9,894,,1688888631.0,False,False,False,False,False
21,14uoa8h,oddlysatisfying,/r/oddlysatisfying/comments/14uoa8h/cutting_a_mirror_perfectly/,RD4200,Cutting a mirror perfectly,22903,0.96,315,,1688874958.0,False,False,False,False,False
22,14ut7z8,WhitePeopleTwitter,/r/WhitePeopleTwitter/comments/14ut7z8/jason_is_elons_number_one_fan_and_helped_him_buy/,christianohlzon,Jason is Elon's number one fan and helped him buy Twitter,4333,0.98,137,,1688891623.0,False,False,False,False,False
23,14urwz1,MapPorn,/r/MapPorn/comments/14urwz1/location_of_every_bomb_dropped_on_laos_by_america/,Money_Astronaut9789,Location of every bomb dropped on Laos by America,5663,0.93,724,,1688887035.0,False,False,False,False,False
24,14upw88,cats,/r/cats/comments/14upw88/i_come_home_to_at_least_10_mins_of_me_patting_her/,Sam_88882,I come home to at least 10 mins of me patting her bum and holding her close or she won’t leave me alone,9296,0.98,161,,1688880117.0,False,False,False,False,False
25,14uplem,shitposting,/r/shitposting/comments/14uplem/painacetamol_heil_spez/,Notafuqin_Carrot211,Painacetamol. Heil spez,16064,0.95,159,We do a little trolling :snoo_trollface:,1688879135.0,False,False,False,False,False
26,14uvmzk,WatchPeopleDieInside,/r/WatchPeopleDieInside/comments/14uvmzk/when_you_teach_your_baby_to_say_dada/,Rhaenelys,"When you teach your baby to say ""dada""",2618,0.91,91,,1688900088.0,False,False,False,False,False
27,14uu5ej,HolUp,/r/HolUp/comments/14uu5ej/bruh/,hornmelon,Bruh,3600,0.99,40,,1688894931.0,False,False,False,False,False
28,14uwce6,worldnews,/r/worldnews/comments/14uwce6/ukrainian_strategy_has_become_a_model_taiwanese/,jefferymr15,Ukrainian strategy has become a model’: Taiwanese beef up military to face China threat,2251,0.96,225,,1688902417.0,False,False,False,False,False
29,14uofu4,NatureIsFuckingLit,/r/NatureIsFuckingLit/comments/14uofu4/buffalo_saves_stuck_tortoise/,peenutbuttherNjelly,🔥 Buffalo 🐃 saves stuck tortoise,13387,0.96,235,,1688875431.0,False,False,False,False,False
30,14uw0vk,UkrainianConflict,/r/UkrainianConflict/comments/14uw0vk/an_owner_of_a_russian_restaurant_in_dresden/,cito,"An owner of a Russian restaurant in Dresden, Germany, called Putin to strike a pro-Ukrainian protest. She publicly voiced her support of Russia, Putin and war many times. Now German law enforcement opened a case against her and her restaurant is not doing well. She begs Russian FM to intervene.",2284,0.96,287,,1688901340.0,False,False,False,False,False
31,14uuuw6,technology,/r/technology/comments/14uuuw6/2_authors_say_openai_ingested_their_books_to/,nuubbi,"2 authors say OpenAI 'ingested' their books to train ChatGPT. Now they're suing, and a 'wave' of similar court cases may follow.",2785,0.94,708,,1688897410.0,False,False,False,False,False
32,14uvn1h,OldSchoolCool,/r/OldSchoolCool/comments/14uvn1h/my_parents_when_they_eloped_in_vegas_in_1977_and/,m33gs,My parents when they eloped in Vegas in 1977 and then when they had their real wedding a year later in Hawaii,2388,0.97,137,,1688900093.0,False,False,False,False,False
33,14uuurk,ProgrammerHumor,/r/ProgrammerHumor/comments/14uuurk/wheneveryouneedregularexpressions/,Colon_Backslash,wheneverYouNeedRegularExpressions,2705,0.97,108,:g:,1688897398.0,False,False,False,False,False
34,14uxgu5,shittymoviedetails,/r/shittymoviedetails/comments/14uxgu5/in_saving_private_ryan_1998_vin_diesel_is_unable/,fuzzy_dice_99,"In Saving Private Ryan (1998), Vin Diesel is unable to stop the Nazis because he didn’t have his car with him",1723,0.99,31,,1688905994.0,False,False,False,False,False
35,14uodlv,lotrmemes,/r/lotrmemes/comments/14uodlv/this_is_possibly_the_best_lotr_meme_ive_ever_seen/,PowerfulSenses,This is possibly the best lotr meme I've ever seen.,11002,0.96,59,,1688875262.0,False,False,False,False,False
36,14uu2dz,europe,/r/europe/comments/14uu2dz/heraldic_map_of_europe/,Porodicnostablo,Heraldic map of Europe,2937,0.95,212,I posted the Nazi spoon,1688894613.0,False,False,False,False,False
37,14ul3iw,news,/r/news/comments/14ul3iw/suspended_twitter_account_tracking_elon_musks_jet/,IsItJustMeOrt,Suspended Twitter account tracking Elon Musk’s jet moves to Threads,49771,0.91,1851,,1688865307.0,False,False,False,False,False
38,14uw6i2,BrandNewSentence,/r/BrandNewSentence/comments/14uw6i2/human_salsa_by_his_own_invention/,teaandbentley,Human salsa by his own invention,1899,0.99,29,,1688901867.0,False,False,False,False,False
39,14uo79p,antiwork,/r/antiwork/comments/14uo79p/im_a_secret_shopper_that_goes_in_and_doesnt_rat/,JurassicPark-fan-190,I’m a secret shopper that goes in and doesn’t rat out the employees. I get paid to eat and always give a positive review.,9185,0.94,485,,1688874688.0,False,False,False,False,False
40,14uw7j2,AITAH,/r/AITAH/comments/14uw7j2/aitah_for_rejecting_my_estranged_sons_chance_to/,,AITAH for rejecting my estranged son's chance to reunite?,1816,0.92,1218,,1688901965.0,False,1688902243.0,False,False,False
41,14uvaeh,CrazyFuckingVideos,/r/CrazyFuckingVideos/comments/14uvaeh/i_think_britney_spears_is_back_on_the_razzle/,RightOfLifeIsRight,I think Britney Spears is back on the razzle!,2113,0.91,870,,1688898888.0,False,False,False,False,False
42,14ux9pi,HonkaiStarRail,/r/HonkaiStarRail/comments/14ux9pi/hoyo_fr_designed_the_most_fire_character_ever_and/,StickySlush,hoyo fr designed the most fire character ever and made him physical,1522,0.97,98,,1688905381.0,False,False,False,False,False
43,14uwapc,science,/r/science/comments/14uwapc/people_who_believe_in_manifestation_the_ability/,geoff199,"People who believe in manifestation - the ability to cosmically attract success in life through positive self-talk, visualization, and symbolic actions - are more likely to be drawn to risky investments and have experienced bankruptcy.",1679,0.96,135,,1688902253.0,False,False,False,False,False
44,14uwumf,comics,/r/comics/comments/14uwumf/spider_in_the_bathroom/,neilkohney,Spider in the bathroom,1553,0.96,13,The Other End,1688904100.0,False,False,False,False,False
45,14ulps2,politics,/r/politics/comments/14ulps2/pay_attention_to_what_you_see_donald_trump_is/,thenewrepublic,"Pay Attention to What You See: Donald Trump Is Losing His Marbles | If he keeps this up, he’ll drag the entire Republican Party down with him in 2024.",16062,0.91,1682,The New Republic,1688867138.0,False,False,False,False,False
46,14umc68,LeopardsAteMyFace,/r/LeopardsAteMyFace/comments/14umc68/well_you_made_the_checkmark_purchasable/,SternenO,"Well, you made the checkmark purchasable",12260,0.96,288,,1688868961.0,False,False,False,False,False
47,14uve1w,ukraine,/r/ukraine/comments/14uve1w/poland_secretly_handed_over_about_dozen_mi24/,Minneapolitanian,Poland secretly handed over about dozen Mi-24 helicopters to Ukraine – WSJ,1890,0.98,62,,1688899242.0,False,False,False,False,False
48,14ut93o,me_irlgbt,/r/me_irlgbt/comments/14ut93o/me_irlgbt/,ThisIsMyPassword100,me_irlgbt,2771,0.96,70,,1688891732.0,False,False,False,False,False
49,14uvb49,wallstreetbets,/r/wallstreetbets/comments/14uvb49/your_wife_and_her_4_boyfriends_say_ok_then_show/,illyousion,"Your wife and her 4 boyfriends say: “ok then, show us how to successfully trade”",1893,0.95,83,,1688898953.0,False,False,False,False,False
50,14uwqkw,freefromwork,/r/freefromwork/comments/14uwqkw/freefromwork/,MaryFlitk,freefromwork,1457,0.98,31,,1688903751.0,False,False,False,False,False
51,14uwgqx,PeterExplainsTheJoke,/r/PeterExplainsTheJoke/comments/14uwgqx/what/,Bockanator,What,1539,0.98,44,,1688902831.0,False,False,False,False,False
52,14uma4p,BeAmazed,/r/BeAmazed/comments/14uma4p/airline_pilot_takeoff_vs_boeing_test_pilot_takeoff/,purple-circle,Airline pilot take-off vs Boeing test pilot take-off,12296,0.94,946,,1688868798.0,False,False,False,False,False
53,14up5fj,starterpacks,/r/starterpacks/comments/14up5fj/selfdiagnosed_autistic_starter_pack/,Penenko,Self-Diagnosed Autistic Starter Pack,6591,0.86,907,,1688877709.0,False,False,False,False,False
54,14uvsui,clevercomebacks,/r/clevercomebacks/comments/14uvsui/they_should_never_mess_with_opera_gx_on_pride/,Petra_Sommer,They should never mess with Opera GX on Pride,1684,0.97,20,,1688900605.0,False,False,False,False,False
55,14uqcji,therewasanattempt,/r/therewasanattempt/comments/14uqcji/to_parkour_across_a_cesspit/,JohnnyTeardrop,to parkour across a cesspit,4667,0.96,192,,1688881650.0,False,False,False,False,False
56,14uw79t,Eyebleach,/r/Eyebleach/comments/14uw79t/dozing_off_while_taking_a_dust_bath/,lnfinity,Dozing off while taking a dust bath,1510,0.99,19,,1688901938.0,False,False,False,False,False
57,14uyjg4,Spiderman,/r/Spiderman/comments/14uyjg4/ladies_gentlemen_with_6546_votes_miles_morales_is/,LivingOutOfSpite9,"Ladies & gentlemen… with 6,546 votes, Miles morales is out with 58.99% of the votes",1031,0.95,117,,1688909146.0,False,False,False,False,False
58,14usvf7,oddlyterrifying,/r/oddlyterrifying/comments/14usvf7/this_guy_trusts_the_ledge_more_than_i_trust_my/,Rifletree,this guy trusts the ledge more than I trust my friends.,2734,0.95,188,,1688890407.0,False,False,False,False,False
59,14upzcf,wholesome,/r/wholesome/comments/14upzcf/positivity_in_motion/,fabioke,Positivity in Motion,4895,0.95,60,,1688880414.0,False,False,False,False,False
60,14uyh8z,tumblr,/r/tumblr/comments/14uyh8z/thanks_for_the_personal_attack/,Old_Specialist7892,Thanks for the personal attack,1071,0.99,18,,1688908974.0,False,False,False,False,False
61,14uw1si,formuladank,/r/formuladank/comments/14uw1si/who_will_be_on_the_podcast_today/,Geldnehmer,Who will be on the Podcast today?,1481,0.98,61,BWOAHHHHHHH ,1688901428.0,False,False,False,False,False
62,14uvmop,MoldyMemes,/r/MoldyMemes/comments/14uvmop/room_temperature/,InterestingToe3115,Room Temperature,1627,0.96,39,,1688900057.0,False,False,False,False,False
63,14uwkza,awesome,/r/awesome/comments/14uwkza/enemy_blinder_3000/,NaomiMMuncy,Enemy Blinder 3000,1353,0.96,79,,1688903220.0,False,False,False,False,False
64,14ulvqg,pcmasterrace,/r/pcmasterrace/comments/14ulvqg/something_happened/,Ninemeister0,"""Something happened""",13027,0.97,259,,1688867643.0,False,False,False,False,False
65,14ux6b2,whenthe,/r/whenthe/comments/14ux6b2/we_are_witnessing_an_actual_mass_mental/,SubSharanSubHuman,We are witnessing an actual mass mental deterioration event,1217,0.98,57,,1688905088.0,False,False,False,False,False
66,14uozt5,BlackPeopleTwitter,/r/BlackPeopleTwitter/comments/14uozt5/conservative_son_or_thot_daughter/,MikeisTOOOTALLL,Conservative son or Thot daughter?,5303,0.94,269,,1688877202.0,False,False,False,False,False
67,14us92c,harrypotter,/r/harrypotter/comments/14us92c/what_else_comes_to_your_mind/,Vanilla_CS,What else comes to your mind?,2791,0.95,371,:ClawS3: Ravenclaw,1688888242.0,False,False,False,False,False
68,14uv08x,AskReddit,/r/AskReddit/comments/14uv08x/people_of_reddit_who_have_been_abducted_by_aliens/,Churbuddahbread,People of reddit who have been abducted by aliens. What’s your story?,1692,0.84,358,,1688897905.0,False,False,False,False,False
69,14unyld,quityourbullshit,/r/quityourbullshit/comments/14unyld/katee_sackhoff_setting_it_straight/,Flupox,Katee Sackhoff setting it straight,6173,0.97,130,,1688873907.0,False,False,False,False,False
70,14urxpy,Animemes,/r/Animemes/comments/14urxpy/boring_vs_dislikeable_apparently/,The_Nameless24,Boring vs dislikeable apparently,3057,0.97,135,,1688887110.0,False,False,False,False,False
71,14uqpdh,discordVideos,/r/discordVideos/comments/14uqpdh/hidden_episode_of_spongebob/,gamingyoshi247,Hidden episode of SpongeBob,3997,0.93,77,,1688882825.0,False,False,False,False,False
72,14uxgqz,AnimalsBeingBros,/r/AnimalsBeingBros/comments/14uxgqz/definition_of_animals_being_bros/,SinVerguenza04,Definition of animals being bros,1072,0.96,27,,1688905988.0,False,False,False,False,False
73,14uv7sd,WTF,/r/WTF/comments/14uv7sd/hen_escaping_a_crocodile_pond/,Vlad_TheImpalla,Hen escaping a crocodile pond.,1545,0.93,128,,1688898640.0,False,False,False,False,False
74,14ute49,Genshin_Impact,/r/Genshin_Impact/comments/14ute49/the_spark_knight_with_sparkle/,Shot-Weakness4388,The Spark Knight with sparkle,2136,0.97,39,:dehya:,1688892229.0,False,False,False,False,False
75,14uw04f,Damnthatsinteresting,/r/Damnthatsinteresting/comments/14uw04f/air_vortex_cannon/,Arro,Air vortex cannon,3269,0.98,188,,1688901277.0,False,False,False,False,False
76,14ul6yp,PublicFreakout,/r/PublicFreakout/comments/14ul6yp/fascists_strolling_through_austin/,gravityVT,Fascists strolling through Austin,13192,0.87,3876,,1688865588.0,False,False,False,False,False
77,14urtrc,ImTheMainCharacter,/r/ImTheMainCharacter/comments/14urtrc/no_reaction/,fffelix123,No reaction😱😱😱😱,2825,0.9,264,,1688886725.0,False,False,False,False,False
78,14uo8pu,anime_irl,/r/anime_irl/comments/14uo8pu/anime_irl/,BlablaBlabla215600,anime_irl,5961,0.95,115,,1688874824.0,False,False,False,False,False
79,14uwyu7,TheLastAirbender,/r/TheLastAirbender/comments/14uwyu7/this_gotta_be_the_most_onesided_beatdown_ive_seen/,Muted_Hovercraft_907,This gotta be the most one-sided beatdown I've seen,1097,0.95,210,,1688904430.0,False,False,False,False,False
80,14uu7nz,terriblefacebookmemes,/r/terriblefacebookmemes/comments/14uu7nz/the_war_in_the_comments/,peasantfarmerbernard,The war in the comments 💀,1735,0.96,156,,1688895153.0,False,False,False,False,False
81,14up6ya,Breath_of_the_Wild,/r/Breath_of_the_Wild/comments/14up6ya/i_bet_its_blueberry/,BrokenNobil,I bet it's blueberry,4461,0.97,155,,1688877852.0,False,False,False,False,False
82,14ujwmw,maybemaybemaybe,/r/maybemaybemaybe/comments/14ujwmw/maybe_maybe_maybe/,peseoane,Maybe Maybe Maybe,18615,0.96,234,,1688861900.0,False,False,False,False,False
83,14uxzuc,witcher,/r/witcher/comments/14uxzuc/why/,CarnivoreX,Why,917,0.94,48,,1688907621.0,True,False,False,False,False
84,14uphrc,SipsTea,/r/SipsTea/comments/14uphrc/can_mexicans_pronounce_n/,AnnoyingHello,Can Mexicans pronounce N***?,4267,0.97,100,,1688878853.0,False,False,False,False,False
85,14uof7k,facepalm,/r/facepalm/comments/14uof7k/tiktok_challenges_home_of_the_darwin_awards/,Alien__Yes,TikTok Challenges -Home of the Darwin Awards,36910,0.96,1989,,1688875383.0,False,False,False,False,False
86,14uu7m0,UkraineWarVideoReport,/r/UkraineWarVideoReport/comments/14uu7m0/18_the_price_for_freedom_a_ukrainian_assault/,LeesaMoore,"18+_the price for freedom! A Ukrainian assault group records its own destruction on the Svatovo-Kremennaya front, ending with the death of the cameraman. You never be forgotton, true heroes!",1693,0.93,196,,1688895148.0,True,False,False,False,False
87,14ut9b3,lgbt,/r/lgbt/comments/14ut9b3/ftm/,JMar-08,FtM,1977,0.95,162,,1688891752.0,False,False,False,False,False
88,14ukjov,oddlyspecific,/r/oddlyspecific/comments/14ukjov/this_is_when_my_phone_anxiety_began_did_anyone/,Mammoth-Medicine1385,This is when my phone anxiety began. Did anyone else rehearse what they were going to say to the receptionist?,12888,0.97,92,,1688863708.0,False,False,False,False,False
89,14uvh52,ffxiv,/r/ffxiv/comments/14uvh52/the_world_of_ffxiv_speedrunning_is_viscous/,CevicheLemon,The World of FFXIV Speedrunning is Viscous,1299,0.95,56,:fsh::dps::healer2: Community Artist n' stuff,1688899537.0,False,False,False,False,False
90,14uonc7,wholesomememes,/r/wholesomememes/comments/14uonc7/positive_influence/,Getitgirl419,Positive influence 😊,23044,0.93,212,,1688876091.0,False,False,False,False,False
91,14usey2,DesignPorn,/r/DesignPorn/comments/14usey2/aids_awareness_poster/,Brone9,AIDS Awareness Poster,2261,0.96,32,,1688888815.0,False,False,False,False,False
92,14uvnxr,Grimdank,/r/Grimdank/comments/14uvnxr/da_boyz_just_love_showin_up_unannounced/,Zoborxw,Da Boyz just love showin’ up unannounced,1258,0.9,660,,1688900171.0,False,False,False,False,False
93,14uw3r9,Hololive,/r/Hololive/comments/14uw3r9/fox_dive/,FusionDjango,Fox Dive,1191,0.99,22,,1688901613.0,False,False,False,False,False
94,14uxob1,NoStupidQuestions,/r/NoStupidQuestions/comments/14uxob1/what_the_hell_happened_to_elon_musk/,TommyShelbyPFB,What the hell happened to Elon Musk?,930,0.77,640,,1688906666.0,False,1688915069.0,False,False,False
95,14uo22v,doordash,/r/doordash/comments/14uo22v/dasher_steals_food_and_proceeds_to_brag_about_it/,dmfuller,Dasher steals food and proceeds to brag about it,5057,0.96,568,,1688874218.0,False,False,False,False,False
96,14uq3xb,ufc,/r/ufc/comments/14uq3xb/volk_finishes_yair/,Justabudah,Volk finishes yair.,3294,0.97,362,,1688880835.0,False,False,False,False,False
97,14uln4a,FunnyandSad,/r/FunnyandSad/comments/14uln4a/i_would_if_i_could/,zuixiivii,I would if I could,8934,0.96,180,,1688866909.0,False,False,False,False,False
98,14ux4pn,lego,/r/lego/comments/14ux4pn/my_build_for_the_billund_lego_house/,ranghaal,My build for the Billund Lego House,937,0.99,24,,1688904941.0,False,False,False,False,False
99,14uutwd,LeagueOfMemes,/r/LeagueOfMemes/comments/14uutwd/here_have_a_luxpyke_skin_instead/,octobersveryown616,Here have a lux/pyke skin instead,1352,0.99,18,,1688897312.0,False,False,False,False,False
100,14uujps,2meirl4meirl,/r/2meirl4meirl/comments/14uujps/2meirl4meirl/,tHeBrUt3KiLLeR,2meirl4meirl,1431,0.97,25,,1688896374.0,False,False,False,False,False
