rank,id,subreddit,permalink,author,title,score,upvote_ratio,num_comments,author_flair_text,created_utc,over_18,edited,stickied,locked,is_original_content
1,14nspky,WhitePeopleTwitter,/r/WhitePeopleTwitter/comments/14nspky/smart/,datsnotright0,Smart,30214,0.93,1116,,1688210715.0,False,False,False,False,False
2,14nyilb,nba,/r/nba/comments/14nyilb/haynes_breaking_news_portland_trail_blazers/,SpiritedSuccess5675,"[Haynes] BREAKING NEWS: Portland Trail Blazers superstar Damian Lillard has requested a trade this morning, league sources tell @NBAonTNT, @BleacherReport.",5355,0.99,1714,:lal-2: Lakers,1688227013.0,False,False,False,False,False
3,14nsu7q,facepalm,/r/facepalm/comments/14nsu7q/no_comments/,NewBlackberry9,No comments,29243,0.96,484,,1688211150.0,False,False,False,False,False
4,14ns8c2,therewasanattempt,/r/therewasanattempt/comments/14ns8c2/to_sell_shoes_to_50_cent_for_6000/,papillonintunisia,to sell shoes to 50 Cent for $ 6000,23558,0.96,1357,,1688209125.0,False,False,False,False,False
5,14ntby4,nextfuckinglevel,/r/nextfuckinglevel/comments/14ntby4/surgeon_in_london_performing_remote_operation_on/,lawbscher,Surgeon in London performing remote operation on a banana in California using 5G,15288,0.95,1119,,1688212760.0,False,False,False,False,False
6,14nv4kp,worldnews,/r/worldnews/comments/14nv4kp/yevgeny_prigozhin_will_never_be_discussed_again/,marissa_fox,‘Yevgeny Prigozhin will never be discussed again’: Russian media to erase all traces of mutinous warlord,6828,0.97,642,,1688217976.0,False,False,False,False,False
7,14nud55,MadeMeSmile,/r/MadeMeSmile/comments/14nud55/best_friends_reunion/,axlnotfound,Best friends reunion,9733,0.97,119,,1688215844.0,False,False,False,False,False
8,14nthwo,politics,/r/politics/comments/14nthwo/trumps_motorcade_heckled_at_moms_for_liberty/,BelleAriel,"Trump's motorcade heckled at Moms for Liberty event: ""Traitor""",8143,0.96,577,,1688213215.0,False,False,False,False,False
9,14nue2i,TikTokCringe,/r/TikTokCringe/comments/14nue2i/who_is_actually_hurting_kids/,cak3crumbs,Who is actually hurting kids,6565,0.93,501,,1688215912.0,False,False,False,False,False
10,14nrujg,meirl,/r/meirl/comments/14nrujg/meirl/,redmambo_no6,meirl,13960,0.98,322,,1688207754.0,False,False,False,False,False
11,14nrbv7,antiwork,/r/antiwork/comments/14nrbv7/applying_for_tech_support_jobs_saw_this/,Mythromize,"Applying for tech support jobs, saw this, immediately thought of this sub.",13046,0.97,746,,1688205917.0,False,False,False,False,False
12,14nu278,BlackPeopleTwitter,/r/BlackPeopleTwitter/comments/14nu278/turn_around_is_fair_play/,Kelmo7,Turn around is fair play,5361,0.96,143,☑️,1688214922.0,False,False,False,False,False
13,14nukb7,Hololive,/r/Hololive/comments/14nukb7/holotori_is_now_considered_an_official_unit/,extralie,HoloTori is now considered an official unit!,4510,0.95,163,:Kiara::Amelia::Kiara::Reine::Kiara:,1688216421.0,False,False,False,False,False
14,14nsex6,Breath_of_the_Wild,/r/Breath_of_the_Wild/comments/14nsex6/just_imagine_how_frustrating/,DebEmersone,Just imagine how frustrating,6246,0.97,101,,1688209705.0,False,False,False,False,False
15,14nu5xp,ProgrammerHumor,/r/ProgrammerHumor/comments/14nu5xp/somethingsomethinglayer8/,xFlumel_,somethingSomethingLayer8,4342,0.98,73,,1688215237.0,False,False,False,False,False
16,14nt379,WhitePeopleTwitter,/r/WhitePeopleTwitter/comments/14nt379/its_funny_how_the_2nd_amendment_has_made_us_so/,EmptySpaceForAHeart,It’s funny how the 2nd Amendment has made us so complacent to oppression.,10414,0.97,272,,1688211971.0,False,False,False,False,False
17,14nptms,dankmemes,/r/dankmemes/comments/14nptms/seal_the_deal/,johnlen1n,Seal the deal,17748,0.97,87,,1688200419.0,False,False,False,False,False
18,14nrcc0,MadeMeSmile,/r/MadeMeSmile/comments/14nrcc0/checking_in_on_her_dad_after_she_saw_him_sitting/,mindyour,Checking in on her dad after she saw him sitting outside.,23620,0.96,558,,1688205957.0,False,False,False,False,False
19,14ntmqp,BeAmazed,/r/BeAmazed/comments/14ntmqp/have_you_ever_seen_a_peacock_fly/,silvercatbob,Have you ever seen a peacock fly?,4602,0.98,297,,1688213627.0,False,False,False,False,False
20,14nszs7,facepalm,/r/facepalm/comments/14nszs7/and_coal_runs_out/,GreenGazelle7,And coal runs out...,10711,0.95,882,,1688211669.0,False,False,False,False,False
21,14nptsy,Damnthatsinteresting,/r/Damnthatsinteresting/comments/14nptsy/nuclear_war_after_math/,notthevcode,Nuclear war after math,10598,0.94,965,,1688200439.0,False,False,False,False,False
22,14nqceb,CrazyFuckingVideos,/r/CrazyFuckingVideos/comments/14nqceb/bully_gets_bullied/,RightOfLifeIsRight,Bully gets bullied,8271,0.94,531,,1688202318.0,False,False,False,False,False
23,14nr86p,technicallythetruth,/r/technicallythetruth/comments/14nr86p/that_is_some_logic_mate/,FullTimeGamer2021,that is some logic mate,7884,0.9,635,Here for the logical shit,1688205609.0,False,False,False,False,False
24,14nudg7,LeagueOfMemes,/r/LeagueOfMemes/comments/14nudg7/how_to_ask_for_a_gank_without_sounding_agressive/,TeamBDSOfficial,How to ask for a gank without sounding agressive :,3337,0.97,38,,1688215867.0,False,False,False,False,False
25,14nu42f,Eldenring,/r/Eldenring/comments/14nu42f/i_am_excited_as_i_am_afraid_folks/,Huge-Swing-7137,I am excited as I am afraid folks...,3276,0.98,289,,1688215082.0,False,False,False,False,False
26,14nq6gv,memes,/r/memes/comments/14nq6gv/medieval_health_care_be_like/,Casul-Loner2,Medieval health care be like,9330,0.96,61,,1688201767.0,False,False,False,False,False
27,14nrxf3,LifeProTips,/r/LifeProTips/comments/14nrxf3/lpt_when_you_have_to_cancel_a_reservation_in_a/,withveroni,"LPT When you have to cancel a reservation in a hotel but you can't due to a 24 hour rule, call the hotel and move your date to a later one. Call them again in a few days and cancel free of charge.",4355,0.94,282,,1688208052.0,False,False,False,False,False
28,14nuizw,cursedcomments,/r/cursedcomments/comments/14nuizw/cursed_wanker/,Gone_Mads,Cursed_wanker,2976,0.98,42,,1688216322.0,False,False,False,False,False
29,14nrz6x,tumblr,/r/tumblr/comments/14nrz6x/thirsty_websites/,caughtyoulookinn,Thirsty websites,4408,0.98,18,,1688208238.0,False,False,False,False,False
30,14nsls5,wholesomememes,/r/wholesomememes/comments/14nsls5/under_the_braid/,SensitiveGifts,🎶Under the braid🎶,3810,0.98,29,,1688210361.0,False,False,False,False,False
31,14nropd,TwoXChromosomes,/r/TwoXChromosomes/comments/14nropd/finally_realized_my_husband_just_doesnt_like_me/,fauxpunkfatigues_,Finally realized my husband just doesn’t like me that much,4211,0.92,350,,1688207179.0,False,1688229266.0,False,False,False
32,14nssum,pettyrevenge,/r/pettyrevenge/comments/14nssum/use_my_email_lose_your_kohls_cash/,uber765,"Use my email, lose your Kohl's Cash",3412,0.97,302,,1688211028.0,False,False,False,False,False
33,14nt5li,BrandNewSentence,/r/BrandNewSentence/comments/14nt5li/if_only_theyd_had_some_indication/,CinemaslaveJoe,If only they’d had some indication…,3143,0.99,57,,1688212189.0,False,False,False,False,False
34,14nntlw,shitposting,/r/shitposting/comments/14nntlw/heil_spez/,Siil_Udus,heil spez,31340,0.86,684,,1688193333.0,False,False,False,False,False
35,14nqh77,comics,/r/comics/comments/14nqh77/table_tp_rpg_teamwork/,Yoffeepop,Table Tp RPG - “Teamwork”,5139,0.97,31,,1688202815.0,False,False,False,False,True
36,14nvlig,WorkReform,/r/WorkReform/comments/14nvlig/the_root_of_the_problem_is_colleges_are_too/,hazardousmug,The root of the problem is colleges are too expensive. This problem is never going to go away until colleges become more affordable.,2091,0.98,65,⛓️ Prison For Union Busters,1688219299.0,False,False,False,False,False
37,14nudu8,atheism,/r/atheism/comments/14nudu8/dutch_government_to_ban_police_officers_from/,Leeming,"Dutch government to ban police officers from wearing religious symbols as part of uniforms in public. ‘Religious neutrality of the police should be explicit,’ according to minister for justice Dilan Yesilgoz.",2430,0.97,126,Strong Atheist,1688215896.0,False,False,False,False,False
38,14np7of,sadcringe,/r/sadcringe/comments/14np7of/what_the_actual_fuck_dude/,TxTyler2019,what the actual fuck dude,7537,0.95,721,,1688198247.0,True,False,False,False,False
39,14ntgap,PublicFreakout,/r/PublicFreakout/comments/14ntgap/paris_is_a_warzone_right_now_gangs_have_taken_over/,SmokyDoky876,"Paris is a warzone right now, gangs have taken over",2833,0.84,281,,1688213080.0,False,False,False,True,False
40,14nsdd6,NonPoliticalTwitter,/r/NonPoliticalTwitter/comments/14nsdd6/based_anti_cheat/,burakalp34,Based anti cheat,3372,0.99,34,:blue1::blue2::1111::1112:,1688209551.0,False,False,False,False,False
41,14nqfvm,marvelmemes,/r/marvelmemes/comments/14nqfvm/the_movie_still_completes_me/,Happy-Courage2382,The movie still completes me,5301,0.92,200,Avengers,1688202677.0,False,False,False,False,False
42,14nrpfp,formuladank,/r/formuladank/comments/14nrpfp/the_king_has_spoken/,oxymoronMMII,The king has spoken,3763,0.93,106,BWOAHHHHHHH ,1688207250.0,False,False,False,False,False
43,14nlzra,LeopardsAteMyFace,/r/LeopardsAteMyFace/comments/14nlzra/conservative_gay_dude_shocked_that_desantis_is/,Ausir,Conservative gay dude shocked that DeSantis is homophobic,14419,0.96,748,,1688187229.0,False,False,False,False,False
44,14ntoch,HolUp,/r/HolUp/comments/14ntoch/prank_gone_wrong/,ss6239620,Prank Gone wrong,2699,0.95,99,,1688213759.0,False,False,False,False,False
45,14nuy20,AnimalsBeingBros,/r/AnimalsBeingBros/comments/14nuy20/older_bird_welcoming_the_chicks/,CommercialBox4175,Older Bird Welcoming The Chicks,2075,0.98,46,,1688217463.0,False,False,False,False,False
46,14nm5lv,pcmasterrace,/r/pcmasterrace/comments/14nm5lv/youtubes_new_adblock_policy/,edvards55,YouTube's new adblock policy,15443,0.97,1794,PC Master Race,1688187738.0,False,False,False,False,False
47,14nrjjr,UkraineWarVideoReport,/r/UkraineWarVideoReport/comments/14nrjjr/found_in_a_captured_russian_trench_in_bakhmut/,baxly01,"Found in a captured Russian trench, in Bakhmut. Translate required",3641,0.96,705,,1688206671.0,False,False,False,False,False
48,14nvxs0,WhitePeopleTwitter,/r/WhitePeopleTwitter/comments/14nvxs0/harvard_announces_loophole_in_scotus_ruling/,FalconLynx13,Harvard announces loophole in SCOTUS ruling,5484,0.98,244,,1688220220.0,False,False,False,False,False
49,14np1is,CasualUK,/r/CasualUK/comments/14np1is/best_friend_posted_his_own_wage_slip_through/,butwhydidhe,Best friend posted his own wage slip through attractive neighbours door to impress them. This is weird isn’t it?,6287,0.94,1476,,1688197619.0,False,1688225918.0,False,False,False
50,14nrmly,Spiderman,/r/Spiderman/comments/14nrmly/thought_this_belongs_here_reposting_cus_i_cropped/,Prudent-Buffalo467,Thought this belongs here ( reposting cus i cropped it bad lol),3662,0.96,73,,1688206976.0,False,False,False,False,False
51,14npiaq,AskReddit,/r/AskReddit/comments/14npiaq/whats_an_addiction_that_people_often_overlook/,OneApplication2371,What's an addiction that people often overlook?,5805,0.94,4843,,1688199269.0,False,False,False,False,False
52,14nscb6,PeterExplainsTheJoke,/r/PeterExplainsTheJoke/comments/14nscb6/what_is_it_peter/,sukuidoardo,What is it Peter?,3136,0.96,75,,1688209459.0,False,False,False,False,False
53,14nppex,popculturechat,/r/popculturechat/comments/14nppex/taylor_swift_fan_hides_identity_because_she/,MeeranQureshi,Taylor Swift fan hides identity because she called in sick to work,4995,0.97,130,,1688199988.0,False,False,False,False,False
54,14nu8hh,ImTheMainCharacter,/r/ImTheMainCharacter/comments/14nu8hh/who_is_the_main_character_in_this_one/,Sharkmasterfl3x,Who is the main character in this one?,2118,0.86,698,,1688215466.0,False,False,False,False,False
55,14nuwf0,NintendoSwitch,/r/NintendoSwitch/comments/14nuwf0/it_took_me_2_weeks_to_finish_this_link_botw_art/,turnedninja,It took me 2 weeks to finish this Link (BotW) art. Hope you like it!,1896,0.95,65,,1688217331.0,False,False,False,False,True
56,14nmt94,news,/r/news/comments/14nmt94/18_hasidic_schools_failed_to_provide_basic/,thevoges,"18 Hasidic Schools Failed to Provide Basic Education, New York City Finds",8814,0.97,832,,1688189951.0,False,False,False,False,False
57,14nr5z9,ContagiousLaughter,/r/ContagiousLaughter/comments/14nr5z9/that_food_is_shit/,LaughBakery,That food is shit,3615,0.96,103,,1688205384.0,False,False,False,False,False
58,14nt7ol,anime_irl,/r/anime_irl/comments/14nt7ol/anime_irl/,Randymaple92,anime_irl,2472,0.96,76,,1688212369.0,False,False,False,False,False
59,14nsk2k,lotr,/r/lotr/comments/14nsk2k/chance_encounter_with_this_legend_last_night/,dunkerpup,Chance encounter with this legend last night!,2694,0.96,74,,1688210191.0,False,False,False,False,True
60,14ntauy,Awww,/r/Awww/comments/14ntauy/owners_reunited_with_dog_after_he_went_missing/,ExistingParsnips,Owners reunited with dog after he went missing during a car accident,2393,0.97,87,,1688212653.0,False,False,False,False,False
61,14nswiq,TheLastAirbender,/r/TheLastAirbender/comments/14nswiq/so_does_the_avatar_state_boost_physical_strength/,Muted_Hovercraft_907,So does the Avatar State boost Physical strength also or is Korra just that strong?,2556,0.96,184,,1688211370.0,False,False,False,False,False
62,14nqwmk,maybemaybemaybe,/r/maybemaybemaybe/comments/14nqwmk/maybe_maybe_maybe/,XahidX,Maybe maybe maybe,3720,0.98,57,,1688204425.0,False,False,False,False,False
63,14nui23,lgbt,/r/lgbt/comments/14nui23/in_honor_of_the_christian_winning_their_case/,Future-Ad2802,In honor of the Christian winning their case against the LGBT community,1947,0.97,31,:ace: Ace as Cake,1688216241.0,False,False,False,False,False
64,14nn61m,cats,/r/cats/comments/14nn61m/how_my_cat_sleeps_every_night_do_cats_normally_do/,imivani,How my cat sleeps every night. Do cats normally do this?? 😂,8989,0.99,548,,1688191165.0,False,False,False,False,False
65,14ns87o,197,/r/197/comments/14ns87o/rule_italia/,IDidntHadAStroke,Rule italia,2854,0.97,87,,1688209112.0,False,False,False,False,False
66,14nu757,technology,/r/technology/comments/14nu757/california_man_creates_ai_chatbot_to_waste_the/,Sariel007,California man creates AI chatbot to waste the time of telemarketers,1988,0.96,97,,1688215345.0,False,False,False,False,False
67,14nk6p4,oddlysatisfying,/r/oddlysatisfying/comments/14nk6p4/sculpting_a_figurine_with_polymer_clay/,tommos,Sculpting a figurine with polymer clay,46215,0.93,605,,1688181378.0,False,False,False,False,False
68,14njfn2,funny,/r/funny/comments/14njfn2/taylor_swift_fan_hides_identity_because_she/,ebradio,Taylor Swift Fan Hides Identity Because She Called in Sick to Work,65613,0.93,941,,1688179055.0,False,False,False,False,False
69,14npkzo,oddlyterrifying,/r/oddlyterrifying/comments/14npkzo/active_volcano_oozing_lava_near_the_resort_we_are/,npad69,Active volcano oozing lava near the resort we are staying at,4666,0.98,98,,1688199546.0,False,False,False,False,False
70,14nrxj7,Damnthatsinteresting,/r/Damnthatsinteresting/comments/14nrxj7/propaganda_booklet_found_in_a_trench_in_bakhmut/,TotalSpaceNut,Propaganda booklet found in a trench in Bakhmut,4988,0.97,481,,1688208062.0,False,False,False,False,False
71,14ntkba,FUCKYOUINPARTICULAR,/r/FUCKYOUINPARTICULAR/comments/14ntkba/wtf/,WolfsToothDogFood,Wtf,2023,0.95,63,,1688213429.0,False,False,False,False,False
72,14nmxts,SipsTea,/r/SipsTea/comments/14nmxts/your_powers_do_not_work_here/,HugeSettings,Your powers do not work here,9061,0.95,279,,1688190390.0,False,False,False,False,False
73,14nv2nj,AnimalsBeingDerps,/r/AnimalsBeingDerps/comments/14nv2nj/doggo_making_bread/,Bihema,Doggo making bread,1560,0.98,15,,1688217821.0,False,False,False,False,False
74,14nu4a8,fixedbytheduet,/r/fixedbytheduet/comments/14nu4a8/walking_is_for_poor_people/,HeyHeyBitconeeeeect,Walking is for poor people,1812,0.93,38,,1688215099.0,False,False,False,False,False
75,14nv089,IllegallySmolCats,/r/IllegallySmolCats/comments/14nv089/sphinx_first_babies_they_look_unusual_but_are_so/,Smile_Quean,"Sphinx. First babies. They look unusual, but are so nice to the touch",1539,0.97,53,,1688217643.0,False,False,False,False,False
76,14noji0,BeAmazed,/r/BeAmazed/comments/14noji0/1932_vs_2016_a_comparison_of_the_100m_swim/,Patient_Island_2080,1932 vs 2016 - A Comparison of the 100m Swim: Evolution of Performance Over Time.,10670,0.96,534,,1688195855.0,False,False,False,False,False
77,14nss9n,antiwork,/r/antiwork/comments/14nss9n/workers_unite/,MsSeraphim,workers unite,3642,0.99,60,permanently disabled and still funny  :snoo_tongue:,1688210977.0,False,False,False,False,False
78,14noten,teenagers,/r/teenagers/comments/14noten/guests_had_sex_right_next_to_me/,ColonelCrusherx,Guests had sex right next to me,5620,0.95,584,15,1688196825.0,True,False,False,False,False
79,14nubmv,WhatsWrongWithYourCat,/r/WhatsWrongWithYourCat/comments/14nubmv/are_you_comfortable_mate/,Junipersstar,Are you comfortable mate ?,1625,0.98,22,,1688215726.0,False,False,False,False,False
80,14ns3g3,Embroidery,/r/Embroidery/comments/14ns3g3/so_many_french_knots/,StephaniLowman,SO. MANY. FRENCH. KNOTS.,2336,0.89,18,,1688208658.0,False,False,False,False,True
81,14npi69,PrequelMemes,/r/PrequelMemes/comments/14npi69/a_man_has_fallen_into_lava_in_lego_mustafar/,VonRomano,A man has fallen into lava in Lego Mustafar!,4113,0.94,23,,1688199255.0,False,False,False,False,False
82,14nu73l,wholesome,/r/wholesome/comments/14nu73l/dad_teaching_his_daughters_science/,fabioke,Dad teaching his daughters science,1615,0.96,19,,1688215341.0,False,False,False,False,False
83,14nrxnh,nextfuckinglevel,/r/nextfuckinglevel/comments/14nrxnh/linkin_park_pulling_the_crowd_into_their_song/,mike-tm-1,Linkin Park pulling the crowd into their song with little effort.,4294,0.95,218,,1688208073.0,False,False,False,False,False
84,14nsd8q,okbuddychicanery,/r/okbuddychicanery/comments/14nsd8q/what_did_finger_mean_by_this/,Gumbas100,What did finger mean by this,2144,0.97,86,,1688209540.0,False,False,False,False,False
85,14nw266,politics,/r/politics/comments/14nw266/cesspool_of_corruption_dems_reintroduce_bill_to/,newnemo,'Cesspool of Corruption': Dems Reintroduce Bill to Impose Supreme Court Term Limits,2014,0.99,94,:flag-vt: Vermont,1688220557.0,False,False,False,False,False
86,14nt5zk,mildlyinfuriating,/r/mildlyinfuriating/comments/14nt5zk/mcdonalds_charges_for_paper_take_out_bags_now_we/,Pyrsec,McDonalds charges for paper take out bags now. We were handed everything individually and have no garbage bag now,1928,0.8,629,,1688212222.0,False,False,False,False,False
87,14ntktv,trees,/r/trees/comments/14ntktv/last_weekend_at_goodwill/,Catfish_Mudcat,Last weekend at Goodwill 😁,1674,0.97,162,,1688213470.0,False,False,False,False,False
88,14nstdh,awfuleverything,/r/awfuleverything/comments/14nstdh/instagram_account_ninjago_is_life_just_got/,mr_hee_hee,Instagram account _.ninjago_is_life._ just got thousands of lego stolen from him.,1907,0.96,174,,1688211073.0,False,False,False,False,False
89,14nux74,OldSchoolCool,/r/OldSchoolCool/comments/14nux74/70_years_ago_today_gentlemen_prefer_blondes_1953/,filmroses,"70 years ago today, Gentlemen Prefer Blondes (1953) was released and turned Marilyn Monroe into a global superstar. Here's her iconic musical number from it, ""Diamonds Are a Girl's Best Friend"". 70 years later and she is still so captivating.",1350,0.95,107,,1688217394.0,False,False,False,False,False
90,14nrfj9,starwarsmemes,/r/starwarsmemes/comments/14nrfj9/facts/,Werdak,Facts,2433,0.95,98,,1688206271.0,False,False,False,False,False
91,14nsnro,diablo4,/r/diablo4/comments/14nsnro/can_we_please_have_some_male_outfit_maybe_hooded/,One-Inspector-8614,Can we please have some male outfit? Maybe hooded cloak without this chest open?,1913,0.86,798,,1688210543.0,False,False,False,False,False
92,14npn23,facepalm,/r/facepalm/comments/14npn23/so_thats_the_conclusion_of_crisis_meetings/,Skulldab,So that's the conclusion of crisis meetings?,21370,0.95,1993,,1688199750.0,False,False,False,False,False
93,14nttvo,Grimdank,/r/Grimdank/comments/14nttvo/to_be_fair_they_probably_eat_some_kinda_xeno_slop/,MmmTastyCakes,To be fair. They probably eat some kinda xeno slop.,1551,0.98,37,VULKAN LIFTS!,1688214229.0,False,False,False,False,False
94,14nud6q,castiron,/r/castiron/comments/14nud6q/made_my_first_cast_iron_pizza/,Pristine_Lobster4607,Made my first cast iron pizza!,1403,0.96,48,,1688215847.0,False,False,False,False,False
95,14ns9mi,science,/r/science/comments/14ns9mi/taking_higherthanrecommended_doses_of_vitamin_d/,Wagamaga,"Taking higher-than-recommended doses of vitamin D for five years reduced the risk of atrial fibrillation. Risk of atrial fibrillation was 27% lower in the 40 micrograms group, and 32% lower in the 80 micrograms group, when compared to the placebo group",1954,0.96,145,,1688209242.0,False,False,False,False,False
96,14nv4kd,3Dprinting,/r/3Dprinting/comments/14nv4kd/ive_designed_a_tactical_snack_container_enjoy/,jarhead_5537,I've designed a tactical snack container. Enjoy.,1235,0.95,89,,1688217975.0,False,False,False,False,False
97,14non7u,NoStupidQuestions,/r/NoStupidQuestions/comments/14non7u/is_it_socially_unacceptable_for_a_woman_in_her/,Louloulemonade,Is it socially unacceptable for a woman in her mid thirties to be out at a bar at 2am or should I not care?,4039,0.85,1776,,1688196217.0,False,False,False,False,False
98,14nnmyp,ukraine,/r/ukraine/comments/14nnmyp/i_spent_4_months_building_kharkiv_in_minecraft/,GeneralGeneral5302,I spent 4 months building Kharkiv in Minecraft,4744,0.95,127,,1688192699.0,False,False,False,False,False
99,14nv7gh,ThatsInsane,/r/ThatsInsane/comments/14nv7gh/the_riots_have_spread_from_france_to_belgium_the/,missthisworld,The riots have spread from France to Belgium. The police have announced that more than 100 rioters were arrested after unrest in Brussels and Liege yesterday,1214,0.97,228,,1688218203.0,False,False,False,False,False
100,14nqqct,lotrmemes,/r/lotrmemes/comments/14nqqct/its_my_friday/,rastaman96734ln,It’s my Friday 💃🏻💃🏻,2535,0.99,25,,1688203778.0,False,False,False,False,False
